ffff8101d983c180 2492906264 S Bo:5:033:4 -115 24 = 00001800 07ff000b 52494d5f 4a617661 4c6f6164 65720000
ffff810179594840 2492907883 C Bi:5:033:3 0 44 = 00002c00 0802000b 52494d5f 4a617661 4c6f6164 65720000 00000000 01000800
ffff8101d983c180 2492907893 C Bo:5:033:4 0 24 >
ffff8101d983c180 2492909425 S Bi:5:033:3 -115 4096 <
ffff8101d983c900 2492922105 S Bo:5:033:4 -115 8 = 00000800 0a02000c
ffff8101d983c900 2492922863 C Bo:5:033:4 0 8 >
ffff8101d983c180 2492923879 C Bi:5:033:3 0 8 = 00000800 1002000c
ffff8101d983c180 2492929129 S Bi:5:033:3 -115 4096 <
ffff8101d983c180 2492929880 C Bi:5:033:3 0 12 = 00000c00 13020100 00000000
ffff8101d983c180 2492934461 S Bi:5:033:3 -115 4096 <
ffff8101d983c180 2492934880 C Bi:5:033:3 0 5 = 02000500 01
ffff8101d983c180 2492938023 S Bi:5:033:3 -115 4096 <
ffff8101d983c900 2492942150 S Bo:5:033:4 -115 8 = 02000800 64000000
ffff8101d983c900 2492942869 C Bo:5:033:4 0 8 >
ffff8101d983c180 2492943882 C Bi:5:033:3 0 12 = 00000c00 13020100 01000000
ffff8101d983c180 2492945177 S Bi:5:033:3 -115 4096 <
ffff8101d983c180 2492945882 C Bi:5:033:3 0 8 = 02000800 65000000
ffff8101d983c180 2492948716 S Bi:5:033:3 -115 4096 <
ffff8101d983c900 2492950645 S Bo:5:033:4 -115 8 = 02000800 71000000
ffff8101d983c900 2492950864 C Bo:5:033:4 0 8 >
ffff8101d983c180 2492951880 C Bi:5:033:3 0 12 = 00000c00 13020100 02000000
ffff8101d983c180 2492955697 S Bi:5:033:3 -115 4096 <
ffff8101d983c180 2492968885 C Bi:5:033:3 0 8 = 02000800 64002000
ffff8101d983c180 2492971879 S Bi:5:033:3 -115 4096 <
ffff8101d983c180 2492972882 C Bi:5:033:3 0 36 = 02002400 84000d03 24129c49 00000000 0405006e 00000000 00000064 00000001
ffff8101d983c180 2492974215 S Bi:5:033:3 -115 4096 <
ffff8101d983c900 2492975358 S Bo:5:033:4 -115 8 = 02000800 79000000
ffff8101d983c900 2492975865 C Bo:5:033:4 0 8 >
ffff8101d983c180 2492976884 C Bi:5:033:3 0 12 = 00000c00 13020100 03000000
ffff8101d983c180 2492978007 S Bi:5:033:3 -115 4096 <
ffff8101d983c180 2492978883 C Bi:5:033:3 0 8 = 02000800 6400b801
ffff8101d983c180 2492981305 S Bi:5:033:3 -115 4096 <
ffff8101d983c180 2492981883 C Bi:5:033:3 0 444 = 0200bc01 0a000400 b8010000 01170205 030d0084 52494d20 38313030 20536572
ffff8101d983c180 2492985582 S Bo:5:033:4 -115 8 = 02000800 78000000
ffff8101d983c900 2492985601 S Bi:5:033:3 -115 4096 <
ffff8101d983c180 2492985867 C Bo:5:033:4 0 8 >
ffff8101d983c900 2492986881 C Bi:5:033:3 0 12 = 00000c00 13020100 04000000
ffff8101d983c900 2492992783 S Bi:5:033:3 -115 4096 <
ffff8101d983c900 2492993886 C Bi:5:033:3 0 8 = 02000800 6400a001
ffff8101d983c900 2492998469 S Bi:5:033:3 -115 4096 <
ffff8101d983c900 2492999885 C Bi:5:033:3 0 420 = 0200a401 10000300 a0010000 00000680 00b26480 904d7ba0 53434d00 00000000
ffff8101f8b79780 2493028283 S Bi:5:033:3 -115 4096 <
ffff81017941fa80 2493031123 S Bo:5:033:4 -115 8 = 02000800 6d000000
ffff81017941fa80 2493031873 C Bo:5:033:4 0 8 >
ffff8101f8b79780 2493032892 C Bi:5:033:3 0 12 = 00000c00 13020100 05000000
ffff81017941fa80 2493034218 S Bi:5:033:3 -115 4096 <
ffff81017941fa80 2493049893 C Bi:5:033:3 0 8 = 02000800 64009202
ffff81017941fa80 2493055696 S Bi:5:033:3 -115 4096 <
ffff81017941fa80 2493056890 C Bi:5:033:3 0 662 = 02009602 00100013 00160019 001c0055 0058005b 005e0064 0067006a 006d0070
ffff81017941fa80 2493058376 S Bi:5:033:3 -115 4096 <
ffff81017941f0c0 2493062088 S Bo:5:033:4 -115 8 = 02000800 6e000200
ffff81017941f0c0 2493062876 C Bo:5:033:4 0 8 >
ffff81017941fa80 2493063887 C Bi:5:033:3 0 12 = 00000c00 13020100 06000000
ffff81017941fa80 2493068622 S Bo:5:033:4 -115 6 = 02000600 0010
ffff81017941f0c0 2493068680 S Bi:5:033:3 -115 4096 <
ffff81017941fa80 2493068873 C Bo:5:033:4 0 6 >
ffff81017941f0c0 2493069889 C Bi:5:033:3 0 12 = 00000c00 13020100 07000000
ffff81017941f0c0 2493070905 S Bi:5:033:3 -115 4096 <
ffff81017941f0c0 2493071886 C Bi:5:033:3 0 8 = 02000800 64003b00
ffff81017941f0c0 2493075309 S Bi:5:033:3 -115 4096 <
ffff81017941f0c0 2493075888 C Bi:5:033:3 0 63 = 02003f00 0844491b 9c080020 6e65745f 72696d5f 706c6174 666f726d 5f726573
ffff81017941f0c0 2493078121 S Bi:5:033:3 -115 4096 <
ffff81017941fa80 2493080749 S Bo:5:033:4 -115 8 = 02000800 6e000200
ffff81017941fa80 2493080874 C Bo:5:033:4 0 8 >
ffff81017941f0c0 2493081888 C Bi:5:033:3 0 12 = 00000c00 13020100 08000000
ffff81017941f0c0 2493090091 S Bo:5:033:4 -115 6 = 02000600 0013
ffff81017941fa80 2493090146 S Bi:5:033:3 -115 4096 <
ffff81017941f0c0 2493090873 C Bo:5:033:4 0 6 >
ffff81017941fa80 2493090893 C Bi:5:033:3 0 12 = 00000c00 13020100 09000000
ffff81017941fa80 2493092124 S Bi:5:033:3 -115 4096 <
ffff81017941fa80 2493092890 C Bi:5:033:3 0 8 = 02000800 64003e00
ffff81017941fa80 2493096779 S Bi:5:033:3 -115 4096 <
ffff81017941fa80 2493097890 C Bi:5:033:3 0 66 = 02004200 0718491b 9b470023 6e65745f 72696d5f 706c6174 666f726d 5f696d5f
ffff81017941fa80 2493099102 S Bi:5:033:3 -115 4096 <
ffff81017941f0c0 2493102733 S Bo:5:033:4 -115 8 = 02000800 6e000200
ffff81017941f0c0 2493102875 C Bo:5:033:4 0 8 >
ffff81017941fa80 2493103890 C Bi:5:033:3 0 12 = 00000c00 13020100 0a000000
ffff81017941fa80 2493106772 S Bo:5:033:4 -115 6 = 02000600 0016
ffff81017941f0c0 2493106828 S Bi:5:033:3 -115 4096 <
ffff81017941fa80 2493106873 C Bo:5:033:4 0 6 >
ffff81017941f0c0 2493107938 C Bi:5:033:3 0 12 = 00000c00 13020100 0b000000
ffff81017941f0c0 2493114174 S Bi:5:033:3 -115 4096 <
ffff81017941f0c0 2493114891 C Bi:5:033:3 0 8 = 02000800 64003f00
ffff81017941f0c0 2493116230 S Bi:5:033:3 -115 4096 <
ffff81017941f0c0 2493116893 C Bi:5:033:3 0 67 = 02004300 0854491b 9ca30024 6e65745f 72696d5f 706c6174 666f726d 61707073
ffff81017941f0c0 2493124202 S Bo:5:033:4 -115 8 = 02000800 6e000200
ffff81017941fa80 2493124487 S Bi:5:033:3 -115 4096 <
ffff81017941f0c0 2493124876 C Bo:5:033:4 0 8 >
ffff81017941fa80 2493125895 C Bi:5:033:3 0 12 = 00000c00 13020100 0c000000
ffff81017941fa80 2493131086 S Bo:5:033:4 -115 6 = 02000600 0019
ffff81017941f0c0 2493131148 S Bi:5:033:3 -115 4096 <
ffff81017941fa80 2493131877 C Bo:5:033:4 0 6 >
ffff81017941f0c0 2493131897 C Bi:5:033:3 0 12 = 00000c00 13020100 0d000000
ffff81017941f0c0 2493134089 S Bi:5:033:3 -115 4096 <
ffff81017941f0c0 2493134894 C Bi:5:033:3 0 8 = 02000800 64002e00
ffff81017941f0c0 2493137795 S Bi:5:033:3 -115 4096 <
ffff81017941f0c0 2493138893 C Bi:5:033:3 0 50 = 02003200 0820491b 9b4a0013 6e65745f 72696d5f 6170705f 6d616e61 67657200
ffff81017941f0c0 2493141231 S Bi:5:033:3 -115 4096 <
ffff81017941fa80 2493148345 S Bo:5:033:4 -115 8 = 02000800 6e000200
ffff81017941fa80 2493148878 C Bo:5:033:4 0 8 >
ffff81017941f0c0 2493149897 C Bi:5:033:3 0 12 = 00000c00 13020100 0e000000
ffff81017941f0c0 2493157109 S Bo:5:033:4 -115 6 = 02000600 001c
ffff81017941fa80 2493157166 S Bi:5:033:3 -115 4096 <
ffff81017941f0c0 2493157888 C Bo:5:033:4 0 6 >
ffff81017941fa80 2493158897 C Bi:5:033:3 0 12 = 00000c00 13020100 0f000000
ffff81017941fa80 2493163089 S Bi:5:033:3 -115 4096 <
ffff81017941fa80 2493163895 C Bi:5:033:3 0 8 = 02000800 64002700
ffff81017941fa80 2493169926 S Bi:5:033:3 -115 4096 <
ffff81017941fa80 2493170903 C Bi:5:033:3 0 43 = 02002b00 9c44491b 9af6000c 6e65745f 72696d5f 636c6463 0009342e 352e302e
ffff81017941fa80 2493176835 S Bi:5:033:3 -115 4096 <
ffff81017941fcc0 2493177848 S Bo:5:033:4 -115 8 = 02000800 6e000200
ffff81017941fa80 2493178896 C Bi:5:033:3 0 12 = 00000c00 13020100 10000000
ffff81017941fcc0 2493178901 C Bo:5:033:4 0 8 >
ffff81017941fcc0 2493181910 S Bo:5:033:4 -115 6 = 02000600 0055
ffff81017941fa80 2493181969 S Bi:5:033:3 -115 4096 <
ffff81017941fcc0 2493182887 C Bo:5:033:4 0 6 >
ffff81017941fa80 2493182909 C Bi:5:033:3 0 12 = 00000c00 13020100 11000000
ffff81017941fa80 2493184911 S Bi:5:033:3 -115 4096 <
ffff81017941fa80 2493185896 C Bi:5:033:3 0 8 = 02000800 64003400
ffff81017941fa80 2493196910 S Bi:5:033:3 -115 4096 <
ffff81017941fa80 2493197898 C Bi:5:033:3 0 56 = 02003800 2e80491b 9c030019 6e65745f 72696d5f 706c6174 666f726d 5f726573
ffff81017941fa80 2493201527 S Bi:5:033:3 -115 4096 <
ffff81017941fcc0 2493204096 S Bo:5:033:4 -115 8 = 02000800 6e000200
ffff81017941fcc0 2493204883 C Bo:5:033:4 0 8 >
ffff81017941fa80 2493205909 C Bi:5:033:3 0 12 = 00000c00 13020100 12000000
ffff81017941fa80 2493208975 S Bi:5:033:3 -115 4096 <
ffff81017941fcc0 2493209718 S Bo:5:033:4 -115 6 = 02000600 0058
ffff81017941fcc0 2493209880 C Bo:5:033:4 0 6 >
ffff81017941fa80 2493210897 C Bi:5:033:3 0 12 = 00000c00 13020100 13000000
ffff81017941fa80 2493222085 S Bi:5:033:3 -115 4096 <
ffff81017941fa80 2493223965 C Bi:5:033:3 0 8 = 02000800 64003800
ffff81017941fa80 2493225474 S Bi:5:033:3 -115 4096 <
ffff81017941fa80 2493225904 C Bi:5:033:3 0 60 = 02003c00 5a74491b 9c07001d 6e65745f 72696d5f 706c6174 666f726d 5f726573
ffff81017941fa80 2493229708 S Bi:5:033:3 -115 4096 <
ffff81017941fcc0 2493233064 S Bo:5:033:4 -115 8 = 02000800 6e000200
ffff81017941fa80 2493233900 C Bi:5:033:3 0 12 = 00000c00 13020100 14000000
ffff81017941fcc0 2493233905 C Bo:5:033:4 0 8 >
ffff81017941fcc0 2493241891 S Bo:5:033:4 -115 6 = 02000600 005b
ffff81017941fa80 2493241956 S Bi:5:033:3 -115 4096 <
ffff81017941fcc0 2493242884 C Bo:5:033:4 0 6 >
ffff81017941fa80 2493242906 C Bi:5:033:3 0 12 = 00000c00 13020100 15000000
ffff81017941fa80 2493247449 S Bi:5:033:3 -115 4096 <
ffff81017941fa80 2493247910 C Bi:5:033:3 0 8 = 02000800 64003000
ffff81017941fa80 2493251997 S Bi:5:033:3 -115 4096 <
ffff81017941fa80 2493252902 C Bi:5:033:3 0 52 = 02003400 8148491b 9b730015 6e65745f 72696d5f 73657276 69636573 5f696d70
ffff81017941fa80 2493257662 S Bi:5:033:3 -115 4096 <
ffff81017941fcc0 2493259427 S Bo:5:033:4 -115 8 = 02000800 6e000200
ffff81017941fcc0 2493259886 C Bo:5:033:4 0 8 >
ffff81017941fa80 2493260898 C Bi:5:033:3 0 12 = 00000c00 13020100 16000000
ffff81017941fa80 2493263412 S Bo:5:033:4 -115 6 = 02000600 005e
ffff81017941fcc0 2493263491 S Bi:5:033:3 -115 4096 <
ffff81017941fa80 2493263885 C Bo:5:033:4 0 6 >
ffff81017941fcc0 2493264901 C Bi:5:033:3 0 12 = 00000c00 13020100 17000000
ffff81017941fcc0 2493270831 S Bi:5:033:3 -115 4096 <
ffff81017941fcc0 2493271910 C Bi:5:033:3 0 8 = 02000800 64003700
ffff81017941fcc0 2493274373 S Bi:5:033:3 -115 4096 <
ffff81017941fcc0 2493274900 C Bi:5:033:3 0 59 = 02003b00 6efc491b 9b42001c 6e65745f 72696d5f 706c6174 666f726d 5f696d5f
ffff81017941fcc0 2493278915 S Bo:5:033:4 -115 8 = 02000800 6e000200
ffff81017941fa80 2493278970 S Bi:5:033:3 -115 4096 <
ffff81017941fcc0 2493279887 C Bo:5:033:4 0 8 >
ffff81017941fa80 2493279909 C Bi:5:033:3 0 12 = 00000c00 13020100 18000000
ffff81017941fa80 2493283117 S Bi:5:033:3 -115 4096 <
ffff81017941fcc0 2493284098 S Bo:5:033:4 -115 6 = 02000600 0064
ffff81017941fa80 2493284903 C Bi:5:033:3 0 12 = 00000c00 13020100 19000000
ffff81017941fcc0 2493284907 C Bo:5:033:4 0 6 >
ffff81017941fcc0 2493286182 S Bi:5:033:3 -115 4096 <
ffff81017941fcc0 2493286902 C Bi:5:033:3 0 8 = 02000800 64003b00
ffff81017941fcc0 2493290220 S Bi:5:033:3 -115 4096 <
ffff81017941fcc0 2493290901 C Bi:5:033:3 0 63 = 02003f00 0ea0491b 9b420020 6e65745f 72696d5f 706c6174 666f726d 5f696d5f
ffff81017941fcc0 2493292510 S Bi:5:033:3 -115 4096 <
ffff81017941fa80 2493295063 S Bo:5:033:4 -115 8 = 02000800 6e000200
ffff81017941fcc0 2493295921 C Bi:5:033:3 0 12 = 00000c00 13020100 1a000000
ffff81017941fa80 2493295926 C Bo:5:033:4 0 8 >
ffff81017941fa80 2493298102 S Bo:5:033:4 -115 6 = 02000600 0067
ffff81017941fcc0 2493298159 S Bi:5:033:3 -115 4096 <
ffff81017941fa80 2493298884 C Bo:5:033:4 0 6 >
ffff81017941fcc0 2493298904 C Bi:5:033:3 0 12 = 00000c00 13020100 1b000000
ffff81017941fcc0 2493300110 S Bi:5:033:3 -115 4096 <
ffff81017941fcc0 2493300900 C Bi:5:033:3 0 8 = 02000800 64003300
ffff81017941fcc0 2493301744 S Bi:5:033:3 -115 4096 <
ffff81017941fcc0 2493301901 C Bi:5:033:3 0 55 = 02003700 0b20491b 9b6a0018 6e65745f 72696d5f 70726f63 6573735f 6c61756e
ffff81017941fcc0 2493304519 S Bi:5:033:3 -115 4096 <
ffff81017941fa80 2493308087 S Bo:5:033:4 -115 8 = 02000800 6e000200
ffff81017941fcc0 2493308904 C Bi:5:033:3 0 12 = 00000c00 13020100 1c000000
ffff81017941fa80 2493308909 C Bo:5:033:4 0 8 >
ffff81017941fa80 2493316527 S Bo:5:033:4 -115 6 = 02000600 006a
ffff81017941fcc0 2493316585 S Bi:5:033:3 -115 4096 <
ffff81017941fa80 2493316887 C Bo:5:033:4 0 6 >
ffff81017941fcc0 2493317980 C Bi:5:033:3 0 12 = 00000c00 13020100 1d000000
ffff81017941fcc0 2493319922 S Bi:5:033:3 -115 4096 <
ffff81017941fcc0 2493320901 C Bi:5:033:3 0 8 = 02000800 64002f00
ffff81017941fcc0 2493323316 S Bi:5:033:3 -115 4096 <
ffff81017941fcc0 2493323901 C Bi:5:033:3 0 51 = 02003300 0cbc491b 9b5e0014 6e65745f 72696d5f 706c617a 6d69635f 6d617468
ffff81017941fcc0 2493328142 S Bi:5:033:3 -115 4096 <
ffff81017941fa80 2493330798 S Bo:5:033:4 -115 8 = 02000800 6e000200
ffff81017941fcc0 2493331904 C Bi:5:033:3 0 12 = 00000c00 13020100 1e000000
ffff81017941fa80 2493331910 C Bo:5:033:4 0 8 >
ffff81017941fa80 2493334263 S Bo:5:033:4 -115 6 = 02000600 006d
ffff81017941fcc0 2493334316 S Bi:5:033:3 -115 4096 <
ffff81017941fa80 2493334885 C Bo:5:033:4 0 6 >
ffff81017941fcc0 2493335901 C Bi:5:033:3 0 12 = 00000c00 13020100 1f000000
ffff81017941fcc0 2493338458 S Bi:5:033:3 -115 4096 <
ffff81017941fcc0 2493338903 C Bi:5:033:3 0 8 = 02000800 64003600
ffff81017941fcc0 2493341772 S Bi:5:033:3 -115 4096 <
ffff81017941fcc0 2493342905 C Bi:5:033:3 0 58 = 02003a00 3464491b 9b60001b 6e65745f 72696d5f 706c617a 6d69635f 6d656469
ffff81017941fcc0 2493344849 S Bi:5:033:3 -115 4096 <
ffff81017941fa80 2493352375 S Bo:5:033:4 -115 8 = 02000800 6e000200
ffff81017941fa80 2493352889 C Bo:5:033:4 0 8 >
ffff81017941fcc0 2493353906 C Bi:5:033:3 0 12 = 00000c00 13020100 20000000
ffff81017941fcc0 2493356968 S Bo:5:033:4 -115 6 = 02000600 0070
ffff81017941fa80 2493357023 S Bi:5:033:3 -115 4096 <
ffff81017941fcc0 2493357893 C Bo:5:033:4 0 6 >
ffff81017941fa80 2493357917 C Bi:5:033:3 0 12 = 00000c00 13020100 21000000
ffff81017941fa80 2493406712 S Bi:5:033:3 -115 4096 <
ffff81017941fa80 2493407912 C Bi:5:033:3 0 8 = 02000800 64003c00
ffff81017941fa80 2493413999 S Bi:5:033:3 -115 4096 <
ffff81017941fa80 2493414911 C Bi:5:033:3 0 64 = 02004000 6688491b 9c160021 6e65745f 72696d5f 706c617a 6d69635f 6d656469
ffff81017941fa80 2493419853 S Bo:5:033:4 -115 8 = 02000800 6e000200
ffff81017941fcc0 2493419919 S Bi:5:033:3 -115 4096 <
ffff81017941fa80 2493420896 C Bo:5:033:4 0 8 >
ffff81017941fcc0 2493420920 C Bi:5:033:3 0 12 = 00000c00 13020100 22000000
ffff81017941fcc0 2493426946 S Bo:5:033:4 -115 6 = 02000600 0073
ffff81017941fa80 2493427014 S Bi:5:033:3 -115 4096 <
ffff81017941fcc0 2493427894 C Bo:5:033:4 0 6 >
ffff81017941fa80 2493427916 C Bi:5:033:3 0 12 = 00000c00 13020100 23000000
ffff81017941fa80 2493429367 S Bi:5:033:3 -115 4096 <
ffff81017941fa80 2493429909 C Bi:5:033:3 0 8 = 02000800 64003c00
ffff81017941fa80 2493432005 S Bi:5:033:3 -115 4096 <
ffff81017941fa80 2493432920 C Bi:5:033:3 0 64 = 02004000 ba50491b 9c170021 6e65745f 72696d5f 706c617a 6d69635f 6d656469
ffff81017941fa80 2493434146 S Bi:5:033:3 -115 4096 <
ffff81017941fcc0 2493437938 S Bo:5:033:4 -115 8 = 02000800 6e000200
ffff81017941fa80 2493438912 C Bi:5:033:3 0 12 = 00000c00 13020100 24000000
ffff81017941fcc0 2493438916 C Bo:5:033:4 0 8 >
ffff81017941fcc0 2493442496 S Bo:5:033:4 -115 6 = 02000600 0079
ffff81017941fa80 2493442554 S Bi:5:033:3 -115 4096 <
ffff81017941fcc0 2493442894 C Bo:5:033:4 0 6 >
ffff81017941fa80 2493443908 C Bi:5:033:3 0 12 = 00000c00 13020100 25000000
ffff81017941fa80 2493448158 S Bi:5:033:3 -115 4096 <
ffff81017941fa80 2493448912 C Bi:5:033:3 0 8 = 02000800 64003d00
ffff81017941fa80 2493460662 S Bi:5:033:3 -115 4096 <
ffff81017941fa80 2493460912 C Bi:5:033:3 0 65 = 02004100 150c491b 9c130022 6e65745f 72696d5f 706c617a 6d69635f 6d656469
ffff81017941fa80 2493464454 S Bi:5:033:3 -115 4096 <
ffff81017941fcc0 2493473423 S Bo:5:033:4 -115 8 = 02000800 6e000200
ffff81017941fcc0 2493473896 C Bo:5:033:4 0 8 >
ffff81017941fa80 2493474914 C Bi:5:033:3 0 12 = 00000c00 13020100 26000000
ffff81017941fa80 2493479741 S Bo:5:033:4 -115 6 = 02000600 007c
ffff81017941fcc0 2493479810 S Bi:5:033:3 -115 4096 <
ffff81017941fa80 2493479896 C Bo:5:033:4 0 6 >
ffff81017941fcc0 2493480930 C Bi:5:033:3 0 12 = 00000c00 13020100 27000000
ffff81017941fcc0 2493482679 S Bi:5:033:3 -115 4096 <
ffff81017941fcc0 2493482911 C Bi:5:033:3 0 8 = 02000800 64003600
ffff81017941fcc0 2493490732 S Bi:5:033:3 -115 4096 <
ffff81017941fcc0 2493490922 C Bi:5:033:3 0 58 = 02003a00 14c4491b 9b4b001b 6e65745f 72696d5f 6170705f 6d616e61 6765725f
ffff81017941fcc0 2493493909 S Bi:5:033:3 -115 4096 <
ffff81017941f0c0 2493499599 S Bo:5:033:4 -115 8 = 02000800 6e000200
ffff81017941f0c0 2493499898 C Bo:5:033:4 0 8 >
ffff81017941fcc0 2493500918 C Bi:5:033:3 0 12 = 00000c00 13020100 28000000
ffff81017941fcc0 2493504257 S Bo:5:033:4 -115 6 = 02000600 007f
ffff81017941fcc0 2493504900 C Bo:5:033:4 0 6 >
ffff81017941f0c0 2493505435 S Bi:5:033:3 -115 4096 <
ffff81017941f0c0 2493505995 C Bi:5:033:3 0 12 = 00000c00 13020100 29000000
ffff81017941f0c0 2493508442 S Bi:5:033:3 -115 4096 <
ffff81017941f0c0 2493508921 C Bi:5:033:3 0 8 = 02000800 64004300
ffff81017941f0c0 2493510141 S Bi:5:033:3 -115 4096 <
ffff81017941f0c0 2493510916 C Bi:5:033:3 0 71 = 02004700 0f64491b 9c900028 6e65745f 72696d5f 62625f61 70706c69 63617469
ffff81017941f0c0 2493514155 S Bi:5:033:3 -115 4096 <
ffff81017941fcc0 2493517171 S Bo:5:033:4 -115 8 = 02000800 6e000200
ffff81017941fcc0 2493517899 C Bo:5:033:4 0 8 >
ffff81017941f0c0 2493518913 C Bi:5:033:3 0 12 = 00000c00 13020100 2a000000
ffff81017941f0c0 2493522168 S Bo:5:033:4 -115 6 = 02000600 0082
ffff81017941fcc0 2493522214 S Bi:5:033:3 -115 4096 <
ffff81017941f0c0 2493522897 C Bo:5:033:4 0 6 >
ffff81017941fcc0 2493523912 C Bi:5:033:3 0 12 = 00000c00 13020100 2b000000
ffff81017941fcc0 2493526406 S Bi:5:033:3 -115 4096 <
ffff81017941fcc0 2493526915 C Bi:5:033:3 0 8 = 02000800 64003f00
ffff81017941fcc0 2493536274 S Bi:5:033:3 -115 4096 <
ffff81017941fcc0 2493536916 C Bi:5:033:3 0 67 = 02004300 0be4491b 9c430024 6e65745f 72696d5f 62625f74 72757374 5f617070
ffff81017941fcc0 2493540109 S Bo:5:033:4 -115 8 = 02000800 6e000200
ffff81017941f0c0 2493540167 S Bi:5:033:3 -115 4096 <
ffff81017941fcc0 2493540899 C Bo:5:033:4 0 8 >
ffff81017941f0c0 2493540920 C Bi:5:033:3 0 12 = 00000c00 13020100 2c000000
ffff81017941f0c0 2493542405 S Bo:5:033:4 -115 6 = 02000600 0085
ffff81017941fcc0 2493542481 S Bi:5:033:3 -115 4096 <
ffff81017941f0c0 2493542897 C Bo:5:033:4 0 6 >
ffff81017941fcc0 2493543914 C Bi:5:033:3 0 12 = 00000c00 13020100 2d000000
ffff81017941fcc0 2493545351 S Bi:5:033:3 -115 4096 <
ffff81017941fcc0 2493545914 C Bi:5:033:3 0 8 = 02000800 64003800
ffff81017941fcc0 2493548410 S Bi:5:033:3 -115 4096 <
ffff81017941fcc0 2493548917 C Bi:5:033:3 0 60 = 02003c00 0b50491b 9c9a001d 6e65745f 72696d5f 706c6174 666f726d 61707073
ffff81017941fcc0 2493550512 S Bi:5:033:3 -115 4096 <
ffff8101d983c900 2493555153 S Bo:5:033:4 -115 8 = 02000800 6e000200
ffff8101d983c900 2493555905 C Bo:5:033:4 0 8 >
ffff81017941fcc0 2493556915 C Bi:5:033:3 0 12 = 00000c00 13020100 2e000000
ffff8101d983c900 2493558107 S Bo:5:033:4 -115 6 = 02000600 0088
ffff8101d983c180 2493558128 S Bi:5:033:3 -115 4096 <
ffff8101d983c900 2493558900 C Bo:5:033:4 0 6 >
ffff8101d983c180 2493558922 C Bi:5:033:3 0 12 = 00000c00 13020100 2f000000
ffff8101d983c180 2493562319 S Bi:5:033:3 -115 4096 <
ffff8101d983c180 2493562915 C Bi:5:033:3 0 8 = 02000800 64003c00
ffff8101d983c180 2493566953 S Bi:5:033:3 -115 4096 <
ffff8101d983c180 2493567915 C Bi:5:033:3 0 64 = 02004000 caa8491b 9c9f0021 6e65745f 72696d5f 706c6174 666f726d 61707073
ffff8101d983c180 2493568979 S Bi:5:033:3 -115 4096 <
ffff8101d983c900 2493571906 S Bo:5:033:4 -115 8 = 02000800 6e000200
ffff8101d983c180 2493572916 C Bi:5:033:3 0 12 = 00000c00 13020100 30000000
ffff8101d983c900 2493572921 C Bo:5:033:4 0 8 >
ffff8101d983c900 2493579543 S Bo:5:033:4 -115 6 = 02000600 008b
ffff8101d983c180 2493579564 S Bi:5:033:3 -115 4096 <
ffff8101d983c900 2493579901 C Bo:5:033:4 0 6 >
ffff8101d983c180 2493580915 C Bi:5:033:3 0 12 = 00000c00 13020100 31000000
ffff8101d983c180 2493582862 S Bi:5:033:3 -115 4096 <
ffff8101d983c180 2493583917 C Bi:5:033:3 0 8 = 02000800 64003100
ffff8101d983c180 2493586278 S Bi:5:033:3 -115 4096 <
ffff8101d983c180 2493586916 C Bi:5:033:3 0 53 = 02003500 6bf8491b 9ca60016 6e65745f 72696d5f 62625f61 64647265 7373626f
ffff8101d983c180 2493588408 S Bi:5:033:3 -115 4096 <
ffff8101d983c900 2493590323 S Bo:5:033:4 -115 8 = 02000800 6e000200
ffff8101d983c900 2493590901 C Bo:5:033:4 0 8 >
ffff8101d983c180 2493591916 C Bi:5:033:3 0 12 = 00000c00 13020100 32000000
ffff8101d983c180 2493593101 S Bo:5:033:4 -115 6 = 02000600 008e
ffff8101d983c900 2493593115 S Bi:5:033:3 -115 4096 <
ffff8101d983c180 2493593901 C Bo:5:033:4 0 6 >
ffff8101d983c900 2493593921 C Bi:5:033:3 0 12 = 00000c00 13020100 33000000
ffff8101d983c900 2493599120 S Bi:5:033:3 -115 4096 <
ffff8101d983c900 2493599919 C Bi:5:033:3 0 8 = 02000800 64002d00
ffff8101d983c900 2493603076 S Bi:5:033:3 -115 4096 <
ffff8101d983c900 2493603917 C Bi:5:033:3 0 49 = 02003100 0918491b 9c950012 6e65745f 72696d5f 62625f62 726f7773 65720009
ffff8101d983c900 2493608157 S Bo:5:033:4 -115 8 = 02000800 6e000200
ffff8101d983c180 2493608178 S Bi:5:033:3 -115 4096 <
ffff8101d983c900 2493608904 C Bo:5:033:4 0 8 >
ffff8101d983c180 2493609917 C Bi:5:033:3 0 12 = 00000c00 13020100 34000000
ffff8101d983c180 2493611165 S Bo:5:033:4 -115 6 = 02000600 0091
ffff8101d983c900 2493611182 S Bi:5:033:3 -115 4096 <
ffff8101d983c180 2493611902 C Bo:5:033:4 0 6 >
ffff8101d983c900 2493612916 C Bi:5:033:3 0 12 = 00000c00 13020100 35000000
ffff8101d983c900 2493614065 S Bi:5:033:3 -115 4096 <
ffff8101d983c900 2493614917 C Bi:5:033:3 0 8 = 02000800 64003200
ffff8101d983c900 2493618385 S Bi:5:033:3 -115 4096 <
ffff8101d983c900 2493618918 C Bi:5:033:3 0 54 = 02003600 0720491b 9c4e0017 6e65745f 72696d5f 62625f63 616c6c5f 636f6e74
ffff8101d983c900 2493620356 S Bi:5:033:3 -115 4096 <
ffff8101d983c180 2493623391 S Bo:5:033:4 -115 8 = 02000800 6e000200
ffff8101d983c180 2493623902 C Bo:5:033:4 0 8 >
ffff8101d983c900 2493624918 C Bi:5:033:3 0 12 = 00000c00 13020100 36000000
ffff8101d983c900 2493626235 S Bo:5:033:4 -115 6 = 02000600 0094
ffff8101d983c180 2493626252 S Bi:5:033:3 -115 4096 <
ffff8101d983c900 2493626902 C Bo:5:033:4 0 6 >
ffff8101d983c180 2493627917 C Bi:5:033:3 0 12 = 00000c00 13020100 37000000
ffff8101d983c180 2493629267 S Bi:5:033:3 -115 4096 <
ffff8101d983c180 2493629918 C Bi:5:033:3 0 8 = 02000800 64003300
ffff8101d983c180 2493633288 S Bi:5:033:3 -115 4096 <
ffff8101d983c180 2493633921 C Bi:5:033:3 0 55 = 02003700 ccac491b 9c3d0018 6e65745f 72696d5f 62625f66 72616d65 776f726b
ffff8101d983c180 2493635339 S Bi:5:033:3 -115 4096 <
ffff8101d983c900 2493639317 S Bo:5:033:4 -115 8 = 02000800 6e000200
ffff8101d983c900 2493639902 C Bo:5:033:4 0 8 >
ffff8101d983c180 2493640919 C Bi:5:033:3 0 12 = 00000c00 13020100 38000000
ffff8101d983c180 2493643731 S Bo:5:033:4 -115 6 = 02000600 009d
ffff8101d983c900 2493643750 S Bi:5:033:3 -115 4096 <
ffff8101d983c180 2493643902 C Bo:5:033:4 0 6 >
ffff8101d983c900 2493644918 C Bi:5:033:3 0 12 = 00000c00 13020100 39000000
ffff8101d983c900 2493647043 S Bi:5:033:3 -115 4096 <
ffff8101d983c900 2493647920 C Bi:5:033:3 0 8 = 02000800 64002f00
ffff8101d983c900 2493649065 S Bi:5:033:3 -115 4096 <
ffff8101d983c900 2493649920 C Bi:5:033:3 0 51 = 02003300 b104491b 9cb00014 6e65745f 72696d5f 62625f6d 65737361 67696e67
ffff8101d983c900 2493651101 S Bi:5:033:3 -115 4096 <
ffff8101d983c180 2493653757 S Bo:5:033:4 -115 8 = 02000800 6e000200
ffff8101d983c180 2493653904 C Bo:5:033:4 0 8 >
ffff8101d983c900 2493654919 C Bi:5:033:3 0 12 = 00000c00 13020100 3a000000
ffff8101d983c900 2493658251 S Bo:5:033:4 -115 6 = 02000600 00a3
ffff8101d983c180 2493658270 S Bi:5:033:3 -115 4096 <
ffff8101d983c900 2493658906 C Bo:5:033:4 0 6 >
ffff8101d983c180 2493659919 C Bi:5:033:3 0 12 = 00000c00 13020100 3b000000
ffff8101d983c180 2493662954 S Bi:5:033:3 -115 4096 <
ffff8101d983c180 2493663922 C Bi:5:033:3 0 8 = 02000800 64003300
ffff8101d983c180 2493666171 S Bi:5:033:3 -115 4096 <
ffff8101d983c180 2493666921 C Bi:5:033:3 0 55 = 02003700 54ec491b 9cc30018 6e65745f 72696d5f 62625f6d 65737361 67696e67
ffff8101d983c180 2493670190 S Bo:5:033:4 -115 8 = 02000800 6e000200
ffff8101d983c900 2493670211 S Bi:5:033:3 -115 4096 <
ffff8101d983c180 2493670905 C Bo:5:033:4 0 8 >
ffff8101d983c900 2493671919 C Bi:5:033:3 0 12 = 00000c00 13020100 3c000000
ffff8101d983c900 2493674157 S Bo:5:033:4 -115 6 = 02000600 00a6
ffff8101d983c180 2493674173 S Bi:5:033:3 -115 4096 <
ffff8101d983c900 2493674905 C Bo:5:033:4 0 6 >
ffff8101d983c180 2493675920 C Bi:5:033:3 0 12 = 00000c00 13020100 3d000000
ffff8101d983c180 2493678303 S Bi:5:033:3 -115 4096 <
ffff8101d983c180 2493678921 C Bi:5:033:3 0 8 = 02000800 64002c00
ffff8101d983c180 2493682349 S Bi:5:033:3 -115 4096 <
ffff8101d983c180 2493682925 C Bi:5:033:3 0 48 = 02003000 940c491b 9cba0011 6e65745f 72696d5f 62625f6d 6f64656c 73000934
ffff8101d983c180 2493687237 S Bo:5:033:4 -115 8 = 02000800 6e000200
ffff8101d983c900 2493687260 S Bi:5:033:3 -115 4096 <
ffff8101d983c180 2493687909 C Bo:5:033:4 0 8 >
ffff8101d983c900 2493688921 C Bi:5:033:3 0 12 = 00000c00 13020100 3e000000
ffff8101d983c900 2493690302 S Bo:5:033:4 -115 6 = 02000600 00a9
ffff8101d983c180 2493690318 S Bi:5:033:3 -115 4096 <
ffff8101d983c900 2493690905 C Bo:5:033:4 0 6 >
ffff8101d983c180 2493691920 C Bi:5:033:3 0 12 = 00000c00 13020100 3f000000
ffff8101d983c180 2493693336 S Bi:5:033:3 -115 4096 <
ffff8101d983c180 2493693921 C Bi:5:033:3 0 8 = 02000800 64003400
ffff8101d983c180 2493696368 S Bi:5:033:3 -115 4096 <
ffff8101d983c180 2493696922 C Bi:5:033:3 0 56 = 02003800 4a98491b 9c3d0019 6e65745f 72696d5f 62625f73 79737465 6d5f736d
ffff8101d983c180 2493698170 S Bi:5:033:3 -115 4096 <
ffff8101d983c900 2493702135 S Bo:5:033:4 -115 8 = 02000800 6e000200
ffff8101d983c900 2493702906 C Bo:5:033:4 0 8 >
ffff8101d983c180 2493703921 C Bi:5:033:3 0 12 = 00000c00 13020100 40000000
ffff81017941f0c0 2493707369 S Bo:5:033:4 -115 6 = 02000600 00ac
ffff81017941fa80 2493707428 S Bi:5:033:3 -115 4096 <
ffff81017941f0c0 2493707909 C Bo:5:033:4 0 6 >
ffff81017941fa80 2493708923 C Bi:5:033:3 0 12 = 00000c00 13020100 41000000
ffff81017941fa80 2493710348 S Bi:5:033:3 -115 4096 <
ffff81017941fa80 2493710923 C Bi:5:033:3 0 8 = 02000800 64002d00
ffff81017941fa80 2493713645 S Bi:5:033:3 -115 4096 <
ffff81017941fa80 2493713931 C Bi:5:033:3 0 49 = 02003100 29c0491b 9c890012 6e65745f 72696d5f 62625f6f 7074696f 6e730009
ffff81017941fa80 2493717621 S Bo:5:033:4 -115 8 = 02000800 6e000200
ffff81017941f0c0 2493717679 S Bi:5:033:3 -115 4096 <
ffff81017941fa80 2493717909 C Bo:5:033:4 0 8 >
ffff81017941f0c0 2493718923 C Bi:5:033:3 0 12 = 00000c00 13020100 42000000
ffff81017941f0c0 2493722545 S Bo:5:033:4 -115 6 = 02000600 00af
ffff81017941fa80 2493722598 S Bi:5:033:3 -115 4096 <
ffff81017941f0c0 2493722908 C Bo:5:033:4 0 6 >
ffff81017941fa80 2493723923 C Bi:5:033:3 0 12 = 00000c00 13020100 43000000
ffff81017941fa80 2493726620 S Bi:5:033:3 -115 4096 <
ffff81017941fa80 2493726930 C Bi:5:033:3 0 8 = 02000800 64003100
ffff81017941fa80 2493729700 S Bi:5:033:3 -115 4096 <
ffff81017941fa80 2493729926 C Bi:5:033:3 0 53 = 02003500 b370491b 9d1d0016 6e65745f 72696d5f 62625f6f 7074696f 6e735f61
ffff81017941fa80 2493736619 S Bi:5:033:3 -115 4096 <
ffff81017941f0c0 2493738810 S Bo:5:033:4 -115 8 = 02000800 6e000200
ffff81017941f0c0 2493738911 C Bo:5:033:4 0 8 >
ffff81017941fa80 2493739926 C Bi:5:033:3 0 12 = 00000c00 13020100 44000000
ffff81017941fa80 2493741819 S Bi:5:033:3 -115 4096 <
ffff81017941f0c0 2493742940 S Bo:5:033:4 -115 6 = 02000600 00bb
ffff81017941fa80 2493743926 C Bi:5:033:3 0 12 = 00000c00 13020100 45000000
ffff81017941f0c0 2493743930 C Bo:5:033:4 0 6 >
ffff81017941f0c0 2493746411 S Bi:5:033:3 -115 4096 <
ffff81017941f0c0 2493746925 C Bi:5:033:3 0 8 = 02000800 64003100
ffff81017941f0c0 2493749983 S Bi:5:033:3 -115 4096 <
ffff81017941f0c0 2493750930 C Bi:5:033:3 0 53 = 02003500 04c0491b 9cba0016 6e65745f 72696d5f 62625f70 686f6e65 5f6d6f64
ffff81017941f0c0 2493754405 S Bi:5:033:3 -115 4096 <
ffff81017941fa80 2493760445 S Bo:5:033:4 -115 8 = 02000800 6e000200
ffff81017941fa80 2493760912 C Bo:5:033:4 0 8 >
ffff81017941f0c0 2493761929 C Bi:5:033:3 0 12 = 00000c00 13020100 46000000
ffff81017941f0c0 2493763675 S Bo:5:033:4 -115 6 = 02000600 00be
ffff81017941fa80 2493763717 S Bi:5:033:3 -115 4096 <
ffff81017941f0c0 2493763910 C Bo:5:033:4 0 6 >
ffff81017941fa80 2493764925 C Bi:5:033:3 0 12 = 00000c00 13020100 47000000
ffff81017941fa80 2493766340 S Bi:5:033:3 -115 4096 <
ffff81017941fa80 2493766926 C Bi:5:033:3 0 8 = 02000800 64003400
ffff81017941fa80 2493770149 S Bi:5:033:3 -115 4096 <
ffff81017941fa80 2493770928 C Bi:5:033:3 0 56 = 02003800 72b8491b 9c8f0019 6e65745f 72696d5f 62625f70 686f6e65 5f726573
ffff81017941fa80 2493774345 S Bi:5:033:3 -115 4096 <
ffff81017941f0c0 2493776793 S Bo:5:033:4 -115 8 = 02000800 6e000200
ffff81017941f0c0 2493776913 C Bo:5:033:4 0 8 >
ffff81017941fa80 2493777927 C Bi:5:033:3 0 12 = 00000c00 13020100 48000000
ffff81017941fa80 2493779312 S Bo:5:033:4 -115 6 = 02000600 00c1
ffff81017941f0c0 2493779359 S Bi:5:033:3 -115 4096 <
ffff81017941fa80 2493779910 C Bo:5:033:4 0 6 >
ffff81017941f0c0 2493780929 C Bi:5:033:3 0 12 = 00000c00 13020100 49000000
ffff81017941f0c0 2493790337 S Bi:5:033:3 -115 4096 <
ffff81017941f0c0 2493790930 C Bi:5:033:3 0 8 = 02000800 64003200
ffff81017941f0c0 2493794571 S Bi:5:033:3 -115 4096 <
ffff81017941f0c0 2493794930 C Bi:5:033:3 0 54 = 02003600 1778491b 9ccd0017 6e65745f 72696d5f 62625f70 726f6669 6c65735f
ffff81017941f0c0 2493796502 S Bi:5:033:3 -115 4096 <
ffff81017941fa80 2493799503 S Bo:5:033:4 -115 8 = 02000800 6e000200
ffff81017941fa80 2493799914 C Bo:5:033:4 0 8 >
ffff81017941f0c0 2493800930 C Bi:5:033:3 0 12 = 00000c00 13020100 4a000000
ffff8101d983c180 2493802541 S Bo:5:033:4 -115 6 = 02000600 00c4
ffff8101d983c900 2493802561 S Bi:5:033:3 -115 4096 <
ffff8101d983c180 2493802912 C Bo:5:033:4 0 6 >
ffff8101d983c900 2493803927 C Bi:5:033:3 0 12 = 00000c00 13020100 4b000000
ffff8101d983c900 2493806276 S Bi:5:033:3 -115 4096 <
ffff8101d983c900 2493806931 C Bi:5:033:3 0 8 = 02000800 64003200
ffff8101d983c900 2493810385 S Bi:5:033:3 -115 4096 <
ffff8101d983c900 2493810930 C Bi:5:033:3 0 54 = 02003600 208c491b 9cc30017 6e65745f 72696d5f 62625f70 726f6669 6c65735f
ffff8101d983c900 2493817029 S Bo:5:033:4 -115 8 = 02000800 6e000200
ffff8101d983c180 2493817051 S Bi:5:033:3 -115 4096 <
ffff8101d983c900 2493817914 C Bo:5:033:4 0 8 >
ffff8101d983c180 2493817935 C Bi:5:033:3 0 12 = 00000c00 13020100 4c000000
ffff8101d983c180 2493821344 S Bi:5:033:3 -115 4096 <
ffff8101d983c900 2493822346 S Bo:5:033:4 -115 6 = 02000600 00c7
ffff8101d983c900 2493822913 C Bo:5:033:4 0 6 >
ffff8101d983c180 2493823930 C Bi:5:033:3 0 12 = 00000c00 13020100 4d000000
ffff8101d983c180 2493826435 S Bi:5:033:3 -115 4096 <
ffff8101d983c180 2493826932 C Bi:5:033:3 0 8 = 02000800 64003200
ffff8101d983c180 2493830607 S Bi:5:033:3 -115 4096 <
ffff8101d983c180 2493830931 C Bi:5:033:3 0 54 = 02003600 5c94491b 9cab0017 6e65745f 72696d5f 62625f71 7569636b 636f6e74
ffff8101d983c180 2493832304 S Bi:5:033:3 -115 4096 <
ffff8101d983c900 2493836205 S Bo:5:033:4 -115 8 = 02000800 6e000200
ffff8101d983c900 2493836913 C Bo:5:033:4 0 8 >
ffff8101d983c180 2493837930 C Bi:5:033:3 0 12 = 00000c00 13020100 4e000000
ffff8101d983c180 2493839194 S Bo:5:033:4 -115 6 = 02000600 00ca
ffff8101d983c900 2493839212 S Bi:5:033:3 -115 4096 <
ffff8101d983c180 2493839914 C Bo:5:033:4 0 6 >
ffff8101d983c900 2493840929 C Bi:5:033:3 0 12 = 00000c00 13020100 4f000000
ffff8101d983c900 2493842232 S Bi:5:033:3 -115 4096 <
ffff8101d983c900 2493842930 C Bi:5:033:3 0 8 = 02000800 64003000
ffff8101d983c900 2493845368 S Bi:5:033:3 -115 4096 <
ffff8101d983c900 2493845930 C Bi:5:033:3 0 52 = 02003400 5d10491b 9cd20015 6e65745f 72696d5f 62625f72 6962626f 6e5f6c69
ffff8101d983c900 2493847495 S Bi:5:033:3 -115 4096 <
ffff8101d983c180 2493851323 S Bo:5:033:4 -115 8 = 02000800 6e000200
ffff8101d983c180 2493851918 C Bo:5:033:4 0 8 >
ffff8101d983c900 2493852931 C Bi:5:033:3 0 12 = 00000c00 13020100 50000000
ffff81017941f300 2493856281 S Bo:5:033:4 -115 6 = 02000600 00cd
ffff81017941f900 2493856336 S Bi:5:033:3 -115 4096 <
ffff81017941f300 2493856915 C Bo:5:033:4 0 6 >
ffff81017941f900 2493857936 C Bi:5:033:3 0 12 = 00000c00 13020100 51000000
ffff81017941f900 2493859509 S Bi:5:033:3 -115 4096 <
ffff81017941f900 2493859931 C Bi:5:033:3 0 8 = 02000800 64002c00
ffff81017941f900 2493862104 S Bi:5:033:3 -115 4096 <
ffff81017941f900 2493862943 C Bi:5:033:3 0 48 = 02003000 3138491b 9c890011 6e65745f 72696d5f 62625f73 65617263 68000934
ffff81017941f900 2493864742 S Bi:5:033:3 -115 4096 <
ffff81017941f300 2493867250 S Bo:5:033:4 -115 8 = 02000800 6e000200
ffff81017941f300 2493867918 C Bo:5:033:4 0 8 >
ffff81017941f900 2493868937 C Bi:5:033:3 0 12 = 00000c00 13020100 52000000
ffff81017941f900 2493870414 S Bo:5:033:4 -115 6 = 02000600 00d0
ffff81017941f300 2493870455 S Bi:5:033:3 -115 4096 <
ffff81017941f900 2493870915 C Bo:5:033:4 0 6 >
ffff81017941f300 2493871931 C Bi:5:033:3 0 12 = 00000c00 13020100 53000000
ffff81017941f300 2493874576 S Bi:5:033:3 -115 4096 <
ffff81017941f300 2493874933 C Bi:5:033:3 0 8 = 02000800 64002f00
ffff81017941f300 2493879651 S Bi:5:033:3 -115 4096 <
ffff81017941f300 2493879936 C Bi:5:033:3 0 51 = 02003300 13b0491b 9c530014 6e65745f 72696d5f 62625f74 696d657a 6f6e6573
ffff81017941f300 2493882366 S Bi:5:033:3 -115 4096 <
ffff81017941f900 2493883909 S Bo:5:033:4 -115 8 = 02000800 6e000200
ffff81017941f300 2493884935 C Bi:5:033:3 0 12 = 00000c00 13020100 54000000
ffff81017941f900 2493884940 C Bo:5:033:4 0 8 >
ffff81017941f900 2493886310 S Bo:5:033:4 -115 6 = 02000600 00d3
ffff81017941f300 2493886363 S Bi:5:033:3 -115 4096 <
ffff81017941f900 2493886917 C Bo:5:033:4 0 6 >
ffff81017941f300 2493887932 C Bi:5:033:3 0 12 = 00000c00 13020100 55000000
ffff81017941f300 2493890565 S Bi:5:033:3 -115 4096 <
ffff81017941f300 2493890932 C Bi:5:033:3 0 8 = 02000800 64002b00
ffff81017941f300 2493895504 S Bi:5:033:3 -115 4096 <
ffff81017941f300 2493895935 C Bi:5:033:3 0 47 = 02002f00 44dc491b 9cb00010 6e65745f 72696d5f 62625f76 6f696365 0009342e
ffff81017941f300 2493898685 S Bi:5:033:3 -115 4096 <
ffff8101d983c900 2493905896 S Bo:5:033:4 -115 8 = 02000800 6e000200
ffff81017941f300 2493906940 C Bi:5:033:3 0 12 = 00000c00 13020100 56000000
ffff8101d983c900 2493906946 C Bo:5:033:4 0 8 >
ffff8101d983c900 2493910412 S Bo:5:033:4 -115 6 = 02000600 00d6
ffff8101d983c180 2493910433 S Bi:5:033:3 -115 4096 <
ffff8101d983c900 2493910920 C Bo:5:033:4 0 6 >
ffff8101d983c180 2493911934 C Bi:5:033:3 0 12 = 00000c00 13020100 57000000
ffff8101d983c180 2493915419 S Bi:5:033:3 -115 4096 <
ffff8101d983c180 2493915935 C Bi:5:033:3 0 8 = 02000800 64003100
ffff8101d983c180 2493917592 S Bi:5:033:3 -115 4096 <
ffff8101d983c180 2493917935 C Bi:5:033:3 0 53 = 02003500 e464491b 9cec0016 6e65745f 72696d5f 62625f73 65747570 77697a61
ffff8101d983c180 2493928066 S Bo:5:033:4 -115 8 = 02000800 6e000200
ffff8101d983c900 2493928086 S Bi:5:033:3 -115 4096 <
ffff8101d983c180 2493928920 C Bo:5:033:4 0 8 >
ffff8101d983c900 2493928941 C Bi:5:033:3 0 12 = 00000c00 13020100 58000000
ffff8101d983c900 2493931285 S Bo:5:033:4 -115 6 = 02000600 00d9
ffff8101d983c180 2493931306 S Bi:5:033:3 -115 4096 <
ffff8101d983c900 2493931919 C Bo:5:033:4 0 6 >
ffff8101d983c180 2493932936 C Bi:5:033:3 0 12 = 00000c00 13020100 59000000
ffff8101d983c180 2493935142 S Bi:5:033:3 -115 4096 <
ffff8101d983c180 2493935935 C Bi:5:033:3 0 8 = 02000800 64003000
ffff81017941f900 2493949247 S Bi:5:033:3 -115 4096 <
ffff81017941f900 2493950941 C Bi:5:033:3 0 52 = 02003400 2f04491b 9ca80015 6e65745f 72696d5f 62625f73 70656c6c 63686563
ffff81017941f900 2493956983 S Bo:5:033:4 -115 8 = 02000800 6e000200
ffff81017941f480 2493957047 S Bi:5:033:3 -115 4096 <
ffff81017941f900 2493957923 C Bo:5:033:4 0 8 >
ffff81017941f480 2493957944 C Bi:5:033:3 0 12 = 00000c00 13020100 5a000000
ffff81017941f480 2493963170 S Bo:5:033:4 -115 6 = 02000600 00dc
ffff81017941f900 2493963227 S Bi:5:033:3 -115 4096 <
ffff81017941f480 2493963923 C Bo:5:033:4 0 6 >
ffff81017941f900 2493964938 C Bi:5:033:3 0 12 = 00000c00 13020100 5b000000
ffff81017941f900 2493966082 S Bi:5:033:3 -115 4096 <
ffff81017941f900 2493966940 C Bi:5:033:3 0 8 = 02000800 64002a00
ffff81017941f900 2493969363 S Bi:5:033:3 -115 4096 <
ffff81017941f900 2493969940 C Bi:5:033:3 0 46 = 02002e00 a408491b 9b4f000f 6e65745f 72696d5f 65736372 65656e00 09342e35
ffff81017941f900 2493970960 S Bi:5:033:3 -115 4096 <
ffff81017941f480 2493976354 S Bo:5:033:4 -115 8 = 02000800 6e000200
ffff81017941f480 2493976924 C Bo:5:033:4 0 8 >
ffff81017941f900 2493977942 C Bi:5:033:3 0 12 = 00000c00 13020100 5c000000
ffff81017941f900 2493979451 S Bo:5:033:4 -115 6 = 02000600 00df
ffff81017941f480 2493979502 S Bi:5:033:3 -115 4096 <
ffff81017941f900 2493979923 C Bo:5:033:4 0 6 >
ffff81017941f480 2493980937 C Bi:5:033:3 0 12 = 00000c00 13020100 5d000000
ffff81017941f480 2493981951 S Bi:5:033:3 -115 4096 <
ffff81017941f480 2493982937 C Bi:5:033:3 0 8 = 02000800 64002e00
ffff81017941f480 2493986116 S Bi:5:033:3 -115 4096 <
ffff81017941f480 2493986943 C Bi:5:033:3 0 50 = 02003200 2530491b 9c0c0013 6e65745f 72696d5f 65736372 65656e5f 61707000
ffff81017941f480 2493989009 S Bi:5:033:3 -115 4096 <
ffff81017941f900 2493991239 S Bo:5:033:4 -115 8 = 02000800 6e000200
ffff81017941f900 2493991925 C Bo:5:033:4 0 8 >
ffff81017941f480 2493992939 C Bi:5:033:3 0 12 = 00000c00 13020100 5e000000
ffff81017941f480 2494000261 S Bo:5:033:4 -115 6 = 02000600 00e2
ffff81017941f900 2494000304 S Bi:5:033:3 -115 4096 <
ffff81017941f480 2494000922 C Bo:5:033:4 0 6 >
ffff81017941f900 2494001939 C Bi:5:033:3 0 12 = 00000c00 13020100 5f000000
ffff81017941f900 2494006628 S Bi:5:033:3 -115 4096 <
ffff81017941f900 2494006949 C Bi:5:033:3 0 8 = 02000800 64002800
ffff81017941f900 2494009292 S Bi:5:033:3 -115 4096 <
ffff81017941f900 2494009946 C Bi:5:033:3 0 44 = 02002c00 4f38491b 9b57000d 6e65745f 72696d5f 6d656469 61000934 2e352e30
ffff81017941f900 2494011869 S Bi:5:033:3 -115 4096 <
ffff81017941f480 2494014816 S Bo:5:033:4 -115 8 = 02000800 6e000200
ffff81017941f900 2494015944 C Bi:5:033:3 0 12 = 00000c00 13020100 60000000
ffff81017941f480 2494015948 C Bo:5:033:4 0 8 >
ffff81017941f480 2494018496 S Bo:5:033:4 -115 6 = 02000600 00e5
ffff81017941f900 2494018544 S Bi:5:033:3 -115 4096 <
ffff81017941f480 2494018924 C Bo:5:033:4 0 6 >
ffff81017941f900 2494019939 C Bi:5:033:3 0 12 = 00000c00 13020100 61000000
ffff81017941f900 2494022084 S Bi:5:033:3 -115 4096 <
ffff81017941f900 2494022939 C Bi:5:033:3 0 8 = 02000800 64002800
ffff81017941f900 2494026980 S Bi:5:033:3 -115 4096 <
ffff81017941f900 2494027943 C Bi:5:033:3 0 44 = 02002c00 3ce8491b 9b62000d 6e65745f 72696d5f 73617473 61000934 2e352e30
ffff81017941f900 2494036354 S Bo:5:033:4 -115 8 = 02000800 6e000200
ffff81017941f480 2494036410 S Bi:5:033:3 -115 4096 <
ffff81017941f900 2494036927 C Bo:5:033:4 0 8 >
ffff81017941f480 2494037946 C Bi:5:033:3 0 12 = 00000c00 13020100 62000000
ffff81017941f480 2494039585 S Bo:5:033:4 -115 6 = 02000600 00e8
ffff81017941f900 2494039636 S Bi:5:033:3 -115 4096 <
ffff81017941f480 2494039925 C Bo:5:033:4 0 6 >
ffff81017941f900 2494040940 C Bi:5:033:3 0 12 = 00000c00 13020100 63000000
ffff81017941f900 2494042163 S Bi:5:033:3 -115 4096 <
ffff81017941f900 2494042940 C Bi:5:033:3 0 8 = 02000800 64002900
ffff81017941f900 2494046173 S Bi:5:033:3 -115 4096 <
ffff81017941f900 2494046945 C Bi:5:033:3 0 45 = 02002d00 5930491b 9c1c000e 6e65745f 72696d5f 6a617872 70630009 342e352e
ffff81017941f900 2494048378 S Bi:5:033:3 -115 4096 <
ffff81017941f480 2494051251 S Bo:5:033:4 -115 8 = 02000800 6e000200
ffff81017941f480 2494051929 C Bo:5:033:4 0 8 >
ffff81017941f900 2494052949 C Bi:5:033:3 0 12 = 00000c00 13020100 64000000
ffff81017941f900 2494060275 S Bo:5:033:4 -115 6 = 02000600 00eb
ffff81017941f480 2494060327 S Bi:5:033:3 -115 4096 <
ffff81017941f900 2494060927 C Bo:5:033:4 0 6 >
ffff81017941f480 2494061943 C Bi:5:033:3 0 12 = 00000c00 13020100 65000000
ffff81017941f480 2494068798 S Bi:5:033:3 -115 4096 <
ffff81017941f480 2494068987 C Bi:5:033:3 0 8 = 02000800 64003300
ffff81017941f480 2494071412 S Bi:5:033:3 -115 4096 <
ffff81017941f480 2494071946 C Bi:5:033:3 0 55 = 02003700 1bbc491b 9c9a0018 6e65745f 72696d5f 62625f6c 6f63616c 6572656d
ffff81017941f480 2494074097 S Bi:5:033:3 -115 4096 <
ffff81017941f900 2494075830 S Bo:5:033:4 -115 8 = 02000800 6e000200
ffff81017941f480 2494076948 C Bi:5:033:3 0 12 = 00000c00 13020100 66000000
ffff81017941f900 2494076954 C Bo:5:033:4 0 8 >
ffff81017941f900 2494077905 S Bi:5:033:3 -115 4096 <
ffff81017941f480 2494078861 S Bo:5:033:4 -115 6 = 02000600 00ee
ffff81017941f900 2494079943 C Bi:5:033:3 0 12 = 00000c00 13020100 67000000
ffff81017941f480 2494079948 C Bo:5:033:4 0 6 >
ffff81017941f480 2494082069 S Bi:5:033:3 -115 4096 <
ffff81017941f480 2494082942 C Bi:5:033:3 0 8 = 02000800 64002900
ffff81017941f480 2494086910 S Bi:5:033:3 -115 4096 <
ffff81017941f480 2494087950 C Bi:5:033:3 0 45 = 02002d00 74d4491b 9cdd000e 6e65745f 72696d5f 62625f73 6d730009 342e352e
ffff81017941f480 2494096278 S Bo:5:033:4 -115 8 = 02000800 6e000200
ffff81017941f900 2494096339 S Bi:5:033:3 -115 4096 <
ffff81017941f480 2494096931 C Bo:5:033:4 0 8 >
ffff81017941f900 2494097945 C Bi:5:033:3 0 12 = 00000c00 13020100 68000000
ffff81017941f900 2494102472 S Bi:5:033:3 -115 4096 <
ffff81017941f480 2494103704 S Bo:5:033:4 -115 6 = 02000600 00f4
ffff81017941f480 2494103931 C Bo:5:033:4 0 6 >
ffff81017941f900 2494104945 C Bi:5:033:3 0 12 = 00000c00 13020100 69000000
ffff81017941f900 2494113263 S Bi:5:033:3 -115 4096 <
ffff81017941f900 2494113948 C Bi:5:033:3 0 8 = 02000800 64003000
ffff81017941f900 2494120273 S Bi:5:033:3 -115 4096 <
ffff81017941f900 2494120948 C Bi:5:033:3 0 52 = 02003400 2d8c491b 9d1b0015 6e65745f 72696d5f 63656c6c 62726f61 64636173
ffff81017941f900 2494126510 S Bi:5:033:3 -115 4096 <
ffff81017941f480 2494130324 S Bo:5:033:4 -115 8 = 02000800 6e000200
ffff81017941f480 2494130933 C Bo:5:033:4 0 8 >
ffff81017941f900 2494131948 C Bi:5:033:3 0 12 = 00000c00 13020100 6a000000
ffff81017941f900 2494134266 S Bo:5:033:4 -115 6 = 02000600 00f7
ffff81017941f480 2494134321 S Bi:5:033:3 -115 4096 <
ffff81017941f900 2494134931 C Bo:5:033:4 0 6 >
ffff81017941f480 2494135947 C Bi:5:033:3 0 12 = 00000c00 13020100 6b000000
ffff81017941f480 2494138368 S Bi:5:033:3 -115 4096 <
ffff81017941f480 2494138947 C Bi:5:033:3 0 8 = 02000800 64002f00
ffff81017941f480 2494142563 S Bi:5:033:3 -115 4096 <
ffff81017941f480 2494142949 C Bi:5:033:3 0 51 = 02003300 0a08491b 9c020014 6e65745f 72696d5f 7469645f 6d756c74 69746170
ffff81017941f480 2494144385 S Bi:5:033:3 -115 4096 <
ffff81017941f900 2494146993 S Bo:5:033:4 -115 8 = 02000800 6e000200
ffff81017941f480 2494147950 C Bi:5:033:3 0 12 = 00000c00 13020100 6c000000
ffff81017941f900 2494147954 C Bo:5:033:4 0 8 >
ffff81017941f900 2494149601 S Bo:5:033:4 -115 6 = 02000600 00fa
ffff81017941f480 2494149644 S Bi:5:033:3 -115 4096 <
ffff81017941f900 2494149932 C Bo:5:033:4 0 6 >
ffff81017941f480 2494150952 C Bi:5:033:3 0 12 = 00000c00 13020100 6d000000
ffff81017941f480 2494154612 S Bi:5:033:3 -115 4096 <
ffff81017941f480 2494154950 C Bi:5:033:3 0 8 = 02000800 64002c00
ffff81017941f480 2494158768 S Bi:5:033:3 -115 4096 <
ffff81017941f480 2494158959 C Bi:5:033:3 0 48 = 02003000 0b78491b 9cdd0011 6e65745f 72696d5f 626c7565 746f6f74 68000934
ffff81017941f480 2494161837 S Bi:5:033:3 -115 4096 <
ffff81017941f900 2494168327 S Bo:5:033:4 -115 8 = 02000800 6e000200
ffff81017941f900 2494168935 C Bo:5:033:4 0 8 >
ffff81017941f480 2494169950 C Bi:5:033:3 0 12 = 00000c00 13020100 6e000000
ffff81017941f480 2494171539 S Bo:5:033:4 -115 6 = 02000600 0100
ffff81017941f900 2494171580 S Bi:5:033:3 -115 4096 <
ffff81017941f480 2494171934 C Bo:5:033:4 0 6 >
ffff81017941f900 2494172948 C Bi:5:033:3 0 12 = 00000c00 13020100 6f000000
ffff81017941f900 2494174114 S Bi:5:033:3 -115 4096 <
ffff81017941f900 2494177955 C Bi:5:033:3 0 8 = 02000800 64002900
ffff81017941f900 2494178759 S Bi:5:033:3 -115 4096 <
ffff81017941f900 2494179014 C Bi:5:033:3 0 45 = 02002d00 61944804 f9850011 6e65745f 72696d5f 62625f71 6d5f6169 6d000632
ffff81017941f900 2494183090 S Bo:5:033:4 -115 8 = 02000800 6e000200
ffff81017941f480 2494183152 S Bi:5:033:3 -115 4096 <
ffff81017941f900 2494183935 C Bo:5:033:4 0 8 >
ffff81017941f480 2494183956 C Bi:5:033:3 0 12 = 00000c00 13020100 70000000
ffff81017941f480 2494192364 S Bo:5:033:4 -115 6 = 02000600 010f
ffff81017941f900 2494192411 S Bi:5:033:3 -115 4096 <
ffff81017941f480 2494192935 C Bo:5:033:4 0 6 >
ffff81017941f900 2494193953 C Bi:5:033:3 0 12 = 00000c00 13020100 71000000
ffff81017941f900 2494195620 S Bi:5:033:3 -115 4096 <
ffff81017941f900 2494195951 C Bi:5:033:3 0 8 = 02000800 64003500
ffff81017941f900 2494202333 S Bi:5:033:3 -115 4096 <
ffff81017941f900 2494203028 C Bi:5:033:3 0 57 = 02003900 5c604804 f9a0001d 6e65745f 72696d5f 62625f71 6d5f6169 6d5f7265
ffff81017941f900 2494205997 S Bi:5:033:3 -115 4096 <
ffff81017941f480 2494208090 S Bo:5:033:4 -115 8 = 02000800 6e000200
ffff81017941f900 2494208956 C Bi:5:033:3 0 12 = 00000c00 13020100 72000000
ffff81017941f480 2494208962 C Bo:5:033:4 0 8 >
ffff8101e9e5ed80 2494210052 S Bo:5:033:4 -115 6 = 02000600 0112
ffff81012a229840 2494210073 S Bi:5:033:3 -115 4096 <
ffff8101e9e5ed80 2494210935 C Bo:5:033:4 0 6 >
ffff81012a229840 2494210957 C Bi:5:033:3 0 12 = 00000c00 13020100 73000000
ffff81012a229840 2494213868 S Bi:5:033:3 -115 4096 <
ffff81012a229840 2494214952 C Bi:5:033:3 0 8 = 02000800 64003500
ffff81012a229840 2494219311 S Bi:5:033:3 -115 4096 <
ffff81012a229840 2494219953 C Bi:5:033:3 0 57 = 02003900 67b44804 f9a6001d 6e65745f 72696d5f 62625f71 6d5f6169 6d5f7265
ffff81012a229840 2494225590 S Bi:5:033:3 -115 4096 <
ffff8101f8b98240 2494226582 S Bo:5:033:4 -115 8 = 02000800 6e000200
ffff8101f8b98240 2494226937 C Bo:5:033:4 0 8 >
ffff81012a229840 2494227951 C Bi:5:033:3 0 12 = 00000c00 13020100 74000000
ffff8101f8b98240 2494230658 S Bo:5:033:4 -115 6 = 02000600 0115
ffff8100b5228180 2494230678 S Bi:5:033:3 -115 4096 <
ffff8101f8b98240 2494230938 C Bo:5:033:4 0 6 >
ffff8100b5228180 2494231953 C Bi:5:033:3 0 12 = 00000c00 13020100 75000000
ffff8100b5228180 2494234383 S Bi:5:033:3 -115 4096 <
ffff8100b5228180 2494234952 C Bi:5:033:3 0 8 = 02000800 64002a00
ffff8100b5228180 2494238291 S Bi:5:033:3 -115 4096 <
ffff8100b5228180 2494238952 C Bi:5:033:3 0 46 = 02002e00 12bc491b ac42000f 6e65745f 72696d5f 6269735f 6c696200 09342e35
ffff81017941f3c0 2494243257 S Bi:5:033:3 -115 4096 <
ffff81017941ff00 2494244221 S Bo:5:033:4 -115 8 = 02000800 6e000200
ffff81017941ff00 2494244940 C Bo:5:033:4 0 8 >
ffff81017941f3c0 2494246005 C Bi:5:033:3 0 12 = 00000c00 13020100 76000000
ffff81017941f3c0 2494247355 S Bo:5:033:4 -115 6 = 02000600 0118
ffff81017941ff00 2494247405 S Bi:5:033:3 -115 4096 <
ffff81017941f3c0 2494247983 C Bo:5:033:4 0 6 >
ffff81017941ff00 2494248956 C Bi:5:033:3 0 12 = 00000c00 13020100 77000000
ffff81017941ff00 2494254231 S Bi:5:033:3 -115 4096 <
ffff81017941ff00 2494254956 C Bi:5:033:3 0 8 = 02000800 64002d00
ffff81017941ff00 2494258968 S Bi:5:033:3 -115 4096 <
ffff81017941ff00 2494259955 C Bi:5:033:3 0 49 = 02003100 a160491b b5140012 6e65745f 72696d5f 6269735f 636c6965 6e740009
ffff81017941ff00 2494262121 S Bi:5:033:3 -115 4096 <
ffff81017941f3c0 2494265021 S Bo:5:033:4 -115 8 = 02000800 6e000200
ffff81017941ff00 2494265956 C Bi:5:033:3 0 12 = 00000c00 13020100 78000000
ffff81017941f3c0 2494265961 C Bo:5:033:4 0 8 >
ffff81017941f3c0 2494269171 S Bo:5:033:4 -115 6 = 02000600 0121
ffff81017941ff00 2494269214 S Bi:5:033:3 -115 4096 <
ffff81017941f3c0 2494269940 C Bo:5:033:4 0 6 >
ffff81017941ff00 2494269960 C Bi:5:033:3 0 12 = 00000c00 13020100 79000000
ffff81017941ff00 2494276109 S Bi:5:033:3 -115 4096 <
ffff81017941ff00 2494276955 C Bi:5:033:3 0 8 = 02000800 64002d00
ffff81017941ff00 2494279499 S Bi:5:033:3 -115 4096 <
ffff81017941ff00 2494279955 C Bi:5:033:3 0 49 = 02003100 ca30491b b4c00012 6e65745f 72696d5f 6269735f 6c61756e 63680009
ffff81017941ff00 2494281871 S Bi:5:033:3 -115 4096 <
ffff81017941f3c0 2494285145 S Bo:5:033:4 -115 8 = 02000800 6e000200
ffff81017941ff00 2494285958 C Bi:5:033:3 0 12 = 00000c00 13020100 7a000000
ffff81017941f3c0 2494285963 C Bo:5:033:4 0 8 >
ffff81017941f3c0 2494289453 S Bo:5:033:4 -115 6 = 02000600 0124
ffff81017941ff00 2494289503 S Bi:5:033:3 -115 4096 <
ffff81017941f3c0 2494289941 C Bo:5:033:4 0 6 >
ffff81017941ff00 2494290955 C Bi:5:033:3 0 12 = 00000c00 13020100 7b000000
ffff81017941ff00 2494294400 S Bi:5:033:3 -115 4096 <
ffff81017941ff00 2494294956 C Bi:5:033:3 0 8 = 02000800 64003100
ffff81017941ff00 2494298264 S Bi:5:033:3 -115 4096 <
ffff81017941ff00 2494298959 C Bi:5:033:3 0 53 = 02003500 0648491b ac830016 6e65745f 72696d5f 6269735f 636c6965 6e745f72
ffff81017941ff00 2494304210 S Bo:5:033:4 -115 8 = 02000800 6e000200
ffff81017941f3c0 2494304376 S Bi:5:033:3 -115 4096 <
ffff81017941ff00 2494304942 C Bo:5:033:4 0 8 >
ffff81017941f3c0 2494305959 C Bi:5:033:3 0 12 = 00000c00 13020100 7c000000
ffff81017941f3c0 2494307208 S Bo:5:033:4 -115 6 = 02000600 0127
ffff81017941ff00 2494307290 S Bi:5:033:3 -115 4096 <
ffff81017941f3c0 2494307941 C Bo:5:033:4 0 6 >
ffff81017941ff00 2494308959 C Bi:5:033:3 0 12 = 00000c00 13020100 7d000000
ffff8100b5228180 2494314790 S Bi:5:033:3 -115 4096 <
ffff8100b5228180 2494314961 C Bi:5:033:3 0 8 = 02000800 64003700
ffff8100b5228180 2494318693 S Bi:5:033:3 -115 4096 <
ffff8100b5228180 2494318958 C Bi:5:033:3 0 59 = 02003b00 0624491b ac84001c 6e65745f 72696d5f 6269735f 636c6965 6e745f72
ffff8100b5228180 2494327016 S Bo:5:033:4 -115 8 = 02000800 6e000200
ffff8100b52283c0 2494327042 S Bi:5:033:3 -115 4096 <
ffff8100b5228180 2494327942 C Bo:5:033:4 0 8 >
ffff8100b52283c0 2494327963 C Bi:5:033:3 0 12 = 00000c00 13020100 7e000000
ffff8100b52283c0 2494334316 S Bo:5:033:4 -115 6 = 02000600 012a
ffff8100b5228180 2494334336 S Bi:5:033:3 -115 4096 <
ffff8100b52283c0 2494334944 C Bo:5:033:4 0 6 >
ffff8100b5228180 2494335959 C Bi:5:033:3 0 12 = 00000c00 13020100 7f000000
ffff8100b5228180 2494338257 S Bi:5:033:3 -115 4096 <
ffff8100b5228180 2494338958 C Bi:5:033:3 0 8 = 02000800 64003100
ffff8100b5228180 2494342520 S Bi:5:033:3 -115 4096 <
ffff8100b5228180 2494342960 C Bi:5:033:3 0 53 = 02003500 2138491b ac520016 6e65745f 72696d5f 6269735f 636c6965 6e745f5f
ffff8100b5228180 2494347693 S Bi:5:033:3 -115 4096 <
ffff8100b52283c0 2494351920 S Bo:5:033:4 -115 8 = 02000800 6e000200
ffff8100b5228180 2494352965 C Bi:5:033:3 0 12 = 00000c00 13020100 80000000
ffff8100b52283c0 2494352972 C Bo:5:033:4 0 8 >
ffff8100b52283c0 2494358572 S Bo:5:033:4 -115 6 = 02000600 012d
ffff8100b5228180 2494358590 S Bi:5:033:3 -115 4096 <
ffff8100b52283c0 2494358944 C Bo:5:033:4 0 6 >
ffff8100b5228180 2494359959 C Bi:5:033:3 0 12 = 00000c00 13020100 81000000
ffff8100b5228180 2494362409 S Bi:5:033:3 -115 4096 <
ffff8100b5228180 2494362960 C Bi:5:033:3 0 8 = 02000800 64003100
ffff8100b5228180 2494365445 S Bi:5:033:3 -115 4096 <
ffff8100b5228180 2494365960 C Bi:5:033:3 0 53 = 02003500 2cb0491b ac510016 6e65745f 72696d5f 6269735f 636c6965 6e745f5f
ffff8100b5228180 2494372052 S Bo:5:033:4 -115 8 = 02000800 6e000200
ffff8100b52283c0 2494372074 S Bi:5:033:3 -115 4096 <
ffff8100b5228180 2494372947 C Bo:5:033:4 0 8 >
ffff8100b52283c0 2494372968 C Bi:5:033:3 0 12 = 00000c00 13020100 82000000
ffff8100b52283c0 2494374041 S Bo:5:033:4 -115 6 = 02000600 0130
ffff8100b5228180 2494374059 S Bi:5:033:3 -115 4096 <
ffff8100b52283c0 2494374945 C Bo:5:033:4 0 6 >
ffff8100b5228180 2494374966 C Bi:5:033:3 0 12 = 00000c00 13020100 83000000
ffff8100b5228180 2494378397 S Bi:5:033:3 -115 4096 <
ffff8100b5228180 2494378961 C Bi:5:033:3 0 8 = 02000800 64003100
ffff8100b5228180 2494382861 S Bi:5:033:3 -115 4096 <
ffff8100b5228180 2494383960 C Bi:5:033:3 0 53 = 02003500 2438491b ac5b0016 6e65745f 72696d5f 6269735f 636c6965 6e745f5f
ffff8100b5228180 2494389858 S Bi:5:033:3 -115 4096 <
ffff8100b52283c0 2494390730 S Bo:5:033:4 -115 8 = 02000800 6e000200
ffff8100b52283c0 2494390946 C Bo:5:033:4 0 8 >
ffff8100b5228180 2494391960 C Bi:5:033:3 0 12 = 00000c00 13020100 84000000
ffff8100b5228180 2494394344 S Bo:5:033:4 -115 6 = 02000600 0133
ffff8100b52283c0 2494394362 S Bi:5:033:3 -115 4096 <
ffff8100b5228180 2494394946 C Bo:5:033:4 0 6 >
ffff8100b52283c0 2494395959 C Bi:5:033:3 0 12 = 00000c00 13020100 85000000
ffff8100b52283c0 2494398794 S Bi:5:033:3 -115 4096 <
ffff8100b52283c0 2494398962 C Bi:5:033:3 0 8 = 02000800 64004700
ffff8100b52283c0 2494402679 S Bi:5:033:3 -115 4096 <
ffff8100b52283c0 2494402961 C Bi:5:033:3 0 75 = 02004b00 5e18491b ab1b002c 6e65745f 72696d5f 7469645f 64796e61 6d69635f
ffff8100b52283c0 2494404974 S Bi:5:033:3 -115 4096 <
ffff8100b5228180 2494411563 S Bo:5:033:4 -115 8 = 02000800 6e000200
ffff8100b5228180 2494411948 C Bo:5:033:4 0 8 >
ffff8100b52283c0 2494412963 C Bi:5:033:3 0 12 = 00000c00 13020100 86000000
ffff8100b52283c0 2494414592 S Bo:5:033:4 -115 6 = 02000600 0136
ffff8100b5228180 2494414612 S Bi:5:033:3 -115 4096 <
ffff8100b52283c0 2494414948 C Bo:5:033:4 0 6 >
ffff8100b5228180 2494415962 C Bi:5:033:3 0 12 = 00000c00 13020100 87000000
ffff8100b5228180 2494418210 S Bi:5:033:3 -115 4096 <
ffff8100b5228180 2494418963 C Bi:5:033:3 0 8 = 02000800 64004700
ffff8100b5228180 2494421381 S Bi:5:033:3 -115 4096 <
ffff8100b5228180 2494421963 C Bi:5:033:3 0 75 = 02004b00 5c94491b ab71002c 6e65745f 72696d5f 7469645f 64796e61 6d69635f
ffff8100b5228180 2494423400 S Bi:5:033:3 -115 4096 <
ffff8100b52283c0 2494427423 S Bo:5:033:4 -115 8 = 02000800 6e000200
ffff8100b52283c0 2494427947 C Bo:5:033:4 0 8 >
ffff8100b5228180 2494428964 C Bi:5:033:3 0 12 = 00000c00 13020100 88000000
ffff81017941f3c0 2494432328 S Bo:5:033:4 -115 6 = 02000600 0139
ffff81017941ff00 2494432377 S Bi:5:033:3 -115 4096 <
ffff81017941f3c0 2494432947 C Bo:5:033:4 0 6 >
ffff81017941ff00 2494433964 C Bi:5:033:3 0 12 = 00000c00 13020100 89000000
ffff81017941ff00 2494435583 S Bi:5:033:3 -115 4096 <
ffff81017941ff00 2494435964 C Bi:5:033:3 0 8 = 02000800 64002b00
ffff81017941ff00 2494438190 S Bi:5:033:3 -115 4096 <
ffff81017941ff00 2494438976 C Bi:5:033:3 0 47 = 02002f00 b084491b a9d10010 6e65745f 72696d5f 7469645f 636f7265 0009342e
ffff81017941ff00 2494444180 S Bo:5:033:4 -115 8 = 02000800 6e000200
ffff81017941f3c0 2494444345 S Bi:5:033:3 -115 4096 <
ffff81017941ff00 2494444950 C Bo:5:033:4 0 8 >
ffff81017941f3c0 2494444970 C Bi:5:033:3 0 12 = 00000c00 13020100 8a000000
ffff81017941f3c0 2494447555 S Bo:5:033:4 -115 6 = 02000600 013c
ffff81017941ff00 2494447611 S Bi:5:033:3 -115 4096 <
ffff81017941f3c0 2494447949 C Bo:5:033:4 0 6 >
ffff81017941ff00 2494448967 C Bi:5:033:3 0 12 = 00000c00 13020100 8b000000
ffff81017941ff00 2494455071 S Bi:5:033:3 -115 4096 <
ffff81017941ff00 2494455966 C Bi:5:033:3 0 8 = 02000800 64004200
ffff81017941ff00 2494457133 S Bi:5:033:3 -115 4096 <
ffff81017941ff00 2494457975 C Bi:5:033:3 0 70 = 02004600 47c0491b ad100027 6e65745f 72696d5f 62625f6f 7074696f 6e735f63
ffff81017941ff00 2494460155 S Bi:5:033:3 -115 4096 <
ffff81017941f3c0 2494462225 S Bo:5:033:4 -115 8 = 02000800 6e000200
ffff81017941f3c0 2494462951 C Bo:5:033:4 0 8 >
ffff81017941ff00 2494463969 C Bi:5:033:3 0 12 = 00000c00 13020100 8c000000
ffff81017941ff00 2494466063 S Bo:5:033:4 -115 6 = 02000600 013f
ffff81017941f3c0 2494466115 S Bi:5:033:3 -115 4096 <
ffff81017941ff00 2494466948 C Bo:5:033:4 0 6 >
ffff81017941f3c0 2494466968 C Bi:5:033:3 0 12 = 00000c00 13020100 8d000000
ffff81017941f3c0 2494469109 S Bi:5:033:3 -115 4096 <
ffff81017941f3c0 2494469970 C Bi:5:033:3 0 8 = 02000800 64003300
ffff81017941f3c0 2494471773 S Bi:5:033:3 -115 4096 <
ffff81017941f3c0 2494471976 C Bi:5:033:3 0 55 = 02003700 3b60491b aafc0018 6e65745f 72696d5f 7469645f 696d5f61 6c70685f
ffff81017941ff00 2494476223 S Bo:5:033:4 -115 8 = 02000800 6e000200
ffff81017941f480 2494476855 S Bi:5:033:3 -115 4096 <
ffff81017941ff00 2494476952 C Bo:5:033:4 0 8 >
ffff81017941f480 2494477977 C Bi:5:033:3 0 12 = 00000c00 13020100 8e000000
ffff81017941f480 2494480088 S Bo:5:033:4 -115 6 = 02000600 0142
ffff81017941ff00 2494480150 S Bi:5:033:3 -115 4096 <
ffff81017941f480 2494480950 C Bo:5:033:4 0 6 >
ffff81017941ff00 2494480970 C Bi:5:033:3 0 12 = 00000c00 13020100 8f000000
ffff81017941ff00 2494482106 S Bi:5:033:3 -115 4096 <
ffff81017941ff00 2494483964 C Bi:5:033:3 0 8 = 02000800 64002600
ffff81017941ff00 2494485959 S Bi:5:033:3 -115 4096 <
ffff81017941ff00 2494486966 C Bi:5:033:3 0 42 = 02002a00 376c491b 9b69000b 6e65745f 72696d5f 74696400 09342e35 2e302e31
ffff81017941ff00 2494490569 S Bi:5:033:3 -115 4096 <
ffff81017941f3c0 2494493505 S Bo:5:033:4 -115 8 = 02000800 6e000200
ffff81017941f3c0 2494493953 C Bo:5:033:4 0 8 >
ffff81017941ff00 2494494968 C Bi:5:033:3 0 12 = 00000c00 13020100 90000000
ffff81017941ff00 2494498071 S Bo:5:033:4 -115 6 = 02000600 0148
ffff81017941f3c0 2494498128 S Bi:5:033:3 -115 4096 <
ffff81017941ff00 2494498951 C Bo:5:033:4 0 6 >
ffff81017941f3c0 2494498971 C Bi:5:033:3 0 12 = 00000c00 13020100 91000000
ffff81017941f3c0 2494502057 S Bi:5:033:3 -115 4096 <
ffff81017941f3c0 2494504974 C Bi:5:033:3 0 8 = 02000800 64004900
ffff81017941f3c0 2494507134 S Bi:5:033:3 -115 4096 <
ffff81017941f3c0 2494508033 C Bi:5:033:3 0 77 = 02004d00 e5e4491b ab16002e 6e65745f 72696d5f 7469645f 64796e61 6d69635f
ffff81017941f3c0 2494509207 S Bi:5:033:3 -115 4096 <
ffff81017941ff00 2494515321 S Bo:5:033:4 -115 8 = 02000800 6e000200
ffff81017941ff00 2494515954 C Bo:5:033:4 0 8 >
ffff81017941f3c0 2494516972 C Bi:5:033:3 0 12 = 00000c00 13020100 92000000
ffff81017941f3c0 2494518352 S Bo:5:033:4 -115 6 = 02000600 0154
ffff81017941ff00 2494518393 S Bi:5:033:3 -115 4096 <
ffff81017941f3c0 2494518952 C Bo:5:033:4 0 6 >
ffff81017941ff00 2494519966 C Bi:5:033:3 0 12 = 00000c00 13020100 93000000
ffff81017941ff00 2494521389 S Bi:5:033:3 -115 4096 <
ffff81017941ff00 2494525970 C Bi:5:033:3 0 8 = 02000800 64004900
ffff81017941ff00 2494529649 S Bi:5:033:3 -115 4096 <
ffff81017941ff00 2494529972 C Bi:5:033:3 0 77 = 02004d00 72b8491b ab95002e 6e65745f 72696d5f 7469645f 64796e61 6d69635f
ffff81017941ff00 2494534744 S Bo:5:033:4 -115 8 = 02000800 6e000200
ffff81017941ff00 2494534956 C Bo:5:033:4 0 8 >
ffff81017941f3c0 2494535016 S Bi:5:033:3 -115 4096 <
ffff81017941f3c0 2494536003 C Bi:5:033:3 0 12 = 00000c00 13020100 94000000
ffff81017941f3c0 2494537554 S Bo:5:033:4 -115 6 = 02000600 0160
ffff81017941ff00 2494537597 S Bi:5:033:3 -115 4096 <
ffff81017941f3c0 2494537953 C Bo:5:033:4 0 6 >
ffff81017941ff00 2494538998 C Bi:5:033:3 0 12 = 00000c00 13020100 95000000
ffff81017941ff00 2494540595 S Bi:5:033:3 -115 4096 <
ffff81017941ff00 2494541968 C Bi:5:033:3 0 8 = 02000800 64003200
ffff81017941ff00 2494545955 S Bi:5:033:3 -115 4096 <
ffff81017941ff00 2494546972 C Bi:5:033:3 0 54 = 02003600 780c491b ab3a0017 6e65745f 72696d5f 7469645f 7370656c 6c5f6368
ffff81017941ff00 2494551754 S Bo:5:033:4 -115 8 = 02000800 6e000200
ffff81017941f3c0 2494551817 S Bi:5:033:3 -115 4096 <
ffff81017941ff00 2494551956 C Bo:5:033:4 0 8 >
ffff81017941f3c0 2494552971 C Bi:5:033:3 0 12 = 00000c00 13020100 96000000
ffff81017941f3c0 2494555800 S Bo:5:033:4 -115 6 = 02000600 0166
ffff81017941ff00 2494555857 S Bi:5:033:3 -115 4096 <
ffff81017941f3c0 2494555955 C Bo:5:033:4 0 6 >
ffff81017941ff00 2494556981 C Bi:5:033:3 0 12 = 00000c00 13020100 97000000
ffff81017941ff00 2494558838 S Bi:5:033:3 -115 4096 <
ffff81017941ff00 2494575978 C Bi:5:033:3 0 8 = 02000800 64003600
ffff81017941ff00 2494578060 S Bi:5:033:3 -115 4096 <
ffff81017941ff00 2494578973 C Bi:5:033:3 0 58 = 02003a00 e4fc491b a354001b 6e65745f 72696d5f 666f6e74 5f6c6174 696e5f74
ffff81017941ff00 2494582065 S Bi:5:033:3 -115 4096 <
ffff81017941f3c0 2494585847 S Bo:5:033:4 -115 8 = 02000800 6e000200
ffff81017941f3c0 2494585959 C Bo:5:033:4 0 8 >
ffff81017941ff00 2494586972 C Bi:5:033:3 0 12 = 00000c00 13020100 98000000
ffff81017941ff00 2494589600 S Bo:5:033:4 -115 6 = 02000600 018a
ffff81017941f3c0 2494589652 S Bi:5:033:3 -115 4096 <
ffff81017941ff00 2494589956 C Bo:5:033:4 0 6 >
ffff81017941f3c0 2494590971 C Bi:5:033:3 0 12 = 00000c00 13020100 99000000
ffff81017941f3c0 2494593884 S Bi:5:033:3 -115 4096 <
ffff81017941f3c0 2494605976 C Bi:5:033:3 0 8 = 02000800 64002500
ffff81017941f3c0 2494609486 S Bi:5:033:3 -115 4096 <
ffff81017941f3c0 2494609977 C Bi:5:033:3 0 41 = 02002900 d398491b a98b000a 6e65745f 72696d5f 6f730009 342e352e 302e3131
ffff81017941f3c0 2494614525 S Bo:5:033:4 -115 8 = 02000800 6e000200
ffff81017941ff00 2494614587 S Bi:5:033:3 -115 4096 <
ffff81017941f3c0 2494614959 C Bo:5:033:4 0 8 >
ffff81017941ff00 2494615975 C Bi:5:033:3 0 12 = 00000c00 13020100 9a000000
ffff81017941ff00 2494617553 S Bo:5:033:4 -115 6 = 02000600 01a5
ffff81017941f3c0 2494617600 S Bi:5:033:3 -115 4096 <
ffff81017941ff00 2494617958 C Bo:5:033:4 0 6 >
ffff81017941f3c0 2494618996 C Bi:5:033:3 0 12 = 00000c00 13020100 9b000000
ffff81017941f3c0 2494621465 S Bi:5:033:3 -115 4096 <
ffff81017941f3c0 2494621974 C Bi:5:033:3 0 8 = 02000800 64002c00
ffff81017941f3c0 2494625920 S Bi:5:033:3 -115 4096 <
ffff81017941f3c0 2494626975 C Bi:5:033:3 0 48 = 02003000 7154491b aab30011 6e65745f 72696d5f 736d6172 74636172 64000934
ffff81017941f3c0 2494629770 S Bi:5:033:3 -115 4096 <
ffff81017941ff00 2494632679 S Bo:5:033:4 -115 8 = 02000800 6e000200
ffff81017941ff00 2494632962 C Bo:5:033:4 0 8 >
ffff81017941f3c0 2494634037 C Bi:5:033:3 0 12 = 00000c00 13020100 9c000000
ffff81017941f3c0 2494635521 S Bo:5:033:4 -115 6 = 02000600 01a8
ffff81017941ff00 2494635563 S Bi:5:033:3 -115 4096 <
ffff81017941f3c0 2494635959 C Bo:5:033:4 0 6 >
ffff81017941ff00 2494636985 C Bi:5:033:3 0 12 = 00000c00 13020100 9d000000
ffff81017941ff00 2494638558 S Bi:5:033:3 -115 4096 <
ffff81017941ff00 2494638974 C Bi:5:033:3 0 8 = 02000800 64003700
ffff81017941ff00 2494641678 S Bi:5:033:3 -115 4096 <
ffff81017941ff00 2494641985 C Bi:5:033:3 0 59 = 02003b00 34e8491b aa84001c 6e65745f 72696d5f 6576656e 745f6c6f 675f7669
ffff81017941ff00 2494643650 S Bi:5:033:3 -115 4096 <
ffff81017941f3c0 2494647530 S Bo:5:033:4 -115 8 = 02000800 6e000200
ffff81017941f3c0 2494647962 C Bo:5:033:4 0 8 >
ffff81017941ff00 2494649028 C Bi:5:033:3 0 12 = 00000c00 13020100 9e000000
ffff81017941ff00 2494650559 S Bo:5:033:4 -115 6 = 02000600 01ab
ffff81017941f3c0 2494650610 S Bi:5:033:3 -115 4096 <
ffff81017941ff00 2494650960 C Bo:5:033:4 0 6 >
ffff81017941f3c0 2494651974 C Bi:5:033:3 0 12 = 00000c00 13020100 9f000000
ffff81017941f3c0 2494655618 S Bi:5:033:3 -115 4096 <
ffff81017941f3c0 2494655978 C Bi:5:033:3 0 8 = 02000800 64003300
ffff81017941f3c0 2494658819 S Bi:5:033:3 -115 4096 <
ffff81017941f3c0 2494658977 C Bi:5:033:3 0 55 = 02003700 3184491b aa720018 6e65745f 72696d5f 636c6463 5f696f5f 72696d5f
ffff81017941f3c0 2494663571 S Bo:5:033:4 -115 8 = 02000800 6e000200
ffff81017941ff00 2494663634 S Bi:5:033:3 -115 4096 <
ffff81017941f3c0 2494663962 C Bo:5:033:4 0 8 >
ffff81017941ff00 2494665052 C Bi:5:033:3 0 12 = 00000c00 13020100 a0000000
ffff81017941ff00 2494666665 S Bo:5:033:4 -115 6 = 02000600 01ae
ffff81017941f3c0 2494666712 S Bi:5:033:3 -115 4096 <
ffff81017941ff00 2494666961 C Bo:5:033:4 0 6 >
ffff81017941f3c0 2494668043 C Bi:5:033:3 0 12 = 00000c00 13020100 a1000000
ffff81017941f3c0 2494669577 S Bi:5:033:3 -115 4096 <
ffff81017941f3c0 2494669976 C Bi:5:033:3 0 8 = 02000800 64003300
ffff81017941f3c0 2494671596 S Bi:5:033:3 -115 4096 <
ffff81017941f3c0 2494672001 C Bi:5:033:3 0 55 = 02003700 0a98491b a36b0018 6e65745f 72696d5f 72756e74 696d655f 7265736f
ffff81017941f3c0 2494673711 S Bi:5:033:3 -115 4096 <
ffff81017941ff00 2494676638 S Bo:5:033:4 -115 8 = 02000800 6e000200
ffff81017941ff00 2494676963 C Bo:5:033:4 0 8 >
ffff81017941f3c0 2494677977 C Bi:5:033:3 0 12 = 00000c00 13020100 a2000000
ffff81017941f3c0 2494679689 S Bo:5:033:4 -115 6 = 02000600 01b1
ffff81017941ff00 2494679734 S Bi:5:033:3 -115 4096 <
ffff81017941f3c0 2494679961 C Bo:5:033:4 0 6 >
ffff81017941ff00 2494680989 C Bi:5:033:3 0 12 = 00000c00 13020100 a3000000
ffff81017941ff00 2494682498 S Bi:5:033:3 -115 4096 <
ffff81017941ff00 2494682976 C Bi:5:033:3 0 8 = 02000800 64003700
ffff81017941ff00 2494685699 S Bi:5:033:3 -115 4096 <
ffff81017941ff00 2494686008 C Bi:5:033:3 0 59 = 02003b00 3338491b a360001c 6e65745f 72696d5f 72756e74 696d655f 7265736f
ffff81017941ff00 2494687646 S Bi:5:033:3 -115 4096 <
ffff81017941f3c0 2494690539 S Bo:5:033:4 -115 8 = 02000800 6e000200
ffff81017941f3c0 2494690964 C Bo:5:033:4 0 8 >
ffff81017941ff00 2494691978 C Bi:5:033:3 0 12 = 00000c00 13020100 a4000000
ffff81017941ff00 2494694518 S Bo:5:033:4 -115 6 = 02000600 01b4
ffff81017941f3c0 2494694574 S Bi:5:033:3 -115 4096 <
ffff81017941ff00 2494694962 C Bo:5:033:4 0 6 >
ffff81017941f3c0 2494695979 C Bi:5:033:3 0 12 = 00000c00 13020100 a5000000
ffff81017941f3c0 2494697547 S Bi:5:033:3 -115 4096 <
ffff81017941f3c0 2494697977 C Bi:5:033:3 0 8 = 02000800 64003000
ffff81017941f3c0 2494701871 S Bi:5:033:3 -115 4096 <
ffff81017941f3c0 2494702981 C Bi:5:033:3 0 52 = 02003400 e3fc491b a6ea0015 6e65745f 72696d5f 62625f61 63746976 6174696f
ffff81017941f3c0 2494707816 S Bo:5:033:4 -115 8 = 02000800 6e000200
ffff81017941ff00 2494707876 S Bi:5:033:3 -115 4096 <
ffff81017941f3c0 2494707971 C Bo:5:033:4 0 8 >
ffff81017941ff00 2494708989 C Bi:5:033:3 0 12 = 00000c00 13020100 a6000000
ffff81017941ff00 2494710885 S Bo:5:033:4 -115 6 = 02000600 01b7
ffff81017941f3c0 2494710937 S Bi:5:033:3 -115 4096 <
ffff81017941ff00 2494711962 C Bo:5:033:4 0 6 >
ffff81017941f3c0 2494711982 C Bi:5:033:3 0 12 = 00000c00 13020100 a7000000
ffff81017941f3c0 2494713862 S Bi:5:033:3 -115 4096 <
ffff81017941f3c0 2494715981 C Bi:5:033:3 0 8 = 02000800 64003500
ffff81017941f3c0 2494719014 S Bi:5:033:3 -115 4096 <
ffff81017941f3c0 2494719982 C Bi:5:033:3 0 57 = 02003900 3dd4491b a64e001a 6e65745f 72696d5f 62625f61 64647265 7373626f
ffff81017941f3c0 2494722203 S Bi:5:033:3 -115 4096 <
ffff81017941ff00 2494725087 S Bo:5:033:4 -115 8 = 02000800 6e000200
ffff81017941f3c0 2494725984 C Bi:5:033:3 0 12 = 00000c00 13020100 a8000000
ffff81017941ff00 2494725989 C Bo:5:033:4 0 8 >
ffff81017941ff00 2494729515 S Bi:5:033:3 -115 4096 <
ffff81017941f3c0 2494730476 S Bo:5:033:4 -115 6 = 02000600 01bd
ffff81017941f3c0 2494730966 C Bo:5:033:4 0 6 >
ffff81017941ff00 2494731980 C Bi:5:033:3 0 12 = 00000c00 13020100 a9000000
ffff81017941ff00 2494733672 S Bi:5:033:3 -115 4096 <
ffff81017941ff00 2494733981 C Bi:5:033:3 0 8 = 02000800 64003500
ffff81017941ff00 2494738930 S Bi:5:033:3 -115 4096 <
ffff81017941ff00 2494739983 C Bi:5:033:3 0 57 = 02003900 7948491b b3ad001a 6e65745f 72696d5f 62625f61 64647265 7373626f
ffff81017941ff00 2494741889 S Bi:5:033:3 -115 4096 <
ffff81017941f3c0 2494744839 S Bo:5:033:4 -115 8 = 02000800 6e000200
ffff81017941f3c0 2494744966 C Bo:5:033:4 0 8 >
ffff81017941ff00 2494745983 C Bi:5:033:3 0 12 = 00000c00 13020100 aa000000
ffff81017941ff00 2494749594 S Bo:5:033:4 -115 6 = 02000600 01c0
ffff81017941f3c0 2494749646 S Bi:5:033:3 -115 4096 <
ffff81017941ff00 2494749966 C Bo:5:033:4 0 6 >
ffff81017941f3c0 2494750980 C Bi:5:033:3 0 12 = 00000c00 13020100 ab000000
ffff81017941f3c0 2494754370 S Bi:5:033:3 -115 4096 <
ffff81017941f3c0 2494754984 C Bi:5:033:3 0 8 = 02000800 64003800
ffff81017941f3c0 2494756031 S Bi:5:033:3 -115 4096 <
ffff81017941f3c0 2494756984 C Bi:5:033:3 0 60 = 02003c00 5404491b b3a0001d 6e65745f 72696d5f 62625f61 64647265 7373626f
ffff81017941f3c0 2494761086 S Bo:5:033:4 -115 8 = 02000800 6e000200
ffff81017941ff00 2494761147 S Bi:5:033:3 -115 4096 <
ffff81017941f3c0 2494761967 C Bo:5:033:4 0 8 >
ffff81017941ff00 2494761988 C Bi:5:033:3 0 12 = 00000c00 13020100 ac000000
ffff81017941ff00 2494765889 S Bo:5:033:4 -115 6 = 02000600 01c3
ffff81017941f3c0 2494765944 S Bi:5:033:3 -115 4096 <
ffff81017941ff00 2494766968 C Bo:5:033:4 0 6 >
ffff81017941f3c0 2494766989 C Bi:5:033:3 0 12 = 00000c00 13020100 ad000000
ffff81017941f3c0 2494769712 S Bi:5:033:3 -115 4096 <
ffff81017941f3c0 2494769983 C Bi:5:033:3 0 8 = 02000800 64003e00
ffff81017941f3c0 2494772649 S Bi:5:033:3 -115 4096 <
ffff81017941f3c0 2494772985 C Bi:5:033:3 0 66 = 02004200 4854491b a6090023 6e65745f 72696d5f 62625f61 64647265 7373626f
ffff81017941f3c0 2494780026 S Bo:5:033:4 -115 8 = 02000800 6e000200
ffff81017941ff00 2494780090 S Bi:5:033:3 -115 4096 <
ffff81017941f3c0 2494780973 C Bo:5:033:4 0 8 >
ffff81017941ff00 2494780994 C Bi:5:033:3 0 12 = 00000c00 13020100 ae000000
ffff81017941ff00 2494785912 S Bo:5:033:4 -115 6 = 02000600 01c6
ffff81017941f3c0 2494785968 S Bi:5:033:3 -115 4096 <
ffff81017941ff00 2494786969 C Bo:5:033:4 0 6 >
ffff81017941f3c0 2494786989 C Bi:5:033:3 0 12 = 00000c00 13020100 af000000
ffff81017941f3c0 2494789454 S Bi:5:033:3 -115 4096 <
ffff81017941f3c0 2494789983 C Bi:5:033:3 0 8 = 02000800 64002f00
ffff81017941f3c0 2494793979 S Bi:5:033:3 -115 4096 <
ffff81017941f3c0 2494794987 C Bi:5:033:3 0 51 = 02003300 47e8491b a4480014 6e65745f 72696d5f 62625f61 6c61726d 5f617070
ffff81017941f3c0 2494797912 S Bi:5:033:3 -115 4096 <
ffff81017941ff00 2494800066 S Bo:5:033:4 -115 8 = 02000800 6e000200
ffff81017941f3c0 2494800991 C Bi:5:033:3 0 12 = 00000c00 13020100 b0000000
ffff81017941ff00 2494800998 C Bo:5:033:4 0 8 >
ffff81017941ff00 2494805821 S Bo:5:033:4 -115 6 = 02000600 01c9
ffff81017941f3c0 2494805866 S Bi:5:033:3 -115 4096 <
ffff81017941ff00 2494805969 C Bo:5:033:4 0 6 >
ffff81017941f3c0 2494806984 C Bi:5:033:3 0 12 = 00000c00 13020100 b1000000
ffff81017941f3c0 2494810624 S Bi:5:033:3 -115 4096 <
ffff81017941f3c0 2494824992 C Bi:5:033:3 0 8 = 02000800 64003400
ffff81017941f3c0 2494830608 S Bi:5:033:3 -115 4096 <
ffff81017941f3c0 2494830987 C Bi:5:033:3 0 56 = 02003800 759c491b b30b0019 6e65745f 72696d5f 62625f61 7070735f 6672616d
ffff81017941f3c0 2494837552 S Bo:5:033:4 -115 8 = 02000800 6e000200
ffff81017941ff00 2494837614 S Bi:5:033:3 -115 4096 <
ffff81017941f3c0 2494837973 C Bo:5:033:4 0 8 >
ffff81017941ff00 2494839012 C Bi:5:033:3 0 12 = 00000c00 13020100 b2000000
ffff81017941ff00 2494840587 S Bo:5:033:4 -115 6 = 02000600 01e4
ffff81017941f3c0 2494840628 S Bi:5:033:3 -115 4096 <
ffff81017941ff00 2494840971 C Bo:5:033:4 0 6 >
ffff81017941f3c0 2494841990 C Bi:5:033:3 0 12 = 00000c00 13020100 b3000000
ffff81017941f3c0 2494845885 S Bi:5:033:3 -115 4096 <
ffff81017941f3c0 2494846987 C Bi:5:033:3 0 8 = 02000800 64003000
ffff81017941f3c0 2494850509 S Bi:5:033:3 -115 4096 <
ffff81017941f3c0 2494850989 C Bi:5:033:3 0 52 = 02003400 1490491b b3c80015 6e65745f 72696d5f 62625f61 74746163 686d656e
ffff81017941f3c0 2494854548 S Bi:5:033:3 -115 4096 <
ffff8100b5228180 2494859105 S Bo:5:033:4 -115 8 = 02000800 6e000200
ffff81017941f3c0 2494859993 C Bi:5:033:3 0 12 = 00000c00 13020100 b4000000
ffff8100b5228180 2494860000 C Bo:5:033:4 0 8 >
ffff8100b5228180 2494861995 S Bo:5:033:4 -115 6 = 02000600 01e7
ffff8100b52283c0 2494862014 S Bi:5:033:3 -115 4096 <
ffff8100b5228180 2494862973 C Bo:5:033:4 0 6 >
ffff8100b52283c0 2494862994 C Bi:5:033:3 0 12 = 00000c00 13020100 b5000000
ffff8100b52283c0 2494865374 S Bi:5:033:3 -115 4096 <
ffff8100b52283c0 2494865989 C Bi:5:033:3 0 8 = 02000800 64003700
ffff8100b52283c0 2494868373 S Bi:5:033:3 -115 4096 <
ffff8100b52283c0 2494868988 C Bi:5:033:3 0 59 = 02003b00 2d94491b abdd001c 6e65745f 72696d5f 62625f62 726f7773 65725f66
ffff8100b52283c0 2494872966 S Bi:5:033:3 -115 4096 <
ffff8100b5228180 2494876081 S Bo:5:033:4 -115 8 = 02000800 6e000200
ffff8100b52283c0 2494876995 C Bi:5:033:3 0 12 = 00000c00 13020100 b6000000
ffff8100b5228180 2494877001 C Bo:5:033:4 0 8 >
ffff8100b5228180 2494879014 S Bi:5:033:3 -115 4096 <
ffff8100b52283c0 2494880532 S Bo:5:033:4 -115 6 = 02000600 01ea
ffff8100b52283c0 2494880974 C Bo:5:033:4 0 6 >
ffff8100b5228180 2494881990 C Bi:5:033:3 0 12 = 00000c00 13020100 b7000000
ffff8100b5228180 2494883042 S Bi:5:033:3 -115 4096 <
ffff8100b5228180 2494883990 C Bi:5:033:3 0 8 = 02000800 64003200
ffff8100b5228180 2494885977 S Bi:5:033:3 -115 4096 <
ffff8100b5228180 2494886989 C Bi:5:033:3 0 54 = 02003600 8714491b abf50017 6e65745f 72696d5f 62625f62 726f7773 65725f70
ffff8100b5228180 2494889655 S Bi:5:033:3 -115 4096 <
ffff8100b52283c0 2494892646 S Bo:5:033:4 -115 8 = 02000800 6e000200
ffff8100b52283c0 2494892979 C Bo:5:033:4 0 8 >
ffff8100b5228180 2494893991 C Bi:5:033:3 0 12 = 00000c00 13020100 b8000000
ffff8100b5228180 2494898060 S Bo:5:033:4 -115 6 = 02000600 01ed
ffff8100b52283c0 2494898079 S Bi:5:033:3 -115 4096 <
ffff8100b5228180 2494898978 C Bo:5:033:4 0 6 >
ffff8100b52283c0 2494899001 C Bi:5:033:3 0 12 = 00000c00 13020100 b9000000
ffff8100b52283c0 2494901347 S Bi:5:033:3 -115 4096 <
ffff8100b52283c0 2494903989 C Bi:5:033:3 0 8 = 02000800 64003200
ffff8100b52283c0 2494905380 S Bi:5:033:3 -115 4096 <
ffff8100b52283c0 2494905990 C Bi:5:033:3 0 54 = 02003600 cce0491b a6f70017 6e65745f 72696d5f 62625f63 616c656e 6461725f
ffff8100b52283c0 2494908386 S Bi:5:033:3 -115 4096 <
ffff8100b5228180 2494911310 S Bo:5:033:4 -115 8 = 02000800 6e000200
ffff8100b5228180 2494911979 C Bo:5:033:4 0 8 >
ffff8100b52283c0 2494912991 C Bi:5:033:3 0 12 = 00000c00 13020100 ba000000
ffff8100b52283c0 2494914861 S Bo:5:033:4 -115 6 = 02000600 01f3
ffff8100b5228180 2494914878 S Bi:5:033:3 -115 4096 <
ffff8100b52283c0 2494914975 C Bo:5:033:4 0 6 >
ffff8100b5228180 2494915989 C Bi:5:033:3 0 12 = 00000c00 13020100 bb000000
ffff8100b5228180 2494917968 S Bi:5:033:3 -115 4096 <
ffff8100b5228180 2494920994 C Bi:5:033:3 0 8 = 02000800 64003200
ffff8100b5228180 2494928062 S Bi:5:033:3 -115 4096 <
ffff8100b5228180 2494928992 C Bi:5:033:3 0 54 = 02003600 b130491b b4590017 6e65745f 72696d5f 62625f63 616c656e 6461725f
ffff8100b5228180 2494934562 S Bi:5:033:3 -115 4096 <
ffff8100b52283c0 2494936444 S Bo:5:033:4 -115 8 = 02000800 6e000200
ffff8100b52283c0 2494936983 C Bo:5:033:4 0 8 >
ffff8100b5228180 2494937996 C Bi:5:033:3 0 12 = 00000c00 13020100 bc000000
ffff8100b5228180 2494939911 S Bo:5:033:4 -115 6 = 02000600 01f9
ffff8100b52283c0 2494939935 S Bi:5:033:3 -115 4096 <
ffff8100b5228180 2494940978 C Bo:5:033:4 0 6 >
ffff8100b52283c0 2494941000 C Bi:5:033:3 0 12 = 00000c00 13020100 bd000000
ffff8100b52283c0 2494945985 S Bi:5:033:3 -115 4096 <
ffff8100b52283c0 2494946994 C Bi:5:033:3 0 8 = 02000800 64003200
ffff8100b52283c0 2494950612 S Bi:5:033:3 -115 4096 <
ffff8100b52283c0 2494950994 C Bi:5:033:3 0 54 = 02003600 90a4491b a6c30017 6e65745f 72696d5f 62625f63 616c656e 6461725f
ffff8100b52283c0 2494953797 S Bi:5:033:3 -115 4096 <
ffff8100b5228180 2494956565 S Bo:5:033:4 -115 8 = 02000800 6e000200
ffff8100b5228180 2494956982 C Bo:5:033:4 0 8 >
ffff8100b52283c0 2494957997 C Bi:5:033:3 0 12 = 00000c00 13020100 be000000
ffff8100b52283c0 2494959572 S Bo:5:033:4 -115 6 = 02000600 01fc
ffff8100b5228180 2494959590 S Bi:5:033:3 -115 4096 <
ffff8100b52283c0 2494959977 C Bo:5:033:4 0 6 >
ffff8100b5228180 2494960992 C Bi:5:033:3 0 12 = 00000c00 13020100 bf000000
ffff8100b5228180 2494962609 S Bi:5:033:3 -115 4096 <
ffff8100b5228180 2494971996 C Bi:5:033:3 0 8 = 02000800 64002b00
ffff81017941ff00 2494974290 S Bi:5:033:3 -115 4096 <
ffff81017941ff00 2494974995 C Bi:5:033:3 0 47 = 02002f00 3f14491b b3b50010 6e65745f 72696d5f 62625f65 6d61696c 0009342e
ffff81017941ff00 2494976350 S Bi:5:033:3 -115 4096 <
ffff81017941f480 2494981156 S Bo:5:033:4 -115 8 = 02000800 6e000200
ffff81017941ff00 2494981998 C Bi:5:033:3 0 12 = 00000c00 13020100 c0000000
ffff81017941f480 2494982003 C Bo:5:033:4 0 8 >
ffff81017941f480 2494985832 S Bo:5:033:4 -115 6 = 02000600 020b
ffff81017941ff00 2494985874 S Bi:5:033:3 -115 4096 <
ffff81017941f480 2494985979 C Bo:5:033:4 0 6 >
ffff81017941ff00 2494986994 C Bi:5:033:3 0 12 = 00000c00 13020100 c1000000
ffff81017941ff00 2494989603 S Bi:5:033:3 -115 4096 <
ffff81017941ff00 2494989995 C Bi:5:033:3 0 8 = 02000800 64003400
ffff81017941ff00 2494993242 S Bi:5:033:3 -115 4096 <
ffff81017941ff00 2494994008 C Bi:5:033:3 0 56 = 02003800 3240491b a5df0019 6e65745f 72696d5f 62625f70 726f6669 6c65735f
ffff81017941ff00 2495001918 S Bo:5:033:4 -115 8 = 02000800 6e000200
ffff81017941f480 2495001978 S Bi:5:033:3 -115 4096 <
ffff81017941ff00 2495002982 C Bo:5:033:4 0 8 >
ffff81017941f480 2495003003 C Bi:5:033:3 0 12 = 00000c00 13020100 c2000000
ffff81017941f480 2495005981 S Bo:5:033:4 -115 6 = 02000600 020e
ffff81017941ff00 2495006032 S Bi:5:033:3 -115 4096 <
ffff81017941f480 2495006982 C Bo:5:033:4 0 6 >
ffff81017941ff00 2495007003 C Bi:5:033:3 0 12 = 00000c00 13020100 c3000000
ffff81017941ff00 2495009602 S Bi:5:033:3 -115 4096 <
ffff81017941ff00 2495009996 C Bi:5:033:3 0 8 = 02000800 64003500
ffff81017941ff00 2495014447 S Bi:5:033:3 -115 4096 <
ffff81017941ff00 2495015009 C Bi:5:033:3 0 57 = 02003900 41f8491b b330001a 6e65745f 72696d5f 62625f72 656d696e 6465726d
ffff81017941ff00 2495017382 S Bi:5:033:3 -115 4096 <
ffff81017941f480 2495023306 S Bo:5:033:4 -115 8 = 02000800 6e000200
ffff81017941f480 2495023983 C Bo:5:033:4 0 8 >
ffff81017941ff00 2495025000 C Bi:5:033:3 0 12 = 00000c00 13020100 c4000000
ffff81017941ff00 2495026381 S Bo:5:033:4 -115 6 = 02000600 0211
ffff81017941f480 2495026422 S Bi:5:033:3 -115 4096 <
ffff81017941ff00 2495026981 C Bo:5:033:4 0 6 >
ffff81017941f480 2495027996 C Bi:5:033:3 0 12 = 00000c00 13020100 c5000000
ffff81017941f480 2495029246 S Bi:5:033:3 -115 4096 <
ffff81017941f480 2495034997 C Bi:5:033:3 0 8 = 02000800 64003000
ffff81017941f480 2495036920 S Bi:5:033:3 -115 4096 <
ffff81017941f480 2495038000 C Bi:5:033:3 0 52 = 02003400 4814491b a7a00015 6e65745f 72696d5f 62625f72 6962626f 6e5f6170
ffff81017941f480 2495042290 S Bi:5:033:3 -115 4096 <
ffff81017941ff00 2495044893 S Bo:5:033:4 -115 8 = 02000800 6e000200
ffff81017941f480 2495046000 C Bi:5:033:3 0 12 = 00000c00 13020100 c6000000
ffff81017941ff00 2495046005 C Bo:5:033:4 0 8 >
ffff81017941ff00 2495049588 S Bo:5:033:4 -115 6 = 02000600 021a
ffff81017941f480 2495049637 S Bi:5:033:3 -115 4096 <
ffff81017941ff00 2495049983 C Bo:5:033:4 0 6 >
ffff81017941f480 2495050998 C Bi:5:033:3 0 12 = 00000c00 13020100 c7000000
ffff81017941f480 2495054774 S Bi:5:033:3 -115 4096 <
ffff81017941f480 2495056001 C Bi:5:033:3 0 8 = 02000800 64003500
ffff81017941f480 2495057215 S Bi:5:033:3 -115 4096 <
ffff81017941f480 2495058009 C Bi:5:033:3 0 57 = 02003900 2240491b b527001a 6e65745f 72696d5f 62625f72 6962626f 6e5f736b
ffff81017941f480 2495059285 S Bi:5:033:3 -115 4096 <
ffff81017941ff00 2495066067 S Bo:5:033:4 -115 8 = 02000800 6e000200
ffff81017941f480 2495067002 C Bi:5:033:3 0 12 = 00000c00 13020100 c8000000
ffff81017941ff00 2495067008 C Bo:5:033:4 0 8 >
ffff81017941ff00 2495069174 S Bo:5:033:4 -115 6 = 02000600 0220
ffff81017941f480 2495069225 S Bi:5:033:3 -115 4096 <
ffff81017941ff00 2495069983 C Bo:5:033:4 0 6 >
ffff81017941f480 2495070003 C Bi:5:033:3 0 12 = 00000c00 13020100 c9000000
ffff81017941f480 2495071122 S Bi:5:033:3 -115 4096 <
ffff81017941f480 2495075001 C Bi:5:033:3 0 8 = 02000800 64003700
ffff81017941f480 2495078217 S Bi:5:033:3 -115 4096 <
ffff81017941f480 2495079002 C Bi:5:033:3 0 59 = 02003b00 7ea8491b b3cf001c 6e65745f 72696d5f 62625f6d 65737361 67657365
ffff81017941f480 2495080169 S Bi:5:033:3 -115 4096 <
ffff81017941ff00 2495086184 S Bo:5:033:4 -115 8 = 02000800 6e000200
ffff81017941f480 2495087003 C Bi:5:033:3 0 12 = 00000c00 13020100 ca000000
ffff81017941ff00 2495087008 C Bo:5:033:4 0 8 >
ffff81017941ff00 2495090099 S Bo:5:033:4 -115 6 = 02000600 0226
ffff81017941f480 2495090153 S Bi:5:033:3 -115 4096 <
ffff81017941ff00 2495090986 C Bo:5:033:4 0 6 >
ffff81017941f480 2495091007 C Bi:5:033:3 0 12 = 00000c00 13020100 cb000000
ffff81017941f480 2495093964 S Bi:5:033:3 -115 4096 <
ffff81017941f480 2495095001 C Bi:5:033:3 0 8 = 02000800 64003900
ffff81017941f480 2495096892 S Bi:5:033:3 -115 4096 <
ffff81017941f480 2495098013 C Bi:5:033:3 0 61 = 02003d00 313c491b b3a8001e 6e65745f 72696d5f 62625f61 70706c69 63617469
ffff81017941f480 2495102857 S Bi:5:033:3 -115 4096 <
ffff81017941ff00 2495106412 S Bo:5:033:4 -115 8 = 02000800 6e000200
ffff81017941ff00 2495106989 C Bo:5:033:4 0 8 >
ffff81017941f480 2495108002 C Bi:5:033:3 0 12 = 00000c00 13020100 cc000000
ffff81017941f480 2495117869 S Bo:5:033:4 -115 6 = 02000600 0229
ffff81017941ff00 2495117939 S Bi:5:033:3 -115 4096 <
ffff81017941f480 2495118989 C Bo:5:033:4 0 6 >
ffff81017941ff00 2495119012 C Bi:5:033:3 0 12 = 00000c00 13020100 cd000000
ffff81017941ff00 2495120494 S Bi:5:033:3 -115 4096 <
ffff81017941ff00 2495121002 C Bi:5:033:3 0 8 = 02000800 64002e00
ffff8100b52283c0 2495126427 S Bi:5:033:3 -115 4096 <
ffff8100b52283c0 2495127010 C Bi:5:033:3 0 50 = 02003200 1e50491b ad1e0013 6e65745f 72696d5f 62625f72 65736f75 72636500
ffff8100b52283c0 2495131425 S Bo:5:033:4 -115 8 = 02000800 6e000200
ffff8100b5228180 2495131447 S Bi:5:033:3 -115 4096 <
ffff8100b52283c0 2495131989 C Bo:5:033:4 0 8 >
ffff8100b5228180 2495133004 C Bi:5:033:3 0 12 = 00000c00 13020100 ce000000
ffff8100b5228180 2495134438 S Bo:5:033:4 -115 6 = 02000600 022c
ffff8100b52283c0 2495134454 S Bi:5:033:3 -115 4096 <
ffff8100b5228180 2495134988 C Bo:5:033:4 0 6 >
ffff8100b52283c0 2495136003 C Bi:5:033:3 0 12 = 00000c00 13020100 cf000000
ffff8100b52283c0 2495137430 S Bi:5:033:3 -115 4096 <
ffff8100b52283c0 2495141005 C Bi:5:033:3 0 8 = 02000800 64003200
ffff8100b52283c0 2495143375 S Bi:5:033:3 -115 4096 <
ffff8100b52283c0 2495144005 C Bi:5:033:3 0 54 = 02003600 4540491b ad2f0017 6e65745f 72696d5f 62625f72 65736f75 7263655f
ffff8100b52283c0 2495146458 S Bi:5:033:3 -115 4096 <
ffff8100b5228180 2495149312 S Bo:5:033:4 -115 8 = 02000800 6e000200
ffff8100b5228180 2495149992 C Bo:5:033:4 0 8 >
ffff8100b52283c0 2495151004 C Bi:5:033:3 0 12 = 00000c00 13020100 d0000000
ffff8100b52283c0 2495154311 S Bo:5:033:4 -115 6 = 02000600 0232
ffff8100b5228180 2495154330 S Bi:5:033:3 -115 4096 <
ffff8100b52283c0 2495154993 C Bo:5:033:4 0 6 >
ffff8100b5228180 2495156005 C Bi:5:033:3 0 12 = 00000c00 13020100 d1000000
ffff8100b5228180 2495157445 S Bi:5:033:3 -115 4096 <
ffff8100b5228180 2495158004 C Bi:5:033:3 0 8 = 02000800 64002c00
ffff8100b5228180 2495159470 S Bi:5:033:3 -115 4096 <
ffff8100b5228180 2495160005 C Bi:5:033:3 0 48 = 02003000 2b18491b b80e0011 6e65745f 72696d5f 62625f6d 635f6170 70000934
ffff8100b5228180 2495164667 S Bi:5:033:3 -115 4096 <
ffff8100b52283c0 2495167339 S Bo:5:033:4 -115 8 = 02000800 6e000200
ffff8100b52283c0 2495167994 C Bo:5:033:4 0 8 >
ffff8100b5228180 2495169031 C Bi:5:033:3 0 12 = 00000c00 13020100 d2000000
ffff8100b5228180 2495170367 S Bo:5:033:4 -115 6 = 02000600 0235
ffff8100b52283c0 2495170385 S Bi:5:033:3 -115 4096 <
ffff8100b5228180 2495170989 C Bo:5:033:4 0 6 >
ffff8100b52283c0 2495172003 C Bi:5:033:3 0 12 = 00000c00 13020100 d3000000
ffff8100b52283c0 2495174294 S Bi:5:033:3 -115 4096 <
ffff8100b52283c0 2495175005 C Bi:5:033:3 0 8 = 02000800 64003500
ffff8100b52283c0 2495178332 S Bi:5:033:3 -115 4096 <
ffff8100b52283c0 2495179007 C Bi:5:033:3 0 57 = 02003900 0ffc491b b843001a 6e65745f 72696d5f 62625f70 61737377 6f72645f
ffff8100b52283c0 2495180496 S Bi:5:033:3 -115 4096 <
ffff8100b5228180 2495183359 S Bo:5:033:4 -115 8 = 02000800 6e000200
ffff8100b5228180 2495183993 C Bo:5:033:4 0 8 >
ffff8100b52283c0 2495185007 C Bi:5:033:3 0 12 = 00000c00 13020100 d4000000
ffff8100b52283c0 2495186248 S Bo:5:033:4 -115 6 = 02000600 0238
ffff8100b5228180 2495186267 S Bi:5:033:3 -115 4096 <
ffff8100b52283c0 2495186994 C Bo:5:033:4 0 6 >
ffff8100b5228180 2495188006 C Bi:5:033:3 0 12 = 00000c00 13020100 d5000000
ffff8100b5228180 2495189286 S Bi:5:033:3 -115 4096 <
ffff8100b5228180 2495190007 C Bi:5:033:3 0 8 = 02000800 64003600
ffff8100b5228180 2495195674 S Bi:5:033:3 -115 4096 <
ffff8100b5228180 2495196012 C Bi:5:033:3 0 58 = 02003a00 3ef0491b a665001b 6e65745f 72696d5f 62625f67 6c6f6261 6c736561
ffff8100b5228180 2495197515 S Bi:5:033:3 -115 4096 <
ffff8101796a2cc0 2495200496 S Bo:5:033:4 -115 8 = 02000800 6e000200
ffff8101796a2cc0 2495200995 C Bo:5:033:4 0 8 >
ffff8100b5228180 2495202006 C Bi:5:033:3 0 12 = 00000c00 13020100 d6000000
ffff8101796a2cc0 2495206301 S Bo:5:033:4 -115 6 = 02000600 023b
ffff8101796a2e40 2495206318 S Bi:5:033:3 -115 4096 <
ffff8101796a2cc0 2495206996 C Bo:5:033:4 0 6 >
ffff8101796a2e40 2495208010 C Bi:5:033:3 0 12 = 00000c00 13020100 d7000000
ffff8101796a2e40 2495209198 S Bi:5:033:3 -115 4096 <
ffff8101796a2e40 2495210009 C Bi:5:033:3 0 8 = 02000800 64003000
ffff8101796a2e40 2495214102 S Bi:5:033:3 -115 4096 <
ffff8101796a2e40 2495215011 C Bi:5:033:3 0 52 = 02003400 b47c491b abe90015 6e65745f 72696d5f 73657269 616c666f 726d6174
ffff8101796a2e40 2495217508 S Bi:5:033:3 -115 4096 <
ffff8101796a2cc0 2495220126 S Bo:5:033:4 -115 8 = 02000800 6e000200
ffff8101796a2e40 2495221015 C Bi:5:033:3 0 12 = 00000c00 13020100 d8000000
ffff8101796a2cc0 2495221022 C Bo:5:033:4 0 8 >
ffff8101796a2cc0 2495225848 S Bo:5:033:4 -115 6 = 02000600 023e
ffff8101796a2e40 2495225868 S Bi:5:033:3 -115 4096 <
ffff8101796a2cc0 2495225996 C Bo:5:033:4 0 6 >
ffff8101796a2e40 2495227008 C Bi:5:033:3 0 12 = 00000c00 13020100 d9000000
ffff8101796a2e40 2495229611 S Bi:5:033:3 -115 4096 <
ffff8101796a2e40 2495230013 C Bi:5:033:3 0 8 = 02000800 64003700
ffff8101796a2e40 2495234007 S Bi:5:033:3 -115 4096 <
ffff8101796a2e40 2495235010 C Bi:5:033:3 0 59 = 02003b00 2ed4491b ac40001c 6e65745f 72696d5f 62625f61 64647265 7373626f
ffff8101796a2e40 2495239968 S Bo:5:033:4 -115 8 = 02000800 6e000200
ffff8101796a2cc0 2495239990 S Bi:5:033:3 -115 4096 <
ffff8101796a2e40 2495240997 C Bo:5:033:4 0 8 >
ffff8101796a2cc0 2495241019 C Bi:5:033:3 0 12 = 00000c00 13020100 da000000
ffff8101796a2cc0 2495245988 S Bo:5:033:4 -115 6 = 02000600 0241
ffff8101796a2e40 2495246007 S Bi:5:033:3 -115 4096 <
ffff8101796a2cc0 2495246997 C Bo:5:033:4 0 6 >
ffff8101796a2e40 2495247019 C Bi:5:033:3 0 12 = 00000c00 13020100 db000000
ffff8101796a2e40 2495249605 S Bi:5:033:3 -115 4096 <
ffff8101796a2e40 2495250010 C Bi:5:033:3 0 8 = 02000800 64003000
ffff8101796a2e40 2495254096 S Bi:5:033:3 -115 4096 <
ffff8101796a2e40 2495255013 C Bi:5:033:3 0 52 = 02003400 6d3c491b b3e70015 6e65745f 72696d5f 62625f69 6d706c75 735f6170
ffff8101796a2e40 2495257100 S Bi:5:033:3 -115 4096 <
ffff8101796a2cc0 2495260176 S Bo:5:033:4 -115 8 = 02000800 6e000200
ffff8101796a2e40 2495261018 C Bi:5:033:3 0 12 = 00000c00 13020100 dc000000
ffff8101796a2cc0 2495261024 C Bo:5:033:4 0 8 >
ffff8101796a2cc0 2495262202 S Bo:5:033:4 -115 6 = 02000600 0244
ffff8101796a2e40 2495262220 S Bi:5:033:3 -115 4096 <
ffff8101796a2cc0 2495262994 C Bo:5:033:4 0 6 >
ffff8101796a2e40 2495263015 C Bi:5:033:3 0 12 = 00000c00 13020100 dd000000
ffff8101796a2e40 2495266146 S Bi:5:033:3 -115 4096 <
ffff8101796a2e40 2495267015 C Bi:5:033:3 0 8 = 02000800 64003500
ffff8101796a2e40 2495269072 S Bi:5:033:3 -115 4096 <
ffff8101796a2e40 2495270011 C Bi:5:033:3 0 57 = 02003900 8edc491b b4de001a 6e65745f 72696d5f 62625f73 65747570 77697a61
ffff8101796a2e40 2495271093 S Bi:5:033:3 -115 4096 <
ffff8101796a2cc0 2495274102 S Bo:5:033:4 -115 8 = 02000800 6e000200
ffff8101796a2e40 2495275016 C Bi:5:033:3 0 12 = 00000c00 13020100 de000000
ffff8101796a2cc0 2495275021 C Bo:5:033:4 0 8 >
ffff8101796a2cc0 2495278297 S Bo:5:033:4 -115 6 = 02000600 0247
ffff8101796a2e40 2495278315 S Bi:5:033:3 -115 4096 <
ffff8101796a2cc0 2495278997 C Bo:5:033:4 0 6 >
ffff8101796a2e40 2495280012 C Bi:5:033:3 0 12 = 00000c00 13020100 df000000
ffff8101796a2e40 2495282303 S Bi:5:033:3 -115 4096 <
ffff8101796a2e40 2495283012 C Bi:5:033:3 0 8 = 02000800 64003500
ffff8101796a2e40 2495287312 S Bi:5:033:3 -115 4096 <
ffff8101796a2e40 2495288017 C Bi:5:033:3 0 57 = 02003900 1a2c491b b332001a 6e65745f 72696d5f 62625f73 65637572 6974796d
ffff8101796a2e40 2495292413 S Bo:5:033:4 -115 8 = 02000800 6e000200
ffff8101796a2cc0 2495292435 S Bi:5:033:3 -115 4096 <
ffff8101796a2e40 2495293000 C Bo:5:033:4 0 8 >
ffff8101796a2cc0 2495294014 C Bi:5:033:3 0 12 = 00000c00 13020100 e0000000
ffff8101796a2cc0 2495298296 S Bo:5:033:4 -115 6 = 02000600 024a
ffff8101796a2e40 2495298313 S Bi:5:033:3 -115 4096 <
ffff8101796a2cc0 2495298997 C Bo:5:033:4 0 6 >
ffff8101796a2e40 2495300012 C Bi:5:033:3 0 12 = 00000c00 13020100 e1000000
ffff8101796a2e40 2495301334 S Bi:5:033:3 -115 4096 <
ffff8101796a2e40 2495302012 C Bi:5:033:3 0 8 = 02000800 64003600
ffff8101796a2e40 2495307321 S Bi:5:033:3 -115 4096 <
ffff8101796a2e40 2495308019 C Bi:5:033:3 0 58 = 02003a00 1560491b b31d001b 6e65745f 72696d5f 62625f65 6e746572 70726973
ffff8101796a2e40 2495310525 S Bi:5:033:3 -115 4096 <
ffff8101796a2cc0 2495314362 S Bo:5:033:4 -115 8 = 02000800 6e000200
ffff8101796a2cc0 2495315002 C Bo:5:033:4 0 8 >
ffff8101796a2e40 2495316014 C Bi:5:033:3 0 12 = 00000c00 13020100 e2000000
ffff8101796a2e40 2495318316 S Bo:5:033:4 -115 6 = 02000600 024d
ffff8101796a2cc0 2495318333 S Bi:5:033:3 -115 4096 <
ffff8101796a2e40 2495318997 C Bo:5:033:4 0 6 >
ffff8101796a2cc0 2495320011 C Bi:5:033:3 0 12 = 00000c00 13020100 e3000000
ffff8101796a2cc0 2495321374 S Bi:5:033:3 -115 4096 <
ffff8101796a2cc0 2495322013 C Bi:5:033:3 0 8 = 02000800 64002100
ffff8101796a2cc0 2495327308 S Bi:5:033:3 -115 4096 <
ffff8101796a2cc0 2495328019 C Bi:5:033:3 0 37 = 02002500 6fc4456c 5107000a 53656375 7249444c 69620005 322e312e 3000016f
ffff8101796a2cc0 2495330246 S Bi:5:033:3 -115 4096 <
ffff8101796a2e40 2495334248 S Bo:5:033:4 -115 8 = 02000800 6e000200
ffff8101796a2e40 2495335000 C Bo:5:033:4 0 8 >
ffff8101796a2cc0 2495336015 C Bi:5:033:3 0 12 = 00000c00 13020100 e4000000
ffff8101796a2cc0 2495337424 S Bi:5:033:3 -115 4096 <
ffff8101796a2e40 2495338295 S Bo:5:033:4 -115 6 = 02000600 0250
ffff8101796a2e40 2495338998 C Bo:5:033:4 0 6 >
ffff8101796a2cc0 2495340015 C Bi:5:033:3 0 12 = 00000c00 13020100 e5000000
ffff8101796a2cc0 2495341196 S Bi:5:033:3 -115 4096 <
ffff8101796a2cc0 2495342016 C Bi:5:033:3 0 8 = 02000800 64002e00
ffff8101796a2cc0 2495346335 S Bi:5:033:3 -115 4096 <
ffff8101796a2cc0 2495347023 C Bi:5:033:3 0 50 = 02003200 0fcc4577 3aac0015 6e65745f 72696d5f 72696d73 65637572 69646c69
ffff8101796a2cc0 2495348341 S Bi:5:033:3 -115 4096 <
ffff8101796a2e40 2495351355 S Bo:5:033:4 -115 8 = 02000800 6e000200
ffff8101796a2e40 2495352004 C Bo:5:033:4 0 8 >
ffff8101796a2cc0 2495353017 C Bi:5:033:3 0 12 = 00000c00 13020100 e6000000
ffff8101796a2cc0 2495354246 S Bo:5:033:4 -115 6 = 02000600 0253
ffff8101796a2e40 2495354263 S Bi:5:033:3 -115 4096 <
ffff8101796a2cc0 2495355001 C Bo:5:033:4 0 6 >
ffff8101796a2e40 2495356019 C Bi:5:033:3 0 12 = 00000c00 13020100 e7000000
ffff8101796a2e40 2495358297 S Bi:5:033:3 -115 4096 <
ffff8101796a2e40 2495359017 C Bi:5:033:3 0 8 = 02000800 64003600
ffff8101796a2e40 2495362419 S Bi:5:033:3 -115 4096 <
ffff8101796a2e40 2495363017 C Bi:5:033:3 0 58 = 02003a00 35f8491b aa52001b 6e65745f 72696d5f 636c6463 5f696d70 6c5f736f
ffff8101796a2e40 2495365506 S Bi:5:033:3 -115 4096 <
ffff8101796a2cc0 2495368280 S Bo:5:033:4 -115 8 = 02000800 6e000200
ffff8101796a2cc0 2495369005 C Bo:5:033:4 0 8 >
ffff8101796a2e40 2495370018 C Bi:5:033:3 0 12 = 00000c00 13020100 e8000000
ffff8101796a2e40 2495371308 S Bo:5:033:4 -115 6 = 02000600 0256
ffff8101796a2cc0 2495371326 S Bi:5:033:3 -115 4096 <
ffff8101796a2e40 2495372000 C Bo:5:033:4 0 6 >
ffff8101796a2cc0 2495373016 C Bi:5:033:3 0 12 = 00000c00 13020100 e9000000
ffff8101796a2cc0 2495374345 S Bi:5:033:3 -115 4096 <
ffff8101796a2cc0 2495375016 C Bi:5:033:3 0 8 = 02000800 64003500
ffff8101796a2cc0 2495377362 S Bi:5:033:3 -115 4096 <
ffff8101796a2cc0 2495378019 C Bi:5:033:3 0 57 = 02003900 1a8c491b b32b001a 6e65745f 72696d5f 736f6674 746f6b65 6e735f6f
ffff8101796a2cc0 2495382344 S Bo:5:033:4 -115 8 = 02000800 6e000200
ffff8101796a2e40 2495382365 S Bi:5:033:3 -115 4096 <
ffff8101796a2cc0 2495383006 C Bo:5:033:4 0 8 >
ffff8101796a2e40 2495384016 C Bi:5:033:3 0 12 = 00000c00 13020100 ea000000
ffff8101796a2e40 2495386125 S Bo:5:033:4 -115 6 = 02000600 0259
ffff8101796a2cc0 2495386146 S Bi:5:033:3 -115 4096 <
ffff8101796a2e40 2495387003 C Bo:5:033:4 0 6 >
ffff8101796a2cc0 2495387024 C Bi:5:033:3 0 12 = 00000c00 13020100 eb000000
ffff8101796a2cc0 2495389256 S Bi:5:033:3 -115 4096 <
ffff8101796a2cc0 2495390017 C Bi:5:033:3 0 8 = 02000800 64003300
ffff8101796a2cc0 2495394166 S Bi:5:033:3 -115 4096 <
ffff8101796a2cc0 2495395017 C Bi:5:033:3 0 55 = 02003700 bce4491b b4330018 6e65745f 72696d5f 62625f66 7265655f 62757379
ffff8101796a2cc0 2495397163 S Bi:5:033:3 -115 4096 <
ffff8101796a2e40 2495400184 S Bo:5:033:4 -115 8 = 02000800 6e000200
ffff8101796a2cc0 2495401025 C Bi:5:033:3 0 12 = 00000c00 13020100 ec000000
ffff8101796a2e40 2495401031 C Bo:5:033:4 0 8 >
ffff8101796a2e40 2495406180 S Bo:5:033:4 -115 6 = 02000600 025c
ffff8101796a2cc0 2495406201 S Bi:5:033:3 -115 4096 <
ffff8101796a2e40 2495407007 C Bo:5:033:4 0 6 >
ffff8101796a2cc0 2495407030 C Bi:5:033:3 0 12 = 00000c00 13020100 ed000000
ffff8101796a2cc0 2495410235 S Bi:5:033:3 -115 4096 <
ffff8101796a2cc0 2495411023 C Bi:5:033:3 0 8 = 02000800 64003000
ffff8101796a2cc0 2495414998 S Bi:5:033:3 -115 4096 <
ffff8101796a2cc0 2495416024 C Bi:5:033:3 0 52 = 02003400 6c00491b ab640015 6e65745f 72696d5f 4d494450 526f6f74 43657274
ffff8101796a2cc0 2495421001 S Bo:5:033:4 -115 8 = 02000800 6e000200
ffff8101796a2e40 2495421021 S Bi:5:033:3 -115 4096 <
ffff8101796a2cc0 2495422008 C Bo:5:033:4 0 8 >
ffff8101796a2e40 2495422030 C Bi:5:033:3 0 12 = 00000c00 13020100 ee000000
ffff8101796a2e40 2495426296 S Bo:5:033:4 -115 6 = 02000600 025f
ffff8101796a2cc0 2495426314 S Bi:5:033:3 -115 4096 <
ffff8101796a2e40 2495427008 C Bo:5:033:4 0 6 >
ffff8101796a2cc0 2495428021 C Bi:5:033:3 0 12 = 00000c00 13020100 ef000000
ffff8101796a2cc0 2495429333 S Bi:5:033:3 -115 4096 <
ffff8101796a2cc0 2495430020 C Bi:5:033:3 0 8 = 02000800 64002f00
ffff8101796a2cc0 2495434357 S Bi:5:033:3 -115 4096 <
ffff8101796a2cc0 2495435019 C Bi:5:033:3 0 51 = 02003300 3a78491b a5fd0014 6e65745f 72696d5f 62625f6f 7461736c 5f617070
ffff8101796a2cc0 2495440447 S Bo:5:033:4 -115 8 = 02000800 6e000200
ffff8101796a2e40 2495440469 S Bi:5:033:3 -115 4096 <
ffff8101796a2cc0 2495441009 C Bo:5:033:4 0 8 >
ffff8101796a2e40 2495442021 C Bi:5:033:3 0 12 = 00000c00 13020100 f0000000
ffff8101796a2e40 2495446302 S Bo:5:033:4 -115 6 = 02000600 0262
ffff8101796a2cc0 2495446320 S Bi:5:033:3 -115 4096 <
ffff8101796a2e40 2495447009 C Bo:5:033:4 0 6 >
ffff8101796a2cc0 2495448020 C Bi:5:033:3 0 12 = 00000c00 13020100 f1000000
ffff8101796a2cc0 2495449333 S Bi:5:033:3 -115 4096 <
ffff8101796a2cc0 2495450021 C Bi:5:033:3 0 8 = 02000800 64003300
ffff8101796a2cc0 2495452235 S Bi:5:033:3 -115 4096 <
ffff8101796a2cc0 2495453023 C Bi:5:033:3 0 55 = 02003700 3c30491b a5da0018 6e65745f 72696d5f 62625f6f 7461736c 5f636861
ffff8101796a2cc0 2495457346 S Bi:5:033:3 -115 4096 <
ffff8101796a2e40 2495461196 S Bo:5:033:4 -115 8 = 02000800 6e000200
ffff8101796a2cc0 2495462028 C Bi:5:033:3 0 12 = 00000c00 13020100 f2000000
ffff8101796a2e40 2495462034 C Bo:5:033:4 0 8 >
ffff8101796a2e40 2495465848 S Bo:5:033:4 -115 6 = 02000600 0265
ffff8101796a2cc0 2495465867 S Bi:5:033:3 -115 4096 <
ffff8101796a2e40 2495466009 C Bo:5:033:4 0 6 >
ffff8101796a2cc0 2495467021 C Bi:5:033:3 0 12 = 00000c00 13020100 f3000000
ffff8101796a2cc0 2495468639 S Bi:5:033:3 -115 4096 <
ffff8101796a2cc0 2495469022 C Bi:5:033:3 0 8 = 02000800 64004600
ffff8101796a2cc0 2495471627 S Bi:5:033:3 -115 4096 <
ffff8101796a2cc0 2495472022 C Bi:5:033:3 0 74 = 02004a00 0980491b aa1c002b 6e65745f 72696d5f 7469645f 64796e61 6d69635f
ffff8101796a2cc0 2495473552 S Bi:5:033:3 -115 4096 <
ffff8101796a2e40 2495476547 S Bo:5:033:4 -115 8 = 02000800 6e000200
ffff8101796a2e40 2495477011 C Bo:5:033:4 0 8 >
ffff8101796a2cc0 2495478023 C Bi:5:033:3 0 12 = 00000c00 13020100 f4000000
ffff8101796a2cc0 2495479725 S Bo:5:033:4 -115 6 = 02000600 0268
ffff8101796a2e40 2495479746 S Bi:5:033:3 -115 4096 <
ffff8101796a2cc0 2495480006 C Bo:5:033:4 0 6 >
ffff8101796a2e40 2495481022 C Bi:5:033:3 0 12 = 00000c00 13020100 f5000000
ffff8101796a2e40 2495482605 S Bi:5:033:3 -115 4096 <
ffff8101796a2e40 2495483024 C Bi:5:033:3 0 8 = 02000800 64003600
ffff8101796a2e40 2495486382 S Bi:5:033:3 -115 4096 <
ffff8101796a2e40 2495487028 C Bi:5:033:3 0 58 = 02003a00 ee20491b a34a001b 6e65745f 72696d5f 706c617a 6d69635f 7468656d
ffff8101796a2e40 2495491365 S Bo:5:033:4 -115 8 = 02000800 6e000200
ffff8101796a2cc0 2495491388 S Bi:5:033:3 -115 4096 <
ffff8101796a2e40 2495492011 C Bo:5:033:4 0 8 >
ffff8101796a2cc0 2495493024 C Bi:5:033:3 0 12 = 00000c00 13020100 f6000000
ffff8101796a2cc0 2495494425 S Bo:5:033:4 -115 6 = 02000600 026b
ffff8101796a2e40 2495494441 S Bi:5:033:3 -115 4096 <
ffff8101796a2cc0 2495495007 C Bo:5:033:4 0 6 >
ffff8101796a2e40 2495496024 C Bi:5:033:3 0 12 = 00000c00 13020100 f7000000
ffff8101796a2e40 2495497382 S Bi:5:033:3 -115 4096 <
ffff8101796a2e40 2495498025 C Bi:5:033:3 0 8 = 02000800 64003000
ffff8101796a2e40 2495499372 S Bi:5:033:3 -115 4096 <
ffff8101796a2e40 2495500023 C Bi:5:033:3 0 52 = 02003400 a2e0491b b4400015 6e65745f 72696d5f 62625f64 6961676e 6f737469
ffff8101796a2e40 2495504496 S Bo:5:033:4 -115 8 = 02000800 6e000200
ffff8101796a2cc0 2495504520 S Bi:5:033:3 -115 4096 <
ffff8101796a2e40 2495505013 C Bo:5:033:4 0 8 >
ffff8101796a2cc0 2495506028 C Bi:5:033:3 0 12 = 00000c00 13020100 f8000000
ffff8101796a2cc0 2495509490 S Bo:5:033:4 -115 6 = 02000600 026e
ffff8101796a2e40 2495509509 S Bi:5:033:3 -115 4096 <
ffff8101796a2cc0 2495510010 C Bo:5:033:4 0 6 >
ffff8101796a2e40 2495511025 C Bi:5:033:3 0 12 = 00000c00 13020100 f9000000
ffff8101796a2e40 2495514959 S Bi:5:033:3 -115 4096 <
ffff8101796a2e40 2495516029 C Bi:5:033:3 0 8 = 02000800 64003d00
ffff8101796a2e40 2495519004 S Bi:5:033:3 -115 4096 <
ffff8101796a2e40 2495520026 C Bi:5:033:3 0 65 = 02004100 0ce8491b ac060022 6e65745f 72696d5f 62625f64 6961676e 6f737469
ffff8101796a2e40 2495521989 S Bi:5:033:3 -115 4096 <
ffff8101796a2cc0 2495524942 S Bo:5:033:4 -115 8 = 02000800 6e000200
ffff8101796a2e40 2495526032 C Bi:5:033:3 0 12 = 00000c00 13020100 fa000000
ffff8101796a2cc0 2495526038 C Bo:5:033:4 0 8 >
ffff8101796a2cc0 2495529661 S Bo:5:033:4 -115 6 = 02000600 0271
ffff8101796a2e40 2495529680 S Bi:5:033:3 -115 4096 <
ffff8101796a2cc0 2495530009 C Bo:5:033:4 0 6 >
ffff8101796a2e40 2495531025 C Bi:5:033:3 0 12 = 00000c00 13020100 fb000000
ffff8101796a2e40 2495533405 S Bi:5:033:3 -115 4096 <
ffff8101796a2e40 2495539029 C Bi:5:033:3 0 8 = 02000800 64003300
ffff8101796a2e40 2495542403 S Bi:5:033:3 -115 4096 <
ffff8101796a2e40 2495543026 C Bi:5:033:3 0 55 = 02003700 197c491b b4210018 6e65745f 72696d5f 62625f66 696c655f 6578706c
ffff8101796a2e40 2495547220 S Bo:5:033:4 -115 8 = 02000800 6e000200
ffff8101796a2cc0 2495547242 S Bi:5:033:3 -115 4096 <
ffff8101796a2e40 2495548014 C Bo:5:033:4 0 8 >
ffff8101796a2cc0 2495548036 C Bi:5:033:3 0 12 = 00000c00 13020100 fc000000
ffff8101796a2cc0 2495549268 S Bo:5:033:4 -115 6 = 02000600 027a
ffff8101796a2e40 2495549287 S Bi:5:033:3 -115 4096 <
ffff8101796a2cc0 2495550012 C Bo:5:033:4 0 6 >
ffff8101796a2e40 2495551025 C Bi:5:033:3 0 12 = 00000c00 13020100 fd000000
ffff8101796a2e40 2495552910 S Bi:5:033:3 -115 4096 <
ffff8101796a2e40 2495554027 C Bi:5:033:3 0 8 = 02000800 64003600
ffff8101796a2e40 2495557299 S Bi:5:033:3 -115 4096 <
ffff8101796a2e40 2495558033 C Bi:5:033:3 0 58 = 02003a00 3f3c491b a682001b 6e65745f 72696d5f 62625f66 696c6569 6e646578
ffff8101796a2e40 2495559942 S Bi:5:033:3 -115 4096 <
ffff8101796a2cc0 2495562920 S Bo:5:033:4 -115 8 = 02000800 6e000200
ffff8101796a2e40 2495564034 C Bi:5:033:3 0 12 = 00000c00 13020100 fe000000
ffff8101796a2cc0 2495564040 C Bo:5:033:4 0 8 >
ffff8101796a2cc0 2495565949 S Bo:5:033:4 -115 6 = 02000600 027d
ffff8101796a2e40 2495565967 S Bi:5:033:3 -115 4096 <
ffff8101796a2cc0 2495567012 C Bo:5:033:4 0 6 >
ffff8101796a2e40 2495567034 C Bi:5:033:3 0 12 = 00000c00 13020100 ff000000
ffff8101796a2e40 2495569460 S Bi:5:033:3 -115 4096 <
ffff8101796a2e40 2495570030 C Bi:5:033:3 0 8 = 02000800 64003900
ffff8101796a2e40 2495574051 S Bi:5:033:3 -115 4096 <
ffff8101796a2e40 2495575028 C Bi:5:033:3 0 61 = 02003d00 2180491b a65d001e 6e65745f 72696d5f 62625f6d 65646961 636f6e74
ffff8101796a2e40 2495578089 S Bi:5:033:3 -115 4096 <
ffff8101796a2cc0 2495580178 S Bo:5:033:4 -115 8 = 02000800 6e000200
ffff8101796a2e40 2495581035 C Bi:5:033:3 0 12 = 00000c00 13020100 00010000
ffff8101796a2cc0 2495581041 C Bo:5:033:4 0 8 >
ffff8101796a2cc0 2495586132 S Bo:5:033:4 -115 6 = 02000600 0280
ffff8101796a2e40 2495586153 S Bi:5:033:3 -115 4096 <
ffff8101796a2cc0 2495587016 C Bo:5:033:4 0 6 >
ffff8101796a2e40 2495587038 C Bi:5:033:3 0 12 = 00000c00 13020100 01010000
ffff8101796a2e40 2495589165 S Bi:5:033:3 -115 4096 <
ffff8101796a2e40 2495590029 C Bi:5:033:3 0 8 = 02000800 64003200
ffff8101796a2e40 2495594219 S Bi:5:033:3 -115 4096 <
ffff8101796a2e40 2495595030 C Bi:5:033:3 0 54 = 02003600 0b54491b b4000017 6e65745f 72696d5f 62625f6d 65646961 6c696272
ffff8101796a2e40 2495597236 S Bi:5:033:3 -115 4096 <
ffff8101796a2cc0 2495600349 S Bo:5:033:4 -115 8 = 02000800 6e000200
ffff8101796a2cc0 2495601018 C Bo:5:033:4 0 8 >
ffff8101796a2e40 2495602030 C Bi:5:033:3 0 12 = 00000c00 13020100 02010000
ffff8101796a2e40 2495606545 S Bo:5:033:4 -115 6 = 02000600 0283
ffff8101796a2cc0 2495606562 S Bi:5:033:3 -115 4096 <
ffff8101796a2e40 2495607019 C Bo:5:033:4 0 6 >
ffff8101796a2cc0 2495608031 C Bi:5:033:3 0 12 = 00000c00 13020100 03010000
ffff8101796a2cc0 2495609346 S Bi:5:033:3 -115 4096 <
ffff8101796a2cc0 2495610031 C Bi:5:033:3 0 8 = 02000800 64003800
ffff8101796a2cc0 2495615217 S Bi:5:033:3 -115 4096 <
ffff8101796a2cc0 2495616032 C Bi:5:033:3 0 60 = 02003c00 2180491b a5ca001d 6e65745f 72696d5f 62625f6d 65646961 6c696272
ffff8101796a2cc0 2495617076 S Bi:5:033:3 -115 4096 <
ffff8101796a2e40 2495620089 S Bo:5:033:4 -115 8 = 02000800 6e000200
ffff8101796a2cc0 2495621035 C Bi:5:033:3 0 12 = 00000c00 13020100 04010000
ffff8101796a2e40 2495621041 C Bo:5:033:4 0 8 >
ffff8101796a2e40 2495622106 S Bo:5:033:4 -115 6 = 02000600 0286
ffff8101796a2cc0 2495622122 S Bi:5:033:3 -115 4096 <
ffff8101796a2e40 2495623014 C Bo:5:033:4 0 6 >
ffff8101796a2cc0 2495623034 C Bi:5:033:3 0 12 = 00000c00 13020100 05010000
ffff8101796a2cc0 2495626385 S Bi:5:033:3 -115 4096 <
ffff8101796a2cc0 2495629036 C Bi:5:033:3 0 8 = 02000800 64003300
ffff8101796a2cc0 2495634325 S Bi:5:033:3 -115 4096 <
ffff8101796a2cc0 2495635032 C Bi:5:033:3 0 55 = 02003700 b11c491b ad640018 6e65745f 72696d5f 62625f6d 65646961 7265636f
ffff8101796a2cc0 2495636393 S Bi:5:033:3 -115 4096 <
ffff8101796a2e40 2495639361 S Bo:5:033:4 -115 8 = 02000800 6e000200
ffff8101796a2e40 2495640019 C Bo:5:033:4 0 8 >
ffff8101796a2cc0 2495641036 C Bi:5:033:3 0 12 = 00000c00 13020100 06010000
ffff8101796a2cc0 2495642252 S Bo:5:033:4 -115 6 = 02000600 028c
ffff8101796a2e40 2495642270 S Bi:5:033:3 -115 4096 <
ffff8101796a2cc0 2495643015 C Bo:5:033:4 0 6 >
ffff8101796a2e40 2495643035 C Bi:5:033:3 0 12 = 00000c00 13020100 07010000
ffff8101796a2e40 2495646084 S Bi:5:033:3 -115 4096 <
ffff8101796a2e40 2495647035 C Bi:5:033:3 0 8 = 02000800 64003c00
ffff8101796a2e40 2495649144 S Bi:5:033:3 -115 4096 <
ffff8101796a2e40 2495650034 C Bi:5:033:3 0 64 = 02004000 3a04491b a4ba0021 6e65745f 72696d5f 62625f73 74616e64 61726463
ffff8101796a2e40 2495654044 S Bo:5:033:4 -115 8 = 02000800 6e000200
ffff8101796a2cc0 2495654065 S Bi:5:033:3 -115 4096 <
ffff8101796a2e40 2495655021 C Bo:5:033:4 0 8 >
ffff8101796a2cc0 2495655043 C Bi:5:033:3 0 12 = 00000c00 13020100 08010000
ffff8101796a2cc0 2495658309 S Bo:5:033:4 -115 6 = 02000600 028f
ffff8101796a2e40 2495658326 S Bi:5:033:3 -115 4096 <
ffff8101796a2cc0 2495659019 C Bo:5:033:4 0 6 >
ffff8101796a2e40 2495660032 C Bi:5:033:3 0 12 = 00000c00 13020100 09010000
ffff8101796a2e40 2495662304 S Bi:5:033:3 -115 4096 <
ffff8101796a2e40 2495668039 C Bi:5:033:3 0 8 = 02000800 64003400
ffff8101796a2e40 2495669787 S Bi:5:033:3 -115 4096 <
ffff8101796a2e40 2495670033 C Bi:5:033:3 0 56 = 02003800 f998491b aa9f0019 6e65745f 72696d5f 666f6e74 5f657572 6f706561
ffff8101796a2e40 2495679661 S Bi:5:033:3 -115 4096 <
ffff8101796a2cc0 2495680687 S Bo:5:033:4 -115 8 = 02000800 6e000200
ffff8101796a2cc0 2495681024 C Bo:5:033:4 0 8 >
ffff8101796a2e40 2495682034 C Bi:5:033:3 0 12 = 00000c00 13020100 0a010000
ffff8101796a2e40 2495683749 S Bi:5:033:3 -115 4096 <
ffff8101796a2cc0 2495692978 S Bo:5:033:4 -115 6 = 02000600 0298
ffff8101796a2e40 2495694043 C Bi:5:033:3 0 12 = 00000c00 13020100 0b010000
ffff8101796a2cc0 2495694049 C Bo:5:033:4 0 6 >
ffff8101796a2cc0 2495695718 S Bi:5:033:3 -115 4096 <
ffff8101796a2cc0 2495696040 C Bi:5:033:3 0 8 = 02000800 64003300
ffff8101796a2cc0 2495697759 S Bi:5:033:3 -115 4096 <
ffff8101796a2cc0 2495698038 C Bi:5:033:3 0 55 = 02003700 1af8491b b3060018 6e65745f 72696d5f 64657669 63655f61 70695f67
ffff8101796a2cc0 2495699752 S Bi:5:033:3 -115 4096 <
ffff8101796a2e40 2495702608 S Bo:5:033:4 -115 8 = 02000800 6e000200
ffff8101796a2e40 2495703023 C Bo:5:033:4 0 8 >
ffff8101796a2cc0 2495704037 C Bi:5:033:3 0 12 = 00000c00 13020100 0c010000
ffff8101796a2cc0 2495707317 S Bo:5:033:4 -115 6 = 02000600 029b
ffff8101796a2e40 2495707338 S Bi:5:033:3 -115 4096 <
ffff8101796a2cc0 2495708025 C Bo:5:033:4 0 6 >
ffff8101796a2e40 2495709038 C Bi:5:033:3 0 12 = 00000c00 13020100 0d010000
ffff8101796a2e40 2495710430 S Bi:5:033:3 -115 4096 <
ffff8101796a2e40 2495729043 C Bi:5:033:3 0 8 = 02000800 64003b00
ffff8101796a2e40 2495731618 S Bi:5:033:3 -115 4096 <
ffff8101796a2e40 2495732036 C Bi:5:033:3 0 63 = 02003f00 3cbc491b b3c80020 6e65745f 72696d5f 62625f62 726f7773 65725f72
ffff8101796a2e40 2495733702 S Bi:5:033:3 -115 4096 <
ffff8101796a2cc0 2495736537 S Bo:5:033:4 -115 8 = 02000800 6e000200
ffff8101796a2cc0 2495737026 C Bo:5:033:4 0 8 >
ffff8101796a2e40 2495738038 C Bi:5:033:3 0 12 = 00000c00 13020100 0e010000
ffff8101796a2e40 2495739562 S Bo:5:033:4 -115 6 = 02000600 02b0
ffff8101796a2cc0 2495739586 S Bi:5:033:3 -115 4096 <
ffff8101796a2e40 2495740021 C Bo:5:033:4 0 6 >
ffff8101796a2cc0 2495741036 C Bi:5:033:3 0 12 = 00000c00 13020100 0f010000
ffff8101796a2cc0 2495742600 S Bi:5:033:3 -115 4096 <
ffff8101796a2cc0 2495758047 C Bi:5:033:3 0 8 = 02000800 64003100
ffff8101796a2cc0 2495762439 S Bi:5:033:3 -115 4096 <
ffff8101796a2cc0 2495763040 C Bi:5:033:3 0 53 = 02003500 15e8491b b42d0016 6e65745f 72696d5f 62625f62 726f7773 65725f6c
ffff8101796a2cc0 2495764388 S Bi:5:033:3 -115 4096 <
ffff8101796a2e40 2495766438 S Bo:5:033:4 -115 8 = 02000800 6e000200
ffff8101796a2e40 2495767027 C Bo:5:033:4 0 8 >
ffff8101796a2cc0 2495768041 C Bi:5:033:3 0 12 = 00000c00 13020100 10010000
ffff8101796a2cc0 2495769383 S Bo:5:033:4 -115 6 = 02000600 02c2
ffff8101796a2e40 2495769403 S Bi:5:033:3 -115 4096 <
ffff8101796a2cc0 2495770025 C Bo:5:033:4 0 6 >
ffff8101796a2e40 2495771039 C Bi:5:033:3 0 12 = 00000c00 13020100 11010000
ffff8101796a2e40 2495774306 S Bi:5:033:3 -115 4096 <
ffff8101796a2e40 2495832049 C Bi:5:033:3 0 8 = 02000800 64003400
ffff8101796a2e40 2495834872 S Bi:5:033:3 -115 4096 <
ffff8101796a2e40 2495835043 C Bi:5:033:3 0 56 = 02003800 c2a4491b b4b40019 6e65745f 72696d5f 62625f73 62696e6a 6563746f
ffff8101796a2e40 2495838093 S Bi:5:033:3 -115 4096 <
ffff8101796a2cc0 2495840006 S Bo:5:033:4 -115 8 = 02000800 6e000200
ffff8101796a2e40 2495841048 C Bi:5:033:3 0 12 = 00000c00 13020100 12010000
ffff8101796a2cc0 2495841055 C Bo:5:033:4 0 8 >
ffff8101796a2cc0 2495845963 S Bo:5:033:4 -115 6 = 02000600 02fe
ffff8101796a2e40 2495845982 S Bi:5:033:3 -115 4096 <
ffff8101796a2cc0 2495847030 C Bo:5:033:4 0 6 >
ffff8101796a2e40 2495847051 C Bi:5:033:3 0 12 = 00000c00 13020100 13010000
ffff8101796a2e40 2495849610 S Bi:5:033:3 -115 4096 <
ffff8101796a2e40 2495864051 C Bi:5:033:3 0 8 = 02000800 64003400
ffff8101796a2e40 2495866233 S Bi:5:033:3 -115 4096 <
ffff8101796a2e40 2495867044 C Bi:5:033:3 0 56 = 02003800 f628491b a73b0019 6e65745f 72696d5f 62625f62 726f7773 65725f64
ffff8101796a2e40 2495868153 S Bi:5:033:3 -115 4096 <
ffff8101796a2cc0 2495871037 S Bo:5:033:4 -115 8 = 02000800 6e000200
ffff8101796a2e40 2495872049 C Bi:5:033:3 0 12 = 00000c00 13020100 14010000
ffff8101796a2cc0 2495872055 C Bo:5:033:4 0 8 >
ffff8101796a2cc0 2495874062 S Bo:5:033:4 -115 6 = 02000600 030d
ffff8101796a2e40 2495874080 S Bi:5:033:3 -115 4096 <
ffff8101796a2cc0 2495875029 C Bo:5:033:4 0 6 >
ffff8101796a2e40 2495875049 C Bi:5:033:3 0 12 = 00000c00 13020100 15010000
ffff8101796a2e40 2495877237 S Bi:5:033:3 -115 4096 <
ffff8101796a2e40 2495882049 C Bi:5:033:3 0 8 = 02000800 64002900
ffff8101796a2e40 2495886429 S Bi:5:033:3 -115 4096 <
ffff8101796a2e40 2495887046 C Bi:5:033:3 0 45 = 02002d00 3d94491b 9d45000e 6e65745f 72696d5f 6c6f6164 65720009 342e352e
ffff8101796a2e40 2495891302 S Bo:5:033:4 -115 8 = 02000800 6e000200
ffff8101796a2cc0 2495891323 S Bi:5:033:3 -115 4096 <
ffff8101796a2e40 2495892033 C Bo:5:033:4 0 8 >
ffff8101796a2cc0 2495893051 C Bi:5:033:3 0 12 = 00000c00 13020100 16010000
ffff8101796a2cc0 2495894189 S Bo:5:033:4 -115 6 = 02000600 0313
ffff8101796a2e40 2495894206 S Bi:5:033:3 -115 4096 <
ffff8101796a2cc0 2495895030 C Bo:5:033:4 0 6 >
ffff8101796a2e40 2495895050 C Bi:5:033:3 0 12 = 00000c00 13020100 17010000
ffff8101796a2e40 2495898299 S Bi:5:033:3 -115 4096 <
ffff8101796a2e40 2495899047 C Bi:5:033:3 0 8 = 02000800 64003d00
ffff8101796a2e40 2495902695 S Bi:5:033:3 -115 4096 <
ffff8101796a2e40 2495903048 C Bi:5:033:3 0 65 = 02004100 1518491b b8fa0022 6e65745f 72696d5f 62625f62 726f7773 65725f70
ffff8101796a2e40 2495907213 S Bo:5:033:4 -115 8 = 02000800 6e000200
ffff8101796a2cc0 2495907236 S Bi:5:033:3 -115 4096 <
ffff8101796a2e40 2495908037 C Bo:5:033:4 0 8 >
ffff8101796a2cc0 2495908059 C Bi:5:033:3 0 12 = 00000c00 13020100 18010000
ffff8101796a2cc0 2495909333 S Bo:5:033:4 -115 6 = 02000600 0316
ffff8101796a2e40 2495909354 S Bi:5:033:3 -115 4096 <
ffff8101796a2cc0 2495910033 C Bo:5:033:4 0 6 >
ffff8101796a2e40 2495911048 C Bi:5:033:3 0 12 = 00000c00 13020100 19010000
ffff8101796a2e40 2495916272 S Bi:5:033:3 -115 4096 <
ffff8101796a2e40 2495917053 C Bi:5:033:3 0 8 = 02000800 64003000
ffff8101796a2e40 2495920267 S Bi:5:033:3 -115 4096 <
ffff8101796a2e40 2495921048 C Bi:5:033:3 0 52 = 02003400 92d8491b a6530015 6e65745f 72696d5f 62625f72 6963685f 656d6169
ffff8101796a2e40 2495926342 S Bi:5:033:3 -115 4096 <
ffff8101796a2cc0 2495929201 S Bo:5:033:4 -115 8 = 02000800 6e000200
ffff8101796a2e40 2495930055 C Bi:5:033:3 0 12 = 00000c00 13020100 1a010000
ffff8101796a2cc0 2495930061 C Bo:5:033:4 0 8 >
ffff8101796a2cc0 2495934292 S Bo:5:033:4 -115 6 = 02000600 0319
ffff8101796a2e40 2495934311 S Bi:5:033:3 -115 4096 <
ffff8101796a2cc0 2495935034 C Bo:5:033:4 0 6 >
ffff8101796a2e40 2495936048 C Bi:5:033:3 0 12 = 00000c00 13020100 1b010000
ffff8101796a2e40 2495937334 S Bi:5:033:3 -115 4096 <
ffff8101796a2e40 2495938051 C Bi:5:033:3 0 8 = 02000800 64003700
ffff8101796a2e40 2495939505 S Bi:5:033:3 -115 4096 <
ffff8101796a2e40 2495940056 C Bi:5:033:3 0 59 = 02003b00 3e10491b abf2001c 6e65745f 72696d5f 62625f65 6d61696c 5f636f6d
ffff8101796a2e40 2495942293 S Bi:5:033:3 -115 4096 <
ffff8101796a2cc0 2495944262 S Bo:5:033:4 -115 8 = 02000800 6e000200
ffff8101796a2cc0 2495945038 C Bo:5:033:4 0 8 >
ffff8101796a2e40 2495946052 C Bi:5:033:3 0 12 = 00000c00 13020100 1c010000
ffff8101796a2e40 2495949621 S Bo:5:033:4 -115 6 = 02000600 031c
ffff8101796a2cc0 2495949673 S Bi:5:033:3 -115 4096 <
ffff8101796a2e40 2495950038 C Bo:5:033:4 0 6 >
ffff8101796a2cc0 2495951054 C Bi:5:033:3 0 12 = 00000c00 13020100 1d010000
ffff8101796a2cc0 2495954320 S Bi:5:033:3 -115 4096 <
ffff8101796a2cc0 2495955053 C Bi:5:033:3 0 8 = 02000800 64002e00
ffff8101796a2cc0 2495958412 S Bi:5:033:3 -115 4096 <
ffff8101796a2cc0 2495959052 C Bi:5:033:3 0 50 = 02003200 0e94491b a4c20013 6e65745f 72696d5f 7463705f 6f707469 6f6e7300
ffff8101796a2cc0 2495964295 S Bo:5:033:4 -115 8 = 02000800 6e000200
ffff8101796a2e40 2495964317 S Bi:5:033:3 -115 4096 <
ffff8101796a2cc0 2495965038 C Bo:5:033:4 0 8 >
ffff8101796a2e40 2495966050 C Bi:5:033:3 0 12 = 00000c00 13020100 1e010000
ffff8101796a2e40 2495967216 S Bo:5:033:4 -115 6 = 02000600 031f
ffff8101796a2cc0 2495967232 S Bi:5:033:3 -115 4096 <
ffff8101796a2e40 2495968034 C Bo:5:033:4 0 6 >
ffff8101796a2cc0 2495968053 C Bi:5:033:3 0 12 = 00000c00 13020100 1f010000
ffff8101796a2cc0 2495969245 S Bi:5:033:3 -115 4096 <
ffff8101796a2cc0 2495970053 C Bi:5:033:3 0 8 = 02000800 64002600
ffff8101796a2cc0 2495974380 S Bi:5:033:3 -115 4096 <
ffff8101796a2cc0 2495975050 C Bi:5:033:3 0 42 = 02002a00 1950491b aa8b000b 6e65745f 72696d5f 77617000 09342e35 2e302e31
ffff8101796a2cc0 2495976732 S Bi:5:033:3 -115 4096 <
ffff8101796a2e40 2495980234 S Bo:5:033:4 -115 8 = 02000800 6e000200
ffff8101796a2cc0 2495981056 C Bi:5:033:3 0 12 = 00000c00 13020100 20010000
ffff8101796a2e40 2495981062 C Bo:5:033:4 0 8 >
ffff8101796a2e40 2495985902 S Bo:5:033:4 -115 6 = 02000600 0322
ffff8101796a2cc0 2495985921 S Bi:5:033:3 -115 4096 <
ffff8101796a2e40 2495986036 C Bo:5:033:4 0 6 >
ffff8101796a2cc0 2495987052 C Bi:5:033:3 0 12 = 00000c00 13020100 21010000
ffff8101796a2cc0 2495989469 S Bi:5:033:3 -115 4096 <
ffff8101796a2cc0 2495990055 C Bi:5:033:3 0 8 = 02000800 64003200
ffff8101796a2cc0 2495992971 S Bi:5:033:3 -115 4096 <
ffff8101796a2cc0 2495994052 C Bi:5:033:3 0 54 = 02003600 27c0491b a4420017 6e65745f 72696d5f 62625f73 696d7068 6f6e6562
ffff8101796a2cc0 2495999013 S Bo:5:033:4 -115 8 = 02000800 6e000200
ffff8101796a2e40 2495999034 S Bi:5:033:3 -115 4096 <
ffff8101796a2cc0 2496000039 C Bo:5:033:4 0 8 >
ffff8101796a2e40 2496000061 C Bi:5:033:3 0 12 = 00000c00 13020100 22010000
ffff8101796a2e40 2496001983 S Bo:5:033:4 -115 6 = 02000600 0325
ffff8101796a2cc0 2496002001 S Bi:5:033:3 -115 4096 <
ffff8101796a2e40 2496003037 C Bo:5:033:4 0 6 >
ffff8101796a2cc0 2496003058 C Bi:5:033:3 0 12 = 00000c00 13020100 23010000
ffff8101796a2cc0 2496005949 S Bi:5:033:3 -115 4096 <
ffff8101796a2cc0 2496010058 C Bi:5:033:3 0 8 = 02000800 64003800
ffff81017941ff00 2496014459 S Bi:5:033:3 -115 4096 <
ffff81017941ff00 2496015083 C Bi:5:033:3 0 60 = 02003c00 522c491b a610001d 6e65745f 72696d5f 62625f61 64647265 7373626f
ffff81017941ff00 2496022467 S Bo:5:033:4 -115 8 = 02000800 6e000200
ffff81017941f480 2496022523 S Bi:5:033:3 -115 4096 <
ffff81017941ff00 2496023040 C Bo:5:033:4 0 8 >
ffff81017941f480 2496024053 C Bi:5:033:3 0 12 = 00000c00 13020100 24010000
ffff81017941f480 2496025938 S Bo:5:033:4 -115 6 = 02000600 032b
ffff81017941ff00 2496025988 S Bi:5:033:3 -115 4096 <
ffff81017941f480 2496027036 C Bo:5:033:4 0 6 >
ffff81017941ff00 2496027056 C Bi:5:033:3 0 12 = 00000c00 13020100 25010000
ffff81017941ff00 2496030613 S Bi:5:033:3 -115 4096 <
ffff81017941ff00 2496031056 C Bi:5:033:3 0 8 = 02000800 64002f00
ffff81017941ff00 2496033648 S Bi:5:033:3 -115 4096 <
ffff81017941ff00 2496034054 C Bi:5:033:3 0 51 = 02003300 bbbc491b a3680014 6e65745f 72696d5f 73653133 6e657474 61626c65
ffff81017941ff00 2496036996 S Bi:5:033:3 -115 4096 <
ffff81017941f480 2496043009 S Bo:5:033:4 -115 8 = 02000800 6e000200
ffff81017941ff00 2496044057 C Bi:5:033:3 0 12 = 00000c00 13020100 26010000
ffff81017941f480 2496044062 C Bo:5:033:4 0 8 >
ffff81017941f480 2496046048 S Bo:5:033:4 -115 6 = 02000600 032e
ffff81017941ff00 2496046103 S Bi:5:033:3 -115 4096 <
ffff81017941f480 2496047039 C Bo:5:033:4 0 6 >
ffff81017941ff00 2496047059 C Bi:5:033:3 0 12 = 00000c00 13020100 27010000
ffff81017941ff00 2496051037 S Bi:5:033:3 -115 4096 <
ffff81017941ff00 2496054060 C Bi:5:033:3 0 8 = 02000800 64003500
ffff81017941ff00 2496058877 S Bi:5:033:3 -115 4096 <
ffff81017941ff00 2496059127 C Bi:5:033:3 0 57 = 02003900 f348491b a792001a 6e65745f 72696d5f 62625f64 65766963 655f7365
ffff81017941ff00 2496060742 S Bi:5:033:3 -115 4096 <
ffff81017941f480 2496066710 S Bo:5:033:4 -115 8 = 02000800 6e000200
ffff81017941f480 2496067043 C Bo:5:033:4 0 8 >
ffff81017941ff00 2496068061 C Bi:5:033:3 0 12 = 00000c00 13020100 28010000
ffff81017941ff00 2496069725 S Bo:5:033:4 -115 6 = 02000600 0334
ffff81017941f480 2496069771 S Bi:5:033:3 -115 4096 <
ffff81017941ff00 2496070041 C Bo:5:033:4 0 6 >
ffff81017941f480 2496071061 C Bi:5:033:3 0 12 = 00000c00 13020100 29010000
ffff81017941f480 2496073200 S Bi:5:033:3 -115 4096 <
ffff81017941f480 2496078061 C Bi:5:033:3 0 8 = 02000800 64003000
ffff81017941f480 2496078925 S Bi:5:033:3 -115 4096 <
ffff81017941f480 2496079106 C Bi:5:033:3 0 52 = 02003400 676c491b a75a0015 6e65745f 72696d5f 62625f6f 74617570 67726164
ffff81017941f480 2496081961 S Bi:5:033:3 -115 4096 <
ffff81017941ff00 2496086854 S Bo:5:033:4 -115 8 = 02000800 6e000200
ffff81017941ff00 2496087053 C Bo:5:033:4 0 8 >
ffff81017941f480 2496088062 C Bi:5:033:3 0 12 = 00000c00 13020100 2a010000
ffff81017941f480 2496089883 S Bo:5:033:4 -115 6 = 02000600 033a
ffff81017941ff00 2496089931 S Bi:5:033:3 -115 4096 <
ffff81017941f480 2496090041 C Bo:5:033:4 0 6 >
ffff81017941ff00 2496091065 C Bi:5:033:3 0 12 = 00000c00 13020100 2b010000
ffff81017941ff00 2496093915 S Bi:5:033:3 -115 4096 <
ffff81017941ff00 2496095057 C Bi:5:033:3 0 8 = 02000800 64003d00
ffff81017941ff00 2496098462 S Bi:5:033:3 -115 4096 <
ffff81017941ff00 2496099059 C Bi:5:033:3 0 65 = 02004100 11cc491b ad0d0022 6e65745f 72696d5f 62625f70 72656c6f 61646564
ffff8101796a2e40 2496102920 S Bi:5:033:3 -115 4096 <
ffff8101796a2480 2496105448 S Bo:5:033:4 -115 8 = 02000800 6e000200
ffff8101796a2480 2496106046 C Bo:5:033:4 0 8 >
ffff8101796a2e40 2496107059 C Bi:5:033:3 0 12 = 00000c00 13020100 2c010000
ffff8101796a2e40 2496109505 S Bo:5:033:4 -115 6 = 02000600 033d
ffff8101796a2480 2496109524 S Bi:5:033:3 -115 4096 <
ffff8101796a2e40 2496110042 C Bo:5:033:4 0 6 >
ffff8101796a2480 2496111059 C Bi:5:033:3 0 12 = 00000c00 13020100 2d010000
ffff8101796a2480 2496119671 S Bi:5:033:3 -115 4096 <
ffff8101796a2480 2496140066 C Bi:5:033:3 0 8 = 02000800 64004300
ffff8101796a2480 2496143317 S Bi:5:033:3 -115 4096 <
ffff8101796a2480 2496144060 C Bi:5:033:3 0 71 = 02004700 4328491b ae3b0028 6e65745f 72696d5f 7468656d 655f6262 64696d65
ffff8101796a2480 2496146500 S Bi:5:033:3 -115 4096 <
ffff8101796a2e40 2496149748 S Bo:5:033:4 -115 8 = 02000800 6e000200
ffff8101796a2e40 2496150048 C Bo:5:033:4 0 8 >
ffff8101796a2480 2496151060 C Bi:5:033:3 0 12 = 00000c00 13020100 2e010000
ffff8101796a2480 2496152280 S Bo:5:033:4 -115 6 = 02000600 0355
ffff8101796a2e40 2496152298 S Bi:5:033:3 -115 4096 <
ffff8101796a2480 2496153045 C Bo:5:033:4 0 6 >
ffff8101796a2e40 2496153066 C Bi:5:033:3 0 12 = 00000c00 13020100 2f010000
ffff8101796a2e40 2496158317 S Bi:5:033:3 -115 4096 <
ffff8101796a2e40 2496168070 C Bi:5:033:3 0 8 = 02000800 64004400
ffff8101796a2e40 2496170461 S Bi:5:033:3 -115 4096 <
ffff8101796a2e40 2496171062 C Bi:5:033:3 0 72 = 02004800 00f8491b ae8c0029 6e65745f 72696d5f 7468656d 655f6262 64696d65
ffff8101796a2e40 2496173598 S Bi:5:033:3 -115 4096 <
ffff8101796a2480 2496176622 S Bo:5:033:4 -115 8 = 02000800 6e000200
ffff8101796a2480 2496177050 C Bo:5:033:4 0 8 >
ffff8101796a2e40 2496178065 C Bi:5:033:3 0 12 = 00000c00 13020100 30010000
ffff8101796a2e40 2496179557 S Bo:5:033:4 -115 6 = 02000600 0361
ffff8101796a2480 2496179577 S Bi:5:033:3 -115 4096 <
ffff8101796a2e40 2496180046 C Bo:5:033:4 0 6 >
ffff8101796a2480 2496181062 C Bi:5:033:3 0 12 = 00000c00 13020100 31010000
ffff8101796a2480 2496182459 S Bi:5:033:3 -115 4096 <
ffff8101796a2480 2496320077 C Bi:5:033:3 0 8 = 02000800 64004200
ffff81017941ff00 2496322078 S Bi:5:033:3 -115 4096 <
ffff81017941ff00 2496323070 C Bi:5:033:3 0 70 = 02004600 dba0491b aec30027 6e65745f 72696d5f 7468656d 655f6262 64696d65
ffff81017941ff00 2496325891 S Bi:5:033:3 -115 4096 <
ffff81017941f480 2496332016 S Bo:5:033:4 -115 8 = 02000800 6e000200
ffff81017941ff00 2496333077 C Bi:5:033:3 0 12 = 00000c00 13020100 32010000
ffff81017941f480 2496333083 C Bo:5:033:4 0 8 >
ffff81017941f480 2496339972 S Bo:5:033:4 -115 6 = 02000600 03cd
ffff81017941ff00 2496340031 S Bi:5:033:3 -115 4096 <
ffff81017941f480 2496340257 C Bo:5:033:4 0 6 >
ffff81017941ff00 2496341078 C Bi:5:033:3 0 12 = 00000c00 13020100 33010000
ffff81017941ff00 2496343001 S Bi:5:033:3 -115 4096 <
ffff81017941ff00 2496350077 C Bi:5:033:3 0 8 = 02000800 64004000
ffff81017941ff00 2496351501 S Bi:5:033:3 -115 4096 <
ffff81017941ff00 2496352083 C Bi:5:033:3 0 68 = 02004400 285c491b ae7a0025 6e65745f 72696d5f 7468656d 655f6262 64696d65
ffff81017941ff00 2496361960 S Bo:5:033:4 -115 8 = 02000800 6e000200
ffff81017941f480 2496362023 S Bi:5:033:3 -115 4096 <
ffff81017941ff00 2496363058 C Bo:5:033:4 0 8 >
ffff81017941f480 2496363079 C Bi:5:033:3 0 12 = 00000c00 13020100 34010000
ffff81017941f480 2496365954 S Bo:5:033:4 -115 6 = 02000600 03d3
ffff81017941ff00 2496366011 S Bi:5:033:3 -115 4096 <
ffff81017941f480 2496367056 C Bo:5:033:4 0 6 >
ffff81017941ff00 2496367076 C Bi:5:033:3 0 12 = 00000c00 13020100 35010000
ffff81017941ff00 2496369596 S Bi:5:033:3 -115 4096 <
ffff81017941ff00 2496393080 C Bi:5:033:3 0 8 = 02000800 64003600
ffff81017941ff00 2496395205 S Bi:5:033:3 -115 4096 <
ffff81017941ff00 2496396076 C Bi:5:033:3 0 58 = 02003a00 b664491b b153001b 6e65745f 72696d5f 7468656d 655f3130 305f3234
ffff81017941ff00 2496405434 S Bo:5:033:4 -115 8 = 02000800 6e000200
ffff81017941f480 2496405490 S Bi:5:033:3 -115 4096 <
ffff81017941ff00 2496407061 C Bo:5:033:4 0 8 >
ffff81017941f480 2496407082 C Bi:5:033:3 0 12 = 00000c00 13020100 36010000
ffff81017941f480 2496410097 S Bo:5:033:4 -115 6 = 02000600 03e5
ffff81017941ff00 2496410153 S Bi:5:033:3 -115 4096 <
ffff81017941f480 2496411060 C Bo:5:033:4 0 6 >
ffff81017941ff00 2496411081 C Bi:5:033:3 0 12 = 00000c00 13020100 37010000
ffff81017941ff00 2496413913 S Bi:5:033:3 -115 4096 <
ffff81017941ff00 2496503087 C Bi:5:033:3 0 8 = 02000800 64004700
ffff81017941ff00 2496508262 S Bi:5:033:3 -115 4096 <
ffff81017941ff00 2496509083 C Bi:5:033:3 0 75 = 02004b00 0198491b ad8d002c 6e65745f 72696d5f 62625f6d 65646961 6c6f6164
ffff81017941ff00 2496514041 S Bi:5:033:3 -115 4096 <
ffff81017941f480 2496520979 S Bo:5:033:4 -115 8 = 02000800 6e000200
ffff81017941ff00 2496522085 C Bi:5:033:3 0 12 = 00000c00 13020100 38010000
ffff81017941f480 2496522089 C Bo:5:033:4 0 8 >
ffff81017941f480 2496526686 S Bo:5:033:4 -115 6 = 02000600 0424
ffff81017941ff00 2496526742 S Bi:5:033:3 -115 4096 <
ffff81017941f480 2496527068 C Bo:5:033:4 0 6 >
ffff81017941ff00 2496528082 C Bi:5:033:3 0 12 = 00000c00 13020100 39010000
ffff81017941ff00 2496529777 S Bi:5:033:3 -115 4096 <
ffff81017941ff00 2496564091 C Bi:5:033:3 0 8 = 02000800 64002b00
ffff81017941ff00 2496566354 S Bi:5:033:3 -115 4096 <
ffff81017941ff00 2496567085 C Bi:5:033:3 0 47 = 02002f00 52b4491b b5770010 6e65745f 72696d5f 746d6f5f 66697665 0009342e
ffff81017941ff00 2496568495 S Bi:5:033:3 -115 4096 <
ffff81017941f480 2496574334 S Bo:5:033:4 -115 8 = 02000800 6e000200
ffff81017941f480 2496575071 C Bo:5:033:4 0 8 >
ffff81017941ff00 2496576084 C Bi:5:033:3 0 12 = 00000c00 13020100 3a010000
ffff81017941ff00 2496577837 S Bo:5:033:4 -115 6 = 02000600 043c
ffff81017941f480 2496577883 S Bi:5:033:3 -115 4096 <
ffff81017941ff00 2496578068 C Bo:5:033:4 0 6 >
ffff81017941f480 2496579083 C Bi:5:033:3 0 12 = 00000c00 13020100 3b010000
ffff81017941f480 2496581907 S Bi:5:033:3 -115 4096 <
ffff81017941f480 2496588271 C Bi:5:033:3 0 8 = 02000800 64004300
ffff81017941f480 2496590586 S Bi:5:033:3 -115 4096 <
ffff81017941f480 2496591096 C Bi:5:033:3 0 71 = 02004700 f884491b ad930028 6e65745f 72696d5f 62625f6d 65646961 6c6f6164
ffff81017941f480 2496592531 S Bi:5:033:3 -115 4096 <
ffff81017941ff00 2496599594 S Bo:5:033:4 -115 8 = 02000800 6e000200
ffff81017941ff00 2496600072 C Bo:5:033:4 0 8 >
ffff81017941f480 2496601088 C Bi:5:033:3 0 12 = 00000c00 13020100 3c010000
ffff81017941f480 2496602574 S Bo:5:033:4 -115 6 = 02000600 0442
ffff81017941ff00 2496602624 S Bi:5:033:3 -115 4096 <
ffff81017941f480 2496603069 C Bo:5:033:4 0 6 >
ffff81017941ff00 2496604088 C Bi:5:033:3 0 12 = 00000c00 13020100 3d010000
ffff81017941ff00 2496605464 S Bi:5:033:3 -115 4096 <
ffff81017941ff00 2496618092 C Bi:5:033:3 0 8 = 02000800 64002c00
ffff81017941ff00 2496619957 S Bi:5:033:3 -115 4096 <
ffff81017941ff00 2496621097 C Bi:5:033:3 0 48 = 02003000 3c98491b a5fd0011 6e65745f 72696d5f 62625f63 616d6572 61000934
ffff81017941ff00 2496623018 S Bi:5:033:3 -115 4096 <
ffff81017941f480 2496626795 S Bo:5:033:4 -115 8 = 02000800 6e000200
ffff81017941f480 2496627073 C Bo:5:033:4 0 8 >
ffff81017941ff00 2496628088 C Bi:5:033:3 0 12 = 00000c00 13020100 3e010000
ffff81017941ff00 2496629828 S Bo:5:033:4 -115 6 = 02000600 044b
ffff81017941f480 2496629878 S Bi:5:033:3 -115 4096 <
ffff81017941ff00 2496630071 C Bo:5:033:4 0 6 >
ffff81017941f480 2496631123 C Bi:5:033:3 0 12 = 00000c00 13020100 3f010000
ffff81017941f480 2496632886 S Bi:5:033:3 -115 4096 <
ffff81017941f480 2496641093 C Bi:5:033:3 0 8 = 02000800 64003800
ffff81017941f480 2496642521 S Bi:5:033:3 -115 4096 <
ffff81017941f480 2496643105 C Bi:5:033:3 0 60 = 02003c00 a264491b a688001d 6e65745f 72696d5f 62625f76 6f696365 6e6f7465
ffff81017941f480 2496644323 S Bi:5:033:3 -115 4096 <
ffff81017941ff00 2496647265 S Bo:5:033:4 -115 8 = 02000800 6e000200
ffff81017941f480 2496648091 C Bi:5:033:3 0 12 = 00000c00 13020100 40010000
ffff81017941ff00 2496648096 C Bo:5:033:4 0 8 >
ffff81017941ff00 2496649231 S Bi:5:033:3 -115 4096 <
ffff81017941f480 2496650159 S Bo:5:033:4 -115 6 = 02000600 0451
ffff81017941ff00 2496651089 C Bi:5:033:3 0 12 = 00000c00 13020100 41010000
ffff81017941f480 2496651094 C Bo:5:033:4 0 6 >
ffff81017941f480 2496652188 S Bi:5:033:3 -115 4096 <
ffff81017941f480 2496675096 C Bi:5:033:3 0 8 = 02000800 64004000
ffff81017941f480 2496678924 S Bi:5:033:3 -115 4096 <
ffff81017941f480 2496680093 C Bi:5:033:3 0 68 = 02004400 1818491b ada60025 6e65745f 72696d5f 62625f6d 65646961 6c6f6164
ffff81017941f480 2496682064 S Bi:5:033:3 -115 4096 <
ffff81017941ff00 2496686815 S Bo:5:033:4 -115 8 = 02000800 6e000200
ffff81017941ff00 2496687077 C Bo:5:033:4 0 8 >
ffff81017941f480 2496688103 C Bi:5:033:3 0 12 = 00000c00 13020100 42010000
ffff81017941f480 2496689872 S Bo:5:033:4 -115 6 = 02000600 0460
ffff81017941f480 2496690076 C Bo:5:033:4 0 6 >
ffff81017941ff00 2496690104 S Bi:5:033:3 -115 4096 <
ffff81017941ff00 2496691092 C Bi:5:033:3 0 12 = 00000c00 13020100 43010000
ffff81017941ff00 2496692982 S Bi:5:033:3 -115 4096 <
ffff81017941ff00 2496694090 C Bi:5:033:3 0 8 = 02000800 64003800
ffff81017941ff00 2496698850 S Bi:5:033:3 -115 4096 <
ffff81017941ff00 2496699093 C Bi:5:033:3 0 60 = 02003c00 216c491b b4fb001d 6e65745f 72696d5f 7469645f 6e657757 6f726473
ffff81017941ff00 2496701943 S Bi:5:033:3 -115 4096 <
ffff81017941f480 2496705882 S Bo:5:033:4 -115 8 = 02000800 6e000200
ffff81017941f480 2496706078 C Bo:5:033:4 0 8 >
ffff81017941ff00 2496707093 C Bi:5:033:3 0 12 = 00000c00 13020100 44010000
ffff81017941ff00 2496709535 S Bo:5:033:4 -115 6 = 02000600 0463
ffff81017941f480 2496709584 S Bi:5:033:3 -115 4096 <
ffff81017941ff00 2496710076 C Bo:5:033:4 0 6 >
ffff81017941f480 2496711091 C Bi:5:033:3 0 12 = 00000c00 13020100 45010000
ffff81017941f480 2496713880 S Bi:5:033:3 -115 4096 <
ffff81017941f480 2496714092 C Bi:5:033:3 0 8 = 02000800 64002600
ffff81017941f480 2496718144 S Bi:5:033:3 -115 4096 <
ffff81017941f480 2496719096 C Bi:5:033:3 0 42 = 02002a00 9168491b b337000b 6e65745f 72696d5f 76616400 09342e35 2e302e31
ffff81017941f480 2496723126 S Bi:5:033:3 -115 4096 <
ffff81017941ff00 2496724045 S Bo:5:033:4 -115 8 = 02000800 6e000200
ffff81017941f480 2496725096 C Bi:5:033:3 0 12 = 00000c00 13020100 46010000
ffff81017941ff00 2496725101 C Bo:5:033:4 0 8 >
ffff81017941ff00 2496729588 S Bo:5:033:4 -115 6 = 02000600 0466
ffff81017941f480 2496729637 S Bi:5:033:3 -115 4096 <
ffff81017941ff00 2496730078 C Bo:5:033:4 0 6 >
ffff81017941f480 2496731092 C Bi:5:033:3 0 12 = 00000c00 13020100 47010000
ffff81017941f480 2496734260 S Bi:5:033:3 -115 4096 <
ffff81017941f480 2496735095 C Bi:5:033:3 0 8 = 02000800 64002f00
ffff81017941f480 2496736906 S Bi:5:033:3 -115 4096 <
ffff81017941f480 2496737157 C Bi:5:033:3 0 51 = 02003300 06e0491b b36d0014 6e65745f 72696d5f 7661645f 7265736f 75726365
ffff81017941f480 2496741985 S Bi:5:033:3 -115 4096 <
ffff81017941ff00 2496742907 S Bo:5:033:4 -115 8 = 02000800 6e000200
ffff81017941ff00 2496743080 C Bo:5:033:4 0 8 >
ffff81017941f480 2496744095 C Bi:5:033:3 0 12 = 00000c00 13020100 48010000
ffff81017941f480 2496745818 S Bo:5:033:4 -115 6 = 02000600 0469
ffff81017941ff00 2496745866 S Bi:5:033:3 -115 4096 <
ffff81017941f480 2496746078 C Bo:5:033:4 0 6 >
ffff81017941ff00 2496747092 C Bi:5:033:3 0 12 = 00000c00 13020100 49010000
ffff81017941ff00 2496750621 S Bi:5:033:3 -115 4096 <
ffff81017941ff00 2496751096 C Bi:5:033:3 0 8 = 02000800 64003300
ffff81017941ff00 2496753728 S Bi:5:033:3 -115 4096 <
ffff81017941ff00 2496754097 C Bi:5:033:3 0 55 = 02003700 0c3c491b b37b0018 6e65745f 72696d5f 7661645f 7265736f 75726365
ffff81017941ff00 2496755756 S Bi:5:033:3 -115 4096 <
ffff81017941f480 2496760602 S Bo:5:033:4 -115 8 = 02000800 6e000200
ffff81017941f480 2496761082 C Bo:5:033:4 0 8 >
ffff81017941ff00 2496762095 C Bi:5:033:3 0 12 = 00000c00 13020100 4a010000
ffff81017941ff00 2496766291 S Bo:5:033:4 -115 6 = 02000600 046c
ffff81017941f480 2496766350 S Bi:5:033:3 -115 4096 <
ffff81017941ff00 2496767080 C Bo:5:033:4 0 6 >
ffff81017941f480 2496767101 C Bi:5:033:3 0 12 = 00000c00 13020100 4b010000
ffff81017941f480 2496769192 S Bi:5:033:3 -115 4096 <
ffff81017941f480 2496816104 C Bi:5:033:3 0 8 = 02000800 64003d00
ffff81017941f480 2496818857 S Bi:5:033:3 -115 4096 <
ffff81017941f480 2496819099 C Bi:5:033:3 0 65 = 02004100 f0c8491b b3440022 6e65745f 72696d5f 7661645f 656e6769 6e655f72
ffff81017941f480 2496821957 S Bi:5:033:3 -115 4096 <
ffff81017941ff00 2496824989 S Bo:5:033:4 -115 8 = 02000800 6e000200
ffff81017941f480 2496826103 C Bi:5:033:3 0 12 = 00000c00 13020100 4c010000
ffff81017941ff00 2496826110 C Bo:5:033:4 0 8 >
ffff81017941ff00 2496829450 S Bo:5:033:4 -115 6 = 02000600 048a
ffff81017941f480 2496829497 S Bi:5:033:3 -115 4096 <
ffff81017941ff00 2496830083 C Bo:5:033:4 0 6 >
ffff81017941f480 2496831098 C Bi:5:033:3 0 12 = 00000c00 13020100 4d010000
ffff81017941f480 2496833872 S Bi:5:033:3 -115 4096 <
ffff81017941f480 2496834099 C Bi:5:033:3 0 8 = 02000800 64003300
ffff81017941f480 2496836999 S Bi:5:033:3 -115 4096 <
ffff81017941f480 2496838110 C Bi:5:033:3 0 55 = 02003700 0c9c491b b37e0018 6e65745f 72696d5f 7661645f 7265736f 75726365
ffff81017941f480 2496840050 S Bi:5:033:3 -115 4096 <
ffff81017941ff00 2496842888 S Bo:5:033:4 -115 8 = 02000800 6e000200
ffff81017941ff00 2496843095 C Bo:5:033:4 0 8 >
ffff81017941f480 2496844110 C Bi:5:033:3 0 12 = 00000c00 13020100 4e010000
ffff81017941f480 2496845895 S Bo:5:033:4 -115 6 = 02000600 048d
ffff81017941ff00 2496845967 S Bi:5:033:3 -115 4096 <
ffff81017941f480 2496846083 C Bo:5:033:4 0 6 >
ffff81017941ff00 2496847099 C Bi:5:033:3 0 12 = 00000c00 13020100 4f010000
ffff81017941ff00 2496849764 S Bi:5:033:3 -115 4096 <
ffff81017941ff00 2496887108 C Bi:5:033:3 0 8 = 02000800 64003a00
ffff81017941ff00 2496890579 S Bi:5:033:3 -115 4096 <
ffff81017941ff00 2496891115 C Bi:5:033:3 0 62 = 02003e00 5c30491b b34a001f 6e65745f 72696d5f 7661645f 656e6769 6e655f72
ffff81017941ff00 2496893542 S Bi:5:033:3 -115 4096 <
ffff81017941f480 2496896630 S Bo:5:033:4 -115 8 = 02000800 6e000200
ffff81017941f480 2496897089 C Bo:5:033:4 0 8 >
ffff81017941ff00 2496898105 C Bi:5:033:3 0 12 = 00000c00 13020100 50010000
ffff81017941ff00 2496899574 S Bo:5:033:4 -115 6 = 02000600 04a5
ffff81017941f480 2496899641 S Bi:5:033:3 -115 4096 <
ffff81017941ff00 2496900086 C Bo:5:033:4 0 6 >
ffff81017941f480 2496901106 C Bi:5:033:3 0 12 = 00000c00 13020100 51010000
ffff81017941f480 2496902485 S Bi:5:033:3 -115 4096 <
ffff81017941f480 2496942111 C Bi:5:033:3 0 8 = 02000800 64003d00
ffff81017941f480 2496945956 S Bi:5:033:3 -115 4096 <
ffff81017941f480 2496947107 C Bi:5:033:3 0 65 = 02004100 697c491b b34f0022 6e65745f 72696d5f 7661645f 656e6769 6e655f72
ffff81017941f480 2496948833 S Bi:5:033:3 -115 4096 <
ffff81017941ff00 2496952860 S Bo:5:033:4 -115 8 = 02000800 6e000200
ffff81017941ff00 2496953092 C Bo:5:033:4 0 8 >
ffff81017941f480 2496954110 C Bi:5:033:3 0 12 = 00000c00 13020100 52010000
ffff81017941f480 2496958132 S Bo:5:033:4 -115 6 = 02000600 04bd
ffff81017941ff00 2496958188 S Bi:5:033:3 -115 4096 <
ffff81017941f480 2496959092 C Bo:5:033:4 0 6 >
ffff81017941ff00 2496959112 C Bi:5:033:3 0 12 = 00000c00 13020100 53010000
ffff81017941ff00 2496961053 S Bi:5:033:3 -115 4096 <
ffff81017941ff00 2496962109 C Bi:5:033:3 0 8 = 02000800 64003700
ffff81017941ff00 2496966065 S Bi:5:033:3 -115 4096 <
ffff81017941ff00 2496967109 C Bi:5:033:3 0 59 = 02003b00 3a18491b a9b1001c 6e65745f 72696d5f 72756e74 696d655f 7265736f
ffff81017941ff00 2496974997 S Bo:5:033:4 -115 8 = 02000800 6e000200
ffff81017941f480 2496975090 S Bi:5:033:3 -115 4096 <
ffff81017941ff00 2496976093 C Bo:5:033:4 0 8 >
ffff81017941f480 2496976114 C Bi:5:033:3 0 12 = 00000c00 13020100 54010000
ffff81017941f480 2496977948 S Bo:5:033:4 -115 6 = 02000600 04c0
ffff81017941ff00 2496977993 S Bi:5:033:3 -115 4096 <
ffff81017941f480 2496978098 C Bo:5:033:4 0 6 >
ffff81017941ff00 2496979108 C Bi:5:033:3 0 12 = 00000c00 13020100 55010000
ffff81017941ff00 2496980095 S Bi:5:033:3 -115 4096 <
ffff81017941ff00 2496990112 C Bi:5:033:3 0 8 = 02000800 64003200
ffff81017941ff00 2496995845 S Bi:5:033:3 -115 4096 <
ffff81017941ff00 2496996110 C Bi:5:033:3 0 54 = 02003600 71f4491b ad390017 6e65745f 72696d5f 62625f72 65736f75 7263655f
ffff81017941ff00 2496997762 S Bi:5:033:3 -115 4096 <
ffff81017941f480 2497001884 S Bo:5:033:4 -115 8 = 02000800 6e000200
ffff81017941f480 2497002102 C Bo:5:033:4 0 8 >
ffff81017941ff00 2497003119 C Bi:5:033:3 0 12 = 00000c00 13020100 56010000
ffff81017941ff00 2497005825 S Bo:5:033:4 -115 6 = 02000600 04c6
ffff81017941f480 2497005879 S Bi:5:033:3 -115 4096 <
ffff81017941ff00 2497006093 C Bo:5:033:4 0 6 >
ffff81017941f480 2497007108 C Bi:5:033:3 0 12 = 00000c00 13020100 57010000
ffff81017941f480 2497009447 S Bi:5:033:3 -115 4096 <
ffff81017941f480 2497010107 C Bi:5:033:3 0 8 = 02000800 64003d00
ffff81017941f480 2497014828 S Bi:5:033:3 -115 4096 <
ffff81017941f480 2497015112 C Bi:5:033:3 0 65 = 02004100 0de0491b ac0e0022 6e65745f 72696d5f 62625f64 6961676e 6f737469
ffff8101796a2e40 2497023849 S Bo:5:033:4 -115 8 = 02000800 6e000200
ffff8101796a2480 2497023872 S Bi:5:033:3 -115 4096 <
ffff8101796a2e40 2497024097 C Bo:5:033:4 0 8 >
ffff8101796a2480 2497025111 C Bi:5:033:3 0 12 = 00000c00 13020100 58010000
ffff8101796a2480 2497026766 S Bo:5:033:4 -115 6 = 02000600 04c9
ffff8101796a2e40 2497026782 S Bi:5:033:3 -115 4096 <
ffff8101796a2480 2497027093 C Bo:5:033:4 0 6 >
ffff8101796a2e40 2497028109 C Bi:5:033:3 0 12 = 00000c00 13020100 59010000
ffff8101796a2e40 2497029804 S Bi:5:033:3 -115 4096 <
ffff8101796a2e40 2497060118 C Bi:5:033:3 0 8 = 02000800 64004500
ffff81017941f480 2497062462 S Bi:5:033:3 -115 4096 <
ffff81017941f480 2497063124 C Bi:5:033:3 0 73 = 02004900 b420491b ab95002a 6e65745f 72696d5f 7469645f 64796e61 6d69635f
ffff81017941f480 2497065039 S Bi:5:033:3 -115 4096 <
ffff81017941ff00 2497067957 S Bo:5:033:4 -115 8 = 02000800 6e000200
ffff81017941ff00 2497068098 C Bo:5:033:4 0 8 >
ffff81017941f480 2497069123 C Bi:5:033:3 0 12 = 00000c00 13020100 5a010000
ffff81017941f480 2497070803 S Bo:5:033:4 -115 6 = 02000600 04db
ffff81017941ff00 2497070845 S Bi:5:033:3 -115 4096 <
ffff81017941f480 2497071096 C Bo:5:033:4 0 6 >
ffff81017941ff00 2497072119 C Bi:5:033:3 0 12 = 00000c00 13020100 5b010000
ffff81017941ff00 2497073841 S Bi:5:033:3 -115 4096 <
ffff81017941ff00 2497074111 C Bi:5:033:3 0 8 = 02000800 64004300
ffff81017941ff00 2497076855 S Bi:5:033:3 -115 4096 <
ffff81017941ff00 2497077123 C Bi:5:033:3 0 71 = 02004700 63d8491b ab760028 6e65745f 72696d5f 7469645f 64796e61 6d69635f
ffff81017941ff00 2497078873 S Bi:5:033:3 -115 4096 <
ffff81017941f480 2497082804 S Bo:5:033:4 -115 8 = 02000800 6e000200
ffff81017941f480 2497083108 C Bo:5:033:4 0 8 >
ffff81017941ff00 2497084123 C Bi:5:033:3 0 12 = 00000c00 13020100 5c010000
ffff81017941ff00 2497085783 S Bo:5:033:4 -115 6 = 02000600 04de
ffff81017941f480 2497085833 S Bi:5:033:3 -115 4096 <
ffff81017941ff00 2497086097 C Bo:5:033:4 0 6 >
ffff81017941f480 2497087113 C Bi:5:033:3 0 12 = 00000c00 13020100 5d010000
ffff81017941f480 2497089602 S Bi:5:033:3 -115 4096 <
ffff81017941f480 2497109120 C Bi:5:033:3 0 8 = 02000800 64002d00
ffff81017941f480 2497122370 S Bi:5:033:3 -115 4096 <
ffff81017941f480 2497124120 C Bi:5:033:3 0 49 = 02003100 eae0491b bac90012 6e65745f 72696d5f 62625f71 6d5f7065 65720009
ffff81017941f480 2497126086 S Bi:5:033:3 -115 4096 <
ffff81017941ff00 2497129878 S Bo:5:033:4 -115 8 = 02000800 6e000200
ffff81017941ff00 2497130102 C Bo:5:033:4 0 8 >
ffff81017941f480 2497131115 C Bi:5:033:3 0 12 = 00000c00 13020100 5e010000
ffff81017941f480 2497134156 S Bo:5:033:4 -115 6 = 02000600 04ea
ffff81017941ff00 2497134212 S Bi:5:033:3 -115 4096 <
ffff81017941f480 2497135100 C Bo:5:033:4 0 6 >
ffff81017941ff00 2497135120 C Bi:5:033:3 0 12 = 00000c00 13020100 5f010000
ffff81017941ff00 2497138274 S Bi:5:033:3 -115 4096 <
ffff81017941ff00 2497139117 C Bi:5:033:3 0 8 = 02000800 64003900
ffff81017941ff00 2497140912 S Bi:5:033:3 -115 4096 <
ffff81017941ff00 2497141207 C Bi:5:033:3 0 61 = 02003d00 2774491b bac6001e 6e65745f 72696d5f 62625f71 6d5f7065 65725f72
ffff81017941ff00 2497142947 S Bi:5:033:3 -115 4096 <
ffff81017941f480 2497146910 S Bo:5:033:4 -115 8 = 02000800 6e000200
ffff81017941f480 2497147102 C Bo:5:033:4 0 8 >
ffff81017941ff00 2497148124 C Bi:5:033:3 0 12 = 00000c00 13020100 60010000
ffff81017941ff00 2497149935 S Bo:5:033:4 -115 6 = 02000600 04ed
ffff81017941f480 2497149978 S Bi:5:033:3 -115 4096 <
ffff81017941ff00 2497150101 C Bo:5:033:4 0 6 >
ffff81017941f480 2497151116 C Bi:5:033:3 0 12 = 00000c00 13020100 61010000
ffff81017941f480 2497154501 S Bi:5:033:3 -115 4096 <
ffff81017941f480 2497155118 C Bi:5:033:3 0 8 = 02000800 64003900
ffff81017941f480 2497157774 S Bi:5:033:3 -115 4096 <
ffff81017941f480 2497158131 C Bi:5:033:3 0 61 = 02003d00 2b9c491b bb2b001e 6e65745f 72696d5f 62625f71 6d5f7065 65725f72
ffff81017941ff00 2497165624 S Bo:5:033:4 -115 8 = 02000800 6e000200
ffff81017941f900 2497165812 S Bi:5:033:3 -115 4096 <
ffff81017941ff00 2497166103 C Bo:5:033:4 0 8 >
ffff81017941f900 2497167123 C Bi:5:033:3 0 12 = 00000c00 13020100 62010000
ffff81017941f900 2497170567 S Bi:5:033:3 -115 4096 <
ffff81017941ff00 2497171561 S Bo:5:033:4 -115 6 = 02000600 04f0
ffff81017941ff00 2497172104 C Bo:5:033:4 0 6 >
ffff81017941f900 2497173131 C Bi:5:033:3 0 12 = 00000c00 13020100 63010000
ffff81017941f900 2497174698 S Bi:5:033:3 -115 4096 <
ffff81017941f900 2497175118 C Bi:5:033:3 0 8 = 02000800 64002f00
ffff81017941f900 2497178607 S Bi:5:033:3 -115 4096 <
ffff81017941f900 2497179120 C Bi:5:033:3 0 51 = 02003300 c650491b b4040014 6e65745f 72696d5f 62626170 695f6d61 696c7632
ffff81017941f900 2497182421 S Bi:5:033:3 -115 4096 <
ffff81017941f480 2497187343 S Bo:5:033:4 -115 8 = 02000800 6e000200
ffff81017941f480 2497188105 C Bo:5:033:4 0 8 >
ffff81017941f900 2497189123 C Bi:5:033:3 0 12 = 00000c00 13020100 64010000
ffff81017941f900 2497190240 S Bo:5:033:4 -115 6 = 02000600 04f3
ffff81017941f480 2497190281 S Bi:5:033:3 -115 4096 <
ffff81017941f900 2497191102 C Bo:5:033:4 0 6 >
ffff81017941f480 2497191121 C Bi:5:033:3 0 12 = 00000c00 13020100 65010000
ffff81017941f480 2497193862 S Bi:5:033:3 -115 4096 <
ffff81017941f480 2497194120 C Bi:5:033:3 0 8 = 02000800 64002d00
ffff81017941f480 2497199247 S Bi:5:033:3 -115 4096 <
ffff81017941f480 2497200134 C Bi:5:033:3 0 49 = 02003100 072c491b b44d0012 6e65745f 72696d5f 62626170 695f6d61 696c0009
ffff81017941f480 2497202143 S Bi:5:033:3 -115 4096 <
ffff81017941ff00 2497204353 S Bo:5:033:4 -115 8 = 02000800 6e000200
ffff81017941ff00 2497205107 C Bo:5:033:4 0 8 >
ffff81017941f480 2497206124 C Bi:5:033:3 0 12 = 00000c00 13020100 66010000
ffff81017941f480 2497207213 S Bo:5:033:4 -115 6 = 02000600 04f6
ffff81017941ff00 2497207255 S Bi:5:033:3 -115 4096 <
ffff81017941f480 2497208105 C Bo:5:033:4 0 6 >
ffff81017941ff00 2497208125 C Bi:5:033:3 0 12 = 00000c00 13020100 67010000
ffff81017941ff00 2497209318 S Bi:5:033:3 -115 4096 <
ffff81017941ff00 2497210123 C Bi:5:033:3 0 8 = 02000800 64002d00
ffff81017941ff00 2497212654 S Bi:5:033:3 -115 4096 <
ffff81017941ff00 2497213163 C Bi:5:033:3 0 49 = 02003100 0970491b abf00012 6e65745f 72696d5f 62626170 695f6d61 70730009
ffff81017941ff00 2497220154 S Bo:5:033:4 -115 8 = 02000800 6e000200
ffff81017941f480 2497220212 S Bi:5:033:3 -115 4096 <
ffff81017941ff00 2497221107 C Bo:5:033:4 0 8 >
ffff81017941f480 2497221127 C Bi:5:033:3 0 12 = 00000c00 13020100 68010000
ffff81017941f480 2497226245 S Bo:5:033:4 -115 6 = 02000600 04f9
ffff81017941ff00 2497226307 S Bi:5:033:3 -115 4096 <
ffff81017941f480 2497227107 C Bo:5:033:4 0 6 >
ffff81017941ff00 2497227127 C Bi:5:033:3 0 12 = 00000c00 13020100 69010000
ffff81017941ff00 2497230292 S Bi:5:033:3 -115 4096 <
ffff81017941ff00 2497231121 C Bi:5:033:3 0 8 = 02000800 64003100
ffff81017941ff00 2497235881 S Bi:5:033:3 -115 4096 <
ffff81017941ff00 2497236124 C Bi:5:033:3 0 53 = 02003500 25c0491b b5000016 6e65745f 72696d5f 62626170 695f6d65 6e756974
ffff81017941ff00 2497237961 S Bi:5:033:3 -115 4096 <
ffff81017941f480 2497243095 S Bo:5:033:4 -115 8 = 02000800 6e000200
ffff81017941ff00 2497244126 C Bi:5:033:3 0 12 = 00000c00 13020100 6a010000
ffff81017941f480 2497244131 C Bo:5:033:4 0 8 >
ffff81017941f480 2497246164 S Bo:5:033:4 -115 6 = 02000600 04fc
ffff81017941ff00 2497246216 S Bi:5:033:3 -115 4096 <
ffff81017941f480 2497247106 C Bo:5:033:4 0 6 >
ffff81017941ff00 2497247126 C Bi:5:033:3 0 12 = 00000c00 13020100 6b010000
ffff81017941ff00 2497249749 S Bi:5:033:3 -115 4096 <
ffff81017941ff00 2497250121 C Bi:5:033:3 0 8 = 02000800 64002c00
ffff81017941ff00 2497254066 S Bi:5:033:3 -115 4096 <
ffff81017941ff00 2497255126 C Bi:5:033:3 0 48 = 02003000 021c491b b4220011 6e65745f 72696d5f 62626170 695f7069 6d000934
ffff81017941ff00 2497262950 S Bo:5:033:4 -115 8 = 02000800 6e000200
ffff81017941f480 2497263014 S Bi:5:033:3 -115 4096 <
ffff81017941ff00 2497263109 C Bo:5:033:4 0 8 >
ffff81017941f480 2497264123 C Bi:5:033:3 0 12 = 00000c00 13020100 6c010000
ffff81017941f480 2497265924 S Bo:5:033:4 -115 6 = 02000600 04ff
ffff81017941ff00 2497265977 S Bi:5:033:3 -115 4096 <
ffff81017941f480 2497266108 C Bo:5:033:4 0 6 >
ffff81017941ff00 2497267122 C Bi:5:033:3 0 12 = 00000c00 13020100 6d010000
ffff81017941ff00 2497269585 S Bi:5:033:3 -115 4096 <
ffff81017941ff00 2497270123 C Bi:5:033:3 0 8 = 02000800 64003100
ffff81017941ff00 2497274990 S Bi:5:033:3 -115 4096 <
ffff81017941ff00 2497276125 C Bi:5:033:3 0 53 = 02003500 2324491b b4530016 6e65745f 72696d5f 62626170 695f7069 6d5f746f
ffff81017941ff00 2497277086 S Bi:5:033:3 -115 4096 <
ffff81017941f480 2497281065 S Bo:5:033:4 -115 8 = 02000800 6e000200
ffff81017941ff00 2497282128 C Bi:5:033:3 0 12 = 00000c00 13020100 6e010000
ffff81017941f480 2497282133 C Bo:5:033:4 0 8 >
ffff81017941f480 2497286388 S Bo:5:033:4 -115 6 = 02000600 0502
ffff81017941ff00 2497286444 S Bi:5:033:3 -115 4096 <
ffff81017941f480 2497287110 C Bo:5:033:4 0 6 >
ffff81017941ff00 2497288124 C Bi:5:033:3 0 12 = 00000c00 13020100 6f010000
ffff81017941ff00 2497289425 S Bi:5:033:3 -115 4096 <
ffff81017941ff00 2497299126 C Bi:5:033:3 0 8 = 02000800 64002700
ffff81017941ff00 2497301902 S Bi:5:033:3 -115 4096 <
ffff81017941ff00 2497302126 C Bi:5:033:3 0 43 = 02002b00 6bbc491b b468000c 6e65745f 72696d5f 70646170 0009342e 352e302e
ffff81017941ff00 2497303933 S Bi:5:033:3 -115 4096 <
ffff81017941f480 2497307929 S Bo:5:033:4 -115 8 = 02000800 6e000200
ffff81017941f480 2497308112 C Bo:5:033:4 0 8 >
ffff81017941ff00 2497309130 C Bi:5:033:3 0 12 = 00000c00 13020100 70010000
ffff81017941ff00 2497310830 S Bo:5:033:4 -115 6 = 02000600 0508
ffff81017941f480 2497310944 S Bi:5:033:3 -115 4096 <
ffff81017941ff00 2497311111 C Bo:5:033:4 0 6 >
ffff81017941f480 2497312126 C Bi:5:033:3 0 12 = 00000c00 13020100 71010000
ffff81017941f480 2497314511 S Bi:5:033:3 -115 4096 <
ffff81017941f480 2497315127 C Bi:5:033:3 0 8 = 02000800 64003100
ffff81017941f480 2497319158 S Bi:5:033:3 -115 4096 <
ffff81017941f480 2497320129 C Bi:5:033:3 0 53 = 02003500 0604491b abf70016 6e65745f 72696d5f 70646170 5f726573 6f757263
ffff81017941f480 2497323395 S Bi:5:033:3 -115 4096 <
ffff81017941ff00 2497326976 S Bo:5:033:4 -115 8 = 02000800 6e000200
ffff81017941ff00 2497327113 C Bo:5:033:4 0 8 >
ffff81017941f480 2497328127 C Bi:5:033:3 0 12 = 00000c00 13020100 72010000
ffff81017941f480 2497330004 S Bo:5:033:4 -115 6 = 02000600 050b
ffff81017941ff00 2497330048 S Bi:5:033:3 -115 4096 <
ffff81017941f480 2497330110 C Bo:5:033:4 0 6 >
ffff81017941ff00 2497331126 C Bi:5:033:3 0 12 = 00000c00 13020100 73010000
ffff81017941ff00 2497334887 S Bi:5:033:3 -115 4096 <
ffff81017941ff00 2497335130 C Bi:5:033:3 0 8 = 02000800 64003000
ffff81017941ff00 2497338932 S Bi:5:033:3 -115 4096 <
ffff81017941ff00 2497339129 C Bi:5:033:3 0 52 = 02003400 0754491b a5b50015 6e65745f 72696d5f 62626170 695f7069 6d5f7265
ffff81017941ff00 2497342051 S Bi:5:033:3 -115 4096 <
ffff81017941f480 2497344956 S Bo:5:033:4 -115 8 = 02000800 6e000200
ffff81017941f480 2497345113 C Bo:5:033:4 0 8 >
ffff81017941ff00 2497346129 C Bi:5:033:3 0 12 = 00000c00 13020100 74010000
ffff81017941ff00 2497349615 S Bo:5:033:4 -115 6 = 02000600 050e
ffff81017941f480 2497349666 S Bi:5:033:3 -115 4096 <
ffff81017941ff00 2497350112 C Bo:5:033:4 0 6 >
ffff81017941f480 2497351127 C Bi:5:033:3 0 12 = 00000c00 13020100 75010000
ffff81017941f480 2497354405 S Bi:5:033:3 -115 4096 <
ffff81017941f480 2497355130 C Bi:5:033:3 0 8 = 02000800 64003400
ffff81017941f480 2497361240 S Bi:5:033:3 -115 4096 <
ffff81017941f480 2497362132 C Bi:5:033:3 0 56 = 02003800 09bc491b a5bb0019 6e65745f 72696d5f 62626170 695f7069 6d5f7265
ffff81017941f480 2497363187 S Bi:5:033:3 -115 4096 <
ffff81017941ff00 2497367208 S Bo:5:033:4 -115 8 = 02000800 6e000200
ffff81017941f480 2497368131 C Bi:5:033:3 0 12 = 00000c00 13020100 76010000
ffff81017941ff00 2497368136 C Bo:5:033:4 0 8 >
ffff81017941ff00 2497370143 S Bo:5:033:4 -115 6 = 02000600 0511
ffff81017941f480 2497370191 S Bi:5:033:3 -115 4096 <
ffff81017941ff00 2497371113 C Bo:5:033:4 0 6 >
ffff81017941f480 2497371133 C Bi:5:033:3 0 12 = 00000c00 13020100 77010000
ffff81017941f480 2497374004 S Bi:5:033:3 -115 4096 <
ffff81017941f480 2497375130 C Bi:5:033:3 0 8 = 02000800 64003000
ffff81017941f480 2497378005 S Bi:5:033:3 -115 4096 <
ffff81017941f480 2497379132 C Bi:5:033:3 0 52 = 02003400 0ac0491b abfc0015 6e65745f 72696d5f 62626170 695f6f70 74696f6e
ffff81017941f480 2497381843 S Bi:5:033:3 -115 4096 <
ffff81017941ff00 2497386849 S Bo:5:033:4 -115 8 = 02000800 6e000200
ffff81017941ff00 2497387116 C Bo:5:033:4 0 8 >
ffff81017941f480 2497388131 C Bi:5:033:3 0 12 = 00000c00 13020100 78010000
ffff81017941f480 2497389871 S Bo:5:033:4 -115 6 = 02000600 0514
ffff81017941ff00 2497389915 S Bi:5:033:3 -115 4096 <
ffff81017941f480 2497390114 C Bo:5:033:4 0 6 >
ffff81017941ff00 2497391130 C Bi:5:033:3 0 12 = 00000c00 13020100 79010000
ffff81017941ff00 2497393934 S Bi:5:033:3 -115 4096 <
ffff81017941ff00 2497394131 C Bi:5:033:3 0 8 = 02000800 64003000
ffff81017941ff00 2497398429 S Bi:5:033:3 -115 4096 <
ffff81017941ff00 2497399134 C Bi:5:033:3 0 52 = 02003400 15fc491b b4b80015 6e65745f 72696d5f 62626170 695f6272 6f777365
ffff81017941ff00 2497400578 S Bi:5:033:3 -115 4096 <
ffff81017941f480 2497404377 S Bo:5:033:4 -115 8 = 02000800 6e000200
ffff81017941f480 2497405117 C Bo:5:033:4 0 8 >
ffff81017941ff00 2497406131 C Bi:5:033:3 0 12 = 00000c00 13020100 7a010000
ffff81017941ff00 2497409603 S Bo:5:033:4 -115 6 = 02000600 0517
ffff81017941f480 2497409660 S Bi:5:033:3 -115 4096 <
ffff81017941ff00 2497410117 C Bo:5:033:4 0 6 >
ffff81017941f480 2497411131 C Bi:5:033:3 0 12 = 00000c00 13020100 7b010000
ffff81017941f480 2497413865 S Bi:5:033:3 -115 4096 <
ffff81017941f480 2497414133 C Bi:5:033:3 0 8 = 02000800 64002e00
ffff81017941f480 2497419904 S Bi:5:033:3 -115 4096 <
ffff81017941f480 2497420144 C Bi:5:033:3 0 50 = 02003200 2d34491b abe90013 6e65745f 72696d5f 62626170 695f7068 6f6e6500
ffff81017941f480 2497421871 S Bi:5:033:3 -115 4096 <
ffff81017941ff00 2497425862 S Bo:5:033:4 -115 8 = 02000800 6e000200
ffff81017941ff00 2497426119 C Bo:5:033:4 0 8 >
ffff81017941f480 2497427132 C Bi:5:033:3 0 12 = 00000c00 13020100 7c010000
ffff81017941f480 2497429491 S Bo:5:033:4 -115 6 = 02000600 051a
ffff81017941ff00 2497429537 S Bi:5:033:3 -115 4096 <
ffff81017941f480 2497430116 C Bo:5:033:4 0 6 >
ffff81017941ff00 2497431131 C Bi:5:033:3 0 12 = 00000c00 13020100 7d010000
ffff81017941ff00 2497433916 S Bi:5:033:3 -115 4096 <
ffff81017941ff00 2497434132 C Bi:5:033:3 0 8 = 02000800 64002f00
ffff81017941ff00 2497436839 S Bi:5:033:3 -115 4096 <
ffff81017941ff00 2497437143 C Bi:5:033:3 0 51 = 02003300 32b4491b b5070014 6e65745f 72696d5f 62626170 695f696e 766f6b65
ffff81017941ff00 2497442748 S Bo:5:033:4 -115 8 = 02000800 6e000200
ffff81017941f480 2497442815 S Bi:5:033:3 -115 4096 <
ffff81017941ff00 2497443120 C Bo:5:033:4 0 8 >
ffff81017941f480 2497444133 C Bi:5:033:3 0 12 = 00000c00 13020100 7e010000
ffff81017941f480 2497445776 S Bo:5:033:4 -115 6 = 02000600 051d
ffff81017941ff00 2497445822 S Bi:5:033:3 -115 4096 <
ffff81017941f480 2497446117 C Bo:5:033:4 0 6 >
ffff81017941ff00 2497447131 C Bi:5:033:3 0 12 = 00000c00 13020100 7f010000
ffff81017941ff00 2497449588 S Bi:5:033:3 -115 4096 <
ffff81017941ff00 2497450134 C Bi:5:033:3 0 8 = 02000800 64003100
ffff81017941ff00 2497454181 S Bi:5:033:3 -115 4096 <
ffff81017941ff00 2497455138 C Bi:5:033:3 0 53 = 02003500 0b54491b 9d030016 6e65745f 72696d5f 62625f70 686f6e65 5f656e74
ffff81017941ff00 2497463209 S Bo:5:033:4 -115 8 = 02000800 6e000200
ffff81017941f480 2497463404 S Bi:5:033:3 -115 4096 <
ffff81017941ff00 2497464122 C Bo:5:033:4 0 8 >
ffff81017941f480 2497464144 C Bi:5:033:3 0 12 = 00000c00 13020100 80010000
ffff81017941f480 2497466030 S Bo:5:033:4 -115 6 = 02000600 0520
ffff81017941ff00 2497466080 S Bi:5:033:3 -115 4096 <
ffff81017941f480 2497467118 C Bo:5:033:4 0 6 >
ffff81017941ff00 2497467138 C Bi:5:033:3 0 12 = 00000c00 13020100 81010000
ffff81017941ff00 2497469625 S Bi:5:033:3 -115 4096 <
ffff81017941ff00 2497470136 C Bi:5:033:3 0 8 = 02000800 64002e00
ffff81017941f480 2497474945 S Bi:5:033:3 -115 4096 <
ffff81017941f480 2497475137 C Bi:5:033:3 0 50 = 02003200 7d38491b 9b570013 6e65745f 72696d5f 6c6f6361 74696f6e 61706900
ffff81017941f480 2497477932 S Bi:5:033:3 -115 4096 <
ffff81017941f900 2497480874 S Bo:5:033:4 -115 8 = 02000800 6e000200
ffff81017941f900 2497481122 C Bo:5:033:4 0 8 >
ffff81017941f480 2497482136 C Bi:5:033:3 0 12 = 00000c00 13020100 82010000
ffff81017941f480 2497486861 S Bo:5:033:4 -115 6 = 02000600 0523
ffff81017941f900 2497486920 S Bi:5:033:3 -115 4096 <
ffff81017941f480 2497487121 C Bo:5:033:4 0 6 >
ffff81017941f900 2497488145 C Bi:5:033:3 0 12 = 00000c00 13020100 83010000
ffff81017941f900 2497489754 S Bi:5:033:3 -115 4096 <
ffff81017941f900 2497490136 C Bi:5:033:3 0 8 = 02000800 64003c00
ffff81017941f900 2497494006 S Bi:5:033:3 -115 4096 <
ffff81017941f900 2497495138 C Bi:5:033:3 0 64 = 02004000 0e3c491b b4740021 6e65745f 72696d5f 62626170 695f626c 61636b62
ffff81017941f900 2497501928 S Bo:5:033:4 -115 8 = 02000800 6e000200
ffff81017941f480 2497501988 S Bi:5:033:3 -115 4096 <
ffff81017941f900 2497502122 C Bo:5:033:4 0 8 >
ffff81017941f480 2497503145 C Bi:5:033:3 0 12 = 00000c00 13020100 84010000
ffff81017941f480 2497506416 S Bo:5:033:4 -115 6 = 02000600 0526
ffff81017941f900 2497506471 S Bi:5:033:3 -115 4096 <
ffff81017941f480 2497507121 C Bo:5:033:4 0 6 >
ffff81017941f900 2497508137 C Bi:5:033:3 0 12 = 00000c00 13020100 85010000
ffff81017941f900 2497510021 S Bi:5:033:3 -115 4096 <
ffff81017941f900 2497511136 C Bi:5:033:3 0 8 = 02000800 64003600
ffff81017941f900 2497513972 S Bi:5:033:3 -115 4096 <
ffff81017941f900 2497514172 C Bi:5:033:3 0 58 = 02003a00 195c491b a7b8001b 6e65745f 72696d5f 62626170 695f7374 72696e67
ffff81017941f900 2497515928 S Bi:5:033:3 -115 4096 <
ffff81017941f480 2497521970 S Bo:5:033:4 -115 8 = 02000800 6e000200
ffff81017941f480 2497522124 C Bo:5:033:4 0 8 >
ffff81017941f900 2497523150 C Bi:5:033:3 0 12 = 00000c00 13020100 86010000
ffff81017941f900 2497524962 S Bi:5:033:3 -115 4096 <
ffff81017941f480 2497526030 S Bo:5:033:4 -115 6 = 02000600 0529
ffff81017941f900 2497527140 C Bi:5:033:3 0 12 = 00000c00 13020100 87010000
ffff81017941f480 2497527145 C Bo:5:033:4 0 6 >
ffff81017941f480 2497529590 S Bi:5:033:3 -115 4096 <
ffff81017941f480 2497530138 C Bi:5:033:3 0 8 = 02000800 64002f00
ffff81017941f480 2497534937 S Bi:5:033:3 -115 4096 <
ffff81017941f480 2497535140 C Bi:5:033:3 0 51 = 02003300 1198491b abe40014 6e65745f 72696d5f 62625f6c 62735f61 70695f32
ffff81017941f480 2497536857 S Bi:5:033:3 -115 4096 <
ffff81017941f900 2497540857 S Bo:5:033:4 -115 8 = 02000800 6e000200
ffff81017941f900 2497541124 C Bo:5:033:4 0 8 >
ffff81017941f480 2497542139 C Bi:5:033:3 0 12 = 00000c00 13020100 88010000
ffff81017941f480 2497546852 S Bo:5:033:4 -115 6 = 02000600 052c
ffff81017941f900 2497546912 S Bi:5:033:3 -115 4096 <
ffff81017941f480 2497547125 C Bo:5:033:4 0 6 >
ffff81017941f900 2497548146 C Bi:5:033:3 0 12 = 00000c00 13020100 89010000
ffff81017941f900 2497549759 S Bi:5:033:3 -115 4096 <
ffff81017941f900 2497550139 C Bi:5:033:3 0 8 = 02000800 64003400
ffff81017941f900 2497554070 S Bi:5:033:3 -115 4096 <
ffff81017941f900 2497555141 C Bi:5:033:3 0 56 = 02003800 09e0491b b3060019 6e65745f 72696d5f 62626170 695f7069 6d5f7265
ffff81017941f900 2497557037 S Bi:5:033:3 -115 4096 <
ffff81017941f480 2497562024 S Bo:5:033:4 -115 8 = 02000800 6e000200
ffff81017941f900 2497563143 C Bi:5:033:3 0 12 = 00000c00 13020100 8a010000
ffff81017941f480 2497563148 C Bo:5:033:4 0 8 >
ffff81017941f480 2497565971 S Bo:5:033:4 -115 6 = 02000600 052f
ffff81017941f900 2497566026 S Bi:5:033:3 -115 4096 <
ffff81017941f480 2497566126 C Bo:5:033:4 0 6 >
ffff81017941f900 2497567140 C Bi:5:033:3 0 12 = 00000c00 13020100 8b010000
ffff81017941f900 2497569584 S Bi:5:033:3 -115 4096 <
ffff81017941f900 2497570139 C Bi:5:033:3 0 8 = 02000800 64003200
ffff81017941f900 2497573952 S Bi:5:033:3 -115 4096 <
ffff81017941f900 2497574171 C Bi:5:033:3 0 54 = 02003600 09a4491b aabb0017 6e65745f 72696d5f 63727970 746f5f72 65736f75
ffff81017941f900 2497575945 S Bi:5:033:3 -115 4096 <
ffff81017941f480 2497578982 S Bo:5:033:4 -115 8 = 02000800 6e000200
ffff81017941f480 2497579190 C Bo:5:033:4 0 8 >
ffff81017941f900 2497580144 C Bi:5:033:3 0 12 = 00000c00 13020100 8c010000
ffff8101796a2480 2497587662 S Bo:5:033:4 -115 6 = 02000600 0532
ffff8101796a2cc0 2497587681 S Bi:5:033:3 -115 4096 <
ffff8101796a2480 2497588131 C Bo:5:033:4 0 6 >
ffff8101796a2cc0 2497589144 C Bi:5:033:3 0 12 = 00000c00 13020100 8d010000
ffff8101796a2cc0 2497590704 S Bi:5:033:3 -115 4096 <
ffff8101796a2cc0 2497591147 C Bi:5:033:3 0 8 = 02000800 64003600
ffff8101796a2cc0 2497595395 S Bi:5:033:3 -115 4096 <
ffff8101796a2cc0 2497596145 C Bi:5:033:3 0 58 = 02003a00 406c491b aaca001b 6e65745f 72696d5f 63727970 746f5f72 65736f75
ffff8101796a2cc0 2497599159 S Bi:5:033:3 -115 4096 <
ffff8101796a2480 2497607537 S Bo:5:033:4 -115 8 = 02000800 6e000200
ffff8101796a2480 2497608131 C Bo:5:033:4 0 8 >
ffff8101796a2cc0 2497609143 C Bi:5:033:3 0 12 = 00000c00 13020100 8e010000
ffff8101796a2cc0 2497610940 S Bo:5:033:4 -115 6 = 02000600 0535
ffff8101796a2480 2497610959 S Bi:5:033:3 -115 4096 <
ffff8101796a2cc0 2497611127 C Bo:5:033:4 0 6 >
ffff8101796a2480 2497612142 C Bi:5:033:3 0 12 = 00000c00 13020100 8f010000
ffff8101796a2480 2497614742 S Bi:5:033:3 -115 4096 <
ffff8101796a2480 2497635147 C Bi:5:033:3 0 8 = 02000800 64002b00
ffff8101796a2480 2497638400 S Bi:5:033:3 -115 4096 <
ffff8101796a2480 2497639143 C Bi:5:033:3 0 47 = 02002f00 6174491b aab30010 6e65745f 72696d5f 63727970 746f5f31 0009342e
ffff8101796a2480 2497640412 S Bi:5:033:3 -115 4096 <
ffff81017941f480 2497648343 S Bo:5:033:4 -115 8 = 02000800 6e000200
ffff8101796a2480 2497649144 C Bi:5:033:3 0 12 = 00000c00 13020100 90010000
ffff81017941f480 2497649149 C Bo:5:033:4 0 8 >
ffff81017941f480 2497653847 S Bo:5:033:4 -115 6 = 02000600 0541
ffff81017941f480 2497654130 C Bo:5:033:4 0 6 >
ffff81017941ff00 2497654561 S Bi:5:033:3 -115 4096 <
ffff81017941ff00 2497655209 C Bi:5:033:3 0 12 = 00000c00 13020100 91010000
ffff81017941ff00 2497656791 S Bi:5:033:3 -115 4096 <
ffff81017941ff00 2497657145 C Bi:5:033:3 0 8 = 02000800 64003600
ffff81017941ff00 2497658827 S Bi:5:033:3 -115 4096 <
ffff81017941ff00 2497659167 C Bi:5:033:3 0 58 = 02003a00 461c491b aad0001b 6e65745f 72696d5f 63727970 746f5f72 65736f75
ffff81017941ff00 2497660901 S Bi:5:033:3 -115 4096 <
ffff8101796a2cc0 2497671780 S Bo:5:033:4 -115 8 = 02000800 6e000200
ffff8101796a2cc0 2497672141 C Bo:5:033:4 0 8 >
ffff81017941ff00 2497673150 C Bi:5:033:3 0 12 = 00000c00 13020100 92010000
ffff8101796a2cc0 2497674854 S Bo:5:033:4 -115 6 = 02000600 0544
ffff8101796a2480 2497674871 S Bi:5:033:3 -115 4096 <
ffff8101796a2cc0 2497675130 C Bo:5:033:4 0 6 >
ffff8101796a2480 2497676146 C Bi:5:033:3 0 12 = 00000c00 13020100 93010000
ffff8101796a2480 2497677840 S Bi:5:033:3 -115 4096 <
ffff8101796a2480 2497693156 C Bi:5:033:3 0 8 = 02000800 64002b00
ffff8101796a2480 2497695490 S Bi:5:033:3 -115 4096 <
ffff8101796a2480 2497696152 C Bi:5:033:3 0 47 = 02002f00 02d4491b ab430010 6e65745f 72696d5f 63727970 746f5f32 0009342e
ffff8101796a2480 2497704287 S Bi:5:033:3 -115 4096 <
ffff8101796a2cc0 2497706101 S Bo:5:033:4 -115 8 = 02000800 6e000200
ffff8101796a2480 2497707154 C Bi:5:033:3 0 12 = 00000c00 13020100 94010000
ffff8101796a2cc0 2497707162 C Bo:5:033:4 0 8 >
ffff8101796a2cc0 2497709152 S Bo:5:033:4 -115 6 = 02000600 054d
ffff8101796a2480 2497709170 S Bi:5:033:3 -115 4096 <
ffff8101796a2cc0 2497710131 C Bo:5:033:4 0 6 >
ffff8101796a2480 2497710152 C Bi:5:033:3 0 12 = 00000c00 13020100 95010000
ffff8101796a2480 2497713993 S Bi:5:033:3 -115 4096 <
ffff8101796a2480 2497728154 C Bi:5:033:3 0 8 = 02000800 64002b00
ffff8101796a2480 2497730622 S Bi:5:033:3 -115 4096 <
ffff8101796a2480 2497731149 C Bi:5:033:3 0 47 = 02002f00 c124491b ab610010 6e65745f 72696d5f 63727970 746f5f33 0009342e
ffff8101796a2480 2497732698 S Bi:5:033:3 -115 4096 <
ffff8101796a2cc0 2497736520 S Bo:5:033:4 -115 8 = 02000800 6e000200
ffff8101796a2cc0 2497737137 C Bo:5:033:4 0 8 >
ffff8101796a2480 2497738149 C Bi:5:033:3 0 12 = 00000c00 13020100 96010000
ffff8101796a2480 2497739540 S Bo:5:033:4 -115 6 = 02000600 0556
ffff8101796a2cc0 2497739557 S Bi:5:033:3 -115 4096 <
ffff8101796a2480 2497740134 C Bo:5:033:4 0 6 >
ffff8101796a2cc0 2497741149 C Bi:5:033:3 0 12 = 00000c00 13020100 97010000
ffff8101796a2cc0 2497742486 S Bi:5:033:3 -115 4096 <
ffff8101796a2cc0 2497743149 C Bi:5:033:3 0 8 = 02000800 64003300
ffff8101796a2cc0 2497745485 S Bi:5:033:3 -115 4096 <
ffff8101796a2cc0 2497746150 C Bi:5:033:3 0 55 = 02003700 2ac8491b b8e70018 6e65745f 72696d5f 736d6172 74636172 645f6773
ffff8101796a2cc0 2497754593 S Bo:5:033:4 -115 8 = 02000800 6e000200
ffff8101796a2480 2497754613 S Bi:5:033:3 -115 4096 <
ffff8101796a2cc0 2497755140 C Bo:5:033:4 0 8 >
ffff8101796a2480 2497756151 C Bi:5:033:3 0 12 = 00000c00 13020100 98010000
ffff8101796a2480 2497758493 S Bo:5:033:4 -115 6 = 02000600 0559
ffff8101796a2cc0 2497758511 S Bi:5:033:3 -115 4096 <
ffff8101796a2480 2497759135 C Bo:5:033:4 0 6 >
ffff8101796a2cc0 2497760150 C Bi:5:033:3 0 12 = 00000c00 13020100 99010000
ffff8101796a2cc0 2497762451 S Bi:5:033:3 -115 4096 <
ffff8101796a2cc0 2497763151 C Bi:5:033:3 0 8 = 02000800 64003400
ffff8101796a2cc0 2497765377 S Bi:5:033:3 -115 4096 <
ffff8101796a2cc0 2497766151 C Bi:5:033:3 0 56 = 02003800 418c491b b8e20019 6e65745f 72696d5f 736d6172 74636172 645f6461
ffff8101796a2cc0 2497768640 S Bi:5:033:3 -115 4096 <
ffff8101796a2480 2497773519 S Bo:5:033:4 -115 8 = 02000800 6e000200
ffff8101796a2480 2497774140 C Bo:5:033:4 0 8 >
ffff8101796a2cc0 2497775152 C Bi:5:033:3 0 12 = 00000c00 13020100 9a010000
ffff8101796a2cc0 2497776538 S Bo:5:033:4 -115 6 = 02000600 055c
ffff8101796a2480 2497776556 S Bi:5:033:3 -115 4096 <
ffff8101796a2cc0 2497777136 C Bo:5:033:4 0 6 >
ffff8101796a2480 2497778153 C Bi:5:033:3 0 12 = 00000c00 13020100 9b010000
ffff8101796a2480 2497779569 S Bi:5:033:3 -115 4096 <
ffff8101796a2480 2497780152 C Bi:5:033:3 0 8 = 02000800 64003000
ffff8101796a2480 2497781700 S Bi:5:033:3 -115 4096 <
ffff8101796a2480 2497782151 C Bi:5:033:3 0 52 = 02003400 2b68491b b8e90015 6e65745f 72696d5f 736d6172 74636172 645f7069
ffff8101796a2480 2497783802 S Bi:5:033:3 -115 4096 <
ffff8101796a2cc0 2497786790 S Bo:5:033:4 -115 8 = 02000800 6e000200
ffff8101796a2cc0 2497787141 C Bo:5:033:4 0 8 >
ffff8101796a2480 2497788153 C Bi:5:033:3 0 12 = 00000c00 13020100 9c010000
ffff8101796a2480 2497789542 S Bo:5:033:4 -115 6 = 02000600 055f
ffff8101796a2cc0 2497789560 S Bi:5:033:3 -115 4096 <
ffff8101796a2480 2497790136 C Bo:5:033:4 0 6 >
ffff8101796a2cc0 2497791151 C Bi:5:033:3 0 12 = 00000c00 13020100 9d010000
ffff8101796a2cc0 2497794367 S Bi:5:033:3 -115 4096 <
ffff8101796a2cc0 2497795156 C Bi:5:033:3 0 8 = 02000800 64002d00
ffff8101796a2cc0 2497797138 S Bi:5:033:3 -115 4096 <
ffff8101796a2cc0 2497798152 C Bi:5:033:3 0 49 = 02003100 e124491b ab800012 6e65745f 72696d5f 63727970 746f5f63 6d730009
ffff8101796a2cc0 2497800212 S Bi:5:033:3 -115 4096 <
ffff8101796a2480 2497804013 S Bo:5:033:4 -115 8 = 02000800 6e000200
ffff8101796a2480 2497804144 C Bo:5:033:4 0 8 >
ffff8101796a2cc0 2497805157 C Bi:5:033:3 0 12 = 00000c00 13020100 9e010000
ffff8101796a2cc0 2497807015 S Bo:5:033:4 -115 6 = 02000600 0562
ffff8101796a2480 2497807033 S Bi:5:033:3 -115 4096 <
ffff8101796a2cc0 2497807137 C Bo:5:033:4 0 6 >
ffff8101796a2480 2497808153 C Bi:5:033:3 0 12 = 00000c00 13020100 9f010000
ffff8101796a2480 2497810051 S Bi:5:033:3 -115 4096 <
ffff8101796a2480 2497811153 C Bi:5:033:3 0 8 = 02000800 64002d00
ffff8101796a2480 2497815252 S Bi:5:033:3 -115 4096 <
ffff8101796a2480 2497816159 C Bi:5:033:3 0 49 = 02003100 4298491b ab830012 6e65745f 72696d5f 63727970 746f5f70 67700009
ffff8101796a2480 2497822303 S Bo:5:033:4 -115 8 = 02000800 6e000200
ffff8101796a2cc0 2497822373 S Bi:5:033:3 -115 4096 <
ffff8101796a2480 2497823143 C Bo:5:033:4 0 8 >
ffff8101796a2cc0 2497823168 C Bi:5:033:3 0 12 = 00000c00 13020100 a0010000
ffff8101796a2cc0 2497824263 S Bo:5:033:4 -115 6 = 02000600 0565
ffff8101796a2480 2497824308 S Bi:5:033:3 -115 4096 <
ffff8101796a2cc0 2497825138 C Bo:5:033:4 0 6 >
ffff8101796a2480 2497825159 C Bi:5:033:3 0 12 = 00000c00 13020100 a1010000
ffff8101796a2480 2497828609 S Bi:5:033:3 -115 4096 <
ffff8101796a2480 2497829155 C Bi:5:033:3 0 8 = 02000800 64003000
ffff8101796a2480 2497831612 S Bi:5:033:3 -115 4096 <
ffff8101796a2480 2497832155 C Bi:5:033:3 0 52 = 02003400 2198491b b7580015 6e65745f 72696d5f 62625f63 72797074 6f5f6170
ffff8101796a2480 2497833655 S Bi:5:033:3 -115 4096 <
ffff8101796a2cc0 2497837546 S Bo:5:033:4 -115 8 = 02000800 6e000200
ffff8101796a2cc0 2497838143 C Bo:5:033:4 0 8 >
ffff8101796a2480 2497839156 C Bi:5:033:3 0 12 = 00000c00 13020100 a2010000
ffff8101796a2480 2497842319 S Bo:5:033:4 -115 6 = 02000600 0568
ffff8101796a2cc0 2497842340 S Bi:5:033:3 -115 4096 <
ffff8101796a2480 2497843140 C Bo:5:033:4 0 6 >
ffff8101796a2cc0 2497843161 C Bi:5:033:3 0 12 = 00000c00 13020100 a3010000
ffff8101796a2cc0 2497844343 S Bi:5:033:3 -115 4096 <
ffff8101796a2cc0 2497845156 C Bi:5:033:3 0 8 = 02000800 64003500
ffff8101796a2cc0 2497849587 S Bi:5:033:3 -115 4096 <
ffff8101796a2cc0 2497850156 C Bi:5:033:3 0 57 = 02003900 07c8491b b87a001a 6e65745f 72696d5f 62625f63 72797074 6f5f7265
ffff8101796a2cc0 2497855525 S Bo:5:033:4 -115 8 = 02000800 6e000200
ffff8101796a2480 2497855548 S Bi:5:033:3 -115 4096 <
ffff8101796a2cc0 2497856144 C Bo:5:033:4 0 8 >
ffff8101796a2480 2497857157 C Bi:5:033:3 0 12 = 00000c00 13020100 a4010000
ffff8101796a2480 2497858553 S Bo:5:033:4 -115 6 = 02000600 056b
ffff8101796a2cc0 2497858573 S Bi:5:033:3 -115 4096 <
ffff8101796a2480 2497859140 C Bo:5:033:4 0 6 >
ffff8101796a2cc0 2497860156 C Bi:5:033:3 0 12 = 00000c00 13020100 a5010000
ffff8101796a2cc0 2497862330 S Bi:5:033:3 -115 4096 <
ffff8101796a2cc0 2497863157 C Bi:5:033:3 0 8 = 02000800 64003900
ffff8101796a2cc0 2497888358 S Bi:5:033:3 -115 4096 <
ffff8101796a2cc0 2497890164 C Bi:5:033:3 0 61 = 02003d00 1b04491b b882001e 6e65745f 72696d5f 62625f63 72797074 6f5f7265
ffff8101796a2cc0 2497894405 S Bi:5:033:3 -115 4096 <
ffff8101796a2480 2497897226 S Bo:5:033:4 -115 8 = 02000800 6e000200
ffff8101796a2cc0 2497898164 C Bi:5:033:3 0 12 = 00000c00 13020100 a6010000
ffff8101796a2480 2497898172 C Bo:5:033:4 0 8 >
ffff8101796a2480 2497902769 S Bo:5:033:4 -115 6 = 02000600 056e
ffff8101796a2cc0 2497902828 S Bi:5:033:3 -115 4096 <
ffff8101796a2480 2497903145 C Bo:5:033:4 0 6 >
ffff8101796a2cc0 2497904159 C Bi:5:033:3 0 12 = 00000c00 13020100 a7010000
ffff8101796a2cc0 2497906339 S Bi:5:033:3 -115 4096 <
ffff8101796a2cc0 2497907162 C Bi:5:033:3 0 8 = 02000800 64003900
ffff8101796a2cc0 2497909381 S Bi:5:033:3 -115 4096 <
ffff8101796a2cc0 2497910192 C Bi:5:033:3 0 61 = 02003d00 1d70491b b88a001e 6e65745f 72696d5f 62625f63 72797074 6f5f7265
ffff8101796a2cc0 2497911267 S Bi:5:033:3 -115 4096 <
ffff8101796a2480 2497915396 S Bo:5:033:4 -115 8 = 02000800 6e000200
ffff8101796a2480 2497916149 C Bo:5:033:4 0 8 >
ffff8101796a2cc0 2497917161 C Bi:5:033:3 0 12 = 00000c00 13020100 a8010000
ffff81017941f0c0 2497919343 S Bo:5:033:4 -115 6 = 02000600 0571
ffff81017941fa80 2497919398 S Bi:5:033:3 -115 4096 <
ffff81017941f0c0 2497920143 C Bo:5:033:4 0 6 >
ffff81017941fa80 2497920164 C Bi:5:033:3 0 12 = 00000c00 13020100 a9010000
ffff81017941fa80 2497921229 S Bi:5:033:3 -115 4096 <
ffff81017941fa80 2497922159 C Bi:5:033:3 0 8 = 02000800 64003a00
ffff81017941fa80 2497925978 S Bi:5:033:3 -115 4096 <
ffff81017941fa80 2497926207 C Bi:5:033:3 0 62 = 02003e00 9e88491b b8f5001f 6e65745f 72696d5f 63727970 746f5f6b 65797374
ffff81017941fa80 2497934843 S Bo:5:033:4 -115 8 = 02000800 6e000200
ffff81017941f0c0 2497934907 S Bi:5:033:3 -115 4096 <
ffff81017941fa80 2497935147 C Bo:5:033:4 0 8 >
ffff81017941f0c0 2497936161 C Bi:5:033:3 0 12 = 00000c00 13020100 aa010000
ffff81017941f0c0 2497942978 S Bo:5:033:4 -115 6 = 02000600 0574
ffff81017941fa80 2497943042 S Bi:5:033:3 -115 4096 <
ffff81017941f0c0 2497943148 C Bo:5:033:4 0 6 >
ffff81017941fa80 2497944161 C Bi:5:033:3 0 12 = 00000c00 13020100 ab010000
ffff81017941fa80 2497944908 S Bi:5:033:3 -115 4096 <
ffff81017941fa80 2497945173 C Bi:5:033:3 0 8 = 02000800 64004600
ffff81017941fa80 2497946971 S Bi:5:033:3 -115 4096 <
ffff81017941fa80 2497948162 C Bi:5:033:3 0 74 = 02004a00 21a4491b b917002b 6e65745f 72696d5f 63727970 746f5f6b 65797374
ffff81017941fa80 2497950489 S Bi:5:033:3 -115 4096 <
ffff81017941f0c0 2497953970 S Bo:5:033:4 -115 8 = 02000800 6e000200
ffff81017941f0c0 2497954149 C Bo:5:033:4 0 8 >
ffff81017941fa80 2497955162 C Bi:5:033:3 0 12 = 00000c00 13020100 ac010000
ffff81017941fa80 2497956844 S Bi:5:033:3 -115 4096 <
ffff81017941f0c0 2497957801 S Bo:5:033:4 -115 6 = 02000600 0577
ffff81017941f0c0 2497958146 C Bo:5:033:4 0 6 >
ffff81017941fa80 2497959161 C Bi:5:033:3 0 12 = 00000c00 13020100 ad010000
ffff81017941fa80 2497961796 S Bi:5:033:3 -115 4096 <
ffff81017941fa80 2497962161 C Bi:5:033:3 0 8 = 02000800 64003e00
ffff81017941fa80 2497964836 S Bi:5:033:3 -115 4096 <
ffff81017941fa80 2497965163 C Bi:5:033:3 0 66 = 02004200 171c491b b91c0023 6e65745f 72696d5f 63727970 746f5f6b 65797374
ffff81017941fa80 2497972603 S Bo:5:033:4 -115 8 = 02000800 6e000200
ffff81017941f0c0 2497972663 S Bi:5:033:3 -115 4096 <
ffff81017941fa80 2497973149 C Bo:5:033:4 0 8 >
ffff81017941f0c0 2497974165 C Bi:5:033:3 0 12 = 00000c00 13020100 ae010000
ffff81017941f0c0 2497975576 S Bi:5:033:3 -115 4096 <
ffff81017941fa80 2497976539 S Bo:5:033:4 -115 6 = 02000600 057a
ffff81017941fa80 2497977146 C Bo:5:033:4 0 6 >
ffff81017941f0c0 2497978164 C Bi:5:033:3 0 12 = 00000c00 13020100 af010000
ffff81017941f0c0 2497979577 S Bi:5:033:3 -115 4096 <
ffff81017941f0c0 2497990163 C Bi:5:033:3 0 8 = 02000800 64002e00
ffff81017941f0c0 2497992874 S Bi:5:033:3 -115 4096 <
ffff81017941f0c0 2497993174 C Bi:5:033:3 0 50 = 02003200 e528491b b9230013 6e65745f 72696d5f 73656375 7265656d 61696c00
ffff81017941f0c0 2497994932 S Bi:5:033:3 -115 4096 <
ffff81017941fa80 2497998853 S Bo:5:033:4 -115 8 = 02000800 6e000200
ffff81017941fa80 2497999150 C Bo:5:033:4 0 8 >
ffff81017941f0c0 2498000166 C Bi:5:033:3 0 12 = 00000c00 13020100 b0010000
ffff81017941f0c0 2498000931 S Bi:5:033:3 -115 4096 <
ffff81017941fa80 2498001880 S Bo:5:033:4 -115 6 = 02000600 0580
ffff81017941fa80 2498002148 C Bo:5:033:4 0 6 >
ffff81017941f0c0 2498003174 C Bi:5:033:3 0 12 = 00000c00 13020100 b1010000
ffff81017941f0c0 2498004782 S Bi:5:033:3 -115 4096 <
ffff81017941f0c0 2498005164 C Bi:5:033:3 0 8 = 02000800 64003700
ffff81017941f0c0 2498008614 S Bi:5:033:3 -115 4096 <
ffff81017941f0c0 2498009219 C Bi:5:033:3 0 59 = 02003b00 088c491b b8a6001c 6e65745f 72696d5f 73656375 7265656d 61696c5f
ffff81017941f0c0 2498014669 S Bo:5:033:4 -115 8 = 02000800 6e000200
ffff81017941fa80 2498014734 S Bi:5:033:3 -115 4096 <
ffff81017941f0c0 2498015151 C Bo:5:033:4 0 8 >
ffff81017941fa80 2498016166 C Bi:5:033:3 0 12 = 00000c00 13020100 b2010000
ffff81017941fa80 2498019459 S Bo:5:033:4 -115 6 = 02000600 0583
ffff81017941f0c0 2498019515 S Bi:5:033:3 -115 4096 <
ffff81017941fa80 2498020150 C Bo:5:033:4 0 6 >
ffff81017941f0c0 2498021167 C Bi:5:033:3 0 12 = 00000c00 13020100 b3010000
ffff81017941f0c0 2498022494 S Bi:5:033:3 -115 4096 <
ffff81017941f0c0 2498023164 C Bi:5:033:3 0 8 = 02000800 64003b00
ffff81017941f0c0 2498026540 S Bi:5:033:3 -115 4096 <
ffff81017941f0c0 2498027172 C Bi:5:033:3 0 63 = 02003f00 3b20491b b8b40020 6e65745f 72696d5f 73656375 7265656d 61696c5f
ffff81017941f0c0 2498029550 S Bi:5:033:3 -115 4096 <
ffff81017941fa80 2498032513 S Bo:5:033:4 -115 8 = 02000800 6e000200
ffff81017941fa80 2498033153 C Bo:5:033:4 0 8 >
ffff81017941f0c0 2498034170 C Bi:5:033:3 0 12 = 00000c00 13020100 b4010000
ffff81017941f0c0 2498035538 S Bo:5:033:4 -115 6 = 02000600 0586
ffff81017941fa80 2498035582 S Bi:5:033:3 -115 4096 <
ffff81017941f0c0 2498036153 C Bo:5:033:4 0 6 >
ffff81017941fa80 2498037174 C Bi:5:033:3 0 12 = 00000c00 13020100 b5010000
ffff81017941fa80 2498042310 S Bi:5:033:3 -115 4096 <
ffff81017941fa80 2498043170 C Bi:5:033:3 0 8 = 02000800 64003a00
ffff81017941fa80 2498044371 S Bi:5:033:3 -115 4096 <
ffff81017941fa80 2498045178 C Bi:5:033:3 0 62 = 02003e00 89d4491b b7a3001f 6e65745f 72696d5f 62625f73 65637572 65656d61
ffff81017941fa80 2498047698 S Bi:5:033:3 -115 4096 <
ffff8101796a2e40 2498051468 S Bo:5:033:4 -115 8 = 02000800 6e000200
ffff8101796a2e40 2498052157 C Bo:5:033:4 0 8 >
ffff81017941fa80 2498053169 C Bi:5:033:3 0 12 = 00000c00 13020100 b6010000
ffff8101796a2e40 2498054343 S Bo:5:033:4 -115 6 = 02000600 0589
ffff8101796a2cc0 2498054365 S Bi:5:033:3 -115 4096 <
ffff8101796a2e40 2498055153 C Bo:5:033:4 0 6 >
ffff8101796a2cc0 2498055173 C Bi:5:033:3 0 12 = 00000c00 13020100 b7010000
ffff8101796a2cc0 2498057973 S Bi:5:033:3 -115 4096 <
ffff8101796a2cc0 2498058167 C Bi:5:033:3 0 8 = 02000800 64003b00
ffff8101796a2cc0 2498062339 S Bi:5:033:3 -115 4096 <
ffff8101796a2cc0 2498063172 C Bi:5:033:3 0 63 = 02003f00 2d90491b b8ba0020 6e65745f 72696d5f 73656375 7265656d 61696c5f
ffff8101796a2cc0 2498067243 S Bo:5:033:4 -115 8 = 02000800 6e000200
ffff8101796a2e40 2498067266 S Bi:5:033:3 -115 4096 <
ffff8101796a2cc0 2498068156 C Bo:5:033:4 0 8 >
ffff8101796a2e40 2498068178 C Bi:5:033:3 0 12 = 00000c00 13020100 b8010000
ffff8101796a2e40 2498070265 S Bo:5:033:4 -115 6 = 02000600 058c
ffff8101796a2cc0 2498070281 S Bi:5:033:3 -115 4096 <
ffff8101796a2e40 2498071152 C Bo:5:033:4 0 6 >
ffff8101796a2cc0 2498071171 C Bi:5:033:3 0 12 = 00000c00 13020100 b9010000
ffff8101796a2cc0 2498074308 S Bi:5:033:3 -115 4096 <
ffff8101796a2cc0 2498075174 C Bi:5:033:3 0 8 = 02000800 64003a00
ffff8101796a2cc0 2498077302 S Bi:5:033:3 -115 4096 <
ffff8101796a2cc0 2498078169 C Bi:5:033:3 0 62 = 02003e00 9a90491b b7bf001f 6e65745f 72696d5f 62625f73 65637572 65656d61
ffff8101796a2cc0 2498079361 S Bi:5:033:3 -115 4096 <
ffff8101796a2e40 2498082355 S Bo:5:033:4 -115 8 = 02000800 6e000200
ffff8101796a2cc0 2498083174 C Bi:5:033:3 0 12 = 00000c00 13020100 ba010000
ffff8101796a2e40 2498083180 C Bo:5:033:4 0 8 >
ffff8101796a2e40 2498084372 S Bo:5:033:4 -115 6 = 02000600 058f
ffff8101796a2cc0 2498084389 S Bi:5:033:3 -115 4096 <
ffff8101796a2e40 2498085155 C Bo:5:033:4 0 6 >
ffff8101796a2cc0 2498085175 C Bi:5:033:3 0 12 = 00000c00 13020100 bb010000
ffff8101796a2cc0 2498089442 S Bi:5:033:3 -115 4096 <
ffff8101796a2cc0 2498098177 C Bi:5:033:3 0 8 = 02000800 64002d00
ffff8101796a2cc0 2498102356 S Bi:5:033:3 -115 4096 <
ffff8101796a2cc0 2498103173 C Bi:5:033:3 0 49 = 02003100 3864491b b9300012 6e65745f 72696d5f 62625f70 67705f6c 69620009
ffff8101796a2cc0 2498104355 S Bi:5:033:3 -115 4096 <
ffff8101796a2e40 2498107354 S Bo:5:033:4 -115 8 = 02000800 6e000200
ffff8101796a2cc0 2498108175 C Bi:5:033:3 0 12 = 00000c00 13020100 bc010000
ffff8101796a2e40 2498108181 C Bo:5:033:4 0 8 >
ffff8101796a2e40 2498110381 S Bo:5:033:4 -115 6 = 02000600 0595
ffff8101796a2cc0 2498110399 S Bi:5:033:3 -115 4096 <
ffff8101796a2e40 2498111155 C Bo:5:033:4 0 6 >
ffff8101796a2cc0 2498112171 C Bi:5:033:3 0 12 = 00000c00 13020100 bd010000
ffff81017941f0c0 2498127417 S Bi:5:033:3 -115 4096 <
ffff81017941f0c0 2498129179 C Bi:5:033:3 0 8 = 02000800 64002f00
ffff81017941f0c0 2498130420 S Bi:5:033:3 -115 4096 <
ffff81017941f0c0 2498131174 C Bi:5:033:3 0 51 = 02003300 ce04491b b9360014 6e65745f 72696d5f 62625f73 6d696d65 5f6c6962
ffff81017941f0c0 2498139227 S Bo:5:033:4 -115 8 = 02000800 6e000200
ffff81017941fcc0 2498139289 S Bi:5:033:3 -115 4096 <
ffff81017941f0c0 2498140160 C Bo:5:033:4 0 8 >
ffff81017941fcc0 2498140183 C Bi:5:033:3 0 12 = 00000c00 13020100 be010000
ffff81017941fcc0 2498142884 S Bo:5:033:4 -115 6 = 02000600 0598
ffff81017941f0c0 2498142943 S Bi:5:033:3 -115 4096 <
ffff81017941fcc0 2498143156 C Bo:5:033:4 0 6 >
ffff81017941f0c0 2498144173 C Bi:5:033:3 0 12 = 00000c00 13020100 bf010000
ffff81017941f0c0 2498145903 S Bi:5:033:3 -115 4096 <
ffff81017941f0c0 2498146173 C Bi:5:033:3 0 8 = 02000800 64003200
ffff81017941f0c0 2498149550 S Bi:5:033:3 -115 4096 <
ffff81017941f0c0 2498150175 C Bi:5:033:3 0 54 = 02003600 537c491b b9140017 6e65745f 72696d5f 62625f6c 6461705f 62726f77
ffff81017941f0c0 2498152600 S Bi:5:033:3 -115 4096 <
ffff81017941fcc0 2498155652 S Bo:5:033:4 -115 8 = 02000800 6e000200
ffff81017941fcc0 2498156160 C Bo:5:033:4 0 8 >
ffff81017941f0c0 2498157190 C Bi:5:033:3 0 12 = 00000c00 13020100 c0010000
ffff81017941f0c0 2498158627 S Bo:5:033:4 -115 6 = 02000600 059b
ffff81017941fcc0 2498158673 S Bi:5:033:3 -115 4096 <
ffff81017941f0c0 2498159158 C Bo:5:033:4 0 6 >
ffff81017941fcc0 2498160173 C Bi:5:033:3 0 12 = 00000c00 13020100 c1010000
ffff81017941fcc0 2498162617 S Bi:5:033:3 -115 4096 <
ffff81017941fcc0 2498163177 C Bi:5:033:3 0 8 = 02000800 64003300
ffff81017941fcc0 2498166234 S Bi:5:033:3 -115 4096 <
ffff81017941fcc0 2498167200 C Bi:5:033:3 0 55 = 02003700 06d0491b b7df0018 6e65745f 72696d5f 62625f6c 6461705f 7265736f
ffff81017941fcc0 2498168431 S Bi:5:033:3 -115 4096 <
ffff81017941f0c0 2498172984 S Bo:5:033:4 -115 8 = 02000800 6e000200
ffff81017941f0c0 2498173160 C Bo:5:033:4 0 8 >
ffff81017941fcc0 2498174174 C Bi:5:033:3 0 12 = 00000c00 13020100 c2010000
ffff81017941fcc0 2498176184 S Bo:5:033:4 -115 6 = 02000600 059e
ffff81017941f0c0 2498176317 S Bi:5:033:3 -115 4096 <
ffff81017941fcc0 2498177158 C Bo:5:033:4 0 6 >
ffff81017941f0c0 2498177178 C Bi:5:033:3 0 12 = 00000c00 13020100 c3010000
ffff81017941f0c0 2498179218 S Bi:5:033:3 -115 4096 <
ffff81017941f0c0 2498180173 C Bi:5:033:3 0 8 = 02000800 64003700
ffff81017941f0c0 2498181378 S Bi:5:033:3 -115 4096 <
ffff81017941f0c0 2498182176 C Bi:5:033:3 0 59 = 02003b00 126c491b b7ea001c 6e65745f 72696d5f 62625f6c 6461705f 7265736f
ffff81017941f0c0 2498187197 S Bi:5:033:3 -115 4096 <
ffff81017941fcc0 2498188189 S Bo:5:033:4 -115 8 = 02000800 6e000200
ffff81017941f0c0 2498189178 C Bi:5:033:3 0 12 = 00000c00 13020100 c4010000
ffff81017941fcc0 2498189182 C Bo:5:033:4 0 8 >
ffff81017941fcc0 2498193916 S Bo:5:033:4 -115 6 = 02000600 05a1
ffff81017941f0c0 2498193967 S Bi:5:033:3 -115 4096 <
ffff81017941fcc0 2498194159 C Bo:5:033:4 0 6 >
ffff81017941f0c0 2498195175 C Bi:5:033:3 0 12 = 00000c00 13020100 c5010000
ffff81017941f0c0 2498197874 S Bi:5:033:3 -115 4096 <
ffff81017941f0c0 2498198226 C Bi:5:033:3 0 8 = 02000800 64003700
ffff81017941f0c0 2498199962 S Bi:5:033:3 -115 4096 <
ffff81017941f0c0 2498200183 C Bi:5:033:3 0 59 = 02003b00 1440491b b7ef001c 6e65745f 72696d5f 62625f6c 6461705f 7265736f
ffff81017941f0c0 2498205945 S Bo:5:033:4 -115 8 = 02000800 6e000200
ffff81017941fcc0 2498206003 S Bi:5:033:3 -115 4096 <
ffff81017941f0c0 2498206163 C Bo:5:033:4 0 8 >
ffff81017941fcc0 2498207175 C Bi:5:033:3 0 12 = 00000c00 13020100 c6010000
ffff81017941fcc0 2498209464 S Bo:5:033:4 -115 6 = 02000600 05a4
ffff81017941f0c0 2498209514 S Bi:5:033:3 -115 4096 <
ffff81017941fcc0 2498210160 C Bo:5:033:4 0 6 >
ffff81017941f0c0 2498211175 C Bi:5:033:3 0 12 = 00000c00 13020100 c7010000
ffff81017941f0c0 2498214134 S Bi:5:033:3 -115 4096 <
ffff81017941f0c0 2498215178 C Bi:5:033:3 0 8 = 02000800 64003600
ffff81017941f0c0 2498219946 S Bi:5:033:3 -115 4096 <
ffff81017941f0c0 2498220193 C Bi:5:033:3 0 58 = 02003a00 246c491b b91e001b 6e65745f 72696d5f 62625f6c 6461705f 62726f77
ffff81017941f0c0 2498221872 S Bi:5:033:3 -115 4096 <
ffff81017941fcc0 2498226795 S Bo:5:033:4 -115 8 = 02000800 6e000200
ffff81017941fcc0 2498227164 C Bo:5:033:4 0 8 >
ffff81017941f0c0 2498228192 C Bi:5:033:3 0 12 = 00000c00 13020100 c8010000
ffff81017941f0c0 2498229827 S Bo:5:033:4 -115 6 = 02000600 05a7
ffff81017941fcc0 2498229877 S Bi:5:033:3 -115 4096 <
ffff81017941f0c0 2498230162 C Bo:5:033:4 0 6 >
ffff81017941fcc0 2498231177 C Bi:5:033:3 0 12 = 00000c00 13020100 c9010000
ffff81017941fcc0 2498233940 S Bi:5:033:3 -115 4096 <
ffff81017941fcc0 2498234179 C Bi:5:033:3 0 8 = 02000800 64003700
ffff81017941fcc0 2498236948 S Bi:5:033:3 -115 4096 <
ffff81017941fcc0 2498237250 C Bi:5:033:3 0 59 = 02003b00 2efc491b b922001c 6e65745f 72696d5f 62625f6c 6461705f 62726f77
ffff81017941fcc0 2498238975 S Bi:5:033:3 -115 4096 <
ffff81017941f0c0 2498242960 S Bo:5:033:4 -115 8 = 02000800 6e000200
ffff81017941f0c0 2498243164 C Bo:5:033:4 0 8 >
ffff81017941fcc0 2498244181 C Bi:5:033:3 0 12 = 00000c00 13020100 ca010000
ffff81017941fcc0 2498245870 S Bo:5:033:4 -115 6 = 02000600 05aa
ffff81017941f0c0 2498245889 S Bi:5:033:3 -115 4096 <
ffff81017941fcc0 2498246163 C Bo:5:033:4 0 6 >
ffff81017941f0c0 2498247178 C Bi:5:033:3 0 12 = 00000c00 13020100 cb010000
ffff81017941f0c0 2498249594 S Bi:5:033:3 -115 4096 <
ffff81017941f0c0 2498250178 C Bi:5:033:3 0 8 = 02000800 64002600
ffff81017941f0c0 2498252996 S Bi:5:033:3 -115 4096 <
ffff81017941f0c0 2498253258 C Bi:5:033:3 0 42 = 02002a00 41c8491b 9c0c000b 6e65745f 72696d5f 786d6c00 09342e35 2e302e31
ffff81017941f0c0 2498258880 S Bo:5:033:4 -115 8 = 02000800 6e000200
ffff81017941fcc0 2498258902 S Bi:5:033:3 -115 4096 <
ffff81017941f0c0 2498259165 C Bo:5:033:4 0 8 >
ffff81017941fcc0 2498260179 C Bi:5:033:3 0 12 = 00000c00 13020100 cc010000
ffff81017941fcc0 2498261996 S Bi:5:033:3 -115 4096 <
ffff81017941f0c0 2498262927 S Bo:5:033:4 -115 6 = 02000600 05ad
ffff81017941f0c0 2498263164 C Bo:5:033:4 0 6 >
ffff81017941fcc0 2498264263 C Bi:5:033:3 0 12 = 00000c00 13020100 cd010000
ffff81017941fcc0 2498265973 S Bi:5:033:3 -115 4096 <
ffff81017941fcc0 2498266181 C Bi:5:033:3 0 8 = 02000800 64002a00
ffff81017941fcc0 2498270459 S Bi:5:033:3 -115 4096 <
ffff81017941fcc0 2498271182 C Bi:5:033:3 0 46 = 02002e00 4510491b 9b50000f 6e65745f 72696d5f 786d6c5f 6f726700 09342e35
ffff81017941fcc0 2498276531 S Bo:5:033:4 -115 8 = 02000800 6e000200
ffff81017941f0c0 2498276553 S Bi:5:033:3 -115 4096 <
ffff81017941fcc0 2498277166 C Bo:5:033:4 0 8 >
ffff81017941f0c0 2498278187 C Bi:5:033:3 0 12 = 00000c00 13020100 ce010000
ffff81017941f0c0 2498279588 S Bo:5:033:4 -115 6 = 02000600 05b0
ffff81017941fcc0 2498279604 S Bi:5:033:3 -115 4096 <
ffff81017941f0c0 2498280164 C Bo:5:033:4 0 6 >
ffff81017941fcc0 2498281182 C Bi:5:033:3 0 12 = 00000c00 13020100 cf010000
ffff81017941fcc0 2498282451 S Bi:5:033:3 -115 4096 <
ffff81017941fcc0 2498283188 C Bi:5:033:3 0 8 = 02000800 64003a00
ffff81017941fcc0 2498285491 S Bi:5:033:3 -115 4096 <
ffff81017941fcc0 2498286181 C Bi:5:033:3 0 62 = 02003e00 4f14491b b324001f 6e65745f 72696d5f 62625f6f 7074696f 6e735f66
ffff81017941fcc0 2498289659 S Bi:5:033:3 -115 4096 <
ffff81017941f0c0 2498292489 S Bo:5:033:4 -115 8 = 02000800 6e000200
ffff81017941f0c0 2498293168 C Bo:5:033:4 0 8 >
ffff81017941fcc0 2498294224 C Bi:5:033:3 0 12 = 00000c00 13020100 d0010000
ffff81017941fcc0 2498295628 S Bo:5:033:4 -115 6 = 02000600 05b3
ffff81017941f0c0 2498295646 S Bi:5:033:3 -115 4096 <
ffff81017941fcc0 2498296167 C Bo:5:033:4 0 6 >
ffff81017941f0c0 2498297184 C Bi:5:033:3 0 12 = 00000c00 13020100 d1010000
ffff81017941f0c0 2498298564 S Bi:5:033:3 -115 4096 <
ffff81017941f0c0 2498299181 C Bi:5:033:3 0 8 = 02000800 64003e00
ffff81017941f0c0 2498302629 S Bi:5:033:3 -115 4096 <
ffff81017941f0c0 2498303260 C Bi:5:033:3 0 66 = 02004200 30ec491b ab450023 6e65745f 72696d5f 7469645f 7265706f 7369746f
ffff81017941f0c0 2498305546 S Bi:5:033:3 -115 4096 <
ffff81017941fcc0 2498308536 S Bo:5:033:4 -115 8 = 02000800 6e000200
ffff81017941fcc0 2498309169 C Bo:5:033:4 0 8 >
ffff81017941f0c0 2498310183 C Bi:5:033:3 0 12 = 00000c00 13020100 d2010000
ffff81017941f0c0 2498314321 S Bo:5:033:4 -115 6 = 02000600 05b6
ffff81017941fcc0 2498314340 S Bi:5:033:3 -115 4096 <
ffff81017941f0c0 2498315168 C Bo:5:033:4 0 6 >
ffff81017941fcc0 2498315191 C Bi:5:033:3 0 12 = 00000c00 13020100 d3010000
ffff81017941fcc0 2498316886 S Bi:5:033:3 -115 4096 <
ffff81017941fcc0 2498317192 C Bi:5:033:3 0 8 = 02000800 64003300
ffff81017941fcc0 2498318889 S Bi:5:033:3 -115 4096 <
ffff81017941fcc0 2498319194 C Bi:5:033:3 0 55 = 02003700 b138491b ab9e0018 6e65745f 72696d5f 7469645f 66617374 4575726f
ffff81017941fcc0 2498324928 S Bo:5:033:4 -115 8 = 02000800 6e000200
ffff81017941f0c0 2498324993 S Bi:5:033:3 -115 4096 <
ffff81017941fcc0 2498325169 C Bo:5:033:4 0 8 >
ffff81017941f0c0 2498326182 C Bi:5:033:3 0 12 = 00000c00 13020100 d4010000
ffff81017941f0c0 2498329456 S Bo:5:033:4 -115 6 = 02000600 05b9
ffff81017941fcc0 2498329501 S Bi:5:033:3 -115 4096 <
ffff81017941f0c0 2498330167 C Bo:5:033:4 0 6 >
ffff81017941fcc0 2498331182 C Bi:5:033:3 0 12 = 00000c00 13020100 d5010000
ffff81017941fcc0 2498332922 S Bi:5:033:3 -115 4096 <
ffff81017941fcc0 2498333259 C Bi:5:033:3 0 8 = 02000800 64003800
ffff81017941fcc0 2498334998 S Bi:5:033:3 -115 4096 <
ffff81017941fcc0 2498335242 C Bi:5:033:3 0 60 = 02003c00 e7c0491b ab71001d 6e65745f 72696d5f 7469645f 62617369 63466173
ffff81017941fcc0 2498337016 S Bi:5:033:3 -115 4096 <
ffff81017941f0c0 2498340787 S Bo:5:033:4 -115 8 = 02000800 6e000200
ffff81017941f0c0 2498341170 C Bo:5:033:4 0 8 >
ffff81017941fcc0 2498342184 C Bi:5:033:3 0 12 = 00000c00 13020100 d6010000
ffff81017941fcc0 2498345857 S Bo:5:033:4 -115 6 = 02000600 05bc
ffff81017941f0c0 2498345919 S Bi:5:033:3 -115 4096 <
ffff81017941fcc0 2498346169 C Bo:5:033:4 0 6 >
ffff81017941f0c0 2498347184 C Bi:5:033:3 0 12 = 00000c00 13020100 d7010000
ffff81017941f0c0 2498349671 S Bi:5:033:3 -115 4096 <
ffff81017941f0c0 2498350187 C Bi:5:033:3 0 8 = 02000800 64003500
ffff81017941f0c0 2498352563 S Bi:5:033:3 -115 4096 <
ffff81017941f0c0 2498353186 C Bi:5:033:3 0 57 = 02003900 1164491b aa4c001a 6e65745f 72696d5f 7469645f 776f7264 735f696e
ffff81017941f0c0 2498357554 S Bo:5:033:4 -115 8 = 02000800 6e000200
ffff81017941fcc0 2498357618 S Bi:5:033:3 -115 4096 <
ffff81017941f0c0 2498358170 C Bo:5:033:4 0 8 >
ffff81017941fcc0 2498359184 C Bi:5:033:3 0 12 = 00000c00 13020100 d8010000
ffff81017941fcc0 2498362358 S Bo:5:033:4 -115 6 = 02000600 05bf
ffff81017941f0c0 2498362417 S Bi:5:033:3 -115 4096 <
ffff81017941fcc0 2498363171 C Bo:5:033:4 0 6 >
ffff81017941f0c0 2498363192 C Bi:5:033:3 0 12 = 00000c00 13020100 d9010000
ffff81017941f0c0 2498365304 S Bi:5:033:3 -115 4096 <
ffff81017941f0c0 2498376192 C Bi:5:033:3 0 8 = 02000800 64004100
ffff81017941f0c0 2498377938 S Bi:5:033:3 -115 4096 <
ffff81017941f0c0 2498378195 C Bi:5:033:3 0 69 = 02004500 76f0491b b3130026 6e65745f 72696d5f 64657669 63655f61 7070735f
ffff81017941f0c0 2498379907 S Bi:5:033:3 -115 4096 <
ffff81017941fcc0 2498383902 S Bo:5:033:4 -115 8 = 02000800 6e000200
ffff81017941fcc0 2498384172 C Bo:5:033:4 0 8 >
ffff81017941f0c0 2498385204 C Bi:5:033:3 0 12 = 00000c00 13020100 da010000
ffff81017941f0c0 2498386915 S Bo:5:033:4 -115 6 = 02000600 05c5
ffff81017941fcc0 2498386960 S Bi:5:033:3 -115 4096 <
ffff81017941f0c0 2498387170 C Bo:5:033:4 0 6 >
ffff81017941fcc0 2498388193 C Bi:5:033:3 0 12 = 00000c00 13020100 db010000
ffff81017941fcc0 2498389922 S Bi:5:033:3 -115 4096 <
ffff81017941fcc0 2498401193 C Bi:5:033:3 0 8 = 02000800 64004f00
ffff81017941fcc0 2498405943 S Bi:5:033:3 -115 4096 <
ffff81017941fcc0 2498406197 C Bi:5:033:3 0 83 = 02005300 226c491b a43b0034 6e65745f 72696d5f 64657669 63655f61 7070735f
ffff81017941fcc0 2498409182 S Bi:5:033:3 -115 4096 <
ffff81017941f0c0 2498411900 S Bo:5:033:4 -115 8 = 02000800 6e000200
ffff81017941f0c0 2498412174 C Bo:5:033:4 0 8 >
ffff81017941fcc0 2498413199 C Bi:5:033:3 0 12 = 00000c00 13020100 dc010000
ffff81017941fcc0 2498415068 S Bo:5:033:4 -115 6 = 02000600 05cb
ffff81017941f0c0 2498415117 S Bi:5:033:3 -115 4096 <
ffff81017941fcc0 2498415178 C Bo:5:033:4 0 6 >
ffff81017941f0c0 2498416197 C Bi:5:033:3 0 12 = 00000c00 13020100 dd010000
ffff81017941f0c0 2498417886 S Bi:5:033:3 -115 4096 <
ffff81017941f0c0 2498435195 C Bi:5:033:3 0 8 = 02000800 64002900
ffff81017941f0c0 2498437872 S Bi:5:033:3 -115 4096 <
ffff81017941f0c0 2498438191 C Bi:5:033:3 0 45 = 02002d00 fb74491b b4b9000e 6e65745f 72696d5f 62625f6d 6d730009 342e352e
ffff81017941f0c0 2498439937 S Bi:5:033:3 -115 4096 <
ffff81017941fcc0 2498444030 S Bo:5:033:4 -115 8 = 02000800 6e000200
ffff81017941fcc0 2498444271 C Bo:5:033:4 0 8 >
ffff81017941f0c0 2498445204 C Bi:5:033:3 0 12 = 00000c00 13020100 de010000
ffff81017941f0c0 2498446956 S Bo:5:033:4 -115 6 = 02000600 05d4
ffff81017941fcc0 2498446998 S Bi:5:033:3 -115 4096 <
ffff81017941f0c0 2498447173 C Bo:5:033:4 0 6 >
ffff81017941fcc0 2498448196 C Bi:5:033:3 0 12 = 00000c00 13020100 df010000
ffff81017941fcc0 2498449856 S Bi:5:033:3 -115 4096 <
ffff81017941fcc0 2498450190 C Bi:5:033:3 0 8 = 02000800 64003e00
ffff81017941fcc0 2498452875 S Bi:5:033:3 -115 4096 <
ffff81017941fcc0 2498453200 C Bi:5:033:3 0 66 = 02004200 7208491b a6660023 6e65745f 72696d5f 706c617a 6d69635f 6d656469
ffff81017941fcc0 2498461694 S Bi:5:033:3 -115 4096 <
ffff81017941f0c0 2498466414 S Bo:5:033:4 -115 8 = 02000800 6e000200
ffff81017941f0c0 2498467178 C Bo:5:033:4 0 8 >
ffff81017941fcc0 2498468196 C Bi:5:033:3 0 12 = 00000c00 13020100 e0010000
ffff81017941fcc0 2498470362 S Bo:5:033:4 -115 6 = 02000600 05d7
ffff81017941f0c0 2498470385 S Bi:5:033:3 -115 4096 <
ffff81017941fcc0 2498471174 C Bo:5:033:4 0 6 >
ffff81017941f0c0 2498472189 C Bi:5:033:3 0 12 = 00000c00 13020100 e1010000
ffff81017941f0c0 2498472904 S Bi:5:033:3 -115 4096 <
ffff81017941f0c0 2498473257 C Bi:5:033:3 0 8 = 02000800 64004200
ffff81017941fcc0 2498475867 S Bi:5:033:3 -115 4096 <
ffff81017941fcc0 2498476191 C Bi:5:033:3 0 70 = 02004600 0688491b a5b00027 6e65745f 72696d5f 706c617a 6d69635f 6d656469
ffff81017941fcc0 2498477981 S Bi:5:033:3 -115 4096 <
ffff81017941fa80 2498481939 S Bo:5:033:4 -115 8 = 02000800 6e000200
ffff81017941fa80 2498482178 C Bo:5:033:4 0 8 >
ffff81017941fcc0 2498483191 C Bi:5:033:3 0 12 = 00000c00 13020100 e2010000
ffff81017941fcc0 2498486859 S Bo:5:033:4 -115 6 = 02000600 05da
ffff81017941fa80 2498486926 S Bi:5:033:3 -115 4096 <
ffff81017941fcc0 2498487177 C Bo:5:033:4 0 6 >
ffff81017941fa80 2498488201 C Bi:5:033:3 0 12 = 00000c00 13020100 e3010000
ffff81017941fa80 2498489889 S Bi:5:033:3 -115 4096 <
ffff81017941fa80 2498490191 C Bi:5:033:3 0 8 = 02000800 64003f00
ffff81017941fa80 2498494000 S Bi:5:033:3 -115 4096 <
ffff81017941fa80 2498495198 C Bi:5:033:3 0 67 = 02004300 2758491b a7840024 6e65745f 72696d5f 706c617a 6d69635f 6d656469
ffff81017941fa80 2498496955 S Bi:5:033:3 -115 4096 <
ffff81017941fcc0 2498500917 S Bo:5:033:4 -115 8 = 02000800 6e000200
ffff81017941fcc0 2498501178 C Bo:5:033:4 0 8 >
ffff81017941fa80 2498502192 C Bi:5:033:3 0 12 = 00000c00 13020100 e4010000
ffff81017941fa80 2498506014 S Bo:5:033:4 -115 6 = 02000600 05dd
ffff81017941fcc0 2498506071 S Bi:5:033:3 -115 4096 <
ffff81017941fa80 2498506242 C Bo:5:033:4 0 6 >
ffff81017941fcc0 2498507200 C Bi:5:033:3 0 12 = 00000c00 13020100 e5010000
ffff81017941fcc0 2498508903 S Bi:5:033:3 -115 4096 <
ffff81017941fcc0 2498509194 C Bi:5:033:3 0 8 = 02000800 64004400
ffff81017941fcc0 2498513944 S Bi:5:033:3 -115 4096 <
ffff81017941fcc0 2498514203 C Bi:5:033:3 0 72 = 02004800 1bd0491b a7a50029 6e65745f 72696d5f 64657669 63655f61 7070735f
ffff81017941fcc0 2498521863 S Bo:5:033:4 -115 8 = 02000800 6e000200
ffff81017941fa80 2498522086 S Bi:5:033:3 -115 4096 <
ffff81017941fcc0 2498522180 C Bo:5:033:4 0 8 >
ffff81017941fa80 2498523205 C Bi:5:033:3 0 12 = 00000c00 13020100 e6010000
ffff81017941fa80 2498525284 S Bo:5:033:4 -115 6 = 02000600 05e0
ffff81017941fcc0 2498525336 S Bi:5:033:3 -115 4096 <
ffff81017941fa80 2498526180 C Bo:5:033:4 0 6 >
ffff81017941fcc0 2498526202 C Bi:5:033:3 0 12 = 00000c00 13020100 e7010000
ffff81017941fcc0 2498529603 S Bi:5:033:3 -115 4096 <
ffff81017941fcc0 2498564202 C Bi:5:033:3 0 8 = 02000800 64002300
ffff81017941fcc0 2498567191 S Bi:5:033:3 -115 4096 <
ffff81017941fcc0 2498568198 C Bi:5:033:3 0 39 = 02002700 8b98480d e5e70008 576f7264 546f476f 0009312e 3030302e 30383000
ffff81017941fcc0 2498572138 S Bo:5:033:4 -115 8 = 02000800 6e000200
ffff81017941fa80 2498572202 S Bi:5:033:3 -115 4096 <
ffff81017941fcc0 2498572258 C Bo:5:033:4 0 8 >
ffff81017941fa80 2498573199 C Bi:5:033:3 0 12 = 00000c00 13020100 e8010000
ffff81017941fa80 2498575217 S Bi:5:033:3 -115 4096 <
ffff81017941fcc0 2498576145 S Bo:5:033:4 -115 6 = 02000600 05f2
ffff81017941fa80 2498577200 C Bi:5:033:3 0 12 = 00000c00 13020100 e9010000
ffff81017941fcc0 2498577205 C Bo:5:033:4 0 6 >
ffff81017941fcc0 2498579193 S Bi:5:033:3 -115 4096 <
ffff81017941fcc0 2498580197 C Bi:5:033:3 0 8 = 02000800 64002b00
ffff81017941fcc0 2498582211 S Bi:5:033:3 -115 4096 <
ffff81017941fcc0 2498583198 C Bi:5:033:3 0 47 = 02002f00 0530480d e5f20010 576f7264 546f476f 5265736f 75726365 0009312e
ffff81017941fcc0 2498585193 S Bi:5:033:3 -115 4096 <
ffff81017941fa80 2498588206 S Bo:5:033:4 -115 8 = 02000800 6e000200
ffff81017941fcc0 2498589208 C Bi:5:033:3 0 12 = 00000c00 13020100 ea010000
ffff81017941fa80 2498589213 C Bo:5:033:4 0 8 >
ffff81017941fa80 2498593856 S Bo:5:033:4 -115 6 = 02000600 05f5
ffff81017941fcc0 2498593970 S Bi:5:033:3 -115 4096 <
ffff81017941fa80 2498594183 C Bo:5:033:4 0 6 >
ffff81017941fcc0 2498595198 C Bi:5:033:3 0 12 = 00000c00 13020100 eb010000
ffff81017941fcc0 2498598279 S Bi:5:033:3 -115 4096 <
ffff81017941fcc0 2498599199 C Bi:5:033:3 0 8 = 02000800 64002f00
ffff81017941fcc0 2498600928 S Bi:5:033:3 -115 4096 <
ffff81017941fcc0 2498601207 C Bi:5:033:3 0 51 = 02003300 14c4480d e5f30014 576f7264 546f476f 5265736f 75726365 5f5f656e
ffff81017941fcc0 2498606834 S Bo:5:033:4 -115 8 = 02000800 6e000200
ffff81017941fa80 2498606897 S Bi:5:033:3 -115 4096 <
ffff81017941fcc0 2498607184 C Bo:5:033:4 0 8 >
ffff81017941fa80 2498608200 C Bi:5:033:3 0 12 = 00000c00 13020100 ec010000
ffff81017941fa80 2498609866 S Bo:5:033:4 -115 6 = 02000600 05f8
ffff81017941fcc0 2498609910 S Bi:5:033:3 -115 4096 <
ffff81017941fa80 2498610183 C Bo:5:033:4 0 6 >
ffff81017941fcc0 2498611199 C Bi:5:033:3 0 12 = 00000c00 13020100 ed010000
ffff81017941fcc0 2498614024 S Bi:5:033:3 -115 4096 <
ffff81017941fcc0 2498643207 C Bi:5:033:3 0 8 = 02000800 64002800
ffff81017941fcc0 2498646864 S Bi:5:033:3 -115 4096 <
ffff81017941fcc0 2498647203 C Bi:5:033:3 0 44 = 02002c00 9a28480d e5d5000d 536c6964 6573686f 77546f47 6f000931 2e303030
ffff81017941fcc0 2498650489 S Bi:5:033:3 -115 4096 <
ffff81017941fa80 2498658380 S Bo:5:033:4 -115 8 = 02000800 6e000200
ffff81017941fcc0 2498659205 C Bi:5:033:3 0 12 = 00000c00 13020100 ee010000
ffff81017941fa80 2498659209 C Bo:5:033:4 0 8 >
ffff81017941fa80 2498662054 S Bo:5:033:4 -115 6 = 02000600 0607
ffff81017941fcc0 2498662112 S Bi:5:033:3 -115 4096 <
ffff81017941fa80 2498662187 C Bo:5:033:4 0 6 >
ffff81017941fcc0 2498663203 C Bi:5:033:3 0 12 = 00000c00 13020100 ef010000
ffff81017941fcc0 2498666898 S Bi:5:033:3 -115 4096 <
ffff81017941fcc0 2498667205 C Bi:5:033:3 0 8 = 02000800 64003000
ffff81017941fcc0 2498668942 S Bi:5:033:3 -115 4096 <
ffff81017941fcc0 2498669205 C Bi:5:033:3 0 52 = 02003400 0550480d e5de0015 536c6964 6573686f 77546f47 6f526573 6f757263
ffff81017941fcc0 2498679913 S Bo:5:033:4 -115 8 = 02000800 6e000200
ffff81017941fa80 2498679977 S Bi:5:033:3 -115 4096 <
ffff81017941fcc0 2498680189 C Bo:5:033:4 0 8 >
ffff81017941fa80 2498681241 C Bi:5:033:3 0 12 = 00000c00 13020100 f0010000
ffff81017941fa80 2498682941 S Bo:5:033:4 -115 6 = 02000600 060a
ffff81017941fcc0 2498682983 S Bi:5:033:3 -115 4096 <
ffff81017941fa80 2498683187 C Bo:5:033:4 0 6 >
ffff81017941fcc0 2498684202 C Bi:5:033:3 0 12 = 00000c00 13020100 f1010000
ffff81017941fcc0 2498685984 S Bi:5:033:3 -115 4096 <
ffff81017941fcc0 2498686204 C Bi:5:033:3 0 8 = 02000800 64003400
ffff81017941fcc0 2498689479 S Bi:5:033:3 -115 4096 <
ffff81017941fcc0 2498690207 C Bi:5:033:3 0 56 = 02003800 0cc4480d e5df0019 536c6964 6573686f 77546f47 6f526573 6f757263
ffff81017941fcc0 2498700444 S Bo:5:033:4 -115 8 = 02000800 6e000200
ffff81017941fa80 2498700503 S Bi:5:033:3 -115 4096 <
ffff81017941fcc0 2498702190 C Bo:5:033:4 0 8 >
ffff81017941fa80 2498702212 C Bi:5:033:3 0 12 = 00000c00 13020100 f2010000
ffff81017941fa80 2498705819 S Bo:5:033:4 -115 6 = 02000600 060d
ffff81017941fcc0 2498705870 S Bi:5:033:3 -115 4096 <
ffff81017941fa80 2498706189 C Bo:5:033:4 0 6 >
ffff81017941fcc0 2498707204 C Bi:5:033:3 0 12 = 00000c00 13020100 f3010000
ffff81017941fcc0 2498709591 S Bi:5:033:3 -115 4096 <
ffff81017941fcc0 2498779214 C Bi:5:033:3 0 8 = 02000800 64002900
ffff81017941fcc0 2498781872 S Bi:5:033:3 -115 4096 <
ffff81017941fcc0 2498782210 C Bi:5:033:3 0 45 = 02002d00 885c480d e5bf000e 446f6373 546f476f 436f6d6d 6f6e0009 312e3030
ffff81017941fcc0 2498784010 S Bi:5:033:3 -115 4096 <
ffff81017941fa80 2498793597 S Bo:5:033:4 -115 8 = 02000800 6e000200
ffff81017941fa80 2498794195 C Bo:5:033:4 0 8 >
ffff81017941fcc0 2498795209 C Bi:5:033:3 0 12 = 00000c00 13020100 f4010000
ffff81017941fcc0 2498798827 S Bo:5:033:4 -115 6 = 02000600 062e
ffff81017941fa80 2498798887 S Bi:5:033:3 -115 4096 <
ffff81017941fcc0 2498799196 C Bo:5:033:4 0 6 >
ffff81017941fa80 2498800209 C Bi:5:033:3 0 12 = 00000c00 13020100 f5010000
ffff81017941fa80 2498800897 S Bi:5:033:3 -115 4096 <
ffff81017941fa80 2498801275 C Bi:5:033:3 0 8 = 02000800 64003100
ffff81017941fa80 2498802959 S Bi:5:033:3 -115 4096 <
ffff81017941fa80 2498803261 C Bi:5:033:3 0 53 = 02003500 0810480d e5ca0016 446f6373 546f476f 436f6d6d 6f6e5265 736f7572
ffff81017941fa80 2498812924 S Bo:5:033:4 -115 8 = 02000800 6e000200
ffff81017941fcc0 2498812985 S Bi:5:033:3 -115 4096 <
ffff81017941fa80 2498814198 C Bo:5:033:4 0 8 >
ffff81017941fcc0 2498814222 C Bi:5:033:3 0 12 = 00000c00 13020100 f6010000
ffff81017941fcc0 2498816004 S Bi:5:033:3 -115 4096 <
ffff81017941fa80 2498816905 S Bo:5:033:4 -115 6 = 02000600 0631
ffff81017941fa80 2498817195 C Bo:5:033:4 0 6 >
ffff81017941fcc0 2498818213 C Bi:5:033:3 0 12 = 00000c00 13020100 f7010000
ffff81017941fcc0 2498821092 S Bi:5:033:3 -115 4096 <
ffff81017941fcc0 2498822213 C Bi:5:033:3 0 8 = 02000800 64003500
ffff81017941fcc0 2498825914 S Bi:5:033:3 -115 4096 <
ffff81017941fcc0 2498826213 C Bi:5:033:3 0 57 = 02003900 2acc480d e5cc001a 446f6373 546f476f 436f6d6d 6f6e5265 736f7572
ffff81017941fcc0 2498827958 S Bi:5:033:3 -115 4096 <
ffff81017941fa80 2498836792 S Bo:5:033:4 -115 8 = 02000800 6e000200
ffff81017941fa80 2498837198 C Bo:5:033:4 0 8 >
ffff81017941fcc0 2498838216 C Bi:5:033:3 0 12 = 00000c00 13020100 f8010000
ffff81017941fcc0 2498841444 S Bo:5:033:4 -115 6 = 02000600 0634
ffff81017941fa80 2498841503 S Bi:5:033:3 -115 4096 <
ffff81017941fcc0 2498842198 C Bo:5:033:4 0 6 >
ffff81017941fa80 2498843211 C Bi:5:033:3 0 12 = 00000c00 13020100 f9010000
ffff81017941fa80 2498845824 S Bi:5:033:3 -115 4096 <
ffff81017941fa80 2498846214 C Bi:5:033:3 0 8 = 02000800 64002f00
ffff81017941fa80 2498849677 S Bi:5:033:3 -115 4096 <
ffff81017941fa80 2498850214 C Bi:5:033:3 0 51 = 02003300 17b4480d e5f50014 576f7264 546f476f 5265736f 75726365 5f5f6672
ffff8101796a2cc0 2498856302 S Bi:5:033:3 -115 4096 <
ffff8101796a2e40 2498857093 S Bo:5:033:4 -115 8 = 02000800 6e000200
ffff8101796a2cc0 2498858219 C Bi:5:033:3 0 12 = 00000c00 13020100 fa010000
ffff8101796a2e40 2498858227 C Bo:5:033:4 0 8 >
ffff8101796a2e40 2498862353 S Bo:5:033:4 -115 6 = 02000600 0637
ffff8101796a2cc0 2498862408 S Bi:5:033:3 -115 4096 <
ffff8101796a2e40 2498863201 C Bo:5:033:4 0 6 >
ffff8101796a2cc0 2498863225 C Bi:5:033:3 0 12 = 00000c00 13020100 fb010000
ffff8101796a2cc0 2498866439 S Bi:5:033:3 -115 4096 <
ffff8101796a2cc0 2498867214 C Bi:5:033:3 0 8 = 02000800 64003400
ffff8101796a2cc0 2498869386 S Bi:5:033:3 -115 4096 <
ffff8101796a2cc0 2498870213 C Bi:5:033:3 0 56 = 02003800 0ea4480d e5e10019 536c6964 6573686f 77546f47 6f526573 6f757263
ffff8101796a2cc0 2498874541 S Bo:5:033:4 -115 8 = 02000800 6e000200
ffff8101796a2e40 2498874606 S Bi:5:033:3 -115 4096 <
ffff8101796a2cc0 2498875202 C Bo:5:033:4 0 8 >
ffff8101796a2e40 2498876214 C Bi:5:033:3 0 12 = 00000c00 13020100 fc010000
ffff8101796a2e40 2498877418 S Bo:5:033:4 -115 6 = 02000600 063a
ffff8101796a2cc0 2498877461 S Bi:5:033:3 -115 4096 <
ffff8101796a2e40 2498878197 C Bo:5:033:4 0 6 >
ffff8101796a2cc0 2498878219 C Bi:5:033:3 0 12 = 00000c00 13020100 fd010000
ffff8101796a2cc0 2498882412 S Bi:5:033:3 -115 4096 <
ffff8101796a2cc0 2498883217 C Bi:5:033:3 0 8 = 02000800 64003500
ffff8101796a2cc0 2498887371 S Bi:5:033:3 -115 4096 <
ffff8101796a2cc0 2498888216 C Bi:5:033:3 0 57 = 02003900 2df8480d e5ce001a 446f6373 546f476f 436f6d6d 6f6e5265 736f7572
ffff8101796a2cc0 2498889452 S Bi:5:033:3 -115 4096 <
ffff8101796a2e40 2498893419 S Bo:5:033:4 -115 8 = 02000800 6e000200
ffff8101796a2cc0 2498894218 C Bi:5:033:3 0 12 = 00000c00 13020100 fe010000
ffff8101796a2e40 2498894224 C Bo:5:033:4 0 8 >
ffff8101796a2e40 2498895323 S Bo:5:033:4 -115 6 = 02000600 063d
ffff8101796a2cc0 2498895341 S Bi:5:033:3 -115 4096 <
ffff8101796a2e40 2498896198 C Bo:5:033:4 0 6 >
ffff8101796a2cc0 2498896218 C Bi:5:033:3 0 12 = 00000c00 13020100 ff010000
ffff8101796a2cc0 2498897347 S Bi:5:033:3 -115 4096 <
ffff8101796a2cc0 2498917223 C Bi:5:033:3 0 8 = 02000800 64002d00
ffff81017941fa80 2498919122 S Bi:5:033:3 -115 4096 <
ffff81017941fa80 2498920292 C Bi:5:033:3 0 49 = 02003100 38e4491b b3ef0012 6e65745f 72696d5f 62625f64 6f637669 65770009
ffff81017941fa80 2498931051 S Bo:5:033:4 -115 8 = 02000800 6e000200
ffff81017941fcc0 2498931116 S Bi:5:033:3 -115 4096 <
ffff81017941fa80 2498931203 C Bo:5:033:4 0 8 >
ffff81017941fcc0 2498932218 C Bi:5:033:3 0 12 = 00000c00 13020100 00020000
ffff81017941fcc0 2498934081 S Bo:5:033:4 -115 6 = 02000600 0646
ffff81017941fa80 2498934139 S Bi:5:033:3 -115 4096 <
ffff81017941fcc0 2498934202 C Bo:5:033:4 0 6 >
ffff81017941fa80 2498935217 C Bi:5:033:3 0 12 = 00000c00 13020100 01020000
ffff81017941fa80 2498937926 S Bi:5:033:3 -115 4096 <
ffff81017941fa80 2498938220 C Bi:5:033:3 0 8 = 02000800 64003c00
ffff81017941fa80 2498942967 S Bi:5:033:3 -115 4096 <
ffff81017941fa80 2498943298 C Bi:5:033:3 0 64 = 02004000 13b8491b b41a0021 6e65745f 72696d5f 62625f62 726f7773 65725f70
ffff81017941fa80 2498946793 S Bi:5:033:3 -115 4096 <
ffff81017941fcc0 2498953954 S Bo:5:033:4 -115 8 = 02000800 6e000200
ffff81017941fcc0 2498954205 C Bo:5:033:4 0 8 >
ffff81017941fa80 2498955219 C Bi:5:033:3 0 12 = 00000c00 13020100 02020000
ffff81017941fa80 2498957049 S Bi:5:033:3 -115 4096 <
ffff81017941fcc0 2498957989 S Bo:5:033:4 -115 6 = 02000600 0649
ffff81017941fcc0 2498958203 C Bo:5:033:4 0 6 >
ffff81017941fa80 2498959219 C Bi:5:033:3 0 12 = 00000c00 13020100 03020000
ffff81017941fa80 2498962978 S Bi:5:033:3 -115 4096 <
ffff81017941fa80 2498963222 C Bi:5:033:3 0 8 = 02000800 64003200
ffff81017941fa80 2498965411 S Bi:5:033:3 -115 4096 <
ffff81017941fa80 2498966221 C Bi:5:033:3 0 54 = 02003600 3f84491b a74e0017 6e65745f 72696d5f 62625f64 6f637669 6577696d
ffff81017941fa80 2498968992 S Bi:5:033:3 -115 4096 <
ffff81017941fcc0 2498975475 S Bo:5:033:4 -115 8 = 02000800 6e000200
ffff81017941fcc0 2498976206 C Bo:5:033:4 0 8 >
ffff81017941fa80 2498977225 C Bi:5:033:3 0 12 = 00000c00 13020100 04020000
ffff81017941fa80 2498978364 S Bo:5:033:4 -115 6 = 02000600 064c
ffff81017941fcc0 2498978404 S Bi:5:033:3 -115 4096 <
ffff81017941fa80 2498979203 C Bo:5:033:4 0 6 >
ffff81017941fcc0 2498979223 C Bi:5:033:3 0 12 = 00000c00 13020100 05020000
ffff81017941fcc0 2498982253 S Bi:5:033:3 -115 4096 <
ffff81017941fcc0 2499014228 C Bi:5:033:3 0 8 = 02000800 64002c00
ffff81017941fcc0 2499018886 S Bi:5:033:3 -115 4096 <
ffff81017941fcc0 2499019224 C Bi:5:033:3 0 48 = 02003000 82204804 f9440014 6e65745f 72696d5f 62625f71 6d5f676f 6f676c65
ffff81017941fcc0 2499021956 S Bi:5:033:3 -115 4096 <
ffff81017941fa80 2499029897 S Bo:5:033:4 -115 8 = 02000800 6e000200
ffff81017941fa80 2499030209 C Bo:5:033:4 0 8 >
ffff81017941fcc0 2499031223 C Bi:5:033:3 0 12 = 00000c00 13020100 06020000
ffff81017941fcc0 2499033958 S Bo:5:033:4 -115 6 = 02000600 065b
ffff81017941fa80 2499034007 S Bi:5:033:3 -115 4096 <
ffff81017941fcc0 2499034207 C Bo:5:033:4 0 6 >
ffff81017941fa80 2499035222 C Bi:5:033:3 0 12 = 00000c00 13020100 07020000
ffff81017941fa80 2499037919 S Bi:5:033:3 -115 4096 <
ffff81017941fa80 2499038223 C Bi:5:033:3 0 8 = 02000800 64003800
ffff81017941fa80 2499040961 S Bi:5:033:3 -115 4096 <
ffff81017941fa80 2499041253 C Bi:5:033:3 0 60 = 02003c00 67444804 f95b0020 6e65745f 72696d5f 62625f71 6d5f676f 6f676c65
ffff81017941fa80 2499051479 S Bo:5:033:4 -115 8 = 02000800 6e000200
ffff81017941fcc0 2499051543 S Bi:5:033:3 -115 4096 <
ffff81017941fa80 2499052211 C Bo:5:033:4 0 8 >
ffff81017941fcc0 2499053229 C Bi:5:033:3 0 12 = 00000c00 13020100 08020000
ffff81017941fcc0 2499054603 S Bo:5:033:4 -115 6 = 02000600 065e
ffff81017941fa80 2499054647 S Bi:5:033:3 -115 4096 <
ffff81017941fcc0 2499055208 C Bo:5:033:4 0 6 >
ffff81017941fa80 2499056225 C Bi:5:033:3 0 12 = 00000c00 13020100 09020000
ffff81017941fa80 2499057503 S Bi:5:033:3 -115 4096 <
ffff81017941fa80 2499058224 C Bi:5:033:3 0 8 = 02000800 64003800
ffff8101796a2e40 2499063531 S Bi:5:033:3 -115 4096 <
ffff8101796a2e40 2499064229 C Bi:5:033:3 0 60 = 02003c00 74044804 f9600020 6e65745f 72696d5f 62625f71 6d5f676f 6f676c65
ffff8101796a2e40 2499070745 S Bi:5:033:3 -115 4096 <
ffff8101796a2480 2499071712 S Bo:5:033:4 -115 8 = 02000800 6e000200
ffff8101796a2480 2499072212 C Bo:5:033:4 0 8 >
ffff8101796a2e40 2499073225 C Bi:5:033:3 0 12 = 00000c00 13020100 0a020000
ffff8101796a2e40 2499074583 S Bo:5:033:4 -115 6 = 02000600 0661
ffff8101796a2480 2499074602 S Bi:5:033:3 -115 4096 <
ffff8101796a2e40 2499075209 C Bo:5:033:4 0 6 >
ffff8101796a2480 2499076224 C Bi:5:033:3 0 12 = 00000c00 13020100 0b020000
ffff8101796a2480 2499077551 S Bi:5:033:3 -115 4096 <
ffff8101796a2480 2499078226 C Bi:5:033:3 0 8 = 02000800 64002a00
ffff8101796a2480 2499082407 S Bi:5:033:3 -115 4096 <
ffff8101796a2480 2499083226 C Bi:5:033:3 0 46 = 02002e00 6cc4491b b4d0000f 6e65745f 72696d5f 62625f68 656c7000 09342e35
ffff8101796a2480 2499087597 S Bi:5:033:3 -115 4096 <
ffff8101796a2e40 2499090576 S Bo:5:033:4 -115 8 = 02000800 6e000200
ffff8101796a2e40 2499091215 C Bo:5:033:4 0 8 >
ffff8101796a2480 2499092226 C Bi:5:033:3 0 12 = 00000c00 13020100 0c020000
ffff8101796a2480 2499093600 S Bo:5:033:4 -115 6 = 02000600 0664
ffff8101796a2e40 2499093645 S Bi:5:033:3 -115 4096 <
ffff8101796a2480 2499094211 C Bo:5:033:4 0 6 >
ffff8101796a2e40 2499095225 C Bi:5:033:3 0 12 = 00000c00 13020100 0d020000
ffff8101796a2e40 2499096486 S Bi:5:033:3 -115 4096 <
ffff8101796a2e40 2499116234 C Bi:5:033:3 0 8 = 02000800 64003c00
ffff8101796a2e40 2499119390 S Bi:5:033:3 -115 4096 <
ffff8101796a2e40 2499120231 C Bi:5:033:3 0 64 = 02004000 ea38491b b6810021 6e65745f 72696d5f 62625f68 656c705f 67707273
ffff8101796a2e40 2499121299 S Bi:5:033:3 -115 4096 <
ffff8101796a2480 2499132619 S Bo:5:033:4 -115 8 = 02000800 6e000200
ffff8101796a2480 2499133217 C Bo:5:033:4 0 8 >
ffff8101796a2e40 2499134230 C Bi:5:033:3 0 12 = 00000c00 13020100 0e020000
ffff8101796a2e40 2499135255 S Bo:5:033:4 -115 6 = 02000600 066d
ffff8101796a2480 2499135272 S Bi:5:033:3 -115 4096 <
ffff8101796a2e40 2499136212 C Bo:5:033:4 0 6 >
ffff8101796a2480 2499136232 C Bi:5:033:3 0 12 = 00000c00 13020100 0f020000
ffff8101796a2480 2499138295 S Bi:5:033:3 -115 4096 <
ffff8101796a2480 2499158233 C Bi:5:033:3 0 8 = 02000800 64003c00
ffff8101796a2480 2499161416 S Bi:5:033:3 -115 4096 <
ffff8101796a2480 2499162232 C Bi:5:033:3 0 64 = 02004000 302c491b b6880021 6e65745f 72696d5f 62625f68 656c705f 67707273
ffff8101796a2480 2499164471 S Bi:5:033:3 -115 4096 <
ffff8101796a2e40 2499168308 S Bo:5:033:4 -115 8 = 02000800 6e000200
ffff8101796a2480 2499169238 C Bi:5:033:3 0 12 = 00000c00 13020100 10020000
ffff8101796a2e40 2499169247 C Bo:5:033:4 0 8 >
ffff8101796a2e40 2499171307 S Bo:5:033:4 -115 6 = 02000600 0676
ffff8101796a2480 2499171362 S Bi:5:033:3 -115 4096 <
ffff8101796a2e40 2499172216 C Bo:5:033:4 0 6 >
ffff8101796a2480 2499172240 C Bi:5:033:3 0 12 = 00000c00 13020100 11020000
ffff8101796a2480 2499174341 S Bi:5:033:3 -115 4096 <
ffff8101796a2480 2499175232 C Bi:5:033:3 0 8 = 02000800 64003d00
ffff8101796a2480 2499178394 S Bi:5:033:3 -115 4096 <
ffff8101796a2480 2499179231 C Bi:5:033:3 0 65 = 02004100 43b4491b b7410022 6e65745f 72696d5f 62625f68 656c705f 77697a61
ffff8101796a2480 2499184392 S Bo:5:033:4 -115 8 = 02000800 6e000200
ffff8101796a2e40 2499184452 S Bi:5:033:3 -115 4096 <
ffff8101796a2480 2499185221 C Bo:5:033:4 0 8 >
ffff8101796a2e40 2499185249 C Bi:5:033:3 0 12 = 00000c00 13020100 12020000
ffff8101796a2e40 2499186344 S Bo:5:033:4 -115 6 = 02000600 0679
ffff8101796a2480 2499186390 S Bi:5:033:3 -115 4096 <
ffff8101796a2e40 2499187214 C Bo:5:033:4 0 6 >
ffff8101796a2480 2499187236 C Bi:5:033:3 0 12 = 00000c00 13020100 13020000
ffff8101796a2480 2499190356 S Bi:5:033:3 -115 4096 <
ffff8101796a2480 2499223239 C Bi:5:033:3 0 8 = 02000800 64002900
ffff8101796a2480 2499226349 S Bi:5:033:3 -115 4096 <
ffff8101796a2480 2499227233 C Bi:5:033:3 0 45 = 02002d00 80804804 f9370011 6e65745f 72696d5f 62625f71 6d5f6963 71000632
ffff8101796a2480 2499228383 S Bi:5:033:3 -115 4096 <
ffff8101796a2e40 2499233265 S Bo:5:033:4 -115 8 = 02000800 6e000200
ffff8101796a2480 2499234237 C Bi:5:033:3 0 12 = 00000c00 13020100 14020000
ffff8101796a2e40 2499234243 C Bo:5:033:4 0 8 >
ffff8101796a2e40 2499238338 S Bo:5:033:4 -115 6 = 02000600 0688
ffff8101796a2480 2499238356 S Bi:5:033:3 -115 4096 <
ffff8101796a2e40 2499239218 C Bo:5:033:4 0 6 >
ffff8101796a2480 2499239238 C Bi:5:033:3 0 12 = 00000c00 13020100 15020000
ffff8101796a2480 2499242403 S Bi:5:033:3 -115 4096 <
ffff8101796a2480 2499243234 C Bi:5:033:3 0 8 = 02000800 64003500
ffff8101796a2480 2499246443 S Bi:5:033:3 -115 4096 <
ffff8101796a2480 2499247235 C Bi:5:033:3 0 57 = 02003900 55544804 f94c001d 6e65745f 72696d5f 62625f71 6d5f6963 715f7265
ffff8101796a2480 2499248371 S Bi:5:033:3 -115 4096 <
ffff8101796a2e40 2499253269 S Bo:5:033:4 -115 8 = 02000800 6e000200
ffff8101796a2480 2499254239 C Bi:5:033:3 0 12 = 00000c00 13020100 16020000
ffff8101796a2e40 2499254245 C Bo:5:033:4 0 8 >
ffff81017941fcc0 2499260522 S Bi:5:033:3 -115 4096 <
ffff81017941f0c0 2499261411 S Bo:5:033:4 -115 6 = 02000600 068b
ffff81017941fcc0 2499262240 C Bi:5:033:3 0 12 = 00000c00 13020100 17020000
ffff81017941f0c0 2499262245 C Bo:5:033:4 0 6 >
ffff81017941f0c0 2499266147 S Bi:5:033:3 -115 4096 <
ffff81017941f0c0 2499267238 C Bi:5:033:3 0 8 = 02000800 64003500
ffff81017941f0c0 2499271578 S Bi:5:033:3 -115 4096 <
ffff81017941f0c0 2499272294 C Bi:5:033:3 0 57 = 02003900 5e504804 f951001d 6e65745f 72696d5f 62625f71 6d5f6963 715f7265
ffff81017941f0c0 2499274610 S Bi:5:033:3 -115 4096 <
ffff81017941fcc0 2499284560 S Bo:5:033:4 -115 8 = 02000800 6e000200
ffff81017941fcc0 2499285223 C Bo:5:033:4 0 8 >
ffff81017941f0c0 2499286239 C Bi:5:033:3 0 12 = 00000c00 13020100 18020000
ffff81017941f0c0 2499287586 S Bo:5:033:4 -115 6 = 02000600 068e
ffff81017941fcc0 2499287629 S Bi:5:033:3 -115 4096 <
ffff81017941f0c0 2499288221 C Bo:5:033:4 0 6 >
ffff81017941fcc0 2499289237 C Bi:5:033:3 0 12 = 00000c00 13020100 19020000
ffff81017941fcc0 2499291705 S Bi:5:033:3 -115 4096 <
ffff81017941fcc0 2499346246 C Bi:5:033:3 0 8 = 02000800 64002900
ffff81017941fcc0 2499349702 S Bi:5:033:3 -115 4096 <
ffff81017941fcc0 2499350256 C Bi:5:033:3 0 45 = 02002d00 32d4491b b4e1000e 6e65745f 72696d5f 62625f6c 62730009 342e352e
ffff8101796a2cc0 2499355578 S Bo:5:033:4 -115 8 = 02000800 6e000200
ffff8101796a2e40 2499355683 S Bi:5:033:3 -115 4096 <
ffff8101796a2cc0 2499356230 C Bo:5:033:4 0 8 >
ffff8101796a2e40 2499357246 C Bi:5:033:3 0 12 = 00000c00 13020100 1a020000
ffff8101796a2e40 2499358634 S Bo:5:033:4 -115 6 = 02000600 06a6
ffff8101796a2cc0 2499358682 S Bi:5:033:3 -115 4096 <
ffff8101796a2e40 2499359226 C Bo:5:033:4 0 6 >
ffff8101796a2cc0 2499360239 C Bi:5:033:3 0 12 = 00000c00 13020100 1b020000
ffff8101796a2cc0 2499361441 S Bi:5:033:3 -115 4096 <
ffff8101796a2cc0 2499362242 C Bi:5:033:3 0 8 = 02000800 64002d00
ffff8101796a2cc0 2499366460 S Bi:5:033:3 -115 4096 <
ffff8101796a2cc0 2499367244 C Bi:5:033:3 0 49 = 02003100 6a30491b abe10012 6e65745f 72696d5f 62625f6c 62735f61 70690009
ffff8101796a2cc0 2499368560 S Bi:5:033:3 -115 4096 <
ffff8101796a2e40 2499372339 S Bo:5:033:4 -115 8 = 02000800 6e000200
ffff8101796a2cc0 2499373248 C Bi:5:033:3 0 12 = 00000c00 13020100 1c020000
ffff8101796a2e40 2499373257 C Bo:5:033:4 0 8 >
ffff8101796a2e40 2499378357 S Bo:5:033:4 -115 6 = 02000600 06a9
ffff8101796a2cc0 2499378410 S Bi:5:033:3 -115 4096 <
ffff8101796a2e40 2499379228 C Bo:5:033:4 0 6 >
ffff8101796a2cc0 2499379252 C Bi:5:033:3 0 12 = 00000c00 13020100 1d020000
ffff8101796a2cc0 2499382435 S Bi:5:033:3 -115 4096 <
ffff8101796a2cc0 2499383245 C Bi:5:033:3 0 8 = 02000800 64003500
ffff8101796a2cc0 2499387378 S Bi:5:033:3 -115 4096 <
ffff8101796a2cc0 2499388243 C Bi:5:033:3 0 57 = 02003900 2650491b ace0001a 6e65745f 72696d5f 62625f6c 62735f72 65736f75
ffff8101796a2cc0 2499390520 S Bi:5:033:3 -115 4096 <
ffff8101796a2e40 2499393450 S Bo:5:033:4 -115 8 = 02000800 6e000200
ffff8101796a2e40 2499394232 C Bo:5:033:4 0 8 >
ffff8101796a2cc0 2499395248 C Bi:5:033:3 0 12 = 00000c00 13020100 1e020000
ffff8101796a2cc0 2499398750 S Bo:5:033:4 -115 6 = 02000600 06ac
ffff8101796a2e40 2499398809 S Bi:5:033:3 -115 4096 <
ffff8101796a2cc0 2499399228 C Bo:5:033:4 0 6 >
ffff8101796a2e40 2499400242 C Bi:5:033:3 0 12 = 00000c00 13020100 1f020000
ffff8101796a2e40 2499402362 S Bi:5:033:3 -115 4096 <
ffff8101796a2e40 2499403243 C Bi:5:033:3 0 8 = 02000800 64003500
ffff8101796a2e40 2499406429 S Bi:5:033:3 -115 4096 <
ffff8101796a2e40 2499407249 C Bi:5:033:3 0 57 = 02003900 2954491b ace7001a 6e65745f 72696d5f 62625f6c 62735f72 65736f75
ffff8101796a2e40 2499411309 S Bo:5:033:4 -115 8 = 02000800 6e000200
ffff8101796a2cc0 2499411332 S Bi:5:033:3 -115 4096 <
ffff8101796a2e40 2499412234 C Bo:5:033:4 0 8 >
ffff8101796a2cc0 2499412256 C Bi:5:033:3 0 12 = 00000c00 13020100 20020000
ffff8101796a2cc0 2499414331 S Bo:5:033:4 -115 6 = 02000600 06af
ffff8101796a2e40 2499414355 S Bi:5:033:3 -115 4096 <
ffff8101796a2cc0 2499415230 C Bo:5:033:4 0 6 >
ffff8101796a2e40 2499415252 C Bi:5:033:3 0 12 = 00000c00 13020100 21020000
ffff8101796a2e40 2499416349 S Bi:5:033:3 -115 4096 <
ffff8101796a2e40 2499417244 C Bi:5:033:3 0 8 = 02000800 64003500
ffff8101796a2e40 2499419417 S Bi:5:033:3 -115 4096 <
ffff8101796a2e40 2499420245 C Bi:5:033:3 0 57 = 02003900 05fc483c 6159001b 636f6d5f 62625f6d 64735f72 756e7469 6d655f6c
ffff8101796a2e40 2499426340 S Bo:5:033:4 -115 8 = 02000800 6e000200
ffff8101796a2cc0 2499426363 S Bi:5:033:3 -115 4096 <
ffff8101796a2e40 2499427233 C Bo:5:033:4 0 8 >
ffff8101796a2cc0 2499427255 C Bi:5:033:3 0 12 = 00000c00 13020100 22020000
ffff8101796a2cc0 2499429368 S Bo:5:033:4 -115 6 = 02000600 06b2
ffff8101796a2e40 2499429385 S Bi:5:033:3 -115 4096 <
ffff8101796a2cc0 2499430229 C Bo:5:033:4 0 6 >
ffff8101796a2e40 2499430249 C Bi:5:033:3 0 12 = 00000c00 13020100 23020000
ffff8101796a2e40 2499434311 S Bi:5:033:3 -115 4096 <
ffff8101796a2e40 2499435251 C Bi:5:033:3 0 8 = 02000800 64002d00
ffff8101796a2e40 2499437342 S Bi:5:033:3 -115 4096 <
ffff8101796a2e40 2499438248 C Bi:5:033:3 0 49 = 02003100 0814483c 619f0013 6e65745f 72696d5f 6d64735f 72756e74 696d6500
ffff8101796a2e40 2499441311 S Bi:5:033:3 -115 4096 <
ffff8101796a2cc0 2499445310 S Bo:5:033:4 -115 8 = 02000800 6e000200
ffff8101796a2e40 2499446252 C Bi:5:033:3 0 12 = 00000c00 13020100 24020000
ffff8101796a2cc0 2499446261 C Bo:5:033:4 0 8 >
ffff8101796a2cc0 2499449599 S Bo:5:033:4 -115 6 = 02000600 06b5
ffff8101796a2e40 2499449671 S Bi:5:033:3 -115 4096 <
ffff8101796a2cc0 2499450230 C Bo:5:033:4 0 6 >
ffff8101796a2e40 2499451245 C Bi:5:033:3 0 12 = 00000c00 13020100 25020000
ffff8101796a2e40 2499454369 S Bi:5:033:3 -115 4096 <
ffff8101796a2e40 2499524257 C Bi:5:033:3 0 8 = 02000800 64003100
ffff8101796a2e40 2499526332 S Bi:5:033:3 -115 4096 <
ffff8101796a2e40 2499527253 C Bi:5:033:3 0 53 = 02003500 4f6c483c 615d0017 6e65745f 72696d5f 6d64735f 72756e74 696d655f
ffff8101796a2e40 2499531234 S Bo:5:033:4 -115 8 = 02000800 6e000200
ffff8101796a2cc0 2499531257 S Bi:5:033:3 -115 4096 <
ffff8101796a2e40 2499532238 C Bo:5:033:4 0 8 >
ffff8101796a2cc0 2499532261 C Bi:5:033:3 0 12 = 00000c00 13020100 26020000
ffff8101796a2cc0 2499534261 S Bo:5:033:4 -115 6 = 02000600 06d3
ffff8101796a2e40 2499534281 S Bi:5:033:3 -115 4096 <
ffff8101796a2cc0 2499535237 C Bo:5:033:4 0 6 >
ffff8101796a2e40 2499535258 C Bi:5:033:3 0 12 = 00000c00 13020100 27020000
ffff8101796a2e40 2499536286 S Bi:5:033:3 -115 4096 <
ffff8101796a2e40 2499537251 C Bi:5:033:3 0 8 = 02000800 64003600
ffff8101796a2e40 2499539341 S Bi:5:033:3 -115 4096 <
ffff8101796a2e40 2499540251 C Bi:5:033:3 0 58 = 02003a00 0764483c 6193001c 6e65745f 72696d5f 6d64735f 72756e74 696d655f
ffff8101796a2e40 2499544262 S Bo:5:033:4 -115 8 = 02000800 6e000200
ffff8101796a2cc0 2499544334 S Bi:5:033:3 -115 4096 <
ffff8101796a2e40 2499545239 C Bo:5:033:4 0 8 >
ffff8101796a2cc0 2499545264 C Bi:5:033:3 0 12 = 00000c00 13020100 28020000
ffff8101796a2cc0 2499546317 S Bo:5:033:4 -115 6 = 02000600 06d6
ffff8101796a2e40 2499546358 S Bi:5:033:3 -115 4096 <
ffff8101796a2cc0 2499547235 C Bo:5:033:4 0 6 >
ffff8101796a2e40 2499547257 C Bi:5:033:3 0 12 = 00000c00 13020100 29020000
ffff8101796a2e40 2499549315 S Bi:5:033:3 -115 4096 <
ffff8101796a2e40 2499550251 C Bi:5:033:3 0 8 = 02000800 64003a00
ffff8101796a2e40 2499555323 S Bi:5:033:3 -115 4096 <
ffff8101796a2e40 2499556258 C Bi:5:033:3 0 62 = 02003e00 1e60483c 61970020 6e65745f 72696d5f 6d64735f 72756e74 696d655f
ffff8101796a2e40 2499557408 S Bi:5:033:3 -115 4096 <
ffff8101796a2cc0 2499561385 S Bo:5:033:4 -115 8 = 02000800 6e000200
ffff8101796a2e40 2499562258 C Bi:5:033:3 0 12 = 00000c00 13020100 2a020000
ffff8101796a2cc0 2499562264 C Bo:5:033:4 0 8 >
ffff8101796a2cc0 2499566323 S Bo:5:033:4 -115 6 = 02000600 06d9
ffff8101796a2e40 2499566344 S Bi:5:033:3 -115 4096 <
ffff8101796a2cc0 2499567240 C Bo:5:033:4 0 6 >
ffff8101796a2e40 2499567261 C Bi:5:033:3 0 12 = 00000c00 13020100 2b020000
ffff8101796a2e40 2499569369 S Bi:5:033:3 -115 4096 <
ffff8101796a2e40 2499570253 C Bi:5:033:3 0 8 = 02000800 64003400
ffff8101796a2e40 2499574433 S Bi:5:033:3 -115 4096 <
ffff8101796a2e40 2499575258 C Bi:5:033:3 0 56 = 02003800 0850483c 6155001a 6e65745f 72696d5f 6d64735f 72756e74 696d655f
ffff8101796a2e40 2499580221 S Bo:5:033:4 -115 8 = 02000800 6e000200
ffff8101796a2cc0 2499580243 S Bi:5:033:3 -115 4096 <
ffff8101796a2e40 2499581242 C Bo:5:033:4 0 8 >
ffff8101796a2cc0 2499581264 C Bi:5:033:3 0 12 = 00000c00 13020100 2c020000
ffff8101796a2cc0 2499586398 S Bo:5:033:4 -115 6 = 02000600 06dc
ffff8101796a2e40 2499586419 S Bi:5:033:3 -115 4096 <
ffff8101796a2cc0 2499587238 C Bo:5:033:4 0 6 >
ffff8101796a2e40 2499587259 C Bi:5:033:3 0 12 = 00000c00 13020100 2d020000
ffff8101796a2e40 2499589313 S Bi:5:033:3 -115 4096 <
ffff8101796a2e40 2499590253 C Bi:5:033:3 0 8 = 02000800 64003a00
ffff8101796a2e40 2499594449 S Bi:5:033:3 -115 4096 <
ffff8101796a2e40 2499595259 C Bi:5:033:3 0 62 = 02003e00 2310483c 619b0020 6e65745f 72696d5f 6d64735f 72756e74 696d655f
ffff8101796a2e40 2499596547 S Bi:5:033:3 -115 4096 <
ffff8101796a2cc0 2499602320 S Bo:5:033:4 -115 8 = 02000800 6e000200
ffff8101796a2e40 2499603262 C Bi:5:033:3 0 12 = 00000c00 13020100 2e020000
ffff8101796a2cc0 2499603270 C Bo:5:033:4 0 8 >
ffff8101796a2cc0 2499606015 S Bo:5:033:4 -115 6 = 02000600 06df
ffff8101796a2e40 2499606070 S Bi:5:033:3 -115 4096 <
ffff8101796a2cc0 2499606239 C Bo:5:033:4 0 6 >
ffff8101796a2e40 2499607254 C Bi:5:033:3 0 12 = 00000c00 13020100 2f020000
ffff8101796a2e40 2499609602 S Bi:5:033:3 -115 4096 <
ffff8101796a2e40 2499610254 C Bi:5:033:3 0 8 = 02000800 64003500
ffff8101796a2e40 2499615345 S Bi:5:033:3 -115 4096 <
ffff8101796a2e40 2499616261 C Bi:5:033:3 0 57 = 02003900 052c483c 615b001b 636f6d5f 62625f6d 64735f64 65666175 6c745f6c
ffff8101796a2e40 2499617400 S Bi:5:033:3 -115 4096 <
ffff8101796a2cc0 2499621761 S Bo:5:033:4 -115 8 = 02000800 6e000200
ffff8101796a2cc0 2499622246 C Bo:5:033:4 0 8 >
ffff8101796a2e40 2499623259 C Bi:5:033:3 0 12 = 00000c00 13020100 30020000
ffff8101796a2e40 2499624306 S Bo:5:033:4 -115 6 = 02000600 06e2
ffff8101796a2cc0 2499624325 S Bi:5:033:3 -115 4096 <
ffff8101796a2e40 2499625240 C Bo:5:033:4 0 6 >
ffff8101796a2cc0 2499625260 C Bi:5:033:3 0 12 = 00000c00 13020100 31020000
ffff8101796a2cc0 2499626333 S Bi:5:033:3 -115 4096 <
ffff8101796a2cc0 2499627257 C Bi:5:033:3 0 8 = 02000800 64002e00
ffff8101796a2cc0 2499629398 S Bi:5:033:3 -115 4096 <
ffff8101796a2cc0 2499630257 C Bi:5:033:3 0 50 = 02003200 5378491b a5d10013 6e65745f 72696d5f 62625f6d 656d6f5f 61707000
ffff8101796a2cc0 2499634440 S Bo:5:033:4 -115 8 = 02000800 6e000200
ffff8101796a2e40 2499634464 S Bi:5:033:3 -115 4096 <
ffff8101796a2cc0 2499635246 C Bo:5:033:4 0 8 >
ffff8101796a2e40 2499635268 C Bi:5:033:3 0 12 = 00000c00 13020100 32020000
ffff8101796a2e40 2499636333 S Bo:5:033:4 -115 6 = 02000600 06e5
ffff8101796a2cc0 2499636395 S Bi:5:033:3 -115 4096 <
ffff8101796a2e40 2499637243 C Bo:5:033:4 0 6 >
ffff8101796a2cc0 2499638257 C Bi:5:033:3 0 12 = 00000c00 13020100 33020000
ffff8101796a2cc0 2499639350 S Bi:5:033:3 -115 4096 <
ffff8101796a2cc0 2499677267 C Bi:5:033:3 0 8 = 02000800 64002900
ffff81017941fcc0 2499679035 S Bi:5:033:3 -115 4096 <
ffff81017941fcc0 2499679268 C Bi:5:033:3 0 45 = 02002d00 eeb04804 f9bb0011 6e65745f 72696d5f 62625f71 6d5f6d73 6e000632
ffff81017941fcc0 2499689828 S Bo:5:033:4 -115 8 = 02000800 6e000200
ffff81017941f0c0 2499689881 S Bi:5:033:3 -115 4096 <
ffff81017941fcc0 2499691246 C Bo:5:033:4 0 8 >
ffff81017941f0c0 2499691268 C Bi:5:033:3 0 12 = 00000c00 13020100 34020000
ffff81017941f0c0 2499693934 S Bo:5:033:4 -115 6 = 02000600 06f4
ffff81017941fcc0 2499693951 S Bi:5:033:3 -115 4096 <
ffff81017941f0c0 2499694244 C Bo:5:033:4 0 6 >
ffff81017941fcc0 2499695259 C Bi:5:033:3 0 12 = 00000c00 13020100 35020000
ffff81017941fcc0 2499700093 S Bi:5:033:3 -115 4096 <
ffff81017941fcc0 2499700266 C Bi:5:033:3 0 8 = 02000800 64003500
ffff81017941fcc0 2499704140 S Bi:5:033:3 -115 4096 <
ffff81017941fcc0 2499705265 C Bi:5:033:3 0 57 = 02003900 58c44804 f9d4001d 6e65745f 72696d5f 62625f71 6d5f6d73 6e5f7265
ffff81017941fcc0 2499709562 S Bi:5:033:3 -115 4096 <
ffff81017941f0c0 2499720090 S Bo:5:033:4 -115 8 = 02000800 6e000200
ffff81017941f0c0 2499720251 C Bo:5:033:4 0 8 >
ffff81017941fcc0 2499721263 C Bi:5:033:3 0 12 = 00000c00 13020100 36020000
ffff81017941fcc0 2499722982 S Bo:5:033:4 -115 6 = 02000600 06f7
ffff81017941f0c0 2499723028 S Bi:5:033:3 -115 4096 <
ffff81017941fcc0 2499723246 C Bo:5:033:4 0 6 >
ffff81017941f0c0 2499724262 C Bi:5:033:3 0 12 = 00000c00 13020100 37020000
ffff81017941f0c0 2499725082 S Bi:5:033:3 -115 4096 <
ffff81017941f0c0 2499725269 C Bi:5:033:3 0 8 = 02000800 64003500
ffff81017941f0c0 2499727127 S Bi:5:033:3 -115 4096 <
ffff81017941f0c0 2499727262 C Bi:5:033:3 0 57 = 02003900 62a04804 f9d9001d 6e65745f 72696d5f 62625f71 6d5f6d73 6e5f7265
ffff81017941f0c0 2499739182 S Bi:5:033:3 -115 4096 <
ffff81017941fcc0 2499739728 S Bo:5:033:4 -115 8 = 02000800 6e000200
ffff81017941fcc0 2499740252 C Bo:5:033:4 0 8 >
ffff81017941f0c0 2499741267 C Bi:5:033:3 0 12 = 00000c00 13020100 38020000
ffff81017941f0c0 2499742758 S Bo:5:033:4 -115 6 = 02000600 06fa
ffff81017941fcc0 2499742802 S Bi:5:033:3 -115 4096 <
ffff81017941f0c0 2499743247 C Bo:5:033:4 0 6 >
ffff81017941fcc0 2499744262 C Bi:5:033:3 0 12 = 00000c00 13020100 39020000
ffff81017941fcc0 2499745669 S Bi:5:033:3 -115 4096 <
ffff81017941fcc0 2499746262 C Bi:5:033:3 0 8 = 02000800 64003400
ffff81017941fcc0 2499749682 S Bi:5:033:3 -115 4096 <
ffff81017941fcc0 2499750265 C Bi:5:033:3 0 56 = 02003800 7634491b b8110019 6e65745f 72696d5f 62625f70 61737377 6f72646b
ffff81017941fcc0 2499760727 S Bi:5:033:3 -115 4096 <
ffff81017941f0c0 2499761643 S Bo:5:033:4 -115 8 = 02000800 6e000200
ffff81017941f0c0 2499762250 C Bo:5:033:4 0 8 >
ffff81017941fcc0 2499763267 C Bi:5:033:3 0 12 = 00000c00 13020100 3a020000
ffff81017941fcc0 2499765996 S Bo:5:033:4 -115 6 = 02000600 06fd
ffff81017941f0c0 2499766050 S Bi:5:033:3 -115 4096 <
ffff81017941fcc0 2499766249 C Bo:5:033:4 0 6 >
ffff81017941f0c0 2499767265 C Bi:5:033:3 0 12 = 00000c00 13020100 3b020000
ffff81017941f0c0 2499769483 S Bi:5:033:3 -115 4096 <
ffff81017941f0c0 2499770264 C Bi:5:033:3 0 8 = 02000800 64003d00
ffff81017941f0c0 2499773885 S Bi:5:033:3 -115 4096 <
ffff81017941f0c0 2499774266 C Bi:5:033:3 0 65 = 02004100 0704491b b8140022 6e65745f 72696d5f 62625f70 61737377 6f72646b
ffff81017941f0c0 2499776391 S Bi:5:033:3 -115 4096 <
ffff81017941fcc0 2499785823 S Bo:5:033:4 -115 8 = 02000800 6e000200
ffff81017941fcc0 2499786252 C Bo:5:033:4 0 8 >
ffff81017941f0c0 2499787268 C Bi:5:033:3 0 12 = 00000c00 13020100 3c020000
ffff81017941f0c0 2499788877 S Bo:5:033:4 -115 6 = 02000600 0700
ffff81017941fcc0 2499788896 S Bi:5:033:3 -115 4096 <
ffff81017941f0c0 2499789250 C Bo:5:033:4 0 6 >
ffff81017941fcc0 2499790264 C Bi:5:033:3 0 12 = 00000c00 13020100 3d020000
ffff81017941fcc0 2499792937 S Bi:5:033:3 -115 4096 <
ffff81017941fcc0 2499793291 C Bi:5:033:3 0 8 = 02000800 64004100
ffff81017941fcc0 2499794959 S Bi:5:033:3 -115 4096 <
ffff81017941fcc0 2499795276 C Bi:5:033:3 0 69 = 02004500 0e74491b b81f0026 6e65745f 72696d5f 62625f70 61737377 6f72646b
ffff81017941fcc0 2499809175 S Bo:5:033:4 -115 8 = 02000800 6e000200
ffff81017941f0c0 2499809195 S Bi:5:033:3 -115 4096 <
ffff81017941fcc0 2499810252 C Bo:5:033:4 0 8 >
ffff81017941f0c0 2499810274 C Bi:5:033:3 0 12 = 00000c00 13020100 3e020000
ffff81017941f0c0 2499813958 S Bo:5:033:4 -115 6 = 02000600 0703
ffff81017941fcc0 2499813977 S Bi:5:033:3 -115 4096 <
ffff81017941f0c0 2499814252 C Bo:5:033:4 0 6 >
ffff81017941fcc0 2499815266 C Bi:5:033:3 0 12 = 00000c00 13020100 3f020000
ffff81017941fcc0 2499817913 S Bi:5:033:3 -115 4096 <
ffff81017941fcc0 2499818267 C Bi:5:033:3 0 8 = 02000800 64004100
ffff81017941fcc0 2499824587 S Bi:5:033:3 -115 4096 <
ffff81017941fcc0 2499825280 C Bi:5:033:3 0 69 = 02004500 1000491b b8250026 6e65745f 72696d5f 62625f70 61737377 6f72646b
ffff81017941fcc0 2499834436 S Bo:5:033:4 -115 8 = 02000800 6e000200
ffff81017941f0c0 2499834499 S Bi:5:033:3 -115 4096 <
ffff81017941fcc0 2499835261 C Bo:5:033:4 0 8 >
ffff81017941f0c0 2499835282 C Bi:5:033:3 0 12 = 00000c00 13020100 40020000
ffff81017941f0c0 2499837461 S Bo:5:033:4 -115 6 = 02000600 0706
ffff81017941fcc0 2499837537 S Bi:5:033:3 -115 4096 <
ffff81017941f0c0 2499838252 C Bo:5:033:4 0 6 >
ffff81017941fcc0 2499838273 C Bi:5:033:3 0 12 = 00000c00 13020100 41020000
ffff81017941fcc0 2499841871 S Bi:5:033:3 -115 4096 <
ffff81017941fcc0 2499869277 C Bi:5:033:3 0 8 = 02000800 64002f00
ffff81017941fcc0 2499873870 S Bi:5:033:3 -115 4096 <
ffff81017941fcc0 2499874272 C Bi:5:033:3 0 51 = 02003300 2d08491b 9ccd0014 6e65745f 72696d5f 62625f70 686f6e65 5f617069
ffff81017941fcc0 2499875896 S Bi:5:033:3 -115 4096 <
ffff81017941f0c0 2499884914 S Bo:5:033:4 -115 8 = 02000800 6e000200
ffff81017941f0c0 2499885257 C Bo:5:033:4 0 8 >
ffff81017941fcc0 2499886275 C Bi:5:033:3 0 12 = 00000c00 13020100 42020000
ffff81017941fcc0 2499888389 S Bo:5:033:4 -115 6 = 02000600 0712
ffff81017941f0c0 2499888470 S Bi:5:033:3 -115 4096 <
ffff81017941fcc0 2499889254 C Bo:5:033:4 0 6 >
ffff81017941f0c0 2499889274 C Bi:5:033:3 0 12 = 00000c00 13020100 43020000
ffff81017941f0c0 2499893866 S Bi:5:033:3 -115 4096 <
ffff81017941f0c0 2499905279 C Bi:5:033:3 0 8 = 02000800 64002f00
ffff81017941f0c0 2499907076 S Bi:5:033:3 -115 4096 <
ffff81017941f0c0 2499907309 C Bi:5:033:3 0 51 = 02003300 207c491b 9cf50014 6e65745f 72696d5f 62625f70 686f6e65 5f617070
ffff8101796a2e40 2499920031 S Bo:5:033:4 -115 8 = 02000800 6e000200
ffff8101796a2480 2499920054 S Bi:5:033:3 -115 4096 <
ffff8101796a2e40 2499921262 C Bo:5:033:4 0 8 >
ffff8101796a2480 2499921285 C Bi:5:033:3 0 12 = 00000c00 13020100 44020000
ffff8101796a2480 2499926047 S Bo:5:033:4 -115 6 = 02000600 0718
ffff8101796a2e40 2499926067 S Bi:5:033:3 -115 4096 <
ffff8101796a2480 2499926257 C Bo:5:033:4 0 6 >
ffff8101796a2e40 2499927273 C Bi:5:033:3 0 12 = 00000c00 13020100 45020000
ffff8101796a2e40 2499929656 S Bi:5:033:3 -115 4096 <
ffff8101796a2e40 2499930277 C Bi:5:033:3 0 8 = 02000800 64003a00
ffff8101796a2e40 2499931676 S Bi:5:033:3 -115 4096 <
ffff8101796a2e40 2499932273 C Bi:5:033:3 0 62 = 02003e00 0ae0491b 9d0a001f 6e65745f 72696d5f 62625f70 686f6e65 5f63616c
ffff8101796a2e40 2499933777 S Bi:5:033:3 -115 4096 <
ffff8101796a2480 2499936598 S Bo:5:033:4 -115 8 = 02000800 6e000200
ffff8101796a2480 2499937265 C Bo:5:033:4 0 8 >
ffff8101796a2e40 2499938278 C Bi:5:033:3 0 12 = 00000c00 13020100 46020000
ffff8101796a2e40 2499939579 S Bo:5:033:4 -115 6 = 02000600 071b
ffff8101796a2480 2499939634 S Bi:5:033:3 -115 4096 <
ffff8101796a2e40 2499940262 C Bo:5:033:4 0 6 >
ffff8101796a2480 2499941277 C Bi:5:033:3 0 12 = 00000c00 13020100 47020000
ffff81017941f0c0 2499951025 S Bi:5:033:3 -115 4096 <
ffff81017941f0c0 2499951278 C Bi:5:033:3 0 8 = 02000800 64003800
ffff81017941f0c0 2499955069 S Bi:5:033:3 -115 4096 <
ffff81017941f0c0 2499955276 C Bi:5:033:3 0 60 = 02003c00 5908491b 9bc4001d 6e65745f 72696d5f 706c6174 666f726d 5f726573
ffff81017941f0c0 2499958220 S Bi:5:033:3 -115 4096 <
ffff81017941fcc0 2499971256 S Bo:5:033:4 -115 8 = 02000800 6e000200
ffff81017941f0c0 2499972276 C Bi:5:033:3 0 12 = 00000c00 13020100 48020000
ffff81017941fcc0 2499972281 C Bo:5:033:4 0 8 >
ffff81017941fcc0 2499974047 S Bo:5:033:4 -115 6 = 02000600 071e
ffff81017941f0c0 2499974112 S Bi:5:033:3 -115 4096 <
ffff81017941fcc0 2499974261 C Bo:5:033:4 0 6 >
ffff81017941f0c0 2499975273 C Bi:5:033:3 0 12 = 00000c00 13020100 49020000
ffff81017941f0c0 2499978320 S Bi:5:033:3 -115 4096 <
ffff81017941f0c0 2499979274 C Bi:5:033:3 0 8 = 02000800 64003b00
ffff81017941f0c0 2499981433 S Bi:5:033:3 -115 4096 <
ffff81017941f0c0 2499982276 C Bi:5:033:3 0 63 = 02003f00 1954491b 9b8d0020 6e65745f 72696d5f 706c6174 666f726d 5f696d5f
ffff81017941f0c0 2499983461 S Bi:5:033:3 -115 4096 <
ffff81017941fcc0 2499988457 S Bo:5:033:4 -115 8 = 02000800 6e000200
ffff81017941f0c0 2499989277 C Bi:5:033:3 0 12 = 00000c00 13020100 4a020000
ffff81017941fcc0 2499989282 C Bo:5:033:4 0 8 >
ffff81017941fcc0 2499991333 S Bo:5:033:4 -115 6 = 02000600 0721
ffff81017941f0c0 2499991392 S Bi:5:033:3 -115 4096 <
ffff81017941fcc0 2499992260 C Bo:5:033:4 0 6 >
ffff81017941f0c0 2499992278 C Bi:5:033:3 0 12 = 00000c00 13020100 4b020000
ffff81017941f0c0 2499993355 S Bi:5:033:3 -115 4096 <
ffff81017941f0c0 2499994274 C Bi:5:033:3 0 8 = 02000800 64003c00
ffff81017941f0c0 2499995489 S Bi:5:033:3 -115 4096 <
ffff81017941f0c0 2499996275 C Bi:5:033:3 0 64 = 02004000 bb10491b 9c650021 6e65745f 72696d5f 706c6174 666f726d 61707073
ffff81017941f0c0 2500002325 S Bo:5:033:4 -115 8 = 02000800 6e000200
ffff81017941fcc0 2500002389 S Bi:5:033:3 -115 4096 <
ffff81017941f0c0 2500003263 C Bo:5:033:4 0 8 >
ffff81017941fcc0 2500003282 C Bi:5:033:3 0 12 = 00000c00 13020100 4c020000
ffff81017941fcc0 2500004400 S Bo:5:033:4 -115 6 = 02000600 0724
ffff81017941f0c0 2500004446 S Bi:5:033:3 -115 4096 <
ffff81017941fcc0 2500005261 C Bo:5:033:4 0 6 >
ffff81017941f0c0 2500005278 C Bi:5:033:3 0 12 = 00000c00 13020100 4d020000
ffff81017941f0c0 2500006367 S Bi:5:033:3 -115 4096 <
ffff81017941f0c0 2500029282 C Bi:5:033:3 0 8 = 02000800 64002d00
ffff81017941f0c0 2500030501 S Bi:5:033:3 -115 4096 <
ffff81017941f0c0 2500031278 C Bi:5:033:3 0 49 = 02003100 b21c491b 9d2e0012 6e65745f 72696d5f 65636d61 73637269 70740009
ffff81017941f0c0 2500032352 S Bi:5:033:3 -115 4096 <
ffff81017941fcc0 2500039889 S Bo:5:033:4 -115 8 = 02000800 6e000200
ffff81017941fcc0 2500040266 C Bo:5:033:4 0 8 >
ffff81017941f0c0 2500041289 C Bi:5:033:3 0 12 = 00000c00 13020100 4e020000
ffff81017941f0c0 2500042953 S Bo:5:033:4 -115 6 = 02000600 072d
ffff81017941fcc0 2500042996 S Bi:5:033:3 -115 4096 <
ffff81017941f0c0 2500043263 C Bo:5:033:4 0 6 >
ffff81017941fcc0 2500044277 C Bi:5:033:3 0 12 = 00000c00 13020100 4f020000
ffff81017941fcc0 2500045831 S Bi:5:033:3 -115 4096 <
ffff81017941fcc0 2500046278 C Bi:5:033:3 0 8 = 02000800 64003600
ffff81017941fcc0 2500049707 S Bi:5:033:3 -115 4096 <
ffff81017941fcc0 2500050283 C Bi:5:033:3 0 58 = 02003a00 06d0491b 9d38001b 6e65745f 72696d5f 65636d61 73637269 70745f72
ffff81017941fcc0 2500057555 S Bo:5:033:4 -115 8 = 02000800 6e000200
ffff81017941f0c0 2500057618 S Bi:5:033:3 -115 4096 <
ffff81017941fcc0 2500058266 C Bo:5:033:4 0 8 >
ffff81017941f0c0 2500059278 C Bi:5:033:3 0 12 = 00000c00 13020100 50020000
ffff81017941f0c0 2500062336 S Bo:5:033:4 -115 6 = 02000600 0730
ffff81017941fcc0 2500062397 S Bi:5:033:3 -115 4096 <
ffff81017941f0c0 2500063266 C Bo:5:033:4 0 6 >
ffff81017941fcc0 2500063285 C Bi:5:033:3 0 12 = 00000c00 13020100 51020000
ffff81017941fcc0 2500065383 S Bi:5:033:3 -115 4096 <
ffff81017941fcc0 2500066279 C Bi:5:033:3 0 8 = 02000800 64003a00
ffff81017941fcc0 2500067491 S Bi:5:033:3 -115 4096 <
ffff81017941fcc0 2500068281 C Bi:5:033:3 0 62 = 02003e00 1468491b 9d3b001f 6e65745f 72696d5f 65636d61 73637269 70745f72
ffff81017941fcc0 2500069314 S Bi:5:033:3 -115 4096 <
ffff81017941f0c0 2500079230 S Bo:5:033:4 -115 8 = 02000800 6e000200
ffff81017941fcc0 2500080284 C Bi:5:033:3 0 12 = 00000c00 13020100 52020000
ffff81017941f0c0 2500080289 C Bo:5:033:4 0 8 >
ffff81017941f0c0 2500082214 S Bo:5:033:4 -115 6 = 02000600 0733
ffff81017941fcc0 2500082258 S Bi:5:033:3 -115 4096 <
ffff81017941f0c0 2500083265 C Bo:5:033:4 0 6 >
ffff81017941fcc0 2500083285 C Bi:5:033:3 0 12 = 00000c00 13020100 53020000
ffff81017941fcc0 2500085978 S Bi:5:033:3 -115 4096 <
ffff81017941fcc0 2500086282 C Bi:5:033:3 0 8 = 02000800 64003400
ffff81017941fcc0 2500089701 S Bi:5:033:3 -115 4096 <
ffff81017941fcc0 2500090283 C Bi:5:033:3 0 56 = 02003800 643c491b 9d2a0019 6e65745f 72696d5f 65636d61 73637269 70745f72
ffff81017941fcc0 2500094000 S Bi:5:033:3 -115 4096 <
ffff81017941f0c0 2500099023 S Bo:5:033:4 -115 8 = 02000800 6e000200
ffff81017941f0c0 2500099269 C Bo:5:033:4 0 8 >
ffff81017941fcc0 2500100283 C Bi:5:033:3 0 12 = 00000c00 13020100 54020000
ffff81017941fcc0 2500101083 S Bi:5:033:3 -115 4096 <
ffff81017941f0c0 2500102034 S Bo:5:033:4 -115 6 = 02000600 0736
ffff81017941f0c0 2500102266 C Bo:5:033:4 0 6 >
ffff81017941fcc0 2500103283 C Bi:5:033:3 0 12 = 00000c00 13020100 55020000
ffff81017941fcc0 2500106322 S Bi:5:033:3 -115 4096 <
ffff81017941fcc0 2500107282 C Bi:5:033:3 0 8 = 02000800 64003a00
ffff81017941fcc0 2500110372 S Bi:5:033:3 -115 4096 <
ffff81017941fcc0 2500111283 C Bi:5:033:3 0 62 = 02003e00 06e0491b 9d3e001f 6e65745f 72696d5f 65636d61 73637269 70745f72
ffff81017941fcc0 2500114182 S Bi:5:033:3 -115 4096 <
ffff81017941f0c0 2500120099 S Bo:5:033:4 -115 8 = 02000800 6e000200
ffff81017941f0c0 2500120270 C Bo:5:033:4 0 8 >
ffff81017941fcc0 2500121293 C Bi:5:033:3 0 12 = 00000c00 13020100 56020000
ffff81017941fcc0 2500123091 S Bo:5:033:4 -115 6 = 02000600 0739
ffff81017941f0c0 2500123143 S Bi:5:033:3 -115 4096 <
ffff81017941fcc0 2500123268 C Bo:5:033:4 0 6 >
ffff81017941f0c0 2500124286 C Bi:5:033:3 0 12 = 00000c00 13020100 57020000
ffff81017941f0c0 2500125208 S Bi:5:033:3 -115 4096 <
ffff81017941f0c0 2500126293 C Bi:5:033:3 0 8 = 02000800 64002f00
ffff81017941f0c0 2500132211 S Bi:5:033:3 -115 4096 <
ffff81017941f0c0 2500133304 C Bi:5:033:3 0 51 = 02003300 cefc491b ab3d0014 6e65745f 72696d5f 446f4452 6f6f7443 65727473
ffff81017941f0c0 2500139193 S Bo:5:033:4 -115 8 = 02000800 6e000200
ffff81017941fcc0 2500139255 S Bi:5:033:3 -115 4096 <
ffff81017941f0c0 2500140271 C Bo:5:033:4 0 8 >
ffff81017941fcc0 2500140291 C Bi:5:033:3 0 12 = 00000c00 13020100 58020000
ffff81017941fcc0 2500142021 S Bo:5:033:4 -115 6 = 02000600 073c
ffff81017941f0c0 2500142065 S Bi:5:033:3 -115 4096 <
ffff81017941fcc0 2500142268 C Bo:5:033:4 0 6 >
ffff81017941f0c0 2500143284 C Bi:5:033:3 0 12 = 00000c00 13020100 59020000
ffff81017941f0c0 2500146306 S Bi:5:033:3 -115 4096 <
ffff81017941f0c0 2500147286 C Bi:5:033:3 0 8 = 02000800 64002b00
ffff81017941f0c0 2500149515 S Bi:5:033:3 -115 4096 <
ffff81017941f0c0 2500150287 C Bi:5:033:3 0 47 = 02002f00 0728491b b9410010 6e65745f 72696d5f 62625f73 6d696d65 0009342e
ffff81017941f0c0 2500155402 S Bi:5:033:3 -115 4096 <
ffff81017941fcc0 2500156400 S Bo:5:033:4 -115 8 = 02000800 6e000200
ffff81017941f0c0 2500157289 C Bi:5:033:3 0 12 = 00000c00 13020100 5a020000
ffff81017941fcc0 2500157295 C Bo:5:033:4 0 8 >
ffff81017941fcc0 2500158327 S Bo:5:033:4 -115 6 = 02000600 073f
ffff81017941f0c0 2500158368 S Bi:5:033:3 -115 4096 <
ffff81017941fcc0 2500159269 C Bo:5:033:4 0 6 >
ffff81017941f0c0 2500159289 C Bi:5:033:3 0 12 = 00000c00 13020100 5b020000
ffff81017941f0c0 2500161916 S Bi:5:033:3 -115 4096 <
ffff81017941f0c0 2500162285 C Bi:5:033:3 0 8 = 02000800 64002e00
ffff81017941f0c0 2500165860 S Bi:5:033:3 -115 4096 <
ffff81017941f0c0 2500166297 C Bi:5:033:3 0 50 = 02003200 c12c491b a6cf0013 6e65745f 72696d5f 62625f74 61736b5f 61707000
ffff81017941f0c0 2500169916 S Bi:5:033:3 -115 4096 <
ffff81017941fcc0 2500172955 S Bo:5:033:4 -115 8 = 02000800 6e000200
ffff81017941fcc0 2500173280 C Bo:5:033:4 0 8 >
ffff81017941f0c0 2500174293 C Bi:5:033:3 0 12 = 00000c00 13020100 5c020000
ffff81017941f0c0 2500175922 S Bo:5:033:4 -115 6 = 02000600 0742
ffff81017941fcc0 2500175968 S Bi:5:033:3 -115 4096 <
ffff81017941f0c0 2500176271 C Bo:5:033:4 0 6 >
ffff81017941fcc0 2500177331 C Bi:5:033:3 0 12 = 00000c00 13020100 5d020000
ffff81017941fcc0 2500178809 S Bi:5:033:3 -115 4096 <
ffff81017941fcc0 2500216296 C Bi:5:033:3 0 8 = 02000800 64002b00
ffff81017941fcc0 2500219075 S Bi:5:033:3 -115 4096 <
ffff81017941fcc0 2500219290 C Bi:5:033:3 0 47 = 02002f00 78d04804 fb980013 6e65745f 72696d5f 62625f71 6d5f7961 686f6f00
ffff81017941fcc0 2500221362 S Bi:5:033:3 -115 4096 <
ffff81017941f0c0 2500227036 S Bo:5:033:4 -115 8 = 02000800 6e000200
ffff81017941f0c0 2500227276 C Bo:5:033:4 0 8 >
ffff81017941fcc0 2500228293 C Bi:5:033:3 0 12 = 00000c00 13020100 5e020000
ffff81017941fcc0 2500230124 S Bi:5:033:3 -115 4096 <
ffff81017941f0c0 2500231079 S Bo:5:033:4 -115 6 = 02000600 0751
ffff81017941f0c0 2500231275 C Bo:5:033:4 0 6 >
ffff81017941fcc0 2500232290 C Bi:5:033:3 0 12 = 00000c00 13020100 5f020000
ffff81017941fcc0 2500233226 S Bi:5:033:3 -115 4096 <
ffff81017941fcc0 2500234290 C Bi:5:033:3 0 8 = 02000800 64003700
ffff81017941fcc0 2500238899 S Bi:5:033:3 -115 4096 <
ffff81017941fcc0 2500239293 C Bi:5:033:3 0 59 = 02003b00 634c4804 fb6f001f 6e65745f 72696d5f 62625f71 6d5f7961 686f6f5f
ffff81017941fcc0 2500241996 S Bi:5:033:3 -115 4096 <
ffff81017941f0c0 2500245010 S Bo:5:033:4 -115 8 = 02000800 6e000200
ffff81017941f0c0 2500245278 C Bo:5:033:4 0 8 >
ffff81017941fcc0 2500246301 C Bi:5:033:3 0 12 = 00000c00 13020100 60020000
ffff81017941fcc0 2500247989 S Bo:5:033:4 -115 6 = 02000600 0754
ffff81017941f0c0 2500248048 S Bi:5:033:3 -115 4096 <
ffff81017941fcc0 2500248275 C Bo:5:033:4 0 6 >
ffff81017941f0c0 2500249349 C Bi:5:033:3 0 12 = 00000c00 13020100 61020000
ffff81017941f0c0 2500250899 S Bi:5:033:3 -115 4096 <
ffff81017941f0c0 2500251291 C Bi:5:033:3 0 8 = 02000800 64003700
ffff81017941f0c0 2500253978 S Bi:5:033:3 -115 4096 <
ffff81017941f0c0 2500254332 C Bi:5:033:3 0 59 = 02003b00 6e004804 fb74001f 6e65745f 72696d5f 62625f71 6d5f7961 686f6f5f
ffff81017941f0c0 2500256077 S Bi:5:033:3 -115 4096 <
ffff81017941fcc0 2500260884 S Bo:5:033:4 -115 8 = 02000800 6e000200
ffff81017941fcc0 2500261278 C Bo:5:033:4 0 8 >
ffff81017941f0c0 2500262294 C Bi:5:033:3 0 12 = 00000c00 13020100 62020000
ffff81017941f0c0 2500265936 S Bo:5:033:4 -115 6 = 02000600 108b
ffff81017941fcc0 2500265986 S Bi:5:033:3 -115 4096 <
ffff81017941f0c0 2500266277 C Bo:5:033:4 0 6 >
ffff81017941fcc0 2500267292 C Bi:5:033:3 0 12 = 00000c00 13020100 63020000
ffff81017941fcc0 2500269588 S Bi:5:033:3 -115 4096 <
ffff81017941fcc0 2500270292 C Bi:5:033:3 0 8 = 02000800 64002000
ffff81017941fcc0 2500274297 S Bi:5:033:3 -115 4096 <
ffff81017941fcc0 2500275296 C Bi:5:033:3 0 36 = 02002400 0fe447fe 657a0008 55534154 4f444159 0006312e 34322e32 00000fe4
ffff81017941fcc0 2500278521 S Bi:5:033:3 -115 4096 <
ffff81017941f0c0 2500282335 S Bo:5:033:4 -115 8 = 02000800 6e000200
ffff81017941fcc0 2500283296 C Bi:5:033:3 0 12 = 00000c00 13020100 64020000
ffff81017941f0c0 2500283301 C Bo:5:033:4 0 8 >
ffff81017941f0c0 2500284922 S Bi:5:033:3 -115 4096 <
ffff81017941fcc0 2500285943 S Bo:5:033:4 -115 6 = 02000600 11e9
ffff81017941fcc0 2500286277 C Bo:5:033:4 0 6 >
ffff81017941f0c0 2500287318 C Bi:5:033:3 0 12 = 00000c00 13020100 65020000
ffff81017941f0c0 2500288964 S Bi:5:033:3 -115 4096 <
ffff81017941f0c0 2500356305 C Bi:5:033:3 0 8 = 02000800 64002100
ffff81017941f0c0 2500358081 S Bi:5:033:3 -115 4096 <
ffff81017941f0c0 2500358335 C Bi:5:033:3 0 37 = 02002500 e09048e3 ea11000a 476f6f67 6c654d61 696c0005 322e302e 360006e0
ffff81017941f0c0 2500364057 S Bo:5:033:4 -115 8 = 02000800 6e000200
ffff81017941fcc0 2500364120 S Bi:5:033:3 -115 4096 <
ffff81017941f0c0 2500364284 C Bo:5:033:4 0 8 >
ffff81017941fcc0 2500365382 C Bi:5:033:3 0 12 = 00000c00 13020100 66020000
ffff81017941fcc0 2500367148 S Bo:5:033:4 -115 6 = 02000600 120e
ffff81017941f0c0 2500367195 S Bi:5:033:3 -115 4096 <
ffff81017941fcc0 2500367282 C Bo:5:033:4 0 6 >
ffff81017941f0c0 2500368301 C Bi:5:033:3 0 12 = 00000c00 13020100 67020000
ffff81017941f0c0 2500369984 S Bi:5:033:3 -115 4096 <
ffff81017941f0c0 2500370298 C Bi:5:033:3 0 8 = 02000800 64001e00
ffff81017941f0c0 2500374942 S Bi:5:033:3 -115 4096 <
ffff81017941f0c0 2500375300 C Bi:5:033:3 0 34 = 02002200 17dc45be 7e360009 536f6674 52657365 74000330 2e320000 17dc0000
ffff81017941f0c0 2500377996 S Bi:5:033:3 -115 4096 <
ffff81017941fcc0 2500381886 S Bo:5:033:4 -115 8 = 02000800 6e000200
ffff81017941fcc0 2500382285 C Bo:5:033:4 0 8 >
ffff81017941f0c0 2500383299 C Bi:5:033:3 0 12 = 00000c00 13020100 68020000
ffff81017941f0c0 2500385923 S Bo:5:033:4 -115 6 = 02000600 123e
ffff81017941fcc0 2500385971 S Bi:5:033:3 -115 4096 <
ffff81017941f0c0 2500386282 C Bo:5:033:4 0 6 >
ffff81017941fcc0 2500387365 C Bi:5:033:3 0 12 = 00000c00 13020100 69020000
ffff81017941fcc0 2500389981 S Bi:5:033:3 -115 4096 <
ffff81017941fcc0 2500390300 C Bi:5:033:3 0 8 = 02000800 64002e00
ffff81017941fcc0 2500394877 S Bi:5:033:3 -115 4096 <
ffff81017941fcc0 2500395302 C Bi:5:033:3 0 50 = 02003200 069849b0 39d10015 56696967 6f5f4272 616e645f 5265736f 75726365
ffff81017941fcc0 2500397931 S Bi:5:033:3 -115 4096 <
ffff81017941f0c0 2500401974 S Bo:5:033:4 -115 8 = 02000800 6e000200
ffff81017941f0c0 2500402287 C Bo:5:033:4 0 8 >
ffff81017941fcc0 2500403300 C Bi:5:033:3 0 12 = 00000c00 13020100 6a020000
ffff81017941fcc0 2500406009 S Bo:5:033:4 -115 6 = 02000600 12a9
ffff81017941f0c0 2500406062 S Bi:5:033:3 -115 4096 <
ffff81017941fcc0 2500406284 C Bo:5:033:4 0 6 >
ffff81017941f0c0 2500407308 C Bi:5:033:3 0 12 = 00000c00 13020100 6b020000
ffff81017941f0c0 2500409076 S Bi:5:033:3 -115 4096 <
ffff81017941f0c0 2500409301 C Bi:5:033:3 0 8 = 02000800 64003a00
ffff81017941f0c0 2500413920 S Bi:5:033:3 -115 4096 <
ffff81017941f0c0 2500414311 C Bi:5:033:3 0 62 = 02003e00 0a1449b1 8c5b0021 56696967 6f5f4272 616e645f 52494d4e 6577736c
ffff81017941f0c0 2500416799 S Bi:5:033:3 -115 4096 <
ffff81017941fcc0 2500421151 S Bo:5:033:4 -115 8 = 02000800 6e000200
ffff81017941fcc0 2500421287 C Bo:5:033:4 0 8 >
ffff81017941f0c0 2500422316 C Bi:5:033:3 0 12 = 00000c00 13020100 6c020000
ffff81017941f0c0 2500423912 S Bo:5:033:4 -115 6 = 02000600 1308
ffff81017941fcc0 2500423955 S Bi:5:033:3 -115 4096 <
ffff81017941f0c0 2500424285 C Bo:5:033:4 0 6 >
ffff81017941fcc0 2500425352 C Bi:5:033:3 0 12 = 00000c00 13020100 6d020000
ffff81017941fcc0 2500426894 S Bi:5:033:3 -115 4096 <
ffff81017941fcc0 2500449307 C Bi:5:033:3 0 8 = 02000800 64002300
ffff81017941fcc0 2500453886 S Bi:5:033:3 -115 4096 <
ffff81017941fcc0 2500454304 C Bi:5:033:3 0 39 = 02002700 89f849b0 39d6000a 56696967 6f5f4865 636c0007 332e302e 38393200
ffff81017941fcc0 2500456904 S Bi:5:033:3 -115 4096 <
ffff81017941f0c0 2500459928 S Bo:5:033:4 -115 8 = 02000800 6e000200
ffff81017941f0c0 2500460289 C Bo:5:033:4 0 8 >
ffff81017941fcc0 2500461313 C Bi:5:033:3 0 12 = 00000c00 13020100 6e020000
ffff81017941fcc0 2500462944 S Bo:5:033:4 -115 6 = 02000600 130f
ffff81017941f0c0 2500463006 S Bi:5:033:3 -115 4096 <
ffff81017941fcc0 2500463288 C Bo:5:033:4 0 6 >
ffff81017941f0c0 2500464302 C Bi:5:033:3 0 12 = 00000c00 13020100 6f020000
ffff81017941f0c0 2500465843 S Bi:5:033:3 -115 4096 <
ffff81017941f0c0 2500580316 C Bi:5:033:3 0 8 = 02000800 64002100
ffff81017941f0c0 2500582835 S Bi:5:033:3 -115 4096 <
ffff81017941f0c0 2500583311 C Bi:5:033:3 0 37 = 02002500 c21c4995 d9d4000a 476f6f67 6c654d61 70730005 332e302e 32000ac2
ffff81017941f0c0 2500585775 S Bi:5:033:3 -115 4096 <
ffff81017941fcc0 2500589778 S Bo:5:033:4 -115 8 = 02000800 6e000200
ffff81017941fcc0 2500590297 C Bo:5:033:4 0 8 >
ffff81017941f0c0 2500591312 C Bi:5:033:3 0 12 = 00000c00 13020100 70020000
ffff81017941f0c0 2500593904 S Bo:5:033:4 -115 6 = 02000600 1374
ffff81017941fcc0 2500593956 S Bi:5:033:3 -115 4096 <
ffff81017941f0c0 2500594295 C Bo:5:033:4 0 6 >
ffff81017941fcc0 2500595310 C Bi:5:033:3 0 12 = 00000c00 13020100 71020000
ffff81017941fcc0 2500597892 S Bi:5:033:3 -115 4096 <
ffff81017941fcc0 2500598312 C Bi:5:033:3 0 8 = 02000800 64002b00
ffff81017941fcc0 2500601430 S Bi:5:033:3 -115 4096 <
ffff81017941fcc0 2500602360 C Bi:5:033:3 0 47 = 02002f00 16c449b0 3a080012 56696967 6f5f506c 6174666f 726d5f34 32300007
ffff81017941fcc0 2500607412 S Bo:5:033:4 -115 8 = 02000800 6e000200
ffff81017941f0c0 2500607476 S Bi:5:033:3 -115 4096 <
ffff81017941fcc0 2500608298 C Bo:5:033:4 0 8 >
ffff81017941f0c0 2500608320 C Bi:5:033:3 0 12 = 00000c00 13020100 72020000
ffff81017941f0c0 2500609328 S Bo:5:033:4 -115 6 = 02000600 13ba
ffff81017941fcc0 2500609370 S Bi:5:033:3 -115 4096 <
ffff81017941f0c0 2500610295 C Bo:5:033:4 0 6 >
ffff81017941fcc0 2500610315 C Bi:5:033:3 0 12 = 00000c00 13020100 73020000
ffff81017941fcc0 2500611318 S Bi:5:033:3 -115 4096 <
ffff81017941fcc0 2500682322 C Bi:5:033:3 0 8 = 02000800 64004500
ffff81017941fcc0 2500686277 S Bi:5:033:3 -115 4096 <
ffff81017941fcc0 2500687320 C Bi:5:033:3 0 73 = 02004900 15c04995 d7220024 636f6d5f 706c617a 6d69635f 7468656d 655f6942
ffff81017941fcc0 2500693207 S Bo:5:033:4 -115 8 = 02000800 6e000200
ffff81017941f0c0 2500693269 S Bi:5:033:3 -115 4096 <
ffff81017941fcc0 2500694302 C Bo:5:033:4 0 8 >
ffff81017941f0c0 2500694325 C Bi:5:033:3 0 12 = 00000c00 13020100 74020000
ffff81017941f0c0 2500698099 S Bi:5:033:3 -115 4096 <
ffff81017941fcc0 2500702070 S Bo:5:033:4 -115 6 = 02000600 1473
ffff81017941fcc0 2500702336 C Bo:5:033:4 0 6 >
ffff81017941f0c0 2500703322 C Bi:5:033:3 0 12 = 00000c00 13020100 75020000
ffff81017941f0c0 2500705953 S Bi:5:033:3 -115 4096 <
ffff81017941f0c0 2500751327 C Bi:5:033:3 0 8 = 02000800 64002b00
ffff81017941f0c0 2500753874 S Bi:5:033:3 -115 4096 <
ffff81017941f0c0 2500754320 C Bi:5:033:3 0 47 = 02002f00 10d44970 f6990011 686f636b 65796e65 77735f6d 6f62696c 65000832
ffff81017941f0c0 2500755877 S Bi:5:033:3 -115 4096 <
ffff81017941fcc0 2500759873 S Bo:5:033:4 -115 8 = 02000800 6e000200
ffff81017941fcc0 2500760306 C Bo:5:033:4 0 8 >
ffff81017941f0c0 2500761379 C Bi:5:033:3 0 12 = 00000c00 13020100 76020000
ffff81017941f0c0 2500763064 S Bo:5:033:4 -115 6 = 02000600 1480
ffff81017941fcc0 2500763113 S Bi:5:033:3 -115 4096 <
ffff81017941f0c0 2500763304 C Bo:5:033:4 0 6 >
ffff81017941fcc0 2500764322 C Bi:5:033:3 0 12 = 00000c00 13020100 77020000
ffff81017941fcc0 2500765800 S Bi:5:033:3 -115 4096 <
ffff81017941fcc0 2500791328 C Bi:5:033:3 0 8 = 02000800 64002200
ffff81017941fcc0 2500793999 S Bi:5:033:3 -115 4096 <
ffff81017941fcc0 2500794324 C Bi:5:033:3 0 38 = 02002600 b2603948 5766000b 54696e79 54776974 74657200 05312e31 2e300001
ffff81017941fcc0 2500799022 S Bi:5:033:3 -115 4096 <
ffff81017941f0c0 2500800109 S Bo:5:033:4 -115 8 = 02000800 6e000200
ffff81017941f0c0 2500800309 C Bo:5:033:4 0 8 >
ffff81017941fcc0 2500801370 C Bi:5:033:3 0 12 = 00000c00 13020100 78020000
ffff81017941fcc0 2500803005 S Bo:5:033:4 -115 6 = 02000600 14b6
ffff81017941f0c0 2500803047 S Bi:5:033:3 -115 4096 <
ffff81017941fcc0 2500803307 C Bo:5:033:4 0 6 >
ffff81017941f0c0 2500804268 C Bi:5:033:3 0 12 = 00000c00 13020100 79020000
ffff81017941f0c0 2500805922 S Bi:5:033:3 -115 4096 <
ffff81017941f0c0 2500867332 C Bi:5:033:3 0 8 = 02000800 64002d00
ffff81017941f0c0 2500870612 S Bi:5:033:3 -115 4096 <
ffff81017941f0c0 2500871327 C Bi:5:033:3 0 49 = 02003100 a61048da b33f0013 6e65745f 72696d5f 62625f66 61636562 6f6f6b00
ffff81017941f0c0 2500873564 S Bi:5:033:3 -115 4096 <
ffff81017941fcc0 2500877556 S Bo:5:033:4 -115 8 = 02000800 6e000200
ffff81017941fcc0 2500878312 C Bo:5:033:4 0 8 >
ffff81017941f0c0 2500879327 C Bi:5:033:3 0 12 = 00000c00 13020100 7a020000
ffff81017941f0c0 2500881857 S Bo:5:033:4 -115 6 = 02000600 14c9
ffff81017941fcc0 2500881903 S Bi:5:033:3 -115 4096 <
ffff81017941f0c0 2500882310 C Bo:5:033:4 0 6 >
ffff81017941fcc0 2500883326 C Bi:5:033:3 0 12 = 00000c00 13020100 7b020000
ffff81017941fcc0 2500885873 S Bi:5:033:3 -115 4096 <
ffff81017941fcc0 2500886327 C Bi:5:033:3 0 8 = 02000800 64003600
ffff81017941fcc0 2500890637 S Bi:5:033:3 -115 4096 <
ffff81017941fcc0 2500891330 C Bi:5:033:3 0 58 = 02003a00 5dd048da b34c001c 6e65745f 72696d5f 62625f66 61636562 6f6f6b5f
ffff81017941fcc0 2500893697 S Bi:5:033:3 -115 4096 <
ffff81017941f0c0 2500898574 S Bo:5:033:4 -115 8 = 02000800 6e000200
ffff81017941f0c0 2500899314 C Bo:5:033:4 0 8 >
ffff81017941fcc0 2500900328 C Bi:5:033:3 0 12 = 00000c00 13020100 7c020000
ffff81017941fcc0 2500901606 S Bo:5:033:4 -115 6 = 02000600 14f5
ffff81017941f0c0 2500901651 S Bi:5:033:3 -115 4096 <
ffff81017941fcc0 2500902312 C Bo:5:033:4 0 6 >
ffff81017941f0c0 2500903327 C Bi:5:033:3 0 12 = 00000c00 13020100 7d020000
ffff81017941f0c0 2500905861 S Bi:5:033:3 -115 4096 <
ffff81017941f0c0 2500941336 C Bi:5:033:3 0 8 = 02000800 64002800
ffff81017941f0c0 2500944986 S Bi:5:033:3 -115 4096 <
ffff81017941f0c0 2500945340 C Bi:5:033:3 0 44 = 02002c00 0d1c4946 71990010 476f6f67 6c655379 6e635f34 305f656e 0006302e
ffff81017941f0c0 2500950961 S Bo:5:033:4 -115 8 = 02000800 6e000200
ffff81017941fcc0 2500951029 S Bi:5:033:3 -115 4096 <
ffff81017941f0c0 2500951317 C Bo:5:033:4 0 8 >
ffff81017941fcc0 2500952331 C Bi:5:033:3 0 12 = 00000c00 13020100 7e020000
ffff81017941fcc0 2500953987 S Bo:5:033:4 -115 6 = 02000600 1597
ffff81017941f0c0 2500954035 S Bi:5:033:3 -115 4096 <
ffff81017941fcc0 2500954315 C Bo:5:033:4 0 6 >
ffff81017941f0c0 2500955330 C Bi:5:033:3 0 12 = 00000c00 13020100 7f020000
ffff81017941f0c0 2500958041 S Bi:5:033:3 -115 4096 <
ffff81017941f0c0 2501058342 C Bi:5:033:3 0 8 = 02000800 64004300
ffff81017941f0c0 2501061899 S Bi:5:033:3 -115 4096 <
ffff81017941f0c0 2501062340 C Bi:5:033:3 0 71 = 02004700 c36445df 32a60022 636f6d5f 706c617a 6d69635f 7468656d 655f3831
ffff81017941f0c0 2501063941 S Bi:5:033:3 -115 4096 <
ffff81017941fcc0 2501067768 S Bo:5:033:4 -115 8 = 02000800 6e000200
ffff81017941fcc0 2501068324 C Bo:5:033:4 0 8 >
ffff81017941f0c0 2501069342 C Bi:5:033:3 0 12 = 00000c00 13020100 80020000
ffff81017941f0c0 2501070826 S Bo:5:033:4 -115 6 = 02000600 15ba
ffff81017941fcc0 2501070869 S Bi:5:033:3 -115 4096 <
ffff81017941f0c0 2501071321 C Bo:5:033:4 0 6 >
ffff81017941fcc0 2501072338 C Bi:5:033:3 0 12 = 00000c00 13020100 81020000
ffff81017941fcc0 2501073920 S Bi:5:033:3 -115 4096 <
ffff81017941fcc0 2501149348 C Bi:5:033:3 0 8 = 02000800 64003d00
ffff81017941fcc0 2501154479 S Bi:5:033:3 -115 4096 <
ffff81017941fcc0 2501155345 C Bi:5:033:3 0 65 = 02004100 a158484c 3d72001c 636f6d5f 706c617a 6d69635f 7468656d 655f466c
ffff81017941fcc0 2501160495 S Bo:5:033:4 -115 8 = 02000800 6e000200
ffff81017941f0c0 2501160556 S Bi:5:033:3 -115 4096 <
ffff81017941fcc0 2501161330 C Bo:5:033:4 0 8 >
ffff81017941f0c0 2501161351 C Bi:5:033:3 0 12 = 00000c00 13020100 82020000
ffff81017941f0c0 2501162419 S Bo:5:033:4 -115 6 = 02000600 15d6
ffff81017941fcc0 2501162461 S Bi:5:033:3 -115 4096 <
ffff81017941f0c0 2501163326 C Bo:5:033:4 0 6 >
ffff81017941fcc0 2501163346 C Bi:5:033:3 0 12 = 00000c00 13020100 83020000
ffff8101796a2e40 2501172267 S Bi:5:033:3 -115 4096 <
ffff8101796a2e40 2501190350 C Bi:5:033:3 0 8 = 02000800 64001f00
ffff8101796a2e40 2501194443 S Bi:5:033:3 -115 4096 <
ffff8101796a2e40 2501195344 C Bi:5:033:3 0 35 = 02002300 c62047d9 fe320008 6d696470 73736832 0005312e 372e3300 01c62000
ffff81017941fcc0 2501206979 S Bo:5:033:4 -115 8 = 02000800 6e000200
ffff81017941f0c0 2501207075 S Bi:5:033:3 -115 4096 <
ffff81017941fcc0 2501208342 C Bo:5:033:4 0 8 >
ffff81017941f0c0 2501208365 C Bi:5:033:3 0 12 = 00000c00 13020100 84020000
ffff81017941f0c0 2501210895 S Bo:5:033:4 -115 6 = 02000600 15e8
ffff81017941fcc0 2501210957 S Bi:5:033:3 -115 4096 <
ffff81017941f0c0 2501211403 C Bo:5:033:4 0 6 >
ffff81017941fcc0 2501212349 C Bi:5:033:3 0 12 = 00000c00 13020100 85020000
ffff81017941fcc0 2501214965 S Bi:5:033:3 -115 4096 <
ffff81017941fcc0 2501215347 C Bi:5:033:3 0 8 = 02000800 64001d00
ffff81017941fcc0 2501216931 S Bi:5:033:3 -115 4096 <
ffff81017941fcc0 2501217348 C Bi:5:033:3 0 33 = 02002100 0f5c45c4 0a460008 4175746f 4c6f636b 0003302e 3500000f 5c000000
ffff81017941fcc0 2501218998 S Bi:5:033:3 -115 4096 <
ffff81017941ff00 2501222810 S Bo:5:033:4 -115 8 = 02000800 6e000200
ffff81017941ff00 2501223333 C Bo:5:033:4 0 8 >
ffff81017941fcc0 2501224346 C Bi:5:033:3 0 12 = 00000c00 13020100 86020000
ffff81017941fcc0 2501225803 S Bo:5:033:4 -115 6 = 02000600 15f2
ffff81017941ff00 2501225847 S Bi:5:033:3 -115 4096 <
ffff81017941fcc0 2501226329 C Bo:5:033:4 0 6 >
ffff81017941ff00 2501227345 C Bi:5:033:3 0 12 = 00000c00 13020100 87020000
ffff81017941ff00 2501229653 S Bi:5:033:3 -115 4096 <
ffff81017941ff00 2501403362 C Bi:5:033:3 0 8 = 02000800 64002d00
ffff81017941ff00 2501406344 S Bi:5:033:3 -115 4096 <
ffff81017941ff00 2501407359 C Bi:5:033:3 0 49 = 02003100 2dc049d2 64160013 6e65745f 72696d5f 62625f61 7070776f 726c6400
ffff81017941ff00 2501412381 S Bi:5:033:3 -115 4096 <
ffff81017941fcc0 2501413242 S Bo:5:033:4 -115 8 = 02000800 6e000200
ffff81017941fcc0 2501414343 C Bo:5:033:4 0 8 >
ffff81017941ff00 2501424364 C Bi:5:033:3 0 12 = 00000c00 13020100 88020000
ffff81017941ff00 2501425416 S Bo:5:033:4 -115 6 = 02000600 15fe
ffff81017941fcc0 2501425461 S Bi:5:033:3 -115 4096 <
ffff81017941ff00 2501426341 C Bo:5:033:4 0 6 >
ffff81017941fcc0 2501426361 C Bi:5:033:3 0 12 = 00000c00 13020100 89020000
ffff81017941fcc0 2501429608 S Bi:5:033:3 -115 4096 <
ffff81017941fcc0 2501542371 C Bi:5:033:3 0 8 = 02000800 64004500
ffff81017941fcc0 2501544887 S Bi:5:033:3 -115 4096 <
ffff81017941fcc0 2501545418 C Bi:5:033:3 0 73 = 02004900 0c1c48d4 19160024 636f6d5f 706c617a 6d69635f 7468656d 655f5562
ffff81017941fcc0 2501547847 S Bi:5:033:3 -115 4096 <
ffff81017941ff00 2501549929 S Bo:5:033:4 -115 8 = 02000800 6e000200
ffff81017941ff00 2501550362 C Bo:5:033:4 0 8 >
ffff81017941fcc0 2501551367 C Bi:5:033:3 0 12 = 00000c00 13020100 8a020000
ffff81017941fcc0 2501553894 S Bo:5:033:4 -115 6 = 02000600 163f
ffff81017941ff00 2501553949 S Bi:5:033:3 -115 4096 <
ffff81017941fcc0 2501554348 C Bo:5:033:4 0 6 >
ffff81017941ff00 2501555364 C Bi:5:033:3 0 12 = 00000c00 13020100 8b020000
ffff81017941ff00 2501557987 S Bi:5:033:3 -115 4096 <
ffff81017941ff00 2501622375 C Bi:5:033:3 0 8 = 02000800 64004c00
ffff81017941ff00 2501625857 S Bi:5:033:3 -115 4096 <
ffff81017941ff00 2501626371 C Bi:5:033:3 0 80 = 02005000 8f884801 c7bf002b 636f6d5f 706c617a 6d69635f 7468656d 655f4e65
ffff81017941ff00 2501627898 S Bi:5:033:3 -115 4096 <
ffff81017941fcc0 2501630859 S Bo:5:033:4 -115 8 = 02000800 6e000200
ffff81017941fcc0 2501631366 C Bo:5:033:4 0 8 >
ffff81017941ff00 2501632373 C Bi:5:033:3 0 12 = 00000c00 13020100 8c020000
ffff81017941ff00 2501633774 S Bo:5:033:4 -115 6 = 02000600 16c5
ffff81017941fcc0 2501633816 S Bi:5:033:3 -115 4096 <
ffff81017941ff00 2501634353 C Bo:5:033:4 0 6 >
ffff81017941fcc0 2501635368 C Bi:5:033:3 0 12 = 00000c00 13020100 8d020000
ffff81017941fcc0 2501637810 S Bi:5:033:3 -115 4096 <
ffff81017941fcc0 2501638369 C Bi:5:033:3 0 8 = 02000800 64002f00
ffff81017941fcc0 2501639914 S Bi:5:033:3 -115 4096 <
ffff81017941fcc0 2501640377 C Bi:5:033:3 0 51 = 02003300 171449b0 3a0b0016 56696967 6f5f5374 616e6461 72645f33 32307832
ffff81017941fcc0 2501641742 S Bi:5:033:3 -115 4096 <
ffff81017941ff00 2501645750 S Bo:5:033:4 -115 8 = 02000800 6e000200
ffff81017941ff00 2501646356 C Bo:5:033:4 0 8 >
ffff81017941fcc0 2501647371 C Bi:5:033:3 0 12 = 00000c00 13020100 8e020000
ffff81017941fcc0 2501649610 S Bo:5:033:4 -115 6 = 02000600 16cf
ffff81017941ff00 2501649683 S Bi:5:033:3 -115 4096 <
ffff81017941fcc0 2501650354 C Bo:5:033:4 0 6 >
ffff81017941ff00 2501651372 C Bi:5:033:3 0 12 = 00000c00 13020100 8f020000
ffff81017941ff00 2501653816 S Bi:5:033:3 -115 4096 <
ffff81017941ff00 2501677378 C Bi:5:033:3 0 8 = 02000800 64003400
ffff81017941ff00 2501679973 S Bi:5:033:3 -115 4096 <
ffff81017941ff00 2501680375 C Bi:5:033:3 0 56 = 02003800 00f849b0 3a00001b 56696967 6f5f4170 705f5265 736f7572 6365735f
ffff81017941ff00 2501685964 S Bo:5:033:4 -115 8 = 02000800 6e000200
ffff81017941fcc0 2501686026 S Bi:5:033:3 -115 4096 <
ffff81017941ff00 2501686358 C Bo:5:033:4 0 8 >
ffff81017941fcc0 2501687373 C Bi:5:033:3 0 12 = 00000c00 13020100 90020000
ffff81017941fcc0 2501690472 S Bo:5:033:4 -115 6 = 02000600 16d4
ffff81017941ff00 2501690533 S Bi:5:033:3 -115 4096 <
ffff81017941fcc0 2501691357 C Bo:5:033:4 0 6 >
ffff81017941ff00 2501691378 C Bi:5:033:3 0 12 = 00000c00 13020100 91020000
ffff81017941ff00 2501693512 S Bi:5:033:3 -115 4096 <
ffff81017941ff00 2501694372 C Bi:5:033:3 0 8 = 02000800 64003000
ffff81017941ff00 2501698056 S Bi:5:033:3 -115 4096 <
ffff81017941ff00 2501698384 C Bi:5:033:3 0 52 = 02003400 053849b0 3a0f0017 636f6d5f 76696967 6f5f7669 69676f61 70705f61
ffff81017941ff00 2501700141 S Bi:5:033:3 -115 4096 <
ffff8101796a2e40 2501709054 S Bo:5:033:4 -115 8 = 02000800 6e000200
ffff8101796a2e40 2501709362 C Bo:5:033:4 0 8 >
ffff81017941ff00 2501710375 C Bi:5:033:3 0 12 = 00000c00 13020100 92020000
ffff8101796a2e40 2501712097 S Bo:5:033:4 -115 6 = 02000600 16d7
ffff8101796a2480 2501712117 S Bi:5:033:3 -115 4096 <
ffff8101796a2e40 2501712358 C Bo:5:033:4 0 6 >
ffff8101796a2480 2501713373 C Bi:5:033:3 0 12 = 00000c00 13020100 93020000
ffff8101796a2480 2501714899 S Bi:5:033:3 -115 4096 <
ffff8101796a2480 2501808385 C Bi:5:033:3 0 8 = 02000800 64002200
ffff81017941fcc0 2501810919 S Bi:5:033:3 -115 4096 <
ffff81017941fcc0 2501811380 C Bi:5:033:3 0 38 = 02002600 0b6c49b0 39dd0009 56696967 6f5f4170 69000733 2e302e38 39320008
ffff81017941fcc0 2501814033 S Bi:5:033:3 -115 4096 <
ffff81017941f0c0 2501818025 S Bo:5:033:4 -115 8 = 02000800 6e000200
ffff81017941f0c0 2501818366 C Bo:5:033:4 0 8 >
ffff81017941fcc0 2501819388 C Bi:5:033:3 0 12 = 00000c00 13020100 94020000
ffff81017941fcc0 2501820938 S Bi:5:033:3 -115 4096 <
ffff81017941f0c0 2501821907 S Bo:5:033:4 -115 6 = 02000600 1732
ffff81017941f0c0 2501822365 C Bo:5:033:4 0 6 >
ffff81017941fcc0 2501823399 C Bi:5:033:3 0 12 = 00000c00 13020100 95020000
ffff81017941fcc0 2501824978 S Bi:5:033:3 -115 4096 <
ffff81017941fcc0 2501897392 C Bi:5:033:3 0 8 = 02000800 64002200
ffff81017941fcc0 2501899099 S Bi:5:033:3 -115 4096 <
ffff81017941fcc0 2501899393 C Bi:5:033:3 0 38 = 02002600 d1f849b0 39f00009 56696967 6f5f4170 70000733 2e302e38 39320005
ffff81017941fcc0 2501901150 S Bi:5:033:3 -115 4096 <
ffff81017941f0c0 2501904889 S Bo:5:033:4 -115 8 = 02000800 6e000200
ffff81017941f0c0 2501905371 C Bo:5:033:4 0 8 >
ffff81017941fcc0 2501906389 C Bi:5:033:3 0 12 = 00000c00 13020100 96020000
ffff81017941fcc0 2501907916 S Bo:5:033:4 -115 6 = 02000600 173b
ffff81017941f0c0 2501907957 S Bi:5:033:3 -115 4096 <
ffff81017941fcc0 2501908371 C Bo:5:033:4 0 6 >
ffff81017941f0c0 2501909461 C Bi:5:033:3 0 12 = 00000c00 13020100 97020000
ffff81017941f0c0 2501910960 S Bi:5:033:3 -115 4096 <
ffff81017941f0c0 2501936392 C Bi:5:033:3 0 8 = 02000800 64001900
ffff81017941f0c0 2501938010 S Bi:5:033:3 -115 4096 <
ffff81017941f0c0 2501938460 C Bi:5:033:3 0 29 = 02001d00 41644977 2e230003 72626200 04312e35 31000141 64000000 02
ffff81017941f0c0 2501940067 S Bi:5:033:3 -115 4096 <
ffff81017941fcc0 2501941892 S Bo:5:033:4 -115 8 = 02000800 82000000
ffff81017941fcc0 2501942372 C Bo:5:033:4 0 8 >
ffff81017941f0c0 2501943457 C Bi:5:033:3 0 12 = 00000c00 13020100 98020000
ffff81017941f0c0 2501945956 S Bi:5:033:3 -115 4096 <
ffff81017941f0c0 2501953391 C Bi:5:033:3 0 8 = 02000800 64008200
ffff81017941f0c0 2501955917 S Bi:5:033:3 -115 4096 <
ffff81017941f0c0 2501956388 C Bi:5:033:3 0 134 = 02008600 07570758 0759075a 075b075c 075d075e 075f0760 07610762 07630764
ffff81017941f0c0 2501961978 S Bo:5:033:4 -115 8 = 02000800 84000200
ffff81017941fcc0 2501962046 S Bi:5:033:3 -115 4096 <
ffff81017941f0c0 2501962374 C Bo:5:033:4 0 8 >
ffff81017941fcc0 2501963444 C Bi:5:033:3 0 12 = 00000c00 13020100 99020000
ffff81017941fcc0 2501965019 S Bo:5:033:4 -115 6 = 02000600 0757
ffff81017941f0c0 2501965060 S Bi:5:033:3 -115 4096 <
ffff81017941fcc0 2501965372 C Bo:5:033:4 0 6 >
ffff81017941f0c0 2501966388 C Bi:5:033:3 0 12 = 00000c00 13020100 9a020000
ffff81017941f0c0 2501967934 S Bi:5:033:3 -115 4096 <
ffff81017941f0c0 2501969389 C Bi:5:033:3 0 8 = 02000800 64000400
ffff81017941f0c0 2501972010 S Bi:5:033:3 -115 4096 <
ffff81017941f0c0 2501972390 C Bi:5:033:3 0 8 = 02000800 000001a4
ffff81017941f0c0 2501974177 S Bi:5:033:3 -115 4096 <
ffff81017941fcc0 2501976076 S Bo:5:033:4 -115 8 = 02000800 68000000
ffff81017941fcc0 2501976374 C Bo:5:033:4 0 8 >
ffff81017941f0c0 2501977392 C Bi:5:033:3 0 12 = 00000c00 13020100 9b020000
ffff81017941f0c0 2501978890 S Bi:5:033:3 -115 4096 <
ffff81017941f0c0 2501979388 C Bi:5:033:3 0 8 = 02000800 6e00a401
ffff81017941f0c0 2501980939 S Bi:5:033:3 -115 4096 <
ffff81017941f0c0 2501982388 C Bi:5:033:3 0 424 = 0200a801 ab76d27a 7e5f2ee1 04000000 636f6d2e 62622e6d 64732e64 65666175
ffff81017941f0c0 2501985927 S Bo:5:033:4 -115 8 = 02000800 68000000
ffff81017941fcc0 2501985977 S Bi:5:033:3 -115 4096 <
ffff81017941f0c0 2501986373 C Bo:5:033:4 0 8 >
ffff81017941fcc0 2501987391 C Bi:5:033:3 0 12 = 00000c00 13020100 9c020000
ffff81017941fcc0 2501988974 S Bi:5:033:3 -115 4096 <
ffff81017941fcc0 2501989388 C Bi:5:033:3 0 8 = 02000800 64000000
ffff81017941fcc0 2501990938 S Bi:5:033:3 -115 4096 <
ffff81017941f0c0 2501993081 S Bo:5:033:4 -115 8 = 02000800 84000200
ffff81017941f0c0 2501993375 C Bo:5:033:4 0 8 >
ffff81017941fcc0 2501994400 C Bi:5:033:3 0 12 = 00000c00 13020100 9d020000
ffff81017941fcc0 2501995965 S Bo:5:033:4 -115 6 = 02000600 0758
ffff81017941f0c0 2501996006 S Bi:5:033:3 -115 4096 <
ffff81017941fcc0 2501996375 C Bo:5:033:4 0 6 >
ffff81017941f0c0 2501997446 C Bi:5:033:3 0 12 = 00000c00 13020100 9e020000
ffff81017941f0c0 2501999111 S Bi:5:033:3 -115 4096 <
ffff81017941f0c0 2502000390 C Bi:5:033:3 0 8 = 02000800 64000400
ffff81017941f0c0 2502002903 S Bi:5:033:3 -115 4096 <
ffff81017941f0c0 2502003390 C Bi:5:033:3 0 8 = 02000800 00000254
ffff81017941f0c0 2502005055 S Bi:5:033:3 -115 4096 <
ffff81017941fcc0 2502006939 S Bo:5:033:4 -115 8 = 02000800 68000000
ffff81017941fcc0 2502007375 C Bo:5:033:4 0 8 >
ffff81017941f0c0 2502008425 C Bi:5:033:3 0 12 = 00000c00 13020100 9f020000
ffff81017941f0c0 2502010054 S Bi:5:033:3 -115 4096 <
ffff81017941f0c0 2502010389 C Bi:5:033:3 0 8 = 02000800 6e005402
ffff81017941f0c0 2502012881 S Bi:5:033:3 -115 4096 <
ffff81017941f0c0 2502014390 C Bi:5:033:3 0 600 = 02005802 ab76d27a ac6a1f02 00000000 636f6d2e 64617461 76697a2e 64787467
ffff81017941f0c0 2502015987 S Bi:5:033:3 -115 4096 <
ffff81017941fcc0 2502018983 S Bo:5:033:4 -115 8 = 02000800 68000000
ffff81017941fcc0 2502019376 C Bo:5:033:4 0 8 >
ffff81017941f0c0 2502020399 C Bi:5:033:3 0 12 = 00000c00 13020100 a0020000
ffff81017941f0c0 2502022133 S Bi:5:033:3 -115 4096 <
ffff81017941f0c0 2502022392 C Bi:5:033:3 0 8 = 02000800 64000000
ffff81017941f0c0 2502026009 S Bo:5:033:4 -115 8 = 02000800 84000200
ffff81017941fcc0 2502026069 S Bi:5:033:3 -115 4096 <
ffff81017941f0c0 2502026377 C Bo:5:033:4 0 8 >
ffff81017941fcc0 2502027436 C Bi:5:033:3 0 12 = 00000c00 13020100 a1020000
ffff81017941fcc0 2502028955 S Bo:5:033:4 -115 6 = 02000600 0759
ffff81017941f0c0 2502029007 S Bi:5:033:3 -115 4096 <
ffff81017941fcc0 2502029377 C Bo:5:033:4 0 6 >
ffff81017941f0c0 2502030394 C Bi:5:033:3 0 12 = 00000c00 13020100 a2020000
ffff81017941f0c0 2502031960 S Bi:5:033:3 -115 4096 <
ffff81017941f0c0 2502033390 C Bi:5:033:3 0 8 = 02000800 64000400
ffff81017941f0c0 2502036009 S Bi:5:033:3 -115 4096 <
ffff81017941f0c0 2502036392 C Bi:5:033:3 0 8 = 02000800 00000230
ffff81017941f0c0 2502038095 S Bi:5:033:3 -115 4096 <
ffff81017941fcc0 2502039895 S Bo:5:033:4 -115 8 = 02000800 68000000
ffff81017941fcc0 2502040377 C Bo:5:033:4 0 8 >
ffff81017941f0c0 2502041396 C Bi:5:033:3 0 12 = 00000c00 13020100 a3020000
ffff81017941f0c0 2502042918 S Bi:5:033:3 -115 4096 <
ffff81017941f0c0 2502043392 C Bi:5:033:3 0 8 = 02000800 6e003002
ffff81017941f0c0 2502045005 S Bi:5:033:3 -115 4096 <
ffff81017941f0c0 2502046392 C Bi:5:033:3 0 564 = 02003402 ab76d27a cdf04f72 01000000 636f6d2e 72696d2e 6269732e 636c6965
ffff81017941f0c0 2502048059 S Bi:5:033:3 -115 4096 <
ffff81017941fcc0 2502049939 S Bo:5:033:4 -115 8 = 02000800 68000000
ffff81017941fcc0 2502050377 C Bo:5:033:4 0 8 >
ffff81017941f0c0 2502051395 C Bi:5:033:3 0 12 = 00000c00 13020100 a4020000
ffff81017941f0c0 2502052930 S Bi:5:033:3 -115 4096 <
ffff81017941f0c0 2502053392 C Bi:5:033:3 0 8 = 02000800 64000000
ffff81017941f0c0 2502057068 S Bo:5:033:4 -115 8 = 02000800 84000200
ffff81017941fcc0 2502057127 S Bi:5:033:3 -115 4096 <
ffff81017941f0c0 2502057379 C Bo:5:033:4 0 8 >
ffff81017941fcc0 2502058408 C Bi:5:033:3 0 12 = 00000c00 13020100 a5020000
ffff81017941fcc0 2502060078 S Bi:5:033:3 -115 4096 <
ffff81017941f0c0 2502060876 S Bo:5:033:4 -115 6 = 02000600 075a
ffff81017941f0c0 2502061376 C Bo:5:033:4 0 6 >
ffff81017941fcc0 2502062395 C Bi:5:033:3 0 12 = 00000c00 13020100 a6020000
ffff81017941fcc0 2502063914 S Bi:5:033:3 -115 4096 <
ffff81017941fcc0 2502065392 C Bi:5:033:3 0 8 = 02000800 64000400
ffff81017941fcc0 2502067963 S Bi:5:033:3 -115 4096 <
ffff81017941fcc0 2502068394 C Bi:5:033:3 0 8 = 02000800 00000ff4
ffff81017941fcc0 2502070063 S Bi:5:033:3 -115 4096 <
ffff81017941f0c0 2502072015 S Bo:5:033:4 -115 8 = 02000800 68000000
ffff81017941f0c0 2502072379 C Bo:5:033:4 0 8 >
ffff81017941fcc0 2502073397 C Bi:5:033:3 0 12 = 00000c00 13020100 a7020000
ffff81017941fcc0 2502074900 S Bi:5:033:3 -115 4096 <
ffff81017941fcc0 2502075393 C Bi:5:033:3 0 8 = 02000800 6e00f807
ffff81017941fcc0 2502077937 S Bi:5:033:3 -115 4096 <
ffff81017941fcc0 2502080396 C Bi:5:033:3 0 2044 = 0200fc07 ab76d27a 341da877 01000000 6e65742e 72696d2e 626c6163 6b626572
ffff81017941fcc0 2502082085 S Bi:5:033:3 -115 4096 <
ffff81017941f0c0 2502084004 S Bo:5:033:4 -115 8 = 02000800 68000000
ffff81017941f0c0 2502084379 C Bo:5:033:4 0 8 >
ffff81017941fcc0 2502085423 C Bi:5:033:3 0 12 = 00000c00 13020100 a8020000
ffff81017941fcc0 2502086910 S Bi:5:033:3 -115 4096 <
ffff81017941fcc0 2502087394 C Bi:5:033:3 0 8 = 02000800 6e00f807
ffff81017941fcc0 2502089026 S Bi:5:033:3 -115 4096 <
ffff81017941fcc0 2502091397 C Bi:5:033:3 0 2044 = 0200fc07 67696e65 0000006e 65745f72 696d5f70 6c617a6d 69635f6d 65646961
ffff81017941fcc0 2502095165 S Bo:5:033:4 -115 8 = 02000800 68000000
ffff81017941f0c0 2502095220 S Bi:5:033:3 -115 4096 <
ffff81017941fcc0 2502095379 C Bo:5:033:4 0 8 >
ffff81017941f0c0 2502096404 C Bi:5:033:3 0 12 = 00000c00 13020100 a9020000
ffff81017941f0c0 2502097887 S Bi:5:033:3 -115 4096 <
ffff81017941f0c0 2502098395 C Bi:5:033:3 0 8 = 02000800 6e000400
ffff81017941f0c0 2502099922 S Bi:5:033:3 -115 4096 <
ffff81017941f0c0 2502100399 C Bi:5:033:3 0 8 = 02000800 5f434100
ffff81017941f0c0 2502101970 S Bi:5:033:3 -115 4096 <
ffff81017941fcc0 2502103942 S Bo:5:033:4 -115 8 = 02000800 68000000
ffff81017941fcc0 2502104379 C Bo:5:033:4 0 8 >
ffff81017941f0c0 2502105409 C Bi:5:033:3 0 12 = 00000c00 13020100 aa020000
ffff81017941f0c0 2502106971 S Bi:5:033:3 -115 4096 <
ffff81017941f0c0 2502107395 C Bi:5:033:3 0 8 = 02000800 64000000
ffff81017941f0c0 2502108930 S Bi:5:033:3 -115 4096 <
ffff81017941fcc0 2502111927 S Bo:5:033:4 -115 8 = 02000800 84000200
ffff81017941fcc0 2502112381 C Bo:5:033:4 0 8 >
ffff81017941f0c0 2502113416 C Bi:5:033:3 0 12 = 00000c00 13020100 ab020000
ffff81017941f0c0 2502114971 S Bo:5:033:4 -115 6 = 02000600 075b
ffff81017941fcc0 2502115012 S Bi:5:033:3 -115 4096 <
ffff81017941f0c0 2502115380 C Bo:5:033:4 0 6 >
ffff81017941fcc0 2502116453 C Bi:5:033:3 0 12 = 00000c00 13020100 ac020000
ffff81017941fcc0 2502118128 S Bi:5:033:3 -115 4096 <
ffff81017941fcc0 2502119474 C Bi:5:033:3 0 8 = 02000800 64000400
ffff81017941fcc0 2502122077 S Bi:5:033:3 -115 4096 <
ffff81017941fcc0 2502122398 C Bi:5:033:3 0 8 = 02000800 00000278
ffff81017941fcc0 2502124010 S Bi:5:033:3 -115 4096 <
ffff81017941f0c0 2502125915 S Bo:5:033:4 -115 8 = 02000800 68000000
ffff81017941f0c0 2502126382 C Bo:5:033:4 0 8 >
ffff81017941fcc0 2502127445 C Bi:5:033:3 0 12 = 00000c00 13020100 ad020000
ffff81017941fcc0 2502129117 S Bi:5:033:3 -115 4096 <
ffff81017941fcc0 2502129405 C Bi:5:033:3 0 8 = 02000800 6e007802
ffff81017941fcc0 2502135932 S Bi:5:033:3 -115 4096 <
ffff81017941fcc0 2502137399 C Bi:5:033:3 0 636 = 02007c02 ab76d27a cdc5e834 0b000000 6e65742e 72696d2e 626c6163 6b626572
ffff81017941fcc0 2502140037 S Bi:5:033:3 -115 4096 <
ffff81017941f0c0 2502142019 S Bo:5:033:4 -115 8 = 02000800 68000000
ffff81017941f0c0 2502142384 C Bo:5:033:4 0 8 >
ffff81017941fcc0 2502143407 C Bi:5:033:3 0 12 = 00000c00 13020100 ae020000
ffff81017941fcc0 2502144896 S Bi:5:033:3 -115 4096 <
ffff81017941fcc0 2502145400 C Bi:5:033:3 0 8 = 02000800 64000000
ffff81017941fcc0 2502147001 S Bi:5:033:3 -115 4096 <
ffff81017941f0c0 2502149056 S Bo:5:033:4 -115 8 = 02000800 84000200
ffff81017941f0c0 2502149392 C Bo:5:033:4 0 8 >
ffff81017941fcc0 2502150402 C Bi:5:033:3 0 12 = 00000c00 13020100 af020000
ffff81017941fcc0 2502151930 S Bo:5:033:4 -115 6 = 02000600 075c
ffff81017941f0c0 2502151969 S Bi:5:033:3 -115 4096 <
ffff81017941fcc0 2502152382 C Bo:5:033:4 0 6 >
ffff81017941f0c0 2502153400 C Bi:5:033:3 0 12 = 00000c00 13020100 b0020000
ffff81017941f0c0 2502154954 S Bi:5:033:3 -115 4096 <
ffff81017941f0c0 2502156397 C Bi:5:033:3 0 8 = 02000800 64000400
ffff81017941f0c0 2502157931 S Bi:5:033:3 -115 4096 <
ffff81017941f0c0 2502158472 C Bi:5:033:3 0 8 = 02000800 000000a8
ffff81017941f0c0 2502161932 S Bo:5:033:4 -115 8 = 02000800 68000000
ffff81017941fcc0 2502161988 S Bi:5:033:3 -115 4096 <
ffff81017941f0c0 2502162384 C Bo:5:033:4 0 8 >
ffff81017941fcc0 2502163404 C Bi:5:033:3 0 12 = 00000c00 13020100 b1020000
ffff81017941fcc0 2502164967 S Bi:5:033:3 -115 4096 <
ffff81017941fcc0 2502165398 C Bi:5:033:3 0 8 = 02000800 6e00a800
ffff81017941fcc0 2502167042 S Bi:5:033:3 -115 4096 <
ffff81017941fcc0 2502167408 C Bi:5:033:3 0 172 = 0200ac00 ab76d27a 9c706a9b 0b000000 6e65742e 72696d2e 626c6163 6b626572
ffff81017941fcc0 2502168957 S Bi:5:033:3 -115 4096 <
ffff81017941f0c0 2502173078 S Bo:5:033:4 -115 8 = 02000800 68000000
ffff81017941f0c0 2502173386 C Bo:5:033:4 0 8 >
ffff81017941fcc0 2502174408 C Bi:5:033:3 0 12 = 00000c00 13020100 b2020000
ffff81017941fcc0 2502175966 S Bi:5:033:3 -115 4096 <
ffff81017941fcc0 2502176400 C Bi:5:033:3 0 8 = 02000800 64000000
ffff81017941fcc0 2502179033 S Bi:5:033:3 -115 4096 <
ffff81017941f0c0 2502180069 S Bo:5:033:4 -115 8 = 02000800 84000200
ffff81017941f0c0 2502180385 C Bo:5:033:4 0 8 >
ffff81017941fcc0 2502181402 C Bi:5:033:3 0 12 = 00000c00 13020100 b3020000
ffff81017941fcc0 2502182902 S Bo:5:033:4 -115 6 = 02000600 075d
ffff81017941f0c0 2502182942 S Bi:5:033:3 -115 4096 <
ffff81017941fcc0 2502183383 C Bo:5:033:4 0 6 >
ffff81017941f0c0 2502184453 C Bi:5:033:3 0 12 = 00000c00 13020100 b4020000
ffff81017941f0c0 2502185939 S Bi:5:033:3 -115 4096 <
ffff81017941f0c0 2502187398 C Bi:5:033:3 0 8 = 02000800 64000400
ffff81017941f0c0 2502189992 S Bi:5:033:3 -115 4096 <
ffff81017941f0c0 2502190400 C Bi:5:033:3 0 8 = 02000800 0000010c
ffff81017941f0c0 2502192179 S Bi:5:033:3 -115 4096 <
ffff81017941fcc0 2502193895 S Bo:5:033:4 -115 8 = 02000800 68000000
ffff81017941fcc0 2502194386 C Bo:5:033:4 0 8 >
ffff81017941f0c0 2502197406 C Bi:5:033:3 0 12 = 00000c00 13020100 b5020000
ffff81017941f0c0 2502198968 S Bi:5:033:3 -115 4096 <
ffff81017941f0c0 2502199401 C Bi:5:033:3 0 8 = 02000800 6e000c01
ffff81017941f0c0 2502203401 S Bi:5:033:3 -115 4096 <
ffff81017941f0c0 2502204404 C Bi:5:033:3 0 272 = 02001001 ab76d27a 17704032 0b000000 6e65742e 72696d2e 626c6163 6b626572
ffff81017941f0c0 2502211680 S Bo:5:033:4 -115 8 = 02000800 68000000
ffff81017941f300 2502211743 S Bi:5:033:3 -115 4096 <
ffff81017941f0c0 2502212387 C Bo:5:033:4 0 8 >
ffff81017941f300 2502214401 C Bi:5:033:3 0 12 = 00000c00 13020100 b6020000
ffff81017941f300 2502217801 S Bi:5:033:3 -115 4096 <
ffff81017941f300 2502218403 C Bi:5:033:3 0 8 = 02000800 64000000
ffff81017941f300 2502221975 S Bi:5:033:3 -115 4096 <
ffff81017941fcc0 2502223923 S Bo:5:033:4 -115 8 = 02000800 84000200
ffff81017941fcc0 2502224389 C Bo:5:033:4 0 8 >
ffff81017941f300 2502225414 C Bi:5:033:3 0 12 = 00000c00 13020100 b7020000
ffff81017941f300 2502226987 S Bo:5:033:4 -115 6 = 02000600 075e
ffff81017941fcc0 2502227032 S Bi:5:033:3 -115 4096 <
ffff81017941f300 2502227387 C Bo:5:033:4 0 6 >
ffff81017941fcc0 2502228406 C Bi:5:033:3 0 12 = 00000c00 13020100 b8020000
ffff81017941fcc0 2502229908 S Bi:5:033:3 -115 4096 <
ffff81017941fcc0 2502232402 C Bi:5:033:3 0 8 = 02000800 64000400
ffff81017941fcc0 2502234886 S Bi:5:033:3 -115 4096 <
ffff81017941fcc0 2502235403 C Bi:5:033:3 0 8 = 02000800 000000b4
ffff81017941fcc0 2502238935 S Bo:5:033:4 -115 8 = 02000800 68000000
ffff81017941f300 2502238996 S Bi:5:033:3 -115 4096 <
ffff81017941fcc0 2502239389 C Bo:5:033:4 0 8 >
ffff81017941f300 2502240404 C Bi:5:033:3 0 12 = 00000c00 13020100 b9020000
ffff81017941f300 2502241816 S Bi:5:033:3 -115 4096 <
ffff81017941f300 2502242403 C Bi:5:033:3 0 8 = 02000800 6e00b400
ffff81017941f300 2502245977 S Bi:5:033:3 -115 4096 <
ffff81017941f300 2502246405 C Bi:5:033:3 0 184 = 0200b800 ab76d27a f5362f6c 0b000000 6e65742e 72696d2e 626c6163 6b626572
ffff81017941f300 2502249660 S Bi:5:033:3 -115 4096 <
ffff81017941fcc0 2502251619 S Bo:5:033:4 -115 8 = 02000800 68000000
ffff81017941f300 2502252406 C Bi:5:033:3 0 12 = 00000c00 13020100 ba020000
ffff81017941fcc0 2502252410 C Bo:5:033:4 0 8 >
ffff81017941fcc0 2502253515 S Bi:5:033:3 -115 4096 <
ffff81017941fcc0 2502254402 C Bi:5:033:3 0 8 = 02000800 64000000
ffff81017941fcc0 2502258065 S Bi:5:033:3 -115 4096 <
ffff81017941f300 2502260975 S Bo:5:033:4 -115 8 = 02000800 84000200
ffff81017941f300 2502261391 C Bo:5:033:4 0 8 >
ffff81017941fcc0 2502262405 C Bi:5:033:3 0 12 = 00000c00 13020100 bb020000
ffff81017941fcc0 2502264946 S Bi:5:033:3 -115 4096 <
ffff81017941f300 2502265878 S Bo:5:033:4 -115 6 = 02000600 075f
ffff81017941f300 2502266389 C Bo:5:033:4 0 6 >
ffff81017941fcc0 2502267404 C Bi:5:033:3 0 12 = 00000c00 13020100 bc020000
ffff81017941fcc0 2502269660 S Bi:5:033:3 -115 4096 <
ffff81017941fcc0 2502270404 C Bi:5:033:3 0 8 = 02000800 64000400
ffff81017941fcc0 2502272824 S Bi:5:033:3 -115 4096 <
ffff81017941fcc0 2502273417 C Bi:5:033:3 0 8 = 02000800 000000b4
ffff81017941fcc0 2502275855 S Bo:5:033:4 -115 8 = 02000800 68000000
ffff81017941f300 2502275905 S Bi:5:033:3 -115 4096 <
ffff81017941fcc0 2502276390 C Bo:5:033:4 0 8 >
ffff81017941f300 2502277411 C Bi:5:033:3 0 12 = 00000c00 13020100 bd020000
ffff81017941f300 2502278720 S Bi:5:033:3 -115 4096 <
ffff81017941f300 2502279406 C Bi:5:033:3 0 8 = 02000800 6e00b400
ffff81017941f300 2502281843 S Bi:5:033:3 -115 4096 <
ffff81017941f300 2502282407 C Bi:5:033:3 0 184 = 0200b800 ab76d27a 9a15d914 0b000000 6e65742e 72696d2e 626c6163 6b626572
ffff81017941f300 2502283850 S Bi:5:033:3 -115 4096 <
ffff81017941fcc0 2502285805 S Bo:5:033:4 -115 8 = 02000800 68000000
ffff81017941fcc0 2502286391 C Bo:5:033:4 0 8 >
ffff81017941f300 2502287405 C Bi:5:033:3 0 12 = 00000c00 13020100 be020000
ffff81017941f300 2502289458 S Bi:5:033:3 -115 4096 <
ffff81017941f300 2502290406 C Bi:5:033:3 0 8 = 02000800 64000000
ffff81017941f300 2502294063 S Bi:5:033:3 -115 4096 <
ffff81017941fcc0 2502296907 S Bo:5:033:4 -115 8 = 02000800 84000200
ffff81017941fcc0 2502297393 C Bo:5:033:4 0 8 >
ffff81017941f300 2502298409 C Bi:5:033:3 0 12 = 00000c00 13020100 bf020000
ffff81017941f300 2502299940 S Bo:5:033:4 -115 6 = 02000600 0760
ffff81017941fcc0 2502299987 S Bi:5:033:3 -115 4096 <
ffff81017941f300 2502300391 C Bo:5:033:4 0 6 >
ffff81017941fcc0 2502301410 C Bi:5:033:3 0 12 = 00000c00 13020100 c0020000
ffff81017941fcc0 2502302828 S Bi:5:033:3 -115 4096 <
ffff81017941fcc0 2502304408 C Bi:5:033:3 0 8 = 02000800 64000400
ffff81017941fcc0 2502305986 S Bi:5:033:3 -115 4096 <
ffff81017941fcc0 2502306408 C Bi:5:033:3 0 8 = 02000800 00000140
ffff81017941fcc0 2502307941 S Bi:5:033:3 -115 4096 <
ffff81017941f300 2502309907 S Bo:5:033:4 -115 8 = 02000800 68000000
ffff81017941f300 2502310393 C Bo:5:033:4 0 8 >
ffff81017941fcc0 2502311407 C Bi:5:033:3 0 12 = 00000c00 13020100 c1020000
ffff81017941fcc0 2502313857 S Bi:5:033:3 -115 4096 <
ffff81017941fcc0 2502314406 C Bi:5:033:3 0 8 = 02000800 6e004001
ffff81017941fcc0 2502317937 S Bi:5:033:3 -115 4096 <
ffff81017941fcc0 2502319412 C Bi:5:033:3 0 324 = 02004401 ab76d27a 0d95747d 0b000000 6e65742e 72696d2e 626c6163 6b626572
ffff81017941fcc0 2502320991 S Bi:5:033:3 -115 4096 <
ffff81017941f300 2502322931 S Bo:5:033:4 -115 8 = 02000800 68000000
ffff81017941f300 2502323393 C Bo:5:033:4 0 8 >
ffff81017941fcc0 2502324417 C Bi:5:033:3 0 12 = 00000c00 13020100 c2020000
ffff81017941fcc0 2502325843 S Bi:5:033:3 -115 4096 <
ffff81017941fcc0 2502326410 C Bi:5:033:3 0 8 = 02000800 64000000
ffff81017941fcc0 2502327917 S Bi:5:033:3 -115 4096 <
ffff81017941f300 2502330899 S Bo:5:033:4 -115 8 = 02000800 84000200
ffff81017941f300 2502331395 C Bo:5:033:4 0 8 >
ffff81017941fcc0 2502332418 C Bi:5:033:3 0 12 = 00000c00 13020100 c3020000
ffff81017941fcc0 2502333917 S Bo:5:033:4 -115 6 = 02000600 0761
ffff81017941f300 2502333959 S Bi:5:033:3 -115 4096 <
ffff81017941fcc0 2502334393 C Bo:5:033:4 0 6 >
ffff81017941f300 2502335408 C Bi:5:033:3 0 12 = 00000c00 13020100 c4020000
ffff81017941f300 2502337843 S Bi:5:033:3 -115 4096 <
ffff81017941f300 2502338408 C Bi:5:033:3 0 8 = 02000800 64000400
ffff81017941f300 2502342981 S Bi:5:033:3 -115 4096 <
ffff81017941f300 2502343411 C Bi:5:033:3 0 8 = 02000800 0000017c
ffff81017941f300 2502345985 S Bi:5:033:3 -115 4096 <
ffff81017941fcc0 2502346956 S Bo:5:033:4 -115 8 = 02000800 68000000
ffff81017941fcc0 2502347394 C Bo:5:033:4 0 8 >
ffff81017941f300 2502348418 C Bi:5:033:3 0 12 = 00000c00 13020100 c5020000
ffff81017941f300 2502349853 S Bi:5:033:3 -115 4096 <
ffff81017941f300 2502350409 C Bi:5:033:3 0 8 = 02000800 6e007c01
ffff81017941f300 2502353943 S Bi:5:033:3 -115 4096 <
ffff81017941f300 2502355411 C Bi:5:033:3 0 384 = 02008001 ab76d27a d2a676b1 0a000000 6e65742e 72696d2e 626c6163 6b626572
ffff81017941f300 2502359038 S Bo:5:033:4 -115 8 = 02000800 68000000
ffff81017941fcc0 2502359092 S Bi:5:033:3 -115 4096 <
ffff81017941f300 2502359394 C Bo:5:033:4 0 8 >
ffff81017941fcc0 2502360413 C Bi:5:033:3 0 12 = 00000c00 13020100 c6020000
ffff81017941fcc0 2502361782 S Bi:5:033:3 -115 4096 <
ffff81017941fcc0 2502362410 C Bi:5:033:3 0 8 = 02000800 64000000
ffff81017941fcc0 2502364941 S Bi:5:033:3 -115 4096 <
ffff81017941f300 2502368072 S Bo:5:033:4 -115 8 = 02000800 84000200
ffff81017941f300 2502368397 C Bo:5:033:4 0 8 >
ffff81017941fcc0 2502369430 C Bi:5:033:3 0 12 = 00000c00 13020100 c7020000
ffff81017941fcc0 2502370945 S Bo:5:033:4 -115 6 = 02000600 0762
ffff81017941f300 2502370987 S Bi:5:033:3 -115 4096 <
ffff81017941fcc0 2502371394 C Bo:5:033:4 0 6 >
ffff81017941f300 2502372419 C Bi:5:033:3 0 12 = 00000c00 13020100 c8020000
ffff81017941f300 2502373842 S Bi:5:033:3 -115 4096 <
ffff81017941f300 2502375409 C Bi:5:033:3 0 8 = 02000800 64000400
ffff81017941f300 2502378032 S Bi:5:033:3 -115 4096 <
ffff81017941f300 2502378415 C Bi:5:033:3 0 8 = 02000800 000000e4
ffff81017941f300 2502380109 S Bi:5:033:3 -115 4096 <
ffff81017941fcc0 2502381966 S Bo:5:033:4 -115 8 = 02000800 68000000
ffff81017941fcc0 2502382396 C Bo:5:033:4 0 8 >
ffff81017941f300 2502383411 C Bi:5:033:3 0 12 = 00000c00 13020100 c9020000
ffff81017941f300 2502385800 S Bi:5:033:3 -115 4096 <
ffff81017941f300 2502386411 C Bi:5:033:3 0 8 = 02000800 6e00e400
ffff81017941f300 2502389709 S Bi:5:033:3 -115 4096 <
ffff81017941f300 2502390413 C Bi:5:033:3 0 232 = 0200e800 ab76d27a f9677e42 0b000000 6e65742e 72696d2e 626c6163 6b626572
ffff81017941f300 2502391717 S Bi:5:033:3 -115 4096 <
ffff81017941fcc0 2502393674 S Bo:5:033:4 -115 8 = 02000800 68000000
ffff81017941fcc0 2502394398 C Bo:5:033:4 0 8 >
ffff81017941f300 2502395414 C Bi:5:033:3 0 12 = 00000c00 13020100 ca020000
ffff81017941f300 2502396539 S Bi:5:033:3 -115 4096 <
ffff81017941f300 2502397411 C Bi:5:033:3 0 8 = 02000800 64000000
ffff81017941f300 2502398637 S Bi:5:033:3 -115 4096 <
ffff81017941fcc0 2502401679 S Bo:5:033:4 -115 8 = 02000800 84000200
ffff81017941fcc0 2502402399 C Bo:5:033:4 0 8 >
ffff81017941f300 2502403416 C Bi:5:033:3 0 12 = 00000c00 13020100 cb020000
ffff81017941f300 2502404652 S Bo:5:033:4 -115 6 = 02000600 0763
ffff81017941fcc0 2502404693 S Bi:5:033:3 -115 4096 <
ffff81017941f300 2502405397 C Bo:5:033:4 0 6 >
ffff81017941fcc0 2502406411 C Bi:5:033:3 0 12 = 00000c00 13020100 cc020000
ffff81017941fcc0 2502409452 S Bi:5:033:3 -115 4096 <
ffff81017941fcc0 2502410414 C Bi:5:033:3 0 8 = 02000800 64000400
ffff81017941fcc0 2502413953 S Bi:5:033:3 -115 4096 <
ffff81017941fcc0 2502414414 C Bi:5:033:3 0 8 = 02000800 000000f0
ffff81017941fcc0 2502417051 S Bi:5:033:3 -115 4096 <
ffff81017941f300 2502419997 S Bo:5:033:4 -115 8 = 02000800 68000000
ffff81017941f300 2502420400 C Bo:5:033:4 0 8 >
ffff81017941fcc0 2502421417 C Bi:5:033:3 0 12 = 00000c00 13020100 cd020000
ffff81017941fcc0 2502422892 S Bi:5:033:3 -115 4096 <
ffff81017941fcc0 2502423413 C Bi:5:033:3 0 8 = 02000800 6e00f000
ffff81017941fcc0 2502425271 S Bi:5:033:3 -115 4096 <
ffff81017941fcc0 2502426417 C Bi:5:033:3 0 244 = 0200f400 ab76d27a be34d174 0b000000 6e65742e 72696d2e 626c6163 6b626572
ffff81017941fcc0 2502428006 S Bi:5:033:3 -115 4096 <
ffff81017941f300 2502429972 S Bo:5:033:4 -115 8 = 02000800 68000000
ffff81017941f300 2502430399 C Bo:5:033:4 0 8 >
ffff81017941fcc0 2502431414 C Bi:5:033:3 0 12 = 00000c00 13020100 ce020000
ffff81017941fcc0 2502433803 S Bi:5:033:3 -115 4096 <
ffff81017941fcc0 2502434413 C Bi:5:033:3 0 8 = 02000800 64000000
ffff81017941fcc0 2502436872 S Bi:5:033:3 -115 4096 <
ffff81017941f300 2502439900 S Bo:5:033:4 -115 8 = 02000800 84000200
ffff81017941f300 2502440402 C Bo:5:033:4 0 8 >
ffff81017941fcc0 2502441417 C Bi:5:033:3 0 12 = 00000c00 13020100 cf020000
ffff81017941fcc0 2502442950 S Bo:5:033:4 -115 6 = 02000600 0764
ffff81017941f300 2502442992 S Bi:5:033:3 -115 4096 <
ffff81017941fcc0 2502443399 C Bo:5:033:4 0 6 >
ffff81017941f300 2502444415 C Bi:5:033:3 0 12 = 00000c00 13020100 d0020000
ffff81017941f300 2502445828 S Bi:5:033:3 -115 4096 <
ffff81017941f300 2502447414 C Bi:5:033:3 0 8 = 02000800 64000400
ffff81017941f300 2502450608 S Bi:5:033:3 -115 4096 <
ffff81017941f300 2502451416 C Bi:5:033:3 0 8 = 02000800 00000120
ffff81017941f300 2502454653 S Bo:5:033:4 -115 8 = 02000800 68000000
ffff81017941fcc0 2502454704 S Bi:5:033:3 -115 4096 <
ffff81017941f300 2502455400 C Bo:5:033:4 0 8 >
ffff81017941fcc0 2502456416 C Bi:5:033:3 0 12 = 00000c00 13020100 d1020000
ffff81017941fcc0 2502458562 S Bi:5:033:3 -115 4096 <
ffff81017941fcc0 2502459439 C Bi:5:033:3 0 8 = 02000800 6e002001
ffff81017941fcc0 2502460688 S Bi:5:033:3 -115 4096 <
ffff81017941fcc0 2502461481 C Bi:5:033:3 0 292 = 02002401 ab76d27a 1da53e30 0b000000 6e65742e 72696d2e 626c6163 6b626572
ffff81017941fcc0 2502463696 S Bi:5:033:3 -115 4096 <
ffff81017941f300 2502465647 S Bo:5:033:4 -115 8 = 02000800 68000000
ffff81017941f300 2502466402 C Bo:5:033:4 0 8 >
ffff81017941fcc0 2502467418 C Bi:5:033:3 0 12 = 00000c00 13020100 d2020000
ffff81017941fcc0 2502469516 S Bi:5:033:3 -115 4096 <
ffff81017941fcc0 2502470415 C Bi:5:033:3 0 8 = 02000800 64000000
ffff81017941fcc0 2502472877 S Bi:5:033:3 -115 4096 <
ffff81017941f0c0 2502475921 S Bo:5:033:4 -115 8 = 02000800 84000200
ffff81017941f0c0 2502476403 C Bo:5:033:4 0 8 >
ffff81017941fcc0 2502477419 C Bi:5:033:3 0 12 = 00000c00 13020100 d3020000
ffff81017941fcc0 2502478917 S Bo:5:033:4 -115 6 = 02000600 0765
ffff81017941f0c0 2502478963 S Bi:5:033:3 -115 4096 <
ffff81017941fcc0 2502479401 C Bo:5:033:4 0 6 >
ffff81017941f0c0 2502480418 C Bi:5:033:3 0 12 = 00000c00 13020100 d4020000
ffff81017941f0c0 2502481802 S Bi:5:033:3 -115 4096 <
ffff81017941f0c0 2502483415 C Bi:5:033:3 0 8 = 02000800 64000400
ffff81017941f0c0 2502484907 S Bi:5:033:3 -115 4096 <
ffff81017941f0c0 2502485426 C Bi:5:033:3 0 8 = 02000800 00000100
ffff81017941f0c0 2502487045 S Bi:5:033:3 -115 4096 <
ffff81017941f300 2502488905 S Bo:5:033:4 -115 8 = 02000800 68000000
ffff81017941f300 2502489404 C Bo:5:033:4 0 8 >
ffff81017941f0c0 2502490467 C Bi:5:033:3 0 12 = 00000c00 13020100 d5020000
ffff81017941f0c0 2502491944 S Bi:5:033:3 -115 4096 <
ffff81017941f0c0 2502492417 C Bi:5:033:3 0 8 = 02000800 6e000001
ffff81017941f0c0 2502494839 S Bi:5:033:3 -115 4096 <
ffff81017941f0c0 2502495418 C Bi:5:033:3 0 260 = 02000401 ab76d27a edbf69fc 0a000000 6e65742e 72696d2e 626c6163 6b626572
ffff81017941f0c0 2502497950 S Bi:5:033:3 -115 4096 <
ffff81017941f300 2502500904 S Bo:5:033:4 -115 8 = 02000800 68000000
ffff81017941f300 2502501404 C Bo:5:033:4 0 8 >
ffff81017941f0c0 2502502419 C Bi:5:033:3 0 12 = 00000c00 13020100 d6020000
ffff81017941f0c0 2502505803 S Bi:5:033:3 -115 4096 <
ffff81017941f0c0 2502506418 C Bi:5:033:3 0 8 = 02000800 64000000
ffff81017941f0c0 2502509625 S Bi:5:033:3 -115 4096 <
ffff81017941f300 2502511787 S Bo:5:033:4 -115 8 = 02000800 84000200
ffff81017941f300 2502512406 C Bo:5:033:4 0 8 >
ffff81017941f0c0 2502513422 C Bi:5:033:3 0 12 = 00000c00 13020100 d7020000
ffff81017941f0c0 2502514666 S Bi:5:033:3 -115 4096 <
ffff81017941f300 2502515660 S Bo:5:033:4 -115 6 = 02000600 0767
ffff81017941f300 2502516403 C Bo:5:033:4 0 6 >
ffff81017941f0c0 2502517429 C Bi:5:033:3 0 12 = 00000c00 13020100 d8020000
ffff81017941f0c0 2502519576 S Bi:5:033:3 -115 4096 <
ffff81017941f0c0 2502520420 C Bi:5:033:3 0 8 = 02000800 64000400
ffff81017941f0c0 2502521690 S Bi:5:033:3 -115 4096 <
ffff81017941f0c0 2502522422 C Bi:5:033:3 0 8 = 02000800 00000224
ffff81017941f0c0 2502523690 S Bi:5:033:3 -115 4096 <
ffff81017941f300 2502525647 S Bo:5:033:4 -115 8 = 02000800 68000000
ffff81017941f300 2502526404 C Bo:5:033:4 0 8 >
ffff81017941f0c0 2502527421 C Bi:5:033:3 0 12 = 00000c00 13020100 d9020000
ffff81017941f0c0 2502529464 S Bi:5:033:3 -115 4096 <
ffff81017941f0c0 2502530419 C Bi:5:033:3 0 8 = 02000800 6e002402
ffff81017941f0c0 2502534000 S Bi:5:033:3 -115 4096 <
ffff81017941f0c0 2502535422 C Bi:5:033:3 0 552 = 02002802 ab76d27a 25d0e712 04000000 6e65742e 72696d2e 626c6163 6b626572
ffff81017941f0c0 2502537824 S Bi:5:033:3 -115 4096 <
ffff81017941f300 2502539823 S Bo:5:033:4 -115 8 = 02000800 68000000
ffff81017941f300 2502540257 C Bo:5:033:4 0 8 >
ffff81017941f0c0 2502541422 C Bi:5:033:3 0 12 = 00000c00 13020100 da020000
ffff81017941f0c0 2502542713 S Bi:5:033:3 -115 4096 <
ffff81017941f0c0 2502543421 C Bi:5:033:3 0 8 = 02000800 64000000
ffff81017941f0c0 2502545799 S Bi:5:033:3 -115 4096 <
ffff81017941f300 2502547795 S Bo:5:033:4 -115 8 = 02000800 84000200
ffff81017941f300 2502548408 C Bo:5:033:4 0 8 >
ffff81017941f0c0 2502549425 C Bi:5:033:3 0 12 = 00000c00 13020100 db020000
ffff81017941f0c0 2502550866 S Bo:5:033:4 -115 6 = 02000600 0768
ffff81017941f300 2502550908 S Bi:5:033:3 -115 4096 <
ffff81017941f0c0 2502551405 C Bo:5:033:4 0 6 >
ffff81017941f300 2502552426 C Bi:5:033:3 0 12 = 00000c00 13020100 dc020000
ffff81017941f300 2502553695 S Bi:5:033:3 -115 4096 <
ffff81017941f300 2502555419 C Bi:5:033:3 0 8 = 02000800 64000400
ffff81017941f300 2502557957 S Bi:5:033:3 -115 4096 <
ffff81017941f300 2502558425 C Bi:5:033:3 0 8 = 02000800 00000128
ffff81017941f300 2502559997 S Bi:5:033:3 -115 4096 <
ffff81017941f0c0 2502561961 S Bo:5:033:4 -115 8 = 02000800 68000000
ffff81017941f0c0 2502562406 C Bo:5:033:4 0 8 >
ffff81017941f300 2502563421 C Bi:5:033:3 0 12 = 00000c00 13020100 dd020000
ffff81017941f300 2502565808 S Bi:5:033:3 -115 4096 <
ffff81017941f300 2502566421 C Bi:5:033:3 0 8 = 02000800 6e002801
ffff81017941f300 2502570611 S Bi:5:033:3 -115 4096 <
ffff81017941f300 2502571423 C Bi:5:033:3 0 300 = 02002c01 ab76d27a 82f3c80a 0a000000 6e65742e 72696d2e 626c6163 6b626572
ffff81017941f300 2502573664 S Bi:5:033:3 -115 4096 <
ffff81017941f0c0 2502575665 S Bo:5:033:4 -115 8 = 02000800 68000000
ffff81017941f0c0 2502576408 C Bo:5:033:4 0 8 >
ffff81017941f300 2502577425 C Bi:5:033:3 0 12 = 00000c00 13020100 de020000
ffff81017941f300 2502578563 S Bi:5:033:3 -115 4096 <
ffff81017941f300 2502579421 C Bi:5:033:3 0 8 = 02000800 64000000
ffff81017941f300 2502583620 S Bo:5:033:4 -115 8 = 02000800 84000200
ffff81017941f0c0 2502583682 S Bi:5:033:3 -115 4096 <
ffff81017941f300 2502584408 C Bo:5:033:4 0 8 >
ffff81017941f0c0 2502584428 C Bi:5:033:3 0 12 = 00000c00 13020100 df020000
ffff81017941f0c0 2502585640 S Bo:5:033:4 -115 6 = 02000600 0769
ffff81017941f300 2502585679 S Bi:5:033:3 -115 4096 <
ffff81017941f0c0 2502586406 C Bo:5:033:4 0 6 >
ffff81017941f300 2502591425 C Bi:5:033:3 0 12 = 00000c00 13020100 e0020000
ffff81017941f300 2502593875 S Bi:5:033:3 -115 4096 <
ffff81017941f300 2502594422 C Bi:5:033:3 0 8 = 02000800 64000400
ffff81017941f300 2502596832 S Bi:5:033:3 -115 4096 <
ffff81017941f300 2502597434 C Bi:5:033:3 0 8 = 02000800 000000c8
ffff81017941f300 2502598863 S Bi:5:033:3 -115 4096 <
ffff81017941f0c0 2502600692 S Bo:5:033:4 -115 8 = 02000800 68000000
ffff81017941f0c0 2502601409 C Bo:5:033:4 0 8 >
ffff81017941f300 2502602425 C Bi:5:033:3 0 12 = 00000c00 13020100 e1020000
ffff81017941f300 2502605869 S Bi:5:033:3 -115 4096 <
ffff81017941f300 2502606424 C Bi:5:033:3 0 8 = 02000800 6e00c800
ffff81017941f300 2502609658 S Bi:5:033:3 -115 4096 <
ffff81017941f300 2502610425 C Bi:5:033:3 0 204 = 0200cc00 ab76d27a 684462f5 0a000000 6e65742e 72696d2e 626c6163 6b626572
ffff81017941f300 2502611732 S Bi:5:033:3 -115 4096 <
ffff81017941f0c0 2502613623 S Bo:5:033:4 -115 8 = 02000800 68000000
ffff81017941f300 2502614428 C Bi:5:033:3 0 12 = 00000c00 13020100 e2020000
ffff81017941f0c0 2502614433 C Bo:5:033:4 0 8 >
ffff81017941f0c0 2502617876 S Bi:5:033:3 -115 4096 <
ffff81017941f0c0 2502618426 C Bi:5:033:3 0 8 = 02000800 64000000
ffff81017941f0c0 2502621893 S Bi:5:033:3 -115 4096 <
ffff81017941f300 2502623981 S Bo:5:033:4 -115 8 = 02000800 84000200
ffff81017941f300 2502624411 C Bo:5:033:4 0 8 >
ffff81017941f0c0 2502625436 C Bi:5:033:3 0 12 = 00000c00 13020100 e3020000
ffff81017941f0c0 2502626717 S Bo:5:033:4 -115 6 = 02000600 076a
ffff81017941f300 2502626762 S Bi:5:033:3 -115 4096 <
ffff81017941f0c0 2502627408 C Bo:5:033:4 0 6 >
ffff81017941f300 2502628473 C Bi:5:033:3 0 12 = 00000c00 13020100 e4020000
ffff81017941f300 2502629734 S Bi:5:033:3 -115 4096 <
ffff81017941f300 2502631424 C Bi:5:033:3 0 8 = 02000800 64000400
ffff81017941f300 2502633925 S Bi:5:033:3 -115 4096 <
ffff81017941f300 2502634425 C Bi:5:033:3 0 8 = 02000800 000000cc
ffff81017941f300 2502637837 S Bi:5:033:3 -115 4096 <
ffff81017941f0c0 2502638943 S Bo:5:033:4 -115 8 = 02000800 68000000
ffff81017941f0c0 2502639412 C Bo:5:033:4 0 8 >
ffff81017941f300 2502640429 C Bi:5:033:3 0 12 = 00000c00 13020100 e5020000
ffff81017941f300 2502641846 S Bi:5:033:3 -115 4096 <
ffff81017941f300 2502642425 C Bi:5:033:3 0 8 = 02000800 6e00cc00
ffff81017941f300 2502645881 S Bi:5:033:3 -115 4096 <
ffff81017941f300 2502646427 C Bi:5:033:3 0 208 = 0200d000 ab76d27a 0c8cab76 0a000000 6e65742e 72696d2e 626c6163 6b626572
ffff81017941f300 2502649604 S Bi:5:033:3 -115 4096 <
ffff81017941f0c0 2502651486 S Bo:5:033:4 -115 8 = 02000800 68000000
ffff81017941f300 2502652430 C Bi:5:033:3 0 12 = 00000c00 13020100 e6020000
ffff81017941f0c0 2502652435 C Bo:5:033:4 0 8 >
ffff81017941f0c0 2502653511 S Bi:5:033:3 -115 4096 <
ffff81017941f0c0 2502654425 C Bi:5:033:3 0 8 = 02000800 64000000
ffff81017941f0c0 2502658168 S Bi:5:033:3 -115 4096 <
ffff81017941f300 2502660761 S Bo:5:033:4 -115 8 = 02000800 84000200
ffff81017941f300 2502661414 C Bo:5:033:4 0 8 >
ffff81017941f0c0 2502662428 C Bi:5:033:3 0 12 = 00000c00 13020100 e7020000
ffff81017941f0c0 2502664951 S Bi:5:033:3 -115 4096 <
ffff81017941f300 2502665877 S Bo:5:033:4 -115 6 = 02000600 076b
ffff81017941f300 2502666412 C Bo:5:033:4 0 6 >
ffff81017941f0c0 2502667427 C Bi:5:033:3 0 12 = 00000c00 13020100 e8020000
ffff81017941f0c0 2502669599 S Bi:5:033:3 -115 4096 <
ffff81017941f0c0 2502670427 C Bi:5:033:3 0 8 = 02000800 64000400
ffff81017941f0c0 2502673942 S Bi:5:033:3 -115 4096 <
ffff81017941f0c0 2502674429 C Bi:5:033:3 0 8 = 02000800 000000a8
ffff81017941f0c0 2502677963 S Bi:5:033:3 -115 4096 <
ffff81017941f300 2502679008 S Bo:5:033:4 -115 8 = 02000800 68000000
ffff81017941f300 2502679415 C Bo:5:033:4 0 8 >
ffff81017941f0c0 2502680430 C Bi:5:033:3 0 12 = 00000c00 13020100 e9020000
ffff81017941f0c0 2502681961 S Bi:5:033:3 -115 4096 <
ffff81017941f0c0 2502682428 C Bi:5:033:3 0 8 = 02000800 6e00a800
ffff81017941f0c0 2502684833 S Bi:5:033:3 -115 4096 <
ffff81017941f0c0 2502685441 C Bi:5:033:3 0 172 = 0200ac00 ab76d27a 2944c710 0a000000 6e65742e 72696d2e 626c6163 6b626572
ffff81017941f0c0 2502686881 S Bi:5:033:3 -115 4096 <
ffff81017941f300 2502688961 S Bo:5:033:4 -115 8 = 02000800 68000000
ffff81017941f300 2502689430 C Bo:5:033:4 0 8 >
ffff81017941f0c0 2502690432 C Bi:5:033:3 0 12 = 00000c00 13020100 ea020000
ffff81017941f0c0 2502691869 S Bi:5:033:3 -115 4096 <
ffff81017941f0c0 2502692429 C Bi:5:033:3 0 8 = 02000800 64000000
ffff81017941f0c0 2502695960 S Bo:5:033:4 -115 8 = 02000800 84000200
ffff81017941f300 2502696023 S Bi:5:033:3 -115 4096 <
ffff81017941f0c0 2502696422 C Bo:5:033:4 0 8 >
ffff81017941f300 2502697434 C Bi:5:033:3 0 12 = 00000c00 13020100 eb020000
ffff81017941f300 2502698826 S Bo:5:033:4 -115 6 = 02000600 076c
ffff81017941f0c0 2502698868 S Bi:5:033:3 -115 4096 <
ffff81017941f300 2502699413 C Bo:5:033:4 0 6 >
ffff81017941f0c0 2502700431 C Bi:5:033:3 0 12 = 00000c00 13020100 ec020000
ffff81017941f0c0 2502701853 S Bi:5:033:3 -115 4096 <
ffff81017941f0c0 2502703428 C Bi:5:033:3 0 8 = 02000800 64000400
ffff81017941f0c0 2502705872 S Bi:5:033:3 -115 4096 <
ffff81017941f0c0 2502706432 C Bi:5:033:3 0 8 = 02000800 000000d4
ffff81017941f0c0 2502709445 S Bi:5:033:3 -115 4096 <
ffff81017941f300 2502711460 S Bo:5:033:4 -115 8 = 02000800 68000000
ffff81017941f0c0 2502712435 C Bi:5:033:3 0 12 = 00000c00 13020100 ed020000
ffff81017941f300 2502712442 C Bo:5:033:4 0 8 >
ffff81017941f300 2502713508 S Bi:5:033:3 -115 4096 <
ffff81017941f300 2502714430 C Bi:5:033:3 0 8 = 02000800 6e00d400
ffff81017941f300 2502716844 S Bi:5:033:3 -115 4096 <
ffff81017941f300 2502717439 C Bi:5:033:3 0 216 = 0200d800 ab76d27a 62556f40 0b000000 6e65742e 72696d2e 626c6163 6b626572
ffff81017941f300 2502718970 S Bi:5:033:3 -115 4096 <
ffff81017941f0c0 2502721711 S Bo:5:033:4 -115 8 = 02000800 68000000
ffff81017941f0c0 2502722415 C Bo:5:033:4 0 8 >
ffff81017941f300 2502723432 C Bi:5:033:3 0 12 = 00000c00 13020100 ee020000
ffff81017941f300 2502725905 S Bi:5:033:3 -115 4096 <
ffff81017941f300 2502726431 C Bi:5:033:3 0 8 = 02000800 64000000
ffff81017941f300 2502731720 S Bo:5:033:4 -115 8 = 02000800 84000200
ffff81017941f0c0 2502731781 S Bi:5:033:3 -115 4096 <
ffff81017941f300 2502732417 C Bo:5:033:4 0 8 >
ffff81017941f0c0 2502733433 C Bi:5:033:3 0 12 = 00000c00 13020100 ef020000
ffff81017941f0c0 2502734508 S Bo:5:033:4 -115 6 = 02000600 076d
ffff81017941f300 2502734547 S Bi:5:033:3 -115 4096 <
ffff81017941f0c0 2502735414 C Bo:5:033:4 0 6 >
ffff81017941f300 2502735434 C Bi:5:033:3 0 12 = 00000c00 13020100 f0020000
ffff81017941f300 2502737547 S Bi:5:033:3 -115 4096 <
ffff81017941f300 2502738431 C Bi:5:033:3 0 8 = 02000800 64000400
ffff81017941f300 2502742886 S Bi:5:033:3 -115 4096 <
ffff81017941f300 2502743433 C Bi:5:033:3 0 8 = 02000800 000000ec
ffff81017941f300 2502745786 S Bi:5:033:3 -115 4096 <
ffff81017941f0c0 2502746733 S Bo:5:033:4 -115 8 = 02000800 68000000
ffff81017941f0c0 2502747417 C Bo:5:033:4 0 8 >
ffff81017941f300 2502748484 C Bi:5:033:3 0 12 = 00000c00 13020100 f1020000
ffff81017941f300 2502749765 S Bi:5:033:3 -115 4096 <
ffff81017941f300 2502750432 C Bi:5:033:3 0 8 = 02000800 6e00ec00
ffff81017941f300 2502752889 S Bi:5:033:3 -115 4096 <
ffff81017941f300 2502753441 C Bi:5:033:3 0 240 = 0200f000 ab76d27a fe6507c0 0b000000 6e65742e 72696d2e 626c6163 6b626572
ffff81017941f300 2502755914 S Bi:5:033:3 -115 4096 <
ffff81017941f0c0 2502756821 S Bo:5:033:4 -115 8 = 02000800 68000000
ffff81017941f0c0 2502757418 C Bo:5:033:4 0 8 >
ffff81017941f300 2502758436 C Bi:5:033:3 0 12 = 00000c00 13020100 f2020000
ffff81017941f300 2502759858 S Bi:5:033:3 -115 4096 <
ffff81017941f300 2502760434 C Bi:5:033:3 0 8 = 02000800 64000000
ffff81017941f300 2502761894 S Bi:5:033:3 -115 4096 <
ffff81017941f0c0 2502765858 S Bo:5:033:4 -115 8 = 02000800 84000200
ffff81017941f0c0 2502766419 C Bo:5:033:4 0 8 >
ffff81017941f300 2502767434 C Bi:5:033:3 0 12 = 00000c00 13020100 f3020000
ffff81017941f300 2502769445 S Bo:5:033:4 -115 6 = 02000600 076e
ffff81017941f0c0 2502769515 S Bi:5:033:3 -115 4096 <
ffff81017941f300 2502770416 C Bo:5:033:4 0 6 >
ffff81017941f0c0 2502770436 C Bi:5:033:3 0 12 = 00000c00 13020100 f4020000
ffff81017941f0c0 2502773876 S Bi:5:033:3 -115 4096 <
ffff81017941f0c0 2502774434 C Bi:5:033:3 0 8 = 02000800 64000400
ffff81017941f0c0 2502777872 S Bi:5:033:3 -115 4096 <
ffff81017941f0c0 2502778439 C Bi:5:033:3 0 8 = 02000800 00000174
ffff81017941f0c0 2502781714 S Bo:5:033:4 -115 8 = 02000800 68000000
ffff81017941f300 2502781766 S Bi:5:033:3 -115 4096 <
ffff81017941f0c0 2502782418 C Bo:5:033:4 0 8 >
ffff81017941f300 2502783435 C Bi:5:033:3 0 12 = 00000c00 13020100 f5020000
ffff81017941f300 2502785882 S Bi:5:033:3 -115 4096 <
ffff81017941f300 2502786433 C Bi:5:033:3 0 8 = 02000800 6e007401
ffff81017941f300 2502788661 S Bi:5:033:3 -115 4096 <
ffff81017941f300 2502789450 C Bi:5:033:3 0 376 = 02007801 ab76d27a afc99b8b 0a000000 6e65742e 72696d2e 626c6163 6b626572
ffff81017941f300 2502792484 S Bo:5:033:4 -115 8 = 02000800 68000000
ffff81017941f0c0 2502792534 S Bi:5:033:3 -115 4096 <
ffff81017941f300 2502793419 C Bo:5:033:4 0 8 >
ffff81017941f0c0 2502793439 C Bi:5:033:3 0 12 = 00000c00 13020100 f6020000
ffff81017941f0c0 2502797866 S Bi:5:033:3 -115 4096 <
ffff81017941f0c0 2502798435 C Bi:5:033:3 0 8 = 02000800 64000000
ffff81017941f0c0 2502801904 S Bi:5:033:3 -115 4096 <
ffff81017941f300 2502804779 S Bo:5:033:4 -115 8 = 02000800 84000200
ffff81017941f300 2502805422 C Bo:5:033:4 0 8 >
ffff81017941f0c0 2502806435 C Bi:5:033:3 0 12 = 00000c00 13020100 f7020000
ffff81017941f0c0 2502809685 S Bo:5:033:4 -115 6 = 02000600 076f
ffff81017941f300 2502809736 S Bi:5:033:3 -115 4096 <
ffff81017941f0c0 2502810420 C Bo:5:033:4 0 6 >
ffff81017941f300 2502811438 C Bi:5:033:3 0 12 = 00000c00 13020100 f8020000
ffff81017941f300 2502812659 S Bi:5:033:3 -115 4096 <
ffff81017941f300 2502814434 C Bi:5:033:3 0 8 = 02000800 64000400
ffff81017941f300 2502816810 S Bi:5:033:3 -115 4096 <
ffff81017941f300 2502817446 C Bi:5:033:3 0 8 = 02000800 00000244
ffff81017941f300 2502820810 S Bo:5:033:4 -115 8 = 02000800 68000000
ffff81017941f0c0 2502820868 S Bi:5:033:3 -115 4096 <
ffff81017941f300 2502821422 C Bo:5:033:4 0 8 >
ffff81017941f0c0 2502822436 C Bi:5:033:3 0 12 = 00000c00 13020100 f9020000
ffff81017941f0c0 2502825792 S Bi:5:033:3 -115 4096 <
ffff81017941f0c0 2502826437 C Bi:5:033:3 0 8 = 02000800 6e004402
ffff81017941f0c0 2502829585 S Bi:5:033:3 -115 4096 <
ffff81017941f0c0 2502830439 C Bi:5:033:3 0 584 = 02004802 ab76d27a b3af7ae1 0b000000 6e65742e 72696d2e 626c6163 6b626572
ffff81017941f0c0 2502831635 S Bi:5:033:3 -115 4096 <
ffff81017941f300 2502833594 S Bo:5:033:4 -115 8 = 02000800 68000000
ffff81017941f0c0 2502834438 C Bi:5:033:3 0 12 = 00000c00 13020100 fa020000
ffff81017941f300 2502834442 C Bo:5:033:4 0 8 >
ffff81017941f300 2502838023 S Bi:5:033:3 -115 4096 <
ffff81017941f300 2502838438 C Bi:5:033:3 0 8 = 02000800 64000000
ffff81017941f0c0 2502843844 S Bi:5:033:3 -115 4096 <
ffff81017941fcc0 2502846894 S Bo:5:033:4 -115 8 = 02000800 84000200
ffff81017941fcc0 2502847424 C Bo:5:033:4 0 8 >
ffff81017941f0c0 2502848441 C Bi:5:033:3 0 12 = 00000c00 13020100 fb020000
ffff81017941f0c0 2502849924 S Bo:5:033:4 -115 6 = 02000600 0770
ffff81017941fcc0 2502849967 S Bi:5:033:3 -115 4096 <
ffff81017941f0c0 2502850421 C Bo:5:033:4 0 6 >
ffff81017941fcc0 2502851437 C Bi:5:033:3 0 12 = 00000c00 13020100 fc020000
ffff81017941fcc0 2502853800 S Bi:5:033:3 -115 4096 <
ffff81017941fcc0 2502854438 C Bi:5:033:3 0 8 = 02000800 64000400
ffff81017941fcc0 2502858074 S Bi:5:033:3 -115 4096 <
ffff81017941fcc0 2502858441 C Bi:5:033:3 0 8 = 02000800 00000238
ffff81017941fcc0 2502860066 S Bi:5:033:3 -115 4096 <
ffff81017941f0c0 2502862115 S Bo:5:033:4 -115 8 = 02000800 68000000
ffff81017941f0c0 2502862434 C Bo:5:033:4 0 8 >
ffff81017941fcc0 2502863450 C Bi:5:033:3 0 12 = 00000c00 13020100 fd020000
ffff81017941fcc0 2502864996 S Bi:5:033:3 -115 4096 <
ffff81017941fcc0 2502865438 C Bi:5:033:3 0 8 = 02000800 6e003802
ffff81017941fcc0 2502869697 S Bi:5:033:3 -115 4096 <
ffff81017941fcc0 2502870441 C Bi:5:033:3 0 572 = 02003c02 ab76d27a 927c7c63 0b000000 6e65742e 72696d2e 626c6163 6b626572
ffff81017941fcc0 2502871661 S Bi:5:033:3 -115 4096 <
ffff81017941f0c0 2502873649 S Bo:5:033:4 -115 8 = 02000800 68000000
ffff81017941f0c0 2502874423 C Bo:5:033:4 0 8 >
ffff81017941fcc0 2502875439 C Bi:5:033:3 0 12 = 00000c00 13020100 fe020000
ffff81017941fcc0 2502877817 S Bi:5:033:3 -115 4096 <
ffff81017941fcc0 2502878438 C Bi:5:033:3 0 8 = 02000800 64000000
ffff81017941fcc0 2502884917 S Bo:5:033:4 -115 8 = 02000800 84000200
ffff81017941f0c0 2502884978 S Bi:5:033:3 -115 4096 <
ffff81017941fcc0 2502885425 C Bo:5:033:4 0 8 >
ffff81017941f0c0 2502886439 C Bi:5:033:3 0 12 = 00000c00 13020100 ff020000
ffff81017941f0c0 2502889472 S Bo:5:033:4 -115 6 = 02000600 0771
ffff81017941fcc0 2502889516 S Bi:5:033:3 -115 4096 <
ffff81017941f0c0 2502890423 C Bo:5:033:4 0 6 >
ffff81017941fcc0 2502890443 C Bi:5:033:3 0 12 = 00000c00 13020100 00030000
ffff81017941fcc0 2502891498 S Bi:5:033:3 -115 4096 <
ffff81017941fcc0 2502893443 C Bi:5:033:3 0 8 = 02000800 64000400
ffff81017941fcc0 2502895555 S Bi:5:033:3 -115 4096 <
ffff81017941fcc0 2502896440 C Bi:5:033:3 0 8 = 02000800 000000b4
ffff81017941fcc0 2502897650 S Bi:5:033:3 -115 4096 <
ffff81017941f0c0 2502899599 S Bo:5:033:4 -115 8 = 02000800 68000000
ffff81017941fcc0 2502900443 C Bi:5:033:3 0 12 = 00000c00 13020100 01030000
ffff81017941f0c0 2502900447 C Bo:5:033:4 0 8 >
ffff81017941f0c0 2502901486 S Bi:5:033:3 -115 4096 <
ffff81017941f0c0 2502902439 C Bi:5:033:3 0 8 = 02000800 6e00b400
ffff81017941f0c0 2502906129 S Bi:5:033:3 -115 4096 <
ffff81017941f0c0 2502906486 C Bi:5:033:3 0 184 = 0200b800 ab76d27a bd2c6cf3 0b000000 6e65742e 72696d2e 626c6163 6b626572
ffff81017941f0c0 2502908109 S Bi:5:033:3 -115 4096 <
ffff81017941f3c0 2502912055 S Bo:5:033:4 -115 8 = 02000800 68000000
ffff81017941f3c0 2502912428 C Bo:5:033:4 0 8 >
ffff81017941f0c0 2502913444 C Bi:5:033:3 0 12 = 00000c00 13020100 02030000
ffff81017941f0c0 2502914951 S Bi:5:033:3 -115 4096 <
ffff81017941f0c0 2502915441 C Bi:5:033:3 0 8 = 02000800 64000000
ffff81017941f0c0 2502917035 S Bi:5:033:3 -115 4096 <
ffff81017941f3c0 2502921026 S Bo:5:033:4 -115 8 = 02000800 84000200
ffff81017941f3c0 2502921428 C Bo:5:033:4 0 8 >
ffff81017941f0c0 2502922443 C Bi:5:033:3 0 12 = 00000c00 13020100 03030000
ffff81017941f0c0 2502924914 S Bi:5:033:3 -115 4096 <
ffff81017941f3c0 2502925874 S Bo:5:033:4 -115 6 = 02000600 0772
ffff81017941f3c0 2502926428 C Bo:5:033:4 0 6 >
ffff81017941f0c0 2502927443 C Bi:5:033:3 0 12 = 00000c00 13020100 04030000
ffff81017941f0c0 2502929608 S Bi:5:033:3 -115 4096 <
ffff81017941f0c0 2502930443 C Bi:5:033:3 0 8 = 02000800 64000400
ffff81017941f0c0 2502932643 S Bi:5:033:3 -115 4096 <
ffff81017941f0c0 2502933442 C Bi:5:033:3 0 8 = 02000800 0000015c
ffff81017941f0c0 2502936915 S Bi:5:033:3 -115 4096 <
ffff81017941f3c0 2502938984 S Bo:5:033:4 -115 8 = 02000800 68000000
ffff81017941f3c0 2502939429 C Bo:5:033:4 0 8 >
ffff81017941f0c0 2502940445 C Bi:5:033:3 0 12 = 00000c00 13020100 05030000
ffff81017941f0c0 2502941916 S Bi:5:033:3 -115 4096 <
ffff81017941f0c0 2502942443 C Bi:5:033:3 0 8 = 02000800 6e005c01
ffff81017941f0c0 2502945924 S Bi:5:033:3 -115 4096 <
ffff81017941f0c0 2502946444 C Bi:5:033:3 0 352 = 02006001 ab76d27a c412a394 00000000 6e65742e 72696d2e 64657669 63652e61
ffff81017941f0c0 2502949660 S Bi:5:033:3 -115 4096 <
ffff81017941f3c0 2502952508 S Bo:5:033:4 -115 8 = 02000800 68000000
ffff81017941f0c0 2502953449 C Bi:5:033:3 0 12 = 00000c00 13020100 06030000
ffff81017941f3c0 2502953454 C Bo:5:033:4 0 8 >
ffff81017941f3c0 2502956951 S Bi:5:033:3 -115 4096 <
ffff81017941f3c0 2502957445 C Bi:5:033:3 0 8 = 02000800 64000000
ffff81017941f3c0 2502959044 S Bi:5:033:3 -115 4096 <
ffff81017941f0c0 2502962797 S Bo:5:033:4 -115 8 = 02000800 84000200
ffff81017941f0c0 2502963430 C Bo:5:033:4 0 8 >
ffff81017941f3c0 2502968446 C Bi:5:033:3 0 12 = 00000c00 13020100 07030000
ffff81017941f3c0 2502969589 S Bo:5:033:4 -115 6 = 02000600 0773
ffff81017941f0c0 2502969634 S Bi:5:033:3 -115 4096 <
ffff81017941f3c0 2502970428 C Bo:5:033:4 0 6 >
ffff81017941f0c0 2502970448 C Bi:5:033:3 0 12 = 00000c00 13020100 08030000
ffff81017941f0c0 2502971610 S Bi:5:033:3 -115 4096 <
ffff81017941f0c0 2502974444 C Bi:5:033:3 0 8 = 02000800 64000400
ffff81017941f0c0 2502978013 S Bi:5:033:3 -115 4096 <
ffff81017941f0c0 2502978449 C Bi:5:033:3 0 8 = 02000800 00000164
ffff81017941f0c0 2502980030 S Bi:5:033:3 -115 4096 <
ffff81017941f3c0 2502981937 S Bo:5:033:4 -115 8 = 02000800 68000000
ffff81017941f3c0 2502982431 C Bo:5:033:4 0 8 >
ffff81017941f0c0 2502983446 C Bi:5:033:3 0 12 = 00000c00 13020100 09030000
ffff81017941f0c0 2502985845 S Bi:5:033:3 -115 4096 <
ffff81017941f0c0 2502986444 C Bi:5:033:3 0 8 = 02000800 6e006401
ffff81017941f0c0 2502989740 S Bi:5:033:3 -115 4096 <
ffff81017941f0c0 2502990448 C Bi:5:033:3 0 360 = 02006801 ab76d27a 89673ea2 00000000 6e65742e 72696d2e 64657669 63652e61
ffff81017941f0c0 2502991729 S Bi:5:033:3 -115 4096 <
ffff81017941f3c0 2502993685 S Bo:5:033:4 -115 8 = 02000800 68000000
ffff81017941f3c0 2502994430 C Bo:5:033:4 0 8 >
ffff81017941f0c0 2502995446 C Bi:5:033:3 0 12 = 00000c00 13020100 0a030000
ffff81017941f0c0 2502997906 S Bi:5:033:3 -115 4096 <
ffff81017941f0c0 2502998445 C Bi:5:033:3 0 8 = 02000800 64000000
ffff81017941f0c0 2503001970 S Bi:5:033:3 -115 4096 <
ffff81017941f3c0 2503004958 S Bo:5:033:4 -115 8 = 02000800 84000200
ffff81017941f3c0 2503005432 C Bo:5:033:4 0 8 >
ffff81017941f0c0 2503006448 C Bi:5:033:3 0 12 = 00000c00 13020100 0b030000
ffff81017941f0c0 2503009829 S Bo:5:033:4 -115 6 = 02000600 0774
ffff81017941f3c0 2503009879 S Bi:5:033:3 -115 4096 <
ffff81017941f0c0 2503010432 C Bo:5:033:4 0 6 >
ffff81017941f3c0 2503011448 C Bi:5:033:3 0 12 = 00000c00 13020100 0c030000
ffff81017941f3c0 2503012870 S Bi:5:033:3 -115 4096 <
ffff81017941f3c0 2503014445 C Bi:5:033:3 0 8 = 02000800 64000400
ffff81017941f3c0 2503017918 S Bi:5:033:3 -115 4096 <
ffff81017941f3c0 2503018451 C Bi:5:033:3 0 8 = 02000800 0000018c
ffff81017941f3c0 2503019870 S Bi:5:033:3 -115 4096 <
ffff81017941f0c0 2503021813 S Bo:5:033:4 -115 8 = 02000800 68000000
ffff81017941f0c0 2503022434 C Bo:5:033:4 0 8 >
ffff81017941f3c0 2503023450 C Bi:5:033:3 0 12 = 00000c00 13020100 0d030000
ffff81017941f3c0 2503024771 S Bi:5:033:3 -115 4096 <
ffff81017941f3c0 2503025448 C Bi:5:033:3 0 8 = 02000800 6e008c01
ffff81017941f3c0 2503029690 S Bi:5:033:3 -115 4096 <
ffff81017941f3c0 2503030451 C Bi:5:033:3 0 400 = 02009001 ab76d27a d547685a 00000000 6e65742e 72696d2e 64657669 63652e61
ffff81017941f3c0 2503031669 S Bi:5:033:3 -115 4096 <
ffff81017941f0c0 2503036438 S Bo:5:033:4 -115 8 = 02000800 68000000
ffff81017941f3c0 2503037449 C Bi:5:033:3 0 12 = 00000c00 13020100 0e030000
ffff81017941f0c0 2503037454 C Bo:5:033:4 0 8 >
ffff81017941f0c0 2503038985 S Bi:5:033:3 -115 4096 <
ffff81017941f0c0 2503039447 C Bi:5:033:3 0 8 = 02000800 64000000
ffff81017941f0c0 2503044189 S Bo:5:033:4 -115 8 = 02000800 84000200
ffff81017941f3c0 2503044387 S Bi:5:033:3 -115 4096 <
ffff81017941f0c0 2503044435 C Bo:5:033:4 0 8 >
ffff81017941f3c0 2503045451 C Bi:5:033:3 0 12 = 00000c00 13020100 0f030000
ffff81017941f3c0 2503046916 S Bo:5:033:4 -115 6 = 02000600 0775
ffff81017941f0c0 2503046956 S Bi:5:033:3 -115 4096 <
ffff81017941f3c0 2503047432 C Bo:5:033:4 0 6 >
ffff81017941f0c0 2503048487 C Bi:5:033:3 0 12 = 00000c00 13020100 10030000
ffff81017941f0c0 2503049943 S Bi:5:033:3 -115 4096 <
ffff81017941f0c0 2503051448 C Bi:5:033:3 0 8 = 02000800 64000400
ffff81017941f0c0 2503053046 S Bi:5:033:3 -115 4096 <
ffff81017941f0c0 2503053498 C Bi:5:033:3 0 8 = 02000800 00000140
ffff81017941f0c0 2503056025 S Bi:5:033:3 -115 4096 <
ffff81017941f3c0 2503057035 S Bo:5:033:4 -115 8 = 02000800 68000000
ffff81017941f3c0 2503057437 C Bo:5:033:4 0 8 >
ffff81017941f0c0 2503058463 C Bi:5:033:3 0 12 = 00000c00 13020100 11030000
ffff81017941f0c0 2503059937 S Bi:5:033:3 -115 4096 <
ffff81017941f0c0 2503060450 C Bi:5:033:3 0 8 = 02000800 6e004001
ffff81017941f0c0 2503061977 S Bi:5:033:3 -115 4096 <
ffff81017941f0c0 2503062510 C Bi:5:033:3 0 324 = 02004401 ab76d27a c2fa3f5e 00000000 6e65742e 72696d2e 64657669 63652e61
ffff81017941f0c0 2503064023 S Bi:5:033:3 -115 4096 <
ffff81017941f3c0 2503066005 S Bo:5:033:4 -115 8 = 02000800 68000000
ffff81017941f3c0 2503066434 C Bo:5:033:4 0 8 >
ffff81017941f0c0 2503067450 C Bi:5:033:3 0 12 = 00000c00 13020100 12030000
ffff81017941f0c0 2503069458 S Bi:5:033:3 -115 4096 <
ffff81017941f0c0 2503070449 C Bi:5:033:3 0 8 = 02000800 64000000
ffff81017941f0c0 2503074521 S Bo:5:033:4 -115 8 = 02000800 84000200
ffff81017941f3c0 2503074591 S Bi:5:033:3 -115 4096 <
ffff81017941f0c0 2503075436 C Bo:5:033:4 0 8 >
ffff81017941f3c0 2503075457 C Bi:5:033:3 0 12 = 00000c00 13020100 13030000
ffff81017941f3c0 2503077549 S Bo:5:033:4 -115 6 = 02000600 0776
ffff81017941f0c0 2503077595 S Bi:5:033:3 -115 4096 <
ffff81017941f3c0 2503078435 C Bo:5:033:4 0 6 >
ffff81017941f0c0 2503078456 C Bi:5:033:3 0 12 = 00000c00 13020100 14030000
ffff81017941f0c0 2503082046 S Bi:5:033:3 -115 4096 <
ffff81017941f0c0 2503082451 C Bi:5:033:3 0 8 = 02000800 64000400
ffff81017941f0c0 2503084905 S Bi:5:033:3 -115 4096 <
ffff81017941f0c0 2503085451 C Bi:5:033:3 0 8 = 02000800 0000018c
ffff81017941f0c0 2503089637 S Bi:5:033:3 -115 4096 <
ffff81017941f3c0 2503090628 S Bo:5:033:4 -115 8 = 02000800 68000000
ffff81017941f3c0 2503091437 C Bo:5:033:4 0 8 >
ffff81017941f0c0 2503092460 C Bi:5:033:3 0 12 = 00000c00 13020100 15030000
ffff81017941f0c0 2503094524 S Bi:5:033:3 -115 4096 <
ffff81017941f0c0 2503095450 C Bi:5:033:3 0 8 = 02000800 6e008c01
ffff81017941f0c0 2503098335 S Bi:5:033:3 -115 4096 <
ffff81017941f0c0 2503099454 C Bi:5:033:3 0 400 = 02009001 ab76d27a 63071b6f 00000000 6e65742e 72696d2e 64657669 63652e61
ffff81017941f0c0 2503101428 S Bi:5:033:3 -115 4096 <
ffff81017941f3c0 2503103388 S Bo:5:033:4 -115 8 = 02000800 68000000
ffff81017941f0c0 2503104454 C Bi:5:033:3 0 12 = 00000c00 13020100 16030000
ffff81017941f3c0 2503104459 C Bo:5:033:4 0 8 >
ffff81017941f3c0 2503109595 S Bi:5:033:3 -115 4096 <
ffff81017941f3c0 2503110453 C Bi:5:033:3 0 8 = 02000800 64000000
ffff81017941f3c0 2503114654 S Bo:5:033:4 -115 8 = 02000800 84000200
ffff81017941f0c0 2503114717 S Bi:5:033:3 -115 4096 <
ffff81017941f3c0 2503115438 C Bo:5:033:4 0 8 >
ffff81017941f0c0 2503115459 C Bi:5:033:3 0 12 = 00000c00 13020100 17030000
ffff81017941f0c0 2503117651 S Bo:5:033:4 -115 6 = 02000600 0777
ffff81017941f3c0 2503118238 S Bi:5:033:3 -115 4096 <
ffff81017941f0c0 2503118439 C Bo:5:033:4 0 6 >
ffff81017941f3c0 2503118459 C Bi:5:033:3 0 12 = 00000c00 13020100 18030000
ffff81017941f3c0 2503119588 S Bi:5:033:3 -115 4096 <
ffff81017941f3c0 2503122458 C Bi:5:033:3 0 8 = 02000800 64000400
ffff81017941f3c0 2503126879 S Bi:5:033:3 -115 4096 <
ffff81017941f3c0 2503127455 C Bi:5:033:3 0 8 = 02000800 00000170
ffff81017941f3c0 2503130854 S Bo:5:033:4 -115 8 = 02000800 68000000
ffff81017941f0c0 2503130911 S Bi:5:033:3 -115 4096 <
ffff81017941f3c0 2503131483 C Bo:5:033:4 0 8 >
ffff81017941f0c0 2503132456 C Bi:5:033:3 0 12 = 00000c00 13020100 19030000
ffff81017941f0c0 2503137949 S Bi:5:033:3 -115 4096 <
ffff81017941f0c0 2503138459 C Bi:5:033:3 0 8 = 02000800 6e007001
ffff81017941f0c0 2503139984 S Bi:5:033:3 -115 4096 <
ffff81017941f0c0 2503140467 C Bi:5:033:3 0 372 = 02007401 ab76d27a 529769f7 00000000 6e65742e 72696d2e 64657669 63652e61
ffff81017941f0c0 2503143794 S Bo:5:033:4 -115 8 = 02000800 68000000
ffff81017941f3c0 2503143849 S Bi:5:033:3 -115 4096 <
ffff81017941f0c0 2503144440 C Bo:5:033:4 0 8 >
ffff81017941f3c0 2503145457 C Bi:5:033:3 0 12 = 00000c00 13020100 1a030000
ffff81017941f3c0 2503146827 S Bi:5:033:3 -115 4096 <
ffff81017941f3c0 2503147454 C Bi:5:033:3 0 8 = 02000800 64000000
ffff81017941f3c0 2503151964 S Bo:5:033:4 -115 8 = 02000800 84000200
ffff81017941f0c0 2503152027 S Bi:5:033:3 -115 4096 <
ffff81017941f3c0 2503152450 C Bo:5:033:4 0 8 >
ffff81017941f0c0 2503153459 C Bi:5:033:3 0 12 = 00000c00 13020100 1b030000
ffff81017941f0c0 2503154777 S Bo:5:033:4 -115 6 = 02000600 0778
ffff81017941f3c0 2503154817 S Bi:5:033:3 -115 4096 <
ffff81017941f0c0 2503155439 C Bo:5:033:4 0 6 >
ffff81017941f3c0 2503156455 C Bi:5:033:3 0 12 = 00000c00 13020100 1c030000
ffff81017941f3c0 2503157821 S Bi:5:033:3 -115 4096 <
ffff81017941f3c0 2503159455 C Bi:5:033:3 0 8 = 02000800 64000400
ffff81017941f3c0 2503161947 S Bi:5:033:3 -115 4096 <
ffff81017941f3c0 2503162457 C Bi:5:033:3 0 8 = 02000800 00000158
ffff81017941f3c0 2503163900 S Bi:5:033:3 -115 4096 <
ffff81017941ff00 2503166025 S Bo:5:033:4 -115 8 = 02000800 68000000
ffff81017941ff00 2503166441 C Bo:5:033:4 0 8 >
ffff81017941f3c0 2503167531 C Bi:5:033:3 0 12 = 00000c00 13020100 1d030000
ffff81017941f3c0 2503169808 S Bi:5:033:3 -115 4096 <
ffff81017941f3c0 2503170456 C Bi:5:033:3 0 8 = 02000800 6e005801
ffff81017941f3c0 2503173891 S Bi:5:033:3 -115 4096 <
ffff81017941f3c0 2503174459 C Bi:5:033:3 0 348 = 02005c01 ab76d27a 1d769360 00000000 6e65742e 72696d2e 6a617661 2e626c61
ffff81017941f3c0 2503176887 S Bi:5:033:3 -115 4096 <
ffff81017941ff00 2503178793 S Bo:5:033:4 -115 8 = 02000800 68000000
ffff81017941ff00 2503179442 C Bo:5:033:4 0 8 >
ffff81017941f3c0 2503180464 C Bi:5:033:3 0 12 = 00000c00 13020100 1e030000
ffff81017941f3c0 2503182865 S Bi:5:033:3 -115 4096 <
ffff81017941f3c0 2503183456 C Bi:5:033:3 0 8 = 02000800 64000000
ffff81017941f3c0 2503186964 S Bi:5:033:3 -115 4096 <
ffff81017941ff00 2503188004 S Bo:5:033:4 -115 8 = 02000800 84000200
ffff81017941ff00 2503188444 C Bo:5:033:4 0 8 >
ffff81017941f3c0 2503189463 C Bi:5:033:3 0 12 = 00000c00 13020100 1f030000
ffff81017941f3c0 2503190771 S Bo:5:033:4 -115 6 = 02000600 0779
ffff81017941ff00 2503190815 S Bi:5:033:3 -115 4096 <
ffff81017941f3c0 2503191441 C Bo:5:033:4 0 6 >
ffff81017941ff00 2503192460 C Bi:5:033:3 0 12 = 00000c00 13020100 20030000
ffff81017941ff00 2503193771 S Bi:5:033:3 -115 4096 <
ffff81017941ff00 2503195455 C Bi:5:033:3 0 8 = 02000800 64000400
ffff81017941ff00 2503198018 S Bi:5:033:3 -115 4096 <
ffff81017941ff00 2503198459 C Bi:5:033:3 0 8 = 02000800 0000042c
ffff81017941ff00 2503199988 S Bi:5:033:3 -115 4096 <
ffff81017941f3c0 2503201862 S Bo:5:033:4 -115 8 = 02000800 68000000
ffff81017941f3c0 2503202443 C Bo:5:033:4 0 8 >
ffff81017941ff00 2503203457 C Bi:5:033:3 0 12 = 00000c00 13020100 21030000
ffff81017941ff00 2503207371 S Bi:5:033:3 -115 4096 <
ffff81017941ff00 2503208459 C Bi:5:033:3 0 8 = 02000800 6e002c04
ffff81017941ff00 2503213985 S Bi:5:033:3 -115 4096 <
ffff81017941ff00 2503215461 C Bi:5:033:3 0 1072 = 02003004 ab76d27a 049abeb5 01000000 6e65742e 72696d2e 6a617661 2e62726f
ffff81017941ff00 2503218951 S Bi:5:033:3 -115 4096 <
ffff81017941f0c0 2503219937 S Bo:5:033:4 -115 8 = 02000800 68000000
ffff81017941f0c0 2503220472 C Bo:5:033:4 0 8 >
ffff81017941ff00 2503221461 C Bi:5:033:3 0 12 = 00000c00 13020100 22030000
ffff81017941ff00 2503222960 S Bi:5:033:3 -115 4096 <
ffff81017941ff00 2503223458 C Bi:5:033:3 0 8 = 02000800 64000000
ffff81017941ff00 2503225995 S Bi:5:033:3 -115 4096 <
ffff81017941f0c0 2503229953 S Bo:5:033:4 -115 8 = 02000800 84000200
ffff81017941f0c0 2503230445 C Bo:5:033:4 0 8 >
ffff81017941ff00 2503231461 C Bi:5:033:3 0 12 = 00000c00 13020100 23030000
ffff81017941ff00 2503233856 S Bo:5:033:4 -115 6 = 02000600 077a
ffff81017941f0c0 2503233902 S Bi:5:033:3 -115 4096 <
ffff81017941ff00 2503234443 C Bo:5:033:4 0 6 >
ffff81017941f0c0 2503235458 C Bi:5:033:3 0 12 = 00000c00 13020100 24030000
ffff81017941f0c0 2503237834 S Bi:5:033:3 -115 4096 <
ffff81017941f0c0 2503238459 C Bi:5:033:3 0 8 = 02000800 64000400
ffff81017941f0c0 2503242045 S Bi:5:033:3 -115 4096 <
ffff81017941f0c0 2503242463 C Bi:5:033:3 0 8 = 02000800 0000017c
ffff81017941f0c0 2503245085 S Bi:5:033:3 -115 4096 <
ffff81017941ff00 2503246010 S Bo:5:033:4 -115 8 = 02000800 68000000
ffff81017941ff00 2503246445 C Bo:5:033:4 0 8 >
ffff81017941f0c0 2503247461 C Bi:5:033:3 0 12 = 00000c00 13020100 25030000
ffff81017941f0c0 2503249463 S Bi:5:033:3 -115 4096 <
ffff81017941f0c0 2503250459 C Bi:5:033:3 0 8 = 02000800 6e007c01
ffff81017941f0c0 2503253955 S Bi:5:033:3 -115 4096 <
ffff81017941f0c0 2503255465 C Bi:5:033:3 0 384 = 02008001 ab76d27a bf1da375 00000000 6e65742e 72696d2e 6a617661 2e646f63
ffff81017941f0c0 2503257003 S Bi:5:033:3 -115 4096 <
ffff81017941ff00 2503259973 S Bo:5:033:4 -115 8 = 02000800 68000000
ffff81017941ff00 2503260516 C Bo:5:033:4 0 8 >
ffff81017941f0c0 2503261464 C Bi:5:033:3 0 12 = 00000c00 13020100 26030000
ffff81017941f0c0 2503262860 S Bi:5:033:3 -115 4096 <
ffff81017941f0c0 2503263460 C Bi:5:033:3 0 8 = 02000800 64000000
ffff81017941f0c0 2503268004 S Bo:5:033:4 -115 8 = 02000800 84000200
ffff81017941ff00 2503268071 S Bi:5:033:3 -115 4096 <
ffff81017941f0c0 2503268449 C Bo:5:033:4 0 8 >
ffff81017941ff00 2503269474 C Bi:5:033:3 0 12 = 00000c00 13020100 27030000
ffff81017941ff00 2503270951 S Bo:5:033:4 -115 6 = 02000600 077b
ffff81017941f0c0 2503270995 S Bi:5:033:3 -115 4096 <
ffff81017941ff00 2503271445 C Bo:5:033:4 0 6 >
ffff81017941f0c0 2503272463 C Bi:5:033:3 0 12 = 00000c00 13020100 28030000
ffff81017941f0c0 2503273844 S Bi:5:033:3 -115 4096 <
ffff81017941f0c0 2503275460 C Bi:5:033:3 0 8 = 02000800 64000400
ffff81017941f0c0 2503277983 S Bi:5:033:3 -115 4096 <
ffff81017941f0c0 2503278466 C Bi:5:033:3 0 8 = 02000800 000001b0
ffff81017941f0c0 2503281963 S Bo:5:033:4 -115 8 = 02000800 68000000
ffff81017941ff00 2503282021 S Bi:5:033:3 -115 4096 <
ffff81017941f0c0 2503282447 C Bo:5:033:4 0 8 >
ffff81017941ff00 2503283461 C Bi:5:033:3 0 12 = 00000c00 13020100 29030000
ffff81017941ff00 2503285924 S Bi:5:033:3 -115 4096 <
ffff81017941ff00 2503286462 C Bi:5:033:3 0 8 = 02000800 6e00b001
ffff81017941ff00 2503289628 S Bi:5:033:3 -115 4096 <
ffff81017941ff00 2503290484 C Bi:5:033:3 0 436 = 0200b401 ab76d27a 12c41ea0 00000000 6e65742e 72696d2e 6a617661 2e68656c
ffff81017941ff00 2503292750 S Bi:5:033:3 -115 4096 <
ffff81017941f0c0 2503293650 S Bo:5:033:4 -115 8 = 02000800 68000000
ffff81017941f0c0 2503294448 C Bo:5:033:4 0 8 >
ffff81017941ff00 2503295463 C Bi:5:033:3 0 12 = 00000c00 13020100 2a030000
ffff81017941ff00 2503297006 S Bi:5:033:3 -115 4096 <
ffff81017941ff00 2503297463 C Bi:5:033:3 0 8 = 02000800 64000000
ffff81017941ff00 2503298988 S Bi:5:033:3 -115 4096 <
ffff81017941f0c0 2503302007 S Bo:5:033:4 -115 8 = 02000800 84000200
ffff81017941f0c0 2503302450 C Bo:5:033:4 0 8 >
ffff81017941ff00 2503303468 C Bi:5:033:3 0 12 = 00000c00 13020100 2b030000
ffff81017941ff00 2503305078 S Bo:5:033:4 -115 6 = 02000600 077c
ffff81017941f0c0 2503305123 S Bi:5:033:3 -115 4096 <
ffff81017941ff00 2503305447 C Bo:5:033:4 0 6 >
ffff81017941f0c0 2503306463 C Bi:5:033:3 0 12 = 00000c00 13020100 2c030000
ffff81017941f0c0 2503309477 S Bi:5:033:3 -115 4096 <
ffff81017941f0c0 2503310463 C Bi:5:033:3 0 8 = 02000800 64000400
ffff81017941f0c0 2503315311 S Bi:5:033:3 -115 4096 <
ffff81017941f0c0 2503315466 C Bi:5:033:3 0 8 = 02000800 00000140
ffff81017941f0c0 2503317388 S Bi:5:033:3 -115 4096 <
ffff81017941ff00 2503319358 S Bo:5:033:4 -115 8 = 02000800 68000000
ffff81017941f0c0 2503320467 C Bi:5:033:3 0 12 = 00000c00 13020100 2d030000
ffff81017941ff00 2503320472 C Bo:5:033:4 0 8 >
ffff81017941ff00 2503326073 S Bi:5:033:3 -115 4096 <
ffff81017941ff00 2503326466 C Bi:5:033:3 0 8 = 02000800 6e004001
ffff81017941ff00 2503329755 S Bi:5:033:3 -115 4096 <
ffff81017941ff00 2503330500 C Bi:5:033:3 0 324 = 02004401 ab76d27a 508fb979 00000000 6e65742e 72696d2e 6a617661 2e6d6170
ffff81017941ff00 2503333517 S Bo:5:033:4 -115 8 = 02000800 68000000
ffff81017941f0c0 2503333570 S Bi:5:033:3 -115 4096 <
ffff81017941ff00 2503334449 C Bo:5:033:4 0 8 >
ffff81017941f0c0 2503334469 C Bi:5:033:3 0 12 = 00000c00 13020100 2e030000
ffff81017941f0c0 2503337086 S Bi:5:033:3 -115 4096 <
ffff81017941f0c0 2503337466 C Bi:5:033:3 0 8 = 02000800 64000000
ffff81017941f0c0 2503340186 S Bi:5:033:3 -115 4096 <
ffff81017941ff00 2503344122 S Bo:5:033:4 -115 8 = 02000800 84000200
ffff81017941ff00 2503344454 C Bo:5:033:4 0 8 >
ffff81017941f0c0 2503345470 C Bi:5:033:3 0 12 = 00000c00 13020100 2f030000
ffff81017941f0c0 2503347133 S Bo:5:033:4 -115 6 = 02000600 077d
ffff81017941ff00 2503347180 S Bi:5:033:3 -115 4096 <
ffff81017941f0c0 2503347451 C Bo:5:033:4 0 6 >
ffff81017941ff00 2503348471 C Bi:5:033:3 0 12 = 00000c00 13020100 30030000
ffff81017941ff00 2503351111 S Bi:5:033:3 -115 4096 <
ffff81017941ff00 2503351468 C Bi:5:033:3 0 8 = 02000800 64000400
ffff81017941ff00 2503353213 S Bi:5:033:3 -115 4096 <
ffff81017941ff00 2503353468 C Bi:5:033:3 0 8 = 02000800 00000110
ffff81017941ff00 2503356163 S Bi:5:033:3 -115 4096 <
ffff81017941f0c0 2503357991 S Bo:5:033:4 -115 8 = 02000800 68000000
ffff81017941f0c0 2503358452 C Bo:5:033:4 0 8 >
ffff81017941ff00 2503359467 C Bi:5:033:3 0 12 = 00000c00 13020100 31030000
ffff81017941ff00 2503361991 S Bi:5:033:3 -115 4096 <
ffff81017941ff00 2503362467 C Bi:5:033:3 0 8 = 02000800 6e001001
ffff81017941ff00 2503364304 S Bi:5:033:3 -115 4096 <
ffff81017941ff00 2503365470 C Bi:5:033:3 0 276 = 02001401 ab76d27a 36fa9019 00000000 6e65742e 72696d2e 6a617661 2e6d656d
ffff81017941ff00 2503370504 S Bi:5:033:3 -115 4096 <
ffff81017941f0c0 2503373718 S Bo:5:033:4 -115 8 = 02000800 68000000
ffff81017941f0c0 2503374453 C Bo:5:033:4 0 8 >
ffff81017941ff00 2503375474 C Bi:5:033:3 0 12 = 00000c00 13020100 32030000
ffff81017941ff00 2503377548 S Bi:5:033:3 -115 4096 <
ffff81017941ff00 2503378467 C Bi:5:033:3 0 8 = 02000800 64000000
ffff81017941ff00 2503381926 S Bi:5:033:3 -115 4096 <
ffff81017941f0c0 2503384901 S Bo:5:033:4 -115 8 = 02000800 84000200
ffff81017941f0c0 2503385454 C Bo:5:033:4 0 8 >
ffff81017941ff00 2503386469 C Bi:5:033:3 0 12 = 00000c00 13020100 33030000
ffff81017941ff00 2503389595 S Bo:5:033:4 -115 6 = 02000600 077e
ffff81017941f0c0 2503389641 S Bi:5:033:3 -115 4096 <
ffff81017941ff00 2503390453 C Bo:5:033:4 0 6 >
ffff81017941f0c0 2503390473 C Bi:5:033:3 0 12 = 00000c00 13020100 34030000
ffff81017941f0c0 2503393852 S Bi:5:033:3 -115 4096 <
ffff81017941f0c0 2503394469 C Bi:5:033:3 0 8 = 02000800 64000400
ffff81017941f0c0 2503398438 S Bi:5:033:3 -115 4096 <
ffff81017941f0c0 2503399472 C Bi:5:033:3 0 8 = 02000800 00000230
ffff81017941f0c0 2503401425 S Bi:5:033:3 -115 4096 <
ffff81017941ff00 2503403368 S Bo:5:033:4 -115 8 = 02000800 68000000
ffff81017941f0c0 2503404472 C Bi:5:033:3 0 12 = 00000c00 13020100 35030000
ffff81017941ff00 2503404477 C Bo:5:033:4 0 8 >
ffff81017941ff00 2503409630 S Bi:5:033:3 -115 4096 <
ffff81017941ff00 2503410471 C Bi:5:033:3 0 8 = 02000800 6e003002
ffff81017941ff00 2503412665 S Bi:5:033:3 -115 4096 <
ffff81017941ff00 2503413469 C Bi:5:033:3 0 564 = 02003402 ab76d27a 601a0741 00000000 6e65742e 72696d2e 6a617661 2e706173
ffff81017941ff00 2503419977 S Bo:5:033:4 -115 8 = 02000800 68000000
ffff81017941f0c0 2503420035 S Bi:5:033:3 -115 4096 <
ffff81017941ff00 2503420456 C Bo:5:033:4 0 8 >
ffff81017941f0c0 2503421490 C Bi:5:033:3 0 12 = 00000c00 13020100 36030000
ffff81017941f0c0 2503423009 S Bi:5:033:3 -115 4096 <
ffff81017941f0c0 2503423471 C Bi:5:033:3 0 8 = 02000800 64000000
ffff81017941f0c0 2503425178 S Bi:5:033:3 -115 4096 <
ffff81017941ff00 2503429184 S Bo:5:033:4 -115 8 = 02000800 84000200
ffff81017941ff00 2503429465 C Bo:5:033:4 0 8 >
ffff81017941f0c0 2503430475 C Bi:5:033:3 0 12 = 00000c00 13020100 37030000
ffff81017941f0c0 2503432144 S Bo:5:033:4 -115 6 = 02000600 077f
ffff81017941ff00 2503432189 S Bi:5:033:3 -115 4096 <
ffff81017941f0c0 2503432455 C Bo:5:033:4 0 6 >
ffff81017941ff00 2503433506 C Bi:5:033:3 0 12 = 00000c00 13020100 38030000
ffff81017941ff00 2503435243 S Bi:5:033:3 -115 4096 <
ffff81017941ff00 2503436471 C Bi:5:033:3 0 8 = 02000800 64000400
ffff81017941ff00 2503438403 S Bi:5:033:3 -115 4096 <
ffff81017941ff00 2503439473 C Bi:5:033:3 0 8 = 02000800 00000178
ffff81017941ff00 2503440990 S Bi:5:033:3 -115 4096 <
ffff81017941f0c0 2503442949 S Bo:5:033:4 -115 8 = 02000800 68000000
ffff81017941f0c0 2503443458 C Bo:5:033:4 0 8 >
ffff81017941ff00 2503444476 C Bi:5:033:3 0 12 = 00000c00 13020100 39030000
ffff81017941ff00 2503445966 S Bi:5:033:3 -115 4096 <
ffff81017941ff00 2503446471 C Bi:5:033:3 0 8 = 02000800 6e007801
ffff81017941ff00 2503449660 S Bi:5:033:3 -115 4096 <
ffff81017941ff00 2503450473 C Bi:5:033:3 0 380 = 02007c01 ab76d27a 3b62ef39 01000000 6e65742e 72696d2e 6a617661 2e70686f
ffff81017941ff00 2503452723 S Bi:5:033:3 -115 4096 <
ffff81017941f0c0 2503454565 S Bo:5:033:4 -115 8 = 02000800 68000000
ffff81017941ff00 2503455474 C Bi:5:033:3 0 12 = 00000c00 13020100 3a030000
ffff81017941f0c0 2503455479 C Bo:5:033:4 0 8 >
ffff81017941f0c0 2503457600 S Bi:5:033:3 -115 4096 <
ffff81017941f0c0 2503458471 C Bi:5:033:3 0 8 = 02000800 64000000
ffff81017941f0c0 2503464740 S Bo:5:033:4 -115 8 = 02000800 84000200
ffff81017941ff00 2503464804 S Bi:5:033:3 -115 4096 <
ffff81017941f0c0 2503465459 C Bo:5:033:4 0 8 >
ffff81017941ff00 2503466472 C Bi:5:033:3 0 12 = 00000c00 13020100 3b030000
ffff81017941ff00 2503469597 S Bo:5:033:4 -115 6 = 02000600 0780
ffff81017941f0c0 2503469646 S Bi:5:033:3 -115 4096 <
ffff81017941ff00 2503470457 C Bo:5:033:4 0 6 >
ffff81017941f0c0 2503470477 C Bi:5:033:3 0 12 = 00000c00 13020100 3c030000
ffff81017941f0c0 2503473910 S Bi:5:033:3 -115 4096 <
ffff81017941f0c0 2503474477 C Bi:5:033:3 0 8 = 02000800 64000400
ffff81017941f0c0 2503478727 S Bi:5:033:3 -115 4096 <
ffff81017941f0c0 2503479477 C Bi:5:033:3 0 8 = 02000800 00000190
ffff81017941f0c0 2503480667 S Bi:5:033:3 -115 4096 <
ffff81017941f3c0 2503482647 S Bo:5:033:4 -115 8 = 02000800 68000000
ffff81017941f0c0 2503483475 C Bi:5:033:3 0 12 = 00000c00 13020100 3d030000
ffff81017941f3c0 2503483480 C Bo:5:033:4 0 8 >
ffff81017941f3c0 2503485727 S Bi:5:033:3 -115 4096 <
ffff81017941f3c0 2503486475 C Bi:5:033:3 0 8 = 02000800 6e009001
ffff81017941f3c0 2503490606 S Bi:5:033:3 -115 4096 <
ffff81017941f3c0 2503491491 C Bi:5:033:3 0 404 = 02009401 ab76d27a 1aaa3c25 00000000 6e65742e 72696d2e 6a617661 2e726f6f
ffff81017941f3c0 2503493634 S Bi:5:033:3 -115 4096 <
ffff81017941f0c0 2503495601 S Bo:5:033:4 -115 8 = 02000800 68000000
ffff81017941f3c0 2503496478 C Bi:5:033:3 0 12 = 00000c00 13020100 3e030000
ffff81017941f0c0 2503496483 C Bo:5:033:4 0 8 >
ffff81017941f0c0 2503497634 S Bi:5:033:3 -115 4096 <
ffff81017941f0c0 2503498474 C Bi:5:033:3 0 8 = 02000800 64000000
ffff81017941f0c0 2503501896 S Bi:5:033:3 -115 4096 <
ffff81017941f3c0 2503505872 S Bo:5:033:4 -115 8 = 02000800 84000200
ffff81017941f3c0 2503506461 C Bo:5:033:4 0 8 >
ffff81017941f0c0 2503507476 C Bi:5:033:3 0 12 = 00000c00 13020100 3f030000
ffff81017941f0c0 2503509588 S Bo:5:033:4 -115 6 = 02000600 0781
ffff81017941f3c0 2503509643 S Bi:5:033:3 -115 4096 <
ffff81017941f0c0 2503510458 C Bo:5:033:4 0 6 >
ffff81017941f3c0 2503510478 C Bi:5:033:3 0 12 = 00000c00 13020100 40030000
ffff81017941f3c0 2503513862 S Bi:5:033:3 -115 4096 <
ffff81017941f3c0 2503514476 C Bi:5:033:3 0 8 = 02000800 64000400
ffff81017941f3c0 2503519317 S Bi:5:033:3 -115 4096 <
ffff81017941f3c0 2503519478 C Bi:5:033:3 0 8 = 02000800 000001d0
ffff81017941f3c0 2503521384 S Bi:5:033:3 -115 4096 <
ffff81017941f0c0 2503523355 S Bo:5:033:4 -115 8 = 02000800 68000000
ffff81017941f3c0 2503524477 C Bi:5:033:3 0 12 = 00000c00 13020100 41030000
ffff81017941f0c0 2503524482 C Bo:5:033:4 0 8 >
ffff81017941f0c0 2503529620 S Bi:5:033:3 -115 4096 <
ffff81017941f0c0 2503530478 C Bi:5:033:3 0 8 = 02000800 6e00d001
ffff81017941f0c0 2503534007 S Bi:5:033:3 -115 4096 <
ffff81017941f0c0 2503535480 C Bi:5:033:3 0 468 = 0200d401 ab76d27a b58e5e52 00000000 6e65742e 72696d2e 6a617661 2e736d69
ffff81017941f0c0 2503537923 S Bi:5:033:3 -115 4096 <
ffff81017941f3c0 2503539821 S Bo:5:033:4 -115 8 = 02000800 68000000
ffff81017941f3c0 2503540462 C Bo:5:033:4 0 8 >
ffff81017941f0c0 2503541481 C Bi:5:033:3 0 12 = 00000c00 13020100 42030000
ffff81017941f0c0 2503542857 S Bi:5:033:3 -115 4096 <
ffff81017941f0c0 2503543476 C Bi:5:033:3 0 8 = 02000800 64000000
ffff81017941f0c0 2503545045 S Bi:5:033:3 -115 4096 <
ffff81017941f3c0 2503547990 S Bo:5:033:4 -115 8 = 02000800 84000200
ffff81017941f3c0 2503548464 C Bo:5:033:4 0 8 >
ffff81017941f0c0 2503549480 C Bi:5:033:3 0 12 = 00000c00 13020100 43030000
ffff81017941f0c0 2503550896 S Bo:5:033:4 -115 6 = 02000600 0782
ffff81017941f3c0 2503550940 S Bi:5:033:3 -115 4096 <
ffff81017941f0c0 2503551462 C Bo:5:033:4 0 6 >
ffff81017941f3c0 2503552477 C Bi:5:033:3 0 12 = 00000c00 13020100 44030000
ffff81017941f3c0 2503553851 S Bi:5:033:3 -115 4096 <
ffff81017941f3c0 2503555478 C Bi:5:033:3 0 8 = 02000800 64000400
ffff81017941f3c0 2503557986 S Bi:5:033:3 -115 4096 <
ffff81017941f3c0 2503558498 C Bi:5:033:3 0 8 = 02000800 00000110
ffff81017941f3c0 2503560097 S Bi:5:033:3 -115 4096 <
ffff81017941f0c0 2503563833 S Bo:5:033:4 -115 8 = 02000800 68000000
ffff81017941f0c0 2503564465 C Bo:5:033:4 0 8 >
ffff81017941f3c0 2503565493 C Bi:5:033:3 0 12 = 00000c00 13020100 45030000
ffff81017941f3c0 2503566990 S Bi:5:033:3 -115 4096 <
ffff81017941f3c0 2503567479 C Bi:5:033:3 0 8 = 02000800 6e001001
ffff81017941f3c0 2503569925 S Bi:5:033:3 -115 4096 <
ffff81017941f3c0 2503570478 C Bi:5:033:3 0 276 = 02001401 ab76d27a d7595827 00000000 6e65742e 72696d2e 6a617661 2e746173
ffff81017941f3c0 2503574233 S Bi:5:033:3 -115 4096 <
ffff81017941f0c0 2503577982 S Bo:5:033:4 -115 8 = 02000800 68000000
ffff81017941f0c0 2503578465 C Bo:5:033:4 0 8 >
ffff81017941f3c0 2503579481 C Bi:5:033:3 0 12 = 00000c00 13020100 46030000
ffff81017941f3c0 2503581896 S Bi:5:033:3 -115 4096 <
ffff81017941f3c0 2503582478 C Bi:5:033:3 0 8 = 02000800 64000000
ffff81017941f3c0 2503584898 S Bi:5:033:3 -115 4096 <
ffff81017941f0c0 2503588889 S Bo:5:033:4 -115 8 = 02000800 84000200
ffff81017941f0c0 2503589466 C Bo:5:033:4 0 8 >
ffff81017941f3c0 2503590480 C Bi:5:033:3 0 12 = 00000c00 13020100 47030000
ffff81017941f3c0 2503593833 S Bo:5:033:4 -115 6 = 02000600 0783
ffff81017941f0c0 2503593889 S Bi:5:033:3 -115 4096 <
ffff81017941f3c0 2503594464 C Bo:5:033:4 0 6 >
ffff81017941f0c0 2503595480 C Bi:5:033:3 0 12 = 00000c00 13020100 48030000
ffff81017941f0c0 2503597903 S Bi:5:033:3 -115 4096 <
ffff81017941f0c0 2503598480 C Bi:5:033:3 0 8 = 02000800 64000400
ffff81017941f0c0 2503602538 S Bi:5:033:3 -115 4096 <
ffff81017941f0c0 2503603484 C Bi:5:033:3 0 8 = 02000800 0000027c
ffff81017941f0c0 2503605502 S Bi:5:033:3 -115 4096 <
ffff81017941f3c0 2503607466 S Bo:5:033:4 -115 8 = 02000800 68000000
ffff81017941f0c0 2503608483 C Bi:5:033:3 0 12 = 00000c00 13020100 49030000
ffff81017941f3c0 2503608488 C Bo:5:033:4 0 8 >
ffff81017941f3c0 2503613979 S Bi:5:033:3 -115 4096 <
ffff81017941f3c0 2503614483 C Bi:5:033:3 0 8 = 02000800 6e007c02
ffff81017941f3c0 2503618085 S Bi:5:033:3 -115 4096 <
ffff81017941f3c0 2503619484 C Bi:5:033:3 0 640 = 02008002 ab76d27a 90dff472 00000000 6e65742e 72696d2e 6d64732e 72756e74
ffff81017941f3c0 2503622054 S Bi:5:033:3 -115 4096 <
ffff81017941f0c0 2503623885 S Bo:5:033:4 -115 8 = 02000800 68000000
ffff81017941f0c0 2503624467 C Bo:5:033:4 0 8 >
ffff81017941f3c0 2503625487 C Bi:5:033:3 0 12 = 00000c00 13020100 4a030000
ffff81017941f3c0 2503627002 S Bi:5:033:3 -115 4096 <
ffff81017941f3c0 2503627482 C Bi:5:033:3 0 8 = 02000800 64000000
ffff81017941f3c0 2503629012 S Bi:5:033:3 -115 4096 <
ffff81017941f0c0 2503632854 S Bo:5:033:4 -115 8 = 02000800 84000200
ffff81017941f0c0 2503633468 C Bo:5:033:4 0 8 >
ffff81017941f3c0 2503634483 C Bi:5:033:3 0 12 = 00000c00 13020100 4b030000
ffff81017941f3c0 2503638298 S Bo:5:033:4 -115 6 = 02000600 0784
ffff81017941f0c0 2503638363 S Bi:5:033:3 -115 4096 <
ffff81017941f3c0 2503638468 C Bo:5:033:4 0 6 >
ffff81017941f0c0 2503639482 C Bi:5:033:3 0 12 = 00000c00 13020100 4c030000
ffff81017941f0c0 2503641339 S Bi:5:033:3 -115 4096 <
ffff81017941f0c0 2503642481 C Bi:5:033:3 0 8 = 02000800 64000400
ffff81017941f0c0 2503645938 S Bi:5:033:3 -115 4096 <
ffff81017941f0c0 2503646495 C Bi:5:033:3 0 8 = 02000800 000006f0
ffff81017941f0c0 2503647897 S Bi:5:033:3 -115 4096 <
ffff81017941f3c0 2503649897 S Bo:5:033:4 -115 8 = 02000800 68000000
ffff81017941f3c0 2503650468 C Bo:5:033:4 0 8 >
ffff81017941f0c0 2503651483 C Bi:5:033:3 0 12 = 00000c00 13020100 4d030000
ffff81017941f0c0 2503653842 S Bi:5:033:3 -115 4096 <
ffff81017941f0c0 2503654483 C Bi:5:033:3 0 8 = 02000800 6e00f006
ffff81017941f0c0 2503657934 S Bi:5:033:3 -115 4096 <
ffff81017941f0c0 2503660488 C Bi:5:033:3 0 1780 = 0200f406 ab76d27a 42bd7fcb 01000000 6e65742e 72696d2e 706c6174 666f726d
ffff81017941f0c0 2503661985 S Bi:5:033:3 -115 4096 <
ffff81017941f3c0 2503664139 S Bo:5:033:4 -115 8 = 02000800 68000000
ffff81017941f3c0 2503664469 C Bo:5:033:4 0 8 >
ffff81017941f0c0 2503665487 C Bi:5:033:3 0 12 = 00000c00 13020100 4e030000
ffff81017941f0c0 2503667017 S Bi:5:033:3 -115 4096 <
ffff81017941f0c0 2503667483 C Bi:5:033:3 0 8 = 02000800 64000000
ffff81017941f0c0 2503669983 S Bi:5:033:3 -115 4096 <
ffff81017941f3c0 2503673268 S Bo:5:033:4 -115 8 = 02000800 84000200
ffff81017941f3c0 2503673470 C Bo:5:033:4 0 8 >
ffff81017941f0c0 2503674487 C Bi:5:033:3 0 12 = 00000c00 13020100 4f030000
ffff81017941f0c0 2503676359 S Bi:5:033:3 -115 4096 <
ffff81017941f3c0 2503677002 S Bo:5:033:4 -115 6 = 02000600 0785
ffff81017941f3c0 2503677469 C Bo:5:033:4 0 6 >
ffff81017941f0c0 2503678496 C Bi:5:033:3 0 12 = 00000c00 13020100 50030000
ffff81017941f0c0 2503680078 S Bi:5:033:3 -115 4096 <
ffff81017941f0c0 2503681484 C Bi:5:033:3 0 8 = 02000800 64000400
ffff81017941f0c0 2503686886 S Bi:5:033:3 -115 4096 <
ffff81017941f0c0 2503687486 C Bi:5:033:3 0 8 = 02000800 00000140
ffff81017941f0c0 2503690063 S Bi:5:033:3 -115 4096 <
ffff81017941f3c0 2503691070 S Bo:5:033:4 -115 8 = 02000800 68000000
ffff81017941f3c0 2503691471 C Bo:5:033:4 0 8 >
ffff81017941f0c0 2503692489 C Bi:5:033:3 0 12 = 00000c00 13020100 51030000
ffff81017941f0c0 2503693830 S Bi:5:033:3 -115 4096 <
ffff81017941f0c0 2503694484 C Bi:5:033:3 0 8 = 02000800 6e004001
ffff81017941f0c0 2503697985 S Bi:5:033:3 -115 4096 <
ffff81017941f0c0 2503698563 C Bi:5:033:3 0 324 = 02004401 ab76d27a fb0290fc 0a000000 6e65742e 72696d2e 706c6174 666f726d
ffff81017941f0c0 2503699979 S Bi:5:033:3 -115 4096 <
ffff81017941f3c0 2503703993 S Bo:5:033:4 -115 8 = 02000800 68000000
ffff81017941f3c0 2503704472 C Bo:5:033:4 0 8 >
ffff81017941f0c0 2503705499 C Bi:5:033:3 0 12 = 00000c00 13020100 52030000
ffff81017941f0c0 2503706871 S Bi:5:033:3 -115 4096 <
ffff81017941f0c0 2503707485 C Bi:5:033:3 0 8 = 02000800 64000000
ffff81017941f0c0 2503710194 S Bi:5:033:3 -115 4096 <
ffff81017941f3c0 2503713945 S Bo:5:033:4 -115 8 = 02000800 84000200
ffff81017941f3c0 2503714472 C Bo:5:033:4 0 8 >
ffff81017941f0c0 2503715489 C Bi:5:033:3 0 12 = 00000c00 13020100 53030000
ffff81017941f0c0 2503717847 S Bo:5:033:4 -115 6 = 02000600 0786
ffff81017941f3c0 2503717903 S Bi:5:033:3 -115 4096 <
ffff81017941f0c0 2503718470 C Bo:5:033:4 0 6 >
ffff81017941f3c0 2503719487 C Bi:5:033:3 0 12 = 00000c00 13020100 54030000
ffff81017941f3c0 2503722426 S Bi:5:033:3 -115 4096 <
ffff81017941f3c0 2503723491 C Bi:5:033:3 0 8 = 02000800 64000400
ffff81017941f3c0 2503726359 S Bi:5:033:3 -115 4096 <
ffff81017941f3c0 2503727488 C Bi:5:033:3 0 8 = 02000800 00000108
ffff81017941f3c0 2503729327 S Bi:5:033:3 -115 4096 <
ffff81017941f0c0 2503731269 S Bo:5:033:4 -115 8 = 02000800 68000000
ffff81017941f0c0 2503731472 C Bo:5:033:4 0 8 >
ffff81017941f3c0 2503732488 C Bi:5:033:3 0 12 = 00000c00 13020100 55030000
ffff81017941f3c0 2503733407 S Bi:5:033:3 -115 4096 <
ffff81017941f3c0 2503734486 C Bi:5:033:3 0 8 = 02000800 6e000801
ffff81017941f3c0 2503737909 S Bi:5:033:3 -115 4096 <
ffff81017941f3c0 2503738488 C Bi:5:033:3 0 268 = 02000c01 ab76d27a 4f453cd7 0a000000 6e65742e 72696d2e 706c6174 666f726d
ffff81017941f3c0 2503741937 S Bi:5:033:3 -115 4096 <
ffff81017941f0c0 2503743873 S Bo:5:033:4 -115 8 = 02000800 68000000
ffff81017941f0c0 2503744474 C Bo:5:033:4 0 8 >
ffff81017941f3c0 2503745490 C Bi:5:033:3 0 12 = 00000c00 13020100 56030000
ffff81017941f3c0 2503746910 S Bi:5:033:3 -115 4096 <
ffff81017941f3c0 2503747487 C Bi:5:033:3 0 8 = 02000800 64000000
ffff81017941f3c0 2503749189 S Bi:5:033:3 -115 4096 <
ffff81017941f0c0 2503752848 S Bo:5:033:4 -115 8 = 02000800 84000200
ffff81017941f0c0 2503753475 C Bo:5:033:4 0 8 >
ffff81017941f3c0 2503754489 C Bi:5:033:3 0 12 = 00000c00 13020100 57030000
ffff81017941f3c0 2503758001 S Bo:5:033:4 -115 6 = 02000600 1138
ffff81017941f0c0 2503758060 S Bi:5:033:3 -115 4096 <
ffff81017941f3c0 2503758474 C Bo:5:033:4 0 6 >
ffff81017941f0c0 2503759488 C Bi:5:033:3 0 12 = 00000c00 13020100 58030000
ffff81017941f0c0 2503761837 S Bi:5:033:3 -115 4096 <
ffff81017941f0c0 2503765490 C Bi:5:033:3 0 8 = 02000800 64000400
ffff81017941f0c0 2503770721 S Bi:5:033:3 -115 4096 <
ffff81017941f0c0 2503771493 C Bi:5:033:3 0 8 = 02000800 0000009c
ffff81017941f0c0 2503773868 S Bi:5:033:3 -115 4096 <
ffff81017941f3c0 2503776662 S Bo:5:033:4 -115 8 = 02000800 68000000
ffff81017941f0c0 2503777493 C Bi:5:033:3 0 12 = 00000c00 13020100 59030000
ffff81017941f3c0 2503777498 C Bo:5:033:4 0 8 >
ffff81017941f3c0 2503779689 S Bi:5:033:3 -115 4096 <
ffff81017941f3c0 2503780270 C Bi:5:033:3 0 8 = 02000800 6e009c00
ffff81017941f3c0 2503782728 S Bi:5:033:3 -115 4096 <
ffff81017941f3c0 2503783491 C Bi:5:033:3 0 160 = 0200a000 ab76d27a b8b8c1a2 00000000 72616469 6f626565 3a536d61 7274204d
ffff81017941f3c0 2503786126 S Bi:5:033:3 -115 4096 <
ffff81017941f0c0 2503787786 S Bo:5:033:4 -115 8 = 02000800 68000000
ffff81017941f0c0 2503788476 C Bo:5:033:4 0 8 >
ffff81017941f3c0 2503789496 C Bi:5:033:3 0 12 = 00000c00 13020100 5a030000
ffff81017941f3c0 2503790676 S Bi:5:033:3 -115 4096 <
ffff81017941f3c0 2503791491 C Bi:5:033:3 0 8 = 02000800 64000000
ffff81017941f3c0 2503793875 S Bi:5:033:3 -115 4096 <
ffff81017941f0c0 2503797811 S Bo:5:033:4 -115 8 = 02000800 84000200
ffff81017941f0c0 2503798482 C Bo:5:033:4 0 8 >
ffff81017941f3c0 2503799493 C Bi:5:033:3 0 12 = 00000c00 13020100 5b030000
ffff81017941f3c0 2503801895 S Bo:5:033:4 -115 6 = 02000600 1139
ffff81017941f0c0 2503801945 S Bi:5:033:3 -115 4096 <
ffff81017941f3c0 2503802475 C Bo:5:033:4 0 6 >
ffff81017941f0c0 2503803491 C Bi:5:033:3 0 12 = 00000c00 13020100 5c030000
ffff81017941f0c0 2503806382 S Bi:5:033:3 -115 4096 <
ffff81017941f0c0 2503809495 C Bi:5:033:3 0 8 = 02000800 64000400
ffff81017941f0c0 2503814860 S Bi:5:033:3 -115 4096 <
ffff81017941f0c0 2503815495 C Bi:5:033:3 0 8 = 02000800 000001e0
ffff81017941f0c0 2503817971 S Bi:5:033:3 -115 4096 <
ffff81017941f3c0 2503818942 S Bo:5:033:4 -115 8 = 02000800 68000000
ffff81017941f3c0 2503819478 C Bo:5:033:4 0 8 >
ffff81017941f0c0 2503820495 C Bi:5:033:3 0 12 = 00000c00 13020100 5d030000
ffff81017941f0c0 2503821933 S Bi:5:033:3 -115 4096 <
ffff81017941f0c0 2503822494 C Bi:5:033:3 0 8 = 02000800 6e00e001
ffff81017941f0c0 2503825955 S Bi:5:033:3 -115 4096 <
ffff81017941f0c0 2503827497 C Bi:5:033:3 0 484 = 0200e401 ab76d27a 853542c7 00000000 636f6d5f 706c617a 6d69635f 7468656d
ffff81017941f0c0 2503828919 S Bi:5:033:3 -115 4096 <
ffff81017941f3c0 2503831937 S Bo:5:033:4 -115 8 = 02000800 68000000
ffff81017941f3c0 2503832479 C Bo:5:033:4 0 8 >
ffff81017941f0c0 2503833497 C Bi:5:033:3 0 12 = 00000c00 13020100 5e030000
ffff81017941f0c0 2503834969 S Bi:5:033:3 -115 4096 <
ffff81017941f0c0 2503835492 C Bi:5:033:3 0 8 = 02000800 64000000
ffff81017941f0c0 2503838904 S Bi:5:033:3 -115 4096 <
ffff81017941f3c0 2503843001 S Bo:5:033:4 -115 8 = 02000800 84000200
ffff81017941f3c0 2503843480 C Bo:5:033:4 0 8 >
ffff81017941f0c0 2503844530 C Bi:5:033:3 0 12 = 00000c00 13020100 5f030000
ffff81017941f0c0 2503845980 S Bo:5:033:4 -115 6 = 02000600 113a
ffff81017941f3c0 2503846027 S Bi:5:033:3 -115 4096 <
ffff81017941f0c0 2503846479 C Bo:5:033:4 0 6 >
ffff81017941f3c0 2503847492 C Bi:5:033:3 0 12 = 00000c00 13020100 60030000
ffff81017941f3c0 2503849461 S Bi:5:033:3 -115 4096 <
ffff81017941f3c0 2503853499 C Bi:5:033:3 0 8 = 02000800 64000400
ffff81017941f3c0 2503858059 S Bi:5:033:3 -115 4096 <
ffff81017941f3c0 2503858498 C Bi:5:033:3 0 8 = 02000800 00000188
ffff81017941f3c0 2503860095 S Bi:5:033:3 -115 4096 <
ffff81017941f0c0 2503862798 S Bo:5:033:4 -115 8 = 02000800 68000000
ffff81017941f0c0 2503863480 C Bo:5:033:4 0 8 >
ffff81017941f3c0 2503864502 C Bi:5:033:3 0 12 = 00000c00 13020100 61030000
ffff81017941f3c0 2503865833 S Bi:5:033:3 -115 4096 <
ffff81017941f3c0 2503866494 C Bi:5:033:3 0 8 = 02000800 6e008801
ffff81017941f3c0 2503870612 S Bi:5:033:3 -115 4096 <
ffff81017941f3c0 2503871498 C Bi:5:033:3 0 396 = 02008c01 ab76d27a ecd6ba48 00000000 636f6d5f 706c617a 6d69635f 7468656d
ffff81017941f3c0 2503872514 S Bi:5:033:3 -115 4096 <
ffff81017941f0c0 2503875691 S Bo:5:033:4 -115 8 = 02000800 68000000
ffff81017941f3c0 2503876576 C Bi:5:033:3 0 12 = 00000c00 13020100 62030000
ffff81017941f0c0 2503876583 C Bo:5:033:4 0 8 >
ffff81017941f0c0 2503877571 S Bi:5:033:3 -115 4096 <
ffff81017941f0c0 2503878496 C Bi:5:033:3 0 8 = 02000800 64000000
ffff81017941f0c0 2503880920 S Bi:5:033:3 -115 4096 <
ffff81017941f3c0 2503885755 S Bo:5:033:4 -115 8 = 02000800 84000200
ffff81017941f3c0 2503886482 C Bo:5:033:4 0 8 >
ffff81017941f0c0 2503887498 C Bi:5:033:3 0 12 = 00000c00 13020100 63030000
ffff81017941f0c0 2503889931 S Bo:5:033:4 -115 6 = 02000600 113c
ffff81017941f3c0 2503889988 S Bi:5:033:3 -115 4096 <
ffff81017941f0c0 2503890480 C Bo:5:033:4 0 6 >
ffff81017941f3c0 2503891495 C Bi:5:033:3 0 12 = 00000c00 13020100 64030000
ffff81017941f3c0 2503893891 S Bi:5:033:3 -115 4096 <
ffff81017941f3c0 2503897505 C Bi:5:033:3 0 8 = 02000800 64000400
ffff81017941f3c0 2503901978 S Bi:5:033:3 -115 4096 <
ffff81017941f3c0 2503902499 C Bi:5:033:3 0 8 = 02000800 00000094
ffff81017941f3c0 2503904053 S Bi:5:033:3 -115 4096 <
ffff81017941f0c0 2503905934 S Bo:5:033:4 -115 8 = 02000800 68000000
ffff81017941f0c0 2503906483 C Bo:5:033:4 0 8 >
ffff81017941f3c0 2503907498 C Bi:5:033:3 0 12 = 00000c00 13020100 65030000
ffff81017941f3c0 2503909550 S Bi:5:033:3 -115 4096 <
ffff81017941f3c0 2503910497 C Bi:5:033:3 0 8 = 02000800 6e009400
ffff81017941f3c0 2503915074 S Bi:5:033:3 -115 4096 <
ffff81017941f3c0 2503915527 C Bi:5:033:3 0 152 = 02009800 ab76d27a 868edc0f 00000000 4175746f 4c6f636b 3a416c61 6e205065
ffff81017941f3c0 2503918055 S Bi:5:033:3 -115 4096 <
ffff81017941f0c0 2503919063 S Bo:5:033:4 -115 8 = 02000800 68000000
ffff81017941f0c0 2503919484 C Bo:5:033:4 0 8 >
ffff81017941f3c0 2503920508 C Bi:5:033:3 0 12 = 00000c00 13020100 66030000
ffff81017941f3c0 2503921937 S Bi:5:033:3 -115 4096 <
ffff81017941f3c0 2503922497 C Bi:5:033:3 0 8 = 02000800 64000000
ffff81017941f3c0 2503925085 S Bi:5:033:3 -115 4096 <
ffff81017941f0c0 2503931066 S Bo:5:033:4 -115 8 = 02000800 84000200
ffff81017941f0c0 2503931486 C Bo:5:033:4 0 8 >
ffff81017941f3c0 2503932595 C Bi:5:033:3 0 12 = 00000c00 13020100 67030000
ffff81017941f3c0 2503933965 S Bo:5:033:4 -115 6 = 02000600 113e
ffff81017941f0c0 2503934008 S Bi:5:033:3 -115 4096 <
ffff81017941f3c0 2503934482 C Bo:5:033:4 0 6 >
ffff81017941f0c0 2503935497 C Bi:5:033:3 0 12 = 00000c00 13020100 68030000
ffff81017941f0c0 2503938475 S Bi:5:033:3 -115 4096 <
ffff81017941f0c0 2503941502 C Bi:5:033:3 0 8 = 02000800 64000400
ffff81017941f0c0 2503943541 S Bi:5:033:3 -115 4096 <
ffff81017941f0c0 2503944500 C Bi:5:033:3 0 8 = 02000800 0000007c
ffff81017941f0c0 2503950979 S Bo:5:033:4 -115 8 = 02000800 68000000
ffff81017941f3c0 2503951040 S Bi:5:033:3 -115 4096 <
ffff81017941f0c0 2503951485 C Bo:5:033:4 0 8 >
ffff81017941f3c0 2503952507 C Bi:5:033:3 0 12 = 00000c00 13020100 69030000
ffff81017941f3c0 2503954006 S Bi:5:033:3 -115 4096 <
ffff81017941f3c0 2503954499 C Bi:5:033:3 0 8 = 02000800 6e007c00
ffff81017941f3c0 2503956896 S Bi:5:033:3 -115 4096 <
ffff81017941f3c0 2503957513 C Bi:5:033:3 0 128 = 02008000 ab76d27a 4fd50c03 00000000 54696e79 54776974 7465723a 5374616e
ffff81017941f3c0 2503960889 S Bo:5:033:4 -115 8 = 02000800 68000000
ffff81017941f0c0 2503960948 S Bi:5:033:3 -115 4096 <
ffff81017941f3c0 2503961485 C Bo:5:033:4 0 8 >
ffff81017941f0c0 2503962502 C Bi:5:033:3 0 12 = 00000c00 13020100 6a030000
ffff81017941f0c0 2503963913 S Bi:5:033:3 -115 4096 <
ffff81017941f0c0 2503964500 C Bi:5:033:3 0 8 = 02000800 64000000
ffff81017941f0c0 2503966080 S Bi:5:033:3 -115 4096 <
ffff81017941f3c0 2503968915 S Bo:5:033:4 -115 8 = 02000800 84000200
ffff81017941f3c0 2503969542 C Bo:5:033:4 0 8 >
ffff81017941f0c0 2503970514 C Bi:5:033:3 0 12 = 00000c00 13020100 6b030000
ffff81017941f0c0 2503971928 S Bi:5:033:3 -115 4096 <
ffff81017941f3c0 2503972883 S Bo:5:033:4 -115 6 = 02000600 11ec
ffff81017941f3c0 2503973487 C Bo:5:033:4 0 6 >
ffff81017941f0c0 2503974502 C Bi:5:033:3 0 12 = 00000c00 13020100 6c030000
ffff81017941f0c0 2503978649 S Bi:5:033:3 -115 4096 <
ffff81017941f0c0 2503980506 C Bi:5:033:3 0 8 = 02000800 64000400
ffff81017941f0c0 2503982563 S Bi:5:033:3 -115 4096 <
ffff81017941f0c0 2503983502 C Bi:5:033:3 0 8 = 02000800 00000128
ffff81017941f0c0 2503986677 S Bi:5:033:3 -115 4096 <
ffff81017941f3c0 2503987603 S Bo:5:033:4 -115 8 = 02000800 68000000
ffff81017941f0c0 2503988504 C Bi:5:033:3 0 12 = 00000c00 13020100 6d030000
ffff81017941f3c0 2503988509 C Bo:5:033:4 0 8 >
ffff81017941f3c0 2503989704 S Bi:5:033:3 -115 4096 <
ffff81017941f3c0 2503990502 C Bi:5:033:3 0 8 = 02000800 6e002801
ffff81017941f3c0 2503994860 S Bi:5:033:3 -115 4096 <
ffff81017941f3c0 2503995504 C Bi:5:033:3 0 300 = 02002c01 ab76d27a 848c7577 00000000 476f6f67 6c65204d 6170733a 476f6f67
ffff81017941f3c0 2503999045 S Bi:5:033:3 -115 4096 <
ffff81017941f0c0 2503999933 S Bo:5:033:4 -115 8 = 02000800 68000000
ffff81017941f0c0 2504000488 C Bo:5:033:4 0 8 >
ffff81017941f3c0 2504001505 C Bi:5:033:3 0 12 = 00000c00 13020100 6e030000
ffff81017941f3c0 2504003070 S Bi:5:033:3 -115 4096 <
ffff81017941f3c0 2504003503 C Bi:5:033:3 0 8 = 02000800 64000000
ffff81017941f3c0 2504005919 S Bi:5:033:3 -115 4096 <
ffff81017941f0c0 2504008976 S Bo:5:033:4 -115 8 = 02000800 84000200
ffff81017941f0c0 2504009490 C Bo:5:033:4 0 8 >
ffff81017941f3c0 2504010503 C Bi:5:033:3 0 12 = 00000c00 13020100 6f030000
ffff81017941f3c0 2504013890 S Bo:5:033:4 -115 6 = 02000600 1276
ffff81017941f0c0 2504013943 S Bi:5:033:3 -115 4096 <
ffff81017941f3c0 2504014488 C Bo:5:033:4 0 6 >
ffff81017941f0c0 2504015505 C Bi:5:033:3 0 12 = 00000c00 13020100 70030000
ffff81017941f0c0 2504019698 S Bi:5:033:3 -115 4096 <
ffff81017941f0c0 2504021508 C Bi:5:033:3 0 8 = 02000800 64000400
ffff81017941f0c0 2504023628 S Bi:5:033:3 -115 4096 <
ffff81017941f0c0 2504024504 C Bi:5:033:3 0 8 = 02000800 000000b0
ffff81017941f0c0 2504025746 S Bi:5:033:3 -115 4096 <
ffff81017941f3c0 2504027667 S Bo:5:033:4 -115 8 = 02000800 68000000
ffff81017941f3c0 2504028255 C Bo:5:033:4 0 8 >
ffff81017941f0c0 2504028506 C Bi:5:033:3 0 12 = 00000c00 13020100 71030000
ffff81017941f0c0 2504029711 S Bi:5:033:3 -115 4096 <
ffff81017941f0c0 2504030504 C Bi:5:033:3 0 8 = 02000800 6e00b000
ffff81017941f0c0 2504032599 S Bi:5:033:3 -115 4096 <
ffff81017941f0c0 2504033504 C Bi:5:033:3 0 180 = 0200b400 ab76d27a dd06dc3b 00000000 476d6169 6c3a476f 6f676c65 00000047
ffff81017941f0c0 2504037945 S Bi:5:033:3 -115 4096 <
ffff81017941f3c0 2504038875 S Bo:5:033:4 -115 8 = 02000800 68000000
ffff81017941f3c0 2504039490 C Bo:5:033:4 0 8 >
ffff81017941f0c0 2504040509 C Bi:5:033:3 0 12 = 00000c00 13020100 72030000
ffff81017941f0c0 2504041731 S Bi:5:033:3 -115 4096 <
ffff81017941f0c0 2504042504 C Bi:5:033:3 0 8 = 02000800 64000000
ffff81017941f0c0 2504044968 S Bi:5:033:3 -115 4096 <
ffff81017941f3c0 2504049232 S Bo:5:033:4 -115 8 = 02000800 84000200
ffff81017941f3c0 2504049492 C Bo:5:033:4 0 8 >
ffff81017941f0c0 2504050564 C Bi:5:033:3 0 12 = 00000c00 13020100 73030000
ffff81017941f0c0 2504052025 S Bo:5:033:4 -115 6 = 02000600 1533
ffff81017941f3c0 2504052335 S Bi:5:033:3 -115 4096 <
ffff81017941f0c0 2504052490 C Bo:5:033:4 0 6 >
ffff81017941f3c0 2504053508 C Bi:5:033:3 0 12 = 00000c00 13020100 74030000
ffff81017941f3c0 2504054852 S Bi:5:033:3 -115 4096 <
ffff81017941f3c0 2504060510 C Bi:5:033:3 0 8 = 02000800 64000400
ffff8101796a2e40 2504064271 S Bi:5:033:3 -115 4096 <
ffff8101796a2e40 2504064507 C Bi:5:033:3 0 8 = 02000800 00000088
ffff8101796a2e40 2504068612 S Bi:5:033:3 -115 4096 <
ffff8101796a2cc0 2504071610 S Bo:5:033:4 -115 8 = 02000800 68000000
ffff8101796a2e40 2504072510 C Bi:5:033:3 0 12 = 00000c00 13020100 75030000
ffff8101796a2cc0 2504072516 C Bo:5:033:4 0 8 >
ffff8101796a2cc0 2504073631 S Bi:5:033:3 -115 4096 <
ffff8101796a2cc0 2504074511 C Bi:5:033:3 0 8 = 02000800 6e008800
ffff8101796a2cc0 2504078348 S Bi:5:033:3 -115 4096 <
ffff8101796a2cc0 2504079511 C Bi:5:033:3 0 140 = 02008c00 ab76d27a a47458d3 00000000 476f6f67 6c652053 796e633a 476f6f67
ffff8101796a2cc0 2504082448 S Bi:5:033:3 -115 4096 <
ffff8101796a2e40 2504083341 S Bo:5:033:4 -115 8 = 02000800 68000000
ffff8101796a2e40 2504083491 C Bo:5:033:4 0 8 >
ffff8101796a2cc0 2504084508 C Bi:5:033:3 0 12 = 00000c00 13020100 76030000
ffff8101796a2cc0 2504085456 S Bi:5:033:3 -115 4096 <
ffff8101796a2cc0 2504086508 C Bi:5:033:3 0 8 = 02000800 64000000
ffff8101796a2cc0 2504097454 S Bo:5:033:4 -115 8 = 02000800 84000200
ffff8101796a2e40 2504097476 S Bi:5:033:3 -115 4096 <
ffff8101796a2cc0 2504098496 C Bo:5:033:4 0 8 >
ffff8101796a2e40 2504098518 C Bi:5:033:3 0 12 = 00000c00 13020100 77030000
ffff8101796a2e40 2504103447 S Bo:5:033:4 -115 6 = 02000600 1556
ffff8101796a2cc0 2504103507 S Bi:5:033:3 -115 4096 <
ffff8101796a2e40 2504104494 C Bo:5:033:4 0 6 >
ffff8101796a2cc0 2504104516 C Bi:5:033:3 0 12 = 00000c00 13020100 78030000
ffff8101796a2cc0 2504105491 S Bi:5:033:3 -115 4096 <
ffff8101796a2cc0 2504112509 C Bi:5:033:3 0 8 = 02000800 64000400
ffff8101796a2cc0 2504115325 S Bi:5:033:3 -115 4096 <
ffff8101796a2cc0 2504115510 C Bi:5:033:3 0 8 = 02000800 00000108
ffff8101796a2cc0 2504117409 S Bi:5:033:3 -115 4096 <
ffff8101796a2e40 2504119373 S Bo:5:033:4 -115 8 = 02000800 68000000
ffff8101796a2e40 2504119497 C Bo:5:033:4 0 8 >
ffff8101796a2cc0 2504120511 C Bi:5:033:3 0 12 = 00000c00 13020100 79030000
ffff8101796a2cc0 2504122487 S Bi:5:033:3 -115 4096 <
ffff8101796a2cc0 2504123511 C Bi:5:033:3 0 8 = 02000800 6e000801
ffff8101796a2cc0 2504126409 S Bi:5:033:3 -115 4096 <
ffff8101796a2cc0 2504127512 C Bi:5:033:3 0 268 = 02000c01 ab76d27a f7dc64c8 00000000 46616365 626f6f6b 3a526573 65617263
ffff8101796a2cc0 2504130424 S Bi:5:033:3 -115 4096 <
ffff8101796a2e40 2504137358 S Bo:5:033:4 -115 8 = 02000800 68000000
ffff8101796a2e40 2504137497 C Bo:5:033:4 0 8 >
ffff8101796a2cc0 2504138513 C Bi:5:033:3 0 12 = 00000c00 13020100 7a030000
ffff8101796a2cc0 2504140338 S Bi:5:033:3 -115 4096 <
ffff8101796a2cc0 2504140513 C Bi:5:033:3 0 8 = 02000800 64000000
ffff8101796a2cc0 2504146389 S Bi:5:033:3 -115 4096 <
ffff81017941f0c0 2504154989 S Bo:5:033:4 -115 8 = 02000800 84000200
ffff81017941f0c0 2504155498 C Bo:5:033:4 0 8 >
ffff8101796a2cc0 2504156522 C Bi:5:033:3 0 12 = 00000c00 13020100 7b030000
ffff81017941f0c0 2504158016 S Bo:5:033:4 -115 6 = 02000600 155a
ffff81017941ff00 2504158060 S Bi:5:033:3 -115 4096 <
ffff81017941f0c0 2504158495 C Bo:5:033:4 0 6 >
ffff81017941ff00 2504159511 C Bi:5:033:3 0 12 = 00000c00 13020100 7c030000
ffff81017941ff00 2504161849 S Bi:5:033:3 -115 4096 <
ffff81017941ff00 2504166514 C Bi:5:033:3 0 8 = 02000800 64000400
ffff81017941ff00 2504169773 S Bi:5:033:3 -115 4096 <
ffff81017941ff00 2504170556 C Bi:5:033:3 0 8 = 02000800 000000f4
ffff81017941ff00 2504172346 S Bi:5:033:3 -115 4096 <
ffff81017941f0c0 2504176731 S Bo:5:033:4 -115 8 = 02000800 68000000
ffff81017941f0c0 2504177500 C Bo:5:033:4 0 8 >
ffff81017941ff00 2504178517 C Bi:5:033:3 0 12 = 00000c00 13020100 7d030000
ffff81017941ff00 2504179681 S Bi:5:033:3 -115 4096 <
ffff81017941ff00 2504180513 C Bi:5:033:3 0 8 = 02000800 6e00f400
ffff81017941ff00 2504182721 S Bi:5:033:3 -115 4096 <
ffff81017941ff00 2504183513 C Bi:5:033:3 0 248 = 0200f800 ab76d27a 833c8e6c 00000000 54686520 486f636b 6579204e 65777320
ffff81017941ff00 2504186334 S Bi:5:033:3 -115 4096 <
ffff81017941f0c0 2504188416 S Bo:5:033:4 -115 8 = 02000800 68000000
ffff81017941ff00 2504189518 C Bi:5:033:3 0 12 = 00000c00 13020100 7e030000
ffff81017941f0c0 2504189523 C Bo:5:033:4 0 8 >
ffff81017941f0c0 2504194603 S Bi:5:033:3 -115 4096 <
ffff81017941f0c0 2504195516 C Bi:5:033:3 0 8 = 02000800 64000000
ffff81017941f0c0 2504197536 S Bi:5:033:3 -115 4096 <
ffff81017941ff00 2504202624 S Bo:5:033:4 -115 8 = 02000800 84000200
ffff81017941f0c0 2504203518 C Bi:5:033:3 0 12 = 00000c00 13020100 7f030000
ffff81017941ff00 2504203522 C Bo:5:033:4 0 8 >
ffff81017941ff00 2504206606 S Bo:5:033:4 -115 6 = 02000600 156b
ffff81017941f0c0 2504206676 S Bi:5:033:3 -115 4096 <
ffff81017941ff00 2504207500 C Bo:5:033:4 0 6 >
ffff81017941f0c0 2504207522 C Bi:5:033:3 0 12 = 00000c00 13020100 80030000
ffff81017941f0c0 2504209613 S Bi:5:033:3 -115 4096 <
ffff81017941f0c0 2504215519 C Bi:5:033:3 0 8 = 02000800 64000400
ffff81017941f0c0 2504217944 S Bi:5:033:3 -115 4096 <
ffff81017941f0c0 2504218528 C Bi:5:033:3 0 8 = 02000800 00000058
ffff81017941f0c0 2504219983 S Bi:5:033:3 -115 4096 <
ffff81017941ff00 2504222776 S Bo:5:033:4 -115 8 = 02000800 68000000
ffff81017941ff00 2504223501 C Bo:5:033:4 0 8 >
ffff81017941f0c0 2504224523 C Bi:5:033:3 0 12 = 00000c00 13020100 81030000
ffff81017941f0c0 2504225830 S Bi:5:033:3 -115 4096 <
ffff81017941f0c0 2504226514 C Bi:5:033:3 0 8 = 02000800 6e005800
ffff81017941f0c0 2504231573 S Bi:5:033:3 -115 4096 <
ffff81017941f0c0 2504232520 C Bi:5:033:3 0 92 = 02005c00 ab76d27a 38f3259d 00000000 4d696470 5353483a 584b3732 0000006d
ffff81017941f0c0 2504238055 S Bi:5:033:3 -115 4096 <
ffff81017941ff00 2504238964 S Bo:5:033:4 -115 8 = 02000800 68000000
ffff81017941ff00 2504239502 C Bo:5:033:4 0 8 >
ffff81017941f0c0 2504240525 C Bi:5:033:3 0 12 = 00000c00 13020100 82030000
ffff81017941f0c0 2504241928 S Bi:5:033:3 -115 4096 <
ffff81017941f0c0 2504242515 C Bi:5:033:3 0 8 = 02000800 64000000
ffff81017941f0c0 2504244984 S Bi:5:033:3 -115 4096 <
ffff81017941ff00 2504248945 S Bo:5:033:4 -115 8 = 02000800 84000200
ffff81017941ff00 2504249503 C Bo:5:033:4 0 8 >
ffff81017941f0c0 2504250517 C Bi:5:033:3 0 12 = 00000c00 13020100 83030000
ffff81017941f0c0 2504253841 S Bo:5:033:4 -115 6 = 02000600 1596
ffff81017941ff00 2504253893 S Bi:5:033:3 -115 4096 <
ffff81017941f0c0 2504254501 C Bo:5:033:4 0 6 >
ffff81017941ff00 2504255516 C Bi:5:033:3 0 12 = 00000c00 13020100 84030000
ffff81017941ff00 2504257973 S Bi:5:033:3 -115 4096 <
ffff81017941ff00 2504262522 C Bi:5:033:3 0 8 = 02000800 64000400
ffff81017941ff00 2504265885 S Bi:5:033:3 -115 4096 <
ffff81017941ff00 2504266521 C Bi:5:033:3 0 8 = 02000800 000001d0
ffff81017941ff00 2504270790 S Bo:5:033:4 -115 8 = 02000800 68000000
ffff81017941f0c0 2504271045 S Bi:5:033:3 -115 4096 <
ffff81017941ff00 2504271503 C Bo:5:033:4 0 8 >
ffff81017941f0c0 2504272522 C Bi:5:033:3 0 12 = 00000c00 13020100 85030000
ffff81017941f0c0 2504274097 S Bi:5:033:3 -115 4096 <
ffff81017941f0c0 2504274520 C Bi:5:033:3 0 8 = 02000800 6e00d001
ffff81017941f0c0 2504275943 S Bi:5:033:3 -115 4096 <
ffff81017941f0c0 2504277529 C Bi:5:033:3 0 468 = 0200d401 ab76d27a 74ba5f50 00000000 636f6d5f 706c617a 6d69635f 7468656d
ffff81017941f0c0 2504281873 S Bo:5:033:4 -115 8 = 02000800 68000000
ffff81017941ff00 2504281935 S Bi:5:033:3 -115 4096 <
ffff81017941f0c0 2504282503 C Bo:5:033:4 0 8 >
ffff81017941ff00 2504283518 C Bi:5:033:3 0 12 = 00000c00 13020100 86030000
ffff81017941ff00 2504285958 S Bi:5:033:3 -115 4096 <
ffff81017941ff00 2504286518 C Bi:5:033:3 0 8 = 02000800 64000000
ffff81017941ff00 2504289659 S Bi:5:033:3 -115 4096 <
ffff81017941f0c0 2504293576 S Bo:5:033:4 -115 8 = 02000800 84000200
ffff81017941ff00 2504294523 C Bi:5:033:3 0 12 = 00000c00 13020100 87030000
ffff81017941f0c0 2504294528 C Bo:5:033:4 0 8 >
ffff81017941f0c0 2504295593 S Bo:5:033:4 -115 6 = 02000600 1633
ffff81017941ff00 2504295634 S Bi:5:033:3 -115 4096 <
ffff81017941f0c0 2504296503 C Bo:5:033:4 0 6 >
ffff81017941ff00 2504296524 C Bi:5:033:3 0 12 = 00000c00 13020100 88030000
ffff81017941ff00 2504297623 S Bi:5:033:3 -115 4096 <
ffff81017941ff00 2504304524 C Bi:5:033:3 0 8 = 02000800 64000400
ffff81017941ff00 2504305893 S Bi:5:033:3 -115 4096 <
ffff81017941ff00 2504306529 C Bi:5:033:3 0 8 = 02000800 00000158
ffff81017941ff00 2504308923 S Bi:5:033:3 -115 4096 <
ffff81017941f0c0 2504310877 S Bo:5:033:4 -115 8 = 02000800 68000000
ffff81017941f0c0 2504311506 C Bo:5:033:4 0 8 >
ffff81017941ff00 2504312522 C Bi:5:033:3 0 12 = 00000c00 13020100 89030000
ffff81017941ff00 2504313904 S Bi:5:033:3 -115 4096 <
ffff81017941ff00 2504314520 C Bi:5:033:3 0 8 = 02000800 6e005801
ffff81017941ff00 2504317921 S Bi:5:033:3 -115 4096 <
ffff81017941ff00 2504318525 C Bi:5:033:3 0 348 = 02005c01 ab76d27a 1ecdf6f5 00000000 466c616d 626f7961 6e742049 636f6e3a
ffff81017941ff00 2504322925 S Bo:5:033:4 -115 8 = 02000800 68000000
ffff81017941f0c0 2504322987 S Bi:5:033:3 -115 4096 <
ffff81017941ff00 2504323506 C Bo:5:033:4 0 8 >
ffff81017941f0c0 2504324523 C Bi:5:033:3 0 12 = 00000c00 13020100 8a030000
ffff81017941f0c0 2504325962 S Bi:5:033:3 -115 4096 <
ffff81017941f0c0 2504326520 C Bi:5:033:3 0 8 = 02000800 64000000
ffff81017941f0c0 2504331123 S Bi:5:033:3 -115 4096 <
ffff8101796a2e40 2504340182 S Bo:5:033:4 -115 8 = 02000800 84000200
ffff8101796a2e40 2504340511 C Bo:5:033:4 0 8 >
ffff81017941f0c0 2504341522 C Bi:5:033:3 0 12 = 00000c00 13020100 8b030000
ffff8101796a2e40 2504343035 S Bi:5:033:3 -115 4096 <
ffff8101796a2cc0 2504344007 S Bo:5:033:4 -115 6 = 02000600 168a
ffff8101796a2cc0 2504344507 C Bo:5:033:4 0 6 >
ffff8101796a2e40 2504345527 C Bi:5:033:3 0 12 = 00000c00 13020100 8c030000
ffff8101796a2e40 2504347678 S Bi:5:033:3 -115 4096 <
ffff8101796a2e40 2504353527 C Bi:5:033:3 0 8 = 02000800 64000400
ffff8101796a2e40 2504355422 S Bi:5:033:3 -115 4096 <
ffff8101796a2e40 2504356524 C Bi:5:033:3 0 8 = 02000800 00000184
ffff8101796a2e40 2504359483 S Bi:5:033:3 -115 4096 <
ffff8101796a2cc0 2504360368 S Bo:5:033:4 -115 8 = 02000800 68000000
ffff8101796a2cc0 2504360508 C Bo:5:033:4 0 8 >
ffff8101796a2e40 2504361523 C Bi:5:033:3 0 12 = 00000c00 13020100 8d030000
ffff8101796a2e40 2504366315 S Bi:5:033:3 -115 4096 <
ffff8101796a2e40 2504366526 C Bi:5:033:3 0 8 = 02000800 6e008401
ffff8101796a2e40 2504369417 S Bi:5:033:3 -115 4096 <
ffff8101796a2e40 2504370527 C Bi:5:033:3 0 392 = 02008801 ab76d27a c80603eb 00000000 4e656f6e 20457870 72657373 2049636f
ffff8101796a2e40 2504374436 S Bi:5:033:3 -115 4096 <
ffff8101796a2cc0 2504375441 S Bo:5:033:4 -115 8 = 02000800 68000000
ffff8101796a2e40 2504376528 C Bi:5:033:3 0 12 = 00000c00 13020100 8e030000
ffff8101796a2cc0 2504376534 C Bo:5:033:4 0 8 >
ffff8101796a2cc0 2504379243 S Bi:5:033:3 -115 4096 <
ffff8101796a2cc0 2504379525 C Bi:5:033:3 0 8 = 02000800 64000000
ffff8101796a2cc0 2504381307 S Bi:5:033:3 -115 4096 <
ffff8101796a2e40 2504390383 S Bo:5:033:4 -115 8 = 02000800 84000200
ffff8101796a2e40 2504390512 C Bo:5:033:4 0 8 >
ffff8101796a2cc0 2504391527 C Bi:5:033:3 0 12 = 00000c00 13020100 8f030000
ffff8101796a2cc0 2504394342 S Bo:5:033:4 -115 6 = 02000600 16b8
ffff8101796a2e40 2504394361 S Bi:5:033:3 -115 4096 <
ffff8101796a2cc0 2504394509 C Bo:5:033:4 0 6 >
ffff8101796a2e40 2504395524 C Bi:5:033:3 0 12 = 00000c00 13020100 90030000
ffff8101796a2e40 2504397376 S Bi:5:033:3 -115 4096 <
ffff8101796a2e40 2504403530 C Bi:5:033:3 0 8 = 02000800 64000400
ffff8101796a2e40 2504406413 S Bi:5:033:3 -115 4096 <
ffff8101796a2e40 2504407528 C Bi:5:033:3 0 8 = 02000800 0000007c
ffff8101796a2e40 2504409495 S Bi:5:033:3 -115 4096 <
ffff8101796a2cc0 2504410436 S Bo:5:033:4 -115 8 = 02000800 68000000
ffff8101796a2cc0 2504411510 C Bo:5:033:4 0 8 >
ffff8101796a2e40 2504412525 C Bi:5:033:3 0 12 = 00000c00 13020100 91030000
ffff8101796a2e40 2504413336 S Bi:5:033:3 -115 4096 <
ffff8101796a2e40 2504413528 C Bi:5:033:3 0 8 = 02000800 6e007c00
ffff8101796a2e40 2504415418 S Bi:5:033:3 -115 4096 <
ffff8101796a2e40 2504416531 C Bi:5:033:3 0 128 = 02008000 ab76d27a e1395f04 00000000 55534120 544f4441 59204d6f 62696c65
ffff8101796a2e40 2504419427 S Bi:5:033:3 -115 4096 <
ffff8101796a2cc0 2504420397 S Bo:5:033:4 -115 8 = 02000800 68000000
ffff8101796a2cc0 2504420511 C Bo:5:033:4 0 8 >
ffff8101796a2e40 2504421527 C Bi:5:033:3 0 12 = 00000c00 13020100 92030000
ffff8101796a2e40 2504426315 S Bi:5:033:3 -115 4096 <
ffff8101796a2e40 2504426529 C Bi:5:033:3 0 8 = 02000800 64000000
ffff8101796a2e40 2504429404 S Bi:5:033:3 -115 4096 <
ffff8101796a2cc0 2504438319 S Bo:5:033:4 -115 8 = 02000800 84000200
ffff8101796a2cc0 2504438516 C Bo:5:033:4 0 8 >
ffff8101796a2e40 2504439529 C Bi:5:033:3 0 12 = 00000c00 13020100 93030000
ffff8101796a2e40 2504442325 S Bo:5:033:4 -115 6 = 02000600 16f9
ffff8101796a2cc0 2504442343 S Bi:5:033:3 -115 4096 <
ffff8101796a2e40 2504442513 C Bo:5:033:4 0 6 >
ffff8101796a2cc0 2504443527 C Bi:5:033:3 0 12 = 00000c00 13020100 94030000
ffff8101796a2cc0 2504446324 S Bi:5:033:3 -115 4096 <
ffff8101796a2cc0 2504452529 C Bi:5:033:3 0 8 = 02000800 64000400
ffff81017941ff00 2504454934 S Bi:5:033:3 -115 4096 <
ffff81017941ff00 2504455528 C Bi:5:033:3 0 8 = 02000800 00000088
ffff81017941ff00 2504457063 S Bi:5:033:3 -115 4096 <
ffff81017941fa80 2504458976 S Bo:5:033:4 -115 8 = 02000800 68000000
ffff81017941fa80 2504459513 C Bo:5:033:4 0 8 >
ffff81017941ff00 2504460617 C Bi:5:033:3 0 12 = 00000c00 13020100 95030000
ffff81017941ff00 2504461871 S Bi:5:033:3 -115 4096 <
ffff81017941ff00 2504462527 C Bi:5:033:3 0 8 = 02000800 6e008800
ffff81017941ff00 2504467039 S Bi:5:033:3 -115 4096 <
ffff81017941ff00 2504467530 C Bi:5:033:3 0 140 = 02008c00 ab76d27a e70121af 00000000 536f6674 52657365 743a416c 616e2050
ffff81017941ff00 2504469262 S Bi:5:033:3 -115 4096 <
ffff81017941fa80 2504471424 S Bo:5:033:4 -115 8 = 02000800 68000000
ffff81017941ff00 2504472532 C Bi:5:033:3 0 12 = 00000c00 13020100 96030000
ffff81017941fa80 2504472536 C Bo:5:033:4 0 8 >
ffff81017941ff00 2504474966 S Bi:5:033:3 -115 4096 <
ffff81017941ff00 2504475530 C Bi:5:033:3 0 8 = 02000800 64000000
ffff81017941ff00 2504483056 S Bo:5:033:4 -115 8 = 02000800 84000200
ffff81017941f0c0 2504483119 S Bi:5:033:3 -115 4096 <
ffff81017941ff00 2504483519 C Bo:5:033:4 0 8 >
ffff81017941f0c0 2504484541 C Bi:5:033:3 0 12 = 00000c00 13020100 97030000
ffff81017941f0c0 2504486013 S Bo:5:033:4 -115 6 = 02000600 1790
ffff81017941ff00 2504486060 S Bi:5:033:3 -115 4096 <
ffff81017941f0c0 2504486515 C Bo:5:033:4 0 6 >
ffff81017941ff00 2504487532 C Bi:5:033:3 0 12 = 00000c00 13020100 98030000
ffff8101796a2e40 2504490875 S Bi:5:033:3 -115 4096 <
ffff8101796a2e40 2504495534 C Bi:5:033:3 0 8 = 02000800 64000400
ffff8101796a2e40 2504498381 S Bi:5:033:3 -115 4096 <
ffff8101796a2e40 2504498532 C Bi:5:033:3 0 8 = 02000800 00000574
ffff8101796a2e40 2504501399 S Bi:5:033:3 -115 4096 <
ffff8101796a2480 2504503388 S Bo:5:033:4 -115 8 = 02000800 68000000
ffff8101796a2480 2504503516 C Bo:5:033:4 0 8 >
ffff8101796a2e40 2504504533 C Bi:5:033:3 0 12 = 00000c00 13020100 99030000
ffff8101796a2e40 2504505446 S Bi:5:033:3 -115 4096 <
ffff8101796a2e40 2504506532 C Bi:5:033:3 0 8 = 02000800 6e007405
ffff8101796a2e40 2504509469 S Bi:5:033:3 -115 4096 <
ffff8101796a2e40 2504511533 C Bi:5:033:3 0 1400 = 02007805 ab76d27a 7d3d8cef 00000000 56696967 6f20666f 7220426c 61636b42
ffff8101796a2e40 2504515454 S Bo:5:033:4 -115 8 = 02000800 68000000
ffff8101796a2480 2504515476 S Bi:5:033:3 -115 4096 <
ffff8101796a2e40 2504516518 C Bo:5:033:4 0 8 >
ffff8101796a2480 2504516541 C Bi:5:033:3 0 12 = 00000c00 13020100 9a030000
ffff8101796a2480 2504517417 S Bi:5:033:3 -115 4096 <
ffff8101796a2480 2504518530 C Bi:5:033:3 0 8 = 02000800 64000000
ffff8101796a2480 2504521371 S Bi:5:033:3 -115 4096 <
ffff8101796a2e40 2504533388 S Bo:5:033:4 -115 8 = 02000800 84000200
ffff8101796a2e40 2504533521 C Bo:5:033:4 0 8 >
ffff8101796a2480 2504534533 C Bi:5:033:3 0 12 = 00000c00 13020100 9b030000
ffff8101796a2480 2504538320 S Bo:5:033:4 -115 6 = 02000600 187b
ffff8101796a2e40 2504538337 S Bi:5:033:3 -115 4096 <
ffff8101796a2480 2504538516 C Bo:5:033:4 0 6 >
ffff8101796a2e40 2504539532 C Bi:5:033:3 0 12 = 00000c00 13020100 9c030000
ffff8101796a2e40 2504542089 S Bi:5:033:3 -115 4096 <
ffff8101796a2e40 2504548537 C Bi:5:033:3 0 8 = 02000800 64000400
ffff8101796a2e40 2504550585 S Bi:5:033:3 -115 4096 <
ffff8101796a2e40 2504551533 C Bi:5:033:3 0 8 = 02000800 00000138
ffff8101796a2e40 2504555480 S Bi:5:033:3 -115 4096 <
ffff8101796a2480 2504556264 S Bo:5:033:4 -115 8 = 02000800 68000000
ffff8101796a2480 2504556519 C Bo:5:033:4 0 8 >
ffff8101796a2e40 2504557534 C Bi:5:033:3 0 12 = 00000c00 13020100 9d030000
ffff8101796a2e40 2504559266 S Bi:5:033:3 -115 4096 <
ffff8101796a2e40 2504559536 C Bi:5:033:3 0 8 = 02000800 6e003801
ffff8101796a2e40 2504562379 S Bi:5:033:3 -115 4096 <
ffff8101796a2e40 2504563539 C Bi:5:033:3 0 316 = 02003c01 ab76d27a 043d772c 00000000 426c6163 6b426572 72792041 70702057
ffff8101796a2e40 2504565396 S Bi:5:033:3 -115 4096 <
ffff8101796a2480 2504567488 S Bo:5:033:4 -115 8 = 02000800 68000000
ffff8101796a2e40 2504568536 C Bi:5:033:3 0 12 = 00000c00 13020100 9e030000
ffff8101796a2480 2504568541 C Bo:5:033:4 0 8 >
ffff8101796a2480 2504570233 S Bi:5:033:3 -115 4096 <
ffff8101796a2480 2504570536 C Bi:5:033:3 0 8 = 02000800 64000000
ffff8101796a2480 2504584735 S Bi:5:033:3 -115 4096 <
ffff81003739a600 2541119213 S Bo:5:033:4 -115 8 = 02000800 8d000000
ffff8101796a2480 2541120602 C Bi:5:033:3 0 12 = 00000c00 13020100 9f030000
ffff81003739a600 2541120610 C Bo:5:033:4 0 8 >
ffff81003739a600 2541121912 S Bi:5:033:3 -115 4096 <
ffff81003739a600 2541122597 C Bi:5:033:3 0 8 = 02000800 64000000
ffff81003739a600 2541125029 S Bo:5:033:4 -115 8 = 00000800 0b02000d
ffff81003739acc0 2541125049 S Bi:5:033:3 -115 4096 <
ffff81003739a600 2541125578 C Bo:5:033:4 0 8 >
ffff81003739acc0 2541126594 C Bi:5:033:3 0 8 = 00000800 0c02000d
ffff81003739acc0 2541130008 S Bi:5:033:3 -115 4096 <
