ffff81012cc3b6c0 648218949 S Bo:5:038:6 -115 12 = 01000000 00000000 78563412
ffff81012cc3b3c0 648219067 S Bi:5:038:5 -115 4096 <
ffff81012cc3b6c0 648220869 C Bo:5:038:6 0 12 >
ffff81012cc3b6c0 648222886 S Bo:5:038:8 -115 12 = 01000000 00000000 78563412
ffff81012cc3b0c0 648222916 S Bi:5:038:7 -115 4096 <
ffff81012cc3b6c0 648223867 C Bo:5:038:8 0 12 >
ffff81012cc3b6c0 648229034 S Bo:5:038:8 -115 12 = 01000000 00000000 78563412
ffff81012cc3b6c0 648229867 C Bo:5:038:8 0 12 >
ffff81012cc3b6c0 648235003 S Bo:5:038:8 -115 12 = 01000000 01000000 78563412
ffff81012cc3b0c0 648235885 C Bi:5:038:7 0 28 = 04000000 00000000 00000000 00000000 01000000 1c000000 78563412
ffff81012cc3b6c0 648235890 C Bo:5:038:8 0 12 >
ffff81012cc3b6c0 648238033 S Bi:5:038:7 -115 4096 <
ffff810026306780 648917258 S Bo:5:038:4 -115 24 = 00001800 07ff000c 52494d20 42797061 73730000 00000000
ffff8100263060c0 648917293 S Bi:5:038:3 -115 4096 <
ffff810026306780 648918909 C Bo:5:038:4 0 24 >
ffff810129ba9240 648920921 C Bi:5:038:3 0 44 = 00002c00 0806000c 52494d20 42797061 73730000 00000000 00000000 01fc3f00
ffff810026306780 648921358 S Bo:5:038:6 -115 12 = 01000000 00000000 78563412
ffff8100263060c0 648921925 C Bi:5:038:3 0 12 = 00000c00 13060100 00000000
ffff810026306780 648921935 C Bo:5:038:6 0 12 >
ffff810026306780 648923320 S Bo:5:038:6 -115 12 = 01000000 01000000 78563412
ffff8100263060c0 648923368 S Bi:5:038:3 -115 4096 <
ffff81012cc3b3c0 648923926 C Bi:5:038:5 0 28 = 04000000 00000000 00000000 00000000 01000000 1c000000 78563412
ffff810026306780 648923939 C Bo:5:038:6 0 12 >
ffff810026306780 648925192 S Bi:5:038:5 -115 4096 <
ffff810026306cc0 652473132 S Bo:5:038:10 -115 31 = 55534243 0857ab80 08000000 80000a25 00000000 00000000 00000000 000000
ffff810026306cc0 652475109 C Bo:5:038:10 0 31 >
ffff810026306cc0 652478084 S Bi:5:038:9 -115 8 <
ffff810026306cc0 652479107 C Bi:5:038:9 0 8 = 001e45ff 00000200
ffff810026306cc0 652480240 S Bi:5:038:9 -115 13 <
ffff810026306cc0 652481104 C Bi:5:038:9 0 13 = 55534253 0857ab80 00000000 00
ffff810026306cc0 652486996 S Bo:5:038:10 -115 31 = 55534243 0857ab80 08000000 80000a25 00000000 00000000 00000000 000000
ffff810026306cc0 652487106 C Bo:5:038:10 0 31 >
ffff810026306cc0 652489380 S Bi:5:038:9 -115 8 <
ffff810026306cc0 652490105 C Bi:5:038:9 0 8 = 001e45ff 00000200
ffff810026306cc0 652492080 S Bi:5:038:9 -115 13 <
ffff810026306cc0 652493104 C Bi:5:038:9 0 13 = 55534253 0857ab80 00000000 00
ffff810026306cc0 652497060 S Bo:5:038:10 -115 31 = 55534243 8874aa80 00020000 80000a28 00000020 1b000001 00000000 000000
ffff810026306cc0 652498108 C Bo:5:038:10 0 31 >
ffff810026306cc0 652501139 S Bi:5:038:9 -115 512 <
ffff810026306cc0 652502108 C Bi:5:038:9 0 512 = ebff904d 53444f53 352e3000 02200100 02000200 00f8f200 3f002000 1b200000
ffff810026306cc0 652505978 S Bi:5:038:9 -115 13 <
ffff810026306cc0 652506106 C Bi:5:038:9 0 13 = 55534253 8874aa80 00000000 00
ffff810026306cc0 652510073 S Bo:5:038:10 -115 31 = 55534243 8874aa80 00020000 80000a28 00000f33 0d000001 00000000 000000
ffff810026306cc0 652511106 C Bo:5:038:10 0 31 >
ffff810026306cc0 652514069 S Bi:5:038:9 -115 512 <
ffff810026306cc0 652515112 C Bi:5:038:9 0 512 = 00000000 00000000 00000000 00000000 00000000 00000000 00000000 00000000
ffff810026306cc0 652517498 S Bi:5:038:9 -115 13 <
ffff810026306cc0 652518107 C Bi:5:038:9 0 13 = 55534253 8874aa80 00000000 00
ffff810026306cc0 652521323 S Bo:5:038:10 -115 31 = 55534243 8874aa80 00020000 80000a28 00001e45 ff000001 00000000 000000
ffff810026306cc0 652522111 C Bo:5:038:10 0 31 >
ffff810026306cc0 652523385 S Bi:5:038:9 -115 512 <
ffff810026306cc0 652524110 C Bi:5:038:9 0 512 = 00000000 00000000 00000000 00000000 00000000 00000000 00000000 00000000
ffff810026306cc0 652525196 S Bi:5:038:9 -115 13 <
ffff810026306cc0 652526106 C Bi:5:038:9 0 13 = 55534253 8874aa80 00000000 00
ffff810026306cc0 652534155 S Bo:5:038:10 -115 31 = 55534243 0857ab80 08000000 80000a25 00000000 00000000 00000000 000000
ffff810026306cc0 652535111 C Bo:5:038:10 0 31 >
ffff810026306cc0 652539222 S Bi:5:038:9 -115 8 <
ffff810026306cc0 652540111 C Bi:5:038:9 0 8 = 001e45ff 00000200
ffff810026306cc0 652541032 S Bi:5:038:9 -115 13 <
ffff810026306cc0 652542110 C Bi:5:038:9 0 13 = 55534253 0857ab80 00000000 00
ffff810026306cc0 652548971 S Bo:5:038:10 -115 31 = 55534243 8874aa80 00080000 80000a28 00000020 5b000004 00000000 000000
ffff810026306cc0 652549111 C Bo:5:038:10 0 31 >
ffff810026306cc0 652553466 S Bi:5:038:9 -115 2048 <
ffff810026306cc0 652556120 C Bi:5:038:9 0 2048 = 00000000 00000000 00000000 00000000 00000000 00000000 00000000 00000000
ffff810026306cc0 652557021 S Bi:5:038:9 -115 13 <
ffff810026306cc0 652558109 C Bi:5:038:9 0 13 = 55534253 8874aa80 00000000 00
ffff810026306cc0 652562352 S Bo:5:038:10 -115 31 = 55534243 487eab80 00000000 00000600 00000000 00000000 00000000 000000
ffff810026306cc0 652563111 C Bo:5:038:10 0 31 >
ffff810026306cc0 652564820 S Bi:5:038:9 -115 13 <
ffff810026306cc0 652565110 C Bi:5:038:9 0 13 = 55534253 487eab80 00000000 01
ffff810026306cc0 652566223 S Bo:5:038:10 -115 31 = 55534243 487eab80 12000000 80000c03 00000012 00000000 00000000 000000
ffff810026306cc0 652567108 C Bo:5:038:10 0 31 >
ffff810026306cc0 652570207 S Bi:5:038:9 -115 18 <
ffff810026306cc0 652571117 C Bi:5:038:9 0 18 = 70000600 0000000a 00000000 28000000 0000
ffff810026306cc0 652573374 S Bi:5:038:9 -115 13 <
ffff810026306cc0 652574109 C Bi:5:038:9 0 13 = 55534253 487eab80 00000000 00
ffff810026306cc0 652579106 S Bo:5:038:10 -115 31 = 55534243 487eab80 00000000 00000600 00000000 00000000 00000000 000000
ffff810026306cc0 652580114 C Bo:5:038:10 0 31 >
ffff810026306cc0 652581100 S Bi:5:038:9 -115 13 <
ffff810026306cc0 652582113 C Bi:5:038:9 0 13 = 55534253 487eab80 00000000 00
ffff810026306cc0 652585990 S Bo:5:038:10 -115 31 = 55534243 68fe8580 08000000 80000a25 00000000 00000000 00000000 000000
ffff810026306cc0 652586116 C Bo:5:038:10 0 31 >
ffff810026306cc0 652588505 S Bi:5:038:9 -115 8 <
ffff810026306cc0 652589111 C Bi:5:038:9 0 8 = 001e45ff 00000200
ffff810026306cc0 652590707 S Bi:5:038:9 -115 13 <
ffff810026306cc0 652591110 C Bi:5:038:9 0 13 = 55534253 68fe8580 00000000 00
ffff810026306cc0 652592826 S Bo:5:038:10 -115 31 = 55534243 2855aa80 08000000 80000a25 00000000 00000000 00000000 000000
ffff810026306cc0 652593112 C Bo:5:038:10 0 31 >
ffff810026306cc0 652594804 S Bi:5:038:9 -115 8 <
ffff810026306cc0 652595112 C Bi:5:038:9 0 8 = 001e45ff 00000200
ffff810026306cc0 652597066 S Bi:5:038:9 -115 13 <
ffff810026306cc0 652598110 C Bi:5:038:9 0 13 = 55534253 2855aa80 00000000 00
ffff810026306cc0 652601141 S Bo:5:038:10 -115 31 = 55534243 68fe8580 00020000 80000a28 00000000 00000001 00000000 000000
ffff810026306cc0 652602113 C Bo:5:038:10 0 31 >
ffff810026306cc0 652604244 S Bi:5:038:9 -115 512 <
ffff810026306cc0 652605115 C Bi:5:038:9 0 512 = 00000000 00000000 00000000 00000000 00000000 00000000 00000000 00000000
ffff810026306cc0 652605821 S Bi:5:038:9 -115 13 <
ffff810026306cc0 652606112 C Bi:5:038:9 0 13 = 55534253 68fe8580 00000000 00
ffff810026306cc0 652612075 S Bo:5:038:10 -115 31 = 55534243 2855aa80 08000000 80000a25 00000000 00000000 00000000 000000
ffff810026306cc0 652613114 C Bo:5:038:10 0 31 >
ffff810026306cc0 652614814 S Bi:5:038:9 -115 8 <
ffff810026306cc0 652615112 C Bi:5:038:9 0 8 = 001e45ff 00000200
ffff810026306cc0 652619088 S Bi:5:038:9 -115 13 <
ffff810026306cc0 652620114 C Bi:5:038:9 0 13 = 55534253 2855aa80 00000000 00
ffff810026306cc0 652621901 S Bo:5:038:10 -115 31 = 55534243 2855aa80 08000000 80000a25 00000000 00000000 00000000 000000
ffff810026306cc0 652622112 C Bo:5:038:10 0 31 >
ffff810026306cc0 652625979 S Bi:5:038:9 -115 8 <
ffff810026306cc0 652626115 C Bi:5:038:9 0 8 = 001e45ff 00000200
ffff810026306cc0 652629979 S Bi:5:038:9 -115 13 <
ffff810026306cc0 652630115 C Bi:5:038:9 0 13 = 55534253 2855aa80 00000000 00
ffff810026306cc0 652635175 S Bo:5:038:10 -115 31 = 55534243 68fe8580 00020000 80000a28 00000000 00000001 00000000 000000
ffff810026306cc0 652636116 C Bo:5:038:10 0 31 >
ffff810026306cc0 652637033 S Bi:5:038:9 -115 512 <
ffff810026306cc0 652638115 C Bi:5:038:9 0 512 = 00000000 00000000 00000000 00000000 00000000 00000000 00000000 00000000
ffff810026306cc0 652641280 S Bi:5:038:9 -115 13 <
ffff810026306cc0 652642117 C Bi:5:038:9 0 13 = 55534253 68fe8580 00000000 00
ffff810026306cc0 652645196 S Bo:5:038:10 -115 31 = 55534243 681dab80 00100000 80000a28 00000020 1b000008 00000000 000000
ffff810026306cc0 652646113 C Bo:5:038:10 0 31 >
ffff810026306cc0 652650137 S Bi:5:038:9 -115 4096 <
ffff810026306cc0 652656137 C Bi:5:038:9 0 4096 = ebff904d 53444f53 352e3000 02200100 02000200 00f8f200 3f002000 1b200000
ffff810026306cc0 652658089 S Bi:5:038:9 -115 13 <
ffff810026306cc0 652659116 C Bi:5:038:9 0 13 = 55534253 681dab80 00000000 00
ffff810026306cc0 652661040 S Bo:5:038:10 -115 31 = 55534243 28ceaa80 00100000 80000a28 00000020 23000008 00000000 000000
ffff810026306cc0 652662114 C Bo:5:038:10 0 31 >
ffff810026306cc0 652667159 S Bi:5:038:9 -115 4096 <
ffff810026306cc0 652673139 C Bi:5:038:9 0 4096 = 00000000 00000000 00000000 00000000 00000000 00000000 00000000 00000000
ffff810026306cc0 652674535 S Bi:5:038:9 -115 13 <
ffff810026306cc0 652675117 C Bi:5:038:9 0 13 = 55534253 28ceaa80 00000000 00
ffff810026306cc0 652678601 S Bo:5:038:10 -115 31 = 55534243 28aeab80 00100000 80000a28 00000020 2b000008 00000000 000000
ffff810026306cc0 652679117 C Bo:5:038:10 0 31 >
ffff810026306cc0 652680578 S Bi:5:038:9 -115 4096 <
ffff810026306cc0 652686139 C Bi:5:038:9 0 4096 = 00000000 00000000 00000000 00000000 00000000 00000000 00000000 00000000
ffff810026306cc0 652691242 S Bi:5:038:9 -115 13 <
ffff810026306cc0 652692119 C Bi:5:038:9 0 13 = 55534253 28aeab80 00000000 00
ffff810026306cc0 652692970 S Bo:5:038:10 -115 31 = 55534243 68a6ab80 00100000 80000a28 00000020 33000008 00000000 000000
ffff810026306cc0 652693118 C Bo:5:038:10 0 31 >
ffff810026306cc0 652698020 S Bi:5:038:9 -115 4096 <
ffff810026306cc0 652704138 C Bi:5:038:9 0 4096 = 00000000 00000000 00000000 00000000 00000000 00000000 00000000 00000000
ffff810026306cc0 652707260 S Bi:5:038:9 -115 13 <
ffff810026306cc0 652708120 C Bi:5:038:9 0 13 = 55534253 68a6ab80 00000000 00
ffff810026306cc0 652711184 S Bo:5:038:10 -115 31 = 55534243 2826aa80 00100000 80000a28 00000020 3b000008 00000000 000000
ffff810026306cc0 652712119 C Bo:5:038:10 0 31 >
ffff810026306cc0 652715053 S Bi:5:038:9 -115 4096 <
ffff810026306cc0 652721139 C Bi:5:038:9 0 4096 = 00000000 00000000 00000000 00000000 00000000 00000000 00000000 00000000
ffff810026306cc0 652723195 S Bi:5:038:9 -115 13 <
ffff810026306cc0 652724119 C Bi:5:038:9 0 13 = 55534253 2826aa80 00000000 00
ffff810026306cc0 652725896 S Bo:5:038:10 -115 31 = 55534243 e85970ff 00100000 80000a28 00000020 43000008 00000000 000000
ffff810026306cc0 652726120 C Bo:5:038:10 0 31 >
ffff810026306cc0 652731163 S Bi:5:038:9 -115 4096 <
ffff810026306cc0 652737141 C Bi:5:038:9 0 4096 = 00000000 00000000 00000000 00000000 00000000 00000000 00000000 00000000
ffff810026306cc0 652738011 S Bi:5:038:9 -115 13 <
ffff810026306cc0 652739118 C Bi:5:038:9 0 13 = 55534253 e85970ff 00000000 00
ffff810026306cc0 652741229 S Bo:5:038:10 -115 31 = 55534243 482a7cff 00100000 80000a28 00000020 4b000008 00000000 000000
ffff810026306cc0 652742119 C Bo:5:038:10 0 31 >
ffff810026306cc0 652743164 S Bi:5:038:9 -115 4096 <
ffff810026306cc0 652749139 C Bi:5:038:9 0 4096 = 00000000 00000000 00000000 00000000 00000000 00000000 00000000 00000000
ffff810026306cc0 652750027 S Bi:5:038:9 -115 13 <
ffff810026306cc0 652751121 C Bi:5:038:9 0 13 = 55534253 482a7cff 00000000 00
ffff810026306cc0 652754046 S Bo:5:038:10 -115 31 = 55534243 a88bab80 00100000 80000a28 00000020 53000008 00000000 000000
ffff810026306cc0 652755119 C Bo:5:038:10 0 31 >
ffff810026306cc0 652757981 S Bi:5:038:9 -115 4096 <
ffff810026306cc0 652764139 C Bi:5:038:9 0 4096 = 00000000 00000000 00000000 00000000 00000000 00000000 00000000 00000000
ffff810026306cc0 652766212 S Bi:5:038:9 -115 13 <
ffff810026306cc0 652767120 C Bi:5:038:9 0 13 = 55534253 a88bab80 00000000 00
ffff810026306cc0 652771019 S Bo:5:038:10 -115 31 = 55534243 a8abaa80 00100000 80000a28 00000020 5b000008 00000000 000000
ffff810026306cc0 652772121 C Bo:5:038:10 0 31 >
ffff810026306cc0 652773990 S Bi:5:038:9 -115 4096 <
ffff810026306cc0 652780142 C Bi:5:038:9 0 4096 = 00000000 00000000 00000000 00000000 00000000 00000000 00000000 00000000
ffff810026306cc0 652781286 S Bi:5:038:9 -115 13 <
ffff810026306cc0 652782122 C Bi:5:038:9 0 13 = 55534253 a8abaa80 00000000 00
ffff810026306cc0 652786055 S Bo:5:038:10 -115 31 = 55534243 08b5aa80 00100000 80000a28 00000020 63000008 00000000 000000
ffff810026306cc0 652787125 C Bo:5:038:10 0 31 >
ffff810026306cc0 652790014 S Bi:5:038:9 -115 4096 <
ffff810026306cc0 652796145 C Bi:5:038:9 0 4096 = 00000000 00000000 00000000 00000000 00000000 00000000 00000000 00000000
ffff810026306cc0 652798153 S Bi:5:038:9 -115 13 <
ffff810026306cc0 652799125 C Bi:5:038:9 0 13 = 55534253 08b5aa80 00000000 00
ffff810026306cc0 652802144 S Bo:5:038:10 -115 31 = 55534243 287e7bff 00100000 80000a28 00000020 6b000008 00000000 000000
ffff810026306cc0 652803126 C Bo:5:038:10 0 31 >
ffff810026306cc0 652806052 S Bi:5:038:9 -115 4096 <
ffff810026306cc0 652812145 C Bi:5:038:9 0 4096 = 00000000 00000000 00000000 00000000 00000000 00000000 00000000 00000000
ffff810026306cc0 652812853 S Bi:5:038:9 -115 13 <
ffff810026306cc0 652813124 C Bi:5:038:9 0 13 = 55534253 287e7bff 00000000 00
ffff810026306cc0 652816160 S Bo:5:038:10 -115 31 = 55534243 287eab80 00100000 80000a28 00000020 73000008 00000000 000000
ffff810026306cc0 652817123 C Bo:5:038:10 0 31 >
ffff810026306cc0 652819056 S Bi:5:038:9 -115 4096 <
ffff810026306cc0 652825141 C Bi:5:038:9 0 4096 = 00000000 00000000 00000000 00000000 00000000 00000000 00000000 00000000
ffff810026306cc0 652826017 S Bi:5:038:9 -115 13 <
ffff810026306cc0 652826124 C Bi:5:038:9 0 13 = 55534253 287eab80 00000000 00
ffff810026306cc0 652830165 S Bo:5:038:10 -115 31 = 55534243 c879ab80 00100000 80000a28 00000020 7b000008 00000000 000000
ffff810026306cc0 652831124 C Bo:5:038:10 0 31 >
ffff810026306cc0 652834028 S Bi:5:038:9 -115 4096 <
ffff810026306cc0 652840141 C Bi:5:038:9 0 4096 = 00000000 00000000 00000000 00000000 00000000 00000000 00000000 00000000
ffff810026306cc0 652841059 S Bi:5:038:9 -115 13 <
ffff810026306cc0 652842126 C Bi:5:038:9 0 13 = 55534253 c879ab80 00000000 00
ffff810026306cc0 652846126 S Bo:5:038:10 -115 31 = 55534243 681dab80 00100000 80000a28 00000020 83000008 00000000 000000
ffff810026306cc0 652847127 C Bo:5:038:10 0 31 >
ffff810026306cc0 652850016 S Bi:5:038:9 -115 4096 <
ffff810026306cc0 652856136 C Bi:5:038:9 0 4096 = 00000000 00000000 00000000 00000000 00000000 00000000 00000000 00000000
ffff810026306cc0 652858007 S Bi:5:038:9 -115 13 <
ffff810026306cc0 652858127 C Bi:5:038:9 0 13 = 55534253 681dab80 00000000 00
ffff810026306cc0 652860029 S Bo:5:038:10 -115 31 = 55534243 28ceaa80 00100000 80000a28 00000020 8b000008 00000000 000000
ffff810026306cc0 652861126 C Bo:5:038:10 0 31 >
ffff810026306cc0 652861908 S Bi:5:038:9 -115 4096 <
ffff810026306cc0 652868143 C Bi:5:038:9 0 4096 = 00000000 00000000 00000000 00000000 00000000 00000000 00000000 00000000
ffff810026306cc0 652870102 S Bi:5:038:9 -115 13 <
ffff810026306cc0 652871130 C Bi:5:038:9 0 13 = 55534253 28ceaa80 00000000 00
ffff810026306cc0 652874129 S Bo:5:038:10 -115 31 = 55534243 28aeab80 00100000 80000a28 00000020 93000008 00000000 000000
ffff810026306cc0 652875132 C Bo:5:038:10 0 31 >
ffff810026306cc0 652878074 S Bi:5:038:9 -115 4096 <
ffff810026306cc0 652884151 C Bi:5:038:9 0 4096 = 00000000 00000000 00000000 00000000 00000000 00000000 00000000 00000000
ffff810026306cc0 652885998 S Bi:5:038:9 -115 13 <
ffff810026306cc0 652886130 C Bi:5:038:9 0 13 = 55534253 28aeab80 00000000 00
ffff810026306cc0 652890146 S Bo:5:038:10 -115 31 = 55534243 68a6ab80 00100000 80000a28 00000020 9b000008 00000000 000000
ffff810026306cc0 652891134 C Bo:5:038:10 0 31 >
ffff810026306cc0 652894011 S Bi:5:038:9 -115 4096 <
ffff810026306cc0 652900150 C Bi:5:038:9 0 4096 = 00000000 00000000 00000000 00000000 00000000 00000000 00000000 00000000
ffff810026306cc0 652901053 S Bi:5:038:9 -115 13 <
ffff810026306cc0 652902132 C Bi:5:038:9 0 13 = 55534253 68a6ab80 00000000 00
ffff810026306cc0 652905622 S Bo:5:038:10 -115 31 = 55534243 2826aa80 00100000 80000a28 00000020 a3000008 00000000 000000
ffff810026306cc0 652906132 C Bo:5:038:10 0 31 >
ffff810026306cc0 652909856 S Bi:5:038:9 -115 4096 <
ffff810026306cc0 652916152 C Bi:5:038:9 0 4096 = 00000000 00000000 00000000 00000000 00000000 00000000 00000000 00000000
ffff810026306cc0 652917598 S Bi:5:038:9 -115 13 <
ffff810026306cc0 652918131 C Bi:5:038:9 0 13 = 55534253 2826aa80 00000000 00
ffff810026306cc0 652922156 S Bo:5:038:10 -115 31 = 55534243 e85970ff 00100000 80000a28 00000020 ab000008 00000000 000000
ffff810026306cc0 652923135 C Bo:5:038:10 0 31 >
ffff810026306cc0 652925848 S Bi:5:038:9 -115 4096 <
ffff810026306cc0 652932153 C Bi:5:038:9 0 4096 = 00000000 00000000 00000000 00000000 00000000 00000000 00000000 00000000
ffff810026306cc0 652933809 S Bi:5:038:9 -115 13 <
ffff810026306cc0 652934130 C Bi:5:038:9 0 13 = 55534253 e85970ff 00000000 00
ffff810026306cc0 652937878 S Bo:5:038:10 -115 31 = 55534243 482a7cff 00100000 80000a28 00000020 b3000008 00000000 000000
ffff810026306cc0 652938133 C Bo:5:038:10 0 31 >
ffff810026306cc0 652939877 S Bi:5:038:9 -115 4096 <
ffff810026306cc0 652946153 C Bi:5:038:9 0 4096 = 00000000 00000000 00000000 00000000 00000000 00000000 00000000 00000000
ffff810026306cc0 652949954 S Bi:5:038:9 -115 13 <
ffff810026306cc0 652950136 C Bi:5:038:9 0 13 = 55534253 482a7cff 00000000 00
ffff810026306cc0 652954031 S Bo:5:038:10 -115 31 = 55534243 a88bab80 00100000 80000a28 00000020 bb000008 00000000 000000
ffff810026306cc0 652955136 C Bo:5:038:10 0 31 >
ffff810026306cc0 652957956 S Bi:5:038:9 -115 4096 <
ffff810026306cc0 652964154 C Bi:5:038:9 0 4096 = 00000000 00000000 00000000 00000000 00000000 00000000 00000000 00000000
ffff810026306cc0 652966010 S Bi:5:038:9 -115 13 <
ffff810026306cc0 652966134 C Bi:5:038:9 0 13 = 55534253 a88bab80 00000000 00
ffff810026306cc0 652972241 S Bo:5:038:10 -115 31 = 55534243 a8abaa80 00100000 80000a28 00000020 c3000008 00000000 000000
ffff810026306cc0 652973138 C Bo:5:038:10 0 31 >
ffff810026306cc0 652974253 S Bi:5:038:9 -115 4096 <
ffff810026306cc0 652980154 C Bi:5:038:9 0 4096 = 00000000 00000000 00000000 00000000 00000000 00000000 00000000 00000000
ffff810026306cc0 652981175 S Bi:5:038:9 -115 13 <
ffff810026306cc0 652982136 C Bi:5:038:9 0 13 = 55534253 a8abaa80 00000000 00
ffff810026306cc0 652986029 S Bo:5:038:10 -115 31 = 55534243 08b5aa80 00100000 80000a28 00000020 cb000008 00000000 000000
ffff810026306cc0 652987139 C Bo:5:038:10 0 31 >
ffff810026306cc0 652990013 S Bi:5:038:9 -115 4096 <
ffff810026306cc0 652996156 C Bi:5:038:9 0 4096 = 00000000 00000000 00000000 00000000 00000000 00000000 00000000 00000000
ffff810026306cc0 652998048 S Bi:5:038:9 -115 13 <
ffff810026306cc0 652999136 C Bi:5:038:9 0 13 = 55534253 08b5aa80 00000000 00
ffff810026306cc0 653001407 S Bo:5:038:10 -115 31 = 55534243 287e7bff 00100000 80000a28 00000020 d3000008 00000000 000000
ffff810026306cc0 653002137 C Bo:5:038:10 0 31 >
ffff810026306cc0 653003290 S Bi:5:038:9 -115 4096 <
ffff810026306cc0 653009152 C Bi:5:038:9 0 4096 = 00000000 00000000 00000000 00000000 00000000 00000000 00000000 00000000
ffff810026306cc0 653010017 S Bi:5:038:9 -115 13 <
ffff810026306cc0 653010135 C Bi:5:038:9 0 13 = 55534253 287e7bff 00000000 00
ffff810026306cc0 653012041 S Bo:5:038:10 -115 31 = 55534243 287eab80 00100000 80000a28 00000020 db000008 00000000 000000
ffff810026306cc0 653013136 C Bo:5:038:10 0 31 >
ffff810026306cc0 653014057 S Bi:5:038:9 -115 4096 <
ffff810026306cc0 653020155 C Bi:5:038:9 0 4096 = 00000000 00000000 00000000 00000000 00000000 00000000 00000000 00000000
ffff810026306cc0 653021292 S Bi:5:038:9 -115 13 <
ffff810026306cc0 653022138 C Bi:5:038:9 0 13 = 55534253 287eab80 00000000 00
ffff810026306cc0 653026131 S Bo:5:038:10 -115 31 = 55534243 c879ab80 00100000 80000a28 00000020 e3000008 00000000 000000
ffff810026306cc0 653027141 C Bo:5:038:10 0 31 >
ffff810026306cc0 653030005 S Bi:5:038:9 -115 4096 <
ffff810026306cc0 653036158 C Bi:5:038:9 0 4096 = 00000000 00000000 00000000 00000000 00000000 00000000 00000000 00000000
ffff810026306cc0 653037929 S Bi:5:038:9 -115 13 <
ffff810026306cc0 653038138 C Bi:5:038:9 0 13 = 55534253 c879ab80 00000000 00
ffff810026306cc0 653042162 S Bo:5:038:10 -115 31 = 55534243 681dab80 00100000 80000a28 00000020 eb000008 00000000 000000
ffff810026306cc0 653043139 C Bo:5:038:10 0 31 >
ffff810026306cc0 653046001 S Bi:5:038:9 -115 4096 <
ffff810026306cc0 653052161 C Bi:5:038:9 0 4096 = 00000000 00000000 00000000 00000000 00000000 00000000 00000000 00000000
ffff810026306cc0 653054013 S Bi:5:038:9 -115 13 <
ffff810026306cc0 653054138 C Bi:5:038:9 0 13 = 55534253 681dab80 00000000 00
ffff810026306cc0 653058167 S Bo:5:038:10 -115 31 = 55534243 28ceaa80 00100000 80000a28 00000020 f3000008 00000000 000000
ffff810026306cc0 653059141 C Bo:5:038:10 0 31 >
ffff810026306cc0 653061044 S Bi:5:038:9 -115 4096 <
ffff810026306cc0 653067158 C Bi:5:038:9 0 4096 = 00000000 00000000 00000000 00000000 00000000 00000000 00000000 00000000
ffff810026306cc0 653070214 S Bi:5:038:9 -115 13 <
ffff810026306cc0 653071143 C Bi:5:038:9 0 13 = 55534253 28ceaa80 00000000 00
ffff810026306cc0 653074086 S Bo:5:038:10 -115 31 = 55534243 28aeab80 00100000 80000a28 00000020 fb000008 00000000 000000
ffff810026306cc0 653075142 C Bo:5:038:10 0 31 >
ffff810026306cc0 653078061 S Bi:5:038:9 -115 4096 <
ffff810026306cc0 653084161 C Bi:5:038:9 0 4096 = 00000000 00000000 00000000 00000000 00000000 00000000 00000000 00000000
ffff810026306cc0 653085999 S Bi:5:038:9 -115 13 <
ffff810026306cc0 653086141 C Bi:5:038:9 0 13 = 55534253 28aeab80 00000000 00
ffff810026306cc0 653090105 S Bo:5:038:10 -115 31 = 55534243 68a6ab80 00100000 80000a28 00000021 03000008 00000000 000000
ffff810026306cc0 653091143 C Bo:5:038:10 0 31 >
ffff810026306cc0 653094021 S Bi:5:038:9 -115 4096 <
ffff810026306cc0 653100161 C Bi:5:038:9 0 4096 = 00000000 00000000 00000000 00000000 00000000 00000000 00000000 00000000
ffff810026306cc0 653100987 S Bi:5:038:9 -115 13 <
ffff810026306cc0 653101071 C Bi:5:038:9 0 13 = 55534253 68a6ab80 00000000 00
ffff810026306cc0 653106080 S Bo:5:038:10 -115 31 = 55534243 2826aa80 00100000 80000a28 00000021 0b000008 00000000 000000
ffff810026306cc0 653107144 C Bo:5:038:10 0 31 >
ffff810026306cc0 653110057 S Bi:5:038:9 -115 4096 <
ffff810026306cc0 653116160 C Bi:5:038:9 0 4096 = 00000000 00000000 00000000 00000000 00000000 00000000 00000000 00000000
ffff810026306cc0 653117966 S Bi:5:038:9 -115 13 <
ffff810026306cc0 653118142 C Bi:5:038:9 0 13 = 55534253 2826aa80 00000000 00
ffff810026306cc0 653128000 S Bo:5:038:10 -115 31 = 55534243 482a7cff 00100000 80000a28 00000022 00000008 00000000 000000
ffff810026306cc0 653128146 C Bo:5:038:10 0 31 >
ffff810026306cc0 653129969 S Bi:5:038:9 -115 4096 <
ffff810026306cc0 653136163 C Bi:5:038:9 0 4096 = 424c4143 4b424552 52592008 0011b954 8f3a8f3a 0000b954 8f3a0000 00000000
ffff810026306cc0 653137792 S Bi:5:038:9 -115 13 <
ffff810026306cc0 653138145 C Bi:5:038:9 0 13 = 55534253 482a7cff 00000000 00
ffff810026306cc0 653141314 S Bo:5:038:10 -115 31 = 55534243 68fe8580 c0000000 8000061a 003f00c0 00000000 00000000 000000
ffff810026306cc0 653142145 C Bo:5:038:10 0 31 >
ffff810026306cc0 653145401 S Bi:5:038:9 -115 192 <
ffff810026306cc0 653146147 C Bi:5:038:9 0 68 = 43000053 010a0003 00000000 03000000 051e0080 103f0200 3fff0000 00000000
ffff810026306cc0 653149847 S Bi:5:038:9 -115 13 <
ffff810026306cc0 653150145 C Bi:5:038:9 -32 0
ffff810026306cc0 653154082 S Co:5:038:0 s 02 01 0000 0089 0000 0
ffff810026306cc0 653155145 C Co:5:038:0 0 0
ffff810026306cc0 653156024 S Bi:5:038:9 -115 13 <
ffff810026306cc0 653156145 C Bi:5:038:9 0 13 = 55534253 68fe8580 7c000000 00
ffff810026306cc0 653159151 S Bo:5:038:10 -115 31 = 55534243 28b5aa80 00000000 00000600 00000000 00000000 00000000 000000
ffff810026306cc0 653160144 C Bo:5:038:10 0 31 >
ffff810026306cc0 653161956 S Bi:5:038:9 -115 13 <
ffff810026306cc0 653162144 C Bi:5:038:9 0 13 = 55534253 28b5aa80 00000000 00
ffff810026306cc0 653164139 S Bo:5:038:10 -115 31 = 55534243 487e7bff 00000000 00000600 00000000 00000000 00000000 000000
ffff810026306cc0 653165145 C Bo:5:038:10 0 31 >
ffff810026306cc0 653167017 S Bi:5:038:9 -115 13 <
ffff810026306cc0 653167144 C Bi:5:038:9 0 13 = 55534253 487e7bff 00000000 00
ffff810026306cc0 653217878 S Bo:5:038:10 -115 31 = 55534243 487eab80 00000000 00000600 00000000 00000000 00000000 000000
ffff810026306cc0 653219151 C Bo:5:038:10 0 31 >
ffff810026306cc0 653220197 S Bi:5:038:9 -115 13 <
ffff810026306cc0 653221147 C Bi:5:038:9 0 13 = 55534253 487eab80 00000000 00
ffff810026306cc0 653225732 S Bo:5:038:10 -115 31 = 55534243 e879ab80 00000000 00000600 00000000 00000000 00000000 000000
ffff810026306cc0 653226146 C Bo:5:038:10 0 31 >
ffff810026306cc0 653229670 S Bi:5:038:9 -115 13 <
ffff810026306cc0 653230146 C Bi:5:038:9 0 13 = 55534253 e879ab80 00000000 00
ffff810026306cc0 653231825 S Bo:5:038:10 -115 31 = 55534243 0857ab80 00000000 00000600 00000000 00000000 00000000 000000
ffff810026306cc0 653232146 C Bo:5:038:10 0 31 >
ffff810026306cc0 653233571 S Bi:5:038:9 -115 13 <
ffff810026306cc0 653234146 C Bi:5:038:9 0 13 = 55534253 0857ab80 00000000 00
ffff810026306cc0 653237816 S Bo:5:038:10 -115 31 = 55534243 0857ab80 0c000000 8000061a 0000000c 00000000 00000000 000000
ffff810026306cc0 653238147 C Bo:5:038:10 0 31 >
ffff810026306cc0 653240751 S Bi:5:038:9 -115 12 <
ffff810026306cc0 653241147 C Bi:5:038:9 -32 0
ffff810026306cc0 653242275 S Co:5:038:0 s 02 01 0000 0089 0000 0
ffff810026306cc0 653243148 C Co:5:038:0 0 0
ffff810026306cc0 653244296 S Bi:5:038:9 -115 13 <
ffff810026306cc0 653245148 C Bi:5:038:9 0 13 = 55534253 0857ab80 0c000000 01
ffff810026306cc0 653246185 S Bo:5:038:10 -115 31 = 55534243 0857ab80 12000000 80000c03 00000012 00000000 00000000 000000
ffff810026306cc0 653247147 C Bo:5:038:10 0 31 >
ffff810026306cc0 653249824 S Bi:5:038:9 -115 18 <
ffff810026306cc0 653250150 C Bi:5:038:9 0 18 = 70000500 0000000a 00000000 24000000 0000
ffff810026306cc0 653253309 S Bi:5:038:9 -115 13 <
ffff810026306cc0 653254148 C Bi:5:038:9 0 13 = 55534253 0857ab80 00000000 00
ffff810026306240 653456404 S Bo:5:038:10 -115 31 = 55534243 e8297fff 00000000 00000600 00000000 00000000 00000000 000000
ffff810026306240 653458163 C Bo:5:038:10 0 31 >
ffff810026306240 653459455 S Bi:5:038:9 -115 13 <
ffff810026306240 653460160 C Bi:5:038:9 0 13 = 55534253 e8297fff 00000000 00
ffff810026306240 653474293 S Bo:5:038:10 -115 31 = 55534243 0857ab80 0c000000 8000061a 0000000c 00000000 00000000 000000
ffff810026306240 653476163 C Bo:5:038:10 0 31 >
ffff810110afb540 653478319 S Bi:5:038:9 -115 12 <
ffff810110afb540 653479192 C Bi:5:038:9 -32 0
ffff810110afb540 653480414 S Co:5:038:0 s 02 01 0000 0089 0000 0
ffff810110afb540 653481161 C Co:5:038:0 0 0
ffff810110afb540 653485915 S Bi:5:038:9 -115 13 <
ffff810110afb540 653486172 C Bi:5:038:9 0 13 = 55534253 0857ab80 0c000000 01
ffff810110afb540 653487792 S Bo:5:038:10 -115 31 = 55534243 0857ab80 12000000 80000c03 00000012 00000000 00000000 000000
ffff810110afb540 653488171 C Bo:5:038:10 0 31 >
ffff810110afb540 653490535 S Bi:5:038:9 -115 18 <
ffff810110afb540 653491199 C Bi:5:038:9 0 18 = 70000500 0000000a 00000000 24000000 0000
ffff810110afb540 653492859 S Bi:5:038:9 -115 13 <
ffff810110afb540 653493162 C Bi:5:038:9 0 13 = 55534253 0857ab80 00000000 00
ffff810058cd1600 876754126 S Co:5:001:0 s 23 03 0004 0001 0000 0
ffff810058cd1600 876754133 C Co:5:001:0 0 0
ffff81012cc3b6c0 876757764 C Bi:5:038:7 -84 0
ffff8100263060c0 876757787 C Bi:5:038:3 -84 0
ffff810026306780 876757806 C Bi:5:038:5 -84 0
ffff810210f159c0 876797143 C Ii:5:001:1 0:128 1 = 02
ffff810210f159c0 876797152 S Ii:5:001:1 -115:128 2 <
ffff810058cd1840 876808992 S Ci:5:001:0 s a3 00 0000 0001 0004 4 <
ffff810058cd1840 876809014 C Ci:5:001:0 0 4 = 03010000
ffff810058cd1840 876864953 S Co:5:001:0 s 23 01 0014 0001 0000 0
ffff810058cd1840 876864958 C Co:5:001:0 0 0
ffff810058cd1840 876864975 S Ci:5:000:0 s 80 06 0100 0000 0040 64 <
ffff810058cd1840 876868750 C Ci:5:000:0 0 16 = 12011001 00000010 ca0f0400 07010105
ffff810058cd1840 876868761 S Co:5:001:0 s 23 03 0004 0001 0000 0
ffff810058cd1840 876868765 C Co:5:001:0 0 0
ffff810058cd1840 876920956 S Ci:5:001:0 s a3 00 0000 0001 0004 4 <
ffff810058cd1840 876920979 C Ci:5:001:0 0 4 = 03010000
ffff810058cd1840 876976954 S Co:5:001:0 s 23 01 0014 0001 0000 0
ffff810058cd1840 876976958 C Co:5:001:0 0 0
ffff810058cd1840 876976963 S Co:5:000:0 s 00 05 0026 0000 0000 0
ffff810058cd1840 876979754 C Co:5:000:0 0 0
ffff810058cd1840 876996957 S Ci:5:038:0 s 80 06 0100 0000 0012 18 <
ffff810058cd1840 877001756 C Ci:5:038:0 0 18 = 12011001 00000010 ca0f0400 07010105 0301
ffff810058cd1840 877001767 S Ci:5:038:0 s 80 06 0200 0000 0061 97 <
ffff810058cd1840 877011756 C Ci:5:038:0 0 97 = 09026100 02010080 fa090400 0008ff01 ff020705 81024000 00070502 02400000
ffff810058cd1840 877011764 S Co:5:038:0 s 00 09 0001 0000 0000 0
ffff810058cd1840 877014755 C Co:5:038:0 0 0
ffff810058cd1840 877014785 S Co:5:038:0 s 01 0b 0000 0000 0000 0
ffff810058cd1840 877016754 C Co:5:038:0 0 0
ffff810058cd1840 877016768 S Co:5:038:0 s 01 0b 0000 0001 0000 0
ffff810058cd1840 877017754 C Co:5:038:0 0 0
ffff810058cd1840 877017987 S Co:5:038:0 s 01 0b 0000 0000 0000 0
ffff810058cd1840 877018754 C Co:5:038:0 0 0
ffff810058cd1840 877018783 S Co:5:038:0 s 01 0b 0000 0001 0000 0
ffff810058cd1840 877019754 C Co:5:038:0 0 0
