ffff8100797183c0 2835935935 S Ci:004:00 s 80 06 0300 0000 00ff 255 <
ffff8100797183c0 2835937965 C Ci:004:00 0 4 = 04030904
ffff8100797183c0 2835937986 S Ci:004:00 s 80 06 0301 0409 00ff 255 <
ffff8100797183c0 2835939962 C Ci:004:00 0 40 = 28035200 65007300 65006100 72006300 68002000 49006e00 20004d00 6f007400
ffff8100797183c0 2835939998 S Ci:004:00 s 80 06 0300 0000 00ff 255 <
ffff8100797183c0 2835941962 C Ci:004:00 0 4 = 04030904
ffff8100797183c0 2835941975 S Ci:004:00 s 80 06 0305 0409 00ff 255 <
ffff8100797183c0 2835943964 C Ci:004:00 0 42 = 2a035200 49004d00 20004300 6f006d00 70006f00 73006900 74006500 20004400
ffff8100797183c0 2835944214 S Bo:004:02 -115 16 = 00001000 01ff0000 a818da8d 6c020000
ffff8100797183c0 2835944963 C Bo:004:02 0 16 >
ffff8100797183c0 2835944992 S Bi:004:01 -115 16384 <
ffff8100797183c0 2836953085 C Bi:004:01 -2 0
ffff810137f43f00 2836953326 S Bo:004:04 -115 16 = 00001000 01ff0000 a818da8d 6c020000
ffff810137f43f00 2836955018 C Bo:004:04 0 16 >
ffff810137f43f00 2836955079 S Bi:004:03 -115 16384 <
ffff810137f43f00 2836956080 C Bi:004:03 0 16 = 00001000 02ff0000 a818da8d 6c020000
ffff810137f43f00 2836956270 S Bo:004:06 -115 16 = 00001000 01ff0000 a818da8d 6c020000
ffff810137f43f00 2836957019 C Bo:004:06 0 16 >
ffff810137f43f00 2836957060 S Bi:004:05 -115 16384 <
ffff810137f43f00 2837961146 C Bi:004:05 -2 0
ffff810079718840 2837961378 S Bo:004:08 -115 16 = 00001000 01ff0000 a818da8d 6c020000
ffff810079718840 2837963074 C Bo:004:08 0 16 >
ffff810079718840 2837963102 S Bi:004:07 -115 16384 <
ffff810079718840 2838969198 C Bi:004:07 -2 0
ffff810137f43180 2838969376 S Co:004:00 s 01 0b 0000 0000 0000 0
ffff810137f43180 2838971131 C Co:004:00 0 0
ffff810137f43600 2838971524 S Co:004:00 s 02 01 0000 0085 0000 0
ffff810137f43600 2838972132 C Co:004:00 0 0
ffff810137f43600 2838972160 S Co:004:00 s 02 01 0000 0006 0000 0
ffff810137f43600 2838973130 C Co:004:00 0 0
ffff810137f43600 2838973244 S Bo:004:06 -115 12 = 01000000 00000000 78563412
ffff810137f43600 2838974130 C Bo:004:06 0 12 >
ffff810137f43600 2838974174 S Bi:004:05 -115 16384 <
ffff810137f43600 2839156207 C Bi:004:05 -2 0
ffff810137f43600 2839156406 S Bo:004:06 -115 12 = 01000000 01000000 78563412
ffff810137f43600 2839157141 C Bo:004:06 0 12 >
ffff810137f43600 2839157192 S Bi:004:05 -115 16384 <
ffff810137f43600 2839158201 C Bi:004:05 0 28 = 04000000 00000000 00000000 00000000 01000000 1c000000 78563412
ffff810137f43600 2839158415 S Bo:004:06 -115 28 = 00000000 00000000 03000000 00c20100 00000000 00000000 78563412
ffff810137f43600 2839159141 C Bo:004:06 0 28 >
ffff810137f43600 2839159181 S Bi:004:05 -115 16384 <
ffff810137f43600 2839160201 C Bi:004:05 0 24 = 00000000 23000000 23000000 00c20100 18000000 78563412
ffff810137f43600 2839160395 S Bo:004:06 -115 24 = 00001800 07ff000c 52494d20 42797061 73730000 00000000
ffff810137f43600 2839161141 C Bo:004:06 0 24 >
ffff810137f43600 2839161181 S Bi:004:05 -115 16384 <
ffff810137f43600 2839348220 C Bi:004:05 -2 0
ffff810137f43600 2839348696 S Bi:004:05 -115 16384 <
ffff810137f43600 2839530231 C Bi:004:05 -2 0
ffff810137f43600 2839530370 S Bi:004:05 -115 16384 <
ffff810137f43600 2839712240 C Bi:004:05 -2 0
ffff810079718a80 2839712369 S Bi:004:05 -115 16384 <
ffff810079718a80 2839896258 C Bi:004:05 -2 0
ffff81019bfb50c0 2839896443 S Bi:004:05 -115 16384 <
ffff81019bfb50c0 2840080260 C Bi:004:05 -2 0
ffff81019bfb50c0 2840080382 S Bi:004:05 -115 16384 <
ffff81019bfb50c0 2840264271 C Bi:004:05 -2 0
ffff81019bfb50c0 2840264508 S Bi:004:05 -115 16384 <
ffff81019bfb50c0 2840448282 C Bi:004:05 -2 0
ffff8101086df900 2840448411 S Bi:004:05 -115 16384 <
ffff8101086df900 2840632295 C Bi:004:05 -2 0
ffff8101086df900 2840632416 S Bi:004:05 -115 16384 <
ffff8101086df900 2840816304 C Bi:004:05 -2 0
ffff8101086df900 2840816429 S Bi:004:05 -115 16384 <
ffff8101ef3f23c0 2840876180 S Bo:004:06 -115 1 = 41
ffff8101ef3f23c0 2840877245 C Bo:004:06 0 1 >
ffff8101ef3f23c0 2840885023 S Bo:004:06 -115 1 = 54
ffff8101ef3f23c0 2840885239 C Bo:004:06 0 1 >
ffff8101ef3f23c0 2840894995 S Bo:004:06 -115 1 = 5a
ffff8101ef3f23c0 2840895241 C Bo:004:06 0 1 >
ffff8101ef3f23c0 2840905474 S Bo:004:06 -115 1 = 0d
ffff8101086df900 2840906306 C Bi:004:05 0 6 = 0d0a4f4b 0d0a
ffff8101ef3f23c0 2840906316 C Bo:004:06 0 1 >
ffff8101ef3f23c0 2840907870 S Bi:004:05 -115 16384 <
ffff810206980b40 2840918854 S Bo:004:06 -115 1 = 41
ffff8101ef3f23c0 2840919316 C Bi:004:05 0 1 = 41
ffff810206980b40 2840919325 C Bo:004:06 0 1 >
ffff8101faf64780 2840919721 S Bi:004:05 -115 16384 <
ffff8101faee59c0 2840928170 S Bo:004:06 -115 1 = 54
ffff8101faf64780 2840929310 C Bi:004:05 0 1 = 54
ffff8101faee59c0 2840929322 C Bo:004:06 0 1 >
ffff8101faee59c0 2840931751 S Bi:004:05 -115 16384 <
ffff8101f468dd80 2840938203 S Bo:004:06 -115 1 = 2b
ffff8101faee59c0 2840939313 C Bi:004:05 0 1 = 2b
ffff8101f468dd80 2840939321 C Bo:004:06 0 1 >
ffff8101f468dd80 2840939685 S Bi:004:05 -115 16384 <
ffff8101f468d540 2840948247 S Bo:004:06 -115 1 = 43
ffff8101f468dd80 2840949312 C Bi:004:05 0 1 = 43
ffff8101f468d540 2840949321 C Bo:004:06 0 1 >
ffff8101f468d540 2840951681 S Bi:004:05 -115 16384 <
ffff8101f468dd80 2840958176 S Bo:004:06 -115 1 = 47
ffff8101f468d540 2840959303 C Bi:004:05 0 1 = 47
ffff8101f468dd80 2840959309 C Bo:004:06 0 1 >
ffff8101f468d540 2840960021 S Bi:004:05 -115 16384 <
ffff810089b19900 2840968204 S Bo:004:06 -115 1 = 44
ffff8101f468d540 2840969313 C Bi:004:05 0 1 = 44
ffff810089b19900 2840969319 C Bo:004:06 0 1 >
ffff8101f468d600 2840971754 S Bi:004:05 -115 16384 <
ffff810089b19900 2840978211 S Bo:004:06 -115 1 = 43
ffff8101f468d600 2840979305 C Bi:004:05 0 1 = 43
ffff810089b19900 2840979310 C Bo:004:06 0 1 >
ffff8101f468dd80 2840979807 S Bi:004:05 -115 16384 <
ffff810089b19900 2840989547 S Bo:004:06 -115 1 = 4f
ffff8101f468dd80 2840990321 C Bi:004:05 0 1 = 4f
ffff810089b19900 2840990328 C Bo:004:06 0 1 >
ffff8101f468d840 2840991782 S Bi:004:05 -115 16384 <
ffff810089b19900 2841003295 S Bo:004:06 -115 1 = 4e
ffff8101f468d840 2841004321 C Bi:004:05 0 1 = 4e
ffff810089b19900 2841004326 C Bo:004:06 0 1 >
ffff8101f468d840 2841007749 S Bi:004:05 -115 16384 <
ffff810089b19900 2841013238 S Bo:004:06 -115 1 = 54
ffff8101f468d840 2841014311 C Bi:004:05 0 1 = 54
ffff810089b19900 2841014315 C Bo:004:06 0 1 >
ffff8101f468d000 2841015693 S Bi:004:05 -115 16384 <
ffff810089b19900 2841023296 S Bo:004:06 -115 1 = 3d
ffff8101f468d000 2841024317 C Bi:004:05 0 1 = 3d
ffff810089b19900 2841024323 C Bo:004:06 0 1 >
ffff8101f468dd80 2841027903 S Bi:004:05 -115 16384 <
ffff810089b19900 2841033337 S Bo:004:06 -115 1 = 31
ffff8101f468dd80 2841034314 C Bi:004:05 0 1 = 31
ffff810089b19900 2841034321 C Bo:004:06 0 1 >
ffff8101f468d6c0 2841035693 S Bi:004:05 -115 16384 <
ffff8101853ca3c0 2841043373 S Bo:004:06 -115 1 = 2c
ffff8101f468d6c0 2841044314 C Bi:004:05 0 1 = 2c
ffff8101853ca3c0 2841044320 C Bo:004:06 0 1 >
ffff8101f468d6c0 2841047718 S Bi:004:05 -115 16384 <
ffff8101853ca300 2841053336 S Bo:004:06 -115 1 = 22
ffff8101f468d6c0 2841054317 C Bi:004:05 0 1 = 22
ffff8101853ca300 2841054326 C Bo:004:06 0 1 >
ffff8101f468d600 2841055644 S Bi:004:05 -115 16384 <
ffff8101853ca300 2841063412 S Bo:004:06 -115 1 = 49
ffff8101f468d600 2841064316 C Bi:004:05 0 1 = 49
ffff8101853ca300 2841064323 C Bo:004:06 0 1 >
ffff8101f468d540 2841067741 S Bi:004:05 -115 16384 <
ffff8101853ca300 2841073431 S Bo:004:06 -115 1 = 50
ffff8101f468d540 2841074318 C Bi:004:05 0 1 = 50
ffff8101853ca300 2841074325 C Bo:004:06 0 1 >
ffff8101f468d540 2841075716 S Bi:004:05 -115 16384 <
ffff8101853ca300 2841083402 S Bo:004:06 -115 1 = 22
ffff8101f468d540 2841084316 C Bi:004:05 0 1 = 22
ffff8101853ca300 2841084321 C Bo:004:06 0 1 >
ffff8101f468d540 2841085115 S Bi:004:05 -115 16384 <
ffff8101853ca240 2841093400 S Bo:004:06 -115 1 = 2c
ffff8101f468d540 2841094319 C Bi:004:05 0 1 = 2c
ffff8101853ca240 2841094324 C Bo:004:06 0 1 >
ffff8101f468d600 2841095743 S Bi:004:05 -115 16384 <
ffff8101853ca240 2841103504 S Bo:004:06 -115 1 = 22
ffff8101f468d600 2841104315 C Bi:004:05 0 1 = 22
ffff8101853ca240 2841104319 C Bo:004:06 0 1 >
ffff8101f468d600 2841107694 S Bi:004:05 -115 16384 <
ffff8101853ca180 2841113526 S Bo:004:06 -115 1 = 77
ffff8101f468d600 2841114318 C Bi:004:05 0 1 = 77
ffff8101853ca180 2841114323 C Bo:004:06 0 1 >
ffff8101f468d6c0 2841115881 S Bi:004:05 -115 16384 <
ffff8101853ca180 2841123545 S Bo:004:06 -115 1 = 61
ffff8101f468d6c0 2841124318 C Bi:004:05 0 1 = 61
ffff8101853ca180 2841124322 C Bo:004:06 0 1 >
ffff8101f468d6c0 2841127864 S Bi:004:05 -115 16384 <
ffff8101853ca180 2841133574 S Bo:004:06 -115 1 = 70
ffff8101f468d6c0 2841134404 C Bi:004:05 0 1 = 70
ffff8101853ca180 2841134411 C Bo:004:06 0 1 >
ffff8101f468dd80 2841135663 S Bi:004:05 -115 16384 <
ffff8101853ca180 2841143573 S Bo:004:06 -115 1 = 2e
ffff8101f468dd80 2841144315 C Bi:004:05 0 1 = 2e
ffff8101853ca180 2841144320 C Bo:004:06 0 1 >
ffff8101f468d000 2841145234 S Bi:004:05 -115 16384 <
ffff8101853ca180 2841153595 S Bo:004:06 -115 1 = 76
ffff8101f468d000 2841154318 C Bi:004:05 0 1 = 76
ffff8101853ca180 2841154323 C Bo:004:06 0 1 >
ffff8101f468d840 2841155789 S Bi:004:05 -115 16384 <
ffff8101853ca180 2841163580 S Bo:004:06 -115 1 = 6f
ffff8101f468d840 2841164317 C Bi:004:05 0 1 = 6f
ffff8101853ca180 2841164323 C Bo:004:06 0 1 >
ffff8101f468d840 2841167702 S Bi:004:05 -115 16384 <
ffff8101853ca180 2841173618 S Bo:004:06 -115 1 = 69
ffff8101f468d840 2841174369 C Bi:004:05 0 1 = 69
ffff8101853ca180 2841174375 C Bo:004:06 0 1 >
ffff8101f468d000 2841175855 S Bi:004:05 -115 16384 <
ffff8101853ca180 2841183651 S Bo:004:06 -115 1 = 63
ffff8101f468d000 2841184325 C Bi:004:05 0 1 = 63
ffff8101853ca180 2841184331 C Bo:004:06 0 1 >
ffff8101f468dd80 2841187767 S Bi:004:05 -115 16384 <
ffff8101853ca180 2841193629 S Bo:004:06 -115 1 = 65
ffff8101f468dd80 2841194339 C Bi:004:05 0 1 = 65
ffff8101853ca180 2841194344 C Bo:004:06 0 1 >
ffff8101f468d6c0 2841195659 S Bi:004:05 -115 16384 <
ffff8101853ca180 2841203652 S Bo:004:06 -115 1 = 73
ffff8101f468d6c0 2841204318 C Bi:004:05 0 1 = 73
ffff8101853ca180 2841204322 C Bo:004:06 0 1 >
ffff8101f468d600 2841205244 S Bi:004:05 -115 16384 <
ffff8101853ca180 2841213675 S Bo:004:06 -115 1 = 74
ffff8101f468d600 2841214319 C Bi:004:05 0 1 = 74
ffff8101853ca180 2841214324 C Bo:004:06 0 1 >
ffff8101f468d540 2841215771 S Bi:004:05 -115 16384 <
ffff8101853ca180 2841223702 S Bo:004:06 -115 1 = 72
ffff8101f468d540 2841224319 C Bi:004:05 0 1 = 72
ffff8101853ca180 2841224323 C Bo:004:06 0 1 >
ffff8101f468d540 2841227688 S Bi:004:05 -115 16384 <
ffff8101853ca180 2841233697 S Bo:004:06 -115 1 = 65
ffff8101f468d540 2841234321 C Bi:004:05 0 1 = 65
ffff8101853ca180 2841234326 C Bo:004:06 0 1 >
ffff8101f468d600 2841235979 S Bi:004:05 -115 16384 <
ffff8101853ca180 2841243705 S Bo:004:06 -115 1 = 61
ffff8101f468d600 2841244321 C Bi:004:05 0 1 = 61
ffff8101853ca180 2841244326 C Bo:004:06 0 1 >
ffff8101f468d6c0 2841247780 S Bi:004:05 -115 16384 <
ffff8101853ca180 2841253719 S Bo:004:06 -115 1 = 6d
ffff8101f468d6c0 2841254320 C Bi:004:05 0 1 = 6d
ffff8101853ca180 2841254325 C Bo:004:06 0 1 >
ffff8101f468dd80 2841255664 S Bi:004:05 -115 16384 <
ffff8101853ca180 2841263762 S Bo:004:06 -115 1 = 2e
ffff8101f468dd80 2841264323 C Bi:004:05 0 1 = 2e
ffff8101853ca180 2841264328 C Bo:004:06 0 1 >
ffff8101f468d000 2841265282 S Bi:004:05 -115 16384 <
ffff8101853ca180 2841273773 S Bo:004:06 -115 1 = 63
ffff8101f468d000 2841274325 C Bi:004:05 0 1 = 63
ffff8101853ca180 2841274330 C Bo:004:06 0 1 >
ffff8101f468d840 2841275768 S Bi:004:05 -115 16384 <
ffff8101853ca180 2841283788 S Bo:004:06 -115 1 = 6f
ffff8101f468d840 2841284326 C Bi:004:05 0 1 = 6f
ffff8101853ca180 2841284333 C Bo:004:06 0 1 >
ffff8101f468d840 2841287880 S Bi:004:05 -115 16384 <
ffff8101853ca240 2841293823 S Bo:004:06 -115 1 = 6d
ffff8101f468d840 2841294330 C Bi:004:05 0 1 = 6d
ffff8101853ca240 2841294338 C Bo:004:06 0 1 >
ffff8101f468d840 2841295723 S Bi:004:05 -115 16384 <
ffff8101853ca240 2841303878 S Bo:004:06 -115 1 = 22
ffff8101853ca240 2841304262 C Bo:004:06 0 1 >
ffff8101f468d840 2841305328 C Bi:004:05 0 1 = 22
ffff8101f468d840 2841307722 S Bi:004:05 -115 16384 <
ffff8101853ca240 2841314119 S Bo:004:06 -115 1 = 0d
ffff8101853ca240 2841314263 C Bo:004:06 0 1 >
ffff8101f468d840 2841315327 C Bi:004:05 0 2 = 0d0a
ffff8101f468d840 2841315762 S Bi:004:05 -115 16384 <
ffff8101f468d840 2841316327 C Bi:004:05 0 6 = 0d0a4f4b 0d0a
ffff8101f468d840 2841316433 S Bi:004:05 -115 16384 <
ffff8101853ca240 2841326677 S Bo:004:06 -115 1 = 41
ffff8101f468d840 2841327335 C Bi:004:05 0 1 = 41
ffff8101853ca240 2841327340 C Bo:004:06 0 1 >
ffff8101f468d000 2841327824 S Bi:004:05 -115 16384 <
ffff8101853ca240 2841336657 S Bo:004:06 -115 1 = 54
ffff8101f468d000 2841337325 C Bi:004:05 0 1 = 54
ffff8101853ca240 2841337330 C Bo:004:06 0 1 >
ffff8102139b8f00 2841341000 S Bi:004:05 -115 16384 <
ffff8101853ca240 2841346674 S Bo:004:06 -115 1 = 44
ffff8102139b8f00 2841347325 C Bi:004:05 0 1 = 44
ffff8101853ca240 2841347331 C Bo:004:06 0 1 >
ffff8102139b8f00 2841347714 S Bi:004:05 -115 16384 <
ffff8101853ca240 2841356683 S Bo:004:06 -115 1 = 2a
ffff8102139b8f00 2841357333 C Bi:004:05 0 1 = 2a
ffff8101853ca240 2841357338 C Bo:004:06 0 1 >
ffff8102139b8f00 2841359821 S Bi:004:05 -115 16384 <
ffff8101853ca240 2841366692 S Bo:004:06 -115 1 = 39
ffff8102139b8f00 2841367328 C Bi:004:05 0 1 = 39
ffff8101853ca240 2841367333 C Bo:004:06 0 1 >
ffff8102139b8f00 2841367761 S Bi:004:05 -115 16384 <
ffff8101853ca240 2841376713 S Bo:004:06 -115 1 = 39
ffff8102139b8f00 2841377327 C Bi:004:05 0 1 = 39
ffff8101853ca240 2841377332 C Bo:004:06 0 1 >
ffff8102139b8f00 2841379677 S Bi:004:05 -115 16384 <
ffff8101853ca240 2841386722 S Bo:004:06 -115 1 = 2a
ffff8102139b8f00 2841387356 C Bi:004:05 0 1 = 2a
ffff8101853ca240 2841387362 C Bo:004:06 0 1 >
ffff8102139b8f00 2841388460 S Bi:004:05 -115 16384 <
ffff8101853ca240 2841396786 S Bo:004:06 -115 1 = 2a
ffff8102139b8f00 2841397334 C Bi:004:05 0 1 = 2a
ffff8101853ca240 2841397339 C Bo:004:06 0 1 >
ffff8102139b8f00 2841399768 S Bi:004:05 -115 16384 <
ffff8101853ca240 2841406766 S Bo:004:06 -115 1 = 2a
ffff8102139b8f00 2841407329 C Bi:004:05 0 1 = 2a
ffff8101853ca240 2841407333 C Bo:004:06 0 1 >
ffff8102139b8f00 2841407691 S Bi:004:05 -115 16384 <
ffff8101853ca240 2841416792 S Bo:004:06 -115 1 = 31
ffff8102139b8f00 2841417330 C Bi:004:05 0 1 = 31
ffff8101853ca240 2841417334 C Bo:004:06 0 1 >
ffff8102139b8f00 2841419854 S Bi:004:05 -115 16384 <
ffff8101853ca300 2841426888 S Bo:004:06 -115 1 = 23
ffff8102139b8f00 2841427345 C Bi:004:05 0 1 = 23
ffff8101853ca300 2841427352 C Bo:004:06 0 1 >
ffff8102139b8f00 2841427764 S Bi:004:05 -115 16384 <
ffff8101853ca240 2841436967 S Bo:004:06 -115 1 = 0d
ffff8101853ca240 2841437268 C Bo:004:06 0 1 >
ffff8102139b8f00 2841438332 C Bi:004:05 0 2 = 0d0a
ffff8102139b8f00 2841439734 S Bi:004:05 -115 16384 <
ffff8102139b8f00 2841440333 C Bi:004:05 0 11 = 0d0a434f 4e4e4543 540d0a
ffff8102139b8f00 2841440474 S Bi:004:05 -115 16384 <
ffff8101853ca240 2841450747 S Bo:004:06 -115 1 = 7e
ffff8101853ca240 2841451270 C Bo:004:06 0 1 >
ffff8101853ca240 2841460757 S Bo:004:06 -115 1 = 70
ffff8101853ca240 2841461269 C Bo:004:06 0 1 >
ffff8101853ca240 2841470893 S Bo:004:06 -115 1 = 0d
ffff8101853ca240 2841471273 C Bo:004:06 0 1 >
ffff8102139b8f00 2841624347 C Bi:004:05 -2 0
ffff81010a67e0c0 2841624467 S Bi:004:05 -115 16384 <
ffff81010a67e0c0 2841808356 C Bi:004:05 -2 0
ffff81010a67e0c0 2841808474 S Bi:004:05 -115 16384 <
ffff81010a67e0c0 2841992372 C Bi:004:05 -2 0
ffff8101eb7b3600 2841992490 S Bi:004:05 -115 16384 <
ffff8101eb7b3600 2842176378 C Bi:004:05 -2 0
ffff8101eb7b3600 2842176498 S Bi:004:05 -115 16384 <
ffff8101eb7b3600 2842360388 C Bi:004:05 -2 0
ffff81008b6f10c0 2842360502 S Bi:004:05 -115 16384 <
ffff8101853ca780 2842506862 S Bo:004:06 -115 47 = 7e7eff7d 23c0217d 217d217d 207d347d 227d267d 207d207d 207d207d 257d26ba
ffff8101853ca780 2842507329 C Bo:004:06 0 47 >
ffff81008b6f10c0 2842508392 C Bi:004:05 0 36 = 7eff7d23 c0217d21 7d207d20 7d2e7d22 7d267d20 7d207d20 7d207d23 7d24c023
ffff8101f4700000 2842512662 S Bi:004:05 -115 16384 <
ffff8101853ca780 2842513125 S Bo:004:06 -115 35 = 7eff7d23 c0217d22 7d207d20 7d2e7d22 7d267d20 7d207d20 7d207d23 7d24c023
ffff8101f4700000 2842513394 C Bi:004:05 0 33 = 7eff7d23 c0217d24 7d217d20 7d2e7d25 7d26ba6d eace7d27 7d227d28 7d227776
ffff8101853ca780 2842513403 C Bo:004:06 0 35 >
ffff8101f4700000 2842513864 S Bi:004:05 -115 16384 <
ffff8101853ca780 2842514099 S Bo:004:06 -115 29 = 7eff7d23 c0217d21 7d227d20 7d2a7d22 7d267d20 7d207d20 7d205fad 7e
ffff8101853ca780 2842514330 C Bo:004:06 0 29 >
ffff8101f4700000 2842515395 C Bi:004:05 0 29 = 7eff7d23 c0217d22 7d227d20 7d2a7d22 7d267d20 7d207d20 7d2036d9 7e
ffff8101f47000c0 2842515598 S Bi:004:05 -115 16384 <
ffff8101853ca3c0 2842519406 S Bo:004:06 -115 22 = 7eff03c0 23010100 0e086672 656e6368 6965008c a07e
ffff8101853ca3c0 2842520331 C Bo:004:06 0 22 >
ffff8101f47000c0 2842696406 C Bi:004:05 -2 0
ffff8101f47000c0 2842696532 S Bi:004:05 -115 16384 <
ffff8101f47000c0 2842883417 C Bi:004:05 -2 0
ffff8101853ca180 2842883558 S Bi:004:05 -115 16384 <
ffff8101853ca180 2843067428 C Bi:004:05 -2 0
ffff8101853ca180 2843067570 S Bi:004:05 -115 16384 <
ffff8101853ca180 2843179433 C Bi:004:05 0 12 = 7eff03c0 23020100 0494867e
ffff8101853ca180 2843179774 S Bi:004:05 -115 16384 <
ffff8101853ca240 2843180565 S Bo:004:06 -115 53 = 7eff0380 fd010100 0f1a0478 00180478 0015032f b1cd7e7e ff038021 01010016
ffff8101853ca180 2843181430 C Bi:004:05 0 46 = 7eff7d23 c0217d28 7d217d20 7d3580fd 7d217d21 7d207d2f 7d3a7d24 787d207d
ffff8101853ca240 2843181437 C Bo:004:06 0 53 >
ffff8101853ca240 2843184370 S Bi:004:05 -115 16384 <
ffff8101853ca240 2843185428 C Bi:004:05 0 18 = 7eff0380 21010200 0a0306a9 fe010134 317e
ffff8101853ca240 2843185602 S Bi:004:05 -115 16384 <
ffff8101853ca3c0 2843185982 S Bo:004:06 -115 18 = 7eff0380 21020200 0a0306a9 fe01015d 457e
ffff8101853ca240 2843186428 C Bi:004:05 0 30 = 7eff0380 21030100 16030619 e16e5c81 06425e09 78830642 5e1978e5 f37e
ffff8101853ca3c0 2843186434 C Bo:004:06 0 18 >
ffff8101853ca3c0 2843188581 S Bi:004:05 -115 16384 <
ffff8101853ca240 2843188979 S Bo:004:06 -115 30 = 7eff0380 21010200 16030619 e16e5c81 06425e09 78830642 5e1978fa f07e
ffff8101853ca240 2843189368 C Bo:004:06 0 30 >
ffff8101853ca3c0 2843190435 C Bi:004:05 0 30 = 7eff0380 21020200 16030619 e16e5c81 06425e09 78830642 5e19780c 037e
ffff8101853ca3c0 2843191124 S Bi:004:05 -115 16384 <
ffff8101853ca3c0 2843372444 C Bi:004:05 -2 0
ffff8101c05aaf00 2843372569 S Bi:004:05 -115 16384 <
ffff8101c05aaf00 2843556453 C Bi:004:05 -2 0
ffff8101c05aaf00 2843556573 S Bi:004:05 -115 16384 <
ffff8101c05aaf00 2843740462 C Bi:004:05 -2 0
ffff8101c05aaf00 2843740579 S Bi:004:05 -115 16384 <
ffff8101c05aaf00 2843924472 C Bi:004:05 -2 0
ffff8101eb417b40 2843924590 S Bi:004:05 -115 16384 <
ffff8101eb417b40 2844108482 C Bi:004:05 -2 0
ffff8101eb417b40 2844108596 S Bi:004:05 -115 16384 <
ffff8101eb417b40 2844292494 C Bi:004:05 -2 0
ffff8101eb417b40 2844292609 S Bi:004:05 -115 16384 <
ffff8101eb417b40 2844476504 C Bi:004:05 -2 0
ffff81013212c3c0 2844476653 S Bi:004:05 -115 16384 <
ffff81013212c3c0 2844660512 C Bi:004:05 -2 0
ffff81013212c3c0 2844660631 S Bi:004:05 -115 16384 <
ffff81013212c3c0 2844847522 C Bi:004:05 -2 0
ffff8101ef115c00 2844847624 S Bi:004:05 -115 16384 <
ffff8101ef115c00 2845028536 C Bi:004:05 -2 0
ffff8101ef115c00 2845028678 S Bi:004:05 -115 16384 <
ffff8101ef115c00 2845212547 C Bi:004:05 -2 0
ffff810210410f00 2845212669 S Bi:004:05 -115 16384 <
ffff810210410f00 2845397558 C Bi:004:05 -2 0
ffff8101f4734cc0 2845397700 S Bi:004:05 -115 16384 <
ffff8101f4734cc0 2845580567 C Bi:004:05 -2 0
ffff810185126b40 2845580687 S Bi:004:05 -115 16384 <
ffff810185126b40 2845764579 C Bi:004:05 -2 0
ffff810185126b40 2845764700 S Bi:004:05 -115 16384 <
ffff810185126b40 2845948590 C Bi:004:05 -2 0
ffff81020a6ab180 2845948710 S Bi:004:05 -115 16384 <
ffff81020a6ab180 2846132597 C Bi:004:05 -2 0
ffff81020a6ab180 2846132717 S Bi:004:05 -115 16384 <
ffff81020a6ab180 2846316611 C Bi:004:05 -2 0
ffff81020a6ab180 2846316731 S Bi:004:05 -115 16384 <
ffff81020a6ab180 2846500619 C Bi:004:05 -2 0
ffff81020a68fe40 2846500742 S Bi:004:05 -115 16384 <
ffff81020a68fe40 2846684627 C Bi:004:05 -2 0
ffff81020a68fe40 2846684751 S Bi:004:05 -115 16384 <
ffff81020a68fe40 2846868637 C Bi:004:05 -2 0
ffff8101df180480 2846868761 S Bi:004:05 -115 16384 <
ffff8101df180480 2847052647 C Bi:004:05 -2 0
ffff8101df180480 2847052770 S Bi:004:05 -115 16384 <
ffff8101df180480 2847235658 C Bi:004:05 -2 0
ffff8101f4734780 2847235811 S Bi:004:05 -115 16384 <
ffff8101f4734780 2847420669 C Bi:004:05 -2 0
ffff81013597c000 2847420790 S Bi:004:05 -115 16384 <
ffff81013597c000 2847603679 C Bi:004:05 -2 0
ffff81011dcf1b40 2847603821 S Bi:004:05 -115 16384 <
ffff81011dcf1b40 2847789690 C Bi:004:05 -2 0
ffff81011dcf1b40 2847789828 S Bi:004:05 -115 16384 <
ffff81011dcf1b40 2847973702 C Bi:004:05 -2 0
ffff810213991480 2847973845 S Bi:004:05 -115 16384 <
ffff810213991480 2848156709 C Bi:004:05 -2 0
ffff810213991480 2848156857 S Bi:004:05 -115 16384 <
ffff810213991480 2848344725 C Bi:004:05 -2 0
ffff8100cd3490c0 2848567169 S Co:004:00 s 01 0b 0000 0000 0000 0
ffff8100cd3490c0 2848568668 C Co:004:00 0 0
