ffff810206a6e3c0 2041296260 S Bo:4:053:10 -115 31 = 55534243 46130000 00000000 00000600 00000000 00000000 00000000 000000
ffff810206a6e3c0 2041298128 C Bo:4:053:10 0 31 >
ffff810206a6e3c0 2041298135 S Bi:4:053:9 -115 13 <
ffff810206a6e3c0 2041299126 C Bi:4:053:9 0 13 = 55534253 46130000 00000000 01
ffff810206a6e3c0 2041299133 S Bo:4:053:10 -115 31 = 55534243 47130000 12000000 80000603 00000012 00000000 00000000 000000
ffff810206a6e3c0 2041300125 C Bo:4:053:10 0 31 >
ffff8101ef16fb40 2041300135 S Bi:4:053:9 -115 18 <
ffff8101ef16fb40 2041301125 C Bi:4:053:9 0 18 = 70000200 0000000a 00000000 3a000000 0000
ffff810206a6e3c0 2041301133 S Bi:4:053:9 -115 13 <
ffff810206a6e3c0 2041302126 C Bi:4:053:9 0 13 = 55534253 47130000 00000000 00
ffff810206a6e3c0 2041302158 S Bo:4:053:10 -115 31 = 55534243 48130000 00000000 00000600 00000000 00000000 00000000 000000
ffff810206a6e3c0 2041303126 C Bo:4:053:10 0 31 >
ffff810206a6e3c0 2041303131 S Bi:4:053:9 -115 13 <
ffff810206a6e3c0 2041304129 C Bi:4:053:9 0 13 = 55534253 48130000 00000000 01
ffff810206a6e3c0 2041304338 S Bo:4:053:10 -115 31 = 55534243 49130000 12000000 80000603 00000012 00000000 00000000 000000
ffff810206a6e3c0 2041305130 C Bo:4:053:10 0 31 >
ffff8101ef16fb40 2041305167 S Bi:4:053:9 -115 18 <
ffff8101ef16fb40 2041306127 C Bi:4:053:9 0 18 = 70000200 0000000a 00000000 3a000000 0000
ffff810206a6e3c0 2041306138 S Bi:4:053:9 -115 13 <
ffff810206a6e3c0 2041307126 C Bi:4:053:9 0 13 = 55534253 49130000 00000000 00
ffff810206a6e3c0 2043298306 S Bo:4:053:10 -115 31 = 55534243 4a130000 00000000 00000600 00000000 00000000 00000000 000000
ffff810206a6e3c0 2043300240 C Bo:4:053:10 0 31 >
ffff810206a6e3c0 2043300270 S Bi:4:053:9 -115 13 <
ffff810206a6e3c0 2043301238 C Bi:4:053:9 0 13 = 55534253 4a130000 00000000 01
ffff810206a6e3c0 2043301245 S Bo:4:053:10 -115 31 = 55534243 4b130000 12000000 80000603 00000012 00000000 00000000 000000
ffff810206a6e3c0 2043302237 C Bo:4:053:10 0 31 >
ffff8101330b3300 2043302258 S Bi:4:053:9 -115 18 <
ffff8101330b3300 2043303237 C Bi:4:053:9 0 18 = 70000200 0000000a 00000000 3a000000 0000
ffff810206a6e3c0 2043303246 S Bi:4:053:9 -115 13 <
ffff810206a6e3c0 2043304240 C Bi:4:053:9 0 13 = 55534253 4b130000 00000000 00
ffff810206a6e3c0 2043304313 S Bo:4:053:10 -115 31 = 55534243 4c130000 00000000 00000600 00000000 00000000 00000000 000000
ffff810206a6e3c0 2043305237 C Bo:4:053:10 0 31 >
ffff810206a6e3c0 2043305242 S Bi:4:053:9 -115 13 <
ffff810206a6e3c0 2043306237 C Bi:4:053:9 0 13 = 55534253 4c130000 00000000 01
ffff810206a6e3c0 2043306260 S Bo:4:053:10 -115 31 = 55534243 4d130000 12000000 80000603 00000012 00000000 00000000 000000
ffff810206a6e3c0 2043307237 C Bo:4:053:10 0 31 >
ffff8101330b3300 2043307246 S Bi:4:053:9 -115 18 <
ffff8101330b3300 2043308237 C Bi:4:053:9 0 18 = 70000200 0000000a 00000000 3a000000 0000
ffff810206a6e3c0 2043308245 S Bi:4:053:9 -115 13 <
ffff810206a6e3c0 2043309237 C Bi:4:053:9 0 13 = 55534253 4d130000 00000000 00
ffff810206a6e3c0 2045299160 S Bo:4:053:10 -115 31 = 55534243 4e130000 00000000 00000600 00000000 00000000 00000000 000000
ffff810206a6e3c0 2045300354 C Bo:4:053:10 0 31 >
ffff810206a6e3c0 2045300399 S Bi:4:053:9 -115 13 <
ffff810206a6e3c0 2045301352 C Bi:4:053:9 0 13 = 55534253 4e130000 00000000 01
ffff810206a6e3c0 2045301389 S Bo:4:053:10 -115 31 = 55534243 4f130000 12000000 80000603 00000012 00000000 00000000 000000
ffff810206a6e3c0 2045302349 C Bo:4:053:10 0 31 >
ffff810206a6e480 2045302360 S Bi:4:053:9 -115 18 <
ffff810206a6e480 2045303348 C Bi:4:053:9 0 18 = 70000200 0000000a 00000000 3a000000 0000
ffff810206a6e3c0 2045303357 S Bi:4:053:9 -115 13 <
ffff810206a6e3c0 2045304350 C Bi:4:053:9 0 13 = 55534253 4f130000 00000000 00
ffff810206a6e3c0 2045304419 S Bo:4:053:10 -115 31 = 55534243 50130000 00000000 00000600 00000000 00000000 00000000 000000
ffff810206a6e3c0 2045305349 C Bo:4:053:10 0 31 >
ffff810206a6e3c0 2045305355 S Bi:4:053:9 -115 13 <
ffff810206a6e3c0 2045306348 C Bi:4:053:9 0 13 = 55534253 50130000 00000000 01
ffff810206a6e3c0 2045306355 S Bo:4:053:10 -115 31 = 55534243 51130000 12000000 80000603 00000012 00000000 00000000 000000
ffff810206a6e3c0 2045307348 C Bo:4:053:10 0 31 >
ffff810206a6e480 2045307357 S Bi:4:053:9 -115 18 <
ffff810206a6e480 2045308348 C Bi:4:053:9 0 18 = 70000200 0000000a 00000000 3a000000 0000
ffff810206a6e3c0 2045308357 S Bi:4:053:9 -115 13 <
ffff810206a6e3c0 2045309349 C Bi:4:053:9 0 13 = 55534253 51130000 00000000 00
ffff81012134ac00 2045948326 S Bo:4:053:6 -115 1204 = 7eff0300 21450004 ac6b3140 0040063b 5319e6f8 f8d155ab 939ecb00 50dae5b4
ffff81012134ac00 2045950398 C Bo:4:053:6 0 1204 >
ffff810206a6e3c0 2047298277 S Bo:4:053:10 -115 31 = 55534243 52130000 00000000 00000600 00000000 00000000 00000000 000000
ffff810206a6e3c0 2047299462 C Bo:4:053:10 0 31 >
ffff810206a6e3c0 2047299471 S Bi:4:053:9 -115 13 <
ffff810206a6e3c0 2047300460 C Bi:4:053:9 0 13 = 55534253 52130000 00000000 01
ffff810206a6e3c0 2047300468 S Bo:4:053:10 -115 31 = 55534243 53130000 12000000 80000603 00000012 00000000 00000000 000000
ffff810206a6e3c0 2047301459 C Bo:4:053:10 0 31 >
ffff810137f9a180 2047301468 S Bi:4:053:9 -115 18 <
ffff810137f9a180 2047302460 C Bi:4:053:9 0 18 = 70000200 0000000a 00000000 3a000000 0000
ffff810206a6e3c0 2047302468 S Bi:4:053:9 -115 13 <
ffff810206a6e3c0 2047303459 C Bi:4:053:9 0 13 = 55534253 53130000 00000000 00
ffff810206a6e3c0 2047303495 S Bo:4:053:10 -115 31 = 55534243 54130000 00000000 00000600 00000000 00000000 00000000 000000
ffff810206a6e3c0 2047304461 C Bo:4:053:10 0 31 >
ffff810206a6e3c0 2047304469 S Bi:4:053:9 -115 13 <
ffff810206a6e3c0 2047305462 C Bi:4:053:9 0 13 = 55534253 54130000 00000000 01
ffff810206a6e3c0 2047305496 S Bo:4:053:10 -115 31 = 55534243 55130000 12000000 80000603 00000012 00000000 00000000 000000
ffff810206a6e3c0 2047306462 C Bo:4:053:10 0 31 >
ffff810137f9a180 2047306474 S Bi:4:053:9 -115 18 <
ffff810137f9a180 2047307460 C Bi:4:053:9 0 18 = 70000200 0000000a 00000000 3a000000 0000
ffff810206a6e3c0 2047307469 S Bi:4:053:9 -115 13 <
ffff810206a6e3c0 2047308460 C Bi:4:053:9 0 13 = 55534253 55130000 00000000 00
ffff810206a6e3c0 2049298369 S Bo:4:053:10 -115 31 = 55534243 56130000 00000000 00000600 00000000 00000000 00000000 000000
ffff810206a6e3c0 2049299574 C Bo:4:053:10 0 31 >
ffff810206a6e3c0 2049299605 S Bi:4:053:9 -115 13 <
ffff810206a6e3c0 2049300571 C Bi:4:053:9 0 13 = 55534253 56130000 00000000 01
ffff810206a6e3c0 2049300579 S Bo:4:053:10 -115 31 = 55534243 57130000 12000000 80000603 00000012 00000000 00000000 000000
ffff810206a6e3c0 2049301571 C Bo:4:053:10 0 31 >
ffff810137f9a180 2049301581 S Bi:4:053:9 -115 18 <
ffff810137f9a180 2049302571 C Bi:4:053:9 0 18 = 70000200 0000000a 00000000 3a000000 0000
ffff810206a6e3c0 2049302579 S Bi:4:053:9 -115 13 <
ffff810206a6e3c0 2049303571 C Bi:4:053:9 0 13 = 55534253 57130000 00000000 00
ffff810206a6e3c0 2049303611 S Bo:4:053:10 -115 31 = 55534243 58130000 00000000 00000600 00000000 00000000 00000000 000000
ffff810206a6e3c0 2049304571 C Bo:4:053:10 0 31 >
ffff810206a6e3c0 2049304577 S Bi:4:053:9 -115 13 <
ffff810206a6e3c0 2049305571 C Bi:4:053:9 0 13 = 55534253 58130000 00000000 01
ffff810206a6e3c0 2049305578 S Bo:4:053:10 -115 31 = 55534243 59130000 12000000 80000603 00000012 00000000 00000000 000000
ffff810206a6e3c0 2049306571 C Bo:4:053:10 0 31 >
ffff810137f9a180 2049306578 S Bi:4:053:9 -115 18 <
ffff810137f9a180 2049307572 C Bi:4:053:9 0 18 = 70000200 0000000a 00000000 3a000000 0000
ffff810206a6e3c0 2049307579 S Bi:4:053:9 -115 13 <
ffff810206a6e3c0 2049308571 C Bi:4:053:9 0 13 = 55534253 59130000 00000000 00
ffff81020a6abcc0 2051176239 S Bo:4:053:6 -115 75 = 7eff0300 21450000 43f98240 004011e2 7219e6f8 f8425e09 78be1f00 35002f02
ffff81020a6abcc0 2051177683 C Bo:4:053:6 0 75 >
ffff810206a6e3c0 2051298283 S Bo:4:053:10 -115 31 = 55534243 5a130000 00000000 00000600 00000000 00000000 00000000 000000
ffff810206a6e3c0 2051299685 C Bo:4:053:10 0 31 >
ffff810206a6e3c0 2051299735 S Bi:4:053:9 -115 13 <
ffff810206a6e3c0 2051300684 C Bi:4:053:9 0 13 = 55534253 5a130000 00000000 01
ffff810206a6e3c0 2051300691 S Bo:4:053:10 -115 31 = 55534243 5b130000 12000000 80000603 00000012 00000000 00000000 000000
ffff810206a6e3c0 2051301682 C Bo:4:053:10 0 31 >
ffff81019bd71180 2051301692 S Bi:4:053:9 -115 18 <
ffff81019bd71180 2051302683 C Bi:4:053:9 0 18 = 70000200 0000000a 00000000 3a000000 0000
ffff810206a6e3c0 2051302692 S Bi:4:053:9 -115 13 <
ffff810206a6e3c0 2051303682 C Bi:4:053:9 0 13 = 55534253 5b130000 00000000 00
ffff810206a6e3c0 2051303717 S Bo:4:053:10 -115 31 = 55534243 5c130000 00000000 00000600 00000000 00000000 00000000 000000
ffff810206a6e3c0 2051304683 C Bo:4:053:10 0 31 >
ffff810206a6e3c0 2051304688 S Bi:4:053:9 -115 13 <
ffff810206a6e3c0 2051305682 C Bi:4:053:9 0 13 = 55534253 5c130000 00000000 01
ffff810206a6e3c0 2051305689 S Bo:4:053:10 -115 31 = 55534243 5d130000 12000000 80000603 00000012 00000000 00000000 000000
ffff810206a6e3c0 2051306683 C Bo:4:053:10 0 31 >
ffff81019bd71180 2051306690 S Bi:4:053:9 -115 18 <
ffff81019bd71180 2051307682 C Bi:4:053:9 0 18 = 70000200 0000000a 00000000 3a000000 0000
ffff810206a6e3c0 2051307690 S Bi:4:053:9 -115 13 <
ffff810206a6e3c0 2051308682 C Bi:4:053:9 0 13 = 55534253 5d130000 00000000 00
ffff810206a6e3c0 2053298292 S Bo:4:053:10 -115 31 = 55534243 5e130000 00000000 00000600 00000000 00000000 00000000 000000
ffff810206a6e3c0 2053299797 C Bo:4:053:10 0 31 >
ffff810206a6e3c0 2053299823 S Bi:4:053:9 -115 13 <
ffff810206a6e3c0 2053300795 C Bi:4:053:9 0 13 = 55534253 5e130000 00000000 01
ffff810206a6e3c0 2053300820 S Bo:4:053:10 -115 31 = 55534243 5f130000 12000000 80000603 00000012 00000000 00000000 000000
ffff810206a6e3c0 2053301794 C Bo:4:053:10 0 31 >
ffff810133286e40 2053301817 S Bi:4:053:9 -115 18 <
ffff810133286e40 2053302794 C Bi:4:053:9 0 18 = 70000200 0000000a 00000000 3a000000 0000
ffff810206a6e3c0 2053302820 S Bi:4:053:9 -115 13 <
ffff810206a6e3c0 2053303794 C Bi:4:053:9 0 13 = 55534253 5f130000 00000000 00
ffff810206a6e3c0 2053303856 S Bo:4:053:10 -115 31 = 55534243 60130000 00000000 00000600 00000000 00000000 00000000 000000
ffff810206a6e3c0 2053304795 C Bo:4:053:10 0 31 >
ffff810206a6e3c0 2053304816 S Bi:4:053:9 -115 13 <
ffff810206a6e3c0 2053305794 C Bi:4:053:9 0 13 = 55534253 60130000 00000000 01
ffff810206a6e3c0 2053305817 S Bo:4:053:10 -115 31 = 55534243 61130000 12000000 80000603 00000012 00000000 00000000 000000
ffff810206a6e3c0 2053306795 C Bo:4:053:10 0 31 >
ffff810133286e40 2053306822 S Bi:4:053:9 -115 18 <
ffff810133286e40 2053307794 C Bi:4:053:9 0 18 = 70000200 0000000a 00000000 3a000000 0000
ffff810206a6e3c0 2053307819 S Bi:4:053:9 -115 13 <
ffff810206a6e3c0 2053308795 C Bi:4:053:9 0 13 = 55534253 61130000 00000000 00
ffff810133847600 2054898605 S Bo:4:053:6 -115 75 = 7eff0300 21450000 43fd2540 004011de cf19e6f8 f8425e09 78be4700 35002fc7
ffff810133847600 2054899890 C Bo:4:053:6 0 75 >
ffff810206a6e3c0 2055298306 S Bo:4:053:10 -115 31 = 55534243 62130000 00000000 00000600 00000000 00000000 00000000 000000
ffff810206a6e3c0 2055299907 C Bo:4:053:10 0 31 >
ffff810206a6e3c0 2055299915 S Bi:4:053:9 -115 13 <
ffff810206a6e3c0 2055300906 C Bi:4:053:9 0 13 = 55534253 62130000 00000000 01
ffff810206a6e3c0 2055300913 S Bo:4:053:10 -115 31 = 55534243 63130000 12000000 80000603 00000012 00000000 00000000 000000
ffff810206a6e3c0 2055301905 C Bo:4:053:10 0 31 >
ffff81012cb183c0 2055301914 S Bi:4:053:9 -115 18 <
ffff81012cb183c0 2055302905 C Bi:4:053:9 0 18 = 70000200 0000000a 00000000 3a000000 0000
ffff810206a6e3c0 2055302914 S Bi:4:053:9 -115 13 <
ffff810206a6e3c0 2055303905 C Bi:4:053:9 0 13 = 55534253 63130000 00000000 00
ffff810206a6e3c0 2055303939 S Bo:4:053:10 -115 31 = 55534243 64130000 00000000 00000600 00000000 00000000 00000000 000000
ffff810206a6e3c0 2055304905 C Bo:4:053:10 0 31 >
ffff810206a6e3c0 2055304910 S Bi:4:053:9 -115 13 <
ffff810206a6e3c0 2055305905 C Bi:4:053:9 0 13 = 55534253 64130000 00000000 01
ffff810206a6e3c0 2055305912 S Bo:4:053:10 -115 31 = 55534243 65130000 12000000 80000603 00000012 00000000 00000000 000000
ffff810206a6e3c0 2055306905 C Bo:4:053:10 0 31 >
ffff81012cb183c0 2055306913 S Bi:4:053:9 -115 18 <
ffff81012cb183c0 2055307905 C Bi:4:053:9 0 18 = 70000200 0000000a 00000000 3a000000 0000
ffff810206a6e3c0 2055307912 S Bi:4:053:9 -115 13 <
ffff810206a6e3c0 2055308913 C Bi:4:053:9 0 13 = 55534253 65130000 00000000 00
ffff8101df1b6180 2056178583 S Bo:4:053:6 -115 75 = 7eff0300 21450000 43fe6440 004011cd 9019e6f8 f8425e19 789b1100 35002f15
ffff8101df1b6180 2056179960 C Bo:4:053:6 0 75 >
ffff8101df1b6180 2056180420 S Bi:4:053:5 -115 16384 <
ffff8101df1b6180 2056181015 C Bi:4:053:5 0 476 = 7d5edcc9 29f538be 989e2f71 6f324e48 d73f5457 7fb0ffec 4d5316c3 de68af1a
ffff8101df1b6180 2056182125 S Bi:4:053:5 -115 16384 <
ffff8101df1b6180 2056184009 C Bi:4:053:5 0 1520 = 7eff0300 21450005 dc8ab800 00c606cb f1cfabb5 e719e6f8 f80050e2 80d6b941
ffff8101df1b6180 2056194288 S Bi:4:053:5 -115 16384 <
ffff8101df1b6180 2056195016 C Bi:4:053:5 0 48 = 7eff0300 21450000 28abe000 00c606b9 27d155ab 9319e6f8 f800509e cb0d0df3
ffff8101df1b6180 2056198986 S Bi:4:053:5 -115 16384 <
ffff8101df1b6180 2056200014 C Bi:4:053:5 0 1002 = 7eff0300 21450005 dcb76000 00c606a7 f3d155ab 9319e6f8 f800509e cb0d0df3
ffff8101df1b6180 2056208168 S Bi:4:053:5 -115 16384 <
ffff8101df1b6180 2056209026 C Bi:4:053:5 0 515 = ecc0e335 e08f0da2 9af52a2f 2ffd9254 2fd7d609 862de220 ad240dea 47e24b76
ffff8101df1b6180 2056210189 S Bi:4:053:5 -115 16384 <
ffff8101df1b6180 2056211014 C Bi:4:053:5 0 50 = 7eff0300 21450000 2850cf40 00fe068d 114a7d5d 419319e6 f8f80050 b261d08a
ffff8101df1b6180 2056214990 S Bi:4:053:5 -115 16384 <
ffff8101df1b6180 2056216018 C Bi:4:053:5 0 48 = 7eff0300 21450000 282abc00 00c6063a 4cd155ab 9319e6f8 f800509e cb0d0df9
ffff8101df1b6180 2056216173 S Bi:4:053:5 -115 16384 <
ffff8101df1b6180 2056218012 C Bi:4:053:5 0 1378 = 7eff0300 21450005 dc917400 00c606cd dfd155ab 9319e6f8 f800509e cb0d0df3
ffff8101fad5c000 2056245124 S Bi:4:053:5 -115 16384 <
ffff8101fad5c000 2056247022 C Bi:4:053:5 0 139 = c0802ec0 aeb6c18e 45236330 438e1dd2 aa4a1e48 24609e9f 89ed1e8f 76749b35
ffff81012cb183c0 2056247463 S Bo:4:053:6 -115 95 = 7eff0300 21450000 28a3f540 004006fe 6819e6f8 f8cfabb5 e7e28000 50893c2b
ffff81012cb183c0 2056247964 C Bo:4:053:6 0 95 >
ffff810206a6e3c0 2057297266 S Bo:4:053:10 -115 31 = 55534243 66130000 00000000 00000600 00000000 00000000 00000000 000000
ffff810206a6e3c0 2057299018 C Bo:4:053:10 0 31 >
ffff810206a6e3c0 2057299027 S Bi:4:053:9 -115 13 <
ffff810206a6e3c0 2057300016 C Bi:4:053:9 0 13 = 55534253 66130000 00000000 01
ffff810206a6e3c0 2057300024 S Bo:4:053:10 -115 31 = 55534243 67130000 12000000 80000603 00000012 00000000 00000000 000000
ffff810206a6e3c0 2057301016 C Bo:4:053:10 0 31 >
ffff81012cb18480 2057301025 S Bi:4:053:9 -115 18 <
ffff81012cb18480 2057302016 C Bi:4:053:9 0 18 = 70000200 0000000a 00000000 3a000000 0000
ffff810206a6e3c0 2057302024 S Bi:4:053:9 -115 13 <
ffff810206a6e3c0 2057302736 C Bi:4:053:9 0 13 = 55534253 67130000 00000000 00
ffff810206a6e3c0 2057302769 S Bo:4:053:10 -115 31 = 55534243 68130000 00000000 00000600 00000000 00000000 00000000 000000
ffff810206a6e3c0 2057303017 C Bo:4:053:10 0 31 >
ffff810206a6e3c0 2057303024 S Bi:4:053:9 -115 13 <
ffff810206a6e3c0 2057304016 C Bi:4:053:9 0 13 = 55534253 68130000 00000000 01
ffff810206a6e3c0 2057304023 S Bo:4:053:10 -115 31 = 55534243 69130000 12000000 80000603 00000012 00000000 00000000 000000
ffff810206a6e3c0 2057305017 C Bo:4:053:10 0 31 >
ffff81012cb18480 2057305024 S Bi:4:053:9 -115 18 <
ffff81012cb18480 2057306016 C Bi:4:053:9 0 18 = 70000200 0000000a 00000000 3a000000 0000
ffff810206a6e3c0 2057306023 S Bi:4:053:9 -115 13 <
ffff810206a6e3c0 2057307017 C Bi:4:053:9 0 13 = 55534253 69130000 00000000 00
ffff810206a6e3c0 2059297634 S Bo:4:053:10 -115 31 = 55534243 6a130000 00000000 00000600 00000000 00000000 00000000 000000
ffff810206a6e3c0 2059299130 C Bo:4:053:10 0 31 >
ffff810206a6e3c0 2059299137 S Bi:4:053:9 -115 13 <
ffff810206a6e3c0 2059300128 C Bi:4:053:9 0 13 = 55534253 6a130000 00000000 01
ffff810206a6e3c0 2059300135 S Bo:4:053:10 -115 31 = 55534243 6b130000 12000000 80000603 00000012 00000000 00000000 000000
ffff810206a6e3c0 2059301127 C Bo:4:053:10 0 31 >
ffff81012cb180c0 2059301137 S Bi:4:053:9 -115 18 <
ffff81012cb180c0 2059302128 C Bi:4:053:9 0 18 = 70000200 0000000a 00000000 3a000000 0000
ffff810206a6e3c0 2059302136 S Bi:4:053:9 -115 13 <
ffff810206a6e3c0 2059303128 C Bi:4:053:9 0 13 = 55534253 6b130000 00000000 00
ffff810206a6e3c0 2059303161 S Bo:4:053:10 -115 31 = 55534243 6c130000 00000000 00000600 00000000 00000000 00000000 000000
ffff810206a6e3c0 2059304128 C Bo:4:053:10 0 31 >
ffff810206a6e3c0 2059304134 S Bi:4:053:9 -115 13 <
ffff810206a6e3c0 2059305128 C Bi:4:053:9 0 13 = 55534253 6c130000 00000000 01
ffff810206a6e3c0 2059305134 S Bo:4:053:10 -115 31 = 55534243 6d130000 12000000 80000603 00000012 00000000 00000000 000000
ffff810206a6e3c0 2059306128 C Bo:4:053:10 0 31 >
ffff81012cb180c0 2059306135 S Bi:4:053:9 -115 18 <
ffff81012cb180c0 2059307128 C Bi:4:053:9 0 18 = 70000200 0000000a 00000000 3a000000 0000
ffff810206a6e3c0 2059307136 S Bi:4:053:9 -115 13 <
ffff810206a6e3c0 2059308128 C Bi:4:053:9 0 13 = 55534253 6d130000 00000000 00
ffff81012cb180c0 2059902616 S Bo:4:053:6 -115 75 = 7eff0300 21450000 43020740 004011c9 ee19e6f8 f8425e19 78e5b700 35002f90
ffff81012cb180c0 2059904164 C Bo:4:053:6 0 75 >
ffff8101fad5c180 2059904908 S Bi:4:053:5 -115 16384 <
ffff8101fad5c180 2059905221 C Bi:4:053:5 0 48 = 7eff0300 21450000 28068400 00c6065e 84d155ab 9319e6f8 f800509e cb0d0df9
ffff8101fad5c180 2059905417 S Bi:4:053:5 -115 16384 <
ffff8101fad5c180 2059907216 C Bi:4:053:5 0 1524 = 7eff0300 21450005 dc521400 00c60604 96cfabb5 e719e6f8 f80050e2 80d6b930
ffff8101fad5c840 2059917985 S Bi:4:053:5 -115 16384 <
ffff8101fad5c840 2059919223 C Bi:4:053:5 0 91 = 7eff0300 21450000 53000040 003b11e0 e5425e09 7819e6f8 f80035be 1f003fd4
ffff8101fad5c840 2059923331 S Bi:4:053:5 -115 16384 <
ffff8101fad5c840 2059924219 C Bi:4:053:5 0 91 = 7eff0300 21450000 53372a40 003b11a9 bb425e09 7819e6f8 f80035be 47003f9a
ffff8101fad5c840 2059924440 S Bi:4:053:5 -115 16384 <
ffff8101fad5c840 2059926216 C Bi:4:053:5 0 1522 = 7eff0300 21450005 dc425c00 00c60614 4ecfabb5 e719e6f8 f80050e2 80d6b936
ffff8101fad5cd80 2059945512 S Bi:4:053:5 -115 16384 <
ffff8101fad5cd80 2059947231 C Bi:4:053:5 0 426 = 7eff0300 21450005 dc426000 00c60614 4acfabb5 e719e6f8 f80050e2 80d6b93b
ffff8101fad5c840 2059955470 S Bi:4:053:5 -115 16384 <
ffff8101fad5c840 2059957231 C Bi:4:053:5 0 1096 = a3c92503 5710e7e6 5cdf7a0e 16cdd655 47938a6f 9e266853 3fd54eb5 afe99982
ffff8101fad5c840 2059969555 S Bi:4:053:5 -115 16384 <
ffff8101fad5c840 2059971238 C Bi:4:053:5 0 1520 = 7eff0300 21450005 dc433000 00c60613 7acfabb5 e719e6f8 f80050e2 80d6b941
ffff8101f45a0240 2059971760 S Bo:4:053:6 -115 107 = 7eff0300 21450000 34a3f740 004006fe 5a19e6f8 f8cfabb5 e7e28000 50893c2b
ffff8101f45a0240 2059972175 C Bo:4:053:6 0 107 >
ffff8101c0580cc0 2061178567 S Bo:4:053:6 -115 75 = 7eff0300 21450000 43f98340 004011e2 7119e6f8 f8425e09 78be1f00 35002f02
ffff8101c0580cc0 2061180238 C Bo:4:053:6 0 75 >
ffff8101fad5c6c0 2061180987 S Bi:4:053:5 -115 16384 <
ffff8101fad5c6c0 2061182292 C Bi:4:053:5 0 862 = 7eff0300 21450005 dc433400 00c60613 76cfabb5 e719e6f8 f80050e2 80d6b947
ffff8101fad5c6c0 2061187112 S Bi:4:053:5 -115 16384 <
ffff8101fad5c6c0 2061188298 C Bi:4:053:5 0 653 = 6ea4fa69 adbe8fa6 5f6b71e7 a428630c da78e195 7098cb40 6552b0fe b017466c
ffff8101fad5c6c0 2061202600 S Bi:4:053:5 -115 16384 <
ffff8101fad5c6c0 2061204297 C Bi:4:053:5 0 91 = 7eff0300 21450000 53000040 003311d8 e5425e19 7819e6f8 f800359b 11003fe7
ffff8101fad5c6c0 2061207052 S Bi:4:053:5 -115 16384 <
ffff8101fad5c6c0 2061209293 C Bi:4:053:5 0 1517 = 7eff0300 21450005 dc49ec00 00c60615 68d155ab 9319e6f8 f800509e cb0d0df3
ffff8101fad5c6c0 2061219899 S Bi:4:053:5 -115 16384 <
ffff8101fad5c6c0 2061221301 C Bi:4:053:5 0 962 = 7eff0300 21450005 dc229c00 00c60634 0ecfabb5 e719e6f8 f80050e2 80d6b94d
ffff8101fad5c6c0 2061223608 S Bi:4:053:5 -115 16384 <
ffff8101fad5c6c0 2061224300 C Bi:4:053:5 0 552 = c3320915 a5d3ce31 1668e20e 2b9a033d d2ddceb8 6e01940f 63a9b1c4 98afc269
ffff8101fad5ce40 2061255695 S Bi:4:053:5 -115 16384 <
ffff8101fad5ce40 2061258306 C Bi:4:053:5 0 1524 = 7eff0300 21450005 dc241000 00c6063b 44d155ab 9319e6f8 f800509e cb0d0df9
ffff8101c0580180 2061259151 S Bo:4:053:6 -115 251 = 7eff0300 21450000 3ca3f840 004006fe 5119e6f8 f8cfabb5 e7e28000 50893c2b
ffff8101c0580180 2061260237 C Bo:4:053:6 0 251 >
ffff810206a6e3c0 2061298292 S Bo:4:053:10 -115 31 = 55534243 6e130000 00000000 00000600 00000000 00000000 00000000 000000
ffff810206a6e3c0 2061300240 C Bo:4:053:10 0 31 >
ffff810206a6e3c0 2061300247 S Bi:4:053:9 -115 13 <
ffff810206a6e3c0 2061301239 C Bi:4:053:9 0 13 = 55534253 6e130000 00000000 01
ffff810206a6e3c0 2061301246 S Bo:4:053:10 -115 31 = 55534243 6f130000 12000000 80000603 00000012 00000000 00000000 000000
ffff810206a6e3c0 2061302239 C Bo:4:053:10 0 31 >
ffff8101c0580300 2061302250 S Bi:4:053:9 -115 18 <
ffff8101c0580300 2061303240 C Bi:4:053:9 0 18 = 70000200 0000000a 00000000 3a000000 0000
ffff810206a6e3c0 2061303249 S Bi:4:053:9 -115 13 <
ffff810206a6e3c0 2061304239 C Bi:4:053:9 0 13 = 55534253 6f130000 00000000 00
ffff810206a6e3c0 2061304276 S Bo:4:053:10 -115 31 = 55534243 70130000 00000000 00000600 00000000 00000000 00000000 000000
ffff810206a6e3c0 2061305239 C Bo:4:053:10 0 31 >
ffff810206a6e3c0 2061305245 S Bi:4:053:9 -115 13 <
ffff810206a6e3c0 2061306239 C Bi:4:053:9 0 13 = 55534253 70130000 00000000 01
ffff810206a6e3c0 2061306245 S Bo:4:053:10 -115 31 = 55534243 71130000 12000000 80000603 00000012 00000000 00000000 000000
ffff810206a6e3c0 2061307239 C Bo:4:053:10 0 31 >
ffff8101c0580300 2061307247 S Bi:4:053:9 -115 18 <
ffff8101c0580300 2061308239 C Bi:4:053:9 0 18 = 70000200 0000000a 00000000 3a000000 0000
ffff810206a6e3c0 2061308246 S Bi:4:053:9 -115 13 <
ffff810206a6e3c0 2061309239 C Bi:4:053:9 0 13 = 55534253 71130000 00000000 00
ffff810206a6e3c0 2063298314 S Bo:4:053:10 -115 31 = 55534243 72130000 00000000 00000600 00000000 00000000 00000000 000000
ffff810206a6e3c0 2063299352 C Bo:4:053:10 0 31 >
ffff810206a6e3c0 2063299361 S Bi:4:053:9 -115 13 <
ffff810206a6e3c0 2063300351 C Bi:4:053:9 0 13 = 55534253 72130000 00000000 01
ffff810206a6e3c0 2063300358 S Bo:4:053:10 -115 31 = 55534243 73130000 12000000 80000603 00000012 00000000 00000000 000000
ffff810206a6e3c0 2063301350 C Bo:4:053:10 0 31 >
ffff8101c05809c0 2063301361 S Bi:4:053:9 -115 18 <
ffff8101c05809c0 2063302351 C Bi:4:053:9 0 18 = 70000200 0000000a 00000000 3a000000 0000
ffff810206a6e3c0 2063302359 S Bi:4:053:9 -115 13 <
ffff810206a6e3c0 2063303350 C Bi:4:053:9 0 13 = 55534253 73130000 00000000 00
ffff810206a6e3c0 2063303384 S Bo:4:053:10 -115 31 = 55534243 74130000 00000000 00000600 00000000 00000000 00000000 000000
ffff810206a6e3c0 2063304350 C Bo:4:053:10 0 31 >
ffff810206a6e3c0 2063304356 S Bi:4:053:9 -115 13 <
ffff810206a6e3c0 2063305350 C Bi:4:053:9 0 13 = 55534253 74130000 00000000 01
ffff810206a6e3c0 2063305357 S Bo:4:053:10 -115 31 = 55534243 75130000 12000000 80000603 00000012 00000000 00000000 000000
ffff810206a6e3c0 2063306350 C Bo:4:053:10 0 31 >
ffff8101c05809c0 2063306358 S Bi:4:053:9 -115 18 <
ffff8101c05809c0 2063307351 C Bi:4:053:9 0 18 = 70000200 0000000a 00000000 3a000000 0000
ffff810206a6e3c0 2063307358 S Bi:4:053:9 -115 13 <
ffff810206a6e3c0 2063308351 C Bi:4:053:9 0 13 = 55534253 75130000 00000000 00
ffff8101c05800c0 2064187468 S Bo:4:053:6 -115 69 = 7eff0300 21450000 3cf7f240 00400679 a919e6f8 f85bbd5a 84b87d5e 0050fdf1
ffff8101c05800c0 2064189403 C Bo:4:053:6 0 69 >
ffff810204580540 2064190111 S Bi:4:053:5 -115 16384 <
ffff810204580540 2064191457 C Bi:4:053:5 0 862 = 7eff0300 21450005 dc241400 00c6063b 40d155ab 9319e6f8 f800509e cb0d0dfe
ffff810204580f00 2064196740 S Bi:4:053:5 -115 16384 <
ffff810204580f00 2064198463 C Bi:4:053:5 0 656 = dc0e534f 9b980b6e 344f2bac 77db514a f14804f3 1767e8eb 19f08f0b c56f5489
ffff810204580f00 2064203012 S Bi:4:053:5 -115 16384 <
ffff810204580f00 2064203463 C Bi:4:053:5 0 91 = 7eff0300 21450000 53000040 003311d8 e5425e19 7819e6f8 f80035e5 b7003f63
ffff810204580f00 2064203722 S Bi:4:053:5 -115 16384 <
ffff810204580f00 2064204458 C Bi:4:053:5 0 91 = 7eff0300 21450000 53000040 003b11e0 e5425e09 7819e6f8 f80035be 1f003fde
ffff810204580f00 2064204723 S Bi:4:053:5 -115 16384 <
ffff810204580f00 2064205457 C Bi:4:053:5 0 57 = 7eff0300 21450000 30582c00 00c606d3 7b5bbd5a 8419e6f8 f80050b8 7d5e238d
ffff810204580f00 2064205607 S Bi:4:053:5 -115 16384 <
ffff810204580f00 2064207454 C Bi:4:053:5 0 1518 = 7eff0300 21450005 dc582800 00c606fe 81cfabb5 e719e6f8 f80050e2 80d6b952
ffff810204580e40 2064222689 S Bi:4:053:5 -115 16384 <
ffff810204580e40 2064275466 C Bi:4:053:5 -2 0
ffff810204580e40 2064276049 S Bi:4:053:5 -115 16384 <
ffff810204580e40 2064327473 C Bi:4:053:5 -2 0
ffff810204580e40 2064327620 S Bi:4:053:5 -115 16384 <
ffff810204580e40 2064379473 C Bi:4:053:5 -2 0
ffff810204580e40 2064379595 S Bi:4:053:5 -115 16384 <
ffff810204580e40 2064431475 C Bi:4:053:5 -2 0
ffff810204580e40 2064431593 S Bi:4:053:5 -115 16384 <
ffff810204580e40 2064483478 C Bi:4:053:5 -2 0
ffff810204580e40 2064483592 S Bi:4:053:5 -115 16384 <
ffff810204580e40 2064535481 C Bi:4:053:5 -2 0
ffff810204580e40 2064535615 S Bi:4:053:5 -115 16384 <
ffff810204580e40 2064587484 C Bi:4:053:5 -2 0
ffff810204580e40 2064587603 S Bi:4:053:5 -115 16384 <
ffff810204580e40 2064639482 C Bi:4:053:5 -2 0
ffff810204580e40 2064639592 S Bi:4:053:5 -115 16384 <
ffff810204580e40 2064691485 C Bi:4:053:5 -2 0
ffff810204580e40 2064691600 S Bi:4:053:5 -115 16384 <
ffff810204580e40 2064743487 C Bi:4:053:5 -2 0
ffff810204580e40 2064743592 S Bi:4:053:5 -115 16384 <
ffff810204580e40 2064795491 C Bi:4:053:5 -2 0
ffff810204580e40 2064795604 S Bi:4:053:5 -115 16384 <
ffff810204580e40 2064839492 C Bi:4:053:5 0 58 = 7eff0300 21450000 30f31000 00c60638 975bbd5a 8419e6f8 f80050b8 7d5e238d
ffff810204580e40 2064841851 S Bo:4:053:6 -115 883 = 7eff0300 21450000 28a3fb40 004006fe 6219e6f8 f8cfabb5 e7e28000 50893c2b
ffff810204580e40 2064843442 C Bo:4:053:6 0 883 >
ffff810206a6e3c0 2065298276 S Bo:4:053:10 -115 31 = 55534243 76130000 00000000 00000600 00000000 00000000 00000000 000000
ffff810206a6e3c0 2065299464 C Bo:4:053:10 0 31 >
ffff810206a6e3c0 2065299471 S Bi:4:053:9 -115 13 <
ffff810206a6e3c0 2065300462 C Bi:4:053:9 0 13 = 55534253 76130000 00000000 01
ffff810206a6e3c0 2065300469 S Bo:4:053:10 -115 31 = 55534243 77130000 12000000 80000603 00000012 00000000 00000000 000000
ffff810206a6e3c0 2065301461 C Bo:4:053:10 0 31 >
ffff810204426b40 2065301471 S Bi:4:053:9 -115 18 <
ffff810204426b40 2065302462 C Bi:4:053:9 0 18 = 70000200 0000000a 00000000 3a000000 0000
ffff810206a6e3c0 2065302470 S Bi:4:053:9 -115 13 <
ffff810206a6e3c0 2065303462 C Bi:4:053:9 0 13 = 55534253 77130000 00000000 00
ffff810206a6e3c0 2065303494 S Bo:4:053:10 -115 31 = 55534243 78130000 00000000 00000600 00000000 00000000 00000000 000000
ffff810206a6e3c0 2065304462 C Bo:4:053:10 0 31 >
ffff810206a6e3c0 2065304468 S Bi:4:053:9 -115 13 <
ffff810206a6e3c0 2065305462 C Bi:4:053:9 0 13 = 55534253 78130000 00000000 01
ffff810206a6e3c0 2065305469 S Bo:4:053:10 -115 31 = 55534243 79130000 12000000 80000603 00000012 00000000 00000000 000000
ffff810206a6e3c0 2065306462 C Bo:4:053:10 0 31 >
ffff810204426b40 2065306469 S Bi:4:053:9 -115 18 <
ffff810204426b40 2065307462 C Bi:4:053:9 0 18 = 70000200 0000000a 00000000 3a000000 0000
ffff810206a6e3c0 2065307469 S Bi:4:053:9 -115 13 <
ffff810206a6e3c0 2065308462 C Bi:4:053:9 0 13 = 55534253 79130000 00000000 00
ffff810204426240 2067274575 S Bo:4:053:6 -115 68 = 7eff0300 21450000 3c6df540 00400603 a719e6f8 f85bbd5a 84b87f00 5000bd6b
ffff810204426240 2067276575 C Bo:4:053:6 0 68 >
ffff810204580a80 2067276673 S Bi:4:053:5 -115 16384 <
ffff810204580a80 2067278625 C Bi:4:053:5 0 1522 = 7eff0300 21450005 dc07c800 00c6064e e2cfabb5 e719e6f8 f80050e2 80d6b958
ffff810204580a80 2067291781 S Bi:4:053:5 -115 16384 <
ffff810204580a80 2067294633 C Bi:4:053:5 0 1520 = 7eff0300 21450005 dc095000 00c6064d 5acfabb5 e719e6f8 f80050e2 80d6b95e
ffff810206a6e3c0 2067298269 S Bo:4:053:10 -115 31 = 55534243 7a130000 00000000 00000600 00000000 00000000 00000000 000000
ffff810206a6e3c0 2067298573 C Bo:4:053:10 0 31 >
ffff810206a6e3c0 2067298579 S Bi:4:053:9 -115 13 <
ffff810206a6e3c0 2067299573 C Bi:4:053:9 0 13 = 55534253 7a130000 00000000 01
ffff810206a6e3c0 2067299581 S Bo:4:053:10 -115 31 = 55534243 7b130000 12000000 80000603 00000012 00000000 00000000 000000
ffff810206a6e3c0 2067300575 C Bo:4:053:10 0 31 >
ffff810204426900 2067300675 S Bi:4:053:9 -115 18 <
ffff810204426900 2067301574 C Bi:4:053:9 0 18 = 70000200 0000000a 00000000 3a000000 0000
ffff810206a6e3c0 2067301583 S Bi:4:053:9 -115 13 <
ffff810206a6e3c0 2067302573 C Bi:4:053:9 0 13 = 55534253 7b130000 00000000 00
ffff810206a6e3c0 2067302613 S Bo:4:053:10 -115 31 = 55534243 7c130000 00000000 00000600 00000000 00000000 00000000 000000
ffff810206a6e3c0 2067303573 C Bo:4:053:10 0 31 >
ffff810206a6e3c0 2067303579 S Bi:4:053:9 -115 13 <
ffff810206a6e3c0 2067304573 C Bi:4:053:9 0 13 = 55534253 7c130000 00000000 01
ffff810206a6e3c0 2067304580 S Bo:4:053:10 -115 31 = 55534243 7d130000 12000000 80000603 00000012 00000000 00000000 000000
ffff810206a6e3c0 2067305573 C Bo:4:053:10 0 31 >
ffff810204426900 2067305580 S Bi:4:053:9 -115 18 <
ffff810204426900 2067306582 C Bi:4:053:9 0 18 = 70000200 0000000a 00000000 3a000000 0000
ffff810204580a80 2067307906 S Bi:4:053:5 -115 16384 <
ffff810204580a80 2067309633 C Bi:4:053:5 0 1050 = 7eff0300 21450005 dc09c400 00c60655 90d155ab 9319e6f8 f800509e cb0d0e04
ffff810204580a80 2067312118 S Bi:4:053:5 -115 16384 <
ffff810206a6e3c0 2067312179 S Bi:4:053:9 -115 13 <
ffff810206a6e3c0 2067312579 C Bi:4:053:9 0 13 = 55534253 7d130000 00000000 00
ffff810204580a80 2067313630 C Bi:4:053:5 0 473 = 753ac4bb 97824d46 e3f1e0a2 7d5e7377 566f771c 57157aef 8cadef31 211f1a9c
ffff810204580a80 2067343871 S Bi:4:053:5 -115 16384 <
ffff810204580a80 2067346643 C Bi:4:053:5 0 1515 = 7eff0300 21450005 dc0ab000 00c6064b facfabb5 e719e6f8 f80050e2 80d6b963
ffff810204426cc0 2069142477 S Bo:4:053:6 -115 49 = 7eff0300 21450000 28f7f540 00400679 ba19e6f8 f85bbd5a 84b87d5e 0050fdf1
ffff810204426cc0 2069143684 C Bo:4:053:6 0 49 >
ffff810204426cc0 2069144858 S Bi:4:053:5 -115 16384 <
ffff810204426cc0 2069146749 C Bi:4:053:5 0 1050 = 7eff0300 21450005 dc0ab400 00c6064b f6cfabb5 e719e6f8 f80050e2 80d6b969
ffff810204426cc0 2069149534 S Bi:4:053:5 -115 16384 <
ffff810204426cc0 2069150751 C Bi:4:053:5 0 478 = f019b4cb f388126c b3f378b0 acc8575a 1f605803 f711e515 862c9516 d47449a2
ffff810204426cc0 2069166397 S Bi:4:053:5 -115 16384 <
ffff810204426cc0 2069167755 C Bi:4:053:5 0 56 = 7eff0300 21450000 300b8c00 00c60620 1c5bbd5a 8419e6f8 f80050b8 7f257337
ffff810204426cc0 2069168248 S Bi:4:053:5 -115 16384 <
ffff810204426cc0 2069168756 C Bi:4:053:5 0 49 = 7eff0300 21450000 28150800 00c60616 a85bbd5a 8419e6f8 f80050b8 7d5e238d
ffff810204426a80 2069182480 S Bi:4:053:5 -115 16384 <
ffff810204426a80 2069183752 C Bi:4:053:5 0 294 = 7eff0300 21450001 1d1ddc00 00c6060c df5bbd5a 8419e6f8 f80050b8 7d5e238d
ffff810204426a80 2069184524 S Bi:4:053:5 -115 16384 <
ffff810204426a80 2069184740 C Bi:4:053:5 0 49 = 7eff0300 21450000 281de800 00c6060d c85bbd5a 8419e6f8 f80050b8 7d5e238d
ffff810204426a80 2069184888 S Bi:4:053:5 -115 16384 <
ffff810204426a80 2069185746 C Bi:4:053:5 0 56 = 7eff0300 21450000 30b90000 00c60672 a75bbd5a 8419e6f8 f80050b8 7f257337
ffff810204426a80 2069185943 S Bi:4:053:5 -115 16384 <
ffff810204426a80 2069240754 C Bi:4:053:5 -2 0
ffff81008b6f10c0 2069241835 S Bi:4:053:5 -115 16384 <
ffff81008b6f10c0 2069294759 C Bi:4:053:5 -2 0
ffff810206a6e3c0 2069294844 S Bo:4:053:10 -115 31 = 55534243 7e130000 00000000 00000600 00000000 00000000 00000000 000000
ffff810204426600 2069294920 S Bi:4:053:5 -115 16384 <
ffff810206a6e3c0 2069295684 C Bo:4:053:10 0 31 >
ffff810206a6e3c0 2069295704 S Bi:4:053:9 -115 13 <
ffff810206a6e3c0 2069296686 C Bi:4:053:9 0 13 = 55534253 7e130000 00000000 01
ffff810206a6e3c0 2069296708 S Bo:4:053:10 -115 31 = 55534243 7f130000 12000000 80000603 00000012 00000000 00000000 000000
ffff810206a6e3c0 2069297686 C Bo:4:053:10 0 31 >
ffff8101eb77b480 2069297708 S Bi:4:053:9 -115 18 <
ffff8101eb77b480 2069298686 C Bi:4:053:9 0 18 = 70000200 0000000a 00000000 3a000000 0000
ffff810206a6e3c0 2069298711 S Bi:4:053:9 -115 13 <
ffff810206a6e3c0 2069299685 C Bi:4:053:9 0 13 = 55534253 7f130000 00000000 00
ffff810206a6e3c0 2069299734 S Bo:4:053:10 -115 31 = 55534243 80130000 00000000 00000600 00000000 00000000 00000000 000000
ffff810206a6e3c0 2069300685 C Bo:4:053:10 0 31 >
ffff810206a6e3c0 2069300704 S Bi:4:053:9 -115 13 <
ffff810206a6e3c0 2069301685 C Bi:4:053:9 0 13 = 55534253 80130000 00000000 01
ffff810206a6e3c0 2069301706 S Bo:4:053:10 -115 31 = 55534243 81130000 12000000 80000603 00000012 00000000 00000000 000000
ffff810206a6e3c0 2069302686 C Bo:4:053:10 0 31 >
ffff8101eb77b480 2069302707 S Bi:4:053:9 -115 18 <
ffff8101eb77b480 2069303686 C Bi:4:053:9 0 18 = 70000200 0000000a 00000000 3a000000 0000
ffff810206a6e3c0 2069303708 S Bi:4:053:9 -115 13 <
ffff810206a6e3c0 2069304686 C Bi:4:053:9 0 13 = 55534253 81130000 00000000 00
ffff810204426600 2069346759 C Bi:4:053:5 -2 0
ffff810204426600 2069346915 S Bi:4:053:5 -115 16384 <
ffff810204426600 2069362760 C Bi:4:053:5 0 49 = 7eff0300 21450000 28f22400 00c60639 8b5bbd5a 8419e6f8 f80050b8 7d5e238d
ffff8101eb77b240 2069363897 S Bo:4:053:6 -115 403 = 7eff0300 21450000 28a3fe40 004006fe 5f19e6f8 f8cfabb5 e7e28000 50893c2b
ffff8101eb77b240 2069364692 C Bo:4:053:6 0 403 >
ffff810206a6e3c0 2071294795 S Bo:4:053:10 -115 31 = 55534243 82130000 00000000 00000600 00000000 00000000 00000000 000000
ffff810206a6e3c0 2071296800 C Bo:4:053:10 0 31 >
ffff810206a6e3c0 2071296808 S Bi:4:053:9 -115 13 <
ffff810206a6e3c0 2071297798 C Bi:4:053:9 0 13 = 55534253 82130000 00000000 01
ffff810206a6e3c0 2071297805 S Bo:4:053:10 -115 31 = 55534243 83130000 12000000 80000603 00000012 00000000 00000000 000000
ffff810206a6e3c0 2071298797 C Bo:4:053:10 0 31 >
ffff810133286480 2071298808 S Bi:4:053:9 -115 18 <
ffff810133286480 2071299796 C Bi:4:053:9 0 18 = 70000200 0000000a 00000000 3a000000 0000
ffff810206a6e3c0 2071299805 S Bi:4:053:9 -115 13 <
ffff810206a6e3c0 2071300796 C Bi:4:053:9 0 13 = 55534253 83130000 00000000 00
ffff810206a6e3c0 2071300831 S Bo:4:053:10 -115 31 = 55534243 84130000 00000000 00000600 00000000 00000000 00000000 000000
ffff810206a6e3c0 2071301797 C Bo:4:053:10 0 31 >
ffff810206a6e3c0 2071301803 S Bi:4:053:9 -115 13 <
ffff810206a6e3c0 2071302797 C Bi:4:053:9 0 13 = 55534253 84130000 00000000 01
ffff810206a6e3c0 2071302805 S Bo:4:053:10 -115 31 = 55534243 85130000 12000000 80000603 00000012 00000000 00000000 000000
ffff810206a6e3c0 2071303796 C Bo:4:053:10 0 31 >
ffff810133286480 2071303803 S Bi:4:053:9 -115 18 <
ffff810133286480 2071304797 C Bi:4:053:9 0 18 = 70000200 0000000a 00000000 3a000000 0000
ffff810206a6e3c0 2071304804 S Bi:4:053:9 -115 13 <
ffff810206a6e3c0 2071305796 C Bi:4:053:9 0 13 = 55534253 85130000 00000000 00
ffff810206a6e3c0 2073294778 S Bo:4:053:10 -115 31 = 55534243 86130000 00000000 00000600 00000000 00000000 00000000 000000
ffff810206a6e3c0 2073295910 C Bo:4:053:10 0 31 >
ffff810206a6e3c0 2073295928 S Bi:4:053:9 -115 13 <
ffff810206a6e3c0 2073296909 C Bi:4:053:9 0 13 = 55534253 86130000 00000000 01
ffff810206a6e3c0 2073296929 S Bo:4:053:10 -115 31 = 55534243 87130000 12000000 80000603 00000012 00000000 00000000 000000
ffff810206a6e3c0 2073297912 C Bo:4:053:10 0 31 >
ffff81018530b480 2073297929 S Bi:4:053:9 -115 18 <
ffff81018530b480 2073298910 C Bi:4:053:9 0 18 = 70000200 0000000a 00000000 3a000000 0000
ffff810206a6e3c0 2073298920 S Bi:4:053:9 -115 13 <
ffff810206a6e3c0 2073299908 C Bi:4:053:9 0 13 = 55534253 87130000 00000000 00
ffff810206a6e3c0 2073299955 S Bo:4:053:10 -115 31 = 55534243 88130000 00000000 00000600 00000000 00000000 00000000 000000
ffff810206a6e3c0 2073300908 C Bo:4:053:10 0 31 >
ffff810206a6e3c0 2073300915 S Bi:4:053:9 -115 13 <
ffff810206a6e3c0 2073301908 C Bi:4:053:9 0 13 = 55534253 88130000 00000000 01
ffff810206a6e3c0 2073301915 S Bo:4:053:10 -115 31 = 55534243 89130000 12000000 80000603 00000012 00000000 00000000 000000
ffff810206a6e3c0 2073302907 C Bo:4:053:10 0 31 >
ffff81018530b480 2073302916 S Bi:4:053:9 -115 18 <
ffff81018530b480 2073303908 C Bi:4:053:9 0 18 = 70000200 0000000a 00000000 3a000000 0000
ffff810206a6e3c0 2073303915 S Bi:4:053:9 -115 13 <
ffff810206a6e3c0 2073304908 C Bi:4:053:9 0 13 = 55534253 89130000 00000000 00
ffff810206a6e3c0 2075294776 S Bo:4:053:10 -115 31 = 55534243 8a130000 00000000 00000600 00000000 00000000 00000000 000000
ffff810206a6e3c0 2075296023 C Bo:4:053:10 0 31 >
ffff810206a6e3c0 2075296032 S Bi:4:053:9 -115 13 <
ffff810206a6e3c0 2075297020 C Bi:4:053:9 0 13 = 55534253 8a130000 00000000 01
ffff810206a6e3c0 2075297028 S Bo:4:053:10 -115 31 = 55534243 8b130000 12000000 80000603 00000012 00000000 00000000 000000
ffff810206a6e3c0 2075298019 C Bo:4:053:10 0 31 >
ffff81018530bcc0 2075298029 S Bi:4:053:9 -115 18 <
ffff81018530bcc0 2075299019 C Bi:4:053:9 0 18 = 70000200 0000000a 00000000 3a000000 0000
ffff810206a6e3c0 2075299028 S Bi:4:053:9 -115 13 <
ffff810206a6e3c0 2075300019 C Bi:4:053:9 0 13 = 55534253 8b130000 00000000 00
ffff810206a6e3c0 2075300053 S Bo:4:053:10 -115 31 = 55534243 8c130000 00000000 00000600 00000000 00000000 00000000 000000
ffff810206a6e3c0 2075301019 C Bo:4:053:10 0 31 >
ffff810206a6e3c0 2075301026 S Bi:4:053:9 -115 13 <
ffff810206a6e3c0 2075302019 C Bi:4:053:9 0 13 = 55534253 8c130000 00000000 01
ffff810206a6e3c0 2075302026 S Bo:4:053:10 -115 31 = 55534243 8d130000 12000000 80000603 00000012 00000000 00000000 000000
ffff810206a6e3c0 2075303019 C Bo:4:053:10 0 31 >
ffff81018530bcc0 2075303027 S Bi:4:053:9 -115 18 <
ffff81018530bcc0 2075304019 C Bi:4:053:9 0 18 = 70000200 0000000a 00000000 3a000000 0000
ffff810206a6e3c0 2075304026 S Bi:4:053:9 -115 13 <
ffff810206a6e3c0 2075305020 C Bi:4:053:9 0 13 = 55534253 8d130000 00000000 00
ffff810206a6e3c0 2077294776 S Bo:4:053:10 -115 31 = 55534243 8e130000 00000000 00000600 00000000 00000000 00000000 000000
ffff810206a6e3c0 2077296135 C Bo:4:053:10 0 31 >
ffff810206a6e3c0 2077296144 S Bi:4:053:9 -115 13 <
ffff810206a6e3c0 2077297131 C Bi:4:053:9 0 13 = 55534253 8e130000 00000000 01
ffff810206a6e3c0 2077297139 S Bo:4:053:10 -115 31 = 55534243 8f130000 12000000 80000603 00000012 00000000 00000000 000000
ffff810206a6e3c0 2077298130 C Bo:4:053:10 0 31 >
ffff81018530b900 2077298140 S Bi:4:053:9 -115 18 <
ffff81018530b900 2077299130 C Bi:4:053:9 0 18 = 70000200 0000000a 00000000 3a000000 0000
ffff810206a6e3c0 2077299139 S Bi:4:053:9 -115 13 <
ffff810206a6e3c0 2077300131 C Bi:4:053:9 0 13 = 55534253 8f130000 00000000 00
ffff810206a6e3c0 2077300165 S Bo:4:053:10 -115 31 = 55534243 90130000 00000000 00000600 00000000 00000000 00000000 000000
ffff810206a6e3c0 2077301131 C Bo:4:053:10 0 31 >
ffff810206a6e3c0 2077301137 S Bi:4:053:9 -115 13 <
ffff810206a6e3c0 2077302131 C Bi:4:053:9 0 13 = 55534253 90130000 00000000 01
ffff810206a6e3c0 2077302138 S Bo:4:053:10 -115 31 = 55534243 91130000 12000000 80000603 00000012 00000000 00000000 000000
ffff810206a6e3c0 2077303131 C Bo:4:053:10 0 31 >
ffff81018530b900 2077303138 S Bi:4:053:9 -115 18 <
ffff81018530b900 2077304131 C Bi:4:053:9 0 18 = 70000200 0000000a 00000000 3a000000 0000
ffff810206a6e3c0 2077304138 S Bi:4:053:9 -115 13 <
ffff810206a6e3c0 2077305131 C Bi:4:053:9 0 13 = 55534253 91130000 00000000 00
ffff810206a6e3c0 2079294777 S Bo:4:053:10 -115 31 = 55534243 92130000 00000000 00000600 00000000 00000000 00000000 000000
ffff810206a6e3c0 2079296245 C Bo:4:053:10 0 31 >
ffff810206a6e3c0 2079296254 S Bi:4:053:9 -115 13 <
ffff810206a6e3c0 2079297243 C Bi:4:053:9 0 13 = 55534253 92130000 00000000 01
ffff810206a6e3c0 2079297250 S Bo:4:053:10 -115 31 = 55534243 93130000 12000000 80000603 00000012 00000000 00000000 000000
ffff810206a6e3c0 2079298245 C Bo:4:053:10 0 31 >
ffff81018530b900 2079298257 S Bi:4:053:9 -115 18 <
ffff81018530b900 2079299242 C Bi:4:053:9 0 18 = 70000200 0000000a 00000000 3a000000 0000
ffff810206a6e3c0 2079299252 S Bi:4:053:9 -115 13 <
ffff810206a6e3c0 2079300242 C Bi:4:053:9 0 13 = 55534253 93130000 00000000 00
ffff810206a6e3c0 2079300278 S Bo:4:053:10 -115 31 = 55534243 94130000 00000000 00000600 00000000 00000000 00000000 000000
ffff810206a6e3c0 2079301242 C Bo:4:053:10 0 31 >
ffff810206a6e3c0 2079301248 S Bi:4:053:9 -115 13 <
ffff810206a6e3c0 2079302242 C Bi:4:053:9 0 13 = 55534253 94130000 00000000 01
ffff810206a6e3c0 2079302250 S Bo:4:053:10 -115 31 = 55534243 95130000 12000000 80000603 00000012 00000000 00000000 000000
ffff810206a6e3c0 2079303242 C Bo:4:053:10 0 31 >
ffff81018530b900 2079303250 S Bi:4:053:9 -115 18 <
ffff81018530b900 2079304242 C Bi:4:053:9 0 18 = 70000200 0000000a 00000000 3a000000 0000
ffff810206a6e3c0 2079304249 S Bi:4:053:9 -115 13 <
ffff810206a6e3c0 2079305242 C Bi:4:053:9 0 13 = 55534253 95130000 00000000 00
ffff810206a6e3c0 2081294776 S Bo:4:053:10 -115 31 = 55534243 96130000 00000000 00000600 00000000 00000000 00000000 000000
ffff810206a6e3c0 2081296357 C Bo:4:053:10 0 31 >
ffff810206a6e3c0 2081296366 S Bi:4:053:9 -115 13 <
ffff810206a6e3c0 2081297354 C Bi:4:053:9 0 13 = 55534253 96130000 00000000 01
ffff810206a6e3c0 2081297362 S Bo:4:053:10 -115 31 = 55534243 97130000 12000000 80000603 00000012 00000000 00000000 000000
ffff810206a6e3c0 2081298358 C Bo:4:053:10 0 31 >
ffff81018530bcc0 2081298371 S Bi:4:053:9 -115 18 <
ffff81018530bcc0 2081299358 C Bi:4:053:9 0 18 = 70000200 0000000a 00000000 3a000000 0000
ffff810206a6e3c0 2081299384 S Bi:4:053:9 -115 13 <
ffff810206a6e3c0 2081300354 C Bi:4:053:9 0 13 = 55534253 97130000 00000000 00
ffff810206a6e3c0 2081300401 S Bo:4:053:10 -115 31 = 55534243 98130000 00000000 00000600 00000000 00000000 00000000 000000
ffff810206a6e3c0 2081301354 C Bo:4:053:10 0 31 >
ffff810206a6e3c0 2081301372 S Bi:4:053:9 -115 13 <
ffff810206a6e3c0 2081302355 C Bi:4:053:9 0 13 = 55534253 98130000 00000000 01
ffff810206a6e3c0 2081302377 S Bo:4:053:10 -115 31 = 55534243 99130000 12000000 80000603 00000012 00000000 00000000 000000
ffff810206a6e3c0 2081303354 C Bo:4:053:10 0 31 >
ffff81018530bcc0 2081303375 S Bi:4:053:9 -115 18 <
ffff81018530bcc0 2081304353 C Bi:4:053:9 0 18 = 70000200 0000000a 00000000 3a000000 0000
ffff810206a6e3c0 2081304375 S Bi:4:053:9 -115 13 <
ffff810206a6e3c0 2081305354 C Bi:4:053:9 0 13 = 55534253 99130000 00000000 00
ffff810206a6e3c0 2083294795 S Bo:4:053:10 -115 31 = 55534243 9a130000 00000000 00000600 00000000 00000000 00000000 000000
ffff810206a6e3c0 2083296469 C Bo:4:053:10 0 31 >
ffff810206a6e3c0 2083296482 S Bi:4:053:9 -115 13 <
ffff810206a6e3c0 2083297466 C Bi:4:053:9 0 13 = 55534253 9a130000 00000000 01
ffff810206a6e3c0 2083297475 S Bo:4:053:10 -115 31 = 55534243 9b130000 12000000 80000603 00000012 00000000 00000000 000000
ffff810206a6e3c0 2083298465 C Bo:4:053:10 0 31 >
ffff81018530b900 2083298481 S Bi:4:053:9 -115 18 <
ffff81018530b900 2083299465 C Bi:4:053:9 0 18 = 70000200 0000000a 00000000 3a000000 0000
ffff810206a6e3c0 2083299483 S Bi:4:053:9 -115 13 <
ffff810206a6e3c0 2083300465 C Bi:4:053:9 0 13 = 55534253 9b130000 00000000 00
ffff810206a6e3c0 2083300522 S Bo:4:053:10 -115 31 = 55534243 9c130000 00000000 00000600 00000000 00000000 00000000 000000
ffff810206a6e3c0 2083301465 C Bo:4:053:10 0 31 >
ffff810206a6e3c0 2083301472 S Bi:4:053:9 -115 13 <
ffff810206a6e3c0 2083302465 C Bi:4:053:9 0 13 = 55534253 9c130000 00000000 01
ffff810206a6e3c0 2083302472 S Bo:4:053:10 -115 31 = 55534243 9d130000 12000000 80000603 00000012 00000000 00000000 000000
ffff810206a6e3c0 2083303465 C Bo:4:053:10 0 31 >
ffff81018530b900 2083303475 S Bi:4:053:9 -115 18 <
ffff81018530b900 2083304465 C Bi:4:053:9 0 18 = 70000200 0000000a 00000000 3a000000 0000
ffff810206a6e3c0 2083304473 S Bi:4:053:9 -115 13 <
ffff810206a6e3c0 2083305465 C Bi:4:053:9 0 13 = 55534253 9d130000 00000000 00
ffff810206a6e3c0 2085294776 S Bo:4:053:10 -115 31 = 55534243 9e130000 00000000 00000600 00000000 00000000 00000000 000000
ffff810206a6e3c0 2085296578 C Bo:4:053:10 0 31 >
ffff810206a6e3c0 2085296588 S Bi:4:053:9 -115 13 <
ffff810206a6e3c0 2085297577 C Bi:4:053:9 0 13 = 55534253 9e130000 00000000 01
ffff810206a6e3c0 2085297585 S Bo:4:053:10 -115 31 = 55534243 9f130000 12000000 80000603 00000012 00000000 00000000 000000
ffff810206a6e3c0 2085298576 C Bo:4:053:10 0 31 >
ffff81018530b900 2085298585 S Bi:4:053:9 -115 18 <
ffff81018530b900 2085299576 C Bi:4:053:9 0 18 = 70000200 0000000a 00000000 3a000000 0000
ffff810206a6e3c0 2085299585 S Bi:4:053:9 -115 13 <
ffff810206a6e3c0 2085300576 C Bi:4:053:9 0 13 = 55534253 9f130000 00000000 00
ffff810206a6e3c0 2085300634 S Bo:4:053:10 -115 31 = 55534243 a0130000 00000000 00000600 00000000 00000000 00000000 000000
ffff810206a6e3c0 2085301576 C Bo:4:053:10 0 31 >
ffff810206a6e3c0 2085301591 S Bi:4:053:9 -115 13 <
ffff810206a6e3c0 2085302579 C Bi:4:053:9 0 13 = 55534253 a0130000 00000000 01
ffff810206a6e3c0 2085302592 S Bo:4:053:10 -115 31 = 55534243 a1130000 12000000 80000603 00000012 00000000 00000000 000000
ffff810206a6e3c0 2085303577 C Bo:4:053:10 0 31 >
ffff81018530b900 2085303597 S Bi:4:053:9 -115 18 <
ffff81018530b900 2085304578 C Bi:4:053:9 0 18 = 70000200 0000000a 00000000 3a000000 0000
ffff810206a6e3c0 2085304592 S Bi:4:053:9 -115 13 <
ffff810206a6e3c0 2085305576 C Bi:4:053:9 0 13 = 55534253 a1130000 00000000 00
ffff810206a6e3c0 2087298767 S Bo:4:053:10 -115 31 = 55534243 a2130000 00000000 00000600 00000000 00000000 00000000 000000
ffff810206a6e3c0 2087300691 C Bo:4:053:10 0 31 >
ffff810206a6e3c0 2087300700 S Bi:4:053:9 -115 13 <
ffff810206a6e3c0 2087301688 C Bi:4:053:9 0 13 = 55534253 a2130000 00000000 01
ffff810206a6e3c0 2087301697 S Bo:4:053:10 -115 31 = 55534243 a3130000 12000000 80000603 00000012 00000000 00000000 000000
ffff810206a6e3c0 2087302688 C Bo:4:053:10 0 31 >
ffff81018530b3c0 2087302706 S Bi:4:053:9 -115 18 <
ffff81018530b3c0 2087303688 C Bi:4:053:9 0 18 = 70000200 0000000a 00000000 3a000000 0000
ffff810206a6e3c0 2087303709 S Bi:4:053:9 -115 13 <
ffff810206a6e3c0 2087304690 C Bi:4:053:9 0 13 = 55534253 a3130000 00000000 00
ffff810206a6e3c0 2087304747 S Bo:4:053:10 -115 31 = 55534243 a4130000 00000000 00000600 00000000 00000000 00000000 000000
ffff810206a6e3c0 2087305688 C Bo:4:053:10 0 31 >
ffff810206a6e3c0 2087305695 S Bi:4:053:9 -115 13 <
ffff810206a6e3c0 2087306687 C Bi:4:053:9 0 13 = 55534253 a4130000 00000000 01
ffff810206a6e3c0 2087306696 S Bo:4:053:10 -115 31 = 55534243 a5130000 12000000 80000603 00000012 00000000 00000000 000000
ffff810206a6e3c0 2087307688 C Bo:4:053:10 0 31 >
ffff81018530b3c0 2087307700 S Bi:4:053:9 -115 18 <
ffff81018530b3c0 2087308695 C Bi:4:053:9 0 18 = 70000200 0000000a 00000000 3a000000 0000
ffff810206a6e3c0 2087308711 S Bi:4:053:9 -115 13 <
ffff810206a6e3c0 2087309693 C Bi:4:053:9 0 13 = 55534253 a5130000 00000000 00
ffff810206a6e3c0 2089294790 S Bo:4:053:10 -115 31 = 55534243 a6130000 00000000 00000600 00000000 00000000 00000000 000000
ffff810206a6e3c0 2089296801 C Bo:4:053:10 0 31 >
ffff810206a6e3c0 2089296809 S Bi:4:053:9 -115 13 <
ffff810206a6e3c0 2089297799 C Bi:4:053:9 0 13 = 55534253 a6130000 00000000 01
ffff810206a6e3c0 2089297807 S Bo:4:053:10 -115 31 = 55534243 a7130000 12000000 80000603 00000012 00000000 00000000 000000
ffff810206a6e3c0 2089298802 C Bo:4:053:10 0 31 >
ffff81020e615cc0 2089298813 S Bi:4:053:9 -115 18 <
ffff81020e615cc0 2089299799 C Bi:4:053:9 0 18 = 70000200 0000000a 00000000 3a000000 0000
ffff810206a6e3c0 2089299808 S Bi:4:053:9 -115 13 <
ffff810206a6e3c0 2089300799 C Bi:4:053:9 0 13 = 55534253 a7130000 00000000 00
ffff810206a6e3c0 2089300832 S Bo:4:053:10 -115 31 = 55534243 a8130000 00000000 00000600 00000000 00000000 00000000 000000
ffff810206a6e3c0 2089301799 C Bo:4:053:10 0 31 >
ffff810206a6e3c0 2089301805 S Bi:4:053:9 -115 13 <
ffff810206a6e3c0 2089302799 C Bi:4:053:9 0 13 = 55534253 a8130000 00000000 01
ffff810206a6e3c0 2089302807 S Bo:4:053:10 -115 31 = 55534243 a9130000 12000000 80000603 00000012 00000000 00000000 000000
ffff810206a6e3c0 2089303800 C Bo:4:053:10 0 31 >
ffff81020e615cc0 2089303813 S Bi:4:053:9 -115 18 <
ffff81020e615cc0 2089304799 C Bi:4:053:9 0 18 = 70000200 0000000a 00000000 3a000000 0000
ffff810206a6e3c0 2089304822 S Bi:4:053:9 -115 13 <
ffff810206a6e3c0 2089305802 C Bi:4:053:9 0 13 = 55534253 a9130000 00000000 00
ffff810206a6e3c0 2091294776 S Bo:4:053:10 -115 31 = 55534243 aa130000 00000000 00000600 00000000 00000000 00000000 000000
ffff810206a6e3c0 2091295914 C Bo:4:053:10 0 31 >
ffff810206a6e3c0 2091295923 S Bi:4:053:9 -115 13 <
ffff810206a6e3c0 2091296911 C Bi:4:053:9 0 13 = 55534253 aa130000 00000000 01
ffff810206a6e3c0 2091296919 S Bo:4:053:10 -115 31 = 55534243 ab130000 12000000 80000603 00000012 00000000 00000000 000000
ffff810206a6e3c0 2091297910 C Bo:4:053:10 0 31 >
ffff81020e4b06c0 2091297922 S Bi:4:053:9 -115 18 <
ffff81020e4b06c0 2091298910 C Bi:4:053:9 0 18 = 70000200 0000000a 00000000 3a000000 0000
ffff810206a6e3c0 2091298920 S Bi:4:053:9 -115 13 <
ffff810206a6e3c0 2091299910 C Bi:4:053:9 0 13 = 55534253 ab130000 00000000 00
ffff810206a6e3c0 2091299946 S Bo:4:053:10 -115 31 = 55534243 ac130000 00000000 00000600 00000000 00000000 00000000 000000
ffff810206a6e3c0 2091300910 C Bo:4:053:10 0 31 >
ffff810206a6e3c0 2091300917 S Bi:4:053:9 -115 13 <
ffff810206a6e3c0 2091301910 C Bi:4:053:9 0 13 = 55534253 ac130000 00000000 01
ffff810206a6e3c0 2091301917 S Bo:4:053:10 -115 31 = 55534243 ad130000 12000000 80000603 00000012 00000000 00000000 000000
ffff810206a6e3c0 2091302910 C Bo:4:053:10 0 31 >
ffff81020e4b06c0 2091302939 S Bi:4:053:9 -115 18 <
ffff81020e4b06c0 2091303910 C Bi:4:053:9 0 18 = 70000200 0000000a 00000000 3a000000 0000
ffff810206a6e3c0 2091303919 S Bi:4:053:9 -115 13 <
ffff810206a6e3c0 2091304910 C Bi:4:053:9 0 13 = 55534253 ad130000 00000000 00
ffff810206a6e3c0 2093294776 S Bo:4:053:10 -115 31 = 55534243 ae130000 00000000 00000600 00000000 00000000 00000000 000000
ffff810206a6e3c0 2093296025 C Bo:4:053:10 0 31 >
ffff810206a6e3c0 2093296033 S Bi:4:053:9 -115 13 <
ffff810206a6e3c0 2093297022 C Bi:4:053:9 0 13 = 55534253 ae130000 00000000 01
ffff810206a6e3c0 2093297030 S Bo:4:053:10 -115 31 = 55534243 af130000 12000000 80000603 00000012 00000000 00000000 000000
ffff810206a6e3c0 2093298022 C Bo:4:053:10 0 31 >
ffff81020e4b00c0 2093298032 S Bi:4:053:9 -115 18 <
ffff81020e4b00c0 2093299024 C Bi:4:053:9 0 18 = 70000200 0000000a 00000000 3a000000 0000
ffff810206a6e3c0 2093299035 S Bi:4:053:9 -115 13 <
ffff810206a6e3c0 2093300021 C Bi:4:053:9 0 13 = 55534253 af130000 00000000 00
ffff810206a6e3c0 2093300055 S Bo:4:053:10 -115 31 = 55534243 b0130000 00000000 00000600 00000000 00000000 00000000 000000
ffff810206a6e3c0 2093301022 C Bo:4:053:10 0 31 >
ffff810206a6e3c0 2093301028 S Bi:4:053:9 -115 13 <
ffff810206a6e3c0 2093302021 C Bi:4:053:9 0 13 = 55534253 b0130000 00000000 01
ffff810206a6e3c0 2093302028 S Bo:4:053:10 -115 31 = 55534243 b1130000 12000000 80000603 00000012 00000000 00000000 000000
ffff810206a6e3c0 2093303022 C Bo:4:053:10 0 31 >
ffff81020e4b00c0 2093303030 S Bi:4:053:9 -115 18 <
ffff81020e4b00c0 2093304021 C Bi:4:053:9 0 18 = 70000200 0000000a 00000000 3a000000 0000
ffff810206a6e3c0 2093304028 S Bi:4:053:9 -115 13 <
ffff810206a6e3c0 2093305022 C Bi:4:053:9 0 13 = 55534253 b1130000 00000000 00
ffff810206a6e3c0 2095294789 S Bo:4:053:10 -115 31 = 55534243 b2130000 00000000 00000600 00000000 00000000 00000000 000000
ffff810206a6e3c0 2095296138 C Bo:4:053:10 0 31 >
ffff810206a6e3c0 2095296153 S Bi:4:053:9 -115 13 <
ffff810206a6e3c0 2095297141 C Bi:4:053:9 0 13 = 55534253 b2130000 00000000 01
ffff810206a6e3c0 2095297157 S Bo:4:053:10 -115 31 = 55534243 b3130000 12000000 80000603 00000012 00000000 00000000 000000
ffff810206a6e3c0 2095298138 C Bo:4:053:10 0 31 >
ffff8101481c9300 2095298152 S Bi:4:053:9 -115 18 <
ffff8101481c9300 2095299137 C Bi:4:053:9 0 18 = 70000200 0000000a 00000000 3a000000 0000
ffff810206a6e3c0 2095299150 S Bi:4:053:9 -115 13 <
ffff810206a6e3c0 2095300135 C Bi:4:053:9 0 13 = 55534253 b3130000 00000000 00
ffff810206a6e3c0 2095300186 S Bo:4:053:10 -115 31 = 55534243 b4130000 00000000 00000600 00000000 00000000 00000000 000000
ffff810206a6e3c0 2095301138 C Bo:4:053:10 0 31 >
ffff810206a6e3c0 2095301146 S Bi:4:053:9 -115 13 <
ffff810206a6e3c0 2095302139 C Bi:4:053:9 0 13 = 55534253 b4130000 00000000 01
ffff810206a6e3c0 2095302151 S Bo:4:053:10 -115 31 = 55534243 b5130000 12000000 80000603 00000012 00000000 00000000 000000
ffff810206a6e3c0 2095303134 C Bo:4:053:10 0 31 >
ffff8101481c9300 2095303143 S Bi:4:053:9 -115 18 <
ffff8101481c9300 2095304134 C Bi:4:053:9 0 18 = 70000200 0000000a 00000000 3a000000 0000
ffff810206a6e3c0 2095304143 S Bi:4:053:9 -115 13 <
ffff810206a6e3c0 2095305134 C Bi:4:053:9 0 13 = 55534253 b5130000 00000000 00
ffff810206a6e3c0 2097294967 S Bo:4:053:10 -115 31 = 55534243 b6130000 00000000 00000600 00000000 00000000 00000000 000000
ffff810206a6e3c0 2097296249 C Bo:4:053:10 0 31 >
ffff810206a6e3c0 2097296266 S Bi:4:053:9 -115 13 <
ffff810206a6e3c0 2097297247 C Bi:4:053:9 0 13 = 55534253 b6130000 00000000 01
ffff810206a6e3c0 2097297260 S Bo:4:053:10 -115 31 = 55534243 b7130000 12000000 80000603 00000012 00000000 00000000 000000
ffff810206a6e3c0 2097298244 C Bo:4:053:10 0 31 >
ffff8101481c9300 2097298256 S Bi:4:053:9 -115 18 <
ffff8101481c9300 2097299244 C Bi:4:053:9 0 18 = 70000200 0000000a 00000000 3a000000 0000
ffff810206a6e3c0 2097299254 S Bi:4:053:9 -115 13 <
ffff810206a6e3c0 2097300244 C Bi:4:053:9 0 13 = 55534253 b7130000 00000000 00
ffff810206a6e3c0 2097300290 S Bo:4:053:10 -115 31 = 55534243 b8130000 00000000 00000600 00000000 00000000 00000000 000000
ffff810206a6e3c0 2097301244 C Bo:4:053:10 0 31 >
ffff810206a6e3c0 2097301250 S Bi:4:053:9 -115 13 <
ffff810206a6e3c0 2097302244 C Bi:4:053:9 0 13 = 55534253 b8130000 00000000 01
ffff810206a6e3c0 2097302251 S Bo:4:053:10 -115 31 = 55534243 b9130000 12000000 80000603 00000012 00000000 00000000 000000
ffff810206a6e3c0 2097303245 C Bo:4:053:10 0 31 >
ffff8101481c9300 2097303253 S Bi:4:053:9 -115 18 <
ffff8101481c9300 2097304244 C Bi:4:053:9 0 18 = 70000200 0000000a 00000000 3a000000 0000
ffff810206a6e3c0 2097304251 S Bi:4:053:9 -115 13 <
ffff810206a6e3c0 2097305245 C Bi:4:053:9 0 13 = 55534253 b9130000 00000000 00
ffff810206a6e3c0 2099294785 S Bo:4:053:10 -115 31 = 55534243 ba130000 00000000 00000600 00000000 00000000 00000000 000000
ffff810206a6e3c0 2099296360 C Bo:4:053:10 0 31 >
ffff810206a6e3c0 2099296378 S Bi:4:053:9 -115 13 <
ffff810206a6e3c0 2099297359 C Bi:4:053:9 0 13 = 55534253 ba130000 00000000 01
ffff810206a6e3c0 2099297372 S Bo:4:053:10 -115 31 = 55534243 bb130000 12000000 80000603 00000012 00000000 00000000 000000
ffff810206a6e3c0 2099298356 C Bo:4:053:10 0 31 >
ffff8101f46dc0c0 2099298369 S Bi:4:053:9 -115 18 <
ffff8101f46dc0c0 2099299355 C Bi:4:053:9 0 18 = 70000200 0000000a 00000000 3a000000 0000
ffff810206a6e3c0 2099299365 S Bi:4:053:9 -115 13 <
ffff810206a6e3c0 2099300356 C Bi:4:053:9 0 13 = 55534253 bb130000 00000000 00
ffff810206a6e3c0 2099300402 S Bo:4:053:10 -115 31 = 55534243 bc130000 00000000 00000600 00000000 00000000 00000000 000000
ffff810206a6e3c0 2099301356 C Bo:4:053:10 0 31 >
ffff810206a6e3c0 2099301363 S Bi:4:053:9 -115 13 <
ffff810206a6e3c0 2099302356 C Bi:4:053:9 0 13 = 55534253 bc130000 00000000 01
ffff810206a6e3c0 2099302364 S Bo:4:053:10 -115 31 = 55534243 bd130000 12000000 80000603 00000012 00000000 00000000 000000
ffff810206a6e3c0 2099303356 C Bo:4:053:10 0 31 >
ffff8101f46dc0c0 2099303364 S Bi:4:053:9 -115 18 <
ffff8101f46dc0c0 2099304355 C Bi:4:053:9 0 18 = 70000200 0000000a 00000000 3a000000 0000
ffff810206a6e3c0 2099304364 S Bi:4:053:9 -115 13 <
ffff810206a6e3c0 2099305356 C Bi:4:053:9 0 13 = 55534253 bd130000 00000000 00
ffff810206a6e3c0 2101294787 S Bo:4:053:10 -115 31 = 55534243 be130000 00000000 00000600 00000000 00000000 00000000 000000
ffff810206a6e3c0 2101296472 C Bo:4:053:10 0 31 >
ffff810206a6e3c0 2101296481 S Bi:4:053:9 -115 13 <
ffff810206a6e3c0 2101297468 C Bi:4:053:9 0 13 = 55534253 be130000 00000000 01
ffff810206a6e3c0 2101297493 S Bo:4:053:10 -115 31 = 55534243 bf130000 12000000 80000603 00000012 00000000 00000000 000000
ffff810206a6e3c0 2101298474 C Bo:4:053:10 0 31 >
ffff8101f46dc0c0 2101298500 S Bi:4:053:9 -115 18 <
ffff8101f46dc0c0 2101299472 C Bi:4:053:9 0 18 = 70000200 0000000a 00000000 3a000000 0000
ffff810206a6e3c0 2101299519 S Bi:4:053:9 -115 13 <
ffff810206a6e3c0 2101300467 C Bi:4:053:9 0 13 = 55534253 bf130000 00000000 00
ffff810206a6e3c0 2101300541 S Bo:4:053:10 -115 31 = 55534243 c0130000 00000000 00000600 00000000 00000000 00000000 000000
ffff810206a6e3c0 2101301466 C Bo:4:053:10 0 31 >
ffff810206a6e3c0 2101301491 S Bi:4:053:9 -115 13 <
ffff810206a6e3c0 2101302466 C Bi:4:053:9 0 13 = 55534253 c0130000 00000000 01
ffff810206a6e3c0 2101302489 S Bo:4:053:10 -115 31 = 55534243 c1130000 12000000 80000603 00000012 00000000 00000000 000000
ffff810206a6e3c0 2101303467 C Bo:4:053:10 0 31 >
ffff8101f46dc0c0 2101303493 S Bi:4:053:9 -115 18 <
ffff8101f46dc0c0 2101304467 C Bi:4:053:9 0 18 = 70000200 0000000a 00000000 3a000000 0000
ffff810206a6e3c0 2101304478 S Bi:4:053:9 -115 13 <
ffff810206a6e3c0 2101305467 C Bi:4:053:9 0 13 = 55534253 c1130000 00000000 00
ffff810206a6e3c0 2103294776 S Bo:4:053:10 -115 31 = 55534243 c2130000 00000000 00000600 00000000 00000000 00000000 000000
ffff810206a6e3c0 2103296581 C Bo:4:053:10 0 31 >
ffff810206a6e3c0 2103296590 S Bi:4:053:9 -115 13 <
ffff810206a6e3c0 2103297579 C Bi:4:053:9 0 13 = 55534253 c2130000 00000000 01
ffff810206a6e3c0 2103297600 S Bo:4:053:10 -115 31 = 55534243 c3130000 12000000 80000603 00000012 00000000 00000000 000000
ffff810206a6e3c0 2103298579 C Bo:4:053:10 0 31 >
ffff81019bd8a0c0 2103298597 S Bi:4:053:9 -115 18 <
ffff81019bd8a0c0 2103299583 C Bi:4:053:9 0 18 = 70000200 0000000a 00000000 3a000000 0000
ffff810206a6e3c0 2103299598 S Bi:4:053:9 -115 13 <
ffff810206a6e3c0 2103300579 C Bi:4:053:9 0 13 = 55534253 c3130000 00000000 00
ffff810206a6e3c0 2103300626 S Bo:4:053:10 -115 31 = 55534243 c4130000 00000000 00000600 00000000 00000000 00000000 000000
ffff810206a6e3c0 2103301579 C Bo:4:053:10 0 31 >
ffff810206a6e3c0 2103301585 S Bi:4:053:9 -115 13 <
ffff810206a6e3c0 2103302578 C Bi:4:053:9 0 13 = 55534253 c4130000 00000000 01
ffff810206a6e3c0 2103302585 S Bo:4:053:10 -115 31 = 55534243 c5130000 12000000 80000603 00000012 00000000 00000000 000000
ffff810206a6e3c0 2103303578 C Bo:4:053:10 0 31 >
ffff81019bd8a0c0 2103303586 S Bi:4:053:9 -115 18 <
ffff81019bd8a0c0 2103304578 C Bi:4:053:9 0 18 = 70000200 0000000a 00000000 3a000000 0000
ffff810206a6e3c0 2103304586 S Bi:4:053:9 -115 13 <
ffff810206a6e3c0 2103305579 C Bi:4:053:9 0 13 = 55534253 c5130000 00000000 00
ffff810206a6e3c0 2105294777 S Bo:4:053:10 -115 31 = 55534243 c6130000 00000000 00000600 00000000 00000000 00000000 000000
ffff810206a6e3c0 2105296695 C Bo:4:053:10 0 31 >
ffff810206a6e3c0 2105296710 S Bi:4:053:9 -115 13 <
ffff810206a6e3c0 2105297691 C Bi:4:053:9 0 13 = 55534253 c6130000 00000000 01
ffff810206a6e3c0 2105297712 S Bo:4:053:10 -115 31 = 55534243 c7130000 12000000 80000603 00000012 00000000 00000000 000000
ffff810206a6e3c0 2105298693 C Bo:4:053:10 0 31 >
ffff8101481aab40 2105298712 S Bi:4:053:9 -115 18 <
ffff8101481aab40 2105299695 C Bi:4:053:9 0 18 = 70000200 0000000a 00000000 3a000000 0000
ffff810206a6e3c0 2105299830 S Bi:4:053:9 -115 13 <
ffff810206a6e3c0 2105300695 C Bi:4:053:9 0 13 = 55534253 c7130000 00000000 00
ffff810206a6e3c0 2105300750 S Bo:4:053:10 -115 31 = 55534243 c8130000 00000000 00000600 00000000 00000000 00000000 000000
ffff810206a6e3c0 2105301695 C Bo:4:053:10 0 31 >
ffff810206a6e3c0 2105301703 S Bi:4:053:9 -115 13 <
ffff810206a6e3c0 2105302692 C Bi:4:053:9 0 13 = 55534253 c8130000 00000000 01
ffff810206a6e3c0 2105302702 S Bo:4:053:10 -115 31 = 55534243 c9130000 12000000 80000603 00000012 00000000 00000000 000000
ffff810206a6e3c0 2105303691 C Bo:4:053:10 0 31 >
ffff8101481aab40 2105303701 S Bi:4:053:9 -115 18 <
ffff8101481aab40 2105304692 C Bi:4:053:9 0 18 = 70000200 0000000a 00000000 3a000000 0000
ffff810206a6e3c0 2105304702 S Bi:4:053:9 -115 13 <
ffff810206a6e3c0 2105305692 C Bi:4:053:9 0 13 = 55534253 c9130000 00000000 00
ffff810206a6e3c0 2107294798 S Bo:4:053:10 -115 31 = 55534243 ca130000 00000000 00000600 00000000 00000000 00000000 000000
ffff810206a6e3c0 2107296802 C Bo:4:053:10 0 31 >
ffff810206a6e3c0 2107296809 S Bi:4:053:9 -115 13 <
ffff810206a6e3c0 2107297801 C Bi:4:053:9 0 13 = 55534253 ca130000 00000000 01
ffff810206a6e3c0 2107297809 S Bo:4:053:10 -115 31 = 55534243 cb130000 12000000 80000603 00000012 00000000 00000000 000000
ffff810206a6e3c0 2107298801 C Bo:4:053:10 0 31 >
ffff8100896d1cc0 2107298812 S Bi:4:053:9 -115 18 <
ffff8100896d1cc0 2107299802 C Bi:4:053:9 0 18 = 70000200 0000000a 00000000 3a000000 0000
ffff810206a6e3c0 2107299815 S Bi:4:053:9 -115 13 <
ffff810206a6e3c0 2107300801 C Bi:4:053:9 0 13 = 55534253 cb130000 00000000 00
ffff810206a6e3c0 2107300845 S Bo:4:053:10 -115 31 = 55534243 cc130000 00000000 00000600 00000000 00000000 00000000 000000
ffff810206a6e3c0 2107301809 C Bo:4:053:10 0 31 >
ffff810206a6e3c0 2107301822 S Bi:4:053:9 -115 13 <
ffff810206a6e3c0 2107302807 C Bi:4:053:9 0 13 = 55534253 cc130000 00000000 01
ffff810206a6e3c0 2107302823 S Bo:4:053:10 -115 31 = 55534243 cd130000 12000000 80000603 00000012 00000000 00000000 000000
ffff810206a6e3c0 2107303801 C Bo:4:053:10 0 31 >
ffff8100896d1cc0 2107303813 S Bi:4:053:9 -115 18 <
ffff8100896d1cc0 2107304801 C Bi:4:053:9 0 18 = 70000200 0000000a 00000000 3a000000 0000
ffff810206a6e3c0 2107304810 S Bi:4:053:9 -115 13 <
ffff810206a6e3c0 2107305801 C Bi:4:053:9 0 13 = 55534253 cd130000 00000000 00
ffff810206a6e3c0 2109294793 S Bo:4:053:10 -115 31 = 55534243 ce130000 00000000 00000600 00000000 00000000 00000000 000000
ffff810206a6e3c0 2109295915 C Bo:4:053:10 0 31 >
ffff810206a6e3c0 2109295934 S Bi:4:053:9 -115 13 <
ffff810206a6e3c0 2109296914 C Bi:4:053:9 0 13 = 55534253 ce130000 00000000 01
ffff810206a6e3c0 2109296926 S Bo:4:053:10 -115 31 = 55534243 cf130000 12000000 80000603 00000012 00000000 00000000 000000
ffff810206a6e3c0 2109297912 C Bo:4:053:10 0 31 >
ffff8101481aa840 2109297923 S Bi:4:053:9 -115 18 <
ffff8101481aa840 2109298912 C Bi:4:053:9 0 18 = 70000200 0000000a 00000000 3a000000 0000
ffff810206a6e3c0 2109298923 S Bi:4:053:9 -115 13 <
ffff810206a6e3c0 2109299913 C Bi:4:053:9 0 13 = 55534253 cf130000 00000000 00
ffff810206a6e3c0 2109300016 S Bo:4:053:10 -115 31 = 55534243 d0130000 00000000 00000600 00000000 00000000 00000000 000000
ffff810206a6e3c0 2109300913 C Bo:4:053:10 0 31 >
ffff810206a6e3c0 2109300919 S Bi:4:053:9 -115 13 <
ffff810206a6e3c0 2109301912 C Bi:4:053:9 0 13 = 55534253 d0130000 00000000 01
ffff810206a6e3c0 2109301919 S Bo:4:053:10 -115 31 = 55534243 d1130000 12000000 80000603 00000012 00000000 00000000 000000
ffff810206a6e3c0 2109302912 C Bo:4:053:10 0 31 >
ffff8101481aa840 2109302921 S Bi:4:053:9 -115 18 <
ffff8101481aa840 2109303913 C Bi:4:053:9 0 18 = 70000200 0000000a 00000000 3a000000 0000
ffff810206a6e3c0 2109303921 S Bi:4:053:9 -115 13 <
ffff810206a6e3c0 2109304913 C Bi:4:053:9 0 13 = 55534253 d1130000 00000000 00
ffff810206a6e3c0 2111296028 S Bo:4:053:10 -115 31 = 55534243 d2130000 00000000 00000600 00000000 00000000 00000000 000000
ffff810206a6e3c0 2111298028 C Bo:4:053:10 0 31 >
ffff810206a6e3c0 2111298039 S Bi:4:053:9 -115 13 <
ffff810206a6e3c0 2111299026 C Bi:4:053:9 0 13 = 55534253 d2130000 00000000 01
ffff810206a6e3c0 2111299036 S Bo:4:053:10 -115 31 = 55534243 d3130000 12000000 80000603 00000012 00000000 00000000 000000
ffff810206a6e3c0 2111300024 C Bo:4:053:10 0 31 >
ffff8101480a6600 2111300036 S Bi:4:053:9 -115 18 <
ffff8101480a6600 2111301024 C Bi:4:053:9 0 18 = 70000200 0000000a 00000000 3a000000 0000
ffff810206a6e3c0 2111301035 S Bi:4:053:9 -115 13 <
ffff810206a6e3c0 2111302024 C Bi:4:053:9 0 13 = 55534253 d3130000 00000000 00
ffff810206a6e3c0 2111302076 S Bo:4:053:10 -115 31 = 55534243 d4130000 00000000 00000600 00000000 00000000 00000000 000000
ffff810206a6e3c0 2111303024 C Bo:4:053:10 0 31 >
ffff810206a6e3c0 2111303036 S Bi:4:053:9 -115 13 <
ffff810206a6e3c0 2111304023 C Bi:4:053:9 0 13 = 55534253 d4130000 00000000 01
ffff810206a6e3c0 2111304039 S Bo:4:053:10 -115 31 = 55534243 d5130000 12000000 80000603 00000012 00000000 00000000 000000
ffff810206a6e3c0 2111305024 C Bo:4:053:10 0 31 >
ffff8101480a6480 2111305036 S Bi:4:053:9 -115 18 <
ffff8101480a6480 2111306024 C Bi:4:053:9 0 18 = 70000200 0000000a 00000000 3a000000 0000
ffff810206a6e3c0 2111306037 S Bi:4:053:9 -115 13 <
ffff810206a6e3c0 2111307025 C Bi:4:053:9 0 13 = 55534253 d5130000 00000000 00
ffff810206a6e3c0 2113294826 S Bo:4:053:10 -115 31 = 55534243 d6130000 00000000 00000600 00000000 00000000 00000000 000000
ffff810206a6e3c0 2113296141 C Bo:4:053:10 0 31 >
ffff810206a6e3c0 2113296150 S Bi:4:053:9 -115 13 <
ffff810206a6e3c0 2113297136 C Bi:4:053:9 0 13 = 55534253 d6130000 00000000 01
ffff810206a6e3c0 2113297145 S Bo:4:053:10 -115 31 = 55534243 d7130000 12000000 80000603 00000012 00000000 00000000 000000
ffff810206a6e3c0 2113298135 C Bo:4:053:10 0 31 >
ffff81019bd72000 2113298145 S Bi:4:053:9 -115 18 <
ffff81019bd72000 2113299135 C Bi:4:053:9 0 18 = 70000200 0000000a 00000000 3a000000 0000
ffff810206a6e3c0 2113299157 S Bi:4:053:9 -115 13 <
ffff810206a6e3c0 2113300137 C Bi:4:053:9 0 13 = 55534253 d7130000 00000000 00
ffff810206a6e3c0 2113300190 S Bo:4:053:10 -115 31 = 55534243 d8130000 00000000 00000600 00000000 00000000 00000000 000000
ffff810206a6e3c0 2113301135 C Bo:4:053:10 0 31 >
ffff810206a6e3c0 2113301142 S Bi:4:053:9 -115 13 <
ffff810206a6e3c0 2113302135 C Bi:4:053:9 0 13 = 55534253 d8130000 00000000 01
ffff810206a6e3c0 2113302142 S Bo:4:053:10 -115 31 = 55534243 d9130000 12000000 80000603 00000012 00000000 00000000 000000
ffff810206a6e3c0 2113303135 C Bo:4:053:10 0 31 >
ffff81019bd72000 2113303146 S Bi:4:053:9 -115 18 <
ffff81019bd72000 2113304135 C Bi:4:053:9 0 18 = 70000200 0000000a 00000000 3a000000 0000
ffff810206a6e3c0 2113304143 S Bi:4:053:9 -115 13 <
ffff810206a6e3c0 2113305135 C Bi:4:053:9 0 13 = 55534253 d9130000 00000000 00
ffff810206a6e3c0 2115294689 S Bo:4:053:10 -115 31 = 55534243 da130000 00000000 00000600 00000000 00000000 00000000 000000
ffff810206a6e3c0 2115296251 C Bo:4:053:10 0 31 >
ffff810206a6e3c0 2115296260 S Bi:4:053:9 -115 13 <
ffff810206a6e3c0 2115297254 C Bi:4:053:9 0 13 = 55534253 da130000 00000000 01
ffff810206a6e3c0 2115297269 S Bo:4:053:10 -115 31 = 55534243 db130000 12000000 80000603 00000012 00000000 00000000 000000
ffff810206a6e3c0 2115298251 C Bo:4:053:10 0 31 >
ffff81012cb183c0 2115298264 S Bi:4:053:9 -115 18 <
ffff81012cb183c0 2115299249 C Bi:4:053:9 0 18 = 70000200 0000000a 00000000 3a000000 0000
ffff810206a6e3c0 2115299276 S Bi:4:053:9 -115 13 <
ffff810206a6e3c0 2115300246 C Bi:4:053:9 0 13 = 55534253 db130000 00000000 00
ffff810206a6e3c0 2115300295 S Bo:4:053:10 -115 31 = 55534243 dc130000 00000000 00000600 00000000 00000000 00000000 000000
ffff810206a6e3c0 2115301246 C Bo:4:053:10 0 31 >
ffff810206a6e3c0 2115301265 S Bi:4:053:9 -115 13 <
ffff810206a6e3c0 2115302246 C Bi:4:053:9 0 13 = 55534253 dc130000 00000000 01
ffff810206a6e3c0 2115302254 S Bo:4:053:10 -115 31 = 55534243 dd130000 12000000 80000603 00000012 00000000 00000000 000000
ffff810206a6e3c0 2115303247 C Bo:4:053:10 0 31 >
ffff81012cb183c0 2115303255 S Bi:4:053:9 -115 18 <
ffff81012cb183c0 2115304255 C Bi:4:053:9 0 18 = 70000200 0000000a 00000000 3a000000 0000
ffff810206a6e3c0 2115304269 S Bi:4:053:9 -115 13 <
ffff810206a6e3c0 2115305252 C Bi:4:053:9 0 13 = 55534253 dd130000 00000000 00
ffff810206a6e3c0 2117294775 S Bo:4:053:10 -115 31 = 55534243 de130000 00000000 00000600 00000000 00000000 00000000 000000
ffff810206a6e3c0 2117296362 C Bo:4:053:10 0 31 >
ffff810206a6e3c0 2117296372 S Bi:4:053:9 -115 13 <
ffff810206a6e3c0 2117297359 C Bi:4:053:9 0 13 = 55534253 de130000 00000000 01
ffff810206a6e3c0 2117297368 S Bo:4:053:10 -115 31 = 55534243 df130000 12000000 80000603 00000012 00000000 00000000 000000
ffff810206a6e3c0 2117298358 C Bo:4:053:10 0 31 >
ffff8101eb43f780 2117298370 S Bi:4:053:9 -115 18 <
ffff8101eb43f780 2117299361 C Bi:4:053:9 0 18 = 70000200 0000000a 00000000 3a000000 0000
ffff810206a6e3c0 2117299372 S Bi:4:053:9 -115 13 <
ffff810206a6e3c0 2117300360 C Bi:4:053:9 0 13 = 55534253 df130000 00000000 00
ffff810206a6e3c0 2117300398 S Bo:4:053:10 -115 31 = 55534243 e0130000 00000000 00000600 00000000 00000000 00000000 000000
ffff810206a6e3c0 2117301361 C Bo:4:053:10 0 31 >
ffff810206a6e3c0 2117301371 S Bi:4:053:9 -115 13 <
ffff810206a6e3c0 2117302364 C Bi:4:053:9 0 13 = 55534253 e0130000 00000000 01
ffff810206a6e3c0 2117302389 S Bo:4:053:10 -115 31 = 55534243 e1130000 12000000 80000603 00000012 00000000 00000000 000000
ffff810206a6e3c0 2117303364 C Bo:4:053:10 0 31 >
ffff810089b19d80 2117303675 S Bi:4:053:9 -115 18 <
ffff810089b19d80 2117304359 C Bi:4:053:9 0 18 = 70000200 0000000a 00000000 3a000000 0000
ffff810206a6e3c0 2117304385 S Bi:4:053:9 -115 13 <
ffff810206a6e3c0 2117305361 C Bi:4:053:9 0 13 = 55534253 e1130000 00000000 00
ffff810206a6e3c0 2119294778 S Bo:4:053:10 -115 31 = 55534243 e2130000 00000000 00000600 00000000 00000000 00000000 000000
ffff810206a6e3c0 2119296475 C Bo:4:053:10 0 31 >
ffff810206a6e3c0 2119296490 S Bi:4:053:9 -115 13 <
ffff810206a6e3c0 2119297470 C Bi:4:053:9 0 13 = 55534253 e2130000 00000000 01
ffff810206a6e3c0 2119297494 S Bo:4:053:10 -115 31 = 55534243 e3130000 12000000 80000603 00000012 00000000 00000000 000000
ffff810206a6e3c0 2119298470 C Bo:4:053:10 0 31 >
ffff8101480a6b40 2119298495 S Bi:4:053:9 -115 18 <
ffff8101480a6b40 2119299470 C Bi:4:053:9 0 18 = 70000200 0000000a 00000000 3a000000 0000
ffff810206a6e3c0 2119299494 S Bi:4:053:9 -115 13 <
ffff810206a6e3c0 2119300473 C Bi:4:053:9 0 13 = 55534253 e3130000 00000000 00
ffff810206a6e3c0 2119300545 S Bo:4:053:10 -115 31 = 55534243 e4130000 00000000 00000600 00000000 00000000 00000000 000000
ffff810206a6e3c0 2119301474 C Bo:4:053:10 0 31 >
ffff810206a6e3c0 2119301496 S Bi:4:053:9 -115 13 <
ffff810206a6e3c0 2119302473 C Bi:4:053:9 0 13 = 55534253 e4130000 00000000 01
ffff810206a6e3c0 2119302497 S Bo:4:053:10 -115 31 = 55534243 e5130000 12000000 80000603 00000012 00000000 00000000 000000
ffff810206a6e3c0 2119302738 C Bo:4:053:10 0 31 >
ffff8101480a6b40 2119302755 S Bi:4:053:9 -115 18 <
ffff8101480a6b40 2119303475 C Bi:4:053:9 0 18 = 70000200 0000000a 00000000 3a000000 0000
ffff810206a6e3c0 2119304034 S Bi:4:053:9 -115 13 <
ffff810206a6e3c0 2119304473 C Bi:4:053:9 0 13 = 55534253 e5130000 00000000 00
ffff810206a6e3c0 2121294775 S Bo:4:053:10 -115 31 = 55534243 e6130000 00000000 00000600 00000000 00000000 00000000 000000
ffff810206a6e3c0 2121296585 C Bo:4:053:10 0 31 >
ffff810206a6e3c0 2121296596 S Bi:4:053:9 -115 13 <
ffff810206a6e3c0 2121297581 C Bi:4:053:9 0 13 = 55534253 e6130000 00000000 01
ffff810206a6e3c0 2121297589 S Bo:4:053:10 -115 31 = 55534243 e7130000 12000000 80000603 00000012 00000000 00000000 000000
ffff810206a6e3c0 2121298581 C Bo:4:053:10 0 31 >
ffff81012134ae40 2121298592 S Bi:4:053:9 -115 18 <
ffff81012134ae40 2121299581 C Bi:4:053:9 0 18 = 70000200 0000000a 00000000 3a000000 0000
ffff810206a6e3c0 2121299591 S Bi:4:053:9 -115 13 <
ffff810206a6e3c0 2121300580 C Bi:4:053:9 0 13 = 55534253 e7130000 00000000 00
ffff810206a6e3c0 2121300615 S Bo:4:053:10 -115 31 = 55534243 e8130000 00000000 00000600 00000000 00000000 00000000 000000
ffff810206a6e3c0 2121301580 C Bo:4:053:10 0 31 >
ffff810206a6e3c0 2121301586 S Bi:4:053:9 -115 13 <
ffff810206a6e3c0 2121302580 C Bi:4:053:9 0 13 = 55534253 e8130000 00000000 01
ffff810206a6e3c0 2121302587 S Bo:4:053:10 -115 31 = 55534243 e9130000 12000000 80000603 00000012 00000000 00000000 000000
ffff810206a6e3c0 2121303581 C Bo:4:053:10 0 31 >
ffff81012134ad80 2121303945 S Bi:4:053:9 -115 18 <
ffff81012134ad80 2121304580 C Bi:4:053:9 0 18 = 70000200 0000000a 00000000 3a000000 0000
ffff810206a6e3c0 2121304589 S Bi:4:053:9 -115 13 <
ffff810206a6e3c0 2121305581 C Bi:4:053:9 0 13 = 55534253 e9130000 00000000 00
ffff810206a6e3c0 2123294779 S Bo:4:053:10 -115 31 = 55534243 ea130000 00000000 00000600 00000000 00000000 00000000 000000
ffff810206a6e3c0 2123296696 C Bo:4:053:10 0 31 >
ffff810206a6e3c0 2123296707 S Bi:4:053:9 -115 13 <
ffff810206a6e3c0 2123297693 C Bi:4:053:9 0 13 = 55534253 ea130000 00000000 01
ffff810206a6e3c0 2123297703 S Bo:4:053:10 -115 31 = 55534243 eb130000 12000000 80000603 00000012 00000000 00000000 000000
ffff810206a6e3c0 2123298693 C Bo:4:053:10 0 31 >
ffff8101f4758c00 2123298706 S Bi:4:053:9 -115 18 <
ffff8101f4758c00 2123299694 C Bi:4:053:9 0 18 = 70000200 0000000a 00000000 3a000000 0000
ffff810206a6e3c0 2123299706 S Bi:4:053:9 -115 13 <
ffff810206a6e3c0 2123300692 C Bi:4:053:9 0 13 = 55534253 eb130000 00000000 00
ffff810206a6e3c0 2123300728 S Bo:4:053:10 -115 31 = 55534243 ec130000 00000000 00000600 00000000 00000000 00000000 000000
ffff810206a6e3c0 2123301692 C Bo:4:053:10 0 31 >
ffff810206a6e3c0 2123301699 S Bi:4:053:9 -115 13 <
ffff810206a6e3c0 2123302692 C Bi:4:053:9 0 13 = 55534253 ec130000 00000000 01
ffff810206a6e3c0 2123302700 S Bo:4:053:10 -115 31 = 55534243 ed130000 12000000 80000603 00000012 00000000 00000000 000000
ffff810206a6e3c0 2123303692 C Bo:4:053:10 0 31 >
ffff8101f47589c0 2123303992 S Bi:4:053:9 -115 18 <
ffff8101f47589c0 2123304694 C Bi:4:053:9 0 18 = 70000200 0000000a 00000000 3a000000 0000
ffff810206a6e3c0 2123304720 S Bi:4:053:9 -115 13 <
ffff810206a6e3c0 2123305693 C Bi:4:053:9 0 13 = 55534253 ed130000 00000000 00
ffff810206a6e3c0 2125294787 S Bo:4:053:10 -115 31 = 55534243 ee130000 00000000 00000600 00000000 00000000 00000000 000000
ffff810206a6e3c0 2125295808 C Bo:4:053:10 0 31 >
ffff810206a6e3c0 2125295853 S Bi:4:053:9 -115 13 <
ffff810206a6e3c0 2125296804 C Bi:4:053:9 0 13 = 55534253 ee130000 00000000 01
ffff810206a6e3c0 2125296815 S Bo:4:053:10 -115 31 = 55534243 ef130000 12000000 80000603 00000012 00000000 00000000 000000
ffff810206a6e3c0 2125297803 C Bo:4:053:10 0 31 >
ffff8102139b8c00 2125297814 S Bi:4:053:9 -115 18 <
ffff8102139b8c00 2125298803 C Bi:4:053:9 0 18 = 70000200 0000000a 00000000 3a000000 0000
ffff810206a6e3c0 2125298814 S Bi:4:053:9 -115 13 <
ffff810206a6e3c0 2125299803 C Bi:4:053:9 0 13 = 55534253 ef130000 00000000 00
ffff810206a6e3c0 2125299847 S Bo:4:053:10 -115 31 = 55534243 f0130000 00000000 00000600 00000000 00000000 00000000 000000
ffff810206a6e3c0 2125300803 C Bo:4:053:10 0 31 >
ffff810206a6e3c0 2125300808 S Bi:4:053:9 -115 13 <
ffff810206a6e3c0 2125301803 C Bi:4:053:9 0 13 = 55534253 f0130000 00000000 01
ffff810206a6e3c0 2125301810 S Bo:4:053:10 -115 31 = 55534243 f1130000 12000000 80000603 00000012 00000000 00000000 000000
ffff810206a6e3c0 2125302804 C Bo:4:053:10 0 31 >
ffff81013212c3c0 2125303997 S Bi:4:053:9 -115 18 <
ffff81013212c3c0 2125304803 C Bi:4:053:9 0 18 = 70000200 0000000a 00000000 3a000000 0000
ffff810206a6e3c0 2125304813 S Bi:4:053:9 -115 13 <
ffff810206a6e3c0 2125305803 C Bi:4:053:9 0 13 = 55534253 f1130000 00000000 00
ffff810206a6e3c0 2127294993 S Bo:4:053:10 -115 31 = 55534243 f2130000 00000000 00000600 00000000 00000000 00000000 000000
ffff810206a6e3c0 2127296917 C Bo:4:053:10 0 31 >
ffff810206a6e3c0 2127296931 S Bi:4:053:9 -115 13 <
ffff810206a6e3c0 2127297915 C Bi:4:053:9 0 13 = 55534253 f2130000 00000000 01
ffff810206a6e3c0 2127297934 S Bo:4:053:10 -115 31 = 55534243 f3130000 12000000 80000603 00000012 00000000 00000000 000000
ffff810206a6e3c0 2127298918 C Bo:4:053:10 0 31 >
ffff8100896d1f00 2127299053 S Bi:4:053:9 -115 18 <
ffff8100896d1f00 2127299914 C Bi:4:053:9 0 18 = 70000200 0000000a 00000000 3a000000 0000
ffff810206a6e3c0 2127299925 S Bi:4:053:9 -115 13 <
ffff810206a6e3c0 2127300915 C Bi:4:053:9 0 13 = 55534253 f3130000 00000000 00
ffff810206a6e3c0 2127300962 S Bo:4:053:10 -115 31 = 55534243 f4130000 00000000 00000600 00000000 00000000 00000000 000000
ffff810206a6e3c0 2127301914 C Bo:4:053:10 0 31 >
ffff810206a6e3c0 2127301920 S Bi:4:053:9 -115 13 <
ffff810206a6e3c0 2127302915 C Bi:4:053:9 0 13 = 55534253 f4130000 00000000 01
ffff810206a6e3c0 2127303986 S Bo:4:053:10 -115 31 = 55534243 f5130000 12000000 80000603 00000012 00000000 00000000 000000
ffff810206a6e3c0 2127304914 C Bo:4:053:10 0 31 >
ffff8100896d1900 2127304923 S Bi:4:053:9 -115 18 <
ffff8100896d1900 2127305915 C Bi:4:053:9 0 18 = 70000200 0000000a 00000000 3a000000 0000
ffff810206a6e3c0 2127305928 S Bi:4:053:9 -115 13 <
ffff810206a6e3c0 2127306915 C Bi:4:053:9 0 13 = 55534253 f5130000 00000000 00
ffff810206a6e3c0 2129294771 S Bo:4:053:10 -115 31 = 55534243 f6130000 00000000 00000600 00000000 00000000 00000000 000000
ffff810206a6e3c0 2129296031 C Bo:4:053:10 0 31 >
ffff810206a6e3c0 2129296055 S Bi:4:053:9 -115 13 <
ffff810206a6e3c0 2129297027 C Bi:4:053:9 0 13 = 55534253 f6130000 00000000 01
ffff810206a6e3c0 2129297051 S Bo:4:053:10 -115 31 = 55534243 f7130000 12000000 80000603 00000012 00000000 00000000 000000
ffff810206a6e3c0 2129298026 C Bo:4:053:10 0 31 >
ffff8101facc1e40 2129298050 S Bi:4:053:9 -115 18 <
ffff8101facc1e40 2129299028 C Bi:4:053:9 0 18 = 70000200 0000000a 00000000 3a000000 0000
ffff810206a6e3c0 2129299056 S Bi:4:053:9 -115 13 <
ffff810206a6e3c0 2129300029 C Bi:4:053:9 0 13 = 55534253 f7130000 00000000 00
ffff810206a6e3c0 2129300079 S Bo:4:053:10 -115 31 = 55534243 f8130000 00000000 00000600 00000000 00000000 00000000 000000
ffff810206a6e3c0 2129301026 C Bo:4:053:10 0 31 >
ffff810206a6e3c0 2129301046 S Bi:4:053:9 -115 13 <
ffff810206a6e3c0 2129302026 C Bi:4:053:9 0 13 = 55534253 f8130000 00000000 01
ffff810206a6e3c0 2129302047 S Bo:4:053:10 -115 31 = 55534243 f9130000 12000000 80000603 00000012 00000000 00000000 000000
ffff810206a6e3c0 2129303028 C Bo:4:053:10 0 31 >
ffff8101df0f60c0 2129303999 S Bi:4:053:9 -115 18 <
ffff8101df0f60c0 2129305027 C Bi:4:053:9 0 18 = 70000200 0000000a 00000000 3a000000 0000
ffff810206a6e3c0 2129305053 S Bi:4:053:9 -115 13 <
ffff810206a6e3c0 2129306027 C Bi:4:053:9 0 13 = 55534253 f9130000 00000000 00
ffff810206a6e3c0 2131294780 S Bo:4:053:10 -115 31 = 55534243 fa130000 00000000 00000600 00000000 00000000 00000000 000000
ffff810206a6e3c0 2131296142 C Bo:4:053:10 0 31 >
ffff810206a6e3c0 2131296152 S Bi:4:053:9 -115 13 <
ffff810206a6e3c0 2131297138 C Bi:4:053:9 0 13 = 55534253 fa130000 00000000 01
ffff810206a6e3c0 2131297146 S Bo:4:053:10 -115 31 = 55534243 fb130000 12000000 80000603 00000012 00000000 00000000 000000
ffff810206a6e3c0 2131298137 C Bo:4:053:10 0 31 >
ffff81019bd720c0 2131298147 S Bi:4:053:9 -115 18 <
ffff81019bd720c0 2131299137 C Bi:4:053:9 0 18 = 70000200 0000000a 00000000 3a000000 0000
ffff810206a6e3c0 2131299147 S Bi:4:053:9 -115 13 <
ffff810206a6e3c0 2131300137 C Bi:4:053:9 0 13 = 55534253 fb130000 00000000 00
ffff810206a6e3c0 2131300172 S Bo:4:053:10 -115 31 = 55534243 fc130000 00000000 00000600 00000000 00000000 00000000 000000
ffff810206a6e3c0 2131301137 C Bo:4:053:10 0 31 >
ffff810206a6e3c0 2131301143 S Bi:4:053:9 -115 13 <
ffff810206a6e3c0 2131302137 C Bi:4:053:9 0 13 = 55534253 fc130000 00000000 01
ffff810206a6e3c0 2131302144 S Bo:4:053:10 -115 31 = 55534243 fd130000 12000000 80000603 00000012 00000000 00000000 000000
ffff810206a6e3c0 2131303138 C Bo:4:053:10 0 31 >
ffff81019bd72000 2131303931 S Bi:4:053:9 -115 18 <
ffff81019bd72000 2131304137 C Bi:4:053:9 0 18 = 70000200 0000000a 00000000 3a000000 0000
ffff810206a6e3c0 2131304146 S Bi:4:053:9 -115 13 <
ffff810206a6e3c0 2131305137 C Bi:4:053:9 0 13 = 55534253 fd130000 00000000 00
ffff810206a6e3c0 2133294826 S Bo:4:053:10 -115 31 = 55534243 fe130000 00000000 00000600 00000000 00000000 00000000 000000
ffff810206a6e3c0 2133296253 C Bo:4:053:10 0 31 >
ffff810206a6e3c0 2133296271 S Bi:4:053:9 -115 13 <
ffff810206a6e3c0 2133297249 C Bi:4:053:9 0 13 = 55534253 fe130000 00000000 01
ffff810206a6e3c0 2133297263 S Bo:4:053:10 -115 31 = 55534243 ff130000 12000000 80000603 00000012 00000000 00000000 000000
ffff810206a6e3c0 2133298248 C Bo:4:053:10 0 31 >
ffff8101fad5c780 2133298261 S Bi:4:053:9 -115 18 <
ffff8101fad5c780 2133299249 C Bi:4:053:9 0 18 = 70000200 0000000a 00000000 3a000000 0000
ffff810206a6e3c0 2133299261 S Bi:4:053:9 -115 13 <
ffff810206a6e3c0 2133300248 C Bi:4:053:9 0 13 = 55534253 ff130000 00000000 00
ffff810206a6e3c0 2133300295 S Bo:4:053:10 -115 31 = 55534243 00140000 00000000 00000600 00000000 00000000 00000000 000000
ffff810206a6e3c0 2133301249 C Bo:4:053:10 0 31 >
ffff810206a6e3c0 2133301273 S Bi:4:053:9 -115 13 <
ffff810206a6e3c0 2133302248 C Bi:4:053:9 0 13 = 55534253 00140000 00000000 01
ffff810206a6e3c0 2133302256 S Bo:4:053:10 -115 31 = 55534243 01140000 12000000 80000603 00000012 00000000 00000000 000000
ffff810206a6e3c0 2133303248 C Bo:4:053:10 0 31 >
ffff8101c07eb300 2133303258 S Bi:4:053:9 -115 18 <
ffff8101c07eb300 2133304252 C Bi:4:053:9 0 18 = 70000200 0000000a 00000000 3a000000 0000
ffff810206a6e3c0 2133304562 S Bi:4:053:9 -115 13 <
ffff810206a6e3c0 2133305250 C Bi:4:053:9 0 13 = 55534253 01140000 00000000 00
ffff810206a6e3c0 2135294797 S Bo:4:053:10 -115 31 = 55534243 02140000 00000000 00000600 00000000 00000000 00000000 000000
ffff810206a6e3c0 2135296362 C Bo:4:053:10 0 31 >
ffff810206a6e3c0 2135296370 S Bi:4:053:9 -115 13 <
ffff810206a6e3c0 2135297364 C Bi:4:053:9 0 13 = 55534253 02140000 00000000 01
ffff810206a6e3c0 2135298170 S Bo:4:053:10 -115 31 = 55534243 03140000 12000000 80000603 00000012 00000000 00000000 000000
ffff810206a6e3c0 2135298362 C Bo:4:053:10 0 31 >
ffff81021300a540 2135298499 S Bi:4:053:9 -115 18 <
ffff81021300a540 2135299361 C Bi:4:053:9 0 18 = 70000200 0000000a 00000000 3a000000 0000
ffff810206a6e3c0 2135299371 S Bi:4:053:9 -115 13 <
ffff810206a6e3c0 2135300359 C Bi:4:053:9 0 13 = 55534253 03140000 00000000 00
ffff810206a6e3c0 2135300422 S Bo:4:053:10 -115 31 = 55534243 04140000 00000000 00000600 00000000 00000000 00000000 000000
ffff810206a6e3c0 2135301359 C Bo:4:053:10 0 31 >
ffff810206a6e3c0 2135301365 S Bi:4:053:9 -115 13 <
ffff810206a6e3c0 2135302360 C Bi:4:053:9 0 13 = 55534253 04140000 00000000 01
ffff810206a6e3c0 2135302366 S Bo:4:053:10 -115 31 = 55534243 05140000 12000000 80000603 00000012 00000000 00000000 000000
ffff810206a6e3c0 2135303361 C Bo:4:053:10 0 31 >
ffff81021300a540 2135303371 S Bi:4:053:9 -115 18 <
ffff81021300a540 2135304360 C Bi:4:053:9 0 18 = 70000200 0000000a 00000000 3a000000 0000
ffff810206a6e3c0 2135304368 S Bi:4:053:9 -115 13 <
ffff810206a6e3c0 2135305360 C Bi:4:053:9 0 13 = 55534253 05140000 00000000 00
ffff810206a6e3c0 2137294779 S Bo:4:053:10 -115 31 = 55534243 06140000 00000000 00000600 00000000 00000000 00000000 000000
ffff810206a6e3c0 2137296479 C Bo:4:053:10 0 31 >
ffff810206a6e3c0 2137296497 S Bi:4:053:9 -115 13 <
ffff810206a6e3c0 2137297476 C Bi:4:053:9 0 13 = 55534253 06140000 00000000 01
ffff810206a6e3c0 2137297641 S Bo:4:053:10 -115 31 = 55534243 07140000 12000000 80000603 00000012 00000000 00000000 000000
ffff810206a6e3c0 2137298472 C Bo:4:053:10 0 31 >
ffff81020441b180 2137298484 S Bi:4:053:9 -115 18 <
ffff81020441b180 2137299471 C Bi:4:053:9 0 18 = 70000200 0000000a 00000000 3a000000 0000
ffff810206a6e3c0 2137299480 S Bi:4:053:9 -115 13 <
ffff810206a6e3c0 2137300470 C Bi:4:053:9 0 13 = 55534253 07140000 00000000 00
ffff810206a6e3c0 2137300515 S Bo:4:053:10 -115 31 = 55534243 08140000 00000000 00000600 00000000 00000000 00000000 000000
ffff810206a6e3c0 2137301475 C Bo:4:053:10 0 31 >
ffff810206a6e3c0 2137301639 S Bi:4:053:9 -115 13 <
ffff810206a6e3c0 2137302478 C Bi:4:053:9 0 13 = 55534253 08140000 00000000 01
ffff810206a6e3c0 2137302528 S Bo:4:053:10 -115 31 = 55534243 09140000 12000000 80000603 00000012 00000000 00000000 000000
ffff810206a6e3c0 2137303475 C Bo:4:053:10 0 31 >
ffff81020441b180 2137303519 S Bi:4:053:9 -115 18 <
ffff81020441b180 2137304476 C Bi:4:053:9 0 18 = 70000200 0000000a 00000000 3a000000 0000
ffff810206a6e3c0 2137305463 S Bi:4:053:9 -115 13 <
ffff810206a6e3c0 2137306476 C Bi:4:053:9 0 13 = 55534253 09140000 00000000 00
ffff810206a6e3c0 2139294771 S Bo:4:053:10 -115 31 = 55534243 0a140000 00000000 00000600 00000000 00000000 00000000 000000
ffff810206a6e3c0 2139296584 C Bo:4:053:10 0 31 >
ffff810206a6e3c0 2139296591 S Bi:4:053:9 -115 13 <
ffff810206a6e3c0 2139297582 C Bi:4:053:9 0 13 = 55534253 0a140000 00000000 01
ffff810206a6e3c0 2139297590 S Bo:4:053:10 -115 31 = 55534243 0b140000 12000000 80000603 00000012 00000000 00000000 000000
ffff810206a6e3c0 2139298582 C Bo:4:053:10 0 31 >
ffff81009f16d540 2139298593 S Bi:4:053:9 -115 18 <
ffff81009f16d540 2139299582 C Bi:4:053:9 0 18 = 70000200 0000000a 00000000 3a000000 0000
ffff810206a6e3c0 2139299591 S Bi:4:053:9 -115 13 <
ffff810206a6e3c0 2139300582 C Bi:4:053:9 0 13 = 55534253 0b140000 00000000 00
ffff810206a6e3c0 2139300624 S Bo:4:053:10 -115 31 = 55534243 0c140000 00000000 00000600 00000000 00000000 00000000 000000
ffff810206a6e3c0 2139301582 C Bo:4:053:10 0 31 >
ffff810206a6e3c0 2139301588 S Bi:4:053:9 -115 13 <
ffff810206a6e3c0 2139302582 C Bi:4:053:9 0 13 = 55534253 0c140000 00000000 01
ffff810206a6e3c0 2139302589 S Bo:4:053:10 -115 31 = 55534243 0d140000 12000000 80000603 00000012 00000000 00000000 000000
ffff810206a6e3c0 2139303585 C Bo:4:053:10 0 31 >
ffff81009f16d540 2139303596 S Bi:4:053:9 -115 18 <
ffff81009f16d540 2139304582 C Bi:4:053:9 0 18 = 70000200 0000000a 00000000 3a000000 0000
ffff810206a6e3c0 2139304590 S Bi:4:053:9 -115 13 <
ffff810206a6e3c0 2139305582 C Bi:4:053:9 0 13 = 55534253 0d140000 00000000 00
ffff810206a6e3c0 2141294783 S Bo:4:053:10 -115 31 = 55534243 0e140000 00000000 00000600 00000000 00000000 00000000 000000
ffff810206a6e3c0 2141296696 C Bo:4:053:10 0 31 >
ffff810206a6e3c0 2141296727 S Bi:4:053:9 -115 13 <
ffff810206a6e3c0 2141297695 C Bi:4:053:9 0 13 = 55534253 0e140000 00000000 01
ffff810206a6e3c0 2141297725 S Bo:4:053:10 -115 31 = 55534243 0f140000 12000000 80000603 00000012 00000000 00000000 000000
ffff810206a6e3c0 2141298694 C Bo:4:053:10 0 31 >
ffff81010a706540 2141298730 S Bi:4:053:9 -115 18 <
ffff81010a706540 2141299696 C Bi:4:053:9 0 18 = 70000200 0000000a 00000000 3a000000 0000
ffff810206a6e3c0 2141299735 S Bi:4:053:9 -115 13 <
ffff810206a6e3c0 2141300695 C Bi:4:053:9 0 13 = 55534253 0f140000 00000000 00
ffff810206a6e3c0 2141300762 S Bo:4:053:10 -115 31 = 55534243 10140000 00000000 00000600 00000000 00000000 00000000 000000
ffff810206a6e3c0 2141301695 C Bo:4:053:10 0 31 >
ffff810206a6e3c0 2141301725 S Bi:4:053:9 -115 13 <
ffff810206a6e3c0 2141302698 C Bi:4:053:9 0 13 = 55534253 10140000 00000000 01
ffff810206a6e3c0 2141302764 S Bo:4:053:10 -115 31 = 55534243 11140000 12000000 80000603 00000012 00000000 00000000 000000
ffff810206a6e3c0 2141303700 C Bo:4:053:10 0 31 >
ffff810212c27900 2141303771 S Bi:4:053:9 -115 18 <
ffff810212c27900 2141304698 C Bi:4:053:9 0 18 = 70000200 0000000a 00000000 3a000000 0000
ffff810206a6e3c0 2141304760 S Bi:4:053:9 -115 13 <
ffff810206a6e3c0 2141305698 C Bi:4:053:9 0 13 = 55534253 11140000 00000000 00
ffff810206a6e3c0 2143294780 S Bo:4:053:10 -115 31 = 55534243 12140000 00000000 00000600 00000000 00000000 00000000 000000
ffff810206a6e3c0 2143295807 C Bo:4:053:10 0 31 >
ffff810206a6e3c0 2143295814 S Bi:4:053:9 -115 13 <
ffff810206a6e3c0 2143296805 C Bi:4:053:9 0 13 = 55534253 12140000 00000000 01
ffff810206a6e3c0 2143296812 S Bo:4:053:10 -115 31 = 55534243 13140000 12000000 80000603 00000012 00000000 00000000 000000
ffff810206a6e3c0 2143297804 C Bo:4:053:10 0 31 >
ffff8101ef115f00 2143297814 S Bi:4:053:9 -115 18 <
ffff8101ef115f00 2143298805 C Bi:4:053:9 0 18 = 70000200 0000000a 00000000 3a000000 0000
ffff810206a6e3c0 2143298814 S Bi:4:053:9 -115 13 <
ffff810206a6e3c0 2143299805 C Bi:4:053:9 0 13 = 55534253 13140000 00000000 00
ffff810206a6e3c0 2143299850 S Bo:4:053:10 -115 31 = 55534243 14140000 00000000 00000600 00000000 00000000 00000000 000000
ffff810206a6e3c0 2143300805 C Bo:4:053:10 0 31 >
ffff810206a6e3c0 2143300810 S Bi:4:053:9 -115 13 <
ffff810206a6e3c0 2143301805 C Bi:4:053:9 0 13 = 55534253 14140000 00000000 01
ffff810206a6e3c0 2143301811 S Bo:4:053:10 -115 31 = 55534243 15140000 12000000 80000603 00000012 00000000 00000000 000000
ffff810206a6e3c0 2143302805 C Bo:4:053:10 0 31 >
ffff8101ef115f00 2143302813 S Bi:4:053:9 -115 18 <
ffff8101ef115f00 2143303805 C Bi:4:053:9 0 18 = 70000200 0000000a 00000000 3a000000 0000
ffff810206a6e3c0 2143303812 S Bi:4:053:9 -115 13 <
ffff810206a6e3c0 2143304805 C Bi:4:053:9 0 13 = 55534253 15140000 00000000 00
ffff810206a6e3c0 2145294780 S Bo:4:053:10 -115 31 = 55534243 16140000 00000000 00000600 00000000 00000000 00000000 000000
ffff810206a6e3c0 2145295918 C Bo:4:053:10 0 31 >
ffff810206a6e3c0 2145295926 S Bi:4:053:9 -115 13 <
ffff810206a6e3c0 2145296917 C Bi:4:053:9 0 13 = 55534253 16140000 00000000 01
ffff810206a6e3c0 2145296924 S Bo:4:053:10 -115 31 = 55534243 17140000 12000000 80000603 00000012 00000000 00000000 000000
ffff810206a6e3c0 2145297915 C Bo:4:053:10 0 31 >
ffff8101f4758cc0 2145297926 S Bi:4:053:9 -115 18 <
ffff8101f4758cc0 2145298917 C Bi:4:053:9 0 18 = 70000200 0000000a 00000000 3a000000 0000
ffff810206a6e3c0 2145298938 S Bi:4:053:9 -115 13 <
ffff810206a6e3c0 2145299916 C Bi:4:053:9 0 13 = 55534253 17140000 00000000 00
ffff810206a6e3c0 2145299968 S Bo:4:053:10 -115 31 = 55534243 18140000 00000000 00000600 00000000 00000000 00000000 000000
ffff810206a6e3c0 2145300916 C Bo:4:053:10 0 31 >
ffff810206a6e3c0 2145300922 S Bi:4:053:9 -115 13 <
ffff810206a6e3c0 2145301916 C Bi:4:053:9 0 13 = 55534253 18140000 00000000 01
ffff810206a6e3c0 2145301922 S Bo:4:053:10 -115 31 = 55534243 19140000 12000000 80000603 00000012 00000000 00000000 000000
ffff810206a6e3c0 2145302916 C Bo:4:053:10 0 31 >
ffff8101f4758cc0 2145302925 S Bi:4:053:9 -115 18 <
ffff8101f4758cc0 2145303916 C Bi:4:053:9 0 18 = 70000200 0000000a 00000000 3a000000 0000
ffff810206a6e3c0 2145303924 S Bi:4:053:9 -115 13 <
ffff810206a6e3c0 2145304916 C Bi:4:053:9 0 13 = 55534253 19140000 00000000 00
ffff810206a6e3c0 2147294789 S Bo:4:053:10 -115 31 = 55534243 1a140000 00000000 00000600 00000000 00000000 00000000 000000
ffff810206a6e3c0 2147296030 C Bo:4:053:10 0 31 >
ffff810206a6e3c0 2147296104 S Bi:4:053:9 -115 13 <
ffff810206a6e3c0 2147297028 C Bi:4:053:9 0 13 = 55534253 1a140000 00000000 01
ffff810206a6e3c0 2147297057 S Bo:4:053:10 -115 31 = 55534243 1b140000 12000000 80000603 00000012 00000000 00000000 000000
ffff810206a6e3c0 2147298028 C Bo:4:053:10 0 31 >
ffff81012cb183c0 2147298121 S Bi:4:053:9 -115 18 <
ffff81012cb183c0 2147299030 C Bi:4:053:9 0 18 = 70000200 0000000a 00000000 3a000000 0000
ffff810206a6e3c0 2147299066 S Bi:4:053:9 -115 13 <
ffff810206a6e3c0 2147300029 C Bi:4:053:9 0 13 = 55534253 1b140000 00000000 00
ffff810206a6e3c0 2147300101 S Bo:4:053:10 -115 31 = 55534243 1c140000 00000000 00000600 00000000 00000000 00000000 000000
ffff810206a6e3c0 2147301029 C Bo:4:053:10 0 31 >
ffff810206a6e3c0 2147301056 S Bi:4:053:9 -115 13 <
ffff810206a6e3c0 2147302029 C Bi:4:053:9 0 13 = 55534253 1c140000 00000000 01
ffff810206a6e3c0 2147302062 S Bo:4:053:10 -115 31 = 55534243 1d140000 12000000 80000603 00000012 00000000 00000000 000000
ffff810206a6e3c0 2147303029 C Bo:4:053:10 0 31 >
ffff8101eb41b540 2147303063 S Bi:4:053:9 -115 18 <
ffff8101eb41b540 2147304033 C Bi:4:053:9 0 18 = 70000200 0000000a 00000000 3a000000 0000
ffff810206a6e3c0 2147304107 S Bi:4:053:9 -115 13 <
ffff810206a6e3c0 2147305033 C Bi:4:053:9 0 13 = 55534253 1d140000 00000000 00
ffff810206a6e3c0 2149294811 S Bo:4:053:10 -115 31 = 55534243 1e140000 00000000 00000600 00000000 00000000 00000000 000000
ffff810206a6e3c0 2149296144 C Bo:4:053:10 0 31 >
ffff810206a6e3c0 2149296192 S Bi:4:053:9 -115 13 <
ffff810206a6e3c0 2149297144 C Bi:4:053:9 0 13 = 55534253 1e140000 00000000 01
ffff810206a6e3c0 2149297186 S Bo:4:053:10 -115 31 = 55534243 1f140000 12000000 80000603 00000012 00000000 00000000 000000
ffff810206a6e3c0 2149298143 C Bo:4:053:10 0 31 >
ffff8101c0687780 2149298185 S Bi:4:053:9 -115 18 <
ffff8101c0687780 2149299145 C Bi:4:053:9 0 18 = 70000200 0000000a 00000000 3a000000 0000
ffff810206a6e3c0 2149299194 S Bi:4:053:9 -115 13 <
ffff810206a6e3c0 2149300141 C Bi:4:053:9 0 13 = 55534253 1f140000 00000000 00
ffff810206a6e3c0 2149300259 S Bo:4:053:10 -115 31 = 55534243 20140000 00000000 00000600 00000000 00000000 00000000 000000
ffff810206a6e3c0 2149301144 C Bo:4:053:10 0 31 >
ffff810206a6e3c0 2149301185 S Bi:4:053:9 -115 13 <
ffff810206a6e3c0 2149302145 C Bi:4:053:9 0 13 = 55534253 20140000 00000000 01
ffff810206a6e3c0 2149302159 S Bo:4:053:10 -115 31 = 55534243 21140000 12000000 80000603 00000012 00000000 00000000 000000
ffff810206a6e3c0 2149303140 C Bo:4:053:10 0 31 >
ffff8101c0687480 2149303166 S Bi:4:053:9 -115 18 <
ffff8101c0687480 2149304139 C Bi:4:053:9 0 18 = 70000200 0000000a 00000000 3a000000 0000
ffff810206a6e3c0 2149304148 S Bi:4:053:9 -115 13 <
ffff810206a6e3c0 2149305139 C Bi:4:053:9 0 13 = 55534253 21140000 00000000 00
ffff810206a6e3c0 2151294795 S Bo:4:053:10 -115 31 = 55534243 22140000 00000000 00000600 00000000 00000000 00000000 000000
ffff810206a6e3c0 2151296252 C Bo:4:053:10 0 31 >
ffff810206a6e3c0 2151296260 S Bi:4:053:9 -115 13 <
ffff810206a6e3c0 2151297251 C Bi:4:053:9 0 13 = 55534253 22140000 00000000 01
ffff810206a6e3c0 2151297258 S Bo:4:053:10 -115 31 = 55534243 23140000 12000000 80000603 00000012 00000000 00000000 000000
ffff810206a6e3c0 2151298250 C Bo:4:053:10 0 31 >
ffff81020a73e0c0 2151298260 S Bi:4:053:9 -115 18 <
ffff81020a73e0c0 2151299250 C Bi:4:053:9 0 18 = 70000200 0000000a 00000000 3a000000 0000
ffff810206a6e3c0 2151299259 S Bi:4:053:9 -115 13 <
ffff810206a6e3c0 2151300250 C Bi:4:053:9 0 13 = 55534253 23140000 00000000 00
ffff810206a6e3c0 2151300301 S Bo:4:053:10 -115 31 = 55534243 24140000 00000000 00000600 00000000 00000000 00000000 000000
ffff810206a6e3c0 2151301250 C Bo:4:053:10 0 31 >
ffff810206a6e3c0 2151301255 S Bi:4:053:9 -115 13 <
ffff810206a6e3c0 2151302250 C Bi:4:053:9 0 13 = 55534253 24140000 00000000 01
ffff810206a6e3c0 2151302256 S Bo:4:053:10 -115 31 = 55534243 25140000 12000000 80000603 00000012 00000000 00000000 000000
ffff810206a6e3c0 2151303250 C Bo:4:053:10 0 31 >
ffff81020a73e0c0 2151303257 S Bi:4:053:9 -115 18 <
ffff81020a73e0c0 2151304250 C Bi:4:053:9 0 18 = 70000200 0000000a 00000000 3a000000 0000
ffff810206a6e3c0 2151304257 S Bi:4:053:9 -115 13 <
ffff810206a6e3c0 2151305250 C Bi:4:053:9 0 13 = 55534253 25140000 00000000 00
ffff810206a6e3c0 2153295754 S Bo:4:053:10 -115 31 = 55534243 26140000 00000000 00000600 00000000 00000000 00000000 000000
ffff810206a6e3c0 2153297365 C Bo:4:053:10 0 31 >
ffff810206a6e3c0 2153297401 S Bi:4:053:9 -115 13 <
ffff810206a6e3c0 2153298362 C Bi:4:053:9 0 13 = 55534253 26140000 00000000 01
ffff810206a6e3c0 2153298389 S Bo:4:053:10 -115 31 = 55534243 27140000 12000000 80000603 00000012 00000000 00000000 000000
ffff810206a6e3c0 2153299363 C Bo:4:053:10 0 31 >
ffff810148175840 2153299407 S Bi:4:053:9 -115 18 <
ffff810148175840 2153300364 C Bi:4:053:9 0 18 = 70000200 0000000a 00000000 3a000000 0000
ffff810206a6e3c0 2153300400 S Bi:4:053:9 -115 13 <
ffff810206a6e3c0 2153301361 C Bi:4:053:9 0 13 = 55534253 27140000 00000000 00
ffff810206a6e3c0 2153301426 S Bo:4:053:10 -115 31 = 55534243 28140000 00000000 00000600 00000000 00000000 00000000 000000
ffff810206a6e3c0 2153302362 C Bo:4:053:10 0 31 >
ffff810206a6e3c0 2153302383 S Bi:4:053:9 -115 13 <
ffff810206a6e3c0 2153303362 C Bi:4:053:9 0 13 = 55534253 28140000 00000000 01
ffff810206a6e3c0 2153303387 S Bo:4:053:10 -115 31 = 55534243 29140000 12000000 80000603 00000012 00000000 00000000 000000
ffff810206a6e3c0 2153304362 C Bo:4:053:10 0 31 >
ffff810148175300 2153304390 S Bi:4:053:9 -115 18 <
ffff810148175300 2153305364 C Bi:4:053:9 0 18 = 70000200 0000000a 00000000 3a000000 0000
ffff810206a6e3c0 2153305409 S Bi:4:053:9 -115 13 <
ffff810206a6e3c0 2153306361 C Bi:4:053:9 0 13 = 55534253 29140000 00000000 00
ffff810206a6e3c0 2155294799 S Bo:4:053:10 -115 31 = 55534243 2a140000 00000000 00000600 00000000 00000000 00000000 000000
ffff810206a6e3c0 2155296475 C Bo:4:053:10 0 31 >
ffff810206a6e3c0 2155296484 S Bi:4:053:9 -115 13 <
ffff810206a6e3c0 2155297473 C Bi:4:053:9 0 13 = 55534253 2a140000 00000000 01
ffff810206a6e3c0 2155297481 S Bo:4:053:10 -115 31 = 55534243 2b140000 12000000 80000603 00000012 00000000 00000000 000000
ffff810206a6e3c0 2155298473 C Bo:4:053:10 0 31 >
ffff8101f886b300 2155298483 S Bi:4:053:9 -115 18 <
ffff8101f886b300 2155299473 C Bi:4:053:9 0 18 = 70000200 0000000a 00000000 3a000000 0000
ffff810206a6e3c0 2155299481 S Bi:4:053:9 -115 13 <
ffff810206a6e3c0 2155300473 C Bi:4:053:9 0 13 = 55534253 2b140000 00000000 00
ffff810206a6e3c0 2155300526 S Bo:4:053:10 -115 31 = 55534243 2c140000 00000000 00000600 00000000 00000000 00000000 000000
ffff810206a6e3c0 2155301473 C Bo:4:053:10 0 31 >
ffff810206a6e3c0 2155301479 S Bi:4:053:9 -115 13 <
ffff810206a6e3c0 2155302478 C Bi:4:053:9 0 13 = 55534253 2c140000 00000000 01
ffff810206a6e3c0 2155302526 S Bo:4:053:10 -115 31 = 55534243 2d140000 12000000 80000603 00000012 00000000 00000000 000000
ffff810206a6e3c0 2155303473 C Bo:4:053:10 0 31 >
ffff8101f886b300 2155303483 S Bi:4:053:9 -115 18 <
ffff8101f886b300 2155304473 C Bi:4:053:9 0 18 = 70000200 0000000a 00000000 3a000000 0000
ffff810206a6e3c0 2155304481 S Bi:4:053:9 -115 13 <
ffff810206a6e3c0 2155305473 C Bi:4:053:9 0 13 = 55534253 2d140000 00000000 00
ffff810206a6e3c0 2157294969 S Bo:4:053:10 -115 31 = 55534243 2e140000 00000000 00000600 00000000 00000000 00000000 000000
ffff810206a6e3c0 2157296587 C Bo:4:053:10 0 31 >
ffff810206a6e3c0 2157296597 S Bi:4:053:9 -115 13 <
ffff810206a6e3c0 2157297585 C Bi:4:053:9 0 13 = 55534253 2e140000 00000000 01
ffff810206a6e3c0 2157297593 S Bo:4:053:10 -115 31 = 55534243 2f140000 12000000 80000603 00000012 00000000 00000000 000000
ffff810206a6e3c0 2157298584 C Bo:4:053:10 0 31 >
ffff810024fd8cc0 2157298595 S Bi:4:053:9 -115 18 <
ffff810024fd8cc0 2157299584 C Bi:4:053:9 0 18 = 70000200 0000000a 00000000 3a000000 0000
ffff810206a6e3c0 2157299592 S Bi:4:053:9 -115 13 <
ffff810206a6e3c0 2157300583 C Bi:4:053:9 0 13 = 55534253 2f140000 00000000 00
ffff810206a6e3c0 2157300637 S Bo:4:053:10 -115 31 = 55534243 30140000 00000000 00000600 00000000 00000000 00000000 000000
ffff810206a6e3c0 2157301584 C Bo:4:053:10 0 31 >
ffff810206a6e3c0 2157301590 S Bi:4:053:9 -115 13 <
ffff810206a6e3c0 2157302587 C Bi:4:053:9 0 13 = 55534253 30140000 00000000 01
ffff810206a6e3c0 2157302596 S Bo:4:053:10 -115 31 = 55534243 31140000 12000000 80000603 00000012 00000000 00000000 000000
ffff810206a6e3c0 2157303584 C Bo:4:053:10 0 31 >
ffff810024fd8cc0 2157303592 S Bi:4:053:9 -115 18 <
ffff810024fd8cc0 2157304584 C Bi:4:053:9 0 18 = 70000200 0000000a 00000000 3a000000 0000
ffff810206a6e3c0 2157304592 S Bi:4:053:9 -115 13 <
ffff810206a6e3c0 2157305584 C Bi:4:053:9 0 13 = 55534253 31140000 00000000 00
ffff810206a6e3c0 2159294784 S Bo:4:053:10 -115 31 = 55534243 32140000 00000000 00000600 00000000 00000000 00000000 000000
ffff810206a6e3c0 2159296699 C Bo:4:053:10 0 31 >
ffff810206a6e3c0 2159296747 S Bi:4:053:9 -115 13 <
ffff810206a6e3c0 2159297696 C Bi:4:053:9 0 13 = 55534253 32140000 00000000 01
ffff810206a6e3c0 2159297722 S Bo:4:053:10 -115 31 = 55534243 33140000 12000000 80000603 00000012 00000000 00000000 000000
ffff810206a6e3c0 2159298696 C Bo:4:053:10 0 31 >
ffff810206a6e000 2159298726 S Bi:4:053:9 -115 18 <
ffff810206a6e000 2159299695 C Bi:4:053:9 0 18 = 70000200 0000000a 00000000 3a000000 0000
ffff810206a6e3c0 2159299722 S Bi:4:053:9 -115 13 <
ffff810206a6e3c0 2159300696 C Bi:4:053:9 0 13 = 55534253 33140000 00000000 00
ffff810206a6e3c0 2159300768 S Bo:4:053:10 -115 31 = 55534243 34140000 00000000 00000600 00000000 00000000 00000000 000000
ffff810206a6e3c0 2159301697 C Bo:4:053:10 0 31 >
ffff810206a6e3c0 2159301726 S Bi:4:053:9 -115 13 <
ffff810206a6e3c0 2159302699 C Bi:4:053:9 0 13 = 55534253 34140000 00000000 01
ffff810206a6e3c0 2159302739 S Bo:4:053:10 -115 31 = 55534243 35140000 12000000 80000603 00000012 00000000 00000000 000000
ffff810206a6e3c0 2159303697 C Bo:4:053:10 0 31 >
ffff8101eb5999c0 2159303729 S Bi:4:053:9 -115 18 <
ffff8101eb5999c0 2159304699 C Bi:4:053:9 0 18 = 70000200 0000000a 00000000 3a000000 0000
ffff810206a6e3c0 2159304866 S Bi:4:053:9 -115 13 <
ffff810206a6e3c0 2159305697 C Bi:4:053:9 0 13 = 55534253 35140000 00000000 00
ffff810206a6e3c0 2161294779 S Bo:4:053:10 -115 31 = 55534243 36140000 00000000 00000600 00000000 00000000 00000000 000000
ffff810206a6e3c0 2161295809 C Bo:4:053:10 0 31 >
ffff810206a6e3c0 2161295816 S Bi:4:053:9 -115 13 <
ffff810206a6e3c0 2161296807 C Bi:4:053:9 0 13 = 55534253 36140000 00000000 01
ffff810206a6e3c0 2161296814 S Bo:4:053:10 -115 31 = 55534243 37140000 12000000 80000603 00000012 00000000 00000000 000000
ffff810206a6e3c0 2161297806 C Bo:4:053:10 0 31 >
ffff8101eb56e0c0 2161297816 S Bi:4:053:9 -115 18 <
ffff8101eb56e0c0 2161298806 C Bi:4:053:9 0 18 = 70000200 0000000a 00000000 3a000000 0000
ffff810206a6e3c0 2161298815 S Bi:4:053:9 -115 13 <
ffff810206a6e3c0 2161299807 C Bi:4:053:9 0 13 = 55534253 37140000 00000000 00
ffff810206a6e3c0 2161299849 S Bo:4:053:10 -115 31 = 55534243 38140000 00000000 00000600 00000000 00000000 00000000 000000
ffff810206a6e3c0 2161300806 C Bo:4:053:10 0 31 >
ffff810206a6e3c0 2161300812 S Bi:4:053:9 -115 13 <
ffff810206a6e3c0 2161301807 C Bi:4:053:9 0 13 = 55534253 38140000 00000000 01
ffff810206a6e3c0 2161301813 S Bo:4:053:10 -115 31 = 55534243 39140000 12000000 80000603 00000012 00000000 00000000 000000
ffff810206a6e3c0 2161302807 C Bo:4:053:10 0 31 >
ffff8101eb56e0c0 2161302814 S Bi:4:053:9 -115 18 <
ffff8101eb56e0c0 2161303807 C Bi:4:053:9 0 18 = 70000200 0000000a 00000000 3a000000 0000
ffff810206a6e3c0 2161303814 S Bi:4:053:9 -115 13 <
ffff810206a6e3c0 2161304807 C Bi:4:053:9 0 13 = 55534253 39140000 00000000 00
ffff810206a6e3c0 2163294780 S Bo:4:053:10 -115 31 = 55534243 3a140000 00000000 00000600 00000000 00000000 00000000 000000
ffff810206a6e3c0 2163295920 C Bo:4:053:10 0 31 >
ffff810206a6e3c0 2163295927 S Bi:4:053:9 -115 13 <
ffff810206a6e3c0 2163296919 C Bi:4:053:9 0 13 = 55534253 3a140000 00000000 01
ffff810206a6e3c0 2163296926 S Bo:4:053:10 -115 31 = 55534243 3b140000 12000000 80000603 00000012 00000000 00000000 000000
ffff810206a6e3c0 2163297918 C Bo:4:053:10 0 31 >
ffff8101086dfb40 2163297928 S Bi:4:053:9 -115 18 <
ffff8101086dfb40 2163298918 C Bi:4:053:9 0 18 = 70000200 0000000a 00000000 3a000000 0000
ffff810206a6e3c0 2163298927 S Bi:4:053:9 -115 13 <
ffff810206a6e3c0 2163299918 C Bi:4:053:9 0 13 = 55534253 3b140000 00000000 00
ffff810206a6e3c0 2163299959 S Bo:4:053:10 -115 31 = 55534243 3c140000 00000000 00000600 00000000 00000000 00000000 000000
ffff810206a6e3c0 2163300927 C Bo:4:053:10 0 31 >
ffff810206a6e3c0 2163300977 S Bi:4:053:9 -115 13 <
ffff810206a6e3c0 2163301923 C Bi:4:053:9 0 13 = 55534253 3c140000 00000000 01
ffff810206a6e3c0 2163301969 S Bo:4:053:10 -115 31 = 55534243 3d140000 12000000 80000603 00000012 00000000 00000000 000000
ffff810206a6e3c0 2163302924 C Bo:4:053:10 0 31 >
ffff8101086dfb40 2163302994 S Bi:4:053:9 -115 18 <
ffff8101086dfb40 2163303920 C Bi:4:053:9 0 18 = 70000200 0000000a 00000000 3a000000 0000
ffff810206a6e3c0 2163303948 S Bi:4:053:9 -115 13 <
ffff810206a6e3c0 2163304918 C Bi:4:053:9 0 13 = 55534253 3d140000 00000000 00
ffff810206a6e3c0 2165294776 S Bo:4:053:10 -115 31 = 55534243 3e140000 00000000 00000600 00000000 00000000 00000000 000000
ffff810206a6e3c0 2165296033 C Bo:4:053:10 0 31 >
ffff810206a6e3c0 2165296060 S Bi:4:053:9 -115 13 <
ffff810206a6e3c0 2165297031 C Bi:4:053:9 0 13 = 55534253 3e140000 00000000 01
ffff810206a6e3c0 2165297058 S Bo:4:053:10 -115 31 = 55534243 3f140000 12000000 80000603 00000012 00000000 00000000 000000
ffff810206a6e3c0 2165298032 C Bo:4:053:10 0 31 >
ffff81020441b0c0 2165298137 S Bi:4:053:9 -115 18 <
ffff81020441b0c0 2165299036 C Bi:4:053:9 0 18 = 70000200 0000000a 00000000 3a000000 0000
ffff810206a6e3c0 2165299126 S Bi:4:053:9 -115 13 <
ffff810206a6e3c0 2165300034 C Bi:4:053:9 0 13 = 55534253 3f140000 00000000 00
ffff810206a6e3c0 2165300374 S Bo:4:053:10 -115 31 = 55534243 40140000 00000000 00000600 00000000 00000000 00000000 000000
ffff810206a6e3c0 2165301033 C Bo:4:053:10 0 31 >
ffff810206a6e3c0 2165301041 S Bi:4:053:9 -115 13 <
ffff810206a6e3c0 2165302029 C Bi:4:053:9 0 13 = 55534253 40140000 00000000 01
ffff810206a6e3c0 2165302037 S Bo:4:053:10 -115 31 = 55534243 41140000 12000000 80000603 00000012 00000000 00000000 000000
ffff810206a6e3c0 2165303030 C Bo:4:053:10 0 31 >
ffff81020441b0c0 2165303040 S Bi:4:053:9 -115 18 <
ffff81020441b0c0 2165304029 C Bi:4:053:9 0 18 = 70000200 0000000a 00000000 3a000000 0000
ffff810206a6e3c0 2165304038 S Bi:4:053:9 -115 13 <
ffff810206a6e3c0 2165305030 C Bi:4:053:9 0 13 = 55534253 41140000 00000000 00
ffff810206a6e3c0 2167294787 S Bo:4:053:10 -115 31 = 55534243 42140000 00000000 00000600 00000000 00000000 00000000 000000
ffff810206a6e3c0 2167296142 C Bo:4:053:10 0 31 >
ffff810206a6e3c0 2167296150 S Bi:4:053:9 -115 13 <
ffff810206a6e3c0 2167297142 C Bi:4:053:9 0 13 = 55534253 42140000 00000000 01
ffff810206a6e3c0 2167297149 S Bo:4:053:10 -115 31 = 55534243 43140000 12000000 80000603 00000012 00000000 00000000 000000
ffff810206a6e3c0 2167298140 C Bo:4:053:10 0 31 >
ffff8101330b30c0 2167298149 S Bi:4:053:9 -115 18 <
ffff8101330b30c0 2167299140 C Bi:4:053:9 0 18 = 70000200 0000000a 00000000 3a000000 0000
ffff810206a6e3c0 2167299148 S Bi:4:053:9 -115 13 <
ffff810206a6e3c0 2167300141 C Bi:4:053:9 0 13 = 55534253 43140000 00000000 00
ffff810206a6e3c0 2167300187 S Bo:4:053:10 -115 31 = 55534243 44140000 00000000 00000600 00000000 00000000 00000000 000000
ffff810206a6e3c0 2167301140 C Bo:4:053:10 0 31 >
ffff810206a6e3c0 2167301146 S Bi:4:053:9 -115 13 <
ffff810206a6e3c0 2167302141 C Bi:4:053:9 0 13 = 55534253 44140000 00000000 01
ffff810206a6e3c0 2167302147 S Bo:4:053:10 -115 31 = 55534243 45140000 12000000 80000603 00000012 00000000 00000000 000000
ffff810206a6e3c0 2167303140 C Bo:4:053:10 0 31 >
ffff8101330b30c0 2167303147 S Bi:4:053:9 -115 18 <
ffff8101330b30c0 2167304141 C Bi:4:053:9 0 18 = 70000200 0000000a 00000000 3a000000 0000
ffff810206a6e3c0 2167304148 S Bi:4:053:9 -115 13 <
ffff810206a6e3c0 2167305141 C Bi:4:053:9 0 13 = 55534253 45140000 00000000 00
ffff810206a6e3c0 2169294779 S Bo:4:053:10 -115 31 = 55534243 46140000 00000000 00000600 00000000 00000000 00000000 000000
ffff810206a6e3c0 2169296254 C Bo:4:053:10 0 31 >
ffff810206a6e3c0 2169296262 S Bi:4:053:9 -115 13 <
ffff810206a6e3c0 2169297253 C Bi:4:053:9 0 13 = 55534253 46140000 00000000 01
ffff810206a6e3c0 2169297260 S Bo:4:053:10 -115 31 = 55534243 47140000 12000000 80000603 00000012 00000000 00000000 000000
ffff810206a6e3c0 2169298252 C Bo:4:053:10 0 31 >
ffff8100a738c300 2169298261 S Bi:4:053:9 -115 18 <
ffff8100a738c300 2169299252 C Bi:4:053:9 0 18 = 70000200 0000000a 00000000 3a000000 0000
ffff810206a6e3c0 2169299260 S Bi:4:053:9 -115 13 <
ffff810206a6e3c0 2169300252 C Bi:4:053:9 0 13 = 55534253 47140000 00000000 00
ffff810206a6e3c0 2169300294 S Bo:4:053:10 -115 31 = 55534243 48140000 00000000 00000600 00000000 00000000 00000000 000000
ffff810206a6e3c0 2169301252 C Bo:4:053:10 0 31 >
ffff810206a6e3c0 2169301258 S Bi:4:053:9 -115 13 <
ffff810206a6e3c0 2169302252 C Bi:4:053:9 0 13 = 55534253 48140000 00000000 01
ffff810206a6e3c0 2169302258 S Bo:4:053:10 -115 31 = 55534243 49140000 12000000 80000603 00000012 00000000 00000000 000000
ffff810206a6e3c0 2169303252 C Bo:4:053:10 0 31 >
ffff8100a738c300 2169303259 S Bi:4:053:9 -115 18 <
ffff8100a738c300 2169304252 C Bi:4:053:9 0 18 = 70000200 0000000a 00000000 3a000000 0000
ffff810206a6e3c0 2169304259 S Bi:4:053:9 -115 13 <
ffff810206a6e3c0 2169305253 C Bi:4:053:9 0 13 = 55534253 49140000 00000000 00
ffff810206a6e3c0 2171294874 S Bo:4:053:10 -115 31 = 55534243 4a140000 00000000 00000600 00000000 00000000 00000000 000000
ffff810206a6e3c0 2171296368 C Bo:4:053:10 0 31 >
ffff810206a6e3c0 2171296405 S Bi:4:053:9 -115 13 <
ffff810206a6e3c0 2171297367 C Bi:4:053:9 0 13 = 55534253 4a140000 00000000 01
ffff810206a6e3c0 2171297413 S Bo:4:053:10 -115 31 = 55534243 4b140000 12000000 80000603 00000012 00000000 00000000 000000
ffff810206a6e3c0 2171298365 C Bo:4:053:10 0 31 >
ffff81008b44b600 2171298397 S Bi:4:053:9 -115 18 <
ffff81008b44b600 2171299364 C Bi:4:053:9 0 18 = 70000200 0000000a 00000000 3a000000 0000
ffff810206a6e3c0 2171299391 S Bi:4:053:9 -115 13 <
ffff810206a6e3c0 2171300364 C Bi:4:053:9 0 13 = 55534253 4b140000 00000000 00
ffff810206a6e3c0 2171300429 S Bo:4:053:10 -115 31 = 55534243 4c140000 00000000 00000600 00000000 00000000 00000000 000000
ffff810206a6e3c0 2171301364 C Bo:4:053:10 0 31 >
ffff810206a6e3c0 2171301395 S Bi:4:053:9 -115 13 <
ffff810206a6e3c0 2171302364 C Bi:4:053:9 0 13 = 55534253 4c140000 00000000 01
ffff810206a6e3c0 2171302392 S Bo:4:053:10 -115 31 = 55534243 4d140000 12000000 80000603 00000012 00000000 00000000 000000
ffff810206a6e3c0 2171303365 C Bo:4:053:10 0 31 >
ffff81019bd0bc00 2171303402 S Bi:4:053:9 -115 18 <
ffff81019bd0bc00 2171304365 C Bi:4:053:9 0 18 = 70000200 0000000a 00000000 3a000000 0000
ffff810206a6e3c0 2171304401 S Bi:4:053:9 -115 13 <
ffff810206a6e3c0 2171305364 C Bi:4:053:9 0 13 = 55534253 4d140000 00000000 00
ffff810206a6e3c0 2173294777 S Bo:4:053:10 -115 31 = 55534243 4e140000 00000000 00000600 00000000 00000000 00000000 000000
ffff810206a6e3c0 2173296477 C Bo:4:053:10 0 31 >
ffff810206a6e3c0 2173296504 S Bi:4:053:9 -115 13 <
ffff810206a6e3c0 2173297479 C Bi:4:053:9 0 13 = 55534253 4e140000 00000000 01
ffff810206a6e3c0 2173297518 S Bo:4:053:10 -115 31 = 55534243 4f140000 12000000 80000603 00000012 00000000 00000000 000000
ffff810206a6e3c0 2173298475 C Bo:4:053:10 0 31 >
ffff8101facc1000 2173298485 S Bi:4:053:9 -115 18 <
ffff8101facc1000 2173299478 C Bi:4:053:9 0 18 = 70000200 0000000a 00000000 3a000000 0000
ffff810206a6e3c0 2173299489 S Bi:4:053:9 -115 13 <
ffff810206a6e3c0 2173300475 C Bi:4:053:9 0 13 = 55534253 4f140000 00000000 00
ffff810206a6e3c0 2173300518 S Bo:4:053:10 -115 31 = 55534243 50140000 00000000 00000600 00000000 00000000 00000000 000000
ffff810206a6e3c0 2173301475 C Bo:4:053:10 0 31 >
ffff810206a6e3c0 2173301481 S Bi:4:053:9 -115 13 <
ffff810206a6e3c0 2173302475 C Bi:4:053:9 0 13 = 55534253 50140000 00000000 01
ffff810206a6e3c0 2173302481 S Bo:4:053:10 -115 31 = 55534243 51140000 12000000 80000603 00000012 00000000 00000000 000000
ffff810206a6e3c0 2173303475 C Bo:4:053:10 0 31 >
ffff8101facc1000 2173303482 S Bi:4:053:9 -115 18 <
ffff8101facc1000 2173304484 C Bi:4:053:9 0 18 = 70000200 0000000a 00000000 3a000000 0000
ffff810206a6e3c0 2173304540 S Bi:4:053:9 -115 13 <
ffff810206a6e3c0 2173305480 C Bi:4:053:9 0 13 = 55534253 51140000 00000000 00
ffff810206a6e3c0 2175294778 S Bo:4:053:10 -115 31 = 55534243 52140000 00000000 00000600 00000000 00000000 00000000 000000
ffff810206a6e3c0 2175296588 C Bo:4:053:10 0 31 >
ffff810206a6e3c0 2175296596 S Bi:4:053:9 -115 13 <
ffff810206a6e3c0 2175297587 C Bi:4:053:9 0 13 = 55534253 52140000 00000000 01
ffff810206a6e3c0 2175297594 S Bo:4:053:10 -115 31 = 55534243 53140000 12000000 80000603 00000012 00000000 00000000 000000
ffff810206a6e3c0 2175298586 C Bo:4:053:10 0 31 >
ffff8101df0e30c0 2175298595 S Bi:4:053:9 -115 18 <
ffff8101df0e30c0 2175299586 C Bi:4:053:9 0 18 = 70000200 0000000a 00000000 3a000000 0000
ffff810206a6e3c0 2175299594 S Bi:4:053:9 -115 13 <
ffff810206a6e3c0 2175300586 C Bi:4:053:9 0 13 = 55534253 53140000 00000000 00
ffff810206a6e3c0 2175300628 S Bo:4:053:10 -115 31 = 55534243 54140000 00000000 00000600 00000000 00000000 00000000 000000
ffff810206a6e3c0 2175301586 C Bo:4:053:10 0 31 >
ffff810206a6e3c0 2175301592 S Bi:4:053:9 -115 13 <
ffff810206a6e3c0 2175302586 C Bi:4:053:9 0 13 = 55534253 54140000 00000000 01
ffff810206a6e3c0 2175302592 S Bo:4:053:10 -115 31 = 55534243 55140000 12000000 80000603 00000012 00000000 00000000 000000
ffff810206a6e3c0 2175303587 C Bo:4:053:10 0 31 >
ffff8101df0e30c0 2175303594 S Bi:4:053:9 -115 18 <
ffff8101df0e30c0 2175304586 C Bi:4:053:9 0 18 = 70000200 0000000a 00000000 3a000000 0000
ffff810206a6e3c0 2175304593 S Bi:4:053:9 -115 13 <
ffff810206a6e3c0 2175305587 C Bi:4:053:9 0 13 = 55534253 55140000 00000000 00
ffff810037aaf000 2175683842 S Bo:4:053:6 -115 4 = 4154480d
ffff810037aaf000 2175685614 C Bo:4:053:6 0 4 >
ffff8101084bd540 2175685722 S Bi:4:053:5 -115 16384 <
ffff8101084bd540 2175687668 C Bi:4:053:5 0 1515 = 7eff0300 21450005 dc07c800 00c6064e e2cfabb5 e719e6f8 f80050e2 80d6b96f
ffff8101084bd540 2175699399 S Bi:4:053:5 -115 16384 <
ffff8101084bd540 2175701682 C Bi:4:053:5 0 1517 = 7eff0300 21450005 dc07cc00 00c6064e decfabb5 e719e6f8 f80050e2 80d6b974
ffff810037aafb40 2175727941 S Bi:4:053:5 -115 16384 <
ffff810037aafb40 2175729691 C Bi:4:053:5 0 1058 = 7eff0300 21450005 dc07d000 00c60657 84d155ab 9319e6f8 f800509e cb0d0df9
ffff8101ef19fc00 2175754115 S Bi:4:053:5 -115 16384 <
ffff8101ef19fc00 2175755696 C Bi:4:053:5 0 466 = ab15f3e1 c8741a09 f765facb 6991b8e3 5346dddf debd1ccc 4e8175bf 9cc281df
ffff8101c0662180 2175755897 S Bi:4:053:5 -115 16384 <
ffff8101c0662180 2175757688 C Bi:4:053:5 0 1519 = 7eff0300 21450005 dc07d400 00c60657 80d155ab 9319e6f8 f800509e cb0d0e0a
ffff8101f45a0e40 2175787579 S Bi:4:053:5 -115 16384 <
ffff8101f45a0e40 2175789695 C Bi:4:053:5 0 1046 = 7eff0300 21450005 dc07d800 00c6064e d2cfabb5 e719e6f8 f80050e2 80d6b97a
ffff8101f45a0e40 2175819001 S Bi:4:053:5 -115 16384 <
ffff8101f45a0e40 2175820697 C Bi:4:053:5 0 484 = 9369ec74 935dd3ef 627aefdc 7d5debc3 7d5eebee 3ba2def1 26bbc3a4 bb59e878
ffff8101f45a0e40 2175821367 S Bi:4:053:5 -115 16384 <
ffff8101f45a0e40 2175823683 C Bi:4:053:5 0 1502 = 7eff0300 21450005 dc798800 00c606dd 21cfabb5 e719e6f8 f80050e2 80d6b963
ffff8101f45a0e40 2175850270 S Bi:4:053:5 -115 16384 <
ffff8101f45a0e40 2175851699 C Bi:4:053:5 0 13 = 49738ea8 c360b026 c9912ea8 7e
ffff8101f45a0e40 2175854862 S Bi:4:053:5 -115 16384 <
ffff8101f45a0e40 2175856691 C Bi:4:053:5 0 1524 = 7eff0300 21450005 dc858000 00c606d9 d3d155ab 9319e6f8 f800509e cb0d0df9
ffff8101f45a0e40 2175912481 S Bi:4:053:5 -115 16384 <
ffff8101f45a0e40 2175913692 C Bi:4:053:5 0 566 = 7eff0300 21450005 dc1f6000 00c60637 4acfabb5 e719e6f8 f80050e2 80d6b963
ffff810206a6e3c0 2177294786 S Bo:4:053:10 -115 31 = 55534243 56140000 00000000 00000600 00000000 00000000 00000000 000000
ffff810206a6e3c0 2177296700 C Bo:4:053:10 0 31 >
ffff810206a6e3c0 2177296708 S Bi:4:053:9 -115 13 <
ffff810206a6e3c0 2177297699 C Bi:4:053:9 0 13 = 55534253 56140000 00000000 01
ffff810206a6e3c0 2177297706 S Bo:4:053:10 -115 31 = 55534243 57140000 12000000 80000603 00000012 00000000 00000000 000000
ffff810206a6e3c0 2177298698 C Bo:4:053:10 0 31 >
ffff8100a738c600 2177298708 S Bi:4:053:9 -115 18 <
ffff8100a738c600 2177299697 C Bi:4:053:9 0 18 = 70000200 0000000a 00000000 3a000000 0000
ffff810206a6e3c0 2177299737 S Bi:4:053:9 -115 13 <
ffff810206a6e3c0 2177300699 C Bi:4:053:9 0 13 = 55534253 57140000 00000000 00
ffff810206a6e3c0 2177300761 S Bo:4:053:10 -115 31 = 55534243 58140000 00000000 00000600 00000000 00000000 00000000 000000
ffff810206a6e3c0 2177301698 C Bo:4:053:10 0 31 >
ffff810206a6e3c0 2177301704 S Bi:4:053:9 -115 13 <
ffff810206a6e3c0 2177302698 C Bi:4:053:9 0 13 = 55534253 58140000 00000000 01
ffff810206a6e3c0 2177302705 S Bo:4:053:10 -115 31 = 55534243 59140000 12000000 80000603 00000012 00000000 00000000 000000
ffff810206a6e3c0 2177303698 C Bo:4:053:10 0 31 >
ffff8100a738c600 2177303705 S Bi:4:053:9 -115 18 <
ffff8100a738c600 2177304698 C Bi:4:053:9 0 18 = 70000200 0000000a 00000000 3a000000 0000
ffff810206a6e3c0 2177304705 S Bi:4:053:9 -115 13 <
ffff810206a6e3c0 2177305698 C Bi:4:053:9 0 13 = 55534253 59140000 00000000 00
ffff810206a6e3c0 2179294777 S Bo:4:053:10 -115 31 = 55534243 5a140000 00000000 00000600 00000000 00000000 00000000 000000
ffff810206a6e3c0 2179295817 C Bo:4:053:10 0 31 >
ffff810206a6e3c0 2179295868 S Bi:4:053:9 -115 13 <
ffff810206a6e3c0 2179296814 C Bi:4:053:9 0 13 = 55534253 5a140000 00000000 01
ffff810206a6e3c0 2179296859 S Bo:4:053:10 -115 31 = 55534243 5b140000 12000000 80000603 00000012 00000000 00000000 000000
ffff810206a6e3c0 2179297815 C Bo:4:053:10 0 31 >
ffff81019bd9b540 2179297860 S Bi:4:053:9 -115 18 <
ffff81019bd9b540 2179298809 C Bi:4:053:9 0 18 = 70000200 0000000a 00000000 3a000000 0000
ffff810206a6e3c0 2179298818 S Bi:4:053:9 -115 13 <
ffff810206a6e3c0 2179299809 C Bi:4:053:9 0 13 = 55534253 5b140000 00000000 00
ffff810206a6e3c0 2179299852 S Bo:4:053:10 -115 31 = 55534243 5c140000 00000000 00000600 00000000 00000000 00000000 000000
ffff810206a6e3c0 2179300809 C Bo:4:053:10 0 31 >
ffff810206a6e3c0 2179300815 S Bi:4:053:9 -115 13 <
ffff810206a6e3c0 2179301809 C Bi:4:053:9 0 13 = 55534253 5c140000 00000000 01
ffff810206a6e3c0 2179301816 S Bo:4:053:10 -115 31 = 55534243 5d140000 12000000 80000603 00000012 00000000 00000000 000000
ffff810206a6e3c0 2179302809 C Bo:4:053:10 0 31 >
ffff81019bd9b540 2179302816 S Bi:4:053:9 -115 18 <
ffff81019bd9b540 2179303809 C Bi:4:053:9 0 18 = 70000200 0000000a 00000000 3a000000 0000
ffff810206a6e3c0 2179303816 S Bi:4:053:9 -115 13 <
ffff810206a6e3c0 2179304809 C Bi:4:053:9 0 13 = 55534253 5d140000 00000000 00
ffff810206a6e3c0 2181294779 S Bo:4:053:10 -115 31 = 55534243 5e140000 00000000 00000600 00000000 00000000 00000000 000000
ffff810206a6e3c0 2181295922 C Bo:4:053:10 0 31 >
ffff810206a6e3c0 2181295929 S Bi:4:053:9 -115 13 <
ffff810206a6e3c0 2181296921 C Bi:4:053:9 0 13 = 55534253 5e140000 00000000 01
ffff810206a6e3c0 2181296929 S Bo:4:053:10 -115 31 = 55534243 5f140000 12000000 80000603 00000012 00000000 00000000 000000
ffff810206a6e3c0 2181297920 C Bo:4:053:10 0 31 >
ffff81019bc91000 2181297930 S Bi:4:053:9 -115 18 <
ffff81019bc91000 2181298920 C Bi:4:053:9 0 18 = 70000200 0000000a 00000000 3a000000 0000
ffff810206a6e3c0 2181298928 S Bi:4:053:9 -115 13 <
ffff810206a6e3c0 2181299920 C Bi:4:053:9 0 13 = 55534253 5f140000 00000000 00
ffff810206a6e3c0 2181299962 S Bo:4:053:10 -115 31 = 55534243 60140000 00000000 00000600 00000000 00000000 00000000 000000
ffff810206a6e3c0 2181300920 C Bo:4:053:10 0 31 >
ffff810206a6e3c0 2181300926 S Bi:4:053:9 -115 13 <
ffff810206a6e3c0 2181301920 C Bi:4:053:9 0 13 = 55534253 60140000 00000000 01
ffff810206a6e3c0 2181301927 S Bo:4:053:10 -115 31 = 55534243 61140000 12000000 80000603 00000012 00000000 00000000 000000
ffff810206a6e3c0 2181302742 C Bo:4:053:10 0 31 >
ffff81019bc91000 2181302765 S Bi:4:053:9 -115 18 <
ffff81019bc91000 2181302922 C Bi:4:053:9 0 18 = 70000200 0000000a 00000000 3a000000 0000
ffff810206a6e3c0 2181302929 S Bi:4:053:9 -115 13 <
ffff810206a6e3c0 2181303920 C Bi:4:053:9 0 13 = 55534253 61140000 00000000 00
ffff810206a6e3c0 2183294786 S Bo:4:053:10 -115 31 = 55534243 62140000 00000000 00000600 00000000 00000000 00000000 000000
ffff810206a6e3c0 2183296036 C Bo:4:053:10 0 31 >
ffff810206a6e3c0 2183296079 S Bi:4:053:9 -115 13 <
ffff810206a6e3c0 2183297033 C Bi:4:053:9 0 13 = 55534253 62140000 00000000 01
ffff810206a6e3c0 2183297064 S Bo:4:053:10 -115 31 = 55534243 63140000 12000000 80000603 00000012 00000000 00000000 000000
ffff810206a6e3c0 2183298032 C Bo:4:053:10 0 31 >
ffff8101df27d480 2183298056 S Bi:4:053:9 -115 18 <
ffff8101df27d480 2183299032 C Bi:4:053:9 0 18 = 70000200 0000000a 00000000 3a000000 0000
ffff810206a6e3c0 2183299065 S Bi:4:053:9 -115 13 <
ffff810206a6e3c0 2183300033 C Bi:4:053:9 0 13 = 55534253 63140000 00000000 00
ffff810206a6e3c0 2183300097 S Bo:4:053:10 -115 31 = 55534243 64140000 00000000 00000600 00000000 00000000 00000000 000000
ffff810206a6e3c0 2183301032 C Bo:4:053:10 0 31 >
ffff810206a6e3c0 2183301053 S Bi:4:053:9 -115 13 <
ffff810206a6e3c0 2183302036 C Bi:4:053:9 0 13 = 55534253 64140000 00000000 01
ffff810206a6e3c0 2183302076 S Bo:4:053:10 -115 31 = 55534243 65140000 12000000 80000603 00000012 00000000 00000000 000000
ffff810206a6e3c0 2183303032 C Bo:4:053:10 0 31 >
ffff8101ef3d0840 2183303057 S Bi:4:053:9 -115 18 <
ffff8101ef3d0840 2183304032 C Bi:4:053:9 0 18 = 70000200 0000000a 00000000 3a000000 0000
ffff810206a6e3c0 2183304057 S Bi:4:053:9 -115 13 <
ffff810206a6e3c0 2183305032 C Bi:4:053:9 0 13 = 55534253 65140000 00000000 00
ffff810206a6e3c0 2185294779 S Bo:4:053:10 -115 31 = 55534243 66140000 00000000 00000600 00000000 00000000 00000000 000000
ffff810206a6e3c0 2185296145 C Bo:4:053:10 0 31 >
ffff810206a6e3c0 2185296153 S Bi:4:053:9 -115 13 <
ffff810206a6e3c0 2185297144 C Bi:4:053:9 0 13 = 55534253 66140000 00000000 01
ffff810206a6e3c0 2185297151 S Bo:4:053:10 -115 31 = 55534243 67140000 12000000 80000603 00000012 00000000 00000000 000000
ffff810206a6e3c0 2185298143 C Bo:4:053:10 0 31 >
ffff8102139b8a80 2185298152 S Bi:4:053:9 -115 18 <
ffff8102139b8a80 2185299143 C Bi:4:053:9 0 18 = 70000200 0000000a 00000000 3a000000 0000
ffff810206a6e3c0 2185299150 S Bi:4:053:9 -115 13 <
ffff810206a6e3c0 2185300143 C Bi:4:053:9 0 13 = 55534253 67140000 00000000 00
ffff810206a6e3c0 2185300186 S Bo:4:053:10 -115 31 = 55534243 68140000 00000000 00000600 00000000 00000000 00000000 000000
ffff810206a6e3c0 2185301143 C Bo:4:053:10 0 31 >
ffff810206a6e3c0 2185301148 S Bi:4:053:9 -115 13 <
ffff810206a6e3c0 2185302143 C Bi:4:053:9 0 13 = 55534253 68140000 00000000 01
ffff810206a6e3c0 2185302150 S Bo:4:053:10 -115 31 = 55534243 69140000 12000000 80000603 00000012 00000000 00000000 000000
ffff810206a6e3c0 2185303143 C Bo:4:053:10 0 31 >
ffff8102139b8a80 2185303150 S Bi:4:053:9 -115 18 <
ffff8102139b8a80 2185304143 C Bi:4:053:9 0 18 = 70000200 0000000a 00000000 3a000000 0000
ffff810206a6e3c0 2185304150 S Bi:4:053:9 -115 13 <
ffff810206a6e3c0 2185305143 C Bi:4:053:9 0 13 = 55534253 69140000 00000000 00
ffff810206a6e3c0 2187294963 S Bo:4:053:10 -115 31 = 55534243 6a140000 00000000 00000600 00000000 00000000 00000000 000000
ffff810206a6e3c0 2187296257 C Bo:4:053:10 0 31 >
ffff810206a6e3c0 2187296264 S Bi:4:053:9 -115 13 <
ffff810206a6e3c0 2187297255 C Bi:4:053:9 0 13 = 55534253 6a140000 00000000 01
ffff810206a6e3c0 2187297262 S Bo:4:053:10 -115 31 = 55534243 6b140000 12000000 80000603 00000012 00000000 00000000 000000
ffff810206a6e3c0 2187298254 C Bo:4:053:10 0 31 >
ffff8101c07eb780 2187298263 S Bi:4:053:9 -115 18 <
ffff8101c07eb780 2187299254 C Bi:4:053:9 0 18 = 70000200 0000000a 00000000 3a000000 0000
ffff810206a6e3c0 2187299262 S Bi:4:053:9 -115 13 <
ffff810206a6e3c0 2187300254 C Bi:4:053:9 0 13 = 55534253 6b140000 00000000 00
ffff810206a6e3c0 2187300294 S Bo:4:053:10 -115 31 = 55534243 6c140000 00000000 00000600 00000000 00000000 00000000 000000
ffff810206a6e3c0 2187301255 C Bo:4:053:10 0 31 >
ffff810206a6e3c0 2187301260 S Bi:4:053:9 -115 13 <
ffff810206a6e3c0 2187302254 C Bi:4:053:9 0 13 = 55534253 6c140000 00000000 01
ffff810206a6e3c0 2187302261 S Bo:4:053:10 -115 31 = 55534243 6d140000 12000000 80000603 00000012 00000000 00000000 000000
ffff810206a6e3c0 2187303255 C Bo:4:053:10 0 31 >
ffff8101c07eb780 2187303262 S Bi:4:053:9 -115 18 <
ffff8101c07eb780 2187304254 C Bi:4:053:9 0 18 = 70000200 0000000a 00000000 3a000000 0000
ffff810206a6e3c0 2187304262 S Bi:4:053:9 -115 13 <
ffff810206a6e3c0 2187305255 C Bi:4:053:9 0 13 = 55534253 6d140000 00000000 00
ffff810206a6e3c0 2189294798 S Bo:4:053:10 -115 31 = 55534243 6e140000 00000000 00000600 00000000 00000000 00000000 000000
ffff810206a6e3c0 2189296373 C Bo:4:053:10 0 31 >
ffff810206a6e3c0 2189296442 S Bi:4:053:9 -115 13 <
ffff810206a6e3c0 2189297368 C Bi:4:053:9 0 13 = 55534253 6e140000 00000000 01
ffff810206a6e3c0 2189297401 S Bo:4:053:10 -115 31 = 55534243 6f140000 12000000 80000603 00000012 00000000 00000000 000000
ffff810206a6e3c0 2189298366 C Bo:4:053:10 0 31 >
ffff810210e3d000 2189298395 S Bi:4:053:9 -115 18 <
ffff810210e3d000 2189299367 C Bi:4:053:9 0 18 = 70000200 0000000a 00000000 3a000000 0000
ffff810206a6e3c0 2189299392 S Bi:4:053:9 -115 13 <
ffff810206a6e3c0 2189300366 C Bi:4:053:9 0 13 = 55534253 6f140000 00000000 00
ffff810206a6e3c0 2189300433 S Bo:4:053:10 -115 31 = 55534243 70140000 00000000 00000600 00000000 00000000 00000000 000000
ffff810206a6e3c0 2189301366 C Bo:4:053:10 0 31 >
ffff810206a6e3c0 2189301394 S Bi:4:053:9 -115 13 <
ffff810206a6e3c0 2189302367 C Bi:4:053:9 0 13 = 55534253 70140000 00000000 01
ffff810206a6e3c0 2189302397 S Bo:4:053:10 -115 31 = 55534243 71140000 12000000 80000603 00000012 00000000 00000000 000000
ffff810206a6e3c0 2189303372 C Bo:4:053:10 0 31 >
ffff810210c9aa80 2189303448 S Bi:4:053:9 -115 18 <
ffff810210c9aa80 2189304372 C Bi:4:053:9 0 18 = 70000200 0000000a 00000000 3a000000 0000
ffff810206a6e3c0 2189304451 S Bi:4:053:9 -115 13 <
ffff810206a6e3c0 2189305370 C Bi:4:053:9 0 13 = 55534253 71140000 00000000 00
ffff810206a6e3c0 2191294845 S Bo:4:053:10 -115 31 = 55534243 72140000 00000000 00000600 00000000 00000000 00000000 000000
ffff810206a6e3c0 2191296480 C Bo:4:053:10 0 31 >
ffff810206a6e3c0 2191296489 S Bi:4:053:9 -115 13 <
ffff810206a6e3c0 2191297478 C Bi:4:053:9 0 13 = 55534253 72140000 00000000 01
ffff810206a6e3c0 2191297485 S Bo:4:053:10 -115 31 = 55534243 73140000 12000000 80000603 00000012 00000000 00000000 000000
ffff810206a6e3c0 2191298477 C Bo:4:053:10 0 31 >
ffff8101c056c180 2191298486 S Bi:4:053:9 -115 18 <
ffff8101c056c180 2191299477 C Bi:4:053:9 0 18 = 70000200 0000000a 00000000 3a000000 0000
ffff810206a6e3c0 2191299485 S Bi:4:053:9 -115 13 <
ffff810206a6e3c0 2191300477 C Bi:4:053:9 0 13 = 55534253 73140000 00000000 00
ffff810206a6e3c0 2191300520 S Bo:4:053:10 -115 31 = 55534243 74140000 00000000 00000600 00000000 00000000 00000000 000000
ffff810206a6e3c0 2191301477 C Bo:4:053:10 0 31 >
ffff810206a6e3c0 2191301483 S Bi:4:053:9 -115 13 <
ffff810206a6e3c0 2191302477 C Bi:4:053:9 0 13 = 55534253 74140000 00000000 01
ffff810206a6e3c0 2191302484 S Bo:4:053:10 -115 31 = 55534243 75140000 12000000 80000603 00000012 00000000 00000000 000000
ffff810206a6e3c0 2191303477 C Bo:4:053:10 0 31 >
ffff8101c056c180 2191303484 S Bi:4:053:9 -115 18 <
ffff8101c056c180 2191304477 C Bi:4:053:9 0 18 = 70000200 0000000a 00000000 3a000000 0000
ffff810206a6e3c0 2191304484 S Bi:4:053:9 -115 13 <
ffff810206a6e3c0 2191305477 C Bi:4:053:9 0 13 = 55534253 75140000 00000000 00
ffff810206a6e3c0 2193294785 S Bo:4:053:10 -115 31 = 55534243 76140000 00000000 00000600 00000000 00000000 00000000 000000
ffff810206a6e3c0 2193296591 C Bo:4:053:10 0 31 >
ffff810206a6e3c0 2193296598 S Bi:4:053:9 -115 13 <
ffff810206a6e3c0 2193297589 C Bi:4:053:9 0 13 = 55534253 76140000 00000000 01
ffff810206a6e3c0 2193297596 S Bo:4:053:10 -115 31 = 55534243 77140000 12000000 80000603 00000012 00000000 00000000 000000
ffff810206a6e3c0 2193298589 C Bo:4:053:10 0 31 >
ffff8100cd3f7b40 2193298598 S Bi:4:053:9 -115 18 <
ffff8100cd3f7b40 2193299588 C Bi:4:053:9 0 18 = 70000200 0000000a 00000000 3a000000 0000
ffff810206a6e3c0 2193299596 S Bi:4:053:9 -115 13 <
ffff810206a6e3c0 2193300588 C Bi:4:053:9 0 13 = 55534253 77140000 00000000 00
ffff810206a6e3c0 2193300631 S Bo:4:053:10 -115 31 = 55534243 78140000 00000000 00000600 00000000 00000000 00000000 000000
ffff810206a6e3c0 2193301588 C Bo:4:053:10 0 31 >
ffff810206a6e3c0 2193301594 S Bi:4:053:9 -115 13 <
ffff810206a6e3c0 2193302588 C Bi:4:053:9 0 13 = 55534253 78140000 00000000 01
ffff810206a6e3c0 2193302595 S Bo:4:053:10 -115 31 = 55534243 79140000 12000000 80000603 00000012 00000000 00000000 000000
ffff810206a6e3c0 2193303589 C Bo:4:053:10 0 31 >
ffff8100cd3f7b40 2193303596 S Bi:4:053:9 -115 18 <
ffff8100cd3f7b40 2193304588 C Bi:4:053:9 0 18 = 70000200 0000000a 00000000 3a000000 0000
ffff810206a6e3c0 2193304595 S Bi:4:053:9 -115 13 <
ffff810206a6e3c0 2193305589 C Bi:4:053:9 0 13 = 55534253 79140000 00000000 00
ffff810206a6e3c0 2195296547 S Bo:4:053:10 -115 31 = 55534243 7a140000 00000000 00000600 00000000 00000000 00000000 000000
ffff810206a6e3c0 2195297705 C Bo:4:053:10 0 31 >
ffff810206a6e3c0 2195297738 S Bi:4:053:9 -115 13 <
ffff810206a6e3c0 2195298701 C Bi:4:053:9 0 13 = 55534253 7a140000 00000000 01
ffff810206a6e3c0 2195298732 S Bo:4:053:10 -115 31 = 55534243 7b140000 12000000 80000603 00000012 00000000 00000000 000000
ffff810206a6e3c0 2195299701 C Bo:4:053:10 0 31 >
ffff8101faf01480 2195299736 S Bi:4:053:9 -115 18 <
ffff8101faf01480 2195300708 C Bi:4:053:9 0 18 = 70000200 0000000a 00000000 3a000000 0000
ffff810206a6e3c0 2195300801 S Bi:4:053:9 -115 13 <
ffff810206a6e3c0 2195301705 C Bi:4:053:9 0 13 = 55534253 7b140000 00000000 00
ffff810206a6e3c0 2195301841 S Bo:4:053:10 -115 31 = 55534243 7c140000 00000000 00000600 00000000 00000000 00000000 000000
ffff810206a6e3c0 2195302704 C Bo:4:053:10 0 31 >
ffff810206a6e3c0 2195302742 S Bi:4:053:9 -115 13 <
ffff810206a6e3c0 2195303700 C Bi:4:053:9 0 13 = 55534253 7c140000 00000000 01
ffff810206a6e3c0 2195303725 S Bo:4:053:10 -115 31 = 55534243 7d140000 12000000 80000603 00000012 00000000 00000000 000000
ffff810206a6e3c0 2195304701 C Bo:4:053:10 0 31 >
ffff8101faf01480 2195304726 S Bi:4:053:9 -115 18 <
ffff8101faf01480 2195305701 C Bi:4:053:9 0 18 = 70000200 0000000a 00000000 3a000000 0000
ffff810206a6e3c0 2195305734 S Bi:4:053:9 -115 13 <
ffff810206a6e3c0 2195306701 C Bi:4:053:9 0 13 = 55534253 7d140000 00000000 00
ffff8101ef1209c0 2196795582 S Bo:4:053:6 -115 28 = 00000000 23000000 03000000 00c20100 71677d20 3ccd747d 78563412
ffff8101ef1209c0 2196796794 C Bo:4:053:6 0 28 >
ffff8101ef1209c0 2196797575 S Bi:4:053:5 -115 16384 <
ffff8101ef1209c0 2196798849 C Bi:4:053:5 0 949 = 29b463d8 2b2fbce1 26291a99 8235c51f d5522a1b 90e53585 773a383b cc0866dc
ffff8101ef1209c0 2196804853 S Bi:4:053:5 -115 16384 <
ffff8101ef1209c0 2196806857 C Bi:4:053:5 0 1524 = 7eff0300 21450005 dcfdcc00 00c60661 87d155ab 9319e6f8 f800509e cb0d0df9
ffff8101ef1209c0 2196826117 S Bi:4:053:5 -115 16384 <
ffff8101ef1209c0 2196828867 C Bi:4:053:5 0 1515 = 7eff0300 21450005 dc86a000 00c606d0 09cfabb5 e719e6f8 f80050e2 80d6b963
ffff8101ef1209c0 2196860721 S Bi:4:053:5 -115 16384 <
ffff8101ef1209c0 2196861867 C Bi:4:053:5 0 24 = 00000000 23000000 23000000 00c20100 18000000 78563412
ffff8100a738cb40 2196862021 S Bi:4:053:5 -115 16384 <
ffff8100a738cb40 2196914861 C Bi:4:053:5 -2 0
ffff810210e3d000 2196915103 S Bo:4:053:6 -115 12 = 01000000 00000000 78563412
ffff810210e3d000 2196915790 C Bo:4:053:6 0 12 >
ffff810210e3d000 2196916722 S Bi:4:053:5 -115 16384 <
ffff810210e3d000 2196968856 C Bi:4:053:5 -2 0
ffff810210e3d000 2196968973 S Bi:4:053:5 -115 16384 <
ffff810210e3d000 2197022857 C Bi:4:053:5 -2 0
ffff810210e3d000 2197022945 S Bi:4:053:5 -115 16384 <
ffff810210e3d000 2197074864 C Bi:4:053:5 -2 0
ffff810210e3d000 2197074984 S Bi:4:053:5 -115 16384 <
ffff810210e3d000 2197126868 C Bi:4:053:5 -2 0
ffff810210e3d000 2197127000 S Bi:4:053:5 -115 16384 <
ffff810210e3d000 2197180866 C Bi:4:053:5 -2 0
ffff810210e3d000 2197180939 S Bi:4:053:5 -115 16384 <
ffff810210e3d000 2197234869 C Bi:4:053:5 -2 0
ffff810210e3d000 2197234986 S Bi:4:053:5 -115 16384 <
ffff810210e3d000 2197290874 C Bi:4:053:5 -2 0
ffff810210e3d000 2197290954 S Bi:4:053:5 -115 16384 <
ffff810206a6e3c0 2197294776 S Bo:4:053:10 -115 31 = 55534243 7e140000 00000000 00000600 00000000 00000000 00000000 000000
ffff810206a6e3c0 2197295811 C Bo:4:053:10 0 31 >
ffff810206a6e3c0 2197295817 S Bi:4:053:9 -115 13 <
ffff810206a6e3c0 2197296811 C Bi:4:053:9 0 13 = 55534253 7e140000 00000000 01
ffff810206a6e3c0 2197296818 S Bo:4:053:10 -115 31 = 55534243 7f140000 12000000 80000603 00000012 00000000 00000000 000000
ffff810206a6e3c0 2197297811 C Bo:4:053:10 0 31 >
ffff810210e3dcc0 2197297819 S Bi:4:053:9 -115 18 <
ffff810210e3dcc0 2197298811 C Bi:4:053:9 0 18 = 70000200 0000000a 00000000 3a000000 0000
ffff810206a6e3c0 2197298818 S Bi:4:053:9 -115 13 <
ffff810206a6e3c0 2197299812 C Bi:4:053:9 0 13 = 55534253 7f140000 00000000 00
ffff810206a6e3c0 2197299870 S Bo:4:053:10 -115 31 = 55534243 80140000 00000000 00000600 00000000 00000000 00000000 000000
ffff810206a6e3c0 2197300811 C Bo:4:053:10 0 31 >
ffff810206a6e3c0 2197300817 S Bi:4:053:9 -115 13 <
ffff810206a6e3c0 2197301812 C Bi:4:053:9 0 13 = 55534253 80140000 00000000 01
ffff810206a6e3c0 2197301818 S Bo:4:053:10 -115 31 = 55534243 81140000 12000000 80000603 00000012 00000000 00000000 000000
ffff810206a6e3c0 2197302812 C Bo:4:053:10 0 31 >
ffff810210e3dcc0 2197302819 S Bi:4:053:9 -115 18 <
ffff810210e3dcc0 2197303812 C Bi:4:053:9 0 18 = 70000200 0000000a 00000000 3a000000 0000
ffff810206a6e3c0 2197303819 S Bi:4:053:9 -115 13 <
ffff810206a6e3c0 2197304811 C Bi:4:053:9 0 13 = 55534253 81140000 00000000 00
ffff810210e3d000 2197342875 C Bi:4:053:5 -2 0
ffff810210e3d000 2197342955 S Bi:4:053:5 -115 16384 <
ffff810210e3d000 2197394880 C Bi:4:053:5 -2 0
ffff810210e3d000 2197394957 S Bi:4:053:5 -115 16384 <
ffff810210e3d000 2197446884 C Bi:4:053:5 -2 0
ffff8101f4408240 2197447009 S Bi:4:053:5 -115 16384 <
ffff8101f4408240 2197501886 C Bi:4:053:5 -2 0
ffff8101f4408240 2197501955 S Bi:4:053:5 -115 16384 <
ffff8101f4408240 2197554893 C Bi:4:053:5 -2 0
ffff8101f4408240 2197555036 S Bi:4:053:5 -115 16384 <
ffff8101f4408240 2197606900 C Bi:4:053:5 -2 0
ffff8101f4408240 2197607052 S Bi:4:053:5 -115 16384 <
ffff8101f4408240 2197658899 C Bi:4:053:5 -2 0
ffff8101f4408240 2197659043 S Bi:4:053:5 -115 16384 <
ffff8101f4408240 2197710902 C Bi:4:053:5 -2 0
ffff8101f4408240 2197711048 S Bi:4:053:5 -115 16384 <
ffff8101f4408240 2197762905 C Bi:4:053:5 -2 0
ffff8101f4408240 2197763051 S Bi:4:053:5 -115 16384 <
ffff8101f4408240 2197814908 C Bi:4:053:5 -2 0
ffff8101f4408240 2197815054 S Bi:4:053:5 -115 16384 <
ffff8101f4408240 2197866911 C Bi:4:053:5 -2 0
ffff8101f4408240 2197867056 S Bi:4:053:5 -115 16384 <
ffff8101f4408240 2197918914 C Bi:4:053:5 -2 0
ffff810044125780 2197919060 S Bi:4:053:5 -115 16384 <
ffff810044125780 2197970917 C Bi:4:053:5 -2 0
ffff810044125780 2197971062 S Bi:4:053:5 -115 16384 <
ffff810044125780 2198022919 C Bi:4:053:5 -2 0
ffff8101ef206540 2198023063 S Bi:4:053:5 -115 16384 <
ffff8101ef206540 2198074929 C Bi:4:053:5 -2 0
ffff8101ef206540 2198075093 S Bi:4:053:5 -115 16384 <
ffff8101ef206540 2198126927 C Bi:4:053:5 -2 0
ffff8101ef206540 2198127076 S Bi:4:053:5 -115 16384 <
ffff8101ef206540 2198178934 C Bi:4:053:5 -2 0
ffff81019bd71180 2198179291 S Bi:4:053:5 -115 16384 <
ffff81019bd71180 2198230935 C Bi:4:053:5 -2 0
ffff8101c0580300 2198231057 S Bi:4:053:5 -115 16384 <
ffff8101c0580300 2198282934 C Bi:4:053:5 -2 0
ffff8101c0580300 2198283056 S Bi:4:053:5 -115 16384 <
ffff8101c0580300 2198334941 C Bi:4:053:5 -2 0
ffff810137f43d80 2198335119 S Bi:4:053:5 -115 16384 <
ffff810137f43d80 2198386941 C Bi:4:053:5 -2 0
ffff810137f43d80 2198387073 S Bi:4:053:5 -115 16384 <
ffff810137f43d80 2198438943 C Bi:4:053:5 -2 0
ffff810137f43d80 2198439064 S Bi:4:053:5 -115 16384 <
ffff810137f43d80 2198490948 C Bi:4:053:5 -2 0
ffff810137f43d80 2198491348 S Bi:4:053:5 -115 16384 <
ffff810137f43d80 2198542950 C Bi:4:053:5 -2 0
ffff810137f43d80 2198543072 S Bi:4:053:5 -115 16384 <
ffff810137f43d80 2198594958 C Bi:4:053:5 -2 0
ffff810137f43d80 2198595090 S Bi:4:053:5 -115 16384 <
ffff810137f43d80 2198646963 C Bi:4:053:5 -2 0
ffff810137f43d80 2198647083 S Bi:4:053:5 -115 16384 <
ffff810137f43d80 2198698962 C Bi:4:053:5 -2 0
ffff810137f43d80 2198699091 S Bi:4:053:5 -115 16384 <
ffff810137f43d80 2198750964 C Bi:4:053:5 -2 0
ffff810137f43d80 2198751084 S Bi:4:053:5 -115 16384 <
ffff810137f43d80 2198802965 C Bi:4:053:5 -2 0
ffff810137f43d80 2198803087 S Bi:4:053:5 -115 16384 <
ffff810137f43d80 2198854968 C Bi:4:053:5 -2 0
ffff810137f43d80 2198855092 S Bi:4:053:5 -115 16384 <
ffff810137f43d80 2198906972 C Bi:4:053:5 -2 0
ffff810137f43d80 2198907145 S Bi:4:053:5 -115 16384 <
ffff810137f43d80 2198958975 C Bi:4:053:5 -2 0
ffff810137f43d80 2198959102 S Bi:4:053:5 -115 16384 <
ffff810137f43d80 2199011976 C Bi:4:053:5 -2 0
ffff810137f43d80 2199012109 S Bi:4:053:5 -115 16384 <
ffff810137f43d80 2199063979 C Bi:4:053:5 -2 0
ffff810137f43d80 2199064113 S Bi:4:053:5 -115 16384 <
ffff810137f43d80 2199114977 C Bi:4:053:5 -2 0
ffff81018530b180 2199115093 S Bi:4:053:5 -115 16384 <
ffff81018530b180 2199166987 C Bi:4:053:5 -2 0
ffff810137f43000 2199167114 S Bi:4:053:5 -115 16384 <
ffff810137f43000 2199218988 C Bi:4:053:5 -2 0
ffff810137f43000 2199219149 S Bi:4:053:5 -115 16384 <
ffff810137f43000 2199270993 C Bi:4:053:5 -2 0
ffff810137f43000 2199271154 S Bi:4:053:5 -115 16384 <
ffff810206a6e3c0 2199294592 S Bo:4:053:10 -115 31 = 55534243 82140000 00000000 00000600 00000000 00000000 00000000 000000
ffff810206a6e3c0 2199294926 C Bo:4:053:10 0 31 >
ffff810206a6e3c0 2199294936 S Bi:4:053:9 -115 13 <
ffff810206a6e3c0 2199295923 C Bi:4:053:9 0 13 = 55534253 82140000 00000000 01
ffff810206a6e3c0 2199295932 S Bo:4:053:10 -115 31 = 55534243 83140000 12000000 80000603 00000012 00000000 00000000 000000
ffff810206a6e3c0 2199296927 C Bo:4:053:10 0 31 >
ffff81018530bd80 2199296943 S Bi:4:053:9 -115 18 <
ffff81018530bd80 2199297923 C Bi:4:053:9 0 18 = 70000200 0000000a 00000000 3a000000 0000
ffff810206a6e3c0 2199297952 S Bi:4:053:9 -115 13 <
ffff810206a6e3c0 2199298926 C Bi:4:053:9 0 13 = 55534253 83140000 00000000 00
ffff810206a6e3c0 2199298988 S Bo:4:053:10 -115 31 = 55534243 84140000 00000000 00000600 00000000 00000000 00000000 000000
ffff810206a6e3c0 2199299924 C Bo:4:053:10 0 31 >
ffff810206a6e3c0 2199299953 S Bi:4:053:9 -115 13 <
ffff810206a6e3c0 2199300923 C Bi:4:053:9 0 13 = 55534253 84140000 00000000 01
ffff810206a6e3c0 2199300951 S Bo:4:053:10 -115 31 = 55534243 85140000 12000000 80000603 00000012 00000000 00000000 000000
ffff810206a6e3c0 2199301924 C Bo:4:053:10 0 31 >
ffff81018530bd80 2199301935 S Bi:4:053:9 -115 18 <
ffff81018530bd80 2199302924 C Bi:4:053:9 0 18 = 70000200 0000000a 00000000 3a000000 0000
ffff810206a6e3c0 2199302933 S Bi:4:053:9 -115 13 <
ffff810206a6e3c0 2199303926 C Bi:4:053:9 0 13 = 55534253 85140000 00000000 00
ffff810137f43000 2199322996 C Bi:4:053:5 -2 0
ffff810137f43000 2199323130 S Bi:4:053:5 -115 16384 <
ffff810137f43000 2199374998 C Bi:4:053:5 -2 0
ffff810137f43000 2199375151 S Bi:4:053:5 -115 16384 <
ffff810137f43000 2199427001 C Bi:4:053:5 -2 0
ffff810137f43000 2199427173 S Bi:4:053:5 -115 16384 <
ffff810137f43000 2199480004 C Bi:4:053:5 -2 0
ffff810137f43000 2199480158 S Bi:4:053:5 -115 16384 <
ffff810137f43000 2199531005 C Bi:4:053:5 -2 0
ffff810137f43000 2199531157 S Bi:4:053:5 -115 16384 <
ffff810137f43000 2199585007 C Bi:4:053:5 -2 0
ffff810137f43000 2199585163 S Bi:4:053:5 -115 16384 <
ffff810137f43000 2199639012 C Bi:4:053:5 -2 0
ffff810137f43000 2199639165 S Bi:4:053:5 -115 16384 <
ffff810137f43000 2199691014 C Bi:4:053:5 -2 0
ffff810137f43000 2199691167 S Bi:4:053:5 -115 16384 <
ffff810137f43000 2199743017 C Bi:4:053:5 -2 0
ffff810137f43000 2199743171 S Bi:4:053:5 -115 16384 <
ffff810137f43000 2199795021 C Bi:4:053:5 -2 0
ffff810137f43000 2199795183 S Bi:4:053:5 -115 16384 <
ffff810137f43000 2199847022 C Bi:4:053:5 -2 0
ffff810137f43000 2199847174 S Bi:4:053:5 -115 16384 <
ffff810137f43000 2199899027 C Bi:4:053:5 -2 0
ffff810137f43000 2199899195 S Bi:4:053:5 -115 16384 <
ffff810137f43000 2199951028 C Bi:4:053:5 -2 0
ffff810137f43000 2199951182 S Bi:4:053:5 -115 16384 <
ffff810137f43000 2200003029 C Bi:4:053:5 -2 0
ffff810137f43000 2200003198 S Bi:4:053:5 -115 16384 <
ffff810137f43000 2200055034 C Bi:4:053:5 -2 0
ffff810137f43000 2200055187 S Bi:4:053:5 -115 16384 <
ffff810137f43000 2200107041 C Bi:4:053:5 -2 0
ffff810137f43000 2200107200 S Bi:4:053:5 -115 16384 <
ffff810137f43000 2200160048 C Bi:4:053:5 -2 0
ffff810137f43000 2200160214 S Bi:4:053:5 -115 16384 <
ffff810137f43000 2200211038 C Bi:4:053:5 -2 0
ffff81018530bcc0 2200211233 S Bi:4:053:5 -115 16384 <
ffff81018530bcc0 2200263046 C Bi:4:053:5 -2 0
ffff81018530bcc0 2200263188 S Bi:4:053:5 -115 16384 <
ffff81018530bcc0 2200315049 C Bi:4:053:5 -2 0
ffff81018530bcc0 2200315208 S Bi:4:053:5 -115 16384 <
ffff81018530bcc0 2200367051 C Bi:4:053:5 -2 0
ffff81018530bcc0 2200367196 S Bi:4:053:5 -115 16384 <
ffff81018530bcc0 2200419053 C Bi:4:053:5 -2 0
ffff810137f43480 2200419176 S Bi:4:053:5 -115 16384 <
ffff810137f43480 2200471057 C Bi:4:053:5 -2 0
ffff810137f43480 2200471179 S Bi:4:053:5 -115 16384 <
ffff810137f43480 2200523060 C Bi:4:053:5 -2 0
ffff810137f43480 2200523181 S Bi:4:053:5 -115 16384 <
ffff810137f43480 2200575063 C Bi:4:053:5 -2 0
ffff810137f43480 2200575184 S Bi:4:053:5 -115 16384 <
ffff810137f43480 2200627064 C Bi:4:053:5 -2 0
ffff810137f43480 2200627183 S Bi:4:053:5 -115 16384 <
ffff810137f43480 2200679068 C Bi:4:053:5 -2 0
ffff810137f43480 2200679189 S Bi:4:053:5 -115 16384 <
ffff810137f43480 2200731072 C Bi:4:053:5 -2 0
ffff810137f43480 2200731220 S Bi:4:053:5 -115 16384 <
ffff810137f43480 2200783075 C Bi:4:053:5 -2 0
ffff810137f43480 2200783230 S Bi:4:053:5 -115 16384 <
ffff810137f43480 2200835076 C Bi:4:053:5 -2 0
ffff810137f43480 2200835229 S Bi:4:053:5 -115 16384 <
ffff810137f43480 2200887081 C Bi:4:053:5 -2 0
ffff810137f43480 2200887235 S Bi:4:053:5 -115 16384 <
ffff810137f43480 2200939083 C Bi:4:053:5 -2 0
ffff810137f43480 2200939212 S Bi:4:053:5 -115 16384 <
ffff810137f43480 2200992082 C Bi:4:053:5 -2 0
ffff810137f43480 2200992330 S Bo:4:053:6 -115 28 = 00000000 23000000 00000000 00c20100 42425411 b3d15bf9 78563412
ffff810137f43480 2200993019 C Bo:4:053:6 0 28 >
ffff81018530bd80 2200993117 S Bi:4:053:5 -115 16384 <
ffff81018530bd80 2201047085 C Bi:4:053:5 -2 0
ffff81018530bd80 2201047196 S Bi:4:053:5 -115 16384 <
ffff81018530bd80 2201100091 C Bi:4:053:5 -2 0
ffff81018530bd80 2201100238 S Bi:4:053:5 -115 16384 <
ffff81018530bd80 2201152099 C Bi:4:053:5 -2 0
ffff8101ef37c780 2201152239 S Bi:4:053:5 -115 16384 <
ffff8101ef37c780 2201203098 C Bi:4:053:5 -2 0
ffff81019bc1bb40 2201203226 S Bi:4:053:5 -115 16384 <
ffff81019bc1bb40 2201255098 C Bi:4:053:5 -2 0
ffff81004a25d300 2201255221 S Bi:4:053:5 -115 16384 <
ffff810206a6e3c0 2201294794 S Bo:4:053:10 -115 31 = 55534243 86140000 00000000 00000600 00000000 00000000 00000000 000000
ffff810206a6e3c0 2201295034 C Bo:4:053:10 0 31 >
ffff810206a6e3c0 2201295041 S Bi:4:053:9 -115 13 <
ffff810206a6e3c0 2201296034 C Bi:4:053:9 0 13 = 55534253 86140000 00000000 01
ffff810206a6e3c0 2201296041 S Bo:4:053:10 -115 31 = 55534243 87140000 12000000 80000603 00000012 00000000 00000000 000000
ffff810206a6e3c0 2201297034 C Bo:4:053:10 0 31 >
ffff8100896e1f00 2201297043 S Bi:4:053:9 -115 18 <
ffff8100896e1f00 2201298034 C Bi:4:053:9 0 18 = 70000200 0000000a 00000000 3a000000 0000
ffff810206a6e3c0 2201298041 S Bi:4:053:9 -115 13 <
ffff810206a6e3c0 2201299034 C Bi:4:053:9 0 13 = 55534253 87140000 00000000 00
ffff810206a6e3c0 2201299103 S Bo:4:053:10 -115 31 = 55534243 88140000 00000000 00000600 00000000 00000000 00000000 000000
ffff810206a6e3c0 2201300035 C Bo:4:053:10 0 31 >
ffff810206a6e3c0 2201300040 S Bi:4:053:9 -115 13 <
ffff810206a6e3c0 2201301035 C Bi:4:053:9 0 13 = 55534253 88140000 00000000 01
ffff810206a6e3c0 2201301041 S Bo:4:053:10 -115 31 = 55534243 89140000 12000000 80000603 00000012 00000000 00000000 000000
ffff810206a6e3c0 2201302034 C Bo:4:053:10 0 31 >
ffff8100896e1f00 2201302041 S Bi:4:053:9 -115 18 <
ffff8100896e1f00 2201303035 C Bi:4:053:9 0 18 = 70000200 0000000a 00000000 3a000000 0000
ffff810206a6e3c0 2201303042 S Bi:4:053:9 -115 13 <
ffff810206a6e3c0 2201304035 C Bi:4:053:9 0 13 = 55534253 89140000 00000000 00
ffff81004a25d300 2201307104 C Bi:4:053:5 -2 0
ffff8100896e1f00 2201307253 S Bi:4:053:5 -115 16384 <
ffff8100896e1f00 2201359103 C Bi:4:053:5 -2 0
ffff8101df178c00 2201359251 S Bi:4:053:5 -115 16384 <
ffff8101df178c00 2201411111 C Bi:4:053:5 -2 0
ffff8101df178c00 2201411253 S Bi:4:053:5 -115 16384 <
