ffff810210e3d000 1332789965 S Bo:4:048:6 -115 12 = 01000000 01000000 78563412
ffff8101481756c0 1332791659 C Bi:4:048:5 0 28 = 04000000 00000000 00000000 00000000 01000000 1c000000 78563412
ffff810210e3d000 1332791667 C Bo:4:048:6 0 12 >
ffff810210e3d000 1332827167 S Bo:4:048:6 -115 28 = 00000000 00000000 03000000 00c20100 222c2277 61702e76 78563412
ffff810210e3dcc0 1332827193 S Bi:4:048:5 -115 4096 <
ffff810210e3d000 1332828654 C Bo:4:048:6 0 28 >
ffff810210e3dcc0 1332828681 C Bi:4:048:5 0 24 = 00000000 23000000 23000000 00c20100 18000000 78563412
ffff810210e3dcc0 1332838622 S Bo:4:048:6 -115 3 = 41540d
ffff810210e3dcc0 1332839649 C Bo:4:048:6 0 3 >
ffff810210e3dcc0 1332856093 S Bi:4:048:5 -115 4096 <
ffff810210e3dcc0 1332857666 C Bi:4:048:5 0 2 = 4154
ffff810210e3dcc0 1332864074 S Bi:4:048:5 -115 4096 <
ffff810210e3dcc0 1332864664 C Bi:4:048:5 0 2 = 0d0a
ffff810210e3dcc0 1332867626 S Bi:4:048:5 -115 4096 <
ffff810210e3dcc0 1332868665 C Bi:4:048:5 0 6 = 0d0a4f4b 0d0a
ffff810210e3dcc0 1332875577 S Bi:4:048:5 -115 4096 <
ffff810210e3d000 1332886554 S Bo:4:048:6 -115 7 = 41544530 56310d
ffff810210e3dcc0 1332887670 C Bi:4:048:5 0 6 = 41544530 5631
ffff810210e3d000 1332887676 C Bo:4:048:6 0 7 >
ffff810210e3d000 1332891561 S Bi:4:048:5 -115 4096 <
ffff810210e3d000 1332892664 C Bi:4:048:5 0 2 = 0d0a
ffff810210e3d000 1332895464 S Bi:4:048:5 -115 4096 <
ffff810210e3d000 1332895665 C Bi:4:048:5 0 6 = 0d0a4f4b 0d0a
ffff810210e3d000 1332900564 S Bi:4:048:5 -115 4096 <
ffff810210e3dcc0 1332904093 S Bo:4:048:6 -115 3 = 41540d
ffff810210e3d000 1332904668 C Bi:4:048:5 0 6 = 0d0a4f4b 0d0a
ffff810210e3dcc0 1332904674 C Bo:4:048:6 0 3 >
ffff810210e3dcc0 1332907468 S Bi:4:048:5 -115 4096 <
ffff810210e3d000 1332914592 S Bo:4:048:6 -115 40 = 41542b63 6764636f 6e743d31 2c224950 222c2277 61702e76 6f696365 73747265
ffff810210e3dcc0 1332915667 C Bi:4:048:5 0 6 = 0d0a4f4b 0d0a
ffff810210e3d000 1332915672 C Bo:4:048:6 0 40 >
ffff810210e3d000 1332919215 S Bi:4:048:5 -115 4096 <
ffff810210e3dcc0 1332922254 S Bo:4:048:6 -115 7 = 41545330 3d300d
ffff810210e3dcc0 1332922651 C Bo:4:048:6 0 7 >
ffff810210e3d000 1332923665 C Bi:4:048:5 0 6 = 0d0a4f4b 0d0a
ffff810210e3d000 1332927441 S Bo:4:048:6 -115 28 = 00000000 23000000 03000000 00c20100 222c2277 61702e76 78563412
ffff810210e3dcc0 1332927462 S Bi:4:048:5 -115 4096 <
ffff810210e3d000 1332927652 C Bo:4:048:6 0 28 >
ffff810210e3dcc0 1332928668 C Bi:4:048:5 0 24 = 00000000 23000000 23000000 00c20100 18000000 78563412
ffff810210e3dcc0 1332930215 S Bi:4:048:5 -115 4096 <
ffff810210e3d000 1332931122 S Bo:4:048:6 -115 3 = 41540d
ffff810210e3dcc0 1332931665 C Bi:4:048:5 0 6 = 0d0a4f4b 0d0a
ffff810210e3d000 1332931670 C Bo:4:048:6 0 3 >
ffff810210e3d000 1332934280 S Bi:4:048:5 -115 4096 <
ffff810210e3dcc0 1332941359 S Bo:4:048:6 -115 7 = 41544530 56310d
ffff810210e3dcc0 1332941653 C Bo:4:048:6 0 7 >
ffff810210e3d000 1332942667 C Bi:4:048:5 0 6 = 0d0a4f4b 0d0a
ffff810210e3d000 1332947704 S Bi:4:048:5 -115 4096 <
ffff810210e3dcc0 1332954435 S Bo:4:048:6 -115 3 = 41540d
ffff810210e3dcc0 1332954654 C Bo:4:048:6 0 3 >
ffff810210e3d000 1332955668 C Bi:4:048:5 0 6 = 0d0a4f4b 0d0a
ffff810210e3d000 1332958478 S Bi:4:048:5 -115 4096 <
ffff810210e3dcc0 1332962525 S Bo:4:048:6 -115 40 = 41542b63 6764636f 6e743d31 2c224950 222c2277 61702e76 6f696365 73747265
ffff810210e3dcc0 1332962651 C Bo:4:048:6 0 40 >
ffff810210e3d000 1332963667 C Bi:4:048:5 0 6 = 0d0a4f4b 0d0a
ffff810210e3d000 1332970337 S Bi:4:048:5 -115 4096 <
ffff810210e3dcc0 1332971259 S Bo:4:048:6 -115 13 = 41544454 2a39392a 2a2a3123 0d
ffff810210e3dcc0 1332971653 C Bo:4:048:6 0 13 >
ffff810210e3d000 1332972129 C Bi:4:048:5 0 11 = 0d0a434f 4e4e4543 540d0a
ffff810210e3d000 1332974296 S Bi:4:048:5 -115 4096 <
ffff8101fad5c600 1338011132 S Bo:4:048:6 -115 28 = 00000000 23000000 03000000 00c20100 222c2277 61702e76 78563412
ffff810210e3d000 1338012955 C Bi:4:048:5 0 24 = 00000000 23000000 23000000 00c20100 18000000 78563412
ffff8101fad5c600 1338012961 C Bo:4:048:6 0 28 >
ffff8101fad5c600 1338024050 S Bo:4:048:6 -115 90 = 7eff7d23 c0217d21 7d207d20 327d227d 267d207d 207d207d 207d257d 26239471
ffff8101fad5c780 1338024073 S Bi:4:048:5 -115 4096 <
ffff8101fad5c600 1338024940 C Bo:4:048:6 0 90 >
ffff8101fad5c780 1338024964 C Bi:4:048:5 0 36 = 7eff7d23 c0217d21 7d207d20 7d2e7d22 7d267d20 7d207d20 7d207d23 7d24c023
ffff8101fad5c780 1338027082 S Bo:4:048:6 -115 35 = 7eff7d23 c0217d22 7d207d20 7d2e7d22 7d267d20 7d207d20 7d207d23 7d24c023
ffff8101fad5c600 1338027103 S Bi:4:048:5 -115 4096 <
ffff8101fad5c780 1338027932 C Bo:4:048:6 0 35 >
ffff8101fad5c600 1338027954 C Bi:4:048:5 0 77 = 7eff7d23 c0217d24 7d207d20 2c7d257d 26239471 677d277d 227d287d 227d2d7d
ffff8101fad5c600 1338030003 S Bo:4:048:6 -115 29 = 7eff7d23 c0217d21 7d217d20 7d2a7d22 7d267d20 7d207d20 7d20587b 7e
ffff8101fad5c780 1338030024 S Bi:4:048:5 -115 4096 <
ffff8101fad5c600 1338030941 C Bo:4:048:6 0 29 >
ffff8101fad5c780 1338030968 C Bi:4:048:5 0 30 = 7eff7d23 c0217d22 7d217d20 7d2a7d22 7d267d20 7d207d20 7d20317d 2f7e
ffff8101fad5c780 1338032115 S Bi:4:048:5 -115 4096 <
ffff8101fad5c600 1338033006 S Bo:4:048:6 -115 95 = 7eff03c0 210c0200 12239471 674d5352 41535635 2e30302f 557e7eff 03c0210c
ffff8101fad5c780 1338033952 C Bi:4:048:5 0 40 = 7eff7d23 c0217d27 7d217d20 7d367d2c 7d227d20 7d322394 71674d53 52415356
ffff8101fad5c600 1338033959 C Bo:4:048:6 0 95 >
ffff8101fad5c600 1338037032 S Bi:4:048:5 -115 4096 <
ffff8101fad5c600 1338037955 C Bi:4:048:5 0 51 = 7eff7d23 c0217d27 7d227d20 237d2c7d 237d207d 3f239471 674d5352 41532d31
ffff8101fad5c600 1338042185 S Bi:4:048:5 -115 4096 <
ffff8101fad5c600 1338941006 C Bi:4:048:5 0 12 = 7eff03c0 23021900 04c3c57e
ffff8101fad5c600 1338947553 S Bo:4:048:6 -115 66 = 7eff0380 fd010400 0a120600 000001bd c17e7eff 03802101 05002802 06002d0f
ffff8101fad5c0c0 1338947579 S Bi:4:048:5 -115 4096 <
ffff8101fad5c600 1338948990 C Bo:4:048:6 0 66 >
ffff8101fad5c0c0 1338949012 C Bi:4:048:5 0 40 = 7eff7d23 c0217d28 7d237d20 7d3080fd 7d217d24 7d207d2a 7d327d26 7d207d20
ffff8101fad5c0c0 1338954180 S Bi:4:048:5 -115 4096 <
ffff8101fad5c0c0 1338955008 C Bi:4:048:5 0 18 = 7eff0380 21010400 0a0306a9 fe01012b 957e
ffff8101fad5c0c0 1338956337 S Bi:4:048:5 -115 4096 <
ffff8101fad5c0c0 1338957001 C Bi:4:048:5 0 30 = 7eff0380 21040500 16020600 2d0f0182 06000000 00840600 0000007c 9f7e
ffff8101fad5c0c0 1338957222 S Bo:4:048:6 -115 18 = 7eff0380 21020400 0a0306a9 fe010142 e17e
ffff8101fad5c0c0 1338957985 C Bo:4:048:6 0 18 >
ffff8101fad5c0c0 1338958235 S Bi:4:048:5 -115 4096 <
ffff8101fad5c600 1338959234 S Bo:4:048:6 -115 30 = 7eff0380 21010600 16030600 00000081 06000000 00830600 0000006a 5f7e
ffff8101fad5c0c0 1338960000 C Bi:4:048:5 0 30 = 7eff0380 21030600 16030619 e27a5581 06425e09 78830642 5e197834 a27e
ffff8101fad5c600 1338960004 C Bo:4:048:6 0 30 >
ffff8101fad5c600 1338962271 S Bo:4:048:6 -115 30 = 7eff0380 21010700 16030619 e27a5581 06425e09 78830642 5e1978f3 cf7e
ffff8101fad5c0c0 1338962288 S Bi:4:048:5 -115 4096 <
ffff8101fad5c600 1338962985 C Bo:4:048:6 0 30 >
ffff8101fad5c0c0 1338963005 C Bi:4:048:5 0 30 = 7eff0380 21020700 16030619 e27a5581 06425e09 78830642 5e197805 3c7e
ffff8101fad5c0c0 1338971865 S Bi:4:048:5 -115 4096 <
ffff8101fad5c600 1339150457 S Bo:4:048:6 -115 336 = 7eff0300 21450001 48005100 008011a5 1d19e27a 55ffffff ff004400 430134bc
ffff8101fad5c600 1339151008 C Bo:4:048:6 0 336 >
ffff810079682cc0 1343099057 S Bo:4:048:6 -115 336 = 7eff0300 21450001 48005200 008011a5 1c19e27a 55ffffff ff004400 430134b8
ffff810079682cc0 1343100244 C Bo:4:048:6 0 336 >
ffff8101c0796840 1401252319 S Bo:4:048:6 -115 34 = 7eff7d23 c0217d25 7d287d20 7d302394 71677d20 3ccd747d 207d207d 207d2074
ffff8101fad5c0c0 1401253475 C Bi:4:048:5 0 18 = 7eff7d23 c0217d26 7d287d20 7d24ee7d 5e7e
ffff8101c0796840 1401253482 C Bo:4:048:6 0 34 >
ffff8101c0796840 1401257058 S Bi:4:048:5 -115 4096 <
ffff8101c0796b40 1401312013 S Bo:4:048:6 -115 4 = 4154480d
ffff8101c0796b40 1401312469 C Bo:4:048:6 0 4 >
ffff8101c0796840 1401313498 C Bi:4:048:5 0 6 = 0d0a4f4b 0d0a
ffff8101c0796840 1401318175 S Bi:4:048:5 -115 4096 <
ffff8101c0796b40 1401321207 S Bo:4:048:6 -115 28 = 00000000 23000000 03000000 00c20100 71677d20 3ccd747d 78563412
ffff8101c0796b40 1401321475 C Bo:4:048:6 0 28 >
ffff8101c0796840 1401322486 C Bi:4:048:5 0 24 = 00000000 23000000 23000000 00c20100 18000000 78563412
ffff8101c0796840 1401324008 S Bi:4:048:5 -115 4096 <
ffff8101c0796b40 1401329706 S Bo:4:048:6 -115 3 = 41540d
ffff8101c0796840 1401330477 C Bi:4:048:5 0 6 = 0d0a4f4b 0d0a
ffff8101c0796b40 1401330483 C Bo:4:048:6 0 3 >
ffff8101c0796b40 1401333700 S Bi:4:048:5 -115 4096 <
ffff8101c0796840 1401341789 S Bo:4:048:6 -115 7 = 41544530 56310d
ffff8101c0796b40 1401342477 C Bi:4:048:5 0 6 = 0d0a4f4b 0d0a
ffff8101c0796840 1401342481 C Bo:4:048:6 0 7 >
ffff8101c0796840 1401346683 S Bi:4:048:5 -115 4096 <
ffff8101c0796b40 1401349717 S Bo:4:048:6 -115 3 = 41540d
ffff8101c0796b40 1401350461 C Bo:4:048:6 0 3 >
ffff8101c0796840 1401351474 C Bi:4:048:5 0 6 = 0d0a4f4b 0d0a
ffff8101c0796840 1401353981 S Bi:4:048:5 -115 4096 <
ffff8101c0796b40 1401362247 S Bo:4:048:6 -115 40 = 41542b63 6764636f 6e743d31 2c224950 222c2277 61702e76 6f696365 73747265
ffff8101c0796b40 1401362461 C Bo:4:048:6 0 40 >
ffff8101c0796840 1401363477 C Bi:4:048:5 0 6 = 0d0a4f4b 0d0a
ffff8101c0796840 1401365730 S Bi:4:048:5 -115 4096 <
ffff8101c0796b40 1401369681 S Bo:4:048:6 -115 7 = 41545330 3d300d
ffff8101c0796840 1401370479 C Bi:4:048:5 0 6 = 0d0a4f4b 0d0a
ffff8101c0796b40 1401370484 C Bo:4:048:6 0 7 >
ffff8101c0796b40 1401374729 S Bi:4:048:5 -115 4096 <
ffff8101c0796840 1401382645 S Bo:4:048:6 -115 12 = 01000000 00000000 78563412
ffff8101c0796840 1401383464 C Bo:4:048:6 0 12 >
ffff8101c0796840 1401384648 S Bo:4:048:6 -115 28 = 00000000 23000000 00000000 00c20100 222c2277 61702e76 78563412
ffff8101c0796840 1401385460 C Bo:4:048:6 0 28 >
