ffff810114d70a80 562514249 S Bo:4:055:6 -115 97 = 7eff0300 21450000 28010e40 0080066e fa0a0002 0fd155ad 63041a00 506bc998
ffff810114d70a80 562515764 C Bo:4:055:6 0 97 >
ffff8100443cf000 565721628 S Bo:4:055:6 -115 241 = 7eff0300 21450000 28011040 00800670 dc0a0002 0fd155ab 7f041800 500b0dfb
ffff8100443cf000 565722943 C Bo:4:055:6 0 241 >
ffff8100443cf000 566709778 S Bo:4:055:6 -115 56 = 7eff0300 21450000 30011a40 008006da 0c19e14a e0451175 cf041b00 50f77366
ffff8100443cf000 566710996 C Bo:4:055:6 0 56 >
ffff8101c0687cc0 567063031 C Bi:4:055:5 0 56 = 7eff0300 21450000 309ec800 00c60636 5e451175 cf19e14a e0005004 1bb33a1b
ffff8100443cf000 567067246 S Bo:4:055:6 -115 48 = 7eff0300 21450000 28011c40 008006da 1219e14a e0451175 cf041b00 50f77366
ffff8101f4408000 567067272 S Bi:4:055:5 -115 4096 <
ffff8100443cf000 567069011 C Bo:4:055:6 0 48 >
ffff8101f44089c0 567070533 S Bo:4:055:6 -115 679 = 7eff0300 21450002 9f011d40 008006d7 9a19e14a e0451175 cf041b00 50f77366
ffff8101f44089c0 567072012 C Bo:4:055:6 0 679 >
ffff8101f4408000 568083088 C Bi:4:055:5 0 49 = 7eff0300 21450000 28c7ec00 00c6060d 42451175 cf19e14a e0005004 1bb33a1b
ffff810037aaf000 568086457 S Bi:4:055:5 -115 4096 <
ffff810037aaf000 568233098 C Bi:4:055:5 0 1514 = 7eff0300 21450005 dcd9e000 00c606f5 99451175 cf19e14a e0005004 1bb33a1b
ffff810037aaf000 568247722 S Bi:4:055:5 -115 4096 <
ffff810037aaf000 568352328 C Bi:4:055:5 0 1525 = 7eff0300 21450005 dcd9ec00 00c606f5 8d451175 cf19e14a e0005004 1bb33a20
ffff810037aaf000 568355884 S Bo:4:055:6 -115 48 = 7eff0300 21450000 28011e40 008006da 1019e14a e0451175 cf041b00 50f77368
ffff810037aaff00 568355953 S Bi:4:055:5 -115 4096 <
ffff810037aaf000 568356086 C Bo:4:055:6 0 48 >
ffff810037aaff00 568676116 C Bi:4:055:5 0 1529 = 7eff0300 21450005 dc09e000 00c606c5 9a451175 cf19e14a e0005004 1bb33a26
ffff810037aaff00 568678799 S Bi:4:055:5 -115 4096 <
ffff810037aaff00 568731126 C Bi:4:055:5 0 1521 = 7eff0300 21450005 dc09e400 00c606c5 96451175 cf19e14a e0005004 1bb33a2c
ffff810037aaff00 568733586 S Bo:4:055:6 -115 48 = 7eff0300 21450000 28011f40 008006da 0f19e14a e0451175 cf041b00 50f77368
ffff810037aaf780 568733652 S Bi:4:055:5 -115 4096 <
ffff810037aaff00 568734106 C Bo:4:055:6 0 48 >
ffff810037aaf780 568791129 C Bi:4:055:5 0 1519 = 7eff0300 21450005 dc09e800 00c606c5 92451175 cf19e14a e0005004 1bb33a31
ffff810037aaf780 568796395 S Bi:4:055:5 -115 4096 <
ffff810037aafd80 568940486 S Bo:4:055:6 -115 48 = 7eff0300 21450000 28012040 008006da 0e19e14a e0451175 cf041b00 50f77368
ffff810037aafd80 568941129 C Bo:4:055:6 0 48 >
ffff810037aaf780 569017144 C Bi:4:055:5 0 1530 = 7eff0300 21450005 dc1a0000 00c606b5 7a451175 cf19e14a e0005004 1bb33a37
ffff810037aaf780 569017414 S Bo:4:055:6 -115 97 = 7eff0300 21450000 28012140 0080066e e70a0002 0fd155ad 63041a00 506bc998
ffff810037aaf780 569018166 C Bo:4:055:6 0 97 >
ffff810037aaf780 569020733 S Bi:4:055:5 -115 4096 <
ffff810037aafd80 569127013 S Bo:4:055:6 -115 48 = 7eff0300 21450000 28012340 008006da 0b19e14a e0451175 cf041b00 50f77368
ffff810037aafd80 569127129 C Bo:4:055:6 0 48 >
ffff810037aaf780 569291157 C Bi:4:055:5 0 1531 = 7eff0300 21450005 dc1a0400 00c606b5 76451175 cf19e14a e0005004 1bb33a3d
ffff8101f44089c0 569295634 S Bi:4:055:5 -115 4096 <
ffff8101f44089c0 569298152 C Bi:4:055:5 0 1522 = 7eff0300 21450005 dc1a0800 00c606b5 72451175 cf19e14a e0005004 1bb33a43
ffff8101f44089c0 569300474 S Bo:4:055:6 -115 48 = 7eff0300 21450000 28012440 008006da 0a19e14a e0451175 cf041b00 50f77368
ffff8101f4408000 569300495 S Bi:4:055:5 -115 4096 <
ffff8101f44089c0 569301135 C Bo:4:055:6 0 48 >
ffff8101f4408000 569302148 C Bi:4:055:5 0 1038 = 7eff0300 21450005 dc23a800 00c606ab d2451175 cf19e14a e0005004 1bb33a48
ffff8101f4408000 569305555 S Bi:4:055:5 -115 4096 <
ffff8101f4408000 569307151 C Bi:4:055:5 0 489 = 1c5b89c1 50e1bcb5 e1258bcc b38c4d2a 79d4f2ee 1bc37f6d e272fc15 2cdeb6ff
ffff8101f4408000 569315662 S Bi:4:055:5 -115 4096 <
ffff8101f44089c0 569456797 S Bo:4:055:6 -115 48 = 7eff0300 21450000 28012540 008006da 0919e14a e0451175 cf041b00 50f77368
ffff8101f44089c0 569457149 C Bo:4:055:6 0 48 >
ffff8101f4408000 569471165 C Bi:4:055:5 0 1521 = 7eff0300 21450005 dc23ac00 00c606ab ce451175 cf19e14a e0005004 1bb33a4e
ffff8101f4408000 569474945 S Bi:4:055:5 -115 4096 <
ffff8101f44089c0 569662976 S Bo:4:055:6 -115 48 = 7eff0300 21450000 28012640 008006da 0819e14a e0451175 cf041b00 50f77368
ffff8101f44089c0 569663160 C Bo:4:055:6 0 48 >
ffff8101f4408000 570580225 C Bi:4:055:5 0 1526 = 7eff0300 21450005 dc2dac00 00c606a1 ce451175 cf19e14a e0005004 1bb33a54
ffff8101fae8b300 570582370 S Bi:4:055:5 -115 4096 <
ffff8101fae8b300 570584223 C Bi:4:055:5 0 1522 = 7eff0300 21450005 dc2db000 00c606a1 ca451175 cf19e14a e0005004 1bb33a59
ffff8101fae8b300 570588471 S Bo:4:055:6 -115 48 = 7eff0300 21450000 28012740 008006da 0719e14a e0451175 cf041b00 50f77368
ffff8101fae8be40 570588493 S Bi:4:055:5 -115 4096 <
ffff8101fae8b300 570589207 C Bo:4:055:6 0 48 >
ffff8101fae8be40 570590220 C Bi:4:055:5 0 1042 = 7eff0300 21450005 dc360c00 00c60699 6e451175 cf19e14a e0005004 1bb33a5f
ffff8101fae8be40 570593519 S Bi:4:055:5 -115 4096 <
ffff8101fae8be40 570594228 C Bi:4:055:5 0 479 = af08fc12 f08eb86d bc7d5d67 a2ea979a 7d5e87a8 2fc72f0c 785be237 c0ef88df
ffff8101fae8be40 570598168 S Bi:4:055:5 -115 4096 <
ffff8101fae8be40 570761239 C Bi:4:055:5 0 1520 = 7eff0300 21450005 dc361000 00c60699 6a451175 cf19e14a e0005004 1bb33a65
ffff8101fae8be40 570764099 S Bo:4:055:6 -115 48 = 7eff0300 21450000 28012840 008006da 0619e14a e0451175 cf041b00 50f77368
ffff8101fae8b300 570764124 S Bi:4:055:5 -115 4096 <
ffff8101fae8be40 570764218 C Bo:4:055:6 0 48 >
ffff8101fae8b300 570766229 C Bi:4:055:5 0 1526 = 7eff0300 21450005 dc361400 00c60699 66451175 cf19e14a e0005004 1bb33a6b
ffff8101fae8b300 570771584 S Bi:4:055:5 -115 4096 <
ffff8101fae8be40 570873685 S Bo:4:055:6 -115 48 = 7eff0300 21450000 28012940 008006da 0519e14a e0451175 cf041b00 50f77368
ffff8101fae8be40 570874227 C Bo:4:055:6 0 48 >
ffff8101fae8b300 570888240 C Bi:4:055:5 0 1522 = 7eff0300 21450005 dc3e2400 00c60691 56451175 cf19e14a e0005004 1bb33a70
ffff8101fae8b300 570890642 S Bi:4:055:5 -115 4096 <
ffff8101fae8b300 570976251 C Bi:4:055:5 0 1528 = 7eff0300 21450005 dc3e2800 00c60691 52451175 cf19e14a e0005004 1bb33a76
ffff8101fae8b300 570983666 S Bo:4:055:6 -115 48 = 7eff0300 21450000 28012a40 008006da 0419e14a e0451175 cf041b00 50f77368
ffff8101fae8be40 570983688 S Bi:4:055:5 -115 4096 <
ffff8101fae8b300 570984229 C Bo:4:055:6 0 48 >
ffff8101fae8be40 571059254 C Bi:4:055:5 0 1523 = 7eff0300 21450005 dc59f800 00c60675 82451175 cf19e14a e0005004 1bb33a7c
ffff8101fae8be40 571067679 S Bi:4:055:5 -115 4096 <
ffff8101fae8be40 571157261 C Bi:4:055:5 0 1529 = 7eff0300 21450005 dc59fc00 00c60675 7d5e4511 75cf19e1 4ae00050 041bb33a
ffff8101c0662900 571165367 S Bo:4:055:6 -115 48 = 7eff0300 21450000 28012b40 008006da 0319e14a e0451175 cf041b00 50f77368
ffff8101c06620c0 571165442 S Bi:4:055:5 -115 4096 <
ffff8101c0662900 571166244 C Bo:4:055:6 0 48 >
ffff8101c06620c0 571167268 C Bi:4:055:5 0 1523 = 7eff0300 21450005 dc851c00 00c6064a 5e451175 cf19e14a e0005004 1bb33a87
ffff8101c06620c0 571170376 S Bi:4:055:5 -115 4096 <
ffff8101c06620c0 571172258 C Bi:4:055:5 0 1038 = 7eff0300 21450005 dc852000 00c6064a 5a451175 cf19e14a e0005004 1bb33a8d
ffff8101c06620c0 571173395 S Bi:4:055:5 -115 4096 <
ffff8101c06620c0 571174256 C Bi:4:055:5 0 485 = 51f82ff1 2adadbe2 ceafc38f 815aa7c6 1f14f8db c257bf1b dfe24f8e 74af19e8
ffff8101c06620c0 571178641 S Bo:4:055:6 -115 48 = 7eff0300 21450000 28012c40 008006da 0219e14a e0451175 cf041b00 50f77368
ffff8101c0662900 571178705 S Bi:4:055:5 -115 4096 <
ffff8101c06620c0 571179243 C Bo:4:055:6 0 48 >
ffff8101c0662900 571181264 C Bi:4:055:5 0 1525 = 7eff0300 21450005 dc852400 00c6064a 56451175 cf19e14a e0005004 1bb33a92
ffff8101c0662900 571183808 S Bi:4:055:5 -115 4096 <
ffff8101c0662900 571185260 C Bi:4:055:5 0 1038 = 7eff0300 21450005 dc8fb400 00c6063f c6451175 cf19e14a e0005004 1bb33a98
ffff8101c0662900 571190205 S Bi:4:055:5 -115 4096 <
ffff8101c0662900 571191259 C Bi:4:055:5 0 487 = f88628fc 057769e2 df157c18 d0a7f0ff 00c5ef86 fac476fe 24f889a6 7887e235
ffff8101c0662900 571199676 S Bo:4:055:6 -115 48 = 7eff0300 21450000 28012d40 008006da 0119e14a e0451175 cf041b00 50f77368
ffff8101c06620c0 571199771 S Bi:4:055:5 -115 4096 <
ffff8101c0662900 571200254 C Bo:4:055:6 0 48 >
ffff8101c06620c0 571256266 C Bi:4:055:5 0 1522 = 7eff0300 21450005 dc8fb800 00c6063f c2451175 cf19e14a e0005004 1bb33a9e
ffff8101c06620c0 571262863 S Bi:4:055:5 -115 4096 <
ffff8101c06620c0 571311269 C Bi:4:055:5 0 1525 = 7eff0300 21450005 dc8fbc00 00c6063f be451175 cf19e14a e0005004 1bb33aa4
ffff8101c06620c0 571320764 S Bo:4:055:6 -115 48 = 7eff0300 21450000 28012e40 008006da 0019e14a e0451175 cf041b00 50f77368
ffff8101c0662900 571320825 S Bi:4:055:5 -115 4096 <
ffff8101c06620c0 571321260 C Bo:4:055:6 0 48 >
ffff8101c0662900 571599285 C Bi:4:055:5 0 1518 = 7eff0300 21450005 dc90ec00 00c6063e 8e451175 cf19e14a e0005004 1bb33aa9
ffff81019bc1b840 571602347 S Bi:4:055:5 -115 4096 <
ffff81019bc1b840 571684291 C Bi:4:055:5 0 1523 = 7eff0300 21450005 dc90f000 00c6063e 8a451175 cf19e14a e0005004 1bb33aaf
ffff81019bc1b840 571691681 S Bo:4:055:6 -115 48 = 7eff0300 21450000 28012f40 008006d9 ff19e14a e0451175 cf041b00 50f77368
ffff8101ef145480 571691744 S Bi:4:055:5 -115 4096 <
ffff81019bc1b840 571692271 C Bo:4:055:6 0 48 >
ffff8101ef145480 571694280 C Bi:4:055:5 0 1519 = 7eff0300 21450005 dc958400 00c60639 f6451175 cf19e14a e0005004 1bb33ab5
ffff8101ef145480 571697434 S Bi:4:055:5 -115 4096 <
ffff8101ef145480 571699286 C Bi:4:055:5 0 1050 = 7eff0300 21450005 dc958800 00c60639 f2451175 cf19e14a e0005004 1bb33aba
ffff8101ef145480 571702271 S Bi:4:055:5 -115 4096 <
ffff8101ef145480 571703339 C Bi:4:055:5 0 466 = 743f154c fa669df1 0afbc27f 0feffe09 f82fc21f 052cb448 3e1f7c43 f1a78af4
ffff8101ef145480 571706662 S Bo:4:055:6 -115 48 = 7eff0300 21450000 28013040 008006d9 fe19e14a e0451175 cf041b00 50f77368
ffff8101f46dc180 571706731 S Bi:4:055:5 -115 4096 <
ffff8101ef145480 571707272 C Bo:4:055:6 0 48 >
ffff8101f46dc180 571709280 C Bi:4:055:5 0 1523 = 7eff0300 21450005 dc958c00 00c60639 ee451175 cf19e14a e0005004 1bb33ac0
ffff8101f46dc180 571718956 S Bi:4:055:5 -115 4096 <
ffff8101f46dc840 571844804 S Bo:4:055:6 -115 48 = 7eff0300 21450000 28013140 008006d9 fd19e14a e0451175 cf041b00 50f77368
ffff8101f46dc840 571845280 C Bo:4:055:6 0 48 >
ffff8101f46dc180 571919304 C Bi:4:055:5 0 1519 = 7eff0300 21450005 dc9f6400 00c60630 16451175 cf19e14a e0005004 1bb33ac6
ffff810148114a80 571923942 S Bi:4:055:5 -115 4096 <
ffff810148114a80 571926300 C Bi:4:055:5 0 1524 = 7eff0300 21450005 dc9f6800 00c60630 12451175 cf19e14a e0005004 1bb33acb
ffff810148114a80 571929701 S Bo:4:055:6 -115 48 = 7eff0300 21450000 28013240 008006d9 fc19e14a e0451175 cf041b00 50f77368
ffff8101481149c0 571929769 S Bi:4:055:5 -115 4096 <
ffff810148114a80 571930297 C Bo:4:055:6 0 48 >
ffff8101481149c0 571931307 C Bi:4:055:5 0 1050 = 7eff0300 21450005 dc9f6c00 00c60630 0e451175 cf19e14a e0005004 1bb33ad1
ffff8101481149c0 571933247 S Bi:4:055:5 -115 4096 <
ffff8101481149c0 571934304 C Bi:4:055:5 0 476 = 776df10a ce7d5d22 db4fd02d be29f8ba ebc5be32 b59be1af 863e22f8 fbbef036
ffff8101481149c0 571937295 S Bi:4:055:5 -115 4096 <
ffff8101481149c0 571939300 C Bi:4:055:5 0 1525 = 7eff0300 21450005 dca13c00 00c6062e 3e451175 cf19e14a e0005004 1bb33ad7
ffff8101481149c0 571943134 S Bo:4:055:6 -115 48 = 7eff0300 21450000 28013340 008006d9 fb19e14a e0451175 cf041b00 50f77368
ffff810148114a80 571943204 S Bi:4:055:5 -115 4096 <
ffff8101481149c0 571943295 C Bo:4:055:6 0 48 >
ffff810148114a80 571957305 C Bi:4:055:5 0 1522 = 7eff0300 21450005 dca14000 00c6062e 3a451175 cf19e14a e0005004 1bb33add
ffff810148114a80 571960215 S Bi:4:055:5 -115 4096 <
ffff810148114a80 572018310 C Bi:4:055:5 0 1517 = 7eff0300 21450005 dca14400 00c6062e 36451175 cf19e14a e0005004 1bb33ae2
ffff8101fae8b540 572020893 S Bo:4:055:6 -115 48 = 7eff0300 21450000 28013440 008006d9 fa19e14a e0451175 cf041b00 50f77368
ffff8101fae8bb40 572020916 S Bi:4:055:5 -115 4096 <
ffff8101fae8b540 572021289 C Bo:4:055:6 0 48 >
ffff8101fae8bb40 572096311 C Bi:4:055:5 0 1518 = 7eff0300 21450005 dca24000 00c6062d 3a451175 cf19e14a e0005004 1bb33ae8
ffff8101fae8bb40 572103242 S Bi:4:055:5 -115 4096 <
ffff8101fae8bb40 572152315 C Bi:4:055:5 0 1522 = 7eff0300 21450005 dca24400 00c6062d 36451175 cf19e14a e0005004 1bb33aee
ffff8101fae8bb40 572154565 S Bo:4:055:6 -115 48 = 7eff0300 21450000 28013540 008006d9 f919e14a e0451175 cf041b00 50f77368
ffff8101fae8b540 572154588 S Bi:4:055:5 -115 4096 <
ffff8101fae8bb40 572155294 C Bo:4:055:6 0 48 >
ffff8101fae8b540 572211319 C Bi:4:055:5 0 1524 = 7eff0300 21450005 dca24800 00c6062d 32451175 cf19e14a e0005004 1bb33af3
ffff8101fae8b540 572215664 S Bi:4:055:5 -115 4096 <
ffff8101fae8b540 572276322 C Bi:4:055:5 0 1521 = 7eff0300 21450005 dcaa3000 00c60625 4a451175 cf19e14a e0005004 1bb33af9
ffff8101fae8b540 572279136 S Bo:4:055:6 -115 49 = 7eff0300 21450000 28013640 008006d9 f819e14a e0451175 cf041b00 50f77368
ffff8101fae8bb40 572279158 S Bi:4:055:5 -115 4096 <
ffff8101fae8b540 572279301 C Bo:4:055:6 0 49 >
ffff8101fae8bb40 572578332 C Bi:4:055:5 0 1519 = 7eff0300 21450005 dcaa3400 00c60625 46451175 cf19e14a e0005004 1bb33aff
ffff8101fae8bb40 572584056 S Bi:4:055:5 -115 4096 <
ffff8101fae8bb40 572586333 C Bi:4:055:5 0 1522 = 7eff0300 21450005 dcaa3800 00c60625 42451175 cf19e14a e0005004 1bb33b04
ffff8101fae8bb40 572589249 S Bo:4:055:6 -115 48 = 7eff0300 21450000 28013740 008006d9 f719e14a e0451175 cf041b00 50f77368
ffff8101fae8b540 572589271 S Bi:4:055:5 -115 4096 <
ffff8101fae8bb40 572590318 C Bo:4:055:6 0 48 >
ffff8101fae8b540 572591330 C Bi:4:055:5 0 1050 = 7eff0300 21450005 dcbb1c00 00c60614 5e451175 cf19e14a e0005004 1bb33b0a
ffff8101fae8b540 572593709 S Bi:4:055:5 -115 4096 <
ffff8101fae8b540 572594334 C Bi:4:055:5 0 470 = 00087c71 f0e268df 113e1c78 7353ff00 85597d5d a3eade3b f15f83ef af349d77
ffff8101fae8b540 572598781 S Bi:4:055:5 -115 4096 <
ffff8101fae8b540 572601339 C Bi:4:055:5 0 1521 = 7eff0300 21450005 dcbb2000 00c60614 5a451175 cf19e14a e0005004 1bb33b10
ffff8101fae8b540 572603830 S Bo:4:055:6 -115 48 = 7eff0300 21450000 28013840 008006d9 f619e14a e0451175 cf041b00 50f77368
ffff8101fae8bb40 572603853 S Bi:4:055:5 -115 4096 <
ffff8101fae8b540 572604320 C Bo:4:055:6 0 48 >
ffff8101fae8bb40 572617336 C Bi:4:055:5 0 1522 = 7eff0300 21450005 dcbb2400 00c60614 56451175 cf19e14a e0005004 1bb33b16
ffff8101fae8bb40 572620382 S Bi:4:055:5 -115 4096 <
ffff8101fae8bb40 572677344 C Bi:4:055:5 0 1519 = 7eff0300 21450005 dcbc4000 00c60613 3a451175 cf19e14a e0005004 1bb33b1b
ffff8101fae8bb40 572680724 S Bo:4:055:6 -115 48 = 7eff0300 21450000 28013940 008006d9 f519e14a e0451175 cf041b00 50f77368
ffff8101fae8b540 572680746 S Bi:4:055:5 -115 4096 <
ffff8101fae8bb40 572681323 C Bo:4:055:6 0 48 >
ffff8101fae8b540 572710341 C Bi:4:055:5 0 1523 = 7eff0300 21450005 dcbc4400 00c60613 36451175 cf19e14a e0005004 1bb33b21
ffff8101fae8b540 572714385 S Bi:4:055:5 -115 4096 <
ffff8101fae8b540 572774352 C Bi:4:055:5 0 1521 = 7eff0300 21450005 dcbc4800 00c60613 32451175 cf19e14a e0005004 1bb33b27
ffff8101fae8b540 572779761 S Bo:4:055:6 -115 48 = 7eff0300 21450000 28013a40 008006d9 f419e14a e0451175 cf041b00 50f77368
ffff8101fae8bb40 572779783 S Bi:4:055:5 -115 4096 <
ffff8101fae8b540 572780331 C Bo:4:055:6 0 48 >
ffff8101fae8bb40 572857355 C Bi:4:055:5 0 1533 = 7eff0300 21450005 dcc23000 00c6060d 4a451175 cf19e14a e0005004 1bb33b2c
ffff8101fae8bb40 572859653 S Bi:4:055:5 -115 4096 <
ffff8101fae8b540 573073493 S Bo:4:055:6 -115 48 = 7eff0300 21450000 28013b40 008006d9 f319e14a e0451175 cf041b00 50f77368
ffff8101fae8b540 573074348 C Bo:4:055:6 0 48 >
ffff8101fae8bb40 573136364 C Bi:4:055:5 0 1520 = 7eff0300 21450005 dcc23400 00c6060d 46451175 cf19e14a e0005004 1bb33b32
ffff8101fae8bb40 573141269 S Bi:4:055:5 -115 4096 <
ffff8101fae8b540 573225801 S Bo:4:055:6 -115 48 = 7eff0300 21450000 28013c40 008006d9 f219e14a e0451175 cf041b00 50f77368
ffff8101fae8b540 573226358 C Bo:4:055:6 0 48 >
ffff8101fae8bb40 573238370 C Bi:4:055:5 0 1523 = 7eff0300 21450005 dcc69400 00c60608 e6451175 cf19e14a e0005004 1bb33b38
ffff8101fae8bb40 573241489 S Bi:4:055:5 -115 4096 <
ffff8101fae8bb40 573243371 C Bi:4:055:5 0 1518 = 7eff0300 21450005 dcc69800 00c60608 e2451175 cf19e14a e0005004 1bb33b3e
ffff8101fae8bb40 573246829 S Bo:4:055:6 -115 48 = 7eff0300 21450000 28013d40 008006d9 f119e14a e0451175 cf041b00 50f77368
ffff8101fae8b540 573246850 S Bi:4:055:5 -115 4096 <
ffff8101fae8bb40 573247355 C Bo:4:055:6 0 48 >
ffff8101fae8b540 573248369 C Bi:4:055:5 0 1050 = 7eff0300 21450005 dcc69c00 00c60608 de451175 cf19e14a e0005004 1bb33b43
ffff8101fae8b540 573250144 S Bi:4:055:5 -115 4096 <
ffff8101fae8b540 573251369 C Bi:4:055:5 0 471 = 47f1ef80 fe22e83f 163e2278 0fe33e89 e2ef0c78 dbfb697c 29ab697a 07893e18
ffff8101fae8b540 573253413 S Bi:4:055:5 -115 4096 <
ffff8101fae8b540 573399385 C Bi:4:055:5 0 1526 = 7eff0300 21450005 dcc73000 00c60608 4a451175 cf19e14a e0005004 1bb33b49
ffff8101fae8b540 573405474 S Bo:4:055:6 -115 48 = 7eff0300 21450000 28013e40 008006d9 f019e14a e0451175 cf041b00 50f77368
ffff8101fae8bb40 573405496 S Bi:4:055:5 -115 4096 <
ffff8101fae8b540 573406364 C Bo:4:055:6 0 48 >
ffff8101fae8bb40 573407376 C Bi:4:055:5 0 1522 = 7eff0300 21450005 dcc73400 00c60608 46451175 cf19e14a e0005004 1bb33b4f
ffff8101fae8bb40 573412162 S Bi:4:055:5 -115 4096 <
ffff8101fae8bb40 573483391 C Bi:4:055:5 0 1521 = 7eff0300 21450005 dcc73800 00c60608 42451175 cf19e14a e0005004 1bb33b54
ffff8101fae8bb40 573486711 S Bo:4:055:6 -115 48 = 7eff0300 21450000 28013f40 008006d9 ef19e14a e0451175 cf041b00 50f77368
ffff8101fae8b540 573486734 S Bi:4:055:5 -115 4096 <
ffff8101fae8bb40 573487368 C Bo:4:055:6 0 48 >
ffff8101fae8b540 573489377 C Bi:4:055:5 0 1520 = 7eff0300 21450005 dccb7800 00c60604 02451175 cf19e14a e0005004 1bb33b5a
ffff8101fae8b540 573496235 S Bi:4:055:5 -115 4096 <
ffff8101fae8b540 573498384 C Bi:4:055:5 0 1050 = 7eff0300 21450005 dccb7c00 00c60603 fe451175 cf19e14a e0005004 1bb33b60
ffff8101fae8b540 573502091 S Bi:4:055:5 -115 4096 <
ffff8101fae8b540 573503384 C Bi:4:055:5 0 480 = 6fe1ff00 88dfda7f 19adb1b4 7f865e2d f891a77c 50f87d5d e35f88fe 06d1a0f0
ffff8101fae8b540 573506090 S Bo:4:055:6 -115 48 = 7eff0300 21450000 28014040 008006d9 ee19e14a e0451175 cf041b00 50f77368
ffff8101fae8bb40 573506112 S Bi:4:055:5 -115 4096 <
ffff8101fae8b540 573506369 C Bo:4:055:6 0 48 >
ffff8101fae8bb40 573699403 C Bi:4:055:5 0 1525 = 7eff0300 21450005 dccb8000 00c60603 fa451175 cf19e14a e0005004 1bb33b65
ffff8100b66d1b40 573707706 S Bi:4:055:5 -115 4096 <
ffff8100b66d1b40 573710401 C Bi:4:055:5 0 1530 = 7eff0300 21450005 dcd48400 00c606fa f5451175 cf19e14a e0005004 1bb33b6b
ffff8100b66d1b40 573714669 S Bo:4:055:6 -115 48 = 7eff0300 21450000 28014340 008006d9 eb19e14a e0451175 cf041b00 50f77368
ffff8100b66d1000 573714740 S Bi:4:055:5 -115 4096 <
ffff8100b66d1b40 573715394 C Bo:4:055:6 0 48 >
ffff8100b66d1000 573716402 C Bi:4:055:5 0 1034 = 7eff0300 21450005 dcd48800 00c606fa f1451175 cf19e14a e0005004 1bb33b71
ffff8100b66d1000 573718530 S Bi:4:055:5 -115 4096 <
ffff8100b66d1000 573719399 C Bi:4:055:5 0 497 = f82fe2e5 be93f0cb 58d57c41 a16abe1d f1bcda56 abe02f8e 7abfc0bd 2f55d26c
ffff8100b66d1000 573723235 S Bi:4:055:5 -115 4096 <
ffff8100b66d1000 573782420 C Bi:4:055:5 0 1526 = 7eff0300 21450005 dcd48c00 00c606fa ed451175 cf19e14a e0005004 1bb33b77
ffff8100b66d1000 573786317 S Bo:4:055:6 -115 48 = 7eff0300 21450000 28014440 008006d9 ea19e14a e0451175 cf041b00 50f77368
ffff8100b66d1b40 573786386 S Bi:4:055:5 -115 4096 <
ffff8100b66d1000 573787389 C Bo:4:055:6 0 48 >
ffff8100b66d1b40 573788408 C Bi:4:055:5 0 1523 = 7eff0300 21450005 dce16800 00c606ee 11451175 cf19e14a e0005004 1bb33b7c
ffff8100b66d1b40 573791492 S Bi:4:055:5 -115 4096 <
ffff8101f4758600 573930288 S Bo:4:055:6 -115 48 = 7eff0300 21450000 28014540 008006d9 e919e14a e0451175 cf041b00 50f77368
ffff8101f4758600 573931397 C Bo:4:055:6 0 48 >
ffff8100b66d1b40 573958426 C Bi:4:055:5 0 1519 = 7eff0300 21450005 dce16c00 00c606ee 0d451175 cf19e14a e0005004 1bb33b82
ffff8101f4758600 573962638 S Bi:4:055:5 -115 4096 <
ffff8101f4758600 573964418 C Bi:4:055:5 0 1526 = 7eff0300 21450005 dce17000 00c606ee 09451175 cf19e14a e0005004 1bb33b88
ffff8101fae8b540 573967711 S Bo:4:055:6 -115 48 = 7eff0300 21450000 28014640 008006d9 e819e14a e0451175 cf041b00 50f77368
ffff8101fae8b000 573967735 S Bi:4:055:5 -115 4096 <
ffff8101fae8b540 573968397 C Bo:4:055:6 0 48 >
ffff8101fae8b000 574041421 C Bi:4:055:5 0 1522 = 7eff0300 21450005 dcf50c00 00c606da 6d451175 cf19e14a e0005004 1bb33b8d
ffff8101fae8b000 574048184 S Bi:4:055:5 -115 4096 <
ffff8101fae8b000 574050416 C Bi:4:055:5 0 1522 = 7eff0300 21450005 dcf51000 00c606da 69451175 cf19e14a e0005004 1bb33b93
ffff8101fae8b000 574054848 S Bo:4:055:6 -115 48 = 7eff0300 21450000 28014740 008006d9 e719e14a e0451175 cf041b00 50f77368
ffff8101fae8b000 574055400 C Bo:4:055:6 0 48 >
ffff8101fae8b000 574055725 S Bi:4:055:5 -115 4096 <
ffff8101fae8b000 574057412 C Bi:4:055:5 0 1046 = 7eff0300 21450005 dcf51400 00c606da 65451175 cf19e14a e0005004 1bb33b99
ffff8101fae8b000 574058446 S Bi:4:055:5 -115 4096 <
ffff8101fae8b000 574059415 C Bi:4:055:5 0 473 = 5ed7747f 065feade 23f827e1 1fda12e7 421f0fbf 677f82da 65dfc45f 841f117c
ffff8101fae8b000 574062169 S Bi:4:055:5 -115 4096 <
ffff8101fae8b000 574064417 C Bi:4:055:5 0 1524 = 7eff0300 21450005 dcf5c000 00c606d9 b9451175 cf19e14a e0005004 1bb33b9e
ffff8101fae8b000 574066996 S Bo:4:055:6 -115 48 = 7eff0300 21450000 28014840 008006d9 e619e14a e0451175 cf041b00 50f77368
ffff8101fae8b540 574067018 S Bi:4:055:5 -115 4096 <
ffff8101fae8b000 574067401 C Bo:4:055:6 0 48 >
ffff8101fae8b540 574318429 C Bi:4:055:5 0 1532 = 7eff0300 21450005 dcf5c400 00c606d9 b5451175 cf19e14a e0005004 1bb33ba4
ffff8101fae8b540 574321205 S Bi:4:055:5 -115 4096 <
ffff8101fae8b540 574323430 C Bi:4:055:5 0 1526 = 7eff0300 21450005 dcf5c800 00c606d9 b1451175 cf19e14a e0005004 1bb33baa
ffff8101fae8b540 574326720 S Bo:4:055:6 -115 48 = 7eff0300 21450000 28014940 008006d9 e519e14a e0451175 cf041b00 50f77368
ffff8101fae8b000 574326743 S Bi:4:055:5 -115 4096 <
ffff8101fae8b540 574327417 C Bo:4:055:6 0 48 >
ffff8101fae8b000 574503446 C Bi:4:055:5 0 1522 = 7eff0300 21450005 dcfb2400 00c606d4 55451175 cf19e14a e0005004 1bb33bb0
ffff8101fae8b000 574506050 S Bi:4:055:5 -115 4096 <
ffff8101fae8b000 574508442 C Bi:4:055:5 0 1522 = 7eff0300 21450005 dcfb2800 00c606d4 51451175 cf19e14a e0005004 1bb33bb5
ffff8101fae8b000 574513114 S Bo:4:055:6 -115 48 = 7eff0300 21450000 28014a40 008006d9 e419e14a e0451175 cf041b00 50f77368
ffff8101fae8b540 574513135 S Bi:4:055:5 -115 4096 <
ffff8101fae8b000 574513426 C Bo:4:055:6 0 48 >
ffff8101fae8b540 574514440 C Bi:4:055:5 0 1046 = 7eff0300 21450005 dcfb2c00 00c606d4 4d451175 cf19e14a e0005004 1bb33bbb
ffff8101fae8b540 574516389 S Bi:4:055:5 -115 4096 <
ffff8101fae8b540 574517446 C Bi:4:055:5 0 475 = 3e10d3b5 8b9f065a 7c62f8a7 a0fc59f8 7179e29f 00fc201a 49f88fe3 9f0978ef
ffff8101fae8b540 574522710 S Bi:4:055:5 -115 4096 <
ffff8101fae8b540 574525446 C Bi:4:055:5 0 1521 = 7eff0300 21450005 dcff8800 00c606cf f1451175 cf19e14a e0005004 1bb33bc1
ffff8101fae8b540 574528321 S Bo:4:055:6 -115 48 = 7eff0300 21450000 28014b40 008006d9 e319e14a e0451175 cf041b00 50f77368
ffff8101fae8b000 574528342 S Bi:4:055:5 -115 4096 <
ffff8101fae8b540 574528427 C Bo:4:055:6 0 48 >
ffff8101fae8b000 574630455 C Bi:4:055:5 0 1520 = 7eff0300 21450005 dcff8c00 00c606cf ed451175 cf19e14a e0005004 1bb33bc6
ffff8101fae8b000 574634947 S Bi:4:055:5 -115 4096 <
ffff8101fae8b000 574719459 C Bi:4:055:5 0 1530 = 7eff0300 21450005 dcff9000 00c606cf e9451175 cf19e14a e0005004 1bb33bcc
ffff8101fae8b000 574722758 S Bo:4:055:6 -115 48 = 7eff0300 21450000 28014c40 008006d9 e219e14a e0451175 cf041b00 50f77368
ffff8101fae8b540 574722781 S Bi:4:055:5 -115 4096 <
ffff8101fae8b000 574723438 C Bo:4:055:6 0 48 >
ffff8101fae8b540 574818465 C Bi:4:055:5 0 1523 = 7eff0300 21450005 dc0fec00 00c606bf 8e451175 cf19e14a e0005004 1bb33bd2
ffff8101fae8b540 574826770 S Bi:4:055:5 -115 4096 <
ffff8101fae8b540 574829462 C Bi:4:055:5 0 1530 = 7eff0300 21450005 dc0ff000 00c606bf 8a451175 cf19e14a e0005004 1bb33bd8
ffff8101fae8b540 574835162 S Bo:4:055:6 -115 49 = 7eff0300 21450000 28014d40 008006d9 e119e14a e0451175 cf041b00 50f77368
ffff8101fae8b000 574835184 S Bi:4:055:5 -115 4096 <
ffff8101fae8b540 574835444 C Bo:4:055:6 0 49 >
ffff8101fae8b000 574872467 C Bi:4:055:5 0 1523 = 7eff0300 21450005 dc1ab400 00c606b4 c6451175 cf19e14a e0005004 1bb33bdd
ffff8101fae8b000 574875276 S Bi:4:055:5 -115 4096 <
ffff8101fae8b000 574877462 C Bi:4:055:5 0 1527 = 7eff0300 21450005 dc1ab800 00c606b4 c2451175 cf19e14a e0005004 1bb33be3
ffff8101fae8b000 574883667 S Bo:4:055:6 -115 48 = 7eff0300 21450000 28014e40 008006d9 e019e14a e0451175 cf041b00 50f77368
ffff8101fae8b540 574883688 S Bi:4:055:5 -115 4096 <
ffff8101fae8b000 574884446 C Bo:4:055:6 0 48 >
ffff8101fae8b540 575018475 C Bi:4:055:5 0 1518 = 7eff0300 21450005 dc1b8400 00c606b3 f6451175 cf19e14a e0005004 1bb33be9
ffff8101fae8b540 575023177 S Bi:4:055:5 -115 4096 <
ffff8101fae8b540 575025471 C Bi:4:055:5 0 1517 = 7eff0300 21450005 dc1b8800 00c606b3 f2451175 cf19e14a e0005004 1bb33bee
ffff8101fae8b540 575027847 S Bo:4:055:6 -115 48 = 7eff0300 21450000 28014f40 008006d9 df19e14a e0451175 cf041b00 50f77368
ffff8101fae8b000 575027868 S Bi:4:055:5 -115 4096 <
ffff8101fae8b540 575028456 C Bo:4:055:6 0 48 >
ffff8101fae8b000 575176485 C Bi:4:055:5 0 1526 = 7eff0300 21450005 dc1b8c00 00c606b3 ee451175 cf19e14a e0005004 1bb33bf4
ffff8101fae8b000 575183668 S Bi:4:055:5 -115 4096 <
ffff8101fae8b000 575185479 C Bi:4:055:5 0 1516 = 7eff0300 21450005 dc24ec00 00c606aa 8e451175 cf19e14a e0005004 1bb33bfa
ffff8101fae8b000 575188254 S Bo:4:055:6 -115 49 = 7eff0300 21450000 28015040 008006d9 de19e14a e0451175 cf041b00 50f77368
ffff8101fae8b540 575188275 S Bi:4:055:5 -115 4096 <
ffff8101fae8b000 575188463 C Bo:4:055:6 0 49 >
ffff8101fae8b540 575275490 C Bi:4:055:5 0 1520 = 7eff0300 21450005 dc24f000 00c606aa 8a451175 cf19e14a e0005004 1bb33bff
ffff8101fae8b540 575278985 S Bi:4:055:5 -115 4096 <
ffff8101fae8b540 575281484 C Bi:4:055:5 0 1524 = 7eff0300 21450005 dc24f400 00c606aa 86451175 cf19e14a e0005004 1bb33c05
ffff8101fae8b540 575289062 S Bo:4:055:6 -115 48 = 7eff0300 21450000 28015140 008006d9 dd19e14a e0451175 cf041b00 50f77368
ffff8101fae8b000 575289083 S Bi:4:055:5 -115 4096 <
ffff8101fae8b540 575289469 C Bo:4:055:6 0 48 >
ffff8101fae8b540 575336239 S Bo:4:055:6 -115 241 = 7eff0300 21450000 28015240 00800670 9a0a0002 0fd155ab 7f041800 500b0dfb
ffff8101fae8b540 575337477 C Bo:4:055:6 0 241 >
ffff8101fae8b000 575355488 C Bi:4:055:5 0 1520 = 7eff0300 21450005 dc288400 00c606a6 f6451175 cf19e14a e0005004 1bb33c0b
ffff8101fae8b000 575358029 S Bi:4:055:5 -115 4096 <
ffff8101fae8b000 575360489 C Bi:4:055:5 0 1528 = 7eff0300 21450005 dc288800 00c606a6 f2451175 cf19e14a e0005004 1bb33c11
ffff8101fae8b000 575363096 S Bo:4:055:6 -115 48 = 7eff0300 21450000 28015740 008006d9 d719e14a e0451175 cf041b00 50f77368
ffff8101fae8b540 575363118 S Bi:4:055:5 -115 4096 <
ffff8101fae8b000 575363473 C Bo:4:055:6 0 48 >
ffff8101fae8b540 575517503 C Bi:4:055:5 0 1523 = 7eff0300 21450005 dc288c00 00c606a6 ee451175 cf19e14a e0005004 1bb33c16
ffff8101fae8b540 575521041 S Bi:4:055:5 -115 4096 <
ffff8101fae8b540 575523497 C Bi:4:055:5 0 1524 = 7eff0300 21450005 dc29cc00 00c606a5 ae451175 cf19e14a e0005004 1bb33c1c
ffff8101fae8b540 575526285 S Bo:4:055:6 -115 48 = 7eff0300 21450000 28015840 008006d9 d619e14a e0451175 cf041b00 50f77368
ffff8101fae8b000 575526308 S Bi:4:055:5 -115 4096 <
ffff8101fae8b540 575526481 C Bo:4:055:6 0 48 >
ffff8101fae8b000 575675512 C Bi:4:055:5 0 1528 = 7eff0300 21450005 dc29d000 00c606a5 aa451175 cf19e14a e0005004 1bb33c22
ffff810137f9aa80 575678518 S Bi:4:055:5 -115 4096 <
ffff810137f9aa80 575680511 C Bi:4:055:5 0 1522 = 7eff0300 21450005 dc29d400 00c606a5 a6451175 cf19e14a e0005004 1bb33c27
ffff810137f9aa80 575684273 S Bo:4:055:6 -115 48 = 7eff0300 21450000 28015940 008006d9 d519e14a e0451175 cf041b00 50f77368
ffff810137f9a3c0 575684338 S Bi:4:055:5 -115 4096 <
ffff810137f9aa80 575684538 C Bo:4:055:6 0 48 >
ffff810137f9a3c0 575813520 C Bi:4:055:5 0 1519 = 7eff0300 21450005 dc386000 00c60697 1a451175 cf19e14a e0005004 1bb33c2d
ffff810137f9a3c0 575818250 S Bi:4:055:5 -115 4096 <
ffff810137f9a3c0 575894537 C Bi:4:055:5 0 1523 = 7eff0300 21450005 dc386400 00c60697 16451175 cf19e14a e0005004 1bb33c33
ffff810137f9a3c0 575906333 S Bo:4:055:6 -115 48 = 7eff0300 21450000 28015a40 008006d9 d419e14a e0451175 cf041b00 50f77368
ffff810137f9aa80 575907451 S Bi:4:055:5 -115 4096 <
ffff810137f9a3c0 575907508 C Bo:4:055:6 0 48 >
ffff810137f9aa80 575909531 C Bi:4:055:5 0 1519 = 7eff0300 21450005 dc386800 00c60697 12451175 cf19e14a e0005004 1bb33c38
ffff810137f9aa80 575913291 S Bi:4:055:5 -115 4096 <
ffff810137f9aa80 575984531 C Bi:4:055:5 0 1519 = 7eff0300 21450005 dc3eac00 00c60690 ce451175 cf19e14a e0005004 1bb33c3e
ffff810137f9aa80 575990272 S Bo:4:055:6 -115 48 = 7eff0300 21450000 28015b40 008006d9 d319e14a e0451175 cf041b00 50f77368
ffff810137f9ac00 575990341 S Bi:4:055:5 -115 4096 <
ffff810137f9aa80 575990575 C Bo:4:055:6 0 48 >
ffff810137f9ac00 575992521 C Bi:4:055:5 0 1524 = 7eff0300 21450005 dc3eb000 00c60690 ca451175 cf19e14a e0005004 1bb33c44
ffff810137f9ac00 575995298 S Bi:4:055:5 -115 4096 <
ffff810137f9ac00 575997529 C Bi:4:055:5 0 1050 = 7eff0300 21450005 dc3eb400 00c60690 c6451175 cf19e14a e0005004 1bb33c4a
ffff810137f9ac00 575999219 S Bi:4:055:5 -115 4096 <
ffff810137f9ac00 576000525 C Bi:4:055:5 0 473 = f3be16c6 f0e6618c 8e3f09fd ab95e3f2 4a98ee15 a786c833 eaf0c9f1 73f1272b
ffff810137f9ac00 576004265 S Bo:4:055:6 -115 48 = 7eff0300 21450000 28015c40 008006d9 d219e14a e0451175 cf041b00 50f77368
ffff810137f9aa80 576004330 S Bi:4:055:5 -115 4096 <
ffff810137f9ac00 576004512 C Bo:4:055:6 0 48 >
ffff810137f9aa80 576252553 C Bi:4:055:5 0 1535 = 7eff0300 21450005 dc47bc00 00c60687 be451175 cf19e14a e0005004 1bb33c4f
ffff810137f9aa80 576255271 S Bi:4:055:5 -115 4096 <
ffff810137f9aa80 576257543 C Bi:4:055:5 0 1519 = 7eff0300 21450005 dc49d000 00c60685 aa451175 cf19e14a e0005004 1bb33c55
ffff810137f9aa80 576261204 S Bo:4:055:6 -115 48 = 7eff0300 21450000 28015d40 008006d9 d119e14a e0451175 cf041b00 50f77368
ffff810137f9ac00 576261272 S Bi:4:055:5 -115 4096 <
ffff810137f9aa80 576261536 C Bo:4:055:6 0 48 >
ffff810137f9ac00 576262548 C Bi:4:055:5 0 1038 = 7eff0300 21450005 dc49d400 00c60685 a6451175 cf19e14a e0005004 1bb33c5b
ffff810137f9ac00 576266268 S Bi:4:055:5 -115 4096 <
ffff810137f9ac00 576267542 C Bi:4:055:5 0 484 = ecbe1be9 1f0ebc0d f1124ef7 4c1e13f1 1eada9d8 783758d6 3c35fb36 3f8be4b2
ffff810137f9ac00 576271341 S Bi:4:055:5 -115 4096 <
ffff810137f9ac00 576273545 C Bi:4:055:5 0 1521 = 7eff0300 21450005 dc4f6000 00c60680 1a451175 cf19e14a e0005004 1bb33c60
ffff810137f9ac00 576279276 S Bo:4:055:6 -115 48 = 7eff0300 21450000 28015e40 008006d9 d019e14a e0451175 cf041b00 50f77368
ffff810137f9ac00 576279537 C Bo:4:055:6 0 48 >
ffff810137f9ac00 576280264 S Bi:4:055:5 -115 4096 <
ffff810137f9ac00 576437555 C Bi:4:055:5 0 1521 = 7eff0300 21450005 dc4f6400 00c60680 16451175 cf19e14a e0005004 1bb33c66
ffff810137f9ac00 576441670 S Bi:4:055:5 -115 4096 <
ffff810137f9ac00 576443556 C Bi:4:055:5 0 1519 = 7eff0300 21450005 dc4f9000 00c6067f ea451175 cf19e14a e0005004 1bb33c6c
ffff810137f9ac00 576446743 S Bo:4:055:6 -115 48 = 7eff0300 21450000 28015f40 008006d9 cf19e14a e0451175 cf041b00 50f77368
ffff810137f9a3c0 576446811 S Bi:4:055:5 -115 4096 <
ffff810137f9ac00 576447536 C Bo:4:055:6 0 48 >
ffff810137f9a3c0 576448559 C Bi:4:055:5 0 1050 = 7eff0300 21450005 dc4f9400 00c6067f e6451175 cf19e14a e0005004 1bb33c71
ffff810137f9a3c0 576449790 S Bi:4:055:5 -115 4096 <
ffff810137f9a3c0 576450549 C Bi:4:055:5 0 475 = aba07827 e34bfc36 f097c48b 3f17f89a eefbc6be 3083e13f 8abc1bf0 b74dbbf8
ffff810137f9a3c0 576452711 S Bi:4:055:5 -115 4096 <
ffff810137f9a3c0 576457556 C Bi:4:055:5 0 1527 = 7eff0300 21450005 dc5fdc00 00c6066f 9e451175 cf19e14a e0005004 1bb33c77
ffff810137f9a3c0 576460981 S Bo:4:055:6 -115 49 = 7eff0300 21450000 28016040 008006d9 ce19e14a e0451175 cf041b00 50f77368
ffff810137f9ac00 576461047 S Bi:4:055:5 -115 4096 <
ffff810137f9a3c0 576461579 C Bo:4:055:6 0 49 >
ffff810137f9ac00 576536555 C Bi:4:055:5 0 1519 = 7eff0300 21450005 dc5fe000 00c6066f 9a451175 cf19e14a e0005004 1bb33c7d
ffff810137f9ac00 576540816 S Bi:4:055:5 -115 4096 <
ffff810137f9ac00 576595564 C Bi:4:055:5 0 1523 = 7eff0300 21450005 dc6cd800 00c60662 a2451175 cf19e14a e0005004 1bb33c83
ffff810137f9ac00 576598261 S Bo:4:055:6 -115 48 = 7eff0300 21450000 28016140 008006d9 cd19e14a e0451175 cf041b00 50f77368
ffff810137f9a3c0 576598348 S Bi:4:055:5 -115 4096 <
ffff810137f9ac00 576598552 C Bo:4:055:6 0 48 >
ffff810137f9a3c0 576656567 C Bi:4:055:5 0 1525 = 7eff0300 21450005 dc6cdc00 00c60662 9e451175 cf19e14a e0005004 1bb33c88
ffff810137f9a3c0 576660883 S Bi:4:055:5 -115 4096 <
ffff810137f9a3c0 576715571 C Bi:4:055:5 0 1523 = 7eff0300 21450005 dc6f8c00 00c6065f ee451175 cf19e14a e0005004 1bb33c8e
ffff810137f9a3c0 576719418 S Bo:4:055:6 -115 48 = 7eff0300 21450000 28016240 008006d9 cc19e14a e0451175 cf041b00 50f77368
ffff810137f9ac00 576719486 S Bi:4:055:5 -115 4096 <
ffff810137f9a3c0 576719551 C Bo:4:055:6 0 48 >
ffff810137f9ac00 576777573 C Bi:4:055:5 0 1525 = 7eff0300 21450005 dc6f9000 00c6065f ea451175 cf19e14a e0005004 1bb33c94
ffff810137f9ac00 576780791 S Bi:4:055:5 -115 4096 <
ffff810137f9ac00 576831577 C Bi:4:055:5 0 1521 = 7eff0300 21450005 dc795c00 00c60656 1e451175 cf19e14a e0005004 1bb33c99
ffff810137f9ac00 576834253 S Bo:4:055:6 -115 48 = 7eff0300 21450000 28016340 008006d9 cb19e14a e0451175 cf041b00 50f77368
ffff810137f9a780 576834320 S Bi:4:055:5 -115 4096 <
ffff810137f9ac00 576834567 C Bo:4:055:6 0 48 >
ffff810137f9a780 577119618 C Bi:4:055:5 0 1522 = 7eff0300 21450005 dc796000 00c60656 1a451175 cf19e14a e0005004 1bb33c9f
ffff810137f9a780 577131422 S Bi:4:055:5 -115 4096 <
ffff810137f9a780 577133591 C Bi:4:055:5 0 1522 = 7eff0300 21450005 dc7f2c00 00c60650 4e451175 cf19e14a e0005004 1bb33ca5
ffff810137f9a780 577136254 S Bo:4:055:6 -115 48 = 7eff0300 21450000 28016440 008006d9 ca19e14a e0451175 cf041b00 50f77368
ffff810137f9a780 577136582 C Bo:4:055:6 0 48 >
ffff810137f9a780 577137634 S Bi:4:055:5 -115 4096 <
ffff810137f9a780 577276602 C Bi:4:055:5 0 1516 = 7eff0300 21450005 dc7f3000 00c60650 4a451175 cf19e14a e0005004 1bb33cab
ffff810137f9a780 577280761 S Bi:4:055:5 -115 4096 <
ffff810137f9a780 577282605 C Bi:4:055:5 0 1520 = 7eff0300 21450005 dc80dc00 00c6064e 9e451175 cf19e14a e0005004 1bb33cb0
ffff810137f9a780 577284855 S Bo:4:055:6 -115 48 = 7eff0300 21450000 28016540 008006d9 c919e14a e0451175 cf041b00 50f77368
ffff810137f9a000 577284918 S Bi:4:055:5 -115 4096 <
ffff810137f9a780 577285584 C Bo:4:055:6 0 48 >
ffff810137f9a000 577286595 C Bi:4:055:5 0 1058 = 7eff0300 21450005 dc80e000 00c6064e 9a451175 cf19e14a e0005004 1bb33cb6
ffff810137f9a000 577287904 S Bi:4:055:5 -115 4096 <
ffff810137f9a000 577288598 C Bi:4:055:5 0 465 = f38b3039 ad3c1e3f 2fe20c87 13c4189a 39ccf2fc ce19165d 9bd6cab2 be14c3fc
ffff810137f9a000 577290834 S Bi:4:055:5 -115 4096 <
ffff810137f9a000 577437611 C Bi:4:055:5 0 1516 = 7eff0300 21450005 dc877800 00c60648 02451175 cf19e14a e0005004 1bb33cbc
ffff810137f9a000 577446379 S Bo:4:055:6 -115 48 = 7eff0300 21450000 28016640 008006d9 c819e14a e0451175 cf041b00 50f77368
ffff810137f9aa80 577446451 S Bi:4:055:5 -115 4096 <
ffff810137f9a000 577446593 C Bo:4:055:6 0 48 >
ffff810137f9aa80 577448604 C Bi:4:055:5 0 1518 = 7eff0300 21450005 dc877c00 00c60647 fe451175 cf19e14a e0005004 1bb33cc1
ffff810137f9aa80 577452219 S Bi:4:055:5 -115 4096 <
ffff810137f9aa80 577453606 C Bi:4:055:5 0 1058 = 7eff0300 21450005 dc919800 00c6063d e2451175 cf19e14a e0005004 1bb33cc7
ffff810137f9aa80 577457218 S Bi:4:055:5 -115 4096 <
ffff810137f9aa80 577458606 C Bi:4:055:5 0 467 = 126c07c6 cf827af7 8bfc03a0 6b3268be 35b7b797 e2778974 9bed7d5e d3e17d5e
ffff810137f9aa80 577462646 S Bo:4:055:6 -115 48 = 7eff0300 21450000 28016740 008006d9 c719e14a e0451175 cf041b00 50f77368
ffff810137f9a000 577462714 S Bi:4:055:5 -115 4096 <
ffff810137f9aa80 577463594 C Bo:4:055:6 0 48 >
ffff810137f9a000 577623622 C Bi:4:055:5 0 1527 = 7eff0300 21450005 dc919c00 00c6063d de451175 cf19e14a e0005004 1bb33ccd
ffff8101fae8b540 577626716 S Bi:4:055:5 -115 4096 <
ffff8101fae8b540 577628615 C Bi:4:055:5 0 1521 = 7eff0300 21450005 dc957c00 00c60639 fe451175 cf19e14a e0005004 1bb33cd2
ffff8101fae8b540 577631636 S Bo:4:055:6 -115 48 = 7eff0300 21450000 28016840 008006d9 c619e14a e0451175 cf041b00 50f77368
ffff8101fae8b000 577631658 S Bi:4:055:5 -115 4096 <
ffff8101fae8b540 577632599 C Bo:4:055:6 0 48 >
ffff8101fae8b000 577633611 C Bi:4:055:5 0 1042 = 7eff0300 21450005 dc958000 00c60639 fa451175 cf19e14a e0005004 1bb33cd8
ffff8101fae8b000 577634730 S Bi:4:055:5 -115 4096 <
ffff8101fae8b000 577635614 C Bi:4:055:5 0 487 = 15f8b36f f046ff00 4ff1059f 886dfc1d 36ada95e dec1e21f 15f80e5f 1a783be3
ffff8101fae8b000 577641363 S Bi:4:055:5 -115 4096 <
ffff8101fae8b000 577643615 C Bi:4:055:5 0 1518 = 7eff0300 21450005 dc999000 00c60635 ea451175 cf19e14a e0005004 1bb33cde
ffff8101fae8b000 577646439 S Bo:4:055:6 -115 48 = 7eff0300 21450000 28016940 008006d9 c519e14a e0451175 cf041b00 50f77368
ffff8101fae8b540 577646460 S Bi:4:055:5 -115 4096 <
ffff8101fae8b000 577646600 C Bo:4:055:6 0 48 >
ffff8101fae8b540 577648611 C Bi:4:055:5 0 1042 = 7eff0300 21450005 dc999400 00c60635 e6451175 cf19e14a e0005004 1bb33ce4
ffff8101fae8b540 577651511 S Bi:4:055:5 -115 4096 <
ffff8101fae8b540 577652616 C Bi:4:055:5 0 477 = 0e66d83e 19c9f33c df118acb f8a69e0b 1d9b6510 a8b0b977 caf1761b c37a7986
ffff8101fae8b540 577655523 S Bi:4:055:5 -115 4096 <
ffff8101fae8b000 577788765 S Bo:4:055:6 -115 48 = 7eff0300 21450000 28016a40 008006d9 c419e14a e0451175 cf041b00 50f77368
ffff8101fae8b000 577789611 C Bo:4:055:6 0 48 >
ffff8101fae8b540 577870634 C Bi:4:055:5 0 1525 = 7eff0300 21450005 dc9fe800 00c6062f 92451175 cf19e14a e0005004 1bb33ce9
ffff8101fae8b540 577874793 S Bi:4:055:5 -115 4096 <
ffff8101fae8be40 578074697 S Bo:4:055:6 -115 48 = 7eff0300 21450000 28016b40 008006d9 c319e14a e0451175 cf041b00 50f77368
ffff8101fae8be40 578075629 C Bo:4:055:6 0 48 >
ffff8101fae8b540 578618673 C Bi:4:055:5 0 1521 = 7eff0300 21450005 dc9fec00 00c6062f 8e451175 cf19e14a e0005004 1bb33cef
ffff8101fae8b540 578620877 S Bi:4:055:5 -115 4096 <
ffff8101fae8b540 578677677 C Bi:4:055:5 0 1530 = 7eff0300 21450005 dca83400 00c60627 46451175 cf19e14a e0005004 1bb33cf5
ffff8101fae8b540 578680386 S Bo:4:055:6 -115 48 = 7eff0300 21450000 28016c40 008006d9 c219e14a e0451175 cf041b00 50f77368
ffff8101fae8b540 578680657 C Bo:4:055:6 0 48 >
ffff8101fae8b540 578681168 S Bi:4:055:5 -115 4096 <
ffff8101fae8b540 578738682 C Bi:4:055:5 0 1521 = 7eff0300 21450005 dca83800 00c60627 42451175 cf19e14a e0005004 1bb33cfa
ffff8101fae8b540 578743345 S Bi:4:055:5 -115 4096 <
ffff8101fae8b540 578798681 C Bi:4:055:5 0 1523 = 7eff0300 21450005 dcb4ac00 00c6061a ce451175 cf19e14a e0005004 1bb33d00
ffff8101fae8b540 578800794 S Bo:4:055:6 -115 48 = 7eff0300 21450000 28016d40 008006d9 c119e14a e0451175 cf041b00 50f77368
ffff8101fae8be40 578800815 S Bi:4:055:5 -115 4096 <
ffff8101fae8b540 578801664 C Bo:4:055:6 0 48 >
ffff8101fae8be40 578829681 C Bi:4:055:5 0 1518 = 7eff0300 21450005 dcb4b000 00c6061a ca451175 cf19e14a e0005004 1bb33d06
ffff8101fae8be40 578831725 S Bi:4:055:5 -115 4096 <
ffff8101fae8be40 578889685 C Bi:4:055:5 0 1529 = 7eff0300 21450005 dcbbfc00 00c60613 7d5e4511 75cf19e1 4ae00050 041bb33d
ffff8101fae8be40 578891833 S Bo:4:055:6 -115 48 = 7eff0300 21450000 28016e40 008006d9 c019e14a e0451175 cf041b00 50f77368
ffff8101fae8b540 578891857 S Bi:4:055:5 -115 4096 <
ffff8101fae8be40 578892669 C Bo:4:055:6 0 48 >
ffff8101fae8b540 578949693 C Bi:4:055:5 0 1522 = 7eff0300 21450005 dcbc0000 00c60613 7a451175 cf19e14a e0005004 1bb33d11
ffff8101fae8b540 578954738 S Bi:4:055:5 -115 4096 <
ffff8101fae8b540 579009693 C Bi:4:055:5 0 1521 = 7eff0300 21450005 dcbd0c00 00c60612 6e451175 cf19e14a e0005004 1bb33d17
ffff8101fae8b540 579013483 S Bo:4:055:6 -115 48 = 7eff0300 21450000 28016f40 008006d9 bf19e14a e0451175 cf041b00 50f77368
ffff8101fae8be40 579013505 S Bi:4:055:5 -115 4096 <
ffff8101fae8b540 579013676 C Bo:4:055:6 0 48 >
ffff8101fae8be40 579069695 C Bi:4:055:5 0 1521 = 7eff0300 21450005 dcbd1000 00c60612 6a451175 cf19e14a e0005004 1bb33d1d
ffff8101fae8be40 579074886 S Bi:4:055:5 -115 4096 <
ffff8101fae8be40 579135706 C Bi:4:055:5 0 1521 = 7eff0300 21450005 dccebc00 00c60600 be451175 cf19e14a e0005004 1bb33d22
ffff8101fae8be40 579138795 S Bo:4:055:6 -115 48 = 7eff0300 21450000 28017040 008006d9 be19e14a e0451175 cf041b00 50f77368
ffff8101fae8b540 579138816 S Bi:4:055:5 -115 4096 <
ffff8101fae8be40 579139683 C Bo:4:055:6 0 48 >
ffff8101fae8b540 579460722 C Bi:4:055:5 0 1526 = 7eff0300 21450005 dccec000 00c60600 ba451175 cf19e14a e0005004 1bb33d28
ffff8101fae8b540 579467842 S Bi:4:055:5 -115 4096 <
ffff8101fae8b540 579469717 C Bi:4:055:5 0 1526 = 7eff0300 21450005 dccf7400 00c60600 06451175 cf19e14a e0005004 1bb33d2e
ffff8101fae8b540 579472946 S Bo:4:055:6 -115 48 = 7eff0300 21450000 28017140 008006d9 bd19e14a e0451175 cf041b00 50f77368
ffff8101fae8b540 579473701 C Bo:4:055:6 0 48 >
ffff8101fae8b540 579473912 S Bi:4:055:5 -115 4096 <
ffff8101fae8b540 579531720 C Bi:4:055:5 0 1521 = 7eff0300 21450005 dccf7800 00c60600 02451175 cf19e14a e0005004 1bb33d33
ffff8101fae8b540 579534712 S Bi:4:055:5 -115 4096 <
ffff8101fae8b540 579621733 C Bi:4:055:5 0 1521 = 7eff0300 21450005 dce19800 00c606ed e1451175 cf19e14a e0005004 1bb33d39
ffff8101df178b40 579625293 S Bo:4:055:6 -115 48 = 7eff0300 21450000 28017240 008006d9 bc19e14a e0451175 cf041b00 50f77368
ffff8101df1789c0 579625361 S Bi:4:055:5 -115 4096 <
ffff8101df178b40 579625795 C Bo:4:055:6 0 48 >
ffff8101df1789c0 579627722 C Bi:4:055:5 0 1527 = 7eff0300 21450005 dce19c00 00c606ed dd451175 cf19e14a e0005004 1bb33d3f
ffff8101df1789c0 579630329 S Bi:4:055:5 -115 4096 <
ffff8101df1789c0 579631737 C Bi:4:055:5 0 1042 = 7eff0300 21450005 dcecc400 00c606e2 b5451175 cf19e14a e0005004 1bb33d45
ffff8101df1789c0 579633241 S Bi:4:055:5 -115 4096 <
ffff8101df1789c0 579634735 C Bi:4:055:5 0 480 = cae9d5e3 6a19f705 70f70dd2 cc686578 7c052c1e 3b0f93cb 22c566d9 442cdb30
ffff8101df1789c0 579637342 S Bo:4:055:6 -115 48 = 7eff0300 21450000 28017340 008006d9 bb19e14a e0451175 cf041b00 50f77368
ffff8101df178b40 579637408 S Bi:4:055:5 -115 4096 <
ffff8101df1789c0 579637720 C Bo:4:055:6 0 48 >
ffff8101df178b40 579639726 C Bi:4:055:5 0 1532 = 7eff0300 21450005 dcecc800 00c606e2 b1451175 cf19e14a e0005004 1bb33d4a
ffff8101df178b40 579642432 S Bi:4:055:5 -115 4096 <
ffff8101df178b40 579643728 C Bi:4:055:5 0 1038 = 7eff0300 21450005 dced7800 00c606e2 01451175 cf19e14a e0005004 1bb33d50
ffff8101df178b40 579645281 S Bi:4:055:5 -115 4096 <
ffff8101df178b40 579646725 C Bi:4:055:5 0 492 = 20d59b4a ff0084a1 edfc77fb 42f82749 f09f8935 9d5ff67f f1eeb0de 28f8ade3
ffff8101df178b40 579650273 S Bo:4:055:6 -115 48 = 7eff0300 21450000 28017440 008006d9 ba19e14a e0451175 cf041b00 50f77368
ffff8101df1789c0 579650337 S Bi:4:055:5 -115 4096 <
ffff8101df178b40 579650714 C Bo:4:055:6 0 48 >
ffff8101df1789c0 579652776 C Bi:4:055:5 0 1518 = 7eff0300 21450005 dced7c00 00c606e1 fd451175 cf19e14a e0005004 1bb33d56
ffff8101df1789c0 579654446 S Bi:4:055:5 -115 4096 <
ffff8101df1789c0 579654727 C Bi:4:055:5 0 9 = 5e68dac7 c4cfad78 7e
ffff8101df1789c0 579658231 S Bi:4:055:5 -115 4096 <
ffff8101df1789c0 579697737 C Bi:4:055:5 0 1520 = 7eff0300 21450005 dced8c00 00c606e1 ed451175 cf19e14a e0005004 1bb33d5b
ffff8101df1789c0 579700832 S Bo:4:055:6 -115 48 = 7eff0300 21450000 28017540 008006d9 b919e14a e0451175 cf041b00 50f77368
ffff8101df178b40 579700900 S Bi:4:055:5 -115 4096 <
ffff8101df1789c0 579701717 C Bo:4:055:6 0 48 >
ffff8101df178b40 579758749 C Bi:4:055:5 0 1522 = 7eff0300 21450005 dced9000 00c606e1 e9451175 cf19e14a e0005004 1bb33d61
ffff8101df178b40 579760784 S Bi:4:055:5 -115 4096 <
ffff8101df1789c0 579877186 S Bo:4:055:6 -115 48 = 7eff0300 21450000 28017640 008006d9 b819e14a e0451175 cf041b00 50f77368
ffff8101df1789c0 579877728 C Bo:4:055:6 0 48 >
ffff8101df178b40 580017749 C Bi:4:055:5 0 1519 = 7eff0300 21450005 dcf29400 00c606dc e5451175 cf19e14a e0005004 1bb33d67
ffff8101851260c0 580020790 S Bi:4:055:5 -115 4096 <
ffff8101851260c0 580022752 C Bi:4:055:5 0 1522 = 7eff0300 21450005 dcf29800 00c606dc e1451175 cf19e14a e0005004 1bb33d6c
ffff8101851260c0 580024861 S Bo:4:055:6 -115 48 = 7eff0300 21450000 28017740 008006d9 b719e14a e0451175 cf041b00 50f77368
ffff8101851260c0 580025735 C Bo:4:055:6 0 48 >
ffff8101851260c0 580025845 S Bi:4:055:5 -115 4096 <
ffff8101851260c0 580027746 C Bi:4:055:5 0 1050 = 7eff0300 21450005 dc0c3000 00c606c3 4a451175 cf19e14a e0005004 1bb33d72
ffff8101851260c0 580028746 S Bi:4:055:5 -115 4096 <
ffff8101851260c0 580029751 C Bi:4:055:5 0 474 = fc655e12 e2dc93eb 7c2596e7 f4b33c93 34e06a32 960729e0 bca38778 d788722a
ffff8101851260c0 580031925 S Bi:4:055:5 -115 4096 <
ffff8101851260c0 580179818 C Bi:4:055:5 0 1525 = 7eff0300 21450005 dc0c3400 00c606c3 46451175 cf19e14a e0005004 1bb33d78
ffff8101851260c0 580182216 S Bo:4:055:6 -115 49 = 7eff0300 21450000 28017840 008006d9 b619e14a e0451175 cf041b00 50f77368
ffff8101851260c0 580182756 C Bo:4:055:6 0 49 >
ffff8101851260c0 580183310 S Bi:4:055:5 -115 4096 <
ffff8101851260c0 580264769 C Bi:4:055:5 0 1528 = 7eff0300 21450005 dc112000 00c606be 5a451175 cf19e14a e0005004 1bb33d7d
ffff8101851260c0 580267435 S Bi:4:055:5 -115 4096 <
ffff8101851260c0 580269765 C Bi:4:055:5 0 1528 = 7eff0300 21450005 dc112400 00c606be 56451175 cf19e14a e0005004 1bb33d83
ffff8101851260c0 580272206 S Bo:4:055:6 -115 48 = 7eff0300 21450000 28017940 008006d9 b519e14a e0451175 cf041b00 50f77368
ffff810185126900 580272268 S Bi:4:055:5 -115 4096 <
ffff8101851260c0 580272748 C Bo:4:055:6 0 48 >
ffff810185126900 580273769 C Bi:4:055:5 0 1038 = 7eff0300 21450005 dc19e800 00c606b5 92451175 cf19e14a e0005004 1bb33d89
ffff810185126900 580277220 S Bi:4:055:5 -115 4096 <
ffff810185126900 580278794 C Bi:4:055:5 0 496 = 17c1db1d 26c743f8 5fa3df5d f8275ef1 7d5ebff0 3bc0b7da 6ea7f147 c41e1883
ffff810185126900 580281114 S Bi:4:055:5 -115 4096 <
ffff810185126900 580283766 C Bi:4:055:5 0 1523 = 7eff0300 21450005 dc19ec00 00c606b5 8e451175 cf19e14a e0005004 1bb33d8f
ffff810185126900 580286151 S Bo:4:055:6 -115 48 = 7eff0300 21450000 28017a40 008006d9 b419e14a e0451175 cf041b00 50f77368
ffff8101851260c0 580286214 S Bi:4:055:5 -115 4096 <
ffff810185126900 580286748 C Bo:4:055:6 0 48 >
ffff8101851260c0 580287761 C Bi:4:055:5 0 1034 = 7eff0300 21450005 dc1ad400 00c606b4 a6451175 cf19e14a e0005004 1bb33d94
ffff8101851260c0 580289325 S Bi:4:055:5 -115 4096 <
ffff8101851260c0 580290761 C Bi:4:055:5 0 489 = 8fae788b a0bfbfd2 be236bfe 27f0fea8 751f889e 271f0f7d 5e0569fa e7fc2bff
ffff8101851260c0 580294097 S Bi:4:055:5 -115 4096 <
ffff8101851260c0 580329772 C Bi:4:055:5 0 1524 = 7eff0300 21450005 dc1ad800 00c606b4 a2451175 cf19e14a e0005004 1bb33d9a
ffff8101851260c0 580334293 S Bo:4:055:6 -115 48 = 7eff0300 21450000 28017b40 008006d9 b319e14a e0451175 cf041b00 50f77368
ffff810185126900 580334390 S Bi:4:055:5 -115 4096 <
ffff8101851260c0 580334752 C Bo:4:055:6 0 48 >
ffff810185126900 580389775 C Bi:4:055:5 0 1516 = 7eff0300 21450005 dc24f800 00c606aa 82451175 cf19e14a e0005004 1bb33da0
ffff810185126900 580394215 S Bi:4:055:5 -115 4096 <
ffff810185126180 580606157 S Bo:4:055:6 -115 48 = 7eff0300 21450000 28017c40 008006d9 b219e14a e0451175 cf041b00 50f77368
ffff810185126180 580606781 C Bo:4:055:6 0 48 >
ffff810185126900 580660787 C Bi:4:055:5 0 1520 = 7eff0300 21450005 dc24fc00 00c606aa 7d5e4511 75cf19e1 4ae00050 041bb33d
ffff810185126900 580665162 S Bi:4:055:5 -115 4096 <
ffff810185126900 580667861 C Bi:4:055:5 0 1531 = 7eff0300 21450005 dc26b400 00c606a8 c6451175 cf19e14a e0005004 1bb33dab
ffff810185126900 580670259 S Bo:4:055:6 -115 49 = 7eff0300 21450000 28017d5d 40008006 d9b119e1 4ae04511 75cf041b 0050f773
ffff810185126900 580670799 C Bo:4:055:6 0 49 >
ffff810185126900 580671224 S Bi:4:055:5 -115 4096 <
ffff810185126900 580672793 C Bi:4:055:5 0 1042 = 7eff0300 21450005 dc26b800 00c606a8 c2451175 cf19e14a e0005004 1bb33db1
ffff810185126900 580675353 S Bi:4:055:5 -115 4096 <
ffff810185126900 580676786 C Bi:4:055:5 0 484 = e00e87a3 43e0cd0b c29f0d2d d350bc6d 6bc35e35 f050b8f1 0d9788ba 31dc4bc3
ffff810185126900 580680891 S Bi:4:055:5 -115 4096 <
ffff810185126900 580682788 C Bi:4:055:5 0 1520 = 7eff0300 21450005 dc329800 00c6069c e2451175 cf19e14a e0005004 1bb33db7
ffff810185126900 580685926 S Bo:4:055:6 -115 49 = 7eff0300 21450000 28017d5e 40008006 d9b019e1 4ae04511 75cf041b 0050f773
ffff810185126900 580686782 C Bo:4:055:6 0 49 >
ffff810185126900 580687017 S Bi:4:055:5 -115 4096 <
ffff810185126900 580689794 C Bi:4:055:5 0 1521 = 7eff0300 21450005 dc43e400 00c6068b 96451175 cf19e14a e0005004 1bb33dbc
ffff810185126900 580693870 S Bi:4:055:5 -115 4096 <
ffff810185126900 580735794 C Bi:4:055:5 0 1520 = 7eff0300 21450005 dc60ec00 00c6066e 8e451175 cf19e14a e0005004 1bb33dc2
ffff810185126900 580739211 S Bo:4:055:6 -115 48 = 7eff0300 21450000 28017f40 008006d9 af19e14a e0451175 cf041b00 50f77368
ffff810185126300 580739278 S Bi:4:055:5 -115 4096 <
ffff810185126900 580739852 C Bo:4:055:6 0 48 >
ffff810185126300 580972808 C Bi:4:055:5 0 1520 = 7eff0300 21450005 dc60f000 00c6066e 8a451175 cf19e14a e0005004 1bb33dc8
ffff8101330b3540 580978219 S Bi:4:055:5 -115 4096 <
ffff8101330b3540 581015824 C Bi:4:055:5 0 1520 = 7eff0300 21450005 dc68cc00 00c60666 ae451175 cf19e14a e0005004 1bb33dcd
ffff8101330b3540 581018343 S Bo:4:055:6 -115 48 = 7eff0300 21450000 28018040 008006d9 ae19e14a e0451175 cf041b00 50f77368
ffff8101330b3540 581018791 C Bo:4:055:6 0 48 >
ffff8101330b3540 581019345 S Bi:4:055:5 -115 4096 <
ffff8101330b3540 581021798 C Bi:4:055:5 0 1525 = 7eff0300 21450005 dc68d000 00c60666 aa451175 cf19e14a e0005004 1bb33dd3
ffff8101330b3540 581026214 S Bi:4:055:5 -115 4096 <
ffff8101330b3540 581027808 C Bi:4:055:5 0 522 = 7eff0300 21450001 fc68d400 00c6066a 86451175 cf19e14a e0005004 1bb33dd9
ffff8101330b3540 581046234 S Bo:4:055:6 -115 48 = 7eff0300 21450000 28018140 008006d9 ad19e14a e0451175 cf041b00 50f77368
ffff81020a6abe40 581047271 S Bi:4:055:5 -115 4096 <
ffff8101330b3540 581047803 C Bo:4:055:6 0 48 >
ffff81020a6ab000 581061157 S Bo:4:055:6 -115 735 = 7eff0300 21450002 9f018640 008006d7 3119e14a e0451175 cf041b00 50f77368
ffff81020a6ab000 581062801 C Bo:4:055:6 0 735 >
ffff81020a6abe40 581424829 C Bi:4:055:5 0 56 = 7eff0300 21450000 30f9d000 00c606db 55451175 cf19e14a e0005004 1cbe435e
ffff8101fae8be40 581428270 S Bo:4:055:6 -115 48 = 7eff0300 21450000 28018e40 008006d9 a019e14a e0451175 cf041c00 507b26bd
ffff8101fae8be40 581428810 C Bo:4:055:6 0 48 >
ffff8101fae8be40 581430799 S Bo:4:055:6 -115 679 = 7eff0300 21450002 9f018f40 008006d7 2819e14a e0451175 cf041c00 507b26bd
ffff8101fae8b540 581430827 S Bi:4:055:5 -115 4096 <
ffff8101fae8be40 581431815 C Bo:4:055:6 0 679 >
ffff8101fae8b540 581515832 C Bi:4:055:5 0 1514 = 7eff0300 21450005 dcfc0000 00c606d3 79451175 cf19e14a e0005004 1bb33ddb
ffff8101fae8b540 581521270 S Bi:4:055:5 -115 4096 <
ffff8101fae8b540 581575846 C Bi:4:055:5 0 1525 = 7eff0300 21450005 dcfc0800 00c606d3 71451175 cf19e14a e0005004 1bb33de0
ffff81008b44b600 581578229 S Bo:4:055:6 -115 48 = 7eff0300 21450000 28019040 008006d9 9e19e14a e0451175 cf041b00 50f7736b
ffff81008b44b600 581578831 C Bo:4:055:6 0 48 >
ffff81008b44b600 581579221 S Bi:4:055:5 -115 4096 <
ffff81008b44b600 581877856 C Bi:4:055:5 0 1529 = 7eff0300 21450005 dcfc0c00 00c606d3 6d451175 cf19e14a e0005004 1bb33de6
ffff8101fae8be40 581880749 S Bi:4:055:5 -115 4096 <
ffff8101fae8be40 581882852 C Bi:4:055:5 0 1521 = 7eff0300 21450005 dcfc1800 00c606d3 61451175 cf19e14a e0005004 1bb33dec
ffff8101fae8be40 581892464 S Bo:4:055:6 -115 48 = 7eff0300 21450000 28019140 008006d9 9d19e14a e0451175 cf041b00 50f7736b
ffff8101fae8b000 581892481 S Bi:4:055:5 -115 4096 <
ffff8101fae8be40 581893837 C Bo:4:055:6 0 48 >
ffff8101fae8b000 581951859 C Bi:4:055:5 0 1519 = 7eff0300 21450005 dcfc1c00 00c606d3 5d451175 cf19e14a e0005004 1bb33df1
ffff8101fae8b000 581954748 S Bi:4:055:5 -115 4096 <
ffff8101fae8b000 581956855 C Bi:4:055:5 0 955 = 7eff0300 21450003 a4fc2400 00c606d5 8d451175 cf19e14a e0005004 1bb33df7
ffff8101fae8b000 581963721 S Bo:4:055:6 -115 48 = 7eff0300 21450000 28019240 008006d9 9c19e14a e0451175 cf041b00 50f7736b
ffff8101fae8be40 581963744 S Bi:4:055:5 -115 4096 <
ffff8101fae8b000 581963840 C Bo:4:055:6 0 48 >
ffff8101fae8be40 582042862 C Bi:4:055:5 0 1525 = 7eff0300 21450005 dcfc6800 00c606d3 11451175 cf19e14a e0005004 1bb33dfb
ffff8101fae8b000 582049801 S Bi:4:055:5 -115 4096 <
ffff8101fae8b000 582051861 C Bi:4:055:5 0 1530 = 7eff0300 21450005 dcfc7000 00c606d3 09451175 cf19e14a e0005004 1bb33e00
ffff8101fae8b000 582054896 S Bo:4:055:6 -115 48 = 7eff0300 21450000 28019340 008006d9 9b19e14a e0451175 cf041b00 50f7736b
ffff8101fae8b540 582054919 S Bi:4:055:5 -115 4096 <
ffff8101fae8b000 582055845 C Bo:4:055:6 0 48 >
ffff8101fae8b540 582183868 C Bi:4:055:5 0 1526 = 7eff0300 21450005 dcfc7400 00c606d3 05451175 cf19e14a e0005004 1bb33e06
ffff8101fae8b540 582186746 S Bi:4:055:5 -115 4096 <
ffff8101fae8b540 582188868 C Bi:4:055:5 0 1522 = 7eff0300 21450005 dcfc8400 00c606d2 f5451175 cf19e14a e0005004 1bb33e0c
ffff8101fae8b540 582194741 S Bo:4:055:6 -115 48 = 7eff0300 21450000 28019440 008006d9 9a19e14a e0451175 cf041b00 50f7736b
ffff8101fae8b000 582194764 S Bi:4:055:5 -115 4096 <
ffff8101fae8b540 582194853 C Bo:4:055:6 0 48 >
ffff8101fae8b000 582196864 C Bi:4:055:5 0 1042 = 7eff0300 21450005 dcfc8800 00c606d2 f1451175 cf19e14a e0005004 1bb33e11
ffff8101fae8b000 582203655 S Bi:4:055:5 -115 4096 <
ffff8101fae8b000 582204869 C Bi:4:055:5 0 481 = c13a878a ec7c69a5 68afe25f 164f63e2 ff00873e 2af885e2 ad53c17d 5e18f867
ffff8101fae8b000 582207842 S Bi:4:055:5 -115 4096 <
ffff8101fae8b000 582209869 C Bi:4:055:5 0 949 = 7eff0300 21450003 a4fc9000 00c606d5 21451175 cf19e14a e0005004 1bb33e17
ffff8101fae8b000 582212859 S Bo:4:055:6 -115 48 = 7eff0300 21450000 28019540 008006d9 9919e14a e0451175 cf041b00 50f7736b
ffff8101fae8b540 582212879 S Bi:4:055:5 -115 4096 <
ffff8101fae8b000 582213855 C Bo:4:055:6 0 48 >
ffff8101fae8b540 582214866 C Bi:4:055:5 0 1523 = 7eff0300 21450005 dcfccc00 00c606d2 ad451175 cf19e14a e0005004 1bb33e1b
ffff8101fae8b540 582219523 S Bi:4:055:5 -115 4096 <
ffff8101fae8b540 582221870 C Bi:4:055:5 0 1522 = 7eff0300 21450005 dcfcd400 00c606d2 a5451175 cf19e14a e0005004 1bb33e20
ffff810044125000 582249298 S Bo:4:055:6 -115 48 = 7eff0300 21450000 28019640 008006d9 9819e14a e0451175 cf041b00 50f7736b
ffff8100441256c0 582249366 S Bi:4:055:5 -115 4096 <
ffff810044125000 582250872 C Bo:4:055:6 0 48 >
ffff8100441256c0 582278882 C Bi:4:055:5 0 1521 = 7eff0300 21450005 dcfcd800 00c606d2 a1451175 cf19e14a e0005004 1bb33e26
ffff8100441256c0 582281896 S Bi:4:055:5 -115 4096 <
ffff810044125600 582505183 S Bo:4:055:6 -115 48 = 7eff0300 21450000 28019740 008006d9 9719e14a e0451175 cf041b00 50f7736b
ffff810044125600 582505874 C Bo:4:055:6 0 48 >
ffff810044125600 582513247 S Bo:4:055:6 -115 97 = 7eff0300 21450000 28019840 0080066e 700a0002 0fd155ad 63041a00 506bc998
ffff810044125600 582513874 C Bo:4:055:6 0 97 >
ffff8100441256c0 582519898 C Bi:4:055:5 0 1525 = 7eff0300 21450005 dcfce000 00c606d2 99451175 cf19e14a e0005004 1bb33e2c
ffff8100441256c0 582526692 S Bi:4:055:5 -115 4096 <
ffff8100441256c0 582598899 C Bi:4:055:5 0 1526 = 7eff0300 21450005 dcfce400 00c606d2 95451175 cf19e14a e0005004 1bb33e31
ffff8100441256c0 582602798 S Bo:4:055:6 -115 48 = 7eff0300 21450000 28019a40 008006d9 9419e14a e0451175 cf041b00 50f7736b
ffff810044125600 582602867 S Bi:4:055:5 -115 4096 <
ffff8100441256c0 582603975 C Bo:4:055:6 0 48 >
ffff810044125600 582604891 C Bi:4:055:5 0 951 = 7eff0300 21450003 a4fcec00 00c606d4 c5451175 cf19e14a e0005004 1bb33e37
ffff810044125600 582607758 S Bi:4:055:5 -115 4096 <
ffff810044125600 582670902 C Bi:4:055:5 0 1522 = 7eff0300 21450005 dcfd1800 00c606d2 61451175 cf19e14a e0005004 1bb33e3b
ffff810044125600 582674361 S Bo:4:055:6 -115 49 = 7eff0300 21450000 28019b40 008006d9 9319e14a e0451175 cf041b00 50f7736b
ffff8100441256c0 582674432 S Bi:4:055:5 -115 4096 <
ffff810044125600 582674893 C Bo:4:055:6 0 49 >
ffff8100441256c0 582731914 C Bi:4:055:5 0 1528 = 7eff0300 21450005 dcfd2000 00c606d2 59451175 cf19e14a e0005004 1bb33e40
ffff8100441256c0 582734279 S Bi:4:055:5 -115 4096 <
ffff8100441256c0 582736909 C Bi:4:055:5 0 1519 = 7eff0300 21450005 dcfd2400 00c606d2 55451175 cf19e14a e0005004 1bb33e46
ffff8100441256c0 582744841 S Bo:4:055:6 -115 48 = 7eff0300 21450000 28019c40 008006d9 9219e14a e0451175 cf041b00 50f7736b
ffff810044125600 582744913 S Bi:4:055:5 -115 4096 <
ffff8100441256c0 582745887 C Bo:4:055:6 0 48 >
ffff810044125600 582820910 C Bi:4:055:5 0 1524 = 7eff0300 21450005 dcfd2c00 00c606d2 4d451175 cf19e14a e0005004 1bb33e4c
ffff810044125600 582826220 S Bi:4:055:5 -115 4096 <
ffff810044125600 582828908 C Bi:4:055:5 0 1527 = 7eff0300 21450005 dcfd3000 00c606d2 49451175 cf19e14a e0005004 1bb33e51
ffff810044125600 582835705 S Bo:4:055:6 -115 48 = 7eff0300 21450000 28019d40 008006d9 9119e14a e0451175 cf041b00 50f7736b
ffff8100441256c0 582835775 S Bi:4:055:5 -115 4096 <
ffff810044125600 582835899 C Bo:4:055:6 0 48 >
ffff8100441256c0 582837913 C Bi:4:055:5 0 952 = 7eff0300 21450003 a4fd3800 00c606d4 79451175 cf19e14a e0005004 1bb33e57
ffff8100441256c0 582841368 S Bi:4:055:5 -115 4096 <
ffff810044125d80 582993039 S Bo:4:055:6 -115 48 = 7eff0300 21450000 28019e40 008006d9 9019e14a e0451175 cf041b00 50f7736b
ffff810044125d80 582993906 C Bo:4:055:6 0 48 >
ffff8100441256c0 583063924 C Bi:4:055:5 0 1523 = 7eff0300 21450005 dcfd6400 00c606d2 15451175 cf19e14a e0005004 1bb33e5b
ffff8100441256c0 583070286 S Bi:4:055:5 -115 4096 <
ffff8100441256c0 583072921 C Bi:4:055:5 0 1520 = 7eff0300 21450005 dcfd7000 00c606d2 09451175 cf19e14a e0005004 1bb33e60
ffff8100441256c0 583078236 S Bo:4:055:6 -115 48 = 7eff0300 21450000 28019f40 008006d9 8f19e14a e0451175 cf041b00 50f7736b
ffff810044125d80 583078299 S Bi:4:055:5 -115 4096 <
ffff8100441256c0 583078917 C Bo:4:055:6 0 48 >
ffff810044125d80 583079931 C Bi:4:055:5 0 1050 = 7eff0300 21450005 dcfd7400 00c606d2 05451175 cf19e14a e0005004 1bb33e66
ffff810044125d80 583085246 S Bi:4:055:5 -115 4096 <
ffff810044125d80 583085921 C Bi:4:055:5 0 473 = f8df58f1 bfc69f05 e8de27f8 a5f037c1 f7de11f1 aea5e29d 1fc31e20 f1347a0c
ffff810044125d80 583088280 S Bi:4:055:5 -115 4096 <
ffff810044125d80 583090921 C Bi:4:055:5 0 1519 = 7eff0300 21450005 dcfd7c00 00c606d1 fd451175 cf19e14a e0005004 1bb33e6c
ffff810044125d80 583094217 S Bo:4:055:6 -115 48 = 7eff0300 21450000 2801a040 008006d9 8e19e14a e0451175 cf041b00 50f7736b
ffff8100441256c0 583094285 S Bi:4:055:5 -115 4096 <
ffff810044125d80 583094907 C Bo:4:055:6 0 48 >
ffff8100441256c0 583209931 C Bi:4:055:5 0 1522 = 7eff0300 21450005 dcfd8000 00c606d1 f9451175 cf19e14a e0005004 1bb33e71
ffff8100441256c0 583214218 S Bi:4:055:5 -115 4096 <
ffff8100441256c0 583294937 C Bi:4:055:5 0 947 = 7eff0300 21450003 a4fd8800 00c606d4 29451175 cf19e14a e0005004 1bb33e77
ffff8100441256c0 583298435 S Bo:4:055:6 -115 48 = 7eff0300 21450000 2801a140 008006d9 8d19e14a e0451175 cf041b00 50f7736b
ffff810044125d80 583298502 S Bi:4:055:5 -115 4096 <
ffff8100441256c0 583298927 C Bo:4:055:6 0 48 >
ffff810044125d80 583300928 C Bi:4:055:5 0 1517 = 7eff0300 21450005 dcfdd000 00c606d1 a9451175 cf19e14a e0005004 1bb33e7b
ffff810044125d80 583304146 S Bi:4:055:5 -115 4096 <
ffff810044125d80 583379942 C Bi:4:055:5 0 1522 = 7eff0300 21450005 dcfdd800 00c606d1 a1451175 cf19e14a e0005004 1bb33e80
ffff810044125d80 583382963 S Bo:4:055:6 -115 48 = 7eff0300 21450000 2801a240 008006d9 8c19e14a e0451175 cf041b00 50f7736b
ffff8100441256c0 583383031 S Bi:4:055:5 -115 4096 <
ffff810044125d80 583383924 C Bo:4:055:6 0 48 >
ffff8100441256c0 583384936 C Bi:4:055:5 0 1519 = 7eff0300 21450005 dcfddc00 00c606d1 9d451175 cf19e14a e0005004 1bb33e86
ffff8100441256c0 583387865 S Bi:4:055:5 -115 4096 <
ffff8100441256c0 583451946 C Bi:4:055:5 0 1525 = 7eff0300 21450005 dcfde400 00c606d1 95451175 cf19e14a e0005004 1bb33e8c
ffff8100441256c0 583455211 S Bo:4:055:6 -115 48 = 7eff0300 21450000 2801a340 008006d9 8b19e14a e0451175 cf041b00 50f7736b
ffff810044125600 583455276 S Bi:4:055:5 -115 4096 <
ffff8100441256c0 583455926 C Bo:4:055:6 0 48 >
ffff810044125600 583457940 C Bi:4:055:5 0 1528 = 7eff0300 21450005 dcfde800 00c606d1 91451175 cf19e14a e0005004 1bb33e91
ffff810044125600 583461146 S Bi:4:055:5 -115 4096 <
ffff8100441256c0 583609192 S Bo:4:055:6 -115 48 = 7eff0300 21450000 2801a440 008006d9 8a19e14a e0451175 cf041b00 50f7736b
ffff8100441256c0 583609936 C Bo:4:055:6 0 48 >
ffff810044125600 583616957 C Bi:4:055:5 0 951 = 7eff0300 21450003 a4fdf000 00c606d3 c1451175 cf19e14a e0005004 1bb33e97
ffff810044125600 583620794 S Bi:4:055:5 -115 4096 <
ffff810044125600 583622952 C Bi:4:055:5 0 1519 = 7eff0300 21450005 dcfe3c00 00c606d1 3d451175 cf19e14a e0005004 1bb33e9b
ffff810044125600 583625942 S Bo:4:055:6 -115 48 = 7eff0300 21450000 2801a540 008006d9 8919e14a e0451175 cf041b00 50f7736b
ffff8100441256c0 583626009 S Bi:4:055:5 -115 4096 <
ffff810044125600 583626938 C Bo:4:055:6 0 48 >
ffff8100441256c0 583692959 C Bi:4:055:5 0 1520 = 7eff0300 21450005 dcfe5000 00c606d1 29451175 cf19e14a e0005004 1bb33ea0
ffff8100441256c0 583704081 S Bi:4:055:5 -115 4096 <
ffff8100441256c0 583706955 C Bi:4:055:5 0 1516 = 7eff0300 21450005 dcfe5400 00c606d1 25451175 cf19e14a e0005004 1bb33ea6
ffff8100441256c0 583710363 S Bo:4:055:6 -115 48 = 7eff0300 21450000 2801a640 008006d9 8819e14a e0451175 cf041b00 50f7736b
ffff810044125600 583710430 S Bi:4:055:5 -115 4096 <
ffff8100441256c0 583710967 C Bo:4:055:6 0 48 >
ffff810044125600 583838977 C Bi:4:055:5 0 1522 = 7eff0300 21450005 dcfe5c00 00c606d1 1d451175 cf19e14a e0005004 1bb33eac
ffff810044125600 583846009 S Bi:4:055:5 -115 4096 <
ffff810044125600 583916972 C Bi:4:055:5 0 1523 = 7eff0300 21450005 dc1e2000 00c606b1 5a451175 cf19e14a e0005004 1bb33eb1
ffff810044125d80 583922469 S Bo:4:055:6 -115 48 = 7eff0300 21450000 2801a740 008006d9 8719e14a e0451175 cf041b00 50f7736b
ffff810044125300 583922540 S Bi:4:055:5 -115 4096 <
ffff810044125d80 583922962 C Bo:4:055:6 0 48 >
ffff810044125300 583924961 C Bi:4:055:5 0 1523 = 7eff0300 21450005 dc1e2400 00c606b1 56451175 cf19e14a e0005004 1bb33eb7
ffff810044125a80 583935642 S Bi:4:055:5 -115 4096 <
ffff810044125a80 583937969 C Bi:4:055:5 0 1514 = 7eff0300 21450005 dc1f3800 00c606b0 42451175 cf19e14a e0005004 1cbe435e
ffff810044125a80 583942778 S Bi:4:055:5 -115 4096 <
ffff810044125a80 584084991 C Bi:4:055:5 0 1525 = 7eff0300 21450005 dc1f4000 00c606b0 3a451175 cf19e14a e0005004 1cbe4364
ffff810044125a80 584087446 S Bo:4:055:6 -115 48 = 7eff0300 21450000 2801a840 008006d9 8619e14a e0451175 cf041c00 507b26bf
ffff810044125000 584087512 S Bi:4:055:5 -115 4096 <
ffff810044125a80 584087961 C Bo:4:055:6 0 48 >
ffff810044125a80 584089372 S Bo:4:055:6 -115 48 = 7eff0300 21450000 2801a940 008006d9 8519e14a e0451175 cf041b00 50f7736b
ffff810044125000 584089970 C Bi:4:055:5 0 1518 = 7eff0300 21450005 dc2f3400 00c606a0 46451175 cf19e14a e0005004 1bb33ebd
ffff810044125a80 584089975 C Bo:4:055:6 0 48 >
ffff810044125a80 584093280 S Bi:4:055:5 -115 4096 <
ffff810044125a80 584094976 C Bi:4:055:5 0 1046 = 7eff0300 21450005 dc2f3800 00c606a0 42451175 cf19e14a e0005004 1bb33ec3
ffff810044125a80 584097203 S Bi:4:055:5 -115 4096 <
ffff810044125a80 584097974 C Bi:4:055:5 0 474 = 7d5e08b0 f097c2dd 0fc63fb4 b69fe09f 8197bac7 c2ef8a5f 11c7c47f 09f8afc6
ffff810044125a80 584106221 S Bo:4:055:6 -115 48 = 7eff0300 21450000 2801aa40 008006d9 8419e14a e0451175 cf041b00 50f7736b
ffff810044125000 584106287 S Bi:4:055:5 -115 4096 <
ffff810044125a80 584106972 C Bo:4:055:6 0 48 >
ffff810044125000 584234990 C Bi:4:055:5 0 1522 = 7eff0300 21450005 dc31e000 00c6069d 9a451175 cf19e14a e0005004 1bb33ec8
ffff8101fae8b540 584238800 S Bi:4:055:5 -115 4096 <
ffff8101fae8b540 584240986 C Bi:4:055:5 0 1522 = 7eff0300 21450005 dc38d800 00c60696 a2451175 cf19e14a e0005004 1bb33ece
ffff8101fae8b540 584246771 S Bo:4:055:6 -115 48 = 7eff0300 21450000 2801ab40 008006d9 8319e14a e0451175 cf041b00 50f7736b
ffff8101fae8b000 584246795 S Bi:4:055:5 -115 4096 <
ffff8101fae8b540 584246967 C Bo:4:055:6 0 48 >
ffff8101fae8b000 584248978 C Bi:4:055:5 0 1046 = 7eff0300 21450005 dc38dc00 00c60696 9e451175 cf19e14a e0005004 1bb33ed4
ffff8101fae8b000 584254641 S Bi:4:055:5 -115 4096 <
ffff8101fae8b000 584255983 C Bi:4:055:5 0 477 = 3a5da78c 7d5e18cd e39f04e8 373aef87 3e186bfa 3d8f85e0 d33c39f1 a347d3be
ffff8101fae8b000 584260704 S Bi:4:055:5 -115 4096 <
ffff8101fae8b540 584430801 S Bo:4:055:6 -115 48 = 7eff0300 21450000 2801ac40 008006d9 8219e14a e0451175 cf041b00 50f7736b
ffff8101fae8b540 584430982 C Bo:4:055:6 0 48 >
ffff8101fae8b000 584453996 C Bi:4:055:5 0 1520 = 7eff0300 21450005 dc422c00 00c6068d 4e451175 cf19e14a e0005004 1bb33ed9
ffff8101fae8b000 584458460 S Bi:4:055:5 -115 4096 <
ffff8101fae8b000 584460996 C Bi:4:055:5 0 1520 = 7eff0300 21450005 dc423000 00c6068d 4a451175 cf19e14a e0005004 1bb33edf
ffff8101fae8b000 584468253 S Bo:4:055:6 -115 48 = 7eff0300 21450000 2801ad40 008006d9 8119e14a e0451175 cf041b00 50f7736b
ffff8101fae8b540 584468274 S Bi:4:055:5 -115 4096 <
ffff8101fae8b000 584468980 C Bo:4:055:6 0 48 >
ffff8101fae8b540 584560001 C Bi:4:055:5 0 1521 = 7eff0300 21450005 dc44f000 00c6068a 8a451175 cf19e14a e0005004 1bb33ee5
ffff8101fae8b540 584568963 S Bi:4:055:5 -115 4096 <
ffff8101fae8b540 584571001 C Bi:4:055:5 0 1528 = 7eff0300 21450005 dc44f400 00c6068a 86451175 cf19e14a e0005004 1bb33eea
ffff8101fae8b540 584575683 S Bo:4:055:6 -115 48 = 7eff0300 21450000 2801ae40 008006d9 8019e14a e0451175 cf041b00 50f7736b
ffff8101fae8b000 584575703 S Bi:4:055:5 -115 4096 <
ffff8101fae8b540 584575986 C Bo:4:055:6 0 48 >
ffff8101fae8b000 584637004 C Bi:4:055:5 0 1523 = 7eff0300 21450005 dc463800 00c60689 42451175 cf19e14a e0005004 1bb33ef0
ffff8101fae8b000 584642813 S Bi:4:055:5 -115 4096 <
ffff8101fae8b000 584718010 C Bi:4:055:5 0 1525 = 7eff0300 21450005 dc463c00 00c60689 3e451175 cf19e14a e0005004 1bb33ef6
ffff8101fae8b000 584726523 S Bo:4:055:6 -115 49 = 7eff0300 21450000 2801af40 008006d9 7f19e14a e0451175 cf041b00 50f7736b
ffff8101fae8b540 584726546 S Bi:4:055:5 -115 4096 <
ffff8101fae8b000 584726994 C Bo:4:055:6 0 49 >
ffff8101fae8b540 584729004 C Bi:4:055:5 0 1521 = 7eff0300 21450005 dc547800 00c6067b 02451175 cf19e14a e0005004 1bb33efc
ffff8101fae8b540 584733413 S Bi:4:055:5 -115 4096 <
ffff8101fae8b540 584735010 C Bi:4:055:5 0 1042 = 7eff0300 21450005 dc5aac00 00c60674 ce451175 cf19e14a e0005004 1bb33f01
ffff8101fae8b540 584737630 S Bi:4:055:5 -115 4096 <
ffff8101fae8b540 584739010 C Bi:4:055:5 0 477 = e3bb5b75 b0f1511f 10edbc1b f10f5ab3 f847e28d 3d4340bf f879e29f 857d5e24
ffff8101fae8b000 584741521 S Bo:4:055:6 -115 49 = 7eff0300 21450000 2801b040 008006d9 7d5e19e1 4ae04511 75cf041b 0050f773
ffff8101fae8b000 584741995 C Bo:4:055:6 0 49 >
ffff8101fae8b000 584742496 S Bi:4:055:5 -115 4096 <
ffff8101fae8b000 584860017 C Bi:4:055:5 0 1524 = 7eff0300 21450005 dc5ab000 00c60674 ca451175 cf19e14a e0005004 1bb33f07
ffff8101fae8b000 584867907 S Bi:4:055:5 -115 4096 <
ffff8101fae8b000 584932025 C Bi:4:055:5 0 1524 = 7eff0300 21450005 dc5f7c00 00c6066f fe451175 cf19e14a e0005004 1bb33f0d
ffff8101fae8b000 584934532 S Bo:4:055:6 -115 49 = 7eff0300 21450000 2801b140 008006d9 7d5d19e1 4ae04511 75cf041b 0050f773
ffff8101fae8b540 584934556 S Bi:4:055:5 -115 4096 <
ffff8101fae8b000 584935005 C Bo:4:055:6 0 49 >
ffff8101fae8b540 585040027 C Bi:4:055:5 0 1522 = 7eff0300 21450005 dc630000 00c6066c 7a451175 cf19e14a e0005004 1bb33f12
ffff8101fae8b540 585043662 S Bi:4:055:5 -115 4096 <
ffff8101fae8b540 585123032 C Bi:4:055:5 0 1518 = 7eff0300 21450005 dc630400 00c6066c 76451175 cf19e14a e0005004 1bb33f18
ffff8101fae8b540 585128646 S Bo:4:055:6 -115 48 = 7eff0300 21450000 2801b240 008006d9 7c19e14a e0451175 cf041b00 50f7736b
ffff8101fae8b000 585128668 S Bi:4:055:5 -115 4096 <
ffff8101fae8b540 585129016 C Bo:4:055:6 0 48 >
ffff8101fae8b000 585131026 C Bi:4:055:5 0 1523 = 7eff0300 21450005 dc671400 00c60668 66451175 cf19e14a e0005004 1bb33f1e
ffff8101fae8b000 585134877 S Bi:4:055:5 -115 4096 <
ffff8101fae8b000 585137032 C Bi:4:055:5 0 1050 = 7eff0300 21450005 dc671800 00c60668 62451175 cf19e14a e0005004 1bb33f23
ffff8101fae8b000 585139655 S Bi:4:055:5 -115 4096 <
ffff8101fae8b000 585141033 C Bi:4:055:5 0 484 = f8097c25 049e3fd1 bc3fa87c 25bbd734 1fecef11 e99a7d5e 8fa0e9df 14ef2c74
ffff8101fae8b000 585149783 S Bo:4:055:6 -115 48 = 7eff0300 21450000 2801b340 008006d9 7b19e14a e0451175 cf041b00 50f7736b
ffff8101fae8b540 585149804 S Bi:4:055:5 -115 4096 <
ffff8101fae8b000 585150018 C Bo:4:055:6 0 48 >
ffff8101fae8b540 585283040 C Bi:4:055:5 0 1524 = 7eff0300 21450005 dc758800 00c60659 f2451175 cf19e14a e0005004 1bb33f29
ffff8101fae8b540 585286327 S Bi:4:055:5 -115 4096 <
ffff8101fae8b540 585289041 C Bi:4:055:5 0 1532 = 7eff0300 21450005 dc792400 00c60656 56451175 cf19e14a e0005004 1bb33f2f
ffff8101fae8b540 585299246 S Bo:4:055:6 -115 48 = 7eff0300 21450000 2801b440 008006d9 7a19e14a e0451175 cf041b00 50f7736b
ffff8101fae8b000 585299265 S Bi:4:055:5 -115 4096 <
ffff8101fae8b540 585300027 C Bo:4:055:6 0 48 >
ffff8101fae8b000 585334043 C Bi:4:055:5 0 1531 = 7eff0300 21450005 dc792800 00c60656 52451175 cf19e14a e0005004 1bb33f35
ffff8101fae8b000 585338737 S Bi:4:055:5 -115 4096 <
ffff8101fae8b000 585413050 C Bi:4:055:5 0 1520 = 7eff0300 21450005 dc7ac400 00c60654 b6451175 cf19e14a e0005004 1bb33f3a
ffff8101fae8b000 585415702 S Bo:4:055:6 -115 48 = 7eff0300 21450000 2801b540 008006d9 7919e14a e0451175 cf041b00 50f7736b
ffff8101fae8b540 585415726 S Bi:4:055:5 -115 4096 <
ffff8101fae8b000 585416032 C Bo:4:055:6 0 48 >
ffff8101fae8b540 585492056 C Bi:4:055:5 0 1522 = 7eff0300 21450005 dc7ac800 00c60654 b2451175 cf19e14a e0005004 1bb33f40
ffff8101fae8b540 585495025 S Bi:4:055:5 -115 4096 <
ffff8101fae8b540 585497053 C Bi:4:055:5 0 1522 = 7eff0300 21450005 dc884400 00c60647 36451175 cf19e14a e0005004 1bb33f46
ffff8101fae8b540 585500833 S Bo:4:055:6 -115 48 = 7eff0300 21450000 2801b640 008006d9 7819e14a e0451175 cf041b00 50f7736b
ffff8101fae8b000 585500854 S Bi:4:055:5 -115 4096 <
ffff8101fae8b540 585501038 C Bo:4:055:6 0 48 >
ffff8101fae8b000 585602067 C Bi:4:055:5 0 1523 = 7eff0300 21450005 dc884800 00c60647 32451175 cf19e14a e0005004 1bb33f4b
ffff81010bf5bb40 585605255 S Bi:4:055:5 -115 4096 <
ffff81010bf5bb40 585607063 C Bi:4:055:5 0 1525 = 7eff0300 21450005 dc8c4400 00c60643 36451175 cf19e14a e0005004 1bb33f51
ffff81010bf5bb40 585611340 S Bo:4:055:6 -115 48 = 7eff0300 21450000 2801b740 008006d9 7719e14a e0451175 cf041b00 50f7736b
ffff81010bf5b780 585611410 S Bi:4:055:5 -115 4096 <
ffff81010bf5bb40 585612046 C Bo:4:055:6 0 48 >
ffff81010bf5b780 585613072 C Bi:4:055:5 0 1042 = 7eff0300 21450005 dc8c4800 00c60643 32451175 cf19e14a e0005004 1bb33f57
ffff81010bf5b780 585614220 S Bi:4:055:5 -115 4096 <
ffff81010bf5b780 585615152 C Bi:4:055:5 0 478 = 7527c52b 7f895f0e 3c63e1cb 1f8d5fb4 bc3a7c5e 22f83bf0 f7e1b6ab 1f87757b
ffff81010bf5b780 585617245 S Bi:4:055:5 -115 4096 <
ffff81010bf5b780 585619063 C Bi:4:055:5 0 1522 = 7eff0300 21450005 dc8fc000 00c6063f ba451175 cf19e14a e0005004 1bb33f5d
ffff81010bf5b780 585622145 S Bo:4:055:6 -115 48 = 7eff0300 21450000 2801b840 008006d9 7619e14a e0451175 cf041b00 50f7736b
ffff81010bf5bb40 585622212 S Bi:4:055:5 -115 4096 <
ffff81010bf5b780 585623046 C Bo:4:055:6 0 48 >
ffff81010bf5bb40 585639067 C Bi:4:055:5 0 1533 = 7eff0300 21450005 dc8fc400 00c6063f b6451175 cf19e14a e0005004 1bb33f62
ffff81010bf5bb40 585641791 S Bi:4:055:5 -115 4096 <
ffff81010bf5bb40 585699071 C Bi:4:055:5 0 1526 = 7eff0300 21450005 dc963800 00c60639 42451175 cf19e14a e0005004 1bb33f68
ffff81010bf5bb40 585701908 S Bo:4:055:6 -115 48 = 7eff0300 21450000 2801b940 008006d9 7519e14a e0451175 cf041b00 50f7736b
ffff81010bf5bb40 585702061 C Bo:4:055:6 0 48 >
ffff81010bf5bb40 585702798 S Bi:4:055:5 -115 4096 <
ffff81010bf5bb40 585777074 C Bi:4:055:5 0 1522 = 7eff0300 21450005 dc973000 00c60638 4a451175 cf19e14a e0005004 1bb33f6e
ffff81010bf5bb40 585780925 S Bi:4:055:5 -115 4096 <
ffff8101f475a600 585913188 S Bo:4:055:6 -115 48 = 7eff0300 21450000 2801ba40 008006d9 7419e14a e0451175 cf041b00 50f7736b
ffff8101f475a600 585914064 C Bo:4:055:6 0 48 >
ffff81010bf5bb40 586037091 C Bi:4:055:5 0 1520 = 7eff0300 21450005 dc9c7000 00c60633 0a451175 cf19e14a e0005004 1bb33f73
ffff8101851a59c0 586047320 S Bi:4:055:5 -115 4096 <
ffff8101851a59c0 586049086 C Bi:4:055:5 0 1523 = 7eff0300 21450005 dc9c7400 00c60633 06451175 cf19e14a e0005004 1bb33f79
ffff8101851a59c0 586054198 S Bo:4:055:6 -115 48 = 7eff0300 21450000 2801bb40 008006d9 7319e14a e0451175 cf041b00 50f7736b
ffff8101851a56c0 586054266 S Bi:4:055:5 -115 4096 <
ffff8101851a59c0 586055072 C Bo:4:055:6 0 48 >
ffff8101851a56c0 586056083 C Bi:4:055:5 0 1050 = 7eff0300 21450005 dcab1800 00c60624 62451175 cf19e14a e0005004 1bb33f7f
ffff8101851a56c0 586057291 S Bi:4:055:5 -115 4096 <
ffff8101851a56c0 586058098 C Bi:4:055:5 0 472 = daa6a7f0 6e0f86d3 78974fd1 6d745f1a 7807c43e 0fbdf8d9 e7fe30f8 67a3fecf
ffff8101851a56c0 586064193 S Bi:4:055:5 -115 4096 <
ffff8101851a56c0 586066089 C Bi:4:055:5 0 1519 = 7eff0300 21450005 dcab1c00 00c60624 5e451175 cf19e14a e0005004 1bb33f84
ffff8101851a56c0 586068309 S Bo:4:055:6 -115 48 = 7eff0300 21450000 2801bc40 008006d9 7219e14a e0451175 cf041b00 50f7736b
ffff8101851a59c0 586068404 S Bi:4:055:5 -115 4096 <
ffff8101851a56c0 586069073 C Bo:4:055:6 0 48 >
ffff8101851a59c0 586296104 C Bi:4:055:5 0 1529 = 7eff0300 21450005 dcb73400 00c60618 46451175 cf19e14a e0005004 1cbe4369
ffff8101fae8b540 586314418 S Bo:4:055:6 -115 56 = 7eff0300 21450000 3001c540 00800615 8619e14a e0d155ad 66041e00 50ad5e07
ffff8101fae8b000 586314444 S Bi:4:055:5 -115 4096 <
ffff8101fae8b540 586316083 C Bo:4:055:6 0 56 >
ffff8101fae8b000 586317096 C Bi:4:055:5 0 1521 = 7eff0300 21450005 dcb73800 00c60618 42451175 cf19e14a e0005004 1cbe436f
ffff8101fae8b000 586323725 S Bo:4:055:6 -115 48 = 7eff0300 21450000 2801c640 008006d9 6819e14a e0451175 cf041c00 507b26bf
ffff8101fae8b540 586323747 S Bi:4:055:5 -115 4096 <
ffff8101fae8b000 586324083 C Bo:4:055:6 0 48 >
ffff8101fae8b540 586377107 C Bi:4:055:5 0 1519 = 7eff0300 21450005 dcb73c00 00c60618 3e451175 cf19e14a e0005004 1cbe4375
ffff8101851a59c0 586380825 S Bi:4:055:5 -115 4096 <
ffff8101851a59c0 586439112 C Bi:4:055:5 0 1526 = 7eff0300 21450005 dcb74000 00c60618 3a451175 cf19e14a e0005004 1bb33f8a
ffff81000bf383c0 586441845 S Bi:4:055:5 -115 4096 <
ffff81000bf383c0 586444110 C Bi:4:055:5 0 1525 = 7eff0300 21450005 dcb98400 00c60615 f6451175 cf19e14a e0005004 1bb33f90
ffff81000bf383c0 586450238 S Bo:4:055:6 -115 48 = 7eff0300 21450000 2801c740 008006d9 6719e14a e0451175 cf041b00 50f7736b
ffff81000bf38240 586450306 S Bi:4:055:5 -115 4096 <
ffff81000bf383c0 586451101 C Bo:4:055:6 0 48 >
ffff81000bf38240 586511117 C Bi:4:055:5 0 1524 = 7eff0300 21450005 dcb98800 00c60615 f2451175 cf19e14a e0005004 1bb33f96
ffff81000bf38240 586515065 S Bi:4:055:5 -115 4096 <
ffff81000bf38240 586599121 C Bi:4:055:5 0 1530 = 7eff0300 21450005 dcc11c00 00c6060e 5e451175 cf19e14a e0005004 1bb33f9b
ffff81000bf38240 586602817 S Bo:4:055:6 -115 48 = 7eff0300 21450000 2801c840 008006d9 6619e14a e0451175 cf041b00 50f7736b
ffff81000bf383c0 586602886 S Bi:4:055:5 -115 4096 <
ffff81000bf38240 586603110 C Bo:4:055:6 0 48 >
ffff81000bf38240 586613803 S Bo:4:055:6 -115 48 = 7eff0300 21450000 2801c940 008006d9 6519e14a e0451175 cf041c00 507b26bf
ffff81000bf38240 586614102 C Bo:4:055:6 0 48 >
ffff81000bf383c0 586678125 C Bi:4:055:5 0 1527 = 7eff0300 21450005 dcc12000 00c6060e 5a451175 cf19e14a e0005004 1bb33fa1
ffff81000bf383c0 586680794 S Bi:4:055:5 -115 4096 <
ffff81000bf383c0 586739129 C Bi:4:055:5 0 1520 = 7eff0300 21450005 dcd12800 00c606fe 51451175 cf19e14a e0005004 1bb33fa7
ffff81000bf383c0 586742455 S Bo:4:055:6 -115 48 = 7eff0300 21450000 2801ca40 008006d9 6419e14a e0451175 cf041b00 50f7736b
ffff81000bf38240 586742524 S Bi:4:055:5 -115 4096 <
ffff81000bf383c0 586743111 C Bo:4:055:6 0 48 >
ffff81000bf38240 586745119 C Bi:4:055:5 0 1517 = 7eff0300 21450005 dcd1cc00 00c606fd ad451175 cf19e14a e0005004 1bb33fac
ffff81000bf38240 586747470 S Bi:4:055:5 -115 4096 <
ffff81000bf38240 586812133 C Bi:4:055:5 0 1523 = 7eff0300 21450005 dcd1d000 00c606fd a9451175 cf19e14a e0005004 1bb33fb2
ffff81000bf38240 586814309 S Bo:4:055:6 -115 48 = 7eff0300 21450000 2801cb40 008006d9 6319e14a e0451175 cf041b00 50f7736b
ffff81000bf38240 586815122 C Bo:4:055:6 0 48 >
ffff81000bf38240 586815365 S Bi:4:055:5 -115 4096 <
ffff81000bf38240 586905138 C Bi:4:055:5 0 1519 = 7eff0300 21450005 dcda6000 00c606f5 19451175 cf19e14a e0005004 1bb33fb8
ffff81000bf38240 586915251 S Bi:4:055:5 -115 4096 <
ffff81000bf38240 586917135 C Bi:4:055:5 0 1519 = 7eff0300 21450005 dcda6400 00c606f5 15451175 cf19e14a e0005004 1bb33fbd
ffff8102045806c0 586922533 S Bo:4:055:6 -115 48 = 7eff0300 21450000 2801cc40 008006d9 6219e14a e0451175 cf041b00 50f7736b
ffff8102045800c0 586922603 S Bi:4:055:5 -115 4096 <
ffff8102045806c0 586923127 C Bo:4:055:6 0 48 >
ffff8102045800c0 586924155 C Bi:4:055:5 0 1054 = 7eff0300 21450005 dce62c00 00c606e9 4d451175 cf19e14a e0005004 1bb33fc3
ffff8102045800c0 586925522 S Bi:4:055:5 -115 4096 <
ffff8102045800c0 586926132 C Bi:4:055:5 0 468 = f80e75f0 578cbc49 f0c7c176 9e157f01 f8c742d0 3e1778ed 07c22e63 e20eabe2
ffff8102045800c0 586928505 S Bi:4:055:5 -115 4096 <
ffff8102045800c0 587033146 C Bi:4:055:5 0 1518 = 7eff0300 21450005 dce63000 00c606e9 49451175 cf19e14a e0005004 1bb33fc9
ffff8102045800c0 587036684 S Bo:4:055:6 -115 48 = 7eff0300 21450000 2801cd40 008006d9 6119e14a e0451175 cf041b00 50f7736b
ffff810204580540 587036752 S Bi:4:055:5 -115 4096 <
ffff8102045800c0 587037125 C Bo:4:055:6 0 48 >
ffff810204580540 587210153 C Bi:4:055:5 0 1528 = 7eff0300 21450005 dce9d000 00c606e5 a9451175 cf19e14a e0005004 1bb33fcf
ffff810204580540 587214213 S Bi:4:055:5 -115 4096 <
ffff810204580540 587216152 C Bi:4:055:5 0 1524 = 7eff0300 21450005 dce9d400 00c606e5 a5451175 cf19e14a e0005004 1bb33fd4
ffff810204580540 587219131 S Bo:4:055:6 -115 48 = 7eff0300 21450000 2801ce40 008006d9 6019e14a e0451175 cf041b00 50f7736b
ffff8102045800c0 587219193 S Bi:4:055:5 -115 4096 <
ffff810204580540 587220149 C Bo:4:055:6 0 48 >
ffff8102045800c0 587221161 C Bi:4:055:5 0 1042 = 7eff0300 21450005 dcf81c00 00c606d7 5d451175 cf19e14a e0005004 1bb33fda
ffff8102045800c0 587226216 S Bi:4:055:5 -115 4096 <
ffff8102045800c0 587227160 C Bi:4:055:5 0 483 = 6de29d52 1ff85a1f 0fbc0ba8 de788bc1 be1afcff 0085e747 8fa58bcf aa60337c
ffff8102045800c0 587230948 S Bi:4:055:5 -115 4096 <
ffff8102045800c0 587233152 C Bi:4:055:5 0 1526 = 7eff0300 21450005 dcf82000 00c606d7 59451175 cf19e14a e0005004 1bb33fe0
ffff8101fae8b000 587243322 S Bo:4:055:6 -115 48 = 7eff0300 21450000 2801cf40 008006d9 5f19e14a e0451175 cf041b00 50f7736b
ffff8101fae8b540 587243344 S Bi:4:055:5 -115 4096 <
ffff8101fae8b000 587244142 C Bo:4:055:6 0 48 >
ffff8101fae8b540 587245148 C Bi:4:055:5 0 1038 = 7eff0300 21450005 dc025000 00c606cd 2a451175 cf19e14a e0005004 1bb33fe5
ffff8101fae8b540 587246537 S Bi:4:055:5 -115 4096 <
ffff8101fae8b540 587247150 C Bi:4:055:5 0 485 = be07d4be 2c7c1cd3 d7c21e2b f0f788fe 1f6b5f12 fe017823 c717be05 f0ff0087
ffff8101fae8b540 587249409 S Bi:4:055:5 -115 4096 <
ffff81013205c000 587382789 S Bo:4:055:6 -115 48 = 7eff0300 21450000 2801d040 008006d9 5e19e14a e0451175 cf041b00 50f7736b
ffff81013205c000 587383147 C Bo:4:055:6 0 48 >
ffff8101fae8b540 587434166 C Bi:4:055:5 0 1520 = 7eff0300 21450005 dc025400 00c606cd 26451175 cf19e14a e0005004 1bb33feb
ffff81013205c540 587439276 S Bi:4:055:5 -115 4096 <
ffff81013205c540 587532173 C Bi:4:055:5 0 1524 = 7eff0300 21450005 dc04f400 00c606ca 86451175 cf19e14a e0005004 1bb33ff1
ffff81013205c540 587538821 S Bo:4:055:6 -115 48 = 7eff0300 21450000 2801d140 008006d9 5d19e14a e0451175 cf041b00 50f7736b
ffff81013205ca80 587538894 S Bi:4:055:5 -115 4096 <
ffff81013205c540 587539161 C Bo:4:055:6 0 48 >
ffff81013205ca80 587620178 C Bi:4:055:5 0 1521 = 7eff0300 21450005 dc04f800 00c606ca 82451175 cf19e14a e0005004 1bb33ff7
ffff81013205ca80 587628137 S Bi:4:055:5 -115 4096 <
ffff81013205ca80 587630176 C Bi:4:055:5 0 1519 = 7eff0300 21450005 dc0b6000 00c606c4 1a451175 cf19e14a e0005004 1bb33ffc
ffff81013205ca80 587642049 S Bo:4:055:6 -115 48 = 7eff0300 21450000 2801d240 008006d9 5c19e14a e0451175 cf041b00 50f7736b
ffff81013205c540 587642119 S Bi:4:055:5 -115 4096 <
ffff81013205ca80 587643160 C Bo:4:055:6 0 48 >
ffff81013205c540 587697179 C Bi:4:055:5 0 1520 = 7eff0300 21450005 dc0b6400 00c606c4 16451175 cf19e14a e0005004 1bb34002
ffff81013205c540 587700802 S Bi:4:055:5 -115 4096 <
ffff81013205c540 587777195 C Bi:4:055:5 0 1524 = 7eff0300 21450005 dc11c800 00c606bd b2451175 cf19e14a e0005004 1bb34008
ffff81013205c540 587779270 S Bo:4:055:6 -115 48 = 7eff0300 21450000 2801d340 008006d9 5b19e14a e0451175 cf041b00 50f7736b
ffff81013205ca80 587779336 S Bi:4:055:5 -115 4096 <
ffff81013205c540 587780215 C Bo:4:055:6 0 48 >
ffff81013205ca80 587781180 C Bi:4:055:5 0 1529 = 7eff0300 21450005 dc11cc00 00c606bd ae451175 cf19e14a e0005004 1bb3400d
ffff81013205ca80 587786475 S Bi:4:055:5 -115 4096 <
ffff81013205ca80 587788184 C Bi:4:055:5 0 1038 = 7eff0300 21450005 dc15b000 00c606b9 ca451175 cf19e14a e0005004 1bb34013
ffff81013205ca80 587789250 S Bi:4:055:5 -115 4096 <
ffff81013205ca80 587790183 C Bi:4:055:5 0 489 = 77c1cf88 fa36b7e1 dd034ef0 e783bc75 1ea3a845 61a6dc7d 5ecf7d5e 0af8ad3f
ffff81013205ca80 587792296 S Bo:4:055:6 -115 48 = 7eff0300 21450000 2801d440 008006d9 5a19e14a e0451175 cf041b00 50f7736b
ffff81013205c540 587792385 S Bi:4:055:5 -115 4096 <
ffff81013205ca80 587793181 C Bo:4:055:6 0 48 >
ffff81013205c540 587946194 C Bi:4:055:5 0 1519 = 7eff0300 21450005 dc15b400 00c606b9 c6451175 cf19e14a e0005004 1bb34019
ffff81013205c540 587954218 S Bi:4:055:5 -115 4096 <
ffff81013205c540 587956270 C Bi:4:055:5 0 1522 = 7eff0300 21450005 dc1b7400 00c606b4 06451175 cf19e14a e0005004 1bb3401e
ffff81013205c540 587958287 S Bo:4:055:6 -115 48 = 7eff0300 21450000 2801d540 008006d9 5919e14a e0451175 cf041b00 50f7736b
ffff81013205c6c0 587958346 S Bi:4:055:5 -115 4096 <
ffff81013205c540 587959263 C Bo:4:055:6 0 48 >
ffff81013205c6c0 587960189 C Bi:4:055:5 0 1050 = 7eff0300 21450005 dc1b7800 00c606b4 02451175 cf19e14a e0005004 1bb34024
ffff81013205c6c0 587962160 S Bi:4:055:5 -115 4096 <
ffff81013205c6c0 587963241 C Bi:4:055:5 0 468 = ac2c3c63 e2fd17c1 babe83a7 6b5e15f1 7f843c69 603e2efc 4cf11f8f 7c2ffb39
ffff81013205c6c0 587965272 S Bi:4:055:5 -115 4096 <
ffff81013205c6c0 587967193 C Bi:4:055:5 0 1520 = 7eff0300 21450005 dc1bd000 00c606b3 aa451175 cf19e14a e0005004 1bb3402a
ffff81013205c6c0 587970364 S Bo:4:055:6 -115 48 = 7eff0300 21450000 2801d640 008006d9 5819e14a e0451175 cf041b00 50f7736b
ffff81013205c540 587970432 S Bi:4:055:5 -115 4096 <
ffff81013205c6c0 587971179 C Bo:4:055:6 0 48 >
ffff81013205c540 588174221 C Bi:4:055:5 0 1525 = 7eff0300 21450005 dc1bd400 00c606b3 a6451175 cf19e14a e0005004 1bb34030
ffff81013205c540 588178843 S Bi:4:055:5 -115 4096 <
ffff81013205c540 588181207 C Bi:4:055:5 0 1521 = 7eff0300 21450005 dc21d400 00c606ad a6451175 cf19e14a e0005004 1bb34035
ffff81013205c540 588183947 S Bo:4:055:6 -115 48 = 7eff0300 21450000 2801d740 008006d9 5719e14a e0451175 cf041b00 50f7736b
ffff81013205c6c0 588184009 S Bi:4:055:5 -115 4096 <
ffff81013205c540 588184188 C Bo:4:055:6 0 48 >
ffff81013205c6c0 588257213 C Bi:4:055:5 0 1524 = 7eff0300 21450005 dc21d800 00c606ad a2451175 cf19e14a e0005004 1bb3403b
ffff81013205c6c0 588260689 S Bi:4:055:5 -115 4096 <
ffff81013205c6c0 588263210 C Bi:4:055:5 0 1524 = 7eff0300 21450005 dc31c000 00c6069d ba451175 cf19e14a e0005004 1bb34041
ffff81013205c6c0 588266763 S Bo:4:055:6 -115 48 = 7eff0300 21450000 2801d840 008006d9 5619e14a e0451175 cf041b00 50f7736b
ffff81013205c540 588266828 S Bi:4:055:5 -115 4096 <
ffff81013205c6c0 588267195 C Bo:4:055:6 0 48 >
ffff81013205c540 588268218 C Bi:4:055:5 0 1046 = 7eff0300 21450005 dc39f800 00c60695 82451175 cf19e14a e0005004 1bb34046
ffff81013205c540 588278087 S Bi:4:055:5 -115 4096 <
ffff81013205c540 588279223 C Bi:4:055:5 0 480 = 5d7f56fd 9a34ff00 0d7c40f0 5ea9e22d 13e126b9 a9fc1be8 cc385b86 d6619af1
ffff81013205c540 588282275 S Bi:4:055:5 -115 4096 <
ffff81013205c540 588424233 C Bi:4:055:5 0 1522 = 7eff0300 21450005 dc39fc00 00c60695 7d5e4511 75cf19e1 4ae00050 041bb340
ffff81013205c540 588426602 S Bo:4:055:6 -115 48 = 7eff0300 21450000 2801d940 008006d9 5519e14a e0451175 cf041b00 50f7736b
ffff81013205c3c0 588426671 S Bi:4:055:5 -115 4096 <
ffff81013205c540 588427261 C Bo:4:055:6 0 48 >
ffff81013205c3c0 588429211 C Bi:4:055:5 0 1523 = 7eff0300 21450005 dc3a0800 00c60695 72451175 cf19e14a e0005004 1bb34052
ffff81013205c3c0 588434219 S Bi:4:055:5 -115 4096 <
ffff81013205c3c0 588436221 C Bi:4:055:5 0 1046 = 7eff0300 21450005 dc3a0c00 00c60695 6e451175 cf19e14a e0005004 1bb34057
ffff81013205c3c0 588438276 S Bi:4:055:5 -115 4096 <
ffff81013205c3c0 588439217 C Bi:4:055:5 0 476 = 837d5e30 d0bc176f f09bc0ba a7873c39 e2bf156c 7c39baf8 9f71e2cb 7f0df8eb
ffff81013205c3c0 588442231 S Bo:4:055:6 -115 48 = 7eff0300 21450000 2801da40 008006d9 5419e14a e0451175 cf041b00 50f7736b
ffff81013205ca80 588442300 S Bi:4:055:5 -115 4096 <
ffff81013205c3c0 588443205 C Bo:4:055:6 0 48 >
ffff81013205ca80 588443225 C Bi:4:055:5 0 56 = 7eff0300 21450000 3049ac00 00c606c7 9ed155ad 6619e14a e0005004 1ec24caa
ffff81013205ca80 588446249 S Bo:4:055:6 -115 48 = 7eff0300 21450000 2801db40 00800615 7819e14a e0d155ad 66041e00 50ad5e07
ffff81013205c3c0 588446308 S Bi:4:055:5 -115 4096 <
ffff81013205ca80 588447265 C Bo:4:055:6 0 48 >
ffff81013205ca80 588448249 S Bo:4:055:6 -115 977 = 7eff0300 21450003 c901dc40 00800611 d619e14a e0d155ad 66041e00 50ad5e07
ffff81013205ca80 588450216 C Bo:4:055:6 0 977 >
ffff81013205c3c0 588636236 C Bi:4:055:5 0 1530 = 7eff0300 21450005 dc49c000 00c60685 ba451175 cf19e14a e0005004 1cbe437a
ffff81013205c3c0 588640224 S Bi:4:055:5 -115 4096 <
ffff81013205c3c0 588642230 C Bi:4:055:5 0 1531 = 7eff0300 21450005 dc49c400 00c60685 b6451175 cf19e14a e0005004 1cbe4380
ffff81013205c3c0 588645207 S Bo:4:055:6 -115 48 = 7eff0300 21450000 2801df40 008006d9 4f19e14a e0451175 cf041c00 507b26bf
ffff81013205ca80 588645273 S Bi:4:055:5 -115 4096 <
ffff81013205c3c0 588646216 C Bo:4:055:6 0 48 >
ffff81013205ca80 588719248 C Bi:4:055:5 0 1522 = 7eff0300 21450005 dc49c800 00c60685 b2451175 cf19e14a e0005004 1cbe4386
ffff81013205ca80 588725621 S Bi:4:055:5 -115 4096 <
ffff81013205ca80 588728238 C Bi:4:055:5 0 1521 = 7eff0300 21450005 dc4e4000 00c60681 3a451175 cf19e14a e0005004 1bb3405d
ffff81013205ca80 588733168 S Bi:4:055:5 -115 4096 <
ffff81013205ca80 588798243 C Bi:4:055:5 0 1524 = 7eff0300 21450005 dc4e4400 00c60681 36451175 cf19e14a e0005004 1bb34063
ffff81013205ca80 588806000 S Bo:4:055:6 -115 48 = 7eff0300 21450000 2801e040 008006d9 4e19e14a e0451175 cf041b00 50f7736b
ffff81013205c3c0 588806072 S Bi:4:055:5 -115 4096 <
ffff81013205ca80 588806224 C Bo:4:055:6 0 48 >
ffff81013205c3c0 588808238 C Bi:4:055:5 0 1519 = 7eff0300 21450005 dc592c00 00c60676 4e451175 cf19e14a e0005004 1bb34069
ffff81013205c3c0 588811722 S Bi:4:055:5 -115 4096 <
ffff81013205c3c0 588813240 C Bi:4:055:5 0 1050 = 7eff0300 21450005 dc593000 00c60676 4a451175 cf19e14a e0005004 1bb3406e
ffff81013205c3c0 588818333 S Bi:4:055:5 -115 4096 <
ffff81013205c3c0 588819240 C Bi:4:055:5 0 466 = 31af9fd3 ab96e332 bc6e030b e1ce650c 156cbd66 789e22e3 4871a671 9d53cc69
ffff81013205c3c0 588822328 S Bo:4:055:6 -115 48 = 7eff0300 21450000 2801e140 008006d9 4d19e14a e0451175 cf041b00 50f7736b
ffff81013205ca80 588822395 S Bi:4:055:5 -115 4096 <
ffff81013205c3c0 588823224 C Bo:4:055:6 0 48 >
ffff81013205c3c0 588906277 S Bo:4:055:6 -115 48 = 7eff0300 21450000 2801e240 008006d9 4c19e14a e0451175 cf041c00 507b26bf
ffff81013205c3c0 588907230 C Bo:4:055:6 0 48 >
ffff81013205ca80 589009255 C Bi:4:055:5 0 1527 = 7eff0300 21450005 dc593c00 00c60676 3e451175 cf19e14a e0005004 1cbe438c
ffff81013205ca80 589014228 S Bi:4:055:5 -115 4096 <
ffff81013205ca80 589016256 C Bi:4:055:5 0 1521 = 7eff0300 21450005 dc594000 00c60676 3a451175 cf19e14a e0005004 1cbe4391
ffff81013205ca80 589019232 S Bo:4:055:6 -115 48 = 7eff0300 21450000 2801e340 008006d9 4b19e14a e0451175 cf041c00 507b26bf
ffff81013205c9c0 589019300 S Bi:4:055:5 -115 4096 <
ffff81013205ca80 589020239 C Bo:4:055:6 0 48 >
ffff81013205c9c0 589021257 C Bi:4:055:5 0 1042 = 7eff0300 21450005 dc634800 00c6066c 32451175 cf19e14a e0005004 1bb34074
ffff81013205c9c0 589023236 S Bi:4:055:5 -115 4096 <
ffff81013205c9c0 589024249 C Bi:4:055:5 0 483 = ef059a7f ab1c475d f09e4d9b 54c570de 4986c32c 26759970 fe650c44 7158ecf2
ffff81013205c9c0 589038848 S Bi:4:055:5 -115 4096 <
ffff81013205c9c0 589041269 C Bi:4:055:5 0 1518 = 7eff0300 21450005 dc634c00 00c6066c 2e451175 cf19e14a e0005004 1bb3407a
ffff81013205c9c0 589043171 S Bo:4:055:6 -115 48 = 7eff0300 21450000 2801e440 008006d9 4a19e14a e0451175 cf041b00 50f7736b
ffff81013205ca80 589044177 S Bi:4:055:5 -115 4096 <
ffff81013205c9c0 589044237 C Bo:4:055:6 0 48 >
ffff81013205ca80 589046249 C Bi:4:055:5 0 1046 = 7eff0300 21450005 dc65fc00 00c60669 7d5e4511 75cf19e1 4ae00050 041bb340
ffff81013205ca80 589047170 S Bi:4:055:5 -115 4096 <
ffff81013205ca80 589048249 C Bi:4:055:5 0 470 = 8be3bb6b 5f1b6b9a 8fc42f84 5aae9ff1 a4f80bc3 1f10f43f 89fe3df8 8561fb49
ffff81013205ca80 589051277 S Bi:4:055:5 -115 4096 <
ffff81013205ca80 589059266 C Bi:4:055:5 0 1522 = 7eff0300 21450005 dc660000 00c60669 7a451175 cf19e14a e0005004 1bb34085
ffff81013205ca80 589063733 S Bo:4:055:6 -115 48 = 7eff0300 21450000 2801e540 008006d9 4919e14a e0451175 cf041b00 50f7736b
ffff81013205c9c0 589063797 S Bi:4:055:5 -115 4096 <
ffff81013205ca80 589064248 C Bo:4:055:6 0 48 >
ffff81013205c9c0 589114261 C Bi:4:055:5 0 1528 = 7eff0300 21450005 dc6b9800 00c60663 e2451175 cf19e14a e0005004 1bb3408b
ffff81013205c9c0 589118273 S Bi:4:055:5 -115 4096 <
ffff81013205c9c0 589178274 C Bi:4:055:5 0 1523 = 7eff0300 21450005 dc6b9c00 00c60663 de451175 cf19e14a e0005004 1bb34090
ffff81013205c9c0 589186141 S Bo:4:055:6 -115 48 = 7eff0300 21450000 2801e640 008006d9 4819e14a e0451175 cf041b00 50f7736b
ffff81013205ca80 589186212 S Bi:4:055:5 -115 4096 <
ffff81013205c9c0 589187246 C Bo:4:055:6 0 48 >
ffff81013205ca80 589211265 C Bi:4:055:5 0 1522 = 7eff0300 21450005 dc6fb000 00c6065f ca451175 cf19e14a e0005004 1bb34096
ffff81013205ca80 589214215 S Bi:4:055:5 -115 4096 <
ffff81013205c9c0 589341758 S Bo:4:055:6 -115 49 = 7eff0300 21450000 2801e740 008006d9 4719e14a e0451175 cf041b00 50f7736b
ffff81013205c9c0 589342255 C Bo:4:055:6 0 49 >
ffff81013205ca80 589511280 C Bi:4:055:5 0 1525 = 7eff0300 21450005 dc6fb400 00c6065f c6451175 cf19e14a e0005004 1bb3409c
ffff81013205ca80 589519414 S Bi:4:055:5 -115 4096 <
ffff81013205ca80 589623290 C Bi:4:055:5 0 1518 = 7eff0300 21450005 dc7b0c00 00c60654 6e451175 cf19e14a e0005004 1bb340a2
ffff81013205ca80 589626398 S Bo:4:055:6 -115 48 = 7eff0300 21450000 2801e840 008006d9 4619e14a e0451175 cf041b00 50f7736b
ffff81013205c3c0 589626463 S Bi:4:055:5 -115 4096 <
ffff81013205ca80 589627278 C Bo:4:055:6 0 48 >
ffff81013205c3c0 589629328 C Bi:4:055:5 0 1520 = 7eff0300 21450005 dc7b1000 00c60654 6a451175 cf19e14a e0005004 1bb340a7
ffff81013205c3c0 589639115 S Bi:4:055:5 -115 4096 <
ffff81013205c3c0 589641290 C Bi:4:055:5 0 1054 = 7eff0300 21450005 dc7d5d54 0000c606 52264511 75cf19e1 4ae00050 041bb340
ffff81013205c3c0 589645213 S Bi:4:055:5 -115 4096 <
ffff81013205c3c0 589646286 C Bi:4:055:5 0 472 = 8d43c21f 0635fb58 fc37e34f 1ef86b53 bff86f6b a6787fc4 b7df17be 1d89341f
ffff81013205c3c0 589650249 S Bo:4:055:6 -115 48 = 7eff0300 21450000 2801e940 008006d9 4519e14a e0451175 cf041b00 50f7736b
ffff81013205ca80 589650311 S Bi:4:055:5 -115 4096 <
ffff81013205c3c0 589651279 C Bo:4:055:6 0 48 >
ffff81013205ca80 589652286 C Bi:4:055:5 0 1530 = 7eff0300 21450005 dc7d5d58 0000c606 52224511 75cf19e1 4ae00050 041bb340
ffff81013205ca80 589661985 S Bi:4:055:5 -115 4096 <
ffff81013205ca80 589663290 C Bi:4:055:5 0 1034 = 7eff0300 21450005 dc87e000 00c60647 9a451175 cf19e14a e0005004 1bb340b8
ffff81013205ca80 589665719 S Bi:4:055:5 -115 4096 <
ffff81013205ca80 589667287 C Bi:4:055:5 0 490 = 5e1dd5b4 3f08fc18 b2bdd7fc 074ad7c7 3ae78374 cf07787b e297c28f 06f8f7e0
ffff81013205ca80 589669805 S Bo:4:055:6 -115 48 = 7eff0300 21450000 2801ea40 008006d9 4419e14a e0451175 cf041b00 50f7736b
ffff81013205ca80 589670273 C Bo:4:055:6 0 48 >
ffff81013205ca80 589670773 S Bi:4:055:5 -115 4096 <
ffff81013205ca80 589835301 C Bi:4:055:5 0 1522 = 7eff0300 21450005 dc919000 00c6063d ea451175 cf19e14a e0005004 1bb340be
ffff81013205ca80 589838604 S Bi:4:055:5 -115 4096 <
ffff81013205ca80 589914305 C Bi:4:055:5 0 1520 = 7eff0300 21450005 dc919400 00c6063d e6451175 cf19e14a e0005004 1bb340c4
ffff81013205ca80 589919300 S Bo:4:055:6 -115 48 = 7eff0300 21450000 2801eb40 008006d9 4319e14a e0451175 cf041b00 50f7736b
ffff81013205c3c0 589919369 S Bi:4:055:5 -115 4096 <
ffff81013205ca80 589920289 C Bo:4:055:6 0 48 >
ffff81013205c3c0 589921301 C Bi:4:055:5 0 1523 = 7eff0300 21450005 dc98b000 00c60636 ca451175 cf19e14a e0005004 1bb340ca
ffff81013205c3c0 589931070 S Bi:4:055:5 -115 4096 <
ffff81013205c3c0 589991309 C Bi:4:055:5 0 1523 = 7eff0300 21450005 dc98b400 00c60636 c6451175 cf19e14a e0005004 1bb340cf
ffff81013205c3c0 589996256 S Bo:4:055:6 -115 48 = 7eff0300 21450000 2801ec40 008006d9 4219e14a e0451175 cf041b00 50f7736b
ffff81013205c540 589996320 S Bi:4:055:5 -115 4096 <
ffff81013205c3c0 589997291 C Bo:4:055:6 0 48 >
ffff81013205c540 589998301 C Bi:4:055:5 0 1524 = 7eff0300 21450005 dca27c00 00c6062c fe451175 cf19e14a e0005004 1bb340d5
ffff81013205c540 590002240 S Bi:4:055:5 -115 4096 <
ffff81013205c3c0 590145202 S Bo:4:055:6 -115 48 = 7eff0300 21450000 2801ed40 008006d9 4119e14a e0451175 cf041b00 50f7736b
ffff81013205c3c0 590146300 C Bo:4:055:6 0 48 >
ffff81013205c540 590175748 C Bi:4:055:5 0 1520 = 7eff0300 21450005 dca28000 00c6062c fa451175 cf19e14a e0005004 1bb340db
ffff81013205c540 590180117 S Bi:4:055:5 -115 4096 <
ffff81013205c540 590182319 C Bi:4:055:5 0 1523 = 7eff0300 21450005 dca3c000 00c6062b ba451175 cf19e14a e0005004 1bb340e0
ffff81013205c540 590184863 S Bo:4:055:6 -115 48 = 7eff0300 21450000 2801ee40 008006d9 4019e14a e0451175 cf041b00 50f7736b
ffff81013205c3c0 590184923 S Bi:4:055:5 -115 4096 <
ffff81013205c540 590185300 C Bo:4:055:6 0 48 >
ffff81013205c3c0 590186322 C Bi:4:055:5 0 1050 = 7eff0300 21450005 dca3c400 00c6062b b6451175 cf19e14a e0005004 1bb340e6
ffff81013205c3c0 590188822 S Bi:4:055:5 -115 4096 <
ffff81013205c3c0 590190315 C Bi:4:055:5 0 471 = df08bc3f f04bc613 cff13fec 5e1bf8d7 77e33d4f e1e7c5af 1dbbf123 e9175ab7
ffff81013205c3c0 590199302 S Bi:4:055:5 -115 4096 <
ffff8101fae8b300 590298956 S Bo:4:055:6 -115 48 = 7eff0300 21450000 2801ef40 008006d9 3f19e14a e0451175 cf041b00 50f7736b
ffff8101fae8b300 590299310 C Bo:4:055:6 0 48 >
ffff81013205c3c0 590332328 C Bi:4:055:5 0 1526 = 7eff0300 21450005 dcb23000 00c6061d 4a451175 cf19e14a e0005004 1bb340ec
ffff8101fae8b300 590334867 S Bi:4:055:5 -115 4096 <
ffff8101fae8b300 590394332 C Bi:4:055:5 0 1520 = 7eff0300 21450005 dcb23400 00c6061d 46451175 cf19e14a e0005004 1bb340f1
ffff8101fae8b300 590399754 S Bo:4:055:6 -115 48 = 7eff0300 21450000 2801f040 008006d9 3e19e14a e0451175 cf041b00 50f7736b
ffff8101fae8b540 590399778 S Bi:4:055:5 -115 4096 <
ffff8101fae8b300 590400311 C Bo:4:055:6 0 48 >
ffff8101fae8b540 590402319 C Bi:4:055:5 0 1524 = 7eff0300 21450005 dcb23800 00c6061d 42451175 cf19e14a e0005004 1bb340f7
ffff8101fae8b540 590406765 S Bi:4:055:5 -115 4096 <
ffff8101fae8b540 590473336 C Bi:4:055:5 0 1526 = 7eff0300 21450005 dcb23c00 00c6061d 3e451175 cf19e14a e0005004 1bb340fd
ffff8101fae8b540 590478736 S Bo:4:055:6 -115 48 = 7eff0300 21450000 2801f140 008006d9 3d19e14a e0451175 cf041b00 50f7736b
ffff8101fae8b300 590478758 S Bi:4:055:5 -115 4096 <
ffff8101fae8b540 590479315 C Bo:4:055:6 0 48 >
ffff8101fae8b300 590481324 C Bi:4:055:5 0 1522 = 7eff0300 21450005 dcbb0c00 00c60614 6e451175 cf19e14a e0005004 1bb34103
ffff8101fae8b300 590483741 S Bi:4:055:5 -115 4096 <
ffff8101fae8b540 590632673 S Bo:4:055:6 -115 48 = 7eff0300 21450000 2801f240 008006d9 3c19e14a e0451175 cf041b00 50f7736b
ffff8101fae8b540 590633328 C Bo:4:055:6 0 48 >
ffff8101fae8b300 590651340 C Bi:4:055:5 0 1528 = 7eff0300 21450005 dcbb1000 00c60614 6a451175 cf19e14a e0005004 1bb34108
ffff8101fae8b300 590655683 S Bi:4:055:5 -115 4096 <
ffff8101fae8b300 590747352 C Bi:4:055:5 0 1531 = 7eff0300 21450005 dcc0e000 00c6060e 9a451175 cf19e14a e0005004 1bb3410e
ffff8101fae8b300 590750803 S Bo:4:055:6 -115 48 = 7eff0300 21450000 2801f340 008006d9 3b19e14a e0451175 cf041b00 50f7736b
ffff8101fae8b540 590750828 S Bi:4:055:5 -115 4096 <
ffff8101fae8b300 590751330 C Bo:4:055:6 0 48 >
ffff8101fae8b540 590753339 C Bi:4:055:5 0 1529 = 7eff0300 21450005 dcc0e400 00c6060e 96451175 cf19e14a e0005004 1bb34114
ffff8101fae8b540 590755665 S Bi:4:055:5 -115 4096 <
ffff8101fae8b540 590757346 C Bi:4:055:5 0 1030 = 7eff0300 21450005 dcca8800 00c60604 f2451175 cf19e14a e0005004 1bb34119
ffff8101fae8b540 590759682 S Bi:4:055:5 -115 4096 <
ffff8101fae8b540 590760345 C Bi:4:055:5 0 492 = b1af41f1 135df115 97813c53 e17f17f8 6fe1cf87 fc5f6b0e b9f146f7 50f11787
ffff8101fae8b540 590771799 S Bo:4:055:6 -115 48 = 7eff0300 21450000 2801f440 008006d9 3a19e14a e0451175 cf041b00 50f7736b
ffff8101fae8b300 590771824 S Bi:4:055:5 -115 4096 <
ffff8101fae8b540 590773335 C Bo:4:055:6 0 48 >
ffff8101fae8b300 590873358 C Bi:4:055:5 0 1521 = 7eff0300 21450005 dcca8c00 00c60604 ee451175 cf19e14a e0005004 1bb3411f
ffff8101fae8b300 590880511 S Bi:4:055:5 -115 4096 <
ffff8101fae8b300 590953363 C Bi:4:055:5 0 1522 = 7eff0300 21450005 dccd4800 00c60602 32451175 cf19e14a e0005004 1bb34125
ffff8101fae8b300 590955851 S Bo:4:055:6 -115 48 = 7eff0300 21450000 2801f540 008006d9 3919e14a e0451175 cf041b00 50f7736b
ffff8101fae8b540 590955875 S Bi:4:055:5 -115 4096 <
ffff8101fae8b300 590956341 C Bo:4:055:6 0 48 >
ffff8101fae8b540 590958350 C Bi:4:055:5 0 1520 = 7eff0300 21450005 dccd4c00 00c60602 2e451175 cf19e14a e0005004 1bb3412a
ffff8101fae8b540 590961763 S Bi:4:055:5 -115 4096 <
ffff8101fae8b540 591038367 C Bi:4:055:5 0 1526 = 7eff0300 21450005 dcda6800 00c606f5 11451175 cf19e14a e0005004 1cbe4397
ffff8101fae8b540 591042746 S Bi:4:055:5 -115 4096 <
ffff8101fae8b300 591089687 S Bo:4:055:6 -115 48 = 7eff0300 21450000 2801f640 008006d9 3819e14a e0451175 cf041b00 50f7736b
ffff8101fae8b300 591090354 C Bo:4:055:6 0 48 >
ffff8101fae8b540 591117371 C Bi:4:055:5 0 1523 = 7eff0300 21450005 dcda6c00 00c606f5 0d451175 cf19e14a e0005004 1cbe439d
ffff8101fae8b540 591121755 S Bo:4:055:6 -115 48 = 7eff0300 21450000 2801f740 008006d9 3719e14a e0451175 cf041c00 507b26bf
ffff8101fae8b300 591121779 S Bi:4:055:5 -115 4096 <
ffff8101fae8b540 591122350 C Bo:4:055:6 0 48 >
ffff8101fae8b300 591177373 C Bi:4:055:5 0 1521 = 7eff0300 21450005 dcda7000 00c606f5 09451175 cf19e14a e0005004 1cbe43a2
ffff8101fae8b300 591185777 S Bi:4:055:5 -115 4096 <
ffff8101fae8b300 591253380 C Bi:4:055:5 0 1508 = 7eff0300 21450005 dcdd8000 00c6062e 1ed155ad 6619e14a e0005004 1ec24caa
ffff8101fae8b300 591258771 S Bi:4:055:5 -115 4096 <
ffff8101fae8b300 591261374 C Bi:4:055:5 0 1508 = 7eff0300 21450005 dcdd8800 00c6062e 16d155ad 6619e14a e0005004 1ec24caf
ffff8101fae8b300 591268813 S Bo:4:055:6 -115 48 = 7eff0300 21450000 2801f840 00800615 5b19e14a e0d155ad 66041e00 50ad5e0b
ffff8101fae8b540 591268835 S Bi:4:055:5 -115 4096 <
ffff8101fae8b300 591269359 C Bo:4:055:6 0 48 >
ffff8101fae8b540 591317383 C Bi:4:055:5 0 1525 = 7eff0300 21450005 dce40400 00c606eb 75451175 cf19e14a e0005004 1bb34130
ffff8101fae8b540 591320647 S Bi:4:055:5 -115 4096 <
ffff8101fae8b540 591323378 C Bi:4:055:5 0 1526 = 7eff0300 21450005 dce40800 00c606eb 71451175 cf19e14a e0005004 1bb34136
ffff8101fae8b540 591332250 S Bo:4:055:6 -115 48 = 7eff0300 21450000 2801f940 008006d9 3519e14a e0451175 cf041b00 50f7736b
ffff8101fae8b300 591332272 S Bi:4:055:5 -115 4096 <
ffff8101fae8b540 591333362 C Bo:4:055:6 0 48 >
ffff8101fae8b300 591334374 C Bi:4:055:5 0 1038 = 7eff0300 21450005 dce49800 00c606ea e1451175 cf19e14a e0005004 1bb3413c
ffff8101fae8b300 591336498 S Bo:4:055:6 -115 48 = 7eff0300 21450000 2801fa40 008006d9 3419e14a e0451175 cf041c00 507b26bf
ffff8101fae8b540 591336518 S Bi:4:055:5 -115 4096 <
ffff8101fae8b300 591337361 C Bo:4:055:6 0 48 >
ffff8101fae8b540 591337380 C Bi:4:055:5 0 486 = f03e278a f1543039 8e1e5c27 3c265d8b cdb2fc7d 5e3b3dc6 54ce6ae6 b8cc13e2
ffff8101fae8b540 591340342 S Bi:4:055:5 -115 4096 <
ffff8101fae8b540 591538396 C Bi:4:055:5 0 1530 = 7eff0300 21450005 dce49c00 00c606ea dd451175 cf19e14a e0005004 1bb34141
ffff8101fae8b540 591542865 S Bo:4:055:6 -115 48 = 7eff0300 21450000 2801fb40 008006d9 3319e14a e0451175 cf041b00 50f7736b
ffff8101fae8b300 591542890 S Bi:4:055:5 -115 4096 <
ffff8101fae8b540 591543374 C Bo:4:055:6 0 48 >
ffff8101fae8b300 591613400 C Bi:4:055:5 0 1520 = 7eff0300 21450005 dce86400 00c606e7 15451175 cf19e14a e0005004 1cbe43a8
ffff8101fae8b300 591619667 S Bi:4:055:5 -115 4096 <
ffff8101fae8b300 591622398 C Bi:4:055:5 0 1526 = 7eff0300 21450005 dce86800 00c606e7 11451175 cf19e14a e0005004 1cbe43ae
ffff8101fae8b300 591624611 S Bo:4:055:6 -115 48 = 7eff0300 21450000 2801fc40 008006d9 3219e14a e0451175 cf041c00 507b26bf
ffff8101fae8b540 591624632 S Bi:4:055:5 -115 4096 <
ffff8101fae8b300 591625381 C Bo:4:055:6 0 48 >
ffff8101fae8b540 591694404 C Bi:4:055:5 0 1521 = 7eff0300 21450005 dcedbc00 00c606e1 bd451175 cf19e14a e0005004 1cbe43b3
ffff8101fae8b540 591698745 S Bi:4:055:5 -115 4096 <
ffff8101fae8b540 591779411 C Bi:4:055:5 0 1528 = 7eff0300 21450005 dcedc000 00c606e1 b9451175 cf19e14a e0005004 1cbe43b9
ffff8101fae8b540 591785916 S Bo:4:055:6 -115 48 = 7eff0300 21450000 2801fd40 008006d9 3119e14a e0451175 cf041c00 507b26bf
ffff8101fae8b300 591785940 S Bi:4:055:5 -115 4096 <
ffff8101fae8b540 591786388 C Bo:4:055:6 0 48 >
ffff8101fae8b300 591788401 C Bi:4:055:5 0 1523 = 7eff0300 21450005 dcedc400 00c606e1 b5451175 cf19e14a e0005004 1cbe43bf
ffff8101fae8b300 591791881 S Bi:4:055:5 -115 4096 <
ffff8101fae8b540 591885585 S Bo:4:055:6 -115 48 = 7eff0300 21450000 2801fe40 008006d9 3019e14a e0451175 cf041c00 507b26bf
ffff8101fae8b540 591886398 C Bo:4:055:6 0 48 >
ffff8101fae8b300 591913411 C Bi:4:055:5 0 1529 = 7eff0300 21450005 dcefa400 00c606df d5451175 cf19e14a e0005004 1bb34147
ffff8101fae8b300 591919873 S Bi:4:055:5 -115 4096 <
ffff8101fae8b300 591922417 C Bi:4:055:5 0 1526 = 7eff0300 21450005 dcefa800 00c606df d1451175 cf19e14a e0005004 1bb3414d
ffff8101fae8b300 591926789 S Bo:4:055:6 -115 48 = 7eff0300 21450000 2801ff40 008006d9 2f19e14a e0451175 cf041b00 50f7736b
ffff8101fae8b540 591926809 S Bi:4:055:5 -115 4096 <
ffff8101fae8b300 591927395 C Bo:4:055:6 0 48 >
ffff8101fae8b540 591995421 C Bi:4:055:5 0 1525 = 7eff0300 21450005 dcf17000 00c606de 09451175 cf19e14a e0005004 1bb34152
ffff8101fae8b540 591998714 S Bi:4:055:5 -115 4096 <
ffff8101fae8b540 592077425 C Bi:4:055:5 0 1522 = 7eff0300 21450005 dcf17400 00c606de 05451175 cf19e14a e0005004 1bb34158
ffff8101fae8b540 592080750 S Bo:4:055:6 -115 48 = 7eff0300 21450000 28020040 008006d9 2e19e14a e0451175 cf041b00 50f7736b
ffff8101fae8b300 592080774 S Bi:4:055:5 -115 4096 <
ffff8101fae8b540 592081404 C Bo:4:055:6 0 48 >
ffff8101fae8b300 592158429 C Bi:4:055:5 0 1519 = 7eff0300 21450005 dcf55c00 00c606da 1d451175 cf19e14a e0005004 1bb3415e
ffff8101fae8b300 592168479 S Bi:4:055:5 -115 4096 <
ffff8101fae8b300 592171430 C Bi:4:055:5 0 1516 = 7eff0300 21450005 dcf56000 00c606da 19451175 cf19e14a e0005004 1bb34164
ffff8101fae8b300 592174244 S Bo:4:055:6 -115 48 = 7eff0300 21450000 28020140 008006d9 2d19e14a e0451175 cf041b00 50f7736b
ffff8101fae8b540 592174267 S Bi:4:055:5 -115 4096 <
ffff8101fae8b300 592174409 C Bo:4:055:6 0 48 >
ffff8101fae8b540 592176420 C Bi:4:055:5 0 1058 = 7eff0300 21450005 dcfd5c00 00c606d2 1d451175 cf19e14a e0005004 1bb34169
ffff8101fae8b540 592179383 S Bi:4:055:5 -115 4096 <
ffff8101fae8b540 592180425 C Bi:4:055:5 0 470 = b1797d5e 0711259e e591c356 cdb2fcaa 580c3712 f16e2b11 4701c51c 79947cee
ffff8101fae8b540 592183334 S Bi:4:055:5 -115 4096 <
ffff8101fae8b540 592185425 C Bi:4:055:5 0 1532 = 7eff0300 21450005 dc10d800 00c606be a2451175 cf19e14a e0005004 1bb3416f
ffff8101fae8b540 592190828 S Bo:4:055:6 -115 48 = 7eff0300 21450000 28020240 008006d9 2c19e14a e0451175 cf041b00 50f7736b
ffff8101fae8b300 592190853 S Bi:4:055:5 -115 4096 <
ffff8101fae8b540 592191410 C Bo:4:055:6 0 48 >
ffff8101fae8b300 592382442 C Bi:4:055:5 0 1520 = 7eff0300 21450005 dc10dc00 00c606be 9e451175 cf19e14a e0005004 1bb34175
ffff8101fae8b300 592386753 S Bi:4:055:5 -115 4096 <
ffff8101fae8b300 592389440 C Bi:4:055:5 0 1519 = 7eff0300 21450005 dc128000 00c606bc fa451175 cf19e14a e0005004 1bb3417a
ffff8101fae8b300 592391734 S Bo:4:055:6 -115 48 = 7eff0300 21450000 28020340 008006d9 2b19e14a e0451175 cf041b00 50f7736b
ffff8101fae8b540 592391758 S Bi:4:055:5 -115 4096 <
ffff8101fae8b300 592392421 C Bo:4:055:6 0 48 >
ffff8101fae8b540 592393434 C Bi:4:055:5 0 1054 = 7eff0300 21450005 dc128400 00c606bc f6451175 cf19e14a e0005004 1bb34180
ffff8101fae8b540 592394800 S Bi:4:055:5 -115 4096 <
ffff8101fae8b540 592395435 C Bi:4:055:5 0 465 = 8cde15d4 74bf1678 dfe26dc6 a9af68da 76a3aa68 1e10bfd2 7c09e0eb 1d334983
ffff8101fae8b540 592402746 S Bi:4:055:5 -115 4096 <
ffff8101fae8b540 592405437 C Bi:4:055:5 0 1524 = 7eff0300 21450005 dc139000 00c606bb ea451175 cf19e14a e0005004 1bb34186
ffff8101fae8b540 592411835 S Bo:4:055:6 -115 48 = 7eff0300 21450000 28020440 008006d9 2a19e14a e0451175 cf041b00 50f7736b
ffff8101fae8b300 592411861 S Bi:4:055:5 -115 4096 <
ffff8101fae8b540 592412425 C Bo:4:055:6 0 48 >
ffff8101fae8b300 592606455 C Bi:4:055:5 0 1521 = 7eff0300 21450005 dc139400 00c606bb e6451175 cf19e14a e0005004 1bb3418b
ffff8101fae8b300 592610716 S Bi:4:055:5 -115 4096 <
ffff8101fae8b300 592613453 C Bi:4:055:5 0 1521 = 7eff0300 21450005 dc2ab000 00c606a4 ca451175 cf19e14a e0005004 1bb34191
ffff8101fae8b300 592618442 S Bo:4:055:6 -115 48 = 7eff0300 21450000 28020540 008006d9 2919e14a e0451175 cf041b00 50f7736b
ffff8101fae8b540 592618463 S Bi:4:055:5 -115 4096 <
ffff8101fae8b300 592619437 C Bo:4:055:6 0 48 >
ffff8101fae8b540 592620446 C Bi:4:055:5 0 1015 = 7eff0300 21450003 e42ab400 00c606a6 be451175 cf19e14a e0005004 1bb34197
ffff8101fae8b540 592630509 S Bi:4:055:5 -115 4096 <
ffff8101fae8b540 592631449 C Bi:4:055:5 0 30 = 7eff0300 21450005 dc900000 00c6063f 7a451175 cf19e14a e0005004 1cbe
ffff8101fae8b540 592633469 S Bi:4:055:5 -115 4096 <
ffff8101fae8b540 592635450 C Bi:4:055:5 0 1498 = 43c5087b 26bf7a50 10e0007a f9000058 9e32caf2 fcf71543 20ad5287 12f0865f
ffff8101fae8b540 592657142 S Bi:4:055:5 -115 4096 <
ffff8101fae8b540 592659452 C Bi:4:055:5 0 1523 = 7eff0300 21450005 dc900400 00c6063f 76451175 cf19e14a e0005004 1cbe43ca
ffff8101fae8b540 592662733 S Bo:4:055:6 -115 48 = 7eff0300 21450000 28020840 008006d9 2619e14a e0451175 cf041c00 507b26bf
ffff8101fae8b300 592662755 S Bi:4:055:5 -115 4096 <
ffff8101fae8b540 592663436 C Bo:4:055:6 0 48 >
ffff8101fae8b300 592665448 C Bi:4:055:5 0 1498 = 7eff0300 21450005 dc900800 00c6063f 72451175 cf19e14a e0005004 1cbe43d0
ffff8101fae8b300 592666616 S Bi:4:055:5 -115 4096 <
ffff8101fae8b300 592667451 C Bi:4:055:5 0 24 = e99ae782 3e21baf8 47c77d5e 11f025bf 8275cf0c 78ce627e
ffff8101fae8b300 592670792 S Bi:4:055:5 -115 4096 <
ffff8101fae8b300 592718464 C Bi:4:055:5 0 1508 = 7eff0300 21450005 dca47400 00c60667 2ad155ad 6619e14a e0005004 1ec24cb5
ffff8101fae8b300 592724648 S Bi:4:055:5 -115 4096 <
ffff8101fae8b300 592778469 C Bi:4:055:5 0 1508 = 7eff0300 21450005 dca47800 00c60667 26d155ad 6619e14a e0005004 1ec24cbb
ffff8101fae8b300 592782846 S Bo:4:055:6 -115 48 = 7eff0300 21450000 28020940 00800615 4a19e14a e0d155ad 66041e00 50ad5e0b
ffff8101fae8b540 592782864 S Bi:4:055:5 -115 4096 <
ffff8101fae8b300 592783447 C Bo:4:055:6 0 48 >
ffff8101fae8b300 592828752 S Bo:4:055:6 -115 96 = 7eff0300 21450000 28020a40 008006d9 2419e14a e0451175 cf041b00 50f7736b
ffff8101fae8b300 592829453 C Bo:4:055:6 0 96 >
ffff8101fae8b540 592839461 C Bi:4:055:5 0 1508 = 7eff0300 21450005 dca47c00 00c60667 22d155ad 6619e14a e0005004 1ec24cc1
ffff8101fae8b540 592844622 S Bi:4:055:5 -115 4096 <
ffff8101fae8b540 592870468 C Bi:4:055:5 0 1525 = 7eff0300 21450005 dcae6400 00c60621 16451175 cf19e14a e0005004 1cbe43d6
ffff8101fae8b540 592874733 S Bi:4:055:5 -115 4096 <
ffff8101fae8b540 592930474 C Bi:4:055:5 0 1525 = 7eff0300 21450005 dcae6800 00c60621 12451175 cf19e14a e0005004 1cbe43db
ffff8101fae8b540 592932964 S Bo:4:055:6 -115 48 = 7eff0300 21450000 28020c40 008006d9 2219e14a e0451175 cf041c00 507b26bf
ffff8101fae8b540 592933451 C Bo:4:055:6 0 48 >
ffff8101fae8b540 592933908 S Bi:4:055:5 -115 4096 <
ffff8101fae8b540 592990476 C Bi:4:055:5 0 1522 = 7eff0300 21450005 dcb17400 00c6061e 06451175 cf19e14a e0005004 1cbe43e1
ffff8101fae8b540 592994713 S Bi:4:055:5 -115 4096 <
ffff8101fae8b300 593044689 S Bo:4:055:6 -115 48 = 7eff0300 21450000 28020d40 00800615 4619e14a e0d155ad 66041e00 50ad5e0b
ffff8101fae8b300 593045463 C Bo:4:055:6 0 48 >
ffff8101fae8b540 593051472 C Bi:4:055:5 0 1525 = 7eff0300 21450005 dcb17800 00c6061e 02451175 cf19e14a e0005004 1cbe43e7
ffff8101fae8b540 593054093 S Bo:4:055:6 -115 48 = 7eff0300 21450000 28020e40 008006d9 2019e14a e0451175 cf041c00 507b26bf
ffff8101fae8b540 593054460 C Bo:4:055:6 0 48 >
ffff8101fae8b540 593055097 S Bi:4:055:5 -115 4096 <
ffff8101fae8b540 593110482 C Bi:4:055:5 0 1518 = 7eff0300 21450005 dcb17c00 00c6061d fe451175 cf19e14a e0005004 1cbe43ec
ffff8101fae8b540 593114743 S Bi:4:055:5 -115 4096 <
ffff8101fae8b300 593252412 S Bo:4:055:6 -115 48 = 7eff0300 21450000 28020f40 008006d9 1f19e14a e0451175 cf041c00 507b26bf
ffff8101fae8b300 593253477 C Bo:4:055:6 0 48 >
ffff8101fae8b540 593343496 C Bi:4:055:5 0 1523 = 7eff0300 21450005 dcb18c00 00c6061d ee451175 cf19e14a e0005004 1cbe43f2
ffff8101fae8b540 593345957 S Bi:4:055:5 -115 4096 <
ffff8101fae8b540 593348491 C Bi:4:055:5 0 1519 = 7eff0300 21450005 dcb19000 00c6061d ea451175 cf19e14a e0005004 1cbe43f8
ffff8101fae8b540 593350844 S Bo:4:055:6 -115 48 = 7eff0300 21450000 28021040 008006d9 1e19e14a e0451175 cf041c00 507b26bf
ffff8101fae8b300 593350865 S Bi:4:055:5 -115 4096 <
ffff8101fae8b540 593351474 C Bo:4:055:6 0 48 >
ffff8101fae8b300 593352487 C Bi:4:055:5 0 1050 = 7eff0300 21450005 dcb19400 00c6061d e6451175 cf19e14a e0005004 1cbe43fe
ffff8101fae8b300 593354785 S Bi:4:055:5 -115 4096 <
ffff8101fae8b300 593355490 C Bi:4:055:5 0 466 = 743f154c fa669df1 0afbc27f 0feffe09 f82fc21f 052cb448 3e1f7c43 f1a78af4
ffff8101fae8b300 593357859 S Bi:4:055:5 -115 4096 <
ffff8101fae8b300 593360490 C Bi:4:055:5 0 1523 = 7eff0300 21450005 dcb57800 00c6061a 02451175 cf19e14a e0005004 1cbe4403
ffff8101fae8b300 593365753 S Bo:4:055:6 -115 48 = 7eff0300 21450000 28021140 008006d9 1d19e14a e0451175 cf041c00 507b26bf
ffff8101fae8b540 593365778 S Bi:4:055:5 -115 4096 <
ffff8101fae8b300 593366479 C Bo:4:055:6 0 48 >
ffff8101fae8b540 593410496 C Bi:4:055:5 0 1519 = 7eff0300 21450005 dcb57c00 00c60619 fe451175 cf19e14a e0005004 1cbe4409
ffff8101fae8b540 593414738 S Bi:4:055:5 -115 4096 <
ffff8101fae8b540 593470504 C Bi:4:055:5 0 1524 = 7eff0300 21450005 dcf18400 00c606dd f5451175 cf19e14a e0005004 1cbe440f
ffff8101fae8b540 593474807 S Bo:4:055:6 -115 48 = 7eff0300 21450000 28021240 008006d9 1c19e14a e0451175 cf041c00 507b26bf
ffff8101fae8b300 593474831 S Bi:4:055:5 -115 4096 <
ffff8101fae8b540 593475481 C Bo:4:055:6 0 48 >
ffff8101fae8b300 593530506 C Bi:4:055:5 0 1526 = 7eff0300 21450005 dcf18800 00c606dd f1451175 cf19e14a e0005004 1cbe4414
ffff8101fae8b300 593534843 S Bi:4:055:5 -115 4096 <
ffff8101fae8b300 593590509 C Bi:4:055:5 0 1525 = 7eff0300 21450005 dcf18c00 00c606dd ed451175 cf19e14a e0005004 1cbe441a
ffff8101fae8b300 593594717 S Bo:4:055:6 -115 48 = 7eff0300 21450000 28021340 008006d9 1b19e14a e0451175 cf041c00 507b26bf
ffff8101fae8b540 593594740 S Bi:4:055:5 -115 4096 <
ffff8101fae8b300 593595488 C Bo:4:055:6 0 48 >
ffff8101fae8b540 593617512 C Bi:4:055:5 0 300 = 7eff0300 21450001 24f1ac00 00c6061e aad155ad 6619e14a e0005004 1ec24cc6
ffff8101fae8b540 593626653 S Bi:4:055:5 -115 4096 <
ffff8101fae8b540 593650509 C Bi:4:055:5 0 1522 = 7eff0300 21450005 dcfe1000 00c606d1 69451175 cf19e14a e0005004 1cbe4420
ffff8101fae8b540 593661164 S Bi:4:055:5 -115 4096 <
ffff8101fae8b540 593710516 C Bi:4:055:5 0 1517 = 7eff0300 21450005 dcfe1400 00c606d1 65451175 cf19e14a e0005004 1cbe4425
ffff8101fae8b540 593713522 S Bo:4:055:6 -115 48 = 7eff0300 21450000 28021640 008006d9 1819e14a e0451175 cf041c00 507b26bf
ffff8101fae8b300 593713546 S Bi:4:055:5 -115 4096 <
ffff8101fae8b540 593714495 C Bo:4:055:6 0 48 >
ffff8101fae8b540 593854878 S Bo:4:055:6 -115 48 = 7eff0300 21450000 28021740 00800615 3c19e14a e0d155ad 66041e00 50ad5e0b
ffff8101fae8b540 593855507 C Bo:4:055:6 0 48 >
ffff8101fae8b300 594045535 C Bi:4:055:5 0 1518 = 7eff0300 21450005 dcfe2400 00c606d1 55451175 cf19e14a e0005004 1cbe442b
ffff8101fae8b300 594053314 S Bi:4:055:5 -115 4096 <
ffff8101fae8b300 594055530 C Bi:4:055:5 0 1522 = 7eff0300 21450005 dcfe2800 00c606d1 51451175 cf19e14a e0005004 1cbe4431
ffff8101fae8b300 594059337 S Bo:4:055:6 -115 48 = 7eff0300 21450000 28021840 008006d9 1619e14a e0451175 cf041c00 507b26bf
ffff8101fae8b540 594059359 S Bi:4:055:5 -115 4096 <
ffff8101fae8b300 594059516 C Bo:4:055:6 0 48 >
ffff8101fae8b540 594061525 C Bi:4:055:5 0 1050 = 7eff0300 21450005 dcfe2c00 00c606d1 4d451175 cf19e14a e0005004 1cbe4437
ffff8101fae8b540 594063274 S Bi:4:055:5 -115 4096 <
ffff8101fae8b540 594064533 C Bi:4:055:5 0 474 = a379a0f8 64c3e2ed 5be2cebd e1fd7f53 f135ff00 8e34cd63 e10f8663 f0c785b5
ffff8101fae8b540 594070730 S Bi:4:055:5 -115 4096 <
ffff8101fae8b540 594072532 C Bi:4:055:5 0 1521 = 7eff0300 21450005 dc009400 00c606ce e6451175 cf19e14a e0005004 1cbe443c
ffff8101fae8b540 594078809 S Bo:4:055:6 -115 48 = 7eff0300 21450000 28021940 008006d9 1519e14a e0451175 cf041c00 507b26bf
ffff8101fae8b300 594078830 S Bi:4:055:5 -115 4096 <
ffff8101fae8b540 594079515 C Bo:4:055:6 0 48 >
ffff8101fae8b300 594192543 C Bi:4:055:5 0 1519 = 7eff0300 21450005 dc009800 00c606ce e2451175 cf19e14a e0005004 1cbe4442
ffff8101fae8b300 594194838 S Bi:4:055:5 -115 4096 <
ffff8101fae8b300 594280548 C Bi:4:055:5 0 1522 = 7eff0300 21450005 dc009c00 00c606ce de451175 cf19e14a e0005004 1cbe4448
ffff8101fae8b300 594282871 S Bo:4:055:6 -115 48 = 7eff0300 21450000 28021a40 008006d9 1419e14a e0451175 cf041c00 507b26bf
ffff8101fae8b540 594282894 S Bi:4:055:5 -115 4096 <
ffff8101fae8b300 594283526 C Bo:4:055:6 0 48 >
ffff8101fae8b540 594285535 C Bi:4:055:5 0 1520 = 7eff0300 21450005 dc01b400 00c606cd c6451175 cf19e14a e0005004 1cbe444d
ffff8101fae8b540 594287769 S Bi:4:055:5 -115 4096 <
ffff8101fae8b540 594418554 C Bi:4:055:5 0 1521 = 7eff0300 21450005 dc01b800 00c606cd c2451175 cf19e14a e0005004 1cbe4453
ffff8101fae8b540 594421733 S Bo:4:055:6 -115 48 = 7eff0300 21450000 28021b40 008006d9 1319e14a e0451175 cf041c00 507b26bf
ffff8101fae8b300 594421758 S Bi:4:055:5 -115 4096 <
ffff8101fae8b540 594422537 C Bo:4:055:6 0 48 >
ffff8101fae8b300 594424543 C Bi:4:055:5 0 1522 = 7eff0300 21450005 dc09d000 00c606c5 aa451175 cf19e14a e0005004 1cbe4459
ffff8101fae8b300 594427747 S Bi:4:055:5 -115 4096 <
ffff8101fae8b300 594488560 C Bi:4:055:5 0 1520 = 7eff0300 21450005 dc09d400 00c606c5 a6451175 cf19e14a e0005004 1cbe445f
ffff8101fae8b300 594490785 S Bo:4:055:6 -115 48 = 7eff0300 21450000 28021c40 008006d9 1219e14a e0451175 cf041c00 507b26bf
ffff8101fae8b300 594491537 C Bo:4:055:6 0 48 >
ffff8101fae8b300 594491777 S Bi:4:055:5 -115 4096 <
ffff8101fae8b300 594574564 C Bi:4:055:5 0 1523 = 7eff0300 21450005 dc09d800 00c606c5 a2451175 cf19e14a e0005004 1cbe4464
ffff8101fae8b300 594578714 S Bi:4:055:5 -115 4096 <
ffff8101fae8b300 594657568 C Bi:4:055:5 0 1521 = 7eff0300 21450005 dc0b8000 00c606c3 fa451175 cf19e14a e0005004 1cbe446a
ffff8101fae8b300 594658785 S Bo:4:055:6 -115 241 = 7eff0300 21450000 28021d40 0080066f cf0a0002 0fd155ab 7f041800 500b0dfb
ffff8101fae8b300 594659548 C Bo:4:055:6 0 241 >
ffff8101fae8b300 594659932 S Bi:4:055:5 -115 4096 <
ffff8101fae8b540 594661783 S Bo:4:055:6 -115 48 = 7eff0300 21450000 28022240 008006d9 0c19e14a e0451175 cf041c00 507b26bf
ffff8101fae8b540 594662547 C Bo:4:055:6 0 48 >
ffff8101fae8b300 594719573 C Bi:4:055:5 0 1533 = 7eff0300 21450005 dc0b8400 00c606c3 f6451175 cf19e14a e0005004 1cbe4470
ffff8101fae8b300 594726224 S Bi:4:055:5 -115 4096 <
ffff8101fae8b300 594728571 C Bi:4:055:5 0 1520 = 7eff0300 21450005 dc0b8800 00c606c3 f2451175 cf19e14a e0005004 1cbe4475
ffff8101fae8b300 594732070 S Bo:4:055:6 -115 48 = 7eff0300 21450000 28022340 008006d9 0b19e14a e0451175 cf041c00 507b26bf
ffff8101fae8b540 594732096 S Bi:4:055:5 -115 4096 <
ffff8101fae8b300 594732553 C Bo:4:055:6 0 48 >
ffff8101fae8b540 594792577 C Bi:4:055:5 0 1523 = 7eff0300 21450005 dc1e7000 00c606b1 0a451175 cf19e14a e0005004 1cbe447b
ffff8101fae8b540 594795006 S Bi:4:055:5 -115 4096 <
ffff8101fae8b300 594808746 S Bo:4:055:6 -115 97 = 7eff0300 21450000 28022440 0080066d e40a0002 0fd155ad 63041a00 506bc998
ffff8101fae8b300 594809559 C Bo:4:055:6 0 97 >
ffff8101fae8b540 594886583 C Bi:4:055:5 0 1518 = 7eff0300 21450005 dc1e7400 00c606b1 06451175 cf19e14a e0005004 1cbe4481
ffff8101fae8b540 594890859 S Bo:4:055:6 -115 48 = 7eff0300 21450000 28022640 008006d9 0819e14a e0451175 cf041c00 507b26bf
ffff8101fae8b540 594891560 C Bo:4:055:6 0 48 >
ffff8101fae8b540 594891848 S Bi:4:055:5 -115 4096 <
ffff8101fae8b540 594894569 C Bi:4:055:5 0 1521 = 7eff0300 21450005 dc1e7800 00c606b1 02451175 cf19e14a e0005004 1cbe4486
ffff8101fae8b540 594898819 S Bi:4:055:5 -115 4096 <
ffff8101fae8b540 594900579 C Bi:4:055:5 0 1050 = 7eff0300 21450005 dc2edc00 00c606a0 9e451175 cf19e14a e0005004 1cbe448c
ffff8101fae8b540 594905695 S Bi:4:055:5 -115 4096 <
ffff8101fae8b540 594906576 C Bi:4:055:5 0 476 = 9df1520f 06e83a17 86bc61f1 7353f186 9577a0ea 1a078a1d 7d5e1878 fbe237c7
ffff8101fae8b540 594910761 S Bo:4:055:6 -115 48 = 7eff0300 21450000 28022740 008006d9 0719e14a e0451175 cf041c00 507b26bf
ffff8101fae8b300 594910781 S Bi:4:055:5 -115 4096 <
ffff8101fae8b540 594911561 C Bo:4:055:6 0 48 >
ffff8101fae8b300 594912574 C Bi:4:055:5 0 1522 = 7eff0300 21450005 dc2ee000 00c606a0 9a451175 cf19e14a e0005004 1cbe4492
ffff8101fae8b300 594920673 S Bi:4:055:5 -115 4096 <
ffff8101fae8b300 594922583 C Bi:4:055:5 0 1521 = 7eff0300 21450005 dc2ee400 00c606a0 96451175 cf19e14a e0005004 1cbe4498
ffff8101fae8b540 594927048 S Bo:4:055:6 -115 48 = 7eff0300 21450000 28022840 008006d9 0619e14a e0451175 cf041c00 507b26bf
ffff810137f5fd80 594927071 S Bi:4:055:5 -115 4096 <
ffff8101fae8b540 594927563 C Bo:4:055:6 0 48 >
ffff810137f5fd80 595197595 C Bi:4:055:5 0 1520 = 7eff0300 21450005 dc396800 00c60696 12451175 cf19e14a e0005004 1cbe449d
ffff810137f5fd80 595203806 S Bi:4:055:5 -115 4096 <
ffff810137f5fd80 595305605 C Bi:4:055:5 0 1530 = 7eff0300 21450005 dc396c00 00c60696 0e451175 cf19e14a e0005004 1cbe44a3
ffff810137f5fd80 595307742 S Bo:4:055:6 -115 48 = 7eff0300 21450000 28022940 008006d9 0519e14a e0451175 cf041c00 507b26bf
ffff810137f5f840 595307765 S Bi:4:055:5 -115 4096 <
ffff810137f5fd80 595308583 C Bo:4:055:6 0 48 >
ffff810137f5f840 595309596 C Bi:4:055:5 0 1525 = 7eff0300 21450005 dc397000 00c60696 0a451175 cf19e14a e0005004 1cbe44a9
ffff810137f5f840 595311851 S Bi:4:055:5 -115 4096 <
ffff810137f5f840 595313599 C Bi:4:055:5 0 1034 = 7eff0300 21450005 dc3ba800 00c60693 d2451175 cf19e14a e0005004 1cbe44ae
ffff810137f5f840 595317830 S Bi:4:055:5 -115 4096 <
ffff810137f5f840 595318605 C Bi:4:055:5 0 496 = a941e248 74bf86fe 3af046bb 75a8e99f 103e39de 683e25f1 678d3c7d 5d7517c2
ffff810137f5f840 595320863 S Bo:4:055:6 -115 48 = 7eff0300 21450000 28022a40 008006d9 0419e14a e0451175 cf041c00 507b26bf
ffff810137f5fd80 595320885 S Bi:4:055:5 -115 4096 <
ffff810137f5f840 595321585 C Bo:4:055:6 0 48 >
ffff810137f5fd80 595434613 C Bi:4:055:5 0 1531 = 7eff0300 21450005 dc3bac00 00c60693 ce451175 cf19e14a e0005004 1cbe44b4
ffff810137f5fd80 595442625 S Bi:4:055:5 -115 4096 <
ffff810137f5fd80 595515617 C Bi:4:055:5 0 1526 = 7eff0300 21450005 dc3bb000 00c60693 ca451175 cf19e14a e0005004 1cbe44ba
ffff810137f5fd80 595517793 S Bo:4:055:6 -115 48 = 7eff0300 21450000 28022b40 008006d9 0319e14a e0451175 cf041c00 507b26bf
ffff810137f5f840 595517818 S Bi:4:055:5 -115 4096 <
ffff810137f5fd80 595518596 C Bo:4:055:6 0 48 >
ffff810137f5f840 595520604 C Bi:4:055:5 0 1523 = 7eff0300 21450005 dc3ed400 00c60690 a6451175 cf19e14a e0005004 1cbe44bf
ffff810137f5f840 595528193 S Bi:4:055:5 -115 4096 <
ffff810137f5f840 595530612 C Bi:4:055:5 0 1519 = 7eff0300 21450005 dc3ed800 00c60690 a2451175 cf19e14a e0005004 1cbe44c5
ffff810137f5f840 595534815 S Bo:4:055:6 -115 48 = 7eff0300 21450000 28022c40 008006d9 0219e14a e0451175 cf041c00 507b26bf
ffff810137f5fd80 595534836 S Bi:4:055:5 -115 4096 <
ffff810137f5f840 595535596 C Bo:4:055:6 0 48 >
ffff810137f5fd80 595536608 C Bi:4:055:5 0 1042 = 7eff0300 21450005 dc3edc00 00c60690 9e451175 cf19e14a e0005004 1cbe44cb
ffff810137f5fd80 595538794 S Bi:4:055:5 -115 4096 <
ffff810137f5fd80 595539611 C Bi:4:055:5 0 6 = 1a7bdf87 1a4f
ffff810137f5fd80 595541927 S Bi:4:055:5 -115 4096 <
ffff810137f5fd80 595542614 C Bi:4:055:5 0 478 = 887d5e23 7863c3bf 18eebc37 e0af0347 a87c46f1 849a07c2 ad57c2bf 06bc0df1
ffff810137f5fd80 595545744 S Bi:4:055:5 -115 4096 <
ffff810137f5f840 595731387 S Bo:4:055:6 -115 48 = 7eff0300 21450000 28022d40 008006d9 0119e14a e0451175 cf041c00 507b26bf
ffff810137f5f840 595731612 C Bo:4:055:6 0 48 >
ffff810137f5fd80 595819629 C Bi:4:055:5 0 1522 = 7eff0300 21450005 dc496000 00c60686 1a451175 cf19e14a e0005004 1cbe44d1
ffff810137f5fd80 595822744 S Bi:4:055:5 -115 4096 <
ffff810137f5fd80 595824629 C Bi:4:055:5 0 1522 = 7eff0300 21450005 dc496400 00c60686 16451175 cf19e14a e0005004 1cbe44d6
ffff810137f5fd80 595830800 S Bo:4:055:6 -115 48 = 7eff0300 21450000 28022e40 008006d9 0019e14a e0451175 cf041c00 507b26bf
ffff810137f5f840 595830822 S Bi:4:055:5 -115 4096 <
ffff810137f5fd80 595831613 C Bo:4:055:6 0 48 >
ffff810137f5f840 595832625 C Bi:4:055:5 0 1046 = 7eff0300 21450005 dc496800 00c60686 12451175 cf19e14a e0005004 1cbe44dc
ffff810137f5f840 595842844 S Bi:4:055:5 -115 4096 <
ffff810137f5f840 595843629 C Bi:4:055:5 0 473 = 5ed7747f 065feade 23f827e1 1fda12e7 421f0fbf 677f82da 65dfc45f 841f117c
ffff810137f5f840 595846760 S Bi:4:055:5 -115 4096 <
ffff810137f5f840 595848631 C Bi:4:055:5 0 1525 = 7eff0300 21450005 dc50ec00 00c6067d 5e8e4511 75cf19e1 4ae00050 041cbe44
ffff8101df180480 595851815 S Bo:4:055:6 -115 48 = 7eff0300 21450000 28022f40 008006d8 ff19e14a e0451175 cf041c00 507b26bf
ffff8101df180780 595851878 S Bi:4:055:5 -115 4096 <
ffff8101df180480 595852616 C Bo:4:055:6 0 48 >
ffff8101df180780 595854622 C Bi:4:055:5 0 1533 = 7eff0300 21450005 dc50f000 00c6067d 5e8a4511 75cf19e1 4ae00050 041cbe44
ffff8101df180780 595858253 S Bi:4:055:5 -115 4096 <
ffff8101df180540 596066237 S Bo:4:055:6 -115 48 = 7eff0300 21450000 28023040 008006d8 fe19e14a e0451175 cf041c00 507b26bf
ffff8101df180540 596066630 C Bo:4:055:6 0 48 >
ffff8101df180780 596179649 C Bi:4:055:5 0 1527 = 7eff0300 21450005 dc50f400 00c6067d 5e864511 75cf19e1 4ae00050 041cbe44
ffff8101df180780 596182315 S Bi:4:055:5 -115 4096 <
ffff8101df180780 596184661 C Bi:4:055:5 0 1522 = 7eff0300 21450005 dc541000 00c6067b 6a451175 cf19e14a e0005004 1cbe44f3
ffff8101df180780 596188351 S Bo:4:055:6 -115 48 = 7eff0300 21450000 28023140 008006d8 fd19e14a e0451175 cf041c00 507b26bf
ffff8101df180540 596188412 S Bi:4:055:5 -115 4096 <
ffff8101df180780 596188634 C Bo:4:055:6 0 48 >
ffff8101df180540 596189723 C Bi:4:055:5 0 1042 = 7eff0300 21450005 dc541400 00c6067b 66451175 cf19e14a e0005004 1cbe44f9
ffff8101df180540 596191473 S Bi:4:055:5 -115 4096 <
ffff8101df180540 596192661 C Bi:4:055:5 0 480 = bc19f16b c75a67c4 3f865e13 8be2b78c 2dbe1fdf 697d5e06 97e2e6a6 3e0b781b
ffff8101df180540 596199058 S Bi:4:055:5 -115 4096 <
ffff8101df180540 596201652 C Bi:4:055:5 0 1521 = 7eff0300 21450005 dc541800 00c6067b 62451175 cf19e14a e0005004 1cbe44fe
ffff8101df180540 596206226 S Bo:4:055:6 -115 48 = 7eff0300 21450000 28023240 008006d8 fc19e14a e0451175 cf041c00 507b26bf
ffff8101df180780 596206295 S Bi:4:055:5 -115 4096 <
ffff8101df180540 596206644 C Bo:4:055:6 0 48 >
ffff8101df180780 596206663 C Bi:4:055:5 0 48 = 7eff0300 21450000 28591800 00c6067c 16451175 cf19e14a e0005004 1bb3419b
ffff8101df180780 596208333 S Bo:4:055:6 -115 48 = 7eff0300 21450000 28023340 008006d8 fb19e14a e0451175 cf041b00 50f7736b
ffff8101df180540 596208388 S Bi:4:055:5 -115 4096 <
ffff8101df180780 596208637 C Bo:4:055:6 0 48 >
ffff8101df180540 596381663 C Bi:4:055:5 0 1521 = 7eff0300 21450005 dc5cf800 00c60672 82451175 cf19e14a e0005004 1cbe4504
ffff810137f5fd80 596393780 S Bi:4:055:5 -115 4096 <
ffff810137f5fd80 596396660 C Bi:4:055:5 0 1521 = 7eff0300 21450005 dc5cfc00 00c60672 7d5e4511 75cf19e1 4ae00050 041cbe45
ffff810137f5fd80 596398684 S Bo:4:055:6 -115 48 = 7eff0300 21450000 28023440 008006d8 fa19e14a e0451175 cf041c00 507b26bf
ffff810137f5fb40 596398704 S Bi:4:055:5 -115 4096 <
ffff810137f5fd80 596399644 C Bo:4:055:6 0 48 >
ffff810137f5fb40 596528673 C Bi:4:055:5 0 1530 = 7eff0300 21450005 dc5d0000 00c60672 7a451175 cf19e14a e0005004 1cbe450f
ffff810137f5fb40 596538003 S Bi:4:055:5 -115 4096 <
ffff810137f5fb40 596639677 C Bi:4:055:5 0 1524 = 7eff0300 21450005 dc5d0800 00c60672 72451175 cf19e14a e0005004 1cbe4515
ffff810137f5fb40 596648275 S Bo:4:055:6 -115 48 = 7eff0300 21450000 28023540 008006d8 f919e14a e0451175 cf041c00 507b26bf
ffff810137f5ff00 596648296 S Bi:4:055:5 -115 4096 <
ffff810137f5fb40 596648658 C Bo:4:055:6 0 48 >
ffff810137f5ff00 596650668 C Bi:4:055:5 0 1530 = 7eff0300 21450005 dc5d0c00 00c60672 6e451175 cf19e14a e0005004 1cbe451b
ffff810137f5ff00 596654343 S Bi:4:055:5 -115 4096 <
ffff810137f5ff00 596655674 C Bi:4:055:5 0 1038 = 7eff0300 21450005 dc5d1000 00c60672 6a451175 cf19e14a e0005004 1cbe4520
ffff810137f5ff00 596657537 S Bi:4:055:5 -115 4096 <
ffff810137f5ff00 596658672 C Bi:4:055:5 0 485 = 1f36c761 b054738c 2470f89e 1ce35c3e 47936679 a6758bce 787b0d98 f1af10e3
ffff810137f5ff00 596661298 S Bo:4:055:6 -115 48 = 7eff0300 21450000 28023640 008006d8 f819e14a e0451175 cf041c00 507b26bf
ffff810137f5fb40 596661321 S Bi:4:055:5 -115 4096 <
ffff810137f5ff00 596661661 C Bo:4:055:6 0 48 >
ffff810137f5fb40 596663669 C Bi:4:055:5 0 1527 = 7eff0300 21450005 dc64e800 00c6066a 92451175 cf19e14a e0005004 1cbe4526
ffff810137f5fb40 596668361 S Bi:4:055:5 -115 4096 <
ffff810137f5fb40 596697678 C Bi:4:055:5 0 1518 = 7eff0300 21450005 dc64ec00 00c6066a 8e451175 cf19e14a e0005004 1cbe452c
ffff810137f5fb40 596700848 S Bo:4:055:6 -115 48 = 7eff0300 21450000 28023740 008006d8 f719e14a e0451175 cf041c00 507b26bf
ffff810137f5fb40 596701661 C Bo:4:055:6 0 48 >
ffff810137f5fb40 596707334 S Bi:4:055:5 -115 4096 <
ffff810137f5fb40 596752685 C Bi:4:055:5 0 1517 = 7eff0300 21450005 dc64f000 00c6066a 8a451175 cf19e14a e0005004 1cbe4532
ffff810137f5fb40 596758786 S Bi:4:055:5 -115 4096 <
ffff810137f5fb40 596812683 C Bi:4:055:5 0 1526 = 7eff0300 21450005 dc77b400 00c60657 c6451175 cf19e14a e0005004 1cbe4537
ffff810137f5fb40 596819765 S Bo:4:055:6 -115 48 = 7eff0300 21450000 28023840 008006d8 f619e14a e0451175 cf041c00 507b26bf
ffff810137f5fb40 596820668 C Bo:4:055:6 0 48 >
ffff810137f5fb40 596820777 S Bi:4:055:5 -115 4096 <
ffff810137f5fb40 597192703 C Bi:4:055:5 0 1516 = 7eff0300 21450005 dc77b800 00c60657 c2451175 cf19e14a e0005004 1cbe453d
ffff810137f5fb40 597195704 S Bi:4:055:5 -115 4096 <
ffff810137f5fb40 597197704 C Bi:4:055:5 0 1520 = 7eff0300 21450005 dc77bc00 00c60657 be451175 cf19e14a e0005004 1cbe4543
ffff810137f5fb40 597200640 S Bo:4:055:6 -115 48 = 7eff0300 21450000 28023940 008006d8 f519e14a e0451175 cf041c00 507b26bf
ffff810137f5ff00 597200660 S Bi:4:055:5 -115 4096 <
ffff810137f5fb40 597201688 C Bo:4:055:6 0 48 >
ffff810137f5ff00 597343713 C Bi:4:055:5 0 1524 = 7eff0300 21450005 dc7af000 00c60654 8a451175 cf19e14a e0005004 1cbe4548
ffff810137f5ff00 597346495 S Bi:4:055:5 -115 4096 <
ffff810137f5ff00 597348712 C Bi:4:055:5 0 1520 = 7eff0300 21450005 dc7af400 00c60654 86451175 cf19e14a e0005004 1cbe454e
ffff810137f5ff00 597351512 S Bo:4:055:6 -115 48 = 7eff0300 21450000 28023a40 008006d8 f419e14a e0451175 cf041c00 507b26bf
ffff810137f5fb40 597351535 S Bi:4:055:5 -115 4096 <
ffff810137f5ff00 597351697 C Bo:4:055:6 0 48 >
ffff810137f5fb40 597433722 C Bi:4:055:5 0 1528 = 7eff0300 21450005 dc7af800 00c60654 82451175 cf19e14a e0005004 1cbe4554
ffff810137f5fb40 597438730 S Bi:4:055:5 -115 4096 <
ffff810137f5fb40 597440718 C Bi:4:055:5 0 1524 = 7eff0300 21450005 dc7d5d00 0000c606 527a4511 75cf19e1 4ae00050 041cbe45
ffff810137f5fb40 597444043 S Bo:4:055:6 -115 48 = 7eff0300 21450000 28023b40 008006d8 f319e14a e0451175 cf041c00 507b26bf
ffff810137f5ff00 597444063 S Bi:4:055:5 -115 4096 <
ffff810137f5fb40 597444702 C Bo:4:055:6 0 48 >
ffff810137f5ff00 597657739 C Bi:4:055:5 0 1525 = 7eff0300 21450005 dc7d5d04 0000c606 52764511 75cf19e1 4ae00050 041cbe45
ffff810137f5ff00 597669648 S Bi:4:055:5 -115 4096 <
ffff810137f5ff00 597671735 C Bi:4:055:5 0 1529 = 7eff0300 21450005 dc7d5d08 0000c606 52724511 75cf19e1 4ae00050 041cbe45
ffff810137f5ff00 597674843 S Bo:4:055:6 -115 48 = 7eff0300 21450000 28023c40 008006d8 f219e14a e0451175 cf041c00 507b26bf
ffff810137f5fb40 597674867 S Bi:4:055:5 -115 4096 <
ffff810137f5ff00 597675716 C Bo:4:055:6 0 48 >
ffff810137f5fb40 597676728 C Bi:4:055:5 0 1522 = 7eff0300 21450005 dc7f7c00 00c6064f fe451175 cf19e14a e0005004 1cbe456b
ffff810137f5fb40 597678975 S Bi:4:055:5 -115 4096 <
ffff810137f5ff00 597813691 S Bo:4:055:6 -115 48 = 7eff0300 21450000 28023d40 008006d8 f119e14a e0451175 cf041c00 507b26bf
ffff810137f5ff00 597814729 C Bo:4:055:6 0 48 >
ffff810137f5fb40 597843741 C Bi:4:055:5 0 1519 = 7eff0300 21450005 dc7f8000 00c6064f fa451175 cf19e14a e0005004 1cbe4570
ffff810137f5fb40 597846861 S Bi:4:055:5 -115 4096 <
ffff810137f5fb40 597848740 C Bi:4:055:5 0 1523 = 7eff0300 21450005 dc7f8400 00c6064f f6451175 cf19e14a e0005004 1cbe4576
ffff810137f5fb40 597850884 S Bo:4:055:6 -115 48 = 7eff0300 21450000 28023e40 008006d8 f019e14a e0451175 cf041c00 507b26bf
ffff810137f5ff00 597850906 S Bi:4:055:5 -115 4096 <
ffff810137f5fb40 597851724 C Bo:4:055:6 0 48 >
ffff810137f5ff00 597852738 C Bi:4:055:5 0 1050 = 7eff0300 21450005 dc89a000 00c60645 da451175 cf19e14a e0005004 1cbe457c
ffff810137f5ff00 597854796 S Bi:4:055:5 -115 4096 <
ffff810137f5ff00 597855741 C Bi:4:055:5 0 469 = 934ed047 8a6e6ce1 f0ee8da4 785bc01e 2ad0ecbc 7d5da36b be38d374 bb2b4f13
ffff810137f5ff00 597857924 S Bi:4:055:5 -115 4096 <
ffff810137f5ff00 598010754 C Bi:4:055:5 0 1519 = 7eff0300 21450005 dc89a400 00c60645 d6451175 cf19e14a e0005004 1cbe4581
ffff810137f5ff00 598014726 S Bo:4:055:6 -115 48 = 7eff0300 21450000 28023f40 008006d8 ef19e14a e0451175 cf041c00 507b26bf
ffff810137f5fb40 598014750 S Bi:4:055:5 -115 4096 <
ffff810137f5ff00 598015734 C Bo:4:055:6 0 48 >
ffff810137f5fb40 598016747 C Bi:4:055:5 0 1523 = 7eff0300 21450005 dc89a800 00c60645 d2451175 cf19e14a e0005004 1cbe4587
ffff810137f5fb40 598019648 S Bi:4:055:5 -115 4096 <
ffff810137f5fb40 598021751 C Bi:4:055:5 0 1050 = 7eff0300 21450005 dc8c3400 00c60643 46451175 cf19e14a e0005004 1cbe458d
ffff810137f5fb40 598027687 S Bi:4:055:5 -115 4096 <
ffff810137f5fb40 598028750 C Bi:4:055:5 0 473 = f3be16c6 f0e6618c 8e3f09fd ab95e3f2 4a98ee15 a786c833 eaf0c9f1 73f1272b
ffff810137f5fb40 598035775 S Bo:4:055:6 -115 48 = 7eff0300 21450000 28024040 008006d8 ee19e14a e0451175 cf041c00 507b26bf
ffff810137f5fb40 598036736 C Bo:4:055:6 0 48 >
ffff810137f5ff00 598036743 S Bi:4:055:5 -115 4096 <
ffff810137f5ff00 598038746 C Bi:4:055:5 0 1535 = 7eff0300 21450005 dc8c3800 00c60643 42451175 cf19e14a e0005004 1cbe4592
ffff810137f5ff00 598041783 S Bi:4:055:5 -115 4096 <
ffff810137f5ff00 598043751 C Bi:4:055:5 0 1030 = 7eff0300 21450005 dc8c3c00 00c60643 3e451175 cf19e14a e0005004 1cbe4598
ffff810137f5ff00 598046726 S Bi:4:055:5 -115 4096 <
ffff810137f5ff00 598047751 C Bi:4:055:5 0 488 = 0cd46e34 9f87bf0f a3b4f82d 65e16f1e 68fe28f1 d7876dbc 6fe1ef0e f83adae7
ffff810137f5ff00 598050770 S Bo:4:055:6 -115 48 = 7eff0300 21450000 28024140 008006d8 ed19e14a e0451175 cf041c00 507b26bf
ffff810137f5fb40 598050791 S Bi:4:055:5 -115 4096 <
ffff810137f5ff00 598051736 C Bo:4:055:6 0 48 >
ffff810137f5fb40 598254763 C Bi:4:055:5 0 1522 = 7eff0300 21450005 dc947c00 00c6063a fe451175 cf19e14a e0005004 1cbe459e
ffff810137f5fb40 598259778 S Bi:4:055:5 -115 4096 <
ffff810137f5fb40 598338769 C Bi:4:055:5 0 1521 = 7eff0300 21450005 dc981800 00c60637 62451175 cf19e14a e0005004 1cbe45a4
ffff810137f5fb40 598346402 S Bo:4:055:6 -115 48 = 7eff0300 21450000 28024240 008006d8 ec19e14a e0451175 cf041c00 507b26bf
ffff810137f5ff00 598346425 S Bi:4:055:5 -115 4096 <
ffff810137f5fb40 598346752 C Bo:4:055:6 0 48 >
ffff810137f5ff00 598348762 C Bi:4:055:5 0 1521 = 7eff0300 21450005 dc981c00 00c60637 5e451175 cf19e14a e0005004 1cbe45a9
ffff810137f5ff00 598351611 S Bi:4:055:5 -115 4096 <
ffff810137f5ff00 598353769 C Bi:4:055:5 0 1046 = 7eff0300 21450005 dc993c00 00c60636 3e451175 cf19e14a e0005004 1cbe45af
ffff810137f5ff00 598357720 S Bi:4:055:5 -115 4096 <
ffff810137f5ff00 598358769 C Bi:4:055:5 0 473 = e2db6f04 0d4fe098 bc2df0cb e33697fb 4849a0f8 17c4fe00 f107887c 392d9dee
ffff810137f5ff00 598360869 S Bo:4:055:6 -115 48 = 7eff0300 21450000 28024340 008006d8 eb19e14a e0451175 cf041c00 507b26bf
ffff810137f5fb40 598360889 S Bi:4:055:5 -115 4096 <
ffff810137f5ff00 598361753 C Bo:4:055:6 0 48 >
ffff810137f5fb40 598362766 C Bi:4:055:5 0 1525 = 7eff0300 21450005 dc994000 00c60636 3a451175 cf19e14a e0005004 1cbe45b5
ffff810206a6e480 598366725 S Bi:4:055:5 -115 4096 <
ffff810206a6e180 598505182 S Bo:4:055:6 -115 48 = 7eff0300 21450000 28024440 008006d8 ea19e14a e0451175 cf041c00 507b26bf
ffff810206a6e180 598505764 C Bo:4:055:6 0 48 >
ffff810206a6e480 598524786 C Bi:4:055:5 0 1527 = 7eff0300 21450005 dca27800 00c6062d 02451175 cf19e14a e0005004 1cbe45ba
ffff810206a6e480 598530221 S Bi:4:055:5 -115 4096 <
ffff810206a6e480 598532782 C Bi:4:055:5 0 1519 = 7eff0300 21450005 dcaad400 00c60624 a6451175 cf19e14a e0005004 1cbe45c0
ffff810206a6e480 598538209 S Bo:4:055:6 -115 48 = 7eff0300 21450000 28024540 008006d8 e919e14a e0451175 cf041c00 507b26bf
ffff810206a6e180 598538278 S Bi:4:055:5 -115 4096 <
ffff810206a6e480 598538766 C Bo:4:055:6 0 48 >
ffff810206a6e180 598539788 C Bi:4:055:5 0 1046 = 7eff0300 21450005 dcaad800 00c60624 a2451175 cf19e14a e0005004 1cbe45c6
ffff810206a6e180 598541241 S Bi:4:055:5 -115 4096 <
ffff810206a6e180 598542775 C Bi:4:055:5 0 477 = 20d27d5e 3ac7e1ff 00037979 e62b30e0 5e13c064 782c1d7c 8b8373be 11c7d7ad
ffff810206a6e180 598546214 S Bi:4:055:5 -115 4096 <
ffff810206a6e180 598548783 C Bi:4:055:5 0 1525 = 7eff0300 21450005 dcab3400 00c60624 46451175 cf19e14a e0005004 1cbe45cc
ffff810206a6e180 598559509 S Bo:4:055:6 -115 48 = 7eff0300 21450000 28024640 008006d8 e819e14a e0451175 cf041c00 507b26bf
ffff810206a6e480 598559582 S Bi:4:055:5 -115 4096 <
ffff810206a6e180 598559815 C Bo:4:055:6 0 48 >
ffff810206a6e480 598813801 C Bi:4:055:5 0 1523 = 7eff0300 21450005 dcab3800 00c60624 42451175 cf19e14a e0005004 1cbe45d1
ffff810137f5fd80 598818803 S Bi:4:055:5 -115 4096 <
ffff810137f5fd80 598820795 C Bi:4:055:5 0 1525 = 7eff0300 21450005 dcb1a800 00c6061d d2451175 cf19e14a e0005004 1cbe45d7
ffff810137f5fd80 598826771 S Bo:4:055:6 -115 48 = 7eff0300 21450000 28024740 008006d8 e719e14a e0451175 cf041c00 507b26bf
ffff810137f5f240 598826791 S Bi:4:055:5 -115 4096 <
ffff810137f5fd80 598827779 C Bo:4:055:6 0 48 >
ffff810137f5f240 598900799 C Bi:4:055:5 0 1521 = 7eff0300 21450005 dcb1ac00 00c6061d ce451175 cf19e14a e0005004 1cbe45dd
ffff810137f5f240 598906728 S Bi:4:055:5 -115 4096 <
ffff810137f5f240 599001809 C Bi:4:055:5 0 1522 = 7eff0300 21450005 dcbed800 00c60610 a2451175 cf19e14a e0005004 1cbe45e8
ffff810137f5f240 599004641 S Bo:4:055:6 -115 59 = 7eff0300 21450000 34024840 008006d8 da19e14a e0451175 cf041c00 507b26bf
ffff810137f5fd80 599004661 S Bi:4:055:5 -115 4096 <
ffff810137f5f240 599004789 C Bo:4:055:6 0 59 >
ffff810137f5f240 599006661 S Bo:4:055:6 -115 1 = 7e
ffff810137f5fd80 599006801 C Bi:4:055:5 0 1516 = 7eff0300 21450005 dcc19000 00c6060d ea451175 cf19e14a e0005004 1cbe45ee
ffff810137f5f240 599006806 C Bo:4:055:6 0 1 >
ffff810137f5f240 599009795 S Bo:4:055:6 -115 59 = 7eff0300 21450000 34024940 008006d8 d919e14a e0451175 cf041c00 507b26bf
ffff810137f5fd80 599009817 S Bi:4:055:5 -115 4096 <
ffff810137f5f240 599010789 C Bo:4:055:6 0 59 >
ffff810137f5fd80 599011801 C Bi:4:055:5 0 1054 = 7eff0300 21450005 dcc19400 00c6060d e6451175 cf19e14a e0005004 1cbe45f3
ffff810137f5fd80 599018957 S Bo:4:055:6 -115 1 = 7e
ffff810137f5f240 599018979 S Bi:4:055:5 -115 4096 <
ffff810137f5fd80 599019791 C Bo:4:055:6 0 1 >
ffff810137f5f240 599019810 C Bi:4:055:5 0 466 = 9c9b05c3 787d5e20 e1ae20c7 7124b075 2792e19c a50ce696 2788f33c 4d6e21cc
ffff810137f5f240 599025727 S Bo:4:055:6 -115 59 = 7eff0300 21450000 34024a40 008006d8 d819e14a e0451175 cf041c00 507b26bf
ffff810137f5f240 599026790 C Bo:4:055:6 0 59 >
ffff810137f5f240 599026882 S Bi:4:055:5 -115 4096 <
ffff810137f5fd80 599027765 S Bo:4:055:6 -115 1 = 7e
ffff810137f5f240 599028802 C Bi:4:055:5 0 1523 = 7eff0300 21450005 dcc33400 00c6060c 46451175 cf19e14a e0005004 1cbe45f9
ffff810137f5fd80 599028807 C Bo:4:055:6 0 1 >
ffff810137f5fd80 599033909 S Bo:4:055:6 -115 59 = 7eff0300 21450000 34024b40 008006d8 d719e14a e0451175 cf041c00 507b26bf
ffff810137f5f240 599033931 S Bi:4:055:5 -115 4096 <
ffff810137f5fd80 599034791 C Bo:4:055:6 0 59 >
ffff810137f5fd80 599035797 S Bo:4:055:6 -115 1 = 7e
ffff810137f5fd80 599036792 C Bo:4:055:6 0 1 >
ffff810137f5f240 599259820 C Bi:4:055:5 0 1515 = 7eff0300 21450005 dcc33800 00c6060c 42451175 cf19e14a e0005004 1cbe45ff
ffff810137f5f240 599262082 S Bo:4:055:6 -115 59 = 7eff0300 21450000 34024c40 008006d8 d619e14a e0451175 cf041c00 507b26bf
ffff810137f5fd80 599262105 S Bi:4:055:5 -115 4096 <
ffff810137f5f240 599262803 C Bo:4:055:6 0 59 >
ffff810137f5f240 599263864 S Bo:4:055:6 -115 1 = 7e
ffff810137f5fd80 599264814 C Bi:4:055:5 0 1518 = 7eff0300 21450005 dcd00800 00c606ff 71451175 cf19e14a e0005004 1cbe4605
ffff810137f5f240 599264818 C Bo:4:055:6 0 1 >
ffff810137f5f240 599267823 S Bo:4:055:6 -115 59 = 7eff0300 21450000 34024d40 008006d8 d519e14a e0451175 cf041c00 507b26bf
ffff810137f5fd80 599267845 S Bi:4:055:5 -115 4096 <
ffff810137f5f240 599268806 C Bo:4:055:6 0 59 >
ffff810137f5f240 599274803 S Bo:4:055:6 -115 1 = 7e
ffff810137f5f240 599275809 C Bo:4:055:6 0 1 >
ffff810137f5fd80 599337826 C Bi:4:055:5 0 1524 = 7eff0300 21450005 dcd00c00 00c606ff 6d451175 cf19e14a e0005004 1cbe460a
ffff810137f5fd80 599339867 S Bo:4:055:6 -115 59 = 7eff0300 21450000 34024e40 008006d8 d419e14a e0451175 cf041c00 507b26bf
ffff810137f5f240 599339890 S Bi:4:055:5 -115 4096 <
ffff810137f5fd80 599340807 C Bo:4:055:6 0 59 >
ffff810137f5f240 599341820 C Bi:4:055:5 0 1527 = 7eff0300 21450005 dce30800 00c606ec 71451175 cf19e14a e0005004 1cbe4610
ffff810137f5f240 599342788 S Bo:4:055:6 -115 1 = 7e
ffff810137f5fd80 599342810 S Bi:4:055:5 -115 4096 <
ffff810137f5f240 599343810 C Bo:4:055:6 0 1 >
ffff810137f5fd80 599344819 C Bi:4:055:5 0 1521 = 7eff0300 21450005 dce30c00 00c606ec 6d451175 cf19e14a e0005004 1cbe4616
ffff810137f5fd80 599349838 S Bo:4:055:6 -115 59 = 7eff0300 21450000 34024f40 008006d8 d319e14a e0451175 cf041c00 507b26bf
ffff810137f5f240 599349857 S Bi:4:055:5 -115 4096 <
ffff810137f5fd80 599350808 C Bo:4:055:6 0 59 >
ffff810137f5fd80 599352902 S Bo:4:055:6 -115 61 = 7e7eff03 00214500 00340250 40008006 d8d219e1 4ae04511 75cf041c 00507b26
ffff810137f5fd80 599353808 C Bo:4:055:6 0 61 >
ffff810137f5f240 599526840 C Bi:4:055:5 0 1530 = 7eff0300 21450005 dce99400 00c606e5 e5451175 cf19e14a e0005004 1cbe461b
ffff810137f5f240 599529819 S Bo:4:055:6 -115 59 = 7eff0300 21450000 34025140 008006d8 d119e14a e0451175 cf041c00 507b26bf
ffff810137f5fd80 599529842 S Bi:4:055:5 -115 4096 <
ffff810137f5f240 599530818 C Bo:4:055:6 0 59 >
ffff810137f5fd80 599531830 C Bi:4:055:5 0 1518 = 7eff0300 21450005 dce99800 00c606e5 e1451175 cf19e14a e0005004 1cbe4621
ffff810137f5fd80 599533890 S Bo:4:055:6 -115 1 = 7e
ffff810137f5f240 599533913 S Bi:4:055:5 -115 4096 <
ffff810137f5fd80 599534819 C Bo:4:055:6 0 1 >
ffff810137f5f240 599535830 C Bi:4:055:5 0 1042 = 7eff0300 21450005 dced1000 00c606e2 69451175 cf19e14a e0005004 1cbe4627
ffff810137f5f240 599536776 S Bo:4:055:6 -115 59 = 7eff0300 21450000 34025240 008006d8 d019e14a e0451175 cf041c00 507b26bf
ffff810137f5f240 599537819 C Bo:4:055:6 0 59 >
ffff810137f5fd80 599537820 S Bi:4:055:5 -115 4096 <
ffff810137f5fd80 599538834 C Bi:4:055:5 0 477 = 0e66d83e 19c9f33c df118acb f8a69e0b 1d9b6510 a8b0b977 caf1761b c37a7986
ffff810137f5fd80 599539667 S Bo:4:055:6 -115 1 = 7e
ffff810137f5fd80 599539819 C Bo:4:055:6 0 1 >
ffff810137f5fd80 599541684 S Bo:4:055:6 -115 59 = 7eff0300 21450000 34025340 008006d8 cf19e14a e0451175 cf041c00 507b26bf
ffff810137f5f240 599541704 S Bi:4:055:5 -115 4096 <
ffff810137f5fd80 599541818 C Bo:4:055:6 0 59 >
ffff810137f5f240 599543829 C Bi:4:055:5 0 1525 = 7eff0300 21450005 dced1400 00c606e2 65451175 cf19e14a e0005004 1cbe462c
ffff810137f5f240 599550696 S Bo:4:055:6 -115 1 = 7e
ffff810137f5f240 599550820 C Bo:4:055:6 0 1 >
ffff810137f5f240 599551650 S Bi:4:055:5 -115 4096 <
ffff810137f5fd80 599552552 S Bo:4:055:6 -115 59 = 7eff0300 21450000 34025440 008006d8 ce19e14a e0451175 cf041c00 507b26bf
ffff810137f5fd80 599552823 C Bo:4:055:6 0 59 >
ffff810137f5f240 599553831 C Bi:4:055:5 0 1042 = 7eff0300 21450005 dcfa2400 00c606d5 55451175 cf19e14a e0005004 1cbe4632
ffff810137f5f240 599554529 S Bo:4:055:6 -115 1 = 7e
ffff810137f5f240 599554820 C Bo:4:055:6 0 1 >
ffff810137f5f240 599556549 S Bi:4:055:5 -115 4096 <
ffff810137f5f240 599557833 C Bi:4:055:5 0 479 = 7d5e23fc 47f88de1 cb86f197 897c73ac fc5fb1bb 66b7bef1 67c44f0e ebbe006f
ffff810137f5f240 599559579 S Bo:4:055:6 -115 59 = 7eff0300 21450000 34025540 008006d8 cd19e14a e0451175 cf041c00 507b26bf
ffff810137f5fd80 599559598 S Bi:4:055:5 -115 4096 <
ffff810137f5f240 599559819 C Bo:4:055:6 0 59 >
ffff810137f5f240 599561600 S Bo:4:055:6 -115 1 = 7e
ffff810137f5f240 599561820 C Bo:4:055:6 0 1 >
ffff810137f5fd80 599591836 C Bi:4:055:5 0 1530 = 7eff0300 21450005 dcfa2800 00c606d5 51451175 cf19e14a e0005004 1cbe4638
ffff810137f5fd80 599593856 S Bo:4:055:6 -115 59 = 7eff0300 21450000 34025640 008006d8 cc19e14a e0451175 cf041c00 507b26bf
ffff810137f5f240 599594718 S Bi:4:055:5 -115 4096 <
ffff810137f5fd80 599594821 C Bo:4:055:6 0 59 >
ffff810137f5fd80 599596743 S Bo:4:055:6 -115 1 = 7e
ffff810137f5fd80 599597822 C Bo:4:055:6 0 1 >
ffff810137f5f240 599651845 C Bi:4:055:5 0 1521 = 7eff0300 21450005 dc009800 00c606ce e2451175 cf19e14a e0005004 1cbe463e
ffff810137f5f240 599654767 S Bo:4:055:6 -115 59 = 7eff0300 21450000 34025740 008006d8 cb19e14a e0451175 cf041c00 507b26bf
ffff810137f5fd80 599654790 S Bi:4:055:5 -115 4096 <
ffff810137f5f240 599655825 C Bo:4:055:6 0 59 >
ffff810137f5f240 599657763 S Bo:4:055:6 -115 1 = 7e
ffff810137f5f240 599658825 C Bo:4:055:6 0 1 >
ffff810137f5fd80 599711843 C Bi:4:055:5 0 1523 = 7eff0300 21450005 dc013400 00c606ce 46451175 cf19e14a e0005004 1cbe4643
ffff810137f5fd80 599713731 S Bo:4:055:6 -115 59 = 7eff0300 21450000 34025840 008006d8 ca19e14a e0451175 cf041c00 507b26bf
ffff810137f5f240 599713754 S Bi:4:055:5 -115 4096 <
ffff810137f5fd80 599714828 C Bo:4:055:6 0 59 >
ffff810137f5fd80 599717768 S Bo:4:055:6 -115 1 = 7e
ffff810137f5fd80 599718829 C Bo:4:055:6 0 1 >
ffff810137f5f240 599771846 C Bi:4:055:5 0 1518 = 7eff0300 21450005 dc013800 00c606ce 42451175 cf19e14a e0005004 1cbe4649
ffff810137f5f240 599773860 S Bo:4:055:6 -115 59 = 7eff0300 21450000 34025940 008006d8 c919e14a e0451175 cf041c00 507b26bf
ffff810137f5fd80 599773883 S Bi:4:055:5 -115 4096 <
ffff810137f5f240 599774832 C Bo:4:055:6 0 59 >
ffff810137f5f240 599777791 S Bo:4:055:6 -115 1 = 7e
ffff810137f5f240 599778833 C Bo:4:055:6 0 1 >
ffff810137f5fd80 599831850 C Bi:4:055:5 0 1528 = 7eff0300 21450005 dc09b000 00c606c5 ca451175 cf19e14a e0005004 1cbe464f
ffff810137f5fd80 599834231 S Bo:4:055:6 -115 59 = 7eff0300 21450000 34025a40 008006d8 c819e14a e0451175 cf041c00 507b26bf
ffff810137f5f240 599834255 S Bi:4:055:5 -115 4096 <
ffff810137f5fd80 599834835 C Bo:4:055:6 0 59 >
ffff810137f5fd80 599836449 S Bo:4:055:6 -115 1 = 7e
ffff810137f5fd80 599836836 C Bo:4:055:6 0 1 >
ffff810137f5f240 599891854 C Bi:4:055:5 0 1523 = 7eff0300 21450005 dc09b400 00c606c5 c6451175 cf19e14a e0005004 1cbe4654
ffff8101f46e2780 599897809 S Bo:4:055:6 -115 59 = 7eff0300 21450000 34025b40 008006d8 c719e14a e0451175 cf041c00 507b26bf
ffff8101f46e2000 599897833 S Bi:4:055:5 -115 4096 <
ffff8101f46e2780 599898839 C Bo:4:055:6 0 59 >
ffff8101f46e2780 599900730 S Bo:4:055:6 -115 1 = 7e
ffff8101f46e2780 599900839 C Bo:4:055:6 0 1 >
ffff8101f46e2000 599947861 C Bi:4:055:5 0 1521 = 7eff0300 21450005 dc0bac00 00c606c3 ce451175 cf19e14a e0005004 1cbe465a
ffff8101f46e2000 599949944 S Bo:4:055:6 -115 59 = 7eff0300 21450000 34025c40 008006d8 c619e14a e0451175 cf041c00 507b26bf
ffff8101f46e2780 599949967 S Bi:4:055:5 -115 4096 <
ffff8101f46e2000 599950842 C Bo:4:055:6 0 59 >
ffff8101f46e2000 599952742 S Bo:4:055:6 -115 1 = 7e
ffff8101f46e2000 599953842 C Bo:4:055:6 0 1 >
ffff8101f46e2780 600011860 C Bi:4:055:5 0 1521 = 7eff0300 21450005 dc0bb000 00c606c3 ca451175 cf19e14a e0005004 1cbe4660
ffff8101f46e2780 600020713 S Bo:4:055:6 -115 59 = 7eff0300 21450000 34025d40 008006d8 c519e14a e0451175 cf041c00 507b26bf
ffff8101f46e2000 600020734 S Bi:4:055:5 -115 4096 <
ffff8101f46e2780 600020846 C Bo:4:055:6 0 59 >
ffff8101f46e2780 600025726 S Bo:4:055:6 -115 1 = 7e
ffff8101f46e2780 600025846 C Bo:4:055:6 0 1 >
ffff8101f46e2000 600071870 C Bi:4:055:5 0 1521 = 7eff0300 21450005 dc0bb400 00c606c3 c6451175 cf19e14a e0005004 1cbe4666
ffff8101f46e2000 600075101 S Bo:4:055:6 -115 59 = 7eff0300 21450000 34025e40 008006d8 c419e14a e0451175 cf041c00 507b26bf
ffff8101f46e2780 600075126 S Bi:4:055:5 -115 4096 <
ffff8101f46e2000 600075848 C Bo:4:055:6 0 59 >
ffff8101f46e2000 600076917 S Bo:4:055:6 -115 1 = 7e
ffff8101f46e2000 600077850 C Bo:4:055:6 0 1 >
ffff8101f46e2780 600127867 C Bi:4:055:5 0 1526 = 7eff0300 21450005 dc0bb800 00c606c3 c2451175 cf19e14a e0005004 1cbe466b
ffff8101f46e2780 600136379 S Bo:4:055:6 -115 59 = 7eff0300 21450000 34025f40 008006d8 c319e14a e0451175 cf041c00 507b26bf
ffff8101f46e2000 600136399 S Bi:4:055:5 -115 4096 <
ffff8101f46e2780 600136853 C Bo:4:055:6 0 59 >
ffff8101f46e2780 600139484 S Bo:4:055:6 -115 1 = 7e
ffff8101f46e2780 600139852 C Bo:4:055:6 0 1 >
ffff8101f46e2000 600195877 C Bi:4:055:5 0 1526 = 7eff0300 21450005 dc195c00 00c606b6 1e451175 cf19e14a e0005004 1cbe4671
ffff8101f46e2000 600197704 S Bo:4:055:6 -115 59 = 7eff0300 21450000 34026040 008006d8 c219e14a e0451175 cf041c00 507b26bf
ffff8101f46e2780 600197726 S Bi:4:055:5 -115 4096 <
ffff8101f46e2000 600197855 C Bo:4:055:6 0 59 >
ffff8101f46e2000 600199651 S Bo:4:055:6 -115 1 = 7e
ffff8101f46e2000 600199856 C Bo:4:055:6 0 1 >
ffff8101f46e2780 600251876 C Bi:4:055:5 0 1521 = 7eff0300 21450005 dc196000 00c606b6 1a451175 cf19e14a e0005004 1cbe4677
ffff8101f46e2780 600253750 S Bo:4:055:6 -115 59 = 7eff0300 21450000 34026140 008006d8 c119e14a e0451175 cf041c00 507b26bf
ffff8101f46e2000 600253773 S Bi:4:055:5 -115 4096 <
ffff8101f46e2780 600253859 C Bo:4:055:6 0 59 >
ffff8101f46e2780 600255752 S Bo:4:055:6 -115 1 = 7e
ffff8101f46e2780 600256858 C Bo:4:055:6 0 1 >
ffff8101f46e2000 600307879 C Bi:4:055:5 0 1521 = 7eff0300 21450005 dc1a4000 00c606b5 3a451175 cf19e14a e0005004 1cbe467c
ffff8101f46e2000 600309819 S Bo:4:055:6 -115 59 = 7eff0300 21450000 34026240 008006d8 c019e14a e0451175 cf041c00 507b26bf
ffff8101f46e2780 600309842 S Bi:4:055:5 -115 4096 <
ffff8101f46e2000 600310860 C Bo:4:055:6 0 59 >
ffff8101f46e2000 600319731 S Bo:4:055:6 -115 1 = 7e
ffff8101f46e2000 600319864 C Bo:4:055:6 0 1 >
ffff8101f46e2780 600371950 C Bi:4:055:5 0 1527 = 7eff0300 21450005 dc1a4400 00c606b5 36451175 cf19e14a e0005004 1cbe4682
ffff810089414e40 600374069 S Bo:4:055:6 -115 59 = 7eff0300 21450000 34026340 008006d8 bf19e14a e0451175 cf041c00 507b26bf
ffff810089414600 600374130 S Bi:4:055:5 -115 4096 <
ffff810089414e40 600374878 C Bo:4:055:6 0 59 >
ffff810089414d80 600376093 S Bo:4:055:6 -115 1 = 7e
ffff810089414d80 600376866 C Bo:4:055:6 0 1 >
ffff810089414600 600460893 C Bi:4:055:5 0 1522 = 7eff0300 21450005 dc1f9000 00c606af ea451175 cf19e14a e0005004 1cbe4688
ffff8102112e1900 600465366 S Bo:4:055:6 -115 59 = 7eff0300 21450000 34026440 008006d8 be19e14a e0451175 cf041c00 507b26bf
ffff8102112e1600 600465430 S Bi:4:055:5 -115 4096 <
ffff8102112e1900 600465873 C Bo:4:055:6 0 59 >
ffff8102112e1900 600467222 S Bo:4:055:6 -115 1 = 7e
ffff8102112e1900 600467872 C Bo:4:055:6 0 1 >
ffff8102112e1600 600725907 C Bi:4:055:5 0 1532 = 7eff0300 21450005 dc233c00 00c606ac 3e451175 cf19e14a e0005004 1cbe468d
ffff8101f46e2d80 600734445 S Bo:4:055:6 -115 59 = 7eff0300 21450000 34026540 008006d8 bd19e14a e0451175 cf041c00 507b26bf
ffff8101f46e2780 600734469 S Bi:4:055:5 -115 4096 <
ffff8101f46e2d80 600734885 C Bo:4:055:6 0 59 >
ffff8101f46e2780 600736896 C Bi:4:055:5 0 1530 = 7eff0300 21450005 dc234000 00c606ac 3a451175 cf19e14a e0005004 1cbe4693
ffff8101f46e2780 600737684 S Bo:4:055:6 -115 1 = 7e
ffff8101f46e2780 600737887 C Bo:4:055:6 0 1 >
ffff8101f46e2780 600738780 S Bi:4:055:5 -115 4096 <
ffff8101f46e2d80 600739845 S Bo:4:055:6 -115 59 = 7eff0300 21450000 34026640 008006d8 bc19e14a e0451175 cf041c00 507b26bf
ffff8101f46e2780 600740896 C Bi:4:055:5 0 1030 = 7eff0300 21450005 dc240000 00c606ab 7a451175 cf19e14a e0005004 1cbe4699
ffff8101f46e2d80 600740901 C Bo:4:055:6 0 59 >
ffff8101f46e2d80 600741995 S Bo:4:055:6 -115 1 = 7e
ffff8101f46e2780 600742015 S Bi:4:055:5 -115 4096 <
ffff8101f46e2d80 600742886 C Bo:4:055:6 0 1 >
ffff8101f46e2780 600742905 C Bi:4:055:5 0 497 = bad34ad3 0def8d3c 57e25f14 6bfe1ff0 97815b57 5f19f8ab c2fe10f8 83a1f86f
ffff8101f46e2780 600745293 S Bo:4:055:6 -115 59 = 7eff0300 21450000 34026740 008006d8 bb19e14a e0451175 cf041c00 507b26bf
ffff8101f46e2d80 600745314 S Bi:4:055:5 -115 4096 <
ffff8101f46e2780 600745885 C Bo:4:055:6 0 59 >
ffff8101f46e2780 600746664 S Bo:4:055:6 -115 1 = 7e
ffff8101f46e2780 600746890 C Bo:4:055:6 0 1 >
ffff8101f46e2d80 600747896 C Bi:4:055:5 0 1520 = 7eff0300 21450005 dc240400 00c606ab 76451175 cf19e14a e0005004 1cbe469f
ffff8101f46e2d80 600749907 S Bo:4:055:6 -115 59 = 7eff0300 21450000 34026840 008006d8 ba19e14a e0451175 cf041c00 507b26bf
ffff8101f46e2780 600749929 S Bi:4:055:5 -115 4096 <
ffff8101f46e2d80 600750886 C Bo:4:055:6 0 59 >
ffff8101f46e2780 600750905 C Bi:4:055:5 0 48 = 7eff0300 21450000 2829cc00 00c606e7 86d155ad 6619e14a e0005004 1ec24cc7
ffff8101f46e2780 600755130 S Bo:4:055:6 -115 1 = 7e
ffff8101f46e2d80 600755149 S Bi:4:055:5 -115 4096 <
ffff8101f46e2780 600755887 C Bo:4:055:6 0 1 >
ffff8101f46e2d80 600756900 C Bi:4:055:5 0 994 = 7eff0300 21450005 dc30d400 00c6069e a6451175 cf19e14a e0005004 1cbe46a4
ffff8101f46e2d80 600757963 S Bo:4:055:6 -115 48 = 7eff0300 21450000 28026940 00800614 ea19e14a e0d155ad 66041e00 50ad5e0b
ffff8101f46e2780 600758873 S Bi:4:055:5 -115 4096 <
ffff8101f46e2d80 600758890 C Bo:4:055:6 0 48 >
ffff8101f46e2780 600759902 C Bi:4:055:5 0 528 = 3bbf0d78 b7c79e36 f06dbea3 accbf0ff 00c2b63f 1135ed4d 349f08fc 3df8a1a2
ffff8101f46e2780 600760796 S Bo:4:055:6 -115 61 = 7eff0300 21450000 34026a40 008006d8 b819e14a e0451175 cf041c00 507b26bf
ffff8101f46e2d80 600761717 S Bi:4:055:5 -115 4096 <
ffff8101f46e2780 600761888 C Bo:4:055:6 0 61 >
ffff8101f46e2d80 600791905 C Bi:4:055:5 0 1519 = 7eff0300 21450005 dc30d800 00c6069e a2451175 cf19e14a e0005004 1cbe46aa
ffff8101f46e2d80 600793338 S Bo:4:055:6 -115 59 = 7eff0300 21450000 34026b40 008006d8 b719e14a e0451175 cf041c00 507b26bf
ffff8101f46e2780 600793360 S Bi:4:055:5 -115 4096 <
ffff8101f46e2d80 600793888 C Bo:4:055:6 0 59 >
ffff8101f46e2d80 600795816 S Bo:4:055:6 -115 1 = 7e
ffff8101f46e2d80 600796888 C Bo:4:055:6 0 1 >
ffff8101f46e2780 600836907 C Bi:4:055:5 0 1438 = 7eff0300 21450005 88397400 00c60696 5a451175 cf19e14a e0005004 1cbe46b0
ffff8101f46e2780 600839364 S Bo:4:055:6 -115 59 = 7eff0300 21450000 34026c40 008006d8 b619e14a e0451175 cf041c00 507b26bf
ffff8101f46e2d80 600839387 S Bi:4:055:5 -115 4096 <
ffff8101f46e2780 600839892 C Bo:4:055:6 0 59 >
ffff8101f46e2780 600840965 S Bo:4:055:6 -115 1 = 7e
ffff8101f46e2780 600841892 C Bo:4:055:6 0 1 >
ffff8101f46e2d80 601014923 C Bi:4:055:5 0 1524 = 7eff0300 21450005 dc397800 00c60696 02451175 cf19e14a e0005004 1cbe46b5
ffff8101f46e2d80 601017591 S Bo:4:055:6 -115 59 = 7eff0300 21450000 34026d40 008006d8 b519e14a e0451175 cf041c00 507b26bf
ffff8101f46e2780 601017611 S Bi:4:055:5 -115 4096 <
ffff8101f46e2d80 601017902 C Bo:4:055:6 0 59 >
ffff8101f46e2780 601019911 C Bi:4:055:5 0 1522 = 7eff0300 21450005 dc3a7400 00c60695 06451175 cf19e14a e0005004 1cbe45e2
ffff8101f46e2780 601024413 S Bo:4:055:6 -115 1 = 7e
ffff8101f46e2780 601024902 C Bo:4:055:6 0 1 >
ffff8101f46e2780 601031659 S Bo:4:055:6 -115 48 = 7eff0300 21450000 28026e40 008006d8 c019e14a e0451175 cf041c00 507b26bf
ffff8101f46e2d80 601031680 S Bi:4:055:5 -115 4096 <
ffff8101f46e2780 601031902 C Bo:4:055:6 0 48 >
ffff8101f46e2d80 601317940 C Bi:4:055:5 0 1524 = 7eff0300 21450005 dcb82800 00c60617 52451175 cf19e14a e0005004 1cbe46bb
ffff8101f46e2d80 601325672 S Bi:4:055:5 -115 4096 <
ffff8101f46e2780 601424771 S Bo:4:055:6 -115 48 = 7eff0300 21450000 28026f40 008006d8 bf19e14a e0451175 cf041c00 507b26bf
ffff8101f46e2780 601424929 C Bo:4:055:6 0 48 >
ffff8101f46e2d80 601545953 C Bi:4:055:5 0 1527 = 7eff0300 21450005 dcb82c00 00c60617 4e451175 cf19e14a e0005004 1cbe46c0
ffff8101f46e2d80 601550532 S Bi:4:055:5 -115 4096 <
ffff8101f46e2d80 601552948 C Bi:4:055:5 0 1529 = 7eff0300 21450005 dcb83000 00c60617 4a451175 cf19e14a e0005004 1cbe46c6
ffff8101f46e2d80 601559666 S Bo:4:055:6 -115 48 = 7eff0300 21450000 28027040 008006d8 be19e14a e0451175 cf041c00 507b26bf
ffff8101f46e2780 601559688 S Bi:4:055:5 -115 4096 <
ffff8101f46e2d80 601559931 C Bo:4:055:6 0 48 >
ffff8101f46e2780 601561942 C Bi:4:055:5 0 1034 = 7eff0300 21450005 dcb83400 00c60617 46451175 cf19e14a e0005004 1cbe46cc
ffff8101f46e2780 601563349 S Bi:4:055:5 -115 4096 <
ffff8101f46e2780 601564944 C Bi:4:055:5 0 498 = af8c92e8 7d5e0ef8 797fae69 b6be37f0 d7c56f1c e932e9de 1b8b5ff0 ef8f7518
ffff8101f46e2780 601568731 S Bi:4:055:5 -115 4096 <
ffff8101f46e2780 601762965 C Bi:4:055:5 0 1524 = 7eff0300 21450005 dcb83800 00c60617 42451175 cf19e14a e0005004 1cbe46d2
ffff8101f46e2780 601772786 S Bo:4:055:6 -115 48 = 7eff0300 21450000 28027140 008006d8 bd19e14a e0451175 cf041c00 507b26bf
ffff8101f46e2780 601772945 C Bo:4:055:6 0 48 >
ffff8101f46e2780 601774218 S Bi:4:055:5 -115 4096 <
ffff8101f46e2780 601776956 C Bi:4:055:5 0 1525 = 7eff0300 21450005 dcb83c00 00c60617 3e451175 cf19e14a e0005004 1cbe46d7
ffff8101f46e2780 601779754 S Bi:4:055:5 -115 4096 <
ffff8101f46e2780 601781959 C Bi:4:055:5 0 1042 = 7eff0300 21450005 dcb84000 00c60617 3a451175 cf19e14a e0005004 1cbe46dd
ffff8101f46e2780 601785315 S Bi:4:055:5 -115 4096 <
ffff8101f46e2780 601785960 C Bi:4:055:5 0 482 = f98e0705 9f64f91e 758ac8a7 91d6cc2a 67157883 2ae30c67 0ce33079 656e1ce0
ffff8101f46e2780 601788292 S Bo:4:055:6 -115 48 = 7eff0300 21450000 28027240 008006d8 bc19e14a e0451175 cf041c00 507b26bf
ffff8101f46e2780 601788944 C Bo:4:055:6 0 48 >
ffff8101f46e2780 601789380 S Bi:4:055:5 -115 4096 <
ffff8101f46e2780 601791953 C Bi:4:055:5 0 1516 = 7eff0300 21450005 dcb84400 00c60617 36451175 cf19e14a e0005004 1cbe46e3
ffff8101f46e2780 601802132 S Bi:4:055:5 -115 4096 <
ffff8101f46e2780 601804960 C Bi:4:055:5 0 1050 = 7eff0300 21450005 dcb84800 00c60617 32451175 cf19e14a e0005004 1cbe46e8
ffff8101f46e2780 601809398 S Bi:4:055:5 -115 4096 <
ffff8101f46e2780 601810961 C Bi:4:055:5 0 468 = f85fc5df 0f7d5e08 5fdb7c78 5f93c778 799e65f9 a6221946 6990d7c0 70ce6bc2
ffff8101f46e2780 601814973 S Bo:4:055:6 -115 48 = 7eff0300 21450000 28027340 008006d8 bb19e14a e0451175 cf041c00 507b26bf
ffff8101f46e2d80 601815382 S Bi:4:055:5 -115 4096 <
ffff8101f46e2780 601815945 C Bo:4:055:6 0 48 >
ffff8101f46e2d80 602019978 C Bi:4:055:5 0 1529 = 7eff0300 21450005 dcb84c00 00c60617 2e451175 cf19e14a e0005004 1cbe46ee
ffff8101f46e2d80 602022332 S Bi:4:055:5 -115 4096 <
ffff8101f46e2d80 602099981 C Bi:4:055:5 0 1529 = 7eff0300 21450005 dcb85000 00c60617 2a451175 cf19e14a e0005004 1cbe46f4
ffff8101f46e2d80 602108975 S Bo:4:055:6 -115 48 = 7eff0300 21450000 28027440 008006d8 ba19e14a e0451175 cf041c00 507b26bf
ffff8101f46e2780 602108996 S Bi:4:055:5 -115 4096 <
ffff8101f46e2d80 602109962 C Bo:4:055:6 0 48 >
ffff8101f46e2780 602110974 C Bi:4:055:5 0 1520 = 7eff0300 21450005 dcb85400 00c60617 26451175 cf19e14a e0005004 1cbe46f9
ffff8101f46e2780 602114052 S Bi:4:055:5 -115 4096 <
ffff8101f46e2780 602172985 C Bi:4:055:5 0 1519 = 7eff0300 21450005 dcb85800 00c60617 22451175 cf19e14a e0005004 1cbe46ff
ffff8101f46e2780 602175866 S Bo:4:055:6 -115 48 = 7eff0300 21450000 28027540 008006d8 b919e14a e0451175 cf041c00 507b26bf
ffff8101f46e2d80 602175887 S Bi:4:055:5 -115 4096 <
ffff8101f46e2780 602176965 C Bo:4:055:6 0 48 >
ffff8101f46e2d80 602264986 C Bi:4:055:5 0 1520 = 7eff0300 21450005 dcb85c00 00c60617 1e451175 cf19e14a e0005004 1cbe4705
ffff8101f46e2d80 602267687 S Bi:4:055:5 -115 4096 <
ffff8101f46e2d80 602269989 C Bi:4:055:5 0 1521 = 7eff0300 21450005 dcb86000 00c60617 1a451175 cf19e14a e0005004 1cbe470b
ffff8101f46e2d80 602280193 S Bo:4:055:6 -115 48 = 7eff0300 21450000 28027640 008006d8 b819e14a e0451175 cf041c00 507b26bf
ffff8101f46e2780 602280213 S Bi:4:055:5 -115 4096 <
ffff8101f46e2d80 602280975 C Bo:4:055:6 0 48 >
ffff8101f46e2780 602281987 C Bi:4:055:5 0 1050 = 7eff0300 21450005 dcb86400 00c60617 16451175 cf19e14a e0005004 1cbe4710
ffff8101f46e2780 602284233 S Bi:4:055:5 -115 4096 <
ffff8101f46e2780 602284989 C Bi:4:055:5 0 471 = f8dfc497 53c1a1fc 41365e12 f0b469e1 2d2f5ef0 afc37d5d 53c73f19 35ad4bc7
ffff8101f46e2780 602287762 S Bi:4:055:5 -115 4096 <
ffff8101f46e2780 602351995 C Bi:4:055:5 0 1525 = 7eff0300 21450005 dcb86800 00c60617 12451175 cf19e14a e0005004 1cbe4716
ffff8101f46e2780 602354722 S Bo:4:055:6 -115 48 = 7eff0300 21450000 28027740 008006d8 b719e14a e0451175 cf041c00 507b26bf
ffff8101f46e2d80 602354745 S Bi:4:055:5 -115 4096 <
ffff8101f46e2780 602354976 C Bo:4:055:6 0 48 >
ffff8101f46e2d80 602373996 C Bi:4:055:5 0 606 = 7eff0300 21450002 50b86c00 00c6061a 9a451175 cf19e14a e0005004 1cbe471c
ffff8101f46e2d80 602432290 S Bo:4:055:6 -115 2043 = 7eff0300 21450000 28027d5e 40008006 d8b019e1 4ae04511 75cf041b 0050f773
ffff8101f46e2780 602432319 S Bi:4:055:5 -115 4096 <
ffff8101f46e2d80 602435995 C Bo:4:055:6 0 2043 >
ffff8101f46e2d80 602450222 S Bo:4:055:6 -115 2043 = 4a554a51 4555414f 455a4f47 4157544b 4e544f55 584b454c 41574249 484f5743
ffff8101f46e2d80 602452994 C Bo:4:055:6 0 2043 >
ffff8101f46e2d80 602454715 S Bo:4:055:6 -115 259 = 54454c55 4d4a554a 51455541 4f455a4f 47415754 4b4e544f 55584b45 4c415742
ffff8101f46e2d80 602455981 C Bo:4:055:6 0 259 >
ffff8101f46e2780 602685014 C Bi:4:055:5 0 48 = 7eff0300 21450000 28052800 00c606d0 06451175 cf19e14a e0005004 1bb3419b
ffff8101f46e2780 602692681 S Bi:4:055:5 -115 4096 <
ffff8101f46e2780 603026034 C Bi:4:055:5 0 48 = 7eff0300 21450000 2818a000 00c606bc 8e451175 cf19e14a e0005004 1cbe471e
ffff8101f46e2780 603029603 S Bo:4:055:6 -115 2043 = 7eff0300 21450005 dc028a40 008006d2 f019e14a e0451175 cf041c00 507b26cf
ffff8101f46e2d80 603029632 S Bi:4:055:5 -115 4096 <
ffff8101f46e2780 603033023 C Bo:4:055:6 0 2043 >
ffff8101f46e2780 603035025 S Bo:4:055:6 -115 973 = 5349434e 564d504f 4d435a56 484f4154 4554434f 42524458 5a4c5351 4f485854
ffff8101f46e2780 603037019 C Bo:4:055:6 0 973 >
ffff8101f46e2d80 603266046 C Bi:4:055:5 0 48 = 7eff0300 21450000 28260800 00c606af 26451175 cf19e14a e0005004 1cbe471e
ffff8101f46e2d80 603269899 S Bo:4:055:6 -115 1224 = 7eff0300 21450004 c0028c40 008006d4 0a19e14a e0451175 cf041c00 507b26da
ffff8101f46e2780 603269927 S Bi:4:055:5 -115 4096 <
ffff8101f46e2d80 603272036 C Bo:4:055:6 0 1224 >
ffff8101f46e2780 603345046 C Bi:4:055:5 0 56 = 7eff0300 21450000 30298800 00c606ab 9e451175 cf19e14a e0005004 20d0781b
ffff8101f46e2780 603348205 S Bo:4:055:6 -115 48 = 7eff0300 21450000 28028d40 008006d8 a119e14a e0451175 cf042000 50db5be7
ffff8101f46e2d80 603348237 S Bi:4:055:5 -115 4096 <
ffff8101f46e2780 603349031 C Bo:4:055:6 0 48 >
ffff8101f46e2780 603352613 S Bo:4:055:6 -115 2043 = 7eff0300 21450005 dc028e40 008006d2 ec19e14a e0451175 cf042000 50db5be7
ffff8101f46e2780 603356041 C Bo:4:055:6 0 2043 >
ffff8101f46e2780 603357730 S Bo:4:055:6 -115 973 = 5a564d50 4d4d5447 52564441 49584e56 4b4c414f 53495850 44434d4b 54515a43
ffff8101f46e2780 603360034 C Bo:4:055:6 0 973 >
ffff8101f46e2d80 603465060 C Bi:4:055:5 0 48 = 7eff0300 21450000 2830c800 00c606a4 66451175 cf19e14a e0005004 1cbe471e
ffff8100b663d6c0 603479738 S Bi:4:055:5 -115 4096 <
ffff8100b663dcc0 603587167 S Bo:4:055:6 -115 48 = 7eff0300 21450000 28029240 00800614 c119e14a e0d155ad 66041e00 50ad5e0b
ffff8100b663dcc0 603588049 C Bo:4:055:6 0 48 >
ffff8100b663d6c0 603746074 C Bi:4:055:5 0 49 = 7eff0300 21450000 283f1c00 00c60696 12451175 cf19e14a e0005004 1cbe471e
ffff8100b663d6c0 603747726 S Bo:4:055:6 -115 625 = 7eff0300 21450002 69029340 008006d6 5a19e14a e0451175 cf041c00 507b26df
ffff8100b663dcc0 603747789 S Bi:4:055:5 -115 4096 <
ffff8100b663d6c0 603749057 C Bo:4:055:6 0 625 >
ffff8100b663dcc0 603926085 C Bi:4:055:5 0 48 = 7eff0300 21450000 28468400 00c6068e aa451175 cf19e14a e0005004 1cbe471e
ffff8100b663dcc0 603927714 S Bi:4:055:5 -115 4096 <
ffff8100b663dcc0 604365110 C Bi:4:055:5 0 49 = 7eff0300 21450000 285eb000 00c60676 7d5e4511 75cf19e1 4ae00050 041cbe47
ffff8100b663dcc0 604366690 S Bi:4:055:5 -115 4096 <
ffff8100b663dcc0 604527128 C Bi:4:055:5 0 48 = 7eff0300 21450000 2867ac00 00c6066d 82451175 cf19e14a e0005004 20d0781b
ffff8100b663dcc0 604528656 S Bo:4:055:6 -115 2043 = 7eff0300 21450005 dc029440 008006d2 e619e14a e0451175 cf042000 50db5bf2
ffff8100b663d6c0 604528720 S Bi:4:055:5 -115 4096 <
ffff8100b663dcc0 604532110 C Bo:4:055:6 0 2043 >
ffff8101f46e2780 604538253 S Bo:4:055:6 -115 2043 = 4b524956 50494a56 52534d54 414d5a4b 4e4b4953 5658484c 54585254 454c554d
ffff8101f46e2780 604541110 C Bo:4:055:6 0 2043 >
ffff8101f46e2780 604543388 S Bo:4:055:6 -115 439 = 52494552 594b5249 5650494a 5652534d 54414d5a 4b4e4b49 53565848 4c545852
ffff8101f46e2780 604544100 C Bo:4:055:6 0 439 >
ffff8100b663d6c0 604607122 C Bi:4:055:5 0 48 = 7eff0300 21450000 28695800 00c606a7 fad155ad 6619e14a e0005004 1ec24cc7
ffff8101f46e2780 604610666 S Bi:4:055:5 -115 4096 <
ffff8101f46e2780 604653121 C Bi:4:055:5 0 407 = 7eff0300 21450001 8e6f9c00 00c60664 2c451175 cf19e14a e0005004 1cbe471e
ffff8101f46e2780 604657341 S Bi:4:055:5 -115 4096 <
ffff8101f46e2000 604869388 S Bo:4:055:6 -115 48 = 7eff0300 21450000 28029940 008006d8 9519e14a e0451175 cf041c00 507b26e1
ffff8101f46e2000 604870120 C Bo:4:055:6 0 48 >
ffff8101f46e2780 605126150 C Bi:4:055:5 0 49 = 7eff0300 21450000 288c7400 00c60648 ba451175 cf19e14a e0005004 20d0781b
ffff8101f46e2780 605130278 S Bo:4:055:6 -115 940 = 7eff0300 21450003 a4029a40 008006d5 1819e14a e0451175 cf042000 50db5c03
ffff8101f46e2000 605130306 S Bi:4:055:5 -115 4096 <
ffff8101f46e2780 605132137 C Bo:4:055:6 0 940 >
ffff8101f46e2000 605325159 C Bi:4:055:5 0 48 = 7eff0300 21450000 28946c00 00c60640 c2451175 cf19e14a e0005004 20d0781b
ffff8101f46e2000 605329450 S Bo:4:055:6 -115 625 = 7eff0300 21450002 69029b40 008006d6 5219e14a e0451175 cf042000 50db5c07
ffff8101f46e2780 605329476 S Bi:4:055:5 -115 4096 <
ffff8101f46e2000 605331145 C Bo:4:055:6 0 625 >
ffff8101f46e2780 605750186 C Bi:4:055:5 0 48 = 7eff0300 21450000 28ae8800 00c60626 a6451175 cf19e14a e0005004 20d0781b
ffff8101f46e2780 605753725 S Bi:4:055:5 -115 4096 <
ffff8101f46e2780 605766182 C Bi:4:055:5 0 407 = 7eff0300 21450001 8eaee800 00c60624 e0451175 cf19e14a e0005004 20d0781b
ffff8101f46e2780 605775511 S Bi:4:055:5 -115 4096 <
ffff8101f46e2000 605877453 S Bo:4:055:6 -115 2043 = 7eff0300 21450005 dc02a040 008006d2 da19e14a e0451175 cf041c00 507b26e1
ffff8101f46e2000 605880188 C Bo:4:055:6 0 2043 >
ffff8101f46e2000 605881213 S Bo:4:055:6 -115 2043 = 4e48514c 434f4f47 44515347 43464d50 5052504d 54594455 414a4343 52594442
ffff8101f46e2000 605884177 C Bo:4:055:6 0 2043 >
ffff8101f46e2000 605885952 S Bo:4:055:6 -115 2043 = 4c514d44 464e4851 4c434f4f 47445153 4743464d 50505250 4d545944 55414a43
ffff8101f46e2000 605889181 C Bo:4:055:6 0 2043 >
ffff8101f46e2000 605890989 S Bo:4:055:6 -115 2043 = 42455559 504e5a54 41454d4f 53544e42 48445742 43434247 484f5459 4d4c4354
ffff8101f46e2000 605897182 C Bo:4:055:6 0 2043 >
ffff8101f46e2000 605899804 S Bo:4:055:6 -115 2043 = 574d5057 4b424555 59504e5a 5441454d 4f53544e 42484457 42434342 47484f54
ffff8101f46e2000 605903182 C Bo:4:055:6 0 2043 >
ffff8101f46e2000 605905660 S Bo:4:055:6 -115 2043 = 42455559 504e5a54 41454d4f 53544e42 48445742 43434247 484f5459 4d4c4354
ffff8101f46e2000 605909183 C Bo:4:055:6 0 2043 >
ffff8101f46e2000 605910655 S Bo:4:055:6 -115 2043 = 574d5057 4b424555 59504e5a 5441454d 4f53544e 42484457 42434342 47484f54
ffff8101f46e2000 605914180 C Bo:4:055:6 0 2043 >
ffff8101f46e2000 605916049 S Bo:4:055:6 -115 2043 = 45465a4c 4e4f4447 464c584f 454a4c42 4849554a 57454453 4d4f4b41 5a4f4450
ffff8101f46e2000 605919202 C Bo:4:055:6 0 2043 >
ffff8101f46e2000 605920630 S Bo:4:055:6 -115 616 = 574b5444 5245465a 4c4e4f44 47464c58 4f454a4c 42484955 4a574544 534d4f4b
ffff8101f46e2000 605923177 C Bo:4:055:6 0 616 >
ffff8101f46e2780 606726240 C Bi:4:055:5 0 48 = 7eff0300 21450000 28e69c00 00c606ee 91451175 cf19e14a e0005004 1cbe471f
ffff8101f46e2780 606733332 S Bi:4:055:5 -115 4096 <
ffff8101f46e2780 606866244 C Bi:4:055:5 0 48 = 7eff0300 21450000 28f04400 00c606e4 e9451175 cf19e14a e0005004 1cbe471f
ffff8101f46e2780 606870471 S Bi:4:055:5 -115 4096 <
ffff8101f46e2780 607065257 C Bi:4:055:5 0 48 = 7eff0300 21450000 28fec000 00c606d6 6d451175 cf19e14a e0005004 1cbe471f
ffff8101f46e2780 607069516 S Bo:4:055:6 -115 625 = 7eff0300 21450002 6902ae40 008006d6 3f19e14a e0451175 cf041c00 507b2701
ffff8101f46e2000 607069541 S Bi:4:055:5 -115 4096 <
ffff8101f46e2780 607071243 C Bo:4:055:6 0 625 >
ffff8101f46e2000 607325270 C Bi:4:055:5 0 48 = 7eff0300 21450000 280a0000 00c606cb 2e451175 cf19e14a e0005004 1cbe471f
ffff8101f46e2000 607331662 S Bi:4:055:5 -115 4096 <
ffff8101f46e2000 607526285 C Bi:4:055:5 0 48 = 7eff0300 21450000 28128400 00c606c2 aa451175 cf19e14a e0005004 1cbe471f
ffff8101f46e2000 607533789 S Bi:4:055:5 -115 4096 <
ffff8101f46e2000 607766298 C Bi:4:055:5 0 48 = 7eff0300 21450000 281df800 00c606b7 36451175 cf19e14a e0005004 20d0781c
ffff8101f46e2000 607769843 S Bi:4:055:5 -115 4096 <
ffff8101f46e2000 608307331 C Bi:4:055:5 0 48 = 7eff0300 21450000 283eec00 00c60696 42451175 cf19e14a e0005004 20d0781c
ffff8101f46e2000 608309725 S Bi:4:055:5 -115 4096 <
ffff8101f46e2780 608433016 S Bo:4:055:6 -115 97 = 7eff0300 21450000 2802af40 0080066d 590a0002 0fd155ad 63041a00 506bc998
ffff8101f46e2780 608433321 C Bo:4:055:6 0 97 >
ffff8101f46e2000 608667348 C Bi:4:055:5 0 49 = 7eff0300 21450000 2850f400 00c60684 3a451175 cf19e14a e0005004 20d0781c
ffff8101f4408000 608669334 S Bo:4:055:6 -115 625 = 7eff0300 21450002 6902b140 008006d6 3c19e14a e0451175 cf042000 50db5c29
ffff8101f44089c0 608669399 S Bi:4:055:5 -115 4096 <
ffff8101f4408000 608670339 C Bo:4:055:6 0 625 >
ffff8101f44089c0 608848359 C Bi:4:055:5 0 48 = 7eff0300 21450000 285c1800 00c60679 16451175 cf19e14a e0005004 20d0781c
ffff8101f44089c0 608850339 S Bi:4:055:5 -115 4096 <
ffff8101f44089c0 608871361 C Bi:4:055:5 0 407 = 7eff0300 21450001 8e5d5800 00c60676 70451175 cf19e14a e0005004 1cbe471f
ffff8101f44089c0 608880204 S Bi:4:055:5 -115 4096 <
ffff8101fae99600 609073184 S Bo:4:055:6 -115 48 = 7eff0300 21450000 2802b440 008006d8 7a19e14a e0451175 cf041c00 507b2703
ffff8101fae99600 609073353 C Bo:4:055:6 0 48 >
ffff8101f44089c0 609148381 C Bi:4:055:5 0 407 = 7eff0300 21450001 8e6ec400 00c60665 04451175 cf19e14a e0005004 20d0781c
ffff8101f46e2000 609174360 S Bo:4:055:6 -115 2043 = 7eff0300 21450005 dc02b940 008006d2 c119e14a e0451175 cf041c00 507b2703
ffff8101f46e2780 609174393 S Bi:4:055:5 -115 4096 <
ffff8101f46e2000 609178370 C Bo:4:055:6 0 2043 >
ffff8101f46e2000 609180265 S Bo:4:055:6 -115 2043 = 52595045 4d595050 4e554b43 42445044 58454c56 49525051 43414159 414d564c
ffff8101f46e2000 609183364 C Bo:4:055:6 0 2043 >
ffff8101f46e2000 609187554 S Bo:4:055:6 -115 2043 = 41524957 46525950 454d5950 504e554b 43424450 4458454c 56495250 51434141
ffff8101f46e2000 609190365 C Bo:4:055:6 0 2043 >
ffff8101f46e2000 609199490 S Bo:4:055:6 -115 2043 = 534d534a 4f445752 50574654 564d5a52 54424846 4141494f 48425549 42554750
ffff8101f46e2000 609202369 C Bo:4:055:6 0 2043 >
ffff8101f46e2000 609205829 S Bo:4:055:6 -115 2043 = 504b444b 43534d53 4a4f4457 52505746 54564d5a 52544248 46414149 4f484255
ffff8101f46e2000 609209367 C Bo:4:055:6 0 2043 >
ffff8101fae99180 609213829 S Bo:4:055:6 -115 2043 = 534d534a 4f445752 50574654 564d5a52 54424846 4141494f 48425549 42554750
ffff8101fae99180 609217372 C Bo:4:055:6 0 2043 >
ffff8101fae99180 609219007 S Bo:4:055:6 -115 2043 = 504b444b 43534d53 4a4f4457 52505746 54564d5a 52544248 46414149 4f484255
ffff8101fae99180 609222369 C Bo:4:055:6 0 2043 >
ffff8101fae99180 609231495 S Bo:4:055:6 -115 2043 = 45514355 59565654 4c424d53 4d52454b 4a564945 46415841 424b5a4a 444f5559
ffff8101fae99180 609234375 C Bo:4:055:6 0 2043 >
ffff8101fae99180 609235471 S Bo:4:055:6 -115 616 = 57554145 45455143 55595656 544c424d 534d5245 4b4a5649 45464158 41424b5a
ffff8101fae99180 609236376 C Bo:4:055:6 0 616 >
ffff8101f46e2780 610386443 C Bi:4:055:5 0 48 = 7eff0300 21450000 28b4c400 00c60620 6a451175 cf19e14a e0005004 1cbe4721
ffff8101f46dc480 610387820 S Bi:4:055:5 -115 4096 <
ffff8101f46dc480 610389437 C Bi:4:055:5 0 48 = 7eff0300 21450000 28b4d000 00c60620 5e451175 cf19e14a e0005004 1cbe4721
ffff8101f46dc480 610395105 S Bo:4:055:6 -115 2043 = 7eff0300 21450005 dc02c540 008006d2 b519e14a e0451175 cf041c00 507b2723
ffff8101f46dc180 610395134 S Bi:4:055:5 -115 4096 <
ffff8101f46dc180 610395439 C Bi:4:055:5 0 48 = 7eff0300 21450000 28b4e000 00c60620 4e451175 cf19e14a e0005004 1cbe4721
ffff8101f46dc480 610398426 C Bo:4:055:6 0 2043 >
ffff8101f46dc480 610399884 S Bo:4:055:6 -115 2043 = 534d534a 4f445752 50574654 564d5a52 54424846 4141494f 48425549 42554750
ffff8101f46dc180 610399914 S Bi:4:055:5 -115 4096 <
ffff8101f46dc480 610403430 C Bo:4:055:6 0 2043 >
ffff8101f46dc480 610404597 S Bo:4:055:6 -115 2043 = 504b444b 43534d53 4a4f4457 52505746 54564d5a 52544248 46414149 4f484255
ffff8101f46dc480 610407429 C Bo:4:055:6 0 2043 >
ffff8101f46dc480 610409716 S Bo:4:055:6 -115 2043 = 45514355 59565654 4c424d53 4d52454b 4a564945 46415841 424b5a4a 444f5559
ffff8101f46dc480 610416434 C Bo:4:055:6 0 2043 >
ffff8101f46dc480 610419875 S Bo:4:055:6 -115 308 = 57554145 45455143 55595656 544c424d 534d5245 4b4a5649 45464158 41424b5a
ffff8101f46dc480 610420426 C Bo:4:055:6 0 308 >
ffff8101f46dc180 610526452 C Bi:4:055:5 0 48 = 7eff0300 21450000 28bd1000 00c60618 1e451175 cf19e14a e0005004 20d0781e
ffff8101f46dc180 610527753 S Bi:4:055:5 -115 4096 <
ffff8101f46dc180 610665459 C Bi:4:055:5 0 48 = 7eff0300 21450000 28c3dc00 00c60611 52451175 cf19e14a e0005004 20d0781e
ffff8101f46dc180 610670789 S Bo:4:055:6 -115 2043 = 7eff0300 21450005 dc02cb40 008006d2 af19e14a e0451175 cf042000 50db5c4b
ffff8101f46dc480 610670821 S Bi:4:055:5 -115 4096 <
ffff8101f46dc180 610673448 C Bo:4:055:6 0 2043 >
ffff8101f46dc180 610677821 S Bo:4:055:6 -115 2043 = 534d534a 4f445752 50574654 564d5a52 54424846 4141494f 48425549 42554750
ffff8101f46dc180 610681450 C Bo:4:055:6 0 2043 >
ffff8101f46dc180 610682797 S Bo:4:055:6 -115 154 = 504b444b 43534d53 4a4f4457 52505746 54564d5a 52544248 46414149 4f484255
ffff8101f46dc180 610683441 C Bo:4:055:6 0 154 >
ffff8101f46dc480 611066481 C Bi:4:055:5 0 48 = 7eff0300 21450000 28dd3400 00c606f7 f9451175 cf19e14a e0005004 20d0781e
ffff8101df0e3480 611067769 S Bi:4:055:5 -115 4096 <
ffff8101df0e3480 611163487 C Bi:4:055:5 0 48 = 7eff0300 21450000 28e1f000 00c606f3 3d451175 cf19e14a e0005004 20d0781e
ffff8101df0e3480 611165812 S Bo:4:055:6 -115 2043 = 7eff0300 21450005 dc02ce40 008006d2 ac19e14a e0451175 cf042000 50db5c5b
ffff8101df0e3e40 611165845 S Bi:4:055:5 -115 4096 <
ffff8101df0e3e40 611166486 C Bi:4:055:5 0 48 = 7eff0300 21450000 28e1f400 00c606f3 39451175 cf19e14a e0005004 1cbe4721
ffff8101df0e3e40 611167823 S Bi:4:055:5 -115 4096 <
ffff8101df0e3480 611168472 C Bo:4:055:6 0 2043 >
ffff8101df0e3480 611169593 S Bo:4:055:6 -115 2043 = 59485955 4b4c584e 58504152 444c4a42 5a4c5954 5458544f 4e434b41 564a5155
ffff8101df0e3480 611172475 C Bo:4:055:6 0 2043 >
ffff8101df0e3480 611173635 S Bo:4:055:6 -115 154 = 4b4d414c 42594859 554b4c58 4e585041 52444c4a 425a4c59 54545854 4f4e434b
ffff8101df0e3480 611174468 C Bo:4:055:6 0 154 >
ffff8101df0e3e40 611343497 C Bi:4:055:5 0 48 = 7eff0300 21450000 28e9a800 00c606eb 85451175 cf19e14a e0005004 1cbe4721
ffff8101df0e3e40 611347746 S Bi:4:055:5 -115 4096 <
ffff8101df0e3e40 611625513 C Bi:4:055:5 0 48 = 7eff0300 21450000 28f9a000 00c606db 8d451175 cf19e14a e0005004 1cbe4721
ffff8100b66d1000 611629233 S Bo:4:055:6 -115 434 = 7eff0300 21450001 aa02d340 008006d6 d919e14a e0451175 cf041c00 507b2743
ffff8100b66d1d80 611629298 S Bi:4:055:5 -115 4096 <
ffff8100b66d1000 611630497 C Bo:4:055:6 0 434 >
ffff8100b66d1d80 611763521 C Bi:4:055:5 0 48 = 7eff0300 21450000 2803c000 00c606d1 6e451175 cf19e14a e0005004 1cbe4721
ffff8100b66d1d80 611765236 S Bi:4:055:5 -115 4096 <
ffff8100b66d1d80 611926529 C Bi:4:055:5 0 48 = 7eff0300 21450000 28123400 00c606c2 fa451175 cf19e14a e0005004 20d0781e
ffff8100b66d1d80 611934238 S Bi:4:055:5 -115 4096 <
ffff8100b66d1d80 611934526 C Bi:4:055:5 0 48 = 7eff0300 21450000 28123000 00c606c2 fe451175 cf19e14a e0005004 1cbe4721
ffff8100b66d1d80 611937132 S Bi:4:055:5 -115 4096 <
ffff8100b66d1d80 612105540 C Bi:4:055:5 0 48 = 7eff0300 21450000 281cc000 00c606b8 6e451175 cf19e14a e0005004 20d0781e
ffff81019bdab300 612112237 S Bi:4:055:5 -115 4096 <
ffff81019bdab300 612123540 C Bi:4:055:5 0 48 = 7eff0300 21450000 281d7400 00c606b7 ba451175 cf19e14a e0005004 20d0781e
ffff81019bdab300 612125203 S Bo:4:055:6 -115 434 = 7eff0300 21450001 aa02d440 008006d6 d819e14a e0451175 cf042000 50db5c6b
ffff8101f4758f00 612125267 S Bi:4:055:5 -115 4096 <
ffff81019bdab300 612126521 C Bo:4:055:6 0 434 >
ffff8101f4758f00 612326553 C Bi:4:055:5 0 48 = 7eff0300 21450000 2829e000 00c606ab 4e451175 cf19e14a e0005004 20d0781e
ffff8101f4758f00 612329204 S Bi:4:055:5 -115 4096 <
ffff8101f4758f00 612486561 C Bi:4:055:5 0 407 = 7eff0300 21450001 8f366800 00c6069d 5f451175 cf19e14a e0005004 20d0781e
ffff8101ef120a80 612495280 S Bi:4:055:5 -115 4096 <
ffff8101ef120a80 612512564 C Bi:4:055:5 0 408 = 7eff0300 21450001 8f36a000 00c6069d 27451175 cf19e14a e0005004 1cbe4721
ffff8101ef120a80 612522090 S Bi:4:055:5 -115 4096 <
ffff8101ef1209c0 612590344 S Bo:4:055:6 -115 2043 = 7eff0300 21450005 dc02dd40 008006d2 9d19e14a e0451175 cf042000 50db5c6d
ffff8101ef1209c0 612593561 C Bo:4:055:6 0 2043 >
ffff8101ef1209c0 612595461 S Bo:4:055:6 -115 2043 = 4e564548 51514154 58485742 5543474c 4c525650 43544e52 48444145 474c4657
ffff8101ef1209c0 612598567 C Bo:4:055:6 0 2043 >
ffff8101ef1209c0 612599836 S Bo:4:055:6 -115 2043 = 4d585650 4c5a4e56 45485151 41545848 57425543 474c4c52 56504354 4e524844
ffff8101ef1209c0 612602556 C Bo:4:055:6 0 2043 >
ffff8101ef1209c0 612610725 S Bo:4:055:6 -115 2043 = 544c534f 43574851 4a515459 444b4659 444a524c 42584947 47505256 53534a4d
ffff8101ef1209c0 612613571 C Bo:4:055:6 0 2043 >
ffff8101ef1209c0 612615799 S Bo:4:055:6 -115 2043 = 44544d50 4b544c53 4f435748 514a5154 59444b46 59444a52 4c425849 47475052
ffff8101ef1209c0 612618561 C Bo:4:055:6 0 2043 >
ffff8101ef1209c0 612621222 S Bo:4:055:6 -115 2043 = 504b544c 534f4357 48514a51 5459444b 4659444a 524c4258 49474750 52565353
ffff8101ef1209c0 612624560 C Bo:4:055:6 0 2043 >
ffff8101ef1209c0 612626271 S Bo:4:055:6 -115 2043 = 585a4454 4d504b54 4c534f43 5748514a 51545944 4b465944 4a524c42 58494747
ffff8101ef1209c0 612629571 C Bo:4:055:6 0 2043 >
ffff8101ef1209c0 612632207 S Bo:4:055:6 -115 2043 = 51555059 5859535a 43544458 4f48454a 4643595a 4f575755 42444a56 4b4a5156
ffff8101ef1209c0 612635558 C Bo:4:055:6 0 2043 >
ffff8101ef1209c0 612642321 S Bo:4:055:6 -115 620 = 43574344 4d515550 59585953 5a435444 584f4845 4a464359 5a4f5757 5542444a
ffff8101ef1209c0 612643565 C Bo:4:055:6 0 620 >
ffff8101ef120a80 613347609 C Bi:4:055:5 0 49 = 7eff0300 21450000 2870f800 00c60664 36451175 cf19e14a e0005004 20d0781f
ffff8101df0e3480 613348756 S Bi:4:055:5 -115 4096 <
ffff8101df0e3480 613443615 C Bi:4:055:5 0 48 = 7eff0300 21450000 28783400 00c6065c fa451175 cf19e14a e0005004 20d0781f
ffff8101df0e3480 613450642 S Bo:4:055:6 -115 2043 = 7eff0300 21450005 dc02ea40 008006d2 9019e14a e0451175 cf042000 50db5c8d
ffff8101df0e3900 613450672 S Bi:4:055:5 -115 4096 <
ffff8101df0e3480 613453610 C Bo:4:055:6 0 2043 >
ffff8101df0e3480 613454824 S Bo:4:055:6 -115 2043 = 534f4357 48514a51 5459444b 4659444a 524c4258 49474750 52565353 4a4d514c
ffff8101df0e3480 613457602 C Bo:4:055:6 0 2043 >
ffff8101df0e3480 613459655 S Bo:4:055:6 -115 154 = 4d504b54 4c534f43 5748514a 51545944 4b465944 4a524c42 58494747 50525653
ffff8101df0e3480 613460596 C Bo:4:055:6 0 154 >
ffff8101df0e3480 613667052 S Bo:4:055:6 -115 56 = 7eff0300 21450000 3002ee40 008006df fe0a0002 0f0a0a01 c3042100 8b4efd98
ffff8101df0e3480 613667613 C Bo:4:055:6 0 56 >
ffff8101df0e3900 613706630 C Bi:4:055:5 0 48 = 7eff0300 21450000 2886fc00 00c6064e 32451175 cf19e14a e0005004 20d0781f
ffff8101df0e3900 613711288 S Bo:4:055:6 -115 2043 = 7eff0300 21450005 dc02ef40 008006d2 8b19e14a e0451175 cf042000 50db5c9d
ffff8101df0e3480 613711318 S Bi:4:055:5 -115 4096 <
ffff8101df0e3900 613714619 C Bo:4:055:6 0 2043 >
ffff8101df0e3900 613719251 S Bo:4:055:6 -115 2043 = 594c5150 47594244 464b4e46 59454955 54445746 55414c49 4455494b 584e485a
ffff8101df0e3900 613722620 C Bo:4:055:6 0 2043 >
ffff8101df0e3900 613725737 S Bo:4:055:6 -115 155 = 4e55524b 4c594c51 50475942 44464b4e 46594549 55544457 4655414c 49445549
ffff8101df0e3900 613726611 C Bo:4:055:6 0 155 >
ffff8101df0e3480 613827635 C Bi:4:055:5 0 48 = 7eff0300 21450000 288abc00 00c6064a 72451175 cf19e14a e0005004 1cbe4722
ffff8101df0e3480 613829800 S Bi:4:055:5 -115 4096 <
ffff8101df0e3480 613983642 C Bi:4:055:5 0 48 = 7eff0300 21450000 2894bc00 00c60640 72451175 cf19e14a e0005004 1cbe4722
ffff8101df0e3480 613985942 S Bo:4:055:6 -115 2043 = 7eff0300 21450005 dc02f240 008006d2 8819e14a e0451175 cf041c00 507b2765
ffff8101df0e3a80 613987485 S Bi:4:055:5 -115 4096 <
ffff8101df0e3480 613988633 C Bo:4:055:6 0 2043 >
ffff8101df0e3480 613989860 S Bo:4:055:6 -115 2043 = 544c534f 43574851 4a515459 444b4659 444a524c 42584947 47505256 53534a4d
ffff8101df0e3480 613992630 C Bo:4:055:6 0 2043 >
ffff8101df0e3480 613993721 S Bo:4:055:6 -115 155 = 44544d50 4b544c53 4f435748 514a5154 59444b46 59444a52 4c425849 47475052
ffff8101df0e3480 613994626 C Bo:4:055:6 0 155 >
ffff8101df0e3a80 614225652 C Bi:4:055:5 0 48 = 7eff0300 21450000 28a2c000 00c60632 6e451175 cf19e14a e0005004 1cbe4722
ffff8101df0e3a80 614229755 S Bi:4:055:5 -115 4096 <
ffff8101df0e3a80 614523670 C Bi:4:055:5 0 49 = 7eff0300 21450000 28b3a000 00c60621 8e451175 cf19e14a e0005004 20d0781f
ffff8101df0e3a80 614525892 S Bi:4:055:5 -115 4096 <
ffff8101df0e3a80 614626677 C Bi:4:055:5 0 48 = 7eff0300 21450000 28b8cc00 00c6061c 62451175 cf19e14a e0005004 20d0781f
ffff8101df0e3a80 614633515 S Bi:4:055:5 -115 4096 <
ffff8101df0e3a80 614667678 C Bi:4:055:5 0 49 = 7eff0300 21450000 28bc9400 00c60618 9a451175 cf19e14a e0005004 1cbe4722
ffff8101df0e3a80 614670934 S Bo:4:055:6 -115 2043 = 7eff0300 21450005 dc02f540 008006d2 8519e14a e0451175 cf041c00 507b2775
ffff8101df0e3480 614670964 S Bi:4:055:5 -115 4096 <
ffff8101df0e3a80 614673670 C Bo:4:055:6 0 2043 >
ffff8101df0e3a80 614677810 S Bo:4:055:6 -115 2043 = 4b4c594c 51504759 4244464b 4e465945 49555444 57465541 4c494455 494b584e
ffff8101df0e3a80 614680671 C Bo:4:055:6 0 2043 >
ffff8101df0e3a80 614681659 S Bo:4:055:6 -115 156 = 4657584e 55524b4c 594c5150 47594244 464b4e46 59454955 54445746 55414c49
ffff8101df0e3a80 614682664 C Bo:4:055:6 0 156 >
ffff8101df0e3480 614823693 C Bi:4:055:5 0 49 = 7eff0300 21450000 28c50000 00c60610 2e451175 cf19e14a e0005004 20d0781f
ffff810137f9aa80 614830352 S Bo:4:055:6 -115 434 = 7eff0300 21450001 aa02f840 008006d6 b419e14a e0451175 cf042000 50db5cad
ffff810137f9a180 614830424 S Bi:4:055:5 -115 4096 <
ffff810137f9aa80 614831677 C Bo:4:055:6 0 434 >
ffff810137f9a180 615166709 C Bi:4:055:5 0 48 = 7eff0300 21450000 28d8a400 00c606fc 89451175 cf19e14a e0005004 20d0781f
ffff810137f9a180 615169425 S Bi:4:055:5 -115 4096 <
ffff810137f9a180 615169706 C Bi:4:055:5 0 48 = 7eff0300 21450000 28d8a800 00c606fc 85451175 cf19e14a e0005004 1cbe4722
ffff810137f9a180 615171259 S Bi:4:055:5 -115 4096 <
ffff810137f9a180 615207719 C Bi:4:055:5 0 49 = 7eff0300 21450000 28d9ec00 00c606fb 41451175 cf19e14a e0005004 1cbe4722
ffff810137f9a180 615217972 S Bi:4:055:5 -115 4096 <
ffff810137f9a180 615363720 C Bi:4:055:5 0 48 = 7eff0300 21450000 28e55000 00c606ef dd451175 cf19e14a e0005004 1cbe4722
ffff8101df0e3a80 615365747 S Bo:4:055:6 -115 436 = 7eff0300 21450001 ab02f940 008006d6 b219e14a e0451175 cf041c00 507b2785
ffff8101df0e3900 615365771 S Bi:4:055:5 -115 4096 <
ffff8101df0e3a80 615366703 C Bo:4:055:6 0 436 >
ffff8101df0e3900 615511727 C Bi:4:055:5 0 49 = 7eff0300 21450000 28ecbc00 00c606e8 71451175 cf19e14a e0005004 1cbe4722
ffff8101df0e3900 615514439 S Bi:4:055:5 -115 4096 <
ffff8101df0e3900 615527727 C Bi:4:055:5 0 407 = 7eff0300 21450001 8fed3400 00c606e6 92451175 cf19e14a e0005004 20d0781f
ffff8101df0e3900 615542561 S Bi:4:055:5 -115 4096 <
ffff8101df0e3900 615647738 C Bi:4:055:5 0 407 = 7eff0300 21450001 8ff31c00 00c606e0 aa451175 cf19e14a e0005004 1cbe4722
ffff8101df0e3900 615663228 S Bi:4:055:5 -115 4096 <
ffff8101df0e3a80 615713769 S Bo:4:055:6 -115 48 = 7eff0300 21450000 2802fe40 008006d8 3019e14a e0451175 cf042000 50db5cae
ffff8101df0e3a80 615714721 C Bo:4:055:6 0 48 >
ffff8101df0e3a80 615797690 S Bo:4:055:6 -115 48 = 7eff0300 21450000 2802ff40 008006d8 2f19e14a e0451175 cf041c00 507b2787
ffff8101df0e3a80 615798727 C Bo:4:055:6 0 48 >
ffff8101df0e3a80 616574728 S Bo:4:055:6 -115 56 = 7eff0300 21450000 30030040 008006df ec0a0002 0f0a0a01 c3042100 8b4efd98
ffff8101df0e3a80 616575771 C Bo:4:055:6 0 56 >
ffff8101f4637b40 617606761 S Bo:4:055:6 -115 914 = 7eff0300 21450003 8a030340 008006d4 c919e14a e0451175 cf042000 50db5cae
ffff8101f4637b40 617608837 C Bo:4:055:6 0 914 >
ffff8101df0e3900 618151874 C Bi:4:055:5 0 701 = 7eff0300 21450002 b3975000 00c6063b 53451175 cf19e14a e0005004 20d07821
ffff8101f4637900 618159104 S Bi:4:055:5 -115 4096 <
ffff8101f4637cc0 618283168 S Bo:4:055:6 -115 48 = 7eff0300 21450000 28030640 008006d8 2819e14a e0451175 cf042000 50db5cb2
ffff8101f4637cc0 618283868 C Bo:4:055:6 0 48 >
ffff810137f5f600 622639553 S Bo:4:055:6 -115 56 = 7eff0300 21450000 30030940 008006df e30a0002 0f0a0a01 c3042100 8b4efd98
ffff810137f5f600 622641110 C Bo:4:055:6 0 56 >
