ffff81019bc91a80 3649171799 S Bo:4:080:6 -115 12 = 01000000 01000000 78563412
ffff8101483ec780 3649173638 C Bi:4:080:5 0 28 = 04000000 00000000 00000000 00000000 01000000 1c000000 78563412
ffff81019bc91a80 3649173645 C Bo:4:080:6 0 12 >
ffff81005c628e40 3649191494 S Bo:4:080:6 -115 28 = 00000000 23000000 03000000 00c20100 222c2277 61702e76 78563412
ffff81005c628900 3649191521 S Bi:4:080:5 -115 4096 <
ffff81005c628e40 3649192581 C Bo:4:080:6 0 28 >
ffff81005c628900 3649192605 C Bi:4:080:5 0 24 = 00000000 23000000 23000000 00c20100 18000000 78563412
ffff81005c628900 3649204470 S Bo:4:080:6 -115 3 = 41540d
ffff81005c628e40 3649204494 S Bi:4:080:5 -115 4096 <
ffff81005c628900 3649204584 C Bo:4:080:6 0 3 >
ffff81005c628e40 3649205595 C Bi:4:080:5 0 6 = 0d0a4f4b 0d0a
ffff81005c628e40 3649227050 S Bi:4:080:5 -115 4096 <
ffff81005c628900 3649244094 S Bo:4:080:6 -115 7 = 41544530 56310d
ffff81005c628900 3649244586 C Bo:4:080:6 0 7 >
ffff81005c628e40 3649245601 C Bi:4:080:5 0 6 = 0d0a4f4b 0d0a
ffff81005c628e40 3649249150 S Bi:4:080:5 -115 4096 <
ffff81005c628900 3649254062 S Bo:4:080:6 -115 3 = 41540d
ffff81005c628e40 3649254603 C Bi:4:080:5 0 6 = 0d0a4f4b 0d0a
ffff81005c628900 3649254609 C Bo:4:080:6 0 3 >
ffff81005c628900 3649258043 S Bi:4:080:5 -115 4096 <
ffff81005c628e40 3649266272 S Bo:4:080:6 -115 40 = 41542b63 6764636f 6e743d31 2c224950 222c2277 61702e76 6f696365 73747265
ffff81005c628e40 3649266587 C Bo:4:080:6 0 40 >
ffff81005c628900 3649267599 C Bi:4:080:5 0 6 = 0d0a4f4b 0d0a
ffff81005c628900 3649269991 S Bi:4:080:5 -115 4096 <
ffff81005c628e40 3649270997 S Bo:4:080:6 -115 7 = 41545330 3d300d
ffff81005c628900 3649271598 C Bi:4:080:5 0 6 = 0d0a4f4b 0d0a
ffff81005c628e40 3649271602 C Bo:4:080:6 0 7 >
ffff81005c628e40 3649275119 S Bo:4:080:6 -115 28 = 00000000 23000000 03000000 00c20100 222c2277 61702e76 78563412
ffff81005c628900 3649275139 S Bi:4:080:5 -115 4096 <
ffff81005c628e40 3649275581 C Bo:4:080:6 0 28 >
ffff81005c628900 3649275601 C Bi:4:080:5 0 24 = 00000000 23000000 23000000 00c20100 18000000 78563412
ffff81005c628900 3649276991 S Bi:4:080:5 -115 4096 <
ffff81005c628e40 3649281064 S Bo:4:080:6 -115 3 = 41540d
ffff81005c628900 3649281599 C Bi:4:080:5 0 6 = 0d0a4f4b 0d0a
ffff81005c628e40 3649281603 C Bo:4:080:6 0 3 >
ffff81005c628e40 3649285069 S Bi:4:080:5 -115 4096 <
ffff81005c628900 3649291962 S Bo:4:080:6 -115 7 = 41544530 56310d
ffff81005c628e40 3649292600 C Bi:4:080:5 0 6 = 0d0a4f4b 0d0a
ffff81005c628900 3649292604 C Bo:4:080:6 0 7 >
ffff81005c628900 3649294998 S Bi:4:080:5 -115 4096 <
ffff81005c628e40 3649301055 S Bo:4:080:6 -115 3 = 41540d
ffff81005c628900 3649301600 C Bi:4:080:5 0 6 = 0d0a4f4b 0d0a
ffff81005c628e40 3649301604 C Bo:4:080:6 0 3 >
ffff81005c628e40 3649305022 S Bi:4:080:5 -115 4096 <
ffff81005c628900 3649312956 S Bo:4:080:6 -115 40 = 41542b63 6764636f 6e743d31 2c224950 222c2277 61702e76 6f696365 73747265
ffff81005c628e40 3649313600 C Bi:4:080:5 0 6 = 0d0a4f4b 0d0a
ffff81005c628900 3649313605 C Bo:4:080:6 0 40 >
ffff81005c628900 3649317999 S Bi:4:080:5 -115 4096 <
ffff81005c628e40 3649321110 S Bo:4:080:6 -115 13 = 41544454 2a39392a 2a2a3123 0d
ffff81005c628e40 3649321584 C Bo:4:080:6 0 13 >
ffff81005c628900 3649322600 C Bi:4:080:5 0 11 = 0d0a434f 4e4e4543 540d0a
ffff81005c628900 3649324836 S Bi:4:080:5 -115 4096 <
ffff81019bc91480 3654356482 S Bo:4:080:6 -115 28 = 00000000 23000000 03000000 00c20100 222c2277 61702e76 78563412
ffff81005c628900 3654357894 C Bi:4:080:5 0 24 = 00000000 23000000 23000000 00c20100 18000000 78563412
ffff81019bc91480 3654357901 C Bo:4:080:6 0 28 >
ffff81019bc91900 3654372493 S Bo:4:080:6 -115 91 = 7eff7d23 c0217d21 7d207d20 327d227d 267d207d 207d207d 207d257d 262a9558
ffff81019bc91cc0 3654373459 S Bi:4:080:5 -115 4096 <
ffff81019bc91900 3654373870 C Bo:4:080:6 0 91 >
ffff81019bc91cc0 3654373891 C Bi:4:080:5 0 36 = 7eff7d23 c0217d21 7d207d20 7d2e7d22 7d267d20 7d207d20 7d207d23 7d24c023
ffff81019bc91cc0 3654375478 S Bo:4:080:6 -115 35 = 7eff7d23 c0217d22 7d207d20 7d2e7d22 7d267d20 7d207d20 7d207d23 7d24c023
ffff81019bc91cc0 3654375866 C Bo:4:080:6 0 35 >
ffff81019bc91cc0 3654376410 S Bi:4:080:5 -115 4096 <
ffff81019bc91cc0 3654376891 C Bi:4:080:5 0 79 = 7eff7d23 c0217d24 7d207d20 2c7d257d 262a9558 947d277d 227d287d 227d2d7d
ffff81019bc91cc0 3654379377 S Bo:4:080:6 -115 29 = 7eff7d23 c0217d21 7d217d20 7d2a7d22 7d267d20 7d207d20 7d20587b 7e
ffff81019bc91900 3654379431 S Bi:4:080:5 -115 4096 <
ffff81019bc91cc0 3654379867 C Bo:4:080:6 0 29 >
ffff81019bc91900 3654379887 C Bi:4:080:5 0 30 = 7eff7d23 c0217d22 7d217d20 7d2a7d22 7d267d20 7d207d20 7d20317d 2f7e
ffff81019bc91900 3654382409 S Bo:4:080:6 -115 95 = 7eff03c0 210c0200 122a9558 944d5352 41535635 2e303060 577e7eff 03c0210c
ffff81019bc91cc0 3654382461 S Bi:4:080:5 -115 4096 <
ffff81019bc91900 3654382867 C Bo:4:080:6 0 95 >
ffff81019bc91cc0 3654383934 C Bi:4:080:5 0 39 = 7eff7d23 c0217d27 7d217d20 7d367d2c 7d227d20 7d322a95 58944d53 52415356
ffff81019bc91cc0 3654385520 S Bi:4:080:5 -115 4096 <
ffff81019bc91cc0 3654385882 C Bi:4:080:5 0 51 = 7eff7d23 c0217d27 7d227d20 237d2c7d 237d207d 3f2a9558 944d5352 41532d31
ffff81019bc91cc0 3654387535 S Bi:4:080:5 -115 4096 <
ffff81019bc91cc0 3655206936 C Bi:4:080:5 0 12 = 7eff03c0 23020100 0494867e
ffff81010ef98e40 3655215499 S Bo:4:080:6 -115 66 = 7eff0380 fd010400 0a120600 000001bd c17e7eff 03802101 05002802 06002d0f
ffff81010ef989c0 3655215566 S Bi:4:080:5 -115 4096 <
ffff81010ef98e40 3655216916 C Bo:4:080:6 0 66 >
ffff81010ef989c0 3655216938 C Bi:4:080:5 0 40 = 7eff7d23 c0217d28 7d237d20 7d3080fd 7d217d24 7d207d2a 7d327d26 7d207d20
ffff81010ef989c0 3655222481 S Bi:4:080:5 -115 4096 <
ffff81010ef989c0 3655222931 C Bi:4:080:5 0 18 = 7eff0380 21010400 0a0306a9 fe01012b 957e
ffff81010ef989c0 3655226022 S Bo:4:080:6 -115 18 = 7eff0380 21020400 0a0306a9 fe010142 e17e
ffff81010ef98e40 3655226086 S Bi:4:080:5 -115 4096 <
ffff81010ef989c0 3655226914 C Bo:4:080:6 0 18 >
ffff81010ef98e40 3655226935 C Bi:4:080:5 0 30 = 7eff0380 21040500 16020600 2d0f0182 06000000 00840600 0000007c 9f7e
ffff81010ef98e40 3655228943 S Bo:4:080:6 -115 30 = 7eff0380 21010600 16030600 00000081 06000000 00830600 0000006a 5f7e
ffff81010ef989c0 3655228997 S Bi:4:080:5 -115 4096 <
ffff81010ef98e40 3655229913 C Bo:4:080:6 0 30 >
ffff81010ef989c0 3655229933 C Bi:4:080:5 0 30 = 7eff0380 21030600 16030619 e123e581 06425e09 78830642 5e1978a9 577e
ffff81010ef989c0 3655230985 S Bi:4:080:5 -115 4096 <
ffff81010ef98e40 3655232020 S Bo:4:080:6 -115 30 = 7eff0380 21010700 16030619 e123e581 06425e09 78830642 5e19786e 3a7e
ffff81010ef989c0 3655232930 C Bi:4:080:5 0 30 = 7eff0380 21020700 16030619 e123e581 06425e09 78830642 5e197898 c97e
ffff81010ef98e40 3655232935 C Bo:4:080:6 0 30 >
ffff81010ef98e40 3655251665 S Bi:4:080:5 -115 4096 <
ffff8101fd278300 3655427335 S Bo:4:080:6 -115 336 = 7eff0300 21450001 48029d00 008011f9 4219e123 e5ffffff ff004400 4301342a
ffff8101fd278300 3655427932 C Bo:4:080:6 0 336 >
ffff81004a3a39c0 3659385555 S Bo:4:080:6 -115 336 = 7eff0300 21450001 48029e00 008011f9 4119e123 e5ffffff ff004400 43013426
ffff81004a3a39c0 3659387151 C Bo:4:080:6 0 336 >
ffff8101a9fb4f00 3668696452 S Bo:4:080:6 -115 34 = 7eff7d23 c0217d25 7d287d20 7d302a95 58947d20 3ccd747d 207d207d 207d20f9
ffff81010ef98e40 3668697681 C Bi:4:080:5 0 18 = 7eff7d23 c0217d26 7d287d20 7d24ee7d 5e7e
ffff8101a9fb4f00 3668697686 C Bo:4:080:6 0 34 >
ffff8101a9fb4f00 3668720579 S Bi:4:080:5 -115 4096 <
ffff8101a9fb4e40 3668762057 S Bo:4:080:6 -115 4 = 4154480d
ffff8101a9fb4f00 3668762698 C Bi:4:080:5 0 6 = 0d0a4f4b 0d0a
ffff8101a9fb4e40 3668762705 C Bo:4:080:6 0 4 >
ffff8101a9fb4e40 3668780361 S Bo:4:080:6 -115 28 = 00000000 23000000 03000000 00c20100 58947d20 3ccd747d 78563412
ffff8101a9fb4f00 3668780428 S Bi:4:080:5 -115 4096 <
ffff8101a9fb4e40 3668781711 C Bo:4:080:6 0 28 >
ffff8101a9fb4f00 3668784697 C Bi:4:080:5 0 24 = 00000000 23000000 23000000 00c20100 18000000 78563412
ffff8101a9fb4f00 3668790259 S Bo:4:080:6 -115 3 = 41540d
ffff8101a9fb4e40 3668790330 S Bi:4:080:5 -115 4096 <
ffff8101a9fb4f00 3668790674 C Bo:4:080:6 0 3 >
ffff8101a9fb4e40 3668791695 C Bi:4:080:5 0 6 = 0d0a4f4b 0d0a
ffff8101a9fb4e40 3668795291 S Bi:4:080:5 -115 4096 <
ffff8101a9fb4f00 3668797302 S Bo:4:080:6 -115 7 = 41544530 56310d
ffff8101a9fb4e40 3668797752 C Bi:4:080:5 0 6 = 0d0a4f4b 0d0a
ffff8101a9fb4f00 3668797757 C Bo:4:080:6 0 7 >
ffff8101a9fb4f00 3668800306 S Bi:4:080:5 -115 4096 <
ffff810189faa0c0 3668808962 S Bo:4:080:6 -115 3 = 41540d
ffff8101a9fb4f00 3668809690 C Bi:4:080:5 0 6 = 0d0a4f4b 0d0a
ffff810189faa0c0 3668809697 C Bo:4:080:6 0 3 >
ffff810189faa0c0 3668812874 S Bi:4:080:5 -115 4096 <
ffff810189faa3c0 3668817118 S Bo:4:080:6 -115 40 = 41542b63 6764636f 6e743d31 2c224950 222c2277 61702e76 6f696365 73747265
ffff810189faa0c0 3668817688 C Bi:4:080:5 0 6 = 0d0a4f4b 0d0a
ffff810189faa3c0 3668817693 C Bo:4:080:6 0 40 >
ffff810189faa3c0 3668821029 S Bi:4:080:5 -115 4096 <
ffff810189faa0c0 3668827861 S Bo:4:080:6 -115 7 = 41545330 3d300d
ffff810189faa3c0 3668828690 C Bi:4:080:5 0 6 = 0d0a4f4b 0d0a
ffff810189faa0c0 3668828696 C Bo:4:080:6 0 7 >
ffff810189faa0c0 3668831964 S Bi:4:080:5 -115 4096 <
ffff810189faa3c0 3668840949 S Bo:4:080:6 -115 12 = 01000000 00000000 78563412
ffff810189faa3c0 3668841673 C Bo:4:080:6 0 12 >
ffff810189faa3c0 3668843922 S Bo:4:080:6 -115 28 = 00000000 23000000 00000000 00c20100 222c2277 61702e76 78563412
ffff810189faa3c0 3668844671 C Bo:4:080:6 0 28 >
ffff810189faa300 3681086313 S Co:4:001:0 s 23 03 0004 0001 0000 0
ffff810189faa300 3681086322 C Co:4:001:0 0 0
ffff81012d59eb40 3681089373 C Bi:4:080:7 -84 0
ffff8101eb77bc00 3681089396 C Bi:4:080:3 -84 0
ffff810189faa0c0 3681089416 C Bi:4:080:5 -84 0
ffff810189faa600 3681140404 S Ci:4:001:0 s a3 00 0000 0001 0004 4 <
ffff810189faa600 3681140428 C Ci:4:001:0 0 4 = 03010000
ffff810189faa600 3681196397 S Co:4:001:0 s 23 01 0014 0001 0000 0
ffff810189faa600 3681196404 C Co:4:001:0 0 0
ffff810189faa600 3681196421 S Ci:4:000:0 s 80 06 0100 0000 0040 64 <
ffff810189faa600 3681200366 C Ci:4:000:0 0 16 = 12011001 00000010 ca0f0400 07010105
ffff810189faa600 3681200378 S Co:4:001:0 s 23 03 0004 0001 0000 0
ffff810189faa600 3681200389 C Co:4:001:0 0 0
ffff810189faa600 3681256402 S Ci:4:001:0 s a3 00 0000 0001 0004 4 <
ffff810189faa600 3681256427 C Ci:4:001:0 0 4 = 03010000
ffff810189faa600 3681312401 S Co:4:001:0 s 23 01 0014 0001 0000 0
ffff810189faa600 3681312407 C Co:4:001:0 0 0
ffff810189faa600 3681312413 S Co:4:000:0 s 00 05 0050 0000 0000 0
ffff810189faa600 3681315371 C Co:4:000:0 0 0
ffff81018515af00 3681331891 S Ci:4:080:0 s 80 06 0100 0000 0012 18 <
ffff81018515af00 3681336367 C Ci:4:080:0 0 18 = 12011001 00000010 ca0f0400 07010105 0301
ffff81018515af00 3681336378 S Ci:4:080:0 s 80 06 0200 0000 0061 97 <
ffff81018515af00 3681346367 C Ci:4:080:0 0 97 = 09026100 02010080 fa090400 0008ff01 ff020705 81024000 00070502 02400000
ffff81018515af00 3681346375 S Co:4:080:0 s 00 09 0001 0000 0000 0
ffff81018515af00 3681349366 C Co:4:080:0 0 0
ffff81018515af00 3681349374 S Co:4:080:0 s 01 0b 0000 0000 0000 0
ffff81018515af00 3681351367 C Co:4:080:0 0 0
ffff81018515af00 3681351380 S Co:4:080:0 s 01 0b 0000 0001 0000 0
ffff81018515af00 3681352366 C Co:4:080:0 0 0
ffff81018515af00 3681352594 S Co:4:080:0 s 01 0b 0000 0000 0000 0
ffff81018515af00 3681353367 C Co:4:080:0 0 0
ffff81018515af00 3681353396 S Co:4:080:0 s 01 0b 0000 0001 0000 0
ffff81018515af00 3681354366 C Co:4:080:0 0 0
