ffff8101df3ef780 3328000447 S Bo:4:080:10 -115 31 = 55534243 100e0000 00000000 00000600 00000000 00000000 00000000 000000
ffff8101df3ef780 3328001694 C Bo:4:080:10 0 31 >
ffff8101df3ef780 3328001703 S Bi:4:080:9 -115 13 <
ffff8101df3ef780 3328002692 C Bi:4:080:9 0 13 = 55534253 100e0000 00000000 01
ffff8101df3ef780 3328002700 S Bo:4:080:10 -115 31 = 55534243 110e0000 12000000 80000603 00000012 00000000 00000000 000000
ffff8101df3ef780 3328003692 C Bo:4:080:10 0 31 >
ffff8101df178b40 3328003702 S Bi:4:080:9 -115 18 <
ffff8101df178b40 3328004695 C Bi:4:080:9 0 18 = 70000200 0000000a 00000000 3a000000 0000
ffff8101df3ef780 3328004745 S Bi:4:080:9 -115 13 <
ffff8101df3ef780 3328005693 C Bi:4:080:9 0 13 = 55534253 110e0000 00000000 00
ffff8101df3ef780 3328005736 S Bo:4:080:10 -115 31 = 55534243 120e0000 00000000 00000600 00000000 00000000 00000000 000000
ffff8101df3ef780 3328006692 C Bo:4:080:10 0 31 >
ffff8101df3ef780 3328006699 S Bi:4:080:9 -115 13 <
ffff8101df3ef780 3328007692 C Bi:4:080:9 0 13 = 55534253 120e0000 00000000 01
ffff8101df3ef780 3328007699 S Bo:4:080:10 -115 31 = 55534243 130e0000 12000000 80000603 00000012 00000000 00000000 000000
ffff8101df3ef780 3328008695 C Bo:4:080:10 0 31 >
ffff81019bd71840 3328008708 S Bi:4:080:9 -115 18 <
ffff81019bd71840 3328009692 C Bi:4:080:9 0 18 = 70000200 0000000a 00000000 3a000000 0000
ffff8101df3ef780 3328009700 S Bi:4:080:9 -115 13 <
ffff8101df3ef780 3328010693 C Bi:4:080:9 0 13 = 55534253 130e0000 00000000 00
ffff8101df3ef780 3330000445 S Bo:4:080:10 -115 31 = 55534243 140e0000 00000000 00000600 00000000 00000000 00000000 000000
ffff8101df3ef780 3330001807 C Bo:4:080:10 0 31 >
ffff8101df3ef780 3330001815 S Bi:4:080:9 -115 13 <
ffff8101df3ef780 3330002805 C Bi:4:080:9 0 13 = 55534253 140e0000 00000000 01
ffff8101df3ef780 3330002813 S Bo:4:080:10 -115 31 = 55534243 150e0000 12000000 80000603 00000012 00000000 00000000 000000
ffff8101df3ef780 3330003803 C Bo:4:080:10 0 31 >
ffff81019bd71240 3330003813 S Bi:4:080:9 -115 18 <
ffff81019bd71240 3330004804 C Bi:4:080:9 0 18 = 70000200 0000000a 00000000 3a000000 0000
ffff8101df3ef780 3330004813 S Bi:4:080:9 -115 13 <
ffff8101df3ef780 3330005804 C Bi:4:080:9 0 13 = 55534253 150e0000 00000000 00
ffff8101df3ef780 3330005843 S Bo:4:080:10 -115 31 = 55534243 160e0000 00000000 00000600 00000000 00000000 00000000 000000
ffff8101df3ef780 3330006803 C Bo:4:080:10 0 31 >
ffff8101df3ef780 3330006809 S Bi:4:080:9 -115 13 <
ffff8101df3ef780 3330007804 C Bi:4:080:9 0 13 = 55534253 160e0000 00000000 01
ffff8101df3ef780 3330007810 S Bo:4:080:10 -115 31 = 55534243 170e0000 12000000 80000603 00000012 00000000 00000000 000000
ffff8101df3ef780 3330008804 C Bo:4:080:10 0 31 >
ffff81019bd71240 3330008812 S Bi:4:080:9 -115 18 <
ffff81019bd71240 3330009804 C Bi:4:080:9 0 18 = 70000200 0000000a 00000000 3a000000 0000
ffff8101df3ef780 3330009811 S Bi:4:080:9 -115 13 <
ffff8101df3ef780 3330010804 C Bi:4:080:9 0 13 = 55534253 170e0000 00000000 00
ffff8101df3ef780 3332000441 S Bo:4:080:10 -115 31 = 55534243 180e0000 00000000 00000600 00000000 00000000 00000000 000000
ffff8101df3ef780 3332001917 C Bo:4:080:10 0 31 >
ffff8101df3ef780 3332001924 S Bi:4:080:9 -115 13 <
ffff8101df3ef780 3332002916 C Bi:4:080:9 0 13 = 55534253 180e0000 00000000 01
ffff8101df3ef780 3332002923 S Bo:4:080:10 -115 31 = 55534243 190e0000 12000000 80000603 00000012 00000000 00000000 000000
ffff8101df3ef780 3332003915 C Bo:4:080:10 0 31 >
ffff81019bd71240 3332003924 S Bi:4:080:9 -115 18 <
ffff81019bd71240 3332004915 C Bi:4:080:9 0 18 = 70000200 0000000a 00000000 3a000000 0000
ffff8101df3ef780 3332004923 S Bi:4:080:9 -115 13 <
ffff8101df3ef780 3332005915 C Bi:4:080:9 0 13 = 55534253 190e0000 00000000 00
ffff8101df3ef780 3332005953 S Bo:4:080:10 -115 31 = 55534243 1a0e0000 00000000 00000600 00000000 00000000 00000000 000000
ffff8101df3ef780 3332006915 C Bo:4:080:10 0 31 >
ffff8101df3ef780 3332006921 S Bi:4:080:9 -115 13 <
ffff8101df3ef780 3332007915 C Bi:4:080:9 0 13 = 55534253 1a0e0000 00000000 01
ffff8101df3ef780 3332007921 S Bo:4:080:10 -115 31 = 55534243 1b0e0000 12000000 80000603 00000012 00000000 00000000 000000
ffff8101df3ef780 3332008915 C Bo:4:080:10 0 31 >
ffff81019bd71240 3332008923 S Bi:4:080:9 -115 18 <
ffff81019bd71240 3332009915 C Bi:4:080:9 0 18 = 70000200 0000000a 00000000 3a000000 0000
ffff8101df3ef780 3332009922 S Bi:4:080:9 -115 13 <
ffff8101df3ef780 3332010915 C Bi:4:080:9 0 13 = 55534253 1b0e0000 00000000 00
ffff8101df3ef780 3334000433 S Bo:4:080:10 -115 31 = 55534243 1c0e0000 00000000 00000600 00000000 00000000 00000000 000000
ffff8101df3ef780 3334002040 C Bo:4:080:10 0 31 >
ffff8101df3ef780 3334002049 S Bi:4:080:9 -115 13 <
ffff8101df3ef780 3334003027 C Bi:4:080:9 0 13 = 55534253 1c0e0000 00000000 01
ffff8101df3ef780 3334003035 S Bo:4:080:10 -115 31 = 55534243 1d0e0000 12000000 80000603 00000012 00000000 00000000 000000
ffff8101df3ef780 3334004027 C Bo:4:080:10 0 31 >
ffff8101853ca3c0 3334004037 S Bi:4:080:9 -115 18 <
ffff8101853ca3c0 3334005026 C Bi:4:080:9 0 18 = 70000200 0000000a 00000000 3a000000 0000
ffff8101df3ef780 3334005034 S Bi:4:080:9 -115 13 <
ffff8101df3ef780 3334006026 C Bi:4:080:9 0 13 = 55534253 1d0e0000 00000000 00
ffff8101df3ef780 3334006063 S Bo:4:080:10 -115 31 = 55534243 1e0e0000 00000000 00000600 00000000 00000000 00000000 000000
ffff8101df3ef780 3334007027 C Bo:4:080:10 0 31 >
ffff8101df3ef780 3334007033 S Bi:4:080:9 -115 13 <
ffff8101df3ef780 3334008027 C Bi:4:080:9 0 13 = 55534253 1e0e0000 00000000 01
ffff8101df3ef780 3334008033 S Bo:4:080:10 -115 31 = 55534243 1f0e0000 12000000 80000603 00000012 00000000 00000000 000000
ffff8101df3ef780 3334009027 C Bo:4:080:10 0 31 >
ffff8101853ca3c0 3334009056 S Bi:4:080:9 -115 18 <
ffff8101853ca3c0 3334010027 C Bi:4:080:9 0 18 = 70000200 0000000a 00000000 3a000000 0000
ffff8101df3ef780 3334010049 S Bi:4:080:9 -115 13 <
ffff8101df3ef780 3334011027 C Bi:4:080:9 0 13 = 55534253 1f0e0000 00000000 00
ffff8101df3ef780 3336000449 S Bo:4:080:10 -115 31 = 55534243 200e0000 00000000 00000600 00000000 00000000 00000000 000000
ffff8101df3ef780 3336002143 C Bo:4:080:10 0 31 >
ffff8101df3ef780 3336002169 S Bi:4:080:9 -115 13 <
ffff8101df3ef780 3336003138 C Bi:4:080:9 0 13 = 55534253 200e0000 00000000 01
ffff8101df3ef780 3336003146 S Bo:4:080:10 -115 31 = 55534243 210e0000 12000000 80000603 00000012 00000000 00000000 000000
ffff8101df3ef780 3336004138 C Bo:4:080:10 0 31 >
ffff81008b6eff00 3336004149 S Bi:4:080:9 -115 18 <
ffff81008b6eff00 3336005146 C Bi:4:080:9 0 18 = 70000200 0000000a 00000000 3a000000 0000
ffff8101df3ef780 3336005156 S Bi:4:080:9 -115 13 <
ffff8101df3ef780 3336006138 C Bi:4:080:9 0 13 = 55534253 210e0000 00000000 00
ffff8101df3ef780 3336006189 S Bo:4:080:10 -115 31 = 55534243 220e0000 00000000 00000600 00000000 00000000 00000000 000000
ffff8101df3ef780 3336007139 C Bo:4:080:10 0 31 >
ffff8101df3ef780 3336007146 S Bi:4:080:9 -115 13 <
ffff8101df3ef780 3336008139 C Bi:4:080:9 0 13 = 55534253 220e0000 00000000 01
ffff8101df3ef780 3336008147 S Bo:4:080:10 -115 31 = 55534243 230e0000 12000000 80000603 00000012 00000000 00000000 000000
ffff8101df3ef780 3336009138 C Bo:4:080:10 0 31 >
ffff8101ef17b900 3336009147 S Bi:4:080:9 -115 18 <
ffff8101ef17b900 3336010138 C Bi:4:080:9 0 18 = 70000200 0000000a 00000000 3a000000 0000
ffff8101df3ef780 3336010146 S Bi:4:080:9 -115 13 <
ffff8101df3ef780 3336011137 C Bi:4:080:9 0 13 = 55534253 230e0000 00000000 00
ffff8101df3ef780 3338000446 S Bo:4:080:10 -115 31 = 55534243 240e0000 00000000 00000600 00000000 00000000 00000000 000000
ffff8101df3ef780 3338002251 C Bo:4:080:10 0 31 >
ffff8101df3ef780 3338002260 S Bi:4:080:9 -115 13 <
ffff8101df3ef780 3338003250 C Bi:4:080:9 0 13 = 55534253 240e0000 00000000 01
ffff8101df3ef780 3338003257 S Bo:4:080:10 -115 31 = 55534243 250e0000 12000000 80000603 00000012 00000000 00000000 000000
ffff8101df3ef780 3338004249 C Bo:4:080:10 0 31 >
ffff81012d59e240 3338004258 S Bi:4:080:9 -115 18 <
ffff81012d59e240 3338005249 C Bi:4:080:9 0 18 = 70000200 0000000a 00000000 3a000000 0000
ffff8101df3ef780 3338005257 S Bi:4:080:9 -115 13 <
ffff8101df3ef780 3338006249 C Bi:4:080:9 0 13 = 55534253 250e0000 00000000 00
ffff8101df3ef780 3338006287 S Bo:4:080:10 -115 31 = 55534243 260e0000 00000000 00000600 00000000 00000000 00000000 000000
ffff8101df3ef780 3338007249 C Bo:4:080:10 0 31 >
ffff8101df3ef780 3338007255 S Bi:4:080:9 -115 13 <
ffff8101df3ef780 3338008249 C Bi:4:080:9 0 13 = 55534253 260e0000 00000000 01
ffff8101df3ef780 3338008255 S Bo:4:080:10 -115 31 = 55534243 270e0000 12000000 80000603 00000012 00000000 00000000 000000
ffff8101df3ef780 3338009249 C Bo:4:080:10 0 31 >
ffff81012d59e240 3338009256 S Bi:4:080:9 -115 18 <
ffff81012d59e240 3338010249 C Bi:4:080:9 0 18 = 70000200 0000000a 00000000 3a000000 0000
ffff8101df3ef780 3338010256 S Bi:4:080:9 -115 13 <
ffff8101df3ef780 3338011249 C Bi:4:080:9 0 13 = 55534253 270e0000 00000000 00
ffff8101df3ef780 3340000452 S Bo:4:080:10 -115 31 = 55534243 280e0000 00000000 00000600 00000000 00000000 00000000 000000
ffff8101df3ef780 3340002362 C Bo:4:080:10 0 31 >
ffff8101df3ef780 3340002420 S Bi:4:080:9 -115 13 <
ffff8101df3ef780 3340003362 C Bi:4:080:9 0 13 = 55534253 280e0000 00000000 01
ffff8101df3ef780 3340003370 S Bo:4:080:10 -115 31 = 55534243 290e0000 12000000 80000603 00000012 00000000 00000000 000000
ffff8101df3ef780 3340004360 C Bo:4:080:10 0 31 >
ffff810037aafd80 3340004369 S Bi:4:080:9 -115 18 <
ffff810037aafd80 3340005361 C Bi:4:080:9 0 18 = 70000200 0000000a 00000000 3a000000 0000
ffff8101df3ef780 3340005368 S Bi:4:080:9 -115 13 <
ffff8101df3ef780 3340006393 C Bi:4:080:9 0 13 = 55534253 290e0000 00000000 00
ffff8101df3ef780 3340006438 S Bo:4:080:10 -115 31 = 55534243 2a0e0000 00000000 00000600 00000000 00000000 00000000 000000
ffff8101df3ef780 3340007361 C Bo:4:080:10 0 31 >
ffff8101df3ef780 3340007369 S Bi:4:080:9 -115 13 <
ffff8101df3ef780 3340008361 C Bi:4:080:9 0 13 = 55534253 2a0e0000 00000000 01
ffff8101df3ef780 3340008369 S Bo:4:080:10 -115 31 = 55534243 2b0e0000 12000000 80000603 00000012 00000000 00000000 000000
ffff8101df3ef780 3340009360 C Bo:4:080:10 0 31 >
ffff810037aafd80 3340009368 S Bi:4:080:9 -115 18 <
ffff810037aafd80 3340010361 C Bi:4:080:9 0 18 = 70000200 0000000a 00000000 3a000000 0000
ffff8101df3ef780 3340010369 S Bi:4:080:9 -115 13 <
ffff8101df3ef780 3340011361 C Bi:4:080:9 0 13 = 55534253 2b0e0000 00000000 00
ffff8101df3ef780 3342000443 S Bo:4:080:10 -115 31 = 55534243 2c0e0000 00000000 00000600 00000000 00000000 00000000 000000
ffff8101df3ef780 3342001474 C Bo:4:080:10 0 31 >
ffff8101df3ef780 3342001481 S Bi:4:080:9 -115 13 <
ffff8101df3ef780 3342002473 C Bi:4:080:9 0 13 = 55534253 2c0e0000 00000000 01
ffff8101df3ef780 3342002480 S Bo:4:080:10 -115 31 = 55534243 2d0e0000 12000000 80000603 00000012 00000000 00000000 000000
ffff8101df3ef780 3342003471 C Bo:4:080:10 0 31 >
ffff81019bcb6a80 3342003482 S Bi:4:080:9 -115 18 <
ffff81019bcb6a80 3342004473 C Bi:4:080:9 0 18 = 70000200 0000000a 00000000 3a000000 0000
ffff8101df3ef780 3342004484 S Bi:4:080:9 -115 13 <
ffff8101df3ef780 3342005472 C Bi:4:080:9 0 13 = 55534253 2d0e0000 00000000 00
ffff8101df3ef780 3342005512 S Bo:4:080:10 -115 31 = 55534243 2e0e0000 00000000 00000600 00000000 00000000 00000000 000000
ffff8101df3ef780 3342006472 C Bo:4:080:10 0 31 >
ffff8101df3ef780 3342006478 S Bi:4:080:9 -115 13 <
ffff8101df3ef780 3342007472 C Bi:4:080:9 0 13 = 55534253 2e0e0000 00000000 01
ffff8101df3ef780 3342007480 S Bo:4:080:10 -115 31 = 55534243 2f0e0000 12000000 80000603 00000012 00000000 00000000 000000
ffff8101df3ef780 3342008472 C Bo:4:080:10 0 31 >
ffff81020e615840 3342008485 S Bi:4:080:9 -115 18 <
ffff81020e615840 3342009472 C Bi:4:080:9 0 18 = 70000200 0000000a 00000000 3a000000 0000
ffff8101df3ef780 3342009480 S Bi:4:080:9 -115 13 <
ffff8101df3ef780 3342010472 C Bi:4:080:9 0 13 = 55534253 2f0e0000 00000000 00
ffff8101df3ef780 3344000646 S Bo:4:080:10 -115 31 = 55534243 300e0000 00000000 00000600 00000000 00000000 00000000 000000
ffff8101df3ef780 3344002585 C Bo:4:080:10 0 31 >
ffff8101df3ef780 3344002609 S Bi:4:080:9 -115 13 <
ffff8101df3ef780 3344003583 C Bi:4:080:9 0 13 = 55534253 300e0000 00000000 01
ffff8101df3ef780 3344003611 S Bo:4:080:10 -115 31 = 55534243 310e0000 12000000 80000603 00000012 00000000 00000000 000000
ffff8101df3ef780 3344004586 C Bo:4:080:10 0 31 >
ffff81018530b900 3344004666 S Bi:4:080:9 -115 18 <
ffff81018530b900 3344005584 C Bi:4:080:9 0 18 = 70000200 0000000a 00000000 3a000000 0000
ffff8101df3ef780 3344005623 S Bi:4:080:9 -115 13 <
ffff8101df3ef780 3344006584 C Bi:4:080:9 0 13 = 55534253 310e0000 00000000 00
ffff8101df3ef780 3344006669 S Bo:4:080:10 -115 31 = 55534243 320e0000 00000000 00000600 00000000 00000000 00000000 000000
ffff8101df3ef780 3344007585 C Bo:4:080:10 0 31 >
ffff8101df3ef780 3344007615 S Bi:4:080:9 -115 13 <
ffff8101df3ef780 3344008584 C Bi:4:080:9 0 13 = 55534253 320e0000 00000000 01
ffff8101df3ef780 3344008606 S Bo:4:080:10 -115 31 = 55534243 330e0000 12000000 80000603 00000012 00000000 00000000 000000
ffff8101df3ef780 3344009583 C Bo:4:080:10 0 31 >
ffff81018530b900 3344009637 S Bi:4:080:9 -115 18 <
ffff81018530b900 3344010584 C Bi:4:080:9 0 18 = 70000200 0000000a 00000000 3a000000 0000
ffff8101df3ef780 3344010607 S Bi:4:080:9 -115 13 <
ffff8101df3ef780 3344011585 C Bi:4:080:9 0 13 = 55534253 330e0000 00000000 00
ffff8102044dbe40 3345276526 S Ci:4:080:0 s 80 06 0100 0000 0012 18 <
ffff8102044dbe40 3345277658 C Ci:4:080:0 0 18 = 12011001 00000010 ca0f0400 07010105 0301
ffff8102044dbe40 3345277694 S Ci:4:080:0 s 80 06 0200 0000 0009 9 <
ffff8102044dbe40 3345278655 C Ci:4:080:0 0 9 = 09026100 02010080 fa
ffff8102044dbe40 3345278682 S Ci:4:080:0 s 80 06 0200 0000 0061 97 <
ffff8102044dbe40 3345279656 C Ci:4:080:0 0 97 = 09026100 02010080 fa090400 0008ff01 ff020705 81024000 00070502 02400000
ffff8101483ecd80 3345281068 S Co:4:080:0 s 01 0b 0000 0001 0000 0
ffff8101483ecd80 3345281664 C Co:4:080:0 0 0
ffff8101483ec900 3365391518 S Ci:4:080:0 s 80 06 0100 0000 0040 64 <
ffff8101483ec900 3365393776 C Ci:4:080:0 0 18 = 12011001 00000010 ca0f0400 07010105 0301
ffff8101483ec900 3365441391 S Ci:4:080:0 s 80 06 0100 0000 0012 18 <
ffff8101483ec900 3365442782 C Ci:4:080:0 0 18 = 12011001 00000010 ca0f0400 07010105 0301
ffff8101483ec900 3365444979 S Ci:4:080:0 s 80 06 0200 0000 0009 9 <
ffff8101483ec900 3365445779 C Ci:4:080:0 0 9 = 09026100 02010080 fa
ffff8101483ec900 3365449532 S Ci:4:080:0 s 80 06 0300 0000 00ff 255 <
ffff8101483ec900 3365450778 C Ci:4:080:0 0 4 = 04030904
ffff8101483ec900 3365453377 S Ci:4:080:0 s 80 06 0303 0409 00ff 255 <
ffff8101483ec900 3365454787 C Ci:4:080:0 0 82 = 52033200 42004500 34003100 33003400 35003000 34004200 38004600 30003800
ffff8101483ec900 3365466386 S Ci:4:080:0 s 80 06 0200 0000 00ff 255 <
ffff8101483ec900 3365468779 C Ci:4:080:0 0 97 = 09026100 02010080 fa090400 0008ff01 ff020705 81024000 00070502 02400000
ffff8101483ec900 3365476821 S Ci:4:080:0 s 80 06 0300 0000 00ff 255 <
ffff8101483ec900 3365478779 C Ci:4:080:0 0 4 = 04030904
ffff8101483ec900 3365481774 S Ci:4:080:0 s 80 06 0305 0409 00ff 255 <
ffff8101483ec900 3365483782 C Ci:4:080:0 0 42 = 2a035200 49004d00 20004300 6f006d00 70006f00 73006900 74006500 20004400
ffff8101483ec900 3365484852 S Ci:4:080:0 s 80 06 0300 0000 00ff 255 <
ffff8101483ec900 3365486780 C Ci:4:080:0 0 4 = 04030904
ffff8101483ec900 3365489388 S Ci:4:080:0 s 80 06 0305 0409 00ff 255 <
ffff8101483ec900 3365490780 C Ci:4:080:0 0 42 = 2a035200 49004d00 20004300 6f006d00 70006f00 73006900 74006500 20004400
ffff8101483ec900 3365539388 S Ci:4:080:0 s 80 06 0100 0000 0012 18 <
ffff8101483ec900 3365540787 C Ci:4:080:0 0 18 = 12011001 00000010 ca0f0400 07010105 0301
ffff8101483ec900 3365543966 S Ci:4:080:0 s 80 06 0200 0000 00ff 255 <
ffff8101483ec900 3365545783 C Ci:4:080:0 0 97 = 09026100 02010080 fa090400 0008ff01 ff020705 81024000 00070502 02400000
ffff8101483ec900 3365562455 S Ci:4:080:0 s 80 06 0300 0000 00ff 255 <
ffff8101483ec900 3365564785 C Ci:4:080:0 0 4 = 04030904
ffff8101483ec900 3365568427 S Ci:4:080:0 s 80 06 0305 0409 00ff 255 <
ffff8101483ec900 3365569785 C Ci:4:080:0 0 42 = 2a035200 49004d00 20004300 6f006d00 70006f00 73006900 74006500 20004400
ffff8101483ec900 3365572571 S Ci:4:080:0 s 80 06 0300 0000 00ff 255 <
ffff8101483ec900 3365573785 C Ci:4:080:0 0 4 = 04030904
ffff8101483ec900 3365576426 S Ci:4:080:0 s 80 06 0305 0409 00ff 255 <
ffff8101483ec900 3365577785 C Ci:4:080:0 0 42 = 2a035200 49004d00 20004300 6f006d00 70006f00 73006900 74006500 20004400
ffff8101483ec900 3365594441 S Ci:4:080:0 s 80 06 0300 0000 00ff 255 <
ffff8101483ec900 3365596787 C Ci:4:080:0 0 4 = 04030904
ffff8101483ec900 3365609289 S Ci:4:080:0 s 80 06 0305 0409 00ff 255 <
ffff8101483ec900 3365611787 C Ci:4:080:0 0 42 = 2a035200 49004d00 20004300 6f006d00 70006f00 73006900 74006500 20004400
ffff8101483ec900 3365612479 S Ci:4:080:0 s 80 06 0300 0000 00ff 255 <
ffff8101483ec900 3365613788 C Ci:4:080:0 0 4 = 04030904
ffff8101483ec900 3365616456 S Ci:4:080:0 s 80 06 0305 0409 00ff 255 <
ffff8101483ec900 3365617787 C Ci:4:080:0 0 42 = 2a035200 49004d00 20004300 6f006d00 70006f00 73006900 74006500 20004400
ffff8101483ec900 3365665803 S Ci:4:080:0 s 80 06 0100 0000 0012 18 <
ffff8101483ec900 3365667794 C Ci:4:080:0 0 18 = 12011001 00000010 ca0f0400 07010105 0301
ffff8101483ec900 3365668397 S Ci:4:080:0 s 80 06 0300 0000 0002 2 <
ffff8101483ec900 3365668792 C Ci:4:080:0 0 2 = 0403
ffff8101483ec900 3365672582 S Ci:4:080:0 s 80 06 0300 0000 0004 4 <
ffff8101483ec900 3365672794 C Ci:4:080:0 0 4 = 04030904
ffff8101483ec900 3365674742 S Ci:4:080:0 s 80 06 0303 0409 0002 2 <
ffff8101483ec900 3365675794 C Ci:4:080:0 0 2 = 5203
ffff8101483ec900 3365677640 S Ci:4:080:0 s 80 06 0303 0409 0052 82 <
ffff8101483ec900 3365678792 C Ci:4:080:0 0 82 = 52033200 42004500 34003100 33003400 35003000 34004200 38004600 30003800
ffff8101483ec900 3365681391 S Co:4:080:0 s 02 01 0000 0089 0000 0
ffff8101483ec900 3365681792 C Co:4:080:0 0 0
ffff8101483ec900 3365682388 S Co:4:080:0 s 02 01 0000 000a 0000 0
ffff8101483ec900 3365682792 C Co:4:080:0 0 0
ffff8101483ec900 3365683390 S Ci:4:080:0 s a1 fe 0000 0001 0001 1 <
ffff8101483ec900 3365683792 C Ci:4:080:0 0 1 = 00
ffff8101483ec900 3365685416 S Bo:4:080:10 -115 31 = 55534243 8849ab80 24000000 80000612 00000024 00000000 00000000 000000
ffff8101483ec900 3365685791 C Bo:4:080:10 0 31 >
ffff8101483ec900 3365688416 S Bi:4:080:9 -115 36 <
ffff8101483ec900 3365688791 C Bi:4:080:9 0 36 = 00800401 1f000000 52494d20 20202020 426c6163 6b626572 72792053 44202020
ffff8101483ec900 3365692397 S Bi:4:080:9 -115 13 <
ffff8101483ec900 3365692791 C Bi:4:080:9 0 13 = 55534253 8849ab80 00000000 00
ffff8101483ec900 3365694399 S Bo:4:080:10 -115 31 = 55534243 8849ab80 fc000000 80000a23 00000000 000000fc 00000000 000000
ffff8101483ec900 3365694791 C Bo:4:080:10 0 31 >
ffff8101483ec900 3365706474 S Bi:4:080:9 -115 252 <
ffff8101483ec900 3365707799 C Bi:4:080:9 0 12 = 00000008 007fffff 03000200
ffff8101483ec900 3365708493 S Bi:4:080:9 -115 13 <
ffff8101483ec900 3365708794 C Bi:4:080:9 -32 0
ffff8101483ec900 3365710448 S Co:4:080:0 s 02 01 0000 0089 0000 0
ffff8101483ec900 3365710794 C Co:4:080:0 0 0
ffff8101483ec900 3365711458 S Bi:4:080:9 -115 13 <
ffff8101483ec900 3365711793 C Bi:4:080:9 0 13 = 55534253 8849ab80 f0000000 01
ffff8101483ec900 3365716005 S Bo:4:080:10 -115 31 = 55534243 8849ab80 12000000 80000c03 00000012 00000000 00000000 000000
ffff8101483ec900 3365716793 C Bo:4:080:10 0 31 >
ffff8101483ec900 3365720642 S Bi:4:080:9 -115 18 <
ffff8101483ec900 3365720795 C Bi:4:080:9 0 18 = 70000200 0000000a 00000000 3a000000 0000
ffff8101483ec900 3365724019 S Bi:4:080:9 -115 13 <
ffff8101483ec900 3365724795 C Bi:4:080:9 0 13 = 55534253 8849ab80 00000000 00
ffff8101483ec900 3365729485 S Bo:4:080:10 -115 31 = 55534243 8849ab80 fc000000 80000a23 00000000 000000fc 00000000 000000
ffff8101483ec900 3365729796 C Bo:4:080:10 0 31 >
ffff8101483ec900 3365731906 S Bi:4:080:9 -115 252 <
ffff8101483ec900 3365732795 C Bi:4:080:9 0 12 = 00000008 007fffff 03000200
ffff8101483ec900 3365736441 S Bi:4:080:9 -115 13 <
ffff8101483ec900 3365736796 C Bi:4:080:9 -32 0
ffff8101483ec900 3365741411 S Co:4:080:0 s 02 01 0000 0089 0000 0
ffff8101483ec900 3365741799 C Co:4:080:0 0 0
ffff8101483ec900 3365743359 S Bi:4:080:9 -115 13 <
ffff8101483ec900 3365743797 C Bi:4:080:9 0 13 = 55534253 8849ab80 f0000000 01
ffff8101ef3c9540 3365745420 S Bo:4:080:10 -115 31 = 55534243 8849ab80 12000000 80000c03 00000012 00000000 00000000 000000
ffff8101ef3c9540 3365745799 C Bo:4:080:10 0 31 >
ffff8101ef3c9540 3365757381 S Bi:4:080:9 -115 18 <
ffff8101ef3c9540 3365758803 C Bi:4:080:9 0 18 = 70000200 0000000a 00000000 3a000000 0000
ffff8101ef3c9540 3365760932 S Bi:4:080:9 -115 13 <
ffff8101ef3c9540 3365761803 C Bi:4:080:9 0 13 = 55534253 8849ab80 00000000 00
ffff8101ef3c9540 3365764862 S Bo:4:080:10 -115 31 = 55534243 8849ab80 fc000000 80000a23 00000000 000000fc 00000000 000000
ffff8101ef3c9540 3365765801 C Bo:4:080:10 0 31 >
ffff8101ef3c9540 3365768929 S Bi:4:080:9 -115 252 <
ffff8101ef3c9540 3365769805 C Bi:4:080:9 0 12 = 00000008 007fffff 03000200
ffff8101ef3c9540 3365772928 S Bi:4:080:9 -115 13 <
ffff8101ef3c9540 3365773802 C Bi:4:080:9 -32 0
ffff8101ef3c9540 3365776937 S Co:4:080:0 s 02 01 0000 0089 0000 0
ffff8101ef3c9540 3365777803 C Co:4:080:0 0 0
ffff8101ef3c9540 3365778956 S Bi:4:080:9 -115 13 <
ffff8101ef3c9540 3365779801 C Bi:4:080:9 0 13 = 55534253 8849ab80 f0000000 01
ffff8101ef3c9540 3365780978 S Bo:4:080:10 -115 31 = 55534243 8849ab80 12000000 80000c03 00000012 00000000 00000000 000000
ffff8101ef3c9540 3365781800 C Bo:4:080:10 0 31 >
ffff8101ef3c9540 3365783997 S Bi:4:080:9 -115 18 <
ffff8101ef3c9540 3365784806 C Bi:4:080:9 0 18 = 70000200 0000000a 00000000 3a000000 0000
ffff8101ef3c9540 3365788934 S Bi:4:080:9 -115 13 <
ffff8101ef3c9540 3365789804 C Bi:4:080:9 0 13 = 55534253 8849ab80 00000000 00
ffff8101ef3c9540 3365795985 S Ci:4:080:0 s 80 06 0100 0000 0012 18 <
ffff8101ef3c9540 3365796804 C Ci:4:080:0 0 18 = 12011001 00000010 ca0f0400 07010105 0301
ffff8101ef3c9540 3365810016 S Ci:4:080:0 s c0 a5 0000 0001 0002 2 <
ffff8101ef3c9540 3365811809 C Ci:4:080:0 0 2 = 0200
ffff8101ef3c9540 3365812969 S Ci:4:080:0 s c0 a8 0000 0001 0005 5 <
ffff8101ef3c9540 3365813805 C Ci:4:080:0 0 5 = 11000001 04
ffff8101ef3c9540 3365816608 S Ci:4:080:0 s c0 a8 0000 0001 0011 17 <
ffff8101ef3c9540 3365816807 C Ci:4:080:0 0 17 = 11000001 04000102 01020202 03020303 02
ffff8101ef3c9540 3365819750 S Bo:4:080:10 -115 31 = 55534243 8849ab80 08000000 80000a25 00000000 00000000 00000000 000000
ffff8101ef3c9540 3365820803 C Bo:4:080:10 0 31 >
ffff8101ef3c9540 3365823980 S Bi:4:080:9 -115 8 <
ffff8101ef3c9540 3365824802 C Bi:4:080:9 0 8 = 00800000 00000200
ffff8101ef3c9540 3365829020 S Bi:4:080:9 -115 13 <
ffff8101ef3c9540 3365829806 C Bi:4:080:9 0 13 = 55534253 8849ab80 00000000 01
ffff8101ef3c9540 3365833007 S Bo:4:080:10 -115 31 = 55534243 8849ab80 12000000 80000c03 00000012 00000000 00000000 000000
ffff8101ef3c9540 3365833807 C Bo:4:080:10 0 31 >
ffff8101ef3c9540 3365837027 S Bi:4:080:9 -115 18 <
ffff8101ef3c9540 3365837808 C Bi:4:080:9 0 18 = 70000200 0000000a 00000000 3a000000 0000
ffff8101ef3c9540 3365840469 S Bi:4:080:9 -115 13 <
ffff8101ef3c9540 3365840807 C Bi:4:080:9 0 13 = 55534253 8849ab80 00000000 00
ffff8101ef3c9540 3365841989 S Bo:4:080:10 -115 31 = 55534243 8849ab80 00020000 80000a28 00000000 00000001 00000000 000000
ffff8101ef3c9540 3365842807 C Bo:4:080:10 0 31 >
ffff8101ef3c9540 3365844012 S Bi:4:080:9 -115 512 <
ffff8101ef3c9540 3365844808 C Bi:4:080:9 -32 0
ffff8101ef3c9540 3365860199 S Co:4:080:0 s 02 01 0000 0089 0000 0
ffff8101ef3c9540 3365861810 C Co:4:080:0 0 0
ffff8101ef3c9540 3365863452 S Bi:4:080:9 -115 13 <
ffff8101ef3c9540 3365863807 C Bi:4:080:9 0 13 = 55534253 8849ab80 00020000 01
ffff8101ef3c9540 3365865065 S Bo:4:080:10 -115 31 = 55534243 8849ab80 12000000 80000c03 00000012 00000000 00000000 000000
ffff8101ef3c9540 3365865808 C Bo:4:080:10 0 31 >
ffff8101ef3c9540 3365869005 S Bi:4:080:9 -115 18 <
ffff8101ef3c9540 3365869809 C Bi:4:080:9 0 18 = 70000200 0000000a 00000000 3a000000 0000
ffff8101ef3c9540 3365873007 S Bi:4:080:9 -115 13 <
ffff8101ef3c9540 3365873809 C Bi:4:080:9 0 13 = 55534253 8849ab80 00000000 00
ffff8101ef3c9540 3365878037 S Bo:4:080:10 -115 31 = 55534243 8849ab80 c0000000 8000061a 001c00c0 00000000 00000000 000000
ffff8101ef3c9540 3365878810 C Bo:4:080:10 0 31 >
ffff8101ef3c9540 3365884110 S Bi:4:080:9 -115 192 <
ffff8101ef3c9540 3365884811 C Bi:4:080:9 0 10 = 09000053 1c060001 0000
ffff8101f8a0d6c0 3365889006 S Bi:4:080:9 -115 13 <
ffff8101f8a0d6c0 3365889805 C Bi:4:080:9 -32 0
ffff8101f8a0d6c0 3365893214 S Co:4:080:0 s 02 01 0000 0089 0000 0
ffff8101f8a0d6c0 3365893804 C Co:4:080:0 0 0
ffff8101f8a0d6c0 3365895240 S Bi:4:080:9 -115 13 <
ffff8101f8a0d6c0 3365895804 C Bi:4:080:9 0 13 = 55534253 8849ab80 b6000000 00
ffff8101f8a0d6c0 3365897123 S Bo:4:080:10 -115 31 = 55534243 a8b3ab80 c0000000 8000061a 003f00c0 00000000 00000000 000000
ffff8101f8a0d6c0 3365897803 C Bo:4:080:10 0 31 >
ffff8101f8a0d6c0 3365911819 S Bi:4:080:9 -115 192 <
ffff8101f8a0d6c0 3365913814 C Bi:4:080:9 0 68 = 43000053 010a0003 00000000 03000000 051e0080 103f0200 3fff0000 00000000
ffff8101314ca000 3365916939 S Bi:4:080:9 -115 13 <
ffff8101314ca000 3365917812 C Bi:4:080:9 -32 0
ffff8101314ca000 3365921114 S Co:4:080:0 s 02 01 0000 0089 0000 0
ffff8101314ca000 3365921812 C Co:4:080:0 0 0
ffff8101314ca000 3365923486 S Bi:4:080:9 -115 13 <
ffff8101314ca000 3365923812 C Bi:4:080:9 0 13 = 55534253 a8b3ab80 7c000000 00
ffff8101314ca000 3365926213 S Bo:4:080:10 -115 31 = 55534243 a8b3ab80 08000000 80000a25 00000000 00000000 00000000 000000
ffff8101314ca000 3365926811 C Bo:4:080:10 0 31 >
ffff8101314ca000 3365928955 S Bi:4:080:9 -115 8 <
ffff8101314ca000 3365929813 C Bi:4:080:9 0 8 = 00800000 00000200
ffff8101314ca000 3365933046 S Bi:4:080:9 -115 13 <
ffff8101314ca000 3365933812 C Bi:4:080:9 0 13 = 55534253 a8b3ab80 00000000 01
ffff8101314ca000 3365936946 S Bo:4:080:10 -115 31 = 55534243 a8b3ab80 12000000 80000c03 00000012 00000000 00000000 000000
ffff8101314ca000 3365937813 C Bo:4:080:10 0 31 >
ffff8101314ca000 3365940939 S Bi:4:080:9 -115 18 <
ffff8101314ca000 3365941815 C Bi:4:080:9 0 18 = 70000200 0000000a 00000000 3a000000 0000
ffff8101314ca000 3365944121 S Bi:4:080:9 -115 13 <
ffff8101314ca000 3365944813 C Bi:4:080:9 0 13 = 55534253 a8b3ab80 00000000 00
ffff8101314ca000 3365960216 S Bo:4:080:10 -115 31 = 55534243 a8b3ab80 00020000 80000a28 00000000 00000001 00000000 000000
ffff8101314ca000 3365961814 C Bo:4:080:10 0 31 >
ffff8101314ca000 3365964185 S Bi:4:080:9 -115 512 <
ffff8101314ca000 3365964819 C Bi:4:080:9 -32 0
ffff8101314ca000 3365966033 S Co:4:080:0 s 02 01 0000 0089 0000 0
ffff8101314ca000 3365966816 C Co:4:080:0 0 0
ffff8101314ca000 3365968107 S Bi:4:080:9 -115 13 <
ffff8101314ca000 3365968819 C Bi:4:080:9 0 13 = 55534253 a8b3ab80 00020000 01
ffff8101314ca000 3365972991 S Bo:4:080:10 -115 31 = 55534243 a8b3ab80 12000000 80000c03 00000012 00000000 00000000 000000
ffff8101314ca000 3365973817 C Bo:4:080:10 0 31 >
ffff8101314ca000 3365977068 S Bi:4:080:9 -115 18 <
ffff8101314ca000 3365977809 C Bi:4:080:9 0 18 = 70000200 0000000a 00000000 3a000000 0000
ffff8101314ca000 3365981057 S Bi:4:080:9 -115 13 <
ffff8101314ca000 3365981808 C Bi:4:080:9 0 13 = 55534253 a8b3ab80 00000000 00
ffff8101314ca000 3365984000 S Bo:4:080:10 -115 31 = 55534243 8849ab80 08000000 80000a25 00000000 00000000 00000000 000000
ffff8101314ca000 3365984808 C Bo:4:080:10 0 31 >
ffff8101314ca000 3365989012 S Bi:4:080:9 -115 8 <
ffff8101314ca000 3365989808 C Bi:4:080:9 0 8 = 00800000 00000200
ffff8101314ca000 3365993090 S Bi:4:080:9 -115 13 <
ffff8101314ca000 3365993809 C Bi:4:080:9 0 13 = 55534253 8849ab80 00000000 01
ffff8101314ca000 3365997040 S Bo:4:080:10 -115 31 = 55534243 8849ab80 12000000 80000c03 00000012 00000000 00000000 000000
ffff8101314ca000 3365997808 C Bo:4:080:10 0 31 >
ffff8101314ca000 3366012448 S Bi:4:080:9 -115 18 <
ffff8101314ca000 3366013818 C Bi:4:080:9 0 18 = 70000200 0000000a 00000000 3a000000 0000
ffff8101483ecd80 3366021951 S Bi:4:080:9 -115 13 <
ffff8101483ecd80 3366022814 C Bi:4:080:9 0 13 = 55534253 8849ab80 00000000 00
ffff8101483ecd80 3366529014 S Bo:4:080:10 -115 31 = 55534243 0847ab80 08000000 80000a25 00000000 00000000 00000000 000000
ffff8101483ecd80 3366530841 C Bo:4:080:10 0 31 >
ffff8101483ecd80 3366532398 S Bi:4:080:9 -115 8 <
ffff8101483ecd80 3366532840 C Bi:4:080:9 0 8 = 00800000 00000200
ffff8101483ecd80 3366534384 S Bi:4:080:9 -115 13 <
ffff8101483ecd80 3366534839 C Bi:4:080:9 0 13 = 55534253 0847ab80 00000000 01
ffff8101483ecd80 3366536403 S Bo:4:080:10 -115 31 = 55534243 0847ab80 12000000 80000c03 00000012 00000000 00000000 000000
ffff8101483ecd80 3366536839 C Bo:4:080:10 0 31 >
ffff8101483ecd80 3366540464 S Bi:4:080:9 -115 18 <
ffff8101483ecd80 3366540839 C Bi:4:080:9 0 18 = 70000200 0000000a 00000000 3a000000 0000
ffff8101483ecd80 3366544066 S Bi:4:080:9 -115 13 <
ffff8101483ecd80 3366544839 C Bi:4:080:9 0 13 = 55534253 0847ab80 00000000 00
ffff8101483ecd80 3366683319 S Bo:4:080:10 -115 31 = 55534243 0847ab80 08000000 80000a25 00000000 00000000 00000000 000000
ffff8101483ecd80 3366684849 C Bo:4:080:10 0 31 >
ffff8101483ecd80 3366686341 S Bi:4:080:9 -115 8 <
ffff8101483ecd80 3366686846 C Bi:4:080:9 0 8 = 00800000 00000200
ffff8101483ecd80 3366688367 S Bi:4:080:9 -115 13 <
ffff8101483ecd80 3366688847 C Bi:4:080:9 0 13 = 55534253 0847ab80 00000000 01
ffff8101483ecd80 3366690249 S Bo:4:080:10 -115 31 = 55534243 0847ab80 12000000 80000c03 00000012 00000000 00000000 000000
ffff8101483ecd80 3366690847 C Bo:4:080:10 0 31 >
ffff8101483ecd80 3366692276 S Bi:4:080:9 -115 18 <
ffff8101483ecd80 3366692847 C Bi:4:080:9 0 18 = 70000200 0000000a 00000000 3a000000 0000
ffff8101483ecd80 3366694302 S Bi:4:080:9 -115 13 <
ffff8101483ecd80 3366694847 C Bi:4:080:9 0 13 = 55534253 0847ab80 00000000 00
ffff8101483ecd80 3366696376 S Bo:4:080:10 -115 31 = 55534243 0847ab80 08000000 80000a25 00000000 00000000 00000000 000000
ffff8101483ecd80 3366696856 C Bo:4:080:10 0 31 >
ffff8101483ecd80 3366708327 S Bi:4:080:9 -115 8 <
ffff8101483ecd80 3366708850 C Bi:4:080:9 0 8 = 00800000 00000200
ffff8101483ecd80 3366710337 S Bi:4:080:9 -115 13 <
ffff8101483ecd80 3366710847 C Bi:4:080:9 0 13 = 55534253 0847ab80 00000000 01
ffff8101483ecd80 3366712366 S Bo:4:080:10 -115 31 = 55534243 0847ab80 12000000 80000c03 00000012 00000000 00000000 000000
ffff8101483ecd80 3366712848 C Bo:4:080:10 0 31 >
ffff8101483ecd80 3366714250 S Bi:4:080:9 -115 18 <
ffff8101483ecd80 3366714848 C Bi:4:080:9 0 18 = 70000200 0000000a 00000000 3a000000 0000
ffff8101483ecd80 3366716288 S Bi:4:080:9 -115 13 <
ffff8101483ecd80 3366716848 C Bi:4:080:9 0 13 = 55534253 0847ab80 00000000 00
ffff8101483ecd80 3366718305 S Bo:4:080:10 -115 31 = 55534243 0847ab80 00000000 00000600 00000000 00000000 00000000 000000
ffff8101483ecd80 3366718849 C Bo:4:080:10 0 31 >
ffff8101483ecd80 3366720325 S Bi:4:080:9 -115 13 <
ffff8101483ecd80 3366720848 C Bi:4:080:9 0 13 = 55534253 0847ab80 00000000 01
ffff8101483ecd80 3366722349 S Bo:4:080:10 -115 31 = 55534243 0847ab80 12000000 80000c03 00000012 00000000 00000000 000000
ffff8101483ecd80 3366722848 C Bo:4:080:10 0 31 >
ffff8101483ecd80 3366724379 S Bi:4:080:9 -115 18 <
ffff8101483ecd80 3366724850 C Bi:4:080:9 0 18 = 70000200 0000000a 00000000 3a000000 0000
ffff8101483ecd80 3366726273 S Bi:4:080:9 -115 13 <
ffff8101483ecd80 3366726848 C Bi:4:080:9 0 13 = 55534253 0847ab80 00000000 00
ffff8101483ecd80 3366728274 S Bo:4:080:10 -115 31 = 55534243 8849ab80 c0000000 8000061a 003f00c0 00000000 00000000 000000
ffff8101483ecd80 3366728850 C Bo:4:080:10 0 31 >
ffff8101483ecd80 3366733121 S Bi:4:080:9 -115 192 <
ffff8101483ecd80 3366733854 C Bi:4:080:9 0 68 = 43000053 010a0003 00000000 03000000 051e0080 103f0200 3fff0000 00000000
ffff8101483ecd80 3366736428 S Bi:4:080:9 -115 13 <
ffff8101483ecd80 3366736851 C Bi:4:080:9 -32 0
ffff8101483ecd80 3366740481 S Co:4:080:0 s 02 01 0000 0089 0000 0
ffff8101483ecd80 3366740851 C Co:4:080:0 0 0
ffff8101483ecd80 3366741492 S Bi:4:080:9 -115 13 <
ffff8101483ecd80 3366741850 C Bi:4:080:9 0 13 = 55534253 8849ab80 7c000000 00
ffff8101483ecd80 3366744529 S Bo:4:080:10 -115 31 = 55534243 8849ab80 08000000 80000a25 00000000 00000000 00000000 000000
ffff8101483ecd80 3366744851 C Bo:4:080:10 0 31 >
ffff8101483ecd80 3366760178 S Bi:4:080:9 -115 8 <
ffff8101483ecd80 3366761853 C Bi:4:080:9 0 8 = 00800000 00000200
ffff8101483ecd80 3366767922 S Bi:4:080:9 -115 13 <
ffff8101483ecd80 3366768852 C Bi:4:080:9 0 13 = 55534253 8849ab80 00000000 01
ffff8101483ecd80 3366772397 S Bo:4:080:10 -115 31 = 55534243 8849ab80 12000000 80000c03 00000012 00000000 00000000 000000
ffff8101483ecd80 3366772852 C Bo:4:080:10 0 31 >
ffff8101483ecd80 3366774359 S Bi:4:080:9 -115 18 <
ffff8101483ecd80 3366774851 C Bi:4:080:9 0 18 = 70000200 0000000a 00000000 3a000000 0000
ffff8101483ecd80 3366776381 S Bi:4:080:9 -115 13 <
ffff8101483ecd80 3366776851 C Bi:4:080:9 0 13 = 55534253 8849ab80 00000000 00
ffff810089414840 3373735753 S Bo:4:080:10 -115 31 = 55534243 686a9e80 08000000 80000a25 00000000 00000000 00000000 000000
ffff810089414840 3373737244 C Bo:4:080:10 0 31 >
ffff810089414840 3373738677 S Bi:4:080:9 -115 8 <
ffff810089414840 3373739241 C Bi:4:080:9 0 8 = 00800000 00000200
ffff810089414840 3373744010 S Bi:4:080:9 -115 13 <
ffff810089414840 3373744245 C Bi:4:080:9 0 13 = 55534253 686a9e80 00000000 01
ffff810089414840 3373745840 S Bo:4:080:10 -115 31 = 55534243 686a9e80 12000000 80000c03 00000012 00000000 00000000 000000
ffff810089414840 3373746241 C Bo:4:080:10 0 31 >
ffff810089414840 3373747854 S Bi:4:080:9 -115 18 <
ffff810089414840 3373748241 C Bi:4:080:9 0 18 = 70000200 0000000a 00000000 3a000000 0000
ffff810089414840 3373749880 S Bi:4:080:9 -115 13 <
ffff810089414840 3373750240 C Bi:4:080:9 0 13 = 55534253 686a9e80 00000000 00
ffff810089414840 3373751848 S Bo:4:080:10 -115 31 = 55534243 686a9e80 08000000 80000a25 00000000 00000000 00000000 000000
ffff810089414840 3373752240 C Bo:4:080:10 0 31 >
ffff810089414840 3373755952 S Bi:4:080:9 -115 8 <
ffff810089414840 3373756240 C Bi:4:080:9 0 8 = 00800000 00000200
ffff810089414840 3373757906 S Bi:4:080:9 -115 13 <
ffff810089414840 3373758241 C Bi:4:080:9 0 13 = 55534253 686a9e80 00000000 01
ffff810089414840 3373760661 S Bo:4:080:10 -115 31 = 55534243 686a9e80 12000000 80000c03 00000012 00000000 00000000 000000
ffff810089414840 3373761245 C Bo:4:080:10 0 31 >
ffff810089414840 3373762704 S Bi:4:080:9 -115 18 <
ffff810089414840 3373763241 C Bi:4:080:9 0 18 = 70000200 0000000a 00000000 3a000000 0000
ffff810089414840 3373768065 S Bi:4:080:9 -115 13 <
ffff810089414840 3373768242 C Bi:4:080:9 0 13 = 55534253 686a9e80 00000000 00
ffff810089414840 3373777719 S Bo:4:080:10 -115 31 = 55534243 686a9e80 00000000 00000600 00000000 00000000 00000000 000000
ffff810089414840 3373778244 C Bo:4:080:10 0 31 >
ffff810089414840 3373779729 S Bi:4:080:9 -115 13 <
ffff810089414840 3373780242 C Bi:4:080:9 0 13 = 55534253 686a9e80 00000000 01
ffff810089414840 3373781578 S Bo:4:080:10 -115 31 = 55534243 686a9e80 12000000 80000c03 00000012 00000000 00000000 000000
ffff810089414840 3373782242 C Bo:4:080:10 0 31 >
ffff810089414840 3373783623 S Bi:4:080:9 -115 18 <
ffff810089414840 3373784242 C Bi:4:080:9 0 18 = 70000200 0000000a 00000000 3a000000 0000
ffff810089414840 3373785621 S Bi:4:080:9 -115 13 <
ffff810089414840 3373786244 C Bi:4:080:9 0 13 = 55534253 686a9e80 00000000 00
ffff81013597c300 3375811260 S Bo:4:080:10 -115 31 = 55534243 08309b80 08000000 80000a25 00000000 00000000 00000000 000000
ffff81013597c300 3375812367 C Bo:4:080:10 0 31 >
ffff81013597c300 3375814279 S Bi:4:080:9 -115 8 <
ffff81013597c300 3375814364 C Bi:4:080:9 0 8 = 00800000 00000200
ffff81013597c300 3375816326 S Bi:4:080:9 -115 13 <
ffff81013597c300 3375817367 C Bi:4:080:9 0 13 = 55534253 08309b80 00000000 01
ffff81013597c300 3375819292 S Bo:4:080:10 -115 31 = 55534243 08309b80 12000000 80000c03 00000012 00000000 00000000 000000
ffff81013597c300 3375820358 C Bo:4:080:10 0 31 >
ffff81013597c300 3375822200 S Bi:4:080:9 -115 18 <
ffff81013597c300 3375822420 C Bi:4:080:9 0 18 = 70000200 0000000a 00000000 3a000000 0000
ffff81013597c300 3375824209 S Bi:4:080:9 -115 13 <
ffff81013597c300 3375824367 C Bi:4:080:9 0 13 = 55534253 08309b80 00000000 00
ffff81013597c300 3375826239 S Bo:4:080:10 -115 31 = 55534243 08309b80 08000000 80000a25 00000000 00000000 00000000 000000
ffff81013597c300 3375826363 C Bo:4:080:10 0 31 >
ffff81013597c300 3375828254 S Bi:4:080:9 -115 8 <
ffff81013597c300 3375828357 C Bi:4:080:9 0 8 = 00800000 00000200
ffff81013597c300 3375831404 S Bi:4:080:9 -115 13 <
ffff81013597c300 3375832369 C Bi:4:080:9 0 13 = 55534253 08309b80 00000000 01
ffff81013597c300 3375833395 S Bo:4:080:10 -115 31 = 55534243 08309b80 12000000 80000c03 00000012 00000000 00000000 000000
ffff81013597c300 3375834367 C Bo:4:080:10 0 31 >
ffff81013597c300 3375835391 S Bi:4:080:9 -115 18 <
ffff81013597c300 3375836359 C Bi:4:080:9 0 18 = 70000200 0000000a 00000000 3a000000 0000
ffff81013597c300 3375837317 S Bi:4:080:9 -115 13 <
ffff81013597c300 3375838359 C Bi:4:080:9 0 13 = 55534253 08309b80 00000000 00
ffff81013597c840 3375841374 S Bo:4:080:10 -115 31 = 55534243 08309b80 00000000 00000600 00000000 00000000 00000000 000000
ffff81013597c840 3375842359 C Bo:4:080:10 0 31 >
ffff81013597c840 3375843418 S Bi:4:080:9 -115 13 <
ffff81013597c840 3375844364 C Bi:4:080:9 0 13 = 55534253 08309b80 00000000 01
ffff81013597c840 3375845278 S Bo:4:080:10 -115 31 = 55534243 08309b80 12000000 80000c03 00000012 00000000 00000000 000000
ffff81013597c840 3375845367 C Bo:4:080:10 0 31 >
ffff81013597c840 3375849517 S Bi:4:080:9 -115 18 <
ffff81013597c840 3375850371 C Bi:4:080:9 0 18 = 70000200 0000000a 00000000 3a000000 0000
ffff81013597c840 3375852091 S Bi:4:080:9 -115 13 <
ffff81013597c840 3375852366 C Bi:4:080:9 0 13 = 55534253 08309b80 00000000 00
ffff81013597c840 3375855101 S Bo:4:080:10 -115 31 = 55534243 08309b80 08000000 80000a25 00000000 00000000 00000000 000000
ffff81013597c840 3375855369 C Bo:4:080:10 0 31 >
ffff81013597c840 3375857013 S Bi:4:080:9 -115 8 <
ffff81013597c840 3375857365 C Bi:4:080:9 0 8 = 00800000 00000200
ffff81013597c300 3375859053 S Bi:4:080:9 -115 13 <
ffff81013597c300 3375859357 C Bi:4:080:9 0 13 = 55534253 08309b80 00000000 01
ffff81013597c300 3375861700 S Bo:4:080:10 -115 31 = 55534243 08309b80 12000000 80000c03 00000012 00000000 00000000 000000
ffff81013597c300 3375862370 C Bo:4:080:10 0 31 >
ffff81013597c300 3375863694 S Bi:4:080:9 -115 18 <
ffff81013597c300 3375864368 C Bi:4:080:9 0 18 = 70000200 0000000a 00000000 3a000000 0000
ffff81013597c300 3375865806 S Bi:4:080:9 -115 13 <
ffff81013597c300 3375866368 C Bi:4:080:9 0 13 = 55534253 08309b80 00000000 00
ffff81013597c300 3375867820 S Bo:4:080:10 -115 31 = 55534243 08309b80 08000000 80000a25 00000000 00000000 00000000 000000
ffff81013597c300 3375868370 C Bo:4:080:10 0 31 >
ffff81013597c300 3375869633 S Bi:4:080:9 -115 8 <
ffff81013597c300 3375870412 C Bi:4:080:9 0 8 = 00800000 00000200
ffff81013597c300 3375871732 S Bi:4:080:9 -115 13 <
ffff81013597c300 3375872370 C Bi:4:080:9 0 13 = 55534253 08309b80 00000000 01
ffff81013597c300 3375874752 S Bo:4:080:10 -115 31 = 55534243 08309b80 12000000 80000c03 00000012 00000000 00000000 000000
ffff81013597c300 3375875369 C Bo:4:080:10 0 31 >
ffff81013597c300 3375877365 S Bi:4:080:9 -115 18 <
ffff81013597c300 3375878362 C Bi:4:080:9 0 18 = 70000200 0000000a 00000000 3a000000 0000
ffff81013597c300 3375880340 S Bi:4:080:9 -115 13 <
ffff81013597c300 3375881371 C Bi:4:080:9 0 13 = 55534253 08309b80 00000000 00
ffff81013597c300 3375887468 S Bo:4:080:10 -115 31 = 55534243 08309b80 00000000 00000600 00000000 00000000 00000000 000000
ffff81013597c300 3375887914 C Bo:4:080:10 0 31 >
ffff81013597c300 3375889387 S Bi:4:080:9 -115 13 <
ffff81013597c300 3375890364 C Bi:4:080:9 0 13 = 55534253 08309b80 00000000 01
ffff81013597c300 3375892390 S Bo:4:080:10 -115 31 = 55534243 08309b80 12000000 80000c03 00000012 00000000 00000000 000000
ffff81013597c300 3375893370 C Bo:4:080:10 0 31 >
ffff81013597c300 3375894251 S Bi:4:080:9 -115 18 <
ffff81013597c300 3375894443 C Bi:4:080:9 0 18 = 70000200 0000000a 00000000 3a000000 0000
ffff81013597c300 3375896265 S Bi:4:080:9 -115 13 <
ffff81013597c300 3375896366 C Bi:4:080:9 0 13 = 55534253 08309b80 00000000 00
ffff81012b753000 3377224178 S Bo:4:080:10 -115 31 = 55534243 48249f80 08000000 80000a25 00000000 00000000 00000000 000000
ffff81012b753000 3377225437 C Bo:4:080:10 0 31 >
ffff81012b753000 3377228408 S Bi:4:080:9 -115 8 <
ffff81012b753000 3377229435 C Bi:4:080:9 0 8 = 00800000 00000200
ffff81012b753000 3377232527 S Bi:4:080:9 -115 13 <
ffff81012b753000 3377233447 C Bi:4:080:9 0 13 = 55534253 48249f80 00000000 01
ffff81012b753000 3377234435 S Bo:4:080:10 -115 31 = 55534243 48249f80 12000000 80000c03 00000012 00000000 00000000 000000
ffff81012b753000 3377235434 C Bo:4:080:10 0 31 >
ffff81012b753000 3377236566 S Bi:4:080:9 -115 18 <
ffff81012b753000 3377237435 C Bi:4:080:9 0 18 = 70000200 0000000a 00000000 3a000000 0000
ffff81012b753000 3377240427 S Bi:4:080:9 -115 13 <
ffff81012b753000 3377241434 C Bi:4:080:9 0 13 = 55534253 48249f80 00000000 00
ffff81012b753000 3377245026 S Bo:4:080:10 -115 31 = 55534243 48249f80 08000000 80000a25 00000000 00000000 00000000 000000
ffff81012b753000 3377245437 C Bo:4:080:10 0 31 >
ffff81012b753000 3377249178 S Bi:4:080:9 -115 8 <
ffff81012b753000 3377249436 C Bi:4:080:9 0 8 = 00800000 00000200
ffff81012b753000 3377256516 S Bi:4:080:9 -115 13 <
ffff81012b753000 3377257438 C Bi:4:080:9 0 13 = 55534253 48249f80 00000000 01
ffff81012b753000 3377260402 S Bo:4:080:10 -115 31 = 55534243 48249f80 12000000 80000c03 00000012 00000000 00000000 000000
ffff81012b753000 3377261436 C Bo:4:080:10 0 31 >
ffff81012b753000 3377263974 S Bi:4:080:9 -115 18 <
ffff81012b753000 3377264463 C Bi:4:080:9 0 18 = 70000200 0000000a 00000000 3a000000 0000
ffff81012b753000 3377268277 S Bi:4:080:9 -115 13 <
ffff81012b753000 3377268436 C Bi:4:080:9 0 13 = 55534253 48249f80 00000000 00
ffff81012b753000 3377269788 S Bo:4:080:10 -115 31 = 55534243 48249f80 00000000 00000600 00000000 00000000 00000000 000000
ffff81012b753000 3377270436 C Bo:4:080:10 0 31 >
ffff81012b753000 3377272400 S Bi:4:080:9 -115 13 <
ffff81012b753000 3377273436 C Bi:4:080:9 0 13 = 55534253 48249f80 00000000 01
ffff81012b753000 3377274375 S Bo:4:080:10 -115 31 = 55534243 48249f80 12000000 80000c03 00000012 00000000 00000000 000000
ffff81012b753000 3377275436 C Bo:4:080:10 0 31 >
ffff81012b753000 3377276397 S Bi:4:080:9 -115 18 <
ffff81012b753000 3377277436 C Bi:4:080:9 0 18 = 70000200 0000000a 00000000 3a000000 0000
ffff81012b753000 3377280413 S Bi:4:080:9 -115 13 <
ffff81012b753000 3377281436 C Bi:4:080:9 0 13 = 55534253 48249f80 00000000 00
ffff8101483ece40 3392548281 S Bo:4:080:4 -115 16 = 00001000 01ff0000 5181560a 00000000
ffff8101483ece40 3392550292 C Bo:4:080:4 0 16 >
ffff8101483ece40 3392552077 S Bi:4:080:3 -115 4096 <
ffff8101483ece40 3392552305 C Bi:4:080:3 0 16 = 00001000 02ff0000 5181560a 00000000
ffff8101483ece40 3392555142 S Bi:4:080:3 -115 4096 <
ffff8101483ec000 3392556115 S Bo:4:080:4 -115 12 = 00000c00 05ff0001 14000100
ffff8101483ec000 3392556290 C Bo:4:080:4 0 12 >
ffff8101483ece40 3392557302 C Bi:4:080:3 0 32 = 00002000 06ff0001 14000100 2be41345 04b8f083 bf26043b 662b2849 439c8ac9
ffff8101483ece40 3392562087 S Bo:4:080:4 -115 12 = 00000c00 05ff0002 08000400
ffff8101483ec000 3392562126 S Bi:4:080:3 -115 4096 <
ffff8101483ece40 3392562288 C Bo:4:080:4 0 12 >
ffff8101483ec000 3392563301 C Bi:4:080:3 0 20 = 00001400 06ff0002 08000400 03000000 499c1224
ffff8101483ec000 3392565978 S Bo:4:080:4 -115 12 = 00000c00 05ff0003 04000500
ffff8101483ece40 3392565998 S Bi:4:080:3 -115 4096 <
ffff8101483ec000 3392566288 C Bo:4:080:4 0 12 >
ffff8101483ece40 3392567303 C Bi:4:080:3 0 12 = 00000c00 06ff0003 00000000
ffff8101483ece40 3392595133 S Bo:4:080:4 -115 12 = 00000c00 05ff0004 04000600
ffff8101483ece40 3392596293 C Bo:4:080:4 0 12 >
ffff8101483ece40 3392616367 S Bi:4:080:3 -115 4096 <
ffff8101483ece40 3392618312 C Bi:4:080:3 0 12 = 00000c00 06ff0004 00000000
ffff81019bd8a0c0 3392656120 S Bo:4:080:4 -115 12 = 00000c00 05ff0005 04000700
ffff81019bd8aa80 3392656143 S Bi:4:080:3 -115 4096 <
ffff81019bd8a0c0 3392657297 C Bo:4:080:4 0 12 >
ffff81019bd8aa80 3392657319 C Bi:4:080:3 0 16 = 00001000 06ff0005 04000700 00020000
ffff81019bd8aa80 3392684010 S Bo:4:080:4 -115 12 = 00000c00 05ff0006 04000800
ffff81019bd8a0c0 3392684034 S Bi:4:080:3 -115 4096 <
ffff81019bd8aa80 3392685301 C Bo:4:080:4 0 12 >
ffff81019bd8a0c0 3392685321 C Bi:4:080:3 0 12 = 00000c00 06ff0006 00000000
ffff81019bd8a0c0 3392704959 S Bi:4:080:3 -115 4096 <
ffff81019bd8aa80 3392757671 S Bo:4:080:4 -115 12 = 00000c00 05ff0007 04000a00
ffff81019bd8aa80 3392758304 C Bo:4:080:4 0 12 >
ffff81019bd8a0c0 3392759313 C Bi:4:080:3 0 12 = 00000c00 06ff0007 00000000
ffff81019bd8a0c0 3392773055 S Bo:4:080:4 -115 12 = 00000c00 05ff0008 04000b00
ffff81019bd8aa80 3392773081 S Bi:4:080:3 -115 4096 <
ffff81019bd8a0c0 3392774302 C Bo:4:080:4 0 12 >
ffff81019bd8aa80 3392774321 C Bi:4:080:3 0 16 = 00001000 06ff0008 04000b00 00000000
ffff8101f8900c00 3393203262 S Ci:4:080:0 s c0 a5 0000 0001 0002 2 <
ffff8101f8900c00 3393204330 C Ci:4:080:0 0 2 = 0200
ffff81012d59e000 3399572724 S Bo:4:080:4 -115 24 = 00001800 07ff0009 52494d20 42797061 73730000 00000000
ffff81012d59e3c0 3399572801 S Bi:4:080:3 -115 4096 <
ffff81012d59e000 3399574692 C Bo:4:080:4 0 24 >
ffff81012d59e3c0 3399576705 C Bi:4:080:3 0 44 = 00002c00 08060009 52494d20 42797061 73730000 00000000 00000000 01fc3f00
ffff81012d59e3c0 3399584729 S Bi:4:080:3 -115 4096 <
ffff81012d59e3c0 3399585710 C Bi:4:080:3 0 12 = 00000c00 13060100 00000000
ffff81012d59e3c0 3399608789 S Bo:4:080:4 -115 8 = 00000800 0a06000a
ffff81012d59e3c0 3399610694 C Bo:4:080:4 0 8 >
ffff81012d59e3c0 3399620854 S Bi:4:080:3 -115 4096 <
ffff81012d59e3c0 3399622726 C Bi:4:080:3 0 8 = 00000800 1006000a
ffff81012d59e3c0 3399625896 S Bi:4:080:3 -115 4096 <
ffff81012d59e000 3399762408 S Bo:4:080:4 -115 10 = 06000a00 40000001 0000
ffff81012d59e000 3399762749 C Bo:4:080:4 0 10 >
ffff81012d59e3c0 3399765717 C Bi:4:080:3 0 12 = 00000c00 13060100 01000000
ffff81012d59e3c0 3399804470 S Bi:4:080:3 -115 4096 <
ffff81012d59e3c0 3399805721 C Bi:4:080:3 0 10 = 06000a00 40000002 0003
ffff81012d59e3c0 3399837418 S Bi:4:080:3 -115 4096 <
ffff81012d59e3c0 3399838719 C Bi:4:080:3 0 23 = 06001700 40000500 6d757865 72080147 4d452044 617461
ffff81012d59e3c0 3399875611 S Bi:4:080:3 -115 4096 <
ffff81012d59e3c0 3400355753 C Bi:4:080:3 0 161 = 0600a100 40010102 00000095 53000000 12530000 000d4742 4953584e 41433030
ffff81012d59e3c0 3400360759 S Bi:4:080:3 -115 4096 <
ffff81012d59e0c0 3400368682 S Bo:4:080:4 -115 22 = 06001600 40010102 0000000a 49000000 00490000 0001
ffff81012d59e0c0 3400369726 C Bo:4:080:4 0 22 >
ffff81012d59e3c0 3400371825 C Bi:4:080:3 0 12 = 00000c00 13060100 02000000
ffff81012d59e3c0 3400378768 S Bi:4:080:3 -115 4096 <
ffff81012d59e0c0 3404080547 S Bo:4:080:6 -115 12 = 01000000 00000000 78563412
ffff81012d59eb40 3404081388 S Bi:4:080:5 -115 4096 <
ffff81012d59e0c0 3404081932 C Bo:4:080:6 0 12 >
ffff81012d59e0c0 3404083988 S Bo:4:080:6 -115 12 = 01000000 00000000 78563412
ffff81012d59e0c0 3404084940 C Bo:4:080:6 0 12 >
ffff81012d59e0c0 3404085001 S Bo:4:080:8 -115 12 = 01000000 00000000 78563412
ffff81012d59e300 3404085035 S Bi:4:080:7 -115 4096 <
ffff81012d59e0c0 3404085932 C Bo:4:080:8 0 12 >
ffff81012d59e0c0 3404086000 S Bo:4:080:6 -115 12 = 01000000 01000000 78563412
ffff81012d59eb40 3404086970 C Bi:4:080:5 0 28 = 04000000 00000000 00000000 00000000 01000000 1c000000 78563412
ffff81012d59e0c0 3404086977 C Bo:4:080:6 0 12 >
ffff81012d59e0c0 3404087047 S Bo:4:080:8 -115 12 = 01000000 00000000 78563412
ffff81012d59e0c0 3404087932 C Bo:4:080:8 0 12 >
ffff81012d59e0c0 3404088036 S Bi:4:080:5 -115 4096 <
ffff81012d59eb40 3404089028 S Bo:4:080:8 -115 12 = 01000000 01000000 78563412
ffff81012d59e300 3404089944 C Bi:4:080:7 0 28 = 04000000 00000000 00000000 00000000 01000000 1c000000 78563412
ffff81012d59eb40 3404089949 C Bo:4:080:8 0 12 >
ffff81012d59eb40 3404093362 S Bi:4:080:7 -115 4096 <
ffff8101f4758780 3419911691 S Bo:4:080:10 -115 31 = 55534243 e8968d80 08000000 80000a25 00000000 00000000 00000000 000000
ffff8101f4758780 3419912816 C Bo:4:080:10 0 31 >
ffff8101f4758780 3419916418 S Bi:4:080:9 -115 8 <
ffff8101f4758780 3419916812 C Bi:4:080:9 0 8 = 00800000 00000200
ffff8101f4758780 3419920920 S Bi:4:080:9 -115 13 <
ffff8101f4758780 3419921812 C Bi:4:080:9 0 13 = 55534253 e8968d80 00000000 01
ffff8101f4758780 3419924357 S Bo:4:080:10 -115 31 = 55534243 e8968d80 12000000 80000c03 00000012 00000000 00000000 000000
ffff8101f4758780 3419924810 C Bo:4:080:10 0 31 >
ffff8101f4758780 3419925998 S Bi:4:080:9 -115 18 <
ffff8101f4758780 3419926811 C Bi:4:080:9 0 18 = 70000200 0000000a 00000000 3a000000 0000
ffff8101f4758780 3419928919 S Bi:4:080:9 -115 13 <
ffff8101f4758780 3419929815 C Bi:4:080:9 0 13 = 55534253 e8968d80 00000000 00
ffff8101f4758780 3419932923 S Bo:4:080:10 -115 31 = 55534243 e8968d80 08000000 80000a25 00000000 00000000 00000000 000000
ffff8101f4758780 3419933814 C Bo:4:080:10 0 31 >
ffff8101f4758780 3419936403 S Bi:4:080:9 -115 8 <
ffff8101f4758780 3419936813 C Bi:4:080:9 0 8 = 00800000 00000200
ffff8101f4758780 3419940401 S Bi:4:080:9 -115 13 <
ffff8101f4758780 3419940813 C Bi:4:080:9 0 13 = 55534253 e8968d80 00000000 01
ffff8101f4758780 3419943462 S Bo:4:080:10 -115 31 = 55534243 e8968d80 12000000 80000c03 00000012 00000000 00000000 000000
ffff8101f4758780 3419943812 C Bo:4:080:10 0 31 >
ffff8101f4758780 3419944849 S Bi:4:080:9 -115 18 <
ffff8101f4758780 3419945813 C Bi:4:080:9 0 18 = 70000200 0000000a 00000000 3a000000 0000
ffff8101f4758780 3419948921 S Bi:4:080:9 -115 13 <
ffff8101f4758780 3419949815 C Bi:4:080:9 0 13 = 55534253 e8968d80 00000000 00
ffff8101f4758780 3419952921 S Bo:4:080:10 -115 31 = 55534243 e8968d80 00000000 00000600 00000000 00000000 00000000 000000
ffff8101f4758780 3419953819 C Bo:4:080:10 0 31 >
ffff8101f4758780 3419956405 S Bi:4:080:9 -115 13 <
ffff8101f4758780 3419956814 C Bi:4:080:9 0 13 = 55534253 e8968d80 00000000 01
ffff8101f4758780 3419960402 S Bo:4:080:10 -115 31 = 55534243 e8968d80 12000000 80000c03 00000012 00000000 00000000 000000
ffff8101f4758780 3419960813 C Bo:4:080:10 0 31 >
ffff8101f4758780 3419963466 S Bi:4:080:9 -115 18 <
ffff8101f4758780 3419963814 C Bi:4:080:9 0 18 = 70000200 0000000a 00000000 3a000000 0000
ffff8101f4758780 3419964994 S Bi:4:080:9 -115 13 <
ffff8101f4758780 3419965814 C Bi:4:080:9 0 13 = 55534253 e8968d80 00000000 00
ffff8101f4758780 3420055670 S Bo:4:080:10 -115 31 = 55534243 e8968d80 08000000 80000a25 00000000 00000000 00000000 000000
ffff8101f4758780 3420056825 C Bo:4:080:10 0 31 >
ffff8101f4758780 3420060921 S Bi:4:080:9 -115 8 <
ffff8101f4758780 3420061820 C Bi:4:080:9 0 8 = 00800000 00000200
ffff8101f4758780 3420063984 S Bi:4:080:9 -115 13 <
ffff8101f4758780 3420064820 C Bi:4:080:9 0 13 = 55534253 e8968d80 00000000 01
ffff8101f4758780 3420068402 S Bo:4:080:10 -115 31 = 55534243 e8968d80 12000000 80000c03 00000012 00000000 00000000 000000
ffff8101f4758780 3420068820 C Bo:4:080:10 0 31 >
ffff8101f4758780 3420072401 S Bi:4:080:9 -115 18 <
ffff8101f4758780 3420072820 C Bi:4:080:9 0 18 = 70000200 0000000a 00000000 3a000000 0000
ffff8101f4758780 3420073923 S Bi:4:080:9 -115 13 <
ffff8101f4758780 3420074820 C Bi:4:080:9 0 13 = 55534253 e8968d80 00000000 00
ffff8101f4758780 3420076920 S Bo:4:080:10 -115 31 = 55534243 e8968d80 08000000 80000a25 00000000 00000000 00000000 000000
ffff8101f4758780 3420077820 C Bo:4:080:10 0 31 >
ffff8101f4758780 3420080919 S Bi:4:080:9 -115 8 <
ffff8101f4758780 3420081821 C Bi:4:080:9 0 8 = 00800000 00000200
ffff8101f4758780 3420083972 S Bi:4:080:9 -115 13 <
ffff8101f4758780 3420084821 C Bi:4:080:9 0 13 = 55534253 e8968d80 00000000 01
ffff8101f4758780 3420088403 S Bo:4:080:10 -115 31 = 55534243 e8968d80 12000000 80000c03 00000012 00000000 00000000 000000
ffff8101f4758780 3420088821 C Bo:4:080:10 0 31 >
ffff8101f4758780 3420092402 S Bi:4:080:9 -115 18 <
ffff8101f4758780 3420092822 C Bi:4:080:9 0 18 = 70000200 0000000a 00000000 3a000000 0000
ffff8101f4758780 3420093929 S Bi:4:080:9 -115 13 <
ffff8101f4758780 3420094821 C Bi:4:080:9 0 13 = 55534253 e8968d80 00000000 00
ffff8101f4758780 3420096922 S Bo:4:080:10 -115 31 = 55534243 e8968d80 00000000 00000600 00000000 00000000 00000000 000000
ffff8101f4758780 3420097821 C Bo:4:080:10 0 31 >
ffff8101f4758780 3420100920 S Bi:4:080:9 -115 13 <
ffff8101f4758780 3420101827 C Bi:4:080:9 0 13 = 55534253 e8968d80 00000000 01
ffff8101f4758780 3420104049 S Bo:4:080:10 -115 31 = 55534243 e8968d80 12000000 80000c03 00000012 00000000 00000000 000000
ffff8101f4758780 3420104822 C Bo:4:080:10 0 31 >
ffff8101f4758780 3420108403 S Bi:4:080:9 -115 18 <
ffff8101f4758780 3420108823 C Bi:4:080:9 0 18 = 70000200 0000000a 00000000 3a000000 0000
ffff8101f4758780 3420112404 S Bi:4:080:9 -115 13 <
ffff8101f4758780 3420112823 C Bi:4:080:9 0 13 = 55534253 e8968d80 00000000 00
ffff8101f4758780 3420115964 S Bo:4:080:10 -115 31 = 55534243 e8968d80 00000000 00000600 00000000 00000000 00000000 000000
ffff8101f4758780 3420116822 C Bo:4:080:10 0 31 >
ffff8101f4758780 3420120403 S Bi:4:080:9 -115 13 <
ffff8101f4758780 3420120823 C Bi:4:080:9 0 13 = 55534253 e8968d80 00000000 01
ffff8101f4758780 3420123452 S Bo:4:080:10 -115 31 = 55534243 e8968d80 12000000 80000c03 00000012 00000000 00000000 000000
ffff8101f4758780 3420123823 C Bo:4:080:10 0 31 >
ffff8101f4758780 3420124839 S Bi:4:080:9 -115 18 <
ffff8101f4758780 3420125822 C Bi:4:080:9 0 18 = 70000200 0000000a 00000000 3a000000 0000
ffff81019bd72000 3420130198 S Bi:4:080:9 -115 13 <
ffff81019bd72000 3420130826 C Bi:4:080:9 0 13 = 55534253 e8968d80 00000000 00
ffff81019bd72000 3420132927 S Bo:4:080:10 -115 31 = 55534243 e8968d80 0c000000 8000061a 0000000c 00000000 00000000 000000
ffff81019bd72000 3420133823 C Bo:4:080:10 0 31 >
ffff81019bd72000 3420136406 S Bi:4:080:9 -115 12 <
ffff81019bd72000 3420136824 C Bi:4:080:9 -32 0
ffff81019bd72000 3420137930 S Co:4:080:0 s 02 01 0000 0089 0000 0
ffff81019bd72000 3420138824 C Co:4:080:0 0 0
ffff81019bd72000 3420139952 S Bi:4:080:9 -115 13 <
ffff81019bd72000 3420140823 C Bi:4:080:9 0 13 = 55534253 e8968d80 0c000000 01
ffff81019bd72000 3420143460 S Bo:4:080:10 -115 31 = 55534243 e8968d80 12000000 80000c03 00000012 00000000 00000000 000000
ffff81019bd72000 3420143824 C Bo:4:080:10 0 31 >
ffff81019bd72000 3420144987 S Bi:4:080:9 -115 18 <
ffff81019bd72000 3420145823 C Bi:4:080:9 0 18 = 70000500 0000000a 00000000 24000000 0000
ffff81019bd72000 3420148919 S Bi:4:080:9 -115 13 <
ffff81019bd72000 3420149825 C Bi:4:080:9 0 13 = 55534253 e8968d80 00000000 00
ffff81019bd72000 3420291700 S Bo:4:080:10 -115 31 = 55534243 28869580 00000000 00000600 00000000 00000000 00000000 000000
ffff81019bd72000 3420292837 C Bo:4:080:10 0 31 >
ffff81019bd72000 3420295455 S Bi:4:080:9 -115 13 <
ffff81019bd72000 3420295832 C Bi:4:080:9 0 13 = 55534253 28869580 00000000 01
ffff81019bd72000 3420297630 S Bo:4:080:10 -115 31 = 55534243 28869580 12000000 80000c03 00000012 00000000 00000000 000000
ffff81019bd72000 3420297833 C Bo:4:080:10 0 31 >
ffff81019bd72000 3420299853 S Bi:4:080:9 -115 18 <
ffff81019bd72000 3420300839 C Bi:4:080:9 0 18 = 70000200 0000000a 00000000 3a000000 0000
ffff81019bd72000 3420302685 S Bi:4:080:9 -115 13 <
ffff81019bd72000 3420302835 C Bi:4:080:9 0 13 = 55534253 28869580 00000000 00
ffff81019bd72000 3420308811 S Bo:4:080:10 -115 31 = 55534243 a8a48e80 0c000000 8000061a 0000000c 00000000 00000000 000000
ffff81019bd72000 3420309834 C Bo:4:080:10 0 31 >
ffff81019bd72000 3420312431 S Bi:4:080:9 -115 12 <
ffff81019bd72000 3420312834 C Bi:4:080:9 -32 0
ffff81019bd72000 3420315707 S Co:4:080:0 s 02 01 0000 0089 0000 0
ffff81019bd72000 3420316834 C Co:4:080:0 0 0
ffff81019bd72000 3420318416 S Bi:4:080:9 -115 13 <
ffff81019bd72000 3420318834 C Bi:4:080:9 0 13 = 55534253 a8a48e80 0c000000 01
ffff81019bd72000 3420319595 S Bo:4:080:10 -115 31 = 55534243 a8a48e80 12000000 80000c03 00000012 00000000 00000000 000000
ffff81019bd72000 3420319834 C Bo:4:080:10 0 31 >
ffff81019bd72000 3420321709 S Bi:4:080:9 -115 18 <
ffff81019bd72000 3420321838 C Bi:4:080:9 0 18 = 70000500 0000000a 00000000 24000000 0000
ffff81019bd72000 3420323604 S Bi:4:080:9 -115 13 <
ffff81019bd72000 3420323839 C Bi:4:080:9 0 13 = 55534253 a8a48e80 00000000 00
ffff81013b5e49c0 3467887155 S Bo:4:080:6 -115 12 = 01000000 01000000 78563412
ffff81012d59e0c0 3467888499 C Bi:4:080:5 0 28 = 04000000 00000000 00000000 00000000 01000000 1c000000 78563412
ffff81013b5e49c0 3467888506 C Bo:4:080:6 0 12 >
ffff81013b5e49c0 3467902199 S Bo:4:080:6 -115 28 = 00000000 00000000 03000000 00c20100 00000000 00000000 78563412
ffff81013b5e4cc0 3467902258 S Bi:4:080:5 -115 4096 <
ffff81013b5e49c0 3467902485 C Bo:4:080:6 0 28 >
ffff81013b5e4cc0 3467903508 C Bi:4:080:5 0 24 = 00000000 23000000 23000000 00c20100 18000000 78563412
ffff81013b5e4cc0 3467917185 S Bo:4:080:6 -115 3 = 41540d
ffff81013b5e49c0 3467917209 S Bi:4:080:5 -115 4096 <
ffff81013b5e4cc0 3467918486 C Bo:4:080:6 0 3 >
ffff81013b5e49c0 3467918508 C Bi:4:080:5 0 2 = 4154
ffff81013b5e49c0 3467961297 S Bi:4:080:5 -115 4096 <
ffff81013b5e49c0 3467962507 C Bi:4:080:5 0 2 = 0d0a
ffff81013b5e49c0 3467975142 S Bi:4:080:5 -115 4096 <
ffff81013b5e49c0 3467976507 C Bi:4:080:5 0 6 = 0d0a4f4b 0d0a
ffff81013b5e49c0 3467994211 S Bi:4:080:5 -115 4096 <
ffff81013b5e4cc0 3468035137 S Bo:4:080:6 -115 7 = 41544530 56310d
ffff81013b5e49c0 3468035512 C Bi:4:080:5 0 6 = 41544530 5631
ffff81013b5e4cc0 3468035518 C Bo:4:080:6 0 7 >
ffff81013b5e4cc0 3468088281 S Bi:4:080:5 -115 4096 <
ffff81013b5e4cc0 3468089516 C Bi:4:080:5 0 2 = 0d0a
ffff81013b5e4cc0 3468114140 S Bi:4:080:5 -115 4096 <
ffff81013b5e4cc0 3468115517 C Bi:4:080:5 0 6 = 0d0a4f4b 0d0a
ffff81013b5e4cc0 3468148320 S Bi:4:080:5 -115 4096 <
ffff81013b5e49c0 3468199203 S Bo:4:080:6 -115 3 = 41540d
ffff81013b5e49c0 3468199504 C Bo:4:080:6 0 3 >
ffff81013b5e4cc0 3468200517 C Bi:4:080:5 0 6 = 0d0a4f4b 0d0a
ffff81013b5e4cc0 3468235139 S Bi:4:080:5 -115 4096 <
ffff81013b5e49c0 3468236244 S Bo:4:080:6 -115 40 = 41542b63 6764636f 6e743d31 2c224950 222c2277 61702e76 6f696365 73747265
ffff81013b5e49c0 3468236505 C Bo:4:080:6 0 40 >
ffff81013b5e4cc0 3468238517 C Bi:4:080:5 0 6 = 0d0a4f4b 0d0a
ffff81013b5e4cc0 3468250229 S Bi:4:080:5 -115 4096 <
ffff81013b5e49c0 3468262280 S Bo:4:080:6 -115 7 = 41545330 3d300d
ffff81013b5e49c0 3468262505 C Bo:4:080:6 0 7 >
ffff81013b5e4cc0 3468263521 C Bi:4:080:5 0 6 = 0d0a4f4b 0d0a
ffff81013b5e4cc0 3468280249 S Bo:4:080:6 -115 28 = 00000000 23000000 03000000 00c20100 222c2277 61702e76 78563412
ffff81013b5e49c0 3468280275 S Bi:4:080:5 -115 4096 <
ffff81013b5e4cc0 3468281507 C Bo:4:080:6 0 28 >
ffff81013b5e49c0 3468281530 C Bi:4:080:5 0 24 = 00000000 23000000 23000000 00c20100 18000000 78563412
ffff81013b5e49c0 3468292210 S Bo:4:080:6 -115 3 = 41540d
ffff81013b5e49c0 3468292511 C Bo:4:080:6 0 3 >
ffff81013b5e49c0 3468293360 S Bi:4:080:5 -115 4096 <
ffff81013b5e49c0 3468293524 C Bi:4:080:5 0 6 = 0d0a4f4b 0d0a
ffff81013b5e49c0 3468315311 S Bi:4:080:5 -115 4096 <
ffff81013b5e4b40 3468339403 S Bo:4:080:6 -115 7 = 41544530 56310d
ffff81013b5e49c0 3468340533 C Bi:4:080:5 0 6 = 0d0a4f4b 0d0a
ffff81013b5e4b40 3468340540 C Bo:4:080:6 0 7 >
ffff81013b5e4e40 3468362247 S Bi:4:080:5 -115 4096 <
ffff81013b5e4900 3468369236 S Bo:4:080:6 -115 3 = 41540d
ffff81013b5e4900 3468369512 C Bo:4:080:6 0 3 >
ffff81013b5e4e40 3468370526 C Bi:4:080:5 0 6 = 0d0a4f4b 0d0a
ffff81013b5e4e40 3468380257 S Bi:4:080:5 -115 4096 <
ffff81013b5e4900 3468389143 S Bo:4:080:6 -115 40 = 41542b63 6764636f 6e743d31 2c224950 222c2277 61702e76 6f696365 73747265
ffff81013b5e4900 3468389513 C Bo:4:080:6 0 40 >
ffff81013b5e4e40 3468390528 C Bi:4:080:5 0 6 = 0d0a4f4b 0d0a
ffff81013b5e4e40 3468396494 S Bi:4:080:5 -115 4096 <
ffff81013b5e4900 3468404285 S Bo:4:080:6 -115 13 = 41544454 2a39392a 2a2a3123 0d
ffff81013b5e4900 3468404515 C Bo:4:080:6 0 13 >
ffff81013b5e4e40 3468405531 C Bi:4:080:5 0 11 = 0d0a434f 4e4e4543 540d0a
ffff81013b5e4900 3468409494 S Bi:4:080:5 -115 4096 <
ffff81013b5e4cc0 3473431022 S Bo:4:080:6 -115 28 = 00000000 23000000 03000000 00c20100 222c2277 61702e76 78563412
ffff81013b5e4900 3473432812 C Bi:4:080:5 0 24 = 00000000 23000000 23000000 00c20100 18000000 78563412
ffff81013b5e4cc0 3473432819 C Bo:4:080:6 0 28 >
ffff81013b5e4cc0 3473437051 S Bi:4:080:5 -115 4096 <
ffff81013b5e4900 3473442943 S Bo:4:080:6 -115 93 = 7eff7d23 c0217d21 7d207d20 327d227d 267d207d 207d207d 207d257d 267d34fa
ffff81013b5e4cc0 3473443814 C Bi:4:080:5 0 36 = 7eff7d23 c0217d21 7d207d20 7d2e7d22 7d267d20 7d207d20 7d207d23 7d24c023
ffff81013b5e4900 3473443820 C Bo:4:080:6 0 93 >
ffff81013b5e4900 3473445979 S Bo:4:080:6 -115 35 = 7eff7d23 c0217d22 7d207d20 7d2e7d22 7d267d20 7d207d20 7d207d23 7d24c023
ffff81013b5e4cc0 3473445999 S Bi:4:080:5 -115 4096 <
ffff81013b5e4900 3473446791 C Bo:4:080:6 0 35 >
ffff81013b5e4cc0 3473446813 C Bi:4:080:5 0 80 = 7eff7d23 c0217d24 7d207d20 2c7d257d 267d34fa 6ef17d27 7d227d28 7d227d2d
ffff81013b5e4cc0 3473450111 S Bo:4:080:6 -115 29 = 7eff7d23 c0217d21 7d217d20 7d2a7d22 7d267d20 7d207d20 7d20587b 7e
ffff81013b5e4900 3473450131 S Bi:4:080:5 -115 4096 <
ffff81013b5e4cc0 3473450792 C Bo:4:080:6 0 29 >
ffff81013b5e4900 3473450813 C Bi:4:080:5 0 30 = 7eff7d23 c0217d22 7d217d20 7d2a7d22 7d267d20 7d207d20 7d20317d 2f7e
ffff81013b5e4900 3473452913 S Bo:4:080:6 -115 95 = 7eff03c0 210c0200 1214fa6e f14d5352 41535635 2e303032 3b7e7eff 03c0210c
ffff81013b5e4cc0 3473452933 S Bi:4:080:5 -115 4096 <
ffff81013b5e4900 3473453798 C Bo:4:080:6 0 95 >
ffff81013b5e4cc0 3473453821 C Bi:4:080:5 0 41 = 7eff7d23 c0217d27 7d217d20 7d367d2c 7d227d20 7d327d34 fa6ef14d 53524153
ffff81013b5e4cc0 3473457940 S Bi:4:080:5 -115 4096 <
ffff81013b5e4cc0 3473458811 C Bi:4:080:5 0 52 = 7eff7d23 c0217d27 7d227d20 237d2c7d 237d207d 3f7d34fa 6ef14d53 5241532d
ffff81013b5e4cc0 3473463037 S Bi:4:080:5 -115 4096 <
ffff81013b5e4cc0 3475216914 C Bi:4:080:5 0 12 = 7eff03c0 23020000 0448dc7e
ffff8101eb77ba80 3475223164 S Bo:4:080:6 -115 66 = 7eff0380 fd010400 0a120600 000001bd c17e7eff 03802101 05002802 06002d0f
ffff8101eb77b0c0 3475223229 S Bi:4:080:5 -115 4096 <
ffff8101eb77ba80 3475224897 C Bo:4:080:6 0 66 >
ffff8101eb77b0c0 3475224921 C Bi:4:080:5 0 40 = 7eff7d23 c0217d28 7d237d20 7d3080fd 7d217d24 7d207d2a 7d327d26 7d207d20
ffff8101eb77b0c0 3475227215 S Bi:4:080:5 -115 4096 <
ffff8101eb77b0c0 3475227912 C Bi:4:080:5 0 18 = 7eff0380 21010400 0a0306a9 fe01012b 957e
ffff8101eb77b0c0 3475230173 S Bo:4:080:6 -115 18 = 7eff0380 21020400 0a0306a9 fe010142 e17e
ffff8101eb77ba80 3475230222 S Bi:4:080:5 -115 4096 <
ffff8101eb77b0c0 3475230892 C Bo:4:080:6 0 18 >
ffff8101eb77ba80 3475230912 C Bi:4:080:5 0 30 = 7eff0380 21040500 16020600 2d0f0182 06000000 00840600 0000007c 9f7e
ffff8101eb77ba80 3475234612 S Bo:4:080:6 -115 30 = 7eff0380 21010600 16030600 00000081 06000000 00830600 0000006a 5f7e
ffff8101eb77b0c0 3475234677 S Bi:4:080:5 -115 4096 <
ffff8101eb77ba80 3475234894 C Bo:4:080:6 0 30 >
ffff8101eb77b0c0 3475235920 C Bi:4:080:5 0 30 = 7eff0380 21030600 16030619 e29bbd81 06425e09 78830642 5e1978eb 817e
ffff8101eb77b0c0 3475237654 S Bo:4:080:6 -115 30 = 7eff0380 21010700 16030619 e29bbd81 06425e09 78830642 5e19782c ec7e
ffff8101eb77ba80 3475237699 S Bi:4:080:5 -115 4096 <
ffff8101eb77b0c0 3475237904 C Bo:4:080:6 0 30 >
ffff8101eb77ba80 3475238982 C Bi:4:080:5 0 30 = 7eff0380 21020700 16030619 e29bbd81 06425e09 78830642 5e1978da 1f7e
ffff8101eb77ba80 3475240592 S Bi:4:080:5 -115 4096 <
ffff81013b5e4900 3475420203 S Bo:4:080:6 -115 336 = 7eff0300 21450001 48002900 00801183 dd19e29b bdffffff ff004400 4301345e
ffff81013b5e4900 3475420909 C Bo:4:080:6 0 336 >
ffff81013b5e4900 3475653746 S Bo:4:080:6 -115 56 = 7eff0300 21450000 30002b40 00800677 8e19e29b bdd809f5 65040501 bb708d7f
ffff81013b5e4900 3475653919 C Bo:4:080:6 0 56 >
ffff8101eb77ba80 3476152965 C Bi:4:080:5 0 56 = 7eff0300 21450000 30abbf40 00eb0660 f9d809f5 6519e29b bd01bb04 05659450
ffff81013b5e4900 3476168111 S Bo:4:080:6 -115 48 = 7eff0300 21450000 28002d40 00800677 9419e29b bdd809f5 65040501 bb708d7f
ffff81013b5e4b40 3476168135 S Bi:4:080:5 -115 4096 <
ffff81013b5e4900 3476169944 C Bo:4:080:6 0 48 >
ffff81013b5e4900 3476200177 S Bo:4:080:6 -115 127 = 7eff0300 21450000 76002e40 00800677 4519e29b bdd809f5 65040501 bb708d7f
ffff81013b5e4900 3476200949 C Bo:4:080:6 0 127 >
ffff81013b5e4b40 3476797998 C Bi:4:080:5 0 1006 = 7eff0300 21450003 e2f1b640 00eb0617 50d809f5 6519e29b bd01bb04 05659450
ffff8101eb77b540 3476808072 S Bo:4:080:6 -115 253 = 7eff0300 21450000 f4003040 00800676 c519e29b bdd809f5 65040501 bb708d7f
ffff8101eb77bb40 3476808134 S Bi:4:080:5 -115 4096 <
ffff8101eb77b540 3476808982 C Bo:4:080:6 0 253 >
ffff8101eb77bb40 3477338029 C Bi:4:080:5 0 116 = 7eff0300 21450000 6b419f40 00eb06ca ded809f5 6519e29b bd01bb04 05659454
ffff81013b5e4900 3477425038 S Bi:4:080:5 -115 4096 <
ffff81013b5e49c0 3477448285 S Bo:4:080:6 -115 48 = 7eff0300 21450000 28003240 00800677 8f19e29b bdd809f5 65040501 bb708d80
ffff81013b5e49c0 3477449019 C Bo:4:080:6 0 48 >
ffff81013b5e49c0 3477578449 S Bo:4:080:6 -115 286 = 7eff0300 21450001 15003340 00800676 a119e29b bdd809f5 65040501 bb708d80
ffff81013b5e49c0 3477579028 C Bo:4:080:6 0 286 >
ffff81013b5e4900 3478265080 C Bi:4:080:5 0 128 = 7eff0300 21450000 78be4940 00eb064e 27d809f5 6519e29b bd01bb04 05659459
ffff81013b5e4900 3478269999 S Bo:4:080:6 -115 59 = 7eff0300 21450000 34003540 00800677 8019e29b bdd809f5 65040501 bb708d81
ffff81013b5e4840 3478270021 S Bi:4:080:5 -115 4096 <
ffff81013b5e4900 3478271060 C Bo:4:080:6 0 59 >
ffff81013b5e4900 3478272999 S Bo:4:080:6 -115 1 = 7e
ffff81013b5e4900 3478274059 C Bo:4:080:6 0 1 >
ffff81013b5e4840 3478435093 C Bi:4:080:5 0 1437 = 7eff0300 21450005 8cbe4840 00eb0649 14d809f5 6519e29b bd01bb04 05659454
ffff81013b5e4840 3478439056 S Bo:4:080:6 -115 48 = 7eff0300 21450000 28003640 00800677 8b19e29b bdd809f5 65040501 bb708d81
ffff81013b5e4900 3478440018 S Bi:4:080:5 -115 4096 <
ffff81013b5e4840 3478440070 C Bo:4:080:6 0 48 >
ffff81013b5e4900 3478463096 C Bi:4:080:5 0 232 = 7eff0300 21450000 dfbe5c40 00eb064d add809f5 6519e29b bd01bb04 0565945a
ffff81013b5e4900 3478465005 S Bo:4:080:6 -115 48 = 7eff0300 21450000 28003740 00800677 8a19e29b bdd809f5 65040501 bb708d81
ffff81013b5e4840 3478465026 S Bi:4:080:5 -115 4096 <
ffff81013b5e4900 3478466069 C Bo:4:080:6 0 48 >
ffff81013b5e4900 3478546858 S Bo:4:080:6 -115 48 = 7eff0300 21450000 28003840 00800677 8919e29b bdd809f5 65040501 bb708d81
ffff81013b5e4900 3478547079 C Bo:4:080:6 0 48 >
ffff81013b5e4840 3478852118 C Bi:4:080:5 0 48 = 7eff0300 21450000 2812a740 00eb06fa 19d809f5 6519e29b bd01bb04 0565945a
ffff8101eb77b540 3478909226 S Bi:4:080:5 -115 4096 <
ffff8101eb77b180 3478916249 S Bo:4:080:4 -115 8 = 00000800 0b06000b
ffff81012d59e3c0 3478917122 C Bi:4:080:3 0 8 = 00000800 0c06000b
ffff8101eb77b180 3478917129 C Bo:4:080:4 0 8 >
ffff8101eb77b180 3478918172 S Bi:4:080:3 -115 4096 <
ffff8101eb77bd80 3478968068 S Bo:4:080:4 -115 24 = 00001800 07ff000c 52494d20 4465736b 746f7000 00000000
ffff8101eb77bc00 3478968136 S Bi:4:080:3 -115 4096 <
ffff8101eb77bd80 3478969111 C Bo:4:080:4 0 24 >
ffff8101eb77b180 3478971133 C Bi:4:080:3 0 44 = 00002c00 0804000c 52494d20 4465736b 746f7000 00000000 00000000 01000400
ffff8101eb77bc00 3478971159 C Bi:4:080:3 0 12 = 00000c00 13040100 00000000
ffff8101eb77bc00 3478980895 S Bi:4:080:3 -115 4096 <
ffff81013b5e4900 3479375953 S Bo:4:080:6 -115 336 = 7eff0300 21450001 48003900 00801183 cd19e29b bdffffff ff004400 4301345a
ffff81013b5e4900 3479377131 C Bo:4:080:6 0 336 >
ffff81018515a840 3484479821 S Bo:4:080:6 -115 57 = 7eff0300 21450000 30004940 008006e6 fb19e29b bd4a7d5d 1367040b 0050c0ee
ffff81018515a840 3484481420 C Bo:4:080:6 0 57 >
ffff8101eb77b540 3485133466 C Bi:4:080:5 0 58 = 7eff0300 21450000 307d5ed4 0000c606 62704a7d 5d136719 e29bbd00 50040b29
ffff81013b5e4e40 3485153675 S Bo:4:080:6 -115 49 = 7eff0300 21450000 28004a40 008006e7 0219e29b bd4a7d5d 1367040b 0050c0ee
ffff81013b5e4240 3485153707 S Bi:4:080:5 -115 4096 <
ffff81013b5e4e40 3485155447 C Bo:4:080:6 0 49 >
ffff81013b5e4e40 3485162778 S Bo:4:080:6 -115 806 = 7eff0300 21450003 1d004b40 008006e4 0c19e29b bd4a7d5d 1367040b 0050c0ee
ffff81013b5e4e40 3485164452 C Bo:4:080:6 0 806 >
ffff81013b5e4240 3485594488 C Bi:4:080:5 0 49 = 7eff0300 21450000 289fe800 00c60641 644a7d5d 136719e2 9bbd0050 040b2919
ffff81013b5e4240 3485598644 S Bi:4:080:5 -115 4096 <
ffff81013b5e4240 3486086515 C Bi:4:080:5 0 640 = 7eff0300 21450002 77be1c00 00c60620 e14a7d5d 136719e2 9bbd0050 040b2919
ffff81013b5e4240 3486094080 S Bi:4:080:5 -115 4096 <
ffff81013b5e4000 3486120105 S Bo:4:080:6 -115 57 = 7eff0300 21450000 30005740 008006e6 f119e29b bd4a7d5d 1363040d 0050259c
ffff81013b5e4000 3486120503 C Bo:4:080:6 0 57 >
ffff81013b5e4000 3486262577 S Bo:4:080:6 -115 49 = 7eff0300 21450000 28005840 008006e6 f419e29b bd4a7d5d 1367040b 0050c0ee
ffff81013b5e4000 3486263509 C Bo:4:080:6 0 49 >
ffff81013b5e4240 3486353534 C Bi:4:080:5 0 57 = 7eff0300 21450000 30d45c00 00c6060c ec4a7d5d 136319e2 9bbd0050 040d2a3d
ffff81013b5e4240 3486358417 S Bo:4:080:6 -115 49 = 7eff0300 21450000 28005940 008006e6 f719e29b bd4a7d5d 1363040d 0050259c
ffff81013b5e4240 3486359511 C Bo:4:080:6 0 49 >
ffff81013b5e4000 3486363410 S Bo:4:080:6 -115 692 = 7eff0300 21450002 ab005a40 008006e4 7319e29b bd4a7d5d 1363040d 0050259c
ffff81013b5e4f00 3486363470 S Bi:4:080:5 -115 4096 <
ffff81013b5e4000 3486364517 C Bo:4:080:6 0 692 >
ffff81013b5e4f00 3486807551 C Bi:4:080:5 0 1517 = 7eff0300 21450005 dcee3000 00c606ed 6b4a7d5d 136319e2 9bbd0050 040d2a3d
ffff8100cd1ac840 3486810391 S Bi:4:080:5 -115 4096 <
ffff8100cd1ac840 3486945569 C Bi:4:080:5 0 1381 = 7eff0300 21450005 55ee3800 00c606ed ea4a7d5d 136319e2 9bbd0050 040d2a3d
ffff81013b5e4000 3486981851 S Bo:4:080:6 -115 50 = 7eff0300 21450000 28005b40 008006e6 f519e29b bd4a7d5d 1363040d 0050259c
ffff81013b5e4240 3486982821 S Bi:4:080:5 -115 4096 <
ffff81013b5e4000 3486983553 C Bo:4:080:6 0 50 >
ffff81013b5e4f00 3487164509 S Bo:4:080:6 -115 50 = 7eff0300 21450000 28005e40 008006e6 f219e29b bd4a7d5d 1363040d 0050259c
ffff81013b5e4f00 3487165560 C Bo:4:080:6 0 50 >
ffff81013b5e4f00 3490236238 S Bo:4:080:6 -115 56 = 7eff0300 21450000 30006740 00800633 6f19e29b bd3ff5d1 5d040f00 50ceecef
ffff81013b5e4f00 3490237730 C Bo:4:080:6 0 56 >
ffff81013b5e4240 3490759775 C Bi:4:080:5 0 56 = 7eff0300 21450000 30f22800 00c6063b ad3ff5d1 5d19e29b bd005004 0f2e6fd9
ffff81013b5e4240 3490762667 S Bo:4:080:6 -115 48 = 7eff0300 21450000 28006840 00800633 7619e29b bd3ff5d1 5d040f00 50ceecef
ffff81013b5e4540 3490762690 S Bi:4:080:5 -115 4096 <
ffff81013b5e4240 3490763756 C Bo:4:080:6 0 48 >
ffff81013b5e4240 3490765693 S Bo:4:080:6 -115 800 = 7eff0300 21450003 18006940 00800630 8519e29b bd3ff5d1 5d040f00 50ceecef
ffff81013b5e4240 3490767759 C Bo:4:080:6 0 800 >
ffff81013b5e4540 3491214876 C Bi:4:080:5 0 706 = 7eff0300 21450002 ba119800 00c60619 b43ff5d1 5d19e29b bd005004 0f2e6fd9
ffff81013212c240 3491243631 S Bi:4:080:5 -115 4096 <
ffff81013b5e4f00 3491290793 S Bo:4:080:6 -115 56 = 7eff0300 21450000 30007640 00800633 6019e29b bd3ff5d1 5d041100 50e39691
ffff81013b5e4f00 3491291789 C Bo:4:080:6 0 56 >
ffff81013b5e40c0 3491365070 S Bo:4:080:6 -115 48 = 7eff0300 21450000 28007740 00800633 6719e29b bd3ff5d1 5d040f00 50ceecf2
ffff81013b5e40c0 3491365792 C Bo:4:080:6 0 48 >
ffff81013212c240 3491513820 C Bi:4:080:5 0 56 = 7eff0300 21450000 3021ec00 00c6060b ea3ff5d1 5d19e29b bd005004 112f0c8b
ffff81013b5e40c0 3491518150 S Bo:4:080:6 -115 48 = 7eff0300 21450000 28007840 00800633 6619e29b bd3ff5d1 5d041100 50e39691
ffff81013b5e4180 3491518174 S Bi:4:080:5 -115 4096 <
ffff81013b5e40c0 3491518799 C Bo:4:080:6 0 48 >
ffff81013b5e40c0 3491520053 S Bo:4:080:6 -115 766 = 7eff0300 21450002 f6007940 00800630 9719e29b bd3ff5d1 5d041100 50e39691
ffff81013b5e40c0 3491521798 C Bo:4:080:6 0 766 >
ffff81013b5e4180 3492024846 C Bi:4:080:5 0 748 = 7eff0300 21450002 e43dac00 00c606ed 753ff5d1 5d19e29b bd005004 112f0c8b
ffff81013b5e4180 3492044044 S Bi:4:080:5 -115 4096 <
ffff81013b5e46c0 3492050335 S Bo:4:080:6 -115 56 = 7eff0300 21450000 30008440 0080068e 4819e29b bdd43ae2 21041300 50d6954f
ffff81013b5e46c0 3492050831 C Bo:4:080:6 0 56 >
ffff81013b5e4780 3492172360 S Bo:4:080:6 -115 48 = 7eff0300 21450000 28008540 00800633 5919e29b bd3ff5d1 5d041100 50e39693
ffff81013b5e4780 3492172837 C Bo:4:080:6 0 48 >
ffff81013b5e4180 3492274863 C Bi:4:080:5 0 56 = 7eff0300 21450000 304c6c00 00c6063c 60d43ae2 2119e29b bd005004 132fa183
ffff81013b5e4180 3492278328 S Bo:4:080:6 -115 48 = 7eff0300 21450000 28008640 0080068e 4e19e29b bdd43ae2 21041300 50d6954f
ffff81013b5e40c0 3492278351 S Bi:4:080:5 -115 4096 <
ffff81013b5e4180 3492278840 C Bo:4:080:6 0 48 >
ffff81013b5e4180 3492279975 S Bo:4:080:6 -115 808 = 7eff0300 21450003 20008740 0080068b 5519e29b bdd43ae2 21041300 50d6954f
ffff81013b5e4180 3492281840 C Bo:4:080:6 0 808 >
ffff81013b5e40c0 3492796891 C Bi:4:080:5 0 48 = 7eff0300 21450000 2868e800 00c6061f ecd43ae2 2119e29b bd005004 132fa183
ffff81013b5e40c0 3492797944 S Bi:4:080:5 -115 4096 <
ffff81013b5e40c0 3493409934 C Bi:4:080:5 0 1508 = 7eff0300 21450005 dc81b800 00c60601 68d43ae2 2119e29b bd005004 132fa183
ffff8101ef13c600 3493438655 S Bi:4:080:5 -115 4096 <
ffff8101ef13c600 3493440790 C Bi:4:080:5 0 1508 = 7eff0300 21450005 dc81c000 00c60601 60d43ae2 2119e29b bd005004 132fa189
ffff8101ef13c600 3493452391 S Bo:4:080:6 -115 48 = 7eff0300 21450000 28008840 0080068e 4c19e29b bdd43ae2 21041300 50d69552
ffff8101ef3c9540 3493452462 S Bi:4:080:5 -115 4096 <
ffff8101ef13c600 3493452908 C Bo:4:080:6 0 48 >
ffff8101ef3c9540 3493872945 C Bi:4:080:5 0 1508 = 7eff0300 21450005 dc986000 00c606ea bfd43ae2 2119e29b bd005004 132fa18e
ffff8101ef3c9540 3493887580 S Bi:4:080:5 -115 4096 <
ffff8101ef3c9540 3493889950 C Bi:4:080:5 0 1508 = 7eff0300 21450005 dc986400 00c606ea bbd43ae2 2119e29b bd005004 132fa194
ffff8101ef3c9540 3493905082 S Bo:4:080:6 -115 48 = 7eff0300 21450000 28008940 0080068e 4b19e29b bdd43ae2 21041300 50d69552
ffff8101f8a0d6c0 3493905151 S Bi:4:080:5 -115 4096 <
ffff8101ef3c9540 3493906934 C Bo:4:080:6 0 48 >
ffff8101f8a0d6c0 3493907944 C Bi:4:080:5 0 1078 = 7eff0300 21450005 dc986800 00c606ea b7d43ae2 2119e29b bd005004 132fa19a
ffff8101f8a0d6c0 3493910495 S Bi:4:080:5 -115 4096 <
ffff8101f8a0d6c0 3493911947 C Bi:4:080:5 0 430 = 61696c20 77696474 683d2236 36222068 65696768 743d2234 39222075 726c3d22
ffff8101f8a0d6c0 3493926504 S Bi:4:080:5 -115 4096 <
ffff8101eb5a7180 3494074986 S Bo:4:080:6 -115 48 = 7eff0300 21450000 28008a40 0080068e 4a19e29b bdd43ae2 21041300 50d69552
ffff8101eb5a7180 3494075942 C Bo:4:080:6 0 48 >
ffff8101f8a0d6c0 3494204967 C Bi:4:080:5 0 1508 = 7eff0300 21450005 dcb33c00 00c606cf e3d43ae2 2119e29b bd005004 132fa19f
ffff8101eb5a7180 3494221655 S Bi:4:080:5 -115 4096 <
ffff8101df23f480 3494370313 S Bo:4:080:6 -115 48 = 7eff0300 21450000 28008b40 0080068e 4919e29b bdd43ae2 21041300 50d69552
ffff8101df23f480 3494370960 C Bo:4:080:6 0 48 >
ffff8101eb5a7180 3494462980 C Bi:4:080:5 0 1508 = 7eff0300 21450005 dcb34000 00c606cf dfd43ae2 2119e29b bd005004 132fa1a5
ffff8101df23f480 3494480998 S Bi:4:080:5 -115 4096 <
ffff8101df23f480 3494504986 C Bi:4:080:5 0 1509 = 7eff0300 21450005 dcb34400 00c606cf dbd43ae2 2119e29b bd005004 132fa1ab
ffff8101df23f480 3494519802 S Bo:4:080:6 -115 48 = 7eff0300 21450000 28008c40 0080068e 4819e29b bdd43ae2 21041300 50d69552
ffff8101f8a99540 3494519874 S Bi:4:080:5 -115 4096 <
ffff8101df23f480 3494519967 C Bo:4:080:6 0 48 >
ffff8101f8a99540 3494521980 C Bi:4:080:5 0 1508 = 7eff0300 21450005 dcbac800 00c606c8 57d43ae2 2119e29b bd005004 132fa1b0
ffff8101f8a99540 3494537739 S Bi:4:080:5 -115 4096 <
ffff8101f8a99540 3494578995 C Bi:4:080:5 0 1508 = 7eff0300 21450005 dcbacc00 00c606c8 53d43ae2 2119e29b bd005004 132fa1b6
ffff8101f8a99540 3494591600 S Bo:4:080:6 -115 48 = 7eff0300 21450000 28008d40 0080068e 4719e29b bdd43ae2 21041300 50d69552
ffff81005c628e40 3494591670 S Bi:4:080:5 -115 4096 <
ffff8101f8a99540 3494591971 C Bo:4:080:6 0 48 >
ffff81005c628e40 3494641996 C Bi:4:080:5 0 1508 = 7eff0300 21450005 dcca8800 00c606b8 97d43ae2 2119e29b bd005004 132fa1bc
ffff81005c628e40 3494658022 S Bi:4:080:5 -115 4096 <
ffff81005c628900 3494769054 S Bo:4:080:6 -115 48 = 7eff0300 21450000 28008e40 0080068e 4619e29b bdd43ae2 21041300 50d69552
ffff81005c628900 3494769981 C Bo:4:080:6 0 48 >
ffff81005c628e40 3494848007 C Bi:4:080:5 0 1508 = 7eff0300 21450005 dcca8c00 00c606b8 93d43ae2 2119e29b bd005004 132fa1c2
ffff81005c628e40 3494861014 S Bi:4:080:5 -115 4096 <
ffff81005c628e40 3494905013 C Bi:4:080:5 0 668 = 7eff0300 21450002 94d3d400 00c606b2 93d43ae2 2119e29b bd005004 132fa1c7
ffff81005c628e40 3494970373 S Bo:4:080:6 -115 48 = 7eff0300 21450000 28008f40 0080068e 4519e29b bdd43ae2 21041300 50d69552
ffff81005c628900 3494970431 S Bi:4:080:5 -115 4096 <
ffff81005c628e40 3494972003 C Bo:4:080:6 0 48 >
ffff81005c628900 3496057073 C Bi:4:080:5 0 49 = 7eff0300 21450000 28219800 00c606bf b44a7d5d 136719e2 9bbd0050 040b2919
ffff8101ef16f180 3496058697 S Bo:4:080:6 -115 49 = 7eff0300 21450000 28009240 008006e6 ba19e29b bd4a7d5d 1367040b 0050c0ee
ffff8101ef16f780 3496058749 S Bi:4:080:5 -115 4096 <
ffff8101ef16f180 3496060049 C Bo:4:080:6 0 49 >
ffff8101ef16f780 3496758112 C Bi:4:080:5 0 49 = 7eff0300 21450000 284df400 00c60693 5c4a7d5d 136319e2 9bbd0050 040d2a3d
ffff8101ef16f780 3496759727 S Bo:4:080:6 -115 50 = 7eff0300 21450000 28009340 008006e6 bd19e29b bd4a7d5d 1363040d 0050259c
ffff8101ef16f180 3496759780 S Bi:4:080:5 -115 4096 <
ffff8101ef16f780 3496761089 C Bo:4:080:6 0 50 >
ffff8101ef16f780 3497997010 S Bo:4:080:6 -115 99 = 7eff0300 21450000 28009640 008006e6 ba19e29b bd4a7d5d 1363040d 0050259c
ffff8101ef16f780 3497998161 C Bo:4:080:6 0 99 >
ffff8101ef16f180 3498235194 C Bi:4:080:5 0 49 = 7eff0300 21450000 28ac3800 00c60635 184a7d5d 136319e2 9bbd0050 040d2a3d
ffff8101eb79d540 3498238765 S Bi:4:080:5 -115 4096 <
ffff8101eb79d540 3498240188 C Bi:4:080:5 0 49 = 7eff0300 21450000 28ad2000 00c60634 2c4a7d5d 136719e2 9bbd0050 040b2919
ffff8101eb79d540 3498242824 S Bi:4:080:5 -115 4096 <
ffff8101483ec000 3498878137 S Bo:4:080:6 -115 57 = 7eff0300 21450000 3000a040 00800686 f119e29b bd40167d 5d810415 00505941
ffff8101483ec000 3498879211 C Bo:4:080:6 0 57 >
ffff8101eb79d540 3499117245 C Bi:4:080:5 0 57 = 7eff0300 21450000 30ef9800 00c60691 f840167d 5d8119e2 9bbd0050 04153627
ffff8101483ec000 3499119094 S Bo:4:080:6 -115 49 = 7eff0300 21450000 2800a140 00800686 f819e29b bd40167d 5d810415 00505941
ffff8101483ec480 3499119160 S Bi:4:080:5 -115 4096 <
ffff8101483ec000 3499120234 C Bo:4:080:6 0 49 >
ffff8101483ec000 3499122410 S Bo:4:080:6 -115 428 = 7eff0300 21450001 a300a240 00800685 7c19e29b bd40167d 5d810415 00505941
ffff8101483ec000 3499123226 C Bo:4:080:6 0 428 >
ffff8101483ec480 3499596270 C Bi:4:080:5 0 49 = 7eff0300 21450000 280aa400 00c60676 f540167d 5d8119e2 9bbd0050 04153627
ffff810173c30180 3499598066 S Bi:4:080:5 -115 4096 <
ffff810173c30180 3499677278 C Bi:4:080:5 0 303 = 7eff0300 21450001 260fd800 00c60670 c340167d 5d8119e2 9bbd0050 04153627
ffff810204426900 3499684024 S Bo:4:080:6 -115 465 = 7eff0300 21450001 c800a740 00800685 5219e29b bd40167d 5d810415 00505941
ffff810204426b40 3499684050 S Bi:4:080:5 -115 4096 <
ffff810204426900 3499685259 C Bo:4:080:6 0 465 >
ffff810204426b40 3500094299 C Bi:4:080:5 0 49 = 7eff0300 21450000 28271400 00c6065a 8540167d 5d8119e2 9bbd0050 04153627
ffff810204426b40 3500098008 S Bi:4:080:5 -115 4096 <
ffff810204426b40 3500590320 C Bi:4:080:5 0 1509 = 7eff0300 21450005 dc35ec00 00c60645 f940167d 5d8119e2 9bbd0050 04153627
ffff8101df03c180 3500640508 S Bo:4:080:6 -115 171 = 7eff0300 21450000 3000b640 00800686 db19e29b bd40167d 5d810416 00505484
ffff8101df03ca80 3500641485 S Bi:4:080:5 -115 4096 <
ffff8101df03c180 3500642312 C Bo:4:080:6 0 171 >
ffff8101df03ca80 3500643321 C Bi:4:080:5 0 1509 = 7eff0300 21450005 dc35f400 00c60645 f140167d 5d8119e2 9bbd0050 04153627
ffff8101483ec480 3500652692 S Bo:4:080:6 -115 49 = 7eff0300 21450000 2800ba40 00800686 df19e29b bd40167d 5d810415 00505941
ffff8101483ec480 3500653313 C Bo:4:080:6 0 49 >
ffff8101483ec480 3500657566 S Bi:4:080:5 -115 4096 <
ffff8101483ec480 3500685331 C Bi:4:080:5 0 1509 = 7eff0300 21450005 dc35f800 00c60645 ed40167d 5d8119e2 9bbd0050 04153627
ffff8101483ec480 3500689163 S Bi:4:080:5 -115 4096 <
ffff8101483ec480 3500874356 C Bi:4:080:5 0 58 = 7eff0300 21450000 30550800 00c6062c 8940167d 5d8119e2 9bbd0050 04163797
ffff8101483ec480 3500876363 S Bo:4:080:6 -115 50 = 7eff0300 21450000 2800bb40 00800686 de19e29b bd40167d 5d810416 00505484
ffff8101483ec900 3500876426 S Bi:4:080:5 -115 4096 <
ffff8101483ec480 3500877323 C Bo:4:080:6 0 50 >
ffff8101483ec480 3500880180 S Bo:4:080:6 -115 474 = 7eff0300 21450001 d000bc40 00800685 3519e29b bd40167d 5d810416 00505484
ffff8101483ec480 3500881324 C Bo:4:080:6 0 474 >
ffff8101483ec480 3500884111 S Bo:4:080:6 -115 49 = 7eff0300 21450000 2800bd40 00800686 dc19e29b bd40167d 5d810415 00505941
ffff8101483ec480 3500884319 C Bo:4:080:6 0 49 >
ffff8101483ec900 3500918344 C Bi:4:080:5 0 57 = 7eff0300 21450000 30584000 00c60629 5140167d 5d8119e2 9bbd0050 041737a7
ffff81012cb18480 3500922027 S Bo:4:080:6 -115 49 = 7eff0300 21450000 2800be40 00800686 db19e29b bd40167d 5d810417 00504d4a
ffff81012cb18480 3500922321 C Bo:4:080:6 0 49 >
ffff81012cb18480 3500922967 S Bi:4:080:5 -115 4096 <
ffff81012cb18a80 3500923966 S Bo:4:080:6 -115 474 = 7eff0300 21450001 d100bf40 00800685 3119e29b bd40167d 5d810417 00504d4a
ffff81012cb18a80 3500925321 C Bo:4:080:6 0 474 >
ffff81012cb18480 3501139353 C Bi:4:080:5 0 57 = 7eff0300 21450000 3059e400 00c60627 ad40167d 5d8119e2 9bbd0050 041837ab
ffff81012cb18480 3501142577 S Bo:4:080:6 -115 49 = 7eff0300 21450000 2800c040 00800686 d919e29b bd40167d 5d810418 00502004
ffff81012cb18a80 3501142601 S Bi:4:080:5 -115 4096 <
ffff81012cb18480 3501143333 C Bo:4:080:6 0 49 >
ffff81012cb18480 3501146127 S Bo:4:080:6 -115 458 = 7eff0300 21450001 c100c140 00800685 3f19e29b bd40167d 5d810418 00502004
ffff81012cb18480 3501147336 C Bo:4:080:6 0 458 >
ffff81012cb18a80 3501174371 C Bi:4:080:5 0 1509 = 7eff0300 21450005 dc5bbc00 00c60620 2940167d 5d8119e2 9bbd0050 04153627
ffff8101483ec480 3501176380 S Bi:4:080:5 -115 4096 <
ffff8101483ec480 3501178355 C Bi:4:080:5 0 1509 = 7eff0300 21450005 dc5bc000 00c60620 2540167d 5d8119e2 9bbd0050 04153627
ffff8101483ec480 3501192993 S Bo:4:080:6 -115 49 = 7eff0300 21450000 2800c240 00800686 d719e29b bd40167d 5d810415 00505941
ffff8101483ecb40 3501193055 S Bi:4:080:5 -115 4096 <
ffff8101483ec480 3501194341 C Bo:4:080:6 0 49 >
ffff8101483ecb40 3501299377 C Bi:4:080:5 0 1509 = 7eff0300 21450005 dc5bc400 00c60620 2140167d 5d8119e2 9bbd0050 04153627
ffff81012cb18000 3501302001 S Bi:4:080:5 -115 4096 <
ffff81012cb18000 3501302363 C Bi:4:080:5 0 48 = 7eff0300 21450000 2868d800 00c606c5 053ff5d1 5d19e29b bd005004 0f2e6fdb
ffff81012cb18000 3501304044 S Bo:4:080:6 -115 48 = 7eff0300 21450000 2800c340 00800633 1b19e29b bd3ff5d1 5d040f00 50ceecf2
ffff81012cb18000 3501304350 C Bo:4:080:6 0 48 >
ffff81012cb18000 3501304882 S Bi:4:080:5 -115 4096 <
ffff81012cb18240 3501478958 S Bo:4:080:6 -115 49 = 7eff0300 21450000 2800c440 00800686 d519e29b bd40167d 5d810415 00505941
ffff81012cb18240 3501479358 C Bo:4:080:6 0 49 >
ffff81012cb18000 3501626382 C Bi:4:080:5 0 1510 = 7eff0300 21450005 dc7d5d8c 0000c606 fe584016 7d5d8119 e29bbd00 50041536
ffff81012cb18000 3501630149 S Bi:4:080:5 -115 4096 <
ffff81012cb186c0 3501781074 S Bo:4:080:6 -115 49 = 7eff0300 21450000 2800c540 00800686 d419e29b bd40167d 5d810415 00505941
ffff81012cb186c0 3501781373 C Bo:4:080:6 0 49 >
ffff81012cb18000 3501884393 C Bi:4:080:5 0 1510 = 7eff0300 21450005 dc7d5d90 0000c606 fe544016 7d5d8119 e29bbd00 50041536
ffff81012cb18000 3501886999 S Bi:4:080:5 -115 4096 <
ffff81012cb18000 3501888394 C Bi:4:080:5 0 326 = 7eff0300 21450001 3d7f4800 00c60601 3c40167d 5d8119e2 9bbd0050 04153627
ffff81012cb18000 3501891208 S Bo:4:080:6 -115 49 = 7eff0300 21450000 2800c640 00800686 d319e29b bd40167d 5d810415 00505941
ffff81012cb186c0 3501891230 S Bi:4:080:5 -115 4096 <
ffff81012cb18000 3501891374 C Bo:4:080:6 0 49 >
ffff81012cb186c0 3501945403 C Bi:4:080:5 0 1511 = 7eff0300 21450005 dc86b000 00c606f5 3440167d 5d8119e2 9bbd0050 04163797
ffff81012cb186c0 3501950963 S Bi:4:080:5 -115 4096 <
ffff81012cb186c0 3501951395 C Bi:4:080:5 0 174 = 7eff0300 21450000 a486b800 00c606fa 6440167d 5d8119e2 9bbd0050 04163797
ffff81012cb186c0 3501954872 S Bo:4:080:6 -115 50 = 7eff0300 21450000 2800c940 00800686 d019e29b bd40167d 5d810416 00505484
ffff81012cb18000 3501954899 S Bi:4:080:5 -115 4096 <
ffff81012cb186c0 3501955383 C Bo:4:080:6 0 50 >
ffff81012cb18000 3501955407 C Bi:4:080:5 0 49 = 7eff0300 21450000 28871800 00c606fa 8040167d 5d8119e2 9bbd0050 041737a7
ffff81012cb18000 3501957901 S Bi:4:080:5 -115 4096 <
ffff81012cb18000 3501958395 C Bi:4:080:5 0 49 = 7eff0300 21450000 28871c00 00c606fa 7c40167d 5d8119e2 9bbd0050 041837ab
ffff81012cb18000 3501959926 S Bi:4:080:5 -115 4096 <
ffff81012cb18000 3501998404 C Bi:4:080:5 0 48 = 7eff0300 21450000 2896bc00 00c60697 213ff5d1 5d19e29b bd005004 112f0c8e
ffff81012cb18000 3502002964 S Bo:4:080:6 -115 48 = 7eff0300 21450000 2800cc40 00800633 1219e29b bd3ff5d1 5d041100 50e39693
ffff81012cb186c0 3502002986 S Bi:4:080:5 -115 4096 <
ffff81012cb18000 3502003387 C Bo:4:080:6 0 48 >
ffff81012cb186c0 3502385424 C Bi:4:080:5 0 1509 = 7eff0300 21450005 dcac8000 00c606cf 6440167d 5d8119e2 9bbd0050 041737a7
ffff81012cb186c0 3502391975 S Bi:4:080:5 -115 4096 <
ffff81012cb186c0 3502404427 C Bi:4:080:5 0 174 = 7eff0300 21450000 a5ac8800 00c606d4 9340167d 5d8119e2 9bbd0050 041737a7
ffff81012cb186c0 3502408033 S Bo:4:080:6 -115 50 = 7eff0300 21450000 2800cd40 00800686 cc19e29b bd40167d 5d810417 00504d4a
ffff81012cb18240 3502408056 S Bi:4:080:5 -115 4096 <
ffff81012cb186c0 3502408404 C Bo:4:080:6 0 50 >
ffff81012cb18240 3503326477 C Bi:4:080:5 0 1509 = 7eff0300 21450005 dcf01c00 00c6068b c840167d 5d8119e2 9bbd0050 041837ab
ffff81012cb18240 3503329965 S Bi:4:080:5 -115 4096 <
ffff81012cb18240 3503424484 C Bi:4:080:5 0 174 = 7eff0300 21450000 a4f02400 00c60690 f840167d 5d8119e2 9bbd0050 041837ab
ffff81012cb18240 3503473411 S Bo:4:080:6 -115 2043 = 7eff0300 21450000 2800d040 00800686 c919e29b bd40167d 5d810418 00502004
ffff81012cb18b40 3503473441 S Bi:4:080:5 -115 4096 <
ffff81012cb18b40 3503474490 C Bi:4:080:5 0 48 = 7eff0300 21450000 28f59400 00c60693 3fd43ae2 2119e29b bd005004 132fa1ca
ffff81012cb18240 3503476464 C Bo:4:080:6 0 2043 >
ffff81012cb18240 3503478885 S Bo:4:080:6 -115 183 = 6e66346c 61640d0a 0d0a01c8 7e7eff03 00214500 003000f7 40008006 869a19e2
ffff81012cb186c0 3503478911 S Bi:4:080:5 -115 4096 <
ffff81012cb18240 3503479464 C Bo:4:080:6 0 183 >
ffff81012cb18240 3503481909 S Bo:4:080:6 -115 48 = 7eff0300 21450000 2800fd40 0080068d d719e29b bdd43ae2 21041300 50d69552
ffff81012cb18240 3503482463 C Bo:4:080:6 0 48 >
ffff81012cb186c0 3503985512 C Bi:4:080:5 0 1509 = 7eff0300 21450005 dc180400 00c60663 e140167d 5d8119e2 9bbd0050 04153627
ffff8101483ecb40 3503997088 S Bo:4:080:6 -115 106 = 7eff0300 21450000 28010240 00800686 9719e29b bd40167d 5d810415 00505941
ffff8101483ec480 3503997162 S Bi:4:080:5 -115 4096 <
ffff8101483ecb40 3503997503 C Bo:4:080:6 0 106 >
ffff8101483ec480 3503997524 C Bi:4:080:5 0 186 = 7eff0300 21450000 b1180c00 00c60669 0440167d 5d8119e2 9bbd0050 04153627
ffff8101483ec480 3503999151 S Bo:4:080:6 -115 49 = 7eff0300 21450000 28010840 00800686 9119e29b bd40167d 5d810415 00505941
ffff8101483ecb40 3503999200 S Bi:4:080:5 -115 4096 <
ffff8101483ec480 3503999493 C Bo:4:080:6 0 49 >
ffff8101483ecb40 3504276530 C Bi:4:080:5 0 57 = 7eff0300 21450000 30298800 00c60658 0940167d 5d8119e2 9bbd0050 04193a1e
ffff8101483ecb40 3504278764 S Bo:4:080:6 -115 49 = 7eff0300 21450000 28010940 00800686 9019e29b bd40167d 5d810419 005093ae
ffff8101483ec480 3504278832 S Bi:4:080:5 -115 4096 <
ffff8101483ecb40 3504279521 C Bo:4:080:6 0 49 >
ffff8101483ec480 3504279546 C Bi:4:080:5 0 57 = 7eff0300 21450000 30299400 00c60657 fd40167d 5d8119e2 9bbd0050 041a3a22
ffff8101483ec480 3504281538 S Bo:4:080:6 -115 501 = 7eff0300 21450001 ec010a40 00800684 cb19e29b bd40167d 5d810419 005093ae
ffff8101483ec480 3504282513 C Bo:4:080:6 0 501 >
ffff8101483ec480 3504282565 S Bi:4:080:5 -115 4096 <
ffff8101483ecb40 3504284727 S Bo:4:080:6 -115 540 = 7eff0300 21450000 28010b40 00800686 8e19e29b bd40167d 5d81041a 0050b85a
ffff8101483ecb40 3504285513 C Bo:4:080:6 0 540 >
ffff8101483ec480 3504297532 C Bi:4:080:5 0 56 = 7eff0300 21450000 3029a000 00c60698 b3d155ab 7f19e29b bd005004 1c3a2695
ffff8101483ec480 3504301610 S Bo:4:080:6 -115 48 = 7eff0300 21450000 28010d40 008006c7 4e19e29b bdd155ab 7f041c00 5079268d
ffff8101483ec480 3504302512 C Bo:4:080:6 0 48 >
ffff8101483ec480 3504302577 S Bi:4:080:5 -115 4096 <
ffff8101483ec480 3504303527 C Bi:4:080:5 0 49 = 7eff0300 21450000 2829b800 00c60657 e140167d 5d8119e2 9bbd0050 04153627
ffff8101483ec480 3504303586 S Bo:4:080:6 -115 419 = 7eff0300 21450001 9b010e40 008006c5 da19e29b bdd155ab 7f041c00 5079268d
ffff8101483ecb40 3504304467 S Bi:4:080:5 -115 4096 <
ffff8101483ec480 3504304512 C Bo:4:080:6 0 419 >
ffff8101483ecb40 3504305525 C Bi:4:080:5 0 57 = 7eff0300 21450000 3029c400 00c60657 cd40167d 5d8119e2 9bbd0050 041d3a2a
ffff8101483ecb40 3504309584 S Bo:4:080:6 -115 49 = 7eff0300 21450000 28010f00 008006c6 8a19e29b bd40167d 5d810415 00505941
ffff8101483ec480 3504309644 S Bi:4:080:5 -115 4096 <
ffff8101483ecb40 3504310512 C Bo:4:080:6 0 49 >
ffff8101483ecb40 3504313522 S Bo:4:080:6 -115 544 = 7eff0300 21450000 28011040 00800686 8919e29b bd40167d 5d81041d 0050ee39
ffff8101483ecb40 3504314514 C Bo:4:080:6 0 544 >
ffff8101483ec480 3504545546 C Bi:4:080:5 0 1509 = 7eff0300 21450005 dc2dbc00 00c6064e 2940167d 5d8119e2 9bbd0050 041837ab
ffff8101483ec480 3504559558 S Bo:4:080:6 -115 106 = 7eff0300 21450000 28011540 00800686 8419e29b bd40167d 5d810418 00502004
ffff8101483ecb40 3504559662 S Bi:4:080:5 -115 4096 <
ffff8101483ec480 3504561529 C Bo:4:080:6 0 106 >
ffff8101483ecb40 3504561551 C Bi:4:080:5 0 182 = 7eff0300 21450000 ad2dc400 00c60653 5040167d 5d8119e2 9bbd0050 041837ab
ffff8101483ecb40 3504565085 S Bo:4:080:6 -115 50 = 7eff0300 21450000 28011b40 00800686 7d5e19e2 9bbd4016 7d5d8104 18005020
ffff8101483ec480 3504565146 S Bi:4:080:5 -115 4096 <
ffff8101483ecb40 3504565548 C Bo:4:080:6 0 50 >
ffff8101483ec480 3504604550 C Bi:4:080:5 0 1510 = 7eff0300 21450005 dc2dd000 00c6064e 1540167d 5d8119e2 9bbd0050 041737a7
ffff8101483ec480 3504618533 S Bo:4:080:6 -115 106 = 7eff0300 21450000 28012040 00800686 7919e29b bd40167d 5d810417 00504d4a
ffff8101483ecb40 3504618604 S Bi:4:080:5 -115 4096 <
ffff8101483ec480 3504620543 C Bo:4:080:6 0 106 >
ffff8101483ecb40 3504620565 C Bi:4:080:5 0 189 = 7eff0300 21450000 b42dd800 00c60653 3540167d 5d8119e2 9bbd0050 041737a7
ffff8101483ecb40 3504629568 S Bo:4:080:6 -115 49 = 7eff0300 21450000 28012640 00800686 7319e29b bd40167d 5d810417 00504d4a
ffff8101483ec480 3504629641 S Bi:4:080:5 -115 4096 <
ffff8101483ecb40 3504630531 C Bo:4:080:6 0 49 >
ffff8101483ec480 3504631542 C Bi:4:080:5 0 1509 = 7eff0300 21450005 dc2de000 00c6064e 0540167d 5d8119e2 9bbd0050 04163797
ffff8101483ec480 3504639599 S Bo:4:080:6 -115 49 = 7eff0300 21450000 28012c40 00800686 6d19e29b bd40167d 5d810416 00505484
ffff8101483ecb40 3504639674 S Bi:4:080:5 -115 4096 <
ffff8101483ec480 3504640531 C Bo:4:080:6 0 49 >
ffff8101483ecb40 3504640553 C Bi:4:080:5 0 188 = 7eff0300 21450000 b32de800 00c60653 2640167d 5d8119e2 9bbd0050 04163797
ffff8101483ecb40 3504645008 S Bo:4:080:6 -115 49 = 7eff0300 21450000 28012d40 00800686 6c19e29b bd40167d 5d810416 00505484
ffff8101483ec480 3504645067 S Bi:4:080:5 -115 4096 <
ffff8101483ecb40 3504645531 C Bo:4:080:6 0 49 >
ffff8101483ec480 3504936564 C Bi:4:080:5 0 49 = 7eff0300 21450000 284e6400 00c60633 3540167d 5d8119e2 9bbd0050 04193a1e
ffff81012cb180c0 3504938031 S Bi:4:080:5 -115 4096 <
ffff81012cb180c0 3505230586 C Bi:4:080:5 0 1509 = 7eff0300 21450005 dc501c00 00c6062b c940167d 5d8119e2 9bbd0050 04193a1e
ffff8101483ec480 3505237593 S Bo:4:080:6 -115 49 = 7eff0300 21450000 28013140 00800686 6819e29b bd40167d 5d810419 005093ae
ffff8101df180e40 3505237658 S Bi:4:080:5 -115 4096 <
ffff8101483ec480 3505238564 C Bo:4:080:6 0 49 >
ffff8101df180e40 3505238586 C Bi:4:080:5 0 186 = 7eff0300 21450000 b1502400 00c60630 ec40167d 5d8119e2 9bbd0050 04193a1e
ffff81012cb186c0 3505246140 S Bo:4:080:6 -115 49 = 7eff0300 21450000 28013340 00800686 6619e29b bd40167d 5d810419 005093ae
ffff81012cb18240 3505246164 S Bi:4:080:5 -115 4096 <
ffff81012cb186c0 3505246572 C Bo:4:080:6 0 49 >
ffff81012cb18240 3505246603 C Bi:4:080:5 0 57 = 7eff0300 21450000 30534c00 00c6062e 4540167d 5d8119e2 9bbd0050 041e3aa8
ffff81012cb18240 3505260221 S Bo:4:080:6 -115 50 = 7eff0300 21450000 28013440 00800686 6519e29b bd40167d 5d81041e 00503d46
ffff81012cb186c0 3505260290 S Bi:4:080:5 -115 4096 <
ffff81012cb18240 3505261568 C Bo:4:080:6 0 50 >
ffff81012cb186c0 3505261594 C Bi:4:080:5 0 49 = 7eff0300 21450000 28534400 00c6062e 5540167d 5d8119e2 9bbd0050 041737a7
ffff81012cb186c0 3505264994 S Bo:4:080:6 -115 491 = 7eff0300 21450001 e2013540 00800684 aa19e29b bd40167d 5d81041e 00503d46
ffff81012cb18240 3505265012 S Bi:4:080:5 -115 4096 <
ffff81012cb18240 3505265583 C Bi:4:080:5 0 57 = 7eff0300 21450000 30536400 00c6062e 2d40167d 5d8119e2 9bbd0050 041f3aac
ffff81012cb186c0 3505266563 C Bo:4:080:6 0 491 >
ffff81012cb186c0 3505267927 S Bi:4:080:5 -115 4096 <
ffff81012cb186c0 3505268579 C Bi:4:080:5 0 49 = 7eff0300 21450000 28538800 00c6062e 1140167d 5d8119e2 9bbd0050 04163797
ffff81012cb186c0 3505268903 S Bo:4:080:6 -115 597 = 7eff0300 21450000 28013600 008006c6 6319e29b bd40167d 5d810417 00504d4a
ffff81012cb18240 3505269905 S Bi:4:080:5 -115 4096 <
ffff81012cb186c0 3505270564 C Bo:4:080:6 0 597 >
ffff81012cb186c0 3505273033 S Bo:4:080:6 -115 49 = 7eff0300 21450000 28013900 008006c6 6019e29b bd40167d 5d810416 00505484
ffff81012cb186c0 3505273563 C Bo:4:080:6 0 49 >
ffff81012cb18240 3505309588 C Bi:4:080:5 0 1524 = 7eff0300 21450005 dc576800 00c60665 3fd155ab 7f19e29b bd005004 1c3a2695
ffff81012cb18240 3505315066 S Bi:4:080:5 -115 4096 <
ffff81012cb18240 3505317583 C Bi:4:080:5 0 1516 = 7eff0300 21450005 dc577000 00c60665 37d155ab 7f19e29b bd005004 1c3a269b
ffff81012cb18240 3505322162 S Bo:4:080:6 -115 48 = 7eff0300 21450000 28013a40 008006c7 2119e29b bdd155ab 7f041c00 5079268f
ffff81012cb186c0 3505322183 S Bi:4:080:5 -115 4096 <
ffff81012cb18240 3505322565 C Bo:4:080:6 0 48 >
ffff81012cb186c0 3505322585 C Bi:4:080:5 0 49 = 7eff0300 21450000 285eb000 00c60622 e940167d 5d8119e2 9bbd0050 041a3a22
ffff81012cb186c0 3505323978 S Bi:4:080:5 -115 4096 <
ffff81012cb186c0 3505324583 C Bi:4:080:5 0 49 = 7eff0300 21450000 285eb400 00c60622 e540167d 5d8119e2 9bbd0050 041d3a2a
ffff81012cb186c0 3505329927 S Bi:4:080:5 -115 4096 <
ffff81012cb186c0 3505331585 C Bi:4:080:5 0 950 = 7eff0300 21450005 dc5fbc00 00c6061c 2940167d 5d8119e2 9bbd0050 041d3a2a
ffff81012cb186c0 3505333954 S Bi:4:080:5 -115 4096 <
ffff81012cb186c0 3505335584 C Bi:4:080:5 0 559 = 20202020 20202020 20202020 20202020 20202020 200a3c62 722f3e20 20202020
ffff81012cb186c0 3505340203 S Bo:4:080:6 -115 49 = 7eff0300 21450000 28013f40 00800686 5a19e29b bd40167d 5d81041d 0050ee39
ffff81012cb18240 3505340226 S Bi:4:080:5 -115 4096 <
ffff81012cb186c0 3505340566 C Bo:4:080:6 0 49 >
ffff81012cb18240 3505376589 C Bi:4:080:5 0 180 = 7eff0300 21450000 ab5fc400 00c60621 5240167d 5d8119e2 9bbd0050 041d3a2a
ffff81012cb18240 3505378051 S Bo:4:080:6 -115 49 = 7eff0300 21450000 28014140 00800686 5819e29b bd40167d 5d81041d 0050ee39
ffff81012cb186c0 3505378073 S Bi:4:080:5 -115 4096 <
ffff81012cb18240 3505378569 C Bo:4:080:6 0 49 >
ffff81012cb186c0 3505410595 C Bi:4:080:5 0 1509 = 7eff0300 21450005 dc5fcc00 00c6061c 1940167d 5d8119e2 9bbd0050 041a3a22
ffff81012cb186c0 3505417984 S Bo:4:080:6 -115 49 = 7eff0300 21450000 28014540 00800686 5419e29b bd40167d 5d81041a 0050b85a
ffff81012cb18240 3505418007 S Bi:4:080:5 -115 4096 <
ffff81012cb186c0 3505418572 C Bo:4:080:6 0 49 >
ffff81012cb18240 3505418594 C Bi:4:080:5 0 175 = 7eff0300 21450000 a65fd400 00c60621 4740167d 5d8119e2 9bbd0050 041a3a22
ffff81012cb18240 3505421952 S Bo:4:080:6 -115 49 = 7eff0300 21450000 28014740 00800686 5219e29b bd40167d 5d81041a 0050b85a
ffff81012cb186c0 3505421969 S Bi:4:080:5 -115 4096 <
ffff81012cb18240 3505422571 C Bo:4:080:6 0 49 >
ffff81012cb186c0 3505459595 C Bi:4:080:5 0 49 = 7eff0300 21450000 28745000 00c6060d 4940167d 5d8119e2 9bbd0050 04193a1e
ffff8101df180e40 3505461519 S Bo:4:080:6 -115 49 = 7eff0300 21450000 28014800 008006c6 5119e29b bd40167d 5d810419 005093ae
ffff8101df180240 3505461580 S Bi:4:080:5 -115 4096 <
ffff8101df180e40 3505462574 C Bo:4:080:6 0 49 >
ffff8101df180240 3505845619 C Bi:4:080:5 0 1521 = 7eff0300 21450005 dc86cc00 00c60635 dbd155ab 7f19e29b bd005004 1c3a26a1
ffff8101df180240 3505852154 S Bi:4:080:5 -115 4096 <
ffff8101df180240 3505905624 C Bi:4:080:5 0 1524 = 7eff0300 21450005 dc86d000 00c60635 d7d155ab 7f19e29b bd005004 1c3a26a6
ffff8101df180240 3505907988 S Bo:4:080:6 -115 48 = 7eff0300 21450000 28014940 008006c7 1219e29b bdd155ab 7f041c00 5079268f
ffff8101df180e40 3505908047 S Bi:4:080:5 -115 4096 <
ffff8101df180240 3505908599 C Bo:4:080:6 0 48 >
ffff8101df180e40 3505948626 C Bi:4:080:5 0 1520 = 7eff0300 21450005 dc86d400 00c60635 d3d155ab 7f19e29b bd005004 1c3a26ac
ffff8101df180e40 3505951040 S Bi:4:080:5 -115 4096 <
ffff8101df180e40 3505951619 C Bi:4:080:5 0 49 = 7eff0300 21450000 2886dc00 00c606fa bc40167d 5d8119e2 9bbd0050 041d3a2a
ffff8101df180e40 3505955132 S Bo:4:080:6 -115 49 = 7eff0300 21450000 28014a00 008006c6 4f19e29b bd40167d 5d81041d 0050ee39
ffff8101df180240 3505955194 S Bi:4:080:5 -115 4096 <
ffff8101df180e40 3505955603 C Bo:4:080:6 0 49 >
ffff8101df180240 3505955624 C Bi:4:080:5 0 49 = 7eff0300 21450000 2886e800 00c606fa b040167d 5d8119e2 9bbd0050 041a3a22
ffff8101df180240 3505957101 S Bo:4:080:6 -115 49 = 7eff0300 21450000 28014b00 008006c6 4e19e29b bd40167d 5d81041a 0050b85a
ffff8101df180e40 3505957144 S Bi:4:080:5 -115 4096 <
ffff8101df180240 3505957602 C Bo:4:080:6 0 49 >
ffff8101df180e40 3505963619 C Bi:4:080:5 0 49 = 7eff0300 21450000 288dd000 00c606f3 c840167d 5d8119e2 9bbd0050 041e3aa8
ffff8101df180e40 3505965331 S Bi:4:080:5 -115 4096 <
ffff8101df180240 3506086015 S Bo:4:080:6 -115 48 = 7eff0300 21450000 28014c40 008006c7 0f19e29b bdd155ab 7f041c00 5079268f
ffff8101df180240 3506086612 C Bo:4:080:6 0 48 >
ffff8101df180e40 3506256643 C Bi:4:080:5 0 1509 = 7eff0300 21450005 dc906800 00c606eb 7c40167d 5d8119e2 9bbd0050 041e3aa8
ffff8101df180e40 3506266498 S Bo:4:080:6 -115 49 = 7eff0300 21450000 28015140 00800686 4819e29b bd40167d 5d81041e 00503d46
ffff8101df180240 3506266567 S Bi:4:080:5 -115 4096 <
ffff8101df180e40 3506266621 C Bo:4:080:6 0 49 >
ffff8101df180240 3506267693 C Bi:4:080:5 0 176 = 7eff0300 21450000 a7907000 00c606f0 a940167d 5d8119e2 9bbd0050 041e3aa8
ffff8101df180240 3506269475 S Bo:4:080:6 -115 49 = 7eff0300 21450000 28015340 00800686 4619e29b bd40167d 5d81041e 00503d46
ffff8101df180e40 3506269524 S Bi:4:080:5 -115 4096 <
ffff8101df180240 3506269620 C Bo:4:080:6 0 49 >
ffff8101df180e40 3506270634 C Bi:4:080:5 0 49 = 7eff0300 21450000 28917400 00c606f0 2440167d 5d8119e2 9bbd0050 041f3aac
ffff8101df180e40 3506273305 S Bi:4:080:5 -115 4096 <
ffff8101df180e40 3506275636 C Bi:4:080:5 0 1516 = 7eff0300 21450005 dc947400 00c606e7 7040167d 5d8119e2 9bbd0050 041f3aac
ffff8101df180e40 3506278468 S Bi:4:080:5 -115 4096 <
ffff8101df180e40 3506279638 C Bi:4:080:5 0 838 = 7eff0300 21450005 dc948000 00c606e7 6440167d 5d8119e2 9bbd0050 041f3aac
ffff8101df180e40 3506280636 S Bi:4:080:5 -115 4096 <
ffff8101df180e40 3506281636 C Bi:4:080:5 0 678 = a89f3f24 f62a254f 0d6356fc 3efb1dea 3bdd5e1d 31e286dd a3e725a4 763b1f61
ffff8101df180e40 3506285402 S Bo:4:080:6 -115 49 = 7eff0300 21450000 28015440 00800686 4519e29b bd40167d 5d81041f 0050e4a8
ffff8101df180240 3506285465 S Bi:4:080:5 -115 4096 <
ffff8101df180e40 3506285699 C Bo:4:080:6 0 49 >
ffff8101df180240 3506287634 C Bi:4:080:5 0 1517 = 7eff0300 21450005 dc9f2000 00c6061d 87d155ab 7f19e29b bd005004 1c3a26b2
ffff8101df180240 3506290291 S Bi:4:080:5 -115 4096 <
ffff8101df180240 3506365649 C Bi:4:080:5 0 723 = 7eff0300 21450002 c59f2400 00c60620 9ad155ab 7f19e29b bd005004 1c3a26b7
ffff8101df180e40 3506388033 S Bo:4:080:6 -115 48 = 7eff0300 21450000 28015740 008006c7 0419e29b bdd155ab 7f041c00 5079268f
ffff8101df180240 3506388103 S Bi:4:080:5 -115 4096 <
ffff8101df180e40 3506389627 C Bo:4:080:6 0 48 >
ffff8101df180e40 3506422683 S Bo:4:080:6 -115 864 = 7eff0300 21450003 57015c40 008006c3 d019e29b bdd155ab 7f041c00 5079268f
ffff8101df180e40 3506424637 C Bo:4:080:6 0 864 >
ffff8101df180240 3506520656 C Bi:4:080:5 0 49 = 7eff0300 21450000 28b32400 00c606ce 7440167d 5d8119e2 9bbd0050 041e3aa8
ffff8101df180240 3506524847 S Bo:4:080:6 -115 49 = 7eff0300 21450000 28015d00 008006c6 3c19e29b bd40167d 5d81041e 00503d46
ffff8101df180e40 3506524903 S Bi:4:080:5 -115 4096 <
ffff8101df180240 3506525634 C Bo:4:080:6 0 49 >
ffff8101df180e40 3506565661 C Bi:4:080:5 0 1518 = 7eff0300 21450005 dcb4ac00 00c606c7 3840167d 5d8119e2 9bbd0050 041f3aac
ffff8101df180e40 3506572417 S Bi:4:080:5 -115 4096 <
ffff8101df180e40 3506637665 C Bi:4:080:5 0 385 = 7eff0300 21450001 74b4b000 00c606cb 9c40167d 5d8119e2 9bbd0050 041f3aac
ffff8101df180e40 3506644694 S Bo:4:080:6 -115 49 = 7eff0300 21450000 28015e40 00800686 3b19e29b bd40167d 5d81041f 0050e4a8
ffff8101df180240 3506644762 S Bi:4:080:5 -115 4096 <
ffff8101df180e40 3506645643 C Bo:4:080:6 0 49 >
ffff8101df180240 3506820674 C Bi:4:080:5 0 377 = 7eff0300 21450001 71c4f800 00c606fc 19d155ab 7f19e29b bd005004 1c3a26ba
ffff8101df180240 3506844041 S Bo:4:080:6 -115 637 = 7eff0300 21450002 74016440 00800683 e919e29b bd40167d 5d81041f 0050e4a8
ffff8101df180e40 3506844107 S Bi:4:080:5 -115 4096 <
ffff8101df180240 3506845670 C Bo:4:080:6 0 637 >
ffff81012cb18480 3506988956 S Bo:4:080:6 -115 49 = 7eff0300 21450000 28016540 008006c6 f619e29b bdd155ab 7f041c00 50792692
ffff81012cb18480 3506989664 C Bo:4:080:6 0 49 >
ffff8101df180e40 3507294700 C Bi:4:080:5 0 49 = 7eff0300 21450000 28e97c00 00c60698 1c40167d 5d8119e2 9bbd0050 041f3aac
ffff8101df180e40 3507297472 S Bi:4:080:5 -115 4096 <
ffff8101df180e40 3507482711 C Bi:4:080:5 0 1509 = 7eff0300 21450005 dceec000 00c6068d 2440167d 5d8119e2 9bbd0050 041f3aac
ffff8101df180e40 3507489967 S Bo:4:080:6 -115 49 = 7eff0300 21450000 28016940 00800686 3019e29b bd40167d 5d81041f 0050e4a8
ffff8101df180240 3507490037 S Bi:4:080:5 -115 4096 <
ffff8101df180e40 3507490690 C Bo:4:080:6 0 49 >
ffff8101df180240 3507490711 C Bi:4:080:5 0 164 = 7eff0300 21450000 9beec800 00c60692 5d40167d 5d8119e2 9bbd0050 041f3aac
ffff8101df180240 3507492982 S Bo:4:080:6 -115 49 = 7eff0300 21450000 28016b40 00800686 2e19e29b bd40167d 5d81041f 0050e4a8
ffff8101df180e40 3507493030 S Bi:4:080:5 -115 4096 <
ffff8101df180240 3507493688 C Bo:4:080:6 0 49 >
ffff8101df180300 3509824509 S Bo:4:080:6 -115 57 = 7eff0300 21450000 30017140 00800686 2019e29b bd40167d 5d810420 0050b092
ffff8101df180300 3509825820 C Bo:4:080:6 0 57 >
ffff8101df180e40 3510858897 C Bi:4:080:5 0 57 = 7eff0300 21450000 30bae000 00c606c6 b040167d 5d8119e2 9bbd0050 04203f42
ffff8101851a56c0 3510863009 S Bo:4:080:6 -115 716 = 7eff0300 21450000 28017340 00800686 2619e29b bd40167d 5d810420 0050b092
ffff8101df1d1300 3510863035 S Bi:4:080:5 -115 4096 <
ffff8101851a56c0 3510864879 C Bo:4:080:6 0 716 >
ffff8101df1d1300 3511336923 C Bi:4:080:5 0 49 = 7eff0300 21450000 28e15c00 00c606a0 3c40167d 5d8119e2 9bbd0050 04203f42
ffff8101f45dc240 3511338042 S Bi:4:080:5 -115 4096 <
ffff8101f45dc240 3511404931 C Bi:4:080:5 0 1509 = 7eff0300 21450005 dce38000 00c60698 6440167d 5d8119e2 9bbd0050 04203f42
ffff8101f45dc240 3511411011 S Bi:4:080:5 -115 4096 <
ffff8101f45dc240 3511419928 C Bi:4:080:5 0 164 = 7eff0300 21450000 9be38800 00c6069d 9d40167d 5d8119e2 9bbd0050 04203f42
ffff8101f45dc240 3511422998 S Bo:4:080:6 -115 50 = 7eff0300 21450000 28017540 00800686 2419e29b bd40167d 5d810420 0050b092
ffff8101f45dc900 3511423018 S Bi:4:080:5 -115 4096 <
ffff8101f45dc240 3511423905 C Bo:4:080:6 0 50 >
ffff810137f9a780 3512999135 S Bo:4:080:6 -115 144 = 7eff0300 21450000 28017a40 00800632 6419e29b bd3ff5d1 5d040f00 50ceecf2
ffff810137f9a780 3513001002 C Bo:4:080:6 0 144 >
ffff8101f45dc900 3513216028 C Bi:4:080:5 0 49 = 7eff0300 21450000 28574000 00c606d6 9d3ff5d1 5d19e29b bd005004 0f2e6fdb
ffff810137f9a900 3513217949 S Bi:4:080:5 -115 4096 <
ffff810137f9a900 3513263033 C Bi:4:080:5 0 48 = 7eff0300 21450000 28591c00 00c6062f b8d43ae2 2119e29b bd005004 132fa1ca
ffff810137f9a900 3513265042 S Bi:4:080:5 -115 4096 <
ffff810137f9a900 3513266025 C Bi:4:080:5 0 48 = 7eff0300 21450000 285ad800 00c606d3 053ff5d1 5d19e29b bd005004 112f0c8e
ffff810137f9a900 3513269948 S Bi:4:080:5 -115 4096 <
ffff810137f9a900 3517358265 C Bi:4:080:5 0 48 = 7eff0300 21450000 28536400 00c6066e f7d155ab 7f19e29b bd005004 1c3a26bb
ffff810137f9a900 3517361443 S Bo:4:080:6 -115 50 = 7eff0300 21450000 28017d5d 40008006 c6de19e2 9bbdd155 ab7f041c 00507926
ffff810137f9ae40 3517361463 S Bi:4:080:5 -115 4096 <
ffff810137f9a900 3517363242 C Bo:4:080:6 0 50 >
ffff810137f9a900 3518188510 S Bo:4:080:6 -115 664 = 7eff0300 21450002 8f018040 00800683 b219e29b bd40167d 5d810420 0050b092
ffff810137f9a900 3518190291 C Bo:4:080:6 0 664 >
ffff810137f9ae40 3518636331 C Bi:4:080:5 0 49 = 7eff0300 21450000 28d89800 00c606a9 0040167d 5d8119e2 9bbd0050 04203f42
ffff810137f9ae40 3518641022 S Bi:4:080:5 -115 4096 <
ffff810137f9ae40 3519046348 C Bi:4:080:5 0 1509 = 7eff0300 21450005 dcefb000 00c6068c 3440167d 5d8119e2 9bbd0050 04203f42
ffff8101f478dcc0 3519092367 S Bo:4:080:6 -115 172 = 7eff0300 21450000 30019740 00800685 fa19e29b bd40167d 5d810421 0050a517
ffff81019bc5a0c0 3519092435 S Bi:4:080:5 -115 4096 <
ffff8101f478dcc0 3519094338 C Bo:4:080:6 0 172 >
ffff81019bc5a0c0 3519106368 C Bi:4:080:5 0 1509 = 7eff0300 21450005 dcefb800 00c6068c 2c40167d 5d8119e2 9bbd0050 04203f42
ffff810137f9a900 3519111440 S Bo:4:080:6 -115 49 = 7eff0300 21450000 28019a40 00800685 ff19e29b bd40167d 5d810420 0050b092
ffff810137f9a240 3519111463 S Bi:4:080:5 -115 4096 <
ffff810137f9a900 3519112334 C Bo:4:080:6 0 49 >
ffff810137f9a240 3519162358 C Bi:4:080:5 0 1509 = 7eff0300 21450005 dcefbc00 00c6068c 2840167d 5d8119e2 9bbd0050 04203f42
ffff810137f9a240 3519165047 S Bi:4:080:5 -115 4096 <
ffff810137f9a900 3519305653 S Bo:4:080:6 -115 49 = 7eff0300 21450000 28019d40 00800685 fc19e29b bd40167d 5d810420 0050b092
ffff810137f9a900 3519306349 C Bo:4:080:6 0 49 >
ffff810137f9a240 3519338364 C Bi:4:080:5 0 58 = 7eff0300 21450000 30081400 00c60679 7d5d4016 7d5d8119 e29bbd00 50042148
ffff810137f9a240 3519342729 S Bo:4:080:6 -115 49 = 7eff0300 21450000 28019e40 00800685 fb19e29b bd40167d 5d810421 0050a517
ffff810137f9a240 3519343346 C Bo:4:080:6 0 49 >
ffff810137f9a240 3519359607 S Bo:4:080:6 -115 664 = 7eff0300 21450002 8e019f40 00800683 9419e29b bd40167d 5d810421 0050a517
ffff810137f9a900 3519359634 S Bi:4:080:5 -115 4096 <
ffff810137f9a240 3519361355 C Bo:4:080:6 0 664 >
ffff810137f9a900 3519361378 C Bi:4:080:5 0 57 = 7eff0300 21450000 30093800 00c60678 5940167d 5d8119e2 9bbd0050 0422480c
ffff810037aaf900 3519366137 S Bo:4:080:6 -115 713 = 7eff0300 21450000 2801a040 00800685 f919e29b bd40167d 5d810422 00500f34
ffff810037aafd80 3519366207 S Bi:4:080:5 -115 4096 <
ffff810037aaf900 3519367354 C Bo:4:080:6 0 713 >
ffff810037aafd80 3519446378 C Bi:4:080:5 0 57 = 7eff0300 21450000 300de000 00c60673 b140167d 5d8119e2 9bbd0050 04234824
ffff810037aafd80 3519453678 S Bo:4:080:6 -115 49 = 7eff0300 21450000 2801a240 00800685 f719e29b bd40167d 5d810423 0050734a
ffff810037aaf900 3519453735 S Bi:4:080:5 -115 4096 <
ffff810037aafd80 3519454444 C Bo:4:080:6 0 49 >
ffff810037aafd80 3519465107 S Bo:4:080:6 -115 648 = 7eff0300 21450002 7f01a340 00800683 9f19e29b bd40167d 5d810423 0050734a
ffff810037aafd80 3519466366 C Bo:4:080:6 0 648 >
ffff810037aaf900 3519483376 C Bi:4:080:5 0 1511 = 7eff0300 21450005 dc106800 00c6066b 7d5d4016 7d5d8119 e29bbd00 5004203f
ffff810137f9a300 3519486654 S Bi:4:080:5 -115 4096 <
ffff810137f9a300 3519540383 C Bi:4:080:5 0 1509 = 7eff0300 21450005 dc106c00 00c6066b 7940167d 5d8119e2 9bbd0050 04203f42
ffff810137f9a300 3519542076 S Bo:4:080:6 -115 49 = 7eff0300 21450000 2801a440 00800685 f519e29b bd40167d 5d810420 0050b092
ffff810137f9a780 3519542100 S Bi:4:080:5 -115 4096 <
ffff810137f9a300 3519542357 C Bo:4:080:6 0 49 >
ffff810137f9a780 3519604382 C Bi:4:080:5 0 1512 = 7eff0300 21450005 dc107000 00c6066b 7540167d 5d8119e2 9bbd0050 04203f42
ffff810137f9a780 3519607062 S Bi:4:080:5 -115 4096 <
ffff810137f9a780 3519668389 C Bi:4:080:5 0 1509 = 7eff0300 21450005 dc18d000 00c60663 1540167d 5d8119e2 9bbd0050 04203f42
ffff810137f9a780 3519670978 S Bo:4:080:6 -115 49 = 7eff0300 21450000 2801a540 00800685 f419e29b bd40167d 5d810420 0050b092
ffff810137f9a300 3519671000 S Bi:4:080:5 -115 4096 <
ffff810137f9a780 3519671364 C Bo:4:080:6 0 49 >
ffff810137f9a300 3519706389 C Bi:4:080:5 0 1509 = 7eff0300 21450005 dc18d400 00c60663 1140167d 5d8119e2 9bbd0050 04203f42
ffff810137f9a300 3519710084 S Bi:4:080:5 -115 4096 <
ffff810137f9a300 3519838395 C Bi:4:080:5 0 49 = 7eff0300 21450000 28306800 00c60651 3140167d 5d8119e2 9bbd0050 04214805
ffff810137f9a300 3519841066 S Bi:4:080:5 -115 4096 <
ffff810137f9a780 3519905013 S Bo:4:080:6 -115 49 = 7eff0300 21450000 2801a640 00800685 f319e29b bd40167d 5d810420 0050b092
ffff810137f9a780 3519905379 C Bo:4:080:6 0 49 >
ffff810137f9a300 3520003403 C Bi:4:080:5 0 1520 = 7eff0300 21450005 dc372c00 00c60644 b940167d 5d8119e2 9bbd0050 04214805
ffff810137f9a300 3520006144 S Bi:4:080:5 -115 4096 <
ffff810137f9a300 3520065413 C Bi:4:080:5 0 1519 = 7eff0300 21450005 dc373400 00c60644 b140167d 5d8119e2 9bbd0050 04214805
ffff810137f9a300 3520068019 S Bo:4:080:6 -115 50 = 7eff0300 21450000 2801a840 00800685 f119e29b bd40167d 5d810421 0050a517
ffff810137f9a780 3520068042 S Bi:4:080:5 -115 4096 <
ffff810137f9a300 3520068387 C Bo:4:080:6 0 50 >
ffff810137f9a780 3520068410 C Bi:4:080:5 0 49 = 7eff0300 21450000 283d5800 00c60644 4140167d 5d8119e2 9bbd0050 0422480c
ffff810137f9a780 3520070034 S Bi:4:080:5 -115 4096 <
ffff810137f9a780 3520126409 C Bi:4:080:5 0 1509 = 7eff0300 21450005 dc3fe400 00c6063c 0140167d 5d8119e2 9bbd0050 04203f42
ffff810137f9a780 3520130045 S Bi:4:080:5 -115 4096 <
ffff810137f9a780 3520186418 C Bi:4:080:5 0 1509 = 7eff0300 21450005 dc3fe800 00c6063b fd40167d 5d8119e2 9bbd0050 04203f42
ffff810137f9a780 3520191001 S Bo:4:080:6 -115 49 = 7eff0300 21450000 2801a940 00800685 f019e29b bd40167d 5d810420 0050b092
ffff810137f9a300 3520191024 S Bi:4:080:5 -115 4096 <
ffff810137f9a780 3520191394 C Bo:4:080:6 0 49 >
ffff810137f9a300 3520519430 C Bi:4:080:5 0 1509 = 7eff0300 21450005 dc3fec00 00c6063b f940167d 5d8119e2 9bbd0050 04203f42
ffff810037aaf240 3520523013 S Bi:4:080:5 -115 4096 <
ffff810037aaf240 3520525433 C Bi:4:080:5 0 1509 = 7eff0300 21450005 dc3ff800 00c6063b ed40167d 5d8119e2 9bbd0050 04203f43
ffff810037aaf240 3520528141 S Bo:4:080:6 -115 49 = 7eff0300 21450000 2801aa40 00800685 ef19e29b bd40167d 5d810420 0050b092
ffff810037aaf540 3520528205 S Bi:4:080:5 -115 4096 <
ffff810037aaf240 3520528414 C Bo:4:080:6 0 49 >
ffff810037aaf540 3520529495 C Bi:4:080:5 0 1070 = 7eff0300 21450005 dc3ffc00 00c6063b e940167d 5d8119e2 9bbd0050 04203f43
ffff810037aaf540 3520532095 S Bi:4:080:5 -115 4096 <
ffff810037aaf540 3520533500 C Bi:4:080:5 0 439 = 20202020 20202020 3c212d2d 20636f6d 6d656e74 202d2d3e 0a202020 20202020
ffff810037aaf540 3520537106 S Bi:4:080:5 -115 4096 <
ffff810037aaf540 3520539433 C Bi:4:080:5 0 1509 = 7eff0300 21450005 dc400000 00c6063b e540167d 5d8119e2 9bbd0050 04203f43
ffff810037aaf540 3520542001 S Bo:4:080:6 -115 49 = 7eff0300 21450000 2801ab40 00800685 ee19e29b bd40167d 5d810420 0050b092
ffff810037aaf540 3520542415 C Bo:4:080:6 0 49 >
ffff810037aaf540 3520543004 S Bi:4:080:5 -115 4096 <
ffff810037aaf540 3520543511 C Bi:4:080:5 0 49 = 7eff0300 21450000 28456400 00c6063c 3540167d 5d8119e2 9bbd0050 04234824
ffff810037aaf540 3520547346 S Bi:4:080:5 -115 4096 <
ffff810037aaf540 3520549435 C Bi:4:080:5 0 1018 = 7eff0300 21450005 dc464c00 00c60635 9940167d 5d8119e2 9bbd0050 04203f43
ffff810037aaf540 3520552785 S Bi:4:080:5 -115 4096 <
ffff810037aaf540 3520553434 C Bi:4:080:5 0 491 = 703b0a20 20202020 20202020 20202020 20202020 20202020 20202020 2020200a
ffff810037aaf540 3520555816 S Bi:4:080:5 -115 4096 <
ffff810037aaf540 3520558433 C Bi:4:080:5 0 1458 = 7eff0300 21450005 dc465000 00c60635 9540167d 5d8119e2 9bbd0050 04203f43
ffff810037aaf540 3520560016 S Bi:4:080:5 -115 4096 <
ffff810037aaf540 3520560431 C Bi:4:080:5 0 51 = 20202020 20202020 20202020 20202020 20266e62 73703b0a 20202020 20202020
ffff810037aaf540 3520563101 S Bo:4:080:6 -115 49 = 7eff0300 21450000 2801ac40 00800685 ed19e29b bd40167d 5d810420 0050b092
ffff810037aaf240 3520563163 S Bi:4:080:5 -115 4096 <
ffff810037aaf540 3520563415 C Bo:4:080:6 0 49 >
ffff810037aaf240 3520587440 C Bi:4:080:5 0 1522 = 7eff0300 21450005 dc52ec00 00c60628 f940167d 5d8119e2 9bbd0050 04214805
ffff810037aaf240 3520590043 S Bi:4:080:5 -115 4096 <
ffff8101fd03c240 3520713466 S Bo:4:080:6 -115 49 = 7eff0300 21450000 2801ad40 00800685 ec19e29b bd40167d 5d810421 0050a517
ffff8101fd03c240 3520714426 C Bo:4:080:6 0 49 >
ffff810037aaf240 3520910458 C Bi:4:080:5 0 1521 = 7eff0300 21450005 dc52f000 00c60628 f540167d 5d8119e2 9bbd0050 04214805
ffff8101fd03c240 3520913964 S Bi:4:080:5 -115 4096 <
ffff8101fd03c240 3520916455 C Bi:4:080:5 0 1522 = 7eff0300 21450005 dc52f400 00c60628 f140167d 5d8119e2 9bbd0050 04214805
ffff8101fd03c240 3520918123 S Bo:4:080:6 -115 49 = 7eff0300 21450000 2801af40 00800685 ea19e29b bd40167d 5d810421 0050a517
ffff8101eb77b480 3520918185 S Bi:4:080:5 -115 4096 <
ffff8101fd03c240 3520918436 C Bo:4:080:6 0 49 >
ffff8101eb77b480 3521026465 C Bi:4:080:5 0 1516 = 7eff0300 21450005 dc577400 00c60624 7140167d 5d8119e2 9bbd0050 0422480c
ffff8101eb77b480 3521028294 S Bi:4:080:5 -115 4096 <
ffff8101eb77b480 3521030460 C Bi:4:080:5 0 1516 = 7eff0300 21450005 dc577c00 00c60624 6940167d 5d8119e2 9bbd0050 0422480c
ffff8101eb77b480 3521034039 S Bo:4:080:6 -115 49 = 7eff0300 21450000 2801b040 00800685 e919e29b bd40167d 5d810422 00500f34
ffff8101eb77b480 3521034443 C Bo:4:080:6 0 49 >
ffff8101eb77b480 3521035016 S Bi:4:080:5 -115 4096 <
ffff8101eb77b480 3521036457 C Bi:4:080:5 0 1062 = 7eff0300 21450005 dc5aa800 00c60621 3d40167d 5d8119e2 9bbd0050 04203f43
ffff8101eb77b480 3521038066 S Bi:4:080:5 -115 4096 <
ffff8101eb77b480 3521039457 C Bi:4:080:5 0 447 = 6e6e6563 74735f74 6f5f6d6f 64656d5f 6275745f 6e6f5f69 6e746572 6e657427
ffff8101eb77b480 3521042012 S Bi:4:080:5 -115 4096 <
ffff8101eb77b480 3521044460 C Bi:4:080:5 0 1509 = 7eff0300 21450005 dc5aac00 00c60621 3940167d 5d8119e2 9bbd0050 04203f43
ffff8101eb77b480 3521047057 S Bo:4:080:6 -115 49 = 7eff0300 21450000 2801b140 00800685 e819e29b bd40167d 5d810420 0050b092
ffff8101eb77b180 3521047116 S Bi:4:080:5 -115 4096 <
ffff8101eb77b480 3521047449 C Bo:4:080:6 0 49 >
ffff8101eb77b180 3521048475 C Bi:4:080:5 0 1070 = 7eff0300 21450005 dc5ab000 00c60621 3540167d 5d8119e2 9bbd0050 04203f43
ffff8101eb77b180 3521049961 S Bi:4:080:5 -115 4096 <
ffff8101eb77b180 3521051456 C Bi:4:080:5 0 439 = 20202020 20202020 20202020 20202020 20202020 20202020 20202020 266e6273
ffff8101eb77b180 3521054012 S Bi:4:080:5 -115 4096 <
ffff8101eb77b180 3521055460 C Bi:4:080:5 0 1139 = 7eff0300 21450004 6a6da800 00c6060f af40167d 5d8119e2 9bbd0050 04203f43
ffff8101eb77b180 3521060039 S Bo:4:080:6 -115 49 = 7eff0300 21450000 2801b240 00800685 e719e29b bd40167d 5d810420 0050b092
ffff8101eb77b480 3521060105 S Bi:4:080:5 -115 4096 <
ffff8101eb77b180 3521060445 C Bo:4:080:6 0 49 >
ffff8101eb77b480 3521068475 C Bi:4:080:5 0 1517 = 7eff0300 21450005 dc783400 00c60603 b140167d 5d8119e2 9bbd0050 04214805
ffff8101eb77b480 3521071326 S Bi:4:080:5 -115 4096 <
ffff8101eb77b480 3521147473 C Bi:4:080:5 0 1527 = 7eff0300 21450005 dc783800 00c60603 ad40167d 5d8119e2 9bbd0050 04214805
ffff8101eb77b480 3521150143 S Bo:4:080:6 -115 49 = 7eff0300 21450000 2801b540 00800685 e419e29b bd40167d 5d810421 0050a517
ffff8101eb77b180 3521150204 S Bi:4:080:5 -115 4096 <
ffff8101eb77b480 3521150448 C Bo:4:080:6 0 49 >
ffff8101eb77b180 3521187474 C Bi:4:080:5 0 1515 = 7eff0300 21450005 dc825400 00c606f9 9040167d 5d8119e2 9bbd0050 04214805
ffff8101eb77b180 3521190326 S Bi:4:080:5 -115 4096 <
ffff8101eb77b180 3521203475 C Bi:4:080:5 0 305 = 7eff0300 21450001 24825800 00c606fe 4440167d 5d8119e2 9bbd0050 04214805
ffff8101eb77b180 3521210448 S Bo:4:080:6 -115 49 = 7eff0300 21450000 2801b640 00800685 e319e29b bd40167d 5d810421 0050a517
ffff8101eb77b540 3521210517 S Bi:4:080:5 -115 4096 <
ffff8101eb77b180 3521211454 C Bo:4:080:6 0 49 >
ffff8101eb77b540 3521307483 C Bi:4:080:5 0 760 = 7eff0300 21450002 ec8b2800 00c606f3 ac40167d 5d8119e2 9bbd0050 04234824
ffff810137f9a000 3521312065 S Bi:4:080:5 -115 4096 <
ffff810137f9a000 3521368485 C Bi:4:080:5 0 1518 = 7eff0300 21450005 dc8b9400 00c606f0 5040167d 5d8119e2 9bbd0050 0422480c
ffff810137f9a000 3521370960 S Bi:4:080:5 -115 4096 <
ffff810137f9aa80 3521411961 S Bo:4:080:6 -115 49 = 7eff0300 21450000 2801bb40 00800685 de19e29b bd40167d 5d810423 0050734a
ffff810137f9aa80 3521412467 C Bo:4:080:6 0 49 >
ffff810137f9a000 3521428485 C Bi:4:080:5 0 1519 = 7eff0300 21450005 dc8b9800 00c606f0 4c40167d 5d8119e2 9bbd0050 0422480c
ffff810137f9a000 3521430999 S Bo:4:080:6 -115 49 = 7eff0300 21450000 2801bc40 00800685 dd19e29b bd40167d 5d810422 00500f34
ffff810137f9aa80 3521431025 S Bi:4:080:5 -115 4096 <
ffff810137f9a000 3521431462 C Bo:4:080:6 0 49 >
ffff810137f9aa80 3521459487 C Bi:4:080:5 0 776 = 7eff0300 21450002 fb8b9c00 00c606f3 2940167d 5d8119e2 9bbd0050 0422480c
ffff810137f9aa80 3521502319 S Bo:4:080:6 -115 2043 = 7eff0300 21450002 aa01c640 00800683 5119e29b bd40167d 5d810420 0050b092
ffff810137f9a000 3521502347 S Bi:4:080:5 -115 4096 <
ffff810137f9aa80 3521505482 C Bo:4:080:6 0 2043 >
ffff810137f9aa80 3521636569 S Bo:4:080:6 -115 140 = 746d6363 6e3d2864 69726563 74297c75 746d636d 643d286e 6f6e6529 0d0a0d0a
ffff810137f9aa80 3521637480 C Bo:4:080:6 0 140 >
ffff810137f9aa80 3521647055 S Bo:4:080:6 -115 56 = 7eff0300 21450000 3001d240 008006e1 1a0a0002 0f0a0a01 c3042600 8b1229d0
ffff810137f9aa80 3521647478 C Bo:4:080:6 0 56 >
ffff810137f9a000 3521924509 C Bi:4:080:5 0 1234 = 7eff0300 21450004 beb51800 00c606c7 ea40167d 5d8119e2 9bbd0050 04203f43
ffff8101eb77bb40 3521944796 S Bi:4:080:5 -115 4096 <
ffff8101eb77bb40 3522082524 C Bi:4:080:5 0 1040 = 7eff0300 21450004 02bd8400 00c606c0 3a40167d 5d8119e2 9bbd0050 04214805
ffff8101eb77bb40 3522093343 S Bi:4:080:5 -115 4096 <
ffff8101eb77bb40 3522093528 C Bi:4:080:5 0 56 = 7eff0300 21450000 30c03000 00c606ff fdd155ad a419e29b bd005004 254a3cca
ffff8101eb77bb40 3522094995 S Bo:4:080:6 -115 48 = 7eff0300 21450000 2801d940 008006c4 5d19e29b bdd155ad a4042500 503e9613
ffff8101eb77bb40 3522095503 C Bo:4:080:6 0 48 >
ffff810137f9a000 3522099909 S Bo:4:080:6 -115 432 = 7eff0300 21450001 a801da40 008006c2 dc19e29b bdd155ad a4042500 503e9613
ffff810137f9aa80 3522099978 S Bi:4:080:5 -115 4096 <
ffff810137f9a000 3522100504 C Bo:4:080:6 0 432 >
ffff810137f9a000 3522113967 S Bo:4:080:6 -115 49 = 7eff0300 21450000 2801db40 00800685 be19e29b bd40167d 5d810420 0050b092
ffff810137f9a000 3522114502 C Bo:4:080:6 0 49 >
ffff810137f9aa80 3522161526 C Bi:4:080:5 0 1147 = 7eff0300 21450004 6ac63400 00c606b7 2240167d 5d8119e2 9bbd0050 04234824
ffff810137f9aa80 3522174768 S Bi:4:080:5 -115 4096 <
ffff8101eb77bb40 3522218534 S Bo:4:080:6 -115 49 = 7eff0300 21450000 2801de40 00800685 bb19e29b bd40167d 5d810421 0050a517
ffff8101eb77bb40 3522219509 C Bo:4:080:6 0 49 >
ffff8101eb77bb40 3522315998 S Bo:4:080:6 -115 49 = 7eff0300 21450000 2801df40 00800685 ba19e29b bd40167d 5d810423 0050734a
ffff8101eb77bb40 3522316516 C Bo:4:080:6 0 49 >
ffff810137f9aa80 3522786563 C Bi:4:080:5 0 1514 = 7eff0300 21450005 dcea6400 00c606d0 1dd155ad a419e29b bd005004 254a3cca
ffff8101eb77b540 3522792162 S Bi:4:080:5 -115 4096 <
ffff8101eb77b540 3522838566 C Bi:4:080:5 0 1515 = 7eff0300 21450005 dcea6c00 00c606d0 15d155ad a419e29b bd005004 254a3cd0
ffff8101eb77b540 3522840627 S Bo:4:080:6 -115 48 = 7eff0300 21450000 2801e040 008006c4 5619e29b bdd155ad a4042500 503e9615
ffff8101eb77bd80 3522840687 S Bi:4:080:5 -115 4096 <
ffff8101eb77b540 3522841541 C Bo:4:080:6 0 48 >
ffff8101eb77bd80 3523145583 C Bi:4:080:5 0 1526 = 7eff0300 21450005 dcfe4400 00c606bc 3dd155ad a419e29b bd005004 254a3cd6
ffff810137f9a000 3523150198 S Bi:4:080:5 -115 4096 <
ffff810137f9a000 3523200590 C Bi:4:080:5 0 1516 = 7eff0300 21450005 dcfe4800 00c606bc 39d155ad a419e29b bd005004 254a3cdb
ffff810137f9a000 3523204161 S Bo:4:080:6 -115 48 = 7eff0300 21450000 2801e140 008006c4 5519e29b bdd155ad a4042500 503e9615
ffff810137f9a300 3523204183 S Bi:4:080:5 -115 4096 <
ffff810137f9a000 3523204562 C Bo:4:080:6 0 48 >
ffff810137f9a300 3523260587 C Bi:4:080:5 0 1526 = 7eff0300 21450005 dcfe4c00 00c606bc 35d155ad a419e29b bd005004 254a3ce1
ffff8101eb77bd80 3523265867 S Bi:4:080:5 -115 4096 <
ffff810137f9a000 3523414025 S Bo:4:080:6 -115 48 = 7eff0300 21450000 2801e240 008006c4 5419e29b bdd155ad a4042500 503e9615
ffff810137f9a000 3523414578 C Bo:4:080:6 0 48 >
ffff8101eb77bd80 3523468595 C Bi:4:080:5 0 1520 = 7eff0300 21450005 dc12c400 00c606a7 bed155ad a419e29b bd005004 254a3ce7
ffff810137f9a000 3523471972 S Bi:4:080:5 -115 4096 <
ffff810137f9a000 3523528599 C Bi:4:080:5 0 1517 = 7eff0300 21450005 dc12c800 00c606a7 bad155ad a419e29b bd005004 254a3cec
ffff810137f9a000 3523530988 S Bo:4:080:6 -115 48 = 7eff0300 21450000 2801e340 008006c4 5319e29b bdd155ad a4042500 503e9615
ffff810137f9a900 3523531011 S Bi:4:080:5 -115 4096 <
ffff810137f9a000 3523531579 C Bo:4:080:6 0 48 >
ffff810137f9a900 3523540598 C Bi:4:080:5 0 578 = 7eff0300 21450002 3312cc00 00c606ab 5fd155ad a419e29b bd005004 254a3cf2
ffff8101eb77bb40 3523559200 S Bo:4:080:6 -115 439 = 7eff0300 21450001 af01e740 008006c2 c819e29b bdd155ad a4042500 503e9615
ffff8101eb77bcc0 3523559271 S Bi:4:080:5 -115 4096 <
ffff8101eb77bb40 3523560587 C Bo:4:080:6 0 439 >
ffff8101eb77bcc0 3523948621 C Bi:4:080:5 0 1520 = 7eff0300 21450005 dc2e6c00 00c6068c 16d155ad a419e29b bd005004 254a3cf4
ffff810137f9a900 3523953371 S Bi:4:080:5 -115 4096 <
ffff810137f9a900 3524008631 C Bi:4:080:5 0 1522 = 7eff0300 21450005 dc2e7400 00c6068c 0ed155ad a419e29b bd005004 254a3cfa
ffff8101eb77b480 3524014483 S Bo:4:080:6 -115 48 = 7eff0300 21450000 2801e840 008006c4 4e19e29b bdd155ad a4042500 503e9616
ffff8101eb77b780 3524014547 S Bi:4:080:5 -115 4096 <
ffff8101eb77b480 3524014609 C Bo:4:080:6 0 48 >
ffff8101eb77b780 3524040632 C Bi:4:080:5 0 1515 = 7eff0300 21450005 dc2e7800 00c6068c 0ad155ad a419e29b bd005004 254a3d00
ffff8101eb77b780 3524043534 S Bi:4:080:5 -115 4096 <
ffff8101eb77b780 3524100637 C Bi:4:080:5 0 1517 = 7eff0300 21450005 dc2e8000 00c6068c 02d155ad a419e29b bd005004 254a3d05
ffff8101eb77b780 3524103077 S Bo:4:080:6 -115 48 = 7eff0300 21450000 2801e940 008006c4 4d19e29b bdd155ad a4042500 503e9616
ffff8101eb77b780 3524103614 C Bo:4:080:6 0 48 >
ffff8101eb77b780 3524104040 S Bi:4:080:5 -115 4096 <
ffff8101eb77b780 3524164639 C Bi:4:080:5 0 1519 = 7eff0300 21450005 dc2e8400 00c6068b fed155ad a419e29b bd005004 254a3d0b
ffff8101eb77b780 3524169559 S Bi:4:080:5 -115 4096 <
ffff8101eb77b780 3524187642 C Bi:4:080:5 0 947 = 7eff0300 21450003 a42e8c00 00c6068e 2ed155ad a419e29b bd005004 254a3d11
ffff8101eb77b780 3524190831 S Bo:4:080:6 -115 48 = 7eff0300 21450000 2801ea40 008006c4 4c19e29b bdd155ad a4042500 503e9616
ffff81018530b480 3524190900 S Bi:4:080:5 -115 4096 <
ffff8101eb77b780 3524191619 C Bo:4:080:6 0 48 >
ffff81018530b480 3524248644 C Bi:4:080:5 0 1521 = 7eff0300 21450005 dc2fdc00 00c6068a a6d155ad a419e29b bd005004 254a3d14
ffff81018530b480 3524255555 S Bi:4:080:5 -115 4096 <
ffff81018530b480 3524308648 C Bi:4:080:5 0 1520 = 7eff0300 21450005 dc43c400 00c60676 bed155ad a419e29b bd005004 254a3d1a
ffff81018530b480 3524314548 S Bo:4:080:6 -115 48 = 7eff0300 21450000 2801eb40 008006c4 4b19e29b bdd155ad a4042500 503e9616
ffff81018530bcc0 3524314615 S Bi:4:080:5 -115 4096 <
ffff81018530b480 3524315626 C Bo:4:080:6 0 48 >
ffff81018530bcc0 3524349650 C Bi:4:080:5 0 1522 = 7eff0300 21450005 dc43c800 00c60676 bad155ad a419e29b bd005004 254a3d20
ffff81018530bcc0 3524356467 S Bi:4:080:5 -115 4096 <
ffff81018530bcc0 3524400654 C Bi:4:080:5 0 1521 = 7eff0300 21450005 dc43cc00 00c60676 b6d155ad a419e29b bd005004 254a3d25
ffff8101fae99000 3524404305 S Bo:4:080:6 -115 48 = 7eff0300 21450000 2801ec40 008006c4 4a19e29b bdd155ad a4042500 503e9616
ffff8101fae99600 3524404367 S Bi:4:080:5 -115 4096 <
ffff8101fae99000 3524404629 C Bo:4:080:6 0 48 >
ffff8101fae99600 3524426653 C Bi:4:080:5 0 435 = 7eff0300 21450001 a843d000 00c6067a e6d155ad a419e29b bd005004 254a3d2b
ffff8100897df840 3524464773 S Bi:4:080:5 -115 4096 <
ffff81018511a240 3524486572 S Bo:4:080:6 -115 56 = 7eff0300 21450000 3001f640 008006c4 4219e29b bdd155ad 9a042800 50fc7230
ffff81018511a240 3524487636 C Bo:4:080:6 0 56 >
ffff810137f9a000 3524618105 S Bo:4:080:6 -115 104 = 7eff0300 21450000 3001f740 008006e0 f50a0002 0f0a0a01 c3042600 8b1229d0
ffff810137f9a000 3524618647 C Bo:4:080:6 0 104 >
ffff8100897df840 3524738670 C Bi:4:080:5 0 56 = 7eff0300 21450000 305f1c00 00c60661 1cd155ad 9a19e29b bd005004 284c0c16
ffff810137f9a000 3524744566 S Bo:4:080:6 -115 49 = 7eff0300 21450000 2801f940 008006c4 4719e29b bdd155ad 9a042800 50fc7230
ffff810137f9a240 3524744589 S Bi:4:080:5 -115 4096 <
ffff810137f9a000 3524745647 C Bo:4:080:6 0 49 >
ffff810137f9a000 3524749085 S Bo:4:080:6 -115 494 = 7eff0300 21450001 e601fa40 008006c2 8819e29b bdd155ad 9a042800 50fc7230
ffff810137f9a000 3524750651 C Bo:4:080:6 0 494 >
ffff810137f9a240 3525100690 C Bi:4:080:5 0 586 = 7eff0300 21450002 4272b000 00c6064b 76d155ad 9a19e29b bd005004 284c0c16
ffff810137f9a240 3525343961 S Bo:4:080:6 -115 2043 = 7eff0300 21450003 a901fe40 008006c0 c119e29b bdd155ad 9a042800 50fc7232
ffff810137f9a000 3525343992 S Bi:4:080:5 -115 4096 <
ffff810137f9a240 3525347696 C Bo:4:080:6 0 2043 >
ffff810137f9a240 3525387958 S Bo:4:080:6 -115 1704 = 3a206874 74703a2f 2f77696b 692e636f 6c61722e 6e65742f 62627465 74686572
ffff810137f9a240 3525390696 C Bo:4:080:6 0 1704 >
ffff810137f9a240 3525473339 S Bo:4:080:6 -115 56 = 7eff0300 21450000 30021340 008006c4 2519e29b bdd155ad 9a042a00 50bdfd05
ffff810137f9a240 3525473695 C Bo:4:080:6 0 56 >
ffff810137f9a240 3525534349 S Bo:4:080:6 -115 57 = 7eff0300 21450000 30021d40 00800685 7419e29b bd40167d 5d81042b 0050743e
ffff810137f9a240 3525534703 C Bo:4:080:6 0 57 >
ffff810137f9a240 3525871759 S Bo:4:080:6 -115 105 = 7eff0300 21450000 28022c40 008006c6 2f19e29b bdd155ab 7f041c00 50792692
ffff810137f9a240 3525872719 C Bo:4:080:6 0 105 >
ffff810137f9a000 3526063739 C Bi:4:080:5 0 1144 = 7eff0300 21450004 6eaec800 00c606ce 8a40167d 5d8119e2 9bbd0050 0422480c
ffff810137f9a000 3526094200 S Bo:4:080:6 -115 685 = 7eff0300 21450002 a4023140 00800682 ec19e29b bd40167d 5d810422 00500f34
ffff810137f9a240 3526094228 S Bi:4:080:5 -115 4096 <
ffff810137f9a000 3526095735 C Bo:4:080:6 0 685 >
ffff810137f9a240 3526104750 C Bi:4:080:5 0 48 = 7eff0300 21450000 28b32c00 00c6060d 14d155ad 9a19e29b bd005004 284c0c18
ffff810137f9a240 3526105998 S Bi:4:080:5 -115 4096 <
ffff810137f9a240 3526144749 C Bi:4:080:5 0 1520 = 7eff0300 21450005 dcb35800 00c60607 34d155ad 9a19e29b bd005004 284c0c18
ffff810137f9a240 3526152961 S Bi:4:080:5 -115 4096 <
ffff810137f9a240 3526200755 C Bi:4:080:5 0 1295 = 7eff0300 21450004 fcb36400 00c60608 08d155ad 9a19e29b bd005004 284c0c1e
ffff810137f9a240 3526261947 S Bo:4:080:6 -115 900 = 7eff0300 21450000 28023340 008006c4 0d19e29b bdd155ad 9a042800 50fc7235
ffff810137f9a000 3526261971 S Bi:4:080:5 -115 4096 <
ffff810137f9a000 3526263760 C Bi:4:080:5 0 56 = 7eff0300 21450000 30b8f400 00c60607 44d155ad 9a19e29b bd005004 2a4d3711
ffff810137f9a240 3526264733 C Bo:4:080:6 0 900 >
ffff810137f9a240 3526265641 S Bi:4:080:5 -115 4096 <
ffff810137f9a240 3526266749 C Bi:4:080:5 0 57 = 7eff0300 21450000 30b90800 00c606c8 8840167d 5d8119e2 9bbd0050 04294d3b
ffff810137f9a240 3526270675 S Bo:4:080:6 -115 1019 = 7eff0300 21450000 28023940 008006c4 0719e29b bdd155ad 9a042a00 50bdfd05
ffff810137f9a000 3526270704 S Bi:4:080:5 -115 4096 <
ffff810137f9a000 3526271753 C Bi:4:080:5 0 48 = 7eff0300 21450000 28b91800 00c60609 43d155ab 7f19e29b bd005004 1c3a26bb
ffff810137f9a240 3526272734 C Bo:4:080:6 0 1019 >
ffff810137f9a240 3526273815 S Bi:4:080:5 -115 4096 <
ffff810137f9a000 3526274635 S Bo:4:080:6 -115 738 = 7eff0300 21450000 28023b40 00800685 5e19e29b bd40167d 5d810429 0050c548
ffff810137f9a240 3526274752 C Bi:4:080:5 0 57 = 7eff0300 21450000 30b92000 00c606c8 7040167d 5d8119e2 9bbd0050 042b4d3e
ffff810137f9a000 3526275738 C Bo:4:080:6 0 738 >
ffff810137f9acc0 3526278371 S Bo:4:080:6 -115 49 = 7eff0300 21450000 28023d40 00800685 5c19e29b bd40167d 5d81042b 0050743e
ffff810137f9a000 3526278394 S Bi:4:080:5 -115 4096 <
ffff810137f9acc0 3526278735 C Bo:4:080:6 0 49 >
ffff810137f9a000 3526278760 C Bi:4:080:5 0 56 = 7eff0300 21450000 30b94c00 00c60609 07d155ab 7f19e29b bd005004 2c4d46d0
ffff810137f9a000 3526280368 S Bo:4:080:6 -115 680 = 7eff0300 21450002 9f023e40 00800682 e419e29b bd40167d 5d81042b 0050743e
ffff810137f9acc0 3526281436 S Bi:4:080:5 -115 4096 <
ffff810137f9a000 3526281738 C Bo:4:080:6 0 680 >
ffff810137f9acc0 3526282758 C Bi:4:080:5 0 1059 = 7eff0300 21450004 17bdc800 00c606bf e140167d 5d8119e2 9bbd0050 04214805
ffff810137f9acc0 3526283356 S Bo:4:080:6 -115 979 = 7eff0300 21450000 28023f40 008006c6 1c19e29b bdd155ab 7f042c00 505943fa
ffff810137f9acc0 3526284740 C Bo:4:080:6 0 979 >
ffff810137f9acc0 3526289533 S Bo:4:080:6 -115 681 = 7eff0300 21450002 a0024240 00800682 df19e29b bd40167d 5d810421 0050a517
ffff810137f9a000 3526289562 S Bi:4:080:5 -115 4096 <
ffff810137f9acc0 3526290739 C Bo:4:080:6 0 681 >
ffff810137f9a000 3526306759 C Bi:4:080:5 0 1120 = 7eff0300 21450004 56bdd400 00c606bf 9640167d 5d8119e2 9bbd0050 04203f43
ffff810137f9a000 3526336095 S Bo:4:080:6 -115 689 = 7eff0300 21450002 a8024540 00800682 d419e29b bd40167d 5d810420 0050b092
ffff810137f9acc0 3526336180 S Bi:4:080:5 -115 4096 <
ffff810137f9a000 3526337749 C Bo:4:080:6 0 689 >
ffff810137f9acc0 3526362761 C Bi:4:080:5 0 1517 = 7eff0300 21450005 dcbdd800 00c606be 0c40167d 5d8119e2 9bbd0050 04234824
ffff810137f9acc0 3526367045 S Bi:4:080:5 -115 4096 <
ffff810137f9acc0 3526378763 C Bi:4:080:5 0 208 = 7eff0300 21450000 c6bde000 00c606c3 1a40167d 5d8119e2 9bbd0050 04234824
ffff810137f9acc0 3526383029 S Bo:4:080:6 -115 49 = 7eff0300 21450000 28024740 00800685 5219e29b bd40167d 5d810423 0050734a
ffff810137f9a000 3526383051 S Bi:4:080:5 -115 4096 <
ffff810137f9acc0 3526383739 C Bo:4:080:6 0 49 >
ffff810137f9a000 3526592776 C Bi:4:080:5 0 1518 = 7eff0300 21450005 dccefc00 00c606ac e840167d 5d8119e2 9bbd0050 0422480c
ffff810137f9a000 3526617442 S Bi:4:080:5 -115 4096 <
ffff810137f9a000 3526618780 C Bi:4:080:5 0 517 = 7eff0300 21450001 facf0400 00c606b0 c240167d 5d8119e2 9bbd0050 0422480c
ffff810137f9a000 3526623967 S Bo:4:080:6 -115 49 = 7eff0300 21450000 28024c40 00800685 4d19e29b bd40167d 5d810422 00500f34
ffff810137f9acc0 3526624021 S Bi:4:080:5 -115 4096 <
ffff810137f9a000 3526624757 C Bo:4:080:6 0 49 >
ffff810137f9acc0 3526726783 C Bi:4:080:5 0 1517 = 7eff0300 21450005 dcdd1000 00c606dd 71d155ad a419e29b bd005004 254a3d2c
ffff810137f9acc0 3526730138 S Bi:4:080:5 -115 4096 <
ffff810137f9acc0 3526781793 C Bi:4:080:5 0 1223 = 7eff0300 21450004 b6dd1800 00c606de 8fd155ad a419e29b bd005004 254a3d32
ffff810137f9acc0 3526840316 S Bo:4:080:6 -115 946 = 7eff0300 21450000 28024f40 008006c3 e719e29b bdd155ad a4042500 503e9619
ffff810137f9a000 3526840347 S Bi:4:080:5 -115 4096 <
ffff810137f9acc0 3526842774 C Bo:4:080:6 0 946 >
ffff810137f9a000 3526948794 C Bi:4:080:5 0 1517 = 7eff0300 21450005 dce89000 00c606d1 fbd155ad 9a19e29b bd005004 2a4d3711
ffff810137f9a000 3526958156 S Bi:4:080:5 -115 4096 <
ffff810137f9a000 3527003799 C Bi:4:080:5 0 1365 = 7eff0300 21450005 45e89800 00c606d2 8ad155ad 9a19e29b bd005004 2a4d3717
ffff810137f9a000 3527051038 S Bo:4:080:6 -115 48 = 7eff0300 21450000 28025540 008006c3 eb19e29b bdd155ad 9a042a00 50bdfd08
ffff810137f9acc0 3527051059 S Bi:4:080:5 -115 4096 <
ffff810137f9a000 3527052778 C Bo:4:080:6 0 48 >
ffff810137f9acc0 3527106802 C Bi:4:080:5 0 49 = 7eff0300 21450000 28f22c00 00c6068f 6c40167d 5d8119e2 9bbd0050 04294d3b
ffff810137f9acc0 3527108098 S Bi:4:080:5 -115 4096 <
ffff810137f9acc0 3527145806 C Bi:4:080:5 0 1512 = 7eff0300 21450005 dcf2f800 00c60688 ec40167d 5d8119e2 9bbd0050 04294d3b
ffff810137f9acc0 3527150036 S Bi:4:080:5 -115 4096 <
ffff810137f9acc0 3527158814 C Bi:4:080:5 0 202 = 7eff0300 21450000 c1f30000 00c6068d ff40167d 5d8119e2 9bbd0050 04294d3b
ffff810137f9acc0 3527163497 S Bo:4:080:6 -115 49 = 7eff0300 21450000 28025840 00800685 4119e29b bd40167d 5d810429 0050c548
ffff810137f9a000 3527163519 S Bi:4:080:5 -115 4096 <
ffff810137f9acc0 3527163790 C Bo:4:080:6 0 49 >
ffff810137f9a000 3527241809 C Bi:4:080:5 0 49 = 7eff0300 21450000 28fa1400 00c60687 8440167d 5d8119e2 9bbd0050 042b4d3e
ffff810137f9a000 3527244044 S Bi:4:080:5 -115 4096 <
ffff810137f9a000 3527341816 C Bi:4:080:5 0 377 = 7eff0300 21450001 71ffa000 00c606c1 71d155ab 7f19e29b bd005004 2c4d46d0
ffff810137f9a000 3527348279 S Bi:4:080:5 -115 4096 <
ffff810137f9a000 3527360813 C Bi:4:080:5 0 263 = 7eff0300 21450000 fe005400 00c60680 6f40167d 5d8119e2 9bbd0050 042b4d3e
ffff810137f9acc0 3527398496 S Bi:4:080:5 -115 4096 <
ffff810137f9acc0 3527520830 C Bi:4:080:5 0 1522 = 7eff0300 21450005 dc0a0400 00c60671 e140167d 5d8119e2 9bbd0050 04214805
ffff81018515a240 3527521182 S Bo:4:080:6 -115 97 = 7eff0300 21450000 28025f40 008006c5 fc19e29b bdd155ab 7f042c00 505943fd
ffff81018515a240 3527521813 C Bo:4:080:6 0 97 >
ffff81018515a240 3527558368 S Bi:4:080:5 -115 4096 <
ffff81018515a240 3527579830 C Bi:4:080:5 0 710 = 7eff0300 21450002 b90a0c00 00c60674 fc40167d 5d8119e2 9bbd0050 04214805
ffff81018515a240 3527584894 S Bo:4:080:6 -115 49 = 7eff0300 21450000 28026340 00800685 3619e29b bd40167d 5d810421 0050a517
ffff81018515a3c0 3527584959 S Bi:4:080:5 -115 4096 <
ffff81018515a240 3527585808 C Bo:4:080:6 0 49 >
ffff81018515a3c0 3527706837 C Bi:4:080:5 0 49 = 7eff0300 21450000 2815f400 00c6066b a540167d 5d8119e2 9bbd0050 04203f43
ffff8101087a06c0 3527708254 S Bi:4:080:5 -115 4096 <
ffff8101087a06c0 3527746839 C Bi:4:080:5 0 1516 = 7eff0300 21450005 dc16d400 00c60665 1140167d 5d8119e2 9bbd0050 04203f43
ffff8101087a06c0 3527782784 S Bi:4:080:5 -115 4096 <
ffff8101087a06c0 3527806841 C Bi:4:080:5 0 1516 = 7eff0300 21450005 dc16dc00 00c60665 0940167d 5d8119e2 9bbd0050 04203f43
ffff8101087a06c0 3527811543 S Bo:4:080:6 -115 49 = 7eff0300 21450000 28026840 00800685 3119e29b bd40167d 5d810420 0050b092
ffff8101087a09c0 3527811653 S Bi:4:080:5 -115 4096 <
ffff8101087a06c0 3527811821 C Bo:4:080:6 0 49 >
ffff8101087a09c0 3527867846 C Bi:4:080:5 0 1518 = 7eff0300 21450005 dc16e800 00c60664 fd40167d 5d8119e2 9bbd0050 04203f43
ffff8101087a09c0 3527871594 S Bi:4:080:5 -115 4096 <
ffff8101087a09c0 3527872855 C Bi:4:080:5 0 385 = 7eff0300 21450001 7416f000 00c60669 5d40167d 5d8119e2 9bbd0050 04203f43
ffff8101087a09c0 3527877495 S Bo:4:080:6 -115 49 = 7eff0300 21450000 28026940 00800685 3019e29b bd40167d 5d810420 0050b092
ffff8101087a09c0 3527877825 C Bo:4:080:6 0 49 >
ffff8101087a09c0 3527878532 S Bi:4:080:5 -115 4096 <
ffff8101087a09c0 3527943851 C Bi:4:080:5 0 1434 = 7eff0300 21450005 8e1be400 00c6069e ecd155ad a419e29b bd005004 254a3d37
ffff8101087a09c0 3527972775 S Bi:4:080:5 -115 4096 <
ffff810137f9ae40 3528122957 S Bo:4:080:6 -115 48 = 7eff0300 21450000 28027240 008006c3 c419e29b bdd155ad a4042500 503e961d
ffff810137f9ae40 3528123841 C Bo:4:080:6 0 48 >
ffff810137f9a000 3530620945 S Bo:4:080:6 -115 56 = 7eff0300 21450000 30027340 008006e0 790a0002 0f0a0a01 c3042600 8b1229d0
ffff810137f9a000 3530621979 C Bo:4:080:6 0 56 >
ffff810137f9a780 3533115492 S Bo:4:080:6 -115 488 = 7eff0300 21450000 28027840 008006c3 be19e29b bdd155ad a4042500 503e961d
ffff810137f9a780 3533117123 C Bo:4:080:6 0 488 >
ffff8101087a09c0 3533397161 C Bi:4:080:5 0 48 = 7eff0300 21450000 285f9400 00c60660 a2d155ad a419e29b bd005004 254a3d3c
ffff810137f9a780 3533404565 S Bi:4:080:5 -115 4096 <
ffff810137f9a780 3533406157 C Bi:4:080:5 0 48 = 7eff0300 21450000 285fac00 00c60660 8ad155ad a419e29b bd005004 254a3d3c
ffff810137f9a780 3533454013 S Bo:4:080:6 -115 48 = 7eff0300 21450000 28028740 008006c3 af19e29b bdd155ad a4042500 503e961d
ffff810137f9a000 3533454036 S Bi:4:080:5 -115 4096 <
ffff810137f9a780 3533455139 C Bo:4:080:6 0 48 >
ffff810137f9a000 3533455164 C Bi:4:080:5 0 49 = 7eff0300 21450000 28604c00 00c60621 4d40167d 5d8119e2 9bbd0050 04203f43
ffff810137f9a000 3533478904 S Bi:4:080:5 -115 4096 <
ffff810137f9a000 3533480156 C Bi:4:080:5 0 49 = 7eff0300 21450000 28606400 00c60621 3540167d 5d8119e2 9bbd0050 04203f43
ffff810137f9a000 3533505435 S Bo:4:080:6 -115 49 = 7eff0300 21450000 28028840 00800685 1119e29b bd40167d 5d810420 0050b092
ffff810137f9a780 3533505456 S Bi:4:080:5 -115 4096 <
ffff810137f9a000 3533507139 C Bo:4:080:6 0 49 >
ffff810137f9a780 3533507163 C Bi:4:080:5 0 49 = 7eff0300 21450000 28615400 00c60620 4540167d 5d8119e2 9bbd0050 04214805
ffff810137f9a000 3533582887 S Bi:4:080:5 -115 4096 <
ffff810137f9a000 3533584163 C Bi:4:080:5 0 49 = 7eff0300 21450000 28616c00 00c60620 2d40167d 5d8119e2 9bbd0050 04214805
ffff810137f9a000 3533601686 S Bo:4:080:6 -115 49 = 7eff0300 21450000 28028d40 00800685 0c19e29b bd40167d 5d810421 0050a517
ffff810137f9acc0 3533601711 S Bi:4:080:5 -115 4096 <
ffff810137f9a000 3533603146 C Bo:4:080:6 0 49 >
ffff810137f9acc0 3533603171 C Bi:4:080:5 0 49 = 7eff0300 21450000 28637400 00c6061e 2540167d 5d8119e2 9bbd0050 042b4d3e
ffff810137f9acc0 3533607999 S Bi:4:080:5 -115 4096 <
ffff810137f9acc0 3533608158 C Bi:4:080:5 0 49 = 7eff0300 21450000 2863b800 00c6061d e140167d 5d8119e2 9bbd0050 042b4d3e
ffff810137f9acc0 3533634760 S Bo:4:080:6 -115 49 = 7eff0300 21450000 28028e40 00800685 0b19e29b bd40167d 5d81042b 0050743e
ffff810137f9a000 3533635848 S Bi:4:080:5 -115 4096 <
ffff810137f9acc0 3533636146 C Bo:4:080:6 0 49 >
ffff810137f9a000 3533636170 C Bi:4:080:5 0 48 = 7eff0300 21450000 28643800 00c6065e 23d155ab 7f19e29b bd005004 2c4d46d1
ffff810137f9a000 3533660900 S Bi:4:080:5 -115 4096 <
ffff810137f9a000 3533662167 C Bi:4:080:5 0 48 = 7eff0300 21450000 28646400 00c6065d f7d155ab 7f19e29b bd005004 2c4d46d1
ffff810137f9a000 3533685917 S Bo:4:080:6 -115 48 = 7eff0300 21450000 28028f40 008006c5 cc19e29b bdd155ab 7f042c00 505943fd
ffff810137f9acc0 3533685941 S Bi:4:080:5 -115 4096 <
ffff810137f9a000 3533687151 C Bo:4:080:6 0 48 >
ffff810137f9acc0 3533687176 C Bi:4:080:5 0 49 = 7eff0300 21450000 28652000 00c6061c 7940167d 5d8119e2 9bbd0050 04294d3b
ffff810137f9acc0 3533703896 S Bi:4:080:5 -115 4096 <
ffff810137f9acc0 3533705172 C Bi:4:080:5 0 49 = 7eff0300 21450000 28654000 00c6061c 5940167d 5d8119e2 9bbd0050 04294d3b
ffff810137f9acc0 3533706765 S Bo:4:080:6 -115 49 = 7eff0300 21450000 28029040 00800685 0919e29b bd40167d 5d810429 0050c548
ffff810137f9a000 3533706785 S Bi:4:080:5 -115 4096 <
ffff810137f9acc0 3533707147 C Bo:4:080:6 0 49 >
ffff810137f9a000 3533707168 C Bi:4:080:5 0 48 = 7eff0300 21450000 2865d400 00c6065a 6cd155ad 9a19e29b bd005004 2a4d371c
ffff810137f9a000 3533708824 S Bi:4:080:5 -115 4096 <
ffff810137f9a000 3533709163 C Bi:4:080:5 0 48 = 7eff0300 21450000 2865e400 00c6065a 5cd155ad 9a19e29b bd005004 2a4d371c
ffff810137f9a000 3533710833 S Bo:4:080:6 -115 49 = 7eff0300 21450000 28029140 008006c3 af19e29b bdd155ad 9a042a00 50bdfd08
ffff810137f9acc0 3533710850 S Bi:4:080:5 -115 4096 <
ffff810137f9a000 3533711146 C Bo:4:080:6 0 49 >
ffff810137f9acc0 3533711167 C Bi:4:080:5 0 49 = 7eff0300 21450000 2866a000 00c6061a f940167d 5d8119e2 9bbd0050 0422480c
ffff810137f9acc0 3533712864 S Bi:4:080:5 -115 4096 <
ffff810137f9acc0 3533713163 C Bi:4:080:5 0 49 = 7eff0300 21450000 2866b000 00c6061a e940167d 5d8119e2 9bbd0050 0422480c
ffff810137f9acc0 3533714879 S Bo:4:080:6 -115 49 = 7eff0300 21450000 28029240 00800685 0719e29b bd40167d 5d810422 00500f34
ffff810137f9a000 3533714894 S Bi:4:080:5 -115 4096 <
ffff810137f9acc0 3533715147 C Bo:4:080:6 0 49 >
ffff810137f9a000 3533715168 C Bi:4:080:5 0 49 = 7eff0300 21450000 28687800 00c60619 2140167d 5d8119e2 9bbd0050 04234824
ffff810137f9a000 3533716791 S Bi:4:080:5 -115 4096 <
ffff810137f9a000 3533717169 C Bi:4:080:5 0 49 = 7eff0300 21450000 28689800 00c60619 0140167d 5d8119e2 9bbd0050 04234824
ffff810137f9a000 3533718814 S Bo:4:080:6 -115 49 = 7eff0300 21450000 28029340 00800685 0619e29b bd40167d 5d810423 0050734a
ffff810137f9acc0 3533718829 S Bi:4:080:5 -115 4096 <
ffff810137f9a000 3533719148 C Bo:4:080:6 0 49 >
ffff810137f9acc0 3533719170 C Bi:4:080:5 0 48 = 7eff0300 21450000 28692c00 00c60657 14d155ad 9a19e29b bd005004 284c0c23
ffff810137f9acc0 3533720827 S Bi:4:080:5 -115 4096 <
ffff810137f9acc0 3533721164 C Bi:4:080:5 0 48 = 7eff0300 21450000 28694000 00c60657 00d155ad 9a19e29b bd005004 284c0c23
ffff810137f9acc0 3533722844 S Bo:4:080:6 -115 48 = 7eff0300 21450000 28029440 008006c3 ac19e29b bdd155ad 9a042800 50fc7235
ffff810137f9a000 3533722861 S Bi:4:080:5 -115 4096 <
ffff810137f9acc0 3533723147 C Bo:4:080:6 0 48 >
ffff810171f866c0 3602165878 S Bo:4:080:6 -115 36 = 7eff7d23 c0217d25 7d287d20 7d307d34 fa6ef17d 203ccd74 7d207d20 7d207d20
ffff810137f9a000 3602166987 C Bi:4:080:5 0 18 = 7eff7d23 c0217d26 7d287d20 7d24ee7d 5e7e
ffff810171f866c0 3602166994 C Bo:4:080:6 0 36 >
ffff810171f866c0 3602184145 S Bi:4:080:5 -115 4096 <
ffff810171f86840 3602228005 S Bo:4:080:6 -115 4 = 4154480d
ffff810171f866c0 3602228985 C Bi:4:080:5 0 6 = 0d0a4f4b 0d0a
ffff810171f86840 3602228993 C Bo:4:080:6 0 4 >
ffff8101483ec780 3602233344 S Bi:4:080:5 -115 4096 <
ffff8101483ec000 3602235948 S Bo:4:080:6 -115 28 = 00000000 23000000 03000000 00c20100 fa6ef17d 203ccd74 78563412
ffff8101483ec780 3602237073 C Bi:4:080:5 0 24 = 00000000 23000000 23000000 00c20100 18000000 78563412
ffff8101483ec000 3602237079 C Bo:4:080:6 0 28 >
ffff8101483ec000 3602238729 S Bi:4:080:5 -115 4096 <
ffff8101483ec780 3602244991 S Bo:4:080:6 -115 3 = 41540d
ffff8101483ec000 3602245979 C Bi:4:080:5 0 6 = 0d0a4f4b 0d0a
ffff8101483ec780 3602245984 C Bo:4:080:6 0 3 >
ffff8101483ec780 3602252303 S Bi:4:080:5 -115 4096 <
ffff8101483ec000 3602253238 S Bo:4:080:6 -115 7 = 41544530 56310d
ffff8101483ec780 3602253983 C Bi:4:080:5 0 6 = 0d0a4f4b 0d0a
ffff8101483ec000 3602253990 C Bo:4:080:6 0 7 >
ffff8101483ec000 3602262525 S Bi:4:080:5 -115 4096 <
ffff8101483ec780 3602263425 S Bo:4:080:6 -115 3 = 41540d
ffff8101483ec000 3602263980 C Bi:4:080:5 0 6 = 0d0a4f4b 0d0a
ffff8101483ec780 3602263985 C Bo:4:080:6 0 3 >
ffff8101483ec780 3602266554 S Bi:4:080:5 -115 4096 <
ffff8101483ec000 3602273414 S Bo:4:080:6 -115 40 = 41542b63 6764636f 6e743d31 2c224950 222c2277 61702e76 6f696365 73747265
ffff8101483ec000 3602273966 C Bo:4:080:6 0 40 >
ffff8101483ec780 3602276977 C Bi:4:080:5 0 6 = 0d0a4f4b 0d0a
ffff8101483ec780 3602279393 S Bi:4:080:5 -115 4096 <
ffff8101483ec000 3602284847 S Bo:4:080:6 -115 7 = 41545330 3d300d
ffff8101483ec000 3602284967 C Bo:4:080:6 0 7 >
ffff8101483ec780 3602285979 C Bi:4:080:5 0 6 = 0d0a4f4b 0d0a
ffff8101483ec780 3602295632 S Bi:4:080:5 -115 4096 <
ffff8101483ec000 3602302543 S Bo:4:080:6 -115 12 = 01000000 00000000 78563412
ffff8101483ec000 3602303017 C Bo:4:080:6 0 12 >
ffff8101483ec000 3602305632 S Bo:4:080:6 -115 28 = 00000000 23000000 00000000 00c20100 222c2277 61702e76 78563412
ffff8101483ec000 3602305968 C Bo:4:080:6 0 28 >
