ffff81019bdd2840 291668745 C Bi:4:055:5 -2 0
ffff810140a01840 291668876 S Bi:4:055:5 -115 16384 <
ffff8101f8813c00 291719916 S Bo:4:055:6 -115 60 = 7eff0300 21450000 34464c40 00400669 d60a0a01 c3d155ad 7f9ddb00 50cdbabb
ffff810140a01840 291720747 C Bi:4:055:5 -2 0
ffff8101f8813c00 291720755 C Bo:4:055:6 0 60 >
ffff810140a01840 291720809 S Bi:4:055:5 -115 16384 <
ffff810140a01840 291772754 C Bi:4:055:5 -2 0
ffff810140a01840 291772820 S Bi:4:055:5 -115 16384 <
ffff810140a01840 291824755 C Bi:4:055:5 -2 0
ffff810140a01840 291824812 S Bi:4:055:5 -115 16384 <
ffff810140a01840 291876758 C Bi:4:055:5 -2 0
ffff810140a01840 291876820 S Bi:4:055:5 -115 16384 <
ffff810140a01840 291928762 C Bi:4:055:5 -2 0
ffff810140a01840 291928817 S Bi:4:055:5 -115 16384 <
ffff810140a01840 291980767 C Bi:4:055:5 -2 0
ffff810140a01840 291980833 S Bi:4:055:5 -115 16384 <
ffff810140a01840 292032767 C Bi:4:055:5 -2 0
ffff810140a01840 292032821 S Bi:4:055:5 -115 16384 <
ffff810140a01840 292084768 C Bi:4:055:5 -2 0
ffff810140a01840 292084878 S Bi:4:055:5 -115 16384 <
ffff810140a01840 292136773 C Bi:4:055:5 -2 0
ffff810140a01840 292136828 S Bi:4:055:5 -115 16384 <
ffff81011ed54780 292159926 S Bo:4:055:6 -115 60 = 7eff0300 21450000 34464d40 00400669 d50a0a01 c3d155ad 7f9ddb00 50cdbabb
ffff81011ed54780 292160708 C Bo:4:055:6 0 60 >
ffff810140a01840 292188773 C Bi:4:055:5 -2 0
ffff810140a01840 292188841 S Bi:4:055:5 -115 16384 <
ffff810140a01840 292240778 C Bi:4:055:5 -2 0
ffff810140a01840 292240824 S Bi:4:055:5 -115 16384 <
ffff810140a01840 292292783 C Bi:4:055:5 -2 0
ffff810140a01840 292292845 S Bi:4:055:5 -115 16384 <
ffff810140a01840 292344786 C Bi:4:055:5 -2 0
ffff810140a01840 292344841 S Bi:4:055:5 -115 16384 <
ffff810140a01840 292396788 C Bi:4:055:5 -2 0
ffff8101f4408240 292396938 S Bi:4:055:5 -115 16384 <
ffff8101f4408240 292448790 C Bi:4:055:5 -2 0
ffff8101f4408240 292448928 S Bi:4:055:5 -115 16384 <
ffff8101f4408240 292500791 C Bi:4:055:5 -2 0
ffff8101f4408240 292500928 S Bi:4:055:5 -115 16384 <
ffff8101f4408240 292552795 C Bi:4:055:5 -2 0
ffff8101f4408240 292552932 S Bi:4:055:5 -115 16384 <
ffff8101f4408240 292604802 C Bi:4:055:5 -2 0
ffff8101338479c0 292604925 S Bi:4:055:5 -115 16384 <
ffff8101338479c0 292656800 C Bi:4:055:5 -2 0
ffff8101338479c0 292656904 S Bi:4:055:5 -115 16384 <
ffff8101338479c0 292708802 C Bi:4:055:5 -2 0
ffff8101338479c0 292708867 S Bi:4:055:5 -115 16384 <
ffff8101338479c0 292760808 C Bi:4:055:5 -2 0
ffff8101338479c0 292760870 S Bi:4:055:5 -115 16384 <
ffff8101338479c0 292812810 C Bi:4:055:5 -2 0
ffff8101338479c0 292812880 S Bi:4:055:5 -115 16384 <
ffff8101338479c0 292864813 C Bi:4:055:5 -2 0
ffff8101338479c0 292864874 S Bi:4:055:5 -115 16384 <
ffff8101338479c0 292916814 C Bi:4:055:5 -2 0
ffff8101338479c0 292916870 S Bi:4:055:5 -115 16384 <
ffff8101338479c0 292968818 C Bi:4:055:5 -2 0
ffff8101338479c0 292968876 S Bi:4:055:5 -115 16384 <
ffff8101338479c0 293020821 C Bi:4:055:5 -2 0
ffff8101338479c0 293020877 S Bi:4:055:5 -115 16384 <
ffff81012134ad80 293043918 S Bo:4:055:6 -115 60 = 7eff0300 21450000 34464e40 00400669 d40a0a01 c3d155ad 7f9ddb00 50cdbabb
ffff81012134ad80 293044757 C Bo:4:055:6 0 60 >
ffff8101338479c0 293072825 C Bi:4:055:5 -2 0
ffff8101338479c0 293072883 S Bi:4:055:5 -115 16384 <
ffff8101338479c0 293124828 C Bi:4:055:5 -2 0
ffff8101338479c0 293124909 S Bi:4:055:5 -115 16384 <
ffff8101338479c0 293176830 C Bi:4:055:5 -2 0
ffff8101338479c0 293176908 S Bi:4:055:5 -115 16384 <
ffff8101338479c0 293228831 C Bi:4:055:5 -2 0
ffff8101338479c0 293228882 S Bi:4:055:5 -115 16384 <
ffff8101338479c0 293280837 C Bi:4:055:5 -2 0
ffff8101338479c0 293280897 S Bi:4:055:5 -115 16384 <
ffff8101338479c0 293332840 C Bi:4:055:5 -2 0
ffff8101338479c0 293332953 S Bi:4:055:5 -115 16384 <
ffff8101ef1153c0 293360189 S Bo:4:055:10 -115 31 = 55534243 26060000 00000000 00000600 00000000 00000000 00000000 000000
ffff8101ef1153c0 293360772 C Bo:4:055:10 0 31 >
ffff8101ef1153c0 293360778 S Bi:4:055:9 -115 13 <
ffff8101ef1153c0 293361772 C Bi:4:055:9 0 13 = 55534253 26060000 00000000 01
ffff8101ef1153c0 293361778 S Bo:4:055:10 -115 31 = 55534243 27060000 12000000 80000603 00000012 00000000 00000000 000000
ffff8101ef1153c0 293362771 C Bo:4:055:10 0 31 >
ffff81012134aa80 293362781 S Bi:4:055:9 -115 18 <
ffff81012134aa80 293363771 C Bi:4:055:9 0 18 = 70000200 0000000a 00000000 3a000000 0000
ffff8101ef1153c0 293363778 S Bi:4:055:9 -115 13 <
ffff8101ef1153c0 293364771 C Bi:4:055:9 0 13 = 55534253 27060000 00000000 00
ffff8101ef1153c0 293364811 S Bo:4:055:10 -115 31 = 55534243 28060000 00000000 00000600 00000000 00000000 00000000 000000
ffff8101ef1153c0 293365771 C Bo:4:055:10 0 31 >
ffff8101ef1153c0 293365777 S Bi:4:055:9 -115 13 <
ffff8101ef1153c0 293366772 C Bi:4:055:9 0 13 = 55534253 28060000 00000000 01
ffff8101ef1153c0 293366778 S Bo:4:055:10 -115 31 = 55534243 29060000 12000000 80000603 00000012 00000000 00000000 000000
ffff8101ef1153c0 293367771 C Bo:4:055:10 0 31 >
ffff81012134aa80 293367778 S Bi:4:055:9 -115 18 <
ffff81012134aa80 293368772 C Bi:4:055:9 0 18 = 70000200 0000000a 00000000 3a000000 0000
ffff8101ef1153c0 293368779 S Bi:4:055:9 -115 13 <
ffff8101ef1153c0 293369771 C Bi:4:055:9 0 13 = 55534253 29060000 00000000 00
ffff8101338479c0 293384842 C Bi:4:055:5 -2 0
ffff8101338479c0 293384910 S Bi:4:055:5 -115 16384 <
ffff8101338479c0 293436846 C Bi:4:055:5 -2 0
ffff8101338479c0 293436902 S Bi:4:055:5 -115 16384 <
ffff8101338479c0 293488848 C Bi:4:055:5 -2 0
ffff8101338479c0 293488914 S Bi:4:055:5 -115 16384 <
ffff8101338479c0 293540852 C Bi:4:055:5 -2 0
ffff8101338479c0 293540914 S Bi:4:055:5 -115 16384 <
ffff8101338479c0 293592850 C Bi:4:055:5 -2 0
ffff8101338479c0 293592917 S Bi:4:055:5 -115 16384 <
ffff8101338479c0 293644861 C Bi:4:055:5 -2 0
ffff8101338479c0 293644983 S Bi:4:055:5 -115 16384 <
ffff8101338479c0 293696857 C Bi:4:055:5 -2 0
ffff8101338479c0 293696977 S Bi:4:055:5 -115 16384 <
ffff8101338479c0 293748861 C Bi:4:055:5 -2 0
ffff8101338479c0 293748979 S Bi:4:055:5 -115 16384 <
ffff8101338479c0 293800863 C Bi:4:055:5 -2 0
ffff8101338479c0 293800979 S Bi:4:055:5 -115 16384 <
ffff8101338479c0 293852874 C Bi:4:055:5 -2 0
ffff8101338479c0 293853025 S Bi:4:055:5 -115 16384 <
ffff8101338479c0 293904868 C Bi:4:055:5 -2 0
ffff8101338479c0 293904973 S Bi:4:055:5 -115 16384 <
ffff8101338479c0 293956871 C Bi:4:055:5 -2 0
ffff8101338479c0 293956982 S Bi:4:055:5 -115 16384 <
ffff8101338479c0 294008873 C Bi:4:055:5 -2 0
ffff8101338479c0 294008983 S Bi:4:055:5 -115 16384 <
ffff8101338479c0 294060877 C Bi:4:055:5 -2 0
ffff8101338479c0 294060988 S Bi:4:055:5 -115 16384 <
ffff8101338479c0 294112877 C Bi:4:055:5 -2 0
ffff8101338479c0 294112984 S Bi:4:055:5 -115 16384 <
ffff8101338479c0 294164882 C Bi:4:055:5 -2 0
ffff8101338479c0 294164995 S Bi:4:055:5 -115 16384 <
ffff8101338479c0 294216882 C Bi:4:055:5 -2 0
ffff8101338479c0 294216965 S Bi:4:055:5 -115 16384 <
ffff8101338479c0 294268890 C Bi:4:055:5 -2 0
ffff8101338479c0 294269005 S Bi:4:055:5 -115 16384 <
ffff8101338479c0 294320891 C Bi:4:055:5 -2 0
ffff8101338479c0 294321011 S Bi:4:055:5 -115 16384 <
ffff8101338479c0 294372897 C Bi:4:055:5 -2 0
ffff8101338479c0 294373010 S Bi:4:055:5 -115 16384 <
ffff8101338479c0 294424894 C Bi:4:055:5 -2 0
ffff8101338479c0 294425001 S Bi:4:055:5 -115 16384 <
ffff8101338479c0 294476900 C Bi:4:055:5 -2 0
ffff8101338479c0 294477037 S Bi:4:055:5 -115 16384 <
ffff8101338479c0 294528903 C Bi:4:055:5 -2 0
ffff8101338479c0 294529020 S Bi:4:055:5 -115 16384 <
ffff8101338479c0 294580905 C Bi:4:055:5 -2 0
ffff8101338479c0 294581020 S Bi:4:055:5 -115 16384 <
ffff8101338479c0 294632911 C Bi:4:055:5 -2 0
ffff8101338479c0 294633033 S Bi:4:055:5 -115 16384 <
ffff8101338479c0 294684912 C Bi:4:055:5 -2 0
ffff8101338479c0 294685028 S Bi:4:055:5 -115 16384 <
ffff8101338479c0 294736916 C Bi:4:055:5 -2 0
ffff8101338479c0 294737025 S Bi:4:055:5 -115 16384 <
ffff8101338479c0 294788921 C Bi:4:055:5 -2 0
ffff8101338479c0 294789038 S Bi:4:055:5 -115 16384 <
ffff81012134ad80 294803908 S Bo:4:055:6 -115 60 = 7eff0300 21450000 34464f40 00400669 d30a0a01 c3d155ad 7f9ddb00 50cdbabb
ffff81012134ad80 294804854 C Bo:4:055:6 0 60 >
ffff8101338479c0 294840922 C Bi:4:055:5 -2 0
ffff8101338479c0 294841039 S Bi:4:055:5 -115 16384 <
ffff8101338479c0 294892925 C Bi:4:055:5 -2 0
ffff8101338479c0 294893043 S Bi:4:055:5 -115 16384 <
ffff8101338479c0 294944925 C Bi:4:055:5 -2 0
ffff8101338479c0 294945034 S Bi:4:055:5 -115 16384 <
ffff8101338479c0 294996932 C Bi:4:055:5 -2 0
ffff8101338479c0 294997053 S Bi:4:055:5 -115 16384 <
ffff8101338479c0 295048930 C Bi:4:055:5 -2 0
ffff8101338479c0 295049044 S Bi:4:055:5 -115 16384 <
ffff8101338479c0 295100932 C Bi:4:055:5 -2 0
ffff8101338479c0 295101044 S Bi:4:055:5 -115 16384 <
ffff8101338479c0 295152938 C Bi:4:055:5 -2 0
ffff8101338479c0 295153052 S Bi:4:055:5 -115 16384 <
ffff8101338479c0 295204939 C Bi:4:055:5 -2 0
ffff8101338479c0 295205036 S Bi:4:055:5 -115 16384 <
ffff8101338479c0 295256942 C Bi:4:055:5 -2 0
ffff8101338479c0 295257057 S Bi:4:055:5 -115 16384 <
ffff8101338479c0 295308946 C Bi:4:055:5 -2 0
ffff8101338479c0 295309056 S Bi:4:055:5 -115 16384 <
ffff8101ef1153c0 295367892 S Bo:4:055:10 -115 31 = 55534243 2a060000 00000000 00000600 00000000 00000000 00000000 000000
ffff8101338479c0 295368952 C Bi:4:055:5 -2 0
ffff8101ef1153c0 295368960 C Bo:4:055:10 0 31 >
ffff81012134a600 295369118 S Bi:4:055:5 -115 16384 <
ffff8101ef1153c0 295369167 S Bi:4:055:9 -115 13 <
ffff8101ef1153c0 295369887 C Bi:4:055:9 0 13 = 55534253 2a060000 00000000 01
ffff8101ef1153c0 295369923 S Bo:4:055:10 -115 31 = 55534243 2b060000 12000000 80000603 00000012 00000000 00000000 000000
ffff8101ef1153c0 295370883 C Bo:4:055:10 0 31 >
ffff81012134aa80 295370893 S Bi:4:055:9 -115 18 <
ffff81012134aa80 295371883 C Bi:4:055:9 0 18 = 70000200 0000000a 00000000 3a000000 0000
ffff8101ef1153c0 295371891 S Bi:4:055:9 -115 13 <
ffff8101ef1153c0 295372883 C Bi:4:055:9 0 13 = 55534253 2b060000 00000000 00
ffff8101ef1153c0 295372929 S Bo:4:055:10 -115 31 = 55534243 2c060000 00000000 00000600 00000000 00000000 00000000 000000
ffff8101ef1153c0 295373883 C Bo:4:055:10 0 31 >
ffff8101ef1153c0 295373888 S Bi:4:055:9 -115 13 <
ffff8101ef1153c0 295374883 C Bi:4:055:9 0 13 = 55534253 2c060000 00000000 01
ffff8101ef1153c0 295374890 S Bo:4:055:10 -115 31 = 55534243 2d060000 12000000 80000603 00000012 00000000 00000000 000000
ffff8101ef1153c0 295375883 C Bo:4:055:10 0 31 >
ffff81012134aa80 295375890 S Bi:4:055:9 -115 18 <
ffff81012134aa80 295376883 C Bi:4:055:9 0 18 = 70000200 0000000a 00000000 3a000000 0000
ffff8101ef1153c0 295376890 S Bi:4:055:9 -115 13 <
ffff8101ef1153c0 295377883 C Bi:4:055:9 0 13 = 55534253 2d060000 00000000 00
ffff81012134a600 295419954 C Bi:4:055:5 -2 0
ffff81012134a600 295420093 S Bi:4:055:5 -115 16384 <
ffff81012134a600 295471955 C Bi:4:055:5 -2 0
ffff81012134a600 295472094 S Bi:4:055:5 -115 16384 <
ffff81012134a600 295523960 C Bi:4:055:5 -2 0
ffff81012134a600 295524095 S Bi:4:055:5 -115 16384 <
ffff81012134a600 295575964 C Bi:4:055:5 -2 0
ffff81012134a600 295576405 S Bi:4:055:5 -115 16384 <
ffff81012134a600 295627966 C Bi:4:055:5 -2 0
ffff81012134a600 295628106 S Bi:4:055:5 -115 16384 <
ffff81012134a600 295679970 C Bi:4:055:5 -2 0
ffff81012134a600 295680110 S Bi:4:055:5 -115 16384 <
ffff81012134a600 295731971 C Bi:4:055:5 -2 0
ffff81012134a600 295732110 S Bi:4:055:5 -115 16384 <
ffff81012134a600 295783980 C Bi:4:055:5 -2 0
ffff81012134a600 295785077 S Bi:4:055:5 -115 16384 <
ffff81012134a600 295835977 C Bi:4:055:5 -2 0
ffff81012134a600 295836111 S Bi:4:055:5 -115 16384 <
ffff81012134a600 295887981 C Bi:4:055:5 -2 0
ffff81012134a600 295888118 S Bi:4:055:5 -115 16384 <
ffff81012134a600 295939984 C Bi:4:055:5 -2 0
ffff81012134a600 295940121 S Bi:4:055:5 -115 16384 <
ffff81012134a600 295991984 C Bi:4:055:5 -2 0
ffff81012134a600 295992117 S Bi:4:055:5 -115 16384 <
ffff81012134a600 296043990 C Bi:4:055:5 -2 0
ffff81012134a600 296044127 S Bi:4:055:5 -115 16384 <
ffff81012134a600 296095989 C Bi:4:055:5 -2 0
ffff81012134a600 296096119 S Bi:4:055:5 -115 16384 <
ffff81012134a600 296147996 C Bi:4:055:5 -2 0
ffff81012134a600 296148132 S Bi:4:055:5 -115 16384 <
ffff81012134a600 296199996 C Bi:4:055:5 -2 0
ffff81012134a600 296200132 S Bi:4:055:5 -115 16384 <
ffff81012134a600 296252001 C Bi:4:055:5 -2 0
ffff81012134a600 296252142 S Bi:4:055:5 -115 16384 <
ffff81012134a600 296304004 C Bi:4:055:5 -2 0
ffff81012134a600 296304142 S Bi:4:055:5 -115 16384 <
ffff81012134a600 296356005 C Bi:4:055:5 -2 0
ffff81012134a600 296356145 S Bi:4:055:5 -115 16384 <
ffff81012134a600 296408008 C Bi:4:055:5 -2 0
ffff81012134a600 296408150 S Bi:4:055:5 -115 16384 <
ffff81012134a600 296461019 C Bi:4:055:5 -2 0
ffff810213305780 296471866 S Bi:4:055:5 -115 16384 <
ffff810213305780 296524017 C Bi:4:055:5 -2 0
ffff810213305780 296524159 S Bi:4:055:5 -115 16384 <
ffff810213305780 296576020 C Bi:4:055:5 -2 0
ffff810213305780 296576166 S Bi:4:055:5 -115 16384 <
ffff810213305780 296628022 C Bi:4:055:5 -2 0
ffff810213305780 296628210 S Bi:4:055:5 -115 16384 <
ffff810213305780 296680026 C Bi:4:055:5 -2 0
ffff81001e747d80 296680168 S Bi:4:055:5 -115 16384 <
ffff81001e747d80 296733028 C Bi:4:055:5 -2 0
ffff81001e747d80 296733150 S Bi:4:055:5 -115 16384 <
ffff81001e747d80 296785031 C Bi:4:055:5 -2 0
ffff81001e747d80 296785112 S Bi:4:055:5 -115 16384 <
ffff81001e747d80 296837035 C Bi:4:055:5 -2 0
ffff81001e747d80 296837087 S Bi:4:055:5 -115 16384 <
ffff81001e747d80 296889036 C Bi:4:055:5 -2 0
ffff81001e747d80 296889088 S Bi:4:055:5 -115 16384 <
ffff81001e747d80 296941039 C Bi:4:055:5 -2 0
ffff81001e747d80 296941113 S Bi:4:055:5 -115 16384 <
ffff81001e747d80 296993044 C Bi:4:055:5 -2 0
ffff81001e747d80 296993119 S Bi:4:055:5 -115 16384 <
ffff81001e747d80 297045045 C Bi:4:055:5 -2 0
ffff81001e747d80 297045094 S Bi:4:055:5 -115 16384 <
ffff81001e747d80 297097047 C Bi:4:055:5 -2 0
ffff81001e747d80 297097099 S Bi:4:055:5 -115 16384 <
ffff81001e747d80 297149051 C Bi:4:055:5 -2 0
ffff81001e747d80 297149101 S Bi:4:055:5 -115 16384 <
ffff81001e747d80 297201053 C Bi:4:055:5 -2 0
ffff81001e747d80 297201111 S Bi:4:055:5 -115 16384 <
ffff81001e747d80 297253060 C Bi:4:055:5 -2 0
ffff81001e747d80 297253170 S Bi:4:055:5 -115 16384 <
ffff81001e747d80 297305061 C Bi:4:055:5 -2 0
ffff81001e747d80 297305127 S Bi:4:055:5 -115 16384 <
ffff81001e747d80 297357063 C Bi:4:055:5 -2 0
ffff81001e747d80 297357114 S Bi:4:055:5 -115 16384 <
ffff8101ef1153c0 297363735 S Bo:4:055:10 -115 31 = 55534243 2e060000 00000000 00000600 00000000 00000000 00000000 000000
ffff8101ef1153c0 297363996 C Bo:4:055:10 0 31 >
ffff8101ef1153c0 297364004 S Bi:4:055:9 -115 13 <
ffff8101ef1153c0 297364995 C Bi:4:055:9 0 13 = 55534253 2e060000 00000000 01
ffff8101ef1153c0 297365002 S Bo:4:055:10 -115 31 = 55534243 2f060000 12000000 80000603 00000012 00000000 00000000 000000
ffff8101ef1153c0 297365994 C Bo:4:055:10 0 31 >
ffff810079718840 297366006 S Bi:4:055:9 -115 18 <
ffff810079718840 297367000 C Bi:4:055:9 0 18 = 70000200 0000000a 00000000 3a000000 0000
ffff8101ef1153c0 297367045 S Bi:4:055:9 -115 13 <
ffff8101ef1153c0 297367995 C Bi:4:055:9 0 13 = 55534253 2f060000 00000000 00
ffff8101ef1153c0 297368039 S Bo:4:055:10 -115 31 = 55534243 30060000 00000000 00000600 00000000 00000000 00000000 000000
ffff8101ef1153c0 297368995 C Bo:4:055:10 0 31 >
ffff8101ef1153c0 297369001 S Bi:4:055:9 -115 13 <
ffff8101ef1153c0 297369994 C Bi:4:055:9 0 13 = 55534253 30060000 00000000 01
ffff8101ef1153c0 297370000 S Bo:4:055:10 -115 31 = 55534243 31060000 12000000 80000603 00000012 00000000 00000000 000000
ffff8101ef1153c0 297370994 C Bo:4:055:10 0 31 >
ffff810079718840 297371002 S Bi:4:055:9 -115 18 <
ffff810079718840 297371994 C Bi:4:055:9 0 18 = 70000200 0000000a 00000000 3a000000 0000
ffff8101ef1153c0 297372001 S Bi:4:055:9 -115 13 <
ffff8101ef1153c0 297372995 C Bi:4:055:9 0 13 = 55534253 31060000 00000000 00
ffff81001e747d80 297409065 C Bi:4:055:5 -2 0
ffff81001e747d80 297409125 S Bi:4:055:5 -115 16384 <
ffff81001e747d80 297461069 C Bi:4:055:5 -2 0
ffff81001e747d80 297461151 S Bi:4:055:5 -115 16384 <
ffff81001e747d80 297513072 C Bi:4:055:5 -2 0
ffff81001e747d80 297513138 S Bi:4:055:5 -115 16384 <
ffff81001e747d80 297565076 C Bi:4:055:5 -2 0
ffff81001e747d80 297565128 S Bi:4:055:5 -115 16384 <
ffff81001e747d80 297617079 C Bi:4:055:5 -2 0
ffff81001e747d80 297617179 S Bi:4:055:5 -115 16384 <
ffff81001e747d80 297669087 C Bi:4:055:5 -2 0
ffff81001e747d80 297669212 S Bi:4:055:5 -115 16384 <
ffff81001e747d80 297720084 C Bi:4:055:5 -2 0
ffff810079718000 297720233 S Bi:4:055:5 -115 16384 <
ffff810079718000 297772089 C Bi:4:055:5 -2 0
ffff8101fafc0b40 297772653 S Bi:4:055:5 -115 16384 <
ffff8101fafc0b40 297825103 C Bi:4:055:5 -2 0
ffff81008b44b600 297825258 S Bi:4:055:5 -115 16384 <
ffff81013597c0c0 297867981 S Bo:4:055:6 -115 69 = 7eff0300 21450000 3c705040 0040064b 5119e0aa 5a451175 cfc58f00 50e92f7d
ffff81013597c0c0 297869033 C Bo:4:055:6 0 69 >
ffff81008b44b600 297876093 C Bi:4:055:5 -2 0
ffff8101f4758840 297876244 S Bi:4:055:5 -115 16384 <
ffff8101f4758840 297927091 C Bi:4:055:5 -2 0
ffff8101f4758840 297927233 S Bi:4:055:5 -115 16384 <
ffff8101f4758840 297982094 C Bi:4:055:5 -2 0
ffff81019bdd20c0 297982233 S Bi:4:055:5 -115 16384 <
ffff81019bdd20c0 298036098 C Bi:4:055:5 -2 0
ffff81019bdd20c0 298036237 S Bi:4:055:5 -115 16384 <
ffff81019bdd20c0 298087101 C Bi:4:055:5 -2 0
ffff81019bdd20c0 298087241 S Bi:4:055:5 -115 16384 <
ffff81019bdd20c0 298140104 C Bi:4:055:5 -2 0
ffff81019bdd20c0 298140245 S Bi:4:055:5 -115 16384 <
ffff81019bdd20c0 298192109 C Bi:4:055:5 -2 0
ffff81019bdd20c0 298193118 S Bi:4:055:5 -115 16384 <
ffff81019bdd20c0 298244116 C Bi:4:055:5 -2 0
ffff81019bdd20c0 298244257 S Bi:4:055:5 -115 16384 <
ffff81019bdd20c0 298296115 C Bi:4:055:5 -2 0
ffff810213a30480 298296245 S Bi:4:055:5 -115 16384 <
ffff810213a300c0 298323897 S Bo:4:055:6 -115 60 = 7eff0300 21450000 34465040 00400669 d20a0a01 c3d155ad 7f9ddb00 50cdbabb
ffff810213a300c0 298324050 C Bo:4:055:6 0 60 >
ffff810213a30480 298348119 C Bi:4:055:5 -2 0
ffff810213a30480 298348326 S Bi:4:055:5 -115 16384 <
ffff810213a30480 298363114 C Bi:4:055:5 0 57 = 7eff0300 21450000 308f4000 00c606e6 6c451175 cf19e0aa 5a0050c5 8f9ab075
ffff810213a30480 298363482 S Bi:4:055:5 -115 16384 <
ffff810213a30480 298415121 C Bi:4:055:5 -2 0
ffff81011ed54780 298415315 S Bi:4:055:5 -115 16384 <
ffff81008b6eff00 298417079 S Bo:4:055:6 -115 822 = 7eff0300 21450000 28705140 0040064b 6419e0aa 5a451175 cfc58f00 50e92f7d
ffff81008b6eff00 298418065 C Bo:4:055:6 0 822 >
ffff81011ed54780 298472127 C Bi:4:055:5 -2 0
ffff81008b6eff00 298473199 S Bi:4:055:5 -115 16384 <
ffff81008b6eff00 298528136 C Bi:4:055:5 -2 0
ffff81008b6eff00 298528302 S Bi:4:055:5 -115 16384 <
ffff81008b6eff00 298580131 C Bi:4:055:5 -2 0
ffff81008b6eff00 298580270 S Bi:4:055:5 -115 16384 <
ffff81008b6eff00 298632134 C Bi:4:055:5 -2 0
ffff81019bc5df00 298632278 S Bi:4:055:5 -115 16384 <
ffff81019bc5df00 298688137 C Bi:4:055:5 -2 0
ffff81019bc5df00 298688278 S Bi:4:055:5 -115 16384 <
ffff81019bc5df00 298740140 C Bi:4:055:5 -2 0
ffff81019bc5df00 298740281 S Bi:4:055:5 -115 16384 <
ffff81019bc5df00 298793143 C Bi:4:055:5 -2 0
ffff8101338473c0 298793272 S Bi:4:055:5 -115 16384 <
ffff8101338473c0 298844149 C Bi:4:055:5 -2 0
ffff8101338473c0 298844313 S Bi:4:055:5 -115 16384 <
ffff8101338473c0 298864147 C Bi:4:055:5 0 48 = 7eff0300 21450000 28ad7000 00c606c8 44451175 cf19e0aa 5a0050c5 8f9ab075
ffff8101338473c0 298864374 S Bi:4:055:5 -115 16384 <
ffff8101338473c0 298915148 C Bi:4:055:5 -2 0
ffff8101338473c0 298915341 S Bi:4:055:5 -115 16384 <
ffff8101338473c0 298972148 C Bi:4:055:5 -2 0
ffff8101338473c0 298972243 S Bi:4:055:5 -115 16384 <
ffff8101338473c0 299024153 C Bi:4:055:5 -2 0
ffff8101338473c0 299024273 S Bi:4:055:5 -115 16384 <
ffff8101338473c0 299080160 C Bi:4:055:5 -2 0
ffff8101338473c0 299080286 S Bi:4:055:5 -115 16384 <
ffff8101338473c0 299132154 C Bi:4:055:5 -2 0
ffff8101338473c0 299132219 S Bi:4:055:5 -115 16384 <
ffff8101338473c0 299188163 C Bi:4:055:5 -2 0
ffff8101338473c0 299188277 S Bi:4:055:5 -115 16384 <
ffff8101338473c0 299240159 C Bi:4:055:5 -2 0
ffff8101338473c0 299240230 S Bi:4:055:5 -115 16384 <
ffff8101338473c0 299292169 C Bi:4:055:5 -2 0
ffff8101338473c0 299292294 S Bi:4:055:5 -115 16384 <
ffff8101338473c0 299315172 C Bi:4:055:5 0 1514 = 7eff0300 21450005 dcc0ac00 00c606af 54451175 cf19e0aa 5a0050c5 8f9ab075
ffff8101338473c0 299320014 S Bi:4:055:5 -115 16384 <
ffff8101ef1153c0 299363001 S Bo:4:055:10 -115 31 = 55534243 32060000 00000000 00000600 00000000 00000000 00000000 000000
ffff8101ef1153c0 299363107 C Bo:4:055:10 0 31 >
ffff8101ef1153c0 299363115 S Bi:4:055:9 -115 13 <
ffff8101ef1153c0 299364106 C Bi:4:055:9 0 13 = 55534253 32060000 00000000 01
ffff8101ef1153c0 299364114 S Bo:4:055:10 -115 31 = 55534243 33060000 12000000 80000603 00000012 00000000 00000000 000000
ffff8101ef1153c0 299365106 C Bo:4:055:10 0 31 >
ffff810133847d80 299365115 S Bi:4:055:9 -115 18 <
ffff810133847d80 299366106 C Bi:4:055:9 0 18 = 70000200 0000000a 00000000 3a000000 0000
ffff8101ef1153c0 299366113 S Bi:4:055:9 -115 13 <
ffff8101ef1153c0 299369106 C Bi:4:055:9 0 13 = 55534253 33060000 00000000 00
ffff8101ef1153c0 299369140 S Bo:4:055:10 -115 31 = 55534243 34060000 00000000 00000600 00000000 00000000 00000000 000000
ffff8101ef1153c0 299370110 C Bo:4:055:10 0 31 >
ffff8101ef1153c0 299370115 S Bi:4:055:9 -115 13 <
ffff8101338473c0 299371166 C Bi:4:055:5 0 1525 = 7eff0300 21450005 dcc0b400 00c606af 4c451175 cf19e0aa 5a0050c5 8f9ab07b
ffff8101ef1153c0 299371170 C Bi:4:055:9 0 13 = 55534253 34060000 00000000 01
ffff8101ef1153c0 299371176 S Bo:4:055:10 -115 31 = 55534243 35060000 12000000 80000603 00000012 00000000 00000000 000000
ffff8101ef1153c0 299372106 C Bo:4:055:10 0 31 >
ffff810133847d80 299372113 S Bi:4:055:9 -115 18 <
ffff810133847d80 299373107 C Bi:4:055:9 0 18 = 70000200 0000000a 00000000 3a000000 0000
ffff8101338473c0 299374678 S Bi:4:055:5 -115 16384 <
ffff8101ef1153c0 299374793 S Bi:4:055:9 -115 13 <
ffff8101ef1153c0 299375108 C Bi:4:055:9 0 13 = 55534253 35060000 00000000 00
ffff8101338473c0 299427176 C Bi:4:055:5 -2 0
ffff8101338473c0 299427714 S Bi:4:055:5 -115 16384 <
ffff810133847600 299428066 S Bo:4:055:6 -115 95 = 7eff0300 21450000 28705340 0040064b 6219e0aa 5a451175 cfc58f00 50e92f80
ffff810133847600 299429117 C Bo:4:055:6 0 95 >
ffff8101338473c0 299480181 C Bi:4:055:5 -2 0
ffff8101338473c0 299480342 S Bi:4:055:5 -115 16384 <
ffff8101338473c0 299532179 C Bi:4:055:5 -2 0
ffff8101338473c0 299532294 S Bi:4:055:5 -115 16384 <
ffff8101338473c0 299588191 C Bi:4:055:5 -2 0
ffff8101338473c0 299588333 S Bi:4:055:5 -115 16384 <
ffff8101338473c0 299640190 C Bi:4:055:5 -2 0
ffff8101338473c0 299640331 S Bi:4:055:5 -115 16384 <
ffff8101338473c0 299689194 C Bi:4:055:5 0 1529 = 7eff0300 21450005 dcd31000 00c6069c f0451175 cf19e0aa 5a0050c5 8f9ab080
ffff8101338473c0 299691768 S Bi:4:055:5 -115 16384 <
ffff8101338473c0 299744188 C Bi:4:055:5 -2 0
ffff8101338473c0 299744499 S Bi:4:055:5 -115 16384 <
ffff810133847600 299744757 S Bo:4:055:6 -115 48 = 7eff0300 21450000 28705540 0040064b 6019e0aa 5a451175 cfc58f00 50e92f80
ffff810133847600 299745130 C Bo:4:055:6 0 48 >
ffff8101338473c0 299749194 C Bi:4:055:5 0 1521 = 7eff0300 21450005 dcd31400 00c6069c ec451175 cf19e0aa 5a0050c5 8f9ab086
ffff8101338473c0 299751735 S Bi:4:055:5 -115 16384 <
ffff8101338473c0 299795200 C Bi:4:055:5 0 1519 = 7eff0300 21450005 dcd31800 00c6069c e8451175 cf19e0aa 5a0050c5 8f9ab08c
ffff8101ef1209c0 299798736 S Bi:4:055:5 -115 16384 <
ffff8101ef1209c0 299851204 C Bi:4:055:5 0 1530 = 7eff0300 21450005 dcd31c00 00c6069c e4451175 cf19e0aa 5a0050c5 8f9ab091
ffff8101ef1209c0 299854664 S Bi:4:055:5 -115 16384 <
ffff8101ef1209c0 299909204 C Bi:4:055:5 -2 0
ffff8101ef1209c0 299909907 S Bi:4:055:5 -115 16384 <
ffff810133847180 299910249 S Bo:4:055:6 -115 48 = 7eff0300 21450000 28705640 0040064b 5f19e0aa 5a451175 cfc58f00 50e92f80
ffff810133847180 299911142 C Bo:4:055:6 0 48 >
ffff810133847240 299912487 S Bo:4:055:6 -115 95 = 7eff0300 21450000 28705740 0040064b 5e19e0aa 5a451175 cfc58f00 50e92f80
ffff810133847240 299913138 C Bo:4:055:6 0 95 >
ffff8101ef1209c0 299961206 C Bi:4:055:5 -2 0
ffff8101ef1209c0 299961307 S Bi:4:055:5 -115 16384 <
ffff8101ef1209c0 300013211 C Bi:4:055:5 -2 0
ffff8101ef1209c0 300013272 S Bi:4:055:5 -115 16384 <
ffff8101ef1209c0 300035214 C Bi:4:055:5 0 1531 = 7eff0300 21450005 dce91000 00c60686 f0451175 cf19e0aa 5a0050c5 8f9ab097
ffff8101ef1209c0 300038779 S Bi:4:055:5 -115 16384 <
ffff8101ef1209c0 300090218 C Bi:4:055:5 0 1522 = 7eff0300 21450005 dce91400 00c60686 ec451175 cf19e0aa 5a0050c5 8f9ab09d
ffff8101ef1209c0 300094764 S Bi:4:055:5 -115 16384 <
ffff8101ef1209c0 300149217 C Bi:4:055:5 -2 0
ffff810133847240 300150008 S Bo:4:055:6 -115 48 = 7eff0300 21450000 28705940 0040064b 5c19e0aa 5a451175 cfc58f00 50e92f80
ffff8101ef1209c0 300150032 S Bi:4:055:5 -115 16384 <
ffff810133847240 300150150 C Bo:4:055:6 0 48 >
ffff810133847540 300152417 S Bo:4:055:6 -115 48 = 7eff0300 21450000 28705a40 0040064b 5b19e0aa 5a451175 cfc58f00 50e92f80
ffff810133847540 300153152 C Bo:4:055:6 0 48 >
ffff8101ef1209c0 300169219 C Bi:4:055:5 0 1527 = 7eff0300 21450005 dcf51c00 00c6067a e4451175 cf19e0aa 5a0050c5 8f9ab0a3
ffff8101ef1209c0 300174727 S Bi:4:055:5 -115 16384 <
ffff8101ef1209c0 300229224 C Bi:4:055:5 -2 896 = 7eff0300 21450005 dcf52000 00c6067a e0451175 cf19e0aa 5a0050c5 8f9ab0a8
ffff8101ef1209c0 300229623 S Bi:4:055:5 -115 16384 <
ffff810133847540 300229924 S Bo:4:055:6 -115 49 = 7eff0300 21450000 28705b40 0040064b 5a19e0aa 5a451175 cfc58f00 50e92f80
ffff810133847540 300230160 C Bo:4:055:6 0 49 >
ffff8101ef1209c0 300231222 C Bi:4:055:5 0 625 = 3d75a978 ab40f8b7 a145e23f 0469f77f f087ecf0 07c5ef14 786bc37a ef88fe0e
ffff8101ef1209c0 300232347 S Bi:4:055:5 -115 16384 <
ffff8101ef1209c0 300285226 C Bi:4:055:5 -2 0
ffff8101ef1209c0 300285452 S Bi:4:055:5 -115 16384 <
ffff8101ef1209c0 300289226 C Bi:4:055:5 0 1526 = 7eff0300 21450005 dcf52800 00c6067a d8451175 cf19e0aa 5a0050c5 8f9ab0ae
ffff8101ef1209c0 300294727 S Bi:4:055:5 -115 16384 <
ffff8101ef1209c0 300345232 C Bi:4:055:5 0 1522 = 7eff0300 21450005 dcf52c00 00c6067a d4451175 cf19e0aa 5a0050c5 8f9ab0b4
ffff8101ef1209c0 300350630 S Bi:4:055:5 -115 16384 <
ffff8101ef1209c0 300405233 C Bi:4:055:5 -2 0
ffff810133847480 300406049 S Bo:4:055:6 -115 61 = 7eff0300 21450000 34705c40 0040064b 4d19e0aa 5a451175 cfc58f00 50e92f80
ffff8101ef1209c0 300406074 S Bi:4:055:5 -115 16384 <
ffff810133847480 300406165 C Bo:4:055:6 0 61 >
ffff810133847a80 300408377 S Bo:4:055:6 -115 61 = 7eff0300 21450000 34705d40 0040064b 4c19e0aa 5a451175 cfc58f00 50e92f80
ffff810133847a80 300409167 C Bo:4:055:6 0 61 >
ffff8101ef1209c0 300432233 C Bi:4:055:5 0 1521 = 7eff0300 21450005 dcf7b800 00c60678 48451175 cf19e0aa 5a0050c5 8f9ab0b9
ffff8101ef1209c0 300438610 S Bi:4:055:5 -115 16384 <
ffff8101ef1209c0 300493237 C Bi:4:055:5 -2 0
ffff8101ef1209c0 300493631 S Bi:4:055:5 -115 16384 <
ffff810133847a80 300493879 S Bo:4:055:6 -115 61 = 7eff0300 21450000 34705e40 0040064b 4b19e0aa 5a451175 cfc58f00 50e92f80
ffff810133847a80 300494169 C Bo:4:055:6 0 61 >
ffff8101ef1209c0 300511237 C Bi:4:055:5 0 1520 = 7eff0300 21450005 dcf7bc00 00c60678 44451175 cf19e0aa 5a0050c5 8f9ab0bf
ffff8101ef1209c0 300514880 S Bi:4:055:5 -115 16384 <
ffff8101ef1209c0 300569240 C Bi:4:055:5 -2 0
ffff8101ef1209c0 300569641 S Bi:4:055:5 -115 16384 <
ffff8101338479c0 300569893 S Bo:4:055:6 -115 61 = 7eff0300 21450000 34705f40 0040064b 4a19e0aa 5a451175 cfc58f00 50e92f80
ffff8101338479c0 300570174 C Bo:4:055:6 0 61 >
ffff8101ef1209c0 300589244 C Bi:4:055:5 0 1526 = 7eff0300 21450005 dc036000 00c6066c a1451175 cf19e0aa 5a0050c5 8f9ab0c5
ffff8101ef1209c0 300594840 S Bi:4:055:5 -115 16384 <
ffff8101ef1209c0 300649250 C Bi:4:055:5 -2 0
ffff8101ef1209c0 300649629 S Bi:4:055:5 -115 16384 <
ffff810133847600 300649882 S Bo:4:055:6 -115 61 = 7eff0300 21450000 34706040 0040064b 4919e0aa 5a451175 cfc58f00 50e92f80
ffff810133847600 300650178 C Bo:4:055:6 0 61 >
ffff8101ef1209c0 300672250 C Bi:4:055:5 0 1521 = 7eff0300 21450005 dc036400 00c6066c 9d451175 cf19e0aa 5a0050c5 8f9ab0cb
ffff8101ef1209c0 300678744 S Bi:4:055:5 -115 16384 <
ffff8101ef1209c0 300733249 C Bi:4:055:5 -2 0
ffff8101ef1209c0 300733596 S Bi:4:055:5 -115 16384 <
ffff810133847d80 300733843 S Bo:4:055:6 -115 61 = 7eff0300 21450000 34706140 0040064b 4819e0aa 5a451175 cfc58f00 50e92f80
ffff810133847d80 300734183 C Bo:4:055:6 0 61 >
ffff8101ef1209c0 300755254 C Bi:4:055:5 0 1528 = 7eff0300 21450005 dc036800 00c6066c 99451175 cf19e0aa 5a0050c5 8f9ab0d0
ffff8101ef1209c0 300758561 S Bi:4:055:5 -115 16384 <
ffff8101ef1209c0 300813255 C Bi:4:055:5 -2 0
ffff8101ef1209c0 300813650 S Bi:4:055:5 -115 16384 <
ffff810133847480 300813898 S Bo:4:055:6 -115 61 = 7eff0300 21450000 34706240 0040064b 4719e0aa 5a451175 cfc58f00 50e92f80
ffff810133847480 300814187 C Bo:4:055:6 0 61 >
ffff8101ef1209c0 300828257 C Bi:4:055:5 0 1523 = 7eff0300 21450005 dc036c00 00c6066c 95451175 cf19e0aa 5a0050c5 8f9ab0d6
ffff8101ef1209c0 300834672 S Bi:4:055:5 -115 16384 <
ffff8101ef1209c0 300885260 C Bi:4:055:5 0 1528 = 7eff0300 21450005 dc066000 00c60669 a1451175 cf19e0aa 5a0050c5 8f9ab0dc
ffff810133847a80 300894251 S Bi:4:055:5 -115 16384 <
ffff810133847a80 300947263 C Bi:4:055:5 -2 0
ffff810133847a80 300948124 S Bo:4:055:6 -115 61 = 7eff0300 21450000 34706340 0040064b 4619e0aa 5a451175 cfc58f00 50e92f80
ffff8101338479c0 300948324 S Bi:4:055:5 -115 16384 <
ffff810133847a80 300949195 C Bo:4:055:6 0 61 >
ffff810133847a80 300949419 S Bo:4:055:6 -115 61 = 7eff0300 21450000 34706440 0040064b 4519e0aa 5a451175 cfc58f00 50e92f80
ffff810133847a80 300950195 C Bo:4:055:6 0 61 >
ffff8101338479c0 300978266 C Bi:4:055:5 0 1523 = 7eff0300 21450005 dc066400 00c60669 9d451175 cf19e0aa 5a0050c5 8f9ab0e1
ffff8101338479c0 300981034 S Bi:4:055:5 -115 16384 <
ffff8101338479c0 301033270 C Bi:4:055:5 0 1522 = 7eff0300 21450005 dc0fc800 00c60660 39451175 cf19e0aa 5a0050c5 8f9ab0e7
ffff8101338479c0 301035987 S Bi:4:055:5 -115 16384 <
ffff8101338479c0 301087268 C Bi:4:055:5 -2 0
ffff8101338479c0 301088058 S Bo:4:055:6 -115 61 = 7eff0300 21450000 34706540 0040064b 4419e0aa 5a451175 cfc58f00 50e92f80
ffff8101338479c0 301088206 C Bo:4:055:6 0 61 >
ffff8101338479c0 301088449 S Bo:4:055:6 -115 61 = 7eff0300 21450000 34706640 0040064b 4319e0aa 5a451175 cfc58f00 50e92f80
ffff810133847a80 301088548 S Bi:4:055:5 -115 16384 <
ffff8101338479c0 301089203 C Bo:4:055:6 0 61 >
ffff810133847a80 301098273 C Bi:4:055:5 0 1521 = 7eff0300 21450005 dc10c000 00c6065f 41451175 cf19e0aa 5a0050c5 8f9ab0a8
ffff810133847a80 301103831 S Bi:4:055:5 -115 16384 <
ffff810133847a80 301160273 C Bi:4:055:5 -2 0
ffff810133847a80 301160972 S Bo:4:055:6 -115 48 = 7eff0300 21450000 28706740 0040064b 4e19e0aa 5a451175 cfc58f00 50e92f80
ffff810133847a80 301161208 C Bo:4:055:6 0 48 >
ffff810133847a80 301162224 S Bi:4:055:5 -115 16384 <
ffff810133847a80 301214277 C Bi:4:055:5 -2 0
ffff810133847a80 301214433 S Bi:4:055:5 -115 16384 <
ffff810133847a80 301217269 C Bi:4:055:5 0 1525 = 7eff0300 21450005 dc2f9400 00c60640 6d451175 cf19e0aa 5a0050c5 8f9ab0ed
ffff810133847a80 301219807 S Bi:4:055:5 -115 16384 <
ffff810133847a80 301272280 C Bi:4:055:5 -2 704 = 7eff0300 21450005 dc2f9800 00c60640 69451175 cf19e0aa 5a0050c5 8f9ab0f2
ffff810133847a80 301272864 S Bo:4:055:6 -115 48 = 7eff0300 21450000 28706840 0040064b 4d19e0aa 5a451175 cfc58f00 50e92f80
ffff810133847a80 301273215 C Bo:4:055:6 0 48 >
ffff810133847a80 301273858 S Bi:4:055:5 -115 16384 <
ffff810133847a80 301275276 C Bi:4:055:5 0 821 = 12be177c 10f821e3 6f885e18 f17f87fe 15cde0ab 1f13f86e 4f85ff00 0e9ad7e1
ffff810133847a80 301276727 S Bi:4:055:5 -115 16384 <
ffff810133847a80 301329290 C Bi:4:055:5 -2 0
ffff8101ef120900 301329575 S Bi:4:055:5 -115 16384 <
ffff8101ef1153c0 301363683 S Bo:4:055:10 -115 31 = 55534243 36060000 00000000 00000600 00000000 00000000 00000000 000000
ffff8101ef1153c0 301364218 C Bo:4:055:10 0 31 >
ffff8101ef1153c0 301364226 S Bi:4:055:9 -115 13 <
ffff8101ef1153c0 301365217 C Bi:4:055:9 0 13 = 55534253 36060000 00000000 01
ffff8101ef1153c0 301365224 S Bo:4:055:10 -115 31 = 55534243 37060000 12000000 80000603 00000012 00000000 00000000 000000
ffff8101ef1153c0 301366217 C Bo:4:055:10 0 31 >
ffff810133847540 301366230 S Bi:4:055:9 -115 18 <
ffff810133847540 301367223 C Bi:4:055:9 0 18 = 70000200 0000000a 00000000 3a000000 0000
ffff8101ef1153c0 301367238 S Bi:4:055:9 -115 13 <
ffff8101ef1153c0 301368220 C Bi:4:055:9 0 13 = 55534253 37060000 00000000 00
ffff8101ef1153c0 301368270 S Bo:4:055:10 -115 31 = 55534243 38060000 00000000 00000600 00000000 00000000 00000000 000000
ffff8101ef1153c0 301369217 C Bo:4:055:10 0 31 >
ffff8101ef1153c0 301369223 S Bi:4:055:9 -115 13 <
ffff8101ef1153c0 301370217 C Bi:4:055:9 0 13 = 55534253 38060000 00000000 01
ffff8101ef1153c0 301370224 S Bo:4:055:10 -115 31 = 55534243 39060000 12000000 80000603 00000012 00000000 00000000 000000
ffff8101ef1153c0 301371217 C Bo:4:055:10 0 31 >
ffff810133847540 301371225 S Bi:4:055:9 -115 18 <
ffff810133847540 301372217 C Bi:4:055:9 0 18 = 70000200 0000000a 00000000 3a000000 0000
ffff8101ef1153c0 301372225 S Bi:4:055:9 -115 13 <
ffff8101ef1153c0 301373217 C Bi:4:055:9 0 13 = 55534253 39060000 00000000 00
ffff8101ef120900 301384290 C Bi:4:055:5 -2 0
ffff810133847240 301384447 S Bi:4:055:5 -115 16384 <
ffff810133847240 301436291 C Bi:4:055:5 -2 0
ffff810133847240 301436435 S Bi:4:055:5 -115 16384 <
ffff810133847240 301458293 C Bi:4:055:5 0 1522 = 7eff0300 21450005 dc3b2400 00c60634 dd451175 cf19e0aa 5a0050c5 8f9ab0f8
ffff810133847240 301460984 S Bi:4:055:5 -115 16384 <
ffff810133847240 301512299 C Bi:4:055:5 0 1525 = 7eff0300 21450005 dc3b2c00 00c60634 d5451175 cf19e0aa 5a0050c5 8f9ab0fe
ffff810133847240 301515118 S Bi:4:055:5 -115 16384 <
ffff810133847240 301568302 C Bi:4:055:5 -2 0
ffff810133847540 301569141 S Bo:4:055:6 -115 60 = 7eff0300 21450000 34706940 0040064b 4019e0aa 5a451175 cfc58f00 50e92f80
ffff810135a45f00 301569166 S Bi:4:055:5 -115 16384 <
ffff810133847540 301569230 C Bo:4:055:6 0 60 >
ffff810133847780 301575857 S Bo:4:055:6 -115 60 = 7eff0300 21450000 34706a40 0040064b 3f19e0aa 5a451175 cfc58f00 50e92f80
ffff810133847780 301576232 C Bo:4:055:6 0 60 >
ffff810135a45f00 301578294 C Bi:4:055:5 0 1518 = 7eff0300 21450005 dc3c2c00 00c60633 d5451175 cf19e0aa 5a0050c5 8f9ab104
ffff810135a45f00 301582694 S Bi:4:055:5 -115 16384 <
ffff810135a45f00 301609303 C Bi:4:055:5 0 1523 = 7eff0300 21450005 dc3c3000 00c60633 d1451175 cf19e0aa 5a0050c5 8f9ab109
ffff810135a45f00 301614751 S Bi:4:055:5 -115 16384 <
ffff810135a45f00 301665302 C Bi:4:055:5 -2 0
ffff810133847780 301666156 S Bo:4:055:6 -115 60 = 7eff0300 21450000 34706b40 0040064b 3e19e0aa 5a451175 cfc58f00 50e92f80
ffff810135a45f00 301666183 S Bi:4:055:5 -115 16384 <
ffff810133847780 301666235 C Bo:4:055:6 0 60 >
ffff810133847d80 301668438 S Bo:4:055:6 -115 60 = 7eff0300 21450000 34706c40 0040064b 3d19e0aa 5a451175 cfc58f00 50e92f80
ffff810133847d80 301669234 C Bo:4:055:6 0 60 >
ffff810135a45f00 301718310 C Bi:4:055:5 -2 0
ffff810133847d80 301718531 S Bi:4:055:5 -115 16384 <
ffff810133847d80 301772304 C Bi:4:055:5 -2 0
ffff810133847d80 301772415 S Bi:4:055:5 -115 16384 <
ffff810133847d80 301824311 C Bi:4:055:5 -2 0
ffff810133847d80 301824438 S Bi:4:055:5 -115 16384 <
ffff810133847d80 301874320 C Bi:4:055:5 0 1519 = 7eff0300 21450005 dc439c00 00c6062c 65451175 cf19e0aa 5a0050c5 8f9ab10f
ffff810133847d80 301878957 S Bi:4:055:5 -115 16384 <
ffff810133847d80 301881319 C Bi:4:055:5 0 1516 = 7eff0300 21450005 dc51ac00 00c6061e 55451175 cf19e0aa 5a0050c5 8f9ab115
ffff810133847d80 301886192 S Bi:4:055:5 -115 16384 <
ffff810133847d80 301937316 C Bi:4:055:5 -2 0
ffff810133847d80 301937862 S Bi:4:055:5 -115 16384 <
ffff8101338473c0 301938262 S Bo:4:055:6 -115 119 = 7eff0300 21450000 34706d40 0040064b 3c19e0aa 5a451175 cfc58f00 50e92f80
ffff8101338473c0 301939250 C Bo:4:055:6 0 119 >
ffff810133847d80 301956324 C Bi:4:055:5 0 1525 = 7eff0300 21450005 dc522000 00c6061d e1451175 cf19e0aa 5a0050c5 8f9ab0f2
ffff810133847d80 301959028 S Bi:4:055:5 -115 16384 <
ffff810133847d80 302012319 C Bi:4:055:5 -2 0
ffff810133847d80 302012855 S Bi:4:055:5 -115 16384 <
ffff8101338473c0 302013209 S Bo:4:055:6 -115 48 = 7eff0300 21450000 28706f40 0040064b 4619e0aa 5a451175 cfc58f00 50e92f80
ffff8101338473c0 302014254 C Bo:4:055:6 0 48 >
ffff810133847d80 302064325 C Bi:4:055:5 -2 0
ffff810133847d80 302064478 S Bi:4:055:5 -115 16384 <
ffff810133847d80 302116327 C Bi:4:055:5 -2 0
ffff810133847d80 302116600 S Bi:4:055:5 -115 16384 <
ffff810133847d80 302168328 C Bi:4:055:5 -2 0
ffff810133847d80 302168469 S Bi:4:055:5 -115 16384 <
ffff810133847d80 302220333 C Bi:4:055:5 -2 0
ffff810133847d80 302220474 S Bi:4:055:5 -115 16384 <
ffff810133847d80 302237338 C Bi:4:055:5 0 1523 = 7eff0300 21450005 dc61bc00 00c6060e 45451175 cf19e0aa 5a0050c5 8f9ab11a
ffff810133847d80 302242395 S Bi:4:055:5 -115 16384 <
ffff810133847d80 302269333 C Bi:4:055:5 0 1519 = 7eff0300 21450005 dc61c000 00c6060e 41451175 cf19e0aa 5a0050c5 8f9ab120
ffff810133847d80 302275083 S Bi:4:055:5 -115 16384 <
ffff810133847d80 302328342 C Bi:4:055:5 -2 256 = 7eff0300 21450005 dc64d400 00c6060b 2d451175 cf19e0aa 5a0050c5 8f9ab126
ffff810133847d80 302328888 S Bi:4:055:5 -115 16384 <
ffff810133847240 302329250 S Bo:4:055:6 -115 95 = 7eff0300 21450000 28707040 0040064b 4519e0aa 5a451175 cfc58f00 50e92f80
ffff810133847d80 302330339 C Bi:4:055:5 0 1268 = 90d3e0ac c31d87cd 334c5e13 38c654e2 4e30c873 1c6f1251 caa186e2 ac0e0f2d
ffff810133847240 302330347 C Bo:4:055:6 0 95 >
ffff810133847240 302333759 S Bi:4:055:5 -115 16384 <
ffff810133847240 302385345 C Bi:4:055:5 0 1527 = 7eff0300 21450005 dc64d800 00c6060b 29451175 cf19e0aa 5a0050c5 8f9ab12b
ffff810133847240 302390559 S Bi:4:055:5 -115 16384 <
ffff810133847240 302444343 C Bi:4:055:5 -2 0
ffff810133847240 302444875 S Bi:4:055:5 -115 16384 <
ffff810133847180 302445169 S Bo:4:055:6 -115 60 = 7eff0300 21450000 34707240 0040064b 3719e0aa 5a451175 cfc58f00 50e92f80
ffff810133847180 302445278 C Bo:4:055:6 0 60 >
ffff810133847240 302496345 C Bi:4:055:5 -2 0
ffff810133847240 302496507 S Bi:4:055:5 -115 16384 <
ffff810133847240 302548349 C Bi:4:055:5 -2 0
ffff810133847240 302548486 S Bi:4:055:5 -115 16384 <
ffff810133847240 302600352 C Bi:4:055:5 -2 0
ffff810133847240 302600491 S Bi:4:055:5 -115 16384 <
ffff810133847240 302625357 C Bi:4:055:5 0 1525 = 7eff0300 21450005 dc770c00 00c606f8 f4451175 cf19e0aa 5a0050c5 8f9ab131
ffff810133847240 302630408 S Bi:4:055:5 -115 16384 <
ffff810133847240 302684357 C Bi:4:055:5 -2 0
ffff810133847240 302684723 S Bi:4:055:5 -115 16384 <
ffff810133847180 302685015 S Bo:4:055:6 -115 60 = 7eff0300 21450000 34707340 0040064b 3619e0aa 5a451175 cfc58f00 50e92f80
ffff810133847180 302685293 C Bo:4:055:6 0 60 >
ffff810133847240 302712362 C Bi:4:055:5 0 1522 = 7eff0300 21450005 dc771c00 00c606f8 e4451175 cf19e0aa 5a0050c5 8f9ab137
ffff810133847240 302718561 S Bi:4:055:5 -115 16384 <
ffff810133847240 302772361 C Bi:4:055:5 -2 0
ffff810133847240 302772741 S Bi:4:055:5 -115 16384 <
ffff810133847180 302773031 S Bo:4:055:6 -115 60 = 7eff0300 21450000 34707440 0040064b 3519e0aa 5a451175 cfc58f00 50e92f80
ffff810133847180 302773297 C Bo:4:055:6 0 60 >
ffff810133847240 302778362 C Bi:4:055:5 0 1517 = 7eff0300 21450005 dc7b0800 00c606f4 f8451175 cf19e0aa 5a0050c5 8f9ab13d
ffff810133847240 302782275 S Bi:4:055:5 -115 16384 <
ffff810133847240 302836372 C Bi:4:055:5 -2 0
ffff81019bc0d9c0 302836737 S Bi:4:055:5 -115 16384 <
ffff810133847780 302837091 S Bo:4:055:6 -115 60 = 7eff0300 21450000 34707540 0040064b 3419e0aa 5a451175 cfc58f00 50e92f80
ffff810133847780 302837301 C Bo:4:055:6 0 60 >
ffff81019bc0d9c0 302888371 C Bi:4:055:5 -2 0
ffff81019bc0d9c0 302888488 S Bi:4:055:5 -115 16384 <
ffff81019bc0d9c0 302940374 C Bi:4:055:5 -2 0
ffff81019bc0d9c0 302940446 S Bi:4:055:5 -115 16384 <
ffff81019bc0d9c0 302958374 C Bi:4:055:5 0 1524 = 7eff0300 21450005 dc86a400 00c606e9 5c451175 cf19e0aa 5a0050c5 8f9ab126
ffff81019bc0d9c0 302962545 S Bi:4:055:5 -115 16384 <
ffff81019bc0d9c0 303016378 C Bi:4:055:5 -2 0
ffff81019bc0d9c0 303016658 S Bi:4:055:5 -115 16384 <
ffff8101338473c0 303017052 S Bo:4:055:6 -115 48 = 7eff0300 21450000 28707640 0040064b 3f19e0aa 5a451175 cfc58f00 50e92f80
ffff8101338473c0 303017312 C Bo:4:055:6 0 48 >
ffff81019bc0d9c0 303068383 C Bi:4:055:5 -2 0
ffff81019bc0d9c0 303068457 S Bi:4:055:5 -115 16384 <
ffff81019bc0d9c0 303109385 C Bi:4:055:5 0 1518 = 7eff0300 21450005 dc8e4000 00c606e1 c0451175 cf19e0aa 5a0050c5 8f9ab142
ffff81019bc0d9c0 303114572 S Bi:4:055:5 -115 16384 <
ffff81019bc0d9c0 303168392 C Bi:4:055:5 -2 0
ffff81019bc0d9c0 303168758 S Bi:4:055:5 -115 16384 <
ffff810133847540 303169139 S Bo:4:055:6 -115 48 = 7eff0300 21450000 28707740 0040064b 3e19e0aa 5a451175 cfc58f00 50e92f80
ffff810133847540 303169319 C Bo:4:055:6 0 48 >
ffff81019bc0d9c0 303220388 C Bi:4:055:5 -2 0
ffff810133847540 303220541 S Bi:4:055:5 -115 16384 <
ffff810133847540 303276390 C Bi:4:055:5 -2 0
ffff810133847540 303276515 S Bi:4:055:5 -115 16384 <
ffff810133847540 303289388 C Bi:4:055:5 0 1522 = 7eff0300 21450005 dc98d400 00c606d7 2c451175 cf19e0aa 5a0050c5 8f9ab148
ffff810133847540 303292193 S Bi:4:055:5 -115 16384 <
ffff810133847540 303344396 C Bi:4:055:5 -2 384 = 7eff0300 21450005 dc98d800 00c606d7 28451175 cf19e0aa 5a0050c5 8f9ab14e
ffff810213b6e000 303344758 S Bi:4:055:5 -115 16384 <
ffff810213b6ef00 303345026 S Bo:4:055:6 -115 48 = 7eff0300 21450000 28707840 0040064b 3d19e0aa 5a451175 cfc58f00 50e92f80
ffff810213b6ef00 303345332 C Bo:4:055:6 0 48 >
ffff810213b6e000 303346395 C Bi:4:055:5 0 1140 = acbc6ff1 3743f116 97f002cb e2b78b7d 5d7fc3de 30d53c63 f0c7e22f 817d5e2a
ffff810213b6e000 303348434 S Bi:4:055:5 -115 16384 <
ffff8101ef1153c0 303362988 S Bo:4:055:10 -115 31 = 55534243 3a060000 00000000 00000600 00000000 00000000 00000000 000000
ffff8101ef1153c0 303363331 C Bo:4:055:10 0 31 >
ffff8101ef1153c0 303363338 S Bi:4:055:9 -115 13 <
ffff8101ef1153c0 303364329 C Bi:4:055:9 0 13 = 55534253 3a060000 00000000 01
ffff8101ef1153c0 303364336 S Bo:4:055:10 -115 31 = 55534243 3b060000 12000000 80000603 00000012 00000000 00000000 000000
ffff8101ef1153c0 303365329 C Bo:4:055:10 0 31 >
ffff81019bd9b540 303365340 S Bi:4:055:9 -115 18 <
ffff81019bd9b540 303366328 C Bi:4:055:9 0 18 = 70000200 0000000a 00000000 3a000000 0000
ffff8101ef1153c0 303366336 S Bi:4:055:9 -115 13 <
ffff8101ef1153c0 303367328 C Bi:4:055:9 0 13 = 55534253 3b060000 00000000 00
ffff8101ef1153c0 303367361 S Bo:4:055:10 -115 31 = 55534243 3c060000 00000000 00000600 00000000 00000000 00000000 000000
ffff8101ef1153c0 303368328 C Bo:4:055:10 0 31 >
ffff8101ef1153c0 303368334 S Bi:4:055:9 -115 13 <
ffff8101ef1153c0 303369328 C Bi:4:055:9 0 13 = 55534253 3c060000 00000000 01
ffff8101ef1153c0 303369335 S Bo:4:055:10 -115 31 = 55534243 3d060000 12000000 80000603 00000012 00000000 00000000 000000
ffff8101ef1153c0 303370329 C Bo:4:055:10 0 31 >
ffff81019bd9b540 303370335 S Bi:4:055:9 -115 18 <
ffff81019bd9b540 303371329 C Bi:4:055:9 0 18 = 70000200 0000000a 00000000 3a000000 0000
ffff8101ef1153c0 303371335 S Bi:4:055:9 -115 13 <
ffff8101ef1153c0 303372329 C Bi:4:055:9 0 13 = 55534253 3d060000 00000000 00
ffff810213b6e000 303404400 C Bi:4:055:5 -2 0
ffff81019bd9b540 303404735 S Bi:4:055:5 -115 16384 <
ffff81019bd9b540 303437399 C Bi:4:055:5 0 1521 = 7eff0300 21450005 dca0a400 00c606cf 5c451175 cf19e0aa 5a0050c5 8f9ab153
ffff81019bd9b540 303439946 S Bi:4:055:5 -115 16384 <
ffff81019bd9b540 303492402 C Bi:4:055:5 -2 0
ffff81019bd9b540 303492780 S Bi:4:055:5 -115 16384 <
ffff81019bd9b840 303493075 S Bo:4:055:6 -115 60 = 7eff0300 21450000 34707940 0040064b 3019e0aa 5a451175 cfc58f00 50e92f80
ffff81019bd9b840 303493338 C Bo:4:055:6 0 60 >
ffff81019bd9b540 303544409 C Bi:4:055:5 -2 0
ffff81019bd9b540 303544569 S Bi:4:055:5 -115 16384 <
ffff81019bd9b540 303601413 C Bi:4:055:5 -2 0
ffff81019bc0d6c0 303601532 S Bi:4:055:5 -115 16384 <
ffff81019bc0d6c0 303617419 C Bi:4:055:5 0 1519 = 7eff0300 21450005 dca9b400 00c606c6 4c451175 cf19e0aa 5a0050c5 8f9ab159
ffff81019bc0d6c0 303622912 S Bi:4:055:5 -115 16384 <
ffff81019bc0d6c0 303676417 C Bi:4:055:5 -2 0
ffff81019bd9b840 303676798 S Bi:4:055:5 -115 16384 <
ffff81019bd9b600 303677093 S Bo:4:055:6 -115 60 = 7eff0300 21450000 34707a40 0040064b 2f19e0aa 5a451175 cfc58f00 50e92f80
ffff81019bd9b600 303677348 C Bo:4:055:6 0 60 >
ffff81019bd9b840 303728418 C Bi:4:055:5 -2 0
ffff81019bd9b840 303728574 S Bi:4:055:5 -115 16384 <
ffff81019bd9b840 303769421 C Bi:4:055:5 0 1522 = 7eff0300 21450005 dcb1bc00 00c606be 44451175 cf19e0aa 5a0050c5 8f9ab15f
ffff81019bd9b840 303772037 S Bi:4:055:5 -115 16384 <
ffff81019bd9b840 303824420 C Bi:4:055:5 -2 0
ffff810185205840 303824771 S Bi:4:055:5 -115 16384 <
ffff810185205b40 303825057 S Bo:4:055:6 -115 60 = 7eff0300 21450000 34707b40 0040064b 2e19e0aa 5a451175 cfc58f00 50e92f80
ffff810185205b40 303825356 C Bo:4:055:6 0 60 >
ffff810185205840 303876425 C Bi:4:055:5 -2 0
ffff810185205840 303876579 S Bi:4:055:5 -115 16384 <
ffff810185205840 303928426 C Bi:4:055:5 -2 0
ffff810185205840 303928543 S Bi:4:055:5 -115 16384 <
ffff810185205840 303949423 C Bi:4:055:5 0 1524 = 7eff0300 21450005 dcbebc00 00c606b1 44451175 cf19e0aa 5a0050c5 8f9ab14e
ffff810185205840 303952012 S Bi:4:055:5 -115 16384 <
ffff810185205840 304004426 C Bi:4:055:5 -2 0
ffff810185205840 304004741 S Bi:4:055:5 -115 16384 <
ffff810185205b40 304005085 S Bo:4:055:6 -115 48 = 7eff0300 21450000 28707c40 0040064b 3919e0aa 5a451175 cfc58f00 50e92f80
ffff810185205b40 304005368 C Bo:4:055:6 0 48 >
ffff810185205840 304056436 C Bi:4:055:5 -2 0
ffff810185205840 304056589 S Bi:4:055:5 -115 16384 <
ffff810185205840 304098439 C Bi:4:055:5 0 1521 = 7eff0300 21450005 dcc74400 00c606a8 bc451175 cf19e0aa 5a0050c5 8f9ab164
ffff810185205840 304103045 S Bi:4:055:5 -115 16384 <
ffff810185205840 304156437 C Bi:4:055:5 -2 0
ffff810185205840 304156870 S Bi:4:055:5 -115 16384 <
ffff810185205b40 304157143 S Bo:4:055:6 -115 49 = 7eff0300 21450000 28707d5d 40004006 4b3819e0 aa5a4511 75cfc58f 0050e92f
ffff810185205b40 304157375 C Bo:4:055:6 0 49 >
ffff810185205840 304212445 C Bi:4:055:5 -2 0
ffff810185205840 304212602 S Bi:4:055:5 -115 16384 <
ffff810185205840 304264445 C Bi:4:055:5 -2 0
ffff810185205840 304264583 S Bi:4:055:5 -115 16384 <
ffff810185205840 304291447 C Bi:4:055:5 0 1521 = 7eff0300 21450005 dccec400 00c606a1 3c451175 cf19e0aa 5a0050c5 8f9ab16a
ffff810185205840 304293979 S Bi:4:055:5 -115 16384 <
ffff810185205840 304347451 C Bi:4:055:5 -2 0
ffff8101faf1cb40 304347818 S Bi:4:055:5 -115 16384 <
ffff8101faf1c840 304348091 S Bo:4:055:6 -115 49 = 7eff0300 21450000 28707d5e 40004006 4b3719e0 aa5a4511 75cfc58f 0050e92f
ffff8101faf1c840 304348386 C Bo:4:055:6 0 49 >
ffff8101faf1cb40 304351444 C Bi:4:055:5 0 1522 = 7eff0300 21450005 dccec800 00c606a1 38451175 cf19e0aa 5a0050c5 8f9ab170
ffff8101faf1cb40 304355089 S Bi:4:055:5 -115 16384 <
ffff8101faf1cb40 304408455 C Bi:4:055:5 -2 0
ffff8101faf1cb40 304408979 S Bi:4:055:5 -115 16384 <
ffff8101faf1cf00 304409248 S Bo:4:055:6 -115 48 = 7eff0300 21450000 28707f40 0040064b 3619e0aa 5a451175 cfc58f00 50e92f80
ffff8101faf1cf00 304409388 C Bo:4:055:6 0 48 >
ffff8101faf1cb40 304463459 C Bi:4:055:5 -2 0
ffff8101faf1cb40 304463614 S Bi:4:055:5 -115 16384 <
ffff8101faf1cb40 304471452 C Bi:4:055:5 0 1520 = 7eff0300 21450005 dcd4fc00 00c6069b 04451175 cf19e0aa 5a0050c5 8f9ab176
ffff8101faf1cb40 304474450 S Bi:4:055:5 -115 16384 <
ffff8101faf1cb40 304528461 C Bi:4:055:5 -2 0
ffff8101faf1cb40 304528824 S Bi:4:055:5 -115 16384 <
ffff8101faf1cf00 304529092 S Bo:4:055:6 -115 48 = 7eff0300 21450000 28708040 0040064b 3519e0aa 5a451175 cfc58f00 50e92f80
ffff8101faf1cf00 304529396 C Bo:4:055:6 0 48 >
ffff8101faf1cb40 304580465 C Bi:4:055:5 -2 0
ffff8101faf1cb40 304580621 S Bi:4:055:5 -115 16384 <
ffff8101faf1cb40 304636466 C Bi:4:055:5 -2 0
ffff8101faf1cb40 304636606 S Bi:4:055:5 -115 16384 <
ffff8101faf1cb40 304688468 C Bi:4:055:5 -2 0
ffff8101faf1cb40 304688587 S Bi:4:055:5 -115 16384 <
ffff8101faf1cb40 304740470 C Bi:4:055:5 -2 0
ffff8101faf1cb40 304740598 S Bi:4:055:5 -115 16384 <
ffff8101faf1cb40 304792474 C Bi:4:055:5 -2 0
ffff8101faf1cb40 304792600 S Bi:4:055:5 -115 16384 <
ffff8101faf1cb40 304843480 C Bi:4:055:5 0 1523 = 7eff0300 21450005 dcdf7800 00c60690 88451175 cf19e0aa 5a0050c5 8f9ab17b
ffff8101ef115b40 304846027 S Bi:4:055:5 -115 16384 <
ffff8101ef115b40 304875483 C Bi:4:055:5 0 1521 = 7eff0300 21450005 dce0f000 00c6068f 10451175 cf19e0aa 5a0050c5 8f9ab181
ffff8101ef115b40 304878033 S Bi:4:055:5 -115 16384 <
ffff8101ef115b40 304880475 C Bi:4:055:5 0 1533 = 7eff0300 21450005 dce6fc00 00c60689 04451175 cf19e0aa 5a0050c5 8f9ab187
ffff8101ef115b40 304883072 S Bi:4:055:5 -115 16384 <
ffff8101ef115b40 304884474 C Bi:4:055:5 0 1034 = 7eff0300 21450005 dce70000 00c60689 00451175 cf19e0aa 5a0050c5 8f9ab18c
ffff8101ef115b40 304886222 S Bi:4:055:5 -115 16384 <
ffff8101ef115b40 304887473 C Bi:4:055:5 0 486 = 1f8f3e06 ebfe32f0 5fc59f1b 5df847e1 dcfa25e7 89b524f8 77a17809 7c1de19d
ffff8101ef115b40 304888317 S Bi:4:055:5 -115 16384 <
ffff8101ef115b40 304940485 C Bi:4:055:5 -2 0
ffff8101ef115b40 304941365 S Bi:4:055:5 -115 16384 <
ffff8101ef115900 304941912 S Bo:4:055:6 -115 189 = 7eff0300 21450000 28708140 0040064b 3419e0aa 5a451175 cfc58f00 50e92f80
ffff8101ef115900 304942422 C Bo:4:055:6 0 189 >
ffff8101ef115b40 304997488 C Bi:4:055:5 -2 0
ffff8101ef115b40 304997674 S Bi:4:055:5 -115 16384 <
ffff8101ef115b40 305052490 C Bi:4:055:5 -2 0
ffff8101ef115b40 305052611 S Bi:4:055:5 -115 16384 <
ffff8101ef115b40 305105491 C Bi:4:055:5 -2 0
ffff8101ef115b40 305105614 S Bi:4:055:5 -115 16384 <
ffff8101ef115b40 305156494 C Bi:4:055:5 -2 0
ffff8101ef115b40 305156621 S Bi:4:055:5 -115 16384 <
ffff8101ef115b40 305208499 C Bi:4:055:5 -2 0
ffff8101ef115b40 305208623 S Bi:4:055:5 -115 16384 <
ffff8101ef115b40 305237497 C Bi:4:055:5 0 1523 = 7eff0300 21450005 dcfb2400 00c60674 dc451175 cf19e0aa 5a0050c5 8f9ab192
ffff8101ef115b40 305240136 S Bi:4:055:5 -115 16384 <
ffff8101ef115b40 305269497 C Bi:4:055:5 0 1519 = 7eff0300 21450005 dcfda800 00c60672 58451175 cf19e0aa 5a0050c5 8f9ab198
ffff8101ef115b40 305272124 S Bi:4:055:5 -115 16384 <
ffff8101ef115b40 305324504 C Bi:4:055:5 -2 0
ffff8101df049240 305325028 S Bi:4:055:5 -115 16384 <
ffff8101df049900 305325382 S Bo:4:055:6 -115 95 = 7eff0300 21450000 28708540 0040064b 3019e0aa 5a451175 cfc58f00 50e92f80
ffff8101df049900 305326443 C Bo:4:055:6 0 95 >
ffff8101df049240 305329498 C Bi:4:055:5 0 1521 = 7eff0300 21450005 dcfdb000 00c60672 50451175 cf19e0aa 5a0050c5 8f9ab19e
ffff8101df049240 305338124 S Bi:4:055:5 -115 16384 <
ffff8101df049900 305363565 S Bo:4:055:6 -115 60 = 7eff0300 21450000 34465140 00400669 d10a0a01 c3d155ad 7f9ddb00 50cdbabb
ffff8101ef1153c0 305363777 S Bo:4:055:10 -115 31 = 55534243 3e060000 00000000 00000600 00000000 00000000 00000000 000000
ffff8101df049900 305364443 C Bo:4:055:6 0 60 >
ffff8101ef1153c0 305364448 C Bo:4:055:10 0 31 >
ffff8101ef1153c0 305364454 S Bi:4:055:9 -115 13 <
ffff8101ef1153c0 305365440 C Bi:4:055:9 0 13 = 55534253 3e060000 00000000 01
ffff8101ef1153c0 305365448 S Bo:4:055:10 -115 31 = 55534243 3f060000 12000000 80000603 00000012 00000000 00000000 000000
ffff8101ef1153c0 305366440 C Bo:4:055:10 0 31 >
ffff8101df049900 305366448 S Bi:4:055:9 -115 18 <
ffff8101df049900 305367439 C Bi:4:055:9 0 18 = 70000200 0000000a 00000000 3a000000 0000
ffff8101ef1153c0 305367447 S Bi:4:055:9 -115 13 <
ffff8101ef1153c0 305368440 C Bi:4:055:9 0 13 = 55534253 3f060000 00000000 00
ffff8101ef1153c0 305368473 S Bo:4:055:10 -115 31 = 55534243 40060000 00000000 00000600 00000000 00000000 00000000 000000
ffff8101ef1153c0 305369440 C Bo:4:055:10 0 31 >
ffff8101ef1153c0 305369445 S Bi:4:055:9 -115 13 <
ffff8101ef1153c0 305370440 C Bi:4:055:9 0 13 = 55534253 40060000 00000000 01
ffff8101ef1153c0 305370446 S Bo:4:055:10 -115 31 = 55534243 41060000 12000000 80000603 00000012 00000000 00000000 000000
ffff8101ef1153c0 305371440 C Bo:4:055:10 0 31 >
ffff8101df049900 305371446 S Bi:4:055:9 -115 18 <
ffff8101df049900 305374439 C Bi:4:055:9 0 18 = 70000200 0000000a 00000000 3a000000 0000
ffff8101ef1153c0 305374446 S Bi:4:055:9 -115 13 <
ffff8101ef1153c0 305375444 C Bi:4:055:9 0 13 = 55534253 41060000 00000000 00
ffff8101df049240 305376500 C Bi:4:055:5 0 1526 = 7eff0300 21450005 dcfdb400 00c60672 4c451175 cf19e0aa 5a0050c5 8f9ab1a3
ffff8101df049240 305382208 S Bi:4:055:5 -115 16384 <
ffff8101df049240 305435515 C Bi:4:055:5 0 1522 = 7eff0300 21450005 dcfdb800 00c60672 48451175 cf19e0aa 5a0050c5 8f9ab1a9
ffff8101df049240 305438308 S Bi:4:055:5 -115 16384 <
ffff8101df049240 305492515 C Bi:4:055:5 -2 0
ffff8101df049240 305493240 S Bi:4:055:5 -115 16384 <
ffff8101df049840 305493692 S Bo:4:055:6 -115 142 = 7eff0300 21450000 28708740 0040064b 2e19e0aa 5a451175 cfc58f00 50e92f80
ffff8101df049840 305494455 C Bo:4:055:6 0 142 >
ffff8101df049240 305544517 C Bi:4:055:5 -2 0
ffff8101df049240 305544691 S Bi:4:055:5 -115 16384 <
ffff8101df049240 305596522 C Bi:4:055:5 -2 0
ffff8101df049240 305596657 S Bi:4:055:5 -115 16384 <
ffff8101df049240 305652526 C Bi:4:055:5 -2 0
ffff810137f436c0 305652668 S Bi:4:055:5 -115 16384 <
ffff810137f436c0 305708522 C Bi:4:055:5 -2 0
ffff810137f436c0 305708610 S Bi:4:055:5 -115 16384 <
ffff810137f436c0 305763526 C Bi:4:055:5 -2 0
ffff810137f436c0 305763643 S Bi:4:055:5 -115 16384 <
ffff810137f436c0 305777525 C Bi:4:055:5 0 1521 = 7eff0300 21450005 dc118000 00c6065e 81451175 cf19e0aa 5a0050c5 8f9ab1af
ffff810137f436c0 305780145 S Bi:4:055:5 -115 16384 <
ffff810137f436c0 305832536 C Bi:4:055:5 0 1520 = 7eff0300 21450005 dc118800 00c6065e 79451175 cf19e0aa 5a0050c5 8f9ab1b4
ffff810137f436c0 305835137 S Bi:4:055:5 -115 16384 <
ffff810137f436c0 305887535 C Bi:4:055:5 -2 0
ffff810137f436c0 305888066 S Bi:4:055:5 -115 16384 <
ffff810137f43300 305888428 S Bo:4:055:6 -115 95 = 7eff0300 21450000 28708a40 0040064b 2b19e0aa 5a451175 cfc58f00 50e92f80
ffff810137f43300 305889473 C Bo:4:055:6 0 95 >
ffff810137f436c0 305940542 C Bi:4:055:5 -2 0
ffff810137f436c0 305940705 S Bi:4:055:5 -115 16384 <
ffff810137f436c0 305996540 C Bi:4:055:5 -2 0
ffff810137f436c0 305996658 S Bi:4:055:5 -115 16384 <
ffff810137f436c0 306052541 C Bi:4:055:5 -2 0
ffff810137f436c0 306052623 S Bi:4:055:5 -115 16384 <
ffff810137f436c0 306104544 C Bi:4:055:5 -2 0
ffff810137f436c0 306104618 S Bi:4:055:5 -115 16384 <
ffff810137f436c0 306156550 C Bi:4:055:5 -2 1472 = 7eff0300 21450005 dc1fe400 00c60650 1d451175 cf19e0aa 5a0050c5 8f9ab1ba
ffff810137f436c0 306156657 S Bi:4:055:5 -115 16384 <
ffff810137f436c0 306157554 C Bi:4:055:5 0 58 = 8b7f883e 26f8bfa3 e81e3df0 3fc41f89 a9f1cfc4 3a478f3d efc6d7ba 6f8322f0
ffff810137f436c0 306157791 S Bi:4:055:5 -115 16384 <
ffff810137f436c0 306197551 C Bi:4:055:5 0 1525 = 7eff0300 21450005 dc20a800 00c6064f 59451175 cf19e0aa 5a0050c5 8f9ab1c0
ffff810137f436c0 306200133 S Bi:4:055:5 -115 16384 <
ffff810137f436c0 306252557 C Bi:4:055:5 -2 0
ffff810137f436c0 306252924 S Bi:4:055:5 -115 16384 <
ffff810137f43300 306253210 S Bo:4:055:6 -115 60 = 7eff0300 21450000 34708c40 0040064b 1d19e0aa 5a451175 cfc58f00 50e92f80
ffff810137f43300 306253491 C Bo:4:055:6 0 60 >
ffff810137f436c0 306257550 C Bi:4:055:5 0 1530 = 7eff0300 21450005 dc20ac00 00c6064f 55451175 cf19e0aa 5a0050c5 8f9ab1c5
ffff810137f436c0 306260044 S Bi:4:055:5 -115 16384 <
ffff810137f436c0 306290574 C Bi:4:055:5 0 1531 = 7eff0300 21450005 dc20b800 00c6064f 49451175 cf19e0aa 5a0050c5 8f9ab1cb
ffff810137f436c0 306294201 S Bi:4:055:5 -115 16384 <
ffff810137f436c0 306346564 C Bi:4:055:5 -2 0
ffff810137f436c0 306347153 S Bi:4:055:5 -115 16384 <
ffff810137f43480 306347545 S Bo:4:055:6 -115 119 = 7eff0300 21450000 34708d40 0040064b 1c19e0aa 5a451175 cfc58f00 50e92f80
ffff810137f43480 306348496 C Bo:4:055:6 0 119 >
ffff810137f436c0 306354560 C Bi:4:055:5 0 1526 = 7eff0300 21450005 dc20bc00 00c6064f 45451175 cf19e0aa 5a0050c5 8f9ab1d1
ffff810137f436c0 306359129 S Bi:4:055:5 -115 16384 <
ffff810137f436c0 306405568 C Bi:4:055:5 0 1523 = 7eff0300 21450005 dc216400 00c6064e 9d451175 cf19e0aa 5a0050c5 8f9ab1d7
ffff81021261ec00 306410705 S Bi:4:055:5 -115 16384 <
ffff81021261ec00 306464566 C Bi:4:055:5 -2 0
ffff81021261ec00 306465104 S Bi:4:055:5 -115 16384 <
ffff810137f43000 306465457 S Bo:4:055:6 -115 60 = 7eff0300 21450000 34708f40 0040064b 1a19e0aa 5a451175 cfc58f00 50e92f80
ffff810137f43000 306466501 C Bo:4:055:6 0 60 >
ffff810137f439c0 306468735 S Bo:4:055:6 -115 60 = 7eff0300 21450000 34709040 0040064b 1919e0aa 5a451175 cfc58f00 50e92f80
ffff810137f439c0 306469501 C Bo:4:055:6 0 60 >
ffff81021261ec00 306516572 C Bi:4:055:5 -2 0
ffff81021261ec00 306516706 S Bi:4:055:5 -115 16384 <
ffff81021261ec00 306568575 C Bi:4:055:5 -2 0
ffff81021261ec00 306568674 S Bi:4:055:5 -115 16384 <
ffff81021261ec00 306594573 C Bi:4:055:5 0 1519 = 7eff0300 21450005 dc330c00 00c6063c f5451175 cf19e0aa 5a0050c5 8f9ab1dc
ffff81021261ec00 306598608 S Bi:4:055:5 -115 16384 <
ffff81021261ec00 306643582 C Bi:4:055:5 0 1530 = 7eff0300 21450005 dc370c00 00c60638 f5451175 cf19e0aa 5a0050c5 8f9ab1ba
ffff81021261ec00 306646755 S Bi:4:055:5 -115 16384 <
ffff81021261ec00 306700579 C Bi:4:055:5 -2 0
ffff81021261ec00 306701085 S Bi:4:055:5 -115 16384 <
ffff810137f439c0 306701463 S Bo:4:055:6 -115 60 = 7eff0300 21450000 34709140 0040064b 1819e0aa 5a451175 cfc58f00 50e92f80
ffff810137f439c0 306702515 C Bo:4:055:6 0 60 >
ffff810137f43cc0 306704712 S Bo:4:055:6 -115 48 = 7eff0300 21450000 28709240 0040064b 2319e0aa 5a451175 cfc58f00 50e92f80
ffff810137f43cc0 306705514 C Bo:4:055:6 0 48 >
ffff81021261ec00 306751588 C Bi:4:055:5 0 1526 = 7eff0300 21450005 dc3ac800 00c60635 39451175 cf19e0aa 5a0050c5 8f9ab1e2
ffff81021261ec00 306754672 S Bi:4:055:5 -115 16384 <
ffff81021261ec00 306808591 C Bi:4:055:5 -2 0
ffff81021261ec00 306808941 S Bi:4:055:5 -115 16384 <
ffff810137f43cc0 306809300 S Bo:4:055:6 -115 48 = 7eff0300 21450000 28709340 0040064b 2219e0aa 5a451175 cfc58f00 50e92f80
ffff810137f43cc0 306809522 C Bo:4:055:6 0 48 >
ffff81021261ec00 306860594 C Bi:4:055:5 -2 0
ffff81021261ec00 306860727 S Bi:4:055:5 -115 16384 <
ffff81021261ec00 306912597 C Bi:4:055:5 -2 0
ffff81021261ec00 306912693 S Bi:4:055:5 -115 16384 <
ffff81021261ec00 306964594 C Bi:4:055:5 -2 0
ffff81021261ec00 306964774 S Bi:4:055:5 -115 16384 <
ffff81021261ec00 307016602 C Bi:4:055:5 -2 0
ffff81021261ec00 307016720 S Bi:4:055:5 -115 16384 <
ffff81021261ec00 307068599 C Bi:4:055:5 -2 0
ffff81021261ec00 307068685 S Bi:4:055:5 -115 16384 <
ffff81021261ec00 307098601 C Bi:4:055:5 0 1522 = 7eff0300 21450005 dc4c4c00 00c60623 b5451175 cf19e0aa 5a0050c5 8f9ab1e8
ffff81021261ec00 307102611 S Bi:4:055:5 -115 16384 <
ffff81021261ec00 307156605 C Bi:4:055:5 -2 768 = 7eff0300 21450005 dc4c5800 00c60623 a9451175 cf19e0aa 5a0050c5 8f9ab1ed
ffff81021261ec00 307157235 S Bi:4:055:5 -115 16384 <
ffff810137f43300 307157605 S Bo:4:055:6 -115 48 = 7eff0300 21450000 28709440 0040064b 2119e0aa 5a451175 cfc58f00 50e92f80
ffff81021261ec00 307158603 C Bi:4:055:5 0 754 = cc327c37 0b616b71 7d5e02af 1060b2ae 1be19c2e 5f99f145 6afc252c b725cce5
ffff810137f43300 307158612 C Bo:4:055:6 0 48 >
ffff81021261ec00 307160226 S Bi:4:055:5 -115 16384 <
ffff81021261ec00 307212611 C Bi:4:055:5 -2 0
ffff81021261ec00 307212859 S Bi:4:055:5 -115 16384 <
ffff81021261ec00 307236611 C Bi:4:055:5 0 1519 = 7eff0300 21450005 dc4c5c00 00c60623 a5451175 cf19e0aa 5a0050c5 8f9ab1f3
ffff81021261ec00 307242615 S Bi:4:055:5 -115 16384 <
ffff81021261ec00 307277612 C Bi:4:055:5 0 1524 = 7eff0300 21450005 dc567000 00c60619 91451175 cf19e0aa 5a0050c5 8f9ab1f9
ffff81021261ec00 307282729 S Bi:4:055:5 -115 16384 <
ffff81021261ec00 307336618 C Bi:4:055:5 -2 0
ffff810137f43000 307337438 S Bo:4:055:6 -115 60 = 7eff0300 21450000 34709540 0040064b 1419e0aa 5a451175 cfc58f00 50e92f80
ffff81021261ec00 307337463 S Bi:4:055:5 -115 16384 <
ffff810137f43000 307337551 C Bo:4:055:6 0 60 >
ffff810137f43cc0 307341484 S Bo:4:055:6 -115 60 = 7eff0300 21450000 34709640 0040064b 1319e0aa 5a451175 cfc58f00 50e92f80
ffff810137f43cc0 307342550 C Bo:4:055:6 0 60 >
ffff8101ef1153c0 307362536 S Bo:4:055:10 -115 31 = 55534243 42060000 00000000 00000600 00000000 00000000 00000000 000000
ffff8101ef1153c0 307363554 C Bo:4:055:10 0 31 >
ffff8101ef1153c0 307363580 S Bi:4:055:9 -115 13 <
ffff8101ef1153c0 307364551 C Bi:4:055:9 0 13 = 55534253 42060000 00000000 01
ffff8101ef1153c0 307364559 S Bo:4:055:10 -115 31 = 55534243 43060000 12000000 80000603 00000012 00000000 00000000 000000
ffff8101ef1153c0 307365551 C Bo:4:055:10 0 31 >
ffff810137f43480 307365561 S Bi:4:055:9 -115 18 <
ffff810137f43480 307366551 C Bi:4:055:9 0 18 = 70000200 0000000a 00000000 3a000000 0000
ffff8101ef1153c0 307366558 S Bi:4:055:9 -115 13 <
ffff8101ef1153c0 307367551 C Bi:4:055:9 0 13 = 55534253 43060000 00000000 00
ffff8101ef1153c0 307367586 S Bo:4:055:10 -115 31 = 55534243 44060000 00000000 00000600 00000000 00000000 00000000 000000
ffff8101ef1153c0 307368551 C Bo:4:055:10 0 31 >
ffff8101ef1153c0 307368557 S Bi:4:055:9 -115 13 <
ffff8101ef1153c0 307369566 C Bi:4:055:9 0 13 = 55534253 44060000 00000000 01
ffff8101ef1153c0 307369633 S Bo:4:055:10 -115 31 = 55534243 45060000 12000000 80000603 00000012 00000000 00000000 000000
ffff8101ef1153c0 307370560 C Bo:4:055:10 0 31 >
ffff810137f43480 307370617 S Bi:4:055:9 -115 18 <
ffff810137f43480 307371560 C Bi:4:055:9 0 18 = 70000200 0000000a 00000000 3a000000 0000
ffff8101ef1153c0 307371618 S Bi:4:055:9 -115 13 <
ffff8101ef1153c0 307372554 C Bi:4:055:9 0 13 = 55534253 45060000 00000000 00
ffff81021261ec00 307388621 C Bi:4:055:5 -2 0
ffff81021261ec00 307388741 S Bi:4:055:5 -115 16384 <
ffff81021261ec00 307440624 C Bi:4:055:5 -2 0
ffff810137f43cc0 307440767 S Bi:4:055:5 -115 16384 <
ffff810137f43cc0 307452620 C Bi:4:055:5 0 1532 = 7eff0300 21450005 dc5dbc00 00c60612 45451175 cf19e0aa 5a0050c5 8f9ab1fe
ffff810137f43cc0 307455124 S Bi:4:055:5 -115 16384 <
ffff810137f43cc0 307508627 C Bi:4:055:5 -2 0
ffff810137f43cc0 307509227 S Bo:4:055:6 -115 60 = 7eff0300 21450000 34709740 0040064b 1219e0aa 5a451175 cfc58f00 50e92f80
ffff810137f43480 307509374 S Bi:4:055:5 -115 16384 <
ffff810137f43cc0 307509561 C Bo:4:055:6 0 60 >
ffff810137f43480 307562632 C Bi:4:055:5 -2 0
ffff810137f43480 307562795 S Bi:4:055:5 -115 16384 <
ffff810137f43480 307615632 C Bi:4:055:5 -2 0
ffff810137f43480 307615782 S Bi:4:055:5 -115 16384 <
ffff810137f43480 307669638 C Bi:4:055:5 0 1526 = 7eff0300 21450005 dc663c00 00c60609 c5451175 cf19e0aa 5a0050c5 8f9ab204
ffff810137f43480 307672214 S Bi:4:055:5 -115 16384 <
ffff810137f43480 307724634 C Bi:4:055:5 -2 0
ffff810137f43480 307725197 S Bo:4:055:6 -115 60 = 7eff0300 21450000 34709840 0040064b 1119e0aa 5a451175 cfc58f00 50e92f80
ffff810137f43cc0 307725254 S Bi:4:055:5 -115 16384 <
ffff810137f43480 307725572 C Bo:4:055:6 0 60 >
ffff810137f43cc0 307779639 C Bi:4:055:5 -2 0
ffff810137f43cc0 307779750 S Bi:4:055:5 -115 16384 <
ffff810137f43cc0 307836644 C Bi:4:055:5 -2 0
ffff810137f43cc0 307836763 S Bi:4:055:5 -115 16384 <
ffff810137f43cc0 307888646 C Bi:4:055:5 -2 0
ffff810137f43cc0 307888762 S Bi:4:055:5 -115 16384 <
ffff810137f43cc0 307940644 C Bi:4:055:5 -2 0
ffff810137f43cc0 307940715 S Bi:4:055:5 -115 16384 <
ffff810137f43cc0 307996648 C Bi:4:055:5 -2 0
ffff810137f43cc0 307996717 S Bi:4:055:5 -115 16384 <
ffff810137f43cc0 308052652 C Bi:4:055:5 -2 0
ffff810137f43cc0 308052714 S Bi:4:055:5 -115 16384 <
ffff810137f43cc0 308057650 C Bi:4:055:5 0 1522 = 7eff0300 21450005 dc7cc800 00c606f3 38451175 cf19e0aa 5a0050c5 8f9ab1ed
ffff810137f43cc0 308060177 S Bi:4:055:5 -115 16384 <
ffff810137f43cc0 308112656 C Bi:4:055:5 -2 896 = 7eff0300 21450005 dc7d5d4c 0000c606 f2b44511 75cf19e0 aa5a0050 c58f9ab2
ffff810137f43cc0 308113185 S Bo:4:055:6 -115 48 = 7eff0300 21450000 28709940 0040064b 1c19e0aa 5a451175 cfc58f00 50e92f80
ffff810137f43000 308113245 S Bi:4:055:5 -115 16384 <
ffff810137f43cc0 308113593 C Bo:4:055:6 0 48 >
ffff810137f43000 308114656 C Bi:4:055:5 0 627 = 37c42f04 f86fc79e 04f1b7fc 2a5f8ab7 7d5e0cd2 5b40f12d ef89f5bd 1f5bd47c
ffff810137f43000 308115739 S Bi:4:055:5 -115 16384 <
ffff810137f43000 308168659 C Bi:4:055:5 -2 0
ffff810137f43000 308168856 S Bi:4:055:5 -115 16384 <
ffff810137f43000 308220664 C Bi:4:055:5 -2 0
ffff810137f43000 308220772 S Bi:4:055:5 -115 16384 <
ffff810137f43000 308272668 C Bi:4:055:5 -2 0
ffff810137f43000 308272805 S Bi:4:055:5 -115 16384 <
ffff810137f43000 308324674 C Bi:4:055:5 -2 0
ffff810137f43000 308324805 S Bi:4:055:5 -115 16384 <
ffff810137f43000 308376676 C Bi:4:055:5 -2 0
ffff810137f43000 308376806 S Bi:4:055:5 -115 16384 <
ffff810137f43000 308417678 C Bi:4:055:5 0 1522 = 7eff0300 21450005 dc919400 00c606de 6c451175 cf19e0aa 5a0050c5 8f9ab210
ffff810137f43000 308420324 S Bi:4:055:5 -115 16384 <
ffff810137f43000 308472681 C Bi:4:055:5 0 1521 = 7eff0300 21450005 dc919800 00c606de 68451175 cf19e0aa 5a0050c5 8f9ab215
ffff810137f43000 308475330 S Bi:4:055:5 -115 16384 <
ffff810137f43000 308528684 C Bi:4:055:5 -2 0
ffff810137f43000 308529505 S Bo:4:055:6 -115 60 = 7eff0300 21450000 34709a40 0040064b 0f19e0aa 5a451175 cfc58f00 50e92f80
ffff810137f43180 308529601 S Bi:4:055:5 -115 16384 <
ffff810137f43000 308529647 C Bo:4:055:6 0 60 >
ffff810137f43000 308529887 S Bo:4:055:6 -115 60 = 7eff0300 21450000 34709b40 0040064b 0e19e0aa 5a451175 cfc58f00 50e92f80
ffff810137f43000 308530618 C Bo:4:055:6 0 60 >
ffff810137f43180 308583684 C Bi:4:055:5 -2 0
ffff810137f43180 308583833 S Bi:4:055:5 -115 16384 <
ffff810137f43180 308636690 C Bi:4:055:5 -2 0
ffff810137f43180 308636810 S Bi:4:055:5 -115 16384 <
ffff810137f43180 308688691 C Bi:4:055:5 -2 0
ffff810137f43180 308688806 S Bi:4:055:5 -115 16384 <
ffff810137f43180 308740694 C Bi:4:055:5 -2 0
ffff810137f43180 308740803 S Bi:4:055:5 -115 16384 <
ffff810137f43180 308792696 C Bi:4:055:5 -2 0
ffff810137f43180 308792823 S Bi:4:055:5 -115 16384 <
ffff810137f43180 308844700 C Bi:4:055:5 -2 0
ffff810137f43180 308844835 S Bi:4:055:5 -115 16384 <
ffff810137f43180 308855707 C Bi:4:055:5 0 1521 = 7eff0300 21450005 dca59400 00c606ca 6c451175 cf19e0aa 5a0050c5 8f9ab21b
ffff810137f43180 308858286 S Bi:4:055:5 -115 16384 <
ffff810137f43180 308911705 C Bi:4:055:5 0 1522 = 7eff0300 21450005 dca59800 00c606ca 68451175 cf19e0aa 5a0050c5 8f9ab20a
ffff810137f43180 308914316 S Bi:4:055:5 -115 16384 <
ffff810137f43180 308968716 C Bi:4:055:5 -2 0
ffff810137f43cc0 308969591 S Bo:4:055:6 -115 60 = 7eff0300 21450000 34709c40 0040064b 0d19e0aa 5a451175 cfc58f00 50e92f80
ffff8101851260c0 308970284 S Bi:4:055:5 -115 16384 <
ffff810137f43cc0 308970641 C Bo:4:055:6 0 60 >
ffff810137f436c0 308971816 S Bo:4:055:6 -115 48 = 7eff0300 21450000 28709d40 0040064b 1819e0aa 5a451175 cfc58f00 50e92f80
ffff810137f436c0 308972640 C Bo:4:055:6 0 48 >
ffff8101851260c0 309020709 C Bi:4:055:5 -2 0
ffff8101851260c0 309020842 S Bi:4:055:5 -115 16384 <
ffff8101851260c0 309072711 C Bi:4:055:5 -2 0
ffff8101851260c0 309072819 S Bi:4:055:5 -115 16384 <
ffff8101851260c0 309124711 C Bi:4:055:5 -2 0
ffff8101851260c0 309124814 S Bi:4:055:5 -115 16384 <
ffff8101851260c0 309176718 C Bi:4:055:5 -2 0
ffff8101851260c0 309176833 S Bi:4:055:5 -115 16384 <
ffff8101851260c0 309229718 C Bi:4:055:5 -2 896 = 7eff0300 21450005 dcb75800 00c606b8 a8451175 cf19e0aa 5a0050c5 8f9ab221
ffff8101851260c0 309229826 S Bi:4:055:5 -115 16384 <
ffff8101851260c0 309230720 C Bi:4:055:5 0 624 = 1d7ad3c2 7f0d3e35 693a5f8b 354d7bc4 3f0eefbc 49f0cfc6 9f0e2f3e 2258f8bb
ffff8101851260c0 309231842 S Bi:4:055:5 -115 16384 <
ffff8101851260c0 309284721 C Bi:4:055:5 -2 0
ffff8101851260c0 309284935 S Bi:4:055:5 -115 16384 <
ffff8101851260c0 309289722 C Bi:4:055:5 0 1530 = 7eff0300 21450005 dcb76000 00c606b8 a0451175 cf19e0aa 5a0050c5 8f9ab226
ffff8101851260c0 309294709 S Bi:4:055:5 -115 16384 <
ffff8101851260c0 309342730 C Bi:4:055:5 0 1523 = 7eff0300 21450005 dcb76400 00c606b8 9c451175 cf19e0aa 5a0050c5 8f9ab22c
ffff8101851260c0 309346680 S Bi:4:055:5 -115 16384 <
ffff8101ef1153c0 309363672 S Bo:4:055:10 -115 31 = 55534243 46060000 00000000 00000600 00000000 00000000 00000000 000000
ffff8101ef1153c0 309364663 C Bo:4:055:10 0 31 >
ffff8101ef1153c0 309364670 S Bi:4:055:9 -115 13 <
ffff8101ef1153c0 309365662 C Bi:4:055:9 0 13 = 55534253 46060000 00000000 01
ffff8101ef1153c0 309365669 S Bo:4:055:10 -115 31 = 55534243 47060000 12000000 80000603 00000012 00000000 00000000 000000
ffff8101ef1153c0 309366662 C Bo:4:055:10 0 31 >
ffff810137f43000 309366671 S Bi:4:055:9 -115 18 <
ffff810137f43000 309367662 C Bi:4:055:9 0 18 = 70000200 0000000a 00000000 3a000000 0000
ffff8101ef1153c0 309367670 S Bi:4:055:9 -115 13 <
ffff8101ef1153c0 309368662 C Bi:4:055:9 0 13 = 55534253 47060000 00000000 00
ffff8101ef1153c0 309368695 S Bo:4:055:10 -115 31 = 55534243 48060000 00000000 00000600 00000000 00000000 00000000 000000
ffff8101ef1153c0 309369663 C Bo:4:055:10 0 31 >
ffff8101ef1153c0 309369668 S Bi:4:055:9 -115 13 <
ffff8101ef1153c0 309370662 C Bi:4:055:9 0 13 = 55534253 48060000 00000000 01
ffff8101ef1153c0 309370668 S Bo:4:055:10 -115 31 = 55534243 49060000 12000000 80000603 00000012 00000000 00000000 000000
ffff8101ef1153c0 309371663 C Bo:4:055:10 0 31 >
ffff810137f43000 309371669 S Bi:4:055:9 -115 18 <
ffff810137f43000 309372662 C Bi:4:055:9 0 18 = 70000200 0000000a 00000000 3a000000 0000
ffff8101ef1153c0 309372669 S Bi:4:055:9 -115 13 <
ffff8101ef1153c0 309373663 C Bi:4:055:9 0 13 = 55534253 49060000 00000000 00
ffff8101851260c0 309400728 C Bi:4:055:5 -2 0
ffff810137f43cc0 309401534 S Bo:4:055:6 -115 60 = 7eff0300 21450000 34709e40 0040064b 0b19e0aa 5a451175 cfc58f00 50e92f80
ffff8101851260c0 309401561 S Bi:4:055:5 -115 16384 <
ffff810137f43cc0 309401665 C Bo:4:055:6 0 60 >
ffff810137f43000 309403857 S Bo:4:055:6 -115 60 = 7eff0300 21450000 34709f40 0040064b 0a19e0aa 5a451175 cfc58f00 50e92f80
ffff810137f43000 309404665 C Bo:4:055:6 0 60 >
ffff8101851260c0 309452730 C Bi:4:055:5 -2 0
ffff8101851260c0 309452868 S Bi:4:055:5 -115 16384 <
ffff8101851260c0 309504737 C Bi:4:055:5 -2 0
ffff8101851260c0 309504845 S Bi:4:055:5 -115 16384 <
ffff8101851260c0 309556736 C Bi:4:055:5 -2 0
ffff8101851260c0 309556843 S Bi:4:055:5 -115 16384 <
ffff8101851260c0 309608741 C Bi:4:055:5 -2 0
ffff8101851260c0 309608837 S Bi:4:055:5 -115 16384 <
ffff8101851260c0 309661747 C Bi:4:055:5 -2 0
ffff8101851260c0 309661873 S Bi:4:055:5 -115 16384 <
ffff8101851260c0 309712745 C Bi:4:055:5 -2 0
ffff8101851260c0 309712829 S Bi:4:055:5 -115 16384 <
ffff8101851260c0 309764752 C Bi:4:055:5 -2 0
ffff8101851260c0 309764871 S Bi:4:055:5 -115 16384 <
ffff8101851260c0 309816754 C Bi:4:055:5 -2 0
ffff8101851260c0 309816868 S Bi:4:055:5 -115 16384 <
ffff8101851260c0 309852759 C Bi:4:055:5 0 1530 = 7eff0300 21450005 dcd5a400 00c6069a 5c451175 cf19e0aa 5a0050c5 8f9ab232
ffff8101851260c0 309855717 S Bi:4:055:5 -115 16384 <
ffff8101851260c0 309908762 C Bi:4:055:5 -2 0
ffff8101851260c0 309909136 S Bi:4:055:5 -115 16384 <
ffff810137f43180 309909394 S Bo:4:055:6 -115 61 = 7eff0300 21450000 3470a040 0040064b 0919e0aa 5a451175 cfc58f00 50e92f80
ffff810137f43180 309909693 C Bo:4:055:6 0 61 >
ffff8101851260c0 309912754 C Bi:4:055:5 0 1520 = 7eff0300 21450005 dcd5a800 00c6069a 58451175 cf19e0aa 5a0050c5 8f9ab221
ffff8101851260c0 309918748 S Bi:4:055:5 -115 16384 <
ffff8101851260c0 309972759 C Bi:4:055:5 -2 0
ffff810137f436c0 309973325 S Bo:4:055:6 -115 48 = 7eff0300 21450000 2870a140 0040064b 1419e0aa 5a451175 cfc58f00 50e92f80
ffff810137f436c0 309973696 C Bo:4:055:6 0 48 >
ffff8101851260c0 309974063 S Bi:4:055:5 -115 16384 <
ffff8101851260c0 310024764 C Bi:4:055:5 -2 0
ffff8101851260c0 310024883 S Bi:4:055:5 -115 16384 <
ffff8101851260c0 310076768 C Bi:4:055:5 -2 0
ffff8101851260c0 310076883 S Bi:4:055:5 -115 16384 <
ffff8101851260c0 310128769 C Bi:4:055:5 -2 0
ffff8101851260c0 310129152 S Bi:4:055:5 -115 16384 <
ffff8101851260c0 310180772 C Bi:4:055:5 -2 0
ffff8101851260c0 310180878 S Bi:4:055:5 -115 16384 <
ffff8101851260c0 310217776 C Bi:4:055:5 0 1523 = 7eff0300 21450005 dce2f800 00c6068d 08451175 cf19e0aa 5a0050c5 8f9ab238
ffff8101851260c0 310222679 S Bi:4:055:5 -115 16384 <
ffff8101851260c0 310276782 C Bi:4:055:5 -2 512 = 7eff0300 21450005 dce4d400 00c6068b 2c451175 cf19e0aa 5a0050c5 8f9ab23d
ffff8101df23cb40 310277403 S Bo:4:055:6 -115 48 = 7eff0300 21450000 2870a240 0040064b 1319e0aa 5a451175 cfc58f00 50e92f80
ffff8101df23cb40 310277714 C Bo:4:055:6 0 48 >
ffff8101851260c0 310278014 S Bi:4:055:5 -115 16384 <
ffff8101851260c0 310279774 C Bi:4:055:5 0 1015 = 85f871e1 cf899e13 f0b685f1 9b44f8cf 6bac7c2c f0e0f11f 81fc3fe3 1f8a56d6
ffff8101851260c0 310281564 S Bi:4:055:5 -115 16384 <
ffff8101851260c0 310333785 C Bi:4:055:5 -2 0
ffff8101851260c0 310334086 S Bi:4:055:5 -115 16384 <
ffff8101851260c0 310365787 C Bi:4:055:5 0 1518 = 7eff0300 21450005 dce4d800 00c6068b 28451175 cf19e0aa 5a0050c5 8f9ab243
ffff8101851260c0 310371101 S Bi:4:055:5 -115 16384 <
ffff8101851260c0 310421789 C Bi:4:055:5 -2 0
ffff81020441b9c0 310422396 S Bo:4:055:6 -115 60 = 7eff0300 21450000 3470a340 0040064b 0619e0aa 5a451175 cfc58f00 50e92f80
ffff81020441b600 310422534 S Bi:4:055:5 -115 16384 <
ffff81020441b9c0 310422723 C Bo:4:055:6 0 60 >
ffff81020441b600 310476794 C Bi:4:055:5 -2 0
ffff81020441b600 310476947 S Bi:4:055:5 -115 16384 <
ffff81020441b600 310528793 C Bi:4:055:5 -2 0
ffff81020441b600 310528907 S Bi:4:055:5 -115 16384 <
ffff81020441b600 310572799 C Bi:4:055:5 0 1518 = 7eff0300 21450005 dcf19800 00c6067d 5e684511 75cf19e0 aa5a0050 c58f9ab2
ffff81020441b600 310578321 S Bi:4:055:5 -115 16384 <
ffff81020441b600 310631803 C Bi:4:055:5 -2 0
ffff81020441b600 310632406 S Bo:4:055:6 -115 60 = 7eff0300 21450000 3470a440 0040064b 0519e0aa 5a451175 cfc58f00 50e92f80
ffff81020441b9c0 310632465 S Bi:4:055:5 -115 16384 <
ffff81020441b600 310632734 C Bo:4:055:6 0 60 >
ffff81020441b9c0 310684803 C Bi:4:055:5 -2 0
ffff81020441b9c0 310684938 S Bi:4:055:5 -115 16384 <
ffff81020441b9c0 310735804 C Bi:4:055:5 -2 0
ffff81020441b9c0 310735918 S Bi:4:055:5 -115 16384 <
ffff81020441b9c0 310766809 C Bi:4:055:5 0 1526 = 7eff0300 21450005 dcfa0000 00c60676 00451175 cf19e0aa 5a0050c5 8f9ab24e
ffff81020441b9c0 310770201 S Bi:4:055:5 -115 16384 <
ffff81020441b9c0 310823810 C Bi:4:055:5 -2 0
ffff81020441b9c0 310824414 S Bo:4:055:6 -115 60 = 7eff0300 21450000 3470a540 0040064b 0419e0aa 5a451175 cfc58f00 50e92f80
ffff81020441b6c0 310824473 S Bi:4:055:5 -115 16384 <
ffff81020441b9c0 310824745 C Bo:4:055:6 0 60 >
ffff81020441b6c0 310876815 C Bi:4:055:5 -2 0
ffff81020441b6c0 310876964 S Bi:4:055:5 -115 16384 <
ffff81020441b6c0 310927815 C Bi:4:055:5 -2 0
ffff81020441b6c0 310927933 S Bi:4:055:5 -115 16384 <
ffff81020441b6c0 310965820 C Bi:4:055:5 0 1527 = 7eff0300 21450005 dc048800 00c6066b 79451175 cf19e0aa 5a0050c5 8f9ab23d
ffff81020441b6c0 310970181 S Bi:4:055:5 -115 16384 <
ffff81020441b6c0 311023827 C Bi:4:055:5 -2 0
ffff81020441b6c0 311024462 S Bo:4:055:6 -115 48 = 7eff0300 21450000 2870a640 0040064b 0f19e0aa 5a451175 cfc58f00 50e92f80
ffff81020441b9c0 311024524 S Bi:4:055:5 -115 16384 <
ffff81020441b6c0 311024756 C Bo:4:055:6 0 48 >
ffff81020441b9c0 311076832 C Bi:4:055:5 -2 0
ffff8101df0e3a80 311076965 S Bi:4:055:5 -115 16384 <
ffff8101df0e3a80 311128827 C Bi:4:055:5 -2 0
ffff8101df0e3a80 311128915 S Bi:4:055:5 -115 16384 <
ffff8101df0e3a80 311149828 C Bi:4:055:5 0 1516 = 7eff0300 21450005 dc0d6c00 00c60662 95451175 cf19e0aa 5a0050c5 8f9ab254
ffff8101df0e3a80 311154929 S Bi:4:055:5 -115 16384 <
ffff8101df0e3a80 311208831 C Bi:4:055:5 -2 0
ffff81020441b6c0 311209466 S Bo:4:055:6 -115 48 = 7eff0300 21450000 2870a740 0040064b 0e19e0aa 5a451175 cfc58f00 50e92f80
ffff8101df0e3a80 311209604 S Bi:4:055:5 -115 16384 <
ffff81020441b6c0 311209767 C Bo:4:055:6 0 48 >
ffff8101df0e3a80 311260838 C Bi:4:055:5 -2 0
ffff8101df0e3a80 311260966 S Bi:4:055:5 -115 16384 <
ffff8101df0e3a80 311312839 C Bi:4:055:5 -2 0
ffff8101df0e3a80 311312922 S Bi:4:055:5 -115 16384 <
ffff8101ef1153c0 311363673 S Bo:4:055:10 -115 31 = 55534243 4a060000 00000000 00000600 00000000 00000000 00000000 000000
ffff8101ef1153c0 311363775 C Bo:4:055:10 0 31 >
ffff8101ef1153c0 311363782 S Bi:4:055:9 -115 13 <
ffff8101df0e3a80 311364839 C Bi:4:055:5 -2 0
ffff8101ef1153c0 311364845 C Bi:4:055:9 0 13 = 55534253 4a060000 00000000 01
ffff8101ef1153c0 311364853 S Bo:4:055:10 -115 31 = 55534243 4b060000 12000000 80000603 00000012 00000000 00000000 000000
ffff8101df0e3a80 311364943 S Bi:4:055:5 -115 16384 <
ffff8101ef1153c0 311365774 C Bo:4:055:10 0 31 >
ffff81020441b600 311365784 S Bi:4:055:9 -115 18 <
ffff81020441b600 311366774 C Bi:4:055:9 0 18 = 70000200 0000000a 00000000 3a000000 0000
ffff8101ef1153c0 311366781 S Bi:4:055:9 -115 13 <
ffff8101ef1153c0 311367773 C Bi:4:055:9 0 13 = 55534253 4b060000 00000000 00
ffff8101ef1153c0 311367807 S Bo:4:055:10 -115 31 = 55534243 4c060000 00000000 00000600 00000000 00000000 00000000 000000
ffff8101ef1153c0 311368774 C Bo:4:055:10 0 31 >
ffff8101ef1153c0 311368779 S Bi:4:055:9 -115 13 <
ffff8101ef1153c0 311369773 C Bi:4:055:9 0 13 = 55534253 4c060000 00000000 01
ffff8101ef1153c0 311369779 S Bo:4:055:10 -115 31 = 55534243 4d060000 12000000 80000603 00000012 00000000 00000000 000000
ffff8101ef1153c0 311370774 C Bo:4:055:10 0 31 >
ffff81020441b600 311370780 S Bi:4:055:9 -115 18 <
ffff81020441b600 311371774 C Bi:4:055:9 0 18 = 70000200 0000000a 00000000 3a000000 0000
ffff8101ef1153c0 311371780 S Bi:4:055:9 -115 13 <
ffff8101ef1153c0 311373773 C Bi:4:055:9 0 13 = 55534253 4d060000 00000000 00
ffff8101df0e3a80 311376833 C Bi:4:055:5 0 1520 = 7eff0300 21450005 dc166000 00c60659 a1451175 cf19e0aa 5a0050c5 8f9ab25a
ffff8101df0e3a80 311379303 S Bi:4:055:5 -115 16384 <
ffff8101df0e3a80 311431842 C Bi:4:055:5 0 1524 = 7eff0300 21450005 dc166400 00c60659 9d451175 cf19e0aa 5a0050c5 8f9ab25f
ffff8101df0e3a80 311434646 S Bi:4:055:5 -115 16384 <
ffff8101df0e3a80 311488848 C Bi:4:055:5 -2 0
ffff81020441bd80 311489642 S Bo:4:055:6 -115 48 = 7eff0300 21450000 2870a840 0040064b 0d19e0aa 5a451175 cfc58f00 50e92f80
ffff8101df0e3a80 311489774 S Bi:4:055:5 -115 16384 <
ffff81020441bd80 311489823 C Bo:4:055:6 0 48 >
ffff81020441b600 311491829 S Bo:4:055:6 -115 48 = 7eff0300 21450000 2870a940 0040064b 0c19e0aa 5a451175 cfc58f00 50e92f80
ffff81020441b600 311492781 C Bo:4:055:6 0 48 >
ffff8101df0e3a80 311540852 C Bi:4:055:5 -2 0
ffff8101df0e3a80 311540991 S Bi:4:055:5 -115 16384 <
ffff8101df0e3a80 311592855 C Bi:4:055:5 -2 0
ffff8101df0e3a80 311592969 S Bi:4:055:5 -115 16384 <
ffff8101df0e3a80 311611855 C Bi:4:055:5 0 1520 = 7eff0300 21450005 dc210000 00c6064f 01451175 cf19e0aa 5a0050c5 8f9ab265
ffff8101df0e3a80 311616283 S Bi:4:055:5 -115 16384 <
ffff8101df0e3a80 311667860 C Bi:4:055:5 -2 0
ffff81020441b600 311668472 S Bo:4:055:6 -115 48 = 7eff0300 21450000 2870aa40 0040064b 0b19e0aa 5a451175 cfc58f00 50e92f80
ffff81020441bf00 311668691 S Bi:4:055:5 -115 16384 <
ffff81020441b600 311668793 C Bo:4:055:6 0 48 >
ffff81020441bf00 311719862 C Bi:4:055:5 -2 0
ffff81020441bf00 311720014 S Bi:4:055:5 -115 16384 <
ffff81020441bf00 311771859 C Bi:4:055:5 -2 0
ffff81020441bf00 311771945 S Bi:4:055:5 -115 16384 <
ffff81020441bf00 311795860 C Bi:4:055:5 0 1528 = 7eff0300 21450005 dc294800 00c60646 b9451175 cf19e0aa 5a0050c5 8f9ab26b
ffff81020441bf00 311802087 S Bi:4:055:5 -115 16384 <
ffff81020441bf00 311851874 C Bi:4:055:5 0 1523 = 7eff0300 21450005 dc294c00 00c60646 b5451175 cf19e0aa 5a0050c5 8f9ab271
ffff81020441bf00 311854573 S Bi:4:055:5 -115 16384 <
ffff81020441bf00 311907867 C Bi:4:055:5 -2 0
ffff81020441bf00 311908581 S Bo:4:055:6 -115 48 = 7eff0300 21450000 2870ab40 0040064b 0a19e0aa 5a451175 cfc58f00 50e92f80
ffff81020441bd80 311908787 S Bi:4:055:5 -115 16384 <
ffff81020441bf00 311908834 C Bo:4:055:6 0 48 >
ffff81020441bf00 311909038 S Bo:4:055:6 -115 48 = 7eff0300 21450000 2870ac40 0040064b 0919e0aa 5a451175 cfc58f00 50e92f80
ffff81020441bf00 311909805 C Bo:4:055:6 0 48 >
ffff81020441bf00 311928933 S Bo:4:055:6 -115 92 = 7eff0300 21450000 54834100 0040014b de0a0a01 c3c7f9d7 c3000000 e7645b00
ffff81020441bf00 311929809 C Bo:4:055:6 0 92 >
ffff81020441bd80 311959876 C Bi:4:055:5 -2 0
ffff81020441bd80 311960038 S Bi:4:055:5 -115 16384 <
ffff81020441bd80 312011878 C Bi:4:055:5 -2 0
ffff81020441bd80 312012005 S Bi:4:055:5 -115 16384 <
ffff81020441bd80 312063874 C Bi:4:055:5 -2 0
ffff81020441bd80 312064073 S Bi:4:055:5 -115 16384 <
ffff81020441bd80 312115878 C Bi:4:055:5 -2 0
ffff81020441bd80 312115969 S Bi:4:055:5 -115 16384 <
ffff81020441bd80 312165890 C Bi:4:055:5 0 1524 = 7eff0300 21450005 dc3d9000 00c60632 71451175 cf19e0aa 5a0050c5 8f9ab276
ffff81020441bd80 312170167 S Bi:4:055:5 -115 16384 <
ffff81020441bd80 312223886 C Bi:4:055:5 -2 0
ffff81020441bd80 312224454 S Bo:4:055:6 -115 48 = 7eff0300 21450000 2870ad40 0040064b 0819e0aa 5a451175 cfc58f00 50e92f80
ffff81020441bb40 312224614 S Bi:4:055:5 -115 16384 <
ffff81020441bd80 312224823 C Bo:4:055:6 0 48 >
ffff81020441bb40 312275893 C Bi:4:055:5 -2 0
ffff81020441bb40 312276045 S Bi:4:055:5 -115 16384 <
ffff81020441bb40 312327894 C Bi:4:055:5 -2 0
ffff81020441bb40 312328021 S Bi:4:055:5 -115 16384 <
ffff81020441bb40 312379898 C Bi:4:055:5 -2 0
ffff81020441bb40 312380018 S Bi:4:055:5 -115 16384 <
ffff81020441bb40 312410895 C Bi:4:055:5 0 1528 = 7eff0300 21450005 dc3d9400 00c60632 6d451175 cf19e0aa 5a0050c5 8f9ab27c
ffff81020441bb40 312414336 S Bi:4:055:5 -115 16384 <
ffff81020441bb40 312415890 C Bi:4:055:5 0 1522 = 7eff0300 21450005 dc4b0000 00c60625 01451175 cf19e0aa 5a0050c5 8f9ab282
ffff81020441bb40 312422305 S Bi:4:055:5 -115 16384 <
ffff81020441bb40 312475898 C Bi:4:055:5 -2 0
ffff81020441bb40 312476389 S Bi:4:055:5 -115 16384 <
ffff81020441b540 312476757 S Bo:4:055:6 -115 95 = 7eff0300 21450000 2870ae40 0040064b 0719e0aa 5a451175 cfc58f00 50e92f80
ffff81020441b540 312477837 C Bo:4:055:6 0 95 >
ffff81020441bb40 312511909 C Bi:4:055:5 0 1519 = 7eff0300 21450005 dc4b0800 00c60624 f9451175 cf19e0aa 5a0050c5 8f9ab287
ffff81020441bb40 312518404 S Bi:4:055:5 -115 16384 <
ffff81020441bb40 312571906 C Bi:4:055:5 -2 0
ffff81020441bb40 312572266 S Bi:4:055:5 -115 16384 <
ffff81020441b540 312572545 S Bo:4:055:6 -115 48 = 7eff0300 21450000 2870b040 0040064b 0519e0aa 5a451175 cfc58f00 50e92f80
ffff81020441b540 312572844 C Bo:4:055:6 0 48 >
ffff81020441bb40 312624913 C Bi:4:055:5 -2 0
ffff81020441bb40 312625069 S Bi:4:055:5 -115 16384 <
ffff81020441bb40 312675912 C Bi:4:055:5 -2 0
ffff81020441bb40 312676048 S Bi:4:055:5 -115 16384 <
ffff81020441bb40 312727912 C Bi:4:055:5 -2 0
ffff81020441bb40 312728012 S Bi:4:055:5 -115 16384 <
ffff81020441bb40 312738912 C Bi:4:055:5 0 1523 = 7eff0300 21450005 dc600000 00c60610 01451175 cf19e0aa 5a0050c5 8f9ab28d
ffff81020441bb40 312742182 S Bi:4:055:5 -115 16384 <
ffff81020441bb40 312795921 C Bi:4:055:5 -2 0
ffff81020441bb40 312796284 S Bi:4:055:5 -115 16384 <
ffff81020441b540 312796568 S Bo:4:055:6 -115 48 = 7eff0300 21450000 2870b140 0040064b 0419e0aa 5a451175 cfc58f00 50e92f80
ffff81020441b540 312796855 C Bo:4:055:6 0 48 >
ffff81020441bb40 312847924 C Bi:4:055:5 -2 0
ffff81020441bb40 312848076 S Bi:4:055:5 -115 16384 <
ffff81020441bb40 312899926 C Bi:4:055:5 -2 0
ffff81020441bb40 312900054 S Bi:4:055:5 -115 16384 <
ffff81020441bb40 312951925 C Bi:4:055:5 -2 0
ffff81020441bb40 312952004 S Bi:4:055:5 -115 16384 <
ffff81020441bb40 312957924 C Bi:4:055:5 0 1519 = 7eff0300 21450005 dc606800 00c6060f 99451175 cf19e0aa 5a0050c5 8f9ab293
ffff81020441bb40 312962243 S Bi:4:055:5 -115 16384 <
ffff81020441bb40 312963925 C Bi:4:055:5 0 1519 = 7eff0300 21450005 dc606c00 00c6060f 95451175 cf19e0aa 5a0050c5 8f9ab298
ffff81020441bb40 312970096 S Bi:4:055:5 -115 16384 <
ffff81020441bb40 312971924 C Bi:4:055:5 0 1054 = 7eff0300 21450005 dc607400 00c6060f 8d451175 cf19e0aa 5a0050c5 8f9ab29e
ffff81020441bb40 312977390 S Bi:4:055:5 -115 16384 <
ffff81020441bb40 312978925 C Bi:4:055:5 0 469 = cd30982e 10c561f3 de17c872 aa198e17 20c02cba 9e6187c0 66946a61 ab677fd9
ffff81020441bb40 312979764 S Bi:4:055:5 -115 16384 <
ffff81020441bb40 312981921 C Bi:4:055:5 0 1523 = 7eff0300 21450005 dc632c00 00c6060c d5451175 cf19e0aa 5a0050c5 8f9ab2a4
ffff81020441bb40 312984442 S Bi:4:055:5 -115 16384 <
ffff81020441bb40 313035932 C Bi:4:055:5 -2 0
ffff81020441bb40 313036784 S Bi:4:055:5 -115 16384 <
ffff81020441bd80 313037250 S Bo:4:055:6 -115 142 = 7eff0300 21450000 2870b240 0040064b 0319e0aa 5a451175 cfc58f00 50e92f80
ffff81020441bd80 313037869 C Bo:4:055:6 0 142 >
ffff81020441bb40 313069945 C Bi:4:055:5 0 1535 = 7eff0300 21450005 dc695000 00c60606 b1451175 cf19e0aa 5a0050c5 8f9ab2aa
ffff81020441bb40 313074462 S Bi:4:055:5 -115 16384 <
ffff81020441bd80 313075835 S Bo:4:055:6 -115 48 = 7eff0300 21450000 2870b540 0040064b 0019e0aa 5a451175 cfc58f00 50e92f80
ffff81020441bd80 313076871 C Bo:4:055:6 0 48 >
ffff81020441bb40 313127941 C Bi:4:055:5 -2 0
ffff81020441bb40 313128355 S Bi:4:055:5 -115 16384 <
ffff81020441bb40 313179940 C Bi:4:055:5 -2 0
ffff81020441bb40 313180047 S Bi:4:055:5 -115 16384 <
ffff81020441bd80 313207862 S Bo:4:055:6 -115 48 = 7eff0300 21450000 2870b640 0040064a ff19e0aa 5a451175 cfc58f00 50e92f80
ffff81020441bd80 313208879 C Bo:4:055:6 0 48 >
ffff81020441bb40 313231947 C Bi:4:055:5 -2 0
ffff81020441bb40 313232088 S Bi:4:055:5 -115 16384 <
ffff81020441bb40 313283949 C Bi:4:055:5 -2 0
ffff81020441bb40 313284085 S Bi:4:055:5 -115 16384 <
ffff81020441bb40 313335953 C Bi:4:055:5 -2 0
ffff81020441bb40 313336083 S Bi:4:055:5 -115 16384 <
ffff81020441bb40 313356952 C Bi:4:055:5 0 1518 = 7eff0300 21450005 dc78f800 00c606f7 08451175 cf19e0aa 5a0050c5 8f9ab2af
ffff81020441bb40 313362272 S Bi:4:055:5 -115 16384 <
ffff8101ef1153c0 313363677 S Bo:4:055:10 -115 31 = 55534243 4e060000 00000000 00000600 00000000 00000000 00000000 000000
ffff8101ef1153c0 313363885 C Bo:4:055:10 0 31 >
ffff8101ef1153c0 313363892 S Bi:4:055:9 -115 13 <
ffff8101ef1153c0 313364885 C Bi:4:055:9 0 13 = 55534253 4e060000 00000000 01
ffff8101ef1153c0 313364892 S Bo:4:055:10 -115 31 = 55534243 4f060000 12000000 80000603 00000012 00000000 00000000 000000
ffff8101ef1153c0 313365885 C Bo:4:055:10 0 31 >
ffff81020441b600 313365893 S Bi:4:055:9 -115 18 <
ffff81020441b600 313367886 C Bi:4:055:9 0 18 = 70000200 0000000a 00000000 3a000000 0000
ffff8101ef1153c0 313367977 S Bi:4:055:9 -115 13 <
ffff8101ef1153c0 313368890 C Bi:4:055:9 0 13 = 55534253 4f060000 00000000 00
ffff8101ef1153c0 313368965 S Bo:4:055:10 -115 31 = 55534243 50060000 00000000 00000600 00000000 00000000 00000000 000000
ffff8101ef1153c0 313369886 C Bo:4:055:10 0 31 >
ffff8101ef1153c0 313369891 S Bi:4:055:9 -115 13 <
ffff8101ef1153c0 313370885 C Bi:4:055:9 0 13 = 55534253 50060000 00000000 01
ffff8101ef1153c0 313370891 S Bo:4:055:10 -115 31 = 55534243 51060000 12000000 80000603 00000012 00000000 00000000 000000
ffff8101ef1153c0 313371886 C Bo:4:055:10 0 31 >
ffff81020441b600 313371895 S Bi:4:055:9 -115 18 <
ffff81020441b600 313372885 C Bi:4:055:9 0 18 = 70000200 0000000a 00000000 3a000000 0000
ffff8101ef1153c0 313372893 S Bi:4:055:9 -115 13 <
ffff8101ef1153c0 313373885 C Bi:4:055:9 0 13 = 55534253 51060000 00000000 00
ffff81020441bb40 313397952 C Bi:4:055:5 0 1522 = 7eff0300 21450005 dc78fc00 00c606f7 04451175 cf19e0aa 5a0050c5 8f9ab2b5
ffff81020441bb40 313402152 S Bi:4:055:5 -115 16384 <
ffff81020441bb40 313455960 C Bi:4:055:5 -2 0
ffff81020441bb40 313456500 S Bi:4:055:5 -115 16384 <
ffff81020441b540 313456795 S Bo:4:055:6 -115 48 = 7eff0300 21450000 2870b740 0040064a fe19e0aa 5a451175 cfc58f00 50e92f80
ffff81020441b540 313457896 C Bo:4:055:6 0 48 >
ffff81020441bb40 313458950 C Bi:4:055:5 0 1521 = 7eff0300 21450005 dc7b0400 00c606f4 fc451175 cf19e0aa 5a0050c5 8f9ab2bb
ffff81020441bb40 313461547 S Bi:4:055:5 -115 16384 <
ffff81020441bb40 313511962 C Bi:4:055:5 -2 0
ffff81020441bb40 313512350 S Bi:4:055:5 -115 16384 <
ffff81020441bb40 313517962 C Bi:4:055:5 0 1521 = 7eff0300 21450005 dc7b0800 00c606f4 f8451175 cf19e0aa 5a0050c5 8f9ab2c0
ffff81020441bb40 313522175 S Bi:4:055:5 -115 16384 <
ffff81020441bb40 313549963 C Bi:4:055:5 0 1519 = 7eff0300 21450005 dc7b0c00 00c606f4 f4451175 cf19e0aa 5a0050c5 8f9ab2c6
ffff81020441bb40 313554279 S Bi:4:055:5 -115 16384 <
ffff81020441bb40 313607963 C Bi:4:055:5 -2 0
ffff81020441bb40 313608503 S Bi:4:055:5 -115 16384 <
ffff81020441b540 313608789 S Bo:4:055:6 -115 48 = 7eff0300 21450000 2870b840 0040064a fd19e0aa 5a451175 cfc58f00 50e92f80
ffff81020441b540 313609905 C Bo:4:055:6 0 48 >
ffff81020441bb40 313610960 C Bi:4:055:5 0 1525 = 7eff0300 21450005 dc7f5800 00c606f0 a8451175 cf19e0aa 5a0050c5 8f9ab2cc
ffff81020441bb40 313613533 S Bi:4:055:5 -115 16384 <
ffff81020441bb40 313663971 C Bi:4:055:5 -2 0
ffff81020441bb40 313664365 S Bi:4:055:5 -115 16384 <
ffff81020441b540 313664649 S Bo:4:055:6 -115 48 = 7eff0300 21450000 2870b940 0040064a fc19e0aa 5a451175 cfc58f00 50e92f80
ffff81020441b540 313664904 C Bo:4:055:6 0 48 >
ffff81020441bb40 313715974 C Bi:4:055:5 -2 0
ffff81020441bb40 313716133 S Bi:4:055:5 -115 16384 <
ffff81020441bb40 313767975 C Bi:4:055:5 -2 0
ffff81020441bb40 313768101 S Bi:4:055:5 -115 16384 <
ffff81020441bb40 313771970 C Bi:4:055:5 0 1527 = 7eff0300 21450005 dc8f3c00 00c606e0 c4451175 cf19e0aa 5a0050c5 8f9ab2d1
ffff81020441bb40 313778333 S Bi:4:055:5 -115 16384 <
ffff81020441bb40 313831980 C Bi:4:055:5 -2 1518 = 7eff0300 21450005 dc8f4000 00c606e0 c0451175 cf19e0aa 5a0050c5 8f9ab2d7
ffff81020441bb40 313832349 S Bi:4:055:5 -115 16384 <
ffff81020441bb40 313883982 C Bi:4:055:5 -2 0
ffff81020441bb40 313884137 S Bi:4:055:5 -115 16384 <
ffff81020441bd80 313931895 S Bo:4:055:6 -115 49 = 7eff0300 21450000 2870ba40 0040064a fb19e0aa 5a451175 cfc58f00 50e92f80
ffff81020441bd80 313932919 C Bo:4:055:6 0 49 >
ffff81020441bb40 313935980 C Bi:4:055:5 -2 0
ffff81020441bb40 313936063 S Bi:4:055:5 -115 16384 <
ffff81020441bb40 313987988 C Bi:4:055:5 -2 0
ffff81020441bb40 313988128 S Bi:4:055:5 -115 16384 <
ffff81020441bb40 313998990 C Bi:4:055:5 0 1523 = 7eff0300 21450005 dc967000 00c606d9 90451175 cf19e0aa 5a0050c5 8f9ab2dd
ffff81020441bb40 314002144 S Bi:4:055:5 -115 16384 <
ffff81020441bb40 314052993 C Bi:4:055:5 0 1525 = 7eff0300 21450005 dc967400 00c606d9 8c451175 cf19e0aa 5a0050c5 8f9ab2e3
ffff81020441bb40 314058545 S Bi:4:055:5 -115 16384 <
ffff81020441bb40 314111993 C Bi:4:055:5 -2 0
ffff81020441bb40 314112520 S Bi:4:055:5 -115 16384 <
ffff81020441bd80 314112918 S Bo:4:055:6 -115 119 = 7eff0300 21450000 3470bb40 0040064a ee19e0aa 5a451175 cfc58f00 50e92f80
ffff81020441bd80 314113928 C Bo:4:055:6 0 119 >
ffff81020441bb40 314163998 C Bi:4:055:5 -2 0
ffff81020441bb40 314164159 S Bi:4:055:5 -115 16384 <
ffff81020441bb40 314211001 C Bi:4:055:5 0 1523 = 7eff0300 21450005 dca08000 00c606cf 80451175 cf19e0aa 5a0050c5 8f9ab2e8
ffff81020441bb40 314214149 S Bi:4:055:5 -115 16384 <
ffff81020441bb40 314256005 C Bi:4:055:5 0 1525 = 7eff0300 21450005 dca08400 00c606cf 7c451175 cf19e0aa 5a0050c5 8f9ab2ee
ffff81020441bb40 314262332 S Bi:4:055:5 -115 16384 <
ffff81020441bb40 314314007 C Bi:4:055:5 -2 0
ffff81020441bb40 314314540 S Bi:4:055:5 -115 16384 <
ffff81020441b9c0 314314943 S Bo:4:055:6 -115 119 = 7eff0300 21450000 3470bd40 0040064a ec19e0aa 5a451175 cfc58f00 50e92f80
ffff81020441b9c0 314315943 C Bo:4:055:6 0 119 >
ffff81020441bb40 314316996 C Bi:4:055:5 0 1521 = 7eff0300 21450005 dca3d000 00c606cc 30451175 cf19e0aa 5a0050c5 8f9ab2f4
ffff81020441bb40 314322223 S Bi:4:055:5 -115 16384 <
ffff81020441bb40 314376011 C Bi:4:055:5 -2 1522 = 7eff0300 21450005 dca3d400 00c606cc 2c451175 cf19e0aa 5a0050c5 8f9ab2f9
ffff81020441bb40 314376404 S Bi:4:055:5 -115 16384 <
ffff81020441b6c0 314376695 S Bo:4:055:6 -115 60 = 7eff0300 21450000 3470bf40 0040064a ea19e0aa 5a451175 cfc58f00 50e92f80
ffff81020441b6c0 314376943 C Bo:4:055:6 0 60 >
ffff81020441bb40 314428014 C Bi:4:055:5 -2 0
ffff81020441bb40 314428813 S Bi:4:055:5 -115 16384 <
ffff81020441bb40 314437008 C Bi:4:055:5 0 1522 = 7eff0300 21450005 dcae0c00 00c606c1 f4451175 cf19e0aa 5a0050c5 8f9ab2ff
ffff81020441bb40 314442420 S Bi:4:055:5 -115 16384 <
ffff81020441bb40 314479016 C Bi:4:055:5 0 1518 = 7eff0300 21450005 dcae1400 00c606c1 ec451175 cf19e0aa 5a0050c5 8f9ab2d7
ffff81020441bb40 314482614 S Bi:4:055:5 -115 16384 <
ffff81020441bb40 314536017 C Bi:4:055:5 -2 0
ffff81020441bb40 314536559 S Bi:4:055:5 -115 16384 <
ffff81020441b6c0 314536998 S Bo:4:055:6 -115 127 = 7eff0300 21450000 3c70c040 0040064a e119e0aa 5a451175 cfc58f00 50e92f80
ffff81020441b6c0 314537954 C Bo:4:055:6 0 127 >
ffff81020441bb40 314588023 C Bi:4:055:5 -2 0
ffff81020441bb40 314588187 S Bi:4:055:5 -115 16384 <
ffff81020441bb40 314640025 C Bi:4:055:5 -2 0
ffff81020441bb40 314640167 S Bi:4:055:5 -115 16384 <
ffff81020441bb40 314692026 C Bi:4:055:5 -2 0
ffff81020441bb40 314692185 S Bi:4:055:5 -115 16384 <
ffff81020441bb40 314744027 C Bi:4:055:5 -2 0
ffff81020441bb40 314744150 S Bi:4:055:5 -115 16384 <
ffff81020441bb40 314796030 C Bi:4:055:5 -2 0
ffff81020441bb40 314796159 S Bi:4:055:5 -115 16384 <
ffff81020441bb40 314810029 C Bi:4:055:5 0 1516 = 7eff0300 21450005 dcc34800 00c606ac b8451175 cf19e0aa 5a0050c5 8f9ab305
ffff81020441bb40 314815623 S Bi:4:055:5 -115 16384 <
ffff81020441bb40 314868035 C Bi:4:055:5 -2 0
ffff81020441bb40 314868403 S Bi:4:055:5 -115 16384 <
ffff81020441bd80 314868697 S Bo:4:055:6 -115 60 = 7eff0300 21450000 3470c240 0040064a e719e0aa 5a451175 cfc58f00 50e92f80
ffff81020441bd80 314868973 C Bo:4:055:6 0 60 >
ffff81020441bb40 314871025 C Bi:4:055:5 0 1520 = 7eff0300 21450005 dcc34c00 00c606ac b4451175 cf19e0aa 5a0050c5 8f9ab30b
ffff81020441bb40 314873520 S Bi:4:055:5 -115 16384 <
ffff81020441bb40 314924041 C Bi:4:055:5 -2 0
ffff81020441bb40 314924421 S Bi:4:055:5 -115 16384 <
ffff81020441bd80 314924711 S Bo:4:055:6 -115 60 = 7eff0300 21450000 3470c340 0040064a e619e0aa 5a451175 cfc58f00 50e92f80
ffff81020441bd80 314924974 C Bo:4:055:6 0 60 >
ffff81020441bb40 314976044 C Bi:4:055:5 -2 0
ffff81020441bb40 314976197 S Bi:4:055:5 -115 16384 <
ffff81020441bb40 315028044 C Bi:4:055:5 -2 0
ffff81020441bb40 315028166 S Bi:4:055:5 -115 16384 <
ffff81020441bb40 315051045 C Bi:4:055:5 0 1523 = 7eff0300 21450005 dcc35000 00c606ac b0451175 cf19e0aa 5a0050c5 8f9ab310
ffff81020441bb40 315054125 S Bi:4:055:5 -115 16384 <
ffff81020441bb40 315108048 C Bi:4:055:5 -2 0
ffff81020441bb40 315108412 S Bi:4:055:5 -115 16384 <
ffff81020441bd80 315108702 S Bo:4:055:6 -115 60 = 7eff0300 21450000 3470c440 0040064a e519e0aa 5a451175 cfc58f00 50e92f80
ffff81020441bd80 315108984 C Bo:4:055:6 0 60 >
ffff81020441bb40 315160055 C Bi:4:055:5 -2 0
ffff81020441bb40 315160209 S Bi:4:055:5 -115 16384 <
ffff81020441bb40 315212058 C Bi:4:055:5 -2 0
ffff81020441bb40 315212200 S Bi:4:055:5 -115 16384 <
ffff81020441bb40 315264057 C Bi:4:055:5 -2 0
ffff81020441bb40 315264183 S Bi:4:055:5 -115 16384 <
ffff81020441bb40 315292062 C Bi:4:055:5 0 1522 = 7eff0300 21450005 dcd17000 00c6069e 90451175 cf19e0aa 5a0050c5 8f9ab2f9
ffff81020441bb40 315298201 S Bi:4:055:5 -115 16384 <
ffff81020441bb40 315300057 C Bi:4:055:5 0 1515 = 7eff0300 21450005 dcd17400 00c6069e 8c451175 cf19e0aa 5a0050c5 8f9ab316
ffff81020441bb40 315306121 S Bi:4:055:5 -115 16384 <
ffff81020441bb40 315308055 C Bi:4:055:5 0 1054 = 7eff0300 21450005 dcd29400 00c6069d 6c451175 cf19e0aa 5a0050c5 8f9ab31c
ffff8101f4405b40 315313978 S Bi:4:055:5 -115 16384 <
ffff8101f4405b40 315315061 C Bi:4:055:5 0 464 = e01d67fe 16dfc65f 8a7f0974 07f15de7 c51d77c6 1f1ffe25 fc439f7f 8bfc77f0
ffff8101f4405b40 315315832 S Bi:4:055:5 -115 16384 <
ffff8101ef1153c0 315367674 S Bo:4:055:10 -115 31 = 55534243 52060000 00000000 00000600 00000000 00000000 00000000 000000
ffff8101ef1153c0 315368000 C Bo:4:055:10 0 31 >
ffff8101ef1153c0 315368008 S Bi:4:055:9 -115 13 <
ffff8101f4405b40 315369063 C Bi:4:055:5 -2 0
ffff8101f4405b40 315370008 S Bi:4:055:5 -115 16384 <
ffff81020441b540 315370363 S Bo:4:055:6 -115 48 = 7eff0300 21450000 2870c540 0040064a f019e0aa 5a451175 cfc58f00 50e92f80
ffff81020441b540 315371001 C Bo:4:055:6 0 48 >
ffff8101ef1153c0 315371997 C Bi:4:055:9 0 13 = 55534253 52060000 00000000 01
ffff8101ef1153c0 315372008 S Bo:4:055:10 -115 31 = 55534243 53060000 12000000 80000603 00000012 00000000 00000000 000000
ffff8101ef1153c0 315373001 C Bo:4:055:10 0 31 >
ffff81020441b600 315373009 S Bi:4:055:9 -115 18 <
ffff81020441b840 315373331 S Bo:4:055:6 -115 95 = 7eff0300 21450000 2870c640 0040064a ef19e0aa 5a451175 cfc58f00 50e92f80
ffff8101f4405b40 315374057 C Bi:4:055:5 0 1524 = 7eff0300 21450005 dcd9e400 00c60696 1c451175 cf19e0aa 5a0050c5 8f9ab321
ffff81020441b600 315374061 C Bi:4:055:9 0 18 = 70000200 0000000a 00000000 3a000000 0000
ffff81020441b840 315374065 C Bo:4:055:6 0 95 >
ffff8101ef1153c0 315374073 S Bi:4:055:9 -115 13 <
ffff8101ef1153c0 315374997 C Bi:4:055:9 0 13 = 55534253 53060000 00000000 00
ffff8101ef1153c0 315375040 S Bo:4:055:10 -115 31 = 55534243 54060000 00000000 00000600 00000000 00000000 00000000 000000
ffff8101ef1153c0 315375997 C Bo:4:055:10 0 31 >
ffff8101ef1153c0 315376002 S Bi:4:055:9 -115 13 <
ffff8101ef1153c0 315376996 C Bi:4:055:9 0 13 = 55534253 54060000 00000000 01
ffff8101ef1153c0 315377049 S Bo:4:055:10 -115 31 = 55534243 55060000 12000000 80000603 00000012 00000000 00000000 000000
ffff8101ef1153c0 315377997 C Bo:4:055:10 0 31 >
ffff81020441b840 315378006 S Bi:4:055:9 -115 18 <
ffff8101f4405b40 315378651 S Bi:4:055:5 -115 16384 <
ffff81020441b840 315378997 C Bi:4:055:9 0 18 = 70000200 0000000a 00000000 3a000000 0000
ffff8101ef1153c0 315379005 S Bi:4:055:9 -115 13 <
ffff8101ef1153c0 315379997 C Bi:4:055:9 0 13 = 55534253 55060000 00000000 00
ffff8101f4405b40 315433070 C Bi:4:055:5 -2 0
ffff8101f4405b40 315433397 S Bi:4:055:5 -115 16384 <
ffff81020441b6c0 315434281 S Bo:4:055:6 -115 48 = 7eff0300 21450000 2870c840 0040064a ed19e0aa 5a451175 cfc58f00 50e92f80
ffff81020441b6c0 315435004 C Bo:4:055:6 0 48 >
ffff8101f4405b40 315485076 C Bi:4:055:5 -2 0
ffff8101f4405b40 315485202 S Bi:4:055:5 -115 16384 <
ffff8101f4405b40 315537076 C Bi:4:055:5 -2 0
ffff8101f4405b40 315537137 S Bi:4:055:5 -115 16384 <
ffff8101f4405b40 315589078 C Bi:4:055:5 -2 0
ffff8101f4405b40 315589157 S Bi:4:055:5 -115 16384 <
ffff8101f4405b40 315641083 C Bi:4:055:5 -2 0
ffff8101f4405b40 315641132 S Bi:4:055:5 -115 16384 <
ffff8101f4405b40 315651079 C Bi:4:055:5 0 1527 = 7eff0300 21450005 dce4a000 00c6068b 60451175 cf19e0aa 5a0050c5 8f9ab327
ffff8101f4405b40 315654657 S Bi:4:055:5 -115 16384 <
ffff8101f4405b40 315709085 C Bi:4:055:5 -2 0
ffff8101f4405b40 315709436 S Bi:4:055:5 -115 16384 <
ffff81020441b840 315709786 S Bo:4:055:6 -115 48 = 7eff0300 21450000 2870c940 0040064a ec19e0aa 5a451175 cfc58f00 50e92f80
ffff81020441b840 315710018 C Bo:4:055:6 0 48 >
ffff8101f4405b40 315761089 C Bi:4:055:5 -2 0
ffff8101f4405b40 315761192 S Bi:4:055:5 -115 16384 <
ffff8101f4405b40 315813090 C Bi:4:055:5 -2 0
ffff8101f4405b40 315813177 S Bi:4:055:5 -115 16384 <
ffff8101f4405b40 315863096 C Bi:4:055:5 0 1521 = 7eff0300 21450005 dce5f800 00c6068a 08451175 cf19e0aa 5a0050c5 8f9ab32d
ffff8101f4405b40 315866608 S Bi:4:055:5 -115 16384 <
ffff8101f4405b40 315869088 C Bi:4:055:5 0 1529 = 7eff0300 21450005 dce5fc00 00c6068a 04451175 cf19e0aa 5a0050c5 8f9ab332
ffff8101f4405b40 315874560 S Bi:4:055:5 -115 16384 <
ffff8101f4405b40 315876091 C Bi:4:055:5 0 1038 = 7eff0300 21450005 dce74c00 00c60688 b4451175 cf19e0aa 5a0050c5 8f9ab338
ffff8101f4405b40 315877874 S Bi:4:055:5 -115 16384 <
ffff8101f4405b40 315879088 C Bi:4:055:5 0 480 = cab8b333 960f17c3 b4f3de2a 5573ac3c f139761f 3cc5e21e 172bca6b cb0f2cc2
ffff8101f4405b40 315879881 S Bi:4:055:5 -115 16384 <
ffff8101f4405b40 315933097 C Bi:4:055:5 -2 0
ffff81020441b6c0 315933994 S Bo:4:055:6 -115 48 = 7eff0300 21450000 2870ca40 0040064a eb19e0aa 5a451175 cfc58f00 50e92f80
ffff8101f4405b40 315934180 S Bi:4:055:5 -115 16384 <
ffff81020441b6c0 315935034 C Bo:4:055:6 0 48 >
ffff81020441b840 315937350 S Bo:4:055:6 -115 95 = 7eff0300 21450000 2870cb40 0040064a ea19e0aa 5a451175 cfc58f00 50e92f80
ffff81020441b840 315938030 C Bo:4:055:6 0 95 >
ffff8101f4405b40 315989100 C Bi:4:055:5 -2 0
ffff8101f4405b40 315989229 S Bi:4:055:5 -115 16384 <
ffff8101f4405b40 315997099 C Bi:4:055:5 0 1520 = 7eff0300 21450005 dcf22000 00c6067d 5de04511 75cf19e0 aa5a0050 c58f9ab3
ffff8101f4405b40 316002555 S Bi:4:055:5 -115 16384 <
ffff8101f4405b40 316039103 C Bi:4:055:5 0 1526 = 7eff0300 21450005 dcf22400 00c6067d 5ddc4511 75cf19e0 aa5a0050 c58f9ab3
ffff8101f4405b40 316042551 S Bi:4:055:5 -115 16384 <
ffff8101f4405b40 316098109 C Bi:4:055:5 -2 0
ffff81020441b840 316098923 S Bo:4:055:6 -115 48 = 7eff0300 21450000 2870cd40 0040064a e819e0aa 5a451175 cfc58f00 50e92f80
ffff81020441b840 316099039 C Bo:4:055:6 0 48 >
ffff81020441b840 316099591 S Bo:4:055:6 -115 48 = 7eff0300 21450000 2870ce40 0040064a e719e0aa 5a451175 cfc58f00 50e92f80
ffff8101f4405b40 316100019 S Bi:4:055:5 -115 16384 <
ffff81020441b840 316100070 C Bo:4:055:6 0 48 >
ffff8101f4405b40 316153108 C Bi:4:055:5 -2 0
ffff8101f4405b40 316153253 S Bi:4:055:5 -115 16384 <
ffff8101f4405b40 316190109 C Bi:4:055:5 0 1521 = 7eff0300 21450005 dcfbe400 00c60674 1c451175 cf19e0aa 5a0050c5 8f9ab349
ffff8101f4405b40 316196078 S Bi:4:055:5 -115 16384 <
ffff8101f4405b40 316249113 C Bi:4:055:5 -2 0
ffff81020441b9c0 316249725 S Bo:4:055:6 -115 48 = 7eff0300 21450000 2870cf40 0040064a e619e0aa 5a451175 cfc58f00 50e92f80
ffff81020441b9c0 316250046 C Bo:4:055:6 0 48 >
ffff8101f4405b40 316250345 S Bi:4:055:5 -115 16384 <
ffff8101f4405b40 316279116 C Bi:4:055:5 0 1530 = 7eff0300 21450005 dcfc7400 00c60673 8c451175 cf19e0aa 5a0050c5 8f9ab34f
ffff8101f4405b40 316282980 S Bi:4:055:5 -115 16384 <
ffff8101f4405b40 316334118 C Bi:4:055:5 -2 0
ffff81020441bb40 316334743 S Bo:4:055:6 -115 48 = 7eff0300 21450000 2870d040 0040064a e519e0aa 5a451175 cfc58f00 50e92f80
ffff81020441bb40 316335051 C Bo:4:055:6 0 48 >
ffff8101f4405b40 316335375 S Bi:4:055:5 -115 16384 <
ffff8101f4405b40 316357119 C Bi:4:055:5 0 1521 = 7eff0300 21450005 dcfc7c00 00c60673 84451175 cf19e0aa 5a0050c5 8f9ab355
ffff8101f4405b40 316363280 S Bi:4:055:5 -115 16384 <
ffff8101f4405b40 316400121 C Bi:4:055:5 0 1523 = 7eff0300 21450005 dc027c00 00c6066d 85451175 cf19e0aa 5a0050c5 8f9ab35a
ffff8101f4405b40 316403071 S Bi:4:055:5 -115 16384 <
ffff8101f4405b40 316454124 C Bi:4:055:5 0 1518 = 7eff0300 21450005 dc028000 00c6066d 81451175 cf19e0aa 5a0050c5 8f9ab360
ffff8101f4734300 316458911 S Bi:4:055:5 -115 16384 <
ffff8101f4734300 316513127 C Bi:4:055:5 -2 448 = 7eff0300 21450005 dc028400 00c6066d 7d5d4511 75cf19e0 aa5a0050 c58f9ab3
ffff81020441b600 316514086 S Bo:4:055:6 -115 48 = 7eff0300 21450000 2870d140 0040064a e419e0aa 5a451175 cfc58f00 50e92f80
ffff81020441b600 316515060 C Bo:4:055:6 0 48 >
ffff81020441b600 316515253 S Bo:4:055:6 -115 48 = 7eff0300 21450000 2870d240 0040064a e319e0aa 5a451175 cfc58f00 50e92f80
ffff8101f4734300 316515905 S Bi:4:055:5 -115 16384 <
ffff81020441b600 316516062 C Bo:4:055:6 0 48 >
ffff8101f4734300 316517125 C Bi:4:055:5 0 1081 = 67fc4b8c cb71785c 9f238578 e7557174 71385c06 698bce78 878e3051 abc52a1f
ffff81020441b540 316517329 S Bo:4:055:6 -115 48 = 7eff0300 21450000 2870d340 0040064a e219e0aa 5a451175 cfc58f00 50e92f80
ffff81020441b540 316518061 C Bo:4:055:6 0 48 >
ffff8101f4734780 316523201 S Bi:4:055:5 -115 16384 <
ffff8101f4734780 316576129 C Bi:4:055:5 -2 0
ffff8102139b80c0 316576464 S Bi:4:055:5 -115 16384 <
ffff8102139b80c0 316579128 C Bi:4:055:5 0 1522 = 7eff0300 21450005 dc068800 00c60669 79451175 cf19e0aa 5a0050c5 8f9ab36b
ffff81020441b540 316581677 S Bi:4:055:5 -115 16384 <
ffff81020441b540 316633139 C Bi:4:055:5 0 1521 = 7eff0300 21450005 dc0ae000 00c60665 21451175 cf19e0aa 5a0050c5 8f9ab371
ffff81020441b540 316638156 S Bi:4:055:5 -115 16384 <
ffff81020441b540 316692135 C Bi:4:055:5 -2 0
ffff81020441b540 316692877 S Bo:4:055:6 -115 60 = 7eff0300 21450000 3470d440 0040064a d519e0aa 5a451175 cfc58f00 50e92f80
ffff81020441bb40 316692966 S Bi:4:055:5 -115 16384 <
ffff81020441b540 316693071 C Bo:4:055:6 0 60 >
ffff81020441b540 316693358 S Bo:4:055:6 -115 60 = 7eff0300 21450000 3470d540 0040064a d419e0aa 5a451175 cfc58f00 50e92f80
ffff81020441b540 316694071 C Bo:4:055:6 0 60 >
ffff81020441bb40 316744135 C Bi:4:055:5 -2 0
ffff81020441bb40 316744237 S Bi:4:055:5 -115 16384 <
ffff81020441bb40 316790141 C Bi:4:055:5 0 1521 = 7eff0300 21450005 dc129400 00c6065d 6d451175 cf19e0aa 5a0050c5 8f9ab377
ffff81020441bb40 316792680 S Bi:4:055:5 -115 16384 <
ffff81020441bb40 316844144 C Bi:4:055:5 -2 0
ffff81020441bb40 316844725 S Bo:4:055:6 -115 61 = 7eff0300 21450000 3470d640 0040064a d319e0aa 5a451175 cfc58f00 50e92f80
ffff81020441b840 316844782 S Bi:4:055:5 -115 16384 <
ffff81020441bb40 316845080 C Bo:4:055:6 0 61 >
ffff81020441b840 316850143 C Bi:4:055:5 0 1522 = 7eff0300 21450005 dc129800 00c6065d 69451175 cf19e0aa 5a0050c5 8f9ab37d
ffff81020441b840 316852752 S Bi:4:055:5 -115 16384 <
ffff81020441b840 316908148 C Bi:4:055:5 -2 0
ffff81020441b840 316908769 S Bo:4:055:6 -115 60 = 7eff0300 21450000 3470d740 0040064a d219e0aa 5a451175 cfc58f00 50e92f80
ffff81020441bb40 316908823 S Bi:4:055:5 -115 16384 <
ffff81020441b840 316909083 C Bo:4:055:6 0 60 >
ffff81020441bb40 316938153 C Bi:4:055:5 0 1527 = 7eff0300 21450005 dc135000 00c6065c b1451175 cf19e0aa 5a0050c5 8f9ab382
ffff81020441bb40 316940735 S Bi:4:055:5 -115 16384 <
ffff81020441bb40 316992149 C Bi:4:055:5 -2 0
ffff81020441bb40 316992703 S Bo:4:055:6 -115 60 = 7eff0300 21450000 3470d840 0040064a d119e0aa 5a451175 cfc58f00 50e92f80
ffff81020441b840 316992758 S Bi:4:055:5 -115 16384 <
ffff81020441bb40 316993088 C Bo:4:055:6 0 60 >
ffff81020441b840 317044155 C Bi:4:055:5 -2 0
ffff81020441b840 317044246 S Bi:4:055:5 -115 16384 <
ffff81020441b840 317092156 C Bi:4:055:5 0 1526 = 7eff0300 21450005 dc1ac400 00c60655 3d451175 cf19e0aa 5a0050c5 8f9ab388
ffff81020441b840 317095179 S Bi:4:055:5 -115 16384 <
ffff81020441b840 317097155 C Bi:4:055:5 0 1528 = 7eff0300 21450005 dc1ac800 00c60655 39451175 cf19e0aa 5a0050c5 8f9ab366
ffff81020441b840 317099619 S Bi:4:055:5 -115 16384 <
ffff81020441b840 317152159 C Bi:4:055:5 -2 0
ffff81020441b840 317152869 S Bo:4:055:6 -115 60 = 7eff0300 21450000 3470d940 0040064a d019e0aa 5a451175 cfc58f00 50e92f80
ffff81020441b600 317152966 S Bi:4:055:5 -115 16384 <
ffff81020441b840 317153098 C Bo:4:055:6 0 60 >
ffff81020441b840 317153286 S Bo:4:055:6 -115 48 = 7eff0300 21450000 2870da40 0040064a db19e0aa 5a451175 cfc58f00 50e92f80
ffff81020441b840 317154097 C Bo:4:055:6 0 48 >
ffff81020441b600 317204163 C Bi:4:055:5 -2 0
ffff81020441b600 317204278 S Bi:4:055:5 -115 16384 <
ffff81020441b600 317256166 C Bi:4:055:5 -2 0
ffff81020441b600 317256249 S Bi:4:055:5 -115 16384 <
ffff81020441b600 317308164 C Bi:4:055:5 -2 0
ffff81020441b600 317308225 S Bi:4:055:5 -115 16384 <
ffff81020441b600 317360177 C Bi:4:055:5 -2 0
ffff81020441b600 317360321 S Bi:4:055:5 -115 16384 <
ffff8101ef1153c0 317360463 S Bo:4:055:10 -115 31 = 55534243 56060000 00000000 00000600 00000000 00000000 00000000 000000
ffff8101ef1153c0 317361108 C Bo:4:055:10 0 31 >
ffff8101ef1153c0 317361114 S Bi:4:055:9 -115 13 <
ffff8101ef1153c0 317362108 C Bi:4:055:9 0 13 = 55534253 56060000 00000000 01
ffff8101ef1153c0 317362114 S Bo:4:055:10 -115 31 = 55534243 57060000 12000000 80000603 00000012 00000000 00000000 000000
ffff8101ef1153c0 317363107 C Bo:4:055:10 0 31 >
ffff81020441b540 317363115 S Bi:4:055:9 -115 18 <
ffff81020441b540 317364108 C Bi:4:055:9 0 18 = 70000200 0000000a 00000000 3a000000 0000
ffff8101ef1153c0 317364115 S Bi:4:055:9 -115 13 <
ffff8101ef1153c0 317365108 C Bi:4:055:9 0 13 = 55534253 57060000 00000000 00
ffff8101ef1153c0 317365140 S Bo:4:055:10 -115 31 = 55534243 58060000 00000000 00000600 00000000 00000000 00000000 000000
ffff8101ef1153c0 317366108 C Bo:4:055:10 0 31 >
ffff8101ef1153c0 317366113 S Bi:4:055:9 -115 13 <
ffff8101ef1153c0 317367107 C Bi:4:055:9 0 13 = 55534253 58060000 00000000 01
ffff8101ef1153c0 317367114 S Bo:4:055:10 -115 31 = 55534243 59060000 12000000 80000603 00000012 00000000 00000000 000000
ffff8101ef1153c0 317368107 C Bo:4:055:10 0 31 >
ffff81020441b540 317368114 S Bi:4:055:9 -115 18 <
ffff81020441b540 317369108 C Bi:4:055:9 0 18 = 70000200 0000000a 00000000 3a000000 0000
ffff8101ef1153c0 317369115 S Bi:4:055:9 -115 13 <
ffff8101ef1153c0 317370107 C Bi:4:055:9 0 13 = 55534253 59060000 00000000 00
ffff81020441b600 317415173 C Bi:4:055:5 -2 0
ffff81020441b600 317415260 S Bi:4:055:5 -115 16384 <
ffff81020441b600 317468179 C Bi:4:055:5 -2 0
ffff81020441b600 317468303 S Bi:4:055:5 -115 16384 <
ffff81020441b600 317520182 C Bi:4:055:5 -2 0
ffff81020441b600 317520304 S Bi:4:055:5 -115 16384 <
ffff81020441b600 317539185 C Bi:4:055:5 0 1521 = 7eff0300 21450005 dc334000 00c6063c c1451175 cf19e0aa 5a0050c5 8f9ab38e
ffff81019bfb5c00 317542828 S Bi:4:055:5 -115 16384 <
ffff81019bfb5c00 317597189 C Bi:4:055:5 -2 0
ffff81020441b6c0 317597805 S Bo:4:055:6 -115 48 = 7eff0300 21450000 2870db40 0040064a da19e0aa 5a451175 cfc58f00 50e92f80
ffff81019bfb5c00 317598002 S Bi:4:055:5 -115 16384 <
ffff81020441b6c0 317598123 C Bo:4:055:6 0 48 >
ffff81019bfb5c00 317649194 C Bi:4:055:5 -2 0
ffff81019bfb5c00 317649329 S Bi:4:055:5 -115 16384 <
ffff81019bfb5c00 317701195 C Bi:4:055:5 -2 0
ffff81019bfb5c00 317701304 S Bi:4:055:5 -115 16384 <
ffff81019bfb5c00 317753197 C Bi:4:055:5 -2 0
ffff81019bfb5c00 317753256 S Bi:4:055:5 -115 16384 <
ffff81019bfb5c00 317805199 C Bi:4:055:5 -2 0
ffff81019bfb5c00 317805286 S Bi:4:055:5 -115 16384 <
ffff81019bfb5c00 317857206 C Bi:4:055:5 -2 0
ffff81019bfb5c00 317857268 S Bi:4:055:5 -115 16384 <
ffff81019bfb5c00 317898206 C Bi:4:055:5 0 1521 = 7eff0300 21450005 dc42c800 00c6062d 39451175 cf19e0aa 5a0050c5 8f9ab393
ffff81019bfb5c00 317902913 S Bi:4:055:5 -115 16384 <
ffff81019bfb5c00 317957208 C Bi:4:055:5 -2 0
ffff81020441b6c0 317957806 S Bo:4:055:6 -115 48 = 7eff0300 21450000 2870dc40 0040064a d919e0aa 5a451175 cfc58f00 50e92f80
ffff81019bfb5c00 317958027 S Bi:4:055:5 -115 16384 <
ffff81020441b6c0 317958143 C Bo:4:055:6 0 48 >
ffff81019bfb5c00 317960204 C Bi:4:055:5 0 1527 = 7eff0300 21450005 dc42cc00 00c6062d 35451175 cf19e0aa 5a0050c5 8f9ab399
ffff81019bfb5c00 317966773 S Bi:4:055:5 -115 16384 <
ffff81019bfb5c00 318014214 C Bi:4:055:5 0 1522 = 7eff0300 21450005 dc42d000 00c6062d 31451175 cf19e0aa 5a0050c5 8f9ab39f
ffff81019bfb5c00 318019020 S Bi:4:055:5 -115 16384 <
ffff81019bfb5c00 318073215 C Bi:4:055:5 -2 0
ffff81020441b840 318073960 S Bo:4:055:6 -115 48 = 7eff0300 21450000 2870dd40 0040064a d819e0aa 5a451175 cfc58f00 50e92f80
ffff81020441b840 318074148 C Bo:4:055:6 0 48 >
ffff81020441b840 318074394 S Bo:4:055:6 -115 48 = 7eff0300 21450000 2870de40 0040064a d719e0aa 5a451175 cfc58f00 50e92f80
ffff81019bfb5c00 318074440 S Bi:4:055:5 -115 16384 <
ffff81020441b840 318075153 C Bo:4:055:6 0 48 >
ffff81019bfb5c00 318129217 C Bi:4:055:5 -2 0
ffff81019bfb5c00 318129362 S Bi:4:055:5 -115 16384 <
ffff81019bfb5c00 318181221 C Bi:4:055:5 -2 0
ffff81019bfb5c00 318181331 S Bi:4:055:5 -115 16384 <
ffff81019bfb5c00 318233227 C Bi:4:055:5 -2 0
ffff81019bfb5c00 318233316 S Bi:4:055:5 -115 16384 <
ffff81019bfb5c00 318272226 C Bi:4:055:5 0 1532 = 7eff0300 21450005 dc571400 00c60618 ed451175 cf19e0aa 5a0050c5 8f9ab3a5
ffff81019bfb5c00 318278780 S Bi:4:055:5 -115 16384 <
ffff81019bfb5c00 318333231 C Bi:4:055:5 -2 0
ffff81020441b840 318333832 S Bo:4:055:6 -115 48 = 7eff0300 21450000 2870df40 0040064a d619e0aa 5a451175 cfc58f00 50e92f80
ffff81019bfb5c00 318334056 S Bi:4:055:5 -115 16384 <
ffff81020441b840 318334164 C Bo:4:055:6 0 48 >
ffff81019bfb5c00 318385235 C Bi:4:055:5 -2 0
ffff81019bfb5c00 318385368 S Bi:4:055:5 -115 16384 <
ffff81019bfb5c00 318437234 C Bi:4:055:5 -2 0
ffff81019bfb5c00 318437326 S Bi:4:055:5 -115 16384 <
ffff81019bfb5c00 318489237 C Bi:4:055:5 -2 0
ffff81019bfb5c00 318489353 S Bi:4:055:5 -115 16384 <
ffff81019bfb5c00 318493236 C Bi:4:055:5 0 1530 = 7eff0300 21450005 dc5d7800 00c60612 89451175 cf19e0aa 5a0050c5 8f9ab3aa
ffff81019bfb5c00 318498664 S Bi:4:055:5 -115 16384 <
ffff81019bfb5c00 318553241 C Bi:4:055:5 -2 0
ffff81020441b780 318553841 S Bo:4:055:6 -115 48 = 7eff0300 21450000 2870e040 0040064a d519e0aa 5a451175 cfc58f00 50e92f80
ffff81019bfb5c00 318554067 S Bi:4:055:5 -115 16384 <
ffff81020441b780 318554175 C Bo:4:055:6 0 48 >
ffff81019bfb5c00 318605244 C Bi:4:055:5 -2 0
ffff81019bfb5c00 318605376 S Bi:4:055:5 -115 16384 <
ffff81019bfb5c00 318657247 C Bi:4:055:5 -2 0
ffff81019bfb5c00 318657368 S Bi:4:055:5 -115 16384 <
ffff81019bfb5c00 318680248 C Bi:4:055:5 0 1527 = 7eff0300 21450005 dc65ec00 00c6060a 15451175 cf19e0aa 5a0050c5 8f9ab3b0
ffff81019bfb5c00 318686625 S Bi:4:055:5 -115 16384 <
ffff81019bfb5c00 318733252 C Bi:4:055:5 0 1520 = 7eff0300 21450005 dc65f000 00c6060a 11451175 cf19e0aa 5a0050c5 8f9ab3b6
ffff81019bfb5c00 318738943 S Bi:4:055:5 -115 16384 <
ffff81019bfb5c00 318793254 C Bi:4:055:5 -2 0
ffff81019bfb5c00 318793773 S Bi:4:055:5 -115 16384 <
ffff81020441b540 318794128 S Bo:4:055:6 -115 48 = 7eff0300 21450000 2870e140 0040064a d419e0aa 5a451175 cfc58f00 50e92f80
ffff81020441b540 318795189 C Bo:4:055:6 0 48 >
ffff81020441b600 318795871 S Bo:4:055:6 -115 48 = 7eff0300 21450000 2870e240 0040064a d319e0aa 5a451175 cfc58f00 50e92f80
ffff81020441b600 318796189 C Bo:4:055:6 0 48 >
ffff81019bfb5c00 318845259 C Bi:4:055:5 -2 0
ffff81019bfb5c00 318845401 S Bi:4:055:5 -115 16384 <
ffff81019bfb5c00 318877262 C Bi:4:055:5 0 1522 = 7eff0300 21450005 dc703c00 00c606ff c4451175 cf19e0aa 5a0050c5 8f9ab3bb
ffff81019bfb5c00 318882804 S Bi:4:055:5 -115 16384 <
ffff81019bfb5c00 318937266 C Bi:4:055:5 -2 1344 = 7eff0300 21450005 dc704000 00c606ff c0451175 cf19e0aa 5a0050c5 8f9ab3c1
ffff81019bfb5c00 318937598 S Bi:4:055:5 -115 16384 <
ffff81020441b780 318937953 S Bo:4:055:6 -115 48 = 7eff0300 21450000 2870e340 0040064a d219e0aa 5a451175 cfc58f00 50e92f80
ffff81019bfb5c00 318938261 C Bi:4:055:5 0 175 = c2aca717 431981c3 d1ccf29c 051cfab6 06be6592 62787f38 cb786b36 cd73ec16
ffff81020441b780 318938268 C Bo:4:055:6 0 48 >
ffff81019bfb5c00 318938713 S Bi:4:055:5 -115 16384 <
ffff81019bfb5c00 318992272 C Bi:4:055:5 0 1522 = 7eff0300 21450005 dc70e400 00c606ff 1c451175 cf19e0aa 5a0050c5 8f9ab3c7
ffff81019bfb5c00 318992476 S Bi:4:055:5 -115 16384 <
ffff81019bfb5c00 319045270 C Bi:4:055:5 -2 0
ffff81019bfb5c00 319045335 S Bi:4:055:5 -115 16384 <
ffff81019bfb5c00 319097272 C Bi:4:055:5 -2 0
ffff81019bfb5c00 319097369 S Bi:4:055:5 -115 16384 <
ffff81019bfb5c00 319099266 C Bi:4:055:5 0 1524 = 7eff0300 21450005 dc7b4400 00c606f4 bc451175 cf19e0aa 5a0050c5 8f9ab3cc
ffff81019bfb5c00 319101787 S Bi:4:055:5 -115 16384 <
ffff81019bfb5c00 319153275 C Bi:4:055:5 -2 0
ffff81019bfb5c00 319153573 S Bi:4:055:5 -115 16384 <
ffff81020441b780 319153929 S Bo:4:055:6 -115 60 = 7eff0300 21450000 3470e440 0040064a c519e0aa 5a451175 cfc58f00 50e92f80
ffff81020441b780 319154208 C Bo:4:055:6 0 60 >
ffff81019bfb5c00 319177275 C Bi:4:055:5 0 1525 = 7eff0300 21450005 dc7b4c00 00c606f4 b4451175 cf19e0aa 5a0050c5 8f9ab3d2
ffff81019bfb5c00 319183119 S Bi:4:055:5 -115 16384 <
ffff81019bfb5c00 319237281 C Bi:4:055:5 -2 0
ffff81019bfb5c00 319237642 S Bi:4:055:5 -115 16384 <
ffff81020441b540 319238011 S Bo:4:055:6 -115 60 = 7eff0300 21450000 3470e540 0040064a c419e0aa 5a451175 cfc58f00 50e92f80
ffff81020441b540 319238212 C Bo:4:055:6 0 60 >
ffff81019bfb5c00 319289282 C Bi:4:055:5 -2 0
ffff81019bfb5c00 319289409 S Bi:4:055:5 -115 16384 <
ffff81019bfb5c00 319341287 C Bi:4:055:5 -2 0
ffff81019bfb5c00 319341398 S Bi:4:055:5 -115 16384 <
ffff8101ef1153c0 319363674 S Bo:4:055:10 -115 31 = 55534243 5a060000 00000000 00000600 00000000 00000000 00000000 000000
ffff8101ef1153c0 319364220 C Bo:4:055:10 0 31 >
ffff8101ef1153c0 319364227 S Bi:4:055:9 -115 13 <
ffff8101ef1153c0 319365219 C Bi:4:055:9 0 13 = 55534253 5a060000 00000000 01
ffff8101ef1153c0 319365226 S Bo:4:055:10 -115 31 = 55534243 5b060000 12000000 80000603 00000012 00000000 00000000 000000
ffff8101ef1153c0 319366222 C Bo:4:055:10 0 31 >
ffff81020441b840 319366230 S Bi:4:055:9 -115 18 <
ffff81019bfb5c00 319367281 C Bi:4:055:5 0 1527 = 7eff0300 21450005 dc81f000 00c606ee 10451175 cf19e0aa 5a0050c5 8f9ab3d8
ffff81020441b840 319367286 C Bi:4:055:9 0 18 = 70000200 0000000a 00000000 3a000000 0000
ffff8101ef1153c0 319367293 S Bi:4:055:9 -115 13 <
ffff8101ef1153c0 319368220 C Bi:4:055:9 0 13 = 55534253 5b060000 00000000 00
ffff8101ef1153c0 319368255 S Bo:4:055:10 -115 31 = 55534243 5c060000 00000000 00000600 00000000 00000000 00000000 000000
ffff8101ef1153c0 319369218 C Bo:4:055:10 0 31 >
ffff8101ef1153c0 319369224 S Bi:4:055:9 -115 13 <
ffff8101ef1153c0 319370219 C Bi:4:055:9 0 13 = 55534253 5c060000 00000000 01
ffff8101ef1153c0 319370225 S Bo:4:055:10 -115 31 = 55534243 5d060000 12000000 80000603 00000012 00000000 00000000 000000
ffff81019bfb5c00 319370660 S Bi:4:055:5 -115 16384 <
ffff8101ef1153c0 319371219 C Bo:4:055:10 0 31 >
ffff81020441b840 319371227 S Bi:4:055:9 -115 18 <
ffff81020441b840 319372220 C Bi:4:055:9 0 18 = 70000200 0000000a 00000000 3a000000 0000
ffff8101ef1153c0 319372227 S Bi:4:055:9 -115 13 <
ffff8101ef1153c0 319373219 C Bi:4:055:9 0 13 = 55534253 5d060000 00000000 00
ffff81019bfb5c00 319429293 C Bi:4:055:5 -2 256 = 7eff0300 21450005 dc8dc400 00c606e2 3c451175 cf19e0aa 5a0050c5 8f9ab3c1
ffff81020441b540 319429671 S Bi:4:055:5 -115 16384 <
ffff81020441b840 319429966 S Bo:4:055:6 -115 60 = 7eff0300 21450000 3470e640 0040064a c319e0aa 5a451175 cfc58f00 50e92f80
ffff81020441b840 319430227 C Bo:4:055:6 0 60 >
ffff81020441b540 319431285 C Bi:4:055:5 0 1263 = 65a8fc6b f11cf69f 0c359f11 e95ff0b6 20f89f71 e11f3f8b 388b31c4 e5198633
ffff81020441b540 319433437 S Bi:4:055:5 -115 16384 <
ffff81020441b840 319439874 S Bo:4:055:6 -115 60 = 7eff0300 21450000 34465240 00400669 d00a0a01 c3d155ad 7f9ddb00 50cdbabb
ffff81020441b840 319440225 C Bo:4:055:6 0 60 >
ffff81020441b540 319484298 C Bi:4:055:5 -2 0
ffff81020441b540 319484655 S Bi:4:055:5 -115 16384 <
ffff81020441b540 319514293 C Bi:4:055:5 0 1522 = 7eff0300 21450005 dc8dc800 00c606e2 38451175 cf19e0aa 5a0050c5 8f9ab3c7
ffff81020441b540 319518122 S Bi:4:055:5 -115 16384 <
ffff81020441b540 319572297 C Bi:4:055:5 -2 0
ffff81020441b540 319572662 S Bi:4:055:5 -115 16384 <
ffff81020441b840 319572959 S Bo:4:055:6 -115 60 = 7eff0300 21450000 3470e740 0040064a c219e0aa 5a451175 cfc58f00 50e92f80
ffff81020441b840 319573232 C Bo:4:055:6 0 60 >
ffff81020441b540 319624306 C Bi:4:055:5 -2 0
ffff81020441b540 319624471 S Bi:4:055:5 -115 16384 <
ffff81020441b540 319676311 C Bi:4:055:5 -2 0
ffff810137f5fcc0 319676448 S Bi:4:055:5 -115 16384 <
ffff810137f5fcc0 319728311 C Bi:4:055:5 -2 0
ffff810137f5fcc0 319728433 S Bi:4:055:5 -115 16384 <
ffff810137f5fcc0 319780306 C Bi:4:055:5 -2 0
ffff810137f5fcc0 319780398 S Bi:4:055:5 -115 16384 <
ffff810137f5fcc0 319832312 C Bi:4:055:5 -2 0
ffff810137f5fcc0 319832425 S Bi:4:055:5 -115 16384 <
ffff810137f5fcc0 319851313 C Bi:4:055:5 0 1528 = 7eff0300 21450005 dca0cc00 00c606cf 34451175 cf19e0aa 5a0050c5 8f9ab3de
ffff810137f5fcc0 319854646 S Bi:4:055:5 -115 16384 <
ffff810137f5fcc0 319909316 C Bi:4:055:5 -2 0
ffff810137f5fcc0 319909663 S Bi:4:055:5 -115 16384 <
ffff81020441b780 319910024 S Bo:4:055:6 -115 60 = 7eff0300 21450000 3470e840 0040064a c119e0aa 5a451175 cfc58f00 50e92f80
ffff81020441b780 319910250 C Bo:4:055:6 0 60 >
ffff810137f5fcc0 319960316 C Bi:4:055:5 -2 0
ffff810137f5fcc0 319960447 S Bi:4:055:5 -115 16384 <
ffff810137f5fcc0 320012321 C Bi:4:055:5 -2 0
ffff810137f5fcc0 320012426 S Bi:4:055:5 -115 16384 <
ffff810137f5fcc0 320064327 C Bi:4:055:5 -2 0
ffff810137f5fcc0 320064419 S Bi:4:055:5 -115 16384 <
ffff810137f5fcc0 320116326 C Bi:4:055:5 -2 0
ffff810137f5fcc0 320116432 S Bi:4:055:5 -115 16384 <
ffff810137f5fcc0 320168327 C Bi:4:055:5 -2 0
ffff810137f5fcc0 320168432 S Bi:4:055:5 -115 16384 <
ffff810137f5fcc0 320178330 C Bi:4:055:5 0 1534 = 7eff0300 21450005 dcad6400 00c606c2 9c451175 cf19e0aa 5a0050c5 8f9ab3e3
ffff810137f5fcc0 320182664 S Bi:4:055:5 -115 16384 <
ffff810137f5fcc0 320236336 C Bi:4:055:5 -2 0
ffff810137f5fcc0 320236690 S Bi:4:055:5 -115 16384 <
ffff81020441b780 320237042 S Bo:4:055:6 -115 60 = 7eff0300 21450000 3470e940 0040064a c019e0aa 5a451175 cfc58f00 50e92f80
ffff81020441b780 320237268 C Bo:4:055:6 0 60 >
ffff810137f5fcc0 320288333 C Bi:4:055:5 -2 0
ffff810137f5fcc0 320288457 S Bi:4:055:5 -115 16384 <
ffff810137f5fcc0 320340344 C Bi:4:055:5 -2 0
ffff810137f5fcc0 320340470 S Bi:4:055:5 -115 16384 <
ffff810137f5fcc0 320392343 C Bi:4:055:5 -2 0
ffff810137f5fcc0 320392441 S Bi:4:055:5 -115 16384 <
ffff810137f5fcc0 320444343 C Bi:4:055:5 -2 0
ffff810137f5fcc0 320444447 S Bi:4:055:5 -115 16384 <
ffff810137f5fcc0 320496347 C Bi:4:055:5 -2 0
ffff810137f5fcc0 320496459 S Bi:4:055:5 -115 16384 <
ffff810137f5fcc0 320538351 C Bi:4:055:5 0 1519 = 7eff0300 21450005 dcc15c00 00c606ae a4451175 cf19e0aa 5a0050c5 8f9ab3c1
ffff810137f5fcc0 320543010 S Bi:4:055:5 -115 16384 <
ffff810137f5fcc0 320594353 C Bi:4:055:5 0 1523 = 7eff0300 21450005 dcc16000 00c606ae a0451175 cf19e0aa 5a0050c5 8f9ab3e9
ffff810137f5fcc0 320598849 S Bi:4:055:5 -115 16384 <
ffff810137f5fcc0 320652354 C Bi:4:055:5 -2 0
ffff810137f5fcc0 320652870 S Bi:4:055:5 -115 16384 <
ffff81020441b600 320653229 S Bo:4:055:6 -115 48 = 7eff0300 21450000 2870ea40 0040064a cb19e0aa 5a451175 cfc58f00 50e92f80
ffff81020441b600 320654290 C Bo:4:055:6 0 48 >
ffff81020441b600 320654469 S Bo:4:055:6 -115 48 = 7eff0300 21450000 2870eb40 0040064a ca19e0aa 5a451175 cfc58f00 50e92f80
ffff81020441b600 320655291 C Bo:4:055:6 0 48 >
ffff810137f5fcc0 320704360 C Bi:4:055:5 -2 0
ffff810137f5fcc0 320704502 S Bi:4:055:5 -115 16384 <
ffff810137f5fcc0 320756364 C Bi:4:055:5 -2 0
ffff810137f5fcc0 320756453 S Bi:4:055:5 -115 16384 <
ffff810137f5fcc0 320808366 C Bi:4:055:5 -2 0
ffff810137f5fcc0 320808454 S Bi:4:055:5 -115 16384 <
ffff810137f5fcc0 320860372 C Bi:4:055:5 -2 0
ffff810137f5fcc0 320860445 S Bi:4:055:5 -115 16384 <
ffff810137f5fcc0 320912372 C Bi:4:055:5 -2 0
ffff810137f5fcc0 320912476 S Bi:4:055:5 -115 16384 <
ffff810137f5fcc0 320958376 C Bi:4:055:5 0 1523 = 7eff0300 21450005 dcd4d000 00c6069b 30451175 cf19e0aa 5a0050c5 8f9ab3ef
ffff810137f5fcc0 320962628 S Bi:4:055:5 -115 16384 <
ffff810137f5fcc0 321016378 C Bi:4:055:5 -2 0
ffff810137f5fcc0 321016700 S Bi:4:055:5 -115 16384 <
ffff81020441b540 321017061 S Bo:4:055:6 -115 48 = 7eff0300 21450000 2870ec40 0040064a c919e0aa 5a451175 cfc58f00 50e92f80
ffff81020441b540 321017312 C Bo:4:055:6 0 48 >
ffff810137f5fcc0 321032381 C Bi:4:055:5 0 1524 = 7eff0300 21450005 dcd4d400 00c6069b 2c451175 cf19e0aa 5a0050c5 8f9ab3f4
ffff810137f5fcc0 321038986 S Bi:4:055:5 -115 16384 <
ffff810137f5fcc0 321092382 C Bi:4:055:5 -2 0
ffff810137f5fcc0 321092735 S Bi:4:055:5 -115 16384 <
ffff81020441b6c0 321093077 S Bo:4:055:6 -115 48 = 7eff0300 21450000 2870ed40 0040064a c819e0aa 5a451175 cfc58f00 50e92f80
ffff81020441b6c0 321093317 C Bo:4:055:6 0 48 >
ffff810137f5fcc0 321144382 C Bi:4:055:5 -2 0
ffff810137f5fcc0 321144509 S Bi:4:055:5 -115 16384 <
ffff810137f5fcc0 321196386 C Bi:4:055:5 -2 0
ffff810137f5fcc0 321196505 S Bi:4:055:5 -115 16384 <
ffff810137f5fcc0 321248387 C Bi:4:055:5 -2 0
ffff810137f5fcc0 321248498 S Bi:4:055:5 -115 16384 <
ffff810137f5fcc0 321291391 C Bi:4:055:5 0 1516 = 7eff0300 21450005 dcd4d800 00c6069b 28451175 cf19e0aa 5a0050c5 8f9ab3fa
ffff810137f5fcc0 321294793 S Bi:4:055:5 -115 16384 <
ffff810137f5fcc0 321318393 C Bi:4:055:5 0 1519 = 7eff0300 21450005 dce5d400 00c6068a 2c451175 cf19e0aa 5a0050c5 8f9ab400
ffff810137f5fcc0 321322791 S Bi:4:055:5 -115 16384 <
ffff8101ef1153c0 321363678 S Bo:4:055:10 -115 31 = 55534243 5e060000 00000000 00000600 00000000 00000000 00000000 000000
ffff8101ef1153c0 321364332 C Bo:4:055:10 0 31 >
ffff8101ef1153c0 321364339 S Bi:4:055:9 -115 13 <
ffff8101ef1153c0 321365331 C Bi:4:055:9 0 13 = 55534253 5e060000 00000000 01
ffff8101ef1153c0 321365338 S Bo:4:055:10 -115 31 = 55534243 5f060000 12000000 80000603 00000012 00000000 00000000 000000
ffff8101ef1153c0 321366330 C Bo:4:055:10 0 31 >
ffff81020441b6c0 321366339 S Bi:4:055:9 -115 18 <
ffff81020441b6c0 321367330 C Bi:4:055:9 0 18 = 70000200 0000000a 00000000 3a000000 0000
ffff8101ef1153c0 321367338 S Bi:4:055:9 -115 13 <
ffff8101ef1153c0 321368331 C Bi:4:055:9 0 13 = 55534253 5f060000 00000000 00
ffff8101ef1153c0 321368364 S Bo:4:055:10 -115 31 = 55534243 60060000 00000000 00000600 00000000 00000000 00000000 000000
ffff8101ef1153c0 321369331 C Bo:4:055:10 0 31 >
ffff8101ef1153c0 321369336 S Bi:4:055:9 -115 13 <
ffff8101ef1153c0 321372331 C Bi:4:055:9 0 13 = 55534253 60060000 00000000 01
ffff8101ef1153c0 321372337 S Bo:4:055:10 -115 31 = 55534243 61060000 12000000 80000603 00000012 00000000 00000000 000000
ffff8101ef1153c0 321373335 C Bo:4:055:10 0 31 >
ffff81020441b6c0 321373342 S Bi:4:055:9 -115 18 <
ffff810137f5fcc0 321374391 C Bi:4:055:5 0 1531 = 7eff0300 21450005 dcea1800 00c60685 e8451175 cf19e0aa 5a0050c5 8f9ab405
ffff81020441b6c0 321374396 C Bi:4:055:9 0 18 = 70000200 0000000a 00000000 3a000000 0000
ffff8101ef1153c0 321374402 S Bi:4:055:9 -115 13 <
ffff8101ef1153c0 321375331 C Bi:4:055:9 0 13 = 55534253 61060000 00000000 00
ffff810137f5fcc0 321378797 S Bi:4:055:5 -115 16384 <
ffff810137f5fcc0 321432399 C Bi:4:055:5 -2 0
ffff810137f5fcc0 321433082 S Bi:4:055:5 -115 16384 <
ffff81020441b540 321433476 S Bo:4:055:6 -115 48 = 7eff0300 21450000 2870ee40 0040064a c719e0aa 5a451175 cfc58f00 50e92f80
ffff81020441b540 321434334 C Bo:4:055:6 0 48 >
ffff81020441b6c0 321436585 S Bo:4:055:6 -115 95 = 7eff0300 21450000 2870ef40 0040064a c619e0aa 5a451175 cfc58f00 50e92f80
ffff81020441b6c0 321437335 C Bo:4:055:6 0 95 >
ffff810137f5fcc0 321485402 C Bi:4:055:5 -2 0
ffff810137f5fcc0 321485550 S Bi:4:055:5 -115 16384 <
ffff810137f5fcc0 321536405 C Bi:4:055:5 -2 0
ffff810137f5fcc0 321536522 S Bi:4:055:5 -115 16384 <
ffff810137f5fcc0 321588408 C Bi:4:055:5 -2 0
ffff810137f5fcc0 321588502 S Bi:4:055:5 -115 16384 <
ffff810137f5fcc0 321640410 C Bi:4:055:5 -2 0
ffff810137f5fcc0 321640526 S Bi:4:055:5 -115 16384 <
ffff810137f5fcc0 321692413 C Bi:4:055:5 -2 0
ffff810137f5fcc0 321692511 S Bi:4:055:5 -115 16384 <
ffff810137f5fcc0 321711416 C Bi:4:055:5 0 1526 = 7eff0300 21450005 dcfaec00 00c60675 14451175 cf19e0aa 5a0050c5 8f9ab40b
ffff810137f5fcc0 321714847 S Bi:4:055:5 -115 16384 <
ffff810137f5fcc0 321768418 C Bi:4:055:5 -2 0
ffff810137f5fcc0 321768750 S Bi:4:055:5 -115 16384 <
ffff81020441b6c0 321769083 S Bo:4:055:6 -115 48 = 7eff0300 21450000 2870f140 0040064a c419e0aa 5a451175 cfc58f00 50e92f80
ffff81020441b6c0 321769356 C Bo:4:055:6 0 48 >
ffff810137f5fcc0 321770416 C Bi:4:055:5 0 1520 = 7eff0300 21450005 dcfaf000 00c60675 10451175 cf19e0aa 5a0050c5 8f9ab411
ffff810137f5fcc0 321773127 S Bi:4:055:5 -115 16384 <
ffff810137f5fcc0 321824420 C Bi:4:055:5 -2 0
ffff810137f5fcc0 321824800 S Bi:4:055:5 -115 16384 <
ffff81020441b540 321826093 S Bo:4:055:6 -115 48 = 7eff0300 21450000 2870f240 0040064a c319e0aa 5a451175 cfc58f00 50e92f80
ffff81020441b540 321826359 C Bo:4:055:6 0 48 >
ffff810137f5fcc0 321854438 C Bi:4:055:5 0 1521 = 7eff0300 21450005 dcfaf400 00c60675 0c451175 cf19e0aa 5a0050c5 8f9ab417
ffff810137f5fcc0 321858995 S Bi:4:055:5 -115 16384 <
ffff810137f5fcc0 321912424 C Bi:4:055:5 -2 128 = 7eff0300 21450005 dcfc9400 00c60673 6c451175 cf19e0aa 5a0050c5 8f9ab41c
ffff810137f5fcc0 321912778 S Bi:4:055:5 -115 16384 <
ffff81020441b600 321913112 S Bo:4:055:6 -115 48 = 7eff0300 21450000 2870f340 0040064a c219e0aa 5a451175 cfc58f00 50e92f80
ffff81020441b600 321913364 C Bo:4:055:6 0 48 >
ffff810137f5fcc0 321914422 C Bi:4:055:5 0 1392 = be237c36 d7af3e08 8d66e3c3 5a1e9ba0 cfa71f87 9f1b3c1e 2dbc35e2 4d152e3c
ffff810137f5fcc0 321917094 S Bi:4:055:5 -115 16384 <
ffff810137f5fcc0 321969428 C Bi:4:055:5 -2 0
ffff810137f5fcc0 321969782 S Bi:4:055:5 -115 16384 <
ffff810137f5fcc0 322020431 C Bi:4:055:5 -2 0
ffff810137f5fcc0 322020558 S Bi:4:055:5 -115 16384 <
ffff810137f5fcc0 322056441 C Bi:4:055:5 0 1520 = 7eff0300 21450005 dc0a0800 00c60665 f9451175 cf19e0aa 5a0050c5 8f9ab422
ffff810137f5fcc0 322062924 S Bi:4:055:5 -115 16384 <
ffff810137f5fcc0 322112436 C Bi:4:055:5 0 1520 = 7eff0300 21450005 dc0ce400 00c60663 1d451175 cf19e0aa 5a0050c5 8f9ab428
ffff810137f5fcc0 322118969 S Bi:4:055:5 -115 16384 <
ffff810137f5fcc0 322172441 C Bi:4:055:5 -2 0
ffff810137f5fcc0 322172942 S Bi:4:055:5 -115 16384 <
ffff81020441b9c0 322173303 S Bo:4:055:6 -115 60 = 7eff0300 21450000 3470f440 0040064a b519e0aa 5a451175 cfc58f00 50e92f80
ffff81020441b9c0 322174375 C Bo:4:055:6 0 60 >
ffff81020441bd80 322176652 S Bo:4:055:6 -115 60 = 7eff0300 21450000 3470f540 0040064a b419e0aa 5a451175 cfc58f00 50e92f80
ffff810137f5fcc0 322177433 C Bi:4:055:5 0 1525 = 7eff0300 21450005 dc0ce800 00c60663 19451175 cf19e0aa 5a0050c5 8f9ab42d
ffff81020441bd80 322177438 C Bo:4:055:6 0 60 >
ffff810137f5fd80 322182559 S Bi:4:055:5 -115 16384 <
ffff810137f5fd80 322212441 C Bi:4:055:5 0 523 = 7eff0300 21450001 fc116400 00c60662 7d5d4511 75cf19e0 aa5a0050 c58f9ab4
ffff810137f5fd80 322217234 S Bi:4:055:5 -115 16384 <
ffff810137f5fd80 322268449 C Bi:4:055:5 -2 0
ffff810137f5fd80 322268872 S Bi:4:055:5 -115 16384 <
ffff81020441bd80 322269214 S Bo:4:055:6 -115 60 = 7eff0300 21450000 3470f640 0040064a b319e0aa 5a451175 cfc58f00 50e92f80
ffff81020441bd80 322269381 C Bo:4:055:6 0 60 >
ffff81020441b780 322275403 S Bo:4:055:6 -115 60 = 7eff0300 21450000 3470f740 0040064a b219e0aa 5a451175 cfc58f00 50e92f80
ffff81020441b780 322276382 C Bo:4:055:6 0 60 >
ffff810137f5fd80 322320448 C Bi:4:055:5 -2 0
ffff810137f5fd80 322320579 S Bi:4:055:5 -115 16384 <
ffff810137f5fd80 322372457 C Bi:4:055:5 -2 0
ffff810137f5fd80 322372561 S Bi:4:055:5 -115 16384 <
ffff810137f5fd80 322424455 C Bi:4:055:5 -2 0
ffff810137f5fd80 322424569 S Bi:4:055:5 -115 16384 <
ffff810137f5fd80 322476456 C Bi:4:055:5 -2 0
ffff8101df0e3480 322476569 S Bi:4:055:5 -115 16384 <
ffff8101df0e3480 322486458 C Bi:4:055:5 0 1520 = 7eff0300 21450005 dc1bd000 00c60654 31451175 cf19e0aa 5a0050c5 8f9ab41c
ffff8101df0e3480 322490910 S Bi:4:055:5 -115 16384 <
ffff8101df0e3480 322544461 C Bi:4:055:5 -2 0
ffff8101df0e3480 322544803 S Bi:4:055:5 -115 16384 <
ffff81020441bd80 322545161 S Bo:4:055:6 -115 48 = 7eff0300 21450000 2870f840 0040064a bd19e0aa 5a451175 cfc58f00 50e92f80
ffff81020441bd80 322545397 C Bo:4:055:6 0 48 >
ffff81020441b9c0 322551803 S Bo:4:055:6 -115 48 = 7eff0300 21450000 2870f940 0040064a bc19e0aa 5a451175 cfc58f00 50e92f80
ffff81020441b9c0 322552396 C Bo:4:055:6 0 48 >
ffff8101df0e3480 322596477 C Bi:4:055:5 -2 0
ffff8101df0e3480 322596625 S Bi:4:055:5 -115 16384 <
ffff8101df0e3d80 322597238 S Bo:4:055:6 -115 135 = 7eff0300 21450000 3c6cc240 0040064e df19e0aa 5a451175 cfc59000 5000254a
ffff8101df0e3d80 322598403 C Bo:4:055:6 0 135 >
ffff8101df0e3480 322648472 C Bi:4:055:5 -2 0
ffff8101df0e3480 322648594 S Bi:4:055:5 -115 16384 <
ffff8101df0e3480 322700469 C Bi:4:055:5 -2 0
ffff8101df0e3480 322700584 S Bi:4:055:5 -115 16384 <
ffff8101df0e3480 322752472 C Bi:4:055:5 -2 0
ffff8101df0e3480 322752587 S Bi:4:055:5 -115 16384 <
ffff8101df0e3480 322764473 C Bi:4:055:5 0 48 = 7eff0300 21450000 282ab800 00c6064a fd451175 cf19e0aa 5a0050c5 8f9ab435
ffff8101df0e3480 322768288 S Bi:4:055:5 -115 16384 <
ffff8101df0e3480 322820477 C Bi:4:055:5 -2 0
ffff8101df0e3480 322820650 S Bi:4:055:5 -115 16384 <
ffff8101df0e3480 322825479 C Bi:4:055:5 0 56 = 7eff0300 21450000 302e7400 00c60647 39451175 cf19e0aa 5a0050c5 90a88285
ffff8101df0e3480 322828360 S Bi:4:055:5 -115 16384 <
ffff8101df0e3480 322829477 C Bi:4:055:5 0 56 = 7eff0300 21450000 302e8000 00c60647 2d451175 cf19e0aa 5a0050c5 91a88675
ffff8101df0e3480 322829607 S Bi:4:055:5 -115 16384 <
ffff8101df0e3480 322880482 C Bi:4:055:5 -2 0
ffff8101df0e3480 322880669 S Bi:4:055:5 -115 16384 <
ffff8101df0e3d80 322883689 S Bo:4:055:6 -115 1500 = 7eff0300 21450000 286cc340 0040064e f219e0aa 5a451175 cfc59000 5000254a
ffff8101df0e3d80 322885423 C Bo:4:055:6 0 1500 >
ffff8101df0e3d80 322888561 S Bo:4:055:6 -115 139 = 7c75746d 636d643d 6f726761 6e69633b 2069705f 61646472 65737365 733d3131
ffff8101df0e3d80 322889417 C Bo:4:055:6 0 139 >
ffff8101df0e3480 322932480 C Bi:4:055:5 -2 0
ffff8101df0e3480 322932593 S Bi:4:055:5 -115 16384 <
ffff8101df0e3480 322984484 C Bi:4:055:5 -2 0
ffff8101df0e3480 322984597 S Bi:4:055:5 -115 16384 <
ffff8101df0e3480 323036486 C Bi:4:055:5 -2 0
ffff8101df0e3480 323036600 S Bi:4:055:5 -115 16384 <
ffff8101df0e3480 323088488 C Bi:4:055:5 -2 0
ffff8101df0e3480 323088603 S Bi:4:055:5 -115 16384 <
ffff8101df0e3480 323140492 C Bi:4:055:5 -2 0
ffff8101df0e3480 323140608 S Bi:4:055:5 -115 16384 <
ffff8101df0e3480 323192501 C Bi:4:055:5 -2 0
ffff8101df0e3480 323192617 S Bi:4:055:5 -115 16384 <
ffff8101df0e3480 323244499 C Bi:4:055:5 -2 0
ffff8101df0e3480 323244614 S Bi:4:055:5 -115 16384 <
ffff8101df0e3480 323296500 C Bi:4:055:5 -2 0
ffff8101df0e3480 323296613 S Bi:4:055:5 -115 16384 <
ffff8101df0e3480 323348509 C Bi:4:055:5 -2 0
ffff8101df0e3480 323348643 S Bi:4:055:5 -115 16384 <
ffff8101ef1153c0 323363676 S Bo:4:055:10 -115 31 = 55534243 62060000 00000000 00000600 00000000 00000000 00000000 000000
ffff8101ef1153c0 323364443 C Bo:4:055:10 0 31 >
ffff8101ef1153c0 323364449 S Bi:4:055:9 -115 13 <
ffff8101ef1153c0 323365441 C Bi:4:055:9 0 13 = 55534253 62060000 00000000 01
ffff8101ef1153c0 323365448 S Bo:4:055:10 -115 31 = 55534243 63060000 12000000 80000603 00000012 00000000 00000000 000000
ffff8101ef1153c0 323366442 C Bo:4:055:10 0 31 >
ffff81020441b600 323366451 S Bi:4:055:9 -115 18 <
ffff81020441b600 323367441 C Bi:4:055:9 0 18 = 70000200 0000000a 00000000 3a000000 0000
ffff8101ef1153c0 323367449 S Bi:4:055:9 -115 13 <
ffff8101ef1153c0 323368442 C Bi:4:055:9 0 13 = 55534253 63060000 00000000 00
ffff8101ef1153c0 323368475 S Bo:4:055:10 -115 31 = 55534243 64060000 00000000 00000600 00000000 00000000 00000000 000000
ffff8101ef1153c0 323369442 C Bo:4:055:10 0 31 >
ffff8101ef1153c0 323369447 S Bi:4:055:9 -115 13 <
ffff8101ef1153c0 323370442 C Bi:4:055:9 0 13 = 55534253 64060000 00000000 01
ffff8101ef1153c0 323370448 S Bo:4:055:10 -115 31 = 55534243 65060000 12000000 80000603 00000012 00000000 00000000 000000
ffff8101ef1153c0 323371442 C Bo:4:055:10 0 31 >
ffff81020441b600 323371449 S Bi:4:055:9 -115 18 <
ffff81020441b600 323372442 C Bi:4:055:9 0 18 = 70000200 0000000a 00000000 3a000000 0000
ffff8101ef1153c0 323372449 S Bi:4:055:9 -115 13 <
ffff8101ef1153c0 323373442 C Bi:4:055:9 0 13 = 55534253 65060000 00000000 00
ffff8101df0e3480 323400507 C Bi:4:055:5 -2 0
ffff8101df0e3480 323400625 S Bi:4:055:5 -115 16384 <
ffff8101df0e3480 323452511 C Bi:4:055:5 -2 1216 = 7eff0300 21450005 dc427800 00c6062d 89451175 cf19e0aa 5a0050c5 90a88285
ffff8101df0e3480 323452626 S Bi:4:055:5 -115 16384 <
ffff8101df0e3480 323453512 C Bi:4:055:5 0 299 = 113e1668 de37d7bc 15e13d4e 7f00fc18 b4f04f8f 752f841a 8ea563f0 c35cf1cf
ffff8101df0e3480 323454075 S Bi:4:055:5 -115 16384 <
ffff8101df0e3480 323456505 C Bi:4:055:5 0 1525 = 7eff0300 21450005 dc428000 00c6062d 81451175 cf19e0aa 5a0050c5 90a8828a
ffff8101df0e3480 323462674 S Bi:4:055:5 -115 16384 <
ffff8101df0e3480 323464512 C Bi:4:055:5 0 1050 = 7eff0300 21450005 dc4e2400 00c60621 dd451175 cf19e0aa 5a0050c5 91a88675
ffff8101df0e3480 323469906 S Bi:4:055:5 -115 16384 <
ffff8101df0e3480 323470513 C Bi:4:055:5 0 464 = d2d3d4d5 d6d7d8d9 dae2e3e4 e5e6e7e8 e9eaf2f3 f4f5f6f7 f8f9faff da000c03
ffff8101df0e3480 323471307 S Bi:4:055:5 -115 16384 <
ffff8101df0e3480 323474510 C Bi:4:055:5 0 1525 = 7eff0300 21450005 dc4e2c00 00c60621 d5451175 cf19e0aa 5a0050c5 91a8867b
ffff8101df0e3480 323478689 S Bi:4:055:5 -115 16384 <
ffff8101df0e3480 323532515 C Bi:4:055:5 -2 0
ffff8101df0e3480 323533231 S Bi:4:055:5 -115 16384 <
ffff8101df0e3d80 323533734 S Bo:4:055:6 -115 154 = 7eff0300 21450000 346cc540 0040064e e419e0aa 5a451175 cfc59000 5000254d
ffff8101df0e3d80 323534453 C Bo:4:055:6 0 154 >
ffff8101df0e3480 323584518 C Bi:4:055:5 -2 0
ffff8101df0e3480 323584694 S Bi:4:055:5 -115 16384 <
ffff8101df0e3480 323636520 C Bi:4:055:5 -2 0
ffff8101df0e3480 323636635 S Bi:4:055:5 -115 16384 <
ffff8101df0e3480 323688526 C Bi:4:055:5 -2 0
ffff8101df0e3480 323688663 S Bi:4:055:5 -115 16384 <
ffff8101df0e3480 323740526 C Bi:4:055:5 -2 0
ffff8101df0e3480 323740643 S Bi:4:055:5 -115 16384 <
ffff8101df0e3480 323792533 C Bi:4:055:5 -2 0
ffff8101df0e3480 323792673 S Bi:4:055:5 -115 16384 <
ffff8101df0e3480 323839536 C Bi:4:055:5 0 1529 = 7eff0300 21450005 dc6d3800 00c60602 c9451175 cf19e0aa 5a0050c5 90a88290
ffff8101df0e3480 323842677 S Bi:4:055:5 -115 16384 <
ffff8101df0e3480 323896540 C Bi:4:055:5 -2 0
ffff8101df0e3480 323896894 S Bi:4:055:5 -115 16384 <
ffff8101df0e3d80 323897192 S Bo:4:055:6 -115 60 = 7eff0300 21450000 346cc640 0040064e e319e0aa 5a451175 cfc59000 5000254d
ffff8101df0e3d80 323897472 C Bo:4:055:6 0 60 >
ffff8101df0e3480 323948538 C Bi:4:055:5 -2 0
ffff8101df0e3480 323948664 S Bi:4:055:5 -115 16384 <
ffff8101df0e3480 324000548 C Bi:4:055:5 -2 0
ffff8101df0e3480 324000661 S Bi:4:055:5 -115 16384 <
ffff8101df0e3480 324052544 C Bi:4:055:5 -2 0
ffff8101df0e3480 324052665 S Bi:4:055:5 -115 16384 <
ffff8101df0e3480 324100550 C Bi:4:055:5 0 1529 = 7eff0300 21450005 dc6d3c00 00c60602 c5451175 cf19e0aa 5a0050c5 91a88681
ffff8101df0e3480 324106753 S Bi:4:055:5 -115 16384 <
ffff8101df0e3480 324108548 C Bi:4:055:5 0 1521 = 7eff0300 21450005 dc6d4000 00c60602 c1451175 cf19e0aa 5a0050c5 91a88686
ffff8101df0e3480 324114725 S Bi:4:055:5 -115 16384 <
ffff8101df0e3480 324116549 C Bi:4:055:5 0 1038 = 7eff0300 21450005 dc6eb400 00c60601 4d451175 cf19e0aa 5a0050c5 91a8868c
ffff8101df0e3480 324121851 S Bi:4:055:5 -115 16384 <
ffff8101df0e3480 324122547 C Bi:4:055:5 0 481 = c2c8be1e 6afe0f7f 86daadef 857439ad 34abaf06 df7c37d2 fe21f8b3 23c47f1e
ffff8101df0e3480 324123337 S Bi:4:055:5 -115 16384 <
ffff8101df0e3480 324125544 C Bi:4:055:5 0 1530 = 7eff0300 21450005 dc6eb800 00c60601 49451175 cf19e0aa 5a0050c5 91a88692
ffff8101df0e3480 324130621 S Bi:4:055:5 -115 16384 <
ffff8101df0e3480 324184553 C Bi:4:055:5 -2 0
ffff8101df0e3480 324185416 S Bi:4:055:5 -115 16384 <
ffff8101df0e3d80 324185968 S Bo:4:055:6 -115 189 = 7eff0300 21450000 28a14440 0040061a 7119e0aa 5a451175 cfc59100 50004b8a
ffff8101df0e3d80 324186489 C Bo:4:055:6 0 189 >
ffff8101df0e3480 324236561 C Bi:4:055:5 -2 0
ffff8101df0e3480 324236730 S Bi:4:055:5 -115 16384 <
ffff8101df0e3480 324288563 C Bi:4:055:5 -2 0
ffff8101df0e3480 324288658 S Bi:4:055:5 -115 16384 <
ffff8101df0e3480 324339567 C Bi:4:055:5 0 1515 = 7eff0300 21450005 dc819400 00c606ee 6c451175 cf19e0aa 5a0050c5 90a88285
ffff8101df0e3480 324342829 S Bi:4:055:5 -115 16384 <
ffff8101df0e3480 324344567 C Bi:4:055:5 0 1521 = 7eff0300 21450005 dc819800 00c606ee 68451175 cf19e0aa 5a0050c5 90a88296
ffff8101df0e3480 324350607 S Bi:4:055:5 -115 16384 <
ffff8101df0e3480 324404570 C Bi:4:055:5 -2 0
ffff8101df0e3480 324405064 S Bi:4:055:5 -115 16384 <
ffff8101df0e3d80 324405563 S Bo:4:055:6 -115 95 = 7eff0300 21450000 286cc740 0040064e ee19e0aa 5a451175 cfc59000 5000254d
ffff8101df0e3d80 324406502 C Bo:4:055:6 0 95 >
ffff8101df0e3480 324456571 C Bi:4:055:5 -2 0
ffff8101df0e3480 324456720 S Bi:4:055:5 -115 16384 <
ffff8101df0e3480 324466569 C Bi:4:055:5 0 1531 = 7eff0300 21450005 dc8d1000 00c606e2 f0451175 cf19e0aa 5a0050c5 91a88697
ffff8101df0e3480 324470697 S Bi:4:055:5 -115 16384 <
ffff8101df0e3480 324524573 C Bi:4:055:5 -2 0
ffff8101df0e3480 324524926 S Bi:4:055:5 -115 16384 <
ffff8101df0e3d80 324525205 S Bo:4:055:6 -115 48 = 7eff0300 21450000 28a14840 0040061a 6d19e0aa 5a451175 cfc59100 50004b8a
ffff8101df0e3d80 324525508 C Bo:4:055:6 0 48 >
ffff8101df0e3480 324531570 C Bi:4:055:5 0 1522 = 7eff0300 21450005 dc8d1400 00c606e2 ec451175 cf19e0aa 5a0050c5 91a8869d
ffff81020441b6c0 324534225 S Bi:4:055:5 -115 16384 <
ffff81020441b6c0 324584577 C Bi:4:055:5 -2 0
ffff8101df0e3540 324584941 S Bi:4:055:5 -115 16384 <
ffff8101df0e3000 324585296 S Bo:4:055:6 -115 48 = 7eff0300 21450000 28a14940 0040061a 6c19e0aa 5a451175 cfc59100 50004b8a
ffff8101df0e3000 324585512 C Bo:4:055:6 0 48 >
ffff8101df0e3540 324618584 C Bi:4:055:5 0 1527 = 7eff0300 21450005 dc8d1c00 00c606e2 e4451175 cf19e0aa 5a0050c5 91a886a3
ffff8101df0e3540 324622686 S Bi:4:055:5 -115 16384 <
ffff8101df0e3540 324676584 C Bi:4:055:5 -2 0
ffff8101df0e3540 324676968 S Bi:4:055:5 -115 16384 <
ffff8101df0e3000 324677258 S Bo:4:055:6 -115 49 = 7eff0300 21450000 28a14a40 0040061a 6b19e0aa 5a451175 cfc59100 50004b8a
ffff8101df0e3000 324677519 C Bo:4:055:6 0 49 >
ffff8101df0e3540 324728587 C Bi:4:055:5 -2 0
ffff8101df0e3540 324728729 S Bi:4:055:5 -115 16384 <
ffff8101df0e3540 324780592 C Bi:4:055:5 -2 0
ffff8101df0e3540 324780730 S Bi:4:055:5 -115 16384 <
ffff8101df0e3540 324832593 C Bi:4:055:5 -2 0
ffff8101df0e3540 324832699 S Bi:4:055:5 -115 16384 <
ffff8101df0e3540 324869595 C Bi:4:055:5 0 1521 = 7eff0300 21450005 dc8d2000 00c606e2 e0451175 cf19e0aa 5a0050c5 91a886a9
ffff8101df0e3540 324874799 S Bi:4:055:5 -115 16384 <
ffff8101df0e3540 324876599 C Bi:4:055:5 0 1526 = 7eff0300 21450005 dc972400 00c606d8 dc451175 cf19e0aa 5a0050c5 91a886ae
ffff8101df0e3540 324882600 S Bi:4:055:5 -115 16384 <
ffff8101df0e3540 324884593 C Bi:4:055:5 0 1042 = 7eff0300 21450005 dc972800 00c606d8 d8451175 cf19e0aa 5a0050c5 91a886b4
ffff8101df0e3540 324889783 S Bi:4:055:5 -115 16384 <
ffff8101df0e3540 324890591 C Bi:4:055:5 0 480 = f737ba6c 5ad7c2b9 7c3bf0eb c6be21f8 7d5dad7c 25f8329e 11b6f01e 9377a1e8
ffff8101df0e3540 324891369 S Bi:4:055:5 -115 16384 <
ffff8101df0e3540 324893586 C Bi:4:055:5 0 1521 = 7eff0300 21450005 dc973c00 00c606d8 c4451175 cf19e0aa 5a0050c5 91a886ba
ffff8101df0e3540 324898650 S Bi:4:055:5 -115 16384 <
ffff8101df0e3540 324900591 C Bi:4:055:5 0 1520 = 7eff0300 21450005 dc974000 00c606d8 c0451175 cf19e0aa 5a0050c5 91a886bf
ffff8101df0e3540 324906563 S Bi:4:055:5 -115 16384 <
ffff8101df0e3540 324946600 C Bi:4:055:5 0 1519 = 7eff0300 21450005 dc98e000 00c606d7 20451175 cf19e0aa 5a0050c5 90a8829b
ffff8101df0e3540 324950604 S Bi:4:055:5 -115 16384 <
ffff8101df0e3540 325004603 C Bi:4:055:5 -2 0
ffff8101df0e3540 325005830 S Bi:4:055:5 -115 16384 <
ffff8101df0e3000 325006541 S Bo:4:055:6 -115 283 = 7eff0300 21450000 28a14b40 0040061a 6a19e0aa 5a451175 cfc59100 50004b8a
ffff8101df0e3000 325007541 C Bo:4:055:6 0 283 >
ffff8101df0e3540 325011597 C Bi:4:055:5 0 1530 = 7eff0300 21450005 dc98e400 00c606d7 1c451175 cf19e0aa 5a0050c5 90a882a1
ffff8101df0e3540 325014833 S Bi:4:055:5 -115 16384 <
ffff8101df0e3540 325068607 C Bi:4:055:5 -2 0
ffff8101df0e3540 325069559 S Bo:4:055:6 -115 48 = 7eff0300 21450000 286cca40 0040064e eb19e0aa 5a451175 cfc59000 5000254d
ffff8101df0e3000 325069627 S Bi:4:055:5 -115 16384 <
ffff8101df0e3540 325070539 C Bo:4:055:6 0 48 >
ffff8101df0e3000 325071600 C Bi:4:055:5 0 1531 = 7eff0300 21450005 dc993400 00c606d6 cc451175 cf19e0aa 5a0050c5 90a882a7
ffff8101df0e3000 325074122 S Bi:4:055:5 -115 16384 <
ffff8101df0e3000 325112611 C Bi:4:055:5 0 1526 = 7eff0300 21450005 dca0a800 00c606cf 58451175 cf19e0aa 5a0050c5 91a886c5
ffff8101df0e3000 325118543 S Bi:4:055:5 -115 16384 <
ffff8101df0e3000 325172612 C Bi:4:055:5 -2 0
ffff8101df0e3000 325173638 S Bo:4:055:6 -115 48 = 7eff0300 21450000 286ccb40 0040064e ea19e0aa 5a451175 cfc59000 5000254d
ffff8101df0e3540 325173791 S Bi:4:055:5 -115 16384 <
ffff8101df0e3000 325174546 C Bo:4:055:6 0 48 >
ffff8101df0e3000 325174736 S Bo:4:055:6 -115 48 = 7eff0300 21450000 28a15040 0040061a 6519e0aa 5a451175 cfc59100 50004b8a
ffff8101df0e3000 325175546 C Bo:4:055:6 0 48 >
ffff8101df0e3540 325191617 C Bi:4:055:5 0 1521 = 7eff0300 21450005 dca0ac00 00c606cf 54451175 cf19e0aa 5a0050c5 91a886cb
ffff8101df0e3540 325194394 S Bi:4:055:5 -115 16384 <
ffff8101df0e3540 325248618 C Bi:4:055:5 -2 0
ffff8101df0e3540 325249494 S Bo:4:055:6 -115 48 = 7eff0300 21450000 28a15140 0040061a 6419e0aa 5a451175 cfc59100 50004b8a
ffff8101df0e3000 325249562 S Bi:4:055:5 -115 16384 <
ffff8101df0e3540 325250549 C Bo:4:055:6 0 48 >
ffff8101df0e3000 325300620 C Bi:4:055:5 -2 0
ffff8101df0e3000 325300729 S Bi:4:055:5 -115 16384 <
ffff8101df0e3000 325352622 C Bi:4:055:5 -2 0
ffff8101df0e3000 325352727 S Bi:4:055:5 -115 16384 <
ffff8101ef1153c0 325363676 S Bo:4:055:10 -115 31 = 55534243 66060000 00000000 00000600 00000000 00000000 00000000 000000
ffff8101ef1153c0 325364555 C Bo:4:055:10 0 31 >
ffff8101ef1153c0 325364562 S Bi:4:055:9 -115 13 <
ffff8101ef1153c0 325365553 C Bi:4:055:9 0 13 = 55534253 66060000 00000000 01
ffff8101ef1153c0 325365560 S Bo:4:055:10 -115 31 = 55534243 67060000 12000000 80000603 00000012 00000000 00000000 000000
ffff8101ef1153c0 325366553 C Bo:4:055:10 0 31 >
ffff81020441b9c0 325366562 S Bi:4:055:9 -115 18 <
ffff81020441b9c0 325367553 C Bi:4:055:9 0 18 = 70000200 0000000a 00000000 3a000000 0000
ffff8101ef1153c0 325367561 S Bi:4:055:9 -115 13 <
ffff8101ef1153c0 325368554 C Bi:4:055:9 0 13 = 55534253 67060000 00000000 00
ffff8101ef1153c0 325368587 S Bo:4:055:10 -115 31 = 55534243 68060000 00000000 00000600 00000000 00000000 00000000 000000
ffff8101ef1153c0 325369553 C Bo:4:055:10 0 31 >
ffff8101ef1153c0 325369558 S Bi:4:055:9 -115 13 <
ffff8101ef1153c0 325370553 C Bi:4:055:9 0 13 = 55534253 68060000 00000000 01
ffff8101ef1153c0 325370559 S Bo:4:055:10 -115 31 = 55534243 69060000 12000000 80000603 00000012 00000000 00000000 000000
ffff8101ef1153c0 325371553 C Bo:4:055:10 0 31 >
ffff81020441b9c0 325371560 S Bi:4:055:9 -115 18 <
ffff81020441b9c0 325372554 C Bi:4:055:9 0 18 = 70000200 0000000a 00000000 3a000000 0000
ffff8101ef1153c0 325372561 S Bi:4:055:9 -115 13 <
ffff8101ef1153c0 325373553 C Bi:4:055:9 0 13 = 55534253 69060000 00000000 00
ffff8101df0e3000 325404624 C Bi:4:055:5 -2 0
ffff8101df0e3000 325404703 S Bi:4:055:5 -115 16384 <
ffff8101df0e3000 325456628 C Bi:4:055:5 -2 0
ffff81019bd8ad80 325456748 S Bi:4:055:5 -115 16384 <
ffff81019bd8ad80 325466627 C Bi:4:055:5 0 1528 = 7eff0300 21450005 dcab8800 00c606c4 78451175 cf19e0aa 5a0050c5 91a886d1
ffff81019bd8ad80 325470643 S Bi:4:055:5 -115 16384 <
ffff81019bd8ad80 325472626 C Bi:4:055:5 0 1523 = 7eff0300 21450005 dcab8c00 00c606c4 74451175 cf19e0aa 5a0050c5 91a886d6
ffff81019bd8ad80 325478537 S Bi:4:055:5 -115 16384 <
ffff81019bd8ad80 325479626 C Bi:4:055:5 0 1042 = 7eff0300 21450005 dcb5f800 00c606ba 08451175 cf19e0aa 5a0050c5 91a886dc
ffff81019bd8ad80 325481367 S Bi:4:055:5 -115 16384 <
ffff81019bd8ad80 325482623 C Bi:4:055:5 0 486 = 3b2dc642 182c7d5d 0c9ab713 e799a60f 22a0b2ae 36e15cc3 1d86c67f aa5533da
ffff81019bd8ad80 325483536 S Bi:4:055:5 -115 16384 <
ffff81019bd8ad80 325485627 C Bi:4:055:5 0 1523 = 7eff0300 21450005 dcb5fc00 00c606ba 04451175 cf19e0aa 5a0050c5 91a886e2
ffff81019bd8ad80 325490403 S Bi:4:055:5 -115 16384 <
ffff81019bd8ad80 325491632 C Bi:4:055:5 0 1038 = 7eff0300 21450005 dcc09800 00c606af 68451175 cf19e0aa 5a0050c5 91a886e7
ffff81019bd8ad80 325493332 S Bi:4:055:5 -115 16384 <
ffff81019bd8ad80 325494622 C Bi:4:055:5 0 484 = 51f82ff1 2adadbe2 ceafc38f 815aa7c6 1f14f8db c257bf1b dfe24f8e 74af19e8
ffff81019bd8ad80 325495444 S Bi:4:055:5 -115 16384 <
ffff81019bd8ad80 325537637 C Bi:4:055:5 0 1525 = 7eff0300 21450005 dcc09c00 00c606af 64451175 cf19e0aa 5a0050c5 91a886ed
ffff81019bd8ad80 325542531 S Bi:4:055:5 -115 16384 <
ffff81019bd8ad80 325596638 C Bi:4:055:5 -2 960 = 7eff0300 21450005 dcc0a400 00c606af 5c451175 cf19e0aa 5a0050c5 91a886f3
ffff81019bd8ad80 325597952 S Bo:4:055:6 -115 49 = 7eff0300 21450000 28a15240 0040061a 6319e0aa 5a451175 cfc59100 50004b8a
ffff81019bd8a600 325598544 S Bi:4:055:5 -115 16384 <
ffff81019bd8ad80 325598594 C Bo:4:055:6 0 49 >
ffff81019bd8ad80 325599134 S Bo:4:055:6 -115 236 = 7eff0300 21450000 28a15340 0040061a 6219e0aa 5a451175 cfc59100 50004b8a
ffff81019bd8a600 325599637 C Bi:4:055:5 0 565 = d5b46f85 67c7be0f f10fc45d 5342f867 f0afc15e 0bd2b43c 21e24f0c d9e9c9e0
ffff81019bd8ad80 325599649 C Bo:4:055:6 0 236 >
ffff81019bd8ad80 325600600 S Bi:4:055:5 -115 16384 <
ffff81019bd8ad80 325652641 C Bi:4:055:5 -2 1408 = 7eff0300 21450005 dcc0a800 00c606af 58451175 cf19e0aa 5a0050c5 91a886f8
ffff81019bd8ad80 325652946 S Bi:4:055:5 -115 16384 <
ffff81019bd8ad80 325653633 C Bi:4:055:5 0 114 = f86f2ef1 03094b22 e30ca733 ff005473 3caf30ca 73dc0e73 80e23c76 3b1182c6
ffff81019bd8ad80 325653881 S Bi:4:055:5 -115 16384 <
ffff81019bd8ad80 325704640 C Bi:4:055:5 -2 0
ffff81019bd8ad80 325704828 S Bi:4:055:5 -115 16384 <
ffff81019bd8ad80 325717638 C Bi:4:055:5 0 1525 = 7eff0300 21450005 dcc72800 00c606a8 d8451175 cf19e0aa 5a0050c5 91a886fe
ffff81019bd8ad80 325722609 S Bi:4:055:5 -115 16384 <
ffff81019bd8ad80 325758647 C Bi:4:055:5 0 1518 = 7eff0300 21450005 dcc72c00 00c606a8 d4451175 cf19e0aa 5a0050c5 91a88704
ffff81019bd8ad80 325762645 S Bi:4:055:5 -115 16384 <
ffff81019bd8ad80 325816649 C Bi:4:055:5 -2 0
ffff81019bd8ad80 325817340 S Bo:4:055:6 -115 60 = 7eff0300 21450000 34a15840 0040061a 5119e0aa 5a451175 cfc59100 50004b8a
ffff81019bd8a600 325817407 S Bi:4:055:5 -115 16384 <
ffff81019bd8ad80 325817579 C Bo:4:055:6 0 60 >
ffff81019bd8ad80 325817792 S Bo:4:055:6 -115 60 = 7eff0300 21450000 34a15940 0040061a 5019e0aa 5a451175 cfc59100 50004b8a
ffff81019bd8ad80 325818580 C Bo:4:055:6 0 60 >
ffff81019bd8a600 325820645 C Bi:4:055:5 0 1523 = 7eff0300 21450005 dcc73400 00c606a8 cc451175 cf19e0aa 5a0050c5 91a8870a
ffff81019bd8a600 325826627 S Bi:4:055:5 -115 16384 <
ffff81019bd8a600 325874653 C Bi:4:055:5 0 1519 = 7eff0300 21450005 dcc73800 00c606a8 c8451175 cf19e0aa 5a0050c5 91a8870f
ffff81019bd8a600 325878783 S Bi:4:055:5 -115 16384 <
ffff81019bd8a600 325932656 C Bi:4:055:5 -2 0
ffff81019bd8a600 325933402 S Bo:4:055:6 -115 60 = 7eff0300 21450000 34a15a40 0040061a 4f19e0aa 5a451175 cfc59100 50004b8a
ffff81019bd8ad80 325933470 S Bi:4:055:5 -115 16384 <
ffff81019bd8a600 325933585 C Bo:4:055:6 0 60 >
ffff81019bd8a600 325933806 S Bo:4:055:6 -115 60 = 7eff0300 21450000 34a15b40 0040061a 4e19e0aa 5a451175 cfc59100 50004b8a
ffff81019bd8a600 325934586 C Bo:4:055:6 0 60 >
ffff81019bd8ad80 325938650 C Bi:4:055:5 0 1516 = 7eff0300 21450005 dcc73c00 00c606a8 c4451175 cf19e0aa 5a0050c5 91a88715
ffff81019bd8ad80 325942520 S Bi:4:055:5 -115 16384 <
ffff81019bd8ad80 325996658 C Bi:4:055:5 -2 0
ffff81019bd8ad80 325997190 S Bo:4:055:6 -115 60 = 7eff0300 21450000 34a15c40 0040061a 4d19e0aa 5a451175 cfc59100 50004b8a
ffff81019bd8a600 325997223 S Bi:4:055:5 -115 16384 <
ffff81019bd8ad80 325997589 C Bo:4:055:6 0 60 >
ffff81019bd8a600 326000649 C Bi:4:055:5 0 1523 = 7eff0300 21450005 dcc74000 00c606a8 c0451175 cf19e0aa 5a0050c5 91a8871b
ffff81019bd8a600 326006611 S Bi:4:055:5 -115 16384 <
ffff81019bd8a600 326031668 C Bi:4:055:5 0 1522 = 7eff0300 21450005 dcc80400 00c606a7 fc451175 cf19e0aa 5a0050c5 90a882ac
ffff81019bd8a600 326034713 S Bi:4:055:5 -115 16384 <
ffff81019bd8a600 326088662 C Bi:4:055:5 -2 0
ffff81019bd8a600 326089369 S Bo:4:055:6 -115 60 = 7eff0300 21450000 34a15d40 0040061a 4c19e0aa 5a451175 cfc59100 50004b8a
ffff81019bd8a600 326089594 C Bo:4:055:6 0 60 >
ffff81019bd8a600 326089929 S Bo:4:055:6 -115 48 = 7eff0300 21450000 286ccc40 0040064e e919e0aa 5a451175 cfc59000 5000254d
ffff81019bd8ad80 326089993 S Bi:4:055:5 -115 16384 <
ffff81019bd8a600 326090596 C Bo:4:055:6 0 48 >
ffff81019bd8ad80 326091656 C Bi:4:055:5 0 1527 = 7eff0300 21450005 dcc80c00 00c606a7 f4451175 cf19e0aa 5a0050c5 90a882b2
ffff81019bd8ad80 326094152 S Bi:4:055:5 -115 16384 <
ffff81019bd8ad80 326144666 C Bi:4:055:5 -2 0
ffff81019bd8ad80 326145244 S Bo:4:055:6 -115 48 = 7eff0300 21450000 286ccd40 0040064e e819e0aa 5a451175 cfc59000 5000254d
ffff81019bd8ad80 326145598 C Bo:4:055:6 0 48 >
ffff81019bd8ad80 326145695 S Bi:4:055:5 -115 16384 <
ffff81019bd8ad80 326151671 C Bi:4:055:5 0 1521 = 7eff0300 21450005 dcc81000 00c606a7 f0451175 cf19e0aa 5a0050c5 90a882b8
ffff81019bd8ad80 326155063 S Bi:4:055:5 -115 16384 <
ffff81019bd8ad80 326197667 C Bi:4:055:5 0 1526 = 7eff0300 21450005 dcc81400 00c606a7 ec451175 cf19e0aa 5a0050c5 90a882be
ffff81019bd8ad80 326203025 S Bi:4:055:5 -115 16384 <
ffff81019bd8ad80 326256671 C Bi:4:055:5 -2 0
ffff81019bd8ad80 326257400 S Bo:4:055:6 -115 48 = 7eff0300 21450000 286cce40 0040064e e719e0aa 5a451175 cfc59000 5000254d
ffff81019bd8ad80 326257603 C Bo:4:055:6 0 48 >
ffff81019bd8ad80 326258115 S Bo:4:055:6 -115 49 = 7eff0300 21450000 286ccf40 0040064e e619e0aa 5a451175 cfc59000 5000254d
ffff81019bd8a600 326258220 S Bi:4:055:5 -115 16384 <
ffff81019bd8ad80 326258603 C Bo:4:055:6 0 49 >
ffff81019bd8a600 326271667 C Bi:4:055:5 0 1519 = 7eff0300 21450005 dcca6800 00c606a5 98451175 cf19e0aa 5a0050c5 91a88720
ffff81019bd8a600 326274614 S Bi:4:055:5 -115 16384 <
ffff81019bd8a600 326317673 C Bi:4:055:5 0 1524 = 7eff0300 21450005 dcca6c00 00c606a5 94451175 cf19e0aa 5a0050c5 91a88726
ffff81019bd8a600 326322890 S Bi:4:055:5 -115 16384 <
ffff81019bd8a600 326372681 C Bi:4:055:5 0 1526 = 7eff0300 21450005 dcca7000 00c606a5 90451175 cf19e0aa 5a0050c5 91a8872c
ffff81019bd8a600 326379008 S Bi:4:055:5 -115 16384 <
ffff81019bd8a600 326432681 C Bi:4:055:5 -2 0
ffff81019bd8a600 326433689 S Bo:4:055:6 -115 60 = 7eff0300 21450000 34a15e40 0040061a 4b19e0aa 5a451175 cfc59100 50004b8a
ffff81019bd8ad80 326433883 S Bi:4:055:5 -115 16384 <
ffff81019bd8a600 326434613 C Bo:4:055:6 0 60 >
ffff81019bd8a600 326434901 S Bo:4:055:6 -115 119 = 7eff0300 21450000 34a15f40 0040061a 4a19e0aa 5a451175 cfc59100 50004b8a
ffff81019bd8a600 326436617 C Bo:4:055:6 0 119 >
ffff81019bd8ad80 326437673 C Bi:4:055:5 0 1525 = 7eff0300 21450005 dcca7400 00c606a5 8c451175 cf19e0aa 5a0050c5 91a88731
ffff81019bd8ad80 326442675 S Bi:4:055:5 -115 16384 <
ffff81019bd8ad80 326496686 C Bi:4:055:5 -2 768 = 7eff0300 21450005 dcd0d000 00c6069f 30451175 cf19e0aa 5a0050c5 91a88737
ffff81019bd8ad80 326497299 S Bo:4:055:6 -115 60 = 7eff0300 21450000 34a16140 0040061a 4819e0aa 5a451175 cfc59100 50004b8a
ffff81019bd8a600 326497410 S Bi:4:055:5 -115 16384 <
ffff81019bd8ad80 326497616 C Bo:4:055:6 0 60 >
ffff81019bd8a600 326498680 C Bi:4:055:5 0 754 = 4ed23cd3 e28f87fc 737ff06b c3da3785 bc24f0f8 2f55f881 f197c4f7 d7de31d4
ffff81019bd8a600 326499928 S Bi:4:055:5 -115 16384 <
ffff81019bd8a600 326538686 C Bi:4:055:5 0 1517 = 7eff0300 21450005 dcd0d400 00c6069f 2c451175 cf19e0aa 5a0050c5 91a8873d
ffff81019bd8a600 326543038 S Bi:4:055:5 -115 16384 <
ffff81019bd8a600 326596692 C Bi:4:055:5 -2 0
ffff81019bd8a600 326597141 S Bi:4:055:5 -115 16384 <
ffff81019bd8ad80 326597455 S Bo:4:055:6 -115 68 = 7eff0300 21450000 3ca16240 0040061a 3f19e0aa 5a451175 cfc59100 50004b8a
ffff81019bd8ad80 326597624 C Bo:4:055:6 0 68 >
ffff81019bd8a600 326600682 C Bi:4:055:5 0 1518 = 7eff0300 21450005 dcd0d800 00c6069f 28451175 cf19e0aa 5a0050c5 91a88743
ffff81019bd8a600 326606706 S Bi:4:055:5 -115 16384 <
ffff81019bd8a600 326659696 C Bi:4:055:5 0 1522 = 7eff0300 21450005 dcd0dc00 00c6069f 24451175 cf19e0aa 5a0050c5 91a88748
ffff81019bd8a600 326662826 S Bi:4:055:5 -115 16384 <
ffff81019bd8a600 326691693 C Bi:4:055:5 0 1524 = 7eff0300 21450005 dcd22800 00c6069d d8451175 cf19e0aa 5a0050c5 91a8874e
ffff81019bd8a600 326694754 S Bi:4:055:5 -115 16384 <
ffff81019bd8a600 326748697 C Bi:4:055:5 -2 0
ffff81019bd8a600 326749410 S Bi:4:055:5 -115 16384 <
ffff81019bd8ad80 326749974 S Bo:4:055:6 -115 202 = 7eff0300 21450000 3ca16340 0040061a 3e19e0aa 5a451175 cfc59100 50004b8a
ffff81019bd8ad80 326750635 C Bo:4:055:6 0 202 >
ffff81019bd8a600 326751693 C Bi:4:055:5 0 1521 = 7eff0300 21450005 dcd22c00 00c6069d d4451175 cf19e0aa 5a0050c5 91a88754
ffff81019bd8a600 326754143 S Bi:4:055:5 -115 16384 <
ffff81019bd8a600 326804698 C Bi:4:055:5 -2 0
ffff81019bd8a600 326805070 S Bi:4:055:5 -115 16384 <
ffff81019bd8ad80 326805380 S Bo:4:055:6 -115 68 = 7eff0300 21450000 3ca16640 0040061a 3b19e0aa 5a451175 cfc59100 50004b8a
ffff81019bd8ad80 326805636 C Bo:4:055:6 0 68 >
ffff81019bd8a600 326807692 C Bi:4:055:5 0 1519 = 7eff0300 21450005 dcd23000 00c6069d d0451175 cf19e0aa 5a0050c5 91a88759
ffff81019bd8a600 326810164 S Bi:4:055:5 -115 16384 <
ffff81019bd8a600 326864707 C Bi:4:055:5 -2 0
ffff81020441bd80 326865094 S Bi:4:055:5 -115 16384 <
ffff81019bd8ad80 326865478 S Bo:4:055:6 -115 68 = 7eff0300 21450000 3ca16740 0040061a 3a19e0aa 5a451175 cfc59100 50004b8a
ffff81019bd8ad80 326866637 C Bo:4:055:6 0 68 >
ffff81020441bd80 326871700 C Bi:4:055:5 0 1522 = 7eff0300 21450005 dcd23400 00c6069d cc451175 cf19e0aa 5a0050c5 91a8875f
ffff81020441bd80 326874348 S Bi:4:055:5 -115 16384 <
ffff81020441bd80 326917711 C Bi:4:055:5 0 1520 = 7eff0300 21450005 dcd24400 00c6069d bc451175 cf19e0aa 5a0050c5 91a88765
ffff81020441bd80 326922494 S Bi:4:055:5 -115 16384 <
ffff81020441bd80 326976711 C Bi:4:055:5 -2 448 = 7eff0300 21450005 dcd24800 00c6069d b8451175 cf19e0aa 5a0050c5 91a8876a
ffff81020441bd80 326977267 S Bi:4:055:5 -115 16384 <
ffff81019bd8a240 326977626 S Bo:4:055:6 -115 69 = 7eff0300 21450000 3ca16840 0040061a 3919e0aa 5a451175 cfc59100 50004b8a
ffff81020441bd80 326978704 C Bi:4:055:5 0 1073 = c3180953 c7675c23 530b95e0 f28c4f16 65f99f18 7883c534 f89f0f8d cbf34cdf
ffff81019bd8a240 326978712 C Bo:4:055:6 0 69 >
ffff81019bd8a240 326978929 S Bo:4:055:6 -115 68 = 7eff0300 21450000 3ca16940 0040061a 3819e0aa 5a451175 cfc59100 50004b8a
ffff81019bd8a240 326979646 C Bo:4:055:6 0 68 >
ffff81020441b6c0 326981458 S Bi:4:055:5 -115 16384 <
ffff81020441b6c0 327032714 C Bi:4:055:5 -2 0
ffff81020441b6c0 327033049 S Bi:4:055:5 -115 16384 <
ffff81020441b6c0 327037709 C Bi:4:055:5 0 1522 = 7eff0300 21450005 dcd30000 00c6069d 00451175 cf19e0aa 5a0050c5 91a88770
ffff81020441b6c0 327042199 S Bi:4:055:5 -115 16384 <
ffff81020441b6c0 327096718 C Bi:4:055:5 -2 0
ffff81020441b6c0 327097096 S Bi:4:055:5 -115 16384 <
ffff81019bd8a240 327097463 S Bo:4:055:6 -115 76 = 7eff0300 21450000 44a16a40 0040061a 2f19e0aa 5a451175 cfc59100 50004b8a
ffff81020441b6c0 327098711 C Bi:4:055:5 0 1519 = 7eff0300 21450005 dcd30400 00c6069c fc451175 cf19e0aa 5a0050c5 91a88776
ffff81019bd8a240 327098719 C Bo:4:055:6 0 76 >
ffff81020441b540 327102448 S Bi:4:055:5 -115 16384 <
ffff81020441b540 327156722 C Bi:4:055:5 -2 0
ffff81020441b540 327157108 S Bi:4:055:5 -115 16384 <
ffff81019bd8a240 327157670 S Bo:4:055:6 -115 76 = 7eff0300 21450000 44a16b40 0040061a 2e19e0aa 5a451175 cfc59100 50004b8a
ffff81019bd8a240 327158655 C Bo:4:055:6 0 76 >
ffff81020441b540 327208726 C Bi:4:055:5 -2 0
ffff81020441b540 327208885 S Bi:4:055:5 -115 16384 <
ffff81020441b540 327260729 C Bi:4:055:5 -2 0
ffff81020441b540 327260872 S Bi:4:055:5 -115 16384 <
ffff81020441b540 327312732 C Bi:4:055:5 -2 0
ffff81020441b540 327312873 S Bi:4:055:5 -115 16384 <
ffff8101ef1153c0 327363691 S Bo:4:055:10 -115 31 = 55534243 6a060000 00000000 00000600 00000000 00000000 00000000 000000
ffff81020441b540 327364733 C Bi:4:055:5 -2 0
ffff8101ef1153c0 327364737 C Bo:4:055:10 0 31 >
ffff8101ef1153c0 327364744 S Bi:4:055:9 -115 13 <
ffff81020441b540 327364842 S Bi:4:055:5 -115 16384 <
ffff8101ef1153c0 327365664 C Bi:4:055:9 0 13 = 55534253 6a060000 00000000 01
ffff8101ef1153c0 327365673 S Bo:4:055:10 -115 31 = 55534243 6b060000 12000000 80000603 00000012 00000000 00000000 000000
ffff8101ef1153c0 327366665 C Bo:4:055:10 0 31 >
ffff81020441bd80 327366673 S Bi:4:055:9 -115 18 <
ffff81020441bd80 327367665 C Bi:4:055:9 0 18 = 70000200 0000000a 00000000 3a000000 0000
ffff8101ef1153c0 327367673 S Bi:4:055:9 -115 13 <
ffff8101ef1153c0 327368664 C Bi:4:055:9 0 13 = 55534253 6b060000 00000000 00
ffff8101ef1153c0 327368700 S Bo:4:055:10 -115 31 = 55534243 6c060000 00000000 00000600 00000000 00000000 00000000 000000
ffff8101ef1153c0 327369665 C Bo:4:055:10 0 31 >
ffff8101ef1153c0 327369670 S Bi:4:055:9 -115 13 <
ffff8101ef1153c0 327384667 C Bi:4:055:9 0 13 = 55534253 6c060000 00000000 01
ffff8101ef1153c0 327384675 S Bo:4:055:10 -115 31 = 55534243 6d060000 12000000 80000603 00000012 00000000 00000000 000000
ffff8101ef1153c0 327385669 C Bo:4:055:10 0 31 >
ffff81020441bd80 327385676 S Bi:4:055:9 -115 18 <
ffff81020441b540 327386724 C Bi:4:055:5 0 1525 = 7eff0300 21450005 dcd7d800 00c60698 28451175 cf19e0aa 5a0050c5 91a886f3
ffff81020441bd80 327386728 C Bi:4:055:9 0 18 = 70000200 0000000a 00000000 3a000000 0000
ffff8101ef1153c0 327386735 S Bi:4:055:9 -115 13 <
ffff8101ef1153c0 327387666 C Bi:4:055:9 0 13 = 55534253 6d060000 00000000 00
ffff81020441b540 327390264 S Bi:4:055:5 -115 16384 <
ffff81020441b540 327392738 C Bi:4:055:5 0 1522 = 7eff0300 21450005 dcd7dc00 00c60698 24451175 cf19e0aa 5a0050c5 91a886f8
ffff81020441b540 327396006 S Bi:4:055:5 -115 16384 <
ffff81020441b540 327397738 C Bi:4:055:5 0 1042 = 7eff0300 21450005 dce37400 00c6068c 8c451175 cf19e0aa 5a0050c5 90a882c3
ffff81020441b540 327399612 S Bi:4:055:5 -115 16384 <
ffff81020441b540 327400728 C Bi:4:055:5 0 481 = ebf737ba 6c5ad7c2 b97c3bf0 ebc6be21 f87d5dad 7c25f832 9e11b6f0 1e9377a1
ffff81020441b540 327401565 S Bi:4:055:5 -115 16384 <
ffff81020441b540 327403723 C Bi:4:055:5 0 1521 = 7eff0300 21450005 dce84000 00c60687 c0451175 cf19e0aa 5a0050c5 90a882c9
ffff81020441b540 327410087 S Bi:4:055:5 -115 16384 <
ffff81020441b540 327411728 C Bi:4:055:5 0 1042 = 7eff0300 21450005 dcec6000 00c60683 a0451175 cf19e0aa 5a0050c5 90a882cf
ffff81020441b540 327417330 S Bi:4:055:5 -115 16384 <
ffff81020441b540 327418728 C Bi:4:055:5 0 478 = f84177aa 4dad6a9e 2df8dfe1 df84daaf c49d4fe2 57c50bc9 f40f876b e35c5d3e
ffff81020441b540 327419561 S Bi:4:055:5 -115 16384 <
ffff81020441b540 327472740 C Bi:4:055:5 -2 0
ffff81020441b540 327473940 S Bi:4:055:5 -115 16384 <
ffff81019bd8a240 327474653 S Bo:4:055:6 -115 284 = 7eff0300 21450000 44a16c40 0040061a 2d19e0aa 5a451175 cfc59100 50004b8a
ffff81019bd8a240 327475678 C Bo:4:055:6 0 284 >
ffff81020441b540 327524746 C Bi:4:055:5 -2 0
ffff81019bd8a240 327524918 S Bi:4:055:5 -115 16384 <
ffff81019bd8a240 327576747 C Bi:4:055:5 -2 0
ffff81019bd8a240 327576864 S Bi:4:055:5 -115 16384 <
ffff81019bd8a240 327628756 C Bi:4:055:5 -2 0
ffff81020441b780 327628930 S Bi:4:055:5 -115 16384 <
ffff81020441b780 327646756 C Bi:4:055:5 0 1526 = 7eff0300 21450005 dcec6400 00c60683 9c451175 cf19e0aa 5a0050c5 90a882d4
ffff81019bd8a9c0 327650824 S Bi:4:055:5 -115 16384 <
ffff81019bd8a9c0 327652749 C Bi:4:055:5 0 1521 = 7eff0300 21450005 dcec6800 00c60683 98451175 cf19e0aa 5a0050c5 90a882da
ffff81019bd8a9c0 327658633 S Bi:4:055:5 -115 16384 <
ffff81019bd8a9c0 327660752 C Bi:4:055:5 0 1522 = 7eff0300 21450005 dcfe5c00 00c60671 a4451175 cf19e0aa 5a0050c5 91a88737
ffff81019bd8a9c0 327666201 S Bi:4:055:5 -115 16384 <
ffff81019bd8a9c0 327667750 C Bi:4:055:5 0 1046 = 7eff0300 21450005 dcfe6000 00c60671 a0451175 cf19e0aa 5a0050c5 91a8877c
ffff81019bd8a9c0 327669499 S Bi:4:055:5 -115 16384 <
ffff81019bd8a9c0 327670746 C Bi:4:055:5 0 477 = 86ce68cf 179fe2e5 c34b2fcb f8669f0a e67c0794 706bcd31 39b70c64 59df0471
ffff81019bd8a9c0 327671540 S Bi:4:055:5 -115 16384 <
ffff81019bd8a9c0 327673744 C Bi:4:055:5 0 1521 = 7eff0300 21450005 dc00cc00 00c6066f 35451175 cf19e0aa 5a0050c5 91a88781
ffff81019bd8a9c0 327678242 S Bi:4:055:5 -115 16384 <
ffff81019bd8a9c0 327680751 C Bi:4:055:5 0 1533 = 7eff0300 21450005 dc01f800 00c6066e 09451175 cf19e0aa 5a0050c5 91a88787
ffff81019bd8a9c0 327686705 S Bi:4:055:5 -115 16384 <
ffff81019bd8a9c0 327739757 C Bi:4:055:5 0 1520 = 7eff0300 21450005 dc04cc00 00c6066b 35451175 cf19e0aa 5a0050c5 91a8878d
ffff81019bd8a9c0 327742688 S Bi:4:055:5 -115 16384 <
ffff81019bd8a9c0 327796754 C Bi:4:055:5 -2 0
ffff81019bd8a9c0 327798141 S Bi:4:055:5 -115 16384 <
ffff81019bd8a0c0 327799028 S Bo:4:055:6 -115 390 = 7eff0300 21450000 286cd340 0040064e e219e0aa 5a451175 cfc59000 5000254d
ffff81019bd8a0c0 327799692 C Bo:4:055:6 0 390 >
ffff81019bd8a9c0 327848759 C Bi:4:055:5 -2 0
ffff81019bd8a9c0 327848951 S Bi:4:055:5 -115 16384 <
ffff81019bd8a9c0 327900762 C Bi:4:055:5 -2 0
ffff81019bd8a9c0 327900883 S Bi:4:055:5 -115 16384 <
ffff81019bd8a9c0 327952761 C Bi:4:055:5 -2 0
ffff81019bd8a9c0 327952873 S Bi:4:055:5 -115 16384 <
ffff81019bd8a9c0 327990766 C Bi:4:055:5 0 1523 = 7eff0300 21450005 dc0ad400 00c60665 2d451175 cf19e0aa 5a0050c5 91a88792
ffff81019bd8a9c0 327994949 S Bi:4:055:5 -115 16384 <
ffff81019bd8a9c0 327996765 C Bi:4:055:5 0 1518 = 7eff0300 21450005 dc0ad800 00c60665 29451175 cf19e0aa 5a0050c5 91a88798
ffff81019bd8a9c0 328002591 S Bi:4:055:5 -115 16384 <
ffff81019bd8a9c0 328003764 C Bi:4:055:5 0 1050 = 7eff0300 21450005 dc126c00 00c6065d 95451175 cf19e0aa 5a0050c5 91a8879e
ffff81019bd8a9c0 328005432 S Bi:4:055:5 -115 16384 <
ffff81019bd8a9c0 328006763 C Bi:4:055:5 0 471 = 47f1ef80 fe22e83f 163e2278 0fe33e89 e2ef0c78 dbfb697c 29ab697a 07893e18
ffff81019bd8a9c0 328007567 S Bi:4:055:5 -115 16384 <
ffff81019bd8a9c0 328009763 C Bi:4:055:5 0 1521 = 7eff0300 21450005 dc158800 00c6065a 79451175 cf19e0aa 5a0050c5 91a8876a
ffff81019bd8a9c0 328014911 S Bi:4:055:5 -115 16384 <
ffff81019bd8a9c0 328016765 C Bi:4:055:5 0 1046 = 7eff0300 21450005 dc158c00 00c6065a 75451175 cf19e0aa 5a0050c5 91a887a4
ffff81019bd8a9c0 328021858 S Bi:4:055:5 -115 16384 <
ffff81019bd8a9c0 328022766 C Bi:4:055:5 0 480 = adfc37f8 9df1520f 06e83a17 86bc61f1 7353f186 9577a0ea 1a078a1d 7d5e1878
ffff81019bd8a9c0 328023566 S Bi:4:055:5 -115 16384 <
ffff81019bd8a9c0 328052768 C Bi:4:055:5 0 1522 = 7eff0300 21450005 dc26d000 00c60649 31451175 cf19e0aa 5a0050c5 91a887a9
ffff81019bd8a9c0 328058808 S Bi:4:055:5 -115 16384 <
ffff81019bd8a9c0 328112771 C Bi:4:055:5 -2 0
ffff81019bd8a9c0 328114137 S Bo:4:055:6 -115 60 = 7eff0300 21450000 34a17340 0040061a 3619e0aa 5a451175 cfc59100 50004b8a
ffff81019bd8a9c0 328114706 C Bo:4:055:6 0 60 >
ffff81019bd8a9c0 328115151 S Bo:4:055:6 -115 166 = 7eff0300 21450000 34a17440 0040061a 3519e0aa 5a451175 cfc59100 50004b8a
ffff81019bd8a240 328115399 S Bi:4:055:5 -115 16384 <
ffff81019bd8a9c0 328116707 C Bo:4:055:6 0 166 >
ffff81019bd8a240 328117766 C Bi:4:055:5 0 1521 = 7eff0300 21450005 dc26d400 00c60649 2d451175 cf19e0aa 5a0050c5 91a887af
ffff81019bd8a9c0 328120519 S Bo:4:055:6 -115 95 = 7eff0300 21450000 28a17740 0040061a 3e19e0aa 5a451175 cfc59100 50004b8a
ffff81019bd8a9c0 328120707 C Bo:4:055:6 0 95 >
ffff81019bd8a9c0 328123117 S Bi:4:055:5 -115 16384 <
ffff81019bd8a9c0 328159778 C Bi:4:055:5 0 1520 = 7eff0300 21450005 dc27c400 00c60648 3d451175 cf19e0aa 5a0050c5 91a887b5
ffff81019bd8a9c0 328163140 S Bi:4:055:5 -115 16384 <
ffff81019bd8a9c0 328216783 C Bi:4:055:5 -2 0
ffff81019bd8a9c0 328217530 S Bo:4:055:6 -115 48 = 7eff0300 21450000 28a17940 0040061a 3c19e0aa 5a451175 cfc59100 50004b8a
ffff81019bd8a9c0 328217713 C Bo:4:055:6 0 48 >
ffff81019bd8a9c0 328218270 S Bo:4:055:6 -115 48 = 7eff0300 21450000 28a17a40 0040061a 3b19e0aa 5a451175 cfc59100 50004b8a
ffff81019bd8a240 328218365 S Bi:4:055:5 -115 16384 <
ffff81019bd8a9c0 328218716 C Bo:4:055:6 0 48 >
ffff81019bd8a240 328220773 C Bi:4:055:5 0 1528 = 7eff0300 21450005 dc27cc00 00c60648 35451175 cf19e0aa 5a0050c5 90a882e0
ffff81019bd8a240 328226639 S Bi:4:055:5 -115 16384 <
ffff81019bd8a240 328251786 C Bi:4:055:5 0 1523 = 7eff0300 21450005 dc27d000 00c60648 31451175 cf19e0aa 5a0050c5 90a882e6
ffff81019bd8a240 328255081 S Bi:4:055:5 -115 16384 <
ffff81019bd8a240 328308787 C Bi:4:055:5 -2 0
ffff81019bd8a240 328309554 S Bo:4:055:6 -115 48 = 7eff0300 21450000 286cd540 0040064e e019e0aa 5a451175 cfc59000 5000254d
ffff81019bd8a240 328309718 C Bo:4:055:6 0 48 >
ffff81019bd8a240 328310133 S Bo:4:055:6 -115 48 = 7eff0300 21450000 286cd640 0040064e df19e0aa 5a451175 cfc59000 5000254d
ffff81019bd8a9c0 328310173 S Bi:4:055:5 -115 16384 <
ffff81019bd8a240 328310722 C Bo:4:055:6 0 48 >
ffff81019bd8a9c0 328311782 C Bi:4:055:5 0 1528 = 7eff0300 21450005 dc299000 00c60646 71451175 cf19e0aa 5a0050c5 90a882eb
ffff81019bd8a9c0 328314364 S Bi:4:055:5 -115 16384 <
ffff81019bd8a9c0 328368789 C Bi:4:055:5 -2 0
ffff81019bd8a9c0 328369661 S Bo:4:055:6 -115 48 = 7eff0300 21450000 286cd740 0040064e de19e0aa 5a451175 cfc59000 5000254d
ffff81019bd8a240 328369731 S Bi:4:055:5 -115 16384 <
ffff81019bd8a9c0 328370723 C Bo:4:055:6 0 48 >
ffff81019bd8a240 328371782 C Bi:4:055:5 0 1523 = 7eff0300 21450005 dc389c00 00c60637 65451175 cf19e0aa 5a0050c5 90a882f1
ffff81019bd8a240 328374290 S Bi:4:055:5 -115 16384 <
ffff81019bd8a240 328430798 C Bi:4:055:5 -2 128 = 7eff0300 21450005 dc38a000 00c60637 61451175 cf19e0aa 5a0050c5 90a882f7
ffff81020441b840 328431471 S Bo:4:055:6 -115 48 = 7eff0300 21450000 286cd840 0040064e dd19e0aa 5a451175 cfc59000 5000254d
ffff81020441b6c0 328431522 S Bi:4:055:5 -115 16384 <
ffff81020441b840 328431726 C Bo:4:055:6 0 48 >
ffff81020441b6c0 328433783 C Bi:4:055:5 0 1394 = 1165b8ec 2f12e2be a195d6cc 333965dc 559f66b8 3c7d5d0a b470b997 1564dc4b
ffff81020441b6c0 328438259 S Bi:4:055:5 -115 16384 <
ffff81020441b6c0 328491800 C Bi:4:055:5 -2 1530 = 7eff0300 21450005 dc39ec00 00c60636 15451175 cf19e0aa 5a0050c5 91a887ba
ffff81020441b6c0 328492202 S Bi:4:055:5 -115 16384 <
ffff81020441b6c0 328537802 C Bi:4:055:5 0 1525 = 7eff0300 21450005 dc39f000 00c60636 11451175 cf19e0aa 5a0050c5 91a887c0
ffff81020441b6c0 328542304 S Bi:4:055:5 -115 16384 <
ffff81020441b6c0 328592801 C Bi:4:055:5 0 1530 = 7eff0300 21450005 dc39f800 00c60636 09451175 cf19e0aa 5a0050c5 91a887c6
ffff81020441b6c0 328598285 S Bi:4:055:5 -115 16384 <
ffff81020441b6c0 328651801 C Bi:4:055:5 -2 0
ffff81020441b6c0 328652550 S Bo:4:055:6 -115 60 = 7eff0300 21450000 34a17b40 0040061a 2e19e0aa 5a451175 cfc59100 50004b8a
ffff81020441b840 328652644 S Bi:4:055:5 -115 16384 <
ffff81020441b6c0 328652738 C Bo:4:055:6 0 60 >
ffff81020441b6c0 328652957 S Bo:4:055:6 -115 60 = 7eff0300 21450000 34a17c40 0040061a 2d19e0aa 5a451175 cfc59100 50004b8a
ffff81020441b6c0 328653736 C Bo:4:055:6 0 60 >
ffff81020441b840 328657800 C Bi:4:055:5 0 1531 = 7eff0300 21450005 dc3b1c00 00c60634 e5451175 cf19e0aa 5a0050c5 91a887cb
ffff81020441b840 328662171 S Bi:4:055:5 -115 16384 <
ffff81020441b840 328715805 C Bi:4:055:5 -2 128 = 7eff0300 21450005 dc3b2400 00c60634 dd451175 cf19e0aa 5a0050c5 91a887d1
ffff81020441b840 328716419 S Bo:4:055:6 -115 61 = 7eff0300 21450000 34a17d5d 40004006 1a2c19e0 aa5a4511 75cfc591 0050004b
ffff81020441b6c0 328716477 S Bi:4:055:5 -115 16384 <
ffff81020441b840 328716741 C Bo:4:055:6 0 61 >
ffff81020441b6c0 328718798 C Bi:4:055:5 0 1398 = bf881fb3 ef8efe39 ddfc1bf0 afc6ab8f 14f8964b 3f881e1e d174fbef 13f85b5c
ffff81020441b6c0 328721148 S Bi:4:055:5 -115 16384 <
ffff81020441b6c0 328759805 C Bi:4:055:5 0 1523 = 7eff0300 21450005 dc487400 00c60627 8d451175 cf19e0aa 5a0050c5 91a887d7
ffff81020441b6c0 328766176 S Bi:4:055:5 -115 16384 <
ffff81020441b6c0 328818810 C Bi:4:055:5 0 1519 = 7eff0300 21450005 dc491c00 00c60626 e5451175 cf19e0aa 5a0050c5 91a887dd
ffff81020441b6c0 328822122 S Bi:4:055:5 -115 16384 <
ffff81020441b6c0 328875818 C Bi:4:055:5 -2 0
ffff81020441b6c0 328876798 S Bo:4:055:6 -115 70 = 7eff0300 21450000 3ca17d5e 40004006 1a2319e0 aa5a4511 75cfc591 0050004b
ffff81020441b540 328876887 S Bi:4:055:5 -115 16384 <
ffff81020441b6c0 328877750 C Bo:4:055:6 0 70 >
ffff81020441b6c0 328877979 S Bo:4:055:6 -115 68 = 7eff0300 21450000 3ca17f40 0040061a 2219e0aa 5a451175 cfc59100 50004b8a
ffff81020441b6c0 328878750 C Bo:4:055:6 0 68 >
ffff81020441b540 328880805 C Bi:4:055:5 0 1526 = 7eff0300 21450005 dc492000 00c60626 e1451175 cf19e0aa 5a0050c5 91a887e2
ffff81020441b540 328886071 S Bi:4:055:5 -115 16384 <
ffff81020441b540 328911823 C Bi:4:055:5 0 1522 = 7eff0300 21450005 dc498000 00c60626 81451175 cf19e0aa 5a0050c5 91a887e8
ffff81020441b540 328918123 S Bi:4:055:5 -115 16384 <
ffff81020441b540 328971818 C Bi:4:055:5 -2 1524 = 7eff0300 21450005 dc498400 00c60626 7d5d4511 75cf19e0 aa5a0050 c591a887
ffff81020441b540 328972580 S Bo:4:055:6 -115 69 = 7eff0300 21450000 3ca18040 0040061a 2119e0aa 5a451175 cfc59100 50004b8a
ffff81020441b6c0 328972670 S Bi:4:055:5 -115 16384 <
ffff81020441b540 328972755 C Bo:4:055:6 0 69 >
ffff81020441b540 328972981 S Bo:4:055:6 -115 68 = 7eff0300 21450000 3ca18140 0040061a 2019e0aa 5a451175 cfc59100 50004b8a
ffff81020441b540 328973755 C Bo:4:055:6 0 68 >
ffff81020441b6c0 329023820 C Bi:4:055:5 -2 0
ffff81020441b6c0 329023943 S Bi:4:055:5 -115 16384 <
ffff81020441b6c0 329031691 C Bi:4:055:5 0 1519 = 7eff0300 21450005 dc498800 00c60626 79451175 cf19e0aa 5a0050c5 91a887f3
ffff81020441b6c0 329034269 S Bi:4:055:5 -115 16384 <
ffff81020441b6c0 329087826 C Bi:4:055:5 -2 0
ffff81020441b6c0 329088410 S Bo:4:055:6 -115 76 = 7eff0300 21450000 44a18240 0040061a 1719e0aa 5a451175 cfc59100 50004b8a
ffff81020441b540 329088466 S Bi:4:055:5 -115 16384 <
ffff81020441b6c0 329088762 C Bo:4:055:6 0 76 >
ffff81020441b540 329091818 C Bi:4:055:5 0 1524 = 7eff0300 21450005 dc4c1000 00c60623 f1451175 cf19e0aa 5a0050c5 91a887f9
ffff81020441b540 329099368 S Bi:4:055:5 -115 16384 <
ffff81020441b540 329137829 C Bi:4:055:5 0 1532 = 7eff0300 21450005 dc4c2800 00c60623 d9451175 cf19e0aa 5a0050c5 91a887ff
ffff81020441b540 329142205 S Bi:4:055:5 -115 16384 <
ffff81020441b540 329192835 C Bi:4:055:5 0 1525 = 7eff0300 21450005 dc4fcc00 00c60620 35451175 cf19e0aa 5a0050c5 90a882fc
ffff81020441b540 329198198 S Bi:4:055:5 -115 16384 <
ffff81020441b540 329251835 C Bi:4:055:5 -2 0
ffff81020441b540 329252755 S Bo:4:055:6 -115 76 = 7eff0300 21450000 44a18340 0040061a 1619e0aa 5a451175 cfc59100 50004b8a
ffff81020441b6c0 329252881 S Bi:4:055:5 -115 16384 <
ffff81020441b540 329253771 C Bo:4:055:6 0 76 >
ffff81020441b540 329254115 S Bo:4:055:6 -115 135 = 7eff0300 21450000 44a18440 0040061a 1519e0aa 5a451175 cfc59100 50004b8a
ffff81020441b540 329256774 C Bo:4:055:6 0 135 >
ffff81020441b6c0 329257829 C Bi:4:055:5 0 1525 = 7eff0300 21450005 dc4fd000 00c60620 31451175 cf19e0aa 5a0050c5 90a88302
ffff81020441b6c0 329262267 S Bi:4:055:5 -115 16384 <
ffff81020441b6c0 329315839 C Bi:4:055:5 -2 64 = 7eff0300 21450005 dc4fd800 00c60620 29451175 cf19e0aa 5a0050c5 90a88308
ffff81020441b6c0 329316446 S Bo:4:055:6 -115 60 = 7eff0300 21450000 346cda40 0040064e cf19e0aa 5a451175 cfc59000 5000254d
ffff81020441b540 329316500 S Bi:4:055:5 -115 16384 <
ffff81020441b6c0 329316774 C Bo:4:055:6 0 60 >
ffff81020441b540 329318830 C Bi:4:055:5 0 1458 = 07f43b5f 0f7c51ba f0dea1a4 5efc369a 3d134df1 0f87fc71 a1f83bc6 da9ffc23
ffff81020441b540 329321256 S Bi:4:055:5 -115 16384 <
ffff81020441b540 329358847 C Bi:4:055:5 0 1525 = 7eff0300 21450005 dc537400 00c6061c 8d451175 cf19e0aa 5a0050c5 90a8830d
ffff81020441b540 329362171 S Bi:4:055:5 -115 16384 <
ffff8101ef1153c0 329363675 S Bo:4:055:10 -115 31 = 55534243 6e060000 00000000 00000600 00000000 00000000 00000000 000000
ffff8101ef1153c0 329363776 C Bo:4:055:10 0 31 >
ffff8101ef1153c0 329363782 S Bi:4:055:9 -115 13 <
ffff8101ef1153c0 329364776 C Bi:4:055:9 0 13 = 55534253 6e060000 00000000 01
ffff8101ef1153c0 329364783 S Bo:4:055:10 -115 31 = 55534243 6f060000 12000000 80000603 00000012 00000000 00000000 000000
ffff8101ef1153c0 329365775 C Bo:4:055:10 0 31 >
ffff81020441bd80 329365783 S Bi:4:055:9 -115 18 <
ffff81020441bd80 329366776 C Bi:4:055:9 0 18 = 70000200 0000000a 00000000 3a000000 0000
ffff8101ef1153c0 329366783 S Bi:4:055:9 -115 13 <
ffff8101ef1153c0 329367776 C Bi:4:055:9 0 13 = 55534253 6f060000 00000000 00
ffff8101ef1153c0 329367808 S Bo:4:055:10 -115 31 = 55534243 70060000 00000000 00000600 00000000 00000000 00000000 000000
ffff8101ef1153c0 329368776 C Bo:4:055:10 0 31 >
ffff8101ef1153c0 329368781 S Bi:4:055:9 -115 13 <
ffff8101ef1153c0 329369776 C Bi:4:055:9 0 13 = 55534253 70060000 00000000 01
ffff8101ef1153c0 329369782 S Bo:4:055:10 -115 31 = 55534243 71060000 12000000 80000603 00000012 00000000 00000000 000000
ffff8101ef1153c0 329370776 C Bo:4:055:10 0 31 >
ffff81020441bd80 329370783 S Bi:4:055:9 -115 18 <
ffff81020441bd80 329371776 C Bi:4:055:9 0 18 = 70000200 0000000a 00000000 3a000000 0000
ffff8101ef1153c0 329371783 S Bi:4:055:9 -115 13 <
ffff8101ef1153c0 329372776 C Bi:4:055:9 0 13 = 55534253 71060000 00000000 00
ffff81020441b540 329415842 C Bi:4:055:5 -2 0
ffff81020441b540 329416686 S Bo:4:055:6 -115 68 = 7eff0300 21450000 3c6cdb40 0040064e c619e0aa 5a451175 cfc59000 5000254d
ffff81020441b840 329416745 S Bi:4:055:5 -115 16384 <
ffff81020441b540 329417779 C Bo:4:055:6 0 68 >
ffff81020441b840 329420836 C Bi:4:055:5 0 1518 = 7eff0300 21450005 dc556400 00c6061a 9d451175 cf19e0aa 5a0050c5 90a88313
ffff81020441b840 329426100 S Bi:4:055:5 -115 16384 <
ffff81020441b840 329479848 C Bi:4:055:5 -2 1344 = 7eff0300 21450005 dc5d5400 00c60612 ad451175 cf19e0aa 5a0050c5 91a88804
ffff81020441b840 329480438 S Bo:4:055:6 -115 68 = 7eff0300 21450000 3c6cdc40 0040064e c519e0aa 5a451175 cfc59000 5000254d
ffff81020441b540 329480494 S Bi:4:055:5 -115 16384 <
ffff81020441b840 329480783 C Bo:4:055:6 0 68 >
ffff81020441b540 329480851 C Bi:4:055:5 0 182 = 785a3d3f c4dae9f0 b78435af 8abf0e6e 740f08fc 7cb2f85b e33f12df 79fa35b7
ffff81020441b540 329482148 S Bi:4:055:5 -115 16384 <
ffff81020441b540 329511847 C Bi:4:055:5 0 1530 = 7eff0300 21450005 dc5dfc00 00c60612 05451175 cf19e0aa 5a0050c5 91a887ba
ffff81020441b540 329518130 S Bi:4:055:5 -115 16384 <
ffff81020441b540 329571852 C Bi:4:055:5 -2 1526 = 7eff0300 21450005 dc68ac00 00c60607 55451175 cf19e0aa 5a0050c5 91a887d1
ffff81020441b540 329572460 S Bo:4:055:6 -115 68 = 7eff0300 21450000 3ca18540 0040061a 1c19e0aa 5a451175 cfc59100 50004b8a
ffff81020441b840 329572520 S Bi:4:055:5 -115 16384 <
ffff81020441b540 329572788 C Bo:4:055:6 0 68 >
ffff81020441b840 329623855 C Bi:4:055:5 -2 0
ffff81020441b840 329623970 S Bi:4:055:5 -115 16384 <
ffff81020441b840 329627853 C Bi:4:055:5 0 1523 = 7eff0300 21450005 dc767400 00c606f9 8c451175 cf19e0aa 5a0050c5 91a887ee
ffff81020441b840 329634202 S Bi:4:055:5 -115 16384 <
ffff81020441b840 329687858 C Bi:4:055:5 -2 0
ffff81020441b840 329688410 S Bo:4:055:6 -115 60 = 7eff0300 21450000 34a18640 0040061a 2319e0aa 5a451175 cfc59100 50004b8a
ffff81020441b540 329688466 S Bi:4:055:5 -115 16384 <
ffff81020441b840 329688795 C Bo:4:055:6 0 60 >
ffff81020441b540 329691852 C Bi:4:055:5 0 1522 = 7eff0300 21450005 dc767800 00c606f9 88451175 cf19e0aa 5a0050c5 91a8880a
ffff81020441b540 329698080 S Bi:4:055:5 -115 16384 <
ffff81020441b540 329738863 C Bi:4:055:5 0 1522 = 7eff0300 21450005 dc770000 00c606f9 00451175 cf19e0aa 5a0050c5 91a88810
ffff81020441b540 329742185 S Bi:4:055:5 -115 16384 <
ffff81020441b540 329795864 C Bi:4:055:5 -2 0
ffff81020441b540 329796616 S Bo:4:055:6 -115 68 = 7eff0300 21450000 3ca18740 0040061a 1a19e0aa 5a451175 cfc59100 50004b8a
ffff81020441b840 329796705 S Bi:4:055:5 -115 16384 <
ffff81020441b540 329796801 C Bo:4:055:6 0 68 >
ffff81020441b540 329797044 S Bo:4:055:6 -115 68 = 7eff0300 21450000 3ca18840 0040061a 1919e0aa 5a451175 cfc59100 50004b8a
ffff81020441b540 329797804 C Bo:4:055:6 0 68 >
ffff81020441b840 329798859 C Bi:4:055:5 0 1523 = 7eff0300 21450005 dc770400 00c606f8 fc451175 cf19e0aa 5a0050c5 90a88319
ffff81020441b840 329801422 S Bi:4:055:5 -115 16384 <
ffff81020441b840 329852872 C Bi:4:055:5 -2 0
ffff81020441b840 329853544 S Bo:4:055:6 -115 68 = 7eff0300 21450000 3c6cdd40 0040064e c419e0aa 5a451175 cfc59000 5000254d
ffff81020441b6c0 329853602 S Bi:4:055:5 -115 16384 <
ffff81020441b840 329853805 C Bo:4:055:6 0 68 >
ffff81020441b6c0 329857874 C Bi:4:055:5 0 1522 = 7eff0300 21450005 dc7a8400 00c606f5 7c451175 cf19e0aa 5a0050c5 90a882f7
ffff8101f45dca80 329862235 S Bi:4:055:5 -115 16384 <
ffff8101f45dca80 329915871 C Bi:4:055:5 -2 0
ffff8101f45dca80 329916479 S Bo:4:055:6 -115 60 = 7eff0300 21450000 346cde40 0040064e cb19e0aa 5a451175 cfc59000 5000254d
ffff8101f45dc6c0 329916559 S Bi:4:055:5 -115 16384 <
ffff8101f45dca80 329916807 C Bo:4:055:6 0 60 >
ffff8101f45dc6c0 329918864 C Bi:4:055:5 0 1522 = 7eff0300 21450005 dc80d400 00c606ef 2c451175 cf19e0aa 5a0050c5 90a88308
ffff8101f45dc6c0 329921399 S Bi:4:055:5 -115 16384 <
ffff8101f45dc6c0 329959872 C Bi:4:055:5 0 1521 = 7eff0300 21450005 dc82ac00 00c606ed 54451175 cf19e0aa 5a0050c5 91a88816
ffff8101f45dc6c0 329966116 S Bi:4:055:5 -115 16384 <
ffff8101f45dc6c0 330014876 C Bi:4:055:5 0 1521 = 7eff0300 21450005 dc82b000 00c606ed 50451175 cf19e0aa 5a0050c5 91a8881b
ffff8101f45dc6c0 330018092 S Bi:4:055:5 -115 16384 <
ffff8101f45dc6c0 330071881 C Bi:4:055:5 -2 0
ffff8101f45dc6c0 330072762 S Bo:4:055:6 -115 48 = 7eff0300 21450000 286cdf40 0040064e d619e0aa 5a451175 cfc59000 5000254d
ffff8101f45dca80 330072894 S Bi:4:055:5 -115 16384 <
ffff8101f45dc6c0 330073816 C Bo:4:055:6 0 48 >
ffff8101f45dc6c0 330074146 S Bo:4:055:6 -115 135 = 7eff0300 21450000 3ca18940 0040061a 1819e0aa 5a451175 cfc59100 50004b8a
ffff8101f45dc6c0 330074816 C Bo:4:055:6 0 135 >
ffff8101f45dca80 330083877 C Bi:4:055:5 0 1520 = 7eff0300 21450005 dc87a000 00c606e8 60451175 cf19e0aa 5a0050c5 91a88821
ffff8101f45dca80 330090199 S Bi:4:055:5 -115 16384 <
ffff8101f45dca80 330134886 C Bi:4:055:5 0 1530 = 7eff0300 21450005 dc8ce000 00c606e3 20451175 cf19e0aa 5a0050c5 91a88827
ffff8101f45dca80 330138173 S Bi:4:055:5 -115 16384 <
ffff8101f45dca80 330191886 C Bi:4:055:5 -2 0
ffff8101f45dca80 330192647 S Bo:4:055:6 -115 68 = 7eff0300 21450000 3ca18b40 0040061a 1619e0aa 5a451175 cfc59100 50004b8a
ffff8101f45dc6c0 330192738 S Bi:4:055:5 -115 16384 <
ffff8101f45dca80 330192823 C Bo:4:055:6 0 68 >
ffff8101f45dca80 330193084 S Bo:4:055:6 -115 68 = 7eff0300 21450000 3ca18c40 0040061a 1519e0aa 5a451175 cfc59100 50004b8a
ffff8101f45dca80 330193826 C Bo:4:055:6 0 68 >
ffff8101f45dc6c0 330194881 C Bi:4:055:5 0 1526 = 7eff0300 21450005 dc8ce400 00c606e3 1c451175 cf19e0aa 5a0050c5 91a887d1
ffff8101f45dc6c0 330197477 S Bi:4:055:5 -115 16384 <
ffff8101f45dc6c0 330247892 C Bi:4:055:5 -2 0
ffff8101f45dc6c0 330248514 S Bo:4:055:6 -115 60 = 7eff0300 21450000 34a18d40 0040061a 1c19e0aa 5a451175 cfc59100 50004b8a
ffff8101f45dca80 330248571 S Bi:4:055:5 -115 16384 <
ffff8101f45dc6c0 330248826 C Bo:4:055:6 0 60 >
ffff8101f45dca80 330259897 C Bi:4:055:5 0 1526 = 7eff0300 21450005 dc8ce800 00c606e3 18451175 cf19e0aa 5a0050c5 91a88804
ffff8101f45dca80 330262439 S Bi:4:055:5 -115 16384 <
ffff8101f45dca80 330315899 C Bi:4:055:5 -2 0
ffff8101f45dca80 330316512 S Bo:4:055:6 -115 48 = 7eff0300 21450000 28a18e40 0040061a 2719e0aa 5a451175 cfc59100 50004b8a
ffff8101f45dc6c0 330316726 S Bi:4:055:5 -115 16384 <
ffff8101f45dca80 330316831 C Bo:4:055:6 0 48 >
ffff8101f45dc6c0 330319888 C Bi:4:055:5 0 1523 = 7eff0300 21450005 dc8cec00 00c606e3 14451175 cf19e0aa 5a0050c5 91a8882c
ffff8101f45dc6c0 330326244 S Bi:4:055:5 -115 16384 <
ffff8101f45dc6c0 330351903 C Bi:4:055:5 0 1519 = 7eff0300 21450005 dc8da400 00c606e2 5c451175 cf19e0aa 5a0050c5 90a8831f
ffff81019bcb6c00 330358474 S Bi:4:055:5 -115 16384 <
ffff81019bcb6c00 330407906 C Bi:4:055:5 0 1516 = 7eff0300 21450005 dc904c00 00c606df b4451175 cf19e0aa 5a0050c5 90a88324
ffff81019bcb6c00 330414199 S Bi:4:055:5 -115 16384 <
ffff81019bcb6c00 330467906 C Bi:4:055:5 -2 0
ffff81019bcb6c00 330468828 S Bo:4:055:6 -115 48 = 7eff0300 21450000 28a18f40 0040061a 2619e0aa 5a451175 cfc59100 50004b8a
ffff81019bcb69c0 330469112 S Bi:4:055:5 -115 16384 <
ffff81019bcb6c00 330469838 C Bo:4:055:6 0 48 >
ffff81019bcb6c00 330470122 S Bo:4:055:6 -115 95 = 7eff0300 21450000 286ce040 0040064e d519e0aa 5a451175 cfc59000 5000254d
ffff81019bcb6c00 330470842 C Bo:4:055:6 0 95 >
ffff81019bcb69c0 330471897 C Bi:4:055:5 0 1523 = 7eff0300 21450005 dc905000 00c606df b0451175 cf19e0aa 5a0050c5 90a8832a
ffff81019bcb69c0 330478229 S Bi:4:055:5 -115 16384 <
ffff81019bcb69c0 330531909 C Bi:4:055:5 -2 1519 = 7eff0300 21450005 dc966400 00c606d9 9c451175 cf19e0aa 5a0050c5 90a88330
ffff81019bcb69c0 330532544 S Bo:4:055:6 -115 48 = 7eff0300 21450000 286ce240 0040064e d319e0aa 5a451175 cfc59000 5000254d
ffff81019bcb6c00 330532762 S Bi:4:055:5 -115 16384 <
ffff81019bcb69c0 330532843 C Bo:4:055:6 0 48 >
ffff81019bcb6c00 330583914 C Bi:4:055:5 -2 0
ffff81019bcb6c00 330584066 S Bi:4:055:5 -115 16384 <
ffff81019bcb6c00 330590909 C Bi:4:055:5 0 1530 = 7eff0300 21450005 dc966800 00c606d9 98451175 cf19e0aa 5a0050c5 91a88832
ffff81019bcb6c00 330594225 S Bi:4:055:5 -115 16384 <
ffff81019bcb6c00 330637920 C Bi:4:055:5 0 1523 = 7eff0300 21450005 dc97a800 00c606d8 58451175 cf19e0aa 5a0050c5 91a88838
ffff81019bcb6c00 330642464 S Bi:4:055:5 -115 16384 <
ffff81019bcb6c00 330692922 C Bi:4:055:5 0 1527 = 7eff0300 21450005 dc9a5000 00c606d5 b0451175 cf19e0aa 5a0050c5 91a8883e
ffff81019bcb6c00 330698222 S Bi:4:055:5 -115 16384 <
ffff81019bcb6c00 330751920 C Bi:4:055:5 -2 448 = 7eff0300 21450005 dc9b2000 00c606d4 e0451175 cf19e0aa 5a0050c5 91a88843
ffff81019bcb6c00 330752895 S Bo:4:055:6 -115 48 = 7eff0300 21450000 28a19040 0040061a 2519e0aa 5a451175 cfc59100 50004b8a
ffff81019bcb69c0 330753179 S Bi:4:055:5 -115 16384 <
ffff81019bcb6c00 330753855 C Bo:4:055:6 0 48 >
ffff81019bcb6c00 330754130 S Bo:4:055:6 -115 95 = 7eff0300 21450000 28a19140 0040061a 2419e0aa 5a451175 cfc59100 50004b8a
ffff81019bcb69c0 330754912 C Bi:4:055:5 0 1070 = e9b79e01 f0f785e3 f88f2f87 affc3bad 687a96b7 65f023c0 d0fc39d2 be1fcff0
ffff81019bcb6c00 330754918 C Bo:4:055:6 0 95 >
ffff81019bcb6c00 330757527 S Bi:4:055:5 -115 16384 <
ffff81019bcb6c00 330807924 C Bi:4:055:5 -2 0
ffff81019bcb6c00 330808266 S Bi:4:055:5 -115 16384 <
ffff81019bcb6c00 330817931 C Bi:4:055:5 0 1517 = 7eff0300 21450005 dc9cc000 00c606d3 40451175 cf19e0aa 5a0050c5 91a88849
ffff81019bcb6c00 330822263 S Bi:4:055:5 -115 16384 <
ffff81019bcb6c00 330875930 C Bi:4:055:5 -2 0
ffff81012b753000 330876541 S Bo:4:055:6 -115 60 = 7eff0300 21450000 34a19340 0040061a 1619e0aa 5a451175 cfc59100 50004b8a
ffff81012b753cc0 330876693 S Bi:4:055:5 -115 16384 <
ffff81012b753000 330876862 C Bo:4:055:6 0 60 >
ffff81012b753cc0 330878918 C Bi:4:055:5 0 1526 = 7eff0300 21450005 dca12000 00c606ce e0451175 cf19e0aa 5a0050c5 91a8884f
ffff81012b753cc0 330881492 S Bi:4:055:5 -115 16384 <
ffff81012b753cc0 330920935 C Bi:4:055:5 0 1516 = 7eff0300 21450005 dca85000 00c606c7 b0451175 cf19e0aa 5a0050c5 91a88854
ffff81012b753cc0 330926508 S Bi:4:055:5 -115 16384 <
ffff81012b753cc0 330974938 C Bi:4:055:5 0 1525 = 7eff0300 21450005 dca85400 00c606c7 ac451175 cf19e0aa 5a0050c5 90a88335
ffff81012b753cc0 330978217 S Bi:4:055:5 -115 16384 <
ffff81012b753cc0 331031938 C Bi:4:055:5 -2 0
ffff81012b753cc0 331032666 S Bi:4:055:5 -115 16384 <
ffff81012b753000 331033190 S Bo:4:055:6 -115 178 = 7eff0300 21450000 34a19440 0040061a 1519e0aa 5a451175 cfc59100 50004b8a
ffff81012b753000 331033871 C Bo:4:055:6 0 178 >
ffff81012b753cc0 331043939 C Bi:4:055:5 0 1526 = 7eff0300 21450005 dca85800 00c606c7 a8451175 cf19e0aa 5a0050c5 90a8833b
ffff81012b753cc0 331047886 S Bi:4:055:5 -115 16384 <
ffff81012b753cc0 331070941 C Bi:4:055:5 0 1525 = 7eff0300 21450005 dcaa6c00 00c606c5 94451175 cf19e0aa 5a0050c5 90a88341
ffff81012b753cc0 331074311 S Bi:4:055:5 -115 16384 <
ffff81012b753cc0 331127944 C Bi:4:055:5 -2 0
ffff81012b753cc0 331128532 S Bi:4:055:5 -115 16384 <
ffff81012b753000 331128946 S Bo:4:055:6 -115 119 = 7eff0300 21450000 346ce440 0040064e c519e0aa 5a451175 cfc59000 5000254d
ffff81012b753000 331129876 C Bo:4:055:6 0 119 >
ffff81012b753cc0 331131932 C Bi:4:055:5 0 1520 = 7eff0300 21450005 dcb3d800 00c606bc 28451175 cf19e0aa 5a0050c5 91a8885a
ffff81012b753cc0 331138130 S Bi:4:055:5 -115 16384 <
ffff81012b753cc0 331191949 C Bi:4:055:5 -2 1524 = 7eff0300 21450005 dcb3ec00 00c606bc 14451175 cf19e0aa 5a0050c5 91a88860
ffff81012b753cc0 331192339 S Bi:4:055:5 -115 16384 <
ffff81012b753000 331192632 S Bo:4:055:6 -115 60 = 7eff0300 21450000 34a19640 0040061a 1319e0aa 5a451175 cfc59100 50004b8a
ffff81012b753000 331192880 C Bo:4:055:6 0 60 >
ffff81012b753cc0 331243952 C Bi:4:055:5 -2 0
ffff81012b753cc0 331244114 S Bi:4:055:5 -115 16384 <
ffff81012b753cc0 331251948 C Bi:4:055:5 0 1520 = 7eff0300 21450005 dcb49800 00c606bb 68451175 cf19e0aa 5a0050c5 91a88865
ffff81012b753cc0 331258231 S Bi:4:055:5 -115 16384 <
ffff81012b753cc0 331297955 C Bi:4:055:5 0 1528 = 7eff0300 21450005 dcba8000 00c606b5 80451175 cf19e0aa 5a0050c5 91a8886b
ffff81012b753cc0 331302583 S Bi:4:055:5 -115 16384 <
ffff81012b753cc0 331352958 C Bi:4:055:5 0 1518 = 7eff0300 21450005 dcbfa000 00c606b0 60451175 cf19e0aa 5a0050c5 91a88843
ffff8101851a56c0 331358470 S Bi:4:055:5 -115 16384 <
ffff8101ef1153c0 331363683 S Bo:4:055:10 -115 31 = 55534243 72060000 00000000 00000600 00000000 00000000 00000000 000000
ffff8101ef1153c0 331363890 C Bo:4:055:10 0 31 >
ffff8101ef1153c0 331363897 S Bi:4:055:9 -115 13 <
ffff8101ef1153c0 331364887 C Bi:4:055:9 0 13 = 55534253 72060000 00000000 01
ffff8101ef1153c0 331364894 S Bo:4:055:10 -115 31 = 55534243 73060000 12000000 80000603 00000012 00000000 00000000 000000
ffff8101ef1153c0 331365887 C Bo:4:055:10 0 31 >
ffff8101851a5d80 331365896 S Bi:4:055:9 -115 18 <
ffff8101851a5d80 331366887 C Bi:4:055:9 0 18 = 70000200 0000000a 00000000 3a000000 0000
ffff8101ef1153c0 331366894 S Bi:4:055:9 -115 13 <
ffff8101ef1153c0 331368887 C Bi:4:055:9 0 13 = 55534253 73060000 00000000 00
ffff8101ef1153c0 331368919 S Bo:4:055:10 -115 31 = 55534243 74060000 00000000 00000600 00000000 00000000 00000000 000000
ffff8101ef1153c0 331369888 C Bo:4:055:10 0 31 >
ffff8101ef1153c0 331369893 S Bi:4:055:9 -115 13 <
ffff8101ef1153c0 331370887 C Bi:4:055:9 0 13 = 55534253 74060000 00000000 01
ffff8101ef1153c0 331370893 S Bo:4:055:10 -115 31 = 55534243 75060000 12000000 80000603 00000012 00000000 00000000 000000
ffff8101ef1153c0 331371888 C Bo:4:055:10 0 31 >
ffff8101851a5d80 331371896 S Bi:4:055:9 -115 18 <
ffff8101851a5d80 331372888 C Bi:4:055:9 0 18 = 70000200 0000000a 00000000 3a000000 0000
ffff8101ef1153c0 331372894 S Bi:4:055:9 -115 13 <
ffff8101ef1153c0 331373887 C Bi:4:055:9 0 13 = 55534253 75060000 00000000 00
ffff8101851a56c0 331411959 C Bi:4:055:5 -2 0
ffff8101851a56c0 331412685 S Bi:4:055:5 -115 16384 <
ffff8101851a59c0 331413256 S Bo:4:055:6 -115 194 = 7eff0300 21450000 3ca19740 0040061a 0a19e0aa 5a451175 cfc59100 50004b8a
ffff8101851a59c0 331413896 C Bo:4:055:6 0 194 >
ffff8101851a56c0 331417953 C Bi:4:055:5 0 1522 = 7eff0300 21450005 dcc0e000 00c606af 20451175 cf19e0aa 5a0050c5 90a88346
ffff8101851a56c0 331422322 S Bi:4:055:5 -115 16384 <
ffff8101851a56c0 331472961 C Bi:4:055:5 -2 1519 = 7eff0300 21450005 dcc4ac00 00c606ab 54451175 cf19e0aa 5a0050c5 90a88330
ffff8101851a56c0 331473366 S Bi:4:055:5 -115 16384 <
ffff8101851a59c0 331473658 S Bo:4:055:6 -115 60 = 7eff0300 21450000 346ce640 0040064e c319e0aa 5a451175 cfc59000 5000254d
ffff8101851a59c0 331473896 C Bo:4:055:6 0 60 >
ffff8101851a56c0 331523964 C Bi:4:055:5 -2 0
ffff8101851a56c0 331524118 S Bi:4:055:5 -115 16384 <
ffff8101851a56c0 331575970 C Bi:4:055:5 -2 0
ffff8101851a56c0 331577934 S Bi:4:055:5 -115 16384 <
ffff8101851a56c0 331628974 C Bi:4:055:5 -2 0
ffff8101851a56c0 331629119 S Bi:4:055:5 -115 16384 <
ffff8101851a56c0 331679975 C Bi:4:055:5 -2 0
ffff8101851a56c0 331680118 S Bi:4:055:5 -115 16384 <
ffff8101851a56c0 331694971 C Bi:4:055:5 0 1524 = 7eff0300 21450005 dcd57800 00c6069a 88451175 cf19e0aa 5a0050c5 91a88860
ffff8101851a56c0 331698162 S Bi:4:055:5 -115 16384 <
ffff8101851a56c0 331751978 C Bi:4:055:5 -2 0
ffff8101851a56c0 331752352 S Bi:4:055:5 -115 16384 <
ffff8101851a59c0 331752646 S Bo:4:055:6 -115 48 = 7eff0300 21450000 28a19a40 0040061a 1b19e0aa 5a451175 cfc59100 50004b8a
ffff8101851a59c0 331752911 C Bo:4:055:6 0 48 >
ffff8101851a56c0 331760972 C Bi:4:055:5 0 1523 = 7eff0300 21450005 dcd57c00 00c6069a 84451175 cf19e0aa 5a0050c5 91a88871
ffff8101851a56c0 331768101 S Bi:4:055:5 -115 16384 <
ffff8101851a56c0 331819985 C Bi:4:055:5 -2 1524 = 7eff0300 21450005 dcd59800 00c6069a 68451175 cf19e0aa 5a0050c5 91a88877
ffff8101851a56c0 331820383 S Bi:4:055:5 -115 16384 <
ffff8101851a59c0 331820694 S Bo:4:055:6 -115 48 = 7eff0300 21450000 28a19b40 0040061a 1a19e0aa 5a451175 cfc59100 50004b8a
ffff8101851a59c0 331820916 C Bo:4:055:6 0 48 >
ffff8101851a56c0 331851988 C Bi:4:055:5 0 1528 = 7eff0300 21450005 dcd59c00 00c6069a 64451175 cf19e0aa 5a0050c5 91a8887c
ffff8101ef194d80 331858253 S Bi:4:055:5 -115 16384 <
ffff8101ef194d80 331911990 C Bi:4:055:5 -2 1517 = 7eff0300 21450005 dcd90c00 00c60696 f4451175 cf19e0aa 5a0050c5 90a8834c
ffff8101ef194d80 331912440 S Bi:4:055:5 -115 16384 <
ffff8101ef194f00 331912760 S Bo:4:055:6 -115 60 = 7eff0300 21450000 34a19c40 0040061a 0d19e0aa 5a451175 cfc59100 50004b8a
ffff8101ef194f00 331912919 C Bo:4:055:6 0 60 >
ffff8101ef194d80 331963986 C Bi:4:055:5 -2 0
ffff8101ef194d80 331964130 S Bi:4:055:5 -115 16384 <
ffff8101ef194d80 332015989 C Bi:4:055:5 -2 0
ffff8101ef194d80 332016105 S Bi:4:055:5 -115 16384 <
ffff8101ef194d80 332030986 C Bi:4:055:5 0 1523 = 7eff0300 21450005 dce25c00 00c6068d a4451175 cf19e0aa 5a0050c5 91a88882
ffff8101ef194d80 332034120 S Bi:4:055:5 -115 16384 <
ffff8101ef194d80 332087996 C Bi:4:055:5 -2 0
ffff8101ef194d80 332088362 S Bi:4:055:5 -115 16384 <
ffff8101ef194f00 332088680 S Bo:4:055:6 -115 60 = 7eff0300 21450000 34a19d40 0040061a 0c19e0aa 5a451175 cfc59100 50004b8a
ffff8101ef194f00 332088929 C Bo:4:055:6 0 60 >
ffff8101ef194d80 332132996 C Bi:4:055:5 0 1519 = 7eff0300 21450005 dce58400 00c6068a 7c451175 cf19e0aa 5a0050c5 91a88888
ffff8101ef194d80 332138157 S Bi:4:055:5 -115 16384 <
ffff8101ef194d80 332192002 C Bi:4:055:5 -2 0
ffff8101ef194d80 332192531 S Bi:4:055:5 -115 16384 <
ffff8101ef194a80 332193010 S Bo:4:055:6 -115 60 = 7eff0300 21450000 34a19e40 0040061a 0b19e0aa 5a451175 cfc59100 50004b8a
ffff8101ef194a80 332193934 C Bo:4:055:6 0 60 >
ffff8101ef194d80 332212001 C Bi:4:055:5 0 1523 = 7eff0300 21450005 dce89800 00c60687 68451175 cf19e0aa 5a0050c5 91a8888d
ffff8101ef194d80 332218138 S Bi:4:055:5 -115 16384 <
ffff8101ef194d80 332272005 C Bi:4:055:5 -2 0
ffff8101ef194d80 332272382 S Bi:4:055:5 -115 16384 <
ffff8101ef194a80 332272766 S Bo:4:055:6 -115 60 = 7eff0300 21450000 34a19f40 0040061a 0a19e0aa 5a451175 cfc59100 50004b8a
ffff8101ef194a80 332272939 C Bo:4:055:6 0 60 >
ffff8101ef194d80 332324004 C Bi:4:055:5 -2 0
ffff8101ef194d80 332324118 S Bi:4:055:5 -115 16384 <
ffff8101ef194d80 332360013 C Bi:4:055:5 0 1524 = 7eff0300 21450005 dcf57400 00c6067a 8c451175 cf19e0aa 5a0050c5 91a88877
ffff81005c628e40 332367477 S Bi:4:055:5 -115 16384 <
ffff81005c628e40 332420013 C Bi:4:055:5 -2 0
ffff81005c628e40 332420581 S Bo:4:055:6 -115 48 = 7eff0300 21450000 28a1a040 0040061a 1519e0aa 5a451175 cfc59100 50004b8a
ffff81005c628900 332420644 S Bi:4:055:5 -115 16384 <
ffff81005c628e40 332420947 C Bo:4:055:6 0 48 >
ffff81005c628900 332472014 C Bi:4:055:5 -2 0
ffff81005c628900 332472158 S Bi:4:055:5 -115 16384 <
ffff81005c628900 332524018 C Bi:4:055:5 -2 0
ffff81005c628900 332524143 S Bi:4:055:5 -115 16384 <
ffff81005c628900 332541017 C Bi:4:055:5 0 1519 = 7eff0300 21450005 dc02b400 00c6066d 4d451175 cf19e0aa 5a0050c5 91a88893
ffff81005c628900 332546158 S Bi:4:055:5 -115 16384 <
ffff81005c628900 332600021 C Bi:4:055:5 -2 0
ffff81005c628900 332600608 S Bo:4:055:6 -115 48 = 7eff0300 21450000 28a1a140 0040061a 1419e0aa 5a451175 cfc59100 50004b8a
ffff81005c628e40 332600672 S Bi:4:055:5 -115 16384 <
ffff81005c628900 332600957 C Bo:4:055:6 0 48 >
ffff81005c628e40 332653029 C Bi:4:055:5 -2 0
ffff8101f885cf00 332653165 S Bi:4:055:5 -115 16384 <
ffff8101f885cf00 332688033 C Bi:4:055:5 0 1519 = 7eff0300 21450005 dc08b000 00c60667 51451175 cf19e0aa 5a0050c5 91a88899
ffff8101f885cf00 332691058 S Bi:4:055:5 -115 16384 <
ffff8101f885cf00 332745032 C Bi:4:055:5 -2 0
ffff81005c628900 332745640 S Bo:4:055:6 -115 49 = 7eff0300 21450000 28a1a240 0040061a 1319e0aa 5a451175 cfc59100 50004b8a
ffff8101f885cf00 332745768 S Bi:4:055:5 -115 16384 <
ffff81005c628900 332745967 C Bo:4:055:6 0 49 >
ffff8101f885cf00 332751696 C Bi:4:055:5 0 1523 = 7eff0300 21450005 dc08b400 00c60667 4d451175 cf19e0aa 5a0050c5 91a8889e
ffff8101f885cf00 332754721 S Bi:4:055:5 -115 16384 <
ffff8101f885cf00 332809037 C Bi:4:055:5 -2 0
ffff81005c628900 332809653 S Bo:4:055:6 -115 48 = 7eff0300 21450000 28a1a340 0040061a 1219e0aa 5a451175 cfc59100 50004b8a
ffff8101f885cf00 332809765 S Bi:4:055:5 -115 16384 <
ffff81005c628900 332809971 C Bo:4:055:6 0 48 >
ffff8101f885cf00 332861043 C Bi:4:055:5 -2 0
ffff8101f885cf00 332861150 S Bi:4:055:5 -115 16384 <
ffff8101f885cf00 332900042 C Bi:4:055:5 0 1523 = 7eff0300 21450005 dc117800 00c6065e 89451175 cf19e0aa 5a0050c5 91a888a4
ffff8101f885cf00 332902723 S Bi:4:055:5 -115 16384 <
ffff8101f885cf00 332957047 C Bi:4:055:5 -2 0
ffff8100897df000 332957633 S Bo:4:055:6 -115 48 = 7eff0300 21450000 28a1a440 0040061a 1119e0aa 5a451175 cfc59100 50004b8a
ffff8101f885cf00 332957732 S Bi:4:055:5 -115 16384 <
ffff8100897df000 332957979 C Bo:4:055:6 0 48 >
ffff8101f885cf00 333009049 C Bi:4:055:5 -2 0
ffff8101f885cf00 333009150 S Bi:4:055:5 -115 16384 <
ffff8101f885cf00 333038049 C Bi:4:055:5 0 1535 = 7eff0300 21450005 dc18dc00 00c60657 25451175 cf19e0aa 5a0050c5 91a888aa
ffff8101f885cf00 333042652 S Bi:4:055:5 -115 16384 <
ffff8101f885cf00 333081055 C Bi:4:055:5 0 1518 = 7eff0300 21450005 dc1c0000 00c60654 01451175 cf19e0aa 5a0050c5 91a888b0
ffff8101f885cf00 333086631 S Bi:4:055:5 -115 16384 <
ffff8101f885cf00 333141055 C Bi:4:055:5 -2 0
ffff8100897df840 333141818 S Bo:4:055:6 -115 49 = 7eff0300 21450000 28a1a540 0040061a 1019e0aa 5a451175 cfc59100 50004b8a
ffff8100897df840 333141988 C Bo:4:055:6 0 49 >
ffff8101f885cf00 333142011 S Bi:4:055:5 -115 16384 <
ffff8100897df9c0 333143935 S Bo:4:055:6 -115 48 = 7eff0300 21450000 28a1a640 0040061a 0f19e0aa 5a451175 cfc59100 50004b8a
ffff8100897df9c0 333144989 C Bo:4:055:6 0 48 >
ffff8101f885cf00 333193065 C Bi:4:055:5 -2 0
ffff8101f885cf00 333193192 S Bi:4:055:5 -115 16384 <
ffff8101f885cf00 333232063 C Bi:4:055:5 0 1522 = 7eff0300 21450005 dc217400 00c6064e 8d451175 cf19e0aa 5a0050c5 91a888b5
ffff8101f885cf00 333234701 S Bi:4:055:5 -115 16384 <
ffff8101f885cf00 333288067 C Bi:4:055:5 0 1521 = 7eff0300 21450005 dc217800 00c6064e 89451175 cf19e0aa 5a0050c5 91a888bb
ffff8101f885cf00 333290647 S Bi:4:055:5 -115 16384 <
ffff8101f885cf00 333345067 C Bi:4:055:5 -2 0
ffff81010845ea80 333345847 S Bo:4:055:6 -115 48 = 7eff0300 21450000 28a1a740 0040061a 0e19e0aa 5a451175 cfc59100 50004b8a
ffff81010845ea80 333345999 C Bo:4:055:6 0 48 >
ffff8101f885cf00 333346059 S Bi:4:055:5 -115 16384 <
ffff81010845ea80 333346272 S Bo:4:055:6 -115 48 = 7eff0300 21450000 28a1a840 0040061a 0d19e0aa 5a451175 cfc59100 50004b8a
ffff81010845ea80 333347005 C Bo:4:055:6 0 48 >
ffff8101ef1153c0 333363681 S Bo:4:055:10 -115 31 = 55534243 76060000 00000000 00000600 00000000 00000000 00000000 000000
ffff8101ef1153c0 333364001 C Bo:4:055:10 0 31 >
ffff8101ef1153c0 333364009 S Bi:4:055:9 -115 13 <
ffff8101ef1153c0 333364999 C Bi:4:055:9 0 13 = 55534253 76060000 00000000 01
ffff8101ef1153c0 333365006 S Bo:4:055:10 -115 31 = 55534243 77060000 12000000 80000603 00000012 00000000 00000000 000000
ffff8101ef1153c0 333365999 C Bo:4:055:10 0 31 >
ffff81004a0dd180 333366009 S Bi:4:055:9 -115 18 <
ffff81004a0dd180 333366999 C Bi:4:055:9 0 18 = 70000200 0000000a 00000000 3a000000 0000
ffff8101ef1153c0 333367006 S Bi:4:055:9 -115 13 <
ffff8101ef1153c0 333367999 C Bi:4:055:9 0 13 = 55534253 77060000 00000000 00
ffff8101ef1153c0 333368036 S Bo:4:055:10 -115 31 = 55534243 78060000 00000000 00000600 00000000 00000000 00000000 000000
ffff8101ef1153c0 333368999 C Bo:4:055:10 0 31 >
ffff8101ef1153c0 333369005 S Bi:4:055:9 -115 13 <
ffff8101ef1153c0 333369999 C Bi:4:055:9 0 13 = 55534253 78060000 00000000 01
ffff8101ef1153c0 333370005 S Bo:4:055:10 -115 31 = 55534243 79060000 12000000 80000603 00000012 00000000 00000000 000000
ffff8101ef1153c0 333370998 C Bo:4:055:10 0 31 >
ffff81004a0dd180 333371006 S Bi:4:055:9 -115 18 <
ffff81004a0dd180 333372006 C Bi:4:055:9 0 18 = 70000200 0000000a 00000000 3a000000 0000
ffff8101ef1153c0 333372106 S Bi:4:055:9 -115 13 <
ffff8101ef1153c0 333373012 C Bi:4:055:9 0 13 = 55534253 79060000 00000000 00
ffff8101f885cf00 333397069 C Bi:4:055:5 -2 0
ffff8101f885cf00 333397185 S Bi:4:055:5 -115 16384 <
ffff8101f885cf00 333439074 C Bi:4:055:5 0 1522 = 7eff0300 21450005 dc298400 00c60646 7d5d4511 75cf19e0 aa5a0050 c591a888
ffff8101f885cf00 333442711 S Bi:4:055:5 -115 16384 <
ffff8101f885cf00 333495078 C Bi:4:055:5 0 1519 = 7eff0300 21450005 dc298c00 00c60646 75451175 cf19e0aa 5a0050c5 91a888c6
ffff8101f885cf00 333498683 S Bi:4:055:5 -115 16384 <
ffff8101f885cf00 333553078 C Bi:4:055:5 -2 0
ffff81004a0dd180 333553837 S Bo:4:055:6 -115 48 = 7eff0300 21450000 28a1a940 0040061a 0c19e0aa 5a451175 cfc59100 50004b8a
ffff81004a0dd180 333554011 C Bo:4:055:6 0 48 >
ffff8101f885cf00 333554043 S Bi:4:055:5 -115 16384 <
ffff81004a0dd6c0 333555904 S Bo:4:055:6 -115 48 = 7eff0300 21450000 28a1aa40 0040061a 0b19e0aa 5a451175 cfc59100 50004b8a
ffff81004a0dd6c0 333556011 C Bo:4:055:6 0 48 >
ffff8101f885cf00 333605080 C Bi:4:055:5 -2 0
ffff8101f885cf00 333605193 S Bi:4:055:5 -115 16384 <
ffff8101f885cf00 333619090 C Bi:4:055:5 0 1526 = 7eff0300 21450005 dc323800 00c6063d c9451175 cf19e0aa 5a0050c5 91a888cc
ffff8101f885cf00 333623036 S Bi:4:055:5 -115 16384 <
ffff8101f885cf00 333677086 C Bi:4:055:5 -2 0
ffff81004a0dd840 333677674 S Bo:4:055:6 -115 48 = 7eff0300 21450000 28a1ab40 0040061a 0a19e0aa 5a451175 cfc59100 50004b8a
ffff81004a0dd6c0 333677714 S Bi:4:055:5 -115 16384 <
ffff81004a0dd840 333678016 C Bo:4:055:6 0 48 >
ffff81004a0dd6c0 333681076 C Bi:4:055:5 0 1527 = 7eff0300 21450005 dc323c00 00c6063d c5451175 cf19e0aa 5a0050c5 91a888d2
ffff81004a0dd6c0 333686073 S Bi:4:055:5 -115 16384 <
ffff81004a0dd6c0 333735085 C Bi:4:055:5 0 1518 = 7eff0300 21450005 dc324000 00c6063d c1451175 cf19e0aa 5a0050c5 91a888d7
ffff81004a0dd6c0 333738131 S Bi:4:055:5 -115 16384 <
ffff81004a0dd6c0 333792090 C Bi:4:055:5 -2 0
ffff81004a0dd6c0 333792864 S Bo:4:055:6 -115 48 = 7eff0300 21450000 28a1ac40 0040061a 0919e0aa 5a451175 cfc59100 50004b8a
ffff81004a0dd840 333792962 S Bi:4:055:5 -115 16384 <
ffff81004a0dd6c0 333793027 C Bo:4:055:6 0 48 >
ffff81004a0dd6c0 333793267 S Bo:4:055:6 -115 48 = 7eff0300 21450000 28a1ad40 0040061a 0819e0aa 5a451175 cfc59100 50004b8a
ffff81004a0dd6c0 333794023 C Bo:4:055:6 0 48 >
ffff81004a0dd840 333832094 C Bi:4:055:5 0 1523 = 7eff0300 21450005 dc3c3000 00c60633 d1451175 cf19e0aa 5a0050c5 91a888dd
ffff8101ef206d80 333838185 S Bi:4:055:5 -115 16384 <
ffff8101ef206d80 333892097 C Bi:4:055:5 -2 0
ffff8101ef206d80 333892705 S Bo:4:055:6 -115 48 = 7eff0300 21450000 28a1ae40 0040061a 0719e0aa 5a451175 cfc59100 50004b8a
ffff8101ef206c00 333892767 S Bi:4:055:5 -115 16384 <
ffff8101ef206d80 333893029 C Bo:4:055:6 0 48 >
ffff8101ef206c00 333920094 C Bi:4:055:5 0 1525 = 7eff0300 21450005 dc3c3400 00c60633 cd451175 cf19e0aa 5a0050c5 91a888e3
ffff8101ef206c00 333926287 S Bi:4:055:5 -115 16384 <
ffff8101ef206c00 333975101 C Bi:4:055:5 0 1523 = 7eff0300 21450005 dc41e400 00c6062e 1d451175 cf19e0aa 5a0050c5 91a888e9
ffff8101ef206c00 333978205 S Bi:4:055:5 -115 16384 <
ffff8101ef206c00 334032097 C Bi:4:055:5 -2 0
ffff8101ef206c00 334032807 S Bo:4:055:6 -115 48 = 7eff0300 21450000 28a1af40 0040061a 0619e0aa 5a451175 cfc59100 50004b8a
ffff8101ef206d80 334032905 S Bi:4:055:5 -115 16384 <
ffff8101ef206c00 334033037 C Bo:4:055:6 0 48 >
ffff8101ef206c00 334033231 S Bo:4:055:6 -115 48 = 7eff0300 21450000 28a1b040 0040061a 0519e0aa 5a451175 cfc59100 50004b8a
ffff8101ef206c00 334034037 C Bo:4:055:6 0 48 >
ffff8101ef206d80 334058101 C Bi:4:055:5 0 1525 = 7eff0300 21450005 dc4bcc00 00c60624 35451175 cf19e0aa 5a0050c5 91a888ee
ffff8101ef206d80 334062201 S Bi:4:055:5 -115 16384 <
ffff8101ef206d80 334116106 C Bi:4:055:5 -2 0
ffff8101ef206d80 334116693 S Bo:4:055:6 -115 48 = 7eff0300 21450000 28a1b140 0040061a 0419e0aa 5a451175 cfc59100 50004b8a
ffff8101ef206c00 334116756 S Bi:4:055:5 -115 16384 <
ffff8101ef206d80 334117042 C Bo:4:055:6 0 48 >
ffff8101ef206c00 334119098 C Bi:4:055:5 0 1521 = 7eff0300 21450005 dc4ed800 00c60621 29451175 cf19e0aa 5a0050c5 91a888f4
ffff8101ef206c00 334121634 S Bi:4:055:5 -115 16384 <
ffff8101ef206c00 334172105 C Bi:4:055:5 -2 0
ffff8101ef206c00 334172637 S Bo:4:055:6 -115 48 = 7eff0300 21450000 28a1b240 0040061a 0319e0aa 5a451175 cfc59100 50004b8a
ffff8101ef206d80 334172693 S Bi:4:055:5 -115 16384 <
ffff8101ef206c00 334173045 C Bo:4:055:6 0 48 >
ffff8101ef206d80 334178119 C Bi:4:055:5 0 1522 = 7eff0300 21450005 dc56a000 00c60619 61451175 cf19e0aa 5a0050c5 91a888fa
ffff8101ef206d80 334182179 S Bi:4:055:5 -115 16384 <
ffff8101ef206d80 334220110 C Bi:4:055:5 0 1522 = 7eff0300 21450005 dc56a400 00c60619 5d451175 cf19e0aa 5a0050c5 91a888ff
ffff8101ef206d80 334226125 S Bi:4:055:5 -115 16384 <
ffff8101ef206d80 334280118 C Bi:4:055:5 -2 1408 = 7eff0300 21450005 dc597800 00c60616 89451175 cf19e0aa 5a0050c5 90a88330
ffff8101ef206d80 334280878 S Bo:4:055:6 -115 48 = 7eff0300 21450000 28a1b340 0040061a 0219e0aa 5a451175 cfc59100 50004b8a
ffff8101ef206c00 334280976 S Bi:4:055:5 -115 16384 <
ffff8101ef206d80 334281051 C Bo:4:055:6 0 48 >
ffff8101ef206d80 334281235 S Bo:4:055:6 -115 48 = 7eff0300 21450000 28a1b440 0040061a 0119e0aa 5a451175 cfc59100 50004b8a
ffff8101ef206c00 334282111 C Bi:4:055:5 0 111 = f8af53f0 e4fe21d4 fc5abe30 d2adbe2c f86f5c8a e7d0fc11 e338be2a c31787bc
ffff8101ef206d80 334282116 C Bo:4:055:6 0 48 >
ffff8101ef206d80 334283840 S Bi:4:055:5 -115 16384 <
ffff8101ef206d80 334336119 C Bi:4:055:5 -2 0
ffff8101ef206d80 334336315 S Bi:4:055:5 -115 16384 <
ffff8101ef206d80 334388125 C Bi:4:055:5 -2 0
ffff8101ef206d80 334388282 S Bi:4:055:5 -115 16384 <
ffff8101ef206d80 334440124 C Bi:4:055:5 -2 0
ffff8101ef206d80 334440201 S Bi:4:055:5 -115 16384 <
ffff8101ef206d80 334492133 C Bi:4:055:5 -2 0
ffff8101ef206d80 334492283 S Bi:4:055:5 -115 16384 <
ffff8101ef206d80 334530128 C Bi:4:055:5 0 1516 = 7eff0300 21450005 dc5d3000 00c60612 d1451175 cf19e0aa 5a0050c5 91a88905
ffff8101ef206d80 334534356 S Bi:4:055:5 -115 16384 <
ffff8101ef206d80 334536127 C Bi:4:055:5 0 1520 = 7eff0300 21450005 dc5e1400 00c60611 ed451175 cf19e0aa 5a0050c5 91a8890b
ffff8101ef206d80 334542206 S Bi:4:055:5 -115 16384 <
ffff8101ef206d80 334544125 C Bi:4:055:5 0 1058 = 7eff0300 21450005 dc624400 00c6060d bd451175 cf19e0aa 5a0050c5 91a88911
ffff8101ef206d80 334549424 S Bi:4:055:5 -115 16384 <
ffff8101ef206d80 334550125 C Bi:4:055:5 0 465 = f38b3039 ad3c1e3f 2fe20c87 13c4189a 39ccf2fc ce19165d 9bd6cab2 be14c3fc
ffff8101ef206d80 334550935 S Bi:4:055:5 -115 16384 <
ffff8101ef206d80 334553121 C Bi:4:055:5 0 1515 = 7eff0300 21450005 dc66a400 00c60609 5d451175 cf19e0aa 5a0050c5 91a88916
ffff8101ef206d80 334558223 S Bi:4:055:5 -115 16384 <
ffff8101ef206d80 334560126 C Bi:4:055:5 0 1518 = 7eff0300 21450005 dc6ac400 00c60605 3d451175 cf19e0aa 5a0050c5 91a8891c
ffff8101ef206d80 334566238 S Bi:4:055:5 -115 16384 <
ffff8101ef206d80 334612141 C Bi:4:055:5 0 1524 = 7eff0300 21450005 dc6ac800 00c60605 39451175 cf19e0aa 5a0050c5 91a88922
ffff8101ef206d80 334618170 S Bi:4:055:5 -115 16384 <
ffff8101ef206d80 334668142 C Bi:4:055:5 0 1527 = 7eff0300 21450005 dc6acc00 00c60605 35451175 cf19e0aa 5a0050c5 91a88927
ffff8101ef206d80 334674213 S Bi:4:055:5 -115 16384 <
ffff8101ef206d80 334728143 C Bi:4:055:5 -2 0
ffff8101ef206d80 334729694 S Bo:4:055:6 -115 48 = 7eff0300 21450000 28a1b540 0040061a 0019e0aa 5a451175 cfc59100 50004b8a
ffff8101ef206240 334730055 S Bi:4:055:5 -115 16384 <
ffff8101ef206d80 334730102 C Bo:4:055:6 0 48 >
ffff8101ef206d80 334730703 S Bo:4:055:6 -115 283 = 7eff0300 21450000 28a1b640 00400619 ff19e0aa 5a451175 cfc59100 50004b8a
ffff8101ef206d80 334731077 C Bo:4:055:6 0 283 >
ffff8101ef206240 334784152 C Bi:4:055:5 -2 0
ffff8101ef206240 334784378 S Bi:4:055:5 -115 16384 <
ffff8101ef206240 334836152 C Bi:4:055:5 -2 0
ffff8101ef206240 334836274 S Bi:4:055:5 -115 16384 <
ffff8101ef206240 334888152 C Bi:4:055:5 -2 0
ffff8101ef206240 334888286 S Bi:4:055:5 -115 16384 <
ffff8101ef206240 334940149 C Bi:4:055:5 -2 0
ffff8101ef206240 334940245 S Bi:4:055:5 -115 16384 <
ffff8101ef206240 334992157 C Bi:4:055:5 -2 0
ffff8101ef206240 334992271 S Bi:4:055:5 -115 16384 <
ffff8101ef206240 335018154 C Bi:4:055:5 0 1523 = 7eff0300 21450005 dc809c00 00c606ef 64451175 cf19e0aa 5a0050c5 91a8892d
ffff8101ef206240 335022210 S Bi:4:055:5 -115 16384 <
ffff8101ef206240 335060154 C Bi:4:055:5 0 1529 = 7eff0300 21450005 dc80a000 00c606ef 60451175 cf19e0aa 5a0050c5 91a88933
ffff8101ef206240 335066177 S Bi:4:055:5 -115 16384 <
ffff8101ef206240 335120164 C Bi:4:055:5 -2 1518 = 7eff0300 21450005 dc81e000 00c606ee 20451175 cf19e0aa 5a0050c5 91a88938
ffff8101ef206240 335120912 S Bo:4:055:6 -115 48 = 7eff0300 21450000 28a1bc40 00400619 f919e0aa 5a451175 cfc59100 50004b8a
ffff8101ef206c00 335121011 S Bi:4:055:5 -115 16384 <
ffff8101ef206240 335121098 C Bo:4:055:6 0 48 >
ffff8101ef206240 335121290 S Bo:4:055:6 -115 48 = 7eff0300 21450000 28a1bd40 00400619 f819e0aa 5a451175 cfc59100 50004b8a
ffff8101ef206240 335122097 C Bo:4:055:6 0 48 >
ffff8101ef206c00 335152166 C Bi:4:055:5 0 1519 = 7eff0300 21450005 dc81e400 00c606ee 1c451175 cf19e0aa 5a0050c5 91a8893e
ffff8101ef206c00 335160018 S Bi:4:055:5 -115 16384 <
ffff8101ef206c00 335212171 C Bi:4:055:5 -2 1526 = 7eff0300 21450005 dc81f400 00c606ee 0c451175 cf19e0aa 5a0050c5 91a88944
ffff8101ef206c00 335212798 S Bo:4:055:6 -115 60 = 7eff0300 21450000 34a1be40 00400619 eb19e0aa 5a451175 cfc59100 50004b8a
ffff8101ef206240 335212856 S Bi:4:055:5 -115 16384 <
ffff8101ef206c00 335213102 C Bo:4:055:6 0 60 >
ffff8101ef206240 335264173 C Bi:4:055:5 -2 0
ffff8101ef206240 335264327 S Bi:4:055:5 -115 16384 <
ffff8101ef206240 335272172 C Bi:4:055:5 0 1521 = 7eff0300 21450005 dc83cc00 00c606ec 34451175 cf19e0aa 5a0050c5 91a8894a
ffff8101ef206240 335278493 S Bi:4:055:5 -115 16384 <
ffff8101ef206240 335329177 C Bi:4:055:5 -2 0
ffff8101ef206240 335329777 S Bo:4:055:6 -115 68 = 7eff0300 21450000 3ca1bf40 00400619 e219e0aa 5a451175 cfc59100 50004b8a
ffff8101853ca3c0 335329926 S Bi:4:055:5 -115 16384 <
ffff8101ef206240 335330110 C Bo:4:055:6 0 68 >
ffff8101853ca3c0 335360187 C Bi:4:055:5 0 1530 = 7eff0300 21450005 dc83d000 00c606ec 30451175 cf19e0aa 5a0050c5 91a8894f
ffff8101ef1153c0 335363693 S Bo:4:055:10 -115 31 = 55534243 7a060000 00000000 00000600 00000000 00000000 00000000 000000
ffff8101ef1153c0 335364112 C Bo:4:055:10 0 31 >
ffff8101ef1153c0 335364120 S Bi:4:055:9 -115 13 <
ffff8101ef1153c0 335365111 C Bi:4:055:9 0 13 = 55534253 7a060000 00000000 01
ffff8101ef1153c0 335365122 S Bo:4:055:10 -115 31 = 55534243 7b060000 12000000 80000603 00000012 00000000 00000000 000000
ffff8101ef1153c0 335366110 C Bo:4:055:10 0 31 >
ffff8101853ca780 335366121 S Bi:4:055:9 -115 18 <
ffff8101853ca180 335366632 S Bi:4:055:5 -115 16384 <
ffff8101853ca780 335367111 C Bi:4:055:9 0 18 = 70000200 0000000a 00000000 3a000000 0000
ffff8101ef1153c0 335367121 S Bi:4:055:9 -115 13 <
ffff8101ef1153c0 335368110 C Bi:4:055:9 0 13 = 55534253 7b060000 00000000 00
ffff8101ef1153c0 335368152 S Bo:4:055:10 -115 31 = 55534243 7c060000 00000000 00000600 00000000 00000000 00000000 000000
ffff8101ef1153c0 335369110 C Bo:4:055:10 0 31 >
ffff8101ef1153c0 335369115 S Bi:4:055:9 -115 13 <
ffff8101ef1153c0 335370110 C Bi:4:055:9 0 13 = 55534253 7c060000 00000000 01
ffff8101ef1153c0 335370116 S Bo:4:055:10 -115 31 = 55534243 7d060000 12000000 80000603 00000012 00000000 00000000 000000
ffff8101ef1153c0 335371110 C Bo:4:055:10 0 31 >
ffff8101853ca780 335371117 S Bi:4:055:9 -115 18 <
ffff8101853ca780 335372111 C Bi:4:055:9 0 18 = 70000200 0000000a 00000000 3a000000 0000
ffff8101ef1153c0 335372118 S Bi:4:055:9 -115 13 <
ffff8101ef1153c0 335373110 C Bi:4:055:9 0 13 = 55534253 7d060000 00000000 00
ffff8101853ca180 335392183 C Bi:4:055:5 0 1521 = 7eff0300 21450005 dc95b000 00c606da 50451175 cf19e0aa 5a0050c5 91a88955
ffff8101853ca180 335398421 S Bi:4:055:5 -115 16384 <
ffff8101853ca180 335452183 C Bi:4:055:5 -2 0
ffff8101853ca180 335452970 S Bo:4:055:6 -115 68 = 7eff0300 21450000 3ca1c040 00400619 e119e0aa 5a451175 cfc59100 50004b8a
ffff8101853ca180 335453122 C Bo:4:055:6 0 68 >
ffff8101853ca180 335453368 S Bo:4:055:6 -115 68 = 7eff0300 21450000 3ca1c140 00400619 e019e0aa 5a451175 cfc59100 50004b8a
ffff8101853ca3c0 335453466 S Bi:4:055:5 -115 16384 <
ffff8101853ca180 335454116 C Bo:4:055:6 0 68 >
ffff8101853ca3c0 335475188 C Bi:4:055:5 0 1523 = 7eff0300 21450005 dc95b400 00c606da 4c451175 cf19e0aa 5a0050c5 91a8895b
ffff8101853ca3c0 335478517 S Bi:4:055:5 -115 16384 <
ffff8101853ca3c0 335532188 C Bi:4:055:5 -2 0
ffff8101853ca3c0 335532826 S Bo:4:055:6 -115 68 = 7eff0300 21450000 3ca1c240 00400619 df19e0aa 5a451175 cfc59100 50004b8a
ffff8101853ca180 335532966 S Bi:4:055:5 -115 16384 <
ffff8101853ca3c0 335533121 C Bo:4:055:6 0 68 >
ffff8101853ca180 335535177 C Bi:4:055:5 0 1518 = 7eff0300 21450005 dc95b800 00c606da 48451175 cf19e0aa 5a0050c5 91a88960
ffff8101853ca180 335537869 S Bi:4:055:5 -115 16384 <
ffff8101853ca180 335572192 C Bi:4:055:5 0 1528 = 7eff0300 21450005 dc99b800 00c606d6 48451175 cf19e0aa 5a0050c5 91a88966
ffff8101853ca180 335578571 S Bi:4:055:5 -115 16384 <
ffff8101853ca180 335632213 C Bi:4:055:5 -2 1518 = 7eff0300 21450005 dca02400 00c606cf dc451175 cf19e0aa 5a0050c5 91a88938
ffff8101853ca180 335633082 S Bo:4:055:6 -115 68 = 7eff0300 21450000 3ca1c340 00400619 de19e0aa 5a451175 cfc59100 50004b8a
ffff8101853ca3c0 335633302 S Bi:4:055:5 -115 16384 <
ffff8101853ca180 335634128 C Bo:4:055:6 0 68 >
ffff8101853ca180 335634396 S Bo:4:055:6 -115 68 = 7eff0300 21450000 3ca1c440 00400619 dd19e0aa 5a451175 cfc59100 50004b8a
ffff8101853ca180 335635134 C Bo:4:055:6 0 68 >
ffff8101853ca3c0 335685200 C Bi:4:055:5 -2 0
ffff8101eb56ee40 335685379 S Bi:4:055:5 -115 16384 <
ffff8101eb56ee40 335737199 C Bi:4:055:5 -2 0
ffff8101eb56ee40 335737324 S Bi:4:055:5 -115 16384 <
ffff8101eb56ee40 335775199 C Bi:4:055:5 0 1525 = 7eff0300 21450005 dca4d400 00c606cb 2c451175 cf19e0aa 5a0050c5 91a88944
ffff8101eb56ee40 335779031 S Bi:4:055:5 -115 16384 <
ffff8101eb56ee40 335833205 C Bi:4:055:5 -2 0
ffff8101eb56ee40 335833783 S Bo:4:055:6 -115 60 = 7eff0300 21450000 34a1c540 00400619 e419e0aa 5a451175 cfc59100 50004b8a
ffff8101eb56e840 335833909 S Bi:4:055:5 -115 16384 <
ffff8101eb56ee40 335834136 C Bo:4:055:6 0 60 >
ffff8101eb56e840 335885209 C Bi:4:055:5 -2 0
ffff8101eb56e840 335885340 S Bi:4:055:5 -115 16384 <
ffff8101eb56e840 335895205 C Bi:4:055:5 0 1522 = 7eff0300 21450005 dcac6400 00c606c3 9c451175 cf19e0aa 5a0050c5 91a8896c
ffff8101eb56e840 335898726 S Bi:4:055:5 -115 16384 <
ffff8101eb56e840 335953207 C Bi:4:055:5 -2 0
ffff8101eb56e840 335953553 S Bi:4:055:5 -115 16384 <
ffff8101eb56ee40 335953855 S Bo:4:055:6 -115 60 = 7eff0300 21450000 34a1c640 00400619 e319e0aa 5a451175 cfc59100 50004b8a
ffff8101eb56ee40 335954143 C Bo:4:055:6 0 60 >
ffff8101eb56e840 335973208 C Bi:4:055:5 0 1521 = 7eff0300 21450005 dcac7c00 00c606c3 84451175 cf19e0aa 5a0050c5 91a88971
ffff8101eb56e840 335979109 S Bi:4:055:5 -115 16384 <
ffff8101eb56e840 336033214 C Bi:4:055:5 -2 0
ffff8101eb56e840 336033573 S Bi:4:055:5 -115 16384 <
ffff8101eb56ee40 336033872 S Bo:4:055:6 -115 60 = 7eff0300 21450000 34a1c740 00400619 e219e0aa 5a451175 cfc59100 50004b8a
ffff8101eb56ee40 336034148 C Bo:4:055:6 0 60 >
ffff8101eb56e840 336085217 C Bi:4:055:5 -2 0
ffff8101eb56e840 336085347 S Bi:4:055:5 -115 16384 <
ffff8101eb56e840 336135220 C Bi:4:055:5 0 1521 = 7eff0300 21450005 dcb82400 00c606b7 dc451175 cf19e0aa 5a0050c5 91a88977
ffff8101eb56e840 336138950 S Bi:4:055:5 -115 16384 <
ffff8101eb56e840 336193223 C Bi:4:055:5 -2 0
ffff8101eb56e840 336193567 S Bi:4:055:5 -115 16384 <
ffff8101eb56ee40 336193860 S Bo:4:055:6 -115 61 = 7eff0300 21450000 34a1c840 00400619 e119e0aa 5a451175 cfc59100 50004b8a
ffff8101eb56ee40 336194156 C Bo:4:055:6 0 61 >
ffff8101eb56e840 336245232 C Bi:4:055:5 -2 0
ffff8101eb56e840 336245380 S Bi:4:055:5 -115 16384 <
ffff8101eb56e840 336255225 C Bi:4:055:5 0 1522 = 7eff0300 21450005 dcbf2400 00c606b0 dc451175 cf19e0aa 5a0050c5 91a8897d
ffff8101eb56e840 336258924 S Bi:4:055:5 -115 16384 <
ffff8101eb56e840 336313233 C Bi:4:055:5 -2 0
ffff8101eb56e840 336313585 S Bi:4:055:5 -115 16384 <
ffff8101eb56ee40 336313881 S Bo:4:055:6 -115 60 = 7eff0300 21450000 34a1c940 00400619 e019e0aa 5a451175 cfc59100 50004b8a
ffff8101eb56ee40 336314164 C Bo:4:055:6 0 60 >
ffff8101eb56e840 336320226 C Bi:4:055:5 0 1518 = 7eff0300 21450005 dcc2a800 00c606ad 58451175 cf19e0aa 5a0050c5 91a88938
ffff8101eb56e840 336328337 S Bi:4:055:5 -115 16384 <
ffff8101eb56e840 336381236 C Bi:4:055:5 -2 0
ffff8101eb56e840 336381595 S Bi:4:055:5 -115 16384 <
ffff8101eb56ee40 336381977 S Bo:4:055:6 -115 48 = 7eff0300 21450000 28a1ca40 00400619 eb19e0aa 5a451175 cfc59100 50004b8a
ffff8101eb56ee40 336382168 C Bo:4:055:6 0 48 >
ffff8101eb56e840 336433238 C Bi:4:055:5 -2 0
ffff8101eb56e840 336433371 S Bi:4:055:5 -115 16384 <
ffff8101eb56e840 336485242 C Bi:4:055:5 -2 0
ffff8101ef3f2180 336485373 S Bi:4:055:5 -115 16384 <
ffff8101ef3f2180 336536245 C Bi:4:055:5 -2 0
ffff8101ef3f2180 336536386 S Bi:4:055:5 -115 16384 <
ffff8101ef3f2180 336557241 C Bi:4:055:5 0 1526 = 7eff0300 21450005 dcc2ac00 00c606ad 54451175 cf19e0aa 5a0050c5 91a88983
ffff8101ef3f2180 336562215 S Bi:4:055:5 -115 16384 <
ffff8101ef3f2180 336564238 C Bi:4:055:5 0 1526 = 7eff0300 21450005 dccb8800 00c606a4 78451175 cf19e0aa 5a0050c5 91a88988
ffff8101ef3f2180 336570094 S Bi:4:055:5 -115 16384 <
ffff8101ef3f2180 336624250 C Bi:4:055:5 -2 0
ffff8101ef3f2180 336624795 S Bi:4:055:5 -115 16384 <
ffff8101eb56ee40 336625147 S Bo:4:055:6 -115 48 = 7eff0300 21450000 28a1cb40 00400619 ea19e0aa 5a451175 cfc59100 50004b8a
ffff8101eb56ee40 336626185 C Bo:4:055:6 0 48 >
ffff8101eb56ee40 336626367 S Bo:4:055:6 -115 48 = 7eff0300 21450000 28a1cc40 00400619 e919e0aa 5a451175 cfc59100 50004b8a
ffff8101eb56ee40 336627186 C Bo:4:055:6 0 48 >
ffff8101ef3f2180 336638253 C Bi:4:055:5 0 1521 = 7eff0300 21450005 dcd20400 00c6069d fc451175 cf19e0aa 5a0050c5 91a8898e
ffff8101ef3f2180 336642306 S Bi:4:055:5 -115 16384 <
ffff8101ef3f2180 336675257 C Bi:4:055:5 0 1521 = 7eff0300 21450005 dcd41c00 00c6069b e4451175 cf19e0aa 5a0050c5 91a88994
ffff8101ef3f2180 336678249 S Bi:4:055:5 -115 16384 <
ffff8101ef3f2180 336732256 C Bi:4:055:5 -2 0
ffff8101ef3f2180 336732821 S Bi:4:055:5 -115 16384 <
ffff8101eb56e3c0 336733180 S Bo:4:055:6 -115 48 = 7eff0300 21450000 28a1cd40 00400619 e819e0aa 5a451175 cfc59100 50004b8a
ffff8101eb56e3c0 336734195 C Bo:4:055:6 0 48 >
ffff8101eb56e3c0 336734372 S Bo:4:055:6 -115 48 = 7eff0300 21450000 28a1ce40 00400619 e719e0aa 5a451175 cfc59100 50004b8a
ffff8101ef3f2180 336735249 C Bi:4:055:5 0 1527 = 7eff0300 21450005 dcd42000 00c6069b e0451175 cf19e0aa 5a0050c5 91a88999
ffff8101eb56e3c0 336735256 C Bo:4:055:6 0 48 >
ffff8101ef3f2c00 336738587 S Bi:4:055:5 -115 16384 <
ffff8101ef3f2c00 336792265 C Bi:4:055:5 -2 0
ffff8101ef3f2c00 336792664 S Bi:4:055:5 -115 16384 <
ffff8101eb56e3c0 336792937 S Bo:4:055:6 -115 48 = 7eff0300 21450000 28a1cf40 00400619 e619e0aa 5a451175 cfc59100 50004b8a
ffff8101eb56e3c0 336793194 C Bo:4:055:6 0 48 >
ffff8101ef3f2c00 336844262 C Bi:4:055:5 -2 0
ffff81019bd71240 336844417 S Bi:4:055:5 -115 16384 <
ffff81019bd71240 336892267 C Bi:4:055:5 0 1522 = 7eff0300 21450005 dcdd3400 00c60692 cc451175 cf19e0aa 5a0050c5 91a8899f
ffff81019bd71240 336898526 S Bi:4:055:5 -115 16384 <
ffff81019bd71240 336948270 C Bi:4:055:5 0 1532 = 7eff0300 21450005 dcdd3800 00c60692 c8451175 cf19e0aa 5a0050c5 91a889a5
ffff81019bd71240 336954356 S Bi:4:055:5 -115 16384 <
ffff81019bd71240 337008272 C Bi:4:055:5 -2 0
ffff81019bd71240 337008823 S Bi:4:055:5 -115 16384 <
ffff8101eb56e3c0 337009121 S Bo:4:055:6 -115 48 = 7eff0300 21450000 28a1d040 00400619 e519e0aa 5a451175 cfc59100 50004b8a
ffff8101eb56e3c0 337010206 C Bo:4:055:6 0 48 >
ffff8101eb56e3c0 337010375 S Bo:4:055:6 -115 48 = 7eff0300 21450000 28a1d140 00400619 e419e0aa 5a451175 cfc59100 50004b8a
ffff8101eb56e3c0 337011203 C Bo:4:055:6 0 48 >
ffff81019bd71240 337041284 C Bi:4:055:5 0 1530 = 7eff0300 21450005 dce34c00 00c6068c b4451175 cf19e0aa 5a0050c5 91a889ab
ffff81019bd71240 337046544 S Bi:4:055:5 -115 16384 <
ffff81019bd71240 337100278 C Bi:4:055:5 -2 1152 = 7eff0300 21450005 dce35400 00c6068c ac451175 cf19e0aa 5a0050c5 91a889b0
ffff81019bd71240 337100682 S Bi:4:055:5 -115 16384 <
ffff8101eb56e3c0 337100968 S Bo:4:055:6 -115 49 = 7eff0300 21450000 28a1d240 00400619 e319e0aa 5a451175 cfc59100 50004b8a
ffff81019bd71240 337101275 C Bi:4:055:5 0 375 = 86aebc3d a8f85e5f 851ad7c5 0f0dfd3e 61c3181c d3155f0b 8aca5712 35f52e1d
ffff8101eb56e3c0 337101284 C Bo:4:055:6 0 49 >
ffff81019bd71c00 337104488 S Bi:4:055:5 -115 16384 <
ffff81019bd71c00 337155282 C Bi:4:055:5 0 1520 = 7eff0300 21450005 dce40c00 00c6068b f4451175 cf19e0aa 5a0050c5 91a889b6
ffff81019bd71c00 337158449 S Bi:4:055:5 -115 16384 <
ffff81019bd71c00 337212282 C Bi:4:055:5 -2 0
ffff81019bd71c00 337212859 S Bi:4:055:5 -115 16384 <
ffff8101eb56e3c0 337213162 S Bo:4:055:6 -115 60 = 7eff0300 21450000 34a1d340 00400619 d619e0aa 5a451175 cfc59100 50004b8a
ffff8101eb56e3c0 337214214 C Bo:4:055:6 0 60 >
ffff81019bd71c00 337264285 C Bi:4:055:5 -2 0
ffff81019bd71c00 337264441 S Bi:4:055:5 -115 16384 <
ffff81019bd71c00 337279285 C Bi:4:055:5 0 1522 = 7eff0300 21450005 dcef7c00 00c60680 84451175 cf19e0aa 5a0050c5 91a889bc
ffff81019bd71c00 337282196 S Bi:4:055:5 -115 16384 <
ffff81019bd71c00 337335293 C Bi:4:055:5 0 1519 = 7eff0300 21450005 dcef8000 00c60680 80451175 cf19e0aa 5a0050c5 91a889c1
ffff81019bd71c00 337338280 S Bi:4:055:5 -115 16384 <
ffff8101ef1153c0 337363675 S Bo:4:055:10 -115 31 = 55534243 7e060000 00000000 00000600 00000000 00000000 00000000 000000
ffff8101ef1153c0 337364224 C Bo:4:055:10 0 31 >
ffff8101ef1153c0 337364231 S Bi:4:055:9 -115 13 <
ffff8101ef1153c0 337365222 C Bi:4:055:9 0 13 = 55534253 7e060000 00000000 01
ffff8101ef1153c0 337365229 S Bo:4:055:10 -115 31 = 55534243 7f060000 12000000 80000603 00000012 00000000 00000000 000000
ffff8101ef1153c0 337366221 C Bo:4:055:10 0 31 >
ffff81019bd71840 337366230 S Bi:4:055:9 -115 18 <
ffff81019bd71840 337367221 C Bi:4:055:9 0 18 = 70000200 0000000a 00000000 3a000000 0000
ffff8101ef1153c0 337367229 S Bi:4:055:9 -115 13 <
ffff8101ef1153c0 337368221 C Bi:4:055:9 0 13 = 55534253 7f060000 00000000 00
ffff8101ef1153c0 337368255 S Bo:4:055:10 -115 31 = 55534243 80060000 00000000 00000600 00000000 00000000 00000000 000000
ffff8101ef1153c0 337369221 C Bo:4:055:10 0 31 >
ffff8101ef1153c0 337369226 S Bi:4:055:9 -115 13 <
ffff8101ef1153c0 337370222 C Bi:4:055:9 0 13 = 55534253 80060000 00000000 01
ffff8101ef1153c0 337370228 S Bo:4:055:10 -115 31 = 55534243 81060000 12000000 80000603 00000012 00000000 00000000 000000
ffff8101ef1153c0 337371221 C Bo:4:055:10 0 31 >
ffff81019bd71840 337371271 S Bi:4:055:9 -115 18 <
ffff81019bd71840 337372223 C Bi:4:055:9 0 18 = 70000200 0000000a 00000000 3a000000 0000
ffff8101ef1153c0 337372231 S Bi:4:055:9 -115 13 <
ffff8101ef1153c0 337373221 C Bi:4:055:9 0 13 = 55534253 81060000 00000000 00
ffff81019bd71c00 337392293 C Bi:4:055:5 -2 0
ffff81019bd71c00 337392836 S Bi:4:055:5 -115 16384 <
ffff8101eb56e3c0 337393135 S Bo:4:055:6 -115 60 = 7eff0300 21450000 34a1d440 00400619 d519e0aa 5a451175 cfc59100 50004b8a
ffff8101eb56e3c0 337394227 C Bo:4:055:6 0 60 >
ffff8101eb56e3c0 337394417 S Bo:4:055:6 -115 60 = 7eff0300 21450000 34a1d540 00400619 d419e0aa 5a451175 cfc59100 50004b8a
ffff81019bd71c00 337395281 C Bi:4:055:5 0 1522 = 7eff0300 21450005 dcef8c00 00c60680 74451175 cf19e0aa 5a0050c5 91a889c7
ffff8101eb56e3c0 337395289 C Bo:4:055:6 0 60 >
ffff81019bd71d80 337398316 S Bi:4:055:5 -115 16384 <
ffff81019bd71d80 337452296 C Bi:4:055:5 -2 0
ffff81019bd71d80 337452687 S Bi:4:055:5 -115 16384 <
ffff8101eb56e3c0 337452982 S Bo:4:055:6 -115 60 = 7eff0300 21450000 34a1d640 00400619 d319e0aa 5a451175 cfc59100 50004b8a
ffff8101eb56e3c0 337453229 C Bo:4:055:6 0 60 >
ffff81019bd71d80 337455282 C Bi:4:055:5 0 1524 = 7eff0300 21450005 dcf37000 00c6067c 90451175 cf19e0aa 5a0050c5 91a889cd
ffff81019bd71d80 337457851 S Bi:4:055:5 -115 16384 <
ffff81019bd71d80 337513299 C Bi:4:055:5 -2 0
ffff81019bd71d80 337513682 S Bi:4:055:5 -115 16384 <
ffff81019bc0d9c0 337514038 S Bo:4:055:6 -115 60 = 7eff0300 21450000 34a1d740 00400619 d219e0aa 5a451175 cfc59100 50004b8a
ffff81019bc0d9c0 337514232 C Bo:4:055:6 0 60 >
ffff81019bd71d80 337532302 C Bi:4:055:5 0 1525 = 7eff0300 21450005 dcf91000 00c60676 f0451175 cf19e0aa 5a0050c5 91a889d2
ffff81019bd71d80 337538544 S Bi:4:055:5 -115 16384 <
ffff81019bd71d80 337592304 C Bi:4:055:5 -2 0
ffff81019bd71d80 337592682 S Bi:4:055:5 -115 16384 <
ffff81019bc0d9c0 337593013 S Bo:4:055:6 -115 60 = 7eff0300 21450000 34a1d840 00400619 d119e0aa 5a451175 cfc59100 50004b8a
ffff81019bc0d9c0 337593236 C Bo:4:055:6 0 60 >
ffff81019bd71d80 337644307 C Bi:4:055:5 -2 0
ffff81019bd71d80 337644461 S Bi:4:055:5 -115 16384 <
ffff81019bd71d80 337696309 C Bi:4:055:5 -2 0
ffff81019bd71d80 337696450 S Bi:4:055:5 -115 16384 <
ffff81019bd71d80 337713303 C Bi:4:055:5 0 1527 = 7eff0300 21450005 dc034800 00c6066c b9451175 cf19e0aa 5a0050c5 91a889b0
ffff81019bd71d80 337718235 S Bi:4:055:5 -115 16384 <
ffff81019bd71d80 337769315 C Bi:4:055:5 -2 0
ffff81019bd71d80 337769766 S Bi:4:055:5 -115 16384 <
ffff81019bc0d9c0 337770063 S Bo:4:055:6 -115 48 = 7eff0300 21450000 28a1d940 00400619 dc19e0aa 5a451175 cfc59100 50004b8a
ffff81019bc0d9c0 337770249 C Bo:4:055:6 0 48 >
ffff81019bd71d80 337820320 C Bi:4:055:5 0 1527 = 7eff0300 21450005 dc06f400 00c60669 0d451175 cf19e0aa 5a0050c5 91a889d8
ffff81019bd71d80 337826544 S Bi:4:055:5 -115 16384 <
ffff81019bd71d80 337875321 C Bi:4:055:5 0 1528 = 7eff0300 21450005 dc0bb800 00c60664 49451175 cf19e0aa 5a0050c5 91a889de
ffff81019bd71d80 337878251 S Bi:4:055:5 -115 16384 <
ffff81019bd71d80 337932323 C Bi:4:055:5 -2 0
ffff81019bd71d80 337932877 S Bi:4:055:5 -115 16384 <
ffff81019bc0d9c0 337933167 S Bo:4:055:6 -115 48 = 7eff0300 21450000 28a1da40 00400619 db19e0aa 5a451175 cfc59100 50004b8a
ffff81019bc0d9c0 337934257 C Bo:4:055:6 0 48 >
ffff81019bc0d9c0 337934430 S Bo:4:055:6 -115 48 = 7eff0300 21450000 28a1db40 00400619 da19e0aa 5a451175 cfc59100 50004b8a
ffff81019bc0d9c0 337935255 C Bo:4:055:6 0 48 >
ffff81019bd71d80 337984325 C Bi:4:055:5 -2 0
ffff81019bd71d80 337984491 S Bi:4:055:5 -115 16384 <
ffff81019bd71d80 338032330 C Bi:4:055:5 0 1534 = 7eff0300 21450005 dc172c00 00c60658 d5451175 cf19e0aa 5a0050c5 91a889e4
ffff81019bd71d80 338038399 S Bi:4:055:5 -115 16384 <
ffff81019bd71d80 338092332 C Bi:4:055:5 -2 1523 = 7eff0300 21450005 dc173000 00c60658 d1451175 cf19e0aa 5a0050c5 91a889e9
ffff81019bd71d80 338092765 S Bi:4:055:5 -115 16384 <
ffff81019bc0d9c0 338093066 S Bo:4:055:6 -115 48 = 7eff0300 21450000 28a1dc40 00400619 d919e0aa 5a451175 cfc59100 50004b8a
ffff81019bc0d9c0 338093266 C Bo:4:055:6 0 48 >
ffff81019bd71d80 338144334 C Bi:4:055:5 -2 0
ffff81019bd71d80 338144487 S Bi:4:055:5 -115 16384 <
ffff81019bd71d80 338196338 C Bi:4:055:5 -2 0
ffff81019bd71d80 338198394 S Bi:4:055:5 -115 16384 <
ffff81019bd71d80 338212338 C Bi:4:055:5 0 1523 = 7eff0300 21450005 dc1f4800 00c60650 b9451175 cf19e0aa 5a0050c5 91a889ef
ffff81019bd71d80 338218605 S Bi:4:055:5 -115 16384 <
ffff81019bd71d80 338258342 C Bi:4:055:5 0 1524 = 7eff0300 21450005 dc20dc00 00c6064f 25451175 cf19e0aa 5a0050c5 91a889f5
ffff81019bd71d80 338262307 S Bi:4:055:5 -115 16384 <
ffff81019bd71d80 338316346 C Bi:4:055:5 -2 0
ffff81019bd71d80 338316889 S Bi:4:055:5 -115 16384 <
ffff81019bc0d9c0 338317213 S Bo:4:055:6 -115 60 = 7eff0300 21450000 34a1dd40 00400619 cc19e0aa 5a451175 cfc59100 50004b8a
ffff81019bc0d9c0 338318274 C Bo:4:055:6 0 60 >
ffff81019bc0d9c0 338318469 S Bo:4:055:6 -115 60 = 7eff0300 21450000 34a1de40 00400619 cb19e0aa 5a451175 cfc59100 50004b8a
ffff81019bc0d9c0 338319275 C Bo:4:055:6 0 60 >
ffff81019bd71d80 338368348 C Bi:4:055:5 -2 0
ffff81019bd71d80 338368504 S Bi:4:055:5 -115 16384 <
ffff81019bd71d80 338373341 C Bi:4:055:5 0 1516 = 7eff0300 21450005 dc264800 00c60649 b9451175 cf19e0aa 5a0050c5 91a889fa
ffff81019bd71d80 338378236 S Bi:4:055:5 -115 16384 <
ffff81019bd71d80 338432350 C Bi:4:055:5 -2 0
ffff81019bd71d80 338432721 S Bi:4:055:5 -115 16384 <
ffff81019bc0d9c0 338433010 S Bo:4:055:6 -115 60 = 7eff0300 21450000 34a1df40 00400619 ca19e0aa 5a451175 cfc59100 50004b8a
ffff81019bc0d9c0 338433282 C Bo:4:055:6 0 60 >
ffff81019bd71d80 338484354 C Bi:4:055:5 -2 0
ffff81019bd71d80 338484511 S Bi:4:055:5 -115 16384 <
ffff81019bd71d80 338536357 C Bi:4:055:5 -2 0
ffff81019bd71d80 338536499 S Bi:4:055:5 -115 16384 <
ffff81019bd71d80 338588359 C Bi:4:055:5 -2 0
ffff81019bd71d80 338588522 S Bi:4:055:5 -115 16384 <
ffff81019bd71d80 338640364 C Bi:4:055:5 -2 0
ffff81019bd71d80 338640508 S Bi:4:055:5 -115 16384 <
ffff81019bd71d80 338692366 C Bi:4:055:5 -2 0
ffff81019bd71d80 338692509 S Bi:4:055:5 -115 16384 <
ffff81019bd71d80 338694355 C Bi:4:055:5 0 1519 = 7eff0300 21450005 dc344400 00c6063b bd451175 cf19e0aa 5a0050c5 91a88a00
ffff81019bd71d80 338697026 S Bi:4:055:5 -115 16384 <
ffff81019bd71d80 338699358 C Bi:4:055:5 0 1523 = 7eff0300 21450005 dc344800 00c6063b b9451175 cf19e0aa 5a0050c5 91a889e9
ffff81019bd71d80 338701879 S Bi:4:055:5 -115 16384 <
ffff81019bd71d80 338756369 C Bi:4:055:5 -2 0
ffff81019bd71d80 338756915 S Bi:4:055:5 -115 16384 <
ffff81019bc0d9c0 338757249 S Bo:4:055:6 -115 60 = 7eff0300 21450000 34a1e040 00400619 c919e0aa 5a451175 cfc59100 50004b8a
ffff81019bc0d9c0 338758303 C Bo:4:055:6 0 60 >
ffff81019bc0d9c0 338758477 S Bo:4:055:6 -115 48 = 7eff0300 21450000 28a1e140 00400619 d419e0aa 5a451175 cfc59100 50004b8a
ffff81019bc0d9c0 338759300 C Bo:4:055:6 0 48 >
ffff81019bd71d80 338808372 C Bi:4:055:5 -2 0
ffff81019bd71d80 338808537 S Bi:4:055:5 -115 16384 <
ffff81019bd71d80 338860372 C Bi:4:055:5 -2 0
ffff81019bd71d80 338860520 S Bi:4:055:5 -115 16384 <
ffff81019bd71d80 338912379 C Bi:4:055:5 -2 0
ffff81019bd71d80 338912521 S Bi:4:055:5 -115 16384 <
ffff81019bd71d80 338964391 C Bi:4:055:5 -2 0
ffff81019bc0d9c0 338964522 S Bi:4:055:5 -115 16384 <
ffff81019bc0d9c0 339016384 C Bi:4:055:5 -2 0
ffff81019bc0d9c0 339016507 S Bi:4:055:5 -115 16384 <
ffff81019bc0d9c0 339052381 C Bi:4:055:5 0 1531 = 7eff0300 21450005 dc4f4800 00c60620 b9451175 cf19e0aa 5a0050c5 91a88a06
ffff81019bc0d9c0 339058896 S Bi:4:055:5 -115 16384 <
ffff81019bc0d9c0 339112387 C Bi:4:055:5 -2 1526 = 7eff0300 21450005 dc4f4c00 00c60620 b5451175 cf19e0aa 5a0050c5 91a88a0b
ffff81019bc0d9c0 339112739 S Bi:4:055:5 -115 16384 <
ffff81019bc0d600 339113028 S Bo:4:055:6 -115 48 = 7eff0300 21450000 28a1e240 00400619 d319e0aa 5a451175 cfc59100 50004b8a
ffff81019bc0d600 339113322 C Bo:4:055:6 0 48 >
ffff81019bc0d9c0 339164391 C Bi:4:055:5 -2 0
ffff81019bc0d9c0 339164523 S Bi:4:055:5 -115 16384 <
ffff81019bc0d9c0 339168387 C Bi:4:055:5 0 1520 = 7eff0300 21450005 dc4f5000 00c60620 b1451175 cf19e0aa 5a0050c5 91a88a11
ffff81019bc0d9c0 339174924 S Bi:4:055:5 -115 16384 <
ffff81019bc0d9c0 339228397 C Bi:4:055:5 -2 0
ffff81019bc0d9c0 339228749 S Bi:4:055:5 -115 16384 <
ffff81019bc0d600 339229043 S Bo:4:055:6 -115 60 = 7eff0300 21450000 34a1e340 00400619 c619e0aa 5a451175 cfc59100 50004b8a
ffff81019bc0d600 339229326 C Bo:4:055:6 0 60 >
ffff81019bc0d9c0 339280392 C Bi:4:055:5 -2 0
ffff81019bc0d9c0 339280518 S Bi:4:055:5 -115 16384 <
ffff81019bc0d9c0 339332402 C Bi:4:055:5 -2 0
ffff81019bc0d9c0 339332531 S Bi:4:055:5 -115 16384 <
ffff8101ef1153c0 339363669 S Bo:4:055:10 -115 31 = 55534243 82060000 00000000 00000600 00000000 00000000 00000000 000000
ffff8101ef1153c0 339364333 C Bo:4:055:10 0 31 >
ffff8101ef1153c0 339364339 S Bi:4:055:9 -115 13 <
ffff8101ef1153c0 339365333 C Bi:4:055:9 0 13 = 55534253 82060000 00000000 01
ffff8101ef1153c0 339365340 S Bo:4:055:10 -115 31 = 55534243 83060000 12000000 80000603 00000012 00000000 00000000 000000
ffff8101ef1153c0 339366332 C Bo:4:055:10 0 31 >
ffff81019bd71480 339366341 S Bi:4:055:9 -115 18 <
ffff81019bd71480 339367333 C Bi:4:055:9 0 18 = 70000200 0000000a 00000000 3a000000 0000
ffff8101ef1153c0 339367340 S Bi:4:055:9 -115 13 <
ffff8101ef1153c0 339368333 C Bi:4:055:9 0 13 = 55534253 83060000 00000000 00
ffff8101ef1153c0 339368366 S Bo:4:055:10 -115 31 = 55534243 84060000 00000000 00000600 00000000 00000000 00000000 000000
ffff8101ef1153c0 339369333 C Bo:4:055:10 0 31 >
ffff8101ef1153c0 339369338 S Bi:4:055:9 -115 13 <
ffff8101ef1153c0 339370333 C Bi:4:055:9 0 13 = 55534253 84060000 00000000 01
ffff8101ef1153c0 339370339 S Bo:4:055:10 -115 31 = 55534243 85060000 12000000 80000603 00000012 00000000 00000000 000000
ffff8101ef1153c0 339371333 C Bo:4:055:10 0 31 >
ffff81019bd71480 339371340 S Bi:4:055:9 -115 18 <
ffff81019bd71480 339372333 C Bi:4:055:9 0 18 = 70000200 0000000a 00000000 3a000000 0000
ffff8101ef1153c0 339372339 S Bi:4:055:9 -115 13 <
ffff8101ef1153c0 339373333 C Bi:4:055:9 0 13 = 55534253 85060000 00000000 00
ffff81019bc0d9c0 339379398 C Bi:4:055:5 0 1521 = 7eff0300 21450005 dc5f0000 00c60611 01451175 cf19e0aa 5a0050c5 91a88a17
ffff81019bc0d9c0 339382763 S Bi:4:055:5 -115 16384 <
ffff81019bc0d9c0 339436404 C Bi:4:055:5 -2 0
ffff81019bc0d9c0 339436753 S Bi:4:055:5 -115 16384 <
ffff81019bc0d600 339437046 S Bo:4:055:6 -115 60 = 7eff0300 21450000 34a1e440 00400619 c519e0aa 5a451175 cfc59100 50004b8a
ffff81019bc0d600 339437337 C Bo:4:055:6 0 60 >
ffff81019bc0d9c0 339488406 C Bi:4:055:5 -2 0
ffff81019bc0d9c0 339488536 S Bi:4:055:5 -115 16384 <
ffff81019bc0d9c0 339499408 C Bi:4:055:5 0 1520 = 7eff0300 21450005 dc63e400 00c6060c 1d451175 cf19e0aa 5a0050c5 91a88a1d
ffff81019bc0d9c0 339502908 S Bi:4:055:5 -115 16384 <
ffff81019bc0d9c0 339556407 C Bi:4:055:5 -2 0
ffff81019bc0d9c0 339556751 S Bi:4:055:5 -115 16384 <
ffff81019bc0d600 339557045 S Bo:4:055:6 -115 60 = 7eff0300 21450000 34a1e540 00400619 c419e0aa 5a451175 cfc59100 50004b8a
ffff81019bc0d600 339557344 C Bo:4:055:6 0 60 >
ffff81019bc0d9c0 339608414 C Bi:4:055:5 -2 0
ffff81019bc0d9c0 339608544 S Bi:4:055:5 -115 16384 <
ffff81019bc0d9c0 339660418 C Bi:4:055:5 -2 0
ffff81019bc0d9c0 339660540 S Bi:4:055:5 -115 16384 <
ffff81019bc0d9c0 339712422 C Bi:4:055:5 -2 1526 = 7eff0300 21450005 dc6e6c00 00c60601 95451175 cf19e0aa 5a0050c5 91a88a0b
ffff81019bc0d9c0 339712545 S Bi:4:055:5 -115 16384 <
ffff81019bc0d9c0 339764426 C Bi:4:055:5 -2 0
ffff81019bc0d9c0 339764549 S Bi:4:055:5 -115 16384 <
ffff81019bc0d9c0 339768420 C Bi:4:055:5 0 1519 = 7eff0300 21450005 dc6fb800 00c60600 49451175 cf19e0aa 5a0050c5 90a88330
ffff81019bc0d9c0 339774939 S Bi:4:055:5 -115 16384 <
ffff81019bc0d9c0 339828429 C Bi:4:055:5 -2 0
ffff81019bc0d9c0 339828795 S Bi:4:055:5 -115 16384 <
ffff81019bc0d600 339829094 S Bo:4:055:6 -115 48 = 7eff0300 21450000 286ce740 0040064e ce19e0aa 5a451175 cfc59000 5000254d
ffff81019bc0d600 339829362 C Bo:4:055:6 0 48 >
ffff81019bc0d9c0 339861446 C Bi:4:055:5 0 1520 = 7eff0300 21450005 dc743c00 00c606fb c4451175 cf19e0aa 5a0050c5 91a88a22
ffff81019bc0d9c0 339866833 S Bi:4:055:5 -115 16384 <
ffff81019bc0d9c0 339920431 C Bi:4:055:5 -2 0
ffff81019bc0d9c0 339920799 S Bi:4:055:5 -115 16384 <
ffff81019bc0d600 339921102 S Bo:4:055:6 -115 60 = 7eff0300 21450000 34a1e640 00400619 c319e0aa 5a451175 cfc59100 50004b8a
ffff81019bc0d600 339921365 C Bo:4:055:6 0 60 >
ffff81019bc0d9c0 339972432 C Bi:4:055:5 -2 0
ffff81019bc0d9c0 339972555 S Bi:4:055:5 -115 16384 <
ffff81019bc0d9c0 340024437 C Bi:4:055:5 -2 0
ffff81019bc0d9c0 340024548 S Bi:4:055:5 -115 16384 <
ffff81019bc0d9c0 340076437 C Bi:4:055:5 -2 0
ffff81019bc0d9c0 340076551 S Bi:4:055:5 -115 16384 <
ffff81019bc0d9c0 340095443 C Bi:4:055:5 0 1518 = 7eff0300 21450005 dc7d5eb4 0000c606 f14c4511 75cf19e0 aa5a0050 c590a883
ffff81019bc0d9c0 340098751 S Bi:4:055:5 -115 16384 <
ffff81019bc0d9c0 340152448 C Bi:4:055:5 -2 0
ffff81019bc0d9c0 340152792 S Bi:4:055:5 -115 16384 <
ffff81019bc0d600 340153084 S Bo:4:055:6 -115 48 = 7eff0300 21450000 286ce840 0040064e cd19e0aa 5a451175 cfc59000 5000254d
ffff81019bc0d600 340153379 C Bo:4:055:6 0 48 >
ffff81019bc0d9c0 340178443 C Bi:4:055:5 0 1519 = 7eff0300 21450005 dc7d5eb8 0000c606 f1484511 75cf19e0 aa5a0050 c590a883
ffff81019bc0d9c0 340182969 S Bi:4:055:5 -115 16384 <
ffff81019bc0d9c0 340233456 C Bi:4:055:5 0 1520 = 7eff0300 21450005 dc835800 00c606ec a8451175 cf19e0aa 5a0050c5 91a88a28
ffff81019bc0d9c0 340239012 S Bi:4:055:5 -115 16384 <
ffff81019bc0d9c0 340292450 C Bi:4:055:5 -2 0
ffff81019bc0d9c0 340292978 S Bi:4:055:5 -115 16384 <
ffff81019bc0d600 340293386 S Bo:4:055:6 -115 107 = 7eff0300 21450000 286ce940 0040064e cc19e0aa 5a451175 cfc59000 5000254d
ffff81019bc0d600 340294386 C Bo:4:055:6 0 107 >
ffff81019bc0d9c0 340344455 C Bi:4:055:5 -2 0
ffff81019bc0d9c0 340344601 S Bi:4:055:5 -115 16384 <
ffff81019bc0d9c0 340396458 C Bi:4:055:5 -2 0
ffff81019bc0d9c0 340396574 S Bi:4:055:5 -115 16384 <
ffff81019bc0d9c0 340418458 C Bi:4:055:5 0 1522 = 7eff0300 21450005 dc8b4800 00c606e4 b8451175 cf19e0aa 5a0050c5 90a88358
ffff81019bc0d9c0 340422665 S Bi:4:055:5 -115 16384 <
ffff81019bc0d9c0 340473463 C Bi:4:055:5 0 1524 = 7eff0300 21450005 dc8b4c00 00c606e4 b4451175 cf19e0aa 5a0050c5 90a8835d
ffff81019bc0d9c0 340478708 S Bi:4:055:5 -115 16384 <
ffff81019bc0d9c0 340532467 C Bi:4:055:5 -2 0
ffff81019bd71600 340533016 S Bi:4:055:5 -115 16384 <
ffff8101ef115b40 340533368 S Bo:4:055:6 -115 48 = 7eff0300 21450000 286cea40 0040064e cb19e0aa 5a451175 cfc59000 5000254d
ffff8101ef115b40 340534403 C Bo:4:055:6 0 48 >
ffff8101ef115b40 340534580 S Bo:4:055:6 -115 48 = 7eff0300 21450000 286ceb40 0040064e ca19e0aa 5a451175 cfc59000 5000254d
ffff8101ef115b40 340535399 C Bo:4:055:6 0 48 >
ffff81019bd71600 340552472 C Bi:4:055:5 0 1521 = 7eff0300 21450005 dc916400 00c606de 9c451175 cf19e0aa 5a0050c5 90a88363
ffff81019bd71600 340558427 S Bi:4:055:5 -115 16384 <
ffff81019bd71600 340612472 C Bi:4:055:5 -2 1526 = 7eff0300 21450005 dc916800 00c606de 98451175 cf19e0aa 5a0050c5 91a88a0b
ffff81019bd71600 340612897 S Bi:4:055:5 -115 16384 <
ffff8101ef115b40 340613276 S Bo:4:055:6 -115 48 = 7eff0300 21450000 286cec40 0040064e c919e0aa 5a451175 cfc59000 5000254d
ffff8101ef115b40 340613407 C Bo:4:055:6 0 48 >
ffff81019bd71600 340664475 C Bi:4:055:5 -2 0
ffff81019bd71600 340664631 S Bi:4:055:5 -115 16384 <
ffff81019bd71600 340668467 C Bi:4:055:5 0 1525 = 7eff0300 21450005 dc916c00 00c606de 94451175 cf19e0aa 5a0050c5 91a88a2e
ffff81019bd71600 340674586 S Bi:4:055:5 -115 16384 <
ffff81019bd71600 340728478 C Bi:4:055:5 -2 0
ffff81019bd71600 340728850 S Bi:4:055:5 -115 16384 <
ffff8101ef115b40 340729208 S Bo:4:055:6 -115 60 = 7eff0300 21450000 34a1e840 00400619 c119e0aa 5a451175 cfc59100 50004b8a
ffff8101ef115b40 340729410 C Bo:4:055:6 0 60 >
ffff81019bd71600 340780480 C Bi:4:055:5 -2 0
ffff81019bd71600 340780636 S Bi:4:055:5 -115 16384 <
ffff81019bd71600 340792483 C Bi:4:055:5 0 1519 = 7eff0300 21450005 dc9c0800 00c606d3 f8451175 cf19e0aa 5a0050c5 90a88369
ffff81019bd71600 340798211 S Bi:4:055:5 -115 16384 <
ffff81019bd71600 340852487 C Bi:4:055:5 -2 1522 = 7eff0300 21450005 dc9c0c00 00c606d3 f4451175 cf19e0aa 5a0050c5 90a8836e
ffff81019bd71600 340852862 S Bi:4:055:5 -115 16384 <
ffff8101ef115b40 340853158 S Bo:4:055:6 -115 48 = 7eff0300 21450000 286ced40 0040064e c819e0aa 5a451175 cfc59000 5000254d
ffff8101ef115b40 340853420 C Bo:4:055:6 0 48 >
ffff81019bd71600 340904488 C Bi:4:055:5 -2 0
ffff81019bd71600 340904641 S Bi:4:055:5 -115 16384 <
ffff81019bd71600 340912480 C Bi:4:055:5 0 1520 = 7eff0300 21450005 dca05400 00c606cf ac451175 cf19e0aa 5a0050c5 90a88374
ffff81019bd71600 340918166 S Bi:4:055:5 -115 16384 <
ffff81019bd71600 340958488 C Bi:4:055:5 0 1521 = 7eff0300 21450005 dca05800 00c606cf a8451175 cf19e0aa 5a0050c5 90a8837a
ffff81019bd71600 340962157 S Bi:4:055:5 -115 16384 <
ffff81019bd71600 340994494 C Bi:4:055:5 0 522 = 7eff0300 21450001 fca56000 00c606ce 80451175 cf19e0aa 5a0050c5 91a88a33
ffff81019bd71600 340996683 S Bi:4:055:5 -115 16384 <
ffff81019bd71600 341048496 C Bi:4:055:5 -2 0
ffff81019bd71600 341049096 S Bi:4:055:5 -115 16384 <
ffff8101ef115b40 341049466 S Bo:4:055:6 -115 60 = 7eff0300 21450000 346cee40 0040064e bb19e0aa 5a451175 cfc59000 5000254d
ffff8101ef115b40 341050428 C Bo:4:055:6 0 60 >
ffff8101ef115b40 341050719 S Bo:4:055:6 -115 119 = 7eff0300 21450000 346cef40 0040064e ba19e0aa 5a451175 cfc59000 5000254d
ffff8101ef115b40 341051428 C Bo:4:055:6 0 119 >
ffff81019bd71600 341100499 C Bi:4:055:5 -2 0
ffff81019bd71600 341100665 S Bi:4:055:5 -115 16384 <
ffff81019bd71600 341138503 C Bi:4:055:5 0 1522 = 7eff0300 21450005 dcabb000 00c606c4 50451175 cf19e0aa 5a0050c5 90a88380
ffff81019bd71600 341142211 S Bi:4:055:5 -115 16384 <
ffff81019bd71600 341196505 C Bi:4:055:5 -2 0
ffff81019bd71600 341196875 S Bi:4:055:5 -115 16384 <
ffff8101ef115b40 341197191 S Bo:4:055:6 -115 60 = 7eff0300 21450000 346cf040 0040064e b919e0aa 5a451175 cfc59000 5000254d
ffff8101ef115b40 341197437 C Bo:4:055:6 0 60 >
ffff81019bd71600 341248506 C Bi:4:055:5 -2 0
ffff81019bd71600 341248659 S Bi:4:055:5 -115 16384 <
ffff81019bd71600 341300510 C Bi:4:055:5 -2 0
ffff81019bd71600 341300654 S Bi:4:055:5 -115 16384 <
ffff81019bd71600 341318513 C Bi:4:055:5 0 1519 = 7eff0300 21450005 dcb21000 00c606bd f0451175 cf19e0aa 5a0050c5 90a88385
ffff81019bd71600 341322307 S Bi:4:055:5 -115 16384 <
ffff8101ef1153c0 341363692 S Bo:4:055:10 -115 31 = 55534243 86060000 00000000 00000600 00000000 00000000 00000000 000000
ffff8101ef1153c0 341364446 C Bo:4:055:10 0 31 >
ffff8101ef1153c0 341364454 S Bi:4:055:9 -115 13 <
ffff8101ef1153c0 341365444 C Bi:4:055:9 0 13 = 55534253 86060000 00000000 01
ffff8101ef1153c0 341365451 S Bo:4:055:10 -115 31 = 55534243 87060000 12000000 80000603 00000012 00000000 00000000 000000
ffff8101ef1153c0 341366444 C Bo:4:055:10 0 31 >
ffff81019bd71240 341366483 S Bi:4:055:9 -115 18 <
ffff81019bd71240 341367444 C Bi:4:055:9 0 18 = 70000200 0000000a 00000000 3a000000 0000
ffff8101ef1153c0 341367452 S Bi:4:055:9 -115 13 <
ffff8101ef1153c0 341368445 C Bi:4:055:9 0 13 = 55534253 87060000 00000000 00
ffff8101ef1153c0 341368481 S Bo:4:055:10 -115 31 = 55534243 88060000 00000000 00000600 00000000 00000000 00000000 000000
ffff8101ef1153c0 341369444 C Bo:4:055:10 0 31 >
ffff8101ef1153c0 341369449 S Bi:4:055:9 -115 13 <
ffff8101ef1153c0 341370444 C Bi:4:055:9 0 13 = 55534253 88060000 00000000 01
ffff8101ef1153c0 341370451 S Bo:4:055:10 -115 31 = 55534243 89060000 12000000 80000603 00000012 00000000 00000000 000000
ffff8101ef1153c0 341371444 C Bo:4:055:10 0 31 >
ffff81019bd71240 341371452 S Bi:4:055:9 -115 18 <
ffff81019bd71240 341372444 C Bi:4:055:9 0 18 = 70000200 0000000a 00000000 3a000000 0000
ffff8101ef1153c0 341372453 S Bi:4:055:9 -115 13 <
ffff8101ef1153c0 341373444 C Bi:4:055:9 0 13 = 55534253 89060000 00000000 00
ffff81019bd71600 341376506 C Bi:4:055:5 -2 0
ffff81019bd71600 341376832 S Bi:4:055:5 -115 16384 <
ffff8101ef115b40 341377198 S Bo:4:055:6 -115 60 = 7eff0300 21450000 346cf140 0040064e b819e0aa 5a451175 cfc59000 5000254d
ffff8101ef115b40 341377447 C Bo:4:055:6 0 60 >
ffff81019bd71600 341428517 C Bi:4:055:5 -2 0
ffff81019bd71600 341428670 S Bi:4:055:5 -115 16384 <
ffff81019bd71600 341480520 C Bi:4:055:5 -2 0
ffff81019bd71600 341480662 S Bi:4:055:5 -115 16384 <
ffff81019bd71600 341514524 C Bi:4:055:5 0 1522 = 7eff0300 21450005 dcb21400 00c606bd ec451175 cf19e0aa 5a0050c5 90a8836e
ffff81019bd71600 341518253 S Bi:4:055:5 -115 16384 <
ffff81019bd71600 341520514 C Bi:4:055:5 0 1526 = 7eff0300 21450005 dcb38000 00c606bc 80451175 cf19e0aa 5a0050c5 91a88a0b
ffff81019bd71600 341526168 S Bi:4:055:5 -115 16384 <
ffff81019bd71600 341580525 C Bi:4:055:5 -2 0
ffff81019bd71600 341581078 S Bi:4:055:5 -115 16384 <
ffff8101ef115b40 341581386 S Bo:4:055:6 -115 48 = 7eff0300 21450000 286cf240 0040064e c319e0aa 5a451175 cfc59000 5000254d
ffff8101ef115b40 341582463 C Bo:4:055:6 0 48 >
ffff8101ef115c00 341584480 S Bo:4:055:6 -115 95 = 7eff0300 21450000 28a1ea40 00400619 cb19e0aa 5a451175 cfc59100 50004b8a
ffff8101ef115c00 341585464 C Bo:4:055:6 0 95 >
ffff81019bd71600 341632533 C Bi:4:055:5 -2 0
ffff8101ef115c00 341632704 S Bi:4:055:5 -115 16384 <
ffff8101ef115c00 341678534 C Bi:4:055:5 0 1523 = 7eff0300 21450005 dcc60c00 00c606a9 f4451175 cf19e0aa 5a0050c5 90a8838b
ffff8101ef115c00 341682939 S Bi:4:055:5 -115 16384 <
ffff8101ef115c00 341736537 C Bi:4:055:5 -2 0
ffff8101ef115c00 341736858 S Bi:4:055:5 -115 16384 <
ffff8101ef1156c0 341737143 S Bo:4:055:6 -115 48 = 7eff0300 21450000 286cf340 0040064e c219e0aa 5a451175 cfc59000 5000254d
ffff8101ef1156c0 341737471 C Bo:4:055:6 0 48 >
ffff8101ef115c00 341788537 C Bi:4:055:5 -2 0
ffff8101ef115c00 341788665 S Bi:4:055:5 -115 16384 <
ffff8101ef115c00 341840540 C Bi:4:055:5 -2 0
ffff8101ef115c00 341840661 S Bi:4:055:5 -115 16384 <
ffff8101ef115c00 341858544 C Bi:4:055:5 0 1521 = 7eff0300 21450005 dcd04800 00c6069f b8451175 cf19e0aa 5a0050c5 90a88391
ffff8101ef115c00 341862718 S Bi:4:055:5 -115 16384 <
ffff8101ef115c00 341916544 C Bi:4:055:5 -2 0
ffff8101ef115c00 341916897 S Bi:4:055:5 -115 16384 <
ffff8101ef1156c0 341917188 S Bo:4:055:6 -115 48 = 7eff0300 21450000 286cf440 0040064e c119e0aa 5a451175 cfc59000 5000254d
ffff8101ef1156c0 341917481 C Bo:4:055:6 0 48 >
ffff8101ef115c00 341918539 C Bi:4:055:5 0 1533 = 7eff0300 21450005 dcd04c00 00c6069f b4451175 cf19e0aa 5a0050c5 90a88396
ffff8101ef115c00 341921082 S Bi:4:055:5 -115 16384 <
ffff8101ef115c00 341921541 C Bi:4:055:5 0 48 = 7eff0300 21450000 28d18c00 00c606a4 28451175 cf19e0aa 5a0050c5 91a88a35
ffff8101ef115c00 341921662 S Bi:4:055:5 -115 16384 <
ffff8101ef115c00 341972552 C Bi:4:055:5 -2 0
ffff8101ef115c00 341972876 S Bi:4:055:5 -115 16384 <
ffff8101ef1156c0 341973167 S Bo:4:055:6 -115 48 = 7eff0300 21450000 286cf540 0040064e c019e0aa 5a451175 cfc59000 5000254d
ffff8101ef1156c0 341973482 C Bo:4:055:6 0 48 >
ffff8101ef115c00 342020551 C Bi:4:055:5 0 1521 = 7eff0300 21450005 dcd7cc00 00c60698 34451175 cf19e0aa 5a0050c5 90a8839c
ffff8101ef115c00 342027016 S Bi:4:055:5 -115 16384 <
ffff8101ef115c00 342080553 C Bi:4:055:5 -2 0
ffff8101ef115c00 342080908 S Bi:4:055:5 -115 16384 <
ffff8101ef1156c0 342081198 S Bo:4:055:6 -115 48 = 7eff0300 21450000 286cf640 0040064e bf19e0aa 5a451175 cfc59000 5000254d
ffff8101ef1156c0 342081486 C Bo:4:055:6 0 48 >
ffff8101ef115c00 342132557 C Bi:4:055:5 -2 0
ffff8101ef115c00 342132656 S Bi:4:055:5 -115 16384 <
ffff8101ef115c00 342184556 C Bi:4:055:5 -2 0
ffff8101ef115c00 342184678 S Bi:4:055:5 -115 16384 <
ffff8101ef115c00 342218563 C Bi:4:055:5 0 1523 = 7eff0300 21450005 dce0e000 00c6068f 20451175 cf19e0aa 5a0050c5 90a883a2
ffff8101ef115c00 342222733 S Bi:4:055:5 -115 16384 <
ffff8101ef115c00 342273566 C Bi:4:055:5 0 1518 = 7eff0300 21450005 dce12800 00c6068e d8451175 cf19e0aa 5a0050c5 90a883a7
ffff8101ef115c00 342279019 S Bi:4:055:5 -115 16384 <
ffff8101ef115c00 342332569 C Bi:4:055:5 -2 0
ffff8101ef115c00 342333073 S Bi:4:055:5 -115 16384 <
ffff8101ef1156c0 342333442 S Bo:4:055:6 -115 95 = 7eff0300 21450000 286cf740 0040064e be19e0aa 5a451175 cfc59000 5000254d
ffff8101ef1156c0 342334503 C Bo:4:055:6 0 95 >
ffff8101ef115c00 342381573 C Bi:4:055:5 0 1521 = 7eff0300 21450005 dce51400 00c6068a ec451175 cf19e0aa 5a0050c5 90a883ad
ffff8101ef115c00 342386639 S Bi:4:055:5 -115 16384 <
ffff8101ef115c00 342435575 C Bi:4:055:5 0 1526 = 7eff0300 21450005 dce51800 00c6068a e8451175 cf19e0aa 5a0050c5 90a883b3
ffff8101ef115c00 342438618 S Bi:4:055:5 -115 16384 <
ffff8101ef115c00 342492576 C Bi:4:055:5 -2 0
ffff8101ef115c00 342493067 S Bi:4:055:5 -115 16384 <
ffff8101ef1156c0 342493424 S Bo:4:055:6 -115 95 = 7eff0300 21450000 286cf940 0040064e bc19e0aa 5a451175 cfc59000 5000254d
ffff8101ef1156c0 342494513 C Bo:4:055:6 0 95 >
ffff8101ef115c00 342544579 C Bi:4:055:5 -2 0
ffff8101ef115c00 342544710 S Bi:4:055:5 -115 16384 <
ffff8101ef115c00 342592582 C Bi:4:055:5 0 1523 = 7eff0300 21450005 dcf18c00 00c6067d 5e744511 75cf19e0 aa5a0050 c590a883
ffff8101ef115c00 342598830 S Bi:4:055:5 -115 16384 <
ffff8101ef115c00 342652588 C Bi:4:055:5 -2 1522 = 7eff0300 21450005 dcf19000 00c6067d 5e704511 75cf19e0 aa5a0050 c590a883
ffff8101ef115c00 342652930 S Bi:4:055:5 -115 16384 <
ffff8101ef1156c0 342653214 S Bo:4:055:6 -115 48 = 7eff0300 21450000 286cfb40 0040064e ba19e0aa 5a451175 cfc59000 5000254d
ffff8101ef1156c0 342653520 C Bo:4:055:6 0 48 >
ffff8101ef115c00 342704587 C Bi:4:055:5 -2 0
ffff8101ef115c00 342704712 S Bi:4:055:5 -115 16384 <
ffff8101ef115c00 342756592 C Bi:4:055:5 -2 0
ffff8101ef115c00 342756717 S Bi:4:055:5 -115 16384 <
ffff8101ef115c00 342758583 C Bi:4:055:5 0 1520 = 7eff0300 21450005 dcf85c00 00c60677 a4451175 cf19e0aa 5a0050c5 90a883c4
ffff8101ef115c00 342761062 S Bi:4:055:5 -115 16384 <
ffff8101ef115c00 342812597 C Bi:4:055:5 -2 0
ffff8101ef115c00 342813555 S Bi:4:055:5 -115 16384 <
ffff8101ef1156c0 342813868 S Bo:4:055:6 -115 60 = 7eff0300 21450000 346cfc40 0040064e ad19e0aa 5a451175 cfc59000 5000254d
ffff8101ef1156c0 342814530 C Bo:4:055:6 0 60 >
ffff8101ef115c00 342864597 C Bi:4:055:5 -2 0
ffff8101ef115c00 342864734 S Bi:4:055:5 -115 16384 <
ffff8101ef115c00 342916605 C Bi:4:055:5 -2 0
ffff8101ef115c00 342916739 S Bi:4:055:5 -115 16384 <
ffff8101ef115c00 342968604 C Bi:4:055:5 -2 0
ffff8101ef115c00 342968671 S Bi:4:055:5 -115 16384 <
ffff8101ef115c00 342984600 C Bi:4:055:5 0 1530 = 7eff0300 21450005 dcfa8c00 00c60675 74451175 cf19e0aa 5a0050c5 90a883ca
ffff8101ef115c00 342990693 S Bi:4:055:5 -115 16384 <
ffff8101ef115c00 342992607 C Bi:4:055:5 0 1525 = 7eff0300 21450005 dcfa9000 00c60675 70451175 cf19e0aa 5a0050c5 90a883cf
ffff8101ef115c00 342995490 S Bi:4:055:5 -115 16384 <
ffff8101ef115c00 342996607 C Bi:4:055:5 0 1034 = 7eff0300 21450005 dcfe9c00 00c60671 64451175 cf19e0aa 5a0050c5 90a883d5
ffff8101ef115c00 343001816 S Bi:4:055:5 -115 16384 <
ffff8101ef115c00 343002601 C Bi:4:055:5 0 496 = a941e248 74bf86fe 3af046bb 75a8e99f 103e39de 683e25f1 678d3c7d 5d7517c2
ffff8101ef115c00 343003441 S Bi:4:055:5 -115 16384 <
ffff8101ef115c00 343056611 C Bi:4:055:5 -2 0
ffff8101ef115c00 343057260 S Bi:4:055:5 -115 16384 <
ffff8101ef1156c0 343057771 S Bo:4:055:6 -115 178 = 7eff0300 21450000 346cfd40 0040064e ac19e0aa 5a451175 cfc59000 5000254d
ffff8101ef1156c0 343058541 C Bo:4:055:6 0 178 >
ffff8101ef115c00 343108613 C Bi:4:055:5 -2 0
ffff8101ef115c00 343108724 S Bi:4:055:5 -115 16384 <
ffff8101ef115c00 343160613 C Bi:4:055:5 -2 704 = 7eff0300 21450005 dc048800 00c6066b 79451175 cf19e0aa 5a0050c5 90a883db
ffff8101ef115c00 343160692 S Bi:4:055:5 -115 16384 <
ffff8101ef115c00 343161609 C Bi:4:055:5 0 827 = c7c39652 78cb4dfd 9feefc77 73f165be 367c3cf8 2be26d3f c5df1046 8fe1bb1b
ffff8101ef115c00 343163008 S Bi:4:055:5 -115 16384 <
ffff8101ef115c00 343216618 C Bi:4:055:5 -2 0
ffff8101ef115c00 343216853 S Bi:4:055:5 -115 16384 <
ffff8101ef115c00 343268622 C Bi:4:055:5 -2 0
ffff8101ef115c00 343268698 S Bi:4:055:5 -115 16384 <
ffff8101ef115c00 343320624 C Bi:4:055:5 -2 0
ffff8101ef115c00 343320686 S Bi:4:055:5 -115 16384 <
ffff8101ef115c00 343353625 C Bi:4:055:5 0 1521 = 7eff0300 21450005 dc116c00 00c6065e 95451175 cf19e0aa 5a0050c5 90a883be
ffff8101ef115c00 343358599 S Bi:4:055:5 -115 16384 <
ffff8101ef1153c0 343361501 S Bo:4:055:10 -115 31 = 55534243 8a060000 00000000 00000600 00000000 00000000 00000000 000000
ffff8101ef1153c0 343362561 C Bo:4:055:10 0 31 >
ffff8101ef1153c0 343362607 S Bi:4:055:9 -115 13 <
ffff8101ef1153c0 343363556 C Bi:4:055:9 0 13 = 55534253 8a060000 00000000 01
ffff8101ef1153c0 343363565 S Bo:4:055:10 -115 31 = 55534243 8b060000 12000000 80000603 00000012 00000000 00000000 000000
ffff8101ef1153c0 343364555 C Bo:4:055:10 0 31 >
ffff810114d70300 343364565 S Bi:4:055:9 -115 18 <
ffff810114d70300 343365555 C Bi:4:055:9 0 18 = 70000200 0000000a 00000000 3a000000 0000
ffff8101ef1153c0 343365563 S Bi:4:055:9 -115 13 <
ffff8101ef1153c0 343366555 C Bi:4:055:9 0 13 = 55534253 8b060000 00000000 00
ffff8101ef1153c0 343366599 S Bo:4:055:10 -115 31 = 55534243 8c060000 00000000 00000600 00000000 00000000 00000000 000000
ffff8101ef1153c0 343367555 C Bo:4:055:10 0 31 >
ffff8101ef1153c0 343367561 S Bi:4:055:9 -115 13 <
ffff8101ef1153c0 343368556 C Bi:4:055:9 0 13 = 55534253 8c060000 00000000 01
ffff8101ef1153c0 343368562 S Bo:4:055:10 -115 31 = 55534243 8d060000 12000000 80000603 00000012 00000000 00000000 000000
ffff8101ef1153c0 343369556 C Bo:4:055:10 0 31 >
ffff810114d70300 343369564 S Bi:4:055:9 -115 18 <
ffff810114d70300 343370556 C Bi:4:055:9 0 18 = 70000200 0000000a 00000000 3a000000 0000
ffff8101ef1153c0 343370563 S Bi:4:055:9 -115 13 <
ffff8101ef1153c0 343371555 C Bi:4:055:9 0 13 = 55534253 8d060000 00000000 00
ffff8101ef115c00 343412633 C Bi:4:055:5 -2 0
ffff8101ef115c00 343412923 S Bi:4:055:5 -115 16384 <
ffff8101ef1156c0 343413208 S Bo:4:055:6 -115 48 = 7eff0300 21450000 286d0040 0040064e b519e0aa 5a451175 cfc59000 5000254d
ffff8101ef1156c0 343413562 C Bo:4:055:6 0 48 >
ffff8101ef115c00 343464633 C Bi:4:055:5 -2 0
ffff8101ef115c00 343464762 S Bi:4:055:5 -115 16384 <
ffff8101ef115c00 343516634 C Bi:4:055:5 -2 0
ffff810114d703c0 343516775 S Bi:4:055:5 -115 16384 <
ffff810114d703c0 343568637 C Bi:4:055:5 -2 0
ffff810114d703c0 343568778 S Bi:4:055:5 -115 16384 <
ffff810114d703c0 343623678 C Bi:4:055:5 -2 0
ffff810137f436c0 343628617 S Bi:4:055:5 -115 16384 <
ffff810137f436c0 343672645 C Bi:4:055:5 0 1526 = 7eff0300 21450005 dc219400 00c6064e 6d451175 cf19e0aa 5a0050c5 90a883e0
ffff810137f436c0 343678945 S Bi:4:055:5 -115 16384 <
ffff810137f436c0 343728650 C Bi:4:055:5 0 1523 = 7eff0300 21450005 dc219800 00c6064e 69451175 cf19e0aa 5a0050c5 90a883e6
ffff810137f436c0 343734687 S Bi:4:055:5 -115 16384 <
ffff810137f436c0 343788645 C Bi:4:055:5 -2 0
ffff810137f436c0 343789169 S Bi:4:055:5 -115 16384 <
ffff810137f43300 343789589 S Bo:4:055:6 -115 119 = 7eff0300 21450000 346d0140 0040064e a819e0aa 5a451175 cfc59000 5000254d
ffff810137f43300 343790580 C Bo:4:055:6 0 119 >
ffff810137f436c0 343840651 C Bi:4:055:5 -2 0
ffff810114d703c0 343840808 S Bi:4:055:5 -115 16384 <
ffff810114d703c0 343892655 C Bi:4:055:5 -2 0
ffff810114d703c0 343892804 S Bi:4:055:5 -115 16384 <
ffff810114d703c0 343944658 C Bi:4:055:5 -2 0
ffff810114d703c0 343944796 S Bi:4:055:5 -115 16384 <
ffff810114d703c0 343996658 C Bi:4:055:5 -2 0
ffff810114d703c0 343996779 S Bi:4:055:5 -115 16384 <
ffff810114d703c0 344048658 C Bi:4:055:5 -2 0
ffff810114d703c0 344048772 S Bi:4:055:5 -115 16384 <
ffff810114d703c0 344055657 C Bi:4:055:5 0 1519 = 7eff0300 21450005 dc350800 00c6063a f9451175 cf19e0aa 5a0050c5 90a883ec
ffff810114d703c0 344058206 S Bi:4:055:5 -115 16384 <
ffff810114d703c0 344112659 C Bi:4:055:5 -2 0
ffff810114d703c0 344112959 S Bi:4:055:5 -115 16384 <
ffff810137f43300 344113324 S Bo:4:055:6 -115 60 = 7eff0300 21450000 346d0340 0040064e a619e0aa 5a451175 cfc59000 5000254d
ffff810137f43300 344113599 C Bo:4:055:6 0 60 >
ffff810114d703c0 344164669 C Bi:4:055:5 -2 0
ffff810114d703c0 344164821 S Bi:4:055:5 -115 16384 <
ffff810114d703c0 344216674 C Bi:4:055:5 -2 0
ffff810114d703c0 344216815 S Bi:4:055:5 -115 16384 <
ffff810114d703c0 344260677 C Bi:4:055:5 0 1531 = 7eff0300 21450005 dc350c00 00c6063a f5451175 cf19e0aa 5a0050c5 90a883db
ffff810114d703c0 344266195 S Bi:4:055:5 -115 16384 <
ffff810114d703c0 344268666 C Bi:4:055:5 0 1526 = 7eff0300 21450005 dc351000 00c6063a f1451175 cf19e0aa 5a0050c5 90a883f2
ffff810114d703c0 344274151 S Bi:4:055:5 -115 16384 <
ffff810114d703c0 344328677 C Bi:4:055:5 -2 0
ffff810114d703c0 344329201 S Bi:4:055:5 -115 16384 <
ffff810137f43300 344329565 S Bo:4:055:6 -115 48 = 7eff0300 21450000 286d0440 0040064e b119e0aa 5a451175 cfc59000 5000254d
ffff810137f43300 344330611 C Bo:4:055:6 0 48 >
ffff810137f43300 344330834 S Bo:4:055:6 -115 48 = 7eff0300 21450000 286d0540 0040064e b019e0aa 5a451175 cfc59000 5000254d
ffff810137f43300 344331610 C Bo:4:055:6 0 48 >
ffff810114d703c0 344378680 C Bi:4:055:5 0 1522 = 7eff0300 21450005 dc466400 00c60629 9d451175 cf19e0aa 5a0050c5 90a883f7
ffff810114d703c0 344382207 S Bi:4:055:5 -115 16384 <
ffff810114d703c0 344436683 C Bi:4:055:5 -2 0
ffff810114d703c0 344437054 S Bi:4:055:5 -115 16384 <
ffff810137f43300 344437413 S Bo:4:055:6 -115 48 = 7eff0300 21450000 286d0640 0040064e af19e0aa 5a451175 cfc59000 5000254d
ffff810137f43300 344437620 C Bo:4:055:6 0 48 >
ffff810114d703c0 344488686 C Bi:4:055:5 -2 0
ffff810114d703c0 344488842 S Bi:4:055:5 -115 16384 <
ffff810114d703c0 344540687 C Bi:4:055:5 -2 0
ffff810114d703c0 344540811 S Bi:4:055:5 -115 16384 <
ffff810114d703c0 344592689 C Bi:4:055:5 -2 0
ffff810114d703c0 344592806 S Bi:4:055:5 -115 16384 <
ffff810114d703c0 344601686 C Bi:4:055:5 0 1522 = 7eff0300 21450005 dc4fc000 00c60620 41451175 cf19e0aa 5a0050c5 90a883fd
ffff810114d703c0 344606154 S Bi:4:055:5 -115 16384 <
ffff810114d703c0 344660696 C Bi:4:055:5 -2 768 = 7eff0300 21450005 dc4fcc00 00c60620 35451175 cf19e0aa 5a0050c5 90a88403
ffff810114d703c0 344661064 S Bi:4:055:5 -115 16384 <
ffff810137f43d80 344661426 S Bo:4:055:6 -115 48 = 7eff0300 21450000 286d0740 0040064e ae19e0aa 5a451175 cfc59000 5000254d
ffff810137f43d80 344661634 C Bo:4:055:6 0 48 >
ffff810114d703c0 344662689 C Bi:4:055:5 0 751 = f84be00f 0cfc46f0 3787be1d 7c30f899 f6f943ff 0059325a 198c7039 261abe37
ffff810114d703c0 344664060 S Bi:4:055:5 -115 16384 <
ffff810114d703c0 344716691 C Bi:4:055:5 -2 0
ffff810114d703c0 344716919 S Bi:4:055:5 -115 16384 <
ffff810114d703c0 344768698 C Bi:4:055:5 -2 0
ffff810114d703c0 344768834 S Bi:4:055:5 -115 16384 <
ffff810114d703c0 344820697 C Bi:4:055:5 -2 0
ffff810114d703c0 344820766 S Bi:4:055:5 -115 16384 <
ffff810114d703c0 344872709 C Bi:4:055:5 -2 0
ffff810114d703c0 344872848 S Bi:4:055:5 -115 16384 <
ffff810114d703c0 344895704 C Bi:4:055:5 0 1524 = 7eff0300 21450005 dc573000 00c60618 d1451175 cf19e0aa 5a0050c5 90a88408
ffff810114d703c0 344902164 S Bi:4:055:5 -115 16384 <
ffff810114d703c0 344956712 C Bi:4:055:5 -2 0
ffff810114d703c0 344957062 S Bi:4:055:5 -115 16384 <
ffff810137f43d80 344957425 S Bo:4:055:6 -115 60 = 7eff0300 21450000 346d0840 0040064e a119e0aa 5a451175 cfc59000 5000254d
ffff810137f43d80 344957645 C Bo:4:055:6 0 60 >
ffff810114d703c0 344960701 C Bi:4:055:5 0 1532 = 7eff0300 21450005 dc627000 00c6060d 91451175 cf19e0aa 5a0050c5 90a8840e
ffff810114d703c0 344966122 S Bi:4:055:5 -115 16384 <
ffff810114d703c0 345015721 C Bi:4:055:5 0 1526 = 7eff0300 21450005 dc627400 00c6060d 8d451175 cf19e0aa 5a0050c5 90a88414
ffff810114d703c0 345018423 S Bi:4:055:5 -115 16384 <
ffff810114d703c0 345072718 C Bi:4:055:5 -2 0
ffff810137f43d80 345073582 S Bo:4:055:6 -115 60 = 7eff0300 21450000 346d0940 0040064e a019e0aa 5a451175 cfc59000 5000254d
ffff810114d703c0 345073633 S Bi:4:055:5 -115 16384 <
ffff810137f43d80 345074650 C Bo:4:055:6 0 60 >
ffff810137f43d80 345074862 S Bo:4:055:6 -115 60 = 7eff0300 21450000 346d0a40 0040064e 9f19e0aa 5a451175 cfc59000 5000254d
ffff810137f43d80 345075652 C Bo:4:055:6 0 60 >
ffff810114d703c0 345124717 C Bi:4:055:5 -2 0
ffff810114d703c0 345124846 S Bi:4:055:5 -115 16384 <
ffff810114d703c0 345176726 C Bi:4:055:5 -2 0
ffff810114d703c0 345176865 S Bi:4:055:5 -115 16384 <
ffff810114d703c0 345228722 C Bi:4:055:5 -2 0
ffff810114d703c0 345228807 S Bi:4:055:5 -115 16384 <
ffff810114d703c0 345232728 C Bi:4:055:5 0 1522 = 7eff0300 21450005 dc784c00 00c606f7 b4451175 cf19e0aa 5a0050c5 90a88419
ffff810114d703c0 345238252 S Bi:4:055:5 -115 16384 <
ffff810114d703c0 345292724 C Bi:4:055:5 -2 0
ffff810114d703c0 345293097 S Bi:4:055:5 -115 16384 <
ffff810137f43d80 345293350 S Bo:4:055:6 -115 60 = 7eff0300 21450000 346d0b40 0040064e 9e19e0aa 5a451175 cfc59000 5000254d
ffff810137f43d80 345293664 C Bo:4:055:6 0 60 >
ffff810114d703c0 345344737 C Bi:4:055:5 -2 0
ffff810114d703c0 345344882 S Bi:4:055:5 -115 16384 <
ffff810114d703c0 345348727 C Bi:4:055:5 0 1520 = 7eff0300 21450005 dc7d5d38 0000c606 f2c84511 75cf19e0 aa5a0050 c590a884
ffff810114d703c0 345354200 S Bi:4:055:5 -115 16384 <
ffff8101ef1153c0 345363674 S Bo:4:055:10 -115 31 = 55534243 8e060000 00000000 00000600 00000000 00000000 00000000 000000
ffff8101ef1153c0 345364669 C Bo:4:055:10 0 31 >
ffff8101ef1153c0 345364676 S Bi:4:055:9 -115 13 <
ffff8101ef1153c0 345365666 C Bi:4:055:9 0 13 = 55534253 8e060000 00000000 01
ffff8101ef1153c0 345365673 S Bo:4:055:10 -115 31 = 55534243 8f060000 12000000 80000603 00000012 00000000 00000000 000000
ffff8101ef1153c0 345366667 C Bo:4:055:10 0 31 >
ffff810114d709c0 345366675 S Bi:4:055:9 -115 18 <
ffff810114d709c0 345367667 C Bi:4:055:9 0 18 = 70000200 0000000a 00000000 3a000000 0000
ffff8101ef1153c0 345367675 S Bi:4:055:9 -115 13 <
ffff8101ef1153c0 345368666 C Bi:4:055:9 0 13 = 55534253 8f060000 00000000 00
ffff8101ef1153c0 345368699 S Bo:4:055:10 -115 31 = 55534243 90060000 00000000 00000600 00000000 00000000 00000000 000000
ffff8101ef1153c0 345369667 C Bo:4:055:10 0 31 >
ffff8101ef1153c0 345369673 S Bi:4:055:9 -115 13 <
ffff8101ef1153c0 345370666 C Bi:4:055:9 0 13 = 55534253 90060000 00000000 01
ffff8101ef1153c0 345370672 S Bo:4:055:10 -115 31 = 55534243 91060000 12000000 80000603 00000012 00000000 00000000 000000
ffff8101ef1153c0 345371667 C Bo:4:055:10 0 31 >
ffff810114d709c0 345371674 S Bi:4:055:9 -115 18 <
ffff810114d709c0 345372667 C Bi:4:055:9 0 18 = 70000200 0000000a 00000000 3a000000 0000
ffff8101ef1153c0 345372673 S Bi:4:055:9 -115 13 <
ffff8101ef1153c0 345373667 C Bi:4:055:9 0 13 = 55534253 91060000 00000000 00
ffff810114d703c0 345408733 C Bi:4:055:5 -2 0
ffff810137f43d80 345409386 S Bo:4:055:6 -115 48 = 7eff0300 21450000 286d0c40 0040064e a919e0aa 5a451175 cfc59000 5000254d
ffff810114d703c0 345409630 S Bi:4:055:5 -115 16384 <
ffff810137f43d80 345409683 C Bo:4:055:6 0 48 >
ffff810114d703c0 345460737 C Bi:4:055:5 -2 0
ffff810114d703c0 345460871 S Bi:4:055:5 -115 16384 <
ffff810114d703c0 345512740 C Bi:4:055:5 -2 0
ffff810114d703c0 345512860 S Bi:4:055:5 -115 16384 <
ffff810114d703c0 345564742 C Bi:4:055:5 -2 0
ffff810114d703c0 345564858 S Bi:4:055:5 -115 16384 <
ffff810114d703c0 345592747 C Bi:4:055:5 0 1522 = 7eff0300 21450005 dc895000 00c606e6 b0451175 cf19e0aa 5a0050c5 90a8841f
ffff810114d703c0 345598131 S Bi:4:055:5 -115 16384 <
ffff810114d703c0 345652748 C Bi:4:055:5 -2 0
ffff810137f43d80 345653388 S Bo:4:055:6 -115 48 = 7eff0300 21450000 286d0d40 0040064e a819e0aa 5a451175 cfc59000 5000254d
ffff810114d703c0 345653513 S Bi:4:055:5 -115 16384 <
ffff810137f43d80 345653685 C Bo:4:055:6 0 48 >
ffff810114d703c0 345704749 C Bi:4:055:5 -2 0
ffff810114d703c0 345704862 S Bi:4:055:5 -115 16384 <
ffff810114d703c0 345756754 C Bi:4:055:5 -2 0
ffff810114d703c0 345756872 S Bi:4:055:5 -115 16384 <
ffff810114d703c0 345808753 C Bi:4:055:5 -2 0
ffff810114d703c0 345808836 S Bi:4:055:5 -115 16384 <
ffff810114d703c0 345820755 C Bi:4:055:5 0 1521 = 7eff0300 21450005 dc8f2000 00c606e0 e0451175 cf19e0aa 5a0050c5 90a88425
ffff810114d703c0 345826154 S Bi:4:055:5 -115 16384 <
ffff810114d703c0 345827754 C Bi:4:055:5 0 1521 = 7eff0300 21450005 dc8f2400 00c606e0 dc451175 cf19e0aa 5a0050c5 90a8842b
ffff810114d703c0 345836173 S Bi:4:055:5 -115 16384 <
ffff810114d703c0 345888766 C Bi:4:055:5 -2 0
ffff810137f43300 345889574 S Bo:4:055:6 -115 48 = 7eff0300 21450000 286d0e40 0040064e a719e0aa 5a451175 cfc59000 5000254d
ffff810137f43300 345889700 C Bo:4:055:6 0 48 >
ffff810137f43300 345889958 S Bo:4:055:6 -115 48 = 7eff0300 21450000 286d0f40 0040064e a619e0aa 5a451175 cfc59000 5000254d
ffff810114d703c0 345890027 S Bi:4:055:5 -115 16384 <
ffff810137f43300 345890697 C Bo:4:055:6 0 48 >
ffff810114d703c0 345939770 C Bi:4:055:5 0 1520 = 7eff0300 21450005 dc9bf400 00c606d4 0c451175 cf19e0aa 5a0050c5 90a88430
ffff810114d703c0 345946248 S Bi:4:055:5 -115 16384 <
ffff810114d703c0 346000774 C Bi:4:055:5 -2 0
ffff810137f43300 346001460 S Bo:4:055:6 -115 48 = 7eff0300 21450000 286d1040 0040064e a519e0aa 5a451175 cfc59000 5000254d
ffff810137f43300 346001707 C Bo:4:055:6 0 48 >
ffff810114d703c0 346001779 S Bi:4:055:5 -115 16384 <
ffff810114d703c0 346052773 C Bi:4:055:5 -2 0
ffff810114d703c0 346052926 S Bi:4:055:5 -115 16384 <
ffff810114d703c0 346104778 C Bi:4:055:5 -2 0
ffff810137f43300 346104896 S Bi:4:055:5 -115 16384 <
ffff810137f43300 346156779 C Bi:4:055:5 -2 0
ffff810137f43300 346156900 S Bi:4:055:5 -115 16384 <
ffff810137f43300 346161777 C Bi:4:055:5 0 1530 = 7eff0300 21450005 dca74c00 00c606c8 b4451175 cf19e0aa 5a0050c5 90a88436
ffff810137f43300 346166926 S Bi:4:055:5 -115 16384 <
ffff810137f43300 346220778 C Bi:4:055:5 -2 0
ffff810137f43300 346221351 S Bo:4:055:6 -115 48 = 7eff0300 21450000 286d1140 0040064e a419e0aa 5a451175 cfc59000 5000254d
ffff810137f43480 346221487 S Bi:4:055:5 -115 16384 <
ffff810137f43300 346221717 C Bo:4:055:6 0 48 >
ffff810137f43480 346272784 C Bi:4:055:5 -2 0
ffff810114d70b40 346272933 S Bi:4:055:5 -115 16384 <
ffff810114d70b40 346324790 C Bi:4:055:5 -2 0
ffff810114d70b40 346324964 S Bi:4:055:5 -115 16384 <
ffff810114d70b40 346376793 C Bi:4:055:5 -2 0
ffff810185126180 346376926 S Bi:4:055:5 -115 16384 <
ffff810185126180 346378781 C Bi:4:055:5 0 1523 = 7eff0300 21450005 dca75000 00c606c8 b0451175 cf19e0aa 5a0050c5 90a8843c
ffff810185126180 346381771 S Bi:4:055:5 -115 16384 <
ffff810185126180 346383787 C Bi:4:055:5 0 1530 = 7eff0300 21450005 dcaddc00 00c606c2 24451175 cf19e0aa 5a0050c5 90a88441
ffff810185126180 346390261 S Bi:4:055:5 -115 16384 <
ffff810185126180 346391691 C Bi:4:055:5 0 1038 = 7eff0300 21450005 dcade000 00c606c2 20451175 cf19e0aa 5a0050c5 90a88447
ffff810185126180 346393456 S Bi:4:055:5 -115 16384 <
ffff810185126180 346394784 C Bi:4:055:5 0 485 = 1f36c761 b054738c 2470f89e 1ce35c3e 47936679 a6758bce 787b0d98 f1af10e3
ffff810185126180 346396087 S Bi:4:055:5 -115 16384 <
ffff810185126180 346447793 C Bi:4:055:5 -2 0
ffff810137f43300 346448752 S Bo:4:055:6 -115 48 = 7eff0300 21450000 286d1240 0040064e a319e0aa 5a451175 cfc59000 5000254d
ffff810185126180 346449018 S Bi:4:055:5 -115 16384 <
ffff810137f43300 346449728 C Bo:4:055:6 0 48 >
ffff810137f43000 346452451 S Bo:4:055:6 -115 95 = 7eff0300 21450000 286d1340 0040064e a219e0aa 5a451175 cfc59000 5000254d
ffff810137f43000 346452729 C Bo:4:055:6 0 95 >
ffff810185126180 346500797 C Bi:4:055:5 -2 0
ffff810185126180 346500966 S Bi:4:055:5 -115 16384 <
ffff810185126180 346521804 C Bi:4:055:5 0 1527 = 7eff0300 21450005 dcb7bc00 00c606b8 44451175 cf19e0aa 5a0050c5 90a8844d
ffff810185126180 346526289 S Bi:4:055:5 -115 16384 <
ffff810185126180 346580801 C Bi:4:055:5 -2 0
ffff81013597c240 346581452 S Bo:4:055:6 -115 48 = 7eff0300 21450000 286d1540 0040064e a019e0aa 5a451175 cfc59000 5000254d
ffff810185126180 346581681 S Bi:4:055:5 -115 16384 <
ffff81013597c240 346581738 C Bo:4:055:6 0 48 >
ffff810185126180 346635808 C Bi:4:055:5 -2 0
ffff810185126180 346635957 S Bi:4:055:5 -115 16384 <
ffff810185126180 346687806 C Bi:4:055:5 -2 0
ffff810185126180 346687946 S Bi:4:055:5 -115 16384 <
ffff810185126180 346718804 C Bi:4:055:5 0 1518 = 7eff0300 21450005 dcc3f800 00c606ac 08451175 cf19e0aa 5a0050c5 90a88453
ffff810185126180 346722180 S Bi:4:055:5 -115 16384 <
ffff810185126180 346775810 C Bi:4:055:5 -2 0
ffff81013597c240 346776445 S Bo:4:055:6 -115 48 = 7eff0300 21450000 286d1640 0040064e 9f19e0aa 5a451175 cfc59000 5000254d
ffff810185126180 346776581 S Bi:4:055:5 -115 16384 <
ffff81013597c240 346776748 C Bo:4:055:6 0 48 >
ffff810185126180 346778805 C Bi:4:055:5 0 1517 = 7eff0300 21450005 dcc3fc00 00c606ac 04451175 cf19e0aa 5a0050c5 90a88458
ffff810185126180 346781455 S Bi:4:055:5 -115 16384 <
ffff810185126180 346833819 C Bi:4:055:5 -2 0
ffff81013597cd80 346834472 S Bo:4:055:6 -115 48 = 7eff0300 21450000 286d1740 0040064e 9e19e0aa 5a451175 cfc59000 5000254d
ffff810185126180 346834635 S Bi:4:055:5 -115 16384 <
ffff81013597cd80 346834751 C Bo:4:055:6 0 48 >
ffff810185126180 346838820 C Bi:4:055:5 0 1526 = 7eff0300 21450005 dcc4dc00 00c606ab 24451175 cf19e0aa 5a0050c5 90a8845e
ffff810185126180 346842276 S Bi:4:055:5 -115 16384 <
ffff810185126180 346880824 C Bi:4:055:5 0 1516 = 7eff0300 21450005 dcc4e000 00c606ab 20451175 cf19e0aa 5a0050c5 90a88464
ffff810185126180 346886427 S Bi:4:055:5 -115 16384 <
ffff810185126180 346939821 C Bi:4:055:5 -2 0
ffff81013597cb40 346940641 S Bo:4:055:6 -115 48 = 7eff0300 21450000 286d1840 0040064e 9d19e0aa 5a451175 cfc59000 5000254d
ffff81013597cb40 346940759 C Bo:4:055:6 0 48 >
ffff81013597cb40 346941084 S Bo:4:055:6 -115 48 = 7eff0300 21450000 286d1940 0040064e 9c19e0aa 5a451175 cfc59000 5000254d
ffff810185126180 346941153 S Bi:4:055:5 -115 16384 <
ffff81013597cb40 346941755 C Bo:4:055:6 0 48 >
ffff810185126180 346942815 C Bi:4:055:5 0 1520 = 7eff0300 21450005 dccd3c00 00c606a2 c4451175 cf19e0aa 5a0050c5 90a88469
ffff810185126180 346945425 S Bi:4:055:5 -115 16384 <
ffff810185126180 346996826 C Bi:4:055:5 -2 0
ffff81013597cb40 346997490 S Bo:4:055:6 -115 48 = 7eff0300 21450000 286d1a40 0040064e 9b19e0aa 5a451175 cfc59000 5000254d
ffff81013597cb40 346997762 C Bo:4:055:6 0 48 >
ffff810185126180 346999459 S Bi:4:055:5 -115 16384 <
ffff810185126180 347051829 C Bi:4:055:5 -2 0
ffff810185126180 347051981 S Bi:4:055:5 -115 16384 <
ffff810185126180 347061823 C Bi:4:055:5 0 1524 = 7eff0300 21450005 dcd80400 00c60697 fc451175 cf19e0aa 5a0050c5 90a8846f
ffff810185126180 347066135 S Bi:4:055:5 -115 16384 <
ffff810185126180 347092823 C Bi:4:055:5 0 1520 = 7eff0300 21450005 dcda2000 00c60695 e0451175 cf19e0aa 5a0050c5 90a88475
ffff810185126180 347098134 S Bi:4:055:5 -115 16384 <
ffff810185126180 347151832 C Bi:4:055:5 -2 0
ffff81013597cb40 347152686 S Bo:4:055:6 -115 48 = 7eff0300 21450000 286d1b40 0040064e 9a19e0aa 5a451175 cfc59000 5000254d
ffff81013597cb40 347152773 C Bo:4:055:6 0 48 >
ffff81013597cb40 347153022 S Bo:4:055:6 -115 48 = 7eff0300 21450000 286d1c40 0040064e 9919e0aa 5a451175 cfc59000 5000254d
ffff810185126180 347153091 S Bi:4:055:5 -115 16384 <
ffff81013597cb40 347153767 C Bo:4:055:6 0 48 >
ffff810185126180 347203833 C Bi:4:055:5 -2 0
ffff810185126180 347203952 S Bi:4:055:5 -115 16384 <
ffff810185126180 347255836 C Bi:4:055:5 -2 0
ffff810185126180 347256072 S Bi:4:055:5 -115 16384 <
ffff810185126180 347307835 C Bi:4:055:5 -2 0
ffff810185126180 347307905 S Bi:4:055:5 -115 16384 <
ffff810185126180 347360847 C Bi:4:055:5 -2 0
ffff8101eb5999c0 347360974 S Bi:4:055:5 -115 16384 <
ffff8101ef1153c0 347363679 S Bo:4:055:10 -115 31 = 55534243 92060000 00000000 00000600 00000000 00000000 00000000 000000
ffff8101ef1153c0 347363778 C Bo:4:055:10 0 31 >
ffff8101ef1153c0 347363784 S Bi:4:055:9 -115 13 <
ffff8101ef1153c0 347364778 C Bi:4:055:9 0 13 = 55534253 92060000 00000000 01
ffff8101ef1153c0 347364785 S Bo:4:055:10 -115 31 = 55534243 93060000 12000000 80000603 00000012 00000000 00000000 000000
ffff8101ef1153c0 347365778 C Bo:4:055:10 0 31 >
ffff8101eb599000 347365785 S Bi:4:055:9 -115 18 <
ffff8101eb599000 347366778 C Bi:4:055:9 0 18 = 70000200 0000000a 00000000 3a000000 0000
ffff8101ef1153c0 347366785 S Bi:4:055:9 -115 13 <
ffff8101ef1153c0 347367778 C Bi:4:055:9 0 13 = 55534253 93060000 00000000 00
ffff8101ef1153c0 347367810 S Bo:4:055:10 -115 31 = 55534243 94060000 00000000 00000600 00000000 00000000 00000000 000000
ffff8101ef1153c0 347368778 C Bo:4:055:10 0 31 >
ffff8101ef1153c0 347368784 S Bi:4:055:9 -115 13 <
ffff8101ef1153c0 347369778 C Bi:4:055:9 0 13 = 55534253 94060000 00000000 01
ffff8101ef1153c0 347369784 S Bo:4:055:10 -115 31 = 55534243 95060000 12000000 80000603 00000012 00000000 00000000 000000
ffff8101ef1153c0 347370778 C Bo:4:055:10 0 31 >
ffff8101eb599000 347370785 S Bi:4:055:9 -115 18 <
ffff8101eb599000 347371778 C Bi:4:055:9 0 18 = 70000200 0000000a 00000000 3a000000 0000
ffff8101ef1153c0 347371785 S Bi:4:055:9 -115 13 <
ffff8101ef1153c0 347372779 C Bi:4:055:9 0 13 = 55534253 95060000 00000000 00
ffff8101eb5999c0 347399843 C Bi:4:055:5 0 1528 = 7eff0300 21450005 dcded000 00c60691 30451175 cf19e0aa 5a0050c5 90a8847a
ffff8101eb5999c0 347406162 S Bi:4:055:5 -115 16384 <
ffff8101eb5999c0 347407842 C Bi:4:055:5 0 1523 = 7eff0300 21450005 dcded800 00c60691 28451175 cf19e0aa 5a0050c5 90a88480
ffff8101eb5999c0 347414091 S Bi:4:055:5 -115 16384 <
ffff8101eb5999c0 347415841 C Bi:4:055:5 0 1042 = 7eff0300 21450005 dce12800 00c6068e d8451175 cf19e0aa 5a0050c5 90a88486
ffff8101eb5999c0 347421354 S Bi:4:055:5 -115 16384 <
ffff8101eb5999c0 347422842 C Bi:4:055:5 0 482 = fecfe1aa 78b756d3 7d5e38ea be3df85f e18f8593 eada37c3 9fb0cd72 ac4e55c3
ffff8101eb5999c0 347423689 S Bi:4:055:5 -115 16384 <
ffff8101eb5999c0 347425839 C Bi:4:055:5 0 1528 = 7eff0300 21450005 dce12c00 00c6068e d4451175 cf19e0aa 5a0050c5 90a8848c
ffff8101eb5999c0 347428379 S Bi:4:055:5 -115 16384 <
ffff8101eb5999c0 347452857 C Bi:4:055:5 0 1522 = 7eff0300 21450005 dce7a800 00c60688 58451175 cf19e0aa 5a0050c5 90a88491
ffff8101eb5999c0 347458378 S Bi:4:055:5 -115 16384 <
ffff8101eb5999c0 347508857 C Bi:4:055:5 0 1519 = 7eff0300 21450005 dce7ac00 00c60688 54451175 cf19e0aa 5a0050c5 90a88497
ffff8101eb5999c0 347514496 S Bi:4:055:5 -115 16384 <
ffff8101eb5999c0 347567855 C Bi:4:055:5 -2 0
ffff81013597cb40 347569348 S Bo:4:055:6 -115 48 = 7eff0300 21450000 286d1d40 0040064e 9819e0aa 5a451175 cfc59000 5000254d
ffff8101eb5999c0 347569745 S Bi:4:055:5 -115 16384 <
ffff81013597cb40 347569798 C Bo:4:055:6 0 48 >
ffff81013597cb40 347570321 S Bo:4:055:6 -115 236 = 7eff0300 21450000 286d1e40 0040064e 9719e0aa 5a451175 cfc59000 5000254d
ffff81013597cb40 347570793 C Bo:4:055:6 0 236 >
ffff8101eb599180 347599898 S Bo:4:055:6 -115 60 = 7eff0300 21450000 34465340 00400669 cf0a0a01 c3d155ad 7f9ddb00 50cdbabb
ffff8101eb599180 347600794 C Bo:4:055:6 0 60 >
ffff8101eb5999c0 347623856 C Bi:4:055:5 -2 0
ffff8101eb5999c0 347624018 S Bi:4:055:5 -115 16384 <
ffff8101eb5999c0 347675866 C Bi:4:055:5 -2 0
ffff8101eb5999c0 347676012 S Bi:4:055:5 -115 16384 <
ffff8101eb5999c0 347727867 C Bi:4:055:5 -2 0
ffff8101eb5999c0 347728010 S Bi:4:055:5 -115 16384 <
ffff8101eb5999c0 347779868 C Bi:4:055:5 -2 0
ffff8101eb5999c0 347779994 S Bi:4:055:5 -115 16384 <
ffff8101eb5999c0 347833869 C Bi:4:055:5 -2 0
ffff8101ef0a0300 347833981 S Bi:4:055:5 -115 16384 <
ffff8101ef0a0300 347858880 C Bi:4:055:5 0 1523 = 7eff0300 21450005 dcfe8800 00c60671 78451175 cf19e0aa 5a0050c5 90a8849d
ffff8101ef0a0300 347862175 S Bi:4:055:5 -115 16384 <
ffff8101ef0a0300 347900872 C Bi:4:055:5 0 1519 = 7eff0300 21450005 dcfe9000 00c60671 70451175 cf19e0aa 5a0050c5 90a884a2
ffff8101ef0a0300 347906250 S Bi:4:055:5 -115 16384 <
ffff8101ef0a0300 347959881 C Bi:4:055:5 -2 0
ffff8101ef0a0300 347960608 S Bo:4:055:6 -115 48 = 7eff0300 21450000 286d2340 0040064e 9219e0aa 5a451175 cfc59000 5000254d
ffff8101ef0a0300 347960814 C Bo:4:055:6 0 48 >
ffff8101ef0a0300 347961304 S Bo:4:055:6 -115 48 = 7eff0300 21450000 286d2440 0040064e 9119e0aa 5a451175 cfc59000 5000254d
ffff8101df0e3f00 347961369 S Bi:4:055:5 -115 16384 <
ffff8101ef0a0300 347961813 C Bo:4:055:6 0 48 >
ffff8101df0e3f00 348011877 C Bi:4:055:5 -2 0
ffff8101df0e3f00 348011986 S Bi:4:055:5 -115 16384 <
ffff8101df0e3f00 348063883 C Bi:4:055:5 -2 0
ffff8101df0e3f00 348063999 S Bi:4:055:5 -115 16384 <
ffff8101df0e3f00 348115880 C Bi:4:055:5 -2 0
ffff8101df0e3f00 348115949 S Bi:4:055:5 -115 16384 <
ffff8101df0e3f00 348167887 C Bi:4:055:5 -2 0
ffff8101df0e3f00 348167999 S Bi:4:055:5 -115 16384 <
ffff8101df0e3f00 348207889 C Bi:4:055:5 0 1519 = 7eff0300 21450005 dc00bc00 00c6066f 45451175 cf19e0aa 5a0050c5 90a884a8
ffff8101df0e3f00 348214242 S Bi:4:055:5 -115 16384 <
ffff8101df0e3f00 348215885 C Bi:4:055:5 0 1523 = 7eff0300 21450005 dc00c400 00c6066f 3d451175 cf19e0aa 5a0050c5 90a884ae
ffff8101df0e3f00 348222212 S Bi:4:055:5 -115 16384 <
ffff8101df0e3f00 348223888 C Bi:4:055:5 0 1050 = 7eff0300 21450005 dc00c800 00c6066f 39451175 cf19e0aa 5a0050c5 90a884b3
ffff8101df0e3f00 348229353 S Bi:4:055:5 -115 16384 <
ffff8101df0e3f00 348230887 C Bi:4:055:5 0 473 = f3be16c6 f0e6618c 8e3f09fd ab95e3f2 4a98ee15 a786c833 eaf0c9f1 73f1272b
ffff8101df0e3f00 348231990 S Bi:4:055:5 -115 16384 <
ffff8101df0e3f00 348233886 C Bi:4:055:5 0 1535 = 7eff0300 21450005 dc00cc00 00c6066f 35451175 cf19e0aa 5a0050c5 90a884b9
ffff8101df0e3f00 348236672 S Bi:4:055:5 -115 16384 <
ffff8101df0e3f00 348287896 C Bi:4:055:5 -2 0
ffff8101df0e3f00 348288947 S Bo:4:055:6 -115 48 = 7eff0300 21450000 286d2540 0040064e 9019e0aa 5a451175 cfc59000 5000254d
ffff8101df0e3e40 348289485 S Bi:4:055:5 -115 16384 <
ffff8101df0e3f00 348289833 C Bo:4:055:6 0 48 >
ffff8101df0e3f00 348290214 S Bo:4:055:6 -115 142 = 7eff0300 21450000 286d2640 0040064e 8f19e0aa 5a451175 cfc59000 5000254d
ffff8101df0e3f00 348290831 C Bo:4:055:6 0 142 >
ffff8101df0e3e40 348339900 C Bi:4:055:5 -2 1518 = 7eff0300 21450005 dc022800 00c6066d d9451175 cf19e0aa 5a0050c5 90a884bf
ffff8101df0e3e40 348340069 S Bi:4:055:5 -115 16384 <
ffff8101df0e3e40 348341889 C Bi:4:055:5 0 1522 = 7eff0300 21450005 dc187400 00c60657 8d451175 cf19e0aa 5a0050c5 90a884c5
ffff8101df0e3780 348344519 S Bi:4:055:5 -115 16384 <
ffff8101df0e3780 348346893 C Bi:4:055:5 0 1518 = 7eff0300 21450005 dc187c00 00c60657 85451175 cf19e0aa 5a0050c5 90a884ca
ffff8101df0e3780 348350206 S Bi:4:055:5 -115 16384 <
ffff8101df0e3780 348350896 C Bi:4:055:5 0 3 = b3357e
ffff8101df0e3780 348350962 S Bi:4:055:5 -115 16384 <
ffff8101df0e3780 348403901 C Bi:4:055:5 -2 0
ffff8101df0e3780 348404664 S Bo:4:055:6 -115 60 = 7eff0300 21450000 346d2940 0040064e 8019e0aa 5a451175 cfc59000 5000254d
ffff8101df0e3000 348404753 S Bi:4:055:5 -115 16384 <
ffff8101df0e3780 348404837 C Bo:4:055:6 0 60 >
ffff8101df0e3780 348405054 S Bo:4:055:6 -115 61 = 7eff0300 21450000 346d2a40 0040064e 7f19e0aa 5a451175 cfc59000 5000254d
ffff8101df0e3780 348405836 C Bo:4:055:6 0 61 >
ffff8101df0e3000 348455905 C Bi:4:055:5 -2 0
ffff8101df0e3000 348456059 S Bi:4:055:5 -115 16384 <
ffff8101df0e3000 348507909 C Bi:4:055:5 -2 0
ffff8101df0e3000 348508053 S Bi:4:055:5 -115 16384 <
ffff8101df0e3000 348559914 C Bi:4:055:5 -2 0
ffff8101df0e3000 348560055 S Bi:4:055:5 -115 16384 <
ffff8101df0e3000 348611913 C Bi:4:055:5 -2 0
ffff8101df0e3000 348612045 S Bi:4:055:5 -115 16384 <
ffff8101df0e3000 348663921 C Bi:4:055:5 -2 0
ffff8101df0e3000 348664075 S Bi:4:055:5 -115 16384 <
ffff8101df0e3000 348715924 C Bi:4:055:5 -2 0
ffff8101df0e3000 348716067 S Bi:4:055:5 -115 16384 <
ffff8101df0e3000 348767927 C Bi:4:055:5 -2 0
ffff8101df0e3000 348768072 S Bi:4:055:5 -115 16384 <
ffff8101df0e3000 348779921 C Bi:4:055:5 0 1521 = 7eff0300 21450005 dc279800 00c60648 69451175 cf19e0aa 5a0050c5 90a884d0
ffff8101df0e3000 348786329 S Bi:4:055:5 -115 16384 <
ffff8101df0e3000 348787919 C Bi:4:055:5 0 1519 = 7eff0300 21450005 dc27a400 00c60648 5d451175 cf19e0aa 5a0050c5 90a884d6
ffff8101df0e3000 348794236 S Bi:4:055:5 -115 16384 <
ffff8101df0e3000 348795921 C Bi:4:055:5 0 1050 = 7eff0300 21450005 dc297400 00c60646 8d451175 cf19e0aa 5a0050c5 90a884db
ffff8101df0e3000 348801679 S Bi:4:055:5 -115 16384 <
ffff8101df0e3000 348802920 C Bi:4:055:5 0 475 = aba07827 e34bfc36 f097c48b 3f17f89a eefbc6be 3083e13f 8abc1bf0 b74dbbf8
ffff8101df0e3000 348804156 S Bi:4:055:5 -115 16384 <
ffff8101df0e3000 348855932 C Bi:4:055:5 -2 0
ffff8101df0e3000 348856875 S Bo:4:055:6 -115 61 = 7eff0300 21450000 346d2b40 0040064e 7d5e19e0 aa5a4511 75cfc590 00500025
ffff8101df0e3e40 348857147 S Bi:4:055:5 -115 16384 <
ffff8101df0e3000 348857864 C Bo:4:055:6 0 61 >
ffff8101df0e3000 348858222 S Bo:4:055:6 -115 120 = 7eff0300 21450000 346d2c40 0040064e 7d5d19e0 aa5a4511 75cfc590 00500025
ffff8101df0e3000 348858867 C Bo:4:055:6 0 120 >
ffff8101df0e3e40 348908933 C Bi:4:055:5 -2 0
ffff81013597cb40 348909091 S Bi:4:055:5 -115 16384 <
ffff81013597cb40 348938934 C Bi:4:055:5 0 1527 = 7eff0300 21450005 dc297800 00c60646 89451175 cf19e0aa 5a0050c5 90a884e1
ffff81013597cb40 348942906 S Bi:4:055:5 -115 16384 <
ffff81013597cb40 348944931 C Bi:4:055:5 0 1518 = 7eff0300 21450005 dc297c00 00c60646 85451175 cf19e0aa 5a0050c5 90a884e7
ffff81013597cb40 348950617 S Bi:4:055:5 -115 16384 <
ffff81013597cb40 348951933 C Bi:4:055:5 0 1046 = 7eff0300 21450005 dc300c00 00c6063f f5451175 cf19e0aa 5a0050c5 90a884ed
ffff81013597cb40 348953689 S Bi:4:055:5 -115 16384 <
ffff81013597cb40 348954934 C Bi:4:055:5 0 477 = 20d27d5e 3ac7e1ff 00037979 e62b30e0 5e13c064 782c1d7c 8b8373be 11c7d7ad
ffff81013597cb40 348955751 S Bi:4:055:5 -115 16384 <
ffff81013597cb40 348999941 C Bi:4:055:5 0 1518 = 7eff0300 21450005 dc301000 00c6063f f1451175 cf19e0aa 5a0050c5 90a884bf
ffff81013597cb40 349002578 S Bi:4:055:5 -115 16384 <
ffff81013597cb40 349056944 C Bi:4:055:5 -2 0
ffff81013597cb40 349057845 S Bi:4:055:5 -115 16384 <
ffff8101df0e3000 349058528 S Bo:4:055:6 -115 60 = 7eff0300 21450000 346d2e40 0040064e 7b19e0aa 5a451175 cfc59000 5000254d
ffff8101df0e3000 349058876 C Bo:4:055:6 0 60 >
ffff8101df0e3f00 349061323 S Bo:4:055:6 -115 166 = 7eff0300 21450000 346d2f40 0040064e 7a19e0aa 5a451175 cfc59000 5000254d
ffff8101df0e3f00 349061875 C Bo:4:055:6 0 166 >
ffff81013597cb40 349108948 C Bi:4:055:5 -2 0
ffff81013597cb40 349109123 S Bi:4:055:5 -115 16384 <
ffff81013597cb40 349160948 C Bi:4:055:5 -2 0
ffff81013597cb40 349161012 S Bi:4:055:5 -115 16384 <
ffff81013597cb40 349212951 C Bi:4:055:5 -2 0
ffff81013597cb40 349213009 S Bi:4:055:5 -115 16384 <
ffff81013597cb40 349264955 C Bi:4:055:5 -2 0
ffff81013597cb40 349265003 S Bi:4:055:5 -115 16384 <
ffff81013597cb40 349316957 C Bi:4:055:5 -2 0
ffff81013597cb40 349317004 S Bi:4:055:5 -115 16384 <
ffff8101ef1153c0 349359924 S Bo:4:055:10 -115 31 = 55534243 96060000 00000000 00000600 00000000 00000000 00000000 000000
ffff8101ef1153c0 349360892 C Bo:4:055:10 0 31 >
ffff8101ef1153c0 349360900 S Bi:4:055:9 -115 13 <
ffff8101ef1153c0 349361890 C Bi:4:055:9 0 13 = 55534253 96060000 00000000 01
ffff8101ef1153c0 349361896 S Bo:4:055:10 -115 31 = 55534243 97060000 12000000 80000603 00000012 00000000 00000000 000000
ffff8101ef1153c0 349362889 C Bo:4:055:10 0 31 >
ffff8101df0e3780 349362898 S Bi:4:055:9 -115 18 <
ffff8101df0e3780 349363889 C Bi:4:055:9 0 18 = 70000200 0000000a 00000000 3a000000 0000
ffff8101ef1153c0 349363898 S Bi:4:055:9 -115 13 <
ffff8101ef1153c0 349364889 C Bi:4:055:9 0 13 = 55534253 97060000 00000000 00
ffff8101ef1153c0 349364923 S Bo:4:055:10 -115 31 = 55534243 98060000 00000000 00000600 00000000 00000000 00000000 000000
ffff8101ef1153c0 349365890 C Bo:4:055:10 0 31 >
ffff8101ef1153c0 349365895 S Bi:4:055:9 -115 13 <
ffff8101ef1153c0 349366889 C Bi:4:055:9 0 13 = 55534253 98060000 00000000 01
ffff8101ef1153c0 349366895 S Bo:4:055:10 -115 31 = 55534243 99060000 12000000 80000603 00000012 00000000 00000000 000000
ffff8101ef1153c0 349367631 C Bo:4:055:10 0 31 >
ffff8101df0e3780 349367644 S Bi:4:055:9 -115 18 <
ffff8101df0e3780 349367890 C Bi:4:055:9 0 18 = 70000200 0000000a 00000000 3a000000 0000
ffff8101ef1153c0 349367898 S Bi:4:055:9 -115 13 <
ffff81013597cb40 349368953 C Bi:4:055:5 -2 0
ffff8101ef1153c0 349368960 C Bi:4:055:9 0 13 = 55534253 99060000 00000000 00
ffff81013597cb40 349368998 S Bi:4:055:5 -115 16384 <
ffff81013597cb40 349420964 C Bi:4:055:5 -2 0
ffff81013597cb40 349421042 S Bi:4:055:5 -115 16384 <
ffff81013597cb40 349472965 C Bi:4:055:5 -2 0
ffff81013597cb40 349473012 S Bi:4:055:5 -115 16384 <
ffff81013597cb40 349524970 C Bi:4:055:5 -2 0
ffff8101df0e3900 349525121 S Bi:4:055:5 -115 16384 <
ffff8101df0e3900 349530973 C Bi:4:055:5 0 1525 = 7eff0300 21450005 dc510c00 00c6061e f5451175 cf19e0aa 5a0050c5 90a884f2
ffff8101df0e3900 349534362 S Bi:4:055:5 -115 16384 <
ffff8101df0e3900 349535963 C Bi:4:055:5 0 1523 = 7eff0300 21450005 dc511000 00c6061e f1451175 cf19e0aa 5a0050c5 90a884f8
ffff8101df0e3900 349542135 S Bi:4:055:5 -115 16384 <
ffff8101df0e3900 349543961 C Bi:4:055:5 0 1525 = 7eff0300 21450005 dc518800 00c6061e 79451175 cf19e0aa 5a0050c5 90a884fe
ffff8101df0e3900 349550316 S Bi:4:055:5 -115 16384 <
ffff8101df0e3900 349551961 C Bi:4:055:5 0 1042 = 7eff0300 21450005 dc518c00 00c6061e 75451175 cf19e0aa 5a0050c5 90a88503
ffff8101df0e3900 349557806 S Bi:4:055:5 -115 16384 <
ffff8101df0e3900 349558965 C Bi:4:055:5 0 479 = baef8834 bf88da47 857c7d5d ace8565e 0ef8bfe3 5f8b97be 13b7f0ae 99fb393f
ffff8101df0e3900 349559879 S Bi:4:055:5 -115 16384 <
ffff8101df0e3900 349570974 C Bi:4:055:5 0 1522 = 7eff0300 21450005 dc519000 00c6061e 71451175 cf19e0aa 5a0050c5 90a88509
ffff8101df0e3900 349574243 S Bi:4:055:5 -115 16384 <
ffff8101df0e3900 349627977 C Bi:4:055:5 -2 0
ffff8101df0e3900 349629325 S Bo:4:055:6 -115 48 = 7eff0300 21450000 286d3240 0040064e 8319e0aa 5a451175 cfc59000 5000254d
ffff8101df0e3900 349629913 C Bo:4:055:6 0 48 >
ffff8101df0e3900 349630359 S Bo:4:055:6 -115 142 = 7eff0300 21450000 286d3340 0040064e 8219e0aa 5a451175 cfc59000 5000254d
ffff8101df0e3d80 349630583 S Bi:4:055:5 -115 16384 <
ffff8101df0e3900 349630907 C Bo:4:055:6 0 142 >
ffff8101df0e3900 349631130 S Bo:4:055:6 -115 48 = 7eff0300 21450000 286d3640 0040064e 7f19e0aa 5a451175 cfc59000 5000254d
ffff8101df0e3900 349631909 C Bo:4:055:6 0 48 >
ffff8101df0e3d80 349683978 C Bi:4:055:5 -2 0
ffff8101df0e3d80 349684175 S Bi:4:055:5 -115 16384 <
ffff8101df0e3d80 349735980 C Bi:4:055:5 -2 0
ffff8101df0e3d80 349736122 S Bi:4:055:5 -115 16384 <
ffff8101df0e3d80 349787982 C Bi:4:055:5 -2 0
ffff8101df0e3d80 349788125 S Bi:4:055:5 -115 16384 <
ffff8101df0e3d80 349839985 C Bi:4:055:5 -2 0
ffff8101df0e3d80 349840121 S Bi:4:055:5 -115 16384 <
ffff8101df0e3d80 349891989 C Bi:4:055:5 -2 0
ffff8101df0e3d80 349892133 S Bi:4:055:5 -115 16384 <
ffff8101df0e3d80 349898982 C Bi:4:055:5 0 1522 = 7eff0300 21450005 dc6bc400 00c60604 3d451175 cf19e0aa 5a0050c5 90a8850f
ffff8101df0e3d80 349902277 S Bi:4:055:5 -115 16384 <
ffff8101df0e3d80 349956992 C Bi:4:055:5 -2 0
ffff8101df0e3d80 349957378 S Bi:4:055:5 -115 16384 <
ffff8101df0e3a80 349957681 S Bo:4:055:6 -115 50 = 7eff0300 21450000 286d3740 0040064e 7d5e19e0 aa5a4511 75cfc590 00500025
ffff8101df0e3a80 349957928 C Bo:4:055:6 0 50 >
ffff8101df0e3d80 349958992 C Bi:4:055:5 0 1516 = 7eff0300 21450005 dc6bc800 00c60604 39451175 cf19e0aa 5a0050c5 90a88514
ffff8101df0e3d80 349961794 S Bi:4:055:5 -115 16384 <
ffff8101df0e3d80 350012995 C Bi:4:055:5 -2 0
ffff81019bd8ad80 350013355 S Bi:4:055:5 -115 16384 <
ffff8101df0e3a80 350013716 S Bo:4:055:6 -115 49 = 7eff0300 21450000 286d3840 0040064e 7d5d19e0 aa5a4511 75cfc590 00500025
ffff8101df0e3a80 350013929 C Bo:4:055:6 0 49 >
ffff81019bd8ad80 350020003 C Bi:4:055:5 0 1520 = 7eff0300 21450005 dc6d1400 00c60602 ed451175 cf19e0aa 5a0050c5 90a8851a
ffff81019bd8ad80 350023141 S Bi:4:055:5 -115 16384 <
ffff81019bd8ad80 350077000 C Bi:4:055:5 -2 0
ffff81019bd8ad80 350077365 S Bi:4:055:5 -115 16384 <
ffff8101df0e3a80 350077703 S Bo:4:055:6 -115 48 = 7eff0300 21450000 286d3940 0040064e 7c19e0aa 5a451175 cfc59000 5000254d
ffff8101df0e3a80 350077931 C Bo:4:055:6 0 48 >
ffff81019bd8ad80 350129003 C Bi:4:055:5 -2 0
ffff81019bd8ad80 350129094 S Bi:4:055:5 -115 16384 <
ffff81019bd8ad80 350181005 C Bi:4:055:5 -2 0
ffff81019bd8ad80 350181065 S Bi:4:055:5 -115 16384 <
ffff81019bd8ad80 350233007 C Bi:4:055:5 -2 0
ffff81019bd8ad80 350233066 S Bi:4:055:5 -115 16384 <
ffff81019bd8ad80 350275011 C Bi:4:055:5 0 1523 = 7eff0300 21450005 dc6d1800 00c60602 e9451175 cf19e0aa 5a0050c5 90a88520
ffff81019bd8ad80 350278706 S Bi:4:055:5 -115 16384 <
ffff81019bd8ad80 350281005 C Bi:4:055:5 0 1515 = 7eff0300 21450005 dc6d1c00 00c60602 e5451175 cf19e0aa 5a0050c5 90a88526
ffff81019bd8ad80 350286577 S Bi:4:055:5 -115 16384 <
ffff81019bd8ad80 350341013 C Bi:4:055:5 -2 0
ffff81019bd8ad80 350341457 S Bi:4:055:5 -115 16384 <
ffff8101df0e30c0 350341782 S Bo:4:055:6 -115 48 = 7eff0300 21450000 286d3a40 0040064e 7b19e0aa 5a451175 cfc59000 5000254d
ffff8101df0e30c0 350341946 C Bo:4:055:6 0 48 >
ffff8101df0e36c0 350347879 S Bo:4:055:6 -115 48 = 7eff0300 21450000 286d3b40 0040064e 7a19e0aa 5a451175 cfc59000 5000254d
ffff8101df0e36c0 350348946 C Bo:4:055:6 0 48 >
ffff81019bd8ad80 350393017 C Bi:4:055:5 -2 0
ffff81019bd8ad80 350393166 S Bi:4:055:5 -115 16384 <
ffff81019bd8ad80 350435019 C Bi:4:055:5 0 1518 = 7eff0300 21450005 dc78e400 00c606f7 1c451175 cf19e0aa 5a0050c5 90a8852b
ffff81019bd8ad80 350438740 S Bi:4:055:5 -115 16384 <
ffff81019bd8ad80 350493024 C Bi:4:055:5 -2 0
ffff81019bd8ad80 350493379 S Bi:4:055:5 -115 16384 <
ffff8101df0e3900 350493727 S Bo:4:055:6 -115 48 = 7eff0300 21450000 286d3c40 0040064e 7919e0aa 5a451175 cfc59000 5000254d
ffff8101df0e3900 350493954 C Bo:4:055:6 0 48 >
ffff81019bd8ad80 350502020 C Bi:4:055:5 0 1524 = 7eff0300 21450005 dc78e800 00c606f7 18451175 cf19e0aa 5a0050c5 90a88531
ffff81019bd8ad80 350508081 S Bi:4:055:5 -115 16384 <
ffff81019bd8ad80 350510023 C Bi:4:055:5 0 1527 = 7eff0300 21450005 dc7b5400 00c606f4 ac451175 cf19e0aa 5a0050c5 90a88537
ffff81019bd8ad80 350512490 S Bi:4:055:5 -115 16384 <
ffff81019bd8ad80 350565025 C Bi:4:055:5 -2 0
ffff81019bd8ad80 350565565 S Bi:4:055:5 -115 16384 <
ffff8101df0e3780 350565910 S Bo:4:055:6 -115 48 = 7eff0300 21450000 286d3d40 0040064e 7819e0aa 5a451175 cfc59000 5000254d
ffff8101df0e3780 350566959 C Bo:4:055:6 0 48 >
ffff8101df0e3780 350567197 S Bo:4:055:6 -115 48 = 7eff0300 21450000 286d3e40 0040064e 7719e0aa 5a451175 cfc59000 5000254d
ffff8101df0e3780 350567957 C Bo:4:055:6 0 48 >
ffff81019bd8ad80 350617034 C Bi:4:055:5 -2 0
ffff81019bd8ad80 350617215 S Bi:4:055:5 -115 16384 <
ffff81019bd8ad80 350634032 C Bi:4:055:5 0 1521 = 7eff0300 21450005 dc7f6c00 00c606f0 94451175 cf19e0aa 5a0050c5 90a8853c
ffff81019bd8ad80 350638717 S Bi:4:055:5 -115 16384 <
ffff81019bd8ad80 350693033 C Bi:4:055:5 -2 0
ffff81019bd8ad80 350693354 S Bi:4:055:5 -115 16384 <
ffff8101df0e36c0 350693702 S Bo:4:055:6 -115 48 = 7eff0300 21450000 286d3f40 0040064e 7619e0aa 5a451175 cfc59000 5000254d
ffff8101df0e36c0 350693966 C Bo:4:055:6 0 48 >
ffff81019bd8ad80 350745036 C Bi:4:055:5 -2 0
ffff81019bd8ad80 350745168 S Bi:4:055:5 -115 16384 <
ffff81019bd8ad80 350797038 C Bi:4:055:5 -2 0
ffff81019bd8ad80 350797162 S Bi:4:055:5 -115 16384 <
ffff81019bd8ad80 350849044 C Bi:4:055:5 -2 0
ffff81019bd8ad80 350849175 S Bi:4:055:5 -115 16384 <
ffff81019bd8ad80 350860041 C Bi:4:055:5 0 1530 = 7eff0300 21450005 dc8b3c00 00c606e4 c4451175 cf19e0aa 5a0050c5 90a88542
ffff81019bd8ad80 350862759 S Bi:4:055:5 -115 16384 <
ffff81019bd8ad80 350873044 C Bi:4:055:5 0 1518 = 7eff0300 21450005 dc8b4000 00c606e4 c0451175 cf19e0aa 5a0050c5 90a88548
ffff81019bd8ad80 350878591 S Bi:4:055:5 -115 16384 <
ffff81019bd8ad80 350933047 C Bi:4:055:5 -2 0
ffff81019bd8ad80 350933542 S Bi:4:055:5 -115 16384 <
ffff8101df0e3780 350933880 S Bo:4:055:6 -115 48 = 7eff0300 21450000 286d4040 0040064e 7519e0aa 5a451175 cfc59000 5000254d
ffff8101df0e3780 350933978 C Bo:4:055:6 0 48 >
ffff8101df0e36c0 350935910 S Bo:4:055:6 -115 48 = 7eff0300 21450000 286d4140 0040064e 7419e0aa 5a451175 cfc59000 5000254d
ffff8101df0e36c0 350936978 C Bo:4:055:6 0 48 >
ffff81019bd8ad80 350985048 C Bi:4:055:5 -2 0
ffff81019bd8ad80 350985161 S Bi:4:055:5 -115 16384 <
ffff81019bd8ad80 351037050 C Bi:4:055:5 -2 0
ffff81019bd8ad80 351037172 S Bi:4:055:5 -115 16384 <
ffff81019bd8ad80 351049052 C Bi:4:055:5 0 1519 = 7eff0300 21450005 dc911c00 00c606de e4451175 cf19e0aa 5a0050c5 90a8854d
ffff81019bd8ad80 351054730 S Bi:4:055:5 -115 16384 <
ffff81019bd8ad80 351073054 C Bi:4:055:5 0 1525 = 7eff0300 21450005 dc92f800 00c606dd 08451175 cf19e0aa 5a0050c5 90a88553
ffff81019bd8ad80 351078579 S Bi:4:055:5 -115 16384 <
ffff81019bd8ad80 351091060 C Bi:4:055:5 0 1521 = 7eff0300 21450005 dc92fc00 00c606dd 04451175 cf19e0aa 5a0050c5 90a88559
ffff81019bd8ad80 351094356 S Bi:4:055:5 -115 16384 <
ffff81019bd8ad80 351113055 C Bi:4:055:5 0 1530 = 7eff0300 21450005 dc930000 00c606dd 00451175 cf19e0aa 5a0050c5 90a8855f
ffff81019bd8ad80 351118587 S Bi:4:055:5 -115 16384 <
ffff81019bd8ad80 351121053 C Bi:4:055:5 0 1521 = 7eff0300 21450005 dc96fc00 00c606d9 04451175 cf19e0aa 5a0050c5 90a88564
ffff81019bd8ad80 351126618 S Bi:4:055:5 -115 16384 <
ffff81019bd8ad80 351181060 C Bi:4:055:5 -2 0
ffff81019bd8ad80 351182070 S Bi:4:055:5 -115 16384 <
ffff8101df0e36c0 351182407 S Bo:4:055:6 -115 48 = 7eff0300 21450000 286d4240 0040064e 7319e0aa 5a451175 cfc59000 5000254d
ffff8101df0e36c0 351182995 C Bo:4:055:6 0 48 >
ffff8101df0e3300 351184165 S Bo:4:055:6 -115 189 = 7eff0300 21450000 286d4340 0040064e 7219e0aa 5a451175 cfc59000 5000254d
ffff8101df0e3300 351184993 C Bo:4:055:6 0 189 >
ffff81019bd8ad80 351202064 C Bi:4:055:5 0 1523 = 7eff0300 21450005 dc9e9c00 00c606d1 64451175 cf19e0aa 5a0050c5 90a8856a
ffff81019bd8ad80 351206712 S Bi:4:055:5 -115 16384 <
ffff81019bd8ad80 351261064 C Bi:4:055:5 -2 0
ffff81019bd8ad80 351261422 S Bi:4:055:5 -115 16384 <
ffff81019bd8a0c0 351300365 S Bo:4:055:6 -115 48 = 7eff0300 21450000 286d4740 0040064e 6e19e0aa 5a451175 cfc59000 5000254d
ffff81019bd8a0c0 351301002 C Bo:4:055:6 0 48 >
ffff81019bd8ad80 351313068 C Bi:4:055:5 -2 0
ffff81019bd8ad80 351313149 S Bi:4:055:5 -115 16384 <
ffff81019bd8ad80 351335069 C Bi:4:055:5 0 1518 = 7eff0300 21450005 dca00c00 00c606cf f4451175 cf19e0aa 5a0050c5 90a88570
ffff81019bd8ad80 351338520 S Bi:4:055:5 -115 16384 <
ffff8101ef1153c0 351364044 S Bo:4:055:10 -115 31 = 55534243 9a060000 00000000 00000600 00000000 00000000 00000000 000000
ffff8101ef1153c0 351365006 C Bo:4:055:10 0 31 >
ffff8101ef1153c0 351365017 S Bi:4:055:9 -115 13 <
ffff8101ef1153c0 351366001 C Bi:4:055:9 0 13 = 55534253 9a060000 00000000 01
ffff8101ef1153c0 351366010 S Bo:4:055:10 -115 31 = 55534243 9b060000 12000000 80000603 00000012 00000000 00000000 000000
ffff8101ef1153c0 351367001 C Bo:4:055:10 0 31 >
ffff8101df0e3900 351367011 S Bi:4:055:9 -115 18 <
ffff8101df0e3900 351368001 C Bi:4:055:9 0 18 = 70000200 0000000a 00000000 3a000000 0000
ffff8101ef1153c0 351368010 S Bi:4:055:9 -115 13 <
ffff8101ef1153c0 351369001 C Bi:4:055:9 0 13 = 55534253 9b060000 00000000 00
ffff8101ef1153c0 351369046 S Bo:4:055:10 -115 31 = 55534243 9c060000 00000000 00000600 00000000 00000000 00000000 000000
ffff8101ef1153c0 351370001 C Bo:4:055:10 0 31 >
ffff8101ef1153c0 351370006 S Bi:4:055:9 -115 13 <
ffff8101ef1153c0 351371001 C Bi:4:055:9 0 13 = 55534253 9c060000 00000000 01
ffff8101ef1153c0 351371007 S Bo:4:055:10 -115 31 = 55534243 9d060000 12000000 80000603 00000012 00000000 00000000 000000
ffff8101ef1153c0 351372001 C Bo:4:055:10 0 31 >
ffff8101df0e3900 351372008 S Bi:4:055:9 -115 18 <
ffff8101df0e3900 351373001 C Bi:4:055:9 0 18 = 70000200 0000000a 00000000 3a000000 0000
ffff8101ef1153c0 351373008 S Bi:4:055:9 -115 13 <
ffff8101ef1153c0 351374001 C Bi:4:055:9 0 13 = 55534253 9d060000 00000000 00
ffff81019bd8ad80 351393066 C Bi:4:055:5 -2 0
ffff81019bd8ad80 351393400 S Bi:4:055:5 -115 16384 <
ffff81019bd8ad80 351445074 C Bi:4:055:5 -2 0
ffff81019bd8ad80 351445211 S Bi:4:055:5 -115 16384 <
ffff81019bd8a0c0 351472406 S Bo:4:055:6 -115 48 = 7eff0300 21450000 286d4840 0040064e 6d19e0aa 5a451175 cfc59000 5000254d
ffff81019bd8ad80 351473078 C Bi:4:055:5 0 1528 = 7eff0300 21450005 dcacb400 00c606c3 4c451175 cf19e0aa 5a0050c5 90a88575
ffff81019bd8a0c0 351473086 C Bo:4:055:6 0 48 >
ffff81019bd8a0c0 351478657 S Bi:4:055:5 -115 16384 <
ffff81019bd8a0c0 351533081 C Bi:4:055:5 -2 1216 = 7eff0300 21450005 dcacbc00 00c606c3 44451175 cf19e0aa 5a0050c5 90a8857b
ffff81019bd8a0c0 351533438 S Bi:4:055:5 -115 16384 <
ffff81019bd8a0c0 351534077 C Bi:4:055:5 0 306 = 7abc7a8f 8f3ca3c4 bf0e3e34 786343f8 adab6aaf fd9de26f 8eff000f 7d5e0f78
ffff81019bd8a0c0 351534685 S Bi:4:055:5 -115 16384 <
ffff81019bd8a0c0 351589083 C Bi:4:055:5 -2 0
ffff81019bd8a0c0 351589307 S Bi:4:055:5 -115 16384 <
ffff81019bd8a0c0 351641087 C Bi:4:055:5 -2 0
ffff81019bd8a0c0 351641217 S Bi:4:055:5 -115 16384 <
ffff81019bd8a0c0 351693089 C Bi:4:055:5 -2 0
ffff81019bd8a0c0 351693215 S Bi:4:055:5 -115 16384 <
ffff81019bd8a0c0 351745087 C Bi:4:055:5 -2 0
ffff81019bd8a0c0 351745202 S Bi:4:055:5 -115 16384 <
ffff81019bd8ad80 351752374 S Bo:4:055:6 -115 48 = 7eff0300 21450000 286d4940 0040064e 6c19e0aa 5a451175 cfc59000 5000254d
ffff81019bd8ad80 351753023 C Bo:4:055:6 0 48 >
ffff81019bd8a0c0 351773095 C Bi:4:055:5 0 1521 = 7eff0300 21450005 dcada400 00c606c2 5c451175 cf19e0aa 5a0050c5 90a88581
ffff81019bd8a0c0 351778910 S Bi:4:055:5 -115 16384 <
ffff81019bd8a0c0 351833091 C Bi:4:055:5 -2 0
ffff8101df0e3a80 351837207 S Bi:4:055:5 -115 16384 <
ffff8101df0e3d80 351837625 S Bo:4:055:6 -115 60 = 7eff0300 21450000 346d4a40 0040064e 5f19e0aa 5a451175 cfc59000 5000254d
ffff8101df0e3d80 351838033 C Bo:4:055:6 0 60 >
ffff8101df0e3a80 351867100 C Bi:4:055:5 0 1521 = 7eff0300 21450005 dcadac00 00c606c2 54451175 cf19e0aa 5a0050c5 90a88586
ffff8101df0e3a80 351870196 S Bi:4:055:5 -115 16384 <
ffff8101df0e3a80 351872095 C Bi:4:055:5 0 1521 = 7eff0300 21450005 dcadb000 00c606c2 50451175 cf19e0aa 5a0050c5 90a8858c
ffff8101df0e3a80 351878576 S Bi:4:055:5 -115 16384 <
ffff8101df0e3a80 351880099 C Bi:4:055:5 0 1046 = 7eff0300 21450005 dcadb400 00c606c2 4c451175 cf19e0aa 5a0050c5 90a88592
ffff8101df0e3a80 351885503 S Bi:4:055:5 -115 16384 <
ffff8101df0e3a80 351886093 C Bi:4:055:5 0 480 = 356f8a3a 67c54f13 6bbf1f3e 116b7d5e 24f03f84 fc4fe2ff 008b090d 8d97887d
ffff8101df0e3a80 351886987 S Bi:4:055:5 -115 16384 <
ffff8101df0e3a80 351889088 C Bi:4:055:5 0 1526 = 7eff0300 21450005 dcb21c00 00c606bd e4451175 cf19e0aa 5a0050c5 90a88598
ffff8101df0e3a80 351894371 S Bi:4:055:5 -115 16384 <
ffff8101df0e3a80 351896093 C Bi:4:055:5 0 1038 = 7eff0300 21450005 dcba4c00 00c606b5 b4451175 cf19e0aa 5a0050c5 90a8859d
ffff8101df0e3a80 351901485 S Bi:4:055:5 -115 16384 <
ffff8101df0e3a80 351902092 C Bi:4:055:5 0 483 = e5fa5fc5 3d393c3b aadd7c63 f07d5dc5 cf867d5e 1b69da98 d0f4fd63 41f8e915
ffff8101df0e3a80 351902939 S Bi:4:055:5 -115 16384 <
ffff8101df0e3a80 351956102 C Bi:4:055:5 -2 0
ffff8101df0e3a80 351957179 S Bi:4:055:5 -115 16384 <
ffff8101df0e3300 351957892 S Bo:4:055:6 -115 296 = 7eff0300 21450000 346d4b40 0040064e 5e19e0aa 5a451175 cfc59000 5000254d
ffff8101df0e3300 351959038 C Bo:4:055:6 0 296 >
ffff8101df0e3a80 352008106 C Bi:4:055:5 -2 0
ffff8101df0e3a80 352008300 S Bi:4:055:5 -115 16384 <
ffff8101df0e3a80 352060107 C Bi:4:055:5 -2 0
ffff8101df0e3a80 352060247 S Bi:4:055:5 -115 16384 <
ffff8101df0e3a80 352113112 C Bi:4:055:5 -2 0
ffff81019bd8a600 352113242 S Bi:4:055:5 -115 16384 <
ffff81019bd8a600 352158114 C Bi:4:055:5 0 1521 = 7eff0300 21450005 dcc6a000 00c606a9 60451175 cf19e0aa 5a0050c5 90a885a3
ffff81019bd8a600 352163438 S Bi:4:055:5 -115 16384 <
ffff81019bd8a600 352165118 C Bi:4:055:5 0 1527 = 7eff0300 21450005 dcca0400 00c606a5 fc451175 cf19e0aa 5a0050c5 90a885a9
ffff81019bd8a600 352170587 S Bi:4:055:5 -115 16384 <
ffff81019bd8a600 352225119 C Bi:4:055:5 -2 0
ffff81019bd8a600 352225617 S Bi:4:055:5 -115 16384 <
ffff8101df0e3300 352225976 S Bo:4:055:6 -115 60 = 7eff0300 21450000 346d5040 0040064e 5919e0aa 5a451175 cfc59000 5000254d
ffff8101df0e3300 352227049 C Bo:4:055:6 0 60 >
ffff8101df0e3f00 352229242 S Bo:4:055:6 -115 60 = 7eff0300 21450000 346d5140 0040064e 5819e0aa 5a451175 cfc59000 5000254d
ffff8101df0e3f00 352230049 C Bo:4:055:6 0 60 >
ffff81019bd8a600 352277121 C Bi:4:055:5 -2 0
ffff81019bd8a600 352277275 S Bi:4:055:5 -115 16384 <
ffff81019bd8a600 352329125 C Bi:4:055:5 -2 0
ffff81019bd8a600 352329205 S Bi:4:055:5 -115 16384 <
ffff81019bd8a600 352375128 C Bi:4:055:5 0 1522 = 7eff0300 21450005 dcd04000 00c6069f c0451175 cf19e0aa 5a0050c5 90a8857b
ffff81019bd8a600 352378715 S Bi:4:055:5 -115 16384 <
ffff81019bd8a600 352433130 C Bi:4:055:5 -2 0
ffff81019bd8a600 352433437 S Bi:4:055:5 -115 16384 <
ffff8101df0e30c0 352433850 S Bo:4:055:6 -115 48 = 7eff0300 21450000 286d5240 0040064e 6319e0aa 5a451175 cfc59000 5000254d
ffff8101df0e30c0 352434063 C Bo:4:055:6 0 48 >
ffff81019bd8a600 352485132 C Bi:4:055:5 -2 0
ffff81019bd8a600 352485271 S Bi:4:055:5 -115 16384 <
ffff81019bd8a600 352537136 C Bi:4:055:5 -2 0
ffff8101df0e3d80 352537287 S Bi:4:055:5 -115 16384 <
ffff8101df0e3d80 352539125 C Bi:4:055:5 0 1522 = 7eff0300 21450005 dcd39400 00c6069c 6c451175 cf19e0aa 5a0050c5 90a885ae
ffff8101df0e3d80 352541766 S Bi:4:055:5 -115 16384 <
ffff8101df0e3d80 352595138 C Bi:4:055:5 -2 0
ffff8101df0e3d80 352595509 S Bi:4:055:5 -115 16384 <
ffff8101df0e3000 352595785 S Bo:4:055:6 -115 48 = 7eff0300 21450000 286d5340 0040064e 6219e0aa 5a451175 cfc59000 5000254d
ffff8101df0e3000 352596072 C Bo:4:055:6 0 48 >
ffff8101df0e3d80 352615146 C Bi:4:055:5 0 1532 = 7eff0300 21450005 dcda5c00 00c60695 a4451175 cf19e0aa 5a0050c5 90a885b4
ffff81020441b540 352618940 S Bi:4:055:5 -115 16384 <
ffff81020441b540 352621144 C Bi:4:055:5 0 1530 = 7eff0300 21450005 dcda6000 00c60695 a0451175 cf19e0aa 5a0050c5 90a885ba
ffff81020441b540 352627151 S Bi:4:055:5 -115 16384 <
ffff81020441b540 352681145 C Bi:4:055:5 -2 0
ffff81020441b540 352681684 S Bi:4:055:5 -115 16384 <
ffff8101df0e3000 352682027 S Bo:4:055:6 -115 48 = 7eff0300 21450000 286d5440 0040064e 6119e0aa 5a451175 cfc59000 5000254d
ffff8101df0e3000 352683076 C Bo:4:055:6 0 48 >
ffff8101df0e3900 352685298 S Bo:4:055:6 -115 48 = 7eff0300 21450000 286d5540 0040064e 6019e0aa 5a451175 cfc59000 5000254d
ffff8101df0e3900 352686075 C Bo:4:055:6 0 48 >
ffff81020441b540 352702139 C Bi:4:055:5 0 1527 = 7eff0300 21450005 dce11000 00c6068e f0451175 cf19e0aa 5a0050c5 90a885c0
ffff81020441b540 352707035 S Bi:4:055:5 -115 16384 <
ffff81020441b540 352761144 C Bi:4:055:5 -2 0
ffff81020441b540 352761509 S Bi:4:055:5 -115 16384 <
ffff8101df0e3900 352761807 S Bo:4:055:6 -115 48 = 7eff0300 21450000 286d5640 0040064e 5f19e0aa 5a451175 cfc59000 5000254d
ffff8101df0e3900 352762084 C Bo:4:055:6 0 48 >
ffff81020441b540 352763142 C Bi:4:055:5 0 1520 = 7eff0300 21450005 dce11400 00c6068e ec451175 cf19e0aa 5a0050c5 90a885c5
ffff81020441b540 352765798 S Bi:4:055:5 -115 16384 <
ffff81020441b540 352817153 C Bi:4:055:5 -2 0
ffff81020441b540 352817514 S Bi:4:055:5 -115 16384 <
ffff8101df0e3480 352817842 S Bo:4:055:6 -115 48 = 7eff0300 21450000 286d5740 0040064e 5e19e0aa 5a451175 cfc59000 5000254d
ffff8101df0e3480 352818084 C Bo:4:055:6 0 48 >
ffff81020441b540 352869155 C Bi:4:055:5 -2 0
ffff81020441b540 352869292 S Bi:4:055:5 -115 16384 <
ffff81020441b540 352875152 C Bi:4:055:5 0 1522 = 7eff0300 21450005 dce86800 00c60687 98451175 cf19e0aa 5a0050c5 90a885cb
ffff81020441b540 352878810 S Bi:4:055:5 -115 16384 <
ffff81020441b540 352933159 C Bi:4:055:5 -2 0
ffff81020441b540 352933503 S Bi:4:055:5 -115 16384 <
ffff8101df0e3d80 352933906 S Bo:4:055:6 -115 48 = 7eff0300 21450000 286d5840 0040064e 5d19e0aa 5a451175 cfc59000 5000254d
ffff8101df0e3d80 352934090 C Bo:4:055:6 0 48 >
ffff81020441b540 352973162 C Bi:4:055:5 0 1519 = 7eff0300 21450005 dcee1800 00c60681 e8451175 cf19e0aa 5a0050c5 90a885d1
ffff81020441b540 352978775 S Bi:4:055:5 -115 16384 <
ffff81020441b540 353033161 C Bi:4:055:5 -2 896 = 7eff0300 21450005 dcee1c00 00c60681 e4451175 cf19e0aa 5a0050c5 90a885d6
ffff81020441b540 353033515 S Bi:4:055:5 -115 16384 <
ffff8101df0e3000 353033888 S Bo:4:055:6 -115 48 = 7eff0300 21450000 286d5940 0040064e 5c19e0aa 5a451175 cfc59000 5000254d
ffff8101df0e3000 353034098 C Bo:4:055:6 0 48 >
ffff81020441b540 353035158 C Bi:4:055:5 0 626 = cdf2fcbf 37cbb35c eb84f887 1183c760 b28cdf2b cd323adc 2d96f0b5 2cdb2ec9
ffff81020441b540 353036367 S Bi:4:055:5 -115 16384 <
ffff81020441b540 353089164 C Bi:4:055:5 -2 0
ffff81020441b540 353089427 S Bi:4:055:5 -115 16384 <
ffff81020441b540 353093162 C Bi:4:055:5 0 1525 = 7eff0300 21450005 dcf2f000 00c6067d 5d104511 75cf19e0 aa5a0050 c590a885
ffff81020441b540 353098872 S Bi:4:055:5 -115 16384 <
ffff81020441b540 353153167 C Bi:4:055:5 -2 0
ffff81020441b540 353153518 S Bi:4:055:5 -115 16384 <
ffff8101df0e3900 353153869 S Bo:4:055:6 -115 60 = 7eff0300 21450000 346d5a40 0040064e 4f19e0aa 5a451175 cfc59000 5000254d
ffff8101df0e3900 353154101 C Bo:4:055:6 0 60 >
ffff81020441b540 353205173 C Bi:4:055:5 -2 0
ffff81020441b540 353205313 S Bi:4:055:5 -115 16384 <
ffff81020441b540 353257177 C Bi:4:055:5 -2 0
ffff81020441b540 353257296 S Bi:4:055:5 -115 16384 <
ffff81020441b540 353309175 C Bi:4:055:5 -2 0
ffff81020441b540 353309293 S Bi:4:055:5 -115 16384 <
ffff81020441b540 353361180 C Bi:4:055:5 -2 0
ffff8101ef1153c0 353361297 S Bo:4:055:10 -115 31 = 55534243 9e060000 00000000 00000600 00000000 00000000 00000000 000000
ffff81020441b540 353361315 S Bi:4:055:5 -115 16384 <
ffff8101ef1153c0 353362112 C Bo:4:055:10 0 31 >
ffff8101ef1153c0 353362120 S Bi:4:055:9 -115 13 <
ffff8101ef1153c0 353363112 C Bi:4:055:9 0 13 = 55534253 9e060000 00000000 01
ffff8101ef1153c0 353363119 S Bo:4:055:10 -115 31 = 55534243 9f060000 12000000 80000603 00000012 00000000 00000000 000000
ffff8101ef1153c0 353364112 C Bo:4:055:10 0 31 >
ffff8101df0e3300 353364121 S Bi:4:055:9 -115 18 <
ffff8101df0e3300 353365112 C Bi:4:055:9 0 18 = 70000200 0000000a 00000000 3a000000 0000
ffff8101ef1153c0 353365120 S Bi:4:055:9 -115 13 <
ffff8101ef1153c0 353366112 C Bi:4:055:9 0 13 = 55534253 9f060000 00000000 00
ffff8101ef1153c0 353366145 S Bo:4:055:10 -115 31 = 55534243 a0060000 00000000 00000600 00000000 00000000 00000000 000000
ffff8101ef1153c0 353367112 C Bo:4:055:10 0 31 >
ffff8101ef1153c0 353367118 S Bi:4:055:9 -115 13 <
ffff8101ef1153c0 353368112 C Bi:4:055:9 0 13 = 55534253 a0060000 00000000 01
ffff8101ef1153c0 353368119 S Bo:4:055:10 -115 31 = 55534243 a1060000 12000000 80000603 00000012 00000000 00000000 000000
ffff8101ef1153c0 353369113 C Bo:4:055:10 0 31 >
ffff8101df0e3300 353369123 S Bi:4:055:9 -115 18 <
ffff8101df0e3300 353370112 C Bi:4:055:9 0 18 = 70000200 0000000a 00000000 3a000000 0000
ffff8101ef1153c0 353370119 S Bi:4:055:9 -115 13 <
ffff8101ef1153c0 353371112 C Bi:4:055:9 0 13 = 55534253 a1060000 00000000 00
ffff81020441b540 353379182 C Bi:4:055:5 0 1525 = 7eff0300 21450005 dcf51000 00c6067a f0451175 cf19e0aa 5a0050c5 90a885e2
ffff81020441b540 353382761 S Bi:4:055:5 -115 16384 <
ffff81020441b540 353437182 C Bi:4:055:5 -2 1527 = 7eff0300 21450005 dcf93c00 00c60676 c4451175 cf19e0aa 5a0050c5 90a885e7
ffff81020441b540 353437526 S Bi:4:055:5 -115 16384 <
ffff8101df0e3a80 353437887 S Bo:4:055:6 -115 60 = 7eff0300 21450000 346d5b40 0040064e 4e19e0aa 5a451175 cfc59000 5000254d
ffff8101df0e3a80 353438118 C Bo:4:055:6 0 60 >
ffff81020441b540 353439179 C Bi:4:055:5 0 1528 = 7eff0300 21450005 dcf94000 00c60676 c0451175 cf19e0aa 5a0050c5 90a885ed
ffff81020441b540 353441786 S Bi:4:055:5 -115 16384 <
ffff81020441b540 353443181 C Bi:4:055:5 0 1038 = 7eff0300 21450005 dcfd6c00 00c60672 94451175 cf19e0aa 5a0050c5 90a885f3
ffff81020441b540 353444967 S Bi:4:055:5 -115 16384 <
ffff81020441b540 353446180 C Bi:4:055:5 0 496 = 17c1db1d 26c743f8 5fa3df5d f8275ef1 7d5ebff0 3bc0b7da 6ea7f147 c41e1883
ffff81020441b540 353447090 S Bi:4:055:5 -115 16384 <
ffff81020441b540 353501189 C Bi:4:055:5 -2 0
ffff81020441b540 353501728 S Bi:4:055:5 -115 16384 <
ffff8101df0e3300 353502113 S Bo:4:055:6 -115 68 = 7eff0300 21450000 3c6d5c40 0040064e 4519e0aa 5a451175 cfc59000 5000254d
ffff8101df0e3300 353503121 C Bo:4:055:6 0 68 >
ffff8101df0e30c0 353505339 S Bo:4:055:6 -115 68 = 7eff0300 21450000 3c6d5d40 0040064e 4419e0aa 5a451175 cfc59000 5000254d
ffff8101df0e30c0 353506121 C Bo:4:055:6 0 68 >
ffff81020441b540 353536188 C Bi:4:055:5 0 1523 = 7eff0300 21450005 dc01e800 00c6066e 19451175 cf19e0aa 5a0050c5 90a885f9
ffff81020441b540 353542865 S Bi:4:055:5 -115 16384 <
ffff81020441b540 353597193 C Bi:4:055:5 -2 0
ffff81020441b540 353597558 S Bi:4:055:5 -115 16384 <
ffff8101df0e30c0 353597931 S Bo:4:055:6 -115 68 = 7eff0300 21450000 3c6d5e40 0040064e 4319e0aa 5a451175 cfc59000 5000254d
ffff8101df0e30c0 353598127 C Bo:4:055:6 0 68 >
ffff81020441b540 353649196 C Bi:4:055:5 -2 0
ffff81020441b540 353649340 S Bi:4:055:5 -115 16384 <
ffff81020441b540 353701206 C Bi:4:055:5 -2 0
ffff8101df0e3480 353701341 S Bi:4:055:5 -115 16384 <
ffff8101df0e3480 353753196 C Bi:4:055:5 0 1522 = 7eff0300 21450005 dc114800 00c6065e b9451175 cf19e0aa 5a0050c5 90a885d6
ffff8101df0e3480 353755804 S Bi:4:055:5 -115 16384 <
ffff8101df0e3480 353808202 C Bi:4:055:5 -2 0
ffff8101df0e3480 353808548 S Bi:4:055:5 -115 16384 <
ffff8101df0e3540 353808930 S Bo:4:055:6 -115 60 = 7eff0300 21450000 346d5f40 0040064e 4a19e0aa 5a451175 cfc59000 5000254d
ffff8101df0e3540 353809139 C Bo:4:055:6 0 60 >
ffff8101df0e3480 353860209 C Bi:4:055:5 -2 0
ffff8101df0e3480 353860360 S Bi:4:055:5 -115 16384 <
ffff8101df0e3480 353912209 C Bi:4:055:5 -2 0
ffff8101df0e3480 353912321 S Bi:4:055:5 -115 16384 <
ffff8101df0e3480 353934204 C Bi:4:055:5 0 1527 = 7eff0300 21450005 dc133800 00c6065c c9451175 cf19e0aa 5a0050c5 90a885e7
ffff8101df0e3480 353938815 S Bi:4:055:5 -115 16384 <
ffff8101df0e3480 353992213 C Bi:4:055:5 -2 0
ffff8101df0e3480 353992561 S Bi:4:055:5 -115 16384 <
ffff8101df0e3300 353992956 S Bo:4:055:6 -115 48 = 7eff0300 21450000 286d6040 0040064e 5519e0aa 5a451175 cfc59000 5000254d
ffff8101df0e3300 353993150 C Bo:4:055:6 0 48 >
ffff8101df0e3480 354016214 C Bi:4:055:5 0 1523 = 7eff0300 21450005 dc17c000 00c60658 41451175 cf19e0aa 5a0050c5 90a885fe
ffff8101df0e3480 354018793 S Bi:4:055:5 -115 16384 <
ffff8101df0e3480 354072222 C Bi:4:055:5 -2 0
ffff8101df0e3480 354072607 S Bi:4:055:5 -115 16384 <
ffff8101df0e3300 354072887 S Bo:4:055:6 -115 48 = 7eff0300 21450000 286d6140 0040064e 5419e0aa 5a451175 cfc59000 5000254d
ffff8101df0e3300 354073154 C Bo:4:055:6 0 48 >
ffff8101df0e3480 354082219 C Bi:4:055:5 0 1524 = 7eff0300 21450005 dc1ec400 00c60651 3d451175 cf19e0aa 5a0050c5 90a88604
ffff8101df0e3480 354085014 S Bi:4:055:5 -115 16384 <
ffff8101df0e3480 354136217 C Bi:4:055:5 0 1516 = 7eff0300 21450005 dc1ec800 00c60651 39451175 cf19e0aa 5a0050c5 90a8860a
ffff8101df0e3480 354138698 S Bi:4:055:5 -115 16384 <
ffff8101df0e3480 354192226 C Bi:4:055:5 -2 0
ffff8101df0e3480 354192754 S Bi:4:055:5 -115 16384 <
ffff8101df0e3300 354193202 S Bo:4:055:6 -115 95 = 7eff0300 21450000 286d6240 0040064e 5319e0aa 5a451175 cfc59000 5000254d
ffff8101df0e3300 354194162 C Bo:4:055:6 0 95 >
ffff8101df0e3480 354244233 C Bi:4:055:5 -2 0
ffff8101df0e3480 354244400 S Bi:4:055:5 -115 16384 <
ffff8101df0e3480 354296228 C Bi:4:055:5 -2 0
ffff8101df0e3480 354296335 S Bi:4:055:5 -115 16384 <
ffff8101df0e3480 354348232 C Bi:4:055:5 -2 0
ffff8101df0e3480 354348344 S Bi:4:055:5 -115 16384 <
ffff8101df0e3480 354385240 C Bi:4:055:5 0 1519 = 7eff0300 21450005 dc29a800 00c60646 59451175 cf19e0aa 5a0050c5 90a8860f
ffff8101df0e3480 354387895 S Bi:4:055:5 -115 16384 <
ffff8101df0e3480 354390229 C Bi:4:055:5 0 1531 = 7eff0300 21450005 dc2ec400 00c60641 3d451175 cf19e0aa 5a0050c5 90a88615
ffff8101df0e3480 354392757 S Bi:4:055:5 -115 16384 <
ffff8101df0e3480 354444233 C Bi:4:055:5 -2 0
ffff8101df0e3480 354444721 S Bi:4:055:5 -115 16384 <
ffff8101df0e36c0 354445085 S Bo:4:055:6 -115 95 = 7eff0300 21450000 286d6440 0040064e 5119e0aa 5a451175 cfc59000 5000254d
ffff8101df0e36c0 354446173 C Bo:4:055:6 0 95 >
ffff8101df0e3480 354496245 C Bi:4:055:5 -2 0
ffff8101df0e3480 354496403 S Bi:4:055:5 -115 16384 <
ffff8101df0e3480 354548248 C Bi:4:055:5 -2 0
ffff8101df0e3480 354548390 S Bi:4:055:5 -115 16384 <
ffff8101df0e3480 354600252 C Bi:4:055:5 -2 0
ffff8101df0e3480 354600394 S Bi:4:055:5 -115 16384 <
ffff8101df0e3480 354641246 C Bi:4:055:5 0 1526 = 7eff0300 21450005 dc3a4c00 00c60635 b5451175 cf19e0aa 5a0050c5 90a8861b
ffff8101df0e3480 354646246 S Bi:4:055:5 -115 16384 <
ffff8101df0e3480 354648243 C Bi:4:055:5 0 1520 = 7eff0300 21450005 dc3a5000 00c60635 b1451175 cf19e0aa 5a0050c5 90a88620
ffff8101df0e3480 354650791 S Bi:4:055:5 -115 16384 <
ffff8101df0e3480 354704254 C Bi:4:055:5 -2 0
ffff8101df0e3480 354704772 S Bi:4:055:5 -115 16384 <
ffff8101df0e36c0 354705151 S Bo:4:055:6 -115 95 = 7eff0300 21450000 286d6640 0040064e 4f19e0aa 5a451175 cfc59000 5000254d
ffff8101df0e36c0 354706187 C Bo:4:055:6 0 95 >
ffff8101df0e3480 354756250 C Bi:4:055:5 -2 0
ffff8101df0e3480 354756347 S Bi:4:055:5 -115 16384 <
ffff8101df0e3480 354808259 C Bi:4:055:5 -2 0
ffff8101df0e3480 354808373 S Bi:4:055:5 -115 16384 <
ffff8101df0e3480 354864265 C Bi:4:055:5 -2 0
ffff8101df0e3480 354864402 S Bi:4:055:5 -115 16384 <
ffff8101df0e3480 354916267 C Bi:4:055:5 -2 0
ffff8101df0e3480 354916396 S Bi:4:055:5 -115 16384 <
ffff8101df0e3480 354954263 C Bi:4:055:5 0 1521 = 7eff0300 21450005 dc438c00 00c6062c 75451175 cf19e0aa 5a0050c5 90a88626
ffff8101df0e3480 354956838 S Bi:4:055:5 -115 16384 <
ffff8101df0e3480 355008268 C Bi:4:055:5 -2 0
ffff8101df0e3480 355008606 S Bi:4:055:5 -115 16384 <
ffff8101df0e3300 355008892 S Bo:4:055:6 -115 48 = 7eff0300 21450000 286d6840 0040064e 4d19e0aa 5a451175 cfc59000 5000254d
ffff8101df0e3300 355009204 C Bo:4:055:6 0 48 >
ffff8101df0e3480 355048270 C Bi:4:055:5 0 1520 = 7eff0300 21450005 dc439000 00c6062c 71451175 cf19e0aa 5a0050c5 90a8862c
ffff8101df0e3480 355050850 S Bi:4:055:5 -115 16384 <
ffff8101df0e3480 355053267 C Bi:4:055:5 0 1520 = 7eff0300 21450005 dc43ac00 00c6062c 55451175 cf19e0aa 5a0050c5 90a88632
ffff8101df0e3480 355055948 S Bi:4:055:5 -115 16384 <
ffff8101df0e3480 355057268 C Bi:4:055:5 0 1054 = 7eff0300 21450005 dc4b2800 00c60624 d9451175 cf19e0aa 5a0050c5 90a88637
ffff8101df0e3480 355059057 S Bi:4:055:5 -115 16384 <
ffff8101df0e3480 355060266 C Bi:4:055:5 0 466 = 46f1268d a5fc648f 42f865a6 fc12f157 c31f1069 771f1874 6f15e97f 143c77f1
ffff8101df0e3480 355061090 S Bi:4:055:5 -115 16384 <
ffff8101df0e3480 355063262 C Bi:4:055:5 0 1525 = 7eff0300 21450005 dc4b3800 00c60624 c9451175 cf19e0aa 5a0050c5 90a8863d
ffff8101df0e3480 355065793 S Bi:4:055:5 -115 16384 <
ffff8101df0e3480 355068267 C Bi:4:055:5 0 522 = 7eff0300 21450001 fc4b3c00 00c60628 a5451175 cf19e0aa 5a0050c5 90a88643
ffff8101df0e3480 355069233 S Bi:4:055:5 -115 16384 <
ffff8101df0e3480 355121280 C Bi:4:055:5 -2 0
ffff8101df0e3480 355122445 S Bo:4:055:6 -115 48 = 7eff0300 21450000 286d6940 0040064e 4c19e0aa 5a451175 cfc59000 5000254d
ffff8101df0e3300 355122622 S Bi:4:055:5 -115 16384 <
ffff8101df0e3480 355123214 C Bo:4:055:6 0 48 >
ffff8101df0e3480 355123899 S Bo:4:055:6 -115 189 = 7eff0300 21450000 286d6a40 0040064e 4b19e0aa 5a451175 cfc59000 5000254d
ffff8101df0e3480 355124213 C Bo:4:055:6 0 189 >
ffff8101df0e3480 355140876 S Bo:4:055:6 -115 68 = 7eff0300 21450000 3c445e40 00400677 4319e0aa 5a451175 cfc59200 501f2c01
ffff8101df0e3480 355141216 C Bo:4:055:6 0 68 >
ffff8101df0e30c0 355143866 S Bo:4:055:6 -115 68 = 7eff0300 21450000 3cd54140 004006e6 5f19e0aa 5a451175 cfc59300 501f2090
ffff8101df0e30c0 355144216 C Bo:4:055:6 0 68 >
ffff8101df0e3300 355177282 C Bi:4:055:5 -2 0
ffff81020441bf00 355177455 S Bi:4:055:5 -115 16384 <
ffff81020441bf00 355229283 C Bi:4:055:5 -2 0
ffff81020441bf00 355229429 S Bi:4:055:5 -115 16384 <
ffff81020441bf00 355281285 C Bi:4:055:5 -2 0
ffff81020441bf00 355281397 S Bi:4:055:5 -115 16384 <
ffff81020441bf00 355333289 C Bi:4:055:5 -2 0
ffff81020441bf00 355333406 S Bi:4:055:5 -115 16384 <
ffff8101ef1153c0 355363677 S Bo:4:055:10 -115 31 = 55534243 a2060000 00000000 00000600 00000000 00000000 00000000 000000
ffff8101ef1153c0 355364226 C Bo:4:055:10 0 31 >
ffff8101ef1153c0 355364233 S Bi:4:055:9 -115 13 <
ffff8101ef1153c0 355365225 C Bi:4:055:9 0 13 = 55534253 a2060000 00000000 01
ffff8101ef1153c0 355365322 S Bo:4:055:10 -115 31 = 55534243 a3060000 12000000 80000603 00000012 00000000 00000000 000000
ffff8101ef1153c0 355366225 C Bo:4:055:10 0 31 >
ffff8101df0e36c0 355366271 S Bi:4:055:9 -115 18 <
ffff8101df0e36c0 355367225 C Bi:4:055:9 0 18 = 70000200 0000000a 00000000 3a000000 0000
ffff8101ef1153c0 355367234 S Bi:4:055:9 -115 13 <
ffff8101ef1153c0 355368224 C Bi:4:055:9 0 13 = 55534253 a3060000 00000000 00
ffff8101ef1153c0 355368263 S Bo:4:055:10 -115 31 = 55534243 a4060000 00000000 00000600 00000000 00000000 00000000 000000
ffff8101ef1153c0 355369223 C Bo:4:055:10 0 31 >
ffff8101ef1153c0 355369229 S Bi:4:055:9 -115 13 <
ffff8101ef1153c0 355370224 C Bi:4:055:9 0 13 = 55534253 a4060000 00000000 01
ffff8101ef1153c0 355370230 S Bo:4:055:10 -115 31 = 55534243 a5060000 12000000 80000603 00000012 00000000 00000000 000000
ffff8101ef1153c0 355371223 C Bo:4:055:10 0 31 >
ffff8101df0e36c0 355371230 S Bi:4:055:9 -115 18 <
ffff8101df0e36c0 355372224 C Bi:4:055:9 0 18 = 70000200 0000000a 00000000 3a000000 0000
ffff8101ef1153c0 355372232 S Bi:4:055:9 -115 13 <
ffff8101ef1153c0 355373226 C Bi:4:055:9 0 13 = 55534253 a5060000 00000000 00
ffff81020441bf00 355385295 C Bi:4:055:5 -2 0
ffff81020441bf00 355385420 S Bi:4:055:5 -115 16384 <
ffff81020441bf00 355413293 C Bi:4:055:5 0 48 = 7eff0300 21450000 2863c400 00c60611 f1451175 cf19e0aa 5a0050c5 90a88645
ffff81020441bf00 355416316 S Bi:4:055:5 -115 16384 <
ffff81020441bf00 355417290 C Bi:4:055:5 0 56 = 7eff0300 21450000 30651400 00c60610 99451175 cf19e0aa 5a0050c5 92be385e
ffff81020441bf00 355417428 S Bi:4:055:5 -115 16384 <
ffff81020441bf00 355418291 C Bi:4:055:5 0 56 = 7eff0300 21450000 30652000 00c60610 8d451175 cf19e0aa 5a0050c5 93be3c47
ffff81020441bf00 355418417 S Bi:4:055:5 -115 16384 <
ffff81020441bf00 355472299 C Bi:4:055:5 -2 0
ffff81020441bf00 355472488 S Bi:4:055:5 -115 16384 <
ffff8101df0e3a80 355475637 S Bo:4:055:6 -115 1500 = 7eff0300 21450000 28445f40 00400677 5619e0aa 5a451175 cfc59200 501f2c01
ffff8101df0e3a80 355478244 C Bo:4:055:6 0 1500 >
ffff8101df0e36c0 355482996 S Bo:4:055:6 -115 1500 = 4444514b 47564a42 4d4e464e 534a5953 414f5154 4f594f52 4b4d4f48 4d505343
ffff8101df0e36c0 355485238 C Bo:4:055:6 0 1500 >
ffff8101df0e36c0 355487379 S Bo:4:055:6 -115 1097 = 5945524a 4a44434c 45415955 4d454c59 5a534252 45584a56 43545644 58435842
ffff8101df0e36c0 355489238 C Bo:4:055:6 0 1097 >
ffff8101df0e3e40 355495217 S Bo:4:055:6 -115 1500 = 7e595950 4b444343 51444643 50534d4f 53525057 54444f4a 5a4c555a 4b435459
ffff8101df0e3e40 355497241 C Bo:4:055:6 0 1500 >
ffff81020441bd80 355509467 S Bo:4:055:6 -115 528 = 4d415942 47584851 4d535156 564c4955 44524c54 45504949 52505a45 47504443
ffff81020441bd80 355510242 C Bo:4:055:6 0 528 >
ffff81020441bf00 355528300 C Bi:4:055:5 -2 0
ffff8101df0e3540 355528452 S Bi:4:055:5 -115 16384 <
ffff8101df0e3540 355580305 C Bi:4:055:5 -2 0
ffff8101df0e3540 355580449 S Bi:4:055:5 -115 16384 <
ffff8101df0e3540 355632300 C Bi:4:055:5 -2 0
ffff8101df0e3540 355632393 S Bi:4:055:5 -115 16384 <
ffff8101df0e3540 355684311 C Bi:4:055:5 -2 0
ffff8101df0e3540 355684453 S Bi:4:055:5 -115 16384 <
ffff8101df0e3540 355736306 C Bi:4:055:5 -2 0
ffff8101df0e3540 355736398 S Bi:4:055:5 -115 16384 <
ffff8101df0e3540 355788310 C Bi:4:055:5 -2 0
ffff8101df0e3540 355788391 S Bi:4:055:5 -115 16384 <
ffff8101df0e3540 355840311 C Bi:4:055:5 -2 0
ffff8101df0e3540 355840374 S Bi:4:055:5 -115 16384 <
ffff8101df0e3540 355892322 C Bi:4:055:5 -2 0
ffff8101df0e3540 355892461 S Bi:4:055:5 -115 16384 <
ffff8101df0e3540 355944317 C Bi:4:055:5 -2 0
ffff8101df0e3540 355944397 S Bi:4:055:5 -115 16384 <
ffff8101df0e3540 355996321 C Bi:4:055:5 -2 0
ffff8101df0e3540 355996387 S Bi:4:055:5 -115 16384 <
ffff8101df0e3540 356048323 C Bi:4:055:5 -2 0
ffff8101df0e3540 356048395 S Bi:4:055:5 -115 16384 <
ffff8101df0e3540 356049321 C Bi:4:055:5 0 49 = 7eff0300 21450000 287d5d50 0000c606 f8644511 75cf19e0 aa5a0050 c592be38
ffff8101df0e3540 356049484 S Bi:4:055:5 -115 16384 <
ffff8101df0e3540 356100325 C Bi:4:055:5 -2 0
ffff8101df0e3540 356100442 S Bi:4:055:5 -115 16384 <
ffff810140a01840 356101662 S Bo:4:055:6 -115 502 = 7eff0300 21450005 dc446240 00400671 9f19e0aa 5a451175 cfc59200 501f2c0c
ffff810140a01840 356102268 C Bo:4:055:6 0 502 >
ffff810140a01840 356105073 S Bo:4:055:6 -115 1500 = 7e53414f 51544f59 4f524b4d 4f484d50 53434442 4d415942 47584851 4d535156
ffff810140a01840 356107272 C Bo:4:055:6 0 1500 >
ffff810140a01840 356109184 S Bo:4:055:6 -115 1015 = 4c595a53 42524558 4a564354 56445843 5842555a 5a4a4846 42524b42 5855474d
ffff810140a01840 356111268 C Bo:4:055:6 0 1015 >
ffff8101df0e3540 356152337 C Bi:4:055:5 -2 0
ffff8101df0e3540 356152478 S Bi:4:055:5 -115 16384 <
ffff8101df0e3540 356204336 C Bi:4:055:5 -2 0
ffff8101df0e3540 356204459 S Bi:4:055:5 -115 16384 <
ffff8101df0e3540 356246343 C Bi:4:055:5 0 48 = 7eff0300 21450000 28879000 00c606ee 24451175 cf19e0aa 5a0050c5 92be385e
ffff8101df0e3540 356247812 S Bi:4:055:5 -115 16384 <
ffff8101df0e3540 356300344 C Bi:4:055:5 -2 0
ffff8101df0e3540 356300537 S Bi:4:055:5 -115 16384 <
ffff810140a01840 356302198 S Bo:4:055:6 -115 752 = 7eff0300 21450005 dc446440 00400671 9d19e0aa 5a451175 cfc59200 501f2c18
ffff810140a01840 356303280 C Bo:4:055:6 0 752 >
ffff810140a01840 356306070 S Bo:4:055:6 -115 1500 = 7e444752 44595a56 574b4855 56525655 57535559 45524a4a 44434c45 4159554d
ffff810140a01840 356308284 C Bo:4:055:6 0 1500 >
ffff810140a01840 356313661 S Bo:4:055:6 -115 765 = 55574b56 5a4b5650 4e564f4d 55565547 59494b50 545a5157 4556514a 55464956
ffff810140a01840 356315287 C Bo:4:055:6 0 765 >
ffff8101df0e3540 356352348 C Bi:4:055:5 -2 0
ffff8101df0e3540 356352484 S Bi:4:055:5 -115 16384 <
ffff8101df0e3540 356404351 C Bi:4:055:5 -2 0
ffff8101df0e3540 356404494 S Bi:4:055:5 -115 16384 <
ffff8101df0e3540 356456356 C Bi:4:055:5 -2 0
ffff8101df0e3540 356456497 S Bi:4:055:5 -115 16384 <
ffff8101df0e3540 356508356 C Bi:4:055:5 -2 0
ffff8101df0e3540 356508494 S Bi:4:055:5 -115 16384 <
ffff8101df0e3540 356528357 C Bi:4:055:5 0 60 = 7eff0300 21450000 3496d400 00c606de d4451175 cf19e0aa 5a0050c5 93be3c47
ffff8101df0e3540 356531851 S Bi:4:055:5 -115 16384 <
ffff8101df0e3540 356584363 C Bi:4:055:5 -2 0
ffff8101df0e3540 356584559 S Bi:4:055:5 -115 16384 <
ffff810140a01600 356586224 S Bo:4:055:6 -115 752 = 7eff0300 21450005 dcd54540 004006e0 bb19e0aa 5a451175 cfc59300 501f209b
ffff810140a01600 356587296 C Bo:4:055:6 0 752 >
ffff810140a01600 356588811 S Bo:4:055:6 -115 758 = 7e53414f 51544f59 4f524b4d 4f484d50 53434442 4d415942 47584851 4d535156
ffff810140a01600 356590292 C Bo:4:055:6 0 758 >
ffff8101df0e3540 356637365 C Bi:4:055:5 -2 0
ffff8101df0e3540 356637509 S Bi:4:055:5 -115 16384 <
ffff8101df0e3540 356688367 C Bi:4:055:5 -2 0
ffff8101df0e3540 356688510 S Bi:4:055:5 -115 16384 <
ffff8101df0e3540 356740363 C Bi:4:055:5 -2 0
ffff8101df0e3540 356740443 S Bi:4:055:5 -115 16384 <
ffff8101df0e3540 356796367 C Bi:4:055:5 -2 0
ffff8101df0e3540 356796451 S Bi:4:055:5 -115 16384 <
ffff8101df0e3540 356828367 C Bi:4:055:5 0 60 = 7eff0300 21450000 34a4d800 00c606d0 d0451175 cf19e0aa 5a0050c5 92be385e
ffff8101df0e3540 356828566 S Bi:4:055:5 -115 16384 <
ffff8101df0e3540 356879377 C Bi:4:055:5 -2 0
ffff8101df0e3540 356879571 S Bi:4:055:5 -115 16384 <
ffff810140a01600 356880123 S Bo:4:055:6 -115 151 = 7eff0300 21450000 8f446640 00400676 e819e0aa 5a451175 cfc59200 501f2c23
ffff810140a01600 356881309 C Bo:4:055:6 0 151 >
ffff8101df0e3540 356932381 C Bi:4:055:5 -2 0
ffff8101df0e3540 356932523 S Bi:4:055:5 -115 16384 <
ffff8101df0e3540 356983382 C Bi:4:055:5 -2 0
ffff8101df0e3540 356983518 S Bi:4:055:5 -115 16384 <
ffff8101df0e3540 357040385 C Bi:4:055:5 -2 0
ffff8101df0e3540 357040527 S Bi:4:055:5 -115 16384 <
ffff8101df0e3540 357092382 C Bi:4:055:5 -2 0
ffff8101df0e3540 357092460 S Bi:4:055:5 -115 16384 <
ffff8101df0e3540 357144385 C Bi:4:055:5 -2 0
ffff8101df0e3540 357144472 S Bi:4:055:5 -115 16384 <
ffff8101df0e3540 357200391 C Bi:4:055:5 -2 0
ffff8101df0e3540 357200510 S Bi:4:055:5 -115 16384 <
ffff8101df0e3540 357256390 C Bi:4:055:5 -2 0
ffff8101df0e3540 357256470 S Bi:4:055:5 -115 16384 <
ffff8101df0e3540 357308392 C Bi:4:055:5 -2 0
ffff8101df0e3540 357308613 S Bi:4:055:5 -115 16384 <
ffff8101df0e3540 357345400 C Bi:4:055:5 0 68 = 7eff0300 21450000 3cc00000 00c606b5 a0451175 cf19e0aa 5a0050c5 92be385e
ffff8101df0e3540 357345640 S Bi:4:055:5 -115 16384 <
ffff8101df0e3540 357346394 C Bi:4:055:5 0 68 = 7eff0300 21450000 3cc00800 00c606b5 98451175 cf19e0aa 5a0050c5 92be385e
ffff8101df0e3540 357346555 S Bi:4:055:5 -115 16384 <
ffff8101ef1153c0 357363677 S Bo:4:055:10 -115 31 = 55534243 a6060000 00000000 00000600 00000000 00000000 00000000 000000
ffff8101ef1153c0 357364336 C Bo:4:055:10 0 31 >
ffff8101ef1153c0 357364344 S Bi:4:055:9 -115 13 <
ffff8101ef1153c0 357365335 C Bi:4:055:9 0 13 = 55534253 a6060000 00000000 01
ffff8101ef1153c0 357365342 S Bo:4:055:10 -115 31 = 55534243 a7060000 12000000 80000603 00000012 00000000 00000000 000000
ffff8101ef1153c0 357366335 C Bo:4:055:10 0 31 >
ffff8101df0e3300 357366344 S Bi:4:055:9 -115 18 <
ffff8101df0e3300 357367335 C Bi:4:055:9 0 18 = 70000200 0000000a 00000000 3a000000 0000
ffff8101ef1153c0 357367342 S Bi:4:055:9 -115 13 <
ffff8101ef1153c0 357368335 C Bi:4:055:9 0 13 = 55534253 a7060000 00000000 00
ffff8101ef1153c0 357368368 S Bo:4:055:10 -115 31 = 55534243 a8060000 00000000 00000600 00000000 00000000 00000000 000000
ffff8101ef1153c0 357369335 C Bo:4:055:10 0 31 >
ffff8101ef1153c0 357369340 S Bi:4:055:9 -115 13 <
ffff8101ef1153c0 357370335 C Bi:4:055:9 0 13 = 55534253 a8060000 00000000 01
ffff8101ef1153c0 357370341 S Bo:4:055:10 -115 31 = 55534243 a9060000 12000000 80000603 00000012 00000000 00000000 000000
ffff8101ef1153c0 357371335 C Bo:4:055:10 0 31 >
ffff8101df0e36c0 357371342 S Bi:4:055:9 -115 18 <
ffff8101df0e36c0 357372335 C Bi:4:055:9 0 18 = 70000200 0000000a 00000000 3a000000 0000
ffff8101ef1153c0 357372342 S Bi:4:055:9 -115 13 <
ffff8101ef1153c0 357373336 C Bi:4:055:9 0 13 = 55534253 a9060000 00000000 00
ffff8101df0e3540 357400400 C Bi:4:055:5 -2 0
ffff8101df0e3540 357400578 S Bi:4:055:5 -115 16384 <
ffff810140a01c00 357401837 S Bo:4:055:6 -115 502 = 7eff0300 21450005 dc446740 00400671 9a19e0aa 5a451175 cfc59200 501f2c0c
ffff810140a01c00 357403340 C Bo:4:055:6 0 502 >
ffff810140a01c00 357405246 S Bo:4:055:6 -115 1008 = 7e53414f 51544f59 4f524b4d 4f484d50 53434442 4d415942 47584851 4d535156
ffff810140a01c00 357407341 C Bo:4:055:6 0 1008 >
ffff8101df0e3540 357452408 C Bi:4:055:5 -2 0
ffff8101df0e3540 357452552 S Bi:4:055:5 -115 16384 <
ffff8101df0e3540 357504408 C Bi:4:055:5 -2 0
ffff8101df0e3540 357504517 S Bi:4:055:5 -115 16384 <
ffff8101df0e3540 357556409 C Bi:4:055:5 -2 0
ffff8101df0e3540 357556537 S Bi:4:055:5 -115 16384 <
ffff8101df0e3540 357608408 C Bi:4:055:5 -2 0
ffff8101df0e3540 357608480 S Bi:4:055:5 -115 16384 <
ffff8101df0e3540 357660413 C Bi:4:055:5 -2 0
ffff8101df0e3540 357660491 S Bi:4:055:5 -115 16384 <
ffff8101df0e3540 357712414 C Bi:4:055:5 -2 0
ffff8101df0e3540 357712483 S Bi:4:055:5 -115 16384 <
ffff8101df0e3540 357764419 C Bi:4:055:5 -2 0
ffff8101df0e3540 357764494 S Bi:4:055:5 -115 16384 <
ffff8101df0e3540 357816421 C Bi:4:055:5 -2 0
ffff8101df0e3540 357816487 S Bi:4:055:5 -115 16384 <
ffff8101df0e3540 357868433 C Bi:4:055:5 -2 0
ffff8101df0e3540 357868561 S Bi:4:055:5 -115 16384 <
ffff8101df0e3540 357920429 C Bi:4:055:5 -2 0
ffff8101df0e3540 357920506 S Bi:4:055:5 -115 16384 <
ffff8101df0e3540 357972431 C Bi:4:055:5 -2 0
ffff8101df0e3540 357972502 S Bi:4:055:5 -115 16384 <
ffff8101df0e3540 358024433 C Bi:4:055:5 -2 0
ffff8101df0e3540 358024497 S Bi:4:055:5 -115 16384 <
ffff8101df0e3540 358076436 C Bi:4:055:5 -2 0
ffff8101df0e3540 358076506 S Bi:4:055:5 -115 16384 <
ffff8101df0e3540 358128438 C Bi:4:055:5 -2 0
ffff8101df0e3540 358128508 S Bi:4:055:5 -115 16384 <
ffff8101df0e3540 358180442 C Bi:4:055:5 -2 0
ffff8101df0e3540 358180513 S Bi:4:055:5 -115 16384 <
ffff8101df0e3540 358232452 C Bi:4:055:5 -2 0
ffff8101df0e3540 358232625 S Bi:4:055:5 -115 16384 <
ffff8101df0e3540 358284449 C Bi:4:055:5 -2 0
ffff8101df0e3540 358284522 S Bi:4:055:5 -115 16384 <
ffff8101df0e3540 358336450 C Bi:4:055:5 -2 0
ffff8101df0e3540 358336510 S Bi:4:055:5 -115 16384 <
ffff8101df0e3540 358388461 C Bi:4:055:5 -2 0
ffff8101df0e3540 358388588 S Bi:4:055:5 -115 16384 <
ffff8101df0e3540 358440458 C Bi:4:055:5 -2 0
ffff8101df0e3540 358440537 S Bi:4:055:5 -115 16384 <
ffff8101df0e33c0 358474637 S Bo:4:055:6 -115 1500 = 7eff0300 21450005 dcd54640 004006e0 ba19e0aa 5a451175 cfc59300 501f2090
ffff8101df0e33c0 358476405 C Bo:4:055:6 0 1500 >
ffff8101df0e33c0 358479704 S Bo:4:055:6 -115 8 = 534d4f53 52e2c17e
ffff8101df0e33c0 358480397 C Bo:4:055:6 0 8 >
ffff8101df0e3540 358492459 C Bi:4:055:5 -2 0
ffff8101df0e3540 358492535 S Bi:4:055:5 -115 16384 <
ffff8101df0e3540 358544473 C Bi:4:055:5 -2 0
ffff8101df0e3540 358544613 S Bi:4:055:5 -115 16384 <
ffff8101df0e3540 358596471 C Bi:4:055:5 -2 0
ffff8101df0e3540 358596592 S Bi:4:055:5 -115 16384 <
ffff8101df0e3540 358648477 C Bi:4:055:5 -2 0
ffff8101df0e3540 358648615 S Bi:4:055:5 -115 16384 <
ffff8101df0e3540 358700476 C Bi:4:055:5 -2 0
ffff8101df0e3540 358700597 S Bi:4:055:5 -115 16384 <
ffff8101df0e3540 358752481 C Bi:4:055:5 -2 0
ffff8101df0e3540 358752614 S Bi:4:055:5 -115 16384 <
ffff8101df0e3540 358804479 C Bi:4:055:5 -2 0
ffff8101df0e3540 358804603 S Bi:4:055:5 -115 16384 <
ffff8101df0e3540 358857491 C Bi:4:055:5 -2 0
ffff8101df0e3540 358857622 S Bi:4:055:5 -115 16384 <
ffff8101df0e3540 358908486 C Bi:4:055:5 -2 0
ffff8101df0e3540 358908604 S Bi:4:055:5 -115 16384 <
ffff8101df0e3540 358960490 C Bi:4:055:5 -2 0
ffff8101df0e3540 358960621 S Bi:4:055:5 -115 16384 <
ffff8101df0e3540 359012495 C Bi:4:055:5 -2 0
ffff8101df0e3540 359012639 S Bi:4:055:5 -115 16384 <
ffff8101df0e3540 359064497 C Bi:4:055:5 -2 0
ffff8101df0e3540 359064619 S Bi:4:055:5 -115 16384 <
ffff8101df0e3540 359116497 C Bi:4:055:5 -2 0
ffff8101df0e3540 359116605 S Bi:4:055:5 -115 16384 <
ffff8101df0e3540 359168503 C Bi:4:055:5 -2 0
ffff8101df0e3540 359168633 S Bi:4:055:5 -115 16384 <
ffff8101df0e3540 359220504 C Bi:4:055:5 -2 0
ffff8101df0e3540 359220624 S Bi:4:055:5 -115 16384 <
ffff8101df0e3540 359247503 C Bi:4:055:5 0 48 = 7eff0300 21450000 28205000 00c60655 65451175 cf19e0aa 5a0050c5 93be3c47
ffff8101df0e3540 359247802 S Bi:4:055:5 -115 16384 <
ffff8101df0e3540 359300507 C Bi:4:055:5 -2 0
ffff8101df0e3540 359300681 S Bi:4:055:5 -115 16384 <
ffff8101df0e30c0 359303641 S Bo:4:055:6 -115 1500 = 7eff0300 21450005 dcd54740 004006e0 b919e0aa 5a451175 cfc59300 501f20a1
ffff8101df0e30c0 359305450 C Bo:4:055:6 0 1500 >
ffff8101df0e30c0 359308327 S Bo:4:055:6 -115 1500 = 584a5643 540ae97e ff030021 450005dc d5484000 4006e0b8 19e0aa5a 451175cf
ffff8101df0e30c0 359310449 C Bo:4:055:6 0 1500 >
ffff8101df0e30c0 359310571 S Bo:4:055:6 -115 15 = 48484954 424b4458 44475244 fb8b7e
ffff8101df0e30c0 359311444 C Bo:4:055:6 0 15 >
ffff8101df0e30c0 359314278 S Bo:4:055:6 -115 1500 = 7eff0300 21450005 dc446840 00400671 9919e0aa 5a451175 cfc59200 501f2c0c
ffff8101df0e30c0 359316450 C Bo:4:055:6 0 1500 >
ffff8101df0e36c0 359319821 S Bo:4:055:6 -115 8 = 5953414f 513bc57e
ffff8101df0e36c0 359320446 C Bo:4:055:6 0 8 >
ffff8101df0e3540 359352515 C Bi:4:055:5 -2 0
ffff8101f475a900 359352636 S Bi:4:055:5 -115 16384 <
ffff8101ef1153c0 359363681 S Bo:4:055:10 -115 31 = 55534243 aa060000 00000000 00000600 00000000 00000000 00000000 000000
ffff8101ef1153c0 359364448 C Bo:4:055:10 0 31 >
ffff8101ef1153c0 359364455 S Bi:4:055:9 -115 13 <
ffff8101ef1153c0 359365446 C Bi:4:055:9 0 13 = 55534253 aa060000 00000000 01
ffff8101ef1153c0 359365505 S Bo:4:055:10 -115 31 = 55534243 ab060000 12000000 80000603 00000012 00000000 00000000 000000
ffff8101ef1153c0 359366447 C Bo:4:055:10 0 31 >
ffff8101df0e3000 359366455 S Bi:4:055:9 -115 18 <
ffff8101df0e3000 359367446 C Bi:4:055:9 0 18 = 70000200 0000000a 00000000 3a000000 0000
ffff8101ef1153c0 359367454 S Bi:4:055:9 -115 13 <
ffff8101ef1153c0 359368447 C Bi:4:055:9 0 13 = 55534253 ab060000 00000000 00
ffff8101ef1153c0 359368484 S Bo:4:055:10 -115 31 = 55534243 ac060000 00000000 00000600 00000000 00000000 00000000 000000
ffff8101ef1153c0 359369446 C Bo:4:055:10 0 31 >
ffff8101ef1153c0 359369452 S Bi:4:055:9 -115 13 <
ffff8101ef1153c0 359370447 C Bi:4:055:9 0 13 = 55534253 ac060000 00000000 01
ffff8101ef1153c0 359370453 S Bo:4:055:10 -115 31 = 55534243 ad060000 12000000 80000603 00000012 00000000 00000000 000000
ffff8101ef1153c0 359371446 C Bo:4:055:10 0 31 >
ffff8101df0e3000 359371454 S Bi:4:055:9 -115 18 <
ffff8101df0e3000 359372446 C Bi:4:055:9 0 18 = 70000200 0000000a 00000000 3a000000 0000
ffff8101ef1153c0 359372453 S Bi:4:055:9 -115 13 <
ffff8101ef1153c0 359373448 C Bi:4:055:9 0 13 = 55534253 ad060000 00000000 00
ffff8101f475a900 359404514 C Bi:4:055:5 -2 0
ffff8101f475a900 359404616 S Bi:4:055:5 -115 16384 <
ffff8101f475a900 359456516 C Bi:4:055:5 -2 0
ffff8101f475a900 359456622 S Bi:4:055:5 -115 16384 <
ffff8101f475a900 359508522 C Bi:4:055:5 -2 0
ffff8101f475a900 359508641 S Bi:4:055:5 -115 16384 <
ffff8101f475a900 359560522 C Bi:4:055:5 -2 0
ffff8101f475a900 359560629 S Bi:4:055:5 -115 16384 <
ffff8101f475a900 359614536 C Bi:4:055:5 -2 0
ffff8101df0e3780 359620446 S Bi:4:055:5 -115 16384 <
ffff8101df0e3780 359672533 C Bi:4:055:5 -2 0
ffff8101df0e3780 359672677 S Bi:4:055:5 -115 16384 <
ffff8101df0e3780 359727538 C Bi:4:055:5 0 60 = 7eff0300 21450000 343c6000 00c60639 49451175 cf19e0aa 5a0050c5 93be3c47
ffff8101df0e3780 359727810 S Bi:4:055:5 -115 16384 <
ffff8101df0e3780 359780537 C Bi:4:055:5 -2 0
ffff8101df0e3780 359780733 S Bi:4:055:5 -115 16384 <
ffff8101df0e3000 359783790 S Bo:4:055:6 -115 1500 = 7eff0300 21450005 dcd54940 004006e0 b719e0aa 5a451175 cfc59300 501f20ad
ffff8101df0e3000 359785477 C Bo:4:055:6 0 1500 >
ffff8101df0e3000 359785859 S Bo:4:055:6 -115 158 = 504e564f 4d76f27e ff030021 4500008f d54a4000 4006e603 19e0aa5a 451175cf
ffff8101df0e3000 359786471 C Bo:4:055:6 0 158 >
ffff8101df0e3780 359832541 C Bi:4:055:5 -2 0
ffff8101df0e3780 359832684 S Bi:4:055:5 -115 16384 <
ffff8101df0e3780 359884545 C Bi:4:055:5 -2 0
ffff8101f475aa80 359884676 S Bi:4:055:5 -115 16384 <
ffff8101f475aa80 359927540 C Bi:4:055:5 0 60 = 7eff0300 21450000 34455000 00c60630 59451175 cf19e0aa 5a0050c5 93be3c47
ffff8101f475aa80 359928343 S Bi:4:055:5 -115 16384 <
ffff8101f475aa80 359980547 C Bi:4:055:5 -2 0
ffff8101f475aa80 359980702 S Bi:4:055:5 -115 16384 <
ffff8101f475aa80 360032548 C Bi:4:055:5 -2 0
ffff8101f475aa80 360032651 S Bi:4:055:5 -115 16384 <
ffff8101f475aa80 360084555 C Bi:4:055:5 -2 0
ffff8101f475aa80 360084642 S Bi:4:055:5 -115 16384 <
ffff8101f475aa80 360136556 C Bi:4:055:5 -2 0
ffff8101f475aa80 360136656 S Bi:4:055:5 -115 16384 <
ffff8101f475aa80 360188562 C Bi:4:055:5 -2 60 = 7eff0300 21450000 34507400 00c60625 35451175 cf19e0aa 5a0050c5 92be385e
ffff8101f475aa80 360188648 S Bi:4:055:5 -115 16384 <
ffff8101f475aa80 360240566 C Bi:4:055:5 -2 0
ffff8101f475aa80 360240673 S Bi:4:055:5 -115 16384 <
ffff8101f475aa80 360292562 C Bi:4:055:5 -2 0
ffff8101f475aa80 360292635 S Bi:4:055:5 -115 16384 <
ffff8101f475aa80 360344568 C Bi:4:055:5 -2 0
ffff8101f475aa80 360344672 S Bi:4:055:5 -115 16384 <
ffff8101f475aa80 360396574 C Bi:4:055:5 -2 0
ffff8101f475aa80 360396667 S Bi:4:055:5 -115 16384 <
ffff8101f475aa80 360448573 C Bi:4:055:5 -2 0
ffff8101f475aa80 360448677 S Bi:4:055:5 -115 16384 <
ffff8101f475aa80 360500578 C Bi:4:055:5 -2 0
ffff8101f475aa80 360500670 S Bi:4:055:5 -115 16384 <
ffff8101f475aa80 360552579 C Bi:4:055:5 -2 0
ffff8101f475aa80 360552688 S Bi:4:055:5 -115 16384 <
ffff8101f475aa80 360604579 C Bi:4:055:5 -2 0
ffff8101f475aa80 360604653 S Bi:4:055:5 -115 16384 <
ffff8101f475aa80 360609578 C Bi:4:055:5 0 60 = 7eff0300 21450000 34614800 00c60614 61451175 cf19e0aa 5a0050c5 93be3c47
ffff8101f475aa80 360612286 S Bi:4:055:5 -115 16384 <
ffff8101f475aa80 360612580 C Bi:4:055:5 0 60 = 7eff0300 21450000 34614c00 00c60614 5d451175 cf19e0aa 5a0050c5 93be3c47
ffff8101f475aa80 360612721 S Bi:4:055:5 -115 16384 <
ffff8101f475aa80 360664589 C Bi:4:055:5 -2 0
ffff8101f475aa80 360664763 S Bi:4:055:5 -115 16384 <
ffff8101df0e3780 360666428 S Bo:4:055:6 -115 752 = 7eff0300 21450005 dcd54b40 004006e0 b519e0aa 5a451175 cfc59300 501f209b
ffff8101df0e3780 360667523 C Bo:4:055:6 0 752 >
ffff8101df0e3300 360669986 S Bo:4:055:6 -115 758 = 7e53414f 51544f59 4f524b4d 4f484d50 53434442 4d415942 47584851 4d535156
ffff8101df0e3300 360671523 C Bo:4:055:6 0 758 >
ffff8101f475aa80 360716591 C Bi:4:055:5 -2 0
ffff8101f475aa80 360716694 S Bi:4:055:5 -115 16384 <
ffff8101f475aa80 360768591 C Bi:4:055:5 -2 0
ffff8101f475aa80 360768705 S Bi:4:055:5 -115 16384 <
ffff8101f475aa80 360820594 C Bi:4:055:5 -2 0
ffff8101f475aa80 360820706 S Bi:4:055:5 -115 16384 <
ffff8101f475aa80 360872604 C Bi:4:055:5 -2 0
ffff8101f475aa80 360872688 S Bi:4:055:5 -115 16384 <
ffff8101f475aa80 360924600 C Bi:4:055:5 -2 0
ffff8101f475aa80 360924711 S Bi:4:055:5 -115 16384 <
ffff8101f475aa80 360980604 C Bi:4:055:5 -2 0
ffff8101df0e3d80 360980709 S Bi:4:055:5 -115 16384 <
ffff8101df0e3d80 361032602 C Bi:4:055:5 -2 0
ffff8101df0e3d80 361032714 S Bi:4:055:5 -115 16384 <
ffff8101df0e3d80 361088607 C Bi:4:055:5 -2 0
ffff8101df0e3d80 361088725 S Bi:4:055:5 -115 16384 <
ffff8101df0e3d80 361140609 C Bi:4:055:5 -2 0
ffff8101df0e3d80 361140717 S Bi:4:055:5 -115 16384 <
ffff8101df0e3d80 361192613 C Bi:4:055:5 -2 0
ffff8101df0e3d80 361192747 S Bi:4:055:5 -115 16384 <
ffff8101df0e3d80 361243617 C Bi:4:055:5 -2 0
ffff8101df0e3d80 361243740 S Bi:4:055:5 -115 16384 <
ffff8101df0e3d80 361298619 C Bi:4:055:5 -2 0
ffff8101df0e3d80 361298732 S Bi:4:055:5 -115 16384 <
ffff8101df0e3d80 361356623 C Bi:4:055:5 -2 0
ffff8101df0e3d80 361356751 S Bi:4:055:5 -115 16384 <
ffff8101ef1153c0 361363685 S Bo:4:055:10 -115 31 = 55534243 ae060000 00000000 00000600 00000000 00000000 00000000 000000
ffff8101ef1153c0 361364558 C Bo:4:055:10 0 31 >
ffff8101ef1153c0 361364565 S Bi:4:055:9 -115 13 <
ffff8101ef1153c0 361365558 C Bi:4:055:9 0 13 = 55534253 ae060000 00000000 01
ffff8101ef1153c0 361365566 S Bo:4:055:10 -115 31 = 55534243 af060000 12000000 80000603 00000012 00000000 00000000 000000
ffff8101ef1153c0 361366557 C Bo:4:055:10 0 31 >
ffff8101df0e36c0 361366566 S Bi:4:055:9 -115 18 <
ffff8101df0e36c0 361367558 C Bi:4:055:9 0 18 = 70000200 0000000a 00000000 3a000000 0000
ffff8101ef1153c0 361367565 S Bi:4:055:9 -115 13 <
ffff8101ef1153c0 361368558 C Bi:4:055:9 0 13 = 55534253 af060000 00000000 00
ffff8101ef1153c0 361368592 S Bo:4:055:10 -115 31 = 55534243 b0060000 00000000 00000600 00000000 00000000 00000000 000000
ffff8101ef1153c0 361369558 C Bo:4:055:10 0 31 >
ffff8101ef1153c0 361369563 S Bi:4:055:9 -115 13 <
ffff8101ef1153c0 361370557 C Bi:4:055:9 0 13 = 55534253 b0060000 00000000 01
ffff8101ef1153c0 361370564 S Bo:4:055:10 -115 31 = 55534243 b1060000 12000000 80000603 00000012 00000000 00000000 000000
ffff8101ef1153c0 361371557 C Bo:4:055:10 0 31 >
ffff8101df0e36c0 361371564 S Bi:4:055:9 -115 18 <
ffff8101df0e36c0 361372558 C Bi:4:055:9 0 18 = 70000200 0000000a 00000000 3a000000 0000
ffff8101ef1153c0 361372565 S Bi:4:055:9 -115 13 <
ffff8101ef1153c0 361373561 C Bi:4:055:9 0 13 = 55534253 b1060000 00000000 00
ffff8101df0e3d80 361412630 C Bi:4:055:5 -2 0
ffff8101df0e3d80 361412769 S Bi:4:055:5 -115 16384 <
ffff8101df0e3d80 361464630 C Bi:4:055:5 -2 0
ffff8101df0e3d80 361464753 S Bi:4:055:5 -115 16384 <
ffff8101df0e3d80 361515634 C Bi:4:055:5 -2 0
ffff8101df0e3d80 361515776 S Bi:4:055:5 -115 16384 <
ffff8101df0e3d80 361572638 C Bi:4:055:5 -2 0
ffff8101df0e3d80 361572775 S Bi:4:055:5 -115 16384 <
ffff8101df0e3d80 361628641 C Bi:4:055:5 -2 0
ffff8101df0e3d80 361628789 S Bi:4:055:5 -115 16384 <
ffff8101df0e3d80 361682645 C Bi:4:055:5 -2 0
ffff8101df0e3d80 361682789 S Bi:4:055:5 -115 16384 <
ffff8101df0e3d80 361736643 C Bi:4:055:5 -2 0
ffff8101df0e3d80 361736751 S Bi:4:055:5 -115 16384 <
ffff8101df0e3d80 361788651 C Bi:4:055:5 -2 0
ffff8101df0e3d80 361788786 S Bi:4:055:5 -115 16384 <
ffff8101df0e3d80 361840648 C Bi:4:055:5 -2 0
ffff8101df0e3d80 361840759 S Bi:4:055:5 -115 16384 <
ffff8101df0e3d80 361892656 C Bi:4:055:5 -2 0
ffff8101df0e3d80 361892788 S Bi:4:055:5 -115 16384 <
ffff8101df0e3d80 361943655 C Bi:4:055:5 -2 0
ffff8101df0e3d80 361943784 S Bi:4:055:5 -115 16384 <
ffff8101df0e3d80 361996661 C Bi:4:055:5 -2 0
ffff8101df0e3d80 361996797 S Bi:4:055:5 -115 16384 <
ffff8101df0e3d80 362052665 C Bi:4:055:5 -2 0
ffff8101df0e3d80 362052810 S Bi:4:055:5 -115 16384 <
ffff8101df0e3d80 362104665 C Bi:4:055:5 -2 0
ffff8101df0e3d80 362104786 S Bi:4:055:5 -115 16384 <
ffff8101df0e3d80 362156667 C Bi:4:055:5 -2 0
ffff8101df0e3d80 362156783 S Bi:4:055:5 -115 16384 <
ffff8101df0e3d80 362208673 C Bi:4:055:5 -2 0
ffff8101df0e3d80 362208805 S Bi:4:055:5 -115 16384 <
ffff8101df0e3d80 362264678 C Bi:4:055:5 -2 0
ffff8101df0e3d80 362264870 S Bi:4:055:5 -115 16384 <
ffff8101df0e3d80 362317674 C Bi:4:055:5 -2 0
ffff8101df0e3d80 362317897 S Bi:4:055:5 -115 16384 <
ffff8101df0e3d80 362372683 C Bi:4:055:5 -2 0
ffff8101df0e3d80 362372820 S Bi:4:055:5 -115 16384 <
ffff8101df0e3d80 362428687 C Bi:4:055:5 -2 0
ffff8101df0e3d80 362428826 S Bi:4:055:5 -115 16384 <
ffff8101df0e3d80 362480689 C Bi:4:055:5 -2 0
ffff8101df0e3d80 362480814 S Bi:4:055:5 -115 16384 <
ffff8101df0e3d80 362531691 C Bi:4:055:5 -2 0
ffff8101df0e3d80 362531837 S Bi:4:055:5 -115 16384 <
ffff8101df0e3d80 362584693 C Bi:4:055:5 -2 0
ffff8101df0e3d80 362584823 S Bi:4:055:5 -115 16384 <
ffff8101df0e3d80 362636695 C Bi:4:055:5 -2 0
ffff8101df0e3d80 362636837 S Bi:4:055:5 -115 16384 <
ffff8101df0e3d80 362688701 C Bi:4:055:5 -2 0
ffff810135a45c00 362688825 S Bi:4:055:5 -115 16384 <
ffff810135a45c00 362740698 C Bi:4:055:5 -2 0
ffff810135a45c00 362740798 S Bi:4:055:5 -115 16384 <
ffff810135a45c00 362792704 C Bi:4:055:5 -2 0
ffff810135a45c00 362792800 S Bi:4:055:5 -115 16384 <
ffff810135a45c00 362844708 C Bi:4:055:5 -2 0
ffff810135a45c00 362844811 S Bi:4:055:5 -115 16384 <
ffff810135a45c00 362896712 C Bi:4:055:5 -2 0
ffff810135a45c00 362896806 S Bi:4:055:5 -115 16384 <
ffff810135a45c00 362948709 C Bi:4:055:5 -2 0
ffff810135a45c00 362948803 S Bi:4:055:5 -115 16384 <
ffff810135a45c00 363000714 C Bi:4:055:5 -2 0
ffff810135a45c00 363000801 S Bi:4:055:5 -115 16384 <
ffff810135a45c00 363052717 C Bi:4:055:5 -2 0
ffff810135a45c00 363052814 S Bi:4:055:5 -115 16384 <
ffff810135a45c00 363104718 C Bi:4:055:5 -2 0
ffff810135a45c00 363104812 S Bi:4:055:5 -115 16384 <
ffff8101df0e30c0 363129282 S Bo:4:055:6 -115 1500 = 7eff0300 21450005 dc446940 00400671 9819e0aa 5a451175 cfc59200 501f2c0c
ffff8101df0e30c0 363131664 C Bo:4:055:6 0 1500 >
ffff8101df0e30c0 363131757 S Bo:4:055:6 -115 8 = 5953414f 511cd87e
ffff8101df0e30c0 363132657 C Bo:4:055:6 0 8 >
ffff810135a45c00 363156744 C Bi:4:055:5 -2 0
ffff810135a45c00 363156897 S Bi:4:055:5 -115 16384 <
ffff810135a45c00 363208729 C Bi:4:055:5 -2 0
ffff810135a45c00 363208832 S Bi:4:055:5 -115 16384 <
ffff810135a45c00 363260731 C Bi:4:055:5 -2 0
ffff810135a45c00 363260843 S Bi:4:055:5 -115 16384 <
ffff810135a45c00 363312730 C Bi:4:055:5 -2 0
ffff810135a45c00 363312814 S Bi:4:055:5 -115 16384 <
ffff8101ef1153c0 363363683 S Bo:4:055:10 -115 31 = 55534243 b2060000 00000000 00000600 00000000 00000000 00000000 000000
ffff810135a45c00 363364735 C Bi:4:055:5 -2 0
ffff8101ef1153c0 363364741 C Bo:4:055:10 0 31 >
ffff8101ef1153c0 363364748 S Bi:4:055:9 -115 13 <
ffff810135a45c00 363364836 S Bi:4:055:5 -115 16384 <
ffff8101ef1153c0 363365669 C Bi:4:055:9 0 13 = 55534253 b2060000 00000000 01
ffff8101ef1153c0 363365677 S Bo:4:055:10 -115 31 = 55534243 b3060000 12000000 80000603 00000012 00000000 00000000 000000
ffff8101ef1153c0 363366669 C Bo:4:055:10 0 31 >
ffff8101df0e33c0 363366678 S Bi:4:055:9 -115 18 <
ffff8101df0e33c0 363367669 C Bi:4:055:9 0 18 = 70000200 0000000a 00000000 3a000000 0000
ffff8101ef1153c0 363367676 S Bi:4:055:9 -115 13 <
ffff8101ef1153c0 363368668 C Bi:4:055:9 0 13 = 55534253 b3060000 00000000 00
ffff8101ef1153c0 363368703 S Bo:4:055:10 -115 31 = 55534243 b4060000 00000000 00000600 00000000 00000000 00000000 000000
ffff8101ef1153c0 363369670 C Bo:4:055:10 0 31 >
ffff8101ef1153c0 363369677 S Bi:4:055:9 -115 13 <
ffff8101ef1153c0 363370669 C Bi:4:055:9 0 13 = 55534253 b4060000 00000000 01
ffff8101ef1153c0 363370675 S Bo:4:055:10 -115 31 = 55534243 b5060000 12000000 80000603 00000012 00000000 00000000 000000
ffff8101ef1153c0 363371669 C Bo:4:055:10 0 31 >
ffff8101df0e33c0 363371675 S Bi:4:055:9 -115 18 <
ffff8101df0e33c0 363372669 C Bi:4:055:9 0 18 = 70000200 0000000a 00000000 3a000000 0000
ffff8101ef1153c0 363372675 S Bi:4:055:9 -115 13 <
ffff8101ef1153c0 363373670 C Bi:4:055:9 0 13 = 55534253 b5060000 00000000 00
ffff810135a45c00 363416740 C Bi:4:055:5 -2 0
ffff810135a45c00 363416820 S Bi:4:055:5 -115 16384 <
ffff810135a45c00 363468740 C Bi:4:055:5 -2 0
ffff810135a45c00 363468840 S Bi:4:055:5 -115 16384 <
ffff810135a45c00 363520746 C Bi:4:055:5 -2 0
ffff810135a45c00 363520831 S Bi:4:055:5 -115 16384 <
ffff810135a45c00 363572747 C Bi:4:055:5 -2 0
ffff810135a45c00 363572855 S Bi:4:055:5 -115 16384 <
ffff810135a45c00 363624752 C Bi:4:055:5 -2 0
ffff810135a45c00 363624871 S Bi:4:055:5 -115 16384 <
ffff810135a45c00 363676757 C Bi:4:055:5 -2 0
ffff810135a45c00 363676877 S Bi:4:055:5 -115 16384 <
ffff810135a45c00 363728756 C Bi:4:055:5 -2 0
ffff810135a45c00 363728840 S Bi:4:055:5 -115 16384 <
ffff810135a45c00 363780756 C Bi:4:055:5 -2 0
ffff810135a45c00 363780867 S Bi:4:055:5 -115 16384 <
ffff810135a45c00 363832761 C Bi:4:055:5 -2 0
ffff810135a45c00 363832873 S Bi:4:055:5 -115 16384 <
ffff810135a45c00 363884764 C Bi:4:055:5 -2 0
ffff810135a45c00 363884872 S Bi:4:055:5 -115 16384 <
ffff810135a45c00 363936768 C Bi:4:055:5 -2 0
ffff810135a45c00 363936869 S Bi:4:055:5 -115 16384 <
ffff810135a45c00 363988767 C Bi:4:055:5 -2 0
ffff810135a45c00 363988867 S Bi:4:055:5 -115 16384 <
ffff810135a45c00 364040772 C Bi:4:055:5 -2 0
ffff810135a45c00 364040874 S Bi:4:055:5 -115 16384 <
ffff810135a45c00 364092773 C Bi:4:055:5 -2 0
ffff810135a45c00 364092863 S Bi:4:055:5 -115 16384 <
ffff810135a45c00 364144776 C Bi:4:055:5 -2 0
ffff810135a45c00 364144879 S Bi:4:055:5 -115 16384 <
ffff810135a45c00 364196781 C Bi:4:055:5 -2 0
ffff810135a45c00 364196896 S Bi:4:055:5 -115 16384 <
ffff810135a45c00 364248787 C Bi:4:055:5 -2 0
ffff810135a45c00 364248894 S Bi:4:055:5 -115 16384 <
ffff810135a45c00 364300784 C Bi:4:055:5 -2 0
ffff810135a45c00 364300872 S Bi:4:055:5 -115 16384 <
ffff810135a45c00 364352787 C Bi:4:055:5 -2 0
ffff810135a45c00 364352895 S Bi:4:055:5 -115 16384 <
ffff810135a45c00 364404798 C Bi:4:055:5 -2 0
ffff810135a45c00 364404905 S Bi:4:055:5 -115 16384 <
ffff810135a45c00 364408790 C Bi:4:055:5 0 61 = 7eff0300 21450000 34292c00 00c6064c 7d5d4511 75cf19e0 aa5a0050 c592be38
ffff810135a45c00 364412306 S Bi:4:055:5 -115 16384 <
ffff810135a45c00 364464795 C Bi:4:055:5 -2 0
ffff810135a45c00 364464964 S Bi:4:055:5 -115 16384 <
ffff8101df0e3540 364466611 S Bo:4:055:6 -115 751 = 7eff0300 21450005 dc446a40 00400671 9719e0aa 5a451175 cfc59200 501f2c18
ffff8101df0e3540 364467733 C Bo:4:055:6 0 751 >
ffff8101df0e3300 364470209 S Bo:4:055:6 -115 759 = 7e584447 5244595a 56574b48 55565256 55575355 5945524a 4a44434c 45415955
ffff8101df0e3300 364471734 C Bo:4:055:6 0 759 >
ffff810135a45c00 364516804 C Bi:4:055:5 -2 0
ffff810135a45c00 364516924 S Bi:4:055:5 -115 16384 <
ffff810135a45c00 364567803 C Bi:4:055:5 -2 0
ffff8101df0e3300 364568760 S Bi:4:055:5 -115 16384 <
ffff8101df0e3300 364619804 C Bi:4:055:5 -2 0
ffff8101df0e3300 364619926 S Bi:4:055:5 -115 16384 <
ffff8101df0e3300 364671806 C Bi:4:055:5 -2 0
ffff8101df0e3300 364671919 S Bi:4:055:5 -115 16384 <
ffff8101df0e3300 364723808 C Bi:4:055:5 -2 0
ffff8101df0e3300 364723916 S Bi:4:055:5 -115 16384 <
ffff8101df0e3300 364775813 C Bi:4:055:5 -2 0
ffff8101df0e3300 364775930 S Bi:4:055:5 -115 16384 <
ffff8101df0e3300 364827815 C Bi:4:055:5 -2 0
ffff8101df0e3300 364827932 S Bi:4:055:5 -115 16384 <
ffff8101df0e3300 364879822 C Bi:4:055:5 -2 0
ffff8101df0e3300 364879958 S Bi:4:055:5 -115 16384 <
ffff8101df0e3300 364931823 C Bi:4:055:5 -2 0
ffff8101df0e3300 364931959 S Bi:4:055:5 -115 16384 <
ffff8101df0e3300 364983824 C Bi:4:055:5 -2 0
ffff8101df0e3300 364983939 S Bi:4:055:5 -115 16384 <
ffff8101df0e3300 365035830 C Bi:4:055:5 -2 0
ffff8101df0e3300 365035962 S Bi:4:055:5 -115 16384 <
ffff8101df0e3300 365087830 C Bi:4:055:5 -2 0
ffff8101df0e3300 365087939 S Bi:4:055:5 -115 16384 <
ffff8101df0e3300 365139832 C Bi:4:055:5 -2 0
ffff8101df0e3300 365139944 S Bi:4:055:5 -115 16384 <
ffff8101df0e3300 365191835 C Bi:4:055:5 -2 0
ffff8101df0e3300 365191943 S Bi:4:055:5 -115 16384 <
ffff8101df0e3300 365243839 C Bi:4:055:5 -2 0
ffff8101df0e3300 365243955 S Bi:4:055:5 -115 16384 <
ffff8101df0e3300 365295840 C Bi:4:055:5 -2 0
ffff8101df0e3300 365295948 S Bi:4:055:5 -115 16384 <
ffff8101df0e3300 365347842 C Bi:4:055:5 -2 0
ffff8101df0e3300 365347950 S Bi:4:055:5 -115 16384 <
ffff8101ef1153c0 365363726 S Bo:4:055:10 -115 31 = 55534243 b6060000 00000000 00000600 00000000 00000000 00000000 000000
ffff8101ef1153c0 365364782 C Bo:4:055:10 0 31 >
ffff8101ef1153c0 365364789 S Bi:4:055:9 -115 13 <
ffff8101ef1153c0 365365780 C Bi:4:055:9 0 13 = 55534253 b6060000 00000000 01
ffff8101ef1153c0 365365787 S Bo:4:055:10 -115 31 = 55534243 b7060000 12000000 80000603 00000012 00000000 00000000 000000
ffff8101ef1153c0 365366780 C Bo:4:055:10 0 31 >
ffff8101df0e3000 365366789 S Bi:4:055:9 -115 18 <
ffff8101df0e3000 365367781 C Bi:4:055:9 0 18 = 70000200 0000000a 00000000 3a000000 0000
ffff8101ef1153c0 365367789 S Bi:4:055:9 -115 13 <
ffff8101ef1153c0 365368780 C Bi:4:055:9 0 13 = 55534253 b7060000 00000000 00
ffff8101ef1153c0 365368815 S Bo:4:055:10 -115 31 = 55534243 b8060000 00000000 00000600 00000000 00000000 00000000 000000
ffff8101ef1153c0 365369780 C Bo:4:055:10 0 31 >
ffff8101ef1153c0 365369785 S Bi:4:055:9 -115 13 <
ffff8101ef1153c0 365370780 C Bi:4:055:9 0 13 = 55534253 b8060000 00000000 01
ffff8101ef1153c0 365370787 S Bo:4:055:10 -115 31 = 55534243 b9060000 12000000 80000603 00000012 00000000 00000000 000000
ffff8101ef1153c0 365371780 C Bo:4:055:10 0 31 >
ffff8101df0e3000 365371787 S Bi:4:055:9 -115 18 <
ffff8101df0e3000 365372781 C Bi:4:055:9 0 18 = 70000200 0000000a 00000000 3a000000 0000
ffff8101ef1153c0 365372788 S Bi:4:055:9 -115 13 <
ffff8101ef1153c0 365373780 C Bi:4:055:9 0 13 = 55534253 b9060000 00000000 00
ffff8101df0e3300 365399849 C Bi:4:055:5 -2 0
ffff8101df0e3300 365399979 S Bi:4:055:5 -115 16384 <
ffff8101df0e3300 365451848 C Bi:4:055:5 -2 0
ffff8101df0e3300 365451959 S Bi:4:055:5 -115 16384 <
ffff8101df0e3300 365503852 C Bi:4:055:5 -2 0
ffff8101df0e3300 365503965 S Bi:4:055:5 -115 16384 <
ffff8101df0e3300 365555858 C Bi:4:055:5 -2 0
ffff8101df0e3300 365555970 S Bi:4:055:5 -115 16384 <
ffff8101df0e3300 365607858 C Bi:4:055:5 -2 0
ffff8101df0e3300 365607966 S Bi:4:055:5 -115 16384 <
ffff8101df0e3300 365659864 C Bi:4:055:5 -2 0
ffff8101df0e3300 365660005 S Bi:4:055:5 -115 16384 <
ffff8101df0e3300 365711865 C Bi:4:055:5 -2 0
ffff8101df0e3300 365711986 S Bi:4:055:5 -115 16384 <
ffff8101df0e3300 365763867 C Bi:4:055:5 -2 0
ffff8101df0e3300 365763984 S Bi:4:055:5 -115 16384 <
ffff8101df0e3300 365815870 C Bi:4:055:5 -2 0
ffff8101df0e3300 365815976 S Bi:4:055:5 -115 16384 <
ffff8101df0e3300 365867876 C Bi:4:055:5 -2 0
ffff8101df0e3300 365868035 S Bi:4:055:5 -115 16384 <
ffff8101df0e3300 365919879 C Bi:4:055:5 -2 0
ffff8101df0e3300 365920011 S Bi:4:055:5 -115 16384 <
ffff8101df0e3300 365971881 C Bi:4:055:5 -2 0
ffff8101df0e3300 365971997 S Bi:4:055:5 -115 16384 <
ffff8101df0e3300 366023880 C Bi:4:055:5 -2 0
ffff8101df0e3300 366023984 S Bi:4:055:5 -115 16384 <
ffff8101df0e3300 366075884 C Bi:4:055:5 -2 0
ffff8101df0e3300 366075997 S Bi:4:055:5 -115 16384 <
ffff8101df0e3300 366127886 C Bi:4:055:5 -2 0
ffff8101df0e3300 366127997 S Bi:4:055:5 -115 16384 <
ffff8101df0e3300 366179891 C Bi:4:055:5 -2 0
ffff8101df0e3300 366180006 S Bi:4:055:5 -115 16384 <
ffff8101df0e3300 366232899 C Bi:4:055:5 -2 0
ffff8101df0e3300 366233039 S Bi:4:055:5 -115 16384 <
ffff8101df0e3300 366283895 C Bi:4:055:5 -2 0
ffff8101df0e3300 366284002 S Bi:4:055:5 -115 16384 <
ffff8101df0e3300 366335898 C Bi:4:055:5 -2 0
ffff8101df0e3300 366336002 S Bi:4:055:5 -115 16384 <
ffff8101df0e3300 366389906 C Bi:4:055:5 -2 0
ffff8101df0e3300 366390041 S Bi:4:055:5 -115 16384 <
ffff8101df0e3300 366443906 C Bi:4:055:5 -2 0
ffff8101df0e3300 366444027 S Bi:4:055:5 -115 16384 <
ffff8101df0e3300 366495907 C Bi:4:055:5 -2 0
ffff8101df0e3300 366496016 S Bi:4:055:5 -115 16384 <
ffff8101df0e3300 366547910 C Bi:4:055:5 -2 0
ffff8101df0e3300 366548023 S Bi:4:055:5 -115 16384 <
ffff8101df0e3300 366599913 C Bi:4:055:5 -2 0
ffff8101df0e3300 366600018 S Bi:4:055:5 -115 16384 <
ffff8101df0e3300 366651916 C Bi:4:055:5 -2 0
ffff8101df0e3300 366652028 S Bi:4:055:5 -115 16384 <
ffff81021300aa80 366667120 S Bo:4:055:6 -115 1500 = 7eff0300 21450005 dcd54c40 004006e0 b419e0aa 5a451175 cfc59300 501f209b
ffff81021300aa80 366668864 C Bo:4:055:6 0 1500 >
ffff81021300a900 366672192 S Bo:4:055:6 -115 8 = 5953414f 51f3b27e
ffff81021300a900 366672854 C Bo:4:055:6 0 8 >
ffff8101df0e3300 366703926 C Bi:4:055:5 -2 0
ffff8101df0e3300 366704066 S Bi:4:055:5 -115 16384 <
ffff8101df0e3300 366755925 C Bi:4:055:5 -2 0
ffff8101df0e3300 366756041 S Bi:4:055:5 -115 16384 <
ffff8101df0e3300 366807926 C Bi:4:055:5 -2 0
ffff8101df0e3300 366808052 S Bi:4:055:5 -115 16384 <
ffff8101df0e3300 366859933 C Bi:4:055:5 -2 0
ffff8101df0e3300 366860066 S Bi:4:055:5 -115 16384 <
ffff8101df0e3300 366911932 C Bi:4:055:5 -2 0
ffff8101df0e3300 366912069 S Bi:4:055:5 -115 16384 <
ffff8101df0e3300 366963937 C Bi:4:055:5 -2 0
ffff8101df0e3300 366964056 S Bi:4:055:5 -115 16384 <
ffff8101df0e3300 367015943 C Bi:4:055:5 -2 0
ffff8101df0e3300 367016076 S Bi:4:055:5 -115 16384 <
ffff8101df0e3300 367067940 C Bi:4:055:5 -2 0
ffff8101df0e3300 367068057 S Bi:4:055:5 -115 16384 <
ffff8101df0e3300 367119942 C Bi:4:055:5 -2 0
ffff8101df0e3300 367120049 S Bi:4:055:5 -115 16384 <
ffff8101df0e3300 367171946 C Bi:4:055:5 -2 0
ffff8101df0e3300 367172063 S Bi:4:055:5 -115 16384 <
ffff8101df0e3300 367223948 C Bi:4:055:5 -2 0
ffff8101df0e3300 367224063 S Bi:4:055:5 -115 16384 <
ffff8101df0e3300 367275954 C Bi:4:055:5 -2 0
ffff8101df0e3300 367276077 S Bi:4:055:5 -115 16384 <
ffff8101df0e3300 367327953 C Bi:4:055:5 -2 0
ffff8101df0e3300 367328161 S Bi:4:055:5 -115 16384 <
ffff8101ef1153c0 367363760 S Bo:4:055:10 -115 31 = 55534243 ba060000 00000000 00000600 00000000 00000000 00000000 000000
ffff8101ef1153c0 367363893 C Bo:4:055:10 0 31 >
ffff8101ef1153c0 367363899 S Bi:4:055:9 -115 13 <
ffff8101ef1153c0 367364892 C Bi:4:055:9 0 13 = 55534253 ba060000 00000000 01
ffff8101ef1153c0 367364899 S Bo:4:055:10 -115 31 = 55534243 bb060000 12000000 80000603 00000012 00000000 00000000 000000
ffff8101ef1153c0 367365891 C Bo:4:055:10 0 31 >
ffff8101df0e3540 367365900 S Bi:4:055:9 -115 18 <
ffff8101df0e3540 367366891 C Bi:4:055:9 0 18 = 70000200 0000000a 00000000 3a000000 0000
ffff8101ef1153c0 367366899 S Bi:4:055:9 -115 13 <
ffff8101ef1153c0 367367892 C Bi:4:055:9 0 13 = 55534253 bb060000 00000000 00
ffff8101ef1153c0 367367922 S Bo:4:055:10 -115 31 = 55534243 bc060000 00000000 00000600 00000000 00000000 00000000 000000
ffff8101ef1153c0 367368892 C Bo:4:055:10 0 31 >
ffff8101ef1153c0 367368897 S Bi:4:055:9 -115 13 <
ffff8101ef1153c0 367369892 C Bi:4:055:9 0 13 = 55534253 bc060000 00000000 01
ffff8101ef1153c0 367369898 S Bo:4:055:10 -115 31 = 55534243 bd060000 12000000 80000603 00000012 00000000 00000000 000000
ffff8101ef1153c0 367370892 C Bo:4:055:10 0 31 >
ffff8101df0e3540 367370898 S Bi:4:055:9 -115 18 <
ffff8101df0e3540 367371894 C Bi:4:055:9 0 18 = 70000200 0000000a 00000000 3a000000 0000
ffff8101ef1153c0 367371924 S Bi:4:055:9 -115 13 <
ffff8101ef1153c0 367372893 C Bi:4:055:9 0 13 = 55534253 bd060000 00000000 00
ffff8101df0e3300 367379954 C Bi:4:055:5 -2 0
ffff8101df0e3300 367380116 S Bi:4:055:5 -115 16384 <
ffff8101df0e3300 367431965 C Bi:4:055:5 -2 0
ffff8101df0e3300 367432103 S Bi:4:055:5 -115 16384 <
ffff8101df0e3300 367483964 C Bi:4:055:5 -2 0
ffff8101df0e3300 367484081 S Bi:4:055:5 -115 16384 <
ffff8101df0e3300 367535968 C Bi:4:055:5 -2 0
ffff8101df0e3300 367536089 S Bi:4:055:5 -115 16384 <
ffff8101df0e3300 367587970 C Bi:4:055:5 -2 0
ffff8101df0e3300 367588102 S Bi:4:055:5 -115 16384 <
ffff8101df0e3300 367639975 C Bi:4:055:5 -2 0
ffff8101df0e3300 367640099 S Bi:4:055:5 -115 16384 <
ffff8101df0e3300 367691979 C Bi:4:055:5 -2 0
ffff8101df0e3300 367692118 S Bi:4:055:5 -115 16384 <
ffff8101df0e3300 367743975 C Bi:4:055:5 -2 0
ffff8101df0e3300 367744053 S Bi:4:055:5 -115 16384 <
ffff8101df0e3300 367795982 C Bi:4:055:5 -2 0
ffff8101df0e3300 367796096 S Bi:4:055:5 -115 16384 <
ffff8101df0e3300 367847981 C Bi:4:055:5 -2 0
ffff8101df0e3300 367848057 S Bi:4:055:5 -115 16384 <
ffff8101df0e3300 367870988 C Bi:4:055:5 0 48 = 7eff0300 21450000 28d6c000 00c6069e f4451175 cf19e0aa 5a0050c5 93be3c47
ffff8101df0e3300 367871801 S Bi:4:055:5 -115 16384 <
ffff8101df0e3300 367872979 C Bi:4:055:5 0 48 = 7eff0300 21450000 28d71c00 00c6069e 98451175 cf19e0aa 5a0050c5 93be3c47
ffff8101df0e3300 367873113 S Bi:4:055:5 -115 16384 <
ffff8101df0e3300 367923988 C Bi:4:055:5 -2 0
ffff8101df0e3300 367924204 S Bi:4:055:5 -115 16384 <
ffff8101df0e3300 367975989 C Bi:4:055:5 -2 0
ffff8101df0e3300 367976083 S Bi:4:055:5 -115 16384 <
ffff8101df0e3300 368027996 C Bi:4:055:5 -2 0
ffff8101df0e3300 368028131 S Bi:4:055:5 -115 16384 <
ffff8101df0e3300 368079995 C Bi:4:055:5 -2 0
ffff8101df0e3300 368080080 S Bi:4:055:5 -115 16384 <
ffff8101df0e3300 368131998 C Bi:4:055:5 -2 0
ffff8101df0e3300 368132067 S Bi:4:055:5 -115 16384 <
ffff8101df0e3300 368184001 C Bi:4:055:5 -2 0
ffff8101df0e3300 368184083 S Bi:4:055:5 -115 16384 <
ffff8101df0e3300 368236012 C Bi:4:055:5 -2 0
ffff8101df0e3300 368236150 S Bi:4:055:5 -115 16384 <
ffff8101df0e3300 368288009 C Bi:4:055:5 -2 0
ffff8101df0e3300 368288132 S Bi:4:055:5 -115 16384 <
ffff8101df0e3300 368340011 C Bi:4:055:5 -2 0
ffff8101df0e3300 368340129 S Bi:4:055:5 -115 16384 <
ffff8101df0e3300 368392019 C Bi:4:055:5 -2 0
ffff8101df0e3300 368392149 S Bi:4:055:5 -115 16384 <
ffff8101df0e3300 368444020 C Bi:4:055:5 -2 0
ffff8101df0e3300 368444155 S Bi:4:055:5 -115 16384 <
ffff8101df0e3300 368496020 C Bi:4:055:5 -2 0
ffff8101df0e3300 368496141 S Bi:4:055:5 -115 16384 <
ffff8101df0e3300 368548025 C Bi:4:055:5 -2 0
ffff8101df0e3300 368548159 S Bi:4:055:5 -115 16384 <
ffff8101df0e3300 368600030 C Bi:4:055:5 -2 0
ffff8101df0e3300 368600170 S Bi:4:055:5 -115 16384 <
ffff8101df0e3300 368652034 C Bi:4:055:5 -2 0
ffff8101df0e3300 368652176 S Bi:4:055:5 -115 16384 <
ffff8101df0e3300 368704033 C Bi:4:055:5 -2 0
ffff8101df0e3300 368704156 S Bi:4:055:5 -115 16384 <
ffff8101df0e3300 368756034 C Bi:4:055:5 -2 0
ffff8101df0e3300 368756155 S Bi:4:055:5 -115 16384 <
ffff8101df0e3300 368808039 C Bi:4:055:5 -2 0
ffff8101df0e3300 368808173 S Bi:4:055:5 -115 16384 <
ffff8101df0e3300 368860045 C Bi:4:055:5 -2 0
ffff8101df0e3300 368860180 S Bi:4:055:5 -115 16384 <
ffff8101df0e3300 368912045 C Bi:4:055:5 -2 0
ffff8101df0e3300 368912186 S Bi:4:055:5 -115 16384 <
ffff8101df0e3300 368964047 C Bi:4:055:5 -2 0
ffff8101df0e3300 368964164 S Bi:4:055:5 -115 16384 <
ffff8101df0e3300 369017053 C Bi:4:055:5 -2 0
ffff8101c056cd80 369017173 S Bi:4:055:5 -115 16384 <
ffff8101c056cd80 369069052 C Bi:4:055:5 -2 0
ffff8101c056cd80 369069156 S Bi:4:055:5 -115 16384 <
ffff8101c056cd80 369121052 C Bi:4:055:5 -2 0
ffff8101c056cd80 369121145 S Bi:4:055:5 -115 16384 <
ffff8101c056cd80 369173059 C Bi:4:055:5 -2 0
ffff8101c056cd80 369173163 S Bi:4:055:5 -115 16384 <
ffff8101c056cd80 369225064 C Bi:4:055:5 -2 0
ffff8101c056cd80 369225147 S Bi:4:055:5 -115 16384 <
ffff8101c056cd80 369277065 C Bi:4:055:5 -2 0
ffff8101c056cd80 369277166 S Bi:4:055:5 -115 16384 <
ffff8101c056cd80 369328064 C Bi:4:055:5 -2 0
ffff8101c056cd80 369328152 S Bi:4:055:5 -115 16384 <
ffff8101ef1153c0 369363718 S Bo:4:055:10 -115 31 = 55534243 be060000 00000000 00000600 00000000 00000000 00000000 000000
ffff8101ef1153c0 369364004 C Bo:4:055:10 0 31 >
ffff8101ef1153c0 369364010 S Bi:4:055:9 -115 13 <
ffff8101ef1153c0 369365003 C Bi:4:055:9 0 13 = 55534253 be060000 00000000 01
ffff8101ef1153c0 369365010 S Bo:4:055:10 -115 31 = 55534243 bf060000 12000000 80000603 00000012 00000000 00000000 000000
ffff8101ef1153c0 369366003 C Bo:4:055:10 0 31 >
ffff8101df0e3540 369366012 S Bi:4:055:9 -115 18 <
ffff8101df0e3540 369367003 C Bi:4:055:9 0 18 = 70000200 0000000a 00000000 3a000000 0000
ffff8101ef1153c0 369367011 S Bi:4:055:9 -115 13 <
ffff8101ef1153c0 369368003 C Bi:4:055:9 0 13 = 55534253 bf060000 00000000 00
ffff8101ef1153c0 369368037 S Bo:4:055:10 -115 31 = 55534243 c0060000 00000000 00000600 00000000 00000000 00000000 000000
ffff8101ef1153c0 369369003 C Bo:4:055:10 0 31 >
ffff8101ef1153c0 369369009 S Bi:4:055:9 -115 13 <
ffff8101ef1153c0 369370003 C Bi:4:055:9 0 13 = 55534253 c0060000 00000000 01
ffff8101ef1153c0 369370009 S Bo:4:055:10 -115 31 = 55534243 c1060000 12000000 80000603 00000012 00000000 00000000 000000
ffff8101ef1153c0 369371003 C Bo:4:055:10 0 31 >
ffff8101df0e3540 369371010 S Bi:4:055:9 -115 18 <
ffff8101df0e3540 369372003 C Bi:4:055:9 0 18 = 70000200 0000000a 00000000 3a000000 0000
ffff8101ef1153c0 369372010 S Bi:4:055:9 -115 13 <
ffff8101ef1153c0 369373003 C Bi:4:055:9 0 13 = 55534253 c1060000 00000000 00
ffff8101c056cd80 369381068 C Bi:4:055:5 -2 0
ffff8101c056cd80 369381175 S Bi:4:055:5 -115 16384 <
ffff8101c056cd80 369433077 C Bi:4:055:5 -2 0
ffff8101c056cd80 369433159 S Bi:4:055:5 -115 16384 <
ffff8101c056cd80 369485074 C Bi:4:055:5 -2 0
ffff8101c056cd80 369485174 S Bi:4:055:5 -115 16384 <
ffff8101c056cd80 369537081 C Bi:4:055:5 -2 0
ffff8101c056cd80 369537169 S Bi:4:055:5 -115 16384 <
ffff8101c056cd80 369589080 C Bi:4:055:5 -2 0
ffff8101c056cd80 369589185 S Bi:4:055:5 -115 16384 <
ffff8101c056cd80 369641087 C Bi:4:055:5 -2 0
ffff8101c056cd80 369641194 S Bi:4:055:5 -115 16384 <
ffff8101c056cd80 369693091 C Bi:4:055:5 -2 0
ffff8101c056cd80 369693204 S Bi:4:055:5 -115 16384 <
ffff8101c056cd80 369744089 C Bi:4:055:5 -2 0
ffff8101c056cd80 369744172 S Bi:4:055:5 -115 16384 <
ffff8101c056cd80 369797094 C Bi:4:055:5 -2 0
ffff8101c056cd80 369797199 S Bi:4:055:5 -115 16384 <
ffff8101c056cd80 369849098 C Bi:4:055:5 -2 0
ffff8101c056cd80 369849181 S Bi:4:055:5 -115 16384 <
ffff8101c056cd80 369901102 C Bi:4:055:5 -2 0
ffff8101c056cd80 369901212 S Bi:4:055:5 -115 16384 <
ffff8101c056cd80 369953100 C Bi:4:055:5 -2 0
ffff8101c056cd80 369953174 S Bi:4:055:5 -115 16384 <
ffff8101c056cd80 370005107 C Bi:4:055:5 -2 0
ffff8101c056cd80 370005218 S Bi:4:055:5 -115 16384 <
ffff8101c056cd80 370057107 C Bi:4:055:5 -2 0
ffff8101c056cd80 370057188 S Bi:4:055:5 -115 16384 <
ffff8101c056cd80 370109113 C Bi:4:055:5 -2 0
ffff8101c056cd80 370109223 S Bi:4:055:5 -115 16384 <
ffff8101c056cd80 370161118 C Bi:4:055:5 -2 0
ffff8101c056cd80 370161313 S Bi:4:055:5 -115 16384 <
ffff8101c056cd80 370213114 C Bi:4:055:5 -2 0
ffff8101c056cd80 370213198 S Bi:4:055:5 -115 16384 <
ffff8101c056cd80 370265120 C Bi:4:055:5 -2 0
ffff8101c056cd80 370265225 S Bi:4:055:5 -115 16384 <
ffff8101c056cd80 370317122 C Bi:4:055:5 -2 0
ffff8101c056cd80 370317196 S Bi:4:055:5 -115 16384 <
ffff8101c056cd80 370369127 C Bi:4:055:5 -2 0
ffff8101c056cd80 370369227 S Bi:4:055:5 -115 16384 <
ffff8101c056cd80 370421131 C Bi:4:055:5 -2 0
ffff8101c056cd80 370421219 S Bi:4:055:5 -115 16384 <
ffff8101c056cd80 370473130 C Bi:4:055:5 -2 0
ffff8101c056cd80 370473234 S Bi:4:055:5 -115 16384 <
ffff8101c056cd80 370525136 C Bi:4:055:5 -2 0
ffff8101c056cd80 370525236 S Bi:4:055:5 -115 16384 <
ffff8101c056cd80 370576138 C Bi:4:055:5 -2 0
ffff8101df0e3f00 370576248 S Bi:4:055:5 -115 16384 <
ffff8101df0e3f00 370628141 C Bi:4:055:5 -2 0
ffff8101df0e3f00 370628273 S Bi:4:055:5 -115 16384 <
ffff8101df0e3f00 370680145 C Bi:4:055:5 -2 0
ffff8101df0e3f00 370680286 S Bi:4:055:5 -115 16384 <
ffff8101df0e3f00 370732146 C Bi:4:055:5 -2 0
ffff8101df0e3f00 370732285 S Bi:4:055:5 -115 16384 <
ffff8101df0e3f00 370784152 C Bi:4:055:5 -2 0
ffff8101df0e3f00 370784296 S Bi:4:055:5 -115 16384 <
ffff8101df0e3f00 370836153 C Bi:4:055:5 -2 0
ffff8101df0e3f00 370836292 S Bi:4:055:5 -115 16384 <
ffff8101df0e3f00 370889159 C Bi:4:055:5 -2 0
ffff8101df0e3f00 370889292 S Bi:4:055:5 -115 16384 <
ffff8101df0e3f00 370940156 C Bi:4:055:5 -2 0
ffff8101df0e3f00 370940276 S Bi:4:055:5 -115 16384 <
ffff8101df0e3f00 370992161 C Bi:4:055:5 -2 0
ffff8101df0e3f00 370992294 S Bi:4:055:5 -115 16384 <
ffff8101df0e3f00 371044163 C Bi:4:055:5 -2 0
ffff8101df0e3f00 371044304 S Bi:4:055:5 -115 16384 <
ffff8101df0e3f00 371096168 C Bi:4:055:5 -2 0
ffff8101df0e3f00 371096304 S Bi:4:055:5 -115 16384 <
ffff8101df0e3f00 371148167 C Bi:4:055:5 -2 0
ffff8101df0e3f00 371148283 S Bi:4:055:5 -115 16384 <
ffff8101df0e3f00 371200175 C Bi:4:055:5 -2 0
ffff8101df0e3f00 371200317 S Bi:4:055:5 -115 16384 <
ffff8101df0e3f00 371252174 C Bi:4:055:5 -2 0
ffff8101df0e3f00 371252302 S Bi:4:055:5 -115 16384 <
ffff8101df0e3f00 371304181 C Bi:4:055:5 -2 0
ffff8101df0e3f00 371304316 S Bi:4:055:5 -115 16384 <
ffff8101df0e3f00 371356179 C Bi:4:055:5 -2 0
ffff8101df0e3f00 371356295 S Bi:4:055:5 -115 16384 <
ffff8101ef1153c0 371363775 S Bo:4:055:10 -115 31 = 55534243 c2060000 00000000 00000600 00000000 00000000 00000000 000000
ffff8101ef1153c0 371364116 C Bo:4:055:10 0 31 >
ffff8101ef1153c0 371364123 S Bi:4:055:9 -115 13 <
ffff8101ef1153c0 371365114 C Bi:4:055:9 0 13 = 55534253 c2060000 00000000 01
ffff8101ef1153c0 371365121 S Bo:4:055:10 -115 31 = 55534243 c3060000 12000000 80000603 00000012 00000000 00000000 000000
ffff8101ef1153c0 371366114 C Bo:4:055:10 0 31 >
ffff8101df0e3780 371366123 S Bi:4:055:9 -115 18 <
ffff8101df0e3780 371367114 C Bi:4:055:9 0 18 = 70000200 0000000a 00000000 3a000000 0000
ffff8101ef1153c0 371367122 S Bi:4:055:9 -115 13 <
ffff8101ef1153c0 371368115 C Bi:4:055:9 0 13 = 55534253 c3060000 00000000 00
ffff8101ef1153c0 371368150 S Bo:4:055:10 -115 31 = 55534243 c4060000 00000000 00000600 00000000 00000000 00000000 000000
ffff8101ef1153c0 371369114 C Bo:4:055:10 0 31 >
ffff8101ef1153c0 371369119 S Bi:4:055:9 -115 13 <
ffff8101ef1153c0 371370114 C Bi:4:055:9 0 13 = 55534253 c4060000 00000000 01
ffff8101ef1153c0 371370120 S Bo:4:055:10 -115 31 = 55534243 c5060000 12000000 80000603 00000012 00000000 00000000 000000
ffff8101ef1153c0 371371118 C Bo:4:055:10 0 31 >
ffff8101df0e3780 371371128 S Bi:4:055:9 -115 18 <
ffff8101df0e3780 371372114 C Bi:4:055:9 0 18 = 70000200 0000000a 00000000 3a000000 0000
ffff8101ef1153c0 371372122 S Bi:4:055:9 -115 13 <
ffff8101ef1153c0 371373115 C Bi:4:055:9 0 13 = 55534253 c5060000 00000000 00
ffff8101df0e3f00 371408186 C Bi:4:055:5 -2 0
ffff8101df0e3f00 371408324 S Bi:4:055:5 -115 16384 <
ffff8101df0e3f00 371460186 C Bi:4:055:5 -2 0
ffff8101df0e3f00 371460314 S Bi:4:055:5 -115 16384 <
ffff8101df0e3f00 371512192 C Bi:4:055:5 -2 0
ffff8101df0e3f00 371512397 S Bi:4:055:5 -115 16384 <
ffff8101df0e3f00 371564191 C Bi:4:055:5 -2 0
ffff8101df0e3f00 371564313 S Bi:4:055:5 -115 16384 <
ffff8101df0e3f00 371616200 C Bi:4:055:5 -2 0
ffff8101df0e3f00 371616340 S Bi:4:055:5 -115 16384 <
ffff8101df0e3f00 371668201 C Bi:4:055:5 -2 0
ffff8101df0e3f00 371668344 S Bi:4:055:5 -115 16384 <
ffff8101df0e3f00 371720201 C Bi:4:055:5 -2 0
ffff8101df0e3f00 371720337 S Bi:4:055:5 -115 16384 <
ffff8101df0e3f00 371772205 C Bi:4:055:5 -2 0
ffff8101df0e3f00 371772329 S Bi:4:055:5 -115 16384 <
ffff8101df0e3f00 371824207 C Bi:4:055:5 -2 0
ffff8101df0e3f00 371824344 S Bi:4:055:5 -115 16384 <
ffff8101df0e3f00 371876213 C Bi:4:055:5 -2 0
ffff8101df0e3f00 371876351 S Bi:4:055:5 -115 16384 <
ffff8101df0e3f00 371928213 C Bi:4:055:5 -2 0
ffff8101df0e3f00 371928381 S Bi:4:055:5 -115 16384 <
ffff8101df0e3f00 371980217 C Bi:4:055:5 -2 0
ffff8101df0e3f00 371980351 S Bi:4:055:5 -115 16384 <
ffff8101df0e3f00 372032216 C Bi:4:055:5 -2 0
ffff8101df0e3f00 372032328 S Bi:4:055:5 -115 16384 <
ffff8101df0e3f00 372084223 C Bi:4:055:5 -2 0
ffff8101df0e3f00 372084359 S Bi:4:055:5 -115 16384 <
ffff8101c0796e40 372099111 S Bo:4:055:6 -115 1500 = 7eff0300 21450005 dc446b40 00400671 9619e0aa 5a451175 cfc59200 501f2c18
ffff8101c0796e40 372101164 C Bo:4:055:6 0 1500 >
ffff8101c0796d80 372104192 S Bo:4:055:6 -115 8 = 58444752 44b4087e
ffff8101c0796d80 372105157 C Bo:4:055:6 0 8 >
ffff8101df0e3f00 372137226 C Bi:4:055:5 -2 0
ffff8101c0796d80 372137323 S Bi:4:055:5 -115 16384 <
ffff8101c0796d80 372189227 C Bi:4:055:5 -2 0
ffff8101c0796d80 372189326 S Bi:4:055:5 -115 16384 <
ffff8101c0796d80 372241237 C Bi:4:055:5 -2 0
ffff8101c0796d80 372241347 S Bi:4:055:5 -115 16384 <
ffff8101c0796d80 372293236 C Bi:4:055:5 -2 0
ffff8101c0796d80 372293326 S Bi:4:055:5 -115 16384 <
ffff8101c0796d80 372345238 C Bi:4:055:5 -2 0
ffff8101c0796d80 372345322 S Bi:4:055:5 -115 16384 <
ffff8101c0796d80 372397244 C Bi:4:055:5 -2 0
ffff8101c0796d80 372397331 S Bi:4:055:5 -115 16384 <
ffff8101c0796d80 372449239 C Bi:4:055:5 -2 0
ffff8101c0796d80 372449314 S Bi:4:055:5 -115 16384 <
ffff8101c0796d80 372501247 C Bi:4:055:5 -2 0
ffff8101c0796d80 372501331 S Bi:4:055:5 -115 16384 <
ffff8101c0796d80 372553249 C Bi:4:055:5 -2 0
ffff8101c0796d80 372553330 S Bi:4:055:5 -115 16384 <
ffff8101c0796d80 372605254 C Bi:4:055:5 -2 0
ffff8101c0796d80 372605335 S Bi:4:055:5 -115 16384 <
ffff8101c0796d80 372657259 C Bi:4:055:5 -2 0
ffff8101c0796d80 372657355 S Bi:4:055:5 -115 16384 <
ffff8101c0796d80 372709259 C Bi:4:055:5 -2 0
ffff8101c0796d80 372709336 S Bi:4:055:5 -115 16384 <
ffff8101c0796d80 372761257 C Bi:4:055:5 -2 0
ffff8101c0796d80 372761360 S Bi:4:055:5 -115 16384 <
ffff8101c0796d80 372813262 C Bi:4:055:5 -2 0
ffff8101c0796d80 372813343 S Bi:4:055:5 -115 16384 <
ffff8101c0796d80 372865272 C Bi:4:055:5 -2 0
ffff8101c0796d80 372865357 S Bi:4:055:5 -115 16384 <
ffff8101c0796d80 372869261 C Bi:4:055:5 0 48 = 7eff0300 21450000 28f0f400 00c60684 c0451175 cf19e0aa 5a0050c5 92be385e
ffff8101c0796d80 372872266 S Bi:4:055:5 -115 16384 <
ffff8101c0796d80 372888268 C Bi:4:055:5 0 48 = 7eff0300 21450000 28f14400 00c60684 70451175 cf19e0aa 5a0050c5 92be385e
ffff8101c0796d80 372892281 S Bi:4:055:5 -115 16384 <
ffff8101c0796d80 372945269 C Bi:4:055:5 -2 0
ffff8101c0796d80 372945456 S Bi:4:055:5 -115 16384 <
ffff8101c0796d80 372997272 C Bi:4:055:5 -2 0
ffff8101c0796d80 372997382 S Bi:4:055:5 -115 16384 <
ffff8101c0796d80 373049274 C Bi:4:055:5 -2 0
ffff8101c0796d80 373049350 S Bi:4:055:5 -115 16384 <
ffff8101c0796d80 373101279 C Bi:4:055:5 -2 0
ffff8101c0796d80 373101363 S Bi:4:055:5 -115 16384 <
ffff8101c0796d80 373153280 C Bi:4:055:5 -2 0
ffff8101c0796d80 373153363 S Bi:4:055:5 -115 16384 <
ffff8101c0796d80 373204284 C Bi:4:055:5 -2 0
ffff8101c0796d80 373204379 S Bi:4:055:5 -115 16384 <
ffff8101c0796d80 373257284 C Bi:4:055:5 -2 0
ffff8101c0796d80 373257359 S Bi:4:055:5 -115 16384 <
ffff8101c0796d80 373308292 C Bi:4:055:5 -2 0
ffff8101c0796d80 373308369 S Bi:4:055:5 -115 16384 <
ffff8101c0796d80 373360294 C Bi:4:055:5 -2 0
ffff8101ef1153c0 373360383 S Bo:4:055:10 -115 31 = 55534243 c6060000 00000000 00000600 00000000 00000000 00000000 000000
ffff8101c0796d80 373360415 S Bi:4:055:5 -115 16384 <
ffff8101ef1153c0 373361226 C Bo:4:055:10 0 31 >
ffff8101ef1153c0 373361233 S Bi:4:055:9 -115 13 <
ffff8101ef1153c0 373362226 C Bi:4:055:9 0 13 = 55534253 c6060000 00000000 01
ffff8101ef1153c0 373362232 S Bo:4:055:10 -115 31 = 55534243 c7060000 12000000 80000603 00000012 00000000 00000000 000000
ffff8101ef1153c0 373363226 C Bo:4:055:10 0 31 >
ffff8101df0e3e40 373363235 S Bi:4:055:9 -115 18 <
ffff8101df0e3e40 373364226 C Bi:4:055:9 0 18 = 70000200 0000000a 00000000 3a000000 0000
ffff8101ef1153c0 373364234 S Bi:4:055:9 -115 13 <
ffff8101ef1153c0 373365226 C Bi:4:055:9 0 13 = 55534253 c7060000 00000000 00
ffff8101ef1153c0 373365260 S Bo:4:055:10 -115 31 = 55534243 c8060000 00000000 00000600 00000000 00000000 00000000 000000
ffff8101ef1153c0 373366226 C Bo:4:055:10 0 31 >
ffff8101ef1153c0 373366231 S Bi:4:055:9 -115 13 <
ffff8101ef1153c0 373367225 C Bi:4:055:9 0 13 = 55534253 c8060000 00000000 01
ffff8101ef1153c0 373367231 S Bo:4:055:10 -115 31 = 55534243 c9060000 12000000 80000603 00000012 00000000 00000000 000000
ffff8101ef1153c0 373368226 C Bo:4:055:10 0 31 >
ffff8101df0e3e40 373368233 S Bi:4:055:9 -115 18 <
ffff8101df0e3e40 373369225 C Bi:4:055:9 0 18 = 70000200 0000000a 00000000 3a000000 0000
ffff8101ef1153c0 373369233 S Bi:4:055:9 -115 13 <
ffff8101ef1153c0 373370226 C Bi:4:055:9 0 13 = 55534253 c9060000 00000000 00
ffff8101c0796d80 373412298 C Bi:4:055:5 -2 0
ffff8101c0796d80 373412398 S Bi:4:055:5 -115 16384 <
ffff8101c0796d80 373464299 C Bi:4:055:5 -2 0
ffff8101c0796d80 373464391 S Bi:4:055:5 -115 16384 <
ffff8101c0796d80 373516303 C Bi:4:055:5 -2 0
ffff8101c0796d80 373516388 S Bi:4:055:5 -115 16384 <
ffff8101c0796d80 373576306 C Bi:4:055:5 -2 0
ffff8101df0e3a80 373576414 S Bi:4:055:5 -115 16384 <
ffff8101df0e3a80 373628311 C Bi:4:055:5 -2 0
ffff8101df0e3a80 373628483 S Bi:4:055:5 -115 16384 <
ffff8101df0e3a80 373681318 C Bi:4:055:5 -2 0
ffff8101df0e3a80 373681427 S Bi:4:055:5 -115 16384 <
ffff8101df0e3a80 373736313 C Bi:4:055:5 -2 0
ffff8101df0e3a80 373736407 S Bi:4:055:5 -115 16384 <
ffff8101df0e3a80 373788319 C Bi:4:055:5 -2 0
ffff8101df0e3a80 373788454 S Bi:4:055:5 -115 16384 <
ffff8101df0e3a80 373840317 C Bi:4:055:5 -2 0
ffff8101df0e3a80 373840426 S Bi:4:055:5 -115 16384 <
ffff8101df0e3a80 373892323 C Bi:4:055:5 -2 0
ffff8101df0e3a80 373892461 S Bi:4:055:5 -115 16384 <
ffff8101df0e3a80 373944328 C Bi:4:055:5 -2 0
ffff8101df0e3a80 373944464 S Bi:4:055:5 -115 16384 <
ffff8101df0e3a80 373995328 C Bi:4:055:5 -2 0
ffff8101df0e3a80 373995461 S Bi:4:055:5 -115 16384 <
ffff8101df0e3a80 374052331 C Bi:4:055:5 -2 0
ffff8101df0e3a80 374052471 S Bi:4:055:5 -115 16384 <
ffff8101df0e3a80 374104337 C Bi:4:055:5 -2 0
ffff8101df0e3a80 374104472 S Bi:4:055:5 -115 16384 <
ffff8101df0e3a80 374160335 C Bi:4:055:5 -2 0
ffff8101df0e3a80 374160451 S Bi:4:055:5 -115 16384 <
ffff8101df0e3a80 374212341 C Bi:4:055:5 -2 0
ffff8101df0e3a80 374212475 S Bi:4:055:5 -115 16384 <
ffff8101df0e3a80 374268346 C Bi:4:055:5 -2 0
ffff8101df0e3a80 374268481 S Bi:4:055:5 -115 16384 <
ffff8101df0e3a80 374320348 C Bi:4:055:5 -2 0
ffff8101df0e3a80 374320486 S Bi:4:055:5 -115 16384 <
ffff8101df0e3a80 374372350 C Bi:4:055:5 -2 0
ffff8101df0e3a80 374372477 S Bi:4:055:5 -115 16384 <
ffff8101df0e3a80 374423353 C Bi:4:055:5 -2 0
ffff8101df0e3a80 374423486 S Bi:4:055:5 -115 16384 <
ffff8101df0e3a80 374476352 C Bi:4:055:5 -2 0
ffff8101df0e3a80 374476461 S Bi:4:055:5 -115 16384 <
ffff8101df0e3a80 374528360 C Bi:4:055:5 -2 0
ffff8101df0e3a80 374528500 S Bi:4:055:5 -115 16384 <
ffff8101df0e3a80 374584359 C Bi:4:055:5 -2 0
ffff8101df0e3a80 374584484 S Bi:4:055:5 -115 16384 <
ffff8101df0e3a80 374636366 C Bi:4:055:5 -2 0
ffff8101df0e3a80 374636507 S Bi:4:055:5 -115 16384 <
ffff8101df0e3a80 374692369 C Bi:4:055:5 -2 0
ffff8101df0e3a80 374692508 S Bi:4:055:5 -115 16384 <
ffff8101df0e3a80 374744368 C Bi:4:055:5 -2 0
ffff8101df0e3a80 374744497 S Bi:4:055:5 -115 16384 <
ffff8101df0e3a80 374795374 C Bi:4:055:5 -2 0
ffff8101df0e3a80 374795509 S Bi:4:055:5 -115 16384 <
ffff8101df0e3a80 374852374 C Bi:4:055:5 -2 0
ffff8101df0e3a80 374852484 S Bi:4:055:5 -115 16384 <
ffff8101df0e3a80 374905383 C Bi:4:055:5 -2 0
ffff8101df0e3a80 374905513 S Bi:4:055:5 -115 16384 <
ffff8101df0e3a80 374960383 C Bi:4:055:5 -2 0
ffff8101df0e3a80 374960508 S Bi:4:055:5 -115 16384 <
ffff8101df0e3a80 375012386 C Bi:4:055:5 -2 0
ffff8101df0e3a80 375012521 S Bi:4:055:5 -115 16384 <
ffff8101df0e3a80 375068385 C Bi:4:055:5 -2 0
ffff8101df0e3a80 375068501 S Bi:4:055:5 -115 16384 <
ffff8101df0e3a80 375120392 C Bi:4:055:5 -2 0
ffff8101df0e3a80 375120527 S Bi:4:055:5 -115 16384 <
ffff8101df0e3a80 375176395 C Bi:4:055:5 -2 0
ffff8101df0e3a80 375176528 S Bi:4:055:5 -115 16384 <
ffff8101df0e3a80 375228396 C Bi:4:055:5 -2 0
ffff8101df0e3a80 375228549 S Bi:4:055:5 -115 16384 <
ffff8101df0e3a80 375284399 C Bi:4:055:5 -2 0
ffff8101df0e3a80 375284536 S Bi:4:055:5 -115 16384 <
ffff8101df0e3a80 375336404 C Bi:4:055:5 -2 0
ffff8101df0e3a80 375336553 S Bi:4:055:5 -115 16384 <
ffff8101ef1153c0 375361337 S Bo:4:055:10 -115 31 = 55534243 ca060000 00000000 00000600 00000000 00000000 00000000 000000
ffff8101ef1153c0 375362339 C Bo:4:055:10 0 31 >
ffff8101ef1153c0 375362362 S Bi:4:055:9 -115 13 <
ffff8101ef1153c0 375363337 C Bi:4:055:9 0 13 = 55534253 ca060000 00000000 01
ffff8101ef1153c0 375363344 S Bo:4:055:10 -115 31 = 55534243 cb060000 12000000 80000603 00000012 00000000 00000000 000000
ffff8101ef1153c0 375364337 C Bo:4:055:10 0 31 >
ffff8101df0e3300 375364345 S Bi:4:055:9 -115 18 <
ffff8101df0e3300 375365337 C Bi:4:055:9 0 18 = 70000200 0000000a 00000000 3a000000 0000
ffff8101ef1153c0 375365345 S Bi:4:055:9 -115 13 <
ffff8101ef1153c0 375366337 C Bi:4:055:9 0 13 = 55534253 cb060000 00000000 00
ffff8101ef1153c0 375366367 S Bo:4:055:10 -115 31 = 55534243 cc060000 00000000 00000600 00000000 00000000 00000000 000000
ffff8101ef1153c0 375367337 C Bo:4:055:10 0 31 >
ffff8101ef1153c0 375367719 S Bi:4:055:9 -115 13 <
ffff8101ef1153c0 375368337 C Bi:4:055:9 0 13 = 55534253 cc060000 00000000 01
ffff8101ef1153c0 375368344 S Bo:4:055:10 -115 31 = 55534243 cd060000 12000000 80000603 00000012 00000000 00000000 000000
ffff8101ef1153c0 375369338 C Bo:4:055:10 0 31 >
ffff8101df0e3300 375369346 S Bi:4:055:9 -115 18 <
ffff8101df0e3300 375370337 C Bi:4:055:9 0 18 = 70000200 0000000a 00000000 3a000000 0000
ffff8101ef1153c0 375370344 S Bi:4:055:9 -115 13 <
ffff8101ef1153c0 375371337 C Bi:4:055:9 0 13 = 55534253 cd060000 00000000 00
ffff8101df0e3a80 375388403 C Bi:4:055:5 -2 0
ffff8101df0e3a80 375388534 S Bi:4:055:5 -115 16384 <
ffff8101df0e3a80 375444409 C Bi:4:055:5 -2 0
ffff8101df0e3a80 375444544 S Bi:4:055:5 -115 16384 <
ffff8101df0e3a80 375495410 C Bi:4:055:5 -2 0
ffff8101df0e3a80 375495538 S Bi:4:055:5 -115 16384 <
ffff8101df0e3a80 375552416 C Bi:4:055:5 -2 0
ffff8101df0e3a80 375552554 S Bi:4:055:5 -115 16384 <
ffff8101df0e3a80 375604416 C Bi:4:055:5 -2 0
ffff8101df0e3a80 375604547 S Bi:4:055:5 -115 16384 <
ffff8101df0e3a80 375656423 C Bi:4:055:5 -2 0
ffff8101df0e3a80 375656570 S Bi:4:055:5 -115 16384 <
ffff8101df0e3a80 375711426 C Bi:4:055:5 -2 0
ffff8101df0e3a80 375711567 S Bi:4:055:5 -115 16384 <
ffff8101df0e3a80 375767426 C Bi:4:055:5 -2 0
ffff8101df0e3a80 375767621 S Bi:4:055:5 -115 16384 <
ffff8101df0e3a80 375820431 C Bi:4:055:5 -2 0
ffff8101df0e3a80 375820559 S Bi:4:055:5 -115 16384 <
ffff8101df0e3a80 375872433 C Bi:4:055:5 -2 0
ffff8101df0e3a80 375872569 S Bi:4:055:5 -115 16384 <
ffff8101df0e3a80 375924437 C Bi:4:055:5 -2 0
ffff8101df0e3a80 375924573 S Bi:4:055:5 -115 16384 <
ffff8101df0e3a80 375977439 C Bi:4:055:5 -2 0
ffff8101df0e3a80 375977568 S Bi:4:055:5 -115 16384 <
ffff8101df0e3a80 376031441 C Bi:4:055:5 -2 0
ffff8101df0e3a80 376031569 S Bi:4:055:5 -115 16384 <
ffff8101df0e3a80 376087446 C Bi:4:055:5 -2 0
ffff8101df0e3a80 376087579 S Bi:4:055:5 -115 16384 <
ffff8101df0e3a80 376140450 C Bi:4:055:5 -2 0
ffff8101faf50780 376140568 S Bi:4:055:5 -115 16384 <
ffff8101faf50780 376192450 C Bi:4:055:5 -2 0
ffff8101faf50780 376192544 S Bi:4:055:5 -115 16384 <
ffff8101faf50780 376244455 C Bi:4:055:5 -2 0
ffff8101faf50780 376244544 S Bi:4:055:5 -115 16384 <
ffff8101faf50780 376296456 C Bi:4:055:5 -2 0
ffff8101faf50780 376296534 S Bi:4:055:5 -115 16384 <
ffff8101faf50780 376348460 C Bi:4:055:5 -2 0
ffff8101faf50780 376348560 S Bi:4:055:5 -115 16384 <
ffff8101faf50780 376400463 C Bi:4:055:5 -2 0
ffff8101faf50780 376400555 S Bi:4:055:5 -115 16384 <
ffff8101faf50780 376452472 C Bi:4:055:5 -2 0
ffff8101faf50780 376452584 S Bi:4:055:5 -115 16384 <
ffff8101faf50780 376504471 C Bi:4:055:5 -2 0
ffff8101faf50780 376504575 S Bi:4:055:5 -115 16384 <
ffff8101faf50780 376556474 C Bi:4:055:5 -2 0
ffff8101faf50780 376556589 S Bi:4:055:5 -115 16384 <
ffff8101faf50780 376607474 C Bi:4:055:5 -2 0
ffff8101df0e3d80 376607615 S Bi:4:055:5 -115 16384 <
ffff8101df0e3d80 376660478 C Bi:4:055:5 -2 0
ffff8101df0e3d80 376660641 S Bi:4:055:5 -115 16384 <
ffff8101df0e3d80 376711477 C Bi:4:055:5 -2 0
ffff8101df0e3d80 376711603 S Bi:4:055:5 -115 16384 <
ffff8101df0e3d80 376768481 C Bi:4:055:5 -2 0
ffff8101df0e3d80 376768614 S Bi:4:055:5 -115 16384 <
ffff8101df0e3d80 376820484 C Bi:4:055:5 -2 0
ffff8101df0e3d80 376820614 S Bi:4:055:5 -115 16384 <
ffff8101df0e3d80 376872490 C Bi:4:055:5 -2 0
ffff8101df0e3d80 376872627 S Bi:4:055:5 -115 16384 <
ffff8101df0e3d80 376924493 C Bi:4:055:5 -2 0
ffff8101df0e3d80 376924631 S Bi:4:055:5 -115 16384 <
ffff8101df0e3d80 376976492 C Bi:4:055:5 -2 0
ffff8101df0e3d80 376976620 S Bi:4:055:5 -115 16384 <
ffff8101df0e3d80 377028495 C Bi:4:055:5 -2 0
ffff8101df0e3d80 377028617 S Bi:4:055:5 -115 16384 <
ffff8101df0e3d80 377082500 C Bi:4:055:5 -2 0
ffff8101df0e3d80 377082637 S Bi:4:055:5 -115 16384 <
ffff8101df0e3d80 377136506 C Bi:4:055:5 -2 0
ffff8101df0e3d80 377136645 S Bi:4:055:5 -115 16384 <
ffff8101df0e3d80 377192507 C Bi:4:055:5 -2 0
ffff8101df0e3d80 377192642 S Bi:4:055:5 -115 16384 <
ffff8101df0e3d80 377244509 C Bi:4:055:5 -2 0
ffff8101df0e3d80 377244651 S Bi:4:055:5 -115 16384 <
ffff8101df0e3d80 377297512 C Bi:4:055:5 -2 0
ffff8101df0e3d80 377297648 S Bi:4:055:5 -115 16384 <
ffff8101df0e3d80 377352515 C Bi:4:055:5 -2 0
ffff8101df0e3d80 377352657 S Bi:4:055:5 -115 16384 <
ffff8101ef1153c0 377360827 S Bo:4:055:10 -115 31 = 55534243 ce060000 00000000 00000600 00000000 00000000 00000000 000000
ffff8101ef1153c0 377361451 C Bo:4:055:10 0 31 >
ffff8101ef1153c0 377361458 S Bi:4:055:9 -115 13 <
ffff8101ef1153c0 377362449 C Bi:4:055:9 0 13 = 55534253 ce060000 00000000 01
ffff8101ef1153c0 377362456 S Bo:4:055:10 -115 31 = 55534243 cf060000 12000000 80000603 00000012 00000000 00000000 000000
ffff8101ef1153c0 377363448 C Bo:4:055:10 0 31 >
ffff8101df0e3300 377363456 S Bi:4:055:9 -115 18 <
ffff8101df0e3300 377364449 C Bi:4:055:9 0 18 = 70000200 0000000a 00000000 3a000000 0000
ffff8101ef1153c0 377364533 S Bi:4:055:9 -115 13 <
ffff8101ef1153c0 377365448 C Bi:4:055:9 0 13 = 55534253 cf060000 00000000 00
ffff8101ef1153c0 377365481 S Bo:4:055:10 -115 31 = 55534243 d0060000 00000000 00000600 00000000 00000000 00000000 000000
ffff8101ef1153c0 377366448 C Bo:4:055:10 0 31 >
ffff8101ef1153c0 377366454 S Bi:4:055:9 -115 13 <
ffff8101ef1153c0 377367448 C Bi:4:055:9 0 13 = 55534253 d0060000 00000000 01
ffff8101ef1153c0 377367454 S Bo:4:055:10 -115 31 = 55534243 d1060000 12000000 80000603 00000012 00000000 00000000 000000
ffff8101ef1153c0 377368449 C Bo:4:055:10 0 31 >
ffff8101df0e3300 377368456 S Bi:4:055:9 -115 18 <
ffff8101df0e3300 377369448 C Bi:4:055:9 0 18 = 70000200 0000000a 00000000 3a000000 0000
ffff8101ef1153c0 377369455 S Bi:4:055:9 -115 13 <
ffff8101ef1153c0 377370449 C Bi:4:055:9 0 13 = 55534253 d1060000 00000000 00
ffff8101df0e3d80 377404519 C Bi:4:055:5 -2 0
ffff8101df0e3d80 377404659 S Bi:4:055:5 -115 16384 <
ffff8101df0e3d80 377458523 C Bi:4:055:5 -2 0
ffff8101df0e3d80 377458661 S Bi:4:055:5 -115 16384 <
ffff8101df0e3d80 377516527 C Bi:4:055:5 -2 0
ffff8101df0e3d80 377516671 S Bi:4:055:5 -115 16384 <
ffff8101df0e3d80 377572530 C Bi:4:055:5 -2 0
ffff8101df0e3d80 377572668 S Bi:4:055:5 -115 16384 <
ffff8101df0e3d80 377628534 C Bi:4:055:5 -2 0
ffff8101df0e3d80 377628694 S Bi:4:055:5 -115 16384 <
ffff8101df0e3d80 377684535 C Bi:4:055:5 -2 0
ffff8101df0e3d80 377684783 S Bi:4:055:5 -115 16384 <
ffff8101df0e3d80 377736535 C Bi:4:055:5 -2 0
ffff8101df0e3d80 377736672 S Bi:4:055:5 -115 16384 <
ffff8101df0e3d80 377788542 C Bi:4:055:5 -2 0
ffff8101df0e3d80 377788677 S Bi:4:055:5 -115 16384 <
ffff8101df0e3d80 377840542 C Bi:4:055:5 -2 0
ffff8101df0e3d80 377840680 S Bi:4:055:5 -115 16384 <
ffff8101df0e3d80 377893548 C Bi:4:055:5 -2 0
ffff8101df0e3d80 377893697 S Bi:4:055:5 -115 16384 <
ffff8101df0e3d80 377948550 C Bi:4:055:5 -2 0
ffff8101df0e3d80 377948690 S Bi:4:055:5 -115 16384 <
ffff8101df0e3d80 378001553 C Bi:4:055:5 -2 0
ffff8101df0e3d80 378001689 S Bi:4:055:5 -115 16384 <
ffff8101df0e3d80 378056556 C Bi:4:055:5 -2 0
ffff8101df0e3d80 378056691 S Bi:4:055:5 -115 16384 <
ffff8101df0e3d80 378109560 C Bi:4:055:5 -2 0
ffff8101df0e3d80 378109731 S Bi:4:055:5 -115 16384 <
ffff8101df0e3d80 378161563 C Bi:4:055:5 -2 0
ffff8101df0e3d80 378161699 S Bi:4:055:5 -115 16384 <
ffff8101df0e3d80 378212561 C Bi:4:055:5 -2 0
ffff8101df0e3d80 378212689 S Bi:4:055:5 -115 16384 <
ffff8101df0e3d80 378265569 C Bi:4:055:5 -2 0
ffff8101df0e3d80 378265710 S Bi:4:055:5 -115 16384 <
ffff8101df0e3d80 378320573 C Bi:4:055:5 -2 0
ffff8101df0e3d80 378320711 S Bi:4:055:5 -115 16384 <
ffff8101df0e3d80 378372574 C Bi:4:055:5 -2 0
ffff8101df0e3d80 378372719 S Bi:4:055:5 -115 16384 <
ffff8101df0e3d80 378424575 C Bi:4:055:5 -2 0
ffff8101df0e3d80 378424710 S Bi:4:055:5 -115 16384 <
ffff8101df0e3d80 378477578 C Bi:4:055:5 -2 0
ffff8101df0e3d80 378477717 S Bi:4:055:5 -115 16384 <
ffff8101df0e3d80 378529580 C Bi:4:055:5 -2 0
ffff8101df0e3d80 378529714 S Bi:4:055:5 -115 16384 <
ffff8101df0e3d80 378581583 C Bi:4:055:5 -2 0
ffff8101df0e3d80 378581723 S Bi:4:055:5 -115 16384 <
ffff8101df0e3d80 378634587 C Bi:4:055:5 -2 0
ffff8101df0e3d80 378634720 S Bi:4:055:5 -115 16384 <
ffff8101df0e3d80 378688593 C Bi:4:055:5 -2 0
ffff8101df0e3d80 378688723 S Bi:4:055:5 -115 16384 <
ffff8101df0e3d80 378743593 C Bi:4:055:5 -2 0
ffff8101df0e3d80 378743782 S Bi:4:055:5 -115 16384 <
ffff8101df0e3d80 378800595 C Bi:4:055:5 -2 0
ffff8101df0e3d80 378800729 S Bi:4:055:5 -115 16384 <
ffff8101df0e3d80 378856601 C Bi:4:055:5 -2 0
ffff8101df0e3d80 378856742 S Bi:4:055:5 -115 16384 <
ffff8101df0e3d80 378909603 C Bi:4:055:5 -2 0
ffff8101df0e3d80 378909740 S Bi:4:055:5 -115 16384 <
ffff8101df0e3d80 378960605 C Bi:4:055:5 -2 0
ffff8101df0e3d80 378960742 S Bi:4:055:5 -115 16384 <
ffff8101df0e3d80 379016611 C Bi:4:055:5 -2 0
ffff8101df0e3d80 379016756 S Bi:4:055:5 -115 16384 <
ffff8101df0e3d80 379068610 C Bi:4:055:5 -2 0
ffff8101df0e3d80 379068746 S Bi:4:055:5 -115 16384 <
ffff8101df0e3d80 379120614 C Bi:4:055:5 -2 0
ffff8101df0e3d80 379120747 S Bi:4:055:5 -115 16384 <
ffff8101df0e3d80 379176616 C Bi:4:055:5 -2 0
ffff8101df0e3d80 379176747 S Bi:4:055:5 -115 16384 <
ffff8101df0e3d80 379232623 C Bi:4:055:5 -2 0
ffff8101df0e3d80 379232763 S Bi:4:055:5 -115 16384 <
ffff8101df0e3d80 379285623 C Bi:4:055:5 -2 0
ffff8101df0e3d80 379285754 S Bi:4:055:5 -115 16384 <
ffff8101df0e3d80 379340624 C Bi:4:055:5 -2 0
ffff8101df0e3d80 379340750 S Bi:4:055:5 -115 16384 <
ffff8101ef1153c0 379360299 S Bo:4:055:10 -115 31 = 55534243 d2060000 00000000 00000600 00000000 00000000 00000000 000000
ffff8101ef1153c0 379360562 C Bo:4:055:10 0 31 >
ffff8101ef1153c0 379360568 S Bi:4:055:9 -115 13 <
ffff8101ef1153c0 379361560 C Bi:4:055:9 0 13 = 55534253 d2060000 00000000 01
ffff8101ef1153c0 379361567 S Bo:4:055:10 -115 31 = 55534243 d3060000 12000000 80000603 00000012 00000000 00000000 000000
ffff8101ef1153c0 379362559 C Bo:4:055:10 0 31 >
ffff8101df0e3300 379362567 S Bi:4:055:9 -115 18 <
ffff8101df0e3300 379363559 C Bi:4:055:9 0 18 = 70000200 0000000a 00000000 3a000000 0000
ffff8101ef1153c0 379363567 S Bi:4:055:9 -115 13 <
ffff8101ef1153c0 379364560 C Bi:4:055:9 0 13 = 55534253 d3060000 00000000 00
ffff8101ef1153c0 379364589 S Bo:4:055:10 -115 31 = 55534243 d4060000 00000000 00000600 00000000 00000000 00000000 000000
ffff8101ef1153c0 379365560 C Bo:4:055:10 0 31 >
ffff8101ef1153c0 379365566 S Bi:4:055:9 -115 13 <
ffff8101ef1153c0 379366559 C Bi:4:055:9 0 13 = 55534253 d4060000 00000000 01
ffff8101ef1153c0 379366566 S Bo:4:055:10 -115 31 = 55534243 d5060000 12000000 80000603 00000012 00000000 00000000 000000
ffff8101ef1153c0 379367560 C Bo:4:055:10 0 31 >
ffff8101df0e3300 379367567 S Bi:4:055:9 -115 18 <
ffff8101df0e3300 379368560 C Bi:4:055:9 0 18 = 70000200 0000000a 00000000 3a000000 0000
ffff8101ef1153c0 379368567 S Bi:4:055:9 -115 13 <
ffff8101ef1153c0 379369560 C Bi:4:055:9 0 13 = 55534253 d5060000 00000000 00
ffff8101df0e3d80 379392628 C Bi:4:055:5 -2 0
ffff8101df0e3d80 379392754 S Bi:4:055:5 -115 16384 <
ffff8101df0e3d80 379444633 C Bi:4:055:5 -2 0
ffff8101df0e3d80 379444770 S Bi:4:055:5 -115 16384 <
ffff8101df0e3d80 379500634 C Bi:4:055:5 -2 0
ffff8101df0e3d80 379500764 S Bi:4:055:5 -115 16384 <
ffff8101df0e3d80 379552637 C Bi:4:055:5 -2 0
ffff8101df0e3d80 379552796 S Bi:4:055:5 -115 16384 <
ffff8101df0e3d80 379604650 C Bi:4:055:5 -2 0
ffff8102045809c0 379604818 S Bi:4:055:5 -115 16384 <
ffff8102045809c0 379656646 C Bi:4:055:5 -2 0
ffff8102045809c0 379656765 S Bi:4:055:5 -115 16384 <
ffff8102045809c0 379708646 C Bi:4:055:5 -2 0
ffff8102045809c0 379708722 S Bi:4:055:5 -115 16384 <
ffff8102045809c0 379760650 C Bi:4:055:5 -2 0
ffff8102045809c0 379760754 S Bi:4:055:5 -115 16384 <
ffff8102045809c0 379812653 C Bi:4:055:5 -2 0
ffff8102045809c0 379812730 S Bi:4:055:5 -115 16384 <
ffff8102045809c0 379864657 C Bi:4:055:5 -2 0
ffff8102045809c0 379864744 S Bi:4:055:5 -115 16384 <
ffff8102045809c0 379916661 C Bi:4:055:5 -2 0
ffff8102045809c0 379916737 S Bi:4:055:5 -115 16384 <
ffff8102045809c0 379968665 C Bi:4:055:5 -2 0
ffff8102045809c0 379968772 S Bi:4:055:5 -115 16384 <
ffff8102045809c0 380020664 C Bi:4:055:5 -2 0
ffff8102045809c0 380020739 S Bi:4:055:5 -115 16384 <
ffff8102045809c0 380072666 C Bi:4:055:5 -2 0
ffff8102045809c0 380072780 S Bi:4:055:5 -115 16384 <
ffff8102045809c0 380124674 C Bi:4:055:5 -2 0
ffff8102045809c0 380124747 S Bi:4:055:5 -115 16384 <
ffff8102045809c0 380176673 C Bi:4:055:5 -2 0
ffff8102045809c0 380176775 S Bi:4:055:5 -115 16384 <
ffff8102045809c0 380228676 C Bi:4:055:5 -2 0
ffff8102045809c0 380228758 S Bi:4:055:5 -115 16384 <
ffff8102045809c0 380280679 C Bi:4:055:5 -2 0
ffff8102045809c0 380280755 S Bi:4:055:5 -115 16384 <
ffff8102045809c0 380332682 C Bi:4:055:5 -2 0
ffff8102045809c0 380332780 S Bi:4:055:5 -115 16384 <
ffff8102045809c0 380384688 C Bi:4:055:5 -2 0
ffff8102045809c0 380384771 S Bi:4:055:5 -115 16384 <
ffff8102045809c0 380436689 C Bi:4:055:5 -2 0
ffff8102045809c0 380436779 S Bi:4:055:5 -115 16384 <
ffff8102045809c0 380488690 C Bi:4:055:5 -2 0
ffff8102045809c0 380488769 S Bi:4:055:5 -115 16384 <
ffff8102045809c0 380540696 C Bi:4:055:5 -2 0
ffff8102045809c0 380540817 S Bi:4:055:5 -115 16384 <
ffff8102045809c0 380592697 C Bi:4:055:5 -2 0
ffff8102045809c0 380592769 S Bi:4:055:5 -115 16384 <
ffff8102045809c0 380645699 C Bi:4:055:5 -2 0
ffff8101481aaf00 380649627 S Bi:4:055:5 -115 16384 <
ffff8101481aaf00 380704703 C Bi:4:055:5 -2 0
ffff8101481aaf00 380704840 S Bi:4:055:5 -115 16384 <
ffff8101481aaf00 380757706 C Bi:4:055:5 -2 0
ffff8101481aaf00 380757837 S Bi:4:055:5 -115 16384 <
ffff8101481aaf00 380810709 C Bi:4:055:5 -2 0
ffff8101481aaf00 380810845 S Bi:4:055:5 -115 16384 <
ffff8101481aaf00 380862711 C Bi:4:055:5 -2 0
ffff8101481aaf00 380862848 S Bi:4:055:5 -115 16384 <
ffff8101481aaf00 380916716 C Bi:4:055:5 -2 0
ffff8101481aaf00 380916857 S Bi:4:055:5 -115 16384 <
ffff8101481aaf00 380968717 C Bi:4:055:5 -2 0
ffff8101481aaf00 380968854 S Bi:4:055:5 -115 16384 <
ffff8101481aaf00 381024721 C Bi:4:055:5 -2 0
ffff8101481aaf00 381024858 S Bi:4:055:5 -115 16384 <
ffff8101481aaf00 381076722 C Bi:4:055:5 -2 0
ffff8101481aaf00 381076857 S Bi:4:055:5 -115 16384 <
ffff8101481aaf00 381132727 C Bi:4:055:5 -2 0
ffff8101481aaf00 381132856 S Bi:4:055:5 -115 16384 <
ffff8101481aaf00 381186728 C Bi:4:055:5 -2 0
ffff8101481aaf00 381186862 S Bi:4:055:5 -115 16384 <
ffff8101481aaf00 381237730 C Bi:4:055:5 -2 0
ffff8101481aaf00 381237861 S Bi:4:055:5 -115 16384 <
ffff8101481aaf00 381292733 C Bi:4:055:5 -2 0
ffff8101481aaf00 381292858 S Bi:4:055:5 -115 16384 <
ffff8101481aaf00 381343738 C Bi:4:055:5 -2 0
ffff8101481aaf00 381343873 S Bi:4:055:5 -115 16384 <
ffff8101ef1153c0 381363740 S Bo:4:055:10 -115 31 = 55534243 d6060000 00000000 00000600 00000000 00000000 00000000 000000
ffff8101ef1153c0 381364673 C Bo:4:055:10 0 31 >
ffff8101ef1153c0 381364694 S Bi:4:055:9 -115 13 <
ffff8101ef1153c0 381365673 C Bi:4:055:9 0 13 = 55534253 d6060000 00000000 01
ffff8101ef1153c0 381365700 S Bo:4:055:10 -115 31 = 55534243 d7060000 12000000 80000603 00000012 00000000 00000000 000000
ffff8101ef1153c0 381366671 C Bo:4:055:10 0 31 >
ffff8101481aa240 381366680 S Bi:4:055:9 -115 18 <
ffff8101481aa240 381367671 C Bi:4:055:9 0 18 = 70000200 0000000a 00000000 3a000000 0000
ffff8101ef1153c0 381367679 S Bi:4:055:9 -115 13 <
ffff8101ef1153c0 381368671 C Bi:4:055:9 0 13 = 55534253 d7060000 00000000 00
ffff8101ef1153c0 381368702 S Bo:4:055:10 -115 31 = 55534243 d8060000 00000000 00000600 00000000 00000000 00000000 000000
ffff8101ef1153c0 381369671 C Bo:4:055:10 0 31 >
ffff8101ef1153c0 381369677 S Bi:4:055:9 -115 13 <
ffff8101ef1153c0 381370671 C Bi:4:055:9 0 13 = 55534253 d8060000 00000000 01
ffff8101ef1153c0 381370677 S Bo:4:055:10 -115 31 = 55534243 d9060000 12000000 80000603 00000012 00000000 00000000 000000
ffff8101ef1153c0 381371671 C Bo:4:055:10 0 31 >
ffff8101481aa240 381371678 S Bi:4:055:9 -115 18 <
ffff8101481aa240 381372671 C Bi:4:055:9 0 18 = 70000200 0000000a 00000000 3a000000 0000
ffff8101ef1153c0 381372678 S Bi:4:055:9 -115 13 <
ffff8101ef1153c0 381373671 C Bi:4:055:9 0 13 = 55534253 d9060000 00000000 00
ffff8101481aaf00 381398740 C Bi:4:055:5 -2 0
ffff8101481aaf00 381398872 S Bi:4:055:5 -115 16384 <
ffff8101481aaf00 381452744 C Bi:4:055:5 -2 0
ffff8101481aaf00 381452877 S Bi:4:055:5 -115 16384 <
ffff8101481aaf00 381508751 C Bi:4:055:5 -2 0
ffff8101481aaf00 381508888 S Bi:4:055:5 -115 16384 <
ffff8101481aaf00 381563750 C Bi:4:055:5 -2 0
ffff8101481aaf00 381563889 S Bi:4:055:5 -115 16384 <
ffff8101481aaf00 381619756 C Bi:4:055:5 -2 0
ffff8101481aaf00 381619905 S Bi:4:055:5 -115 16384 <
ffff8101481aaf00 381672759 C Bi:4:055:5 -2 0
ffff8101481aaf00 381672901 S Bi:4:055:5 -115 16384 <
ffff8101481aaf00 381724760 C Bi:4:055:5 -2 0
ffff8101481aaf00 381724895 S Bi:4:055:5 -115 16384 <
ffff8101481aaf00 381776764 C Bi:4:055:5 -2 0
ffff8101481aaf00 381776904 S Bi:4:055:5 -115 16384 <
ffff8101481aaf00 381829768 C Bi:4:055:5 -2 0
ffff8101481aaf00 381829907 S Bi:4:055:5 -115 16384 <
ffff8101481aaf00 381884769 C Bi:4:055:5 -2 0
ffff8101481aaf00 381884954 S Bi:4:055:5 -115 16384 <
ffff8101481aaf00 381936773 C Bi:4:055:5 -2 0
ffff8101481aaf00 381936911 S Bi:4:055:5 -115 16384 <
ffff8101481aaf00 381992776 C Bi:4:055:5 -2 0
ffff8101481aaf00 381992975 S Bi:4:055:5 -115 16384 <
ffff8101481aaf00 382048778 C Bi:4:055:5 -2 0
ffff8101481aaf00 382048916 S Bi:4:055:5 -115 16384 <
ffff8101481aaf00 382100781 C Bi:4:055:5 -2 0
ffff8101481aaf00 382100914 S Bi:4:055:5 -115 16384 <
ffff8101481aaf00 382152781 C Bi:4:055:5 -2 0
ffff8101481aaf00 382152910 S Bi:4:055:5 -115 16384 <
ffff8101481aaf00 382204785 C Bi:4:055:5 -2 0
ffff8101481aaf00 382204920 S Bi:4:055:5 -115 16384 <
ffff8101481aaf00 382256790 C Bi:4:055:5 -2 0
ffff8101481aaf00 382256926 S Bi:4:055:5 -115 16384 <
ffff8101481aaf00 382308790 C Bi:4:055:5 -2 0
ffff8101481aaf00 382308919 S Bi:4:055:5 -115 16384 <
ffff8101481aaf00 382360835 C Bi:4:055:5 -2 0
ffff8101481aaf00 382361081 S Bi:4:055:5 -115 16384 <
ffff8101481aaf00 382415796 C Bi:4:055:5 -2 0
ffff8101481aaf00 382415933 S Bi:4:055:5 -115 16384 <
ffff8101481aaf00 382471803 C Bi:4:055:5 -2 0
ffff8101481aaf00 382471944 S Bi:4:055:5 -115 16384 <
ffff8101481aaf00 382523805 C Bi:4:055:5 -2 0
ffff8101481aaf00 382523944 S Bi:4:055:5 -115 16384 <
ffff8101481aaf00 382580808 C Bi:4:055:5 -2 0
ffff8101481aaf00 382580948 S Bi:4:055:5 -115 16384 <
ffff8101481aaf00 382632815 C Bi:4:055:5 -2 0
ffff810204580540 382632934 S Bi:4:055:5 -115 16384 <
ffff810204580540 382684815 C Bi:4:055:5 -2 0
ffff810204580540 382684938 S Bi:4:055:5 -115 16384 <
ffff810204580540 382736811 C Bi:4:055:5 -2 0
ffff810204580540 382736916 S Bi:4:055:5 -115 16384 <
ffff810204580540 382788820 C Bi:4:055:5 -2 0
ffff810204580540 382788906 S Bi:4:055:5 -115 16384 <
ffff810204580540 382840820 C Bi:4:055:5 -2 0
ffff810204580540 382840925 S Bi:4:055:5 -115 16384 <
ffff810204580540 382892825 C Bi:4:055:5 -2 0
ffff810204580540 382892926 S Bi:4:055:5 -115 16384 <
ffff810204580540 382944826 C Bi:4:055:5 -2 0
ffff810204580540 382944908 S Bi:4:055:5 -115 16384 <
ffff810204580540 382996830 C Bi:4:055:5 -2 0
ffff810204580540 382996927 S Bi:4:055:5 -115 16384 <
ffff810204580540 383048832 C Bi:4:055:5 -2 0
ffff810204580540 383048946 S Bi:4:055:5 -115 16384 <
ffff810204580540 383100833 C Bi:4:055:5 -2 0
ffff810204580540 383100913 S Bi:4:055:5 -115 16384 <
ffff810204580540 383152838 C Bi:4:055:5 -2 0
ffff810204580540 383152945 S Bi:4:055:5 -115 16384 <
ffff810204580540 383204842 C Bi:4:055:5 -2 0
ffff810204580540 383204929 S Bi:4:055:5 -115 16384 <
ffff810204580540 383256841 C Bi:4:055:5 -2 0
ffff810204580540 383256943 S Bi:4:055:5 -115 16384 <
ffff810204580540 383308845 C Bi:4:055:5 -2 0
ffff810204580540 383308936 S Bi:4:055:5 -115 16384 <
ffff810204580540 383360849 C Bi:4:055:5 -2 0
ffff810204580540 383360927 S Bi:4:055:5 -115 16384 <
ffff8101ef1153c0 383363721 S Bo:4:055:10 -115 31 = 55534243 da060000 00000000 00000600 00000000 00000000 00000000 000000
ffff8101ef1153c0 383364784 C Bo:4:055:10 0 31 >
ffff8101ef1153c0 383364791 S Bi:4:055:9 -115 13 <
ffff8101ef1153c0 383365782 C Bi:4:055:9 0 13 = 55534253 da060000 00000000 01
ffff8101ef1153c0 383365789 S Bo:4:055:10 -115 31 = 55534243 db060000 12000000 80000603 00000012 00000000 00000000 000000
ffff8101ef1153c0 383366783 C Bo:4:055:10 0 31 >
ffff81019bfd39c0 383366791 S Bi:4:055:9 -115 18 <
ffff81019bfd39c0 383367782 C Bi:4:055:9 0 18 = 70000200 0000000a 00000000 3a000000 0000
ffff8101ef1153c0 383367790 S Bi:4:055:9 -115 13 <
ffff8101ef1153c0 383368783 C Bi:4:055:9 0 13 = 55534253 db060000 00000000 00
ffff8101ef1153c0 383368817 S Bo:4:055:10 -115 31 = 55534243 dc060000 00000000 00000600 00000000 00000000 00000000 000000
ffff8101ef1153c0 383369782 C Bo:4:055:10 0 31 >
ffff8101ef1153c0 383369787 S Bi:4:055:9 -115 13 <
ffff8101ef1153c0 383370783 C Bi:4:055:9 0 13 = 55534253 dc060000 00000000 01
ffff8101ef1153c0 383370789 S Bo:4:055:10 -115 31 = 55534243 dd060000 12000000 80000603 00000012 00000000 00000000 000000
ffff8101ef1153c0 383371782 C Bo:4:055:10 0 31 >
ffff81019bfd39c0 383371789 S Bi:4:055:9 -115 18 <
ffff81019bfd39c0 383372783 C Bi:4:055:9 0 18 = 70000200 0000000a 00000000 3a000000 0000
ffff8101ef1153c0 383372790 S Bi:4:055:9 -115 13 <
ffff8101ef1153c0 383373783 C Bi:4:055:9 0 13 = 55534253 dd060000 00000000 00
ffff810204580540 383412852 C Bi:4:055:5 -2 0
ffff810204580540 383412947 S Bi:4:055:5 -115 16384 <
ffff810204580540 383464858 C Bi:4:055:5 -2 0
ffff810204580540 383464942 S Bi:4:055:5 -115 16384 <
ffff810204580540 383516862 C Bi:4:055:5 -2 0
ffff810204580540 383516969 S Bi:4:055:5 -115 16384 <
ffff810204580540 383568860 C Bi:4:055:5 -2 0
ffff810204580540 383568959 S Bi:4:055:5 -115 16384 <
ffff810204580540 383620878 C Bi:4:055:5 -2 0
ffff810204580540 383621041 S Bi:4:055:5 -115 16384 <
ffff810204580540 383672875 C Bi:4:055:5 -2 0
ffff810204580540 383673032 S Bi:4:055:5 -115 16384 <
ffff810204580540 383724873 C Bi:4:055:5 -2 0
ffff810204580540 383724990 S Bi:4:055:5 -115 16384 <
ffff810204580540 383776875 C Bi:4:055:5 -2 0
ffff810204580540 383776990 S Bi:4:055:5 -115 16384 <
ffff810204580540 383828872 C Bi:4:055:5 -2 0
ffff810204580540 383828944 S Bi:4:055:5 -115 16384 <
ffff810204580540 383880879 C Bi:4:055:5 -2 0
ffff810204580540 383880987 S Bi:4:055:5 -115 16384 <
ffff810204580540 383932883 C Bi:4:055:5 -2 0
ffff810204580540 383932959 S Bi:4:055:5 -115 16384 <
ffff810204580540 383984881 C Bi:4:055:5 -2 0
ffff810204580540 383984990 S Bi:4:055:5 -115 16384 <
ffff810204580540 384036885 C Bi:4:055:5 -2 0
ffff810204580540 384036962 S Bi:4:055:5 -115 16384 <
ffff810204580540 384088888 C Bi:4:055:5 -2 0
ffff810204580540 384088990 S Bi:4:055:5 -115 16384 <
ffff810204580540 384140890 C Bi:4:055:5 -2 0
ffff810204580540 384140971 S Bi:4:055:5 -115 16384 <
ffff810204580540 384192894 C Bi:4:055:5 -2 0
ffff810204580540 384192990 S Bi:4:055:5 -115 16384 <
ffff810204580540 384244902 C Bi:4:055:5 -2 0
ffff810204580540 384245019 S Bi:4:055:5 -115 16384 <
ffff810204580540 384296903 C Bi:4:055:5 -2 0
ffff810204580540 384296985 S Bi:4:055:5 -115 16384 <
ffff810204580540 384348900 C Bi:4:055:5 -2 0
ffff810204580540 384349001 S Bi:4:055:5 -115 16384 <
ffff810204580540 384400908 C Bi:4:055:5 -2 0
ffff810204580540 384401015 S Bi:4:055:5 -115 16384 <
ffff810204580540 384452912 C Bi:4:055:5 -2 0
ffff810204580540 384453033 S Bi:4:055:5 -115 16384 <
ffff810204580540 384504915 C Bi:4:055:5 -2 0
ffff810204580540 384505028 S Bi:4:055:5 -115 16384 <
ffff810204580540 384555913 C Bi:4:055:5 -2 0
ffff810204580540 384556033 S Bi:4:055:5 -115 16384 <
ffff810204580540 384608915 C Bi:4:055:5 -2 0
ffff810204580540 384609023 S Bi:4:055:5 -115 16384 <
ffff810204580540 384660920 C Bi:4:055:5 -2 0
ffff810204580540 384661032 S Bi:4:055:5 -115 16384 <
ffff810204580540 384712922 C Bi:4:055:5 -2 0
ffff810204580540 384713029 S Bi:4:055:5 -115 16384 <
ffff810204580540 384764926 C Bi:4:055:5 -2 0
ffff810204580540 384765025 S Bi:4:055:5 -115 16384 <
ffff810204580540 384816929 C Bi:4:055:5 -2 0
ffff810204580540 384817032 S Bi:4:055:5 -115 16384 <
ffff810204580540 384868935 C Bi:4:055:5 -2 0
ffff810204580540 384869053 S Bi:4:055:5 -115 16384 <
ffff810204580540 384920936 C Bi:4:055:5 -2 0
ffff810204580540 384921036 S Bi:4:055:5 -115 16384 <
ffff810204580540 384972941 C Bi:4:055:5 -2 0
ffff810204580540 384973045 S Bi:4:055:5 -115 16384 <
ffff810204580540 385024939 C Bi:4:055:5 -2 0
ffff810204580540 385025046 S Bi:4:055:5 -115 16384 <
ffff810204580540 385076941 C Bi:4:055:5 -2 0
ffff810204580540 385077020 S Bi:4:055:5 -115 16384 <
ffff810204580540 385128944 C Bi:4:055:5 -2 0
ffff810204580540 385129019 S Bi:4:055:5 -115 16384 <
ffff810204580540 385180948 C Bi:4:055:5 -2 0
ffff810204580540 385181059 S Bi:4:055:5 -115 16384 <
ffff810204580540 385232952 C Bi:4:055:5 -2 0
ffff810204580540 385233022 S Bi:4:055:5 -115 16384 <
ffff810204580540 385284953 C Bi:4:055:5 -2 0
ffff810204580540 385285057 S Bi:4:055:5 -115 16384 <
ffff810204580540 385336960 C Bi:4:055:5 -2 0
ffff810204580540 385337039 S Bi:4:055:5 -115 16384 <
ffff8101ef1153c0 385363714 S Bo:4:055:10 -115 31 = 55534243 de060000 00000000 00000600 00000000 00000000 00000000 000000
ffff8101ef1153c0 385363894 C Bo:4:055:10 0 31 >
ffff8101ef1153c0 385363901 S Bi:4:055:9 -115 13 <
ffff8101ef1153c0 385364894 C Bi:4:055:9 0 13 = 55534253 de060000 00000000 01
ffff8101ef1153c0 385364901 S Bo:4:055:10 -115 31 = 55534243 df060000 12000000 80000603 00000012 00000000 00000000 000000
ffff8101ef1153c0 385365894 C Bo:4:055:10 0 31 >
ffff8101eb77b840 385365902 S Bi:4:055:9 -115 18 <
ffff8101eb77b840 385366894 C Bi:4:055:9 0 18 = 70000200 0000000a 00000000 3a000000 0000
ffff8101ef1153c0 385366901 S Bi:4:055:9 -115 13 <
ffff8101ef1153c0 385367894 C Bi:4:055:9 0 13 = 55534253 df060000 00000000 00
ffff8101ef1153c0 385367928 S Bo:4:055:10 -115 31 = 55534243 e0060000 00000000 00000600 00000000 00000000 00000000 000000
ffff8101ef1153c0 385368894 C Bo:4:055:10 0 31 >
ffff8101ef1153c0 385368899 S Bi:4:055:9 -115 13 <
ffff8101ef1153c0 385369894 C Bi:4:055:9 0 13 = 55534253 e0060000 00000000 01
ffff8101ef1153c0 385369900 S Bo:4:055:10 -115 31 = 55534243 e1060000 12000000 80000603 00000012 00000000 00000000 000000
ffff8101ef1153c0 385370894 C Bo:4:055:10 0 31 >
ffff8101eb77b840 385370900 S Bi:4:055:9 -115 18 <
ffff8101eb77b840 385371894 C Bi:4:055:9 0 18 = 70000200 0000000a 00000000 3a000000 0000
ffff8101ef1153c0 385371901 S Bi:4:055:9 -115 13 <
ffff8101ef1153c0 385372894 C Bi:4:055:9 0 13 = 55534253 e1060000 00000000 00
ffff810204580540 385388960 C Bi:4:055:5 -2 0
ffff810204580540 385389065 S Bi:4:055:5 -115 16384 <
ffff810204580540 385440965 C Bi:4:055:5 -2 0
ffff810204580540 385441082 S Bi:4:055:5 -115 16384 <
ffff810204580540 385492966 C Bi:4:055:5 -2 0
ffff810204580540 385493069 S Bi:4:055:5 -115 16384 <
ffff810204580540 385544969 C Bi:4:055:5 -2 0
ffff810204580540 385545081 S Bi:4:055:5 -115 16384 <
ffff810204580540 385596971 C Bi:4:055:5 -2 0
ffff810204580540 385597079 S Bi:4:055:5 -115 16384 <
ffff810204580540 385649985 C Bi:4:055:5 -2 0
ffff810204580540 385650659 S Bi:4:055:5 -115 16384 <
ffff810204580540 385704980 C Bi:4:055:5 -2 0
ffff810204580540 385705092 S Bi:4:055:5 -115 16384 <
ffff810204580540 385756982 C Bi:4:055:5 -2 0
ffff810204580540 385757064 S Bi:4:055:5 -115 16384 <
ffff810204580540 385808982 C Bi:4:055:5 -2 0
ffff810204580540 385809089 S Bi:4:055:5 -115 16384 <
ffff810204580540 385860991 C Bi:4:055:5 -2 0
ffff810204580540 385861145 S Bi:4:055:5 -115 16384 <
ffff810204580540 385912989 C Bi:4:055:5 -2 0
ffff810204580540 385913067 S Bi:4:055:5 -115 16384 <
ffff810204580540 385964994 C Bi:4:055:5 -2 0
ffff810204580540 385965107 S Bi:4:055:5 -115 16384 <
ffff810204580540 386016994 C Bi:4:055:5 -2 0
ffff810204580540 386017083 S Bi:4:055:5 -115 16384 <
ffff810204580540 386068996 C Bi:4:055:5 -2 0
ffff810204580540 386069111 S Bi:4:055:5 -115 16384 <
ffff810204580540 386120999 C Bi:4:055:5 -2 0
ffff810204580540 386121077 S Bi:4:055:5 -115 16384 <
ffff810204580540 386173002 C Bi:4:055:5 -2 0
ffff810204580540 386173108 S Bi:4:055:5 -115 16384 <
ffff810204580540 386225008 C Bi:4:055:5 -2 0
ffff810204580540 386225093 S Bi:4:055:5 -115 16384 <
ffff810204580540 386277012 C Bi:4:055:5 -2 0
ffff810204580540 386277121 S Bi:4:055:5 -115 16384 <
ffff810204580540 386329011 C Bi:4:055:5 -2 0
ffff810204580540 386329081 S Bi:4:055:5 -115 16384 <
ffff810204580540 386381015 C Bi:4:055:5 -2 0
ffff810204580540 386381129 S Bi:4:055:5 -115 16384 <
ffff810204580540 386433021 C Bi:4:055:5 -2 0
ffff810204580540 386433117 S Bi:4:055:5 -115 16384 <
ffff810204580540 386485019 C Bi:4:055:5 -2 0
ffff810204580540 386485125 S Bi:4:055:5 -115 16384 <
ffff810204580540 386537022 C Bi:4:055:5 -2 0
ffff810204580540 386537134 S Bi:4:055:5 -115 16384 <
ffff810204580540 386589027 C Bi:4:055:5 -2 0
ffff810204580540 386589140 S Bi:4:055:5 -115 16384 <
ffff810204580540 386641030 C Bi:4:055:5 -2 0
ffff810204580540 386641139 S Bi:4:055:5 -115 16384 <
ffff810204580540 386693034 C Bi:4:055:5 -2 0
ffff810204580540 386693152 S Bi:4:055:5 -115 16384 <
ffff810204580540 386745034 C Bi:4:055:5 -2 0
ffff810204580540 386745134 S Bi:4:055:5 -115 16384 <
ffff810204580540 386797039 C Bi:4:055:5 -2 0
ffff810204580540 386797136 S Bi:4:055:5 -115 16384 <
ffff810204580540 386849040 C Bi:4:055:5 -2 0
ffff810204580540 386849150 S Bi:4:055:5 -115 16384 <
ffff810204580540 386901046 C Bi:4:055:5 -2 0
ffff810204580540 386901124 S Bi:4:055:5 -115 16384 <
ffff810204580540 386953052 C Bi:4:055:5 -2 0
ffff810204580540 386953164 S Bi:4:055:5 -115 16384 <
ffff810204580540 387005051 C Bi:4:055:5 -2 0
ffff810204580540 387005155 S Bi:4:055:5 -115 16384 <
ffff810204580540 387057052 C Bi:4:055:5 -2 0
ffff810204580540 387057157 S Bi:4:055:5 -115 16384 <
ffff810204580540 387109055 C Bi:4:055:5 -2 0
ffff810204580540 387109134 S Bi:4:055:5 -115 16384 <
ffff810204580540 387161058 C Bi:4:055:5 -2 0
ffff810204580540 387161162 S Bi:4:055:5 -115 16384 <
ffff810204580540 387213062 C Bi:4:055:5 -2 0
ffff810204580540 387213167 S Bi:4:055:5 -115 16384 <
ffff810204580540 387265064 C Bi:4:055:5 -2 0
ffff810204580540 387265177 S Bi:4:055:5 -115 16384 <
ffff810204580540 387317066 C Bi:4:055:5 -2 0
ffff810204580540 387317165 S Bi:4:055:5 -115 16384 <
ffff8101ef1153c0 387363715 S Bo:4:055:10 -115 31 = 55534243 e2060000 00000000 00000600 00000000 00000000 00000000 000000
ffff8101ef1153c0 387364025 C Bo:4:055:10 0 31 >
ffff8101ef1153c0 387364033 S Bi:4:055:9 -115 13 <
ffff8101ef1153c0 387365006 C Bi:4:055:9 0 13 = 55534253 e2060000 00000000 01
ffff8101ef1153c0 387365013 S Bo:4:055:10 -115 31 = 55534243 e3060000 12000000 80000603 00000012 00000000 00000000 000000
ffff8101ef1153c0 387366005 C Bo:4:055:10 0 31 >
ffff8101df23f480 387366013 S Bi:4:055:9 -115 18 <
ffff8101df23f480 387367005 C Bi:4:055:9 0 18 = 70000200 0000000a 00000000 3a000000 0000
ffff8101ef1153c0 387367013 S Bi:4:055:9 -115 13 <
ffff8101ef1153c0 387368005 C Bi:4:055:9 0 13 = 55534253 e3060000 00000000 00
ffff8101ef1153c0 387368035 S Bo:4:055:10 -115 31 = 55534243 e4060000 00000000 00000600 00000000 00000000 00000000 000000
ffff810204580540 387369071 C Bi:4:055:5 -2 0
ffff8101ef1153c0 387369077 C Bo:4:055:10 0 31 >
ffff8101ef1153c0 387369083 S Bi:4:055:9 -115 13 <
ffff810204580540 387369170 S Bi:4:055:5 -115 16384 <
ffff8101ef1153c0 387370005 C Bi:4:055:9 0 13 = 55534253 e4060000 00000000 01
ffff8101ef1153c0 387370012 S Bo:4:055:10 -115 31 = 55534243 e5060000 12000000 80000603 00000012 00000000 00000000 000000
ffff8101ef1153c0 387371006 C Bo:4:055:10 0 31 >
ffff8101df23f480 387371012 S Bi:4:055:9 -115 18 <
ffff8101df23f480 387372005 C Bi:4:055:9 0 18 = 70000200 0000000a 00000000 3a000000 0000
ffff8101ef1153c0 387372012 S Bi:4:055:9 -115 13 <
ffff8101ef1153c0 387373005 C Bi:4:055:9 0 13 = 55534253 e5060000 00000000 00
ffff810204580540 387421074 C Bi:4:055:5 -2 0
ffff810204580540 387421178 S Bi:4:055:5 -115 16384 <
ffff810204580540 387473080 C Bi:4:055:5 -2 0
ffff810204580540 387473172 S Bi:4:055:5 -115 16384 <
ffff810204580540 387525079 C Bi:4:055:5 -2 0
ffff810204580540 387525191 S Bi:4:055:5 -115 16384 <
ffff810204580540 387577081 C Bi:4:055:5 -2 0
ffff810204580540 387577184 S Bi:4:055:5 -115 16384 <
ffff810204580540 387628089 C Bi:4:055:5 -2 0
ffff810204580540 387628215 S Bi:4:055:5 -115 16384 <
ffff810204580540 387681091 C Bi:4:055:5 -2 0
ffff810204580540 387681209 S Bi:4:055:5 -115 16384 <
ffff810204580540 387733089 C Bi:4:055:5 -2 0
ffff810204580540 387733188 S Bi:4:055:5 -115 16384 <
ffff810204580540 387785093 C Bi:4:055:5 -2 0
ffff810204580540 387785194 S Bi:4:055:5 -115 16384 <
ffff810204580540 387837096 C Bi:4:055:5 -2 0
ffff810204580540 387837208 S Bi:4:055:5 -115 16384 <
ffff810204580540 387889103 C Bi:4:055:5 -2 0
ffff810204580540 387889188 S Bi:4:055:5 -115 16384 <
ffff810204580540 387941105 C Bi:4:055:5 -2 0
ffff810204580540 387941217 S Bi:4:055:5 -115 16384 <
ffff810204580540 387993104 C Bi:4:055:5 -2 0
ffff810204580540 387993199 S Bi:4:055:5 -115 16384 <
ffff810204580540 388045107 C Bi:4:055:5 -2 0
ffff810204580540 388045203 S Bi:4:055:5 -115 16384 <
ffff810204580540 388097109 C Bi:4:055:5 -2 0
ffff810204580540 388097202 S Bi:4:055:5 -115 16384 <
ffff810204580540 388149113 C Bi:4:055:5 -2 0
ffff810204580540 388149216 S Bi:4:055:5 -115 16384 <
ffff810204580540 388201118 C Bi:4:055:5 -2 0
ffff810204580540 388201219 S Bi:4:055:5 -115 16384 <
ffff810204580540 388253121 C Bi:4:055:5 -2 0
ffff810204580540 388253232 S Bi:4:055:5 -115 16384 <
ffff810204580540 388305121 C Bi:4:055:5 -2 0
ffff810204580540 388305194 S Bi:4:055:5 -115 16384 <
ffff810204580540 388357125 C Bi:4:055:5 -2 0
ffff810204580540 388357227 S Bi:4:055:5 -115 16384 <
ffff810204580540 388409129 C Bi:4:055:5 -2 0
ffff810204580540 388409228 S Bi:4:055:5 -115 16384 <
ffff810204580540 388460141 C Bi:4:055:5 -2 0
ffff8101df27dcc0 388460243 S Bi:4:055:5 -115 16384 <
ffff8101df27dcc0 388512134 C Bi:4:055:5 -2 0
ffff8101df27dcc0 388512239 S Bi:4:055:5 -115 16384 <
ffff8101df27dcc0 388564137 C Bi:4:055:5 -2 0
ffff8101df27dcc0 388564226 S Bi:4:055:5 -115 16384 <
ffff8101df27dcc0 388617146 C Bi:4:055:5 -2 0
ffff810204580a80 388617262 S Bi:4:055:5 -115 16384 <
ffff810204580a80 388669149 C Bi:4:055:5 -2 0
ffff810204580a80 388669270 S Bi:4:055:5 -115 16384 <
ffff810204580a80 388721146 C Bi:4:055:5 -2 0
ffff810204580a80 388721243 S Bi:4:055:5 -115 16384 <
ffff810204580a80 388773148 C Bi:4:055:5 -2 0
ffff810204580a80 388773254 S Bi:4:055:5 -115 16384 <
ffff810204580a80 388825153 C Bi:4:055:5 -2 0
ffff810204580a80 388825252 S Bi:4:055:5 -115 16384 <
ffff810204580a80 388877158 C Bi:4:055:5 -2 0
ffff810204580a80 388877246 S Bi:4:055:5 -115 16384 <
ffff810204580a80 388929162 C Bi:4:055:5 -2 0
ffff810204580a80 388929265 S Bi:4:055:5 -115 16384 <
ffff810204580a80 388981159 C Bi:4:055:5 -2 0
ffff810204580a80 388981259 S Bi:4:055:5 -115 16384 <
ffff810204580a80 389033162 C Bi:4:055:5 -2 0
ffff810204580a80 389033275 S Bi:4:055:5 -115 16384 <
ffff810204580a80 389085166 C Bi:4:055:5 -2 0
ffff810204580a80 389085256 S Bi:4:055:5 -115 16384 <
ffff810204580a80 389137168 C Bi:4:055:5 -2 0
ffff810204580a80 389137267 S Bi:4:055:5 -115 16384 <
ffff810204580a80 389189174 C Bi:4:055:5 -2 0
ffff810204580a80 389189271 S Bi:4:055:5 -115 16384 <
ffff810204580a80 389241175 C Bi:4:055:5 -2 0
ffff810204580a80 389241282 S Bi:4:055:5 -115 16384 <
ffff810204580a80 389293177 C Bi:4:055:5 -2 0
ffff810204580a80 389293259 S Bi:4:055:5 -115 16384 <
ffff810204580a80 389345179 C Bi:4:055:5 -2 0
ffff810204580a80 389345279 S Bi:4:055:5 -115 16384 <
ffff8101ef1153c0 389363675 S Bo:4:055:10 -115 31 = 55534243 e6060000 00000000 00000600 00000000 00000000 00000000 000000
ffff8101ef1153c0 389364117 C Bo:4:055:10 0 31 >
ffff8101ef1153c0 389364124 S Bi:4:055:9 -115 13 <
ffff8101ef1153c0 389365117 C Bi:4:055:9 0 13 = 55534253 e6060000 00000000 01
ffff8101ef1153c0 389365123 S Bo:4:055:10 -115 31 = 55534243 e7060000 12000000 80000603 00000012 00000000 00000000 000000
ffff8101ef1153c0 389366117 C Bo:4:055:10 0 31 >
ffff8101c0701480 389366125 S Bi:4:055:9 -115 18 <
ffff8101c0701480 389367116 C Bi:4:055:9 0 18 = 70000200 0000000a 00000000 3a000000 0000
ffff8101ef1153c0 389367124 S Bi:4:055:9 -115 13 <
ffff8101ef1153c0 389368117 C Bi:4:055:9 0 13 = 55534253 e7060000 00000000 00
ffff8101ef1153c0 389368152 S Bo:4:055:10 -115 31 = 55534243 e8060000 00000000 00000600 00000000 00000000 00000000 000000
ffff8101ef1153c0 389369117 C Bo:4:055:10 0 31 >
ffff8101ef1153c0 389369122 S Bi:4:055:9 -115 13 <
ffff8101ef1153c0 389370116 C Bi:4:055:9 0 13 = 55534253 e8060000 00000000 01
ffff8101ef1153c0 389370122 S Bo:4:055:10 -115 31 = 55534243 e9060000 12000000 80000603 00000012 00000000 00000000 000000
ffff8101ef1153c0 389371117 C Bo:4:055:10 0 31 >
ffff8101c0701480 389371124 S Bi:4:055:9 -115 18 <
ffff8101c0701480 389372117 C Bi:4:055:9 0 18 = 70000200 0000000a 00000000 3a000000 0000
ffff8101ef1153c0 389372123 S Bi:4:055:9 -115 13 <
ffff8101ef1153c0 389373117 C Bi:4:055:9 0 13 = 55534253 e9060000 00000000 00
ffff810204580a80 389397183 C Bi:4:055:5 -2 0
ffff810204580a80 389397280 S Bi:4:055:5 -115 16384 <
ffff810204580a80 389449190 C Bi:4:055:5 -2 0
ffff810204580a80 389449297 S Bi:4:055:5 -115 16384 <
ffff810204580a80 389501189 C Bi:4:055:5 -2 0
ffff810204580a80 389501275 S Bi:4:055:5 -115 16384 <
ffff810204580a80 389553195 C Bi:4:055:5 -2 0
ffff810204580a80 389553305 S Bi:4:055:5 -115 16384 <
ffff810204580a80 389605194 C Bi:4:055:5 -2 0
ffff810204580a80 389605295 S Bi:4:055:5 -115 16384 <
ffff810204580a80 389657197 C Bi:4:055:5 -2 0
ffff810204580a80 389657309 S Bi:4:055:5 -115 16384 <
ffff810204580a80 389709200 C Bi:4:055:5 -2 0
ffff810204580a80 389709280 S Bi:4:055:5 -115 16384 <
ffff810204580a80 389761204 C Bi:4:055:5 -2 0
ffff810204580a80 389761307 S Bi:4:055:5 -115 16384 <
ffff810204580a80 389813206 C Bi:4:055:5 -2 0
ffff810204580a80 389813303 S Bi:4:055:5 -115 16384 <
ffff810204580a80 389865214 C Bi:4:055:5 -2 0
ffff810204580a80 389865331 S Bi:4:055:5 -115 16384 <
ffff810204580a80 389917213 C Bi:4:055:5 -2 0
ffff810204580a80 389917286 S Bi:4:055:5 -115 16384 <
ffff810204580a80 389969220 C Bi:4:055:5 -2 0
ffff810204580a80 389969333 S Bi:4:055:5 -115 16384 <
ffff810204580a80 390021221 C Bi:4:055:5 -2 0
ffff810204580a80 390021309 S Bi:4:055:5 -115 16384 <
ffff810204580a80 390073222 C Bi:4:055:5 -2 0
ffff810204580a80 390073328 S Bi:4:055:5 -115 16384 <
ffff810204580a80 390125222 C Bi:4:055:5 -2 0
ffff810204580a80 390125295 S Bi:4:055:5 -115 16384 <
ffff810204580a80 390177225 C Bi:4:055:5 -2 0
ffff810204580a80 390177331 S Bi:4:055:5 -115 16384 <
ffff810204580a80 390229228 C Bi:4:055:5 -2 0
ffff810204580a80 390229304 S Bi:4:055:5 -115 16384 <
ffff810204580a80 390281234 C Bi:4:055:5 -2 0
ffff810204580a80 390281351 S Bi:4:055:5 -115 16384 <
ffff810204580a80 390333235 C Bi:4:055:5 -2 0
ffff810204580a80 390333312 S Bi:4:055:5 -115 16384 <
ffff810204580a80 390385239 C Bi:4:055:5 -2 0
ffff810204580a80 390385348 S Bi:4:055:5 -115 16384 <
ffff810204580a80 390437244 C Bi:4:055:5 -2 0
ffff810204580a80 390437340 S Bi:4:055:5 -115 16384 <
ffff810204580a80 390489243 C Bi:4:055:5 -2 0
ffff810204580a80 390489354 S Bi:4:055:5 -115 16384 <
ffff810204580a80 390541246 C Bi:4:055:5 -2 0
ffff810204580a80 390541356 S Bi:4:055:5 -115 16384 <
ffff810204580a80 390593250 C Bi:4:055:5 -2 0
ffff810204580a80 390593359 S Bi:4:055:5 -115 16384 <
ffff810204580a80 390645252 C Bi:4:055:5 -2 0
ffff810204580a80 390645360 S Bi:4:055:5 -115 16384 <
ffff810204580a80 390697259 C Bi:4:055:5 -2 0
ffff810204580a80 390697374 S Bi:4:055:5 -115 16384 <
ffff810204580a80 390749257 C Bi:4:055:5 -2 0
ffff810204580a80 390749355 S Bi:4:055:5 -115 16384 <
ffff810204580a80 390801260 C Bi:4:055:5 -2 0
ffff810204580a80 390801360 S Bi:4:055:5 -115 16384 <
ffff810204580a80 390853269 C Bi:4:055:5 -2 0
ffff810204580a80 390853385 S Bi:4:055:5 -115 16384 <
ffff810204580a80 390905266 C Bi:4:055:5 -2 0
ffff810204580a80 390905348 S Bi:4:055:5 -115 16384 <
ffff810204580a80 390956272 C Bi:4:055:5 -2 0
ffff8101c0660d80 390956374 S Bi:4:055:5 -115 16384 <
ffff8101c0660d80 391008274 C Bi:4:055:5 -2 0
ffff8101c0660d80 391008371 S Bi:4:055:5 -115 16384 <
ffff8101c0660d80 391060276 C Bi:4:055:5 -2 0
ffff8101c0660d80 391060388 S Bi:4:055:5 -115 16384 <
ffff8101c0660d80 391112277 C Bi:4:055:5 -2 0
ffff8101c0660d80 391112384 S Bi:4:055:5 -115 16384 <
ffff8101c0660d80 391164282 C Bi:4:055:5 -2 0
ffff8101c0660d80 391164399 S Bi:4:055:5 -115 16384 <
ffff8101c0660d80 391216284 C Bi:4:055:5 -2 0
ffff8101c0660d80 391216397 S Bi:4:055:5 -115 16384 <
ffff8101c0660d80 391268287 C Bi:4:055:5 -2 0
ffff8101c0660d80 391268406 S Bi:4:055:5 -115 16384 <
ffff8101c0660d80 391320287 C Bi:4:055:5 -2 0
ffff8101c0660d80 391320383 S Bi:4:055:5 -115 16384 <
ffff8101ef1153c0 391363680 S Bo:4:055:10 -115 31 = 55534243 ea060000 00000000 00000600 00000000 00000000 00000000 000000
ffff8101ef1153c0 391364230 C Bo:4:055:10 0 31 >
ffff8101ef1153c0 391364237 S Bi:4:055:9 -115 13 <
ffff8101ef1153c0 391365228 C Bi:4:055:9 0 13 = 55534253 ea060000 00000000 01
ffff8101ef1153c0 391365235 S Bo:4:055:10 -115 31 = 55534243 eb060000 12000000 80000603 00000012 00000000 00000000 000000
ffff8101ef1153c0 391366228 C Bo:4:055:10 0 31 >
ffff8101c06606c0 391366237 S Bi:4:055:9 -115 18 <
ffff8101c06606c0 391367227 C Bi:4:055:9 0 18 = 70000200 0000000a 00000000 3a000000 0000
ffff8101ef1153c0 391367235 S Bi:4:055:9 -115 13 <
ffff8101ef1153c0 391368228 C Bi:4:055:9 0 13 = 55534253 eb060000 00000000 00
ffff8101ef1153c0 391368262 S Bo:4:055:10 -115 31 = 55534243 ec060000 00000000 00000600 00000000 00000000 00000000 000000
ffff8101ef1153c0 391369228 C Bo:4:055:10 0 31 >
ffff8101ef1153c0 391369233 S Bi:4:055:9 -115 13 <
ffff8101ef1153c0 391370228 C Bi:4:055:9 0 13 = 55534253 ec060000 00000000 01
ffff8101ef1153c0 391370234 S Bo:4:055:10 -115 31 = 55534243 ed060000 12000000 80000603 00000012 00000000 00000000 000000
ffff8101ef1153c0 391371228 C Bo:4:055:10 0 31 >
ffff8101c06606c0 391371234 S Bi:4:055:9 -115 18 <
ffff8101c0660d80 391372296 C Bi:4:055:5 -2 0
ffff8101c06606c0 391372299 C Bi:4:055:9 0 18 = 70000200 0000000a 00000000 3a000000 0000
ffff8101ef1153c0 391372306 S Bi:4:055:9 -115 13 <
ffff8101c0660d80 391372422 S Bi:4:055:5 -115 16384 <
ffff8101ef1153c0 391373228 C Bi:4:055:9 0 13 = 55534253 ed060000 00000000 00
ffff8101c0660d80 391424297 C Bi:4:055:5 -2 0
ffff8101c0660d80 391424413 S Bi:4:055:5 -115 16384 <
ffff8101c0660d80 391476303 C Bi:4:055:5 -2 0
ffff8101eb417900 391476441 S Bi:4:055:5 -115 16384 <
ffff8101eb417900 391528301 C Bi:4:055:5 -2 0
ffff8101eb417900 391528412 S Bi:4:055:5 -115 16384 <
ffff8101eb417900 391580305 C Bi:4:055:5 -2 0
ffff8101eb417900 391580430 S Bi:4:055:5 -115 16384 <
ffff8101eb417900 391641321 C Bi:4:055:5 -2 0
ffff810204580e40 391641537 S Bi:4:055:5 -115 16384 <
ffff810204580e40 391692319 C Bi:4:055:5 -2 0
ffff810204580e40 391692439 S Bi:4:055:5 -115 16384 <
ffff810204580e40 391744317 C Bi:4:055:5 -2 0
ffff810204580e40 391744401 S Bi:4:055:5 -115 16384 <
ffff810204580e40 391796321 C Bi:4:055:5 -2 0
ffff810204580e40 391796394 S Bi:4:055:5 -115 16384 <
ffff810204580e40 391848321 C Bi:4:055:5 -2 0
ffff810204580e40 391848402 S Bi:4:055:5 -115 16384 <
ffff810204580e40 391900330 C Bi:4:055:5 -2 0
ffff810204580e40 391900388 S Bi:4:055:5 -115 16384 <
ffff810204580e40 391952332 C Bi:4:055:5 -2 0
ffff810204580e40 391952413 S Bi:4:055:5 -115 16384 <
ffff810204580e40 392004332 C Bi:4:055:5 -2 0
ffff810204580e40 392004427 S Bi:4:055:5 -115 16384 <
ffff810204580e40 392057337 C Bi:4:055:5 -2 0
ffff810204580e40 392057456 S Bi:4:055:5 -115 16384 <
ffff810204580e40 392108336 C Bi:4:055:5 -2 0
ffff810204580e40 392108392 S Bi:4:055:5 -115 16384 <
ffff810204580e40 392160338 C Bi:4:055:5 -2 0
ffff810204580e40 392160430 S Bi:4:055:5 -115 16384 <
ffff810204580e40 392212342 C Bi:4:055:5 -2 0
ffff810204580e40 392212413 S Bi:4:055:5 -115 16384 <
ffff810204580e40 392264350 C Bi:4:055:5 -2 0
ffff810204580e40 392264436 S Bi:4:055:5 -115 16384 <
ffff810204580e40 392316349 C Bi:4:055:5 -2 0
ffff810204580e40 392316402 S Bi:4:055:5 -115 16384 <
ffff810204580e40 392368353 C Bi:4:055:5 -2 0
ffff810204580e40 392368439 S Bi:4:055:5 -115 16384 <
ffff810204580e40 392420354 C Bi:4:055:5 -2 0
ffff810204580e40 392420439 S Bi:4:055:5 -115 16384 <
ffff810204580e40 392472358 C Bi:4:055:5 -2 0
ffff810204580e40 392472448 S Bi:4:055:5 -115 16384 <
ffff810204580e40 392524359 C Bi:4:055:5 -2 0
ffff810204580e40 392524462 S Bi:4:055:5 -115 16384 <
ffff810204580e40 392576366 C Bi:4:055:5 -2 0
ffff810204580e40 392576520 S Bi:4:055:5 -115 16384 <
ffff810204580e40 392628366 C Bi:4:055:5 -2 0
ffff810204580e40 392628445 S Bi:4:055:5 -115 16384 <
ffff810204580e40 392680370 C Bi:4:055:5 -2 0
ffff810204580e40 392680487 S Bi:4:055:5 -115 16384 <
ffff810204580e40 392732372 C Bi:4:055:5 -2 0
ffff810204580e40 392732427 S Bi:4:055:5 -115 16384 <
ffff810204580e40 392784376 C Bi:4:055:5 -2 0
ffff810204580e40 392784480 S Bi:4:055:5 -115 16384 <
ffff810204580e40 392836377 C Bi:4:055:5 -2 0
ffff810204580e40 392836430 S Bi:4:055:5 -115 16384 <
ffff810204580e40 392888382 C Bi:4:055:5 -2 0
ffff810204580e40 392888468 S Bi:4:055:5 -115 16384 <
ffff810204580e40 392940386 C Bi:4:055:5 -2 0
ffff810204580e40 392940444 S Bi:4:055:5 -115 16384 <
ffff810204580e40 392992386 C Bi:4:055:5 -2 0
ffff810204580e40 392992486 S Bi:4:055:5 -115 16384 <
ffff810204580e40 393044392 C Bi:4:055:5 -2 0
ffff810204580e40 393044445 S Bi:4:055:5 -115 16384 <
ffff810204580e40 393096392 C Bi:4:055:5 -2 0
ffff810204580e40 393096481 S Bi:4:055:5 -115 16384 <
ffff810204580e40 393148394 C Bi:4:055:5 -2 0
ffff810204580e40 393148493 S Bi:4:055:5 -115 16384 <
ffff810204580e40 393200397 C Bi:4:055:5 -2 0
ffff810204580e40 393200503 S Bi:4:055:5 -115 16384 <
ffff810204580e40 393252399 C Bi:4:055:5 -2 0
ffff810204580e40 393252511 S Bi:4:055:5 -115 16384 <
ffff810204580e40 393304401 C Bi:4:055:5 -2 0
ffff810204580e40 393304456 S Bi:4:055:5 -115 16384 <
ffff810204580e40 393356408 C Bi:4:055:5 -2 0
ffff810204580e40 393356524 S Bi:4:055:5 -115 16384 <
ffff8101ef1153c0 393363683 S Bo:4:055:10 -115 31 = 55534243 ee060000 00000000 00000600 00000000 00000000 00000000 000000
ffff8101ef1153c0 393364341 C Bo:4:055:10 0 31 >
ffff8101ef1153c0 393364350 S Bi:4:055:9 -115 13 <
ffff8101ef1153c0 393365340 C Bi:4:055:9 0 13 = 55534253 ee060000 00000000 01
ffff8101ef1153c0 393365347 S Bo:4:055:10 -115 31 = 55534243 ef060000 12000000 80000603 00000012 00000000 00000000 000000
ffff8101ef1153c0 393366339 C Bo:4:055:10 0 31 >
ffff8100b66d1900 393366348 S Bi:4:055:9 -115 18 <
ffff8100b66d1900 393367339 C Bi:4:055:9 0 18 = 70000200 0000000a 00000000 3a000000 0000
ffff8101ef1153c0 393367347 S Bi:4:055:9 -115 13 <
ffff8101ef1153c0 393368339 C Bi:4:055:9 0 13 = 55534253 ef060000 00000000 00
ffff8101ef1153c0 393368373 S Bo:4:055:10 -115 31 = 55534243 f0060000 00000000 00000600 00000000 00000000 00000000 000000
ffff8101ef1153c0 393369339 C Bo:4:055:10 0 31 >
ffff8101ef1153c0 393369345 S Bi:4:055:9 -115 13 <
ffff8101ef1153c0 393370339 C Bi:4:055:9 0 13 = 55534253 f0060000 00000000 01
ffff8101ef1153c0 393370346 S Bo:4:055:10 -115 31 = 55534243 f1060000 12000000 80000603 00000012 00000000 00000000 000000
ffff8101ef1153c0 393371340 C Bo:4:055:10 0 31 >
ffff8100b66d1900 393371347 S Bi:4:055:9 -115 18 <
ffff8100b66d1900 393372340 C Bi:4:055:9 0 18 = 70000200 0000000a 00000000 3a000000 0000
ffff8101ef1153c0 393372347 S Bi:4:055:9 -115 13 <
ffff8101ef1153c0 393373340 C Bi:4:055:9 0 13 = 55534253 f1060000 00000000 00
ffff810204580e40 393408406 C Bi:4:055:5 -2 0
ffff810204580e40 393408485 S Bi:4:055:5 -115 16384 <
ffff810204580e40 393460413 C Bi:4:055:5 -2 0
ffff810204580e40 393460541 S Bi:4:055:5 -115 16384 <
ffff810204580e40 393512412 C Bi:4:055:5 -2 0
ffff810204580e40 393512514 S Bi:4:055:5 -115 16384 <
ffff810204580e40 393564418 C Bi:4:055:5 -2 0
ffff810204580e40 393564507 S Bi:4:055:5 -115 16384 <
ffff810204580e40 393616422 C Bi:4:055:5 -2 0
ffff810204580e40 393616539 S Bi:4:055:5 -115 16384 <
ffff810204580e40 393668432 C Bi:4:055:5 -2 0
ffff810204580e40 393668548 S Bi:4:055:5 -115 16384 <
ffff810204580e40 393720431 C Bi:4:055:5 -2 0
ffff810204580e40 393720551 S Bi:4:055:5 -115 16384 <
ffff810204580e40 393772428 C Bi:4:055:5 -2 0
ffff810204580e40 393772534 S Bi:4:055:5 -115 16384 <
ffff810204580e40 393824430 C Bi:4:055:5 -2 0
ffff810204580e40 393824527 S Bi:4:055:5 -115 16384 <
ffff810204580e40 393876434 C Bi:4:055:5 -2 0
ffff810204580e40 393876549 S Bi:4:055:5 -115 16384 <
ffff810204580e40 393928435 C Bi:4:055:5 -2 0
ffff810204580e40 393928520 S Bi:4:055:5 -115 16384 <
ffff810204580e40 393980443 C Bi:4:055:5 -2 0
ffff810204580e40 393980565 S Bi:4:055:5 -115 16384 <
ffff810204580e40 394032441 C Bi:4:055:5 -2 0
ffff810204580e40 394032517 S Bi:4:055:5 -115 16384 <
ffff810204580e40 394084442 C Bi:4:055:5 -2 0
ffff810204580e40 394084549 S Bi:4:055:5 -115 16384 <
ffff810204580e40 394137450 C Bi:4:055:5 -2 0
ffff810204580e40 394137541 S Bi:4:055:5 -115 16384 <
ffff810204580e40 394188450 C Bi:4:055:5 -2 0
ffff810204580e40 394188558 S Bi:4:055:5 -115 16384 <
ffff810204580e40 394240457 C Bi:4:055:5 -2 0
ffff810204580e40 394240545 S Bi:4:055:5 -115 16384 <
ffff810204580e40 394292454 C Bi:4:055:5 -2 0
ffff810204580e40 394292560 S Bi:4:055:5 -115 16384 <
ffff810204580e40 394344458 C Bi:4:055:5 -2 0
ffff810204580e40 394344536 S Bi:4:055:5 -115 16384 <
ffff810204580e40 394396465 C Bi:4:055:5 -2 0
ffff810204580e40 394396569 S Bi:4:055:5 -115 16384 <
ffff810204580e40 394448469 C Bi:4:055:5 -2 0
ffff810204580e40 394448585 S Bi:4:055:5 -115 16384 <
ffff810204580e40 394500468 C Bi:4:055:5 -2 0
ffff810204580e40 394500574 S Bi:4:055:5 -115 16384 <
ffff810204580e40 394552471 C Bi:4:055:5 -2 0
ffff810204580e40 394552590 S Bi:4:055:5 -115 16384 <
ffff810204580e40 394604474 C Bi:4:055:5 -2 0
ffff810204580e40 394604580 S Bi:4:055:5 -115 16384 <
ffff810204580e40 394656481 C Bi:4:055:5 -2 0
ffff810204580e40 394656600 S Bi:4:055:5 -115 16384 <
ffff810204580e40 394708479 C Bi:4:055:5 -2 0
ffff810204580e40 394708586 S Bi:4:055:5 -115 16384 <
ffff810204580e40 394760481 C Bi:4:055:5 -2 0
ffff810204580e40 394760565 S Bi:4:055:5 -115 16384 <
ffff810204580e40 394812485 C Bi:4:055:5 -2 0
ffff810204580e40 394812595 S Bi:4:055:5 -115 16384 <
ffff810204580e40 394864490 C Bi:4:055:5 -2 0
ffff810204580e40 394864601 S Bi:4:055:5 -115 16384 <
ffff810204580e40 394916490 C Bi:4:055:5 -2 0
ffff810204580e40 394916572 S Bi:4:055:5 -115 16384 <
ffff810204580e40 394968496 C Bi:4:055:5 -2 0
ffff810204580e40 394968602 S Bi:4:055:5 -115 16384 <
ffff810204580e40 395020495 C Bi:4:055:5 -2 0
ffff810204580e40 395020588 S Bi:4:055:5 -115 16384 <
ffff810204580e40 395072500 C Bi:4:055:5 -2 0
ffff810204580e40 395072610 S Bi:4:055:5 -115 16384 <
ffff810204580e40 395124501 C Bi:4:055:5 -2 0
ffff810204580e40 395124581 S Bi:4:055:5 -115 16384 <
ffff810204580e40 395176507 C Bi:4:055:5 -2 0
ffff810204580e40 395176628 S Bi:4:055:5 -115 16384 <
ffff810204580e40 395228507 C Bi:4:055:5 -2 0
ffff810204580e40 395228600 S Bi:4:055:5 -115 16384 <
ffff810204580e40 395280511 C Bi:4:055:5 -2 0
ffff810204580e40 395280616 S Bi:4:055:5 -115 16384 <
ffff810204580e40 395332513 C Bi:4:055:5 -2 0
ffff810204580e40 395332591 S Bi:4:055:5 -115 16384 <
ffff8101ef1153c0 395363680 S Bo:4:055:10 -115 31 = 55534243 f2060000 00000000 00000600 00000000 00000000 00000000 000000
ffff8101ef1153c0 395364452 C Bo:4:055:10 0 31 >
ffff8101ef1153c0 395364459 S Bi:4:055:9 -115 13 <
ffff8101ef1153c0 395365451 C Bi:4:055:9 0 13 = 55534253 f2060000 00000000 01
ffff8101ef1153c0 395365458 S Bo:4:055:10 -115 31 = 55534243 f3060000 12000000 80000603 00000012 00000000 00000000 000000
ffff8101ef1153c0 395366451 C Bo:4:055:10 0 31 >
ffff810037aaf0c0 395366459 S Bi:4:055:9 -115 18 <
ffff810037aaf0c0 395367450 C Bi:4:055:9 0 18 = 70000200 0000000a 00000000 3a000000 0000
ffff8101ef1153c0 395367458 S Bi:4:055:9 -115 13 <
ffff8101ef1153c0 395368451 C Bi:4:055:9 0 13 = 55534253 f3060000 00000000 00
ffff8101ef1153c0 395368484 S Bo:4:055:10 -115 31 = 55534243 f4060000 00000000 00000600 00000000 00000000 00000000 000000
ffff8101ef1153c0 395369451 C Bo:4:055:10 0 31 >
ffff8101ef1153c0 395369456 S Bi:4:055:9 -115 13 <
ffff8101ef1153c0 395370451 C Bi:4:055:9 0 13 = 55534253 f4060000 00000000 01
ffff8101ef1153c0 395370457 S Bo:4:055:10 -115 31 = 55534243 f5060000 12000000 80000603 00000012 00000000 00000000 000000
ffff8101ef1153c0 395371451 C Bo:4:055:10 0 31 >
ffff810037aaf0c0 395371457 S Bi:4:055:9 -115 18 <
ffff810037aaf0c0 395372451 C Bi:4:055:9 0 18 = 70000200 0000000a 00000000 3a000000 0000
ffff8101ef1153c0 395372458 S Bi:4:055:9 -115 13 <
ffff8101ef1153c0 395373451 C Bi:4:055:9 0 13 = 55534253 f5060000 00000000 00
ffff810204580e40 395384516 C Bi:4:055:5 -2 0
ffff810204580e40 395384624 S Bi:4:055:5 -115 16384 <
ffff810204580e40 395436519 C Bi:4:055:5 -2 0
ffff810204580e40 395436610 S Bi:4:055:5 -115 16384 <
ffff810204580e40 395488526 C Bi:4:055:5 -2 0
ffff810204580e40 395488638 S Bi:4:055:5 -115 16384 <
ffff810204580e40 395540525 C Bi:4:055:5 -2 0
ffff810204580e40 395540632 S Bi:4:055:5 -115 16384 <
ffff810204580e40 395592529 C Bi:4:055:5 -2 0
ffff810204580e40 395592636 S Bi:4:055:5 -115 16384 <
ffff810204580e40 395644531 C Bi:4:055:5 -2 0
ffff810204580e40 395644641 S Bi:4:055:5 -115 16384 <
ffff810204580e40 395696533 C Bi:4:055:5 -2 0
ffff810204580e40 395696647 S Bi:4:055:5 -115 16384 <
ffff810204580e40 395748536 C Bi:4:055:5 -2 0
ffff810204580e40 395748618 S Bi:4:055:5 -115 16384 <
ffff810204580e40 395800541 C Bi:4:055:5 -2 0
ffff810204580e40 395800657 S Bi:4:055:5 -115 16384 <
ffff810204580e40 395852543 C Bi:4:055:5 -2 0
ffff810204580e40 395852696 S Bi:4:055:5 -115 16384 <
ffff810204580e40 395904546 C Bi:4:055:5 -2 0
ffff810204580e40 395904655 S Bi:4:055:5 -115 16384 <
ffff810204580e40 395956553 C Bi:4:055:5 -2 0
ffff810204580e40 395956644 S Bi:4:055:5 -115 16384 <
ffff810204580e40 396008551 C Bi:4:055:5 -2 0
ffff810204580e40 396008660 S Bi:4:055:5 -115 16384 <
ffff810204580e40 396060554 C Bi:4:055:5 -2 0
ffff810204580e40 396060637 S Bi:4:055:5 -115 16384 <
ffff810204580e40 396112556 C Bi:4:055:5 -2 0
ffff810204580e40 396112661 S Bi:4:055:5 -115 16384 <
ffff810204580e40 396164561 C Bi:4:055:5 -2 0
ffff810204580e40 396164646 S Bi:4:055:5 -115 16384 <
ffff810204580e40 396216564 C Bi:4:055:5 -2 0
ffff810204580e40 396216673 S Bi:4:055:5 -115 16384 <
ffff810204580e40 396268571 C Bi:4:055:5 -2 0
ffff810204580e40 396268693 S Bi:4:055:5 -115 16384 <
ffff810204580e40 396320569 C Bi:4:055:5 -2 0
ffff810204580e40 396320675 S Bi:4:055:5 -115 16384 <
ffff810204580e40 396372576 C Bi:4:055:5 -2 0
ffff810204580e40 396372685 S Bi:4:055:5 -115 16384 <
ffff810204580e40 396424577 C Bi:4:055:5 -2 0
ffff810204580e40 396424683 S Bi:4:055:5 -115 16384 <
ffff810204580e40 396476581 C Bi:4:055:5 -2 0
ffff810204580e40 396476695 S Bi:4:055:5 -115 16384 <
ffff810204580e40 396528586 C Bi:4:055:5 -2 0
ffff810204580e40 396528703 S Bi:4:055:5 -115 16384 <
ffff810204580e40 396580583 C Bi:4:055:5 -2 0
ffff810204580e40 396580696 S Bi:4:055:5 -115 16384 <
ffff810204580e40 396632585 C Bi:4:055:5 -2 0
ffff810204580e40 396632695 S Bi:4:055:5 -115 16384 <
ffff810204580e40 396684588 C Bi:4:055:5 -2 0
ffff810204580e40 396684699 S Bi:4:055:5 -115 16384 <
ffff810204580e40 396736591 C Bi:4:055:5 -2 0
ffff810204580e40 396736671 S Bi:4:055:5 -115 16384 <
ffff810204580e40 396788596 C Bi:4:055:5 -2 0
ffff810204580e40 396788705 S Bi:4:055:5 -115 16384 <
ffff810204580e40 396840597 C Bi:4:055:5 -2 0
ffff810204580e40 396840704 S Bi:4:055:5 -115 16384 <
ffff810204580e40 396892605 C Bi:4:055:5 -2 0
ffff810204580e40 396892716 S Bi:4:055:5 -115 16384 <
ffff810204580e40 396944602 C Bi:4:055:5 -2 0
ffff810204580e40 396944679 S Bi:4:055:5 -115 16384 <
ffff810204580e40 396996608 C Bi:4:055:5 -2 0
ffff810204580e40 396996724 S Bi:4:055:5 -115 16384 <
ffff810204580e40 397048610 C Bi:4:055:5 -2 0
ffff810204580e40 397048704 S Bi:4:055:5 -115 16384 <
ffff810204580e40 397100611 C Bi:4:055:5 -2 0
ffff810204580e40 397100716 S Bi:4:055:5 -115 16384 <
ffff810204580e40 397152614 C Bi:4:055:5 -2 0
ffff810204580e40 397152694 S Bi:4:055:5 -115 16384 <
ffff810204580e40 397204617 C Bi:4:055:5 -2 0
ffff810204580e40 397204728 S Bi:4:055:5 -115 16384 <
ffff810204580e40 397256620 C Bi:4:055:5 -2 0
ffff810204580e40 397256705 S Bi:4:055:5 -115 16384 <
ffff810204580e40 397308623 C Bi:4:055:5 -2 0
ffff810204580e40 397308727 S Bi:4:055:5 -115 16384 <
ffff810204580e40 397360625 C Bi:4:055:5 -2 0
ffff8101ef1153c0 397360712 S Bo:4:055:10 -115 31 = 55534243 f6060000 00000000 00000600 00000000 00000000 00000000 000000
ffff810204580e40 397360717 S Bi:4:055:5 -115 16384 <
ffff8101ef1153c0 397361562 C Bo:4:055:10 0 31 >
ffff8101ef1153c0 397361569 S Bi:4:055:9 -115 13 <
ffff8101ef1153c0 397362561 C Bi:4:055:9 0 13 = 55534253 f6060000 00000000 01
ffff8101ef1153c0 397362568 S Bo:4:055:10 -115 31 = 55534243 f7060000 12000000 80000603 00000012 00000000 00000000 000000
ffff8101ef1153c0 397363562 C Bo:4:055:10 0 31 >
ffff8102044db240 397363571 S Bi:4:055:9 -115 18 <
ffff8102044db240 397364562 C Bi:4:055:9 0 18 = 70000200 0000000a 00000000 3a000000 0000
ffff8101ef1153c0 397364569 S Bi:4:055:9 -115 13 <
ffff8101ef1153c0 397365562 C Bi:4:055:9 0 13 = 55534253 f7060000 00000000 00
ffff8101ef1153c0 397365594 S Bo:4:055:10 -115 31 = 55534243 f8060000 00000000 00000600 00000000 00000000 00000000 000000
ffff8101ef1153c0 397366562 C Bo:4:055:10 0 31 >
ffff8101ef1153c0 397366567 S Bi:4:055:9 -115 13 <
ffff8101ef1153c0 397367562 C Bi:4:055:9 0 13 = 55534253 f8060000 00000000 01
ffff8101ef1153c0 397367568 S Bo:4:055:10 -115 31 = 55534243 f9060000 12000000 80000603 00000012 00000000 00000000 000000
ffff8101ef1153c0 397368562 C Bo:4:055:10 0 31 >
ffff8102044db240 397368569 S Bi:4:055:9 -115 18 <
ffff8102044db240 397369563 C Bi:4:055:9 0 18 = 70000200 0000000a 00000000 3a000000 0000
ffff8101ef1153c0 397369571 S Bi:4:055:9 -115 13 <
ffff8101ef1153c0 397370562 C Bi:4:055:9 0 13 = 55534253 f9060000 00000000 00
ffff810204580e40 397412629 C Bi:4:055:5 -2 0
ffff810204580e40 397412727 S Bi:4:055:5 -115 16384 <
ffff810204580e40 397464636 C Bi:4:055:5 -2 0
ffff810204580e40 397464754 S Bi:4:055:5 -115 16384 <
ffff810204580e40 397516635 C Bi:4:055:5 -2 0
ffff810204580e40 397516748 S Bi:4:055:5 -115 16384 <
ffff810204580e40 397568638 C Bi:4:055:5 -2 0
ffff810204580e40 397568732 S Bi:4:055:5 -115 16384 <
ffff810204580e40 397620640 C Bi:4:055:5 -2 0
ffff810204580e40 397620755 S Bi:4:055:5 -115 16384 <
ffff810204580e40 397672650 C Bi:4:055:5 -2 0
ffff810204580e40 397672771 S Bi:4:055:5 -115 16384 <
ffff810204580e40 397724646 C Bi:4:055:5 -2 0
ffff810204580e40 397724750 S Bi:4:055:5 -115 16384 <
ffff810204580e40 397776649 C Bi:4:055:5 -2 0
ffff810204580e40 397776757 S Bi:4:055:5 -115 16384 <
ffff810204580e40 397828655 C Bi:4:055:5 -2 0
ffff810204580e40 397828746 S Bi:4:055:5 -115 16384 <
ffff810204580e40 397880659 C Bi:4:055:5 -2 0
ffff810204580e40 397880767 S Bi:4:055:5 -115 16384 <
ffff810204580e40 397932657 C Bi:4:055:5 -2 0
ffff810204580e40 397932736 S Bi:4:055:5 -115 16384 <
ffff810204580e40 397984666 C Bi:4:055:5 -2 0
ffff810204580e40 397984781 S Bi:4:055:5 -115 16384 <
ffff810204580e40 398036664 C Bi:4:055:5 -2 0
ffff810204580e40 398036770 S Bi:4:055:5 -115 16384 <
ffff810204580e40 398088665 C Bi:4:055:5 -2 0
ffff810204580e40 398088770 S Bi:4:055:5 -115 16384 <
ffff810204580e40 398140670 C Bi:4:055:5 -2 0
ffff810204580e40 398140754 S Bi:4:055:5 -115 16384 <
ffff810204580e40 398192677 C Bi:4:055:5 -2 0
ffff810204580e40 398192786 S Bi:4:055:5 -115 16384 <
ffff810204580e40 398244679 C Bi:4:055:5 -2 0
ffff810204580e40 398244766 S Bi:4:055:5 -115 16384 <
ffff810204580e40 398296678 C Bi:4:055:5 -2 0
ffff810204580e40 398296783 S Bi:4:055:5 -115 16384 <
ffff810204580e40 398348683 C Bi:4:055:5 -2 0
ffff810204580e40 398348761 S Bi:4:055:5 -115 16384 <
ffff810204580e40 398400686 C Bi:4:055:5 -2 0
ffff810204580e40 398400787 S Bi:4:055:5 -115 16384 <
ffff810204580e40 398452686 C Bi:4:055:5 -2 0
ffff810204580e40 398452770 S Bi:4:055:5 -115 16384 <
ffff810204580e40 398505694 C Bi:4:055:5 -2 0
ffff810204580e40 398505812 S Bi:4:055:5 -115 16384 <
ffff810204580e40 398556692 C Bi:4:055:5 -2 0
ffff810204580e40 398556779 S Bi:4:055:5 -115 16384 <
ffff810204580e40 398608701 C Bi:4:055:5 -2 0
ffff810204580e40 398608817 S Bi:4:055:5 -115 16384 <
ffff810204580e40 398660702 C Bi:4:055:5 -2 0
ffff810044125cc0 398660810 S Bi:4:055:5 -115 16384 <
ffff810044125cc0 398712702 C Bi:4:055:5 -2 0
ffff810044125cc0 398712789 S Bi:4:055:5 -115 16384 <
ffff810044125cc0 398764707 C Bi:4:055:5 -2 0
ffff810044125cc0 398764803 S Bi:4:055:5 -115 16384 <
ffff810044125cc0 398816709 C Bi:4:055:5 -2 0
ffff810044125cc0 398816802 S Bi:4:055:5 -115 16384 <
ffff810044125cc0 398868716 C Bi:4:055:5 -2 0
ffff810044125cc0 398868851 S Bi:4:055:5 -115 16384 <
ffff810044125cc0 398920715 C Bi:4:055:5 -2 0
ffff810044125cc0 398920830 S Bi:4:055:5 -115 16384 <
ffff810044125cc0 398972718 C Bi:4:055:5 -2 0
ffff810044125cc0 398972848 S Bi:4:055:5 -115 16384 <
ffff810044125cc0 399024725 C Bi:4:055:5 -2 0
ffff8102045806c0 399024844 S Bi:4:055:5 -115 16384 <
ffff8102045806c0 399076722 C Bi:4:055:5 -2 0
ffff8102045806c0 399076812 S Bi:4:055:5 -115 16384 <
ffff8102045806c0 399128725 C Bi:4:055:5 -2 0
ffff8102045806c0 399128828 S Bi:4:055:5 -115 16384 <
ffff8102045806c0 399180729 C Bi:4:055:5 -2 0
ffff8102045806c0 399180815 S Bi:4:055:5 -115 16384 <
ffff8102045806c0 399232730 C Bi:4:055:5 -2 0
ffff8102045806c0 399232983 S Bi:4:055:5 -115 16384 <
ffff8102045806c0 399284733 C Bi:4:055:5 -2 0
ffff8102045806c0 399284840 S Bi:4:055:5 -115 16384 <
ffff8102045806c0 399336740 C Bi:4:055:5 -2 0
ffff8102045806c0 399336818 S Bi:4:055:5 -115 16384 <
ffff8101ef1153c0 399363678 S Bo:4:055:10 -115 31 = 55534243 fa060000 00000000 00000600 00000000 00000000 00000000 000000
ffff8101ef1153c0 399364674 C Bo:4:055:10 0 31 >
ffff8101ef1153c0 399364681 S Bi:4:055:9 -115 13 <
ffff8101ef1153c0 399365673 C Bi:4:055:9 0 13 = 55534253 fa060000 00000000 01
ffff8101ef1153c0 399365680 S Bo:4:055:10 -115 31 = 55534243 fb060000 12000000 80000603 00000012 00000000 00000000 000000
ffff8101ef1153c0 399366673 C Bo:4:055:10 0 31 >
ffff810044125540 399366682 S Bi:4:055:9 -115 18 <
ffff810044125540 399367673 C Bi:4:055:9 0 18 = 70000200 0000000a 00000000 3a000000 0000
ffff8101ef1153c0 399367681 S Bi:4:055:9 -115 13 <
ffff8101ef1153c0 399368673 C Bi:4:055:9 0 13 = 55534253 fb060000 00000000 00
ffff8101ef1153c0 399368707 S Bo:4:055:10 -115 31 = 55534243 fc060000 00000000 00000600 00000000 00000000 00000000 000000
ffff8101ef1153c0 399369673 C Bo:4:055:10 0 31 >
ffff8101ef1153c0 399369678 S Bi:4:055:9 -115 13 <
ffff8101ef1153c0 399370673 C Bi:4:055:9 0 13 = 55534253 fc060000 00000000 01
ffff8101ef1153c0 399370679 S Bo:4:055:10 -115 31 = 55534243 fd060000 12000000 80000603 00000012 00000000 00000000 000000
ffff8101ef1153c0 399371674 C Bo:4:055:10 0 31 >
ffff810044125540 399371681 S Bi:4:055:9 -115 18 <
ffff810044125540 399372673 C Bi:4:055:9 0 18 = 70000200 0000000a 00000000 3a000000 0000
ffff8101ef1153c0 399372680 S Bi:4:055:9 -115 13 <
ffff8101ef1153c0 399373674 C Bi:4:055:9 0 13 = 55534253 fd060000 00000000 00
ffff8102045806c0 399388741 C Bi:4:055:5 -2 0
ffff8102045806c0 399388860 S Bi:4:055:5 -115 16384 <
ffff8102045806c0 399440742 C Bi:4:055:5 -2 0
ffff8102045806c0 399440838 S Bi:4:055:5 -115 16384 <
ffff8102045806c0 399492750 C Bi:4:055:5 -2 0
ffff8102045806c0 399492861 S Bi:4:055:5 -115 16384 <
ffff8102045806c0 399544755 C Bi:4:055:5 -2 0
ffff8102045806c0 399544866 S Bi:4:055:5 -115 16384 <
ffff8102045806c0 399596750 C Bi:4:055:5 -2 0
ffff8102045806c0 399596856 S Bi:4:055:5 -115 16384 <
ffff8102045806c0 399648761 C Bi:4:055:5 -2 0
ffff8102045806c0 399648911 S Bi:4:055:5 -115 16384 <
ffff8102045806c0 399700760 C Bi:4:055:5 -2 0
ffff8102045806c0 399700879 S Bi:4:055:5 -115 16384 <
ffff8102045806c0 399752763 C Bi:4:055:5 -2 0
ffff8102045806c0 399752820 S Bi:4:055:5 -115 16384 <
ffff8102045806c0 399804766 C Bi:4:055:5 -2 0
ffff8102045806c0 399804863 S Bi:4:055:5 -115 16384 <
ffff8102045806c0 399856772 C Bi:4:055:5 -2 0
ffff8102045806c0 399856825 S Bi:4:055:5 -115 16384 <
ffff8102045806c0 399908774 C Bi:4:055:5 -2 0
ffff8102045806c0 399908863 S Bi:4:055:5 -115 16384 <
ffff8102045806c0 399960776 C Bi:4:055:5 -2 0
ffff8102045806c0 399960865 S Bi:4:055:5 -115 16384 <
ffff8102045806c0 400012779 C Bi:4:055:5 -2 0
ffff8102045806c0 400012859 S Bi:4:055:5 -115 16384 <
ffff8102045806c0 400064782 C Bi:4:055:5 -2 0
ffff8102045806c0 400064836 S Bi:4:055:5 -115 16384 <
ffff8102045806c0 400116783 C Bi:4:055:5 -2 0
ffff8102045806c0 400116867 S Bi:4:055:5 -115 16384 <
ffff8102045806c0 400168786 C Bi:4:055:5 -2 0
ffff8102045806c0 400168849 S Bi:4:055:5 -115 16384 <
ffff8102045806c0 400220789 C Bi:4:055:5 -2 0
ffff8102045806c0 400220866 S Bi:4:055:5 -115 16384 <
ffff8102045806c0 400272793 C Bi:4:055:5 -2 0
ffff8102045806c0 400272848 S Bi:4:055:5 -115 16384 <
ffff8102045806c0 400324795 C Bi:4:055:5 -2 0
ffff8102045806c0 400324875 S Bi:4:055:5 -115 16384 <
ffff8102045806c0 400376801 C Bi:4:055:5 -2 0
ffff8102045806c0 400376922 S Bi:4:055:5 -115 16384 <
ffff8102045806c0 400428803 C Bi:4:055:5 -2 0
ffff8102045806c0 400428904 S Bi:4:055:5 -115 16384 <
ffff8102045806c0 400480805 C Bi:4:055:5 -2 0
ffff8102045806c0 400480869 S Bi:4:055:5 -115 16384 <
ffff8102045806c0 400532808 C Bi:4:055:5 -2 0
ffff8102045806c0 400532922 S Bi:4:055:5 -115 16384 <
ffff8102045806c0 400584811 C Bi:4:055:5 -2 0
ffff8102045806c0 400584866 S Bi:4:055:5 -115 16384 <
ffff8102045806c0 400636812 C Bi:4:055:5 -2 0
ffff8102045806c0 400636898 S Bi:4:055:5 -115 16384 <
ffff8102045806c0 400688817 C Bi:4:055:5 -2 0
ffff8102045806c0 400688930 S Bi:4:055:5 -115 16384 <
ffff8102045806c0 400740817 C Bi:4:055:5 -2 0
ffff8102045806c0 400740899 S Bi:4:055:5 -115 16384 <
ffff8102045806c0 400792820 C Bi:4:055:5 -2 0
ffff8102045806c0 400792916 S Bi:4:055:5 -115 16384 <
ffff8102045806c0 400844824 C Bi:4:055:5 -2 0
ffff8102045806c0 400844903 S Bi:4:055:5 -115 16384 <
ffff8102045806c0 400896826 C Bi:4:055:5 -2 0
ffff8102045806c0 400896931 S Bi:4:055:5 -115 16384 <
ffff8102045806c0 400948833 C Bi:4:055:5 -2 0
ffff8102045806c0 400948923 S Bi:4:055:5 -115 16384 <
ffff8102045806c0 401000832 C Bi:4:055:5 -2 0
ffff8102045806c0 401000937 S Bi:4:055:5 -115 16384 <
ffff8102045806c0 401052835 C Bi:4:055:5 -2 0
ffff8102045806c0 401052913 S Bi:4:055:5 -115 16384 <
ffff8102045806c0 401104837 C Bi:4:055:5 -2 0
ffff8102045806c0 401104951 S Bi:4:055:5 -115 16384 <
ffff8102045806c0 401156839 C Bi:4:055:5 -2 0
ffff8102045806c0 401156921 S Bi:4:055:5 -115 16384 <
ffff8102045806c0 401208845 C Bi:4:055:5 -2 0
ffff8102045806c0 401208952 S Bi:4:055:5 -115 16384 <
ffff8102045806c0 401260848 C Bi:4:055:5 -2 0
ffff8102045806c0 401260922 S Bi:4:055:5 -115 16384 <
ffff8102045806c0 401312848 C Bi:4:055:5 -2 0
ffff8102045806c0 401312946 S Bi:4:055:5 -115 16384 <
ffff810204580300 401344951 S Bo:4:055:6 -115 4 = 4154480d
ffff810204580300 401345788 C Bo:4:055:6 0 4 >
ffff810204580300 401345839 S Bi:4:055:5 -115 16384 <
ffff8101ef1153c0 401363724 S Bo:4:055:10 -115 31 = 55534243 fe060000 00000000 00000600 00000000 00000000 00000000 000000
ffff8102045806c0 401364854 C Bi:4:055:5 -2 0
ffff8101ef1153c0 401364859 C Bo:4:055:10 0 31 >
ffff8101df0e3a80 401364966 S Bi:4:055:5 -115 16384 <
ffff8101ef1153c0 401365012 S Bi:4:055:9 -115 13 <
ffff8101ef1153c0 401365786 C Bi:4:055:9 0 13 = 55534253 fe060000 00000000 01
ffff8101ef1153c0 401365794 S Bo:4:055:10 -115 31 = 55534243 ff060000 12000000 80000603 00000012 00000000 00000000 000000
ffff8101ef1153c0 401366785 C Bo:4:055:10 0 31 >
ffff8101df0e3780 401366793 S Bi:4:055:9 -115 18 <
ffff8101df0e3780 401367785 C Bi:4:055:9 0 18 = 70000200 0000000a 00000000 3a000000 0000
ffff8101ef1153c0 401367793 S Bi:4:055:9 -115 13 <
ffff8101ef1153c0 401368785 C Bi:4:055:9 0 13 = 55534253 ff060000 00000000 00
ffff8101ef1153c0 401368824 S Bo:4:055:10 -115 31 = 55534243 00070000 00000000 00000600 00000000 00000000 00000000 000000
ffff8101ef1153c0 401369785 C Bo:4:055:10 0 31 >
ffff8101ef1153c0 401369790 S Bi:4:055:9 -115 13 <
ffff8101ef1153c0 401370785 C Bi:4:055:9 0 13 = 55534253 00070000 00000000 01
ffff8101ef1153c0 401370791 S Bo:4:055:10 -115 31 = 55534243 01070000 12000000 80000603 00000012 00000000 00000000 000000
ffff8101ef1153c0 401371787 C Bo:4:055:10 0 31 >
ffff8101df0e3780 401372116 S Bi:4:055:9 -115 18 <
ffff8101df0e3780 401372801 C Bi:4:055:9 0 18 = 70000200 0000000a 00000000 3a000000 0000
ffff8101ef1153c0 401372827 S Bi:4:055:9 -115 13 <
ffff8101ef1153c0 401373795 C Bi:4:055:9 0 13 = 55534253 01070000 00000000 00
ffff810204580300 401399861 C Bi:4:055:5 -2 0
ffff8101df0e3a80 401416859 C Bi:4:055:5 -2 0
ffff81021279b900 401416986 S Bi:4:055:5 -115 16384 <
ffff81021279b900 401468860 C Bi:4:055:5 -2 0
ffff81021279b900 401468932 S Bi:4:055:5 -115 16384 <
ffff81021279b900 401520863 C Bi:4:055:5 -2 0
ffff81021279b900 401520969 S Bi:4:055:5 -115 16384 <
ffff81021279b900 401572864 C Bi:4:055:5 -2 0
ffff81021279b900 401572946 S Bi:4:055:5 -115 16384 <
ffff81021279b900 401624867 C Bi:4:055:5 -2 0
ffff81021279b900 401624984 S Bi:4:055:5 -115 16384 <
ffff81021279b900 401676872 C Bi:4:055:5 -2 0
ffff81021279b900 401676984 S Bi:4:055:5 -115 16384 <
ffff81021279b900 401727872 C Bi:4:055:5 -2 0
ffff81021279b900 401727953 S Bi:4:055:5 -115 16384 <
ffff81021279b900 401780875 C Bi:4:055:5 -2 0
ffff81021279b900 401780933 S Bi:4:055:5 -115 16384 <
ffff81021279b900 401832877 C Bi:4:055:5 -2 0
ffff81021279b900 401832974 S Bi:4:055:5 -115 16384 <
ffff81021279b900 401885882 C Bi:4:055:5 -2 0
ffff81021279b900 401885998 S Bi:4:055:5 -115 16384 <
ffff81021279b900 401941892 C Bi:4:055:5 -2 0
ffff8101faf8a900 401942047 S Bi:4:055:5 -115 16384 <
ffff8101faf8a900 401995886 C Bi:4:055:5 -2 0
ffff8101330b3540 401996256 S Bi:4:055:5 -115 16384 <
ffff8101330b3540 402047888 C Bi:4:055:5 -2 0
ffff8101330b3540 402048029 S Bi:4:055:5 -115 16384 <
ffff8101330b3540 402099891 C Bi:4:055:5 -2 0
ffff8101330b3540 402100125 S Bi:4:055:5 -115 16384 <
ffff8101330b3540 402151895 C Bi:4:055:5 -2 0
ffff8101330b3540 402152034 S Bi:4:055:5 -115 16384 <
ffff8101330b3540 402203895 C Bi:4:055:5 -2 0
ffff8101330b3540 402204022 S Bi:4:055:5 -115 16384 <
ffff8101330b3540 402255903 C Bi:4:055:5 -2 0
ffff8101330b3540 402256045 S Bi:4:055:5 -115 16384 <
ffff8101330b3540 402307903 C Bi:4:055:5 -2 0
ffff8101330b3540 402308034 S Bi:4:055:5 -115 16384 <
ffff8101330b3540 402359906 C Bi:4:055:5 -2 0
ffff8101330b3540 402360043 S Bi:4:055:5 -115 16384 <
ffff8101330b3540 402411910 C Bi:4:055:5 -2 0
ffff8101df14be40 402412172 S Bi:4:055:5 -115 16384 <
ffff8101df14be40 402463913 C Bi:4:055:5 -2 0
ffff8101df14be40 402464058 S Bi:4:055:5 -115 16384 <
ffff8101df14be40 402515914 C Bi:4:055:5 -2 0
ffff81018511ad80 402516057 S Bi:4:055:5 -115 16384 <
ffff81018511ad80 402567923 C Bi:4:055:5 -2 0
ffff81018511ad80 402568076 S Bi:4:055:5 -115 16384 <
ffff81018511ad80 402619920 C Bi:4:055:5 -2 0
ffff81018511ad80 402620065 S Bi:4:055:5 -115 16384 <
ffff81018511ad80 402671923 C Bi:4:055:5 -2 0
ffff81018511ad80 402672063 S Bi:4:055:5 -115 16384 <
ffff81018511ad80 402723926 C Bi:4:055:5 -2 0
ffff81018511ad80 402724513 S Bi:4:055:5 -115 16384 <
ffff81018511ad80 402775932 C Bi:4:055:5 -2 0
ffff81018511ad80 402776075 S Bi:4:055:5 -115 16384 <
ffff81018511ad80 402827935 C Bi:4:055:5 -2 0
ffff81018511ad80 402828083 S Bi:4:055:5 -115 16384 <
ffff81018511ad80 402879936 C Bi:4:055:5 -2 0
ffff81018511ad80 402880076 S Bi:4:055:5 -115 16384 <
ffff81018511ad80 402931942 C Bi:4:055:5 -2 0
ffff81018511ad80 402932088 S Bi:4:055:5 -115 16384 <
ffff81018511ad80 402984948 C Bi:4:055:5 -2 0
ffff810089b61840 402985094 S Bi:4:055:5 -115 16384 <
ffff810089b61840 403035948 C Bi:4:055:5 -2 0
ffff810089b61840 403036113 S Bi:4:055:5 -115 16384 <
ffff810089b61840 403087948 C Bi:4:055:5 -2 0
ffff810089b61840 403088097 S Bi:4:055:5 -115 16384 <
ffff810089b61840 403139957 C Bi:4:055:5 -2 0
ffff810089b61840 403140111 S Bi:4:055:5 -115 16384 <
ffff810089b61840 403195952 C Bi:4:055:5 -2 0
ffff810089b61840 403196092 S Bi:4:055:5 -115 16384 <
ffff810089b61840 403247956 C Bi:4:055:5 -2 0
ffff810089b61840 403248095 S Bi:4:055:5 -115 16384 <
ffff810089b61840 403299958 C Bi:4:055:5 -2 0
ffff810089b61840 403300100 S Bi:4:055:5 -115 16384 <
ffff810089b61840 403351965 C Bi:4:055:5 -2 0
ffff810089b61840 403352105 S Bi:4:055:5 -115 16384 <
ffff8101ef1153c0 403363739 S Bo:4:055:10 -115 31 = 55534243 02070000 00000000 00000600 00000000 00000000 00000000 000000
ffff8101ef1153c0 403363898 C Bo:4:055:10 0 31 >
ffff8101ef1153c0 403363906 S Bi:4:055:9 -115 13 <
ffff8101ef1153c0 403364896 C Bi:4:055:9 0 13 = 55534253 02070000 00000000 01
ffff8101ef1153c0 403364903 S Bo:4:055:10 -115 31 = 55534243 03070000 12000000 80000603 00000012 00000000 00000000 000000
ffff8101ef1153c0 403365897 C Bo:4:055:10 0 31 >
ffff810089b61c00 403365906 S Bi:4:055:9 -115 18 <
ffff810089b61c00 403366896 C Bi:4:055:9 0 18 = 70000200 0000000a 00000000 3a000000 0000
ffff8101ef1153c0 403366904 S Bi:4:055:9 -115 13 <
ffff8101ef1153c0 403367897 C Bi:4:055:9 0 13 = 55534253 03070000 00000000 00
ffff8101ef1153c0 403367935 S Bo:4:055:10 -115 31 = 55534243 04070000 00000000 00000600 00000000 00000000 00000000 000000
ffff8101ef1153c0 403368896 C Bo:4:055:10 0 31 >
ffff8101ef1153c0 403368901 S Bi:4:055:9 -115 13 <
ffff8101ef1153c0 403369896 C Bi:4:055:9 0 13 = 55534253 04070000 00000000 01
ffff8101ef1153c0 403369902 S Bo:4:055:10 -115 31 = 55534243 05070000 12000000 80000603 00000012 00000000 00000000 000000
ffff8101ef1153c0 403370896 C Bo:4:055:10 0 31 >
ffff810089b61c00 403370904 S Bi:4:055:9 -115 18 <
ffff810089b61c00 403371898 C Bi:4:055:9 0 18 = 70000200 0000000a 00000000 3a000000 0000
ffff8101ef1153c0 403372128 S Bi:4:055:9 -115 13 <
ffff8101ef1153c0 403372902 C Bi:4:055:9 0 13 = 55534253 05070000 00000000 00
ffff810089b61840 403403967 C Bi:4:055:5 -2 0
ffff8100896e1600 403404154 S Bi:4:055:5 -115 16384 <
ffff8100896e1600 403455968 C Bi:4:055:5 -2 0
ffff8100896e1600 403456108 S Bi:4:055:5 -115 16384 <
ffff8100896e1600 403507970 C Bi:4:055:5 -2 0
ffff8100896e1600 403508115 S Bi:4:055:5 -115 16384 <
ffff8100896e1600 403559975 C Bi:4:055:5 -2 0
ffff8100896e1600 403560117 S Bi:4:055:5 -115 16384 <
ffff8100896e1600 403612985 C Bi:4:055:5 -2 0
ffff8100896e1600 403615291 S Bi:4:055:5 -115 16384 <
ffff8100896e1600 403668980 C Bi:4:055:5 -2 0
ffff81019bd8a600 403669102 S Bi:4:055:5 -115 16384 <
ffff81019bd8a600 403720985 C Bi:4:055:5 -2 0
ffff81019bd8a600 403721094 S Bi:4:055:5 -115 16384 <
ffff81019bd8a600 403772987 C Bi:4:055:5 -2 0
ffff81019bd8a600 403773052 S Bi:4:055:5 -115 16384 <
ffff81019bd8a600 403824989 C Bi:4:055:5 -2 0
ffff81019bd8a600 403825039 S Bi:4:055:5 -115 16384 <
ffff81019bd8a600 403876994 C Bi:4:055:5 -2 0
ffff81019bd8a600 403877112 S Bi:4:055:5 -115 16384 <
ffff81019bd8a600 403928996 C Bi:4:055:5 -2 0
ffff81019bd8a600 403929049 S Bi:4:055:5 -115 16384 <
ffff81019bd8a600 403981001 C Bi:4:055:5 -2 0
ffff81019bd8a600 403981072 S Bi:4:055:5 -115 16384 <
ffff81019bd8a600 404033003 C Bi:4:055:5 -2 0
ffff81019bd8a600 404033053 S Bi:4:055:5 -115 16384 <
ffff81019bd8a600 404085004 C Bi:4:055:5 -2 0
ffff81019bd8a600 404085069 S Bi:4:055:5 -115 16384 <
ffff81019bd8a600 404137010 C Bi:4:055:5 -2 0
ffff81019bd8a600 404137060 S Bi:4:055:5 -115 16384 <
ffff81019bd8a600 404189011 C Bi:4:055:5 -2 0
ffff81019bd8a600 404189153 S Bi:4:055:5 -115 16384 <
ffff81019bd8a600 404240021 C Bi:4:055:5 -2 0
ffff81020441b6c0 404240176 S Bi:4:055:5 -115 16384 <
ffff81020441b6c0 404291015 C Bi:4:055:5 -2 0
ffff81020441b6c0 404291156 S Bi:4:055:5 -115 16384 <
ffff81020441b6c0 404344020 C Bi:4:055:5 -2 0
ffff81020441b6c0 404344162 S Bi:4:055:5 -115 16384 <
ffff81020441b6c0 404396018 C Bi:4:055:5 -2 0
ffff81012b753000 404396167 S Bi:4:055:5 -115 16384 <
ffff81012b753000 404449026 C Bi:4:055:5 -2 0
ffff81012b753000 404449173 S Bi:4:055:5 -115 16384 <
ffff81012b753000 404500025 C Bi:4:055:5 -2 0
ffff8101df21a0c0 404500166 S Bi:4:055:5 -115 16384 <
ffff8101df21a0c0 404553030 C Bi:4:055:5 -2 0
ffff81019bcb6840 404553150 S Bi:4:055:5 -115 16384 <
ffff81019bcb6840 404605033 C Bi:4:055:5 -2 0
ffff81019bcb6840 404605107 S Bi:4:055:5 -115 16384 <
ffff81019bcb6840 404657035 C Bi:4:055:5 -2 0
ffff81019bcb6840 404657151 S Bi:4:055:5 -115 16384 <
ffff81019bcb6840 404709040 C Bi:4:055:5 -2 0
ffff81019bcb6840 404709108 S Bi:4:055:5 -115 16384 <
ffff81019bcb6840 404761043 C Bi:4:055:5 -2 0
ffff81019bcb6840 404761128 S Bi:4:055:5 -115 16384 <
ffff81019bcb6840 404813046 C Bi:4:055:5 -2 0
ffff81019bcb6840 404813131 S Bi:4:055:5 -115 16384 <
ffff81019bcb6840 404865050 C Bi:4:055:5 -2 0
ffff81019bcb6840 404865103 S Bi:4:055:5 -115 16384 <
ffff81019bcb6840 404917052 C Bi:4:055:5 -2 0
ffff81019bcb6840 404917128 S Bi:4:055:5 -115 16384 <
ffff81019bcb6840 404969055 C Bi:4:055:5 -2 0
ffff81019bcb6840 404969115 S Bi:4:055:5 -115 16384 <
ffff81019bcb6840 405021056 C Bi:4:055:5 -2 0
ffff81019bcb6840 405021132 S Bi:4:055:5 -115 16384 <
ffff81019bcb6840 405073059 C Bi:4:055:5 -2 0
ffff81019bcb6840 405073114 S Bi:4:055:5 -115 16384 <
ffff81019bcb6840 405125062 C Bi:4:055:5 -2 0
ffff81019bcb6840 405125145 S Bi:4:055:5 -115 16384 <
ffff81019bcb6840 405177065 C Bi:4:055:5 -2 0
ffff81019bcb6840 405177118 S Bi:4:055:5 -115 16384 <
ffff81019bcb6840 405229069 C Bi:4:055:5 -2 0
ffff81019bcb6840 405229142 S Bi:4:055:5 -115 16384 <
ffff81019bcb6840 405281071 C Bi:4:055:5 -2 0
ffff81019bcb6840 405281126 S Bi:4:055:5 -115 16384 <
ffff81019bcb6840 405333075 C Bi:4:055:5 -2 0
ffff81019bcb6840 405333154 S Bi:4:055:5 -115 16384 <
ffff8101ef1153c0 405363732 S Bo:4:055:10 -115 31 = 55534243 06070000 00000000 00000600 00000000 00000000 00000000 000000
ffff8101ef1153c0 405364008 C Bo:4:055:10 0 31 >
ffff8101ef1153c0 405364020 S Bi:4:055:9 -115 13 <
ffff8101ef1153c0 405365011 C Bi:4:055:9 0 13 = 55534253 06070000 00000000 01
ffff8101ef1153c0 405365049 S Bo:4:055:10 -115 31 = 55534243 07070000 12000000 80000603 00000012 00000000 00000000 000000
ffff8101ef1153c0 405366007 C Bo:4:055:10 0 31 >
ffff81018530bd80 405366017 S Bi:4:055:9 -115 18 <
ffff81018530bd80 405367007 C Bi:4:055:9 0 18 = 70000200 0000000a 00000000 3a000000 0000
ffff8101ef1153c0 405367015 S Bi:4:055:9 -115 13 <
ffff8101ef1153c0 405368008 C Bi:4:055:9 0 13 = 55534253 07070000 00000000 00
ffff8101ef1153c0 405368050 S Bo:4:055:10 -115 31 = 55534243 08070000 00000000 00000600 00000000 00000000 00000000 000000
ffff8101ef1153c0 405369008 C Bo:4:055:10 0 31 >
ffff8101ef1153c0 405369013 S Bi:4:055:9 -115 13 <
ffff8101ef1153c0 405370007 C Bi:4:055:9 0 13 = 55534253 08070000 00000000 01
ffff8101ef1153c0 405370014 S Bo:4:055:10 -115 31 = 55534243 09070000 12000000 80000603 00000012 00000000 00000000 000000
ffff8101ef1153c0 405371008 C Bo:4:055:10 0 31 >
ffff81018530bd80 405371015 S Bi:4:055:9 -115 18 <
ffff81018530bd80 405372008 C Bi:4:055:9 0 18 = 70000200 0000000a 00000000 3a000000 0000
ffff8101ef1153c0 405372019 S Bi:4:055:9 -115 13 <
ffff8101ef1153c0 405373010 C Bi:4:055:9 0 13 = 55534253 09070000 00000000 00
ffff81019bcb6840 405385078 C Bi:4:055:5 -2 0
ffff81019bcb6840 405385131 S Bi:4:055:5 -115 16384 <
ffff81019bcb6840 405437080 C Bi:4:055:5 -2 0
ffff81019bcb6840 405437173 S Bi:4:055:5 -115 16384 <
ffff81019bcb6840 405489082 C Bi:4:055:5 -2 0
ffff81019bcb6840 405489140 S Bi:4:055:5 -115 16384 <
ffff81019bcb6840 405541087 C Bi:4:055:5 -2 0
ffff81019bcb6840 405541164 S Bi:4:055:5 -115 16384 <
ffff81019bcb6840 405593089 C Bi:4:055:5 -2 0
ffff81019bcb6840 405593199 S Bi:4:055:5 -115 16384 <
ffff81019bcb6840 405645090 C Bi:4:055:5 -2 0
ffff81019bcb6840 405645180 S Bi:4:055:5 -115 16384 <
ffff81019bcb6840 405697094 C Bi:4:055:5 -2 0
ffff81019bcb6840 405697154 S Bi:4:055:5 -115 16384 <
ffff81019bcb6840 405749095 C Bi:4:055:5 -2 0
ffff81019bcb6840 405749174 S Bi:4:055:5 -115 16384 <
ffff81019bcb6840 405801100 C Bi:4:055:5 -2 0
ffff81019bcb6840 405801154 S Bi:4:055:5 -115 16384 <
ffff81019bcb6840 405853102 C Bi:4:055:5 -2 0
ffff81019bcb6840 405853198 S Bi:4:055:5 -115 16384 <
ffff81019bcb6840 405905105 C Bi:4:055:5 -2 0
ffff81019bcb6840 405905157 S Bi:4:055:5 -115 16384 <
ffff81019bcb6840 405957110 C Bi:4:055:5 -2 0
ffff81019bcb6840 405957219 S Bi:4:055:5 -115 16384 <
ffff81019bcb6840 406009112 C Bi:4:055:5 -2 0
ffff81019bcb6840 406009213 S Bi:4:055:5 -115 16384 <
ffff81019bcb6840 406061115 C Bi:4:055:5 -2 0
ffff81019bcb6840 406061222 S Bi:4:055:5 -115 16384 <
ffff81019bcb6840 406113118 C Bi:4:055:5 -2 0
ffff81019bcb6840 406113177 S Bi:4:055:5 -115 16384 <
ffff81019bcb6840 406165120 C Bi:4:055:5 -2 0
ffff810044125b40 406165268 S Bi:4:055:5 -115 16384 <
ffff810044125b40 406216121 C Bi:4:055:5 -2 0
ffff810044125b40 406216259 S Bi:4:055:5 -115 16384 <
ffff810044125b40 406268123 C Bi:4:055:5 -2 0
ffff810044125b40 406268258 S Bi:4:055:5 -115 16384 <
ffff810044125b40 406320127 C Bi:4:055:5 -2 0
ffff810044125b40 406320255 S Bi:4:055:5 -115 16384 <
ffff810044125b40 406372128 C Bi:4:055:5 -2 0
ffff810044125b40 406372237 S Bi:4:055:5 -115 16384 <
ffff810044125b40 406424126 C Bi:4:055:5 -2 0
ffff810044125b40 406424193 S Bi:4:055:5 -115 16384 <
ffff810044125b40 406476134 C Bi:4:055:5 -2 0
ffff810044125b40 406476250 S Bi:4:055:5 -115 16384 <
ffff810044125b40 406528137 C Bi:4:055:5 -2 0
ffff810044125b40 406528274 S Bi:4:055:5 -115 16384 <
ffff810044125b40 406580141 C Bi:4:055:5 -2 0
ffff810044125b40 406580270 S Bi:4:055:5 -115 16384 <
ffff810044125b40 406633145 C Bi:4:055:5 -2 0
ffff81019bcb6000 406633265 S Bi:4:055:5 -115 16384 <
ffff81019bcb6000 406685148 C Bi:4:055:5 -2 0
ffff81019bcb6000 406685264 S Bi:4:055:5 -115 16384 <
ffff81019bcb6000 406736150 C Bi:4:055:5 -2 0
ffff81004a3a39c0 406736288 S Bi:4:055:5 -115 16384 <
ffff81004a3a39c0 406788156 C Bi:4:055:5 -2 0
ffff81004a3a39c0 406788288 S Bi:4:055:5 -115 16384 <
ffff81004a3a39c0 406840155 C Bi:4:055:5 -2 0
ffff81004a3a39c0 406840277 S Bi:4:055:5 -115 16384 <
ffff81004a3a39c0 406892157 C Bi:4:055:5 -2 0
ffff81004a3a39c0 406892282 S Bi:4:055:5 -115 16384 <
ffff81004a3a39c0 406944161 C Bi:4:055:5 -2 0
ffff81004a3a39c0 406944293 S Bi:4:055:5 -115 16384 <
ffff81004a3a39c0 406996167 C Bi:4:055:5 -2 0
ffff8101eb79db40 406996306 S Bi:4:055:5 -115 16384 <
ffff8101eb79db40 407048167 C Bi:4:055:5 -2 0
ffff8101eb79db40 407048292 S Bi:4:055:5 -115 16384 <
ffff8101eb79db40 407100170 C Bi:4:055:5 -2 0
ffff8101eb79db40 407100311 S Bi:4:055:5 -115 16384 <
ffff8101eb79db40 407152174 C Bi:4:055:5 -2 0
ffff8101eb79db40 407152314 S Bi:4:055:5 -115 16384 <
ffff8101eb79db40 407204182 C Bi:4:055:5 -2 0
ffff8101eb79db40 407204331 S Bi:4:055:5 -115 16384 <
ffff8101eb79db40 407256179 C Bi:4:055:5 -2 0
ffff8101eb79db40 407256320 S Bi:4:055:5 -115 16384 <
ffff8101eb79db40 407308180 C Bi:4:055:5 -2 0
ffff8101eb79db40 407308319 S Bi:4:055:5 -115 16384 <
ffff8101eb79db40 407360187 C Bi:4:055:5 -2 0
ffff8101eb79db40 407360344 S Bi:4:055:5 -115 16384 <
ffff8101ef1153c0 407363738 S Bo:4:055:10 -115 31 = 55534243 0a070000 00000000 00000600 00000000 00000000 00000000 000000
ffff8101ef1153c0 407364119 C Bo:4:055:10 0 31 >
ffff8101ef1153c0 407364126 S Bi:4:055:9 -115 13 <
ffff8101ef1153c0 407365124 C Bi:4:055:9 0 13 = 55534253 0a070000 00000000 01
ffff8101ef1153c0 407365169 S Bo:4:055:10 -115 31 = 55534243 0b070000 12000000 80000603 00000012 00000000 00000000 000000
ffff8101ef1153c0 407366119 C Bo:4:055:10 0 31 >
ffff8101eb79d540 407366129 S Bi:4:055:9 -115 18 <
ffff8101eb79d540 407367119 C Bi:4:055:9 0 18 = 70000200 0000000a 00000000 3a000000 0000
ffff8101ef1153c0 407367126 S Bi:4:055:9 -115 13 <
ffff8101ef1153c0 407368119 C Bi:4:055:9 0 13 = 55534253 0b070000 00000000 00
ffff8101ef1153c0 407368162 S Bo:4:055:10 -115 31 = 55534243 0c070000 00000000 00000600 00000000 00000000 00000000 000000
ffff8101ef1153c0 407369119 C Bo:4:055:10 0 31 >
ffff8101ef1153c0 407369124 S Bi:4:055:9 -115 13 <
ffff8101ef1153c0 407370119 C Bi:4:055:9 0 13 = 55534253 0c070000 00000000 01
ffff8101ef1153c0 407370125 S Bo:4:055:10 -115 31 = 55534243 0d070000 12000000 80000603 00000012 00000000 00000000 000000
ffff8101ef1153c0 407371119 C Bo:4:055:10 0 31 >
ffff8101eb79d540 407371126 S Bi:4:055:9 -115 18 <
ffff8101eb79d540 407372119 C Bi:4:055:9 0 18 = 70000200 0000000a 00000000 3a000000 0000
ffff8101ef1153c0 407372131 S Bi:4:055:9 -115 13 <
ffff8101ef1153c0 407373124 C Bi:4:055:9 0 13 = 55534253 0d070000 00000000 00
ffff8101eb79db40 407412186 C Bi:4:055:5 -2 0
ffff8101eb79db40 407412330 S Bi:4:055:5 -115 16384 <
ffff8101eb79db40 407464191 C Bi:4:055:5 -2 0
ffff8101eb79db40 407464332 S Bi:4:055:5 -115 16384 <
ffff8101eb79db40 407516193 C Bi:4:055:5 -2 0
ffff8101fae8b240 407516338 S Bi:4:055:5 -115 16384 <
ffff8101fae8b240 407568197 C Bi:4:055:5 -2 0
ffff8101fae8b240 407568336 S Bi:4:055:5 -115 16384 <
ffff8101fae8b240 407624211 C Bi:4:055:5 -2 0
ffff8101fae8b240 407624376 S Bi:4:055:5 -115 16384 <
ffff8101fae8b240 407677213 C Bi:4:055:5 -2 0
ffff81019bcb6300 407677342 S Bi:4:055:5 -115 16384 <
ffff81019bcb6300 407729207 C Bi:4:055:5 -2 0
ffff81019bcb6300 407729327 S Bi:4:055:5 -115 16384 <
ffff81019bcb6300 407781210 C Bi:4:055:5 -2 0
ffff81019bcb6300 407781324 S Bi:4:055:5 -115 16384 <
ffff81019bcb6300 407833220 C Bi:4:055:5 -2 0
ffff81019bcb6300 407833337 S Bi:4:055:5 -115 16384 <
ffff81019bcb6300 407885215 C Bi:4:055:5 -2 0
ffff81019bcb6300 407885319 S Bi:4:055:5 -115 16384 <
ffff81019bcb6300 407936220 C Bi:4:055:5 -2 0
ffff81019bcb6300 407936320 S Bi:4:055:5 -115 16384 <
ffff81019bcb6300 407989224 C Bi:4:055:5 -2 0
ffff81019bcb6300 407989333 S Bi:4:055:5 -115 16384 <
ffff81019bcb6300 408041225 C Bi:4:055:5 -2 0
ffff81019bcb6300 408041321 S Bi:4:055:5 -115 16384 <
ffff81019bcb6300 408093227 C Bi:4:055:5 -2 0
ffff81019bcb6300 408093327 S Bi:4:055:5 -115 16384 <
ffff81019bcb6300 408145230 C Bi:4:055:5 -2 0
ffff81019bcb6300 408145330 S Bi:4:055:5 -115 16384 <
ffff81019bcb6300 408197236 C Bi:4:055:5 -2 0
ffff81019bcb6300 408197332 S Bi:4:055:5 -115 16384 <
ffff81019bcb6300 408249236 C Bi:4:055:5 -2 0
ffff81019bcb6300 408249329 S Bi:4:055:5 -115 16384 <
ffff81019bcb6300 408301238 C Bi:4:055:5 -2 0
ffff81019bcb6300 408301330 S Bi:4:055:5 -115 16384 <
ffff81019bcb6300 408353243 C Bi:4:055:5 -2 0
ffff81019bcb6300 408353323 S Bi:4:055:5 -115 16384 <
ffff81019bcb6300 408404248 C Bi:4:055:5 -2 0
ffff81019bcb6300 408404346 S Bi:4:055:5 -115 16384 <
ffff81019bcb6300 408457249 C Bi:4:055:5 -2 0
ffff81019bcb6300 408457335 S Bi:4:055:5 -115 16384 <
ffff81019bcb6300 408509254 C Bi:4:055:5 -2 0
ffff81019bcb6300 408509350 S Bi:4:055:5 -115 16384 <
ffff81019bcb6300 408561256 C Bi:4:055:5 -2 0
ffff81019bcb6300 408561341 S Bi:4:055:5 -115 16384 <
ffff81019bcb6300 408613258 C Bi:4:055:5 -2 0
ffff81019bcb6300 408613353 S Bi:4:055:5 -115 16384 <
ffff81019bcb6300 408664260 C Bi:4:055:5 -2 0
ffff8101fae8be40 408664404 S Bi:4:055:5 -115 16384 <
ffff8101fae8be40 408716260 C Bi:4:055:5 -2 0
ffff8101fae8be40 408716404 S Bi:4:055:5 -115 16384 <
ffff8101fae8be40 408768267 C Bi:4:055:5 -2 0
ffff8101fae8be40 408768412 S Bi:4:055:5 -115 16384 <
ffff8101fae8be40 408820270 C Bi:4:055:5 -2 0
ffff8101fae8be40 408820416 S Bi:4:055:5 -115 16384 <
ffff8101fae8be40 408872272 C Bi:4:055:5 -2 0
ffff8101fae8be40 408872414 S Bi:4:055:5 -115 16384 <
ffff8101fae8be40 408924275 C Bi:4:055:5 -2 0
ffff8101fae8be40 408924417 S Bi:4:055:5 -115 16384 <
ffff8101fae8be40 408976278 C Bi:4:055:5 -2 0
ffff8101fae8be40 408976409 S Bi:4:055:5 -115 16384 <
ffff8101fae8be40 409028281 C Bi:4:055:5 -2 0
ffff8101fae8be40 409028424 S Bi:4:055:5 -115 16384 <
ffff8101fae8be40 409080284 C Bi:4:055:5 -2 0
ffff8101fae8be40 409080426 S Bi:4:055:5 -115 16384 <
ffff8101fae8be40 409132287 C Bi:4:055:5 -2 0
ffff8101fae8be40 409132427 S Bi:4:055:5 -115 16384 <
ffff8101fae8be40 409184290 C Bi:4:055:5 -2 0
ffff8101fae8be40 409184434 S Bi:4:055:5 -115 16384 <
ffff8101fae8be40 409236292 C Bi:4:055:5 -2 0
ffff8101fae8be40 409236455 S Bi:4:055:5 -115 16384 <
ffff8101fae8be40 409288296 C Bi:4:055:5 -2 0
ffff8101fae8be40 409288437 S Bi:4:055:5 -115 16384 <
ffff8101fae8be40 409340297 C Bi:4:055:5 -2 0
ffff8101fae8be40 409340438 S Bi:4:055:5 -115 16384 <
ffff8101ef1153c0 409363734 S Bo:4:055:10 -115 31 = 55534243 0e070000 00000000 00000600 00000000 00000000 00000000 000000
ffff8101ef1153c0 409364233 C Bo:4:055:10 0 31 >
ffff8101ef1153c0 409364240 S Bi:4:055:9 -115 13 <
ffff8101ef1153c0 409365231 C Bi:4:055:9 0 13 = 55534253 0e070000 00000000 01
ffff8101ef1153c0 409365237 S Bo:4:055:10 -115 31 = 55534243 0f070000 12000000 80000603 00000012 00000000 00000000 000000
ffff8101ef1153c0 409366230 C Bo:4:055:10 0 31 >
ffff8101fae8b540 409366239 S Bi:4:055:9 -115 18 <
ffff8101fae8b540 409367230 C Bi:4:055:9 0 18 = 70000200 0000000a 00000000 3a000000 0000
ffff8101ef1153c0 409367238 S Bi:4:055:9 -115 13 <
ffff8101ef1153c0 409368231 C Bi:4:055:9 0 13 = 55534253 0f070000 00000000 00
ffff8101ef1153c0 409368265 S Bo:4:055:10 -115 31 = 55534243 10070000 00000000 00000600 00000000 00000000 00000000 000000
ffff8101ef1153c0 409369230 C Bo:4:055:10 0 31 >
ffff8101ef1153c0 409369236 S Bi:4:055:9 -115 13 <
ffff8101ef1153c0 409370230 C Bi:4:055:9 0 13 = 55534253 10070000 00000000 01
ffff8101ef1153c0 409370237 S Bo:4:055:10 -115 31 = 55534243 11070000 12000000 80000603 00000012 00000000 00000000 000000
ffff8101ef1153c0 409371230 C Bo:4:055:10 0 31 >
ffff8101fae8b540 409371238 S Bi:4:055:9 -115 18 <
ffff8101fae8b540 409372231 C Bi:4:055:9 0 18 = 70000200 0000000a 00000000 3a000000 0000
ffff8101ef1153c0 409372238 S Bi:4:055:9 -115 13 <
ffff8101ef1153c0 409373230 C Bi:4:055:9 0 13 = 55534253 11070000 00000000 00
ffff8101fae8be40 409392305 C Bi:4:055:5 -2 0
ffff8101fae8be40 409392452 S Bi:4:055:5 -115 16384 <
ffff8101fae8be40 409444303 C Bi:4:055:5 -2 0
ffff8101fae8be40 409444448 S Bi:4:055:5 -115 16384 <
ffff8101fae8be40 409496307 C Bi:4:055:5 -2 0
ffff8101fae8be40 409496447 S Bi:4:055:5 -115 16384 <
ffff8101fae8be40 409548309 C Bi:4:055:5 -2 0
ffff8101fae8be40 409548454 S Bi:4:055:5 -115 16384 <
ffff8101fae8be40 409600313 C Bi:4:055:5 -2 0
ffff8101fae8be40 409600454 S Bi:4:055:5 -115 16384 <
ffff8101fae8be40 409652316 C Bi:4:055:5 -2 0
ffff8101fae8be40 409652526 S Bi:4:055:5 -115 16384 <
ffff8101fae8be40 409704318 C Bi:4:055:5 -2 0
ffff81019bcb6540 409704440 S Bi:4:055:5 -115 16384 <
ffff81019bcb6540 409756323 C Bi:4:055:5 -2 0
ffff81019bcb6540 409756431 S Bi:4:055:5 -115 16384 <
ffff81019bcb6540 409808329 C Bi:4:055:5 -2 0
ffff81019bcb6540 409808416 S Bi:4:055:5 -115 16384 <
ffff81019bcb6540 409860329 C Bi:4:055:5 -2 0
ffff81019bcb6540 409860445 S Bi:4:055:5 -115 16384 <
ffff81019bcb6540 409912325 C Bi:4:055:5 -2 0
ffff81019bcb6540 409912438 S Bi:4:055:5 -115 16384 <
ffff81019bcb6540 409964332 C Bi:4:055:5 -2 0
ffff81019bcb6540 409964448 S Bi:4:055:5 -115 16384 <
ffff81019bcb6540 410016337 C Bi:4:055:5 -2 0
ffff81019bcb6540 410016707 S Bi:4:055:5 -115 16384 <
ffff81019bcb6540 410068337 C Bi:4:055:5 -2 0
ffff81019bcb6540 410068463 S Bi:4:055:5 -115 16384 <
ffff81019bcb6540 410120335 C Bi:4:055:5 -2 0
ffff81019bcb6540 410120446 S Bi:4:055:5 -115 16384 <
ffff81019bcb6540 410172343 C Bi:4:055:5 -2 0
ffff81019bcb6540 410172470 S Bi:4:055:5 -115 16384 <
ffff81019bcb6540 410224346 C Bi:4:055:5 -2 0
ffff81019bcb6540 410224464 S Bi:4:055:5 -115 16384 <
ffff81019bcb6540 410276347 C Bi:4:055:5 -2 0
ffff81019bcb6540 410276456 S Bi:4:055:5 -115 16384 <
ffff81019bcb6540 410328354 C Bi:4:055:5 -2 0
ffff81019bcb6540 410328448 S Bi:4:055:5 -115 16384 <
ffff81019bcb6540 410380353 C Bi:4:055:5 -2 0
ffff81019bcb6540 410380456 S Bi:4:055:5 -115 16384 <
ffff81019bcb6540 410432357 C Bi:4:055:5 -2 0
ffff81019bcb6540 410432460 S Bi:4:055:5 -115 16384 <
ffff81019bcb6540 410484358 C Bi:4:055:5 -2 0
ffff81019bcb6540 410484470 S Bi:4:055:5 -115 16384 <
ffff81019bcb6540 410536363 C Bi:4:055:5 -2 0
ffff81019bcb6540 410536455 S Bi:4:055:5 -115 16384 <
ffff81019bcb6540 410588365 C Bi:4:055:5 -2 0
ffff81019bcb6540 410588459 S Bi:4:055:5 -115 16384 <
ffff81019bcb6540 410640370 C Bi:4:055:5 -2 0
ffff81019bcb6540 410640754 S Bi:4:055:5 -115 16384 <
ffff81019bcb6540 410692372 C Bi:4:055:5 -2 0
ffff81019bcb6540 410692476 S Bi:4:055:5 -115 16384 <
ffff81019bcb6540 410744378 C Bi:4:055:5 -2 0
ffff81019bcb6540 410744470 S Bi:4:055:5 -115 16384 <
ffff81019bcb6540 410796376 C Bi:4:055:5 -2 0
ffff81019bcb6540 410796464 S Bi:4:055:5 -115 16384 <
ffff81019bcb6540 410848381 C Bi:4:055:5 -2 0
ffff81019bcb6540 410848455 S Bi:4:055:5 -115 16384 <
ffff81019bcb6540 410900381 C Bi:4:055:5 -2 0
ffff81019bcb6540 410900464 S Bi:4:055:5 -115 16384 <
ffff81019bcb6540 410952388 C Bi:4:055:5 -2 0
ffff81019bcb6540 410952470 S Bi:4:055:5 -115 16384 <
ffff81019bcb6540 411004391 C Bi:4:055:5 -2 0
ffff81019bcb6540 411004472 S Bi:4:055:5 -115 16384 <
ffff81019bcb6540 411056390 C Bi:4:055:5 -2 0
ffff81019bcb6540 411056463 S Bi:4:055:5 -115 16384 <
ffff81019bcb6540 411108392 C Bi:4:055:5 -2 0
ffff81019bcb6540 411108470 S Bi:4:055:5 -115 16384 <
ffff81019bcb6540 411160404 C Bi:4:055:5 -2 0
ffff81019bcb6540 411160492 S Bi:4:055:5 -115 16384 <
ffff81019bcb6540 411212406 C Bi:4:055:5 -2 0
ffff81019bcb6540 411212613 S Bi:4:055:5 -115 16384 <
ffff81019bcb6540 411264406 C Bi:4:055:5 -2 0
ffff8101481aa3c0 411264553 S Bi:4:055:5 -115 16384 <
ffff8101481aa3c0 411316405 C Bi:4:055:5 -2 0
ffff8101481aa3c0 411316524 S Bi:4:055:5 -115 16384 <
ffff8101ef1153c0 411360313 S Bo:4:055:10 -115 31 = 55534243 12070000 00000000 00000600 00000000 00000000 00000000 000000
ffff8101ef1153c0 411361344 C Bo:4:055:10 0 31 >
ffff8101ef1153c0 411361351 S Bi:4:055:9 -115 13 <
ffff8101ef1153c0 411362342 C Bi:4:055:9 0 13 = 55534253 12070000 00000000 01
ffff8101ef1153c0 411362349 S Bo:4:055:10 -115 31 = 55534243 13070000 12000000 80000603 00000012 00000000 00000000 000000
ffff8101ef1153c0 411363342 C Bo:4:055:10 0 31 >
ffff8101481aacc0 411363370 S Bi:4:055:9 -115 18 <
ffff8101481aacc0 411364342 C Bi:4:055:9 0 18 = 70000200 0000000a 00000000 3a000000 0000
ffff8101ef1153c0 411364351 S Bi:4:055:9 -115 13 <
ffff8101ef1153c0 411365341 C Bi:4:055:9 0 13 = 55534253 13070000 00000000 00
ffff8101ef1153c0 411365375 S Bo:4:055:10 -115 31 = 55534243 14070000 00000000 00000600 00000000 00000000 00000000 000000
ffff8101ef1153c0 411366341 C Bo:4:055:10 0 31 >
ffff8101ef1153c0 411366346 S Bi:4:055:9 -115 13 <
ffff8101ef1153c0 411367341 C Bi:4:055:9 0 13 = 55534253 14070000 00000000 01
ffff8101ef1153c0 411367347 S Bo:4:055:10 -115 31 = 55534243 15070000 12000000 80000603 00000012 00000000 00000000 000000
ffff8101ef1153c0 411368341 C Bo:4:055:10 0 31 >
ffff8101481aacc0 411368348 S Bi:4:055:9 -115 18 <
ffff8101481aa3c0 411369406 C Bi:4:055:5 -2 0
ffff8101481aacc0 411369410 C Bi:4:055:9 0 18 = 70000200 0000000a 00000000 3a000000 0000
ffff8101ef1153c0 411369416 S Bi:4:055:9 -115 13 <
ffff8101481aa3c0 411369542 S Bi:4:055:5 -115 16384 <
ffff8101ef1153c0 411370342 C Bi:4:055:9 0 13 = 55534253 15070000 00000000 00
ffff8101481aa3c0 411421407 C Bi:4:055:5 -2 0
ffff8101481aa3c0 411421522 S Bi:4:055:5 -115 16384 <
ffff8101481aa3c0 411476413 C Bi:4:055:5 -2 0
ffff8101481aa3c0 411476551 S Bi:4:055:5 -115 16384 <
ffff8101481aa3c0 411529417 C Bi:4:055:5 -2 0
ffff8101481aa3c0 411529559 S Bi:4:055:5 -115 16384 <
ffff8101481aa3c0 411584421 C Bi:4:055:5 -2 0
ffff8101481aa3c0 411584561 S Bi:4:055:5 -115 16384 <
ffff8101481aa3c0 411636427 C Bi:4:055:5 -2 0
ffff81019bcb6c00 411636845 S Bi:4:055:5 -115 16384 <
ffff81019bcb6c00 411688436 C Bi:4:055:5 -2 0
ffff81019bcb6c00 411688571 S Bi:4:055:5 -115 16384 <
ffff81019bcb6c00 411740434 C Bi:4:055:5 -2 0
ffff81019bcb6c00 411741477 S Bi:4:055:5 -115 16384 <
ffff81019bcb6c00 411792432 C Bi:4:055:5 -2 0
ffff81019bcb6c00 411792543 S Bi:4:055:5 -115 16384 <
ffff81019bcb6c00 411844433 C Bi:4:055:5 -2 0
ffff81019bcb6c00 411844546 S Bi:4:055:5 -115 16384 <
ffff81019bcb6c00 411896436 C Bi:4:055:5 -2 0
ffff81019bcb6c00 411896549 S Bi:4:055:5 -115 16384 <
ffff81019bcb6c00 411948439 C Bi:4:055:5 -2 0
ffff81019bcb6c00 411948560 S Bi:4:055:5 -115 16384 <
ffff81019bcb6c00 412000442 C Bi:4:055:5 -2 0
ffff81019bcb6c00 412000560 S Bi:4:055:5 -115 16384 <
ffff81019bcb6c00 412052447 C Bi:4:055:5 -2 0
ffff81019bcb6c00 412052561 S Bi:4:055:5 -115 16384 <
ffff81019bcb6c00 412104447 C Bi:4:055:5 -2 0
ffff81019bcb6c00 412104554 S Bi:4:055:5 -115 16384 <
ffff81019bcb6c00 412156448 C Bi:4:055:5 -2 0
ffff81019bcb6c00 412156530 S Bi:4:055:5 -115 16384 <
ffff81019bcb6c00 412208452 C Bi:4:055:5 -2 0
ffff81019bcb6c00 412208559 S Bi:4:055:5 -115 16384 <
ffff81019bcb6c00 412260456 C Bi:4:055:5 -2 0
ffff81019bcb6c00 412260780 S Bi:4:055:5 -115 16384 <
ffff81019bcb6c00 412312458 C Bi:4:055:5 -2 0
ffff81019bcb6c00 412312571 S Bi:4:055:5 -115 16384 <
ffff81019bcb6c00 412364462 C Bi:4:055:5 -2 0
ffff81019bcb6c00 412364575 S Bi:4:055:5 -115 16384 <
ffff81019bcb6c00 412416468 C Bi:4:055:5 -2 0
ffff81019bcb6c00 412416586 S Bi:4:055:5 -115 16384 <
ffff81019bcb6c00 412476470 C Bi:4:055:5 -2 0
ffff8101481aacc0 412476622 S Bi:4:055:5 -115 16384 <
ffff8101481aacc0 412528474 C Bi:4:055:5 -2 0
ffff8101314ca180 412528616 S Bi:4:055:5 -115 16384 <
ffff8101314ca180 412580473 C Bi:4:055:5 -2 0
ffff8101314ca180 412580608 S Bi:4:055:5 -115 16384 <
ffff8101314ca180 412632477 C Bi:4:055:5 -2 0
ffff8101314ca180 412632601 S Bi:4:055:5 -115 16384 <
ffff8101314ca180 412684487 C Bi:4:055:5 -2 0
ffff81019bcb6300 412684610 S Bi:4:055:5 -115 16384 <
ffff81019bcb6300 412736485 C Bi:4:055:5 -2 0
ffff81019bcb6300 412736605 S Bi:4:055:5 -115 16384 <
ffff81019bcb6300 412788486 C Bi:4:055:5 -2 0
ffff81019bcb6300 412788836 S Bi:4:055:5 -115 16384 <
ffff81019bcb6300 412840492 C Bi:4:055:5 -2 0
ffff81019bcb6300 412840604 S Bi:4:055:5 -115 16384 <
ffff81019bcb6300 412892493 C Bi:4:055:5 -2 0
ffff81019bcb6300 412892599 S Bi:4:055:5 -115 16384 <
ffff81019bcb6300 412944497 C Bi:4:055:5 -2 0
ffff81019bcb6300 412944608 S Bi:4:055:5 -115 16384 <
ffff81019bcb6300 412996503 C Bi:4:055:5 -2 0
ffff81019bcb6300 412996609 S Bi:4:055:5 -115 16384 <
ffff81019bcb6300 413048504 C Bi:4:055:5 -2 0
ffff81019bcb6300 413048620 S Bi:4:055:5 -115 16384 <
ffff81019bcb6300 413100506 C Bi:4:055:5 -2 0
ffff81019bcb6300 413100606 S Bi:4:055:5 -115 16384 <
ffff81019bcb6300 413152508 C Bi:4:055:5 -2 0
ffff81019bcb6300 413152615 S Bi:4:055:5 -115 16384 <
ffff81019bcb6300 413204510 C Bi:4:055:5 -2 0
ffff81019bcb6300 413204618 S Bi:4:055:5 -115 16384 <
ffff81019bcb6300 413256512 C Bi:4:055:5 -2 0
ffff81019bcb6300 413256592 S Bi:4:055:5 -115 16384 <
ffff81019bcb6300 413308514 C Bi:4:055:5 -2 0
ffff81019bcb6300 413308617 S Bi:4:055:5 -115 16384 <
ffff81019bcb6300 413360519 C Bi:4:055:5 -2 0
ffff81019bcb6300 413360625 S Bi:4:055:5 -115 16384 <
ffff8101ef1153c0 413363678 S Bo:4:055:10 -115 31 = 55534243 16070000 00000000 00000600 00000000 00000000 00000000 000000
ffff8101ef1153c0 413364453 C Bo:4:055:10 0 31 >
ffff8101ef1153c0 413364460 S Bi:4:055:9 -115 13 <
ffff8101ef1153c0 413365453 C Bi:4:055:9 0 13 = 55534253 16070000 00000000 01
ffff8101ef1153c0 413365459 S Bo:4:055:10 -115 31 = 55534243 17070000 12000000 80000603 00000012 00000000 00000000 000000
ffff8101ef1153c0 413366452 C Bo:4:055:10 0 31 >
ffff8101eb77b900 413366461 S Bi:4:055:9 -115 18 <
ffff8101eb77b900 413367452 C Bi:4:055:9 0 18 = 70000200 0000000a 00000000 3a000000 0000
ffff8101ef1153c0 413367460 S Bi:4:055:9 -115 13 <
ffff8101ef1153c0 413368453 C Bi:4:055:9 0 13 = 55534253 17070000 00000000 00
ffff8101ef1153c0 413368488 S Bo:4:055:10 -115 31 = 55534243 18070000 00000000 00000600 00000000 00000000 00000000 000000
ffff8101ef1153c0 413369453 C Bo:4:055:10 0 31 >
ffff8101ef1153c0 413369458 S Bi:4:055:9 -115 13 <
ffff8101ef1153c0 413370453 C Bi:4:055:9 0 13 = 55534253 18070000 00000000 01
ffff8101ef1153c0 413370459 S Bo:4:055:10 -115 31 = 55534243 19070000 12000000 80000603 00000012 00000000 00000000 000000
ffff8101ef1153c0 413371453 C Bo:4:055:10 0 31 >
ffff8101eb77b900 413371459 S Bi:4:055:9 -115 18 <
ffff8101eb77b900 413372454 C Bi:4:055:9 0 18 = 70000200 0000000a 00000000 3a000000 0000
ffff8101ef1153c0 413372463 S Bi:4:055:9 -115 13 <
ffff8101ef1153c0 413373455 C Bi:4:055:9 0 13 = 55534253 19070000 00000000 00
ffff81019bcb6300 413412522 C Bi:4:055:5 -2 0
ffff81019bcb6300 413412712 S Bi:4:055:5 -115 16384 <
ffff81019bcb6300 413464525 C Bi:4:055:5 -2 0
ffff81019bcb6300 413464623 S Bi:4:055:5 -115 16384 <
ffff81019bcb6300 413516527 C Bi:4:055:5 -2 0
ffff81019bcb6300 413516651 S Bi:4:055:5 -115 16384 <
ffff81019bcb6300 413568531 C Bi:4:055:5 -2 0
ffff81019bcb6300 413568624 S Bi:4:055:5 -115 16384 <
ffff81019bcb6300 413620536 C Bi:4:055:5 -2 0
ffff81019bcb6300 413620653 S Bi:4:055:5 -115 16384 <
ffff81019bcb6300 413672539 C Bi:4:055:5 -2 0
ffff81019bcb6300 413672656 S Bi:4:055:5 -115 16384 <
ffff81019bcb6300 413724541 C Bi:4:055:5 -2 0
ffff81019bcb6300 413724653 S Bi:4:055:5 -115 16384 <
ffff81019bcb6300 413776544 C Bi:4:055:5 -2 0
ffff81019bcb6300 413776654 S Bi:4:055:5 -115 16384 <
ffff81019bcb6300 413828546 C Bi:4:055:5 -2 0
ffff81019bcb6300 413828631 S Bi:4:055:5 -115 16384 <
ffff81019bcb6300 413880549 C Bi:4:055:5 -2 0
ffff81019bcb6300 413880657 S Bi:4:055:5 -115 16384 <
ffff81019bcb6300 413932550 C Bi:4:055:5 -2 0
ffff81019bcb6300 413932628 S Bi:4:055:5 -115 16384 <
ffff81019bcb6300 413984554 C Bi:4:055:5 -2 0
ffff81019bcb6300 413984657 S Bi:4:055:5 -115 16384 <
ffff81019bcb6300 414036558 C Bi:4:055:5 -2 0
ffff81019bcb6300 414036647 S Bi:4:055:5 -115 16384 <
ffff81019bcb6300 414088558 C Bi:4:055:5 -2 0
ffff81019bcb6300 414088664 S Bi:4:055:5 -115 16384 <
ffff81019bcb6300 414140560 C Bi:4:055:5 -2 0
ffff81019bcb6300 414140633 S Bi:4:055:5 -115 16384 <
ffff81019bcb6300 414192564 C Bi:4:055:5 -2 0
ffff81019bcb6300 414192675 S Bi:4:055:5 -115 16384 <
ffff81019bcb6300 414244568 C Bi:4:055:5 -2 0
ffff81019bcb6300 414244653 S Bi:4:055:5 -115 16384 <
ffff81019bcb6300 414296574 C Bi:4:055:5 -2 0
ffff81019bcb6300 414296684 S Bi:4:055:5 -115 16384 <
ffff81019bcb6300 414348575 C Bi:4:055:5 -2 0
ffff81019bcb6300 414348667 S Bi:4:055:5 -115 16384 <
ffff81019bcb6300 414400580 C Bi:4:055:5 -2 0
ffff81019bcb6300 414400681 S Bi:4:055:5 -115 16384 <
ffff81019bcb6300 414452578 C Bi:4:055:5 -2 0
ffff81019bcb6300 414452659 S Bi:4:055:5 -115 16384 <
ffff81019bcb6300 414504584 C Bi:4:055:5 -2 0
ffff81019bcb6300 414504698 S Bi:4:055:5 -115 16384 <
ffff81019bcb6300 414556588 C Bi:4:055:5 -2 0
ffff81019bcb6300 414556669 S Bi:4:055:5 -115 16384 <
ffff81019bcb6300 414608587 C Bi:4:055:5 -2 0
ffff81019bcb6300 414608693 S Bi:4:055:5 -115 16384 <
ffff81019bcb6300 414660597 C Bi:4:055:5 -2 0
ffff81019bcb6300 414660698 S Bi:4:055:5 -115 16384 <
ffff81019bcb6300 414712592 C Bi:4:055:5 -2 0
ffff81019bcb6300 414712699 S Bi:4:055:5 -115 16384 <
ffff81019bcb6300 414764596 C Bi:4:055:5 -2 0
ffff81019bcb6300 414764676 S Bi:4:055:5 -115 16384 <
ffff81019bcb6300 414816599 C Bi:4:055:5 -2 0
ffff81019bcb6300 414816706 S Bi:4:055:5 -115 16384 <
ffff81019bcb6300 414868605 C Bi:4:055:5 -2 0
ffff81019bcb6300 414868690 S Bi:4:055:5 -115 16384 <
ffff81019bcb6300 414920607 C Bi:4:055:5 -2 0
ffff81019bcb6300 414920715 S Bi:4:055:5 -115 16384 <
ffff81019bcb6300 414972608 C Bi:4:055:5 -2 0
ffff81019bcb6300 414972691 S Bi:4:055:5 -115 16384 <
ffff81019bcb6300 415024612 C Bi:4:055:5 -2 0
ffff81019bcb6300 415024717 S Bi:4:055:5 -115 16384 <
ffff81019bcb6300 415076612 C Bi:4:055:5 -2 0
ffff81019bcb6300 415076690 S Bi:4:055:5 -115 16384 <
ffff81019bcb6300 415128614 C Bi:4:055:5 -2 0
ffff81019bcb6300 415128717 S Bi:4:055:5 -115 16384 <
ffff81019bcb6300 415180617 C Bi:4:055:5 -2 0
ffff81019bcb6300 415180700 S Bi:4:055:5 -115 16384 <
ffff81019bcb6300 415232625 C Bi:4:055:5 -2 0
ffff81019bcb6300 415232726 S Bi:4:055:5 -115 16384 <
ffff81019bcb6300 415284623 C Bi:4:055:5 -2 0
ffff81019bcb6300 415284709 S Bi:4:055:5 -115 16384 <
ffff81019bcb6300 415336626 C Bi:4:055:5 -2 0
ffff81019bcb6300 415336728 S Bi:4:055:5 -115 16384 <
ffff8101ef1153c0 415363676 S Bo:4:055:10 -115 31 = 55534243 1a070000 00000000 00000600 00000000 00000000 00000000 000000
ffff8101ef1153c0 415364565 C Bo:4:055:10 0 31 >
ffff8101ef1153c0 415364572 S Bi:4:055:9 -115 13 <
ffff8101ef1153c0 415365570 C Bi:4:055:9 0 13 = 55534253 1a070000 00000000 01
ffff8101ef1153c0 415365676 S Bo:4:055:10 -115 31 = 55534243 1b070000 12000000 80000603 00000012 00000000 00000000 000000
ffff8101ef1153c0 415366570 C Bo:4:055:10 0 31 >
ffff8101eb77bb40 415366616 S Bi:4:055:9 -115 18 <
ffff8101eb77bb40 415367567 C Bi:4:055:9 0 18 = 70000200 0000000a 00000000 3a000000 0000
ffff8101ef1153c0 415367601 S Bi:4:055:9 -115 13 <
ffff8101ef1153c0 415368564 C Bi:4:055:9 0 13 = 55534253 1b070000 00000000 00
ffff8101ef1153c0 415368610 S Bo:4:055:10 -115 31 = 55534243 1c070000 00000000 00000600 00000000 00000000 00000000 000000
ffff8101ef1153c0 415369565 C Bo:4:055:10 0 31 >
ffff8101ef1153c0 415369570 S Bi:4:055:9 -115 13 <
ffff8101ef1153c0 415370564 C Bi:4:055:9 0 13 = 55534253 1c070000 00000000 01
ffff8101ef1153c0 415370571 S Bo:4:055:10 -115 31 = 55534243 1d070000 12000000 80000603 00000012 00000000 00000000 000000
ffff8101ef1153c0 415371564 C Bo:4:055:10 0 31 >
ffff8101eb77bb40 415371571 S Bi:4:055:9 -115 18 <
ffff8101eb77bb40 415372565 C Bi:4:055:9 0 18 = 70000200 0000000a 00000000 3a000000 0000
ffff8101ef1153c0 415372572 S Bi:4:055:9 -115 13 <
ffff8101ef1153c0 415373564 C Bi:4:055:9 0 13 = 55534253 1d070000 00000000 00
ffff81019bcb6300 415388631 C Bi:4:055:5 -2 0
ffff81019bcb6300 415388741 S Bi:4:055:5 -115 16384 <
ffff81019bcb6300 415440638 C Bi:4:055:5 -2 0
ffff81019bcb6300 415440759 S Bi:4:055:5 -115 16384 <
ffff81019bcb6300 415492642 C Bi:4:055:5 -2 0
ffff81019bcb6300 415492731 S Bi:4:055:5 -115 16384 <
ffff81019bcb6300 415544643 C Bi:4:055:5 -2 0
ffff81019bcb6300 415544756 S Bi:4:055:5 -115 16384 <
ffff81019bcb6300 415596641 C Bi:4:055:5 -2 0
ffff81019bcb6300 415596721 S Bi:4:055:5 -115 16384 <
ffff81019bcb6300 415648660 C Bi:4:055:5 -2 0
ffff81019bcb6300 415648786 S Bi:4:055:5 -115 16384 <
ffff81019bcb6300 415700658 C Bi:4:055:5 -2 0
ffff81019bcb6300 415700782 S Bi:4:055:5 -115 16384 <
ffff81019bcb6300 415752650 C Bi:4:055:5 -2 0
ffff81019bcb6300 415752766 S Bi:4:055:5 -115 16384 <
ffff81019bcb6300 415804651 C Bi:4:055:5 -2 0
ffff81019bcb6300 415804740 S Bi:4:055:5 -115 16384 <
ffff81019bcb6300 415856658 C Bi:4:055:5 -2 0
ffff81019bcb6300 415856773 S Bi:4:055:5 -115 16384 <
ffff81019bcb6300 415908659 C Bi:4:055:5 -2 0
ffff81019bcb6300 415908751 S Bi:4:055:5 -115 16384 <
ffff81019bcb6300 415960660 C Bi:4:055:5 -2 0
ffff81019bcb6300 415960767 S Bi:4:055:5 -115 16384 <
ffff81019bcb6300 416012667 C Bi:4:055:5 -2 0
ffff81019bcb6300 416012761 S Bi:4:055:5 -115 16384 <
ffff81019bcb6300 416064666 C Bi:4:055:5 -2 0
ffff81019bcb6300 416064779 S Bi:4:055:5 -115 16384 <
ffff81019bcb6300 416116668 C Bi:4:055:5 -2 0
ffff81019bcb6300 416116756 S Bi:4:055:5 -115 16384 <
ffff81019bcb6300 416168673 C Bi:4:055:5 -2 0
ffff81019bcb6300 416168779 S Bi:4:055:5 -115 16384 <
ffff81019bcb6300 416220675 C Bi:4:055:5 -2 0
ffff81019bcb6300 416220775 S Bi:4:055:5 -115 16384 <
ffff81019bcb6300 416272681 C Bi:4:055:5 -2 0
ffff81019bcb6300 416272793 S Bi:4:055:5 -115 16384 <
ffff81019bcb6300 416325681 C Bi:4:055:5 -2 0
ffff81019bcb6300 416325783 S Bi:4:055:5 -115 16384 <
ffff81019bcb6300 416376687 C Bi:4:055:5 -2 0
ffff81019bcb6300 416376774 S Bi:4:055:5 -115 16384 <
ffff81019bcb6300 416428689 C Bi:4:055:5 -2 0
ffff81019bcb6300 416428797 S Bi:4:055:5 -115 16384 <
ffff81019bcb6300 416480690 C Bi:4:055:5 -2 0
ffff81019bcb6300 416480777 S Bi:4:055:5 -115 16384 <
ffff81019bcb6300 416533699 C Bi:4:055:5 -2 0
ffff8101faf01b40 416533829 S Bi:4:055:5 -115 16384 <
ffff8101faf01b40 416584696 C Bi:4:055:5 -2 0
ffff8101faf01b40 416584780 S Bi:4:055:5 -115 16384 <
ffff8101faf01b40 416636703 C Bi:4:055:5 -2 0
ffff8101faf01b40 416636822 S Bi:4:055:5 -115 16384 <
ffff8101faf01b40 416688703 C Bi:4:055:5 -2 0
ffff81019bd0b240 416688808 S Bi:4:055:5 -115 16384 <
ffff81019bd0b240 416740712 C Bi:4:055:5 -2 0
ffff8101faf01180 416740841 S Bi:4:055:5 -115 16384 <
ffff8101faf01180 416792714 C Bi:4:055:5 -2 0
ffff8101faf01180 416792849 S Bi:4:055:5 -115 16384 <
ffff8101faf01180 416844714 C Bi:4:055:5 -2 0
ffff8101faf01180 416844790 S Bi:4:055:5 -115 16384 <
ffff8101faf01180 416896717 C Bi:4:055:5 -2 0
ffff8101faf01180 416896843 S Bi:4:055:5 -115 16384 <
ffff8101faf01180 416948725 C Bi:4:055:5 -2 0
ffff8101faf01180 416948785 S Bi:4:055:5 -115 16384 <
ffff8101faf01180 417000724 C Bi:4:055:5 -2 0
ffff8101faf01180 417000800 S Bi:4:055:5 -115 16384 <
ffff8101faf01180 417052723 C Bi:4:055:5 -2 0
ffff8101faf01180 417052795 S Bi:4:055:5 -115 16384 <
ffff8101faf01180 417104731 C Bi:4:055:5 -2 0
ffff8101faf01180 417104851 S Bi:4:055:5 -115 16384 <
ffff8101faf01180 417156732 C Bi:4:055:5 -2 0
ffff8101faf01180 417156849 S Bi:4:055:5 -115 16384 <
ffff8101faf01180 417208737 C Bi:4:055:5 -2 0
ffff8101faf01180 417208857 S Bi:4:055:5 -115 16384 <
ffff8101faf01180 417260737 C Bi:4:055:5 -2 0
ffff8101faf01180 417260844 S Bi:4:055:5 -115 16384 <
ffff8101faf01180 417312741 C Bi:4:055:5 -2 0
ffff8101faf01180 417312796 S Bi:4:055:5 -115 16384 <
ffff8101ef1153c0 417363684 S Bo:4:055:10 -115 31 = 55534243 1e070000 00000000 00000600 00000000 00000000 00000000 000000
ffff8101faf01180 417364743 C Bi:4:055:5 -2 0
ffff8101ef1153c0 417364750 C Bo:4:055:10 0 31 >
ffff8101ef1153c0 417364758 S Bi:4:055:9 -115 13 <
ffff8101faf01180 417364797 S Bi:4:055:5 -115 16384 <
ffff8101ef1153c0 417365676 C Bi:4:055:9 0 13 = 55534253 1e070000 00000000 01
ffff8101ef1153c0 417365684 S Bo:4:055:10 -115 31 = 55534243 1f070000 12000000 80000603 00000012 00000000 00000000 000000
ffff8101ef1153c0 417366676 C Bo:4:055:10 0 31 >
ffff81019bd0b300 417366685 S Bi:4:055:9 -115 18 <
ffff81019bd0b300 417367675 C Bi:4:055:9 0 18 = 70000200 0000000a 00000000 3a000000 0000
ffff8101ef1153c0 417367683 S Bi:4:055:9 -115 13 <
ffff8101ef1153c0 417368676 C Bi:4:055:9 0 13 = 55534253 1f070000 00000000 00
ffff8101ef1153c0 417368709 S Bo:4:055:10 -115 31 = 55534243 20070000 00000000 00000600 00000000 00000000 00000000 000000
ffff8101ef1153c0 417369676 C Bo:4:055:10 0 31 >
ffff8101ef1153c0 417369682 S Bi:4:055:9 -115 13 <
ffff8101ef1153c0 417370675 C Bi:4:055:9 0 13 = 55534253 20070000 00000000 01
ffff8101ef1153c0 417370681 S Bo:4:055:10 -115 31 = 55534243 21070000 12000000 80000603 00000012 00000000 00000000 000000
ffff8101ef1153c0 417371676 C Bo:4:055:10 0 31 >
ffff81019bd0b300 417371682 S Bi:4:055:9 -115 18 <
ffff81019bd0b300 417372676 C Bi:4:055:9 0 18 = 70000200 0000000a 00000000 3a000000 0000
ffff8101ef1153c0 417372683 S Bi:4:055:9 -115 13 <
ffff8101ef1153c0 417373676 C Bi:4:055:9 0 13 = 55534253 21070000 00000000 00
ffff8101faf01180 417416747 C Bi:4:055:5 -2 0
ffff8101faf01180 417416802 S Bi:4:055:5 -115 16384 <
ffff8101faf01180 417468750 C Bi:4:055:5 -2 0
ffff8101faf01180 417468841 S Bi:4:055:5 -115 16384 <
ffff8101faf01180 417520752 C Bi:4:055:5 -2 0
ffff8101faf01180 417520837 S Bi:4:055:5 -115 16384 <
ffff8101faf01180 417572755 C Bi:4:055:5 -2 0
ffff8101faf01180 417572810 S Bi:4:055:5 -115 16384 <
ffff8101faf01180 417624756 C Bi:4:055:5 -2 0
ffff8101faf01180 417624882 S Bi:4:055:5 -115 16384 <
ffff8101faf01180 417676763 C Bi:4:055:5 -2 0
ffff8101faf01180 417676877 S Bi:4:055:5 -115 16384 <
ffff8101faf01180 417728761 C Bi:4:055:5 -2 0
ffff8101faf01180 417728819 S Bi:4:055:5 -115 16384 <
ffff8101faf01180 417780767 C Bi:4:055:5 -2 0
ffff8101faf01180 417780853 S Bi:4:055:5 -115 16384 <
ffff8101faf01180 417832766 C Bi:4:055:5 -2 0
ffff8101faf01180 417832844 S Bi:4:055:5 -115 16384 <
ffff8101faf01180 417884774 C Bi:4:055:5 -2 0
ffff8101faf01180 417884884 S Bi:4:055:5 -115 16384 <
ffff8101faf01180 417936777 C Bi:4:055:5 -2 0
ffff8101faf01180 417936838 S Bi:4:055:5 -115 16384 <
ffff8101faf01180 417988781 C Bi:4:055:5 -2 0
ffff8101faf01180 417988842 S Bi:4:055:5 -115 16384 <
ffff8101faf01180 418040781 C Bi:4:055:5 -2 0
ffff8101faf01180 418040860 S Bi:4:055:5 -115 16384 <
ffff8101faf01180 418092783 C Bi:4:055:5 -2 0
ffff8101faf01180 418092842 S Bi:4:055:5 -115 16384 <
ffff8101faf01180 418144784 C Bi:4:055:5 -2 0
ffff8101faf01180 418144837 S Bi:4:055:5 -115 16384 <
ffff8101faf01180 418196789 C Bi:4:055:5 -2 0
ffff8101faf01180 418196856 S Bi:4:055:5 -115 16384 <
ffff8101faf01180 418248799 C Bi:4:055:5 -2 0
ffff8101faf01180 418248879 S Bi:4:055:5 -115 16384 <
ffff8101faf01180 418300795 C Bi:4:055:5 -2 0
ffff8101faf01180 418300849 S Bi:4:055:5 -115 16384 <
ffff8101faf01180 418352799 C Bi:4:055:5 -2 0
ffff8101faf01180 418352853 S Bi:4:055:5 -115 16384 <
ffff8101faf01180 418404803 C Bi:4:055:5 -2 0
ffff8101faf01180 418404863 S Bi:4:055:5 -115 16384 <
ffff8101faf01180 418456807 C Bi:4:055:5 -2 0
ffff8101faf01180 418456916 S Bi:4:055:5 -115 16384 <
ffff8101faf01180 418508807 C Bi:4:055:5 -2 0
ffff8101faf01180 418508874 S Bi:4:055:5 -115 16384 <
ffff8101faf01180 418560811 C Bi:4:055:5 -2 0
ffff8101faf01180 418560920 S Bi:4:055:5 -115 16384 <
ffff8101faf01180 418612811 C Bi:4:055:5 -2 0
ffff8101faf01180 418612888 S Bi:4:055:5 -115 16384 <
ffff8101faf01180 418664818 C Bi:4:055:5 -2 0
ffff8101faf01180 418664939 S Bi:4:055:5 -115 16384 <
ffff8101faf01180 418716820 C Bi:4:055:5 -2 0
ffff8101faf01180 418716918 S Bi:4:055:5 -115 16384 <
ffff8101faf01180 418767823 C Bi:4:055:5 -2 0
ffff81012d59e300 418767965 S Bi:4:055:5 -115 16384 <
ffff81012d59e300 418820823 C Bi:4:055:5 -2 0
ffff81012d59e300 418820934 S Bi:4:055:5 -115 16384 <
ffff81012d59e300 418871829 C Bi:4:055:5 -2 0
ffff81012d59e300 418871969 S Bi:4:055:5 -115 16384 <
ffff81012d59e300 418923826 C Bi:4:055:5 -2 0
ffff81012d59e300 418923946 S Bi:4:055:5 -115 16384 <
ffff81012d59e300 418975832 C Bi:4:055:5 -2 0
ffff81012d59e300 418975965 S Bi:4:055:5 -115 16384 <
ffff81012d59e300 419027835 C Bi:4:055:5 -2 0
ffff81012d59e300 419027962 S Bi:4:055:5 -115 16384 <
ffff81012d59e300 419079837 C Bi:4:055:5 -2 0
ffff81012d59e300 419079972 S Bi:4:055:5 -115 16384 <
ffff81012d59e300 419131837 C Bi:4:055:5 -2 0
ffff81012d59e300 419131941 S Bi:4:055:5 -115 16384 <
ffff81012d59e300 419183842 C Bi:4:055:5 -2 0
ffff81012d59e300 419183976 S Bi:4:055:5 -115 16384 <
ffff81012d59e300 419235843 C Bi:4:055:5 -2 0
ffff81012d59e300 419235947 S Bi:4:055:5 -115 16384 <
ffff81012d59e300 419288852 C Bi:4:055:5 -2 0
ffff81012d59e300 419288989 S Bi:4:055:5 -115 16384 <
ffff81012d59e300 419339850 C Bi:4:055:5 -2 0
ffff81012d59e300 419339956 S Bi:4:055:5 -115 16384 <
ffff8101ef1153c0 419363716 S Bo:4:055:10 -115 31 = 55534243 22070000 00000000 00000600 00000000 00000000 00000000 000000
ffff8101ef1153c0 419364789 C Bo:4:055:10 0 31 >
ffff8101ef1153c0 419364796 S Bi:4:055:9 -115 13 <
ffff8101ef1153c0 419365787 C Bi:4:055:9 0 13 = 55534253 22070000 00000000 01
ffff8101ef1153c0 419365794 S Bo:4:055:10 -115 31 = 55534243 23070000 12000000 80000603 00000012 00000000 00000000 000000
ffff8101ef1153c0 419366787 C Bo:4:055:10 0 31 >
ffff81012d59ee40 419366796 S Bi:4:055:9 -115 18 <
ffff81012d59ee40 419367786 C Bi:4:055:9 0 18 = 70000200 0000000a 00000000 3a000000 0000
ffff8101ef1153c0 419367794 S Bi:4:055:9 -115 13 <
ffff8101ef1153c0 419368787 C Bi:4:055:9 0 13 = 55534253 23070000 00000000 00
ffff8101ef1153c0 419368821 S Bo:4:055:10 -115 31 = 55534243 24070000 00000000 00000600 00000000 00000000 00000000 000000
ffff8101ef1153c0 419369786 C Bo:4:055:10 0 31 >
ffff8101ef1153c0 419369792 S Bi:4:055:9 -115 13 <
ffff8101ef1153c0 419370787 C Bi:4:055:9 0 13 = 55534253 24070000 00000000 01
ffff8101ef1153c0 419370793 S Bo:4:055:10 -115 31 = 55534243 25070000 12000000 80000603 00000012 00000000 00000000 000000
ffff8101ef1153c0 419371787 C Bo:4:055:10 0 31 >
ffff81012d59ee40 419371794 S Bi:4:055:9 -115 18 <
ffff81012d59ee40 419372787 C Bi:4:055:9 0 18 = 70000200 0000000a 00000000 3a000000 0000
ffff8101ef1153c0 419372794 S Bi:4:055:9 -115 13 <
ffff8101ef1153c0 419373787 C Bi:4:055:9 0 13 = 55534253 25070000 00000000 00
ffff81012d59e300 419391854 C Bi:4:055:5 -2 0
ffff81012d59e300 419391979 S Bi:4:055:5 -115 16384 <
ffff81012d59e300 419443857 C Bi:4:055:5 -2 0
ffff81012d59e300 419443979 S Bi:4:055:5 -115 16384 <
ffff81012d59e300 419495863 C Bi:4:055:5 -2 0
ffff81012d59e300 419495997 S Bi:4:055:5 -115 16384 <
ffff81012d59e300 419547863 C Bi:4:055:5 -2 0
ffff81012d59e300 419548001 S Bi:4:055:5 -115 16384 <
ffff81012d59e300 419600874 C Bi:4:055:5 -2 0
ffff81012d59e300 419601250 S Bi:4:055:5 -115 16384 <
ffff81012d59e300 419652872 C Bi:4:055:5 -2 0
ffff8101f4734000 419652995 S Bi:4:055:5 -115 16384 <
ffff8101f4734000 419704871 C Bi:4:055:5 -2 0
ffff8101f4734000 419704985 S Bi:4:055:5 -115 16384 <
ffff8101f4734000 419756876 C Bi:4:055:5 -2 0
ffff8101f4734000 419756966 S Bi:4:055:5 -115 16384 <
ffff8101f4734000 419808876 C Bi:4:055:5 -2 0
ffff8101f4734000 419808963 S Bi:4:055:5 -115 16384 <
ffff8101f4734000 419860886 C Bi:4:055:5 -2 0
ffff8101f4734000 419860992 S Bi:4:055:5 -115 16384 <
ffff8101f4734000 419912882 C Bi:4:055:5 -2 0
ffff8101f4734000 419912973 S Bi:4:055:5 -115 16384 <
ffff8101f4734000 419964887 C Bi:4:055:5 -2 0
ffff8101f4734000 419964978 S Bi:4:055:5 -115 16384 <
ffff8101f4734000 420016890 C Bi:4:055:5 -2 0
ffff8101f4734000 420016979 S Bi:4:055:5 -115 16384 <
ffff8101f4734000 420068900 C Bi:4:055:5 -2 0
ffff8101f4734000 420069073 S Bi:4:055:5 -115 16384 <
ffff8101f4734000 420120898 C Bi:4:055:5 -2 0
ffff8101f4734000 420121012 S Bi:4:055:5 -115 16384 <
ffff8101f4734000 420172904 C Bi:4:055:5 -2 0
ffff8101f4734000 420173027 S Bi:4:055:5 -115 16384 <
ffff8101f4734000 420224898 C Bi:4:055:5 -2 0
ffff8101f4734000 420225008 S Bi:4:055:5 -115 16384 <
ffff8101f4734000 420276905 C Bi:4:055:5 -2 0
ffff8101f4734000 420277012 S Bi:4:055:5 -115 16384 <
ffff8101f4734000 420328904 C Bi:4:055:5 -2 0
ffff8101f4734000 420328991 S Bi:4:055:5 -115 16384 <
ffff8101f4734000 420380913 C Bi:4:055:5 -2 0
ffff8101f4734000 420381003 S Bi:4:055:5 -115 16384 <
ffff8101f4734000 420432912 C Bi:4:055:5 -2 0
ffff8101f4734000 420433013 S Bi:4:055:5 -115 16384 <
ffff8101f4734000 420484916 C Bi:4:055:5 -2 0
ffff8101f4734000 420485030 S Bi:4:055:5 -115 16384 <
ffff8101f4734000 420536918 C Bi:4:055:5 -2 0
ffff8101f4734000 420537040 S Bi:4:055:5 -115 16384 <
ffff8101f4734000 420588920 C Bi:4:055:5 -2 0
ffff8101f4734000 420589039 S Bi:4:055:5 -115 16384 <
ffff8101f4734000 420640923 C Bi:4:055:5 -2 0
ffff8101f4734000 420641033 S Bi:4:055:5 -115 16384 <
ffff8101f4734000 420692927 C Bi:4:055:5 -2 0
ffff8101f4734000 420693046 S Bi:4:055:5 -115 16384 <
ffff8101f4734000 420744929 C Bi:4:055:5 -2 0
ffff8101f4734000 420745035 S Bi:4:055:5 -115 16384 <
ffff8101f4734000 420796932 C Bi:4:055:5 -2 0
ffff8101f4734000 420797053 S Bi:4:055:5 -115 16384 <
ffff8101f4734000 420848935 C Bi:4:055:5 -2 0
ffff8101f4734000 420849037 S Bi:4:055:5 -115 16384 <
ffff8101f4734000 420900939 C Bi:4:055:5 -2 0
ffff8101f4734000 420901050 S Bi:4:055:5 -115 16384 <
ffff8101f4734000 420952953 C Bi:4:055:5 -2 0
ffff8101f4734000 420953080 S Bi:4:055:5 -115 16384 <
ffff8101f4734000 421004945 C Bi:4:055:5 -2 0
ffff8101f4734000 421005081 S Bi:4:055:5 -115 16384 <
ffff8101f4734000 421056949 C Bi:4:055:5 -2 0
ffff8101f4734000 421057048 S Bi:4:055:5 -115 16384 <
ffff8101f4734000 421108952 C Bi:4:055:5 -2 0
ffff8101f4734000 421109039 S Bi:4:055:5 -115 16384 <
ffff8101f4734000 421160952 C Bi:4:055:5 -2 0
ffff8101f4734000 421161035 S Bi:4:055:5 -115 16384 <
ffff8101f4734000 421212958 C Bi:4:055:5 -2 0
ffff8101f4734000 421213044 S Bi:4:055:5 -115 16384 <
ffff8101f4734000 421264961 C Bi:4:055:5 -2 0
ffff8101f4734000 421265032 S Bi:4:055:5 -115 16384 <
ffff8101f4734000 421316959 C Bi:4:055:5 -2 0
ffff8101f4734000 421317038 S Bi:4:055:5 -115 16384 <
ffff8101ef1153c0 421363684 S Bo:4:055:10 -115 31 = 55534243 26070000 00000000 00000600 00000000 00000000 00000000 000000
ffff8101ef1153c0 421363900 C Bo:4:055:10 0 31 >
ffff8101ef1153c0 421363907 S Bi:4:055:9 -115 13 <
ffff8101ef1153c0 421364899 C Bi:4:055:9 0 13 = 55534253 26070000 00000000 01
ffff8101ef1153c0 421364905 S Bo:4:055:10 -115 31 = 55534243 27070000 12000000 80000603 00000012 00000000 00000000 000000
ffff8101ef1153c0 421365898 C Bo:4:055:10 0 31 >
ffff81012d59e780 421365908 S Bi:4:055:9 -115 18 <
ffff81012d59e780 421366898 C Bi:4:055:9 0 18 = 70000200 0000000a 00000000 3a000000 0000
ffff8101ef1153c0 421366906 S Bi:4:055:9 -115 13 <
ffff8101ef1153c0 421367898 C Bi:4:055:9 0 13 = 55534253 27070000 00000000 00
ffff8101ef1153c0 421367934 S Bo:4:055:10 -115 31 = 55534243 28070000 00000000 00000600 00000000 00000000 00000000 000000
ffff8101f4734000 421368962 C Bi:4:055:5 -2 0
ffff8101ef1153c0 421368968 C Bo:4:055:10 0 31 >
ffff8101ef1153c0 421368974 S Bi:4:055:9 -115 13 <
ffff8101f4734000 421369029 S Bi:4:055:5 -115 16384 <
ffff8101ef1153c0 421369899 C Bi:4:055:9 0 13 = 55534253 28070000 00000000 01
ffff8101ef1153c0 421369906 S Bo:4:055:10 -115 31 = 55534243 29070000 12000000 80000603 00000012 00000000 00000000 000000
ffff8101ef1153c0 421370899 C Bo:4:055:10 0 31 >
ffff81012d59e780 421370905 S Bi:4:055:9 -115 18 <
ffff81012d59e780 421371899 C Bi:4:055:9 0 18 = 70000200 0000000a 00000000 3a000000 0000
ffff8101ef1153c0 421371906 S Bi:4:055:9 -115 13 <
ffff8101ef1153c0 421372899 C Bi:4:055:9 0 13 = 55534253 29070000 00000000 00
ffff8101f4734000 421419974 C Bi:4:055:5 -2 0
ffff81012d59ed80 421420134 S Bi:4:055:5 -115 16384 <
ffff81012d59ed80 421471973 C Bi:4:055:5 -2 0
ffff81012d59ed80 421472114 S Bi:4:055:5 -115 16384 <
ffff81012d59ed80 421523973 C Bi:4:055:5 -2 0
ffff81012d59ed80 421524108 S Bi:4:055:5 -115 16384 <
ffff81012d59ed80 421575979 C Bi:4:055:5 -2 0
ffff81012d59ed80 421576117 S Bi:4:055:5 -115 16384 <
ffff81012d59ed80 421627982 C Bi:4:055:5 -2 0
ffff81012d59ed80 421628123 S Bi:4:055:5 -115 16384 <
ffff81012d59ed80 421679985 C Bi:4:055:5 -2 0
ffff81012d59ed80 421680381 S Bi:4:055:5 -115 16384 <
ffff81012d59ed80 421733991 C Bi:4:055:5 -2 0
ffff8101f4734cc0 421734109 S Bi:4:055:5 -115 16384 <
ffff8101f4734cc0 421784989 C Bi:4:055:5 -2 0
ffff8101f4734cc0 421785097 S Bi:4:055:5 -115 16384 <
ffff8101f4734cc0 421836990 C Bi:4:055:5 -2 0
ffff8101f4734cc0 421837078 S Bi:4:055:5 -115 16384 <
ffff8101f4734cc0 421888996 C Bi:4:055:5 -2 0
ffff8101f4734cc0 421889088 S Bi:4:055:5 -115 16384 <
ffff8101f4734cc0 421940996 C Bi:4:055:5 -2 0
ffff8101f4734cc0 421941075 S Bi:4:055:5 -115 16384 <
ffff8101f4734cc0 421993001 C Bi:4:055:5 -2 0
ffff8101f4734cc0 421993104 S Bi:4:055:5 -115 16384 <
ffff8101f4734cc0 422045001 C Bi:4:055:5 -2 0
ffff8101f4734cc0 422045080 S Bi:4:055:5 -115 16384 <
ffff8101f4734cc0 422097008 C Bi:4:055:5 -2 0
ffff8101f4734cc0 422097122 S Bi:4:055:5 -115 16384 <
ffff8101f4734cc0 422149008 C Bi:4:055:5 -2 0
ffff8101f4734cc0 422149098 S Bi:4:055:5 -115 16384 <
ffff8101f4734cc0 422201013 C Bi:4:055:5 -2 0
ffff8101f4734cc0 422201093 S Bi:4:055:5 -115 16384 <
ffff8101f4734cc0 422253016 C Bi:4:055:5 -2 0
ffff8101f4734cc0 422253092 S Bi:4:055:5 -115 16384 <
ffff8101f4734cc0 422305017 C Bi:4:055:5 -2 0
ffff8101f4734cc0 422305123 S Bi:4:055:5 -115 16384 <
ffff8101f4734cc0 422357021 C Bi:4:055:5 -2 0
ffff8101f4734cc0 422357107 S Bi:4:055:5 -115 16384 <
ffff8101f4734cc0 422409027 C Bi:4:055:5 -2 0
ffff8101f4734cc0 422409105 S Bi:4:055:5 -115 16384 <
ffff8101f4734840 422440889 S Bo:4:055:6 -115 28 = 00000000 23000000 03000000 00c20100 71677d20 3ccd747d 78563412
ffff8101f4734cc0 422442028 C Bi:4:055:5 0 24 = 00000000 23000000 23000000 00c20100 18000000 78563412
ffff8101f4734840 422442036 C Bo:4:055:6 0 28 >
ffff8101f4734840 422442081 S Bi:4:055:5 -115 16384 <
ffff8101f4734cc0 422444207 S Bi:4:055:5 -115 16384 <
ffff8101f4734840 422493026 C Bi:4:055:5 -2 0
ffff8101f4734840 422493221 S Bo:4:055:6 -115 12 = 01000000 00000000 78563412
ffff8101f4734840 422493966 C Bo:4:055:6 0 12 >
ffff8101f4734840 422494088 S Bo:4:055:6 -115 28 = 00000000 23000000 00000000 00c20100 4242541f d7fc256f 78563412
ffff8101f4734840 422494963 C Bo:4:055:6 0 28 >
ffff8101f4734840 422494994 S Bi:4:055:5 -115 16384 <
ffff8101f4734cc0 422497029 C Bi:4:055:5 -2 0
ffff8101f4734cc0 422497122 S Bi:4:055:5 -115 16384 <
ffff8101f4734840 422549033 C Bi:4:055:5 -2 0
ffff8101f4734cc0 422550032 C Bi:4:055:5 -108 0
ffff8101f4734cc0 422550049 S Co:4:055:0 s 01 0b 0000 0000 0000 0
ffff8101f4734cc0 422550966 C Co:4:055:0 0 0
ffff8101ef1153c0 423363401 S Bo:4:055:10 -115 31 = 55534243 2a070000 00000000 00000600 00000000 00000000 00000000 000000
ffff8101ef1153c0 423365012 C Bo:4:055:10 0 31 >
ffff8101ef1153c0 423365022 S Bi:4:055:9 -115 13 <
ffff8101ef1153c0 423366010 C Bi:4:055:9 0 13 = 55534253 2a070000 00000000 01
ffff8101ef1153c0 423366017 S Bo:4:055:10 -115 31 = 55534243 2b070000 12000000 80000603 00000012 00000000 00000000 000000
ffff8101ef1153c0 423367010 C Bo:4:055:10 0 31 >
ffff810140a01cc0 423367020 S Bi:4:055:9 -115 18 <
ffff810140a01cc0 423368009 C Bi:4:055:9 0 18 = 70000200 0000000a 00000000 3a000000 0000
ffff8101ef1153c0 423368017 S Bi:4:055:9 -115 13 <
ffff8101ef1153c0 423369009 C Bi:4:055:9 0 13 = 55534253 2b070000 00000000 00
ffff8101ef1153c0 423369042 S Bo:4:055:10 -115 31 = 55534243 2c070000 00000000 00000600 00000000 00000000 00000000 000000
ffff8101ef1153c0 423370010 C Bo:4:055:10 0 31 >
ffff8101ef1153c0 423370017 S Bi:4:055:9 -115 13 <
ffff8101ef1153c0 423371010 C Bi:4:055:9 0 13 = 55534253 2c070000 00000000 01
ffff8101ef1153c0 423371017 S Bo:4:055:10 -115 31 = 55534243 2d070000 12000000 80000603 00000012 00000000 00000000 000000
ffff8101ef1153c0 423372011 C Bo:4:055:10 0 31 >
ffff810140a01cc0 423372019 S Bi:4:055:9 -115 18 <
ffff810140a01cc0 423373009 C Bi:4:055:9 0 18 = 70000200 0000000a 00000000 3a000000 0000
ffff8101ef1153c0 423373514 S Bi:4:055:9 -115 13 <
ffff8101ef1153c0 423374011 C Bi:4:055:9 0 13 = 55534253 2d070000 00000000 00
