ffff8102127d3900 3474036639 S Ci:4:013:0 s 80 06 0300 0000 00ff 255 <
ffff8102127d3900 3474039236 C Ci:4:013:0 0 4 = 04030904
ffff8102127d3900 3474039257 S Ci:4:013:0 s 80 06 0301 0409 00ff 255 <
ffff8102127d3900 3474041234 C Ci:4:013:0 0 40 = 28035200 65007300 65006100 72006300 68002000 49006e00 20004d00 6f007400
ffff8102127d3900 3474041271 S Ci:4:013:0 s 80 06 0300 0000 00ff 255 <
ffff8102127d3900 3474043233 C Ci:4:013:0 0 4 = 04030904
ffff8102127d3900 3474043245 S Ci:4:013:0 s 80 06 0305 0409 00ff 255 <
ffff8102127d3900 3474045233 C Ci:4:013:0 0 42 = 2a035200 49004d00 20004300 6f006d00 70006f00 73006900 74006500 20004400
ffff8102127d3900 3474045469 S Bo:4:013:2 -115 16 = 00001000 01ff0000 a818da8d 6c020000
ffff8102127d3900 3474046235 C Bo:4:013:2 0 16 >
ffff8102127d3900 3474046263 S Bi:4:013:1 -115 16384 <
ffff8102127d3900 3475049357 C Bi:4:013:1 -2 0
ffff8100896e1d80 3475049624 S Bo:4:013:4 -115 16 = 00001000 01ff0000 a818da8d 6c020000
ffff8100896e1d80 3475051288 C Bo:4:013:4 0 16 >
ffff8100896e1d80 3475051326 S Bi:4:013:3 -115 16384 <
ffff8100896e1d80 3475052350 C Bi:4:013:3 0 16 = 00001000 02ff0000 a818da8d 6c020000
ffff8100896e1d80 3475056078 S Bo:4:013:6 -115 16 = 00001000 01ff0000 a818da8d 6c020000
ffff8100896e1d80 3475056290 C Bo:4:013:6 0 16 >
ffff8100896e1d80 3475056327 S Bi:4:013:5 -115 16384 <
ffff8100896e1d80 3476061413 C Bi:4:013:5 -2 0
ffff8100896e1d80 3476061661 S Bo:4:013:8 -115 16 = 00001000 01ff0000 a818da8d 6c020000
ffff8100896e1d80 3476063345 C Bo:4:013:8 0 16 >
ffff8100896e1d80 3476063385 S Bi:4:013:7 -115 16384 <
ffff8100896e1d80 3477065468 C Bi:4:013:7 -2 0
ffff8101f4758a80 3477065620 S Co:4:013:0 s 01 0b 0000 0000 0000 0
ffff8101f4758a80 3477067403 C Co:4:013:0 0 0
ffff8101f4758240 3477068243 S Co:4:013:0 s 02 01 0000 0085 0000 0
ffff8101f4758240 3477068404 C Co:4:013:0 0 0
ffff8101f4758240 3477068446 S Co:4:013:0 s 02 01 0000 0006 0000 0
ffff8101f4758240 3477069402 C Co:4:013:0 0 0
ffff8101f4758240 3477069493 S Bo:4:013:6 -115 12 = 01000000 00000000 78563412
ffff8101f4758240 3477070403 C Bo:4:013:6 0 12 >
ffff8101f4758240 3477070439 S Bi:4:013:5 -115 16384 <
ffff8101f4758240 3477252480 C Bi:4:013:5 -2 0
ffff8101f4758240 3477352400 S Bo:4:013:6 -115 12 = 01000000 00000000 78563412
ffff8101f4758240 3477353418 C Bo:4:013:6 0 12 >
ffff8101f4758240 3477353456 S Bi:4:013:5 -115 16384 <
ffff8101f4758240 3477536491 C Bi:4:013:5 -2 0
ffff8101f47586c0 3477636409 S Bo:4:013:6 -115 12 = 01000000 00000000 78563412
ffff8101f47586c0 3477637437 C Bo:4:013:6 0 12 >
ffff8101f47586c0 3477637477 S Bi:4:013:5 -115 16384 <
ffff8101f47586c0 3477821510 C Bi:4:013:5 -2 0
ffff8101f47586c0 3477920397 S Bo:4:013:6 -115 12 = 01000000 00000000 78563412
ffff8101f47586c0 3477921450 C Bo:4:013:6 0 12 >
ffff8101f47586c0 3477921492 S Bi:4:013:5 -115 16384 <
ffff8101f47586c0 3478104529 C Bi:4:013:5 -2 0
ffff8101f47586c0 3478204447 S Bo:4:013:6 -115 12 = 01000000 00000000 78563412
ffff8101f47586c0 3478205466 C Bo:4:013:6 0 12 >
ffff8101f47586c0 3478205506 S Bi:4:013:5 -115 16384 <
ffff8101f47586c0 3478388543 C Bi:4:013:5 -2 0
ffff8100896e1cc0 3478487899 S Bo:4:013:6 -115 12 = 01000000 00000000 78563412
ffff8100896e1cc0 3478489483 C Bo:4:013:6 0 12 >
ffff8100896e1cc0 3478489537 S Bi:4:013:5 -115 16384 <
ffff8100896e1cc0 3478672560 C Bi:4:013:5 -2 0
ffff8100896e1cc0 3478771899 S Bo:4:013:6 -115 12 = 01000000 00000000 78563412
ffff8100896e1cc0 3478773498 C Bo:4:013:6 0 12 >
ffff8100896e1cc0 3478773552 S Bi:4:013:5 -115 16384 <
ffff8100896e1cc0 3478956574 C Bi:4:013:5 -2 0
ffff8100896e19c0 3479055899 S Bo:4:013:6 -115 12 = 01000000 00000000 78563412
ffff8100896e19c0 3479057514 C Bo:4:013:6 0 12 >
ffff8100896e19c0 3479057567 S Bi:4:013:5 -115 16384 <
ffff8100896e19c0 3479240589 C Bi:4:013:5 -2 0
ffff8101f45a0180 3479339899 S Bo:4:013:6 -115 12 = 01000000 00000000 78563412
ffff8101f45a0180 3479341530 C Bo:4:013:6 0 12 >
ffff8101f45a0180 3479341584 S Bi:4:013:5 -115 16384 <
ffff8101f45a0180 3479524606 C Bi:4:013:5 -2 0
ffff8101c0701d80 3479623908 S Bo:4:013:6 -115 12 = 01000000 00000000 78563412
ffff8101c0701d80 3479625545 C Bo:4:013:6 0 12 >
ffff8101c0701d80 3479625627 S Bi:4:013:5 -115 16384 <
ffff8101c0701d80 3479808623 C Bi:4:013:5 -2 0
ffff8101c0701d80 3479907904 S Bo:4:013:6 -115 12 = 01000000 00000000 78563412
ffff8101c0701d80 3479909561 C Bo:4:013:6 0 12 >
ffff8101c0701d80 3479909611 S Bi:4:013:5 -115 16384 <
ffff8101c0701d80 3480093639 C Bi:4:013:5 -2 0
ffff8101eb79d0c0 3480191895 S Bo:4:013:6 -115 12 = 01000000 00000000 78563412
ffff8101eb79d0c0 3480193578 C Bo:4:013:6 0 12 >
ffff8101eb79d0c0 3480193625 S Bi:4:013:5 -115 16384 <
ffff8101eb79d0c0 3480376652 C Bi:4:013:5 -2 0
ffff8101eb79d0c0 3480475895 S Bo:4:013:6 -115 12 = 01000000 00000000 78563412
ffff8101eb79d0c0 3480477593 C Bo:4:013:6 0 12 >
ffff8101eb79d0c0 3480477641 S Bi:4:013:5 -115 16384 <
ffff8101eb79d0c0 3480660669 C Bi:4:013:5 -2 0
ffff8101f886b540 3480759897 S Bo:4:013:6 -115 12 = 01000000 00000000 78563412
ffff8101f886b540 3480761609 C Bo:4:013:6 0 12 >
ffff8101f886b540 3480761658 S Bi:4:013:5 -115 16384 <
ffff8101f886b540 3480944684 C Bi:4:013:5 -2 0
ffff8101f886b540 3481043903 S Bo:4:013:6 -115 12 = 01000000 00000000 78563412
ffff8101f886b540 3481045624 C Bo:4:013:6 0 12 >
ffff8101f886b540 3481045674 S Bi:4:013:5 -115 16384 <
ffff8101f886b540 3481228700 C Bi:4:013:5 -2 0
ffff8101851a5d80 3481327920 S Bo:4:013:6 -115 12 = 01000000 00000000 78563412
ffff8101851a5d80 3481329641 C Bo:4:013:6 0 12 >
ffff8101851a5d80 3481329692 S Bi:4:013:5 -115 16384 <
ffff8101851a5d80 3481512715 C Bi:4:013:5 -2 0
ffff81013212c300 3481611891 S Bo:4:013:6 -115 12 = 01000000 00000000 78563412
ffff81013212c300 3481613655 C Bo:4:013:6 0 12 >
ffff81013212c300 3481613705 S Bi:4:013:5 -115 16384 <
ffff81013212c300 3481796732 C Bi:4:013:5 -2 0
ffff81013212c300 3481895896 S Bo:4:013:6 -115 12 = 01000000 00000000 78563412
ffff81013212c300 3481897672 C Bo:4:013:6 0 12 >
ffff81013212c300 3481897720 S Bi:4:013:5 -115 16384 <
ffff81013212c300 3482080748 C Bi:4:013:5 -2 0
ffff8101c0580780 3482179895 S Bo:4:013:6 -115 12 = 01000000 00000000 78563412
ffff8101c0580780 3482181688 C Bo:4:013:6 0 12 >
ffff8101c0580780 3482181740 S Bi:4:013:5 -115 16384 <
ffff8101c0580780 3482364762 C Bi:4:013:5 -2 0
ffff8101c0580780 3482463894 S Bo:4:013:6 -115 12 = 01000000 00000000 78563412
ffff8101c0580780 3482465703 C Bo:4:013:6 0 12 >
ffff8101c0580780 3482465752 S Bi:4:013:5 -115 16384 <
ffff8101c0580780 3482648780 C Bi:4:013:5 -2 0
ffff8101facb76c0 3482747897 S Bo:4:013:6 -115 12 = 01000000 00000000 78563412
ffff8101facb76c0 3482749719 C Bo:4:013:6 0 12 >
ffff8101facb76c0 3482749770 S Bi:4:013:5 -115 16384 <
ffff8101facb76c0 3482932796 C Bi:4:013:5 -2 0
ffff8101facb76c0 3483031888 S Bo:4:013:6 -115 12 = 01000000 00000000 78563412
ffff8101facb76c0 3483033735 C Bo:4:013:6 0 12 >
ffff8101facb76c0 3483033784 S Bi:4:013:5 -115 16384 <
ffff8101facb76c0 3483216818 C Bi:4:013:5 -2 0
ffff81009f16d300 3483315892 S Bo:4:013:6 -115 12 = 01000000 00000000 78563412
ffff81009f16d300 3483317752 C Bo:4:013:6 0 12 >
ffff81009f16d300 3483317802 S Bi:4:013:5 -115 16384 <
ffff81009f16d300 3483500828 C Bi:4:013:5 -2 0
ffff8100897dfcc0 3483599888 S Bo:4:013:6 -115 12 = 01000000 00000000 78563412
ffff8100897dfcc0 3483601766 C Bo:4:013:6 0 12 >
ffff8100897dfcc0 3483601823 S Bi:4:013:5 -115 16384 <
ffff8100897dfcc0 3483784843 C Bi:4:013:5 -2 0
ffff8100897dff00 3483883903 S Bo:4:013:6 -115 12 = 01000000 00000000 78563412
ffff8100897dff00 3483885782 C Bo:4:013:6 0 12 >
ffff8100897dff00 3483885839 S Bi:4:013:5 -115 16384 <
ffff8100897dff00 3484068862 C Bi:4:013:5 -2 0
ffff8100897df600 3484167893 S Bo:4:013:6 -115 12 = 01000000 00000000 78563412
ffff8100897df600 3484169799 C Bo:4:013:6 0 12 >
ffff8100897df600 3484169859 S Bi:4:013:5 -115 16384 <
ffff8100897df600 3484352876 C Bi:4:013:5 -2 0
ffff8100897df0c0 3484451900 S Bo:4:013:6 -115 12 = 01000000 00000000 78563412
ffff8100897df0c0 3484453814 C Bo:4:013:6 0 12 >
ffff8100897df0c0 3484453869 S Bi:4:013:5 -115 16384 <
ffff8100897df0c0 3484636892 C Bi:4:013:5 -2 0
ffff8100897df540 3484735905 S Bo:4:013:6 -115 12 = 01000000 00000000 78563412
ffff8100897df540 3484737831 C Bo:4:013:6 0 12 >
ffff8100897df540 3484737888 S Bi:4:013:5 -115 16384 <
ffff8100897df540 3484920906 C Bi:4:013:5 -2 0
ffff8100897df540 3485020210 S Bo:4:013:6 -115 12 = 01000000 00000000 78563412
ffff8100897df540 3485021850 C Bo:4:013:6 0 12 >
ffff8100897df540 3485022157 S Bi:4:013:5 -115 16384 <
ffff8100897df540 3485204923 C Bi:4:013:5 -2 0
ffff8100897df540 3485303956 S Bo:4:013:6 -115 12 = 01000000 00000000 78563412
ffff8100897df540 3485305862 C Bo:4:013:6 0 12 >
ffff8100897df540 3485305916 S Bi:4:013:5 -115 16384 <
ffff8100897df540 3485487939 C Bi:4:013:5 -2 0
ffff8100897df540 3485587895 S Bo:4:013:6 -115 12 = 01000000 00000000 78563412
ffff8100897df540 3485589877 C Bo:4:013:6 0 12 >
ffff8100897df540 3485589931 S Bi:4:013:5 -115 16384 <
ffff8100897df540 3485772956 C Bi:4:013:5 -2 0
ffff81019bd8a300 3485871915 S Bo:4:013:6 -115 12 = 01000000 00000000 78563412
ffff81019bd8a300 3485873896 C Bo:4:013:6 0 12 >
ffff81019bd8a300 3485873933 S Bi:4:013:5 -115 16384 <
ffff81019bd8a300 3486056971 C Bi:4:013:5 -2 0
ffff81019bd8a300 3486155876 S Bo:4:013:6 -115 12 = 01000000 00000000 78563412
ffff81019bd8a300 3486156912 C Bo:4:013:6 0 12 >
ffff81019bd8a300 3486156947 S Bi:4:013:5 -115 16384 <
ffff81019bd8a300 3486340987 C Bi:4:013:5 -2 0
ffff81019bd8a300 3486440371 S Bo:4:013:6 -115 12 = 01000000 00000000 78563412
ffff81019bd8a300 3486441929 C Bo:4:013:6 0 12 >
ffff81019bd8a300 3486441962 S Bi:4:013:5 -115 16384 <
ffff81019bd8a300 3486625003 C Bi:4:013:5 -2 0
ffff81019bd8a300 3486724385 S Bo:4:013:6 -115 12 = 01000000 00000000 78563412
ffff81019bd8a300 3486725946 C Bo:4:013:6 0 12 >
ffff81019bd8a300 3486725982 S Bi:4:013:5 -115 16384 <
ffff81019bd8a300 3486909018 C Bi:4:013:5 -2 0
ffff81019bd8a300 3487008390 S Bo:4:013:6 -115 12 = 01000000 00000000 78563412
ffff81019bd8a300 3487009960 C Bo:4:013:6 0 12 >
ffff81019bd8a300 3487009993 S Bi:4:013:5 -115 16384 <
ffff81019bd8a300 3487193034 C Bi:4:013:5 -2 0
ffff81019bd8a300 3487292376 S Bo:4:013:6 -115 12 = 01000000 00000000 78563412
ffff81019bd8a300 3487293976 C Bo:4:013:6 0 12 >
ffff81019bd8a300 3487294010 S Bi:4:013:5 -115 16384 <
ffff81019bd8a300 3487477051 C Bi:4:013:5 -2 0
ffff81019bd8aa80 3487514666 S Co:4:013:0 s 01 0b 0000 0000 0000 0
ffff81019bd8aa80 3487515989 C Co:4:013:0 0 0
ffff810133286cc0 3672704133 S Ci:4:013:0 s 80 06 0300 0000 00ff 255 <
ffff810133286cc0 3672706296 C Ci:4:013:0 0 4 = 04030904
ffff810133286cc0 3672706328 S Ci:4:013:0 s 80 06 0301 0409 00ff 255 <
ffff810133286cc0 3672708295 C Ci:4:013:0 0 40 = 28035200 65007300 65006100 72006300 68002000 49006e00 20004d00 6f007400
ffff810133286cc0 3672708351 S Ci:4:013:0 s 80 06 0300 0000 00ff 255 <
ffff810133286cc0 3672710294 C Ci:4:013:0 0 4 = 04030904
ffff810133286cc0 3672710318 S Ci:4:013:0 s 80 06 0305 0409 00ff 255 <
ffff810133286cc0 3672712295 C Ci:4:013:0 0 42 = 2a035200 49004d00 20004300 6f006d00 70006f00 73006900 74006500 20004400
ffff810133286cc0 3672712552 S Bo:4:013:2 -115 16 = 00001000 01ff0000 a818da8d 6c020000
ffff810133286cc0 3672713295 C Bo:4:013:2 0 16 >
ffff810133286cc0 3672713334 S Bi:4:013:1 -115 16384 <
ffff810133286cc0 3673717419 C Bi:4:013:1 -2 0
ffff810133286cc0 3673717657 S Bo:4:013:4 -115 16 = 00001000 01ff0000 a818da8d 6c020000
ffff810133286cc0 3673719350 C Bo:4:013:4 0 16 >
ffff810133286cc0 3673719391 S Bi:4:013:3 -115 16384 <
ffff810133286cc0 3673720413 C Bi:4:013:3 0 16 = 00001000 02ff0000 a818da8d 6c020000
ffff810133286cc0 3673723944 S Bo:4:013:6 -115 16 = 00001000 01ff0000 a818da8d 6c020000
ffff810133286cc0 3673724351 C Bo:4:013:6 0 16 >
ffff810133286cc0 3673724386 S Bi:4:013:5 -115 16384 <
ffff810133286cc0 3674729475 C Bi:4:013:5 -2 0
ffff810133286cc0 3674729706 S Bo:4:013:8 -115 16 = 00001000 01ff0000 a818da8d 6c020000
ffff810133286cc0 3674731406 C Bo:4:013:8 0 16 >
ffff810133286cc0 3674731447 S Bi:4:013:7 -115 16384 <
ffff810133286cc0 3675733529 C Bi:4:013:7 -2 0
ffff810133286cc0 3675733699 S Co:4:013:0 s 01 0b 0000 0000 0000 0
ffff810133286cc0 3675735463 C Co:4:013:0 0 0
ffff810133286780 3675735864 S Co:4:013:0 s 02 01 0000 0085 0000 0
ffff810133286780 3675736463 C Co:4:013:0 0 0
ffff810133286780 3675736491 S Co:4:013:0 s 02 01 0000 0006 0000 0
ffff810133286780 3675737463 C Co:4:013:0 0 0
ffff810133286780 3675737578 S Bo:4:013:6 -115 12 = 01000000 00000000 78563412
ffff810133286780 3675738463 C Bo:4:013:6 0 12 >
ffff810133286780 3675738510 S Bi:4:013:5 -115 16384 <
ffff810133286780 3675920539 C Bi:4:013:5 -2 0
ffff810133286780 3676019870 S Bo:4:013:6 -115 12 = 01000000 00000000 78563412
ffff810133286780 3676021480 C Bo:4:013:6 0 12 >
ffff810133286780 3676021525 S Bi:4:013:5 -115 16384 <
ffff810133286780 3676204560 C Bi:4:013:5 -2 0
ffff810114d70840 3676304438 S Bo:4:013:6 -115 12 = 01000000 00000000 78563412
ffff810114d70840 3676305497 C Bo:4:013:6 0 12 >
ffff810114d70840 3676305535 S Bi:4:013:5 -115 16384 <
ffff810114d70840 3676488574 C Bi:4:013:5 -2 0
ffff810114d70d80 3676588398 S Bo:4:013:6 -115 12 = 01000000 00000000 78563412
ffff810114d70d80 3676589512 C Bo:4:013:6 0 12 >
ffff810114d70d80 3676589549 S Bi:4:013:5 -115 16384 <
ffff810114d70d80 3676773590 C Bi:4:013:5 -2 0
ffff810114d70d80 3676872399 S Bo:4:013:6 -115 12 = 01000000 00000000 78563412
ffff810114d70d80 3676873528 C Bo:4:013:6 0 12 >
ffff810114d70d80 3676873567 S Bi:4:013:5 -115 16384 <
ffff810114d70d80 3677056600 C Bi:4:013:5 -2 0
ffff810114d70a80 3677156388 S Bo:4:013:6 -115 12 = 01000000 00000000 78563412
ffff810114d70a80 3677157543 C Bo:4:013:6 0 12 >
ffff810114d70a80 3677157580 S Bi:4:013:5 -115 16384 <
ffff810114d70a80 3677340619 C Bi:4:013:5 -2 0
ffff810114d70a80 3677440402 S Bo:4:013:6 -115 12 = 01000000 00000000 78563412
ffff810114d70a80 3677441559 C Bo:4:013:6 0 12 >
ffff810114d70a80 3677441599 S Bi:4:013:5 -115 16384 <
ffff810114d70a80 3677624634 C Bi:4:013:5 -2 0
ffff810114d70540 3677724402 S Bo:4:013:6 -115 12 = 01000000 00000000 78563412
ffff810114d70540 3677725577 C Bo:4:013:6 0 12 >
ffff810114d70540 3677725616 S Bi:4:013:5 -115 16384 <
ffff810114d70540 3677908651 C Bi:4:013:5 -2 0
ffff810114d70540 3678008392 S Bo:4:013:6 -115 12 = 01000000 00000000 78563412
ffff810114d70540 3678009590 C Bo:4:013:6 0 12 >
ffff810114d70540 3678009628 S Bi:4:013:5 -115 16384 <
ffff810114d70540 3678192668 C Bi:4:013:5 -2 0
ffff810114d70540 3678292719 S Bo:4:013:6 -115 12 = 01000000 00000000 78563412
ffff810114d70540 3678294607 C Bo:4:013:6 0 12 >
ffff810114d70540 3678294669 S Bi:4:013:5 -115 16384 <
ffff810114d70540 3678476681 C Bi:4:013:5 -2 0
ffff810114d70540 3678576401 S Bo:4:013:6 -115 12 = 01000000 00000000 78563412
ffff810114d70540 3678577623 C Bo:4:013:6 0 12 >
ffff810114d70540 3678577666 S Bi:4:013:5 -115 16384 <
ffff810114d70540 3678760702 C Bi:4:013:5 -2 0
ffff810114d70540 3678859901 S Bo:4:013:6 -115 12 = 01000000 00000000 78563412
ffff810114d70540 3678861642 C Bo:4:013:6 0 12 >
ffff810114d70540 3678861681 S Bi:4:013:5 -115 16384 <
ffff810114d70540 3679044715 C Bi:4:013:5 -2 0
ffff810114d70780 3679144395 S Bo:4:013:6 -115 12 = 01000000 00000000 78563412
ffff810114d70780 3679145655 C Bo:4:013:6 0 12 >
ffff810114d70780 3679145694 S Bi:4:013:5 -115 16384 <
ffff810114d70780 3679328730 C Bi:4:013:5 -2 0
ffff810114d70240 3679432484 S Bo:4:013:6 -115 12 = 01000000 00000000 78563412
ffff810114d70240 3679433675 C Bo:4:013:6 0 12 >
ffff810114d70240 3679433752 S Bi:4:013:5 -115 16384 <
ffff810114d70240 3679616749 C Bi:4:013:5 -2 0
ffff810114d70a80 3679716403 S Bo:4:013:6 -115 12 = 01000000 00000000 78563412
ffff810114d70a80 3679717688 C Bo:4:013:6 0 12 >
ffff810114d70a80 3679717728 S Bi:4:013:5 -115 16384 <
ffff810114d70a80 3679900763 C Bi:4:013:5 -2 0
ffff810114d703c0 3679905608 S Co:4:013:0 s 01 0b 0000 0000 0000 0
ffff810114d703c0 3679906696 C Co:4:013:0 0 0
