######### this is mostly windows stuff (USB polling etc... for a while (~halfway)#######
ffff81019bc1b000 2240850967 C Bi:4:012:3 -84 0
ffff81019bc1b0c0 2240850995 C Bi:4:012:5 -84 0
ffff810089b61000 2240851016 C Bi:4:012:7 -84 0
ffff81021131ae40 2240863780 C Ii:4:001:1 0:128 1 = 02
ffff81021131ae40 2240863787 S Ii:4:001:1 -115:128 2 <
ffff8100b66d1a80 2240863796 S Ci:4:001:0 s a3 00 0000 0001 0004 4 <
ffff8100b66d1a80 2240863801 C Ci:4:001:0 0 4 = 00010300
ffff8100b66d1a80 2240863805 S Co:4:001:0 s 23 01 0010 0001 0000 0
ffff8100b66d1a80 2240863808 C Co:4:001:0 0 0
ffff8100b66d1a80 2240863809 S Co:4:001:0 s 23 01 0011 0001 0000 0
ffff8100b66d1a80 2240863812 C Co:4:001:0 0 0
ffff8100b66d1a80 2240864536 S Ci:4:001:0 s a3 00 0000 0001 0004 4 <
ffff8100b66d1a80 2240864541 C Ci:4:001:0 0 4 = 00010000
ffff8101facc1180 2240895991 S Ci:4:001:0 s a3 00 0000 0001 0004 4 <
ffff8101facc1180 2240896000 C Ci:4:001:0 0 4 = 00010000
ffff8101eb79da80 2240927803 S Ci:4:001:0 s a3 00 0000 0001 0004 4 <
ffff8101eb79da80 2240927811 C Ci:4:001:0 0 4 = 00010000
ffff8101eb79d840 2240959853 S Ci:4:001:0 s a3 00 0000 0001 0004 4 <
ffff8101eb79d840 2240959862 C Ci:4:001:0 0 4 = 00010000
ffff8101eb79d840 2240991869 S Ci:4:001:0 s a3 00 0000 0001 0004 4 <
ffff8101eb79d840 2240991878 C Ci:4:001:0 0 4 = 00010000
ffff81021131ae40 2243535780 C Ii:4:001:1 -2:128 0
ffff8101eb79da80 2244719780 S Ci:4:001:0 s a3 00 0000 0001 0004 4 <
ffff8101eb79da80 2244719787 C Ci:4:001:0 0 4 = 01010100
ffff8101eb79da80 2244719790 S Ci:4:001:0 s a3 00 0000 0002 0004 4 <
ffff8101eb79da80 2244719794 C Ci:4:001:0 0 4 = 00010000
ffff81021131ae40 2244719796 S Ii:4:001:1 -115:128 2 <
ffff81021131ae40 2244723778 C Ii:4:001:1 0:128 1 = 02
ffff81021131ae40 2244723781 S Ii:4:001:1 -115:128 2 <
ffff8101eb79d240 2244735802 S Ci:4:001:0 s a3 00 0000 0001 0004 4 <
ffff8101eb79d240 2244735807 C Ci:4:001:0 0 4 = 01010100
ffff8101eb79d240 2244735809 S Co:4:001:0 s 23 01 0010 0001 0000 0
ffff8101eb79d240 2244735812 C Co:4:001:0 0 0
ffff8101eb79d240 2244735814 S Ci:4:001:0 s a3 00 0000 0001 0004 4 <
ffff8101eb79d240 2244735818 C Ci:4:001:0 0 4 = 01010000
ffff8101eb79db40 2244767776 S Ci:4:001:0 s a3 00 0000 0001 0004 4 <
ffff8101eb79db40 2244767783 C Ci:4:001:0 0 4 = 01010000
ffff8101eb79db40 2244799776 S Ci:4:001:0 s a3 00 0000 0001 0004 4 <
ffff8101eb79db40 2244799784 C Ci:4:001:0 0 4 = 01010000
ffff8101eb79db40 2244831782 S Ci:4:001:0 s a3 00 0000 0001 0004 4 <
ffff8101eb79db40 2244831788 C Ci:4:001:0 0 4 = 01010000
ffff8101eb79db40 2244863774 S Ci:4:001:0 s a3 00 0000 0001 0004 4 <
ffff8101eb79db40 2244863781 C Ci:4:001:0 0 4 = 01010000
ffff8101eb79db40 2244863789 S Co:4:001:0 s 23 03 0004 0001 0000 0
ffff8101eb79db40 2244863793 C Co:4:001:0 0 0
ffff8101eb79db40 2244919776 S Ci:4:001:0 s a3 00 0000 0001 0004 4 <
ffff8101eb79db40 2244919798 C Ci:4:001:0 0 4 = 01010000
ffff8101eb79db40 2244975776 S Ci:4:001:0 s a3 00 0000 0001 0004 4 <
ffff8101eb79db40 2244975783 C Ci:4:001:0 0 4 = 03010000
ffff8101eb79db40 2245031778 S Co:4:001:0 s 23 01 0014 0001 0000 0
ffff8101eb79db40 2245031782 C Co:4:001:0 0 0
ffff8101eb79db40 2245031797 S Ci:4:000:0 s 80 06 0100 0000 0040 64 <
ffff8101eb79db40 2245035807 C Ci:4:000:0 0 16 = 12011001 00000010 ca0f0400 07010105
ffff8101eb79db40 2245035815 S Co:4:001:0 s 23 03 0004 0001 0000 0
ffff8101eb79db40 2245035819 C Co:4:001:0 0 0
ffff81021131ae40 2245079777 C Ii:4:001:1 0:128 1 = 02
ffff81021131ae40 2245079780 S Ii:4:001:1 -115:128 2 <
ffff8101eb79db40 2245091778 S Ci:4:001:0 s a3 00 0000 0001 0004 4 <
ffff8101eb79db40 2245091800 C Ci:4:001:0 0 4 = 03010000
ffff8101eb79db40 2245147774 S Co:4:001:0 s 23 01 0014 0001 0000 0
ffff8101eb79db40 2245147777 C Co:4:001:0 0 0
ffff8101eb79db40 2245147780 S Co:4:000:0 s 00 05 000d 0000 0000 0
ffff8101eb79db40 2245149812 C Co:4:000:0 0 0
ffff8101eb79db40 2245167781 S Ci:4:013:0 s 80 06 0100 0000 0012 18 <
ffff8101eb79db40 2245171815 C Ci:4:013:0 0 18 = 12011001 00000010 ca0f0400 07010105 0301
ffff8101eb79db40 2245171828 S Ci:4:013:0 s 80 06 0200 0000 0009 9 <
ffff8101eb79db40 2245175812 C Ci:4:013:0 0 9 = 09026100 02010080 fa
ffff8101eb79db40 2245176015 S Ci:4:013:0 s 80 06 0200 0000 0061 97 <
ffff8101eb79db40 2245185825 C Ci:4:013:0 0 97 = 09026100 02010080 fa090400 0008ff01 ff020705 81024000 00070502 02400000
ffff8101eb79db40 2245185852 S Ci:4:013:0 s 80 06 0300 0000 00ff 255 <
ffff8101eb79db40 2245190816 C Ci:4:013:0 0 4 = 04030904
ffff8101eb79db40 2245190828 S Ci:4:013:0 s 80 06 0305 0409 00ff 255 <
ffff8101eb79db40 2245197813 C Ci:4:013:0 0 42 = 2a035200 49004d00 20004300 6f006d00 70006f00 73006900 74006500 20004400
ffff8101eb79db40 2245197821 S Ci:4:013:0 s 80 06 0301 0409 00ff 255 <
ffff8101eb79db40 2245204813 C Ci:4:013:0 0 40 = 28035200 65007300 65006100 72006300 68002000 49006e00 20004d00 6f007400
ffff8101eb79db40 2245204822 S Ci:4:013:0 s 80 06 0303 0409 00ff 255 <
ffff8101eb79db40 2245214814 C Ci:4:013:0 0 82 = 52033200 42004500 34003100 33003400 35003000 34004200 38004600 30003800
ffff8101eb79db40 2245214954 S Co:4:013:0 s 00 09 0001 0000 0000 0
ffff8101eb79db40 2245217813 C Co:4:013:0 0 0
ffff8101eb79db40 2245217868 S Ci:4:013:0 s 80 06 0302 0409 00ff 255 <
ffff8101eb79db40 2245220820 C Ci:4:013:0 0 22 = 16034200 6c006100 63006b00 42006500 72007200 7900
ffff8101eb418540 2245256406 S Ci:4:013:0 s 80 06 0304 0409 00ff 255 <
ffff8101eb418540 2245258817 C Ci:4:013:0 0 48 = 30035200 49004d00 20004d00 61007300 73002000 53007400 6f007200 61006700
ffff8101eb418540 2245258955 S Ci:4:001:0 s a3 00 0000 0002 0004 4 <
ffff8101eb418540 2245258962 C Ci:4:001:0 0 4 = 00010000
ffff8101eb418540 2245258966 S Ci:4:001:0 s a3 00 0000 0001 0004 4 <
ffff8101eb418540 2245258970 C Ci:4:001:0 0 4 = 03010000
ffff81019bd8ad80 2245372749 S Ci:4:013:0 s 80 06 0100 0000 0012 18 <
ffff81019bd8ad80 2245373830 C Ci:4:013:0 0 18 = 12011001 00000010 ca0f0400 07010105 0301
ffff81019bd8ad80 2245373964 S Ci:4:013:0 s 80 06 0200 0000 0009 9 <
ffff81019bd8ad80 2245374827 C Ci:4:013:0 0 9 = 09026100 02010080 fa
ffff81019bd8ad80 2245374909 S Ci:4:013:0 s 80 06 0200 0000 0061 97 <
ffff81019bd8ad80 2245375830 C Ci:4:013:0 0 97 = 09026100 02010080 fa090400 0008ff01 ff020705 81024000 00070502 02400000
ffff81019bd8ad80 2245376035 S Co:4:013:0 s 01 0b 0000 0001 0000 0
ffff81019bd8ad80 2245376830 C Co:4:013:0 0 0
ffff8101f45dc840 2245520827 S Ci:4:013:0 s 80 06 0100 0000 0040 64 <
ffff8101f45dc840 2245523834 C Ci:4:013:0 0 18 = 12011001 00000010 ca0f0400 07010105 0301
ffff8101f45dc840 2245560832 S Ci:4:013:0 s 80 06 0100 0000 0012 18 <
ffff8101f45dc840 2245562839 C Ci:4:013:0 0 18 = 12011001 00000010 ca0f0400 07010105 0301
ffff8101f45dc840 2245564825 S Ci:4:013:0 s 80 06 0200 0000 0009 9 <
ffff8101f45dc840 2245565835 C Ci:4:013:0 0 9 = 09026100 02010080 fa
ffff8101f45dc840 2245568874 S Ci:4:013:0 s 80 06 0300 0000 00ff 255 <
ffff8101f45dc840 2245570835 C Ci:4:013:0 0 4 = 04030904
ffff8101f45dc840 2245572833 S Ci:4:013:0 s 80 06 0303 0409 00ff 255 <
ffff8101f45dc840 2245574835 C Ci:4:013:0 0 82 = 52033200 42004500 34003100 33003400 35003000 34004200 38004600 30003800
ffff8101f45dc840 2245576834 S Ci:4:013:0 s 80 06 0200 0000 00ff 255 <
ffff8101f45dc840 2245578835 C Ci:4:013:0 0 97 = 09026100 02010080 fa090400 0008ff01 ff020705 81024000 00070502 02400000
ffff8101f45dc840 2245581845 S Ci:4:013:0 s 80 06 0300 0000 00ff 255 <
ffff8101f45dc840 2245583836 C Ci:4:013:0 0 4 = 04030904
ffff8101f45dc840 2245584833 S Ci:4:013:0 s 80 06 0305 0409 00ff 255 <
ffff8101f45dc840 2245586835 C Ci:4:013:0 0 42 = 2a035200 49004d00 20004300 6f006d00 70006f00 73006900 74006500 20004400
ffff8101f45dc840 2245588824 S Ci:4:013:0 s 80 06 0300 0000 00ff 255 <
ffff8101f45dc840 2245590837 C Ci:4:013:0 0 4 = 04030904
ffff8101f45dc840 2245592876 S Ci:4:013:0 s 80 06 0305 0409 00ff 255 <
ffff8101f45dc840 2245594836 C Ci:4:013:0 0 42 = 2a035200 49004d00 20004300 6f006d00 70006f00 73006900 74006500 20004400
ffff8101f45dc840 2245598913 S Ci:4:013:0 s 80 06 0100 0000 0012 18 <
ffff8101f45dc840 2245599837 C Ci:4:013:0 0 18 = 12011001 00000010 ca0f0400 07010105 0301
ffff8101f45dc840 2245600838 S Ci:4:013:0 s 80 06 0200 0000 00ff 255 <
ffff8101f45dc840 2245602838 C Ci:4:013:0 0 97 = 09026100 02010080 fa090400 0008ff01 ff020705 81024000 00070502 02400000
ffff8101f45dc840 2245606010 S Ci:4:013:0 s 80 06 0300 0000 00ff 255 <
ffff8101f45dc840 2245607837 C Ci:4:013:0 0 4 = 04030904
ffff8101f45dc840 2245608975 S Ci:4:013:0 s 80 06 0305 0409 00ff 255 <
ffff8101f45dc840 2245610837 C Ci:4:013:0 0 42 = 2a035200 49004d00 20004300 6f006d00 70006f00 73006900 74006500 20004400
ffff8101f45dc840 2245611903 S Ci:4:013:0 s 80 06 0300 0000 00ff 255 <
ffff8101f45dc840 2245613836 C Ci:4:013:0 0 4 = 04030904
ffff8101f45dc840 2245615913 S Ci:4:013:0 s 80 06 0305 0409 00ff 255 <
ffff8101f45dc840 2245617837 C Ci:4:013:0 0 42 = 2a035200 49004d00 20004300 6f006d00 70006f00 73006900 74006500 20004400
ffff8101f45dc840 2245627190 S Ci:4:013:0 s 80 06 0300 0000 00ff 255 <
ffff8101f45dc840 2245628838 C Ci:4:013:0 0 4 = 04030904
ffff8101f45dc840 2245630180 S Ci:4:013:0 s 80 06 0305 0409 00ff 255 <
ffff8101f45dc840 2245631838 C Ci:4:013:0 0 42 = 2a035200 49004d00 20004300 6f006d00 70006f00 73006900 74006500 20004400
ffff8101f45dc840 2245633185 S Ci:4:013:0 s 80 06 0300 0000 00ff 255 <
ffff8101f45dc840 2245634840 C Ci:4:013:0 0 4 = 04030904
ffff8101f45dc840 2245636262 S Ci:4:013:0 s 80 06 0305 0409 00ff 255 <
ffff8101f45dc840 2245637838 C Ci:4:013:0 0 42 = 2a035200 49004d00 20004300 6f006d00 70006f00 73006900 74006500 20004400
ffff8101f45dc840 2245655318 S Ci:4:013:0 s 80 06 0100 0000 0012 18 <
ffff8101f45dc840 2245656843 C Ci:4:013:0 0 18 = 12011001 00000010 ca0f0400 07010105 0301
ffff8101f45dc840 2245658464 S Ci:4:013:0 s 80 06 0300 0000 0002 2 <
ffff8101f45dc840 2245658841 C Ci:4:013:0 0 2 = 0403
ffff8101f45dc840 2245660341 S Ci:4:013:0 s 80 06 0300 0000 0004 4 <
ffff8101f45dc840 2245660841 C Ci:4:013:0 0 4 = 04030904
ffff8101f45dc840 2245662223 S Ci:4:013:0 s 80 06 0303 0409 0002 2 <
ffff8101f45dc840 2245662841 C Ci:4:013:0 0 2 = 5203
ffff8101f45dc840 2245664204 S Ci:4:013:0 s 80 06 0303 0409 0052 82 <
ffff8101f45dc840 2245664842 C Ci:4:013:0 0 82 = 52033200 42004500 34003100 33003400 35003000 34004200 38004600 30003800
ffff8101f45dc840 2245666405 S Co:4:013:0 s 02 01 0000 0089 0000 0
ffff8101f45dc840 2245666840 C Co:4:013:0 0 0
ffff8101f45dc840 2245668349 S Co:4:013:0 s 02 01 0000 000a 0000 0
ffff8101f45dc840 2245668840 C Co:4:013:0 0 0
ffff8101f45dc840 2245669257 S Ci:4:013:0 s a1 fe 0000 0001 0001 1 <
ffff8101f45dc840 2245669841 C Ci:4:013:0 0 1 = 00
ffff8101f45dc840 2245671385 S Bo:4:013:10 -115 31 = 55534243 88619c80 24000000 80000612 00000024 00000000 00000000 000000
ffff8101f45dc840 2245671840 C Bo:4:013:10 0 31 >
ffff8101f45dc840 2245673291 S Bi:4:013:9 -115 36 <
ffff8101f45dc840 2245673840 C Bi:4:013:9 0 36 = 00800401 1f000000 52494d20 20202020 426c6163 6b626572 72792053 44202020
ffff8101f45dc840 2245675352 S Bi:4:013:9 -115 13 <
ffff8101f45dc840 2245675841 C Bi:4:013:9 0 13 = 55534253 88619c80 00000000 00
ffff8101f45dc840 2245677283 S Bo:4:013:10 -115 31 = 55534243 88619c80 fc000000 80000a23 00000000 000000fc 00000000 000000
ffff8101f45dc840 2245677840 C Bo:4:013:10 0 31 >
ffff8101f45dc840 2245679421 S Bi:4:013:9 -115 252 <
ffff8101f45dc840 2245679842 C Bi:4:013:9 0 12 = 00000008 007fffff 03000200
ffff8101f45dc840 2245681378 S Bi:4:013:9 -115 13 <
ffff8101f45dc840 2245681841 C Bi:4:013:9 -32 0
ffff8101f45dc840 2245683375 S Co:4:013:0 s 02 01 0000 0089 0000 0
ffff8101f45dc840 2245683842 C Co:4:013:0 0 0
ffff8101f45dc840 2245684346 S Bi:4:013:9 -115 13 <
ffff8101f45dc840 2245684841 C Bi:4:013:9 0 13 = 55534253 88619c80 f0000000 01
ffff8101f45dc840 2245686289 S Bo:4:013:10 -115 31 = 55534243 88619c80 12000000 80000c03 00000012 00000000 00000000 000000
ffff8101f45dc840 2245686841 C Bo:4:013:10 0 31 >
ffff8101f45dc840 2245688195 S Bi:4:013:9 -115 18 <
ffff8101f45dc840 2245688840 C Bi:4:013:9 0 18 = 70000200 0000000a 00000000 3a000000 0000
ffff8101f45dc840 2245690275 S Bi:4:013:9 -115 13 <
ffff8101f45dc840 2245690843 C Bi:4:013:9 0 13 = 55534253 88619c80 00000000 00
ffff8101f45dc840 2245692391 S Bo:4:013:10 -115 31 = 55534243 88619c80 fc000000 80000a23 00000000 000000fc 00000000 000000
ffff8101f45dc840 2245692841 C Bo:4:013:10 0 31 >
ffff8101f45dc840 2245694342 S Bi:4:013:9 -115 252 <
ffff8101f45dc840 2245694843 C Bi:4:013:9 0 12 = 00000008 007fffff 03000200
ffff8101f45dc840 2245696350 S Bi:4:013:9 -115 13 <
ffff8101f45dc840 2245696841 C Bi:4:013:9 -32 0
ffff8101f45dc840 2245698315 S Co:4:013:0 s 02 01 0000 0089 0000 0
ffff8101f45dc840 2245698842 C Co:4:013:0 0 0
ffff8101f45dc840 2245700218 S Bi:4:013:9 -115 13 <
ffff8101f45dc840 2245700842 C Bi:4:013:9 0 13 = 55534253 88619c80 f0000000 01
ffff8101f45dc840 2245702307 S Bo:4:013:10 -115 31 = 55534243 88619c80 12000000 80000c03 00000012 00000000 00000000 000000
ffff8101f45dc840 2245702841 C Bo:4:013:10 0 31 >
ffff8101f45dc840 2245704285 S Bi:4:013:9 -115 18 <
ffff8101f45dc840 2245704842 C Bi:4:013:9 0 18 = 70000200 0000000a 00000000 3a000000 0000
ffff8101f45dc840 2245706267 S Bi:4:013:9 -115 13 <
ffff8101f45dc840 2245706843 C Bi:4:013:9 0 13 = 55534253 88619c80 00000000 00
ffff8101f45dc840 2245708289 S Bo:4:013:10 -115 31 = 55534243 88619c80 fc000000 80000a23 00000000 000000fc 00000000 000000
ffff8101f45dc840 2245708842 C Bo:4:013:10 0 31 >
ffff8101f45dc840 2245711184 S Bi:4:013:9 -115 252 <
ffff8101f45dc840 2245711844 C Bi:4:013:9 0 12 = 00000008 007fffff 03000200
ffff8101f45dc840 2245713204 S Bi:4:013:9 -115 13 <
ffff8101f45dc840 2245713843 C Bi:4:013:9 -32 0
ffff8101f45dc840 2245716861 S Co:4:013:0 s 02 01 0000 0089 0000 0
ffff8101f45dc840 2245717844 C Co:4:013:0 0 0
ffff8101f45dc840 2245718845 S Bi:4:013:9 -115 13 <
ffff8101f45dc840 2245719843 C Bi:4:013:9 0 13 = 55534253 88619c80 f0000000 01
ffff8101f45dc840 2245720737 S Bo:4:013:10 -115 31 = 55534243 88619c80 12000000 80000c03 00000012 00000000 00000000 000000
ffff8101f45dc840 2245720843 C Bo:4:013:10 0 31 >
ffff8101f45dc840 2245722756 S Bi:4:013:9 -115 18 <
ffff8101f45dc840 2245722843 C Bi:4:013:9 0 18 = 70000200 0000000a 00000000 3a000000 0000
ffff8101f45dc840 2245724780 S Bi:4:013:9 -115 13 <
ffff8101f45dc840 2245725843 C Bi:4:013:9 0 13 = 55534253 88619c80 00000000 00
ffff8101f45dc840 2245730882 S Ci:4:013:0 s 80 06 0100 0000 0012 18 <
ffff8101f45dc840 2245731845 C Ci:4:013:0 0 18 = 12011001 00000010 ca0f0400 07010105 0301
ffff8101f45dc840 2245732757 S Ci:4:013:0 s c0 a5 0000 0001 0002 2 <
ffff8101f45dc840 2245733848 C Ci:4:013:0 0 2 = 0200
ffff8101f45dc840 2245734830 S Ci:4:013:0 s c0 a8 0000 0001 0005 5 <
ffff8101f45dc840 2245735844 C Ci:4:013:0 0 5 = 11000001 04
ffff8101f45dc840 2245736872 S Ci:4:013:0 s c0 a8 0000 0001 0011 17 <
ffff8101f45dc840 2245737846 C Ci:4:013:0 0 17 = 11000001 04000102 01020202 03020303 02
ffff8101f45dc840 2245739873 S Bo:4:013:10 -115 31 = 55534243 c86cab80 08000000 80000a25 00000000 00000000 00000000 000000
ffff8101f45dc840 2245740844 C Bo:4:013:10 0 31 >
ffff8101f45dc840 2245741907 S Bi:4:013:9 -115 8 <
ffff8101f45dc840 2245742844 C Bi:4:013:9 0 8 = 00800000 00000200
ffff8101f45dc840 2245744023 S Bi:4:013:9 -115 13 <
ffff8101f45dc840 2245744844 C Bi:4:013:9 0 13 = 55534253 c86cab80 00000000 01
ffff8101f45dc840 2245746847 S Bo:4:013:10 -115 31 = 55534243 c86cab80 12000000 80000c03 00000012 00000000 00000000 000000
ffff8101f45dc840 2245747846 C Bo:4:013:10 0 31 >
ffff8101f45dc840 2245748901 S Bi:4:013:9 -115 18 <
ffff8101f45dc840 2245749845 C Bi:4:013:9 0 18 = 70000200 0000000a 00000000 3a000000 0000
ffff8101f45dc840 2245751923 S Bi:4:013:9 -115 13 <
ffff8101f45dc840 2245752844 C Bi:4:013:9 0 13 = 55534253 c86cab80 00000000 00
ffff8101f45dc840 2245754028 S Bo:4:013:10 -115 31 = 55534243 c86cab80 00020000 80000a28 00000000 00000001 00000000 000000
ffff8101f45dc840 2245754844 C Bo:4:013:10 0 31 >
ffff8101f45dc840 2245755997 S Bi:4:013:9 -115 512 <
ffff8101f45dc840 2245756848 C Bi:4:013:9 -32 0
ffff8101f45dc840 2245758897 S Co:4:013:0 s 02 01 0000 0089 0000 0
ffff8101f45dc840 2245759846 C Co:4:013:0 0 0
ffff8101f45dc840 2245760988 S Bi:4:013:9 -115 13 <
ffff8101f45dc840 2245761845 C Bi:4:013:9 0 13 = 55534253 c86cab80 00020000 01
ffff8101f45dc840 2245762891 S Bo:4:013:10 -115 31 = 55534243 c86cab80 12000000 80000c03 00000012 00000000 00000000 000000
ffff8101f45dc840 2245763845 C Bo:4:013:10 0 31 >
ffff8101f45dc840 2245764901 S Bi:4:013:9 -115 18 <
ffff8101f45dc840 2245765845 C Bi:4:013:9 0 18 = 70000200 0000000a 00000000 3a000000 0000
ffff8101f45dc840 2245766981 S Bi:4:013:9 -115 13 <
ffff8101f45dc840 2245767845 C Bi:4:013:9 0 13 = 55534253 c86cab80 00000000 00
ffff8101f45dc840 2245769985 S Bo:4:013:10 -115 31 = 55534243 c86cab80 c0000000 8000061a 001c00c0 00000000 00000000 000000
ffff8101f45dc840 2245770846 C Bo:4:013:10 0 31 >
ffff8101f45dc840 2245771890 S Bi:4:013:9 -115 192 <
ffff8101f45dc840 2245772847 C Bi:4:013:9 0 10 = 09000053 1c060001 0000
ffff8101f45dc840 2245774802 S Bi:4:013:9 -115 13 <
ffff8101f45dc840 2245775846 C Bi:4:013:9 -32 0
ffff8101f45dc840 2245777833 S Co:4:013:0 s 02 01 0000 0089 0000 0
ffff8101f45dc840 2245778846 C Co:4:013:0 0 0
ffff8101f45dc840 2245779853 S Bi:4:013:9 -115 13 <
ffff8101f45dc840 2245780846 C Bi:4:013:9 0 13 = 55534253 c86cab80 b6000000 00
ffff8101f45dc840 2245782749 S Bo:4:013:10 -115 31 = 55534243 c8ac9080 c0000000 8000061a 003f00c0 00000000 00000000 000000
ffff8101f45dc840 2245782846 C Bo:4:013:10 0 31 >
ffff8101f45dc840 2245785297 S Bi:4:013:9 -115 192 <
ffff8101f45dc840 2245785848 C Bi:4:013:9 0 68 = 43000053 010a0003 00000000 03000000 051e0080 103f0200 3fff0000 00000000
ffff8101f45dc840 2245787783 S Bi:4:013:9 -115 13 <
ffff8101f45dc840 2245788847 C Bi:4:013:9 -32 0
ffff8101f45dc840 2245790808 S Co:4:013:0 s 02 01 0000 0089 0000 0
ffff8101f45dc840 2245791849 C Co:4:013:0 0 0
ffff8101f45dc840 2245792741 S Bi:4:013:9 -115 13 <
ffff8101f45dc840 2245792848 C Bi:4:013:9 0 13 = 55534253 c8ac9080 7c000000 00
ffff8101f45dc840 2245794918 S Bo:4:013:10 -115 31 = 55534243 c86cab80 08000000 80000a25 00000000 00000000 00000000 000000
ffff8101f45dc840 2245795847 C Bo:4:013:10 0 31 >
ffff8101f45dc840 2245797812 S Bi:4:013:9 -115 8 <
ffff8101f45dc840 2245798846 C Bi:4:013:9 0 8 = 00800000 00000200
ffff8101f45dc840 2245800857 S Bi:4:013:9 -115 13 <
ffff8101f45dc840 2245801847 C Bi:4:013:9 0 13 = 55534253 c86cab80 00000000 01
ffff8101f45dc840 2245802885 S Bo:4:013:10 -115 31 = 55534243 c86cab80 12000000 80000c03 00000012 00000000 00000000 000000
ffff8101f45dc840 2245803847 C Bo:4:013:10 0 31 >
ffff8101f45dc840 2245804735 S Bi:4:013:9 -115 18 <
ffff8101f45dc840 2245804849 C Bi:4:013:9 0 18 = 70000200 0000000a 00000000 3a000000 0000
ffff8101f45dc840 2245806750 S Bi:4:013:9 -115 13 <
ffff8101f45dc840 2245806848 C Bi:4:013:9 0 13 = 55534253 c86cab80 00000000 00
ffff8101f45dc840 2245808771 S Bo:4:013:10 -115 31 = 55534243 c86cab80 00020000 80000a28 00000000 00000001 00000000 000000
ffff8101f45dc840 2245808848 C Bo:4:013:10 0 31 >
ffff8101f45dc840 2245810783 S Bi:4:013:9 -115 512 <
ffff8101f45dc840 2245811849 C Bi:4:013:9 -32 0
ffff8101f45dc840 2245813810 S Co:4:013:0 s 02 01 0000 0089 0000 0
ffff8101f45dc840 2245814848 C Co:4:013:0 0 0
ffff8101f45dc840 2245815875 S Bi:4:013:9 -115 13 <
ffff8101f45dc840 2245816848 C Bi:4:013:9 0 13 = 55534253 c86cab80 00020000 01
ffff8101f45dc840 2246003947 S Bo:4:013:4 -115 16 = 00001000 01ff0000 5926ba47 00000000
ffff8101f45dc840 2246005864 C Bo:4:013:4 0 16 >
ffff8101f45dc840 2246008930 S Bo:4:013:10 -115 31 = 55534243 c86cab80 12000000 80000c03 00000012 00000000 00000000 000000
ffff8101f45dc240 2246009839 S Bi:4:013:3 -115 4096 <
ffff8101f45dc840 2246009860 C Bo:4:013:10 0 31 >
ffff8101f45dc240 2246010875 C Bi:4:013:3 0 16 = 00001000 02ff0000 5926ba47 00000000
ffff8101f45dc240 2246012918 S Bi:4:013:9 -115 18 <
ffff8101f45dc240 2246013860 C Bi:4:013:9 0 18 = 70000200 0000000a 00000000 3a000000 0000
ffff8101f45dc240 2246013972 S Bo:4:013:4 -115 12 = 00000c00 05ff0001 14000100
ffff8101f45dc840 2246013988 S Bi:4:013:3 -115 4096 <
ffff8101f45dcd80 2246014855 S Bi:4:013:9 -115 13 <
ffff8101f45dc240 2246014860 C Bo:4:013:4 0 12 >
ffff8101f45dc840 2246014880 C Bi:4:013:3 0 32 = 00002000 06ff0001 14000100 2be41345 04b8f083 bf26043b 662b2849 439c8ac9
ffff8101f45dcd80 2246015859 C Bi:4:013:9 0 13 = 55534253 c86cab80 00000000 00
ffff8101f45dcd80 2246016911 S Bo:4:013:10 -115 31 = 55534243 88c7ab80 08000000 80000a25 00000000 00000000 00000000 000000
ffff8101f45dcd80 2246017859 C Bo:4:013:10 0 31 >
ffff8101f45dcd80 2246019161 S Bi:4:013:9 -115 8 <
ffff8101f45dc840 2246019178 S Bo:4:013:4 -115 12 = 00000c00 05ff0002 08000400
ffff8101f45dc240 2246019188 S Bi:4:013:3 -115 4096 <
ffff8101f45dcd80 2246019859 C Bi:4:013:9 0 8 = 00800000 00000200
ffff8101f45dc840 2246019863 C Bo:4:013:4 0 12 >
ffff8101f45dc840 2246020805 S Bi:4:013:9 -115 13 <
ffff8101f45dc240 2246020876 C Bi:4:013:3 0 20 = 00001400 06ff0002 08000400 03000000 499c1224
ffff8101f45dc840 2246021859 C Bi:4:013:9 0 13 = 55534253 88c7ab80 00000000 01
ffff8101f45dc840 2246024872 S Bo:4:013:10 -115 31 = 55534243 88c7ab80 12000000 80000c03 00000012 00000000 00000000 000000
ffff8101f45dc840 2246025860 C Bo:4:013:10 0 31 >
ffff8101f45dc840 2246025981 S Bo:4:013:4 -115 12 = 00000c00 05ff0003 04000500
ffff8101f45dc240 2246025996 S Bi:4:013:3 -115 4096 <
ffff8101f45dc840 2246026860 C Bo:4:013:4 0 12 >
ffff8101f45dc240 2246026880 C Bi:4:013:3 0 12 = 00000c00 06ff0003 00000000
ffff8101f45dc840 2246026882 S Bi:4:013:9 -115 18 <
ffff8101f45dc840 2246027861 C Bi:4:013:9 0 18 = 70000200 0000000a 00000000 3a000000 0000
ffff8101f45dc840 2246028975 S Bi:4:013:9 -115 13 <
ffff8101f45dc840 2246029860 C Bi:4:013:9 0 13 = 55534253 88c7ab80 00000000 00
ffff8101f45dc840 2246029922 S Bo:4:013:4 -115 12 = 00000c00 05ff0004 04000600
ffff8101f45dc240 2246029936 S Bi:4:013:3 -115 4096 <
ffff8101f45dc840 2246030861 C Bo:4:013:4 0 12 >
ffff8101f45dc240 2246030882 C Bi:4:013:3 0 12 = 00000c00 06ff0004 00000000
ffff8101f45dc240 2246036063 S Bo:4:013:10 -115 31 = 55534243 c86cab80 08000000 80000a25 00000000 00000000 00000000 000000
ffff8101f45dc240 2246036861 C Bo:4:013:10 0 31 >
ffff8101f45dc240 2246038040 S Bi:4:013:9 -115 8 <
ffff8101f45dc240 2246038860 C Bi:4:013:9 0 8 = 00800000 00000200
ffff8101f45dc240 2246040041 S Bi:4:013:9 -115 13 <
ffff8101f45dc240 2246040861 C Bi:4:013:9 0 13 = 55534253 c86cab80 00000000 01
ffff8101f45dc240 2246042032 S Bo:4:013:10 -115 31 = 55534243 c86cab80 12000000 80000c03 00000012 00000000 00000000 000000
ffff8101f45dc240 2246042861 C Bo:4:013:10 0 31 >
ffff8101f45dc240 2246044047 S Bi:4:013:9 -115 18 <
ffff8101f45dc240 2246044862 C Bi:4:013:9 0 18 = 70000200 0000000a 00000000 3a000000 0000
ffff8101f45dc240 2246047024 S Bi:4:013:9 -115 13 <
ffff8101f45dc240 2246047862 C Bi:4:013:9 0 13 = 55534253 c86cab80 00000000 00
ffff8101f45dc240 2246049896 S Bo:4:013:10 -115 31 = 55534243 88c7ab80 08000000 80000a25 00000000 00000000 00000000 000000
ffff8101f45dc240 2246050861 C Bo:4:013:10 0 31 >
ffff8101f45dc240 2246051981 S Bi:4:013:9 -115 8 <
ffff8101f45dc240 2246052862 C Bi:4:013:9 0 8 = 00800000 00000200
ffff8101f45dc240 2246054015 S Bi:4:013:9 -115 13 <
ffff8101f45dc240 2246054861 C Bi:4:013:9 0 13 = 55534253 88c7ab80 00000000 01
ffff8101f45dc240 2246056344 S Bo:4:013:10 -115 31 = 55534243 88c7ab80 12000000 80000c03 00000012 00000000 00000000 000000
ffff8101f45dc240 2246056861 C Bo:4:013:10 0 31 >
ffff8101f45dc240 2246059138 S Bi:4:013:9 -115 18 <
ffff8101f45dc240 2246059862 C Bi:4:013:9 0 18 = 70000200 0000000a 00000000 3a000000 0000
ffff8101f45dc240 2246060854 S Bi:4:013:9 -115 13 <
ffff8101f45dc240 2246061862 C Bi:4:013:9 0 13 = 55534253 88c7ab80 00000000 00
ffff8101f45dc840 2246095701 S Bi:4:013:3 -115 4096 <
ffff8101f45dcd80 2246096684 S Bo:4:013:4 -115 12 = 00000c00 05ff0005 04000700
ffff8101f45dcd80 2246096870 C Bo:4:013:4 0 12 >
###### Commands ?? ##########
ffff8101f45dc840 2246097882 C Bi:4:013:3 0 16 = 00001000 06ff0005 04000700 00020000
ffff8101f45dc840 2246099686 S Bo:4:013:4 -115 12 = 00000c00 05ff0006 04000800
ffff8101f45dcd80 2246099704 S Bi:4:013:3 -115 4096 <
ffff8101f45dc840 2246099863 C Bo:4:013:4 0 12 >
ffff8101f45dcd80 2246100879 C Bi:4:013:3 0 12 = 00000c00 06ff0006 00000000
ffff8101f45dcd80 2246102717 S Bi:4:013:3 -115 4096 <
ffff8101f45dc840 2246103716 S Bo:4:013:4 -115 12 = 00000c00 05ff0007 04000a00
ffff8101f45dc840 2246103864 C Bo:4:013:4 0 12 >
ffff8101f45dcd80 2246104880 C Bi:4:013:3 0 12 = 00000c00 06ff0007 00000000
ffff8101f45dcd80 2246106669 S Bo:4:013:4 -115 12 = 00000c00 05ff0008 04000b00
ffff8101f45dc840 2246106686 S Bi:4:013:3 -115 4096 <
ffff8101f45dcd80 2246106865 C Bo:4:013:4 0 12 >
ffff8101f45dc840 2246107879 C Bi:4:013:3 0 16 = 00001000 06ff0008 04000b00 00000000
ffff810109befa80 2246382560 S Ci:4:013:0 s c0 a5 0000 0001 0002 2 <
ffff810109befa80 2246383886 C Ci:4:013:0 0 2 = 0200
#### RIM Bypass - return socket ??#####################
ffff81020a6ab000 2251430195 S Bo:4:013:4 -115 24 = 00001800 07ff0009 52494d20 42797061 73730000 00000000
ffff8101f4665e40 2251430880 S Bi:4:013:3 -115 4096 <
ffff81020a6ab000 2251432167 C Bo:4:013:4 0 24 >
## bypass OK ###
ffff8101f4665e40 2251434179 C Bi:4:013:3 0 44 = 00002c00 08060009 52494d20 42797061 73730000 00000000 00000000 01fc3f00
ffff8101f4665e40 2251438942 S Bi:4:013:3 -115 4096 <
ffff8101f4665e40 2251439180 C Bi:4:013:3 0 12 = 00000c00 13060100 00000000
ffff8101f4665e40 2251441979 S Bo:4:013:4 -115 8 = 00000800 0a06000a
ffff8101f4665e40 2251442163 C Bo:4:013:4 0 8 >
ffff8101f4665e40 2251445835 S Bi:4:013:3 -115 4096 <
ffff8101f4665e40 2251446182 C Bi:4:013:3 0 8 = 00000800 1006000a
ffff8101f4665e40 2251449947 S Bi:4:013:3 -115 4096 <
ffff8101f4665900 2251452866 S Bo:4:013:4 -115 10 = 06000a00 40000001 0000
ffff8101f4665900 2251453166 C Bo:4:013:4 0 10 >
ffff8101f4665e40 2251481186 C Bi:4:013:3 0 12 = 00000c00 13060100 01000000
ffff8101f4665e40 2251485864 S Bi:4:013:3 -115 4096 <
ffff8101f4665e40 2251486186 C Bi:4:013:3 0 10 = 06000a00 40000002 0003
ffff8101f4665e40 2251490894 S Bi:4:013:3 -115 4096 <
ffff8101f4665e40 2251491183 C Bi:4:013:3 0 23 = 06001700 40000500 6d757865 72080147 4d452044 617461
ffff8101f4665e40 2251493863 S Bi:4:013:3 -115 4096 <
ffff8101f4665e40 2251995217 C Bi:4:013:3 0 142 = 06008e00 40010102 00000082 53000000 12530000 000d4742 4953584e 41433030
ffff81020a6ab9c0 2251998009 S Bi:4:013:3 -115 4096 <
ffff81020a6abf00 2252001043 S Bo:4:013:4 -115 22 = 06001600 40010102 0000000a 49000000 00490000 0001
ffff81020a6abf00 2252001203 C Bo:4:013:4 0 22 >
ffff81020a6ab9c0 2252004209 C Bi:4:013:3 0 12 = 00000c00 13060100 02000000
ffff81020a6ab9c0 2252009245 S Bi:4:013:3 -115 4096 <
##################    RIM STOP #############
ffff810079682480 2256516699 S Bo:4:013:6 -115 12 = 01000000 00000000 78563412
ffff810079682c00 2256516728 S Bi:4:013:5 -115 4096 <
ffff810079682480 2256518448 C Bo:4:013:6 0 12 >
##################    RIM STOP - again ?#############
ffff810079682480 2256521875 S Bo:4:013:6 -115 12 = 01000000 00000000 78563412
ffff810079682480 2256522445 C Bo:4:013:6 0 12 >
##################    RIM STOP - other endpoint (pollign modem eps ?)#############
ffff810079682480 2256524868 S Bo:4:013:8 -115 12 = 01000000 00000000 78563412
ffff810079682900 2256524938 S Bi:4:013:7 -115 4096 <
##################    RIM START on ep 6 #############
ffff810079682840 2256524960 S Bo:4:013:6 -115 12 = 01000000 01000000 78563412
################ OK reply ###########
ffff810079682c00 2256525462 C Bi:4:013:5 0 28 = 04000000 00000000 00000000 00000000 01000000 1c000000 78563412
ffff810079682480 2256525467 C Bo:4:013:8 0 12 >
ffff810079682840 2256525470 C Bo:4:013:6 0 12 >
######## sending a session key ########
ffff810079682840 2256529903 S Bo:4:013:6 -115 28 = 00000000 00000000 03000000 00c20100 44004900 00004e00 78563412
ffff810079682840 2256530448 C Bo:4:013:6 0 28 >
########  sending another STOP ? #########
ffff810079682840 2256531003 S Bo:4:013:8 -115 12 = 01000000 00000000 78563412
ffff810079682480 2256531021 S Bi:4:013:5 -115 4096 <
ffff810079682840 2256531453 C Bo:4:013:8 0 12 >
######## what's this exactly ###########
ffff810079682480 2256531475 C Bi:4:013:5 0 24 = 00000000 23000000 23000000 00c20100 18000000 78563412
######## RIM START ###########
ffff810079682480 2256532790 S Bo:4:013:8 -115 12 = 01000000 01000000 78563412
ffff810079682840 2256532808 S Bo:4:013:6 -115 3 = 41540d
######## OK ########
ffff810079682900 2256533462 C Bi:4:013:7 0 28 = 04000000 00000000 00000000 00000000 01000000 1c000000 78563412
ffff810079682480 2256533466 C Bo:4:013:8 0 12 >
ffff810079682840 2256533469 C Bo:4:013:6 0 3 >
ffff810079682840 2256533801 S Bi:4:013:5 -115 4096 <
ffff810079682840 2256534462 C Bi:4:013:5 0 2 = 4154
ffff810079682840 2256534808 S Bi:4:013:7 -115 4096 <
ffff810079682480 2256536825 S Bi:4:013:5 -115 4096 <
ffff810079682480 2256537462 C Bi:4:013:5 0 2 = 0d0a
ffff810079682480 2256541936 S Bi:4:013:5 -115 4096 <
###### Start ppp chat script - ATZ etc... #########
ffff810079682480 2256542463 C Bi:4:013:5 0 6 = 0d0a4f4b 0d0a
ffff810079682480 2256544716 S Bi:4:013:5 -115 4096 <
ffff810079682900 2256552854 S Bo:4:013:6 -115 7 = 41544530 56310d
ffff810079682480 2256553466 C Bi:4:013:5 0 6 = 41544530 5631
ffff810079682900 2256553472 C Bo:4:013:6 0 7 >
ffff810079682900 2256557832 S Bi:4:013:5 -115 4096 <
ffff810079682900 2256558464 C Bi:4:013:5 0 2 = 0d0a
ffff810079682900 2256561850 S Bi:4:013:5 -115 4096 <
ffff810079682900 2256562464 C Bi:4:013:5 0 6 = 0d0a4f4b 0d0a
ffff810079682900 2256566134 S Bi:4:013:5 -115 4096 <
ffff810079682480 2256571854 S Bo:4:013:6 -115 3 = 41540d
ffff810079682900 2256572465 C Bi:4:013:5 0 6 = 0d0a4f4b 0d0a
ffff810079682480 2256572469 C Bo:4:013:6 0 3 >
ffff810079682480 2256574889 S Bi:4:013:5 -115 4096 <
ffff810079682900 2256581816 S Bo:4:013:6 -115 40 = 41542b63 6764636f 6e743d31 2c224950 222c2277 61702e76 6f696365 73747265
ffff810079682480 2256582465 C Bi:4:013:5 0 6 = 0d0a4f4b 0d0a
ffff810079682900 2256582469 C Bo:4:013:6 0 40 >
ffff810079682900 2256586840 S Bi:4:013:5 -115 4096 <
ffff810079682480 2256591891 S Bo:4:013:6 -115 7 = 41545330 3d300d
ffff810079682900 2256592465 C Bi:4:013:5 0 6 = 0d0a4f4b 0d0a
ffff810079682480 2256592470 C Bo:4:013:6 0 7 >
##### what's this - another rim packet ??############
ffff810079682480 2256595812 S Bo:4:013:6 -115 28 = 00000000 23000000 03000000 00c20100 222c2277 61702e76 78563412
ffff810079682900 2256595830 S Bi:4:013:5 -115 4096 <
ffff810079682480 2256596449 C Bo:4:013:6 0 28 >
#### RIM Bypass again ?? ###############
ffff810079682900 2256596469 C Bi:4:013:5 0 24 = 00000000 23000000 23000000 00c20100 18000000 78563412
ffff810079682900 2256597830 S Bi:4:013:5 -115 4096 <
#### some more ppp #####
ffff810079682480 2256601819 S Bo:4:013:6 -115 3 = 41540d
ffff810079682900 2256602465 C Bi:4:013:5 0 6 = 0d0a4f4b 0d0a
ffff810079682480 2256602469 C Bo:4:013:6 0 3 >
ffff810079682480 2256605859 S Bi:4:013:5 -115 4096 <
ffff810079682900 2256611845 S Bo:4:013:6 -115 7 = 41544530 56310d
ffff810079682480 2256612467 C Bi:4:013:5 0 6 = 0d0a4f4b 0d0a
ffff810079682900 2256612472 C Bo:4:013:6 0 7 >
ffff810079682900 2256614880 S Bi:4:013:5 -115 4096 <
ffff810079682480 2256621818 S Bo:4:013:6 -115 3 = 41540d
ffff810079682900 2256622469 C Bi:4:013:5 0 6 = 0d0a4f4b 0d0a
ffff810079682480 2256622473 C Bo:4:013:6 0 3 >
##### some windows packets ???######
ffff810079682480 2256625863 S Bi:4:013:5 -115 4096 <
ffff810079682900 2256631849 S Bo:4:013:6 -115 40 = 41542b63 6764636f 6e743d31 2c224950 222c2277 61702e76 6f696365 73747265
ffff810079682480 2256632468 C Bi:4:013:5 0 6 = 0d0a4f4b 0d0a
ffff810079682900 2256632473 C Bo:4:013:6 0 40 >
ffff810079682900 2256635929 S Bi:4:013:5 -115 4096 <
ffff810079682480 2256641820 S Bo:4:013:6 -115 13 = 41544454 2a39392a 2a2a3123 0d
ffff810079682900 2256642470 C Bi:4:013:5 0 11 = 0d0a434f 4e4e4543 540d0a
ffff810079682480 2256642475 C Bo:4:013:6 0 13 >
ffff810079682480 2256645924 S Bi:4:013:5 -115 4096 <
ffff810079682900 2261072725 S Bo:4:013:10 -115 31 = 55534243 e882ab80 08000000 80000a25 00000000 00000000 00000000 000000
ffff810079682900 2261074703 C Bo:4:013:10 0 31 >
ffff810079682900 2261076826 S Bi:4:013:9 -115 8 <
ffff810079682900 2261077698 C Bi:4:013:9 0 8 = 00800000 00000200
ffff810079682900 2261078845 S Bi:4:013:9 -115 13 <
ffff810079682900 2261079698 C Bi:4:013:9 0 13 = 55534253 e882ab80 00000000 01
ffff810079682900 2261082694 S Bo:4:013:10 -115 31 = 55534243 e882ab80 12000000 80000c03 00000012 00000000 00000000 000000
ffff810079682900 2261083698 C Bo:4:013:10 0 31 >
ffff810079682900 2261084712 S Bi:4:013:9 -115 18 <
ffff810079682900 2261085698 C Bi:4:013:9 0 18 = 70000200 0000000a 00000000 3a000000 0000
ffff810079682900 2261088882 S Bi:4:013:9 -115 13 <
ffff810079682900 2261089699 C Bi:4:013:9 0 13 = 55534253 e882ab80 00000000 00
ffff810079682900 2261091877 S Bo:4:013:10 -115 31 = 55534243 e882ab80 08000000 80000a25 00000000 00000000 00000000 000000
ffff810079682900 2261092699 C Bo:4:013:10 0 31 >
ffff810079682900 2261093777 S Bi:4:013:9 -115 8 <
ffff810079682900 2261094699 C Bi:4:013:9 0 8 = 00800000 00000200
ffff810079682900 2261096989 S Bi:4:013:9 -115 13 <
ffff810079682900 2261097700 C Bi:4:013:9 0 13 = 55534253 e882ab80 00000000 01
ffff810079682900 2261098855 S Bo:4:013:10 -115 31 = 55534243 e882ab80 12000000 80000c03 00000012 00000000 00000000 000000
ffff810079682900 2261099698 C Bo:4:013:10 0 31 >
ffff810079682900 2261100878 S Bi:4:013:9 -115 18 <
ffff810079682900 2261101706 C Bi:4:013:9 0 18 = 70000200 0000000a 00000000 3a000000 0000
ffff810079682900 2261104881 S Bi:4:013:9 -115 13 <
ffff810079682900 2261105701 C Bi:4:013:9 0 13 = 55534253 e882ab80 00000000 00
ffff810079682900 2261108976 S Bo:4:013:10 -115 31 = 55534243 e882ab80 00000000 00000600 00000000 00000000 00000000 000000
ffff810079682900 2261109700 C Bo:4:013:10 0 31 >
ffff810079682900 2261110874 S Bi:4:013:9 -115 13 <
ffff810079682900 2261111700 C Bi:4:013:9 0 13 = 55534253 e882ab80 00000000 01
ffff810079682900 2261112884 S Bo:4:013:10 -115 31 = 55534243 e882ab80 12000000 80000c03 00000012 00000000 00000000 000000
ffff810079682900 2261113700 C Bo:4:013:10 0 31 >
ffff810079682900 2261116989 S Bi:4:013:9 -115 18 <
ffff810079682900 2261117700 C Bi:4:013:9 0 18 = 70000200 0000000a 00000000 3a000000 0000
ffff810079682900 2261118857 S Bi:4:013:9 -115 13 <
ffff810079682900 2261119700 C Bi:4:013:9 0 13 = 55534253 e882ab80 00000000 00
ffff810079682900 2261147965 S Bo:4:013:10 -115 31 = 55534243 e882ab80 08000000 80000a25 00000000 00000000 00000000 000000
ffff810079682900 2261149704 C Bo:4:013:10 0 31 >
ffff810079682900 2261152315 S Bi:4:013:9 -115 8 <
ffff810079682900 2261152702 C Bi:4:013:9 0 8 = 00800000 00000200
ffff810079682900 2261156310 S Bi:4:013:9 -115 13 <
ffff810079682900 2261156704 C Bi:4:013:9 0 13 = 55534253 e882ab80 00000000 01
ffff810079682900 2261157835 S Bo:4:013:10 -115 31 = 55534243 e882ab80 12000000 80000c03 00000012 00000000 00000000 000000
ffff810079682900 2261158702 C Bo:4:013:10 0 31 >
ffff810079682900 2261160838 S Bi:4:013:9 -115 18 <
ffff810079682900 2261161702 C Bi:4:013:9 0 18 = 70000200 0000000a 00000000 3a000000 0000
ffff810079682900 2261164824 S Bi:4:013:9 -115 13 <
ffff810079682900 2261165703 C Bi:4:013:9 0 13 = 55534253 e882ab80 00000000 00
ffff810079682900 2261168933 S Bo:4:013:10 -115 31 = 55534243 e882ab80 08000000 80000a25 00000000 00000000 00000000 000000
ffff810079682900 2261169703 C Bo:4:013:10 0 31 >
ffff810079682900 2261170906 S Bi:4:013:9 -115 8 <
ffff810079682900 2261171703 C Bi:4:013:9 0 8 = 00800000 00000200
ffff810079682900 2261172882 S Bi:4:013:9 -115 13 <
ffff810079682900 2261173703 C Bi:4:013:9 0 13 = 55534253 e882ab80 00000000 01
ffff810079682900 2261176839 S Bo:4:013:10 -115 31 = 55534243 e882ab80 12000000 80000c03 00000012 00000000 00000000 000000
ffff810079682900 2261177703 C Bo:4:013:10 0 31 >
ffff810079682900 2261178869 S Bi:4:013:9 -115 18 <
ffff810079682900 2261179704 C Bi:4:013:9 0 18 = 70000200 0000000a 00000000 3a000000 0000
ffff810079682900 2261182538 S Bi:4:013:9 -115 13 <
ffff810079682900 2261182704 C Bi:4:013:9 0 13 = 55534253 e882ab80 00000000 00
ffff810079682900 2261184137 S Bo:4:013:10 -115 31 = 55534243 e882ab80 00000000 00000600 00000000 00000000 00000000 000000
ffff810079682900 2261184704 C Bo:4:013:10 0 31 >
ffff810079682900 2261188971 S Bi:4:013:9 -115 13 <
ffff810079682900 2261189706 C Bi:4:013:9 0 13 = 55534253 e882ab80 00000000 01
ffff810079682900 2261190911 S Bo:4:013:10 -115 31 = 55534243 e882ab80 12000000 80000c03 00000012 00000000 00000000 000000
ffff810079682900 2261191704 C Bo:4:013:10 0 31 >
ffff810079682900 2261192933 S Bi:4:013:9 -115 18 <
ffff810079682900 2261193704 C Bi:4:013:9 0 18 = 70000200 0000000a 00000000 3a000000 0000
ffff810079682900 2261196822 S Bi:4:013:9 -115 13 <
ffff810079682900 2261197705 C Bi:4:013:9 0 13 = 55534253 e882ab80 00000000 00
ffff810079682900 2261199865 S Bo:4:013:10 -115 31 = 55534243 e882ab80 00000000 00000600 00000000 00000000 00000000 000000
ffff810079682900 2261200704 C Bo:4:013:10 0 31 >
ffff810079682900 2261201745 S Bi:4:013:9 -115 13 <
ffff810079682900 2261202705 C Bi:4:013:9 0 13 = 55534253 e882ab80 00000000 01
ffff810079682900 2261204826 S Bo:4:013:10 -115 31 = 55534243 e882ab80 12000000 80000c03 00000012 00000000 00000000 000000
ffff810079682900 2261205704 C Bo:4:013:10 0 31 >
ffff810079682900 2261208884 S Bi:4:013:9 -115 18 <
ffff810079682900 2261209705 C Bi:4:013:9 0 18 = 70000200 0000000a 00000000 3a000000 0000
ffff810079682900 2261210864 S Bi:4:013:9 -115 13 <
ffff810079682900 2261211705 C Bi:4:013:9 0 13 = 55534253 e882ab80 00000000 00
ffff810079682900 2261212795 S Bo:4:013:10 -115 31 = 55534243 e882ab80 0c000000 8000061a 0000000c 00000000 00000000 000000
ffff810079682900 2261213705 C Bo:4:013:10 0 31 >
ffff810079682900 2261216826 S Bi:4:013:9 -115 12 <
ffff810079682900 2261217706 C Bi:4:013:9 -32 0
ffff810079682900 2261218849 S Co:4:013:0 s 02 01 0000 0089 0000 0
ffff810079682900 2261219707 C Co:4:013:0 0 0
ffff810079682900 2261220874 S Bi:4:013:9 -115 13 <
ffff810079682900 2261221706 C Bi:4:013:9 0 13 = 55534253 e882ab80 0c000000 01
ffff810079682900 2261227148 S Bo:4:013:10 -115 31 = 55534243 e882ab80 12000000 80000c03 00000012 00000000 00000000 000000
ffff810079682900 2261227706 C Bo:4:013:10 0 31 >
ffff810079682900 2261229408 S Bi:4:013:9 -115 18 <
ffff810079682900 2261229706 C Bi:4:013:9 0 18 = 70000500 0000000a 00000000 24000000 0000
ffff810079682900 2261231428 S Bi:4:013:9 -115 13 <
ffff810079682900 2261231706 C Bi:4:013:9 0 13 = 55534253 e882ab80 00000000 00
ffff810137f43300 2261328497 S Bo:4:013:10 -115 31 = 55534243 e882ab80 00000000 00000600 00000000 00000000 00000000 000000
ffff810137f43300 2261329716 C Bo:4:013:10 0 31 >
ffff810137f43300 2261330946 S Bi:4:013:9 -115 13 <
ffff810137f43300 2261331712 C Bi:4:013:9 0 13 = 55534253 e882ab80 00000000 01
ffff810137f43300 2261337831 S Bo:4:013:10 -115 31 = 55534243 e882ab80 12000000 80000c03 00000012 00000000 00000000 000000
ffff810137f43300 2261338716 C Bo:4:013:10 0 31 >
ffff810137f43300 2261340888 S Bi:4:013:9 -115 18 <
ffff810137f43300 2261341713 C Bi:4:013:9 0 18 = 70000200 0000000a 00000000 3a000000 0000
ffff810137f43300 2261348410 S Bi:4:013:9 -115 13 <
ffff810137f43300 2261348714 C Bi:4:013:9 0 13 = 55534253 e882ab80 00000000 00
ffff810137f43300 2261351190 S Bo:4:013:10 -115 31 = 55534243 e882ab80 0c000000 8000061a 0000000c 00000000 00000000 000000
ffff810137f43300 2261351713 C Bo:4:013:10 0 31 >
ffff810137f43300 2261353213 S Bi:4:013:9 -115 12 <
ffff810137f43300 2261353713 C Bi:4:013:9 -32 0
ffff810137f43300 2261361330 S Co:4:013:0 s 02 01 0000 0089 0000 0
ffff810137f43300 2261361715 C Co:4:013:0 0 0
ffff810137f43300 2261362338 S Bi:4:013:9 -115 13 <
ffff810137f43300 2261362715 C Bi:4:013:9 0 13 = 55534253 e882ab80 0c000000 01
ffff810137f43300 2261365283 S Bo:4:013:10 -115 31 = 55534243 e882ab80 12000000 80000c03 00000012 00000000 00000000 000000
ffff810137f43300 2261365714 C Bo:4:013:10 0 31 >
ffff810137f43300 2261371192 S Bi:4:013:9 -115 18 <
ffff810137f43300 2261371715 C Bi:4:013:9 0 18 = 70000500 0000000a 00000000 24000000 0000
ffff810137f43300 2261373210 S Bi:4:013:9 -115 13 <
ffff810137f43300 2261373714 C Bi:4:013:9 0 13 = 55534253 e882ab80 00000000 00
######## rim packet again #######
ffff810137f43300 2261689357 S Bo:4:013:6 -115 28 = 00000000 23000000 03000000 00c20100 222c2277 61702e76 78563412
ffff810079682480 2261690754 C Bi:4:013:5 0 24 = 00000000 23000000 23000000 00c20100 18000000 78563412
ffff810137f43300 2261690759 C Bo:4:013:6 0 28 >
##### start ppp data frames (auth etc... ) ############
ffff810137f43300 2261694298 S Bo:4:013:6 -115 89 = 7eff7d23 c0217d21 7d207d20 327d227d 267d207d 207d207d 207d257d 26489b32
ffff810137f43000 2261694347 S Bi:4:013:5 -115 4096 <
ffff810137f43300 2261694735 C Bo:4:013:6 0 89 >
ffff810137f43000 2261695748 C Bi:4:013:5 0 36 = 7eff7d23 c0217d21 7d207d20 7d2e7d22 7d267d20 7d207d20 7d207d23 7d24c023
ffff810137f43000 2261698300 S Bo:4:013:6 -115 35 = 7eff7d23 c0217d22 7d207d20 7d2e7d22 7d267d20 7d207d20 7d207d23 7d24c023
ffff810137f43300 2261698350 S Bi:4:013:5 -115 4096 <
ffff810137f43000 2261698734 C Bo:4:013:6 0 35 >
ffff810137f43300 2261698754 C Bi:4:013:5 0 77 = 7eff7d23 c0217d24 7d207d20 2c7d257d 26489b32 7d3c7d27 7d227d28 7d227d2d
ffff810137f43300 2261702215 S Bo:4:013:6 -115 29 = 7eff7d23 c0217d21 7d217d20 7d2a7d22 7d267d20 7d207d20 7d20587b 7e
ffff810137f43000 2261702265 S Bi:4:013:5 -115 4096 <
ffff810137f43300 2261702734 C Bo:4:013:6 0 29 >
ffff810137f43000 2261702754 C Bi:4:013:5 0 30 = 7eff7d23 c0217d22 7d217d20 7d2a7d22 7d267d20 7d207d20 7d20317d 2f7e
ffff810137f43000 2261705959 S Bi:4:013:5 -115 4096 <
ffff810137f43300 2261706923 S Bo:4:013:6 -115 95 = 7eff03c0 210c0200 12489b32 1c4d5352 41535635 2e3030d4 267e7eff 03c0210c
ffff810137f43000 2261707752 C Bi:4:013:5 0 40 = 7eff7d23 c0217d27 7d217d20 7d367d2c 7d227d20 7d32489b 327d3c4d 53524153
ffff810137f43300 2261707757 C Bo:4:013:6 0 95 >
ffff810137f43300 2261710053 S Bi:4:013:5 -115 4096 <
ffff810137f43300 2261710751 C Bi:4:013:5 0 52 = 7eff7d23 c0217d27 7d227d20 237d2c7d 237d207d 3f489b32 7d3c4d53 5241532d
ffff810137f43300 2261714292 S Bi:4:013:5 -115 4096 <
ffff810137f43300 2262424797 C Bi:4:013:5 0 12 = 7eff03c0 23020000 0448dc7e
ffff8101eb79dc00 2262431800 S Bo:4:013:6 -115 66 = 7eff0380 fd010400 0a120600 000001bd c17e7eff 03802101 05002802 06002d0f
ffff8101eb79d180 2262431869 S Bi:4:013:5 -115 4096 <
ffff8101eb79dc00 2262433778 C Bo:4:013:6 0 66 >
ffff8101eb79d180 2262433799 C Bi:4:013:5 0 40 = 7eff7d23 c0217d28 7d237d20 7d3080fd 7d217d24 7d207d2a 7d327d26 7d207d20
ffff8101eb79d180 2262439065 S Bi:4:013:5 -115 4096 <
ffff8101eb79d180 2262439796 C Bi:4:013:5 0 18 = 7eff0380 21010400 0a0306a9 fe01012b 957e
ffff8101eb79d180 2262442110 S Bo:4:013:6 -115 18 = 7eff0380 21020400 0a0306a9 fe010142 e17e
ffff8101eb79dc00 2262442156 S Bi:4:013:5 -115 4096 <
ffff8101eb79d180 2262442206 C Bo:4:013:6 0 18 >
ffff8101eb79dc00 2262442226 C Bi:4:013:5 0 30 = 7eff0380 21040500 16020600 2d0f0182 06000000 00840600 0000007c 9f7e
ffff8101eb79dc00 2262449284 S Bo:4:013:6 -115 30 = 7eff0380 21010600 16030600 00000081 06000000 00830600 0000006a 5f7e
ffff8101eb79d180 2262449334 S Bi:4:013:5 -115 4096 <
ffff8101eb79dc00 2262449839 C Bo:4:013:6 0 30 >
ffff8101eb79d180 2262449859 C Bi:4:013:5 0 30 = 7eff0380 21030600 16030619 e1425081 06425e09 78830642 5e197858 f57e
ffff8101eb79d180 2262451238 S Bo:4:013:6 -115 30 = 7eff0380 21010700 16030619 e1425081 06425e09 78830642 5e19789f 987e
ffff8101eb79d180 2262451781 C Bo:4:013:6 0 30 >
ffff8101eb79d180 2262452225 S Bi:4:013:5 -115 4096 <
ffff8101eb79d180 2262452793 C Bi:4:013:5 0 30 = 7eff0380 21020700 16030619 e1425081 06425e09 78830642 5e197869 6b7e
ffff8101eb79d180 2262455811 S Bi:4:013:5 -115 4096 <
ffff8101eb79d840 2262611290 S Bo:4:013:6 -115 336 = 7eff0300 21450001 48003900 008011dd 3b19e142 50ffffff ff004400 4301344c
ffff8101eb79d840 2262611836 C Bo:4:013:6 0 336 >
ffff810079682900 2265592781 S Bo:4:013:6 -115 336 = 7eff0300 21450001 48003a00 008011dd 3a19e142 50ffffff ff004400 43013449
ffff810079682900 2265593956 C Bo:4:013:6 0 336 >
ffff810079682900 2273598980 S Bo:4:013:6 -115 35 = 7eff7d23 c0217d25 7d287d20 7d30489b 327d3c7d 203ccd74 7d207d20 7d207d20
ffff8101eb79d180 2273600417 C Bi:4:013:5 0 18 = 7eff7d23 c0217d26 7d287d20 7d24ee7d 5e7e
ffff810079682900 2273600422 C Bo:4:013:6 0 35 >
ffff810079682900 2273619995 S Bi:4:013:5 -115 4096 <
ffff810079682f00 2273651928 S Bo:4:013:6 -115 4 = 4154480d
ffff810079682f00 2273652403 C Bo:4:013:6 0 4 >
ffff810079682900 2273653416 C Bi:4:013:5 0 6 = 0d0a4f4b 0d0a
ffff810079682900 2273657494 S Bi:4:013:5 -115 4096 <
### rim packets ? - then ppp disconnect #######
ffff810079682f00 2273667455 S Bo:4:013:6 -115 28 = 00000000 23000000 03000000 00c20100 327d3c7d 203ccd74 78563412
ffff810079682900 2273668416 C Bi:4:013:5 0 24 = 00000000 23000000 23000000 00c20100 18000000 78563412
ffff810079682f00 2273668421 C Bo:4:013:6 0 28 >
ffff810079682f00 2273671292 S Bi:4:013:5 -115 4096 <
ffff810079682900 2273677831 S Bo:4:013:6 -115 3 = 41540d
ffff810079682f00 2273678416 C Bi:4:013:5 0 6 = 0d0a4f4b 0d0a
ffff810079682900 2273678420 C Bo:4:013:6 0 3 >
ffff810079682900 2273682846 S Bi:4:013:5 -115 4096 <
ffff810079682f00 2273685878 S Bo:4:013:6 -115 7 = 41544530 56310d
ffff810079682900 2273686419 C Bi:4:013:5 0 6 = 0d0a4f4b 0d0a
ffff810079682f00 2273686424 C Bo:4:013:6 0 7 >
ffff810079682f00 2273689965 S Bi:4:013:5 -115 4096 <
ffff810079682900 2273697830 S Bo:4:013:6 -115 3 = 41540d
ffff810079682f00 2273698417 C Bi:4:013:5 0 6 = 0d0a4f4b 0d0a
ffff810079682900 2273698422 C Bo:4:013:6 0 3 >
ffff810079682900 2273701929 S Bi:4:013:5 -115 4096 <
ffff810079682f00 2273705823 S Bo:4:013:6 -115 40 = 41542b63 6764636f 6e743d31 2c224950 222c2277 61702e76 6f696365 73747265
ffff810079682900 2273706419 C Bi:4:013:5 0 6 = 0d0a4f4b 0d0a
ffff810079682f00 2273706423 C Bo:4:013:6 0 40 >
ffff810079682f00 2273709914 S Bi:4:013:5 -115 4096 <
ffff810079682900 2273716864 S Bo:4:013:6 -115 7 = 41545330 3d300d
ffff810079682f00 2273717419 C Bi:4:013:5 0 6 = 0d0a4f4b 0d0a
ffff810079682900 2273717424 C Bo:4:013:6 0 7 >
ffff810079682900 2273720963 S Bi:4:013:5 -115 4096 <
#### rim stop ##########
ffff810079682f00 2273731931 S Bo:4:013:6 -115 12 = 01000000 00000000 78563412
ffff810079682f00 2273732404 C Bo:4:013:6 0 12 >
#### end session ######
ffff810079682f00 2273738987 S Bo:4:013:6 -115 28 = 00000000 23000000 00000000 00c20100 222c2277 61702e76 78563412
ffff810079682f00 2273739403 C Bo:4:013:6 0 28 >
